{
  "url": "https://thuvienphapluat.vn/van-ban/Xuat-nhap-khau/Luat-Thue-Xuat-khau-thue-Nhap-khau-1993-sua-doi-17-L-CTN-38478.aspx",
  "title": "Luật Thuế Xuất khẩu, thuế Nhập khẩu 1993 sửa đổi 17-L/CTN",
  "properties": {
    "Số hiệu": "17-L/CTN",
    "Loại văn bản": "Luật",
    "Nơi ban hành": "Quốc hội",
    "Người ký": "Lê Đức Anh",
    "Ngày ban hành": "05/07/1993",
    "Ngày hiệu lực": "Đã biết",
    "Ngày công báo": "Đã biết",
    "Số công báo": "Đã biết",
    "Tình trạng": "Đã biết"
  },
  "content": "QUỐC HỘI\n ********\nCỘNG HOÀ XÃ HỘI CHỦ NGHĨA VIỆT NAM\n Độc lập - Tự do - Hạnh phúc\n ********\nSố:\n 17-L/CTN Hà\n Nội, ngày 05 tháng 7 năm 1993 LUẬT SỐ 17-L/CTN NGÀY 05/07/1993 CỦA QUỐC HỘI SỬA ĐỔI, BỔ SUNG MỘT SỐ ĐIỀU CỦA LUẬT THUẾ XUẤT KHẨU, THUẾ NHẬP KHẨU Căn cứ vào Điều 84 của Hiến pháp nước Cộng hoà xã hội chủ nghĩa Việt Nam năm 1992;\nLuật này sửa đổi, bổ sung một số điều của Luật thuế xuất khẩu, thuế nhập khẩu\nđược Quốc hội nước Cộng hoà xã hội chủ nghĩa Việt Nam thông qua ngày 26 tháng 12 năm 1991. \nĐiều 1: Sửa\nđổi, bổ sung một số điều của Luật thuế xuất khẩu, thuế nhập khẩu như sau:\n1/ Điều 2 được sửa đổi:\n\"Điều 2 - Hàng hoá trong các trường hợp sau đây không thuộc diện chịu thuế xuất khẩu, thuế nhập khẩu sau khi làm đầy đủ thủ tục hải quan:\n1- Hàng vận chuyển quá cảnh hoặc mượn đường qua biên giới Việt Nam, hàng chuyển khẩu, theo quy định của Chính phủ;\n2- Hàng viện trợ nhân đạo.\"\n2/ Điều 10 được sửa đổi:\n\"Điều 10 - Được miễn thuế\ntrong các trường hợp:\n1- Hàng viện trợ không hoàn lại;\n2- Hàng tạm nhập tái xuất, tạm xuất tái nhập để dự hội chợ triển lãm;\n3- Hàng là tài sản di chuyển;\n4- Hàng xuất khẩu, nhập khẩu của tổ chức, cá nhân nước ngoài được hưởng tiêu chuẩn miễn trừ do Chính phủ quy định phù hợp với các Điều ước Quốc tế mà Việt Nam ký kết hoặc tham gia;\n5- Hàng là vật tư, nguyên liệu nhập khẩu để gia công cho nước ngoài rồi xuất khẩu theo hợp đồng đã ký kết.\"\n3/ Điều 11 được sửa đổi:\n\"Điều 11 - Được xét miễn thuế trong các trường hợp:\n1- Hàng nhập khẩu chuyên dùng phục vụ trực tiếp cho an ninh, quốc phòng, nghiên cứu khoa học và giáo dục, đào tạo;\n2- Hàng xuất khẩu, nhập khẩu của xí nghiệp có vốn đầu tư của nước ngoài và của bên nước ngoài hợp tác kinh doanh trên cơ sở hợp đồng hợp tác kinh doanh trong từng trường hợp đặc biệt cần khuyến khích đầu tư.\nUỷ ban Nhà nước về hợp tác và đầu tư, sau khi có sự thống nhất của Bộ Tài chính, xét miễn thuế xuất khẩu hoặc thuế\nnhập khẩu cho từng trường hợp đặc biệt cần khuyến khích đầu tư;\n3- Hàng là quà biếu, quà tặng của tổ chức, cá nhân nước ngoài cho tổ chức, cá nhân của Việt Nam và ngược lại,\ntrong mức quy định của Chính phủ.\"\n4/ Điều 14 được bổ sung vào cuối khoản 5 một đoạn như sau:\n\"Hàng tạm nhập khẩu để tái xuất khẩu không phải nộp thuế xuất khẩu khi tái xuất khẩu; hàng tạm xuất khẩu để\ntái nhập khẩu không phải nộp thuế nhập khẩu khi tái nhập khẩu.\"\n5/ Điểm a, điểm b, Khoản 3, Điều 17 được sửa đổi, bổ sung như sau:\n\"3- Thời hạn đối tượng nộp thuế phải nộp xong thuế được quy định như sau:\na) Mười lăm ngày, kể từ ngày đối tượng nộp thuế nhận được thông báo chính thức của cơ quan thu thuế về số thuế\nphải nộp, đối với hàng xuất khẩu;\nTrong trường hợp hàng tạm xuất khẩu để tái nhập khẩu được cơ quan Nhà nước có thẩm quyền cho phép, nếu thực tái nhập khẩu trong thời hạn mười lăm ngày quy định tại điểm này, thì không phải nộp thuế xuất khẩu.\nb) Ba mươi ngày, kể từ ngày đối tượng nộp thuế nhận được thông báo chính thức của cơ quan thu thuế về số thuế\nphải nộp, đối với hàng nhập khẩu;\nTrong trường hợp hàng tạm nhập khẩu để tái xuất khẩu được cơ quan Nhà nước có thẩm quyền cho phép, nếu thực tái xuất khẩu trong thời hạn ba mươi ngày quy định tại điểm này, thì không phải nộp thuế nhập khẩu.\nRiêng trường hợp hàng là vật tư,\nnguyên liệu nhập khẩu để sản xuất hàng xuất khẩu, thì thời hạn nộp xong thuế được quy định cho từng ngành nghề sản xuất cụ thể, nhưng chậm nhất không quá chín mươi ngày, kể từ ngày đối tượng nộp thuế nhận được thông báo chính thức của cơ\nquan thu thuế về số thuế phải nộp. Chính phủ quy định chi tiết thời hạn cụ thể\nđược áp dụng cho từng ngành sản xuất.\nTrong trường hợp đã thực xuất khẩu hàng sản xuất bằng vật tư, nguyên liệu nhập khẩu trong thời hạn quy định tại điểm này, thì không phải nộp thuế nhập khẩu;\"\n6/ Khoản 1, Điều 20 được sửa đổi như sau:\n\"1- Quá thời hạn nộp thuế\nquy định tại Điều 17 của Luật này, thì mỗi ngày chậm nộp, đối tượng nộp thuế bị\nphạt 0,2% (hai phần nghìn) số thuế nộp chậm.\"\n7/ Các chữ \"Hội đồng Nhà nước\"\nđược sửa đổi thành các chữ \"Uỷ ban thường vụ Quốc hội\" và các chữ\n\"Hội đồng bộ trưởng\" được sửa đổi thành các chữ \"Chính phủ\".\nĐiều 2: Chính phủ sửa đổi, bổ sung các văn bản quy định chi tiết thi hành Luật thuế xuất khẩu,\nthuế nhập khẩu đã ban hành cho phù hợp với Luật này. \nĐiều 3: Luật này có hiệu lực từ ngày 01 tháng 9 năm 1993.\nLuật này đã được Quốc hội nước Cộng hoà xã hội chủ nghĩa Việt Nam khoá IX, kỳ họp thứ\nba thông qua ngày 5 tháng 7 năm 1993.\nLê\n Đức Anh\n (Đã\n ký)"
}