{
  "url": "https://thuvienphapluat.vn/van-ban/Tai-nguyen-Moi-truong/Luat-Dau-khi-1993-18-L-CTN-38474.aspx",
  "title": "Luật Dầu khí 1993 18-L/CTN",
  "properties": {
    "Số hiệu": "18-L/CTN",
    "Loại văn bản": "Luật",
    "Nơi ban hành": "Quốc hội",
    "Người ký": "Lê Đức Anh",
    "Ngày ban hành": "06/07/1993",
    "Ngày hiệu lực": "Đã biết",
    "Ngày công báo": "Đã biết",
    "Số công báo": "Đã biết",
    "Tình trạng": "Đã biết"
  },
  "content": "QUỐC HỘI\n ********\nCỘNG HOÀ XÃ HỘI CHỦ NGHĨA VIỆT NAM\n Độc lập - Tự do - Hạnh phúc\n ********\nSố: 18-L/CTN Hà Nội, ngày 06 tháng 7 năm 1993 LUẬT SỐ 18-L/CTN NGÀY 06/07/1993 CỦA QUỐC HỘI VỀ DẦU KHÍ\nĐể bảo vệ, khai thác và sử dụng có hiệu quả nguồn tài nguyên dầu khí nhằm phát triển kinh tế quốc dân, mở rộng hợp tác với nước ngoài;\nCăn cứ vào các điều 17, 29 và 84 của Hiến pháp nước Cộng hoà xã hội chủ nghĩa Việt Nam năm 1992;\nLuật này quy định về hoạt động tìm kiếm thăm dò và khai thác dầu khí trong phạm vi lãnh thổ, vùng đặc quyền kinh tế và thềm lục địa của nước Cộng hoà xã hội chủ\nnghĩa Việt Nam. \nChương 1:\nNHỮNG QUY ĐỊNH CHUNG\nĐiều 1 Toàn bộ tài nguyên dầu khí trong lòng đất thuộc đất liền, hải đảo, nội thuỷ, lãnh hải, vùng đặc quyền kinh tế và\nthềm lục địa của nước Cộng hoà xã hội chủ nghĩa Việt Nam thuộc sở hữu toàn dân,\ndo Nhà nước Việt Nam thống nhất quản lý.\nĐiều 2 Nhà nước Việt Nam khuyến khích các tổ chức, cá nhân Việt Nam và nước ngoài đầu tư vốn, công nghệ để tiến hành các hoạt động dầu khí trên cơ sở tôn trọng độc lập, chủ quyền, toàn vẹn lãnh thổ,\nan ninh quốc gia của Việt Nam và tuân thủ pháp luật Việt Nam.\nNhà nước Việt Nam bảo hộ quyền sở\nhữu đối với vốn đầu tư, tài sản và các quyền lợi hợp pháp khác của các tổ chức,\ncá nhân Việt Nam và nước ngoài tiến hành các hoạt động dầu khí ở Việt Nam.Bổ sung\nĐiều 3 Trong Luật này, các từ ngữ dưới\nđây được hiểu như sau:\n1. \"Dầu khí\" là dầu thô, khí thiên nhiên và hydrocarbon ở thể khí, lỏng, rắn hoặc nửa rắn trong trạng thái tự nhiên, kể cả sulphur và các chất tương tự khác kèm theo hydrocarbon nhưng không kể than, đá phiến sét, bitum hoặc các khoáng sản khác có thể chiết xuất được dầu.\n2. \"Dầu thô\" là\nhydrocarbon ở thể lỏng trong trạng thái tự nhiên, asphalt, ozokerite và\nhydrocarbon lỏng thu được từ khí thiên nhiên bằng phương pháp ngưng tụ hoặc chiết xuất.\n3. \"Khí thiên nhiên\"\nlà toàn bộ hydrocarbon ở thể khí, khai thác từ giếng khoan, bao gồm cả khí ẩm,\nkhí khô, khí đầu giếng khoan và khí còn lại sau khi chiết xuất hydrocarbon lỏng từ khí ẩm.\n4. \"Hoạt động dầu khí\"\nlà hoạt động tìm kiếm thăm dò, phát triển mỏ và khai thác dầu khí, kể cả các hoạt\nđộng phục vụ trực tiếp cho các hoạt động này.\n5. \"Hợp đồng dầu khí\"\nlà văn bản ký kết giữa Tổng công ty dầu khí Việt Nam với tổ chức, cá nhân để tiến hành hoạt động dầu khí.\n6. \"Dịch vụ dầu khí\"\nlà các hoạt động liên quan đến tìm kiếm thăm dò, phát triển mỏ và khai thác dầu khí do Nhà thầu phụ tiến hành.\n7. \"Lô\" là một diện tích, giới hạn bởi các toạ độ địa lý, được phân định để tìm kiếm thăm dò và\nkhai thác dầu khí.\n8. \"Nhà thầu\" là tổ chức,\ncá nhân Việt Nam hoặc nước ngoài, được phép tiến hành hoạt động dầu khí trên cơ\nsở hợp đồng dầu khí.\n9. \"Nhà thầu phụ\" là tổ\nchức, cá nhân Việt Nam hoặc nước ngoài ký kết hợp đồng với Nhà thầu hoặc Xí\nnghiệp liên doanh dầu khí để thực hiện các dịch vụ dầu khí.\n10. \"Xí nghiệp liên doanh dầu khí\" là Xí nghiệp liên doanh được thành lập trên cơ sở hợp đồng dầu khí hoặc trên cơ sở Hiệp định ký kết giữa Chính phủ Việt Nam với Chính phủ nước ngoài.\nChương 2:\nHOẠT ĐỘNG DẦU KHÍ\nĐiều 4 Tổ chức, cá nhân tiến hành hoạt\nđộng dầu khí phải sử dụng kỹ thuật, công nghệ tiên tiến, tuân thủ các quy định của pháp luật Việt Nam về bảo vệ tài nguyên, bảo vệ môi trường, an toàn cho người và tài sản.\nĐiều 5 Tổ chức, cá nhân tiến hành hoạt\nđộng dầu khí phải có đề án bảo vệ môi trường, thực hiện tất cả các biện pháp để\nngăn ngừa ô nhiễm, loại trừ ngay các nguyên nhân gây ra ô nhiễm và có trách nhiệm khắc phục hậu quả do sự cố ô nhiễm môi trường gây ra.\nĐiều 6 Tổ chức, cá nhân tiến hành hoạt\nđộng dầu khí phải thiết lập vùng an toàn cho các công trình phục vụ hoạt động dầu khí theo quy định của Chính phủ Việt Nam.\nĐiều 7 Tổ chức, cá nhân tiến hành hoạt\nđộng dầu khí phải mua bảo hiểm đối với các phương tiện, công trình phục vụ hoạt\nđộng dầu khí, bảo hiểm môi trường và các bảo hiểm khác theo quy định của pháp luật Việt Nam, phù hợp với thông lệ trong công nghiệp dầu khí quốc tế.\nĐiều 8 Diện tích tìm kiếm thăm dò đối với một hợp đồng dầu khí được xác định trên cở sở các lô do Chính phủ Việt Nam phân\nđịnh.\nĐiều 9 Không được tiến hành hoạt động dầu khí tại khu vực mà Nhà nước Việt Nam tuyên bố cấm hoặc tạm thời cấm vì lý do quốc phòng, an ninh quốc gia hoặc lợi ích công cộng.\nTrong trường hợp hoạt động dầu khí đã được phép tiến hành mà bị cấm hoặc tạm thời cấm, Chính phủ Việt Nam giải quyết thoả đáng những thiệt hại cho tổ chức, cá nhân do việc cấm hoặc tạm thời cấm gây ra.\nĐiều 10 Chính phủ Việt Nam cho phép tổ\nchức, cá nhân tiến hành các hoạt động nghiên cứu khoa học, tìm kiếm thăm dò và\nkhai thác khoáng sản, tài nguyên thiên nhiên khác ngoài dầu khí trong diện tích hợp đồng dầu khí theo quy định của pháp luật Việt Nam. Các hoạt động này không\nđược gây cản trở và làm thiệt hại cho các hoạt động dầu khí.\nĐiều 11 Toàn bộ mẫu vật, số liệu, thông tin thu được trong quá trình tiến hành các hoạt động dầu khí thuộc sở hữu của Nhà nước Việt Nam. Việc quản lý và sử dụng các mẫu vật, số liệu, thông tin này phải tuân thủ các quy định của pháp luật Việt Nam.\nĐiều 12 Tổ chức, cá nhân tiến hành hoạt\nđộng dầu khí được phép lắp đặt, vận hành, bảo dưỡng các công trình cố định và\nthiết bị phục vụ các hoạt động dầu khí; được xây dựng, sử dụng đường giao thông, đường ống, kho chứa phục vụ vận chuyển và tàng trữ dầu khí theo quy định của pháp luật Việt Nam.\nCác công trình cố định, thiết bị\ntrên đây thuộc sở hữu của Nhà nước Việt Nam kể từ thời điểm do các bên ký kết hợp\nđồng dầu khí thoả thuận.\nĐiều 13 Sau khi kết thúc các hoạt động dầu khí, tổ chức, cá nhân phải giải phóng diện tích đã sử dụng, phải tháo dỡ các công trình cố định, thiết bị theo yêu cầu của cơ quan quản lý Nhà nước có thẩm quyền.\nĐiều 14 Tổng công ty dầu khí Việt Nam\n(tên giao dịch quốc tế là \"PETROVIETNAM\") là doanh nghiệp Nhà nước do Chính phủ Việt Nam thành lập để tiến hành các hoạt động dầu khí và ký kết hợp đồng dầu khí với tổ chức, cá nhân tiến hành các hoạt động dầu khí theo quy định của Luật này.\nChương 3:\nHỢP ĐỒNG DẦU KHÍ\nĐiều 15 Hợp đồng dầu khí được ký kết dưới các hình thức hợp đồng chia sản phẩm, hợp đồng liên doanh hoặc các hình thức khác.\nHợp đồng dầu khí phải tuân thủ Hợp\nđồng mẫu do Chính phủ Việt Nam ban hành, trong đó có những nội dung chính sau\nđây:\n1. Tư cách pháp lý của tổ chức,\ncá nhân tham gia ký kết hợp đồng;\n2. Đối tượng của hợp đồng;\n3. Giới hạn diện tích và tiến độ\nhoàn trả diện tích hợp đồng;\n4. Thời hạn hợp đồng;\n5. Điều kiện chấm dứt hợp đồng trước thời hạn hoặc kéo dài thời hạn hợp đồng;\n6. Cam kết về tiến độ công việc và đầu tư tài chính;\n7. Quyền và nghĩa vụ của các bên ký kết hợp đồng;\n8. Việc thu hồi vốn đầu tư, xác\nđịnh lợi nhuận và phân chia lợi nhuận; quyền của nước chủ nhà đối với tài sản cố\nđịnh sau khi hoàn vốn và khi chấm dứt hợp đồng;\n9. Điều kiện chuyển nhượng quyền và nghĩa vụ của các bên ký kết hợp đồng; quyền của Tổng công ty dầu khí Việt Nam được tham gia vốn đầu tư;\n10. Cam kết đào tạo và ưu tiên sử\ndụng lao động, dịch vụ Việt Nam;\n11. Trách nhiệm bảo vệ môi trường và bảo đảm an toàn trong khi tiến hành hoạt động dầu khí;\n12. Thể thức giải quyết tranh chấp phát sinh từ hợp đồng.\nNgoài những quy định trong Hợp đồng mẫu, các bên ký kết hợp đồng được thoả thuận các điều khoản khác không trái với quy định của Luật này và pháp luật Việt Nam.\nĐiều 16 Tổ chức, cá nhân muốn ký kết hợp\nđồng dầu khí phải thông qua đấu thầu hoặc các hình thức khác do Chính phủ Việt Nam quy định. Tổ chức, cá nhân này phải giải trình rõ khả năng tài chính, trình\nđộ kỹ thuật, kinh nghiệm chuyên môn trong lĩnh vực hoạt động dầu khí.\nĐiều 17 Thời hạn hợp đồng dầu khí không quá hai mươi lăm năm (25 năm), trong đó giai đoạn tìm kiếm thăm dò không quá\nnăm năm (5 năm).\nThời hạn hợp đồng dầu khí đối với khu vực nước sâu, xa bờ và thời hạn hợp đồng tìm kiếm thăm dò, khai thác khí\nthiên nhiên không quá ba mươi năm (30 năm), trong đó giai đoạn tìm kiếm thăm dò\nkhông quá bảy năm (7 năm).\nThời hạn hợp\nđồng dầu khí có thể được kéo dài thêm, nhưng không quá năm năm (5 năm) và thời hạn của giai đoạn tìm kiếm thăm dò có thể được kéo dài thêm, nhưng không quá một năm (1 năm), theo đề nghị của Nhà thầu và phải được Chính phủ Việt Nam quyết định.\nHợp đồng dầu khí có thể kết thúc trước thời hạn với điều kiện Nhà thầu phải hoàn thành các nghĩa vụ đã cam kết và được các bên ký kết hợp đồng thoả thuận.\nĐiều 18 Diện tích tìm kiếm thăm dò đối với một hợp đồng dầu khí không quá hai lô (2 lô).\nTrong trường hợp đặc biệt, Chính phủ Việt Nam có thể cho phép diện tích tìm kiếm thăm dò đối với một hợp đồng dầu khí trên hai lô (2 lô), nhưng không quá bốn lô (4 lô).\nĐiều 19 Nhà thầu phải hoàn trả diện tích tìm kiếm thăm dò theo quy định của Chính phủ Việt Nam.\nĐiều 20 Nhà thầu và Tổng công ty dầu khi Việt Nam phải thoả thuận trong hợp đồng dầu khí tiến độ\ncông việc và cam kết đầu tư tài chính tối thiểu trong gian đoạn tìm kiếm thăm dò.\nĐiều 21 Ngay sau khi phát hiện thấy dầu khí, Nhà thầu và Tổng công ty dầu khí Việt Nam phải báo cáo và cung cấp mọi thông tin cần thiết về việc phát hiện thấy dầu khí cho cơ\nquan quản lý Nhà nước có thẩm quyền.\nNếu xét thấy dầu khí đã phát hiện có giá trị thương mại, Nhà thầu phải tiến hành ngay chương trình thẩm lượng, lập báo cáo trữ lượng, sơ đồ phát triển mỏ và khai thác trình cơ quan quản lý Nhà nước có thẩm quyền phê duyệt.\nĐiều 22 Ngôn ngữ của hợp đồng dầu khí ký\nkết với tổ chức, cá nhân nước ngoài và các văn bản kèm theo hợp đồng phải là tiếng Việt và một thứ tiếng nước ngoài thông dụng do Tổng công ty dầu khí Việt Nam và tổ chức, cá nhân nước ngoài thoả thuận. Bản bằng tiếng Việt và bản bằng tiếng nước ngoài đều có giá trị như nhau.\nĐiều 23 Hợp đồng dầu khí có hiệu lực sau khi được Chính phủ Việt Nam chuẩn y.\nĐiều 24 Việc chuyển nhượng toàn bộ hoặc một phần hợp đồng dầu khí của các bên tham gia hợp đồng chỉ có hiệu lực sau khi\nđược Chính phủ Việt Nam chuẩn y.\nTổng công ty dầu khí Việt Nam được quyền ưu tiên mua lại một phần hoặc toàn bộ hợp đồng được chuyển nhượng.\nĐiều 25 Tổng công ty dầu khí Việt Nam được quyền tham gia vốn vào hợp đồng dầu khí. Tỷ lệ, thời gian tham gia vốn, việc hoàn lại chi phí cho Nhà thầu và thoả thuận về điều hành được quy định trong hợp đồng dầu khí phù hợp với thông lệ trong công nghiệp dầu khí quốc tế.Bổ sung\nĐiều 26 Nhà thầu được quyền ký kết hợp đồng về dịch vụ dầu khí, nhưng phải ưu tiên ký kết những hợp đồng đó với tổ chức, cá\nnhân Việt Nam.\nViệt Nam tự đảm nhiệm dịch vụ\nbay hoặc ký kết hợp đồng liên doanh với nước ngoài để thực hiện các dịch vụ bay phục vụ hoạt động dầu khí.\nĐiều 27 Các tranh chấp phát sinh từ hợp\nđồng dầu khí trước hết phải được giải quyết thông qua thương lượng và hoà giải.\nTrong trường hợp các bên tranh chấp không thể hoà giải được với nhau, nếu các bên tranh chấp là tổ chức, cá\nnhân Việt Nam, thì vụ tranh chấp được giải quyết theo quy định của pháp luật Việt Nam; nếu bên tranh chấp là tổ chức, cá nhân nước ngoài, thì vụ tranh chấp được giải quyết theo các quy định của Luật đầu tư nước ngoài tại Việt Nam.\nChương 4:\nQUYỀN VÀ NGHĨA VỤ CỦA NHÀ THẦU\nĐiều 28 Nhà thầu có các quyền sau đây:\n1. Được hưởng những ưu đãi và những bảo đảm theo quy định của pháp luật Việt Nam;\n2. Được sử dụng các mẫu vật, số\nliệu, thông tin thu được để tiến hành các hoạt động dầu khí;\n3. Được tuyển dụng người lao động để thực hiện các công việc của hợp đồng dầu khí trên cơ sở\nưu tiên tuyển dụng người lao động ViệtNam;\n4. Được thuê Nhà thầu phụ theo quy định của Luật này và phù hợp với thông lệ trong công nghiệp dầu khí quốc tế;\n5. Được miễn thuế nhập khẩu các thiết bị,\nvật tư cần thiết cho hoạt động dầu khí và miễn thuế tái xuất khi các thiết bị\nnhập khẩu không được lắp đặt cố định hoặc vật tư không sử dụng hết theo quy định của pháp luật Việt Nam;\n6. Được quyền sở hữu phần dầu khí của mình sau khi hoàn thành các nghĩa vụ tài chính với Nhà nước Việt Nam;\n7. Được xuất khẩu phần dầu khí của mình theo thoả thuận trong hợp đồng dầu khí;\n8. Được thu hồi vốn đầu tư theo thoả thuận trong hợp đồng dầu khí;\n9. Nhà thầu là tổ chức, cá nhân nước ngoài được chuyển vốn đầu tư và lợi nhuận thu được trong quá trình hoạt động dầu khí ra nước ngoài theo các quy định của Luật đầu tư nước ngoài tại Việt Nam.\nĐiều 29 Nhà thầu phụ được hưởng các quyền quy định tại các điểm 1, 3 và 5 Điều 28 của Luật này.\nNhà thầu phụ là tổ chức, cá nhân nước ngoài còn được hưởng quyền quy định tại điểm 9 Điều 28 của Luật này.\nĐiều 30 Nhà thầu có các nghĩa vụ sau\nđây:\n1. Tuân thủ pháp luật Việt Nam;\n2. Thực hiện các cam kết ghi trong hợp đồng dầu khí;\n3. Nộp các loại thuế, lệ phí\ntheo quy định của pháp luật Việt Nam;\n4. Chuyển giao công nghệ; đào tạo, sử dụng cán bộ, công nhân ViệtNam và bảo đảm quyền lợi của người lao động;\n5. Thực hiện các biện pháp bảo vệ\nmôi trường;\n6. Báo cáo hoạt động dầu khí với cơ quan quản lý Nhà nước có thẩm quyền và Tổng công ty dầu khí Việt Nam;\n7. Cung cấp các tài liệu cho\nđoàn thanh tra;\n8. Thu dọn các công trình, thiết bị, phương tiện sau khi kết thúc hoạt động dầu khí theo yêu cầu của cơ quan quản lý Nhà nước có thẩm quyền;\n9. Bán tại thị trường ViệtNam một phần dầu khí thuộc quyền sở hữu của mình khi Chính phủ\nViệt Nam yêu cầu.\nĐiều 31 Nhà thầu phụ có các nghĩa vụ quy\nđịnh tại các điểm 1, 2, 3, 4, 5 và 7 Điều 30 của Luật này.\nChương 5:\nTHUẾ VÀ LỆ PHÍ\nĐiều 32 Tổ chức, cá nhân khai thác dầu khí phải nộp thuế tài nguyên.\nThuế tài nguyên được tính theo sản lượng khai thác thực tế trong thời kỳ nộp thuế cho từng hợp đồng dầu khí.\nThuế suất thuế tài nguyên đối với dầu thô được quy định từ sáu phần trăm (6%) đến hai mươi lăm phần trăm (25%),\ntrường hợp đặc biệt có thể cao hơn.\nThuế suất thuế tài nguyên đối với khí thiên nhiên được quy định từ không phần trăm (0%) đến mười phần trăm (10%).\nChính phủ Việt Nam quy định thuế\nsuất cụ thể trong phạm vi khung thuế suất nói trên tuỳ thuộc vào các điều kiện\nđịa lý, kinh tế kỹ thuật của mỏ và mức sản lượng dầu thô hoặc khí thiên nhiên.\nĐiều 33 Tổ chức, cá nhân tiến hành tìm kiếm thăm dò và khai thác dầu khí phải nộp thuế lợi tức với thuế suất năm mươi phần trăm (50%) trên lợi tức chịu thuế trong thời kỳ nộp thuế.\nTrong trường hợp đặc biệt, tổ chức,\ncá nhân tiến hành các hoạt động tìm kiếm thăm dò và khai thác dầu khí có thể được miễn hoặc giảm thuế lợi tức. Việc miễn hoặc giảm thuế lợi tức do Chính phủ Việt Nam quy định.\nĐiều 34 Nhà thầu phụ là tổ chức, cá nhân Việt Nam tiến hành các hoạt động tại Việt Nam phải nộp thuế lợi tức theo quy định của Luật thuế lợi tức.\nNhà thầu phụ là tổ chức, cá nhân nước ngoài có đăng ký hoạt động tại Việt Nam phải nộp thuế lợi tức theo quy định của Luật đầu tư nước ngoài tại Việt Nam.\nNhà thầu phụ là tổ chức, cá nhân nước ngoài không đăng ký hoạt động tại Việt Nam phải nộp thuế theo quy định của pháp luật Việt Nam.\nĐiều 35 Tổ chức, cá nhân tiến hành các hoạt động dầu khí phải nộp thuế xuất khẩu, thuế nhập khẩu, tiền thuê sử dụng mặt\nđất hoặc thuế nhà đất, các khoản thuế khác và lệ phí theo quy định của pháp luật Việt Nam.\nTổ chức, cá nhân nước ngoài tiến hành hoạt động dầu khí phải nộp thuế chuyển lợi nhuận ra nước ngoài theo quy định của Luật đầu tư nước ngoài tại Việt Nam.\nĐiều 36 Người nước ngoài và người Việt Nam làm việc cho Nhà thầu, Xí nghiệp liên doanh dầu khí, Nhà thầu phụ phải nộp thuế thu nhập theo quy định của pháp luật Việt Nam.\nĐiều 37 Theo thoả thuận trong hợp đồng dầu khí, thuế tài nguyên và các khoản thuế mà Nhà thầu hoặc Xí nghiệp liên doanh dầu khí phải nộp có thể được tính gộp vào phần chia sản phẩm của Tổng công ty dầu khí Việt Nam, với điều kiện Tổng công ty dầu khí Việt Nam cam kết nộp thuế tài nguyên và các khoản thuế đó thay cho Nhà thầu hoặc Xí nghiệp liên doanh dầu khí.\nChương 6:\nQUẢN LÝ NHÀ NƯỚC VỀ HOẠT\nĐỘNG DẦU KHÍ\nĐiều 38 Nội dung quản lý Nhà nước về dầu khí bao gồm:\n1. Quyết định chiến lược, quy hoạch,\nkế hoạch và chính sách phát triển ngành công nghiệp dầu khí;\n2. Ban hành các văn bản pháp quy về quản lý các hoạt động dầu khí;\n3. Kiểm tra, thanh tra và giám sát các hoạt động dầu khí;\n4. Quyết định việc phân định và điều chỉnh các lô hoặc diện tích tìm kiếm thăm dò, khai thác dầu khí;\n5. Quyết định chủ trương và hình thức hợp tác với nước ngoài;\n6. Chuẩn y các hợp đồng dầu khí;\n7. Quyết định chính sách khuyến khích hoặc hạn chế xuất khẩu dầu khí nhằm bảo đảm lợi ích của Nhà nước, có tính\nđến lợi ích của Nhà thầu;\n8. Chỉ đạo, hướng dẫn, kiểm tra các ngành và địa phương trong việc thực hiện các hoạt động có liên quan đến hoạt\nđộng dầu khí;\n9. Giải quyết các vấn đề liên quan đến quyền tiến hành hoạt động dầu khí, xử lý các vi phạm Luật này.\nĐiều 39 Chính phủ Việt Nam thống nhất quản lý Nhà nước về hoạt động dầu khí.\nCơ quan quản lý Nhà nước về dầu khí được thành lập theo Luật tổ chức Chính phủ để thực hiện chức năng quản lý Nhà nước về hoạt động dầu khí.\nCác Bộ và\ncác cơ quan Nhà nước khác thực hiện chức năng quản lý Nhà nước về hoạt động dầu khí theo nhiệm vụ, quyền hạn của mình.\nChương 7 THANH TRA CÁC HOẠT ĐỘNG DẦU KHÍ\nĐiều 40 Thanh tra các hoạt động dầu khí\nlà thanh tra chuyên ngành nhằm bảo đảm việc chấp hành các quy định của Luật này, các quy chế, quy trình, quy phạm kỹ thuật, bảo vệ tài nguyên dầu khí, bảo vệ môi trường, an toàn kỹ thuật và việc thực hiện các nghĩa vụ đối với Nhà nước Việt Nam của tổ chức, cá nhân tiến hành các hoạt động dầu khí.\nĐiều 41 Cơ quan quản lý Nhà nước về dầu khí tổ chức thực hiện chức năng thanh tra các hoạt động dầu khí.\nKhi tiến hành thanh tra các hoạt\nđộng dầu khí, đoàn thanh tra có quyền:\n1. Yêu cầu các tổ chức, cá nhân có liên quan cung cấp tài liệu và trả lời về những vấn đề cần thiết cho việc thanh tra;\n2. Tiến hành các biện pháp kiểm tra kỹ thuật tại hiện trường;\n3. Tạm đình chỉ hoặc kiến nghị với cơ quan Nhà nước có thẩm quyền đình chỉ các hoạt động dầu khí có nguy cơ gây tai nạn hoặc tổn thất nghiêm trọng đối với người hoặc tài sản, tài nguyên dầu khí và ô nhiễm môi trường;\n4. Xử lý theo thẩm quyền hoặc kiến nghị với cơ quan Nhà nước có thẩm quyền xử lý các vi phạm.\nĐiều 42 Tổ chức, cá nhân tiến hành các hoạt động dầu khí phải tạo điều kiện thuận lợi cho đoàn thanh tra thi hành nhiệm vụ và phải chấp hành nghiêm chỉnh mọi quyết định của đoàn thanh tra.\nTổ chức, cá nhân được quyền khiếu nại quyết định của đoàn thanh tra theo quy định của pháp luật Việt Nam.\nChương 8 XỬ LÝ VI PHẠM\nĐiều 43 Tổ chức,\ncá nhân vi phạm các quy định của Luật này thì tuỳ theo mức độ vi phạm mà bị cảnh cáo, phạt tiền, tịch thu phương tiện hoặc bị áp dụng các hình thức, biện pháp xử\nphạt hành chính khác.\nCá nhân vi phạm có hành vi cấu thành tội phạm thì bị truy cứu trách nhiệm hình sự theo quy định của pháp luật Việt Nam.\nĐiều 44 Tổ chức, cá nhân tiến hành các hoạt động dầu khí gây thiệt hại đối với tài nguyên dầu khí, tài nguyên thiên nhiên khác, môi trường hoặc tài sản của Nhà nước, của tổ chức, cá nhân, thì phải bồi thường thiệt hại theo quy định của pháp luật Việt Nam.\nĐiều 45 Tổ chức, cá nhân cản trở bất hợp pháp các hoạt động dầu khí bị xử lý vi phạm theo quy định của pháp luật Việt Nam.\nĐiều 46 Tổ chức, cá nhân được quyền khiếu nại các quyết định xử lý vi phạm theo quy định của pháp luật Việt Nam.\nChương 9:\nĐIỀU KHOẢN THI HÀNH\nĐiều 47 Luật này và các quy định khác của pháp luật Việt Nam cũng được áp dụng:\n1. Trên các công trình, phương tiện, thiết bị phục vụ cho các hoạt động dầu khí trong vùng đặc quyền kinh tế và\nthềm lục địa của nước Cộng hoà xã hội chủ nghĩa Việt Nam;\n2. Trên các công trình, phương tiện, thiết bị của tổ chức, cá nhân Việt Nam phục vụ cho các hoạt động dầu khí\ntrên cơ sở hợp tác với nước ngoài tại các vùng không thuộc quyền tài phán của nước Cộng hoà xã hội chủ nghĩa Việt Nam.\nĐiều 48 Chính phủ Việt Nam bảo đảm các quyền lợi về kinh tế của các bên đã ký kết các Hiệp định, hợp đồng dầu khí và\nđã được Chính phủ Việt Nam chuẩn y trước ngày Luật này có hiệu lực.\nĐiều 49 Căn cứ vào những quy định trong Luật này, Chính phủ Việt nam ký kết với Chính phủ nước ngoài Hiệp định hợp tác tiến hành các hoạt động dầu khí tại Việt Nam.\nĐiều 50 Những quy định trước đây trái với Luật này đều bãi bỏ.\nChính phủ Việt Nam quy định chi tiết thi hành Luật này.\nĐiều 51 Luật này có hiệu lực từ ngày 01 tháng 9 năm 1993.\nLuật này đã được Quốc hội nước Cộng hoà xã hội chủ nghĩa Việt Nam khoá IX, kỳ họp thứ\nba thông qua ngày 06 tháng 7 năm 1993.\nLê\n Đức Anh\n (Đã\n ký)"
}