{
  "url": "https://thuvienphapluat.vn/van-ban/Bo-may-hanh-chinh/Luat-To-chuc-Hoi-dong-nhan-dan-va-Uy-ban-nhan-dan-1989-19-LCT-HDNN8-37692.aspx",
  "title": "Luật Tổ chức Hội đồng nhân dân và Uỷ ban nhân dân 1989 19-LCT/HĐNN8",
  "properties": {
    "Số hiệu": "19-LCT/HĐNN8",
    "Loại văn bản": "Luật",
    "Nơi ban hành": "Quốc hội",
    "Người ký": "Võ Chí Công",
    "Ngày ban hành": "30/06/1989",
    "Ngày hiệu lực": "Đã biết",
    "Ngày công báo": "Đã biết",
    "Số công báo": "Đã biết",
    "Tình trạng": "Đã biết"
  },
  "content": "QUỐC HỘI\n\t\t\t\t\t\t\t********\nCỘNG HOÀ XÃ HỘI CHỦ NGHĨA VIỆT NAM\n\t\t\t\t\t\t\tĐộc lập - Tự do - Hạnh phúc\n\t\t\t\t\t\t\t********\nSố: 19-LCT/HĐNN8 Hà Nội, ngày 30 tháng 6 năm 1989 LUẬT TỔ CHỨC HỘI ĐỒNG NHÂN DÂN VÀ UỶ BAN NHÂN DÂN CỦA QUỐC HỘI SỐ 19-LCT/HĐNN8 NGÀY 30/06/1989 Căn cứ vào Chương IX của Hiến pháp nước Cộng hoà xã hội chủ nghĩa Việt Nam;\n\t\t\tLuật này quy định về tổ chức và hoạt động của Hội đồng nhân dân và Uỷ ban nhân dân các cấp. \nChương 1:\nNHỮNG QUY ĐỊNH CHUNG \nĐiều 1 Hội đồng nhân dân là cơ quan quyền lực Nhà nước ở địa phương, do nhân dân địa phương bầu ra, đại diện cho ý chí, nguyện vọng và quyền làm chủ của nhân dân ở địa phương, chịu trách nhiệm trước nhân dân địa phương và chính quyền cấp trên.\nĐiều 2 Hội đồng nhân dân bảo đảm việc chấp hành pháp luật của Nhà nước, quyết định của chính quyền cấp trên, căn cứ vào nhiệm vụ, quyền hạn của cấp mình và xuất phát từ lợi ích chung của đất nước, lợi ích của nhân dân địa phương quyết định và bảo đảm thực hiện các chủ trương, biện pháp để phát huy tiềm năng của địa phương, xây dựng và phát triển địa phương về các mặt chính trị, kinh tế, văn hoá, xã hội, an ninh và quốc phòng, không ngừng cải thiện đời sống vật chất và văn hoá của nhân dân địa phương và làm tròn nghĩa vụ của địa phương đối với Nhà nước.\nSố đại biểu Hội đồng nhân dân các cấp và thể thức bầu cử đại biểu Hội đồng nhân dân do Luật định.\nĐiều 3 Thường trực Hội đồng nhân và Uỷ ban nhân dân do Hội đồng nhân dân bầu ra.\nThường trực Hội đồng nhân được thành lập ở Hội đồng nhân dân tỉnh, thành phố trực thuộc trung ương và cấp tương đương, huyện, quận, thành phố thuộc tỉnh và thị xã là cơ quan bảo đảm việc tổ chức các hoạt động của Hội đồng nhân dân các cấp đó, chịu trách nhiệm trước Hội đồng nhân dân cùng cấp, chịu sự giám sát và hướng dẫn của Hội đồng nhân dân cấp trên, của Quốc hội và Hội đồng Nhà nước.\nUỷ ban nhân dân là cơ quan chấp hành của Hội đồng nhân dân, là cơ quan hành chính Nhà nước ở địa phương, chịu trách nhiệm và báo cáo công tác trước Hội đồng nhân dân cùng cấp, chịu sự lãnh đạo của Uỷ ban nhân dân cấp trên và sự lãnh đạo thống nhất của Hội đồng bộ trưởng.\nĐiều 4 Nhiệm kỳ của mỗi khoá Hội đồng nhân các cấp là năm năm.\nNhiệm kỳ của Thường trực Hội đồng nhân dân và của Uỷ ban nhân dân theo nhiệm kỳ của Hội đồng nhân cùng cấp. Khi Hội đồng nhân dân hết nhiệm kỳ, Thường trực Hội đồng nhân dân và Uỷ ban nhân dân tiếp tục làm nhiệm vụ cho đến khi Hội đồng nhân dân bầu ra Thường trực Hội đồng nhân và Uỷ ban nhân dân mới.\nĐiều 5 Hội đồng nhân dân tổ chức và hoạt động theo nguyên tắc tập trung dân chủ.\nHội đồng nhân dân bảo đảm việc quản lý địa phương theo Hiến pháp và pháp luật, tăng cường pháp chế xã hội chủ nghĩa; không ngừng củng cố mối liên hệ mật thiết với nhân dân; ngăn ngừa, khắc phục tệ quan liêu, hách dịch, cửa quyền, vô trách nhiệm và các biểu hiện tiêu cực khác trong các cơ quan Nhà nước và nhân viên Nhà nước ở địa phương.\nĐiều 6 Hiệu quả hoạt động của Hội đồng nhân dân được bảo đảm bằng hiệu quả của các kỳ họp Hội đồng nhân dân, hiệu quả hoạt động của Thường trực Hội đồng nhân dân, của Uỷ ban nhân dân, các Ban của Hội đồng nhân dân và hiệu quả hoạt động của các đại biểu Hội đồng nhân dân.\nĐiều 7 Trong hoạt động của mình, Hội đồng nhân dân, Thường trực Hội đồng nhân, Uỷ ban nhân dân, các ban của Hội đồng nhân dân và các đại biểu Hội đồng nhân dân cộng tác chặt chẽ với Mặt trận Tổ quốc Việt Nam, với các đoàn thể nhân dân, các tổ chức xã hội khác và vận động công dân tham gia rộng rãi vào việc quản lý Nhà nước và thực hiện các nghĩa vụ của mình.\nChương 2:\nNHIỆM VỤ, QUYỀN HẠN CỦA HỘI ĐỒNG NHÂN DÂN CÁC CẤP \nĐiều 8 Hội đồng nhân dân thực hiện các nhiệm vụ và sử dụng những quyền hạn quy định tại Điều 115 của Hiến pháp nước Cộng hoà xã hội chủ nghĩa Việt Nam, theo sự phân cấp quản lý của chính quyền cấp trên, bảo đảm sự lãnh đạo thống nhất của trung ương, đồng thời phát huy quyền chủ động, sáng tạo của địa phương.\nĐiều 9 Về kinh tế, Hội đồng nhân dân:\n1- Căn cứ vào quy hoạch, kế hoạch của cấp trên, xây dựng quy hoạch, quyết định kế hoạch kinh tế - xã hội và dự toán ngân sách của địa phương; phê chuẩn việc thực hiện kế hoạch và quyết toán ngân sách của địa phương;\n2- Quyết định chủ trương, biện pháp phát triển các thành phần kinh tế ở địa phương theo pháp luật của Nhà nước, bảo đảm quyền tự chủ sản xuất, kinh doanh của các đơn vị kinh tế cơ sở;\n3- Quyết định chủ trương, biện pháp về phát triển sản xuất, kinh doanh, phân phối lưu thông, dịch vụ; xây dựng cơ sở vật chất và kỹ thuật của chủ nghĩa xã hội ở địa phương; thực hiện chính sách tài chính, tiền tệ, giá cả và quản lý thị trường;\n4- Quyết định chủ trương, biện pháp về dân số, phân bố lao động và dân cư ở địa phương;\n5- Quyết định biện pháp quản lý đất đai, rừng núi, sông hồ, hầm mỏ, bảo vệ tài nguyên thiên nhiên, bảo vệ và cải thiện môi trường sống ở địa phương, theo quy định của pháp luật;\n6- Bảo đảm thực hiện chính sách tiết kiệm trong mọi hoạt động kinh tế và quản lý Nhà nước của địa phương.\nĐiều 10 Về khoa học và kỹ thuật, Hội đồng nhân dân:\n1- Thông qua kế hoạch phát triển khoa học, kỹ thuật và ứng dụng các tiến bộ khoa học, kỹ thuật;\n2- Bảo đảm việc thực hiện các quy định của Nhà nước về tiêu chuẩn, đo lường và chất lượng sản phẩm ở các đơn vị cơ sở thuộc các thành phần kinh tế.\nĐiều 11 Về văn hoá, xã hội và đời sống, Hội đồng nhân dân:\n1- Quyết định chủ trương, biện pháp cải thiện đời sống của nhân dân; từng bước giải quyết việc làm và cải thiện điều kiện làm việc, sinh hoạt của người lao động ở địa phương;\n2- Bảo đảm xây dựng con người mới xã hội chủ nghĩa; phát triển giáo dục, văn hoá, văn nghệ, thể dục thể thao; bảo vệ, chăm sóc và giáo dục thiếu niên, nhi đồng; bảo vệ sức khoẻ của nhân dân, của người già, bà mẹ và trẻ em; bảo đảm thực hiện kế hoạch hoá gia đình.\nXây dựng nếp sống văn minh, giáo dục đạo đức, truyền thống tốt đẹp của dân tộc; chống những biểu hiện không lành mạnh trong đời sống văn hoá và xã hội ở địa phương;\n3- Đảm bảo việc thi hành chính sách bảo hiểm xã hội, cứu tế xã hội; chăm sóc và giúp đỡ thương binh, bệnh binh, gia đình liệt sĩ, gia đình có công với cách mạng.\nĐiều 12 Về an ninh và quốc phòng, Hội đồng nhân dân:\n1- Quyết định các biện pháp tổ chức quốc phòng toàn dân và xây dựng lực lượng vũ trang nhân ở địa phương; bảo đảm việc thực hiện chế độ nghĩa vụ quân sự; thực hiện nhiệm vụ hậu cần tại chỗ và chính sách hậu phương đối với các lực lượng vũ trang nhân dân;\n2- Bảo vệ an ninh, trật tự, an toàn xã hội; phòng, chống tội phạm và các hành vi vi phạm pháp luật khác.\nĐiều 13 Về chính sách dân tộc, Hội đồng nhân dân bảo đảm thực hiện chính sách dân tộc; bảo đảm sự bình đẳng giữa các dân tộc; giữ vững và tăng cường khối đoàn kết dân tộc.\nĐiều 14 Về pháp chế xã hội chủ nghĩa, Hội đồng nhân dân:\n1- Bảo đảm việc thi hành Hiến pháp và pháp luật trong các cơ quan Nhà nước, các đơn vị kinh tế, các tổ chức xã hội, các lực lượng vũ trang nhân dân, trong nhân viên Nhà nước và nhân dân ở địa phương;\n2- Trong phạm vi nhiệm vụ và quyền hạn của mình, giám sát việc tuân theo pháp luật của các cơ quan, đơn vị kinh tế và các tổ chức khác của cấp trên ở địa phương;\n3- Bảo vệ tài sản xã hội chủ nghĩa ở địa phương;\n4- Bảo hộ tính mạng, tài sản, tự do, danh dự, nhân phẩm, các quyền và lợi ích chính đáng khác của công dân; đồng thời động viên nhân dân làm tròn nghĩa vụ đối với Nhà nước;\n5- Bảo đảm việc giải quyết các khuyến nại, tố cáo và kiến nghị của nhân dân địa phương, theo quy định của pháp luật.\nĐiều 15 Về xây dựng bộ máy chính quyền ở địa phương, Hội đồng nhân dân:\n1- Bầu và bãi miễn các thành viên của Thường trực Hội đồng nhân dân, các thành viên của Uỷ ban nhân dân; bầu và bãi miễn các thành viên của các Ban của Hội đồng nhân dân; bầu và bãi miễn các thành viên của Toà án nhân dân cùng cấp, theo quy định của pháp luật;\n2- Giải tán Hội đồng nhân dân cấp dưới trực tiếp khi Hội đồng nhân dân này làm thiệt hại nghiêm trọng đến quyền lợi của nhân dân.\nNghị quyết giải tán đó phải được sự phê chuẩn của Hội đồng nhân dân cấp trên trực tiếp trước khi thi hành. Nghị quyết của Hội đồng nhân dân tỉnh, thành phố trực thuộc trung ương và cấp tương đương giải tán Hội đồng nhân dân cấp dưới trực tiếp phải được sự phê chuẩn của Hội đồng Nhà nước trước khi thi hành;\n3- Thông qua đề án phân vạch địa giới các đơn vị hành chính ở địa phương và đề nghị cấp trên xét.\nĐiều 16 Căn cứ vào pháp luật của Nhà nước, quyết định của cấp trên, vào tình hình thực tế và yêu cầu nhiệm vụ của địa phương, Hội đồng nhân dân:\n1- Ra những nghị quyết và kiểm tra việc thi hành những nghị quyết đó. Những nghị quyết về những vấn đề mà pháp luật quy định thuộc quyền phê chuẩn của cấp trên thì trước khi thi hành, phải được cấp trên phê chuẩn;\n2- Giám sát và hướng dẫn hoạt động của Hội đồng nhân dân cấp dưới; sửa đổi hoặc bãi bỏ những quyết định không thích đáng của Hội đồng nhân dân cấp dưới trực tiếp;\n3- Giám sát công tác của Thường trực Hội đồng nhân dân, của Uỷ ban nhân dân, sửa đổi hoặc bãi bỏ những quyết định không thích đáng của Thường trực Hội đồng nhân dân, của Uỷ ban nhân dân cùng cấp; giám sát công tác của Toà án nhân dân cùng cấp.\nĐiều 17 Nhiệm vụ, quyền hạn cụ thể của Hội đồng nhân dân mỗi cấp do Hội đồng Nhà nước quy định.\nChương 3:\nKỲ HỌP HỘI ĐỒNG NHÂN DÂN \nĐiều 18 Hội đồng nhân dân các cấp ba tháng họp một kỳ.\nở miền núi, nơi nào đi lại khó khăn, thì hội đồng nhân tỉnh và huyện có thể sáu tháng họp một kỳ.\nKỳ họp của Hội đồng nhân dân tỉnh, huyện và cấp tương đương do Thường trực Hội đồng nhân dân cùng cấp triệu tập; kỳ họp của Hội đồng nhân dân xã, phường, thị trấn do Uỷ ban nhân dân cùng cấp triệu tập theo đúng kỳ hạn.\nThường trực Hội đồng nhân dân tỉnh, huyện và cấp tương đương, Uỷ ban nhân dân xã, phường, thị trấn có thể triệu tập kỳ họp bất thường của Hội đồng nhân dân cấp mình khi xét thấy cần thiết, hoặc khi ít nhất có một phần ba tổng số đại biểu Hội đồng nhân dân cấp mình yêu cầu.\nKỳ họp thứ nhất của Hội đồng nhân dân tỉnh, huyện và cấp tương đương khoá mới do Thường trực Hội đồng nhân dân cùng cấp khoá trước triệu tập; kỳ họp của Hội đồng nhân dân xã, phường, thị trấn do Uỷ ban nhân dân cùng cấp khoá trước triệu tập chậm nhất là 30 ngày, sau khi bầu xong đại biểu Hội đồng nhân dân.\nở miền núi, nơi nào đi lại khó khăn, thì kỳ họp thứ nhất của Hội đồng nhân dân tỉnh có thể được triệu tập chậm nhất là 45 ngày, sau khi bầu xong đại biểu Hội đồng nhân dân.\nThường trực Hội đồng nhân dân tỉnh, huyện và cấp tương đương chủ toạ các kỳ họp của Hội đồng nhân dân cùng cấp. Hội đồng nhân dân bầu Đoàn thư ký kỳ họp theo danh sách do Chủ toạ kỳ họp giới thiệu; Hội đồng nhân dân xã, phường, thị trấn bầu ra Đoàn chủ tịch để Chủ toạ kỳ họp và Đoàn thư ký kỳ họp do Chủ tịch Uỷ ban nhân dân và các tổ trưởng tổ đại biểu Hội đồng nhân dân giới thiệu chung.\nKỳ họp Hội đồng nhân dân được tiến hành khi có ít nhất là hai phần ba tổng số đại biểu Hội đồng nhân dân tham dự.\nĐiều 19 Hội đồng nhân dân các cấp họp công khai; ngày họp, nơi họp và dự kiến chương trình làm việc của kỳ họp Hội đồng nhân dân phải được Thường trực Hội đồng nhân dân và nếu là kỳ họp Hội đồng nhân dân xã, phường, thị trấn thì phải được Uỷ ban nhân dân cùng cấp thông báo cho đại biểu Hội đồng nhân dân biết trước ít nhất là bảy ngày, kèm theo các tài liệu cần thiết và công bố cho nhân dân biết trước ít nhất năm ngày.\nKhi cần thiết, Hội đồng nhân dân quyết định họp kín theo đề nghị của Chủ toạ kỳ họp hoặc của Uỷ ban nhân dân cùng cấp.\nĐiều 20 Trong phiên họp đầu tiên kỳ họp thứ nhất của mỗi khoá, Hội đồng nhân dân cử ra Ban thẩm tra tư cách đại biểu Hội đồng nhân dân theo danh sách do Chủ toạ kỳ họp giới thiệu.\nHội đồng nhân dân căn cứ vào báo cáo của Ban thẩm tra tư cách đại biểu Hội đồng nhân dân, quyết định xác nhận tư cách đại biểu của các đại biểu Hội đồng nhân dân hoặc tuyên bố việc bầu một đại biểu nào đó là không có giá trị.\nKhi có bầu cử bổ sung đại biểu, Hội đồng nhân dân thành lập Ban thẩm tra tư cách đại biểu mới làm nhiệm vụ thẩm tra và báo cáo kết quả để Hội đồng nhân dân quyết định xác nhận tư cách đại biểu của đại biểu được bầu bổ sung.\nĐiều 21 Những vấn đề sau đây nhất thiết phải được thảo luận và giải quyết trong các kỳ họp Hội đồng nhân dân:\n1- Quyết định chương trình làm việc của kỳ họp Hội đồng nhân dân;\n2- Thẩm tra và xác nhận tư cách đại biểu Hội đồng nhân dân;\n3- Quyết định kế hoạch kinh tế - xã hội và dự toán ngân sách của địa phương; phê chuẩn việc thực hiện kế hoạch và quyết toán ngân sách đó;\n4- Quyết định phương hướng và chủ trương lớn về phát triển sản xuất, phân phối lưu thông, dịch vụ, văn hoá, xã hội; về công tác an ninh và quốc phòng;\n5- Xét báo cáo công tác của Thường trực Hội đồng nhân dân, của Uỷ ban nhân dân, của Toà án nhân dân cùng cấp; xét báo cáo về việc giải quyết những khiếu nại, tố cáo và kiến nghị của nhân dân;\n6- Bầu và bãi miễn các thành viên của Thường trực Hội đồng nhân dân, các thành viên của Uỷ ban nhân dân; Bầu và bãi miễn các thành viên của các Ban của Hội đồng nhân dân; bầu và bãi miễn các thành viên của Toà án nhân dân cùng cấp theo quy định của pháp luật;\n7- Xét và quyết định những trường hợp đại biểu Hội đồng nhân dân xin từ chức, bãi miễn đại biểu Hội đồng nhân dân hoặc đưa ra để cử tri bãi miễn;\n8- Thông qua đề án phân vạch địa giới các đơn vị hành chính ở địa phương và đề nghị cấp trên xét;\n9- Sửa đổi hoặc bãi bỏ những quyết định không thích đáng của Thường trực Hội đồng nhân dân, của Uỷ ban nhân dân cùng cấp hoặc của Hội đồng nhân dân cấp dưới trực tiếp;\n10- Giải tán Hội đồng nhân dân cấp dưới trực tiếp, khi Hội đồng nhân dân này làm thiệt hại nghiêm trọng đến quyền lợi của nhân dân.\nĐiều 22 Nghị quyết của Hội đồng nhân dân phải được quá nửa tổng số đại biểu Hội đồng nhân dân biểu quyết tán thành.\nHội đồng nhân dân biểu quyết bằng cách giơ tay hoặc bỏ phiếu kín, theo đề nghị của Chủ toạ kỳ họp.\nSau kỳ họp của Hội đồng nhân dân, nghị quyết và biên bản của kỳ họp phải gửi lên Thường trực Hội đồng nhân dân, Uỷ ban nhân dân cấp trên trực tiếp chậm nhất là bảy ngày. Nghị quyết và biên bản của kỳ họp Hội đồng nhân dân tỉnh, thành phố trực thuộc trung ương và cấp tương đương phải gửi lên Hội đồng Nhà nước và Hội đồng bộ trưởng chậm nhất là mười lăm ngày.\nNghị quyết và biên bản của các phiên họp Hội đồng nhân dân phải được Chủ tịch Hội đồng nhân dân ký chứng thực; nếu là các phiên họp của Hội đồng nhân dân xã, phường, thị trấn thì phải được Chủ toạ kỳ họp ký chứng thực.\nĐiều 23 Khi Hội đồng nhân dân họp, Thường trực Hội đồng nhân dân tỉnh, thành phố trực thuộc trung ương và cấp tương đương, huyện, quận, thành phố thuộc tỉnh và thị xã, Uỷ ban nhân dân xã, phường, thị trấn có trách nhiệm mời đại biểu Quốc hội, đại biểu Hội đồng nhân dân cấp trên được bầu ra ở địa phương, đại diện Mặt trận Tổ quốc, Liên đoàn lao động, Hội nông dân, Đoàn thanh niên Cộng sản Hồ CHí Minh, Hội liên hiệp phụ nữ đến dự.\nViện trưởng Viện kiểm sát nhân dân tham dự các kỳ họp Hội đồng nhân dân và báo cáo tình hình chấp hành pháp luật ở địa phương theo yêu cầu của Hội đồng nhân dân cùng cấp.\nChương 4:\nTHƯỜNG TRỰC HỘI ĐỒNG NHÂN DÂN TỈNH, THÀNH PHỐ TRỰC THUỘC TRUNG ƯƠNG VÀ CẤP TƯƠNG ĐƯƠNG, HUYỆN, QUẬN, THÀNH PHỐ THUỘC TỈNH VÀ THỊ XÃ VÀ CÁC BAN CỦA HỘI ĐỒNG NHÂN DÂN CÁC CẤP \nĐiều 24 Thường trực Hội đồng nhân dân tỉnh, thành phố trực thuộc trung ương và cấp tương đương, huyện, quận, thành phố thuộc tỉnh và thị xã gồm có Chủ tịch Hội đồng nhân dân, Phó Chủ tịch Hội đồng nhân dân và Thư ký Hội đồng nhân dân.\nTrong kỳ họp đầu tiên của mỗi khoá Hội đồng nhân dân, Hội đồng nhân dân tỉnh, thành phố trực thuộc trung ương và cấp tương đương, huyện, quận, thành phố thuộc tỉnh và thị xã bỏ phiếu kín bầu ra Chủ tịch Hội đồng nhân dân, Phó Chủ tịch Hội đồng nhân dân và Thư ký Hội đồng nhân dân cấp mình trong số đại biểu Hội đồng nhân dân theo danh sách đề cử chức vụ từng người do Thường trực Hội đồng nhân dân khoá trước và các tổ đại biểu giới thiệu chung.\nThành viên của Thường trực Hội đồng nhân dân không thể đồng thời là thành viên của Uỷ ban nhân dân cùng cấp.\nĐiều 25 Thường trực Hội đồng nhân dân tỉnh, thành phố trực thuộc trung ương và cấp tương đương, huyện, quận, thành phố thuộc tỉnh và thị xã có những nhiệm vụ, quyền hạn sau đây:\n1- Tổ chức việc chuẩn bị, triệu tập và chủ toạ các kỳ họp Hội đồng nhân dân cấp mình; tổng hợp ý kiến và nguyện vọng của nhân dân để báo cáo tại kỳ họp Hội đồng nhân dân, bảo đảm việc chuẩn bị dự thảo các nghị quyết và các đề án khác trình Hội đồng nhân dân;\n2- Điều hoà, phối hợp hoạt động của các Ban của Hội đồng nhân dân, giữ mối liên hệ với các tổ đại biểu và các đại biểu Hội đồng nhân dân, hướng dẫn hoạt động của Hội đồng nhân dân cấp dưới;\n3- Đôn đốc và kiểm tra Uỷ ban nhân dân cùng cấp và các cơ quan Nhà nước khác ở địa phương thực hiện các nghị quyết của Hội đồng nhân dân;\n4- Tiếp dân, đôn đốc, kiểm tra và xem xét tình hình giải quyết các khiếu nại, tố cáo và kiến nghị của công dân gửi đến Hội đồng nhân dân;\n5- Báo cáo tình hình tổ chức và hoạt động của Hội đồng nhân dân cấp mình lên Hội đồng nhân dân cấp trên. Thường trực Hội đồng nhân dân tỉnh, thành phố trực thuộc trung ương và cấp tương đương báo cáo tình hình tổ chức và hoạt động của Hội đồng nhân dân các cấp ở địa phương lên Hội đồng Nhà nước.\nĐiều 26 Chủ tịch Hội đồng nhân dân điều khiển công việc của Thường trực Hội đồng nhân dân, thay mặt Hội đồng nhân dân trong quan hệ với các cơ quan Nhà nước, với Mặt trận Tổ quốc, các tổ chức thành viên của Mặt trận và công dân.\nĐiều 27 Hội đồng nhân dân tỉnh, thành phố trực thuộc trung ương và cấp tương đương, huyện, quận, thành phố thuộc tỉnh và thị xã thành lập các Ban để giúp Hội đồng theo quy định của Hội đồng Nhà nước.\nHội đồng nhân dân xã, phường, thị trấn thành lập Ban thư ký Hội đồng nhân dân.\nMỗi Ban có Trưởng ban, Phó trưởng ban và các thành viên khác của ban. Trưởng ban và các thành viên khác của Ban được Hội đồng nhân dân bầu ra trong số đại biểu Hội đồng nhân dân theo danh sách do Chủ toạ kỳ họp và các tổ đại biểu giới thiệu. Số thành viên của các Ban do Hội đồng nhân dân quy định.\nThành viên của các Ban của Hội đồng nhân dân không thể đồng thời là thành viên của Uỷ ban nhân dân cùng cấp.\nĐiều 28 Các Ban của Hội đồng nhân dân có những nhiệm vụ, quyền hạn sau đây:\n1- Tham gia chuẩn bị các kỳ họp của Hội đồng nhân dân;\n2- Thẩm tra các báo cáo, đề án do Hội đồng nhân dân hoặc Thường trực Hội đồng nhân dân giao cho;\n3- Nghiên cứu và kiến nghị với Hội đồng nhân dân về những vấn đề thuộc phạm vi hoạt động của Ban;\n4- Giúp Hội đồng nhân dân giám sát Uỷ ban nhân dân cùng cấp và các cơ quan khác của Nhà nước ở địa phương trong việc thi hành pháp luật, chính sách của nhà nước và nghị quyết của Hội đồng nhân dân cấp mình, các quyết định của các cơ quan Nhà nước cấp trên;\n5- Chất Vấn Uỷ ban nhân dân, các thành viên của Uỷ ban nhân dân, Thủ trưởng các cơ quan chuyên môn thuộc Uỷ ban nhân dân và Toà án nhân dân cùng cấp. Thủ tục chất vấn và trả lời chất vấn tiến hành theo quy định tại Điều 34 của Luật này;\n6- Yêu cầu các thành viên của Uỷ ban nhân dân, các cơ quan và nhân viên Nhà nước và những người hữu quan khác cung cấp tài liệu và trình bày những vấn đề cần thiết có liên quan đến nhiệm vụ của Ban.\nĐiều 29 Ban thư ký Hội đồng nhân dân xã, phường, thị trấn có những nhiệm vụ và quyền hạn sau đây:\n1- Giúp Chủ tịch Uỷ ban nhân dân cùng cấp trong việc chuẩn bị và triệu tập các kỳ họp Hội đồng nhân dân;\n2- Tổ chức việc tiếp dân của Hội đồng nhân dân, đôn đốc việc giải quyết các khiếu nại, tố cáo và kiến nghị của nhân dân gửi đến Hội đồng nhân dân;\n3- Giữ quan hệ với các đại biểu Hội đồng nhân dân.\nChương 5:\nĐẠI BIỂU HỘI ĐỒNG NHÂN DÂN \nĐiều 30\nĐại biểu mỗi khoá Hội đồng nhân dân làm nhiệm vụ đại biểu bắt đầu từ kỳ họp thứ nhất của Hội đồng nhân dân khoá đó đến kỳ họp thứ nhất của Hội đồng nhân dân khoá sau.\nĐiều 31\nĐại biểu Hội đồng nhân dân có nhiệm vụ tham gia các kỳ họp và phiên họp của Hội đồng nhân dân.\nĐại biểu nào không tham gia kỳ họp thì phải có lý do và báo cáo trước cho Thường trực Hội đồng nhân dân cấp mình; đối với đại biểu Hội đồng nhân dân xã, phường, thị trấn thì phải báo trước cho Chủ tịch Uỷ ban nhân dân.\nĐại biểu nào không dự được phiên họp thì phải có lý do và phải báo trước cho Chủ toạ kỳ họp.\nĐiều 32\nĐại biểu Hội đồng nhân dân phải liên hệ chặt chẽ với cử tri, chịu sự giám sát của cử tri, phải thu thập và phản ảnh trung thực ý kiến và nguyện vọng của cử tri, bảo vệ quyền và lợi ích hợp pháp của cử tri, thực hiện chế độ tiếp xúc và ít nhất là mỗi năm một lần báo cáo với cử tri về hoạt động của mình và của Hội động nhân dân; trả lời những yêu cầu và kiến nghị của cử tri.\nSau mỗi kỳ họp Hội đồng nhân dân, các đại biểu Hội đồng nhân dân phải báo cáo với cử tri về kết quả của kỳ họp, phổ biến và giải thích các nghị quyết đã được Hội đồng nhân dân thông qua, phải động viên và cùng với nhân dân góp phần thực hiện các nghị quyết đó.\nĐại biểu Hội đồng nhân dân phải gương mẫu chấp hành pháp luật, chính sách của Nhà nước, tuyên truyền, động viên nhân dân chấp hành pháp luật, chính sách và tham gia quản lý công việc của Nhà nước.\nĐiều 33\nĐại biểu Hội đồng nhân dân, nhận được khiếu nại, tố cáo và kiến nghị của nhân dân, có trách nhiệm nghiên cứu và yêu cầu Thủ trưởng cơ quan Nhà nước hữu quan xem xét, giải quyết; theo dõi việc giải quyết và báo cho đương sự biết kết quả. Các cơ quan Nhà nước phải báo cho đại biểu Hội đồng nhân dân biết kết quả giải quyết những khiếu nại, tố cáo và kiến nghị của nhân dân do đại biểu Hội đồng nhân dân chuyển đến.\nĐiều 34\nĐại biểu Hội đồng nhân dân có quyền chất vấn Uỷ ban nhân dân, các thành viên của Uỷ ban nhân dân, Thủ trưởng các cơ quan chuyên môn thuộc Uỷ ban nhân dân và Toà án nhân dân cùng cấp.\nKhi đại biểu Hội đồng nhân dân chất vấn cơ quan, đơn vị hoặc cá nhân nào thì người đứng đầu cơ quan, đơn vị hoặc cá nhân đó trả lời.\nCơ quan hoặc người bị chất vấn phải trả lời trước Hội đồng nhân dân tại kỳ họp của Hội đồng nhân dân. Trong trường hợp cần điều tra thì Hội đồng nhân dân quyết định cho trả lời tại kỳ họp sau.\nKhi cần thiết, Hội đồng nhân dân ra nghị quyết về việc trả lời và trách nhiệm của cơ quan hoặc người bị chất vấn.\nĐiều 35\nĐại biểu Hội đồng nhân dân có quyền yêu cầu các cơ quan Nhà nước, các đơn vị vũ trang nhân dân, các tổ chức xã hội kịp thời chấm dứt những việc làm trái pháp luật, chính sách của cơ quan, đơn vị, tổ chức hoặc nhân viên của cơ quan, đơn vị, tổ chức đó.\nKhi đại biểu Hội đồng nhân dân đến gặp người phụ trách của cơ quan Nhà nước, đơn vị vũ trang nhân dân hoặc tổ chức xã hội thì người đó có trách nhiệm tiếp.\nĐại biểu Hội đồng nhân dân có quyền kiến nghị với các cơ quan Nhà nước về việc thi hành pháp luật, chính sách của Nhà nước và về những vấn đề thuộc lợi ích chung; cơ quan hữu quan có trách nhiệm nghiên cứu và trả lời kiến nghị đó của đại biểu.\nĐiều 36\nĐại biểu Hội đồng nhân dân có quyền tham dự kỳ họp của Hội đồng nhân dân cấp dưới nơi đã bầu ra mình, có quyền phát biểu ý kiến, nhưng không biểu quyết.\nĐiều 37 Các đại biểu Hội đồng nhân được bầu ở một hoặc nhiều đơn vị bầu cử hợp thành tổ đại biểu. Tổ đại biểu có nhiệm vụ tổ chức hoạt động của đại biểu, tổng hợp ý kiến và nguyện vọng của nhân dân trong đơn vị đã bầu ra mình, chuẩn bị tham gia các kỳ họp của Hội động nhân dân; tổ chức nghiên cứu pháp luật, chính sách của Nhà nước do Thường trực Hội đồng nhân dân và Uỷ ban nhân dân cùng cấp thông báo.\nTổ đại biểu cử ra tổ trưởng, tổ phó để điều khiển các cuộc họp của tổ.\nĐiều 38 Trong thời gian Hội đồng nhân dân họp, nếu không được sự đồng ý của Chủ toạ kỳ họp, thì không được bắt giữ đại biểu Hội đồng nhân dân. Nếu vì phạm pháp quả tang hoặc trong trường hợp khẩn cấp mà đại biểu bị tạm giữ thì cơ quan ra lệnh tạm giữ phải báo cáo ngay với Chủ toạ kỳ họp.\nGiữa hai kỳ họp Hội đồng nhân dân, cơ quan Nhà nước có thẩm quyền ra lệnh tạm giữ đại biểu Hội đồng nhân dân tỉnh, thành phố trực thuộc trung ương và cấp tương đương, huyện, quận, thành phố thuộc tỉnh và thị xã thì phải báo cho Chủ tịch Hội đồng nhân dân cùng cấp biết; nếu tạm giữ đại biểu Hội đồng nhân dân xã, phường, thị trấn thì phải báo cho Chủ tịch Uỷ ban nhân dân cùng cấp biết.\nĐiều 39\nĐại biểu Hội đồng nhân dân nào phạm tội, bị Toà án phạt tù, thì mất quyền đại biểu Hội đồng nhân dân.\nĐiều 40\nĐại biểu Hội đồng nhân dân có thể xin từ chức vì lý do không thể đảm nhiệm được nhiệm vụ đại biểu Hội đồng nhân dân.\nViệc chấp nhận đại biểu Hội đồng nhân dân từ chức do Hội đồng nhân dân cùng cấp xét và quyết định.\nĐiều 41\nĐại biểu Hội đồng nhân dân có thể bị cử tri của đơn vị bầu ra mình bãi miễn, nếu không xứng đáng với sự tín nhiệm của nhân dân.\nTuỳ theo mức độ phạm sai lầm, đại biểu Hội đồng nhân dân có thể bị Hội đồng nhân dân bãi miễn hoặc đưa ra để cử tri ở đơn vị bầu ra đại biểu ấy bãi miễn theo đề nghị của Thường trực Hội đồng nhân dân hoặc của Uỷ ban Mặt trận Tổ quốc cùng cấp.\nĐiều 42 Trong trường hợp khuyết đại biểu Hội đồng nhân dân thì có thể tổ chức bầu cử bổ sung.\nHội đồng Nhà nước quyết định việc bầu cử bổ sung đại biểu Hội đồng nhân dân tỉnh, thành phố trực thuộc trung ương và cấp tương đương.\nThường trực Hội đồng nhân dân tỉnh, thành phố trực thuộc trung ương và cấp tương đương quyết định việc bầu cử bổ sung đại biểu Hội đồng nhân dân huyện, xã và cấp tương đương.\nĐại biểu Hội đồng nhân dân được bầu bổ sung bắt đầu làm nhiệm vụ từ kỳ họp Hội đồng nhân dân sau cuộc bầu cử bổ sung đến kỳ họp thứ nhất của Hội đồng nhân dân khoá sau.\nĐiều 43 Trong trường hợp đại biểu Hội đồng nhân dân được phân công cùng di chuyển với nhân dân đến một địa phương khác, thì đại biểu đó là thành viên của Hội đồng nhân dân cấp tương đương ở nơi mới đến và làm nhiệm vụ cho đến khi Hội đồng nhân dân nơi đó hết nhiệm kỳ.\nĐại biểu Hội đồng nhân dân cấp nào vì lý do thuyên chuyển mà không làm công tác và không cư trú ở địa phương thì Hội đồng nhân dân cấp đó quyết định cho thôi chức vụ đại biểu.\nChương 6:\nUỶ BAN NHÂN DÂN Mục 1: NHIỆM VỤ, QUYỀN HẠN CỦA UỶ BAN NHÂN DÂN \nĐiều 44 Uỷ ban nhân dân cùng với Thường trực Hội đồng nhân dân chuẩn bị các kỳ họp của Hội đồng nhân dân; phối hợp với các Ban của Hội đồng nhân dân xây dựng các đề án trình Hội đồng nhân dân xét và quyết định.\nUỷ ban nhân dân tổ chức và chỉ đạo thực hiện nghị quyết của Hội đồng nhân dân cùng cấp và các nghị quyết, nghị định, quyết định, chỉ thị, thông tư của các cơ quan Nhà nước cấp trên.\nUỷ ban nhân dân chỉ đạo các ngành, các cấp thuộc quyền mình thực hiện kế hoạch và ngân sách, phát triển kinh tế, văn hoá, xã hội, giữ vững an ninh, trật tự, an toàn xã hội, củng cố quốc phòng và cải thiện đời sống nhân dân địa phương; đồng thời, bảo đảm sự quản lý thống nhất của Nhà nước từ trung ương đến cơ sở; cùng Mặt trận Tổ quốc và các đoàn thể nhân dân tổ chức và chỉ đạo phong trào thi đua yêu nước xã hội chủ nghĩa.\nĐiều 45 Giữa hai kỳ họp Hội đồng nhân dân, Uỷ ban nhân dân được xét và giải quyết các vấn đề thuộc nhiệm vụ, quyền hạn của Hội đồng nhân dân cùng cấp, trừ những vấn đề quy định tại Điều 21 và Điều 25 của Luật này, và phải trình Hội đồng nhân dân phê chuẩn trong kỳ họp gần nhất.\nĐiều 46 Uỷ ban nhân dân các cấp có trách nhiệm tiếp dân, trực tiếp xét, giải quyết và chỉ đạo các ngành, các cấp thuộc quyền mình xét, giải quyết các khiếu nại, tố cáo và kiến nghị của nhân dân.\nĐiều 47 Uỷ ban nhân dân các cấp có quyền ra những quyết định, chỉ thị theo quy định của pháp luật và kiểm tra việc thi hành những quyết định, chỉ thị ấy; đình chỉ việc thi hành, sửa đổi hoặc bãi bỏ những quyết định không thích đáng của các ngành thuộc quyền mình và của Uỷ ban nhân dân cấp dưới; đình chỉ việc thi hành những nghị quyết không thích đáng của Hội đồng nhân dân cấp dưới trực tiếp, đồng thời đề nghị Hội đồng nhân dân cấp mình sửa đổi hoặc bãi bỏ những nghị quyết đó.\nMục 2: TỔ CHỨC, CHẾ ĐỘ LÀM VIỆC VÀ QUAN HỆ CÔNG TÁC CỦA UỶ BAN NHÂN DÂN \nĐiều 48 Uỷ ban nhân dân gồm có Chủ tịch, một hoặc nhiều Phó Chủ tịch và các uỷ viên khác.\nChủ tịch Uỷ ban nhân dân là đại biểu Hội đồng nhân dân. Các thành viên khác của Uỷ ban nhân dân không nhất thiết phải là đại biểu Hội đồng nhân dân cùng cấp.\nUỷ ban nhân dân tỉnh, thành phố trực thuộc trung ương và cấp tương đương có từ mười một đến mười bảy người.\nUỷ ban nhân dân huyện, quận, thành phố thuộc tỉnh, thị xã có từ chín đến mười ba người.\nUỷ ban nhân dân xã, phường, thị trấn có từ bảy đến chín người.\nSố Phó Chủ tịch của Uỷ ban nhân dân mỗi cấp do Hội đồng bộ trưởng quy định.\nĐiều 49 Trong kỳ họp đầu tiên của mỗi khoá Hội đồng nhân dân, Hội đồng nhân dân bỏ phiếu kín bầu Chủ tịch, các Phó Chủ tịch và các uỷ viên khác của Uỷ ban nhân dân cấp mình theo danh sách đề cử chức vụ từng người do Chủ toạ kỳ họp và các tổ đại biểu giới thiệu chung; từng đại biểu Hội đồng nhân dân cũng có quyền giới thiệu.\nKết quả bầu cử Uỷ ban nhân dân mỗi cấp phải được Uỷ ban nhân dân cấp trên trực tiếp phê chuẩn; Kết quả bầu cử Uỷ ban nhân dân tỉnh, thành phố trực thuộc trung ương và cấp tương đương được Hội đồng bộ trưởng phê chuẩn.\nKhi khuyết thành viên của Uỷ ban nhân dân thì Hội đồng nhân dân cùng cấp xét và quyết định bầu bổ sung.\nĐiều 50 Uỷ ban nhân dân chịu trách nhiệm và báo cáo công tác trước Hội đồng nhân dân cùng cấp và trước Uỷ ban nhân dân cấp trên trực tiếp; Uỷ ban nhân dân tỉnh, thành phố trực thuộc trung ương và cấp tương đương chịu trách nhiệm và báo cáo công tác trước Hội đồng nhân dân cùng cấp và trước Hội đồng bộ trưởng.\nUỷ ban nhân dân làm việc theo chế độ tập thể.\nMỗi thành viên của Uỷ ban nhân dân chịu trách nhiệm cá nhân về phần công tác của mình trước Hội đồng nhân dân, Uỷ ban nhân dân cùng cấp, và cùng với các thành viên khác chịu trách nhiệm tập thể về hoạt động của Uỷ ban nhân dân trước Hội đồng nhân dân cấp mình và trước cấp trên.\nĐiều 51 Chủ tịch Uỷ ban nhân dân lãnh đạo và điều hành công tác của Uỷ ban nhân dân; triệu tập và chủ toạ các kỳ họp của Uỷ ban nhân dân; bảo đảm việc chấp hành các nghị quyết của Hội đồng nhân dân, các quyết định, chỉ thị của Uỷ ban nhân dân cấp mình và các nghị quyết, nghị định, quyết định, chỉ thị, thông tư của các cơ quan Nhà nước cấp trên.\nĐiều 52 Uỷ ban nhân dân các cấp mỗi tháng họp ít nhất một lần.\nCác quyết định của Uỷ ban nhân dân phải được quá nửa tổng số thành viên Uỷ ban biểu quyết tán thành.\nĐiều 53 Chủ tịch Liên đoàn lao động tỉnh, thành phố trực thuộc trung ương và cấp tương đương, huyện, quận và cấp tương đương được mời dự các kỳ họp của Uỷ ban nhân dân cùng cấp.\nChủ tịch Uỷ ban Mặt trận Tổ quốc Việt Nam và những người phụ trách chính các đoàn thể nhân dân khác trong Mặt trận ở địa phương được mời dự các kỳ họp của Uỷ ban nhân dân cùng cấp khi bàn đến các vấn đề quan trọng về kinh tế - xã hội, an ninh và quốc phòng ở địa phương.\nUỷ ban nhân dân các cấp tạo điều kiện thuận lợi để Mặt trận Tổ quốc Việt Nam và các đoàn thể nhân dân trong Mặt trận tổ chức và động viên nhân dân tham gia quản lý Nhà nước, quản lý xã hội.\nMục 3: CÁC CƠ QUAN CHUYÊN MÔN THUỘC UỶ BAN NHÂN DÂN \nĐiều 54 Uỷ ban nhân dân thành lập hoặc bãi bỏ các cơ quan chuyên môn thuộc Uỷ ban nhân dân, theo quy định của Hội đồng bộ trưởng.\nĐiều 55 Các cơ quan chuyên môn giúp Uỷ ban nhân dân cùng cấp thực hiện chức năng quản lý Nhà nước ở địa phương và bảo đảm sự thống nhất quản lý của ngành hoặc lĩnh vực công tác từ trung ương đến cơ sở.\nĐiều 56 Các cơ quan chuyên môn thuộc Uỷ ban nhân dân chịu sự chỉ đạo và quản lý về tổ chức, biên chế và công tác của Uỷ ban nhân dân cấp mình, đồng thời, chịu sự chỉ đạo của cơ quan chuyên môn cấp trên.\nThủ trưởng cơ quan chuyên môn chịu trách nhiệm và báo cáo công tác trước Uỷ ban nhân dân, báo cáo công tác trước Hội đồng nhân dân cấp mình khi cần thiết; đồng thời, chịu trách nhiệm và báo cáo công tác với cơ quan chuyên môn cấp trên.\nChương 7:\nNHỮNG BẢO ĐẢM CHO VIỆC THỰC HIỆN NHIỆM VỤ QUYỀN HẠN CỦA HỘI ĐỒNG NHÂN DÂN \nĐiều 57 Hội đồng Nhà nước giám sát và hướng dẫn hoạt động của Hội đồng nhân dân các cấp nhằm bảo đảm cho Hội đồng nhân dân các cấp làm tròn trách nhiệm là cơ quan đại biểu cho nhân dân địa phương.\nKhi cần thiết, Hội đồng Nhà nước ra nghị quyết để hướng dẫn hoạt động của Hội đồng nhân dân các cấp.\nĐiều 58 Hội đồng bộ trưởng có trách nhiệm bảo đảm cho Hội đồng nhân dân các cấp thực hiện đầy đủ những nhiệm vụ, quyền hạn của cơ quan quyền lực Nhà nước ở địa phương; lãnh đạo Uỷ ban nhân dân các cấp làm tròn trách nhiệm của cơ quan chấp hành của Hội đồng nhân dân và cơ quan hành chính Nhà nước ở địa phương.\nKinh phí hoạt động của Hội đồng nhân dân do Hội đồng nhân dân quyết định và ghi trong ngân sách địa phương theo quy định của Hội đồng Nhà nước.\nĐiều 59 Khi thực hiện nhiệm vụ, đại biểu Hội đồng nhân dân được bảo đảm các điều kiện cần thiết, do Hội đồng Nhà nước quy định.\nUỷ ban nhân dân các cấp, các cơ quan và nhân viên Nhà nước ở địa phương, trong phạm vi nhiệm vụ, quyền hạn của mình, có trách nhiệm tạo điều kiện thuận lợi cho hoạt động của các đại biểu Hội đồng nhân dân và các Ban của Hội đồng nhân dân, như cung cấp tư liệu, thông tin, bảo đảm nơi tiếp xúc với cử tri, các phương tiện đi lại theo tiêu chuẩn.\nNhững người cản trở đại biểu Hội đồng nhân dân và các Ban của Hội đồng nhân dân thi hành nhiệm vụ sẽ bị xử lý theo pháp luật.\nĐiều 60 Uỷ ban Mặt trận Tổ quốc Việt Nam và các đoàn thể nhân dân trong Mặt trận giúp đỡ đại biểu Hội đồng nhân dân cùng cấp làm nhiệm vụ đại biểu; tạo điều kiện cho đại biểu tiếp xúc với cử tri, thu thập ý kiến, nguyện vọng của nhân dân; kiến nghị những vấn đề cần thiết với Hội đồng nhân dân. Mỗi năm hai lần thường trực Hội đồng nhân dân thông báo cho Uỷ ban Mặt trận Tổ quốc Việt Nam cùng cấp về hoạt động của Hội đồng nhân dân.\nChương 8:\nNHỮNG QUY ĐỊNH VỀ TỔ CHỨC TRONG TRƯỜNG HỢP THAY ĐỔI CẤP HOẶC ĐỊA GIỚI CỦA CÁC ĐƠN VỊ HÀNH CHÍNH VÀ TRONG TRƯỜNG HỢP ĐẶC BIỆT \nĐiều 61 Trong trường hợp sát nhập nhiều đơn vị hành chính thành một đơn vị hành chính mới, Hội đồng nhân dân của các đơn vị hành chính cũ nhập lại thành Hội đồng nhân dân của các đơn vị hành chính mới và hoạt động cho đến khi hết nhiệm kỳ.\nHội đồng nhân dân của đơn vị hành chính mới bầu ra Thường trực Hội đồng nhân dân, các Ban của Hội đồng nhân dân và Uỷ ban nhân dân mới.\nĐiều 62 Trong trường hợp chia một đơn vị hành chính thành nhiều đơn vị hành chính mới, các đại biểu Hội đồng nhân dân đã được bầu trong địa hạt đơn vị hành chính mới nào thì hợp thành Hội đồng nhân dân của đơn vị hành chính ấy, và tiếp tục hoạt động cho đến khi hết nhiệm kỳ. Nếu cần bầu thêm đại biểu thì tiến hành theo quy định tại Điều 42 của Luật này.\nHội đồng nhân dân của đơn vị hành chính mới bầu ra Thường trực Hội đồng nhân dân, các Ban của Hội đồng nhân dân và Uỷ ban nhân dân mới.\nĐiều 63 Trong trường hợp một đơn vị hành chính thay đổi cấp thì Hội đồng nhân dân, Thường trực Hội đồng nhân dân, các Ban của Hội đồng nhân dân và Uỷ ban nhân dân tiếp tục hoạt động với cương vị của cấp mới cho đến khi hết nhiệm kỳ.\nĐiều 64 Trong trường hợp một đơn vị hành chính mới được thành lập thì Uỷ ban nhân dân cấp trên trực tiếp chỉ định Uỷ ban nhân dân lâm thời để đảm nhiệm công tác cho đến khi bầu ra Hội đồng nhân dân và Uỷ ban nhân dân; đối với đơn vị hành chính tương đương cấp tỉnh thì Hội đồng bộ trưởng chỉ định Uỷ ban nhân dân lâm thời.\nĐiều 65 Trong trường hợp Hội đồng nhân dân bị giải tán hoặc trong trường hợp đặc biệt khác, Uỷ ban nhân dân cấp trên trực tiếp chỉ định Uỷ ban nhân dân lâm thời để đảm nhiệm công tác cho đến khi bầu ra Hội đồng nhân dân và Uỷ ban nhân dân; đối với tỉnh, thành phố trực thuộc trung ương và cấp tương đương thì Hội đồng bộ trưởng chỉ định Uỷ ban nhân dân lâm thời.\nChương 9:\nĐIỀU KHOẢN CUỐI CÙNG \nĐiều 66 Luật này thay thế Luật tổ chức Hội đồng nhân dân và Uỷ ban nhân dân ngày 30 tháng 6 năm 1983.\nNhững quy định trước đây trái với luật này đều bãi bỏ.\nĐiều 67 Hội đồng Nhà nước, Hội đồng bộ trưởng quy định chi tiết thi hành Luật này.\nLuật này đã được Quốc hội nước Cộng hoà xã hội chủ nghĩa Việt Nam khoá VIII, kỳ họp thứ 5 thông qua ngày 30 tháng 6 năm 1989.\nVõ Chí Công\n(Đã ký)"
}