{
  "url": "https://thuvienphapluat.vn/van-ban/Doanh-nghiep/Luat-Thue-Doanh-thu-1993-sua-doi-20-L-CTN-38475.aspx",
  "title": "Luật Thuế Doanh thu 1993 sửa đổi 20-L/CTN",
  "properties": {
    "Số hiệu": "20-L/CTN",
    "Loại văn bản": "Luật",
    "Nơi ban hành": "Quốc hội",
    "Người ký": "Lê Đức Anh",
    "Ngày ban hành": "05/07/1993",
    "Ngày hiệu lực": "Đã biết",
    "Ngày công báo": "Đã biết",
    "Số công báo": "Đã biết",
    "Tình trạng": "Đã biết"
  },
  "content": "QUỐC HỘI\n ********\nCỘNG HOÀ XÃ HỘI CHỦ NGHĨA VIỆT NAM\n Độc lập - Tự do - Hạnh phúc\n ********\nSố: 20-L/CTN Hà Nội, ngày 05 tháng 7 năm 1993 LUẬT SỐ\n20-L/CTN NGÀY 05/07/1993 CỦA QUỐC HỘI VỀ VIỆC SỬA ĐỔI, BỔ SUNG MỘT SỐ ĐIỀU CỦA LUẬT THUẾ DOANH THU Căn cứ vào Điều 84 của Hiến pháp nước Cộng hoà xã hội chủ nghĩa Việt Nam năm 1992;\nLuật này sửa đổi, bổ sung một số điều của Luật thuế doanh thu được Quốc hội nước Cộng hoà xã hội chủ nghĩa Việt Nam thông qua ngày 30 tháng 6 năm 1990. \nĐiều 1 Sửa đổi, bổ sung một số điều của Luật thuế doanh thu như sau:\n1/ Điều 8 được sửa đổi, bổ sung:\n- Điểm e, khoản 1\nđược sửa đổi, bổ sung:\n\"e) Doanh thu đối với hoạt\nđộng tín dụng là khoản chênh lệch giữa thu lãi tiền cho vay, thu lãi tiền gửi với trả lãi tiền đi vay, trả lãi tiền gửi.\nDoanh thu đối với hoạt động dịch vụ khác thuộc lĩnh vực ngân hàng là tiền thu được hoặc tiền hoa hồng được hưởng đối với dịch vụ đó;\nDoanh thu đối với hoạt động bảo hiểm là tiền thu về phí bảo hiểm nhận của khách hàng.\"\n- Khoản 2 được sửa đổi, bổ sung:\n\"2 - Cơ sở kinh doanh có\ndoanh thu bằng ngoại tệ, được nộp thuế bằng ngoại tệ hoặc bằng đồng tiền Việt Nam, quy đổi theo tỷ giá mua vào do Ngân hàng Nhà nước Việt Nam công bố tại thời\nđiểm nộp thuế.\"\n2/ Khoản 3, Điều 18 được sửa đổi, bổ sung:\n\"3 - Cơ\nsở kinh doanh hoạt động ở miền núi, hải đảo; khai thác thuỷ sản ở vùng biển xa bờ; cơ sở nghiên cứu khoa học, ứng dụng công nghệ mới; cơ sở sản xuất mới thành lập đi vào hoạt động, chạy thử dây chuyền sản xuất mới; cơ sở sản xuất mặt hàng cần thay thế hàng nhập khẩu; nếu gặp khó khăn, được xét giảm thuế tối đa không quá 50% số thuế phải nộp và thời gian được giảm thuế không quá hai năm. Riêng cơ sở kinh doanh hoạt động ở miền núi, hải đảo, thời gian được giảm thuế không quá ba năm.\"\n3/ Điểm c, khoản 1, Điều 19 được sửa đổi:\n\"c) Tổ chức, cá nhân nộp chậm tiền thuế hoặc tiền phạt ghi trong lệnh thu thuế hoặc quyết định xử phạt, thì\nngoài việc phải nộp đủ số thuế hoặc tiền phạt theo quy định của Luật này, mỗi ngày nộp chậm còn bị phạt 0,2% (hai phần nghìn) số tiền nộp chậm;\"\n4/ Các chữ\n\"Hội đồng Nhà nước\" được sửa đổi thành các chữ \"Uỷ ban thường vụ\nQuốc hội\" và các chữ \"Hội đồng bộ trưởng\" được sửa đổi thành các chữ \"Chính phủ\". \nĐiều 2 Sửa đổi, bổ sung thuế suất đối với một số ngành nghề trong Biểu thuế doanh thu kèm theo Luật thuế doanh thu, đã được sửa đổi, bổ sung tại Nghị quyết số: 472 - NQ/HĐNN8 ngày 10 tháng 9 năm 1991 của Hội đồng Nhà nước, như sau:\n1/ Sửa đổi, bổ\nsung một số điểm của \"ngành sản suất\":\na) Điểm 5 được sửa đổi:\n\"5 - Sản xuất, lắp ráp cơ\nkhí:\na - Máy móc, thiết bị, công cụ\n1%\nb - Sản phẩm cơ khí tiêu dùng 2%\nRiêng đồ điện cơ khí, bàn là, quạt\nđiện, biến thế điện dưới 15 A, bơm nước điện dưới 10 m3/h 4%\"\nb) Điểm 7 được sửa đổi:\n\"7 - Sản phẩm hoá chất 4%\nRiêng: - Hoá chất cơ bản, phân bón 1%\n- Thuốc trừ sâu và các hoá chất khác phục vụ sản xuất nông nghiệp 0,5%\"\nc) Điểm 12 được sửa đổi, bổ sung:\n\"12 - Giấy và sản phẩm bằng giấy 4%\nRiêng: bột giấy, giấy in báo, giấy vở học sinh 1%\"\nd) Điểm 15 được sửa đổi, bổ sung:\n\"15 - Công nghiệp thực phẩm\n(bao gồm cả thuốc lá lá, thuốc lá sợi, thuốc lào, cồn, cà phê, chè, mỳ chính,\nđường, bánh kẹo và các loại thực phẩm khác) 6%\nRiêng: - Muối 0,5%\n- Nước đá dùng cho đánh bắt thuỷ\nsản 2%\n- Sữa các loại 4%\n- Nước ngọt, nước giải khát các loại 6%\"\ne) Điểm 18 được sửa đổi, bổ sung:\n\"18 - Sợi, dệt:\na - Sợi các loại (bao gồm cả sợi len dệt thảm, sợi đay, tơ, cói), chỉ 4%\nRiêng: Sợi len, sợi tổng hợp 6%\nb - Dệt các loại 5%\nRiêng: Dệt đay, chiếu, cói, mành và các sản phẩm dệt thủ công, bán cơ khí 3%\"\ng) Điểm 22 được sửa đổi, bổ sung:\n\"22 - In và xuất bản:\na - In và xuất bản sách chính trị,\nsách giáo khoa, sách khoa học kỹ thuật, sách phục vụ thiếu nhi, sách báo in bằng tiếng dân tộc thiểu số 0%\nb - In và xuất bản báo các loại 0,5%\nc - In và xuất bản sách các loại 1%\nd - Sản xuất phim bản đầu 1%\nRiêng: Phim tài liệu, phim đề\ntài cách mạng, đề tài thiếu nhi, đề tài khoa học 0%\ne - In và xuất bản các loại khác; các hoạt động khác thuộc ngành in, xuất bản 4%\"\nh) Điểm 23 được sửa đổi:\n\"23 - Dụng cụ thí nghiệm, y tế, giáo dục, đồ chơi trẻ em 0,5%\"\ni) Điểm 24 được sửa đổi:\n\"24 - Dụng cụ thể dục, thể\nthao, nhạc cụ và phụ tùng:\na - Dụng cụ thể dục, thể thao 2%\nb - Nhạc cụ và phụ tùng 1%\"\nk) Bổ sung thêm điểm 31:\n\"31 - Bài lá, vàng mã,\nhương:\na - Bài lá, vàng mã 20%\nb - Hương 6%\"\n2/ Sửa đổi, bổ\nsung một số điểm của \"Ngành thương nghiệp\":\na) Bổ sung điểm 9 mới:\n\"9 - Kinh doanh ngoại tệ, bất\nđộng sản:\na - Kinh doanh ngoại tệ 0,5%\nb - Kinh doanh bất động sản (kể\ncả xây nhà để bán) 8%\"\nb) Sửa đổi điểm 9 cũ thành điểm 10 và bổ sung vào cuối điểm này:\n\"- Kinh doanh ngoại tệ, bất\nđộng sản 25%\n- Phát hành sách, báo 4%\"\n3/ Sửa đổi, bổ\nsung một số điểm của \"Ngành dịch vụ\":\na) Điểm 2 được sửa đổi:\n\"2 - Dịch vụ khoa học, kỹ\nthuật, bưu điện:\na - Dịch vụ khoa học, kỹ thuật 2%\nb - Dịch vụ bưu điện 4%\"\nb) Điểm 3 được sửa đổi, bổ sung:\n\"3 - Hoạt động của Ngân hàng, Hợp tác xã tín dụng, công ty tài chính:\na - Tín dụng:\n- Tín dụng Ngân hàng nông nghiệp,\nHợp tác xã tín dụng nông nghiệp 2%\n- Tín dụng Ngân hàng đầu tư 15%\n- Tín dụng Ngân hàng Ngoại thương 30%\n- Tín dụng Ngân hàng Công thương, công ty tài chính và các hoạt động tín dụng khác 15%\nb - Các hoạt động dịch vụ nghiệp vụ khác 6%\"\nc) Điểm 6 được sửa đổi, bổ sung:\n\"6 - Dịch vụ dạy nghề, văn hoá, nghệ thuật, y tế,\nthể dục, thể thao, tư vấn pháp luật:\na - Cơ sở kinh doanh dạy nghề, y tế, thể dục,\nthể thao, văn hoá, nghệ thuật 0,5%\nRiêng: Ca múa nhạc dân tộc truyền thống, tuồng, chèo, cải lương, múa rối, ba lê, opera, giao hưởng, xiếc, kịch 0%\nb - Tư vấn pháp luật:\n- Cho nước ngoài 4%\n- Cho trong nước 2%\nc - Chiếu phim nhựa: 1%\nRiêng: Chiếu phim tài liệu, khoa học, đề tài thiếu nhi và phục vụ ở miền núi 0%\"\nd) Điểm 7 được sửa đổi, bổ sung:\n\"7 - Chụp, in, phóng ảnh;\nphô tô copy các loại 6%\"\ne) Điểm 9 được sửa đổi:\n\"9 - Chiếu video, quảng cáo, in băng, thu băng, sang băng 8%\nRiêng chiếu video 6%\"\ng) Điểm 15 được sửa đổi, bổ\nsung:\n\"15 - Dịch vụ đặc biệt:\na - Khiêu vũ 30%\nb - Đua ngựa 20%\nc - Phát hành xổ số kiến thiết và các hoạt động xổ số khác 30%\nRiêng ở các tỉnh miền núi 20%\nd - Đại lý tàu biển 40%\ne - Môi giới vận tải và các loại môi giới khác 15%\" \nĐiều 3 Chính phủ sửa đổi, bổ sung các văn bản quy định chi tiết thi hành Luật thuế doanh thu đã ban hành cho phù hợp với Luật này. \nĐiều 4 Luật này có hiệu lực từ ngày 01 tháng 9 năm 1993.\nLuật này đã được Quốc hội nước Cộng hoà xã hội chủ nghĩa Việt Nam khoá IX, kỳ họp thứ\nba thông qua ngày 5 tháng 7 năm 1993.\nBIỂU THUẾ DOANH THU\n(Đã được sửa đổi, bổ sung)\nNgành nghề\nThuế\n suất (%) \nI- Ngành sản xuất 1- Điện thương phẩm 8\n2- Khai thác hầm mỏ\n2 Riêng khai thác than hầm lò\n1 3- Khai thác dầu mỏ, hơi đốt,\n vàng, đá quý\n8 4- Luyện kim loại:\na) Luyện, cán, kéo kim loại\n đen, luyện cốc 2\nb) Luyện, cán, kéo kim loại màu 4\nc) Luyện, cán, kéo kim loại quý (vàng, bạc) \n8 5- Sản xuất, lắp ráp cơ khí:\na) Máy móc, thiết bị, công cụ \n1 b) Sản phẩm cơ khí tiêu dùng 4\nRiêng đồ điện cơ khí: bàn là,\n quạt điện,\nbiến thế điện dưới 15A, bơm nước\n điện dưới 10m3/h 6\n6- Sản xuất, lắp ráp sản phẩm\n điện tử \n8 7- Sản phẩm hoá chất 4\nRiêng: hoá chất cơ bản, phân bón, thuốc trừ sâu 1\n8- Thuốc chữa bệnh 1\n9- Vật liệu xây dựng, kể cả\n clanhke 5\nRiêng xi măng:\n+ Mác P300 trở lên 10\n+ Mác dưới P300 6\n10- Khai thác lâm sản 4\n11- Chế biến lâm sản và sản xuất\n đồ gỗ \n5 12- Giấy và sản phẩm bằng giấy 4\nRiêng: bột giấy, giấy in báo,\n giấy vở học sinh 1\n13- Gốm, sành sứ, thuỷ tinh 4\nRiêng thuỷ tinh dùng cho y tế \n1 14- Xay, xát, chế biến lương thực 2\nRiêng mì ăn liền 6\n15- Công nghiệp thực phẩm (bao gồm cả thuốc lá lá, thuốc lá sợi, cồn , cà phê, chè, mỳ chính, đường, bánh kẹo và các loại thực phẩm khác)\n6 Riêng:\n+ Muối 1\n+ Nước đá dùng cho đánh bắt thuỷ sản 2\n+ Sữa hộp 4\n+ Nước ngọt, nước giải khát các loại 8\n16- Khai thác thuỷ sản 2\n17- Chế biến thuỷ sản 3\n18- Sợi, dệt:\na) Các loại sợi (bao gồm cả sợi dệt thảm, sợi đay, tơ, cói), chỉ\n4 Riêng: Sợi len, sợi tổng hợp 6\nb) Dệt các loại: dệt vải, dệt kim 5\nRiêng: dệt đay, chiếu, cói,\n mành và các sản phẩm dệt thủ công, bán cơ khí\n3 19- Sản phẩm may mặc, giầy vải 4\n20- Sản xuất nguyên liệu da, vải giả da 4\n21- Sản phẩm bằng da, bằng vải giả da 6\n22- In, xuất bản sách báo các loại 1\nRiêng:\n- In và xuất bản sách chính trị,\n sách giáo khoa, sách khoa học kỹ thuật sách phục vụ thiếu nhi, sách báo in bằng tiếng dân tộc thiểu số\n0\n- In, xuất bản và hoạt động khác trong ngành in, xuất bản 4\n23- Dụng cụ thí nghiệm, y tế\n giáo dục, đồ chơi trẻ em 1\n24- Dụng cụ thể dục, thể thao,\n nhạc cụ và phụ tùng 2\n25- Thức ăn gia súc 2\n26- Hàng mỹ nghệ \n8 27- Hàng mỹ phẩm các loại, sản xuất bài lá, vàng mã \n10 28- Sản xuất, chế biến khác 4\nRiêng gia công các ngành hàng\n (tính trên tiền gia công) \n6 29- Kinh doanh nông nghiệp không thuộc diện nộp thuế nông nghiệp 2\nRiêng: Sản xuất các con giống gia súc, gia cầm 1\n30- Sản xuất các loại công cụ\n sản xuất 1\nII- Ngành xây dựng 1- Có bao thầu nguyên vật liệu 3\n2- Không bao thầu nguyên vật liệu (bao gồm cả khảo sát, thiết kế, xây dựng nhà xưởng, đường sá, cầu cống,\n hầm lò, nề mộc, trang trí nội thất ...\n5 III- Ngành vận tải 1- Vận tải hàng hoá\n2 Riêng vận tải bằng phương tiện thô sơ ở miền núi, hải đảo 1\n2- Vận tải hành khách, hàng không 4\n3- Vận tải hành khách nội thành, nội thị \n1 IV- Ngành thương nghiệp 1- Bán lương thực, thực phẩm,\n rau quả tươi sống (trừ đồ hộp), thuốc chữa bệnh, nguyên liệu, nhiên liệu, chất\n đốt, thiết bị, phụ tùng, dụng cụ thí nghiệm, dụng cụ y tế, giáo dục, đồ chơi trẻ em, cây giống, con giống 1\n2- Bán vàng, bạc, đá quý \n2 3- Bán hàng khác sản xuất trong nước 2\n4- Bán hàng tiêu dùng nhập khẩu\n (trừ những mặt hàng đã ghi trong điểm 1, điểm 2, mục IV này)\n4 Riêng: - Rượu, bia 10\n- Mỹ phẩm, đầu video, xăng 8\n- Ô tô du lịch, ti vi màu, xe gắn máy, đồ hộp, nước giải khát 6\n5- Kinh doanh xuất khẩu 1\n6- Cung ứng tầu biển 4\n7- Buôn chuyến 2\n8- Đại lý bán hàng, bán hàng ký gửi, uỷ thác mua hàng (tính trên tiền hoa hồng)\n12 9- Kinh doanh ngoại tệ, bất động sản:\na) Kinh doanh ngoại tệ\n0,5 b) Kinh doanh bất động sản (kể\n cả xây nhà để bán) \n4 10- Cơ sở kinh doanh (trừ buôn chuyến) có sổ sách kế toán, hoá đơn đúng chế độ, được cơ quan thuế công nhận thì được tính thuế doanh thu trên số chênh lệnh giữa giá bán hàng và giá mua hàng 14 Riêng:\n- Kinh doanh muốn 4\n- Phát hành sách, báo 4\n- Kinh doanh nông sản thực phẩm,\n rau quả tươi và thuỷ sản 10\n- Kinh doanh rượu, bia, hàng\n điện tư, hàng điện lạnh, xe gắn máy, ô tô du lịch từ 15 chỗ ngồi trở xuống,\n xăng, mỹ phẩm 16\n- Kinh doanh vang, bạc, đá\n quý, ngoại tệ, bất động sản 15 V- Ngành ăn uống 1- Quán hàng ăn uống bình dân 4\n2- Cửa hàng ăn uống cao cấp\n (có tiện nghi tốt) \n10 VI- Ngành dịch vụ\n1- Sửa chữa cơ khí, phương tiện vận tải, máy kéo 2\n2- Dịch vụ khoa học, kỹ thuật,\n bưu điện 4\n3- Hoạt động của ngân hàng, công ty tài chính:\nRiêng:\na) Tín dụng:\n- Tín dụng ngân hàng nông nghiệp 5\n- Tín dụng ngân hàng công thương, hợp tác xã tín dụng, công ty tài chính 15\n- Tín dụng ngân hàng đầu tư \n25\n- Tín dụng ngân hàng ngoại thương 35 b) Các hoạt động dịch vụ khác của ngân hàng, công ty tài chính 6\n4- Cầm đồ, bảo hiểm 4\n5- Xếp dỡ hàng hoá, cho thuê\n kho, bến bãi 4\n6- Dịch vụ giáo dục, dạy nghề,\n văn hoá, nghệ thuật, y tế, thể dục thể thao, tư vấn pháp luật 4\n7- Chụp, in, phóng ảnh, Phôtôcópy các loại 6\n8- Sửa chữa thiết bị điện tử,\n tủ đá, tủ lạnh, máy điều hoà nhiệt độ\n6 9- Chiếu video, quảng cáo, in băng, thu băng, sang băng 8\n10- Cho thuê cửa hàng, đồ\n dùng, phòng cưới, hội trường, xe hơi 8\nRiêng cho thuê nhà \n10 11- Kinh doanh khách sạn,\n phòng ngủ, dịch vụ du lịch, tham quan 10 12- Dịch vụ uốn tóc, may đo,\n nhuộm, giặt là, tẩy hấp 6\n13- Mỹ viện 8\n14- Dịch vụ khác 4\nRiêng dịch vụ công cộng 1\n15- Dịch vụ đặc biệt:\na) Khiêu vũ \n30 b) Đua ngựa 20 c) Phát hành xổ số kiến thiết và các hoạt động sổ xố khác 30 Riêng ở các tỉnh miền núi, Tây nguyên 20 d) Đại lý tầu biển 40 e) Môi giới vận tải hàng hải và các loại môi giới khác 15 Lê\n Đức Anh\n (Đã\n ký)"
}