{
  "url": "https://thuvienphapluat.vn/van-ban/Tai-nguyen-Moi-truong/Luat-da-dang-sinh-hoc-2008-20-2008-QH12-82200.aspx",
  "title": "Luật đa dạng sinh học 2008 số 20/2008/QH12 mới nhất",
  "properties": {
    "Số hiệu": "20/2008/QH12",
    "Loại văn bản": "Luật",
    "Nơi ban hành": "Quốc hội",
    "Người ký": "Nguyễn Phú Trọng",
    "Ngày ban hành": "13/11/2008",
    "Ngày hiệu lực": "Đã biết",
    "Ngày công báo": "Đã biết",
    "Số công báo": "Đã biết",
    "Tình trạng": "Đã biết"
  },
  "content": "QUỐC HỘI\n -------\nCỘNG HOÀ XÃ HỘI CHỦ NGHĨA VIỆT NAM\n Độc lập - Tự do - Hạnh phúc\n ---------\nLuật số: 20/2008/QH12 Hà\n Nội, ngày 13 tháng 11 năm 2008 LUẬT\nĐA DẠNG SINH HỌC Căn cứ Hiến pháp nước Cộng hoà xã hội chủ nghĩa Việt Nam năm 1992 đã được sửa đổi, bổ sung một số điều theo Nghị quyết số 51/2001/QH10;\nQuốc hội ban hành Luật đa dạng sinh học.\nCHƯƠNG I NHỮNG QUY ĐỊNH CHUNG\nĐiều 1. Phạm vi điều chỉnh Luật này quy định về bảo tồn và phát triển bền vững đa dạng sinh học; quyền và nghĩa vụ của tổ\nchức, hộ gia đình, cá nhân trong bảo tồn và phát triển bền vững đa dạng sinh học.\nĐiều 2. Đối tượng áp dụng Luật này áp dụng đối với tổ chức, hộ gia đình, cá nhân trong nước,\nngười Việt Nam định cư ở nước ngoài, tổ chức, cá nhân nước ngoài có\nhoạt động trực tiếp hoặc liên quan đến bảo tồn và phát triển bền vững đa dạng sinh học tại Việt Nam.\nĐiều 3. Giải thích từ ngữ\nTrong Luật này, các từ ngữ dưới\nđây được hiểu như sau:\n1. Bảo tồn đa dạng sinh học là việc bảo vệ sự phong phú của các hệ sinh thái tự nhiên quan trọng, đặc thù hoặc đại diện; bảo vệ môi trường sống tự nhiên thường xuyên hoặc theo mùa của loài hoang dã, cảnh quan môi trường, nét đẹp độc đáo của tự nhiên; nuôi, trồng,\nchăm sóc loài thuộc Danh mục loài nguy cấp, quý, hiếm được ưu tiên bảo vệ; lưu giữ và bảo quản lâu dài các mẫu vật di truyền.\n2. Bảo tồn tại chỗ là\nbảo tồn loài hoang dã trong môi trường sống tự nhiên của chúng; bảo tồn loài cây trồng, vật nuôi đặc hữu, có giá trị trong môi trường sống, nơi hình thành và phát triển các đặc điểm đặc trưng của chúng. \n3. Bảo tồn chuyển chỗ là\nbảo tồn loài hoang dã ngoài môi trường sống tự nhiên thường xuyên hoặc theo mùa của chúng; bảo tồn loài cây trồng, vật nuôi đặc hữu, có giá trị ngoài môi trường sống, nơi hình thành và phát triển các đặc điểm đặc trưng của chúng; lưu giữ, bảo quản nguồn gen và mẫu vật di truyền trong các cơ sở\nkhoa học và công nghệ hoặc cơ sở lưu giữ, bảo quản nguồn gen và mẫu vật di truyền.\n4. Cơ sở bảo tồn đa dạng sinh học là cơ sở chăm sóc, nuôi dưỡng, cứu hộ, nhân giống loài hoang dã, cây trồng, vật nuôi, vi sinh vật và nấm đặc hữu, có giá trị; lưu giữ,\nbảo quản nguồn gen và mẫu vật di truyền phục vụ mục đích bảo tồn và phát triển đa dạng sinh học. \n5. Đa dạng sinh học là\nsự phong phú về gen, loài sinh vật và hệ sinh thái trong tự nhiên.\n6. Đánh giá rủi ro do sinh vật biến đổi gen, mẫu vật di truyền của sinh vật biến đổi gen gây ra đối với đa dạng sinh học là xác định tính chất nguy hại tiềm ẩn và mức độ thiệt hại có thể\nxảy ra trong hoạt động liên quan đến sinh vật biến đổi gen, mẫu vật di truyền của sinh vật biến đổi gen, nhất là việc sử dụng, phóng thích sinh vật biến đổi gen và mẫu vật di truyền của sinh vật biến đổi gen.\n7. Gen là một đơn vị di truyền, một đoạn của vật chất di truyền quy định các đặc tính cụ thể của sinh vật.\n8. Hành lang đa dạng sinh học là khu vực nối liền các vùng sinh thái tự nhiên cho phép các loài sinh vật sống trong các vùng sinh thái đó có thể liên hệ với nhau.\n9. Hệ sinh thái là quần xã sinh vật và các yếu tố phi sinh vật của một khu vực địa lý nhất\nđịnh, có tác động qua lại và trao đổi vật chất với nhau. \n10. Hệ sinh thái tự nhiên là hệ sinh thái hình thành, phát triển theo quy luật tự nhiên, vẫn còn giữ được các nét hoang sơ.\n11. Hệ sinh thái tự nhiên mới là hệ sinh thái mới hình thành và phát triển trên vùng bãi bồi tại cửa sông ven biển, vùng có phù sa bồi đắp và\ncác vùng đất khác.\n12. Khu bảo tồn thiên nhiên\n(sau đây gọi là khu bảo tồn) là khu vực địa lý được xác lập ranh giới và phân khu chức năng để bảo tồn đa dạng sinh học. \n13. Loài hoang dã là\nloài động vật, thực vật, vi sinh vật và nấm sinh sống và phát triển theo quy luật.\n14. Loài bị đe dọa tuyệt chủng là loài sinh vật đang có nguy cơ bị suy giảm hoàn toàn số lượng cá thể.\n15. Loài bị tuyệt chủng trong tự nhiên là loài sinh vật chỉ còn tồn tại trong điều kiện nuôi, trồng nhân tạo nằm ngoài phạm vi phân bố tự nhiên của chúng.\n16. Loài đặc hữu là\nloài sinh vật chỉ tồn tại, phát triển trong phạm vi phân bố hẹp và giới hạn trong một vùng lãnh thổ nhất định của Việt Nam mà không được ghi nhận là có ở\nnơi khác trên thế giới.\n17. Loài di cư là loài động vật có toàn bộ hoặc một phần quần thể di chuyển thường xuyên, định kỳ hoặc theo mùa từ khu vực địa lý này đến khu vực địa lý khác.\n18. Loài ngoại lai là\nloài sinh vật xuất hiện và phát triển ở khu vực vốn không phải là môi trường sống tự nhiên của chúng.\n19. Loài ngoại lai xâm hại là loài ngoại lai lấn chiếm nơi sinh sống hoặc gây hại đối với các loài sinh vật bản địa, làm mất cân bằng sinh thái tại nơi chúng xuất hiện và phát triển. \n20. Loài nguy cấp,\nquý, hiếm được ưu tiên bảo vệ là loài hoang dã, giống cây trồng, giống vật nuôi, vi sinh vật và nấm đặc hữu, có giá trị đặc biệt về khoa học, y tế, kinh tế,\nsinh thái, cảnh quan, môi trường hoặc văn hóa - lịch sử mà số lượng còn ít hoặc bị đe dọa tuyệt chủng.\n21. Mẫu vật di truyền là mẫu vật thực vật, động vật, vi sinh vật và nấm mang các đơn vị\nchức năng di truyền còn khả năng tái sinh.\n22. Nguồn gen bao gồm các loài sinh vật, các mẫu vật di truyền trong khu bảo tồn, cơ sở bảo tồn đa dạng sinh học, cơ sở nghiên cứu khoa học và phát triển công nghệ và trong tự nhiên.\n23. Phát triển bền vững\nđa dạng sinh học là việc khai thác, sử dụng hợp lý các hệ\nsinh thái tự nhiên, phát triển nguồn gen, loài sinh vật và bảo đảm cân bằng sinh thái phục vụ phát triển kinh tế - xã hội. \n24. Phóng thích sinh vật biến\nđổi gen là việc chủ động đưa sinh vật biến đổi gen vào môi trường tự nhiên.\n25. Quản lý rủi ro là việc thực hiện các biện pháp an toàn để ngăn ngừa, xử lý và khắc phục rủi ro đối với\nđa dạng sinh học trong các hoạt động có liên quan đến sinh vật biến đổi gen và\nmẫu vật di truyền của sinh vật biến đổi gen. \n26. Quần thể sinh vật là\nmột nhóm cá thể của cùng một loài sinh vật sinh sống và phát triển trong một khu vực nhất định.\n27. Sinh vật biến đổi gen là sinh vật có cấu trúc di truyền bị thay đổi bằng công nghệ chuyển gen.\n28. Tri thức truyền thống về\nnguồn gen là sự hiểu biết, kinh nghiệm, sáng kiến của người dân địa phương về bảo tồn và sử dụng nguồn gen.\n29. Tiếp cận nguồn gen là hoạt động điều tra, thu thập nguồn gen để nghiên cứu phát triển,\nsản xuất sản phẩm thương mại.\n30. Vùng\nđệm là vùng bao quanh, tiếp giáp khu bảo tồn, có tác dụng ngăn chặn, giảm nhẹ tác động tiêu cực từ bên ngoài đối với khu bảo tồn.Bổ sung\nĐiều 4.\nNguyên tắc bảo tồn và phát triển bền vững đa dạng sinh học 1. Bảo tồn đa dạng sinh học là\ntrách nhiệm của Nhà nước và mọi tổ chức, cá nhân. \n2. Kết hợp hài hòa giữa bảo tồn với khai thác, sử dụng hợp lý đa dạng sinh học; giữa bảo tồn, khai thác, sử\ndụng hợp lý đa dạng sinh học với việc xóa đói, giảm nghèo. \n3. Bảo tồn tại chỗ là\nchính, kết hợp bảo tồn tại chỗ với bảo tồn chuyển chỗ.\n4. Tổ chức, cá nhân hưởng lợi từ việc khai thác, sử dụng đa dạng sinh học phải chia sẻ lợi ích với các bên có liên quan; bảo đảm hài hoà giữa lợi ích của Nhà nước với lợi ích của tổ chức, cá nhân. \n5. Bảo đảm quản lý rủi ro do sinh vật biến đổi gen, mẫu vật di truyền của sinh vật biến đổi gen gây ra đối với\nđa dạng sinh học.\nĐiều 5.\nChính sách của Nhà nước về bảo tồn và phát triển bền vững đa dạng sinh học 1. Ưu tiên bảo tồn hệ sinh thái tự nhiên quan trọng, đặc thù hoặc đại diện cho một vùng sinh thái, bảo tồn loài thuộc Danh mục loài nguy cấp, quý, hiếm được ưu tiên bảo vệ; bảo đảm kiểm soát việc tiếp cận nguồn gen.\n2. Bảo đảm kinh phí cho hoạt động\nđiều tra cơ bản, quan trắc, thống kê, xây dựng cơ sở dữ liệu về đa dạng sinh học và quy hoạch bảo tồn đa dạng sinh học; đầu tư cơ sở vật chất - kỹ thuật cho khu bảo tồn, cơ sở bảo tồn đa dạng sinh học của Nhà nước; bảo đảm sự tham gia của nhân dân địa phương trong quá trình xây dựng và thực hiện quy hoạch bảo tồn đa dạng sinh học.\n3. Khuyến khích và bảo đảm quyền, lợi ích hợp pháp của tổ chức, cá nhân đầu tư, áp dụng tiến bộ\nkhoa học, công nghệ, tri thức truyền thống vào việc bảo tồn, phát triển bền vững đa dạng sinh học.\n4. Phát triển du lịch sinh thái gắn với việc xóa đói, giảm nghèo, bảo đảm ổn định cuộc sống của hộ gia đình, cá\nnhân sinh sống hợp pháp trong khu bảo tồn; phát triển bền vững vùng đệm của khu bảo tồn.\n5. Phát huy nguồn lực trong nước, ngoài nước để bảo tồn và phát triển bền vững đa dạng sinh học.\nĐiều 6.\nTrách nhiệm quản lý nhà nước về đa dạng sinh học 1. Chính phủ thống nhất quản lý\nnhà nước về đa dạng sinh học.\n2. Bộ Tài nguyên và Môi trường chịu trách nhiệm trước Chính phủ thực hiện quản lý nhà nước về đa dạng sinh học.\n3. Bộ, cơ quan ngang bộ trong phạm vi nhiệm vụ, quyền hạn của mình thực hiện quản lý nhà nước về đa dạng sinh học theo phân công của Chính phủ.\n4. Ủy ban nhân dân các cấp trong phạm vi nhiệm vụ, quyền hạn của mình thực hiện quản lý nhà nước về đa dạng sinh học theo phân cấp của Chính phủ.\nĐiều 7. Những hành vi bị nghiêm cấm về đa dạng sinh học 1. Săn bắt, đánh bắt, khai thác loài hoang dã trong phân khu bảo vệ nghiêm ngặt của khu bảo tồn,\ntrừ việc vì mục đích nghiên cứu khoa học; lấn chiếm đất đai, phá hoại cảnh quan, hủy hoại hệ sinh thái tự nhiên, nuôi trồng các loài ngoại lai xâm hại trong khu bảo tồn.\n2. Xây dựng công trình, nhà ở\ntrong phân khu bảo vệ nghiêm ngặt của khu bảo tồn, trừ công trình phục vụ mục\nđích quốc phòng, an ninh; xây dựng công trình, nhà ở trái phép trong phân khu phục hồi sinh thái của khu bảo tồn. \n3. Điều tra, khảo sát, thăm dò,\nkhai thác khoáng sản; chăn nuôi gia súc, gia cầm quy mô trang trại, nuôi trồng thuỷ sản quy mô công nghiệp; cư trú trái phép, gây ô nhiễm môi trường trong phân khu bảo vệ nghiêm ngặt và phân khu phục hồi sinh thái của khu bảo tồn.\n4. Săn bắt, đánh bắt, khai thác bộ phận cơ thể, giết, tiêu thụ, vận chuyển, mua, bán trái phép loài thuộc Danh mục loài nguy cấp, quý, hiếm được ưu tiên bảo vệ; quảng cáo, tiếp thị, tiêu thụ\ntrái phép sản phẩm có nguồn gốc từ loài thuộc Danh mục loài nguy cấp, quý,\nhiếm được ưu tiên bảo vệ.\n5. Nuôi sinh sản, nuôi sinh trưởng và trồng cấy nhân tạo trái phép loài động vật, thực vật hoang dã thuộc Danh mục loài nguy cấp, quý, hiếm được ưu tiên bảo vệ.\n6. Nhập khẩu, phóng thích trái phép sinh vật biến đổi gen, mẫu vật di truyền của sinh vật biến đổi gen.\n7. Nhập khẩu, phát triển loài ngoại lai xâm hại.\n8. Tiếp cận trái phép nguồn gen thuộc Danh mục loài nguy cấp, quý, hiếm được ưu tiên bảo vệ.\n9. Chuyển đổi trái phép mục\nđích sử dụng đất trong khu bảo tồn. \nCHƯƠNG II QUY HOẠCH BẢO TỒN ĐA DẠNG SINH HỌC Mục I. QUY HOẠCH TỔNG THỂ BẢO TỒN ĐA DẠNG SINH HỌC CỦA CẢ NƯỚC\nĐiều 8. Căn cứ lập quy hoạch tổng thể bảo tồn\nđa dạng sinh học của cả nước 1. Chiến lược phát triển kinh tế\n- xã hội, quốc phòng, an ninh. \n2. Chiến lược bảo vệ môi trường.\n3. Quy hoạch sử dụng đất, quy hoạch phát triển ngành, lĩnh vực. \n4. Kết quả điều tra cơ bản về đa dạng sinh học, điều kiện tự nhiên, kinh tế - xã hội.\n5. Kết quả thực hiện quy hoạch bảo tồn đa dạng sinh học trước đó.\n6. Thực trạng và dự báo nhu cầu khai thác, sử dụng đa dạng sinh học. \n7. Nguồn lực để thực hiện quy hoạch.\nĐiều 9.\nNội dung quy hoạch tổng thể bảo tồn đa dạng sinh học của cả nước 1. Phương hướng, mục tiêu bảo tồn\nđa dạng sinh học.\n2. Đánh giá điều kiện tự nhiên,\nkinh tế - xã hội, hiện trạng đa dạng sinh học; quy hoạch sử dụng đất, quy hoạch phát triển ngành, lĩnh vực, địa phương; nguồn lực để thực hiện quy hoạch.\n3. Vị trí địa lý, giới hạn, biện pháp tổ chức quản lý, bảo vệ\nhành lang đa dạng sinh học.\n4. Vị trí địa lý, diện tích, chức năng sinh thái, biện pháp tổ chức quản lý, bảo vệ và phát triển bền vững hệ sinh thái tự nhiên.\n5. Vị trí địa lý, diện tích,\nranh giới và bản đồ các khu vực dự kiến thành lập khu bảo tồn, loại hình khu bảo tồn; biện pháp tổ chức quản lý khu bảo tồn; giải pháp ổn định cuộc sống của hộ gia đình, cá nhân sinh sống hợp pháp trong khu bảo tồn. \n6. Nhu cầu bảo tồn chuyển chỗ; loại hình, số lượng, phân bố và kế hoạch phát triển các cơ sở\nbảo tồn đa dạng sinh học.\n7. Đánh giá môi trường chiến lược dự án quy hoạch tổng thể bảo tồn đa dạng sinh học.\n8. Tổ chức thực hiện quy hoạch bảo tồn đa dạng sinh học.\nĐiều 10. Lập,\nphê duyệt, điều chỉnh quy hoạch tổng thể bảo tồn đa dạng sinh học của cả\nnước, quy hoạch bảo tồn đa dạng sinh học của bộ, cơ quan ngang bộ\n1. Bộ Tài nguyên và Môi trường chủ trì phối hợp với bộ, cơ quan ngang bộ có liên quan tổ chức lập, trình Chính phủ phê duyệt, điều chỉnh quy hoạch tổng thể bảo tồn đa dạng sinh học của cả nước.\n2. Bộ, cơ quan ngang bộ căn cứ\nvào quy hoạch tổng thể bảo tồn đa dạng sinh học của cả nước tổ chức lập, phê\nduyệt, điều chỉnh quy hoạch bảo tồn đa dạng sinh học thuộc phạm vi quản lý.\n3. Chính phủ\nquy định cụ thể trình tự, thủ tục lập, phê duyệt, điều chỉnh quy hoạch tổng thể\nbảo tồn đa dạng sinh học quy định tại Điều này. \nĐiều 11.\nCông bố, tổ chức thực hiện quy hoạch tổng thể bảo tồn đa dạng sinh học của cả nước 1. Trong thời hạn 30 ngày, kể từ\nngày được Chính phủ phê duyệt, Bộ Tài nguyên và Môi trường, bộ, cơ quan ngang bộ\ncó liên quan có trách nhiệm công bố quy hoạch tổng thể bảo tồn đa dạng sinh học của cả nước trên trang thông tin điện tử của Bộ Tài nguyên và Môi trường, bộ,\ncơ quan ngang bộ có liên quan; Ủy ban nhân dân tỉnh, thành phố trực thuộc trung\nương (sau đây gọi chung là Ủy ban nhân dân cấp tỉnh) có liên quan công bố quy hoạch tổng thể bảo tồn đa dạng sinh học của cả nước trên trang thông tin điện tử\ncủa Ủy ban nhân dân cấp tỉnh và tại trụ sở Ủy ban nhân dân các cấp có liên quan. \n2. Việc tổ chức thực hiện quy hoạch tổng thể bảo tồn đa dạng sinh học của cả nước được quy định như sau:\na) Bộ Tài nguyên và Môi trường chủ trì phối hợp với bộ, cơ quan ngang bộ có liên quan chỉ đạo việc tổ chức thực hiện quy hoạch tổng thể bảo tồn đa dạng sinh học của cả nước;\nb) Bộ, cơ quan ngang bộ tổ chức thực hiện quy hoạch tổng thể bảo tồn đa dạng sinh học của cả nước thuộc phạm vi quản lý;\nc) Ủy ban nhân dân cấp tỉnh tổ chức thực hiện quy hoạch tổng thể bảo tồn đa dạng sinh học của cả nước tại địa phương;\nd) Trong quá trình tổ chức thực hiện quy hoạch, trường hợp có sự khác nhau giữa quy hoạch tổng thể bảo tồn đa dạng sinh học của cả nước với quy hoạch sử dụng đất của tỉnh, thành phố\ntrực thuộc trung ương, quy hoạch ngành, lĩnh vực, trừ quy hoạch quốc phòng,\nan ninh thì ưu tiên thực hiện quy hoạch bảo tồn đa dạng sinh học. \nMục 2. QUY HOẠCH BẢO TỒN ĐA DẠNG SINH HỌC CỦA TỈNH, THÀNH PHỐ TRỰC THUỘC TRUNG ƯƠNG\nĐiều 12.\nCăn cứ lập quy hoạch bảo tồn đa dạng sinh học của tỉnh, thành phố trực thuộc trung ương 1. Quy hoạch, kế hoạch phát triển kinh tế - xã hội, quốc phòng, an ninh của địa phương.\n2. Quy hoạch tổng thể bảo tồn đa dạng sinh học của cả nước.\n3. Quy hoạch sử dụng đất của tỉnh,\nthành phố trực thuộc trung ương.\n4. Kết quả thực hiện quy hoạch bảo tồn đa dạng sinh học của tỉnh, thành phố trực thuộc trung ương trước đó.\n5. Hiện trạng đa dạng sinh học,\nđiều kiện tự nhiên, kinh tế - xã hội đặc thù của địa phương nơi dự kiến thành lập khu bảo tồn.\n6. Nhu cầu bảo tồn, khai thác đa dạng sinh học của địa phương. \n7. Nguồn lực để thực hiện quy hoạch.\nĐiều 13. Nội dung quy hoạch bảo tồn đa dạng sinh học của tỉnh, thành phố trực thuộc trung\nương 1. Phương hướng, mục tiêu bảo tồn\nđa dạng sinh học của tỉnh, thành phố trực thuộc trung ương. \n2. Đánh giá hiện trạng đa dạng sinh học, điều kiện tự nhiên, kinh tế - xã hội nơi dự kiến thành lập khu bảo tồn cấp tỉnh.\n3. Vị trí địa lý, diện tích,\nranh giới và bản đồ khu vực dự kiến thành lập khu bảo tồn, loại hình khu bảo tồn; biện pháp tổ chức quản lý khu bảo tồn; giải pháp ổn định cuộc sống của hộ\ngia đình, cá nhân sinh sống hợp pháp trong khu bảo tồn. \n4. Nhu cầu bảo tồn chuyển chỗ; loại hình, số lượng, phân bố\nvà kế hoạch phát triển các cơ sở bảo tồn đa dạng sinh học của tỉnh,\nthành phố trực thuộc trung ương. \n5. Tổ chức thực hiện quy hoạch bảo tồn đa dạng sinh học của tỉnh, thành phố trực thuộc trung ương.\nĐiều 14. Lập,\nthẩm định, thông qua, điều chỉnh quy hoạch bảo tồn đa dạng sinh học của tỉnh,\nthành phố trực thuộc trung ương 1. Ủy ban nhân dân cấp tỉnh tổ\nchức lập, thẩm định, điều chỉnh quy hoạch bảo tồn đa dạng sinh học của tỉnh,\nthành phố trực thuộc trung ương trình Hội đồng nhân dân cùng cấp thông qua.\n2. Chính phủ\nquy định trình tự, thủ tục lập, thẩm định, thông qua, điều chỉnh quy hoạch bảo tồn đa dạng sinh học của tỉnh, thành phố trực thuộc trung ương.\nĐiều 15.\nCông bố, tổ chức thực hiện quy hoạch bảo tồn đa dạng sinh học của tỉnh,\nthành phố trực thuộc trung ương 1. Trong thời hạn 30 ngày, kể từ\nngày được Hội đồng nhân dân thông qua, Ủy ban nhân dân cấp tỉnh có trách nhiệm công bố quy hoạch bảo tồn đa dạng sinh học của tỉnh, thành phố trực thuộc trung\nương trên trang thông tin điện tử của Ủy ban nhân dân cấp tỉnh và tại trụ sở Ủy ban nhân dân các cấp có liên quan. \n2. Ủy ban nhân dân cấp tỉnh tổ\nchức thực hiện quy hoạch bảo tồn đa dạng sinh học của tỉnh, thành phố trực thuộc trung ương.\nCHƯƠNG III BẢO TỒN VÀ PHÁT TRIỂN BỀN VỮNG HỆ SINH THÁI TỰ NHIÊN Mục 1. KHU BẢO TỒN\nĐiều 16. Khu bảo tồn, phân cấp khu bảo tồn 1. Khu bảo tồn bao gồm: \na) Vườn quốc gia; \nb) Khu dự trữ thiên nhiên;\nc) Khu bảo tồn loài - sinh cảnh;\nd) Khu bảo vệ cảnh quan.\n2. Căn cứ vào mức độ đa dạng sinh học, giá trị đa dạng sinh học, quy mô diện tích, khu bảo tồn được phân thành cấp quốc gia và cấp tỉnh để có chính sách quản lý, đầu tư phù hợp. \n3. Khu bảo tồn phải được thống kê, kiểm kê diện tích; xác lập vị trí trên bản đồ hiện trạng sử dụng\nđất hoặc xác định tọa độ trên mặt nước biển. \n4. Chính phủ\nquy định cụ thể tiêu chí phân cấp khu bảo tồn.\nĐiều 17. Vườn quốc gia Vườn quốc gia phải có các tiêu chí chủ yếu sau đây:\n1. Có hệ sinh thái tự nhiên quan trọng đối với quốc gia, quốc tế, đặc thù hoặc đại diện cho một vùng sinh thái tự nhiên;\n2. Là nơi sinh sống tự nhiên thường xuyên hoặc theo mùa của ít nhất một loài thuộc Danh mục loài nguy cấp, quý, hiếm\nđược ưu tiên bảo vệ;\n3. Có giá trị đặc biệt về khoa học,\ngiáo dục; \n4. Có cảnh quan môi trường, nét\nđẹp độc đáo của tự nhiên, có giá trị du lịch sinh thái.\nĐiều 18.\nKhu dự trữ thiên nhiên 1. Khu dự trữ thiên nhiên gồm có:\na) Khu dự trữ thiên nhiên cấp quốc gia;\nb) Khu dự trữ thiên nhiên cấp tỉnh.\n2. Khu dự trữ thiên nhiên cấp quốc gia phải có các tiêu chí chủ yếu sau đây: \na) Có hệ sinh thái tự nhiên quan trọng đối với quốc gia, quốc tế, đặc thù hoặc đại diện cho một vùng sinh thái tự nhiên;\nb) Có giá trị đặc biệt về khoa học,\ngiáo dục hoặc du lịch sinh thái, nghỉ dưỡng.\n3. Khu dự trữ thiên nhiên cấp tỉnh là khu thuộc quy hoạch bảo tồn đa dạng sinh học của tỉnh,\nthành phố trực thuộc trung ương nhằm mục đích bảo tồn các hệ sinh thái tự nhiên trên địa bàn.\nĐiều 19.\nKhu bảo tồn loài - sinh cảnh 1. Khu bảo tồn loài - sinh cảnh gồm có:\na) Khu bảo tồn loài - sinh cảnh cấp quốc gia;\nb) Khu bảo tồn loài - sinh cảnh cấp tỉnh.\n2. Khu bảo tồn loài - sinh cảnh cấp quốc gia phải có các tiêu chí chủ yếu sau đây:\na) Là nơi sinh sống tự nhiên thường xuyên hoặc theo mùa của ít nhất một loài thuộc Danh mục loài nguy cấp, quý, hiếm\nđược ưu tiên bảo vệ;\nb) Có giá trị đặc biệt về khoa học,\ngiáo dục.\n3. Khu bảo tồn loài - sinh cảnh cấp tỉnh là khu thuộc quy hoạch bảo tồn đa dạng sinh học của tỉnh, thành phố trực thuộc trung ương nhằm mục đích bảo tồn các loài hoang dã trên địa bàn.\nĐiều 20.\nKhu bảo vệ cảnh quan 1. Khu bảo vệ cảnh quan gồm có:\na) Khu bảo vệ cảnh quan cấp quốc gia;\nb) Khu bảo vệ cảnh quan cấp tỉnh.\n2. Khu bảo vệ cảnh quan cấp quốc gia phải có các tiêu chí chủ yếu sau đây:\na) Có hệ sinh thái đặc thù;\nb) Có cảnh quan môi trường,\nnét đẹp độc đáo của tự nhiên; \nc) Có giá trị về khoa học, giáo dục, du lịch sinh thái, nghỉ dưỡng.\n3. Khu bảo vệ cảnh quan cấp tỉnh là khu thuộc quy hoạch bảo tồn đa dạng sinh học của tỉnh,\nthành phố trực thuộc trung ương nhằm mục đích bảo vệ cảnh quan trên địa bàn.\nĐiều 21.\nNội dung của dự án thành lập khu bảo tồn 1. Mục đích bảo tồn đa dạng sinh học; việc đáp ứng các tiêu chí chủ yếu để xác lập khu bảo tồn. \n2. Thực trạng các hệ sinh thái tự\nnhiên, các loài thuộc Danh mục loài nguy cấp, quý, hiếm được ưu tiên bảo vệ,\ncác loài hoang dã khác, cảnh quan môi trường, nét đẹp độc đáo của tự nhiên.\n3. Diện tích đất, mặt nước; hiện trạng sử dụng đất, mặt nước; số lượng dân cư sống tại nơi dự kiến thành lập khu bảo tồn; phương án chuyển đổi mục đích sử dụng đất.\n4. Trích lục bản đồ, vị trí địa lý, diện tích dự kiến thành lập khu bảo tồn.\n5. Vị trí địa lý, diện tích phân khu bảo vệ nghiêm ngặt, phân khu phục hồi sinh thái, phân khu dịch vụ - hành chính; ranh giới từng phân khu; phương án ổn định cuộc sống hoặc di dời hộ gia\nđình, cá nhân ra khỏi nơi dự kiến thành lập khu bảo tồn. \n6. Kế hoạch quản lý khu bảo tồn.\n7. Tổ chức quản lý khu bảo tồn.\n8. Vị trí địa lý, diện tích,\nranh giới vùng đệm của nơi dự kiến thành lập khu bảo tồn.\n9. Tổ chức thực hiện dự án thành lập khu bảo tồn.\nĐiều 22. Lập,\nthẩm định dự án thành lập khu bảo tồn cấp quốc gia 1. Việc lập, thẩm định dự án thành lập khu bảo tồn cấp quốc gia được thực hiện theo sự phân công, phân cấp của Chính phủ.\n2. Trình tự, thủ tục lập dự án thành lập khu bảo tồn cấp quốc gia được quy định như sau:\na) Tổ chức điều tra, đánh giá hiện trạng đa dạng sinh học nơi dự kiến thành lập khu bảo tồn theo các tiêu chí để\nxác lập khu bảo tồn quy định tại các điều 17, 18, 19 và 20 của Luật này và lập dự án thành lập khu bảo tồn;\nb) Tổ chức lấy ý kiến bộ, cơ\nquan ngang bộ có liên quan, Uỷ ban nhân dân các cấp, ý kiến cộng đồng dân cư\nsinh sống hợp pháp trong khu vực dự kiến thành lập khu bảo tồn hoặc tiếp giáp với khu bảo tồn; \nc) Tổ chức thẩm định dự án thành lập khu bảo tồn cấp quốc gia trình Thủ tướng Chính phủ quyết định.\n3. Hồ sơ dự án thành lập khu bảo tồn cấp quốc gia gồm có:\na) Văn bản đề nghị thành lập khu bảo tồn của cơ quan lập dự án thành lập khu bảo tồn cấp quốc gia; \nb) Dự án thành lập khu bảo tồn với các nội dung quy định tại Điều 21 của Luật này;\nc) Ý kiến của cơ quan nhà nước có thẩm quyền quản lý khu bảo tồn quy định tại khoản 1 Điều 27 của Luật này và\ný kiến của các bên liên quan quy định tại điểm b khoản 2 Điều này; \nd) Kết quả thẩm định dự án thành lập khu bảo tồn cấp quốc gia.\nĐiều 23.\nQuyết định thành lập khu bảo tồn cấp quốc gia 1. Thủ tướng Chính phủ quyết\nđịnh thành lập khu bảo tồn cấp quốc gia.\n2. Quyết định thành lập khu bảo tồn cấp quốc gia phải có các nội dung chủ yếu sau đây: \na) Vị trí địa lý, ranh giới, diện tích khu bảo tồn và vùng đệm;\nb) Vị trí địa lý, ranh giới, diện tích phân khu bảo vệ nghiêm ngặt, phân khu phục hồi sinh thái, phân khu dịch vụ\n- hành chính;\nc) Mục đích bảo tồn đa dạng sinh học của khu bảo tồn;\nd) Kế hoạch phục hồi các hệ sinh thái tự nhiên trong khu bảo tồn;\nđ) Phương án ổn định hoặc di dời hộ gia đình, cá nhân sinh sống trong khu bảo tồn; phương án chuyển đổi mục\nđích sử dụng đất trong khu bảo tồn;\ne) Chức năng, nhiệm vụ và cơ cấu tổ chức của Ban quản lý khu bảo tồn.\n3. Quyết định thành lập khu bảo tồn cấp quốc gia được gửi đến Uỷ ban nhân dân các cấp nơi có khu bảo tồn, cơ\nquan lập dự án thành lập khu bảo tồn theo quy định tại khoản 1 Điều 22 của Luật này và cơ quan nhà nước có thẩm quyền quản lý khu bảo tồn quy định tại khoản 1\nĐiều 27 của Luật này.\nĐiều 24. Lập,\nthẩm định dự án thành lập khu bảo tồn và quyết định thành lập khu bảo tồn cấp tỉnh 1. Căn cứ vào quy hoạch bảo tồn đa dạng sinh học của tỉnh, thành phố trực thuộc trung ương, Ủy ban nhân dân cấp tỉnh quyết định thành lập khu bảo tồn cấp tỉnh sau khi có ý kiến của Uỷ ban nhân dân các cấp có liên quan, ý kiến cộng đồng dân cư sinh sống hợp pháp trong khu vực dự kiến thành lập khu bảo tồn hoặc tiếp giáp với khu bảo tồn và ý kiến chấp thuận của cơ quan nhà nước có thẩm quyền quản lý khu bảo tồn quy\nđịnh tại khoản 1 Điều 27 của Luật này. \n2. Cơ quan nhà nước có thẩm quyền quản lý khu bảo tồn quy định tại khoản 1 Điều 27 của Luật này chủ trì phối hợp với bộ, cơ quan ngang bộ có liên quan quy định trình tự, thủ tục lập, thẩm định dự án thành lập khu bảo tồn cấp tỉnh; nội dung quyết định thành lập khu bảo tồn cấp tỉnh.\nĐiều 25. Sử dụng đất trong khu bảo tồn 1. Căn cứ quyết định thành lập khu bảo tồn, cơ quan có thẩm quyền giao đất theo quy định của Luật đất đai có\ntrách nhiệm giao đất cho Ban quản lý khu bảo tồn hoặc tổ chức khác được giao quản lý khu bảo tồn. \n2. Việc sử dụng đất và việc chuyển mục đích sử dụng đất trong khu bảo tồn được thực hiện theo quy định của pháp luật về đất đai, Luật này và các quy định khác của pháp luật có liên quan. \nĐiều 26.\nPhân khu chức năng và ranh giới khu bảo tồn 1. Khu bảo tồn có các phân khu chức năng sau đây:\na) Phân khu bảo vệ nghiêm ngặt;\nb) Phân khu phục hồi sinh thái;\nc) Phân khu dịch vụ - hành chính.\n2. Khu bảo tồn phải được cắm mốc\nđể xác lập ranh giới; phân khu bảo vệ nghiêm ngặt trong khu bảo tồn phải được xác định diện tích, vị trí trên thực địa hoặc tọa độ trên mặt nước biển.\n3. Ban quản lý khu bảo tồn hoặc tổ chức được giao quản lý khu bảo tồn chủ trì phối hợp với Uỷ ban nhân dân các cấp nơi có khu bảo tồn tổ chức việc cắm mốc phân định ranh giới khu bảo tồn.\nĐiều 27.\nTrách nhiệm quản lý khu bảo tồn 1. Bộ, cơ quan ngang bộ, Uỷ ban nhân dân cấp tỉnh tổ chức quản lý khu bảo tồn theo sự phân công, phân cấp của Chính phủ.\n2. Việc quản lý khu bảo tồn phải\nđược thực hiện theo quy định của Luật này và Quy chế quản lý khu bảo tồn.\nThủ tướng Chính phủ ban hành Quy chế quản lý khu bảo tồn.\nĐiều 28. Tổ\nchức quản lý khu bảo tồn 1. Khu bảo tồn cấp quốc gia có\nBan quản lý. Ban quản lý khu bảo tồn cấp quốc gia là đơn vị sự nghiệp công lập tự chủ về tài chính hoặc đơn vị sự nghiệp công lập chưa tự chủ về tài chính. \n2. Căn cứ vào tình hình thực tế\ncủa địa phương, khu bảo tồn cấp tỉnh được giao cho Ban quản lý là đơn vị sự\nnghiệp công lập tự chủ về tài chính hoặc đơn vị sự nghiệp công lập chưa tự chủ\nvề tài chính hoặc tổ chức được giao quản lý khu bảo tồn theo quy định của pháp luật. \nĐiều 29.\nQuyền và trách nhiệm của Ban quản lý, tổ chức được giao quản lý khu bảo tồn Ban quản lý khu bảo tồn, tổ chức\nđược giao quản lý khu bảo tồn có các quyền và trách nhiệm sau đây: \n1. Bảo tồn đa dạng sinh học theo quy định của Luật này và quy chế quản lý khu bảo tồn;\n2. Xây dựng, trình cơ quan quản lý nhà nước có thẩm quyền phê duyệt và tổ chức thực hiện kế hoạch, chương trình, dự án đầu tư phục hồi hệ sinh thái tự nhiên trong khu bảo tồn;\n3. Quản lý hoạt động nghiên cứu khoa học, thu thập nguồn gen, mẫu vật di truyền; theo dõi, tổ chức thu thập thông tin, số liệu, xây dựng cơ sở dữ liệu và lập báo cáo hiện trạng đa dạng sinh học của khu bảo tồn; có biện pháp phòng, trừ dịch bệnh trong khu bảo tồn;\n4. Kinh doanh, liên doanh trong lĩnh vực du lịch sinh thái, nghiên cứu khoa học, nghỉ dưỡng và các hoạt động dịch vụ khác trong khu bảo tồn theo quy định của pháp luật;\n5. Phối hợp với lực lượng kiểm lâm, cảnh sát môi trường, cảnh sát phòng cháy, chữa cháy và chính quyền địa phương trong việc bảo tồn đa dạng sinh học trong khu bảo tồn;\n6. Được chia sẻ lợi ích từ hoạt\nđộng tiếp cận nguồn gen thuộc phạm vi khu bảo tồn;\n7. Quyền và trách nhiệm khác theo quy định của pháp luật. \nĐiều 30.\nQuyền và nghĩa vụ của hộ gia đình, cá nhân sinh sống hợp pháp trong khu bảo tồn 1. Hộ gia đình, cá nhân sinh sống hợp pháp trong khu bảo tồn có các quyền và nghĩa vụ sau đây:\na) Khai thác nguồn lợi hợp pháp trong khu bảo tồn theo quy định của Luật này, quy chế quản lý khu bảo tồn và các quy định khác của pháp luật có liên quan;\nb) Tham gia, hưởng lợi ích từ\nhoạt động kinh doanh, dịch vụ trong khu bảo tồn;\nc) Hưởng chính sách ưu đãi,\nhỗ trợ, bồi thường, tái định cư theo quy định của pháp luật; \nd) Thực hiện quy chế quản lý khu bảo tồn;\nđ) Quyền và nghĩa vụ khác theo quy định của pháp luật. \n2. Chính phủ quy định cụ thể việc thực hiện Điều này.\nĐiều 31.\nQuyền và nghĩa vụ của tổ chức, cá nhân có hoạt động hợp pháp trong khu bảo tồn Tổ chức, cá nhân có hoạt động hợp pháp trong khu bảo tồn có các quyền và nghĩa vụ sau đây:\n1. Khai thác nguồn lợi hợp pháp trong khu bảo tồn theo quy định của Luật này, quy chế quản lý khu bảo tồn và các quy định khác của pháp luật có liên quan; \n2. Tiếp cận nguồn gen, chia sẻ lợi\ních từ việc tiếp cận nguồn gen và các hoạt động hợp pháp khác trong khu bảo tồn theo quy định của pháp luật;\n3. Thực hiện quy chế quản lý khu bảo tồn;\n4. Tiến hành các hoạt động khác theo quy định của pháp luật;\n5. Quyền và nghĩa vụ khác theo quy định của pháp luật.\nĐiều 32. Quản lý vùng đệm của khu bảo tồn 1. Vị trí, diện tích vùng đệm được quy định trong quyết định thành lập khu bảo tồn và phải được xác định trên bản đồ hiện trạng sử dụng đất hoặc xác định tọa\nđộ trên mặt nước biển. \n2. Mọi hoạt động trong vùng đệm phải tuân thủ quy chế quản lý vùng đệm do Thủ tướng Chính phủ ban hành.\n3. Chủ dự án đầu tư trong vùng đệm của khu bảo tồn phải lập báo cáo đánh giá tác động môi trường trình Hội đồng thẩm định theo quy định của pháp luật về bảo vệ môi trường; trong thành phần Hội\nđồng thẩm định phải có đại diện ban quản lý khu bảo tồn.\nTrường hợp dự án đầu tư trong vùng đệm tiềm ẩn nguy cơ xảy ra sự cố môi trường hoặc phát tán chất thải độc hại thì quyết định phê duyệt báo cáo đánh giá tác động môi trường phải xác định khoảng cách an toàn để không gây tác động xấu đến khu bảo tồn, tổ chức được giao quản lý khu bảo tồn.\nĐiều 33.\nBáo cáo về hiện trạng đa dạng sinh học của khu bảo tồn 1. Định kỳ 3 năm một lần, Ban quản lý khu bảo tồn, tổ chức được giao quản lý khu bảo tồn có trách nhiệm báo cáo hiện trạng đa dạng sinh học của khu bảo tồn với cơ quan nhà nước có thẩm quyền quản lý khu bảo tồn quy định tại khoản 1 Điều 27 của Luật này.\n2. Báo cáo hiện trạng đa dạng sinh học của khu bảo tồn phải có các nội dung chủ yếu sau đây:\na) Thực trạng, tình trạng phục hồi và kế hoạch phục hồi các hệ sinh thái tự nhiên trong khu bảo tồn;\nb) Thực trạng và kế hoạch bảo tồn các loài thuộc Danh mục loài nguy cấp, quý, hiếm được ưu tiên bảo vệ trong khu bảo tồn; \nc) Yêu cầu đặt ra đối với bảo tồn đa dạng sinh học trong khu bảo tồn;\nd) Hiện trạng sử dụng đất trong khu bảo tồn.\nMục 2. PHÁT TRIỂN BỀN VỮNG CÁC HỆ SINH THÁI TỰ NHIÊN\nĐiều 34.\nĐiều tra, đánh giá và xác lập chế độ phát triển bền vững các hệ\nsinh thái tự nhiên 1. Các hệ sinh thái tự nhiên phải được điều tra, đánh giá và xác lập chế độ phát triển bền vững.\n2. Hệ sinh thái rừng tự\nnhiên phải được điều tra, đánh giá và xác lập chế độ phát triển bền vững theo quy định của pháp luật về bảo vệ và phát triển rừng và các quy định khác của pháp luật có liên quan.\n3. Hệ sinh thái tự nhiên trên biển phải được điều tra, đánh giá và xác lập chế độ phát triển bền vững theo quy định của pháp luật về thủy sản và các quy định khác của pháp luật có liên quan. \n4. Hệ sinh thái tự nhiên trên các vùng đất ngập nước tự nhiên, vùng núi đá vôi, vùng đất chưa sử\ndụng không thuộc đối tượng quy định tại khoản 2 và khoản 3 Điều này\nđược điều tra, đánh giá và xác lập chế độ phát triển bền vững theo quy định tại Điều 35 và Điều 36 của Luật này và các quy định khác của pháp luật có liên quan.\nĐiều 35.\nPhát triển bền vững hệ sinh thái tự nhiên trên vùng đất ngập nước tự\nnhiên 1. Đất ngập nước tự nhiên là\nvùng đầm lầy, than bùn hoặc vùng nước thường xuyên hoặc tạm thời, kể\ncả vùng biển có độ sâu không quá 6 mét khi ngấn nước thủy triều thấp nhất.\n2. Việc thống kê, kiểm kê\nvùng đất ngập nước tự nhiên được thực hiện theo quy định của pháp luật về đất đai.\n3. Ủy ban nhân dân cấp tỉnh điều tra, thống kê, kiểm kê, đánh giá hiện trạng đa dạng sinh học, xác lập chế độ\nphát triển bền vững hệ sinh thái tự nhiên và xác lập vị trí, diện tích vùng đất ngập nước tự nhiên trên bản đồ hiện trạng sử dụng đất hoặc tọa độ trên mặt nước biển.\nĐiều 36.\nPhát triển bền vững hệ sinh thái tự nhiên trên vùng núi đá vôi và\nvùng đất chưa sử dụng không thuộc hệ sinh thái rừng 1. Vùng núi đá vôi và vùng\nđất chưa sử dụng không thuộc hệ sinh thái rừng có hệ sinh thái tự nhiên đặc thù hoặc đại diện cho một vùng phải được điều tra, đánh giá hiện trạng đa dạng sinh học và xác lập chế độ phát triển bền vững.\n2. Ủy ban nhân dân cấp tỉnh\nđiều tra, thống kê, đánh giá hiện trạng đa dạng sinh học và xác lập chế độ phát triển bền vững hệ sinh thái tự nhiên trên vùng núi đá vôi và vùng đất chưa sử dụng không thuộc hệ sinh thái rừng. \nCHƯƠNG IV BẢO TỒN VÀ PHÁT TRIỂN BỀN VỮNG CÁC LOÀI SINH VẬT Mục 1.\nBẢO VỆ LOÀI THUỘC DANH MỤC LOÀI NGUY CẤP, QUÝ, HIẾM ĐƯỢC ƯU TIÊN BẢO VỆ\nĐiều 37.\nLoài được đưa vào Danh mục loài nguy cấp, quý, hiếm được ưu tiên bảo vệ\n1. Loài được xem xét đưa vào Danh mục loài nguy cấp, quý, hiếm được ưu tiên bảo vệ bao gồm:\na) Loài động vật, thực vật hoang dã nguy cấp, quý, hiếm;\nb) Giống cây trồng, giống vật nuôi, vi sinh vật và nấm nguy cấp, quý, hiếm. \n2. Chính phủ\nquy định cụ thể tiêu chí xác định loài và chế độ quản lý, bảo vệ loài thuộc Danh mục loài nguy cấp, quý, hiếm được ưu tiên bảo vệ; ban hành Danh mục loài nguy cấp, quý, hiếm được ưu tiên bảo vệ.\nĐiều 38. Đề\nnghị đưa vào hoặc đưa ra khỏi Danh mục loài nguy cấp, quý, hiếm được ưu tiên bảo vệ\n1. Căn cứ vào quy định tại\nĐiều 37 của Luật này, tổ chức, cá nhân sau đây có quyền đề nghị loài được đưa vào hoặc đưa ra khỏi Danh mục loài nguy cấp, quý, hiếm được ưu tiên bảo vệ:\na) Tổ chức, cá nhân thực hiện đề\ntài, dự án điều tra, nghiên cứu về loài sinh vật ở Việt Nam;\nb) Tổ chức, cá nhân được giao quản lý rừng, khu bảo tồn, vùng đất ngập nước, biển và hệ sinh thái tự nhiên khác;\nc) Hội, hiệp hội và tổ chức khác về khoa học và công nghệ, môi trường.\n2. Đề nghị đưa vào hoặc đưa ra khỏi Danh mục loài nguy cấp, quý, hiếm được ưu tiên bảo vệ phải được lập thành hồ sơ gửi bộ, cơ\nquan ngang bộ có liên quan để tổ chức thẩm định theo quy định tại khoản 1 Điều 39 của Luật này. \n3. Hồ sơ đề nghị đưa vào hoặc đưa ra khỏi Danh mục loài nguy cấp, quý, hiếm được ưu tiên bảo vệ gồm có: \na) Tên phổ thông, tên bản địa,\ntên khoa học của loài được đề nghị;\nb) Vùng phân bố, số lượng cá thể\nước tính, điều kiện sống và tình trạng nơi sinh sống tự nhiên thường xuyên hoặc theo mùa của loài được đề nghị;\nc) Các đặc tính cơ bản, tính\nđặc hữu, giá trị đặc biệt về khoa học, y tế, kinh tế, sinh thái, cảnh quan,\nmôi trường hoặc văn hoá - lịch sử của loài được đề nghị;\nd) Mức độ bị đe dọa tuyệt chủng của loài được đề nghị; \nđ) Chế độ quản lý, bảo vệ và\nyêu cầu đặc thù khác;\ne) Kết quả tự đánh giá và đề nghị\nviệc đưa vào hoặc đưa ra khỏi Danh mục loài nguy cấp, quý, hiếm được ưu tiên bảo vệ.\nĐiều 39. Thẩm\nđịnh hồ sơ đề nghị đưa vào hoặc đưa ra khỏi Danh mục loài nguy cấp, quý, hiếm được ưu tiên bảo vệ\n1. Bộ, cơ quan ngang bộ sau khi nhận được hồ sơ hợp lệ phải tổ chức Hội đồng thẩm định hồ sơ đề nghị đưa vào hoặc đưa ra khỏi Danh mục loài nguy cấp, quý, hiếm được ưu tiên bảo vệ gửi Bộ Tài nguyên và Môi trường để\nlập Danh mục loài nguy cấp, quý, hiếm được ưu tiên bảo vệ trình Chính phủ quyết\nđịnh. \n2. Chính phủ quy định cụ thể\ntrình tự, thủ tục thẩm định hồ sơ đề nghị đưa vào hoặc đưa ra khỏi Danh mục loài nguy cấp, quý, hiếm được ưu tiên bảo vệ.\nĐiều 40.\nQuyết định loài được đưa vào hoặc đưa ra khỏi Danh mục loài nguy cấp, quý, hiếm được ưu tiên bảo vệ\n1. Chính phủ quyết định loài\nđược đưa vào hoặc đưa ra khỏi Danh mục loài nguy cấp, quý hiếm được ưu tiên bảo vệ với các nội dung chính sau đây:\na) Tên loài; \nb) Đặc tính cơ bản của loài;\nc) Chế độ quản lý, bảo vệ đặc thù.\n2. Danh mục loài nguy cấp, quý,\nhiếm được ưu tiên bảo vệ phải được công bố công khai trên phương tiện thông tin\nđại chúng.\n3. Định kỳ 3 năm một lần hoặc khi có nhu cầu, loài thuộc Danh mục loài nguy cấp, quý, hiếm được ưu tiên bảo vệ\nphải được điều tra, đánh giá quần thể để sửa đổi, bổ sung.\nĐiều 41.\nBảo tồn loài thuộc Danh mục loài nguy cấp, quý, hiếm được ưu tiên bảo vệ\n1. Khu vực có loài thuộc Danh mục loài nguy cấp, quý, hiếm được ưu tiên bảo vệ quy định tại điểm a khoản 1\nĐiều 37 của Luật này sinh sống tự nhiên thường xuyên hoặc theo mùa phải được điều tra, đánh giá để lập dự án thành lập khu bảo tồn. \n2. Nhà nước thành lập hoặc giao cho tổ chức, cá nhân thành lập cơ sở bảo tồn đa dạng sinh học\nđể bảo tồn loài thuộc Danh mục loài nguy cấp, quý, hiếm được ưu tiên bảo vệ. \n3. Việc đưa loài thuộc Danh mục loài nguy cấp, quý, hiếm được ưu tiên bảo vệ vào nuôi, trồng tại cơ sở\nbảo tồn đa dạng sinh học và việc thả loài thuộc Danh mục loài nguy cấp,\nquý, hiếm được ưu tiên bảo vệ từ cơ sở cứu hộ vào nơi sinh sống tự nhiên của chúng phải được cơ quan nhà nước có thẩm quyền chấp thuận bằng văn bản.\n4. Chính phủ\nquy định cụ thể thẩm quyền, trình tự, thủ tục đưa loài thuộc Danh mục loài nguy cấp, quý, hiếm được ưu tiên bảo vệ vào cơ sở bảo tồn đa dạng sinh học hoặc thả vào nơi sinh sống tự nhiên của chúng.\nMục 2.\nPHÁT TRIỂN BỀN VỮNG CÁC LOÀI SINH VẬT\nĐiều 42.\nThành lập cơ sở bảo tồn đa dạng sinh học 1. Cơ sở bảo tồn đa dạng sinh học được thành lập nhằm mục đích bảo tồn đa dạng sinh học, nghiên cứu khoa học, du lịch sinh thái, bao gồm:\na) Cơ sở nuôi, trồng loài thuộc Danh mục loài nguy cấp, quý, hiếm được ưu tiên bảo vệ; \nb) Cơ sở cứu hộ loài hoang dã;\nc) Cơ sở lưu giữ giống cây trồng,\nvật nuôi, vi sinh vật và nấm đặc hữu, nguy cấp, quý, hiếm có giá trị đặc biệt về\nkhoa học, y tế, kinh tế, sinh thái, cảnh quan, môi trường hoặc văn hóa - lịch sử;\ncơ sở lưu giữ, bảo quản nguồn gen và mẫu vật di truyền.\n2. Cơ sở có đủ các điều kiện sau\nđây được cấp giấy chứng nhận cơ sở bảo tồn đa dạng sinh học:\na) Diện tích đất, chuồng trại, cơ sở vật chất đáp ứng yêu cầu về nuôi, trồng, nuôi sinh sản loài thuộc Danh mục loài nguy cấp, quý, hiếm được ưu tiên bảo vệ; cứu hộ loài hoang dã; lưu giữ, bảo quản nguồn gen và mẫu vật di truyền; \nb) Cán bộ kỹ thuật có chuyên môn phù hợp;\nc) Năng lực tài chính, quản lý cơ sở bảo tồn đa dạng sinh học.\n3. Hồ sơ đăng ký thành lập cơ sở bảo tồn đa dạng sinh học gồm có:\na) Đơn đăng ký thành lập;\nb) Dự án thành lập;\nc) Giấy tờ chứng minh có đủ\ncác điều kiện quy định tại khoản 2 Điều này.\n4. Ủy ban nhân dân cấp tỉnh cấp giấy chứng nhận cơ sở bảo tồn đa dạng sinh học.\n5. Chính phủ\nquy định cụ thể điều kiện nuôi, trồng loài thuộc Danh mục loài nguy cấp,\nquý, hiếm được ưu tiên bảo vệ, cứu hộ loài hoang dã, lưu giữ giống cây trồng,\nvật nuôi, vi sinh vật và nấm đặc hữu, lưu giữ, bảo quản nguồn gen và mẫu vật di truyền, đăng ký thành lập, cấp, thu hồi giấy chứng nhận cơ sở\nbảo tồn đa dạng sinh học.\nĐiều 43.\nQuyền và nghĩa vụ của tổ chức, cá nhân quản lý cơ sở bảo tồn đa dạng sinh học 1. Tổ chức, cá nhân quản lý\ncơ sở bảo tồn đa dạng sinh học có các quyền sau đây:\na) Hưởng chính sách, cơ chế\nưu đãi, hỗ trợ của Nhà nước theo quy định của pháp luật;\nb) Tiếp nhận, thực hiện dự\nán hỗ trợ từ tổ chức, cá nhân trong nước, tổ chức, cá nhân nước ngoài;\nc) Hưởng các khoản thu từ hoạt\nđộng du lịch và các hoạt động khác của cơ sở bảo tồn đa dạng sinh học theo quy định của pháp luật;\nd) Hợp đồng tiếp cận nguồn gen và chia sẻ lợi ích phát sinh từ nguồn gen do mình quản lý;\nđ) Nuôi, trồng, nuôi sinh sản,\ncứu hộ loài thuộc Danh mục loài nguy cấp, quý, hiếm được ưu tiên bảo vệ; lưu giữ giống cây trồng, vật nuôi, vi sinh vật và nấm đặc hữu; lưu giữ, bảo quản nguồn gen và mẫu vật di truyền;\ne) Trao đổi, tặng cho loài thuộc Danh mục loài nguy cấp, quý, hiếm được ưu tiên bảo vệ phục vụ mục đích bảo tồn\nđa dạng sinh học, nghiên cứu khoa học, du lịch sinh thái theo quy định của pháp luật;\ng) Quyền khác theo quy định của pháp luật.\n2. Tổ chức, cá nhân quản lý\ncơ sở bảo tồn đa dạng sinh học có các nghĩa vụ sau đây:\na) Bảo vệ, nuôi dưỡng, chăm sóc loài thuộc Danh mục loài nguy cấp, quý, hiếm được ưu tiên bảo vệ; lưu giữ, bảo quản nguồn gen và mẫu vật di truyền;\nb) Đăng ký, khai báo nguồn gốc loài thuộc Danh mục loài nguy cấp, quý, hiếm được ưu tiên bảo vệ với cơ quan chuyên môn của Ủy ban nhân dân cấp tỉnh; \nc) Có biện pháp phòng dịch,\nchế độ chăm sóc, chữa bệnh cho các loài tại cơ sở của mình;\nd) Tháng 12 hằng năm báo cáo Ủy ban nhân dân cấp tỉnh về tình trạng loài thuộc Danh mục loài nguy cấp, quý, hiếm được ưu tiên bảo vệ tại cơ sở của mình;\nđ) Đề nghị cơ quan nhà nước có\nthẩm quyền quy định tại khoản 4 Điều 41 của Luật này cho phép đưa loài thuộc Danh mục loài nguy cấp, quý, hiếm được ưu tiên bảo vệ vào nuôi, trồng tại cơ sở bảo tồn đa dạng sinh học của mình hoặc thả loài thuộc Danh mục loài nguy cấp, quý, hiếm được ưu tiên bảo vệ từ cơ sở cứu hộ của mình vào nơi sinh sống tự nhiên của chúng;\ne) Nghĩa vụ khác theo quy định của pháp luật.\nĐiều 44. Loài hoang dã bị cấm khai thác và loài hoang dã được khai thác có điều kiện trong tự nhiên 1. Việc khai thác có điều kiện loài hoang dã trong tự nhiên được thực hiện theo quy định của pháp luật về bảo vệ và phát triển rừng, pháp luật về thuỷ sản và các quy định khác của pháp luật có liên quan.\n2. Bộ Nông nghiệp và Phát triển nông thôn chủ trì phối hợp với Bộ Tài nguyên và Môi trường quy định cụ thể việc bảo vệ loài hoang dã bị cấm khai thác trong tự nhiên và việc khai thác loài hoang dã được khai thác có điều kiện trong tự nhiên; định kỳ công bố Danh mục loài hoang dã bị cấm khai thác trong tự nhiên và Danh mục loài hoang dã được khai thác có điều kiện trong tự\nnhiên. \nĐiều 45.\nNuôi, trồng loài thuộc Danh mục loài nguy cấp, quý, hiếm được ưu tiên bảo vệ\n1. Loài thuộc Danh mục loài nguy cấp, quý, hiếm được ưu tiên bảo vệ được nuôi, trồng tại cơ sở bảo tồn đa dạng sinh học phục vụ mục đích bảo tồn đa dạng sinh học, nghiên cứu khoa học, du lịch sinh thái theo quy định của Luật này. \n2. Việc nuôi sinh sản, nuôi sinh trưởng và trồng, cấy nhân tạo một số\nloài thuộc Danh mục loài nguy cấp, quý, hiếm được ưu tiên bảo vệ tại cơ\nsở nuôi sinh sản, nuôi sinh trưởng và trồng, cấy nhân tạo phục vụ mục đích thương mại được thực hiện theo quy định của pháp luật.\nĐiều 46. Trao đổi, xuất khẩu, nhập khẩu, mua,\nbán, tặng cho, lưu giữ, vận chuyển các loài thuộc Danh mục loài nguy cấp,\nquý, hiếm được ưu tiên bảo vệ và mẫu vật di truyền, sản phẩm của chúng Việc trao đổi, xuất khẩu, nhập khẩu, mua, bán, tặng cho, lưu giữ, vận chuyển loài thuộc Danh mục loài nguy cấp, quý, hiếm được ưu tiên bảo vệ và mẫu vật di truyền của chúng phục vụ mục đích bảo tồn đa dạng sinh học, nghiên cứu khoa học, du lịch sinh thái; việc trao đổi, xuất khẩu, nhập khẩu, mua, bán, tặng cho, vận chuyển một số loài thuộc Danh mục loài nguy cấp, quý, hiếm được ưu tiên bảo vệ và các sản phẩm của chúng phục vụ mục đích thương mại được thực hiện theo quy định cụ thể của Chính phủ.\nĐiều 47. Cứu hộ loài thuộc Danh mục loài nguy cấp, quý, hiếm được ưu tiên bảo vệ\n1. Cá thể loài thuộc Danh mục loài nguy cấp, quý, hiếm được ưu tiên bảo vệ bị mất nơi sinh sống tự nhiên, bị\nlạc, bị thương, bị bệnh phải được đưa vào cơ sở cứu hộ để cứu chữa, nuôi dưỡng,\nchăm sóc và thả lại nơi sinh sống tự nhiên của chúng.\n2. Tổ chức, cá nhân phát hiện cá\nthể loài thuộc Danh mục loài nguy cấp, quý, hiếm được ưu tiên bảo vệ bị mất nơi sinh sống tự nhiên, bị lạc, bị thương hoặc bị bệnh có trách nhiệm báo ngay cho Ủy ban nhân dân cấp xã hoặc cơ sở cứu hộ nơi gần nhất. Sau khi nhận được thông tin, Ủy ban nhân dân cấp xã phải kịp thời báo cáo với cơ quan chuyên môn của Ủy ban nhân dân cấp tỉnh hoặc báo cơ sở cứu hộ nơi gần nhất.\n3. Cá thể loài thuộc Danh mục loài nguy cấp, quý, hiếm được ưu tiên bảo vệ sau khi được cứu hộ trở lại trạng thái bình thường được xem xét thả lại nơi sinh sống tự nhiên của chúng. Trường hợp cá thể loài thuộc Danh mục loài nguy cấp, quý, hiếm được ưu tiên bảo vệ bị mất nơi sinh sống tự nhiên thì\nđược xem xét đưa vào nuôi, trồng tại cơ sở bảo tồn đa dạng sinh học phù hợp.\n4. Chính phủ quy định cụ thể việc cứu hộ loài hoang dã thuộc Danh mục loài nguy cấp, quý, hiếm được ưu tiên bảo vệ.\nĐiều 48. Bảo vệ giống cây trồng, vật nuôi đặc hữu hoặc có giá trị đang bị đe dọa tuyệt chủng 1. Bộ Nông nghiệp và Phát triển nông thôn chủ trì phối hợp với bộ, cơ quan ngang bộ tổ chức điều tra, đánh giá giống cây trồng, vật nuôi đặc hữu hoặc có giá trị đang bị đe doạ\ntuyệt chủng để đưa vào Danh mục loài nguy cấp, quý, hiếm được ưu tiên bảo vệ.\n2. Việc tiếp cận nguồn gen cây trồng, vật nuôi đặc hữu hoặc có giá trị đang bị đe dọa tuyệt chủng được thực hiện theo quy định tại Mục 1 và Mục 2 Chương V của Luật này và các quy định khác của pháp luật có liên quan. \nĐiều 49. Bảo vệ loài vi sinh vật và nấm đặc hữu hoặc có giá trị đang bị đe doạ tuyệt chủng 1. Bộ Nông nghiệp và Phát triển nông thôn chủ trì phối hợp với bộ, cơ quan ngang bộ có liên quan tổ chức điều tra, đánh giá, thu thập, bảo quản loài vi sinh vật và nấm đặc hữu hoặc có\ngiá trị đang bị đe dọa tuyệt chủng để đưa vào Danh mục loài nguy cấp, quý, hiếm\nđược ưu tiên bảo vệ.\n2. Việc tiếp cận nguồn gen loài vi sinh vật và nấm đặc hữu hoặc có giá trị đang bị đe dọa tuyệt chủng được thực hiện theo quy định tại Mục 1 và Mục 2 Chương V của Luật này và các quy định khác của pháp luật có liên quan.\nMục 3. KIỂM SOÁT LOÀI NGOẠI LAI XÂM HẠI\nĐiều 50. Điều tra và lập Danh mục loài ngoại lai xâm hại 1. Loài ngoại lai xâm hại bao gồm loài ngoại lai xâm hại đã biết và loài ngoại lai có nguy cơ xâm hại.\n2. Ủy ban nhân dân cấp tỉnh tổ\nchức điều tra để lập Danh mục loài ngoại lai xâm hại trên địa bàn và báo cáo Bộ Tài nguyên và Môi trường, Bộ Nông nghiệp và Phát triển nông thôn.\n3. Bộ Tài nguyên và Môi trường chủ trì phối hợp với Bộ Nông nghiệp và Phát triển nông thôn, bộ, cơ quan ngang bộ khác, Ủy ban nhân dân cấp tỉnh tổ chức điều tra, xác\nđịnh loài ngoại lai xâm hại, thẩm định và ban hành Danh mục loài ngoại lai xâm hại.\nĐiều 51. Kiểm soát việc nhập khẩu loài ngoại lai xâm hại, sự xâm nhập từ bên ngoài của loài ngoại lai 1. Cơ quan hải quan chủ trì phối hợp với các cơ quan có thẩm quyền tại cửa khẩu kiểm tra, phát hiện và xử lý vi phạm trong việc nhập khẩu loài thuộc Danh mục loài ngoại lai xâm hại.\n2. Ủy ban nhân dân cấp tỉnh phối hợp với các cơ quan có thẩm quyền tổ chức kiểm tra, đánh giá khả năng xâm nhập của loài ngoại lai từ bên ngoài để có biện pháp phòng ngừa, kiểm soát loài ngoại lai xâm hại.\nĐiều 52. Kiểm soát việc nuôi trồng loài ngoại lai có nguy cơ xâm hại 1. Việc nuôi trồng loài ngoại lai có nguy cơ xâm hại chỉ được tiến hành sau khi có kết quả khảo nghiệm loài ngoại lai đó không có nguy cơ xâm hại đối với đa dạng sinh học và được Ủy ban nhân dân cấp tỉnh cấp phép.\n2. Việc nuôi trồng, phát triển loài ngoại lai trong khu bảo tồn chỉ được tiến hành sau khi có kết quả\nkhảo nghiệm loài ngoại lai đó không có nguy cơ xâm hại đối với đa dạng sinh học của khu bảo tồn và phải được Ủy ban nhân dân cấp tỉnh cấp phép. \n3. Bộ Tài nguyên và Môi trường chủ trì phối hợp với Bộ Nông nghiệp và Phát triển nông thôn, bộ, cơ quan ngang bộ có liên quan quy định việc khảo nghiệm và việc cấp phép nuôi trồng, phát triển loài ngoại lai.\nĐiều 53. Kiểm soát sự lây lan, phát triển của loài ngoại lai xâm hại 1. Nhà nước đầu tư, khuyến khích tổ chức, cá nhân đầu tư thực hiện các chương trình cô lập và diệt trừ loài thuộc Danh mục loài ngoại lai xâm hại. \n2. Ủy ban nhân dân cấp tỉnh tổ\nchức điều tra, xác định khu vực phân bố, lập kế hoạch cô lập và diệt trừ loài thuộc Danh mục loài ngoại lai xâm hại tại địa phương.\n3. Tổ chức, cá nhân phát hiện loài ngoại lai xâm hại phải thông báo ngay với Ủy ban nhân dân cấp xã nơi gần nhất. Sau khi nhận được thông báo, Ủy ban nhân dân cấp xã phải kịp thời báo cáo với cơ quan cấp trên trực tiếp hoặc cơ quan chuyên môn của Ủy ban nhân dân cấp tỉnh để có biện pháp kiểm soát.\nĐiều 54.\nCông khai thông tin về loài ngoại lai xâm hại 1. Bộ Tài nguyên và Môi trường,\nBộ Nông nghiệp và Phát triển nông thôn, Ủy ban nhân dân cấp tỉnh có trách nhiệm công khai Danh mục loài ngoại lai xâm hại, thông tin về khu vực phân bố, mức\nđộ xâm hại của loài ngoại lai xâm hại trên trang thông tin điện tử của mình. \n2. Cơ quan hải quan và các cơ\nquan có thẩm quyền tại cửa khẩu có trách nhiệm niêm yết Danh mục loài ngoại lai xâm hại tại cửa khẩu.\n3. Các cơ quan thông tin đại chúng có trách nhiệm đưa tin, tuyên truyền về loài ngoại lai xâm hại và biện pháp kiểm soát, cô lập, diệt trừ loài ngoại lai xâm hại.\nCHƯƠNG V BẢO TỒN VÀ PHÁT TRIỂN BỀN VỮNG TÀI NGUYÊN DI TRUYỀN Mục 1. QUẢN LÝ, TIẾP CẬN NGUỒN GEN VÀ CHIA SẺLỢI ÍCH TỪ NGUỒN GEN\nĐiều 55.\nQuản lý nguồn gen 1. Nhà nước thống nhất quản lý toàn bộ nguồn gen trên lãnh thổ Việt Nam.\n2. Nhà nước giao cho tổ chức,\ncá nhân quản lý nguồn gen theo quy định sau đây:\na) Ban quản lý khu bảo tồn, tổ\nchức được giao quản lý khu bảo tồn quản lý nguồn gen trong khu bảo tồn;\nb) Chủ cơ sở bảo tồn đa dạng sinh học, cơ sở nghiên cứu khoa học và phát triển công nghệ, cơ sở\nlưu giữ, bảo quản nguồn gen quản lý nguồn gen thuộc cơ sở của mình; \nc) Tổ chức, hộ gia đình, cá\nnhân được giao quản lý, sử dụng đất, rừng, mặt nước quản lý nguồn gen thuộc phạm vi được giao quản lý, sử dụng;\nd) Ủy ban nhân dân cấp xã\nquản lý nguồn gen trên địa bàn, trừ trường hợp quy định tại các\nđiểm a, b và c khoản này. \nĐiều 56.\nQuyền và nghĩa vụ của tổ chức, hộ gia đình, cá nhân được giao quản lý\nnguồn gen 1. Tổ chức, cá nhân được giao quản lý nguồn gen có các quyền sau đây:\na) Điều tra, thu thập nguồn gen được giao quản lý;\nb) Trao đổi, chuyển giao, cung cấp nguồn gen được giao quản lý cho tổ chức, cá nhân khác theo quy định của pháp luật;\nc) Hưởng lợi ích do tổ chức,\ncá nhân tiếp cận nguồn gen chia sẻ theo quy định tại Điều 58 và Điều 61 của Luật này.\n2. Tổ chức, cá nhân được giao quản lý nguồn gen có các nghĩa vụ sau đây:\na) Thông báo với cơ quan quản lý\nnhà nước có thẩm quyền về hoạt động trao đổi, chuyển giao, cung cấp nguồn gen cho tổ chức, cá nhân khác để sử dụng cho mục đích nghiên cứu phát triển và sản xuất sản phẩm thương mại;\nb) Hợp đồng tiếp cận nguồn gen và chia sẻ lợi ích với tổ chức, cá nhân được cấp giấy phép tiếp cận nguồn gen quy định tại Điều 59 của Luật này;\nc) Kiểm soát việc điều tra,\nthu thập nguồn gen của tổ chức, cá nhân được cấp giấy phép tiếp cận nguồn gen;\nd) Chịu trách nhiệm trước pháp luật và cơ quan quản lý nhà nước có thẩm quyền về việc quản lý nguồn gen.\nĐiều 57.\nTrình tự, thủ tục tiếp cận nguồn gen Trình tự, thủ tục tiếp cận nguồn gen được quy định như sau:\n1. Đăng ký\ntiếp cận nguồn gen; \n2. Hợp đồng bằng văn bản với tổ chức, hộ gia đình, cá nhân được giao quản lý nguồn gen về việc tiếp cận nguồn gen và chia sẻ lợi ích theo quy định tại Điều 58 và Điều 61 của Luật này;\n3. Đề nghị cấp giấy phép tiếp cận nguồn gen theo quy định tại Điều 59 của Luật này.\n4. Chính phủ quy định cụ thể\ntrình tự, thủ tục tiếp cận nguồn gen.\nĐiều 58. Hợp\nđồng tiếp cận nguồn gen và chia sẻ lợi ích 1. Sau khi đăng ký, tổ chức,\ncá nhân có nhu cầu tiếp cận nguồn gen phải hợp đồng bằng văn bản với tổ chức,\nhộ gia đình, cá nhân được giao quản lý nguồn gen về việc tiếp cận nguồn gen và chia sẻ lợi ích.\n2. Hợp đồng tiếp cận nguồn gen và chia sẻ lợi ích phải có xác nhận của Ủy ban nhân dân cấp xã nơi thực hiện việc tiếp cận nguồn gen.\n3. Hợp đồng tiếp cận nguồn gen và chia sẻ lợi ích phải có các nội dung chủ yếu sau đây:\na) Mục đích tiếp cận nguồn gen; \nb) Nguồn gen được tiếp cận và khối lượng thu thập;\nc) Địa điểm tiếp cận nguồn gen;\nd) Kế hoạch tiếp cận nguồn gen;\nđ) Việc chuyển giao cho bên thứ ba kết quả điều tra, thu thập nguồn gen;\ne) Hoạt động nghiên cứu phát triển và sản xuất sản phẩm thương mại từ nguồn gen;\ng) Các bên tham gia nghiên cứu phát triển và sản xuất sản phẩm thương mại từ nguồn gen;\nh) Địa điểm tiến hành nghiên cứu phát triển và sản xuất sản phẩm thương mại từ nguồn gen;\ni) Chia sẻ lợi ích thu được với Nhà nước và các bên có liên quan, bao gồm cả việc phân chia quyền sở\nhữu trí tuệ đối với kết quả sáng tạo trên cơ sở tiếp cận nguồn gen và bản quyền tri thức truyền thống về nguồn gen.\n4. Hợp đồng tiếp cận nguồn gen và chia sẻ lợi ích phải được gửi Ủy ban nhân dân cấp xã nơi thực hiện việc tiếp cận nguồn gen và cơ quan nhà nước có thẩm quyền cấp giấy phép tiếp cận nguồn gen theo quy định tại Điều 59 của Luật này.\n5. Tranh chấp, khiếu nại liên quan đến việc tiếp cận nguồn gen và chia sẻ lợi ích được giải quyết theo quy\nđịnh của pháp luật Việt Nam và điều ước quốc tế mà Cộng hoà xã hội chủ\nnghĩa Việt Nam là thành viên.\nĐiều 59.\nGiấy phép tiếp cận nguồn gen 1. Các điều kiện để tổ chức,\ncá nhân được cấp giấy phép tiếp cận nguồn gen bao gồm:\na) Đăng ký với cơ quan quản lý nhà nước có thẩm quyền;\nb) Đã ký hợp đồng tiếp cận nguồn gen và chia sẻ lợi ích với tổ chức, hộ gia đình, cá nhân được giao quản lý\nnguồn gen;\nc) Việc tiếp cận nguồn gen không thuộc một trong các trường hợp quy định tại khoản 4 Điều này.\n2. Hồ sơ đề nghị cấp giấy phép tiếp cận nguồn gen gồm có:\na) Đơn đề nghị tiếp cận nguồn gen;\nb) Bản sao hợp đồng tiếp cận nguồn gen và chia sẻ lợi ích với tổ chức, hộ gia đình, cá nhân được giao quản lý nguồn gen.\n3. Giấy phép tiếp cận nguồn gen phải có các nội dung chủ yếu sau đây:\na) Mục đích sử dụng nguồn gen;\nb) Nguồn gen được tiếp cận và khối lượng thu thập;\nc) Địa điểm tiếp cận nguồn gen; \nd) Các hoạt động được thực hiện liên quan đến nguồn gen;\nđ) Định kỳ báo cáo kết quả nghiên cứu phát triển, sản xuất sản phẩm thương mại liên quan đến nguồn gen được tiếp cận.\n4. Các trường hợp không cấp giấy phép tiếp cận nguồn gen gồm có:\na) Nguồn gen của loài thuộc Danh mục loài nguy cấp, quý, hiếm được\nưu tiên bảo vệ, trừ trường hợp được cơ quan nhà nước có thẩm quyền cho phép; \nb) Việc sử dụng nguồn gen có\nnguy cơ gây hại đối với con người, môi trường,\nan ninh, quốc phòng và lợi ích quốc gia.\n5. Trường hợp vì lợi ích quốc gia, lợi ích cộng đồng, cơ quan quản lý nhà nước có thẩm quyền cấp giấy phép tiếp cận nguồn gen có quyền cấp phép tiếp cận nguồn gen mà không cần phải có sự đồng ý của tổ chức, hộ gia đình, cá nhân được giao quản lý nguồn gen. \n6. Chính phủ\nquy định cụ thể thẩm quyền, trình tự, thủ tục cấp giấy phép tiếp cận nguồn gen.\nĐiều 60.\nQuyền và nghĩa vụ của tổ chức, cá nhân được cấp giấy phép tiếp cận nguồn gen 1. Tổ chức, cá nhân được cấp giấy phép tiếp cận nguồn gen có các quyền sau đây:\na) Điều tra, thu thập nguồn gen và các hoạt động khác theo quy định của giấy phép tiếp cận nguồn gen;\nb) Đưa nguồn gen không thuộc Danh mục nguồn gen bị cấm xuất khẩu ra khỏi lãnh thổ Việt Nam theo quy định của pháp luật;\nc) Kinh doanh sản phẩm sản xuất từ nguồn gen được phép tiếp cận;\nd) Quyền khác theo quy định của giấy phép tiếp cận nguồn gen, hợp đồng tiếp cận nguồn gen và chia sẻ lợi\ních.\n2. Tổ chức, cá nhân được cấp giấy phép tiếp cận nguồn gen có các nghĩa vụ sau đây:\na) Tuân thủ các quy định của giấy phép tiếp cận nguồn gen; \nb) Báo cáo bằng văn bản với cơ quan có thẩm quyền cấp giấy phép tiếp cận nguồn gen về kết quả nghiên cứu phát triển, sản xuất sản phẩm thương mại theo thời hạn quy định trong giấy phép tiếp cận nguồn gen;\nc) Chia sẻ lợi ích thu được với các bên liên quan, bao gồm cả việc phân chia quyền sở hữu trí tuệ\nđối với kết quả sáng tạo trên cơ sở tiếp cận nguồn gen và bản quyền tri thức truyền thống về nguồn gen;\nd) Nghĩa vụ khác theo quy định của giấy phép tiếp cận nguồn gen, hợp đồng tiếp cận nguồn gen và chia sẻ lợi\ních.\nĐiều 61.\nChia sẻ lợi ích từ việc tiếp cận nguồn gen 1. Lợi ích thu được từ việc tiếp cận nguồn gen phải được chia sẻ cho các bên sau đây:\na) Nhà nước;\nb) Tổ chức, hộ gia đình, cá\nnhân được giao quản lý nguồn gen;\nc) Tổ chức, cá nhân được cấp giấy phép tiếp cận nguồn gen và các bên có liên quan khác được quy định trong giấy phép tiếp cận nguồn gen.\n2. Lợi ích thu được từ việc tiếp cận nguồn gen phải được chia sẻ trên cơ sở hợp đồng tiếp cận nguồn gen và chia sẻ lợi ích, các quy định khác của pháp luật có liên quan.\n3. Chính phủ quy định cụ\nthể việc quản lý, chia sẻ lợi ích thu được từ việc tiếp cận nguồn gen.\nMục 2. LƯU GIỮ, BẢO QUẢN MẪU VẬT DI TRUYỀN; ĐÁNH GIÁ NGUỒN GEN; QUẢN LÝ THÔNG TIN VỀ\nNGUỒN GEN; BẢN QUYỀN TRI THỨC TRUYỀN THỐNG VỀ NGUỒN GEN\nĐiều 62.\nLưu giữ và bảo quản mẫu vật di truyền 1. Bộ, cơ quan ngang bộ trong phạm vi nhiệm vụ, quyền hạn của mình tổ chức việc lưu giữ và bảo quản lâu dài mẫu vật di truyền của loài thuộc Danh mục loài nguy cấp, quý, hiếm được ưu tiên bảo vệ, loài nhập khẩu phục vụ công tác nghiên cứu, nhân giống, lai tạo giống, ứng dụng và phát triển nguồn gen.\n2. Tổ chức, cá nhân phát hiện,\nlưu giữ mẫu vật di truyền của loài thuộc Danh mục loài nguy cấp, quý, hiếm\nđược ưu tiên bảo vệ đã bị tuyệt chủng trong tự nhiên có trách nhiệm báo cho Ủy ban nhân dân cấp xã. Sau khi nhận được thông tin, Ủy ban nhân dân cấp xã\ncó trách nhiệm báo cáo ngay với cơ quan chuyên môn về tài nguyên và môi trường của Ủy ban nhân dân cấp tỉnh để có biện pháp xử lý.\n3. Nhà nước khuyến khích tổ\nchức, cá nhân đầu tư lưu giữ và bảo quản lâu dài mẫu vật di truyền\nđể hình thành ngân hàng gen phục vụ\ncông tác bảo tồn đa dạng sinh học và phát triển kinh tế - xã hội.\nĐiều 63. Điều tra, thu thập, đánh giá, cung cấp, quản lý thông tin về nguồn gen 1. Bộ, cơ quan ngang bộ tổ chức thực hiện chương trình điều tra, thu thập, đánh giá và xây dựng cơ sở dữ liệu về nguồn gen thuộc phạm vi quản lý và cung cấp thông tin về cơ sở dữ liệu về nguồn gen cho Bộ Tài nguyên và Môi trường. \nBộ Tài nguyên và Môi trường thống nhất quản lý cơ sở dữ liệu quốc gia về nguồn gen.\n2. Nhà nước khuyến khích tổ\nchức, cá nhân thực hiện điều tra, thu thập, đánh giá, cung cấp thông tin về nguồn gen để xây dựng cơ sở dữ liệu về nguồn gen và bảo đảm quyền được tiếp cận cơ sở dữ liệu về nguồn gen. \n3. Chính phủ\nquy định cụ thể việc cung cấp thông tin về nguồn gen.\nĐiều 64. Bản quyền tri thức truyền thống về nguồn gen 1. Nhà nước bảo hộ bản quyền tri thức truyền thống về nguồn gen, khuyến khích và hỗ trợ tổ chức, cá\nnhân đăng ký bản quyền tri thức truyền thống về nguồn gen.\n2. Bộ Khoa học và Công nghệ chủ trì phối hợp với bộ, cơ quan ngang bộ có\nliên quan hướng dẫn thủ tục đăng ký bản quyền tri thức truyền thống về nguồn gen. \nMục 3. QUẢN LÝ RỦI RO DO SINH VẬT BIẾN ĐỔI GEN, MẪU VẬT DI TRUYỀN CỦA SINH VẬT BIẾN ĐỔI GEN GÂY RA ĐỐI VỚI ĐA DẠNG SINH HỌC\nĐiều 65.\nTrách nhiệm quản lý rủi ro do sinh vật biến đổi gen, mẫu vật di truyền của sinh vật biến đổi gen gây ra đối với đa dạng sinh học 1. Trách nhiệm quản lý rủi ro do sinh vật biến đổi gen, mẫu vật di truyền của sinh vật biến đổi gen gây ra đối với\nđa dạng sinh học được quy định như sau:\na) Tổ chức, cá nhân nghiên cứu tạo ra sinh vật biến đổi gen, mẫu vật di truyền của sinh vật biến đổi gen phải\nđăng ký với Bộ Khoa học và Công nghệ và phải có các điều kiện về cơ sở vật chất\n- kỹ thuật, công nghệ và cán bộ chuyên môn theo quy định của Bộ Khoa học và\nCông nghệ; \nb) Tổ chức, cá nhân nhập khẩu sinh vật biến đổi gen, mẫu vật di truyền của sinh vật biến đổi gen phải được cơ\nquan nhà nước có thẩm quyền cho phép; \nc) Tổ chức, cá nhân nghiên cứu,\nnhập khẩu, mua, bán, phóng thích sinh vật biến đổi gen, mẫu vật di truyền của sinh vật biến đổi gen phải công khai thông tin về mức độ rủi ro và các biện pháp quản lý rủi ro theo quy định tại Điều 67 của Luật này.\n2. Chính phủ quy định cụ thể\ntrách nhiệm của bộ, cơ quan ngang bộ và tổ chức, cá nhân trong việc quản lý rủi ro do sinh vật biến đổi gen, mẫu vật di truyền của sinh vật biến đổi gen gây ra đối với đa dạng sinh học.\nĐiều 66.\nLập, thẩm định báo cáo đánh giá rủi ro do sinh vật biến đổi gen,\nmẫu vật di truyền của sinh vật biến đổi gen gây ra đối với đa dạng sinh học; cấp giấy chứng nhận an toàn của sinh vật biển đổi gen, mẫu vật di truyền của sinh vật biển đổi gen đối với đa dạng sinh học 1. Tổ chức, cá nhân nghiên cứu tạo ra, nhập khẩu, phóng thích sinh vật biến đổi gen, mẫu vật di truyền của sinh vật biến đổi gen phải lập báo cáo đánh giá rủi ro do sinh vật biến đổi gen gây ra đối với đa dạng sinh học.\n2. Báo cáo đánh giá rủi ro do sinh vật biến đổi gen, mẫu vật di truyền của sinh vật biến đổi gen gây ra đối với đa dạng sinh học phải có các nội dung chủ yếu sau đây:\na) Mô tả biện pháp đánh giá\nrủi ro;\nb) Mức độ rủi ro đối với đa dạng sinh học;\nc) Biện pháp quản lý rủi ro.\n3. Báo cáo đánh giá rủi ro do sinh vật biến đổi gen, mẫu vật di truyền của sinh vật biến đổi gen gây ra đối với đa dạng sinh học phải được cơ quan quản lý nhà nước có\nthẩm quyền thẩm định.\n4. Chính phủ quy định cụ\nthể việc lập, thẩm định báo cáo đánh giá rủi ro do sinh vật biến\nđổi gen, mẫu vật di truyền của sinh vật biến đổi gen gây ra đối với\nđa dạng sinh học và việc cấp giấy chứng nhận an toàn của sinh vật biến đổi gen, mẫu vật di truyền của sinh vật biến đổi gen đối với đa dạng sinh học.\nĐiều 67.\nCông khai thông tin về mức độ rủi ro và biện pháp quản lý rủi ro do sinh vật biến đổi gen, mẫu vật di truyền của sinh vật biến đổi gen gây ra đối với đa dạng sinh học 1. Tổ chức, cá nhân nghiên cứu tạo ra, nhập khẩu, mua, bán, phóng thích sinh vật biến đổi gen,\nmẫu vật di truyền của sinh vật biến đổi gen phải công khai thông tin về mức độ rủi ro và biện pháp quản lý rủi ro đối với đa dạng sinh học.\n2. Chính phủ quy định cụ thể\nviệc công khai thông tin và biện pháp quản lý rủi ro.\nĐiều 68.\nQuản lý cơ sở dữ liệu về sinh vật biến đổi gen, mẫu vật di truyền của sinh vật biến đổi gen liên quan đến đa dạng sinh học 1. Bộ Tài nguyên và Môi trường thống nhất quản lý cơ sở dữ liệu về sinh vật biến đổi gen, mẫu vật di truyền của sinh vật biến đổi gen liên quan đến đa dạng sinh học; xây dựng trang thông tin điện tử về sinh vật biến đổi gen,\nmẫu vật di truyền của sinh vật biến đổi gen liên quan đến đa dạng sinh học. \n2. Tổ chức, cá nhân nghiên cứu tạo ra, nhập khẩu, mua, bán, phóng thích sinh vật biến đổi gen,\nmẫu vật di truyền của sinh vật biến đổi gen liên quan đến đa dạng sinh học phải cung cấp thông tin cho Bộ Tài nguyên và Môi trường. \n3. Tổ chức, cá nhân nghiên cứu tạo ra, phóng thích sinh vật biến đổi gen, mẫu vật di truyền của sinh vật biến đổi gen liên quan đến đa dạng sinh học phải cung cấp thông tin cho Ủy ban nhân dân cấp tỉnh nơi nghiên cứu tạo ra, phóng thích sinh vật biến đổi gen, mẫu vật di truyền của sinh vật biến đổi gen. \n4. Tổ chức, cá nhân cung cấp thông tin về sinh vật biến đổi gen, mẫu vật di truyền của sinh vật biến đổi gen liên quan đến đa dạng sinh học phải chịu trách nhiệm về\ntính chính xác của thông tin do mình cung cấp.\nCHƯƠNG VI HỢP TÁC QUỐC TẾ VỀ ĐA DẠNG SINH HỌC\nĐiều 69. Hợp tác quốc tế và việc thực hiện điều ước quốc tế về đa dạng sinh học 1. Nhà nước Cộng hoà xã hội chủ\nnghĩa Việt Nam cam kết thực hiện điều ước quốc tế về đa dạng sinh học mà Cộng hòa xã hội chủ nghĩa Việt Nam là thành viên và mở rộng hợp tác về bảo tồn và phát triển bền vững đa dạng sinh học với các nước, vùng lãnh thổ, tổ chức, cá nhân nước ngoài.\n2. Hợp tác quốc tế về bảo tồn và\nphát triển bền vững đa dạng sinh học được thực hiện trên nguyên tắc bình đẳng,\ncác bên cùng có lợi, không can thiệp vào công việc nội bộ của nhau, vì mục\nđích bảo tồn và phát triển bền vững đa dạng sinh học, bảo đảm cân bằng sinh thái ở Việt Nam và trên trái đất.\n3. Bộ Tài nguyên và Môi trường chủ trì phối hợp với bộ, cơ quan ngang bộ có liên quan nghiên cứu, đề\nxuất việc đàm phán, ký, gia nhập điều ước quốc tế về đa dạng sinh học.\n4. Nhà nước khuyến khích, tạo điều kiện cho tổ chức, cá nhân Việt Nam, người Việt Nam định cư ở nước ngoài, tổ chức,\ncá nhân nước ngoài thực hiện các chương trình, dự án hợp tác quốc tế về đa dạng sinh học.\nĐiều 70. Hợp tác với các nước có chung biên giới với Việt Nam Nhà nước ưu tiên hợp tác với các nước có chung biên giới với Việt Nam bằng các hoạt động sau đây:\n1. Trao đổi thông tin, dự báo tình hình, biến động về đa dạng sinh học; \n2. Phối hợp quản lý hành lang đa dạng sinh học, tuyến di cư xuyên biên giới của các loài; bảo vệ các loài di cư;\n3. Tham gia các chương trình bảo tồn và phát triển bền vững đa dạng sinh học, các chương trình, dự án bảo vệ các loài di cư và bảo vệ hành lang đa dạng sinh học.\nCHƯƠNG VII CƠ CHẾ, NGUỒN LỰC BẢO TỒN VÀ PHÁT TRIỂN BỀN VỮNG ĐA DẠNG SINH HỌC\nĐiều 71.\nĐiều tra cơ bản, nghiên cứu khoa học, quản lý thông tin, số liệu về đa dạng sinh học 1. Nhà nước đầu tư cho việc điều tra cơ bản hệ sinh thái tự nhiên, loài hoang dã, giống cấy trồng, giống vật nuôi, vi sinh vật và nấm, nguồn gen có giá trị phục vụ công tác bảo tồn và phát triển bền vững đa dạng sinh học.\n2. Nhà nước đầu tư và khuyến khích tổ chức, cá nhân đầu tư nghiên cứu khoa học phục vụ công tác bảo tồn,\nphát triển bền vững đa dạng sinh học và phát triển kinh tế - xã hội.\n3. Thông tin, số liệu điều tra cơ bản, kết quả nghiên cứu khoa học về đa dạng sinh học phải được thu thập và quản lý thống nhất trong Cơ sở dữ liệu về đa dạng sinh học quốc gia.\n4. Tổ chức, cá nhân có hoạt\nđộng liên quan đến đa dạng sinh học có trách nhiệm cung cấp thông tin,\nsố liệu điều tra cơ bản, kết quả nghiên cứu khoa học theo yêu cầu của Bộ\nTài nguyên và Môi trường và được chia sẻ thông tin về đa dạng sinh học theo quy định của pháp luật.\n5. Bộ Tài nguyên và Môi trường quy định cụ thể về hoạt động điều tra cơ bản, việc cung cấp, trao đổi và\nquản lý thông tin về đa dạng sinh học; thống nhất quản lý Cơ sở dữ liệu về đa dạng sinh học quốc gia.\nĐiều 72.\nBáo cáo về đa dạng sinh học 1. Báo cáo về đa dạng sinh học là một phần của Báo cáo môi trường quốc gia.\n2. Báo cáo về đa dạng sinh học phải có các nội dung chủ yếu sau đây:\na) Hiện trạng và diễn biến của các hệ sinh thái tự nhiên chủ yếu;\nb) Hiện trạng, vùng phân bố, số\nlượng cá thể ước tính, đặc điểm của loài thuộc Danh mục loài nguy cấp, quý, hiếm\nđược ưu tiên bảo vệ, sinh vật biến đổi gen và loài ngoại lai xâm hại;\nc) Thực trạng bảo tồn đa dạng sinh học; áp lực, thách thức đối với đa dạng sinh học;\nd) Yêu cầu đặt ra đối với đa dạng sinh học;\nđ) Đánh giá lợi ích của bảo tồn và phát triển bền vững đa dạng sinh học đối với phát triển kinh tế - xã hội;\ne) Giải pháp và kế hoạch bảo tồn\nđa dạng sinh học.\n3. Bộ Tài nguyên và Môi trường chủ trì phối hợp với bộ, cơ quan ngang bộ có liên quan xây dựng báo cáo về đa dạng sinh học. \nĐiều 73.\nTài chính cho việc bảo tồn và phát triển bền vững đa dạng sinh học 1. Kinh phí cho việc bảo tồn và\nphát triển bền vững đa dạng sinh học được hình thành từ các nguồn sau đây:\na) Ngân sách nhà nước;\nb) Đầu tư, đóng góp của tổ\nchức, cá nhân trong nước, tổ chức, cá nhân nước ngoài;\nc) Thu từ dịch vụ môi trường liên quan đến đa dạng sinh học và các nguồn khác theo quy định của pháp luật. \n2. Chi đầu tư phát triển từ\nngân sách nhà nước cho việc bảo tồn và phát triển bền vững đa dạng sinh học được sử dụng cho các mục đích sau đây:\na) Điều tra cơ bản về đa dạng sinh học; \nb) Phục hồi các hệ sinh thái tự\nnhiên; \nc) Bảo tồn loài thuộc Danh mục loài nguy cấp, quý, hiếm được ưu tiên bảo vệ;\nd) Đầu tư xây dựng, nâng cấp, cải tạo cơ sở bảo tồn đa dạng sinh học của Nhà nước;\nđ) Thực hiện các chương trình kiểm soát, cô lập, diệt trừ các loài ngoại lai xâm hại;\ne) Đầu tư khác liên quan đến việc bảo tồn và phát triển bền vững đa dạng sinh học theo quy định của pháp luật.\n3. Chi thường xuyên từ ngân sách nhà nước cho bảo tồn và phát triển bền vững đa dạng sinh học được sử dụng cho các mục đích sau đây:\na) Quan trắc, thống kê, quản lý thông tin, dữ liệu về đa dạng sinh học; xây dựng cơ sở dữ liệu về đa dạng sinh học;\nb) Tổ chức xây dựng báo cáo hiện trạng đa dạng sinh học, báo cáo hiện trạng khu bảo tồn; lập, thẩm định quy hoạch bảo tồn đa dạng sinh học, chương trình, dự án bảo tồn đa dạng sinh học; \nc) Lập, thẩm định Danh mục loài nguy cấp, quý, hiếm được ưu tiên bảo vệ,\nDanh mục loài ngoại lai xâm hại, Danh mục loài hoang dã bị cấm khai thác trong tự nhiên, Danh mục loài hoang dã được khai thác có điều kiện ngoài tự\nnhiên, Danh mục nguồn gen bị cấm xuất khẩu; điều tra, đánh giá quần thể để sửa\nđổi, bổ sung Danh mục loài nguy cấp, quý, hiếm được ưu tiên bảo vệ;\nd) Quản lý khu bảo tồn, cơ sở\nbảo tồn đa dạng sinh học của Nhà nước;\nđ) Xây dựng và thử nghiệm mô\nhình bảo tồn và phát triển bền vững đa dạng sinh học;\ne) Tuyên truyền, giáo dục pháp luật, nâng cao ý thức về bảo tồn và phát triển bền vững đa dạng sinh học;\ng) Đào tạo, bồi dưỡng nâng cao trình độ chuyên môn nghiệp vụ về đa dạng sinh học;\nh) Hợp tác quốc tế về bảo tồn và phát triển bền vững đa dạng sinh học.\nĐiều 74. Dịch vụ môi trường liên quan đến đa dạng sinh học 1. Tổ chức, cá nhân sử dụng dịch vụ môi trường liên quan đến đa dạng sinh học có trách nhiệm trả tiền cho tổ chức,\ncá nhân cung cấp dịch vụ. \n2. Chính phủ quy định cụ thể về\ndịch vụ môi trường liên quan đến đa dạng sinh học. \nĐiều 75. Bồi thường thiệt hại về đa dạng sinh học 1. Tổ chức, cá nhân xâm hại khu bảo tồn, cơ sở bảo tồn đa dạng sinh học, giống cây trồng, vật nuôi, vi sinh vật và nấm đặc hữu, có giá trị, loài thuộc Danh mục loài nguy cấp, quý,\nhiếm được ưu tiên bảo vệ, hành lang đa dạng sinh học thì phải bồi thường thiệt hại theo quy định của pháp luật. \n2. Việc bồi thường thiệt hại do\nô nhiễm, suy thoái môi trường gây ra đối với đa dạng sinh học được thực hiện theo quy định của pháp luật.\n3. Tiền bồi thường thiệt hại về\nđa dạng sinh học cho Nhà nước được đầu tư cho hoạt động bảo tồn và phát triển bền vững đa dạng sinh học theo quy định của Luật này và các quy định khác của pháp luật có liên quan.\nCHƯƠNG VIII\nĐIỀU KHOẢN THI HÀNH\nĐiều 76.\nQuy định chuyển tiếp 1. Các vườn quốc gia, khu dự trữ\nthiên nhiên, khu bảo tồn loài - sinh cảnh, khu bảo vệ cảnh quan, khu bảo tồn biển,\nkhu bảo tồn vùng nước nội địa, khu dự trữ tài nguyên thiên nhiên thủy sinh đã\nthành lập theo quy định của Luật bảo vệ và phát triển rừng, Luật thủy sản trước khi Luật này có hiệu lực nếu đáp ứng các tiêu chí xác lập khu bảo tồn theo quy\nđịnh của Luật này thì không phải ra quyết định thành lập lại. \n2. Các loại giấy phép, giấy chứng nhận đã cấp cho các cơ sở bảo tồn đa dạng sinh học, cơ sở nuôi sinh sản, nuôi sinh trưởng, trồng cấy nhân tạo các loài động vật, thực vật hoang dã nguy cấp, quý, hiếm trước khi Luật này có hiệu lực nếu phù hợp với quy định của Luật này thì vẫn có giá trị thi hành.\nĐiều 77. Hiệu lực thi hành Luật này có hiệu lực thi hành từ\nngày 01 tháng 7 năm 2009.\nĐiều 78.\nQuy định chi tiết và hướng dẫn thi hành Chính phủ quy định chi tiết và\nhướng dẫn thi hành các điều, khoản được giao trong Luật; hướng dẫn những nội dung cần thiết khác của Luật này để đáp ứng yêu cầu quản lý nhà nước.\nLuật này đã được Quốc hội nước Cộng hoà xã hội chủ nghĩa Việt Nam khoá XII, kỳ họp thứ 4 thông qua ngày 13 tháng 11 năm 2008.\nCHỦ\n TỊCH QUỐC HỘI Nguyễn Phú Trọng"
}