{
  "url": "https://thuvienphapluat.vn/van-ban/Thue-Phi-Le-Phi/Luat-Thue-Tieu-thu-dac-biet-1993-sua-doi-21-L-CTN-38477.aspx",
  "title": "Luật Thuế Tiêu thụ đặc biệt 1993 sửa đổi 21-L/CTN",
  "properties": {
    "Số hiệu": "21-L/CTN",
    "Loại văn bản": "Luật",
    "Nơi ban hành": "Quốc hội",
    "Người ký": "Lê Đức Anh",
    "Ngày ban hành": "05/07/1993",
    "Ngày hiệu lực": "Đã biết",
    "Ngày công báo": "Đã biết",
    "Số công báo": "Đã biết",
    "Tình trạng": "Đã biết"
  },
  "content": "QUỐC HỘI\n ********\nCỘNG HOÀ XÃ HỘI CHỦ NGHĨA VIỆT NAM\n Độc lập - Tự do - Hạnh phúc\n ********\nSố: 21-L/CTN Hà Nội, ngày 05 tháng 7 năm 1993 LUẬT SỐ\n21-L/CTN NGÀY 05/07/1993 CỦA QUỐC HỘI SỬA ĐỔI, BỔ SUNG MỘT SỐ ĐIỀU CỦA LUẬT THUẾ\nTIÊU THỤ ĐẶC BIỆT Căn cứ vào Điều 84 của Hiến pháp nước Cộng hoà xã hội chủ nghĩa Việt Nam năm 1992;\nLuật này sửa đổi, bổ sung một số điều của Luật thuế tiêu thụ đặc biệt được Quốc hội nước Cộng hoà xã hội chủ nghĩa Việt nam thông qua ngày 30 tháng 6 năm 1990.\nĐiều 1 Sửa đổi, bổ\nsung một số điều của Luật thuế tiêu thụ đặc biệt như sau:\n1/ Điều 1 sửa đổi, bổ sung:\n\"Điều 1 Tổ chức, cá nhân thuộc các thành phần kinh tế sản xuất mặt hàng quy định tại Điều 9 của Luật này đều phải nộp thuế tiêu thụ đặc biệt tại nơi sản xuất ra hàng hoá đó.\"\n2/ Điều 7 được sửa đổi, bổ sung:\n\"Điều 7 Giá tính thuế tiêu thụ đặc biệt là giá do cơ sở sản xuất mặt hàng đó bán ra tại nơi sản xuất chưa có thuế tiêu thụ đặc biệt.\"\n3/ Điều 8 được sửa đổi:\n\"Điều 8 Trong trường hợp trao đổi hàng hoá\nhoặc cung ứng hàng hoá của cơ sở sản xuất cho nhu cầu tiêu dùng trong nội bộ hoặc biếu, tặng người khác, thì số hàng hoá đó cũng phải nộp thuế tiêu thụ đặc biệt theo quy định của Luật này.\"\n4/ Điều 9 được sửa đổi:\n\"Điều 9 Mặt hàng chịu thuế tiêu thụ đặc biệt và thuế suất được quy định theo Biểu thuế:\nSố\n TT Mặt hàng Thuế\n suất (%)\n1 Thuốc hút:\na) Thuốc lá điếu có đầu lọc, sản xuất chủ yếu bằng nguyên liệu nhập khẩu 70 b) Thuốc lá điếu có đầu lọc, sản xuất chủ yếu bằng nguyên liệu trong nước 52 c) Thuốc lá điếu không có đầu lọc, xì gà \n32 2\nRượu:\na) Rượu thuốc 15 b) Các loại rượu khác:\n- Trên 40 độ \n90\n- Từ 30 độ đến 40 độ \n75\n- Dưới 30 độ, kể cả rượu hoa quả \n25 3\nBia các loại 90\n- Riêng bia hộp 75 4\nPháo 100 Trong trường hợp cần thiết, Uỷ\nban Thường vụ Quốc hội có thể quyết định sửa đổi, bổ sung một số mặt hàng, thuế\nsuất quy định trong Biểu thuế tiêu thụ đặc biệt và phải báo cáo để Quốc hội phê\nchuẩn trong kỳ họp gần nhất.\"\n5/ Điều 14 được sửa đổi:\n\"Điều 14 Thuế tiêu thụ đặc biệt do cơ sở\nsản xuất nộp khi bán hàng hoặc trả hàng gia công.\"\n6/ Khoản 2, Điều 15 được sửa đổi, bổ sung:\n\"2- Trong trường hợp cơ sở\nlớn chưa thu được tiền, thời hạn nộp thuế có thể được kéo dài, nhưng chậm nhất không quá 15 ngày kể từ khi lập hoá đơn bán hàng hoặc trả hàng gia công.\"\n7/ Điều 19 được sửa đổi, bổ sung:\n\"Điều 19 Những trường hợp sau đây được xét giảm thuế, miễn thuế tiêu thụ đặc biệt:\n1- Cơ sở sản xuất hàng thuộc diện chịu thuế tiêu thụ đặc biệt gặp khó khăn do thiên tai, địch hoạ, tai nạn bất ngờ.\n2- Cơ sở sản xuất mới thành lập hoặc cơ sở mở rộng sản xuất áp dụng công nghệ sản xuất mới nếu nộp đủ thuế tiêu thụ đặc biệt mà bị lỗ vốn thì được xét giảm thuế, mức giảm tối đa không quá 30%\n(ba mươi phần trăm) số thuế phải nộp trong thời gian không quá hai năm.\nChính phủ quy định cụ thể việc giảm thuế, miễn thuế tại Điều này.\"\n8/ Điểm c, Khoản 1, Điều 20 được sửa đổi:\n\"c) Tổ chức, cá nhân chậm nộp tiền thuế hoặc tiền phạt ghi trong lệnh thu thuế hoặc quyết định xử phạt, thì\nngoài việc phải nộp đủ số tiền thuế hoặc tiền phạt theo quy định của Luật này,\nmỗi ngày chậm nộp còn bị phạt 0,2% (hai phần nghìn) số tiền nộp chậm.\"\n9/ Các chữ\n\"Hội đồng bộ trưởng\" được sửa đổi thành chữ \"Chính phủ\".\nĐiều 2 Chính phủ sửa đổi, bổ sung các văn bản quy định chi tiết thi hành Luật thuế tiêu thụ đặc biệt đã ban hành cho phù hợp với Luật này. \nĐiều 3 Luật này có hiệu lực từ ngày 01 tháng 9 năm 1993.\nLuật này đã được Quốc hội nước Cộng hoà xã hội chủ nghĩa Việt Nam khoá IX, kỳ họp thứ\nba thông qua ngày 5 tháng 7 năm 1993.\nLê\n Đức Anh\n (Đã\n ký)"
}