{
  "url": "https://thuvienphapluat.vn/van-ban/The-thao-Y-te/Luat-Bao-ve-suc-khoe-nhan-dan-1989-21-LCT-HDNN8-37690.aspx",
  "title": "Luật Bảo vệ sức khỏe nhân dân 1989 số 21-LCT/HĐNN8 mới nhất",
  "properties": {
    "Số hiệu": "21-LCT/HĐNN8",
    "Loại văn bản": "Luật",
    "Nơi ban hành": "Quốc hội",
    "Người ký": "Võ Chí Công",
    "Ngày ban hành": "30/06/1989",
    "Ngày hiệu lực": "Đã biết",
    "Ngày công báo": "Đã biết",
    "Số công báo": "Đã biết",
    "Tình trạng": "Đã biết"
  },
  "content": "QUỐC HỘI\n\t\t\t\t\t\t\t********\nCỘNG HOÀ XÃ HỘI CHỦ NGHĨA VIỆT NAM\n\t\t\t\t\t\t\tĐộc lập - Tự do - Hạnh phúc\n\t\t\t\t\t\t\t********\nSố: 21-LCT/HĐNN8 Hà Nội, ngày 30 tháng 6 năm 1989 LUẬT CỦA QUỐC HỘI SỐ 21-LCT/HĐNN8 NGÀY 30/06/1989 VỀ BẢO VỆ SỨC KHOẺ NHÂN DÂN Sức khoẻ là vốn quý nhất của con người, là một trong những điều cơ bản để con người sống hạnh phúc, là mục tiêu và là nhân tố quan trọng trong việc phát triển kinh tế, văn hoá, xã hội và bảo vệ Tổ quốc.\n\t\t\tĐể bảo vệ và tăng cường sức khoẻ nhân dân;\n\t\t\tCăn cứ vào Điều 47, Điều 61 và Điều 83 của Hiến pháp nước Cộng hoà xã hội chủ nghĩa Việt Nam;\n\t\t\tLuật này quy định việc bảo vệ sức khoẻ nhân dân. \nChương 1:\nNHỮNG QUY ĐỊNH CHUNG \nĐiều 1. Quyền và nghĩa vụ của công dân trong bảo vệ sức khoẻ.\n1- Công dân có quyền được bảo vệ sức khoẻ, nghỉ ngơi, giải trí, rèn luyện thân thể; được bảo đảm vệ sinh trong lao động, vệ sinh dinh dưỡng, vệ sinh môi trường sống và được phục vụ về chuyên môn y tế.\n2- Bảo vệ sức khoẻ là sự nghiệp của toàn dân. Tất cả công dân có nghĩa vụ thực hiện nghiêm chỉnh những quy định của pháp luật về bảo vệ sức khoẻ nhân dân để giữ gìn sức khoẻ cho mình và cho mọi người.\nĐiều 2. Nguyên tắc chỉ đạo công tác bảo vệ sức khoẻ.\n1- Đẩy mạnh tuyên truyền, giáo dục vệ sinh trong nhân dân; tiến hành các biện pháp dự phòng, cải tạo và làm sạch môi trường sống; bảo đảm tiêu chuẩn vệ sinh lao động, vệ sinh lương thực, thực phẩm và nước uống theo quy định của Hội đồng bộ trngưở.\n2- Mở rộng mạng lưới nhà nghỉ, nhà điều dưỡng, cơ sở tập luyện thể dục thể thao; kết hợp lao động, học tập với nghỉ ngơi và giải trí; phát triển thể dục thể thao quần chúng để duy trì và phục hồi khả năng lao động.\n3- Hoàn thiện, nâng cao chất lượng và phát triển mạng lưới phòng, chống dịch, khám bệnh, chữa bệnh; kết hợp phát triển hệ thống y tế Nhà nước với y tế tập thể và y tế tư nhân.\n4- Xây dựng nền y học Việt Nam kế thừa và phát triển nền y học, dược học cổ truyền dân tộc; kết hợp y học, dược học hiện đại với y học, dược học cổ truyền dân tộc, nghiên cứu và ứng dụng những tiến bộ khoa học kỹ thuật của y học thế giới vào thực tiễn Việt Nam, xây dựng các mũi nhọn khoa học y học, dược học Việt Nam.\nĐiều 3. Trách nhiệm của Nhà nước.\n1- Nhà nước chăm lo bảo vệ và tăng cường sức khoẻ nhân dân; đưa công tác bảo vệ sức khoẻ nhân dân vào kế hoạch phát triển kinh tế - xã hội và ngân sách Nhà nước; quyết định những chế độ chính sách, biện pháp để bảo vệ và tăng cường sức khoẻ nhân dân.\n2- Bộ y tế có trách nhiệm quản lý, hoàn thiện, nâng cao chất lượng và phát triển hệ thống phòng bệnh, chống dịch, khám bệnh, chữa bệnh, sản xuất, lưu thông thuốc và thiết bị y tế, kiểm tra việc thực hiện các quy định về chuyên môn nghiệp vụ y, dược.\n3- Hội đồng nhân dân các cấp dành tỷ lệ ngân sách thích đáng cho công tác bảo vệ sức khoẻ nhân dân ở địa phương; thường xuyên giám sát, kiểm tra việc tuân theo pháp luật về bảo vệ sức khoẻ nhân dân của Uỷ ban nhân dân cùng cấp, của các cơ quan, các tổ chức xã hội, cơ sở sản xuất, kinh doanh của Nhà nước, tập thể, tư nhân và mọi công dân trong địa phương. Uỷ ban nhân dân các cấp có trách nhiệm thực hiện các biện pháp để bảo đảm vệ sinh ăn, ở, sinh hoạt, vệ sinh công cộng cho nhân dân trong địa phương; lãnh đạo các cơ quan y tế trực thuộc, chỉ đạo sự phối hợp giữa các ngành, các tổ chức xã hội trong địa phương để thực hiện những quy định của pháp luật về bảo vệ sức khoẻ nhân dân.\nĐiều 4. Trách nhiệm của các cơ quan Nhà nước, các cơ sở sản xuất, kinh doanh, các đơn vị vũ trang nhân dân.\nCác cơ quan Nhà nước, các cơ sở sản xuất, kinh doanh của Nhà nước, các đơn vị vũ trang nhân dân (gọi chung là các tổ chức Nhà nước), các cơ sở sản xuất, kinh doanh của tập thể và tư nhân có trách nhiệm trực tiếp chăm lo, bảo vệ, tăng cường sức khoẻ của những thành viên trong cơ quan, đơn vị mình và đóng góp tiền của, công sức theo khả năng cho công tác bảo vệ sức khoẻ nhân dân.\nĐiều 5. Trách nhiệm của các tổ chức xã hội.\n1- Mặt trận Tổ quốc Việt Nam, Tổng liên đoàn lao động Việt Nam, Đoàn thanh niên Cộng sản Hồ Chí Minh, Hội liên hiệp phụ nữ Việt Nam, Hội nông dân Việt Nam, Tổng hội y dược học Việt Nam, Hội y học cổ truyền dân tộc Việt Nam và các tổ chức xã hội khác động viên, giáo dục các thành viên trong tổ chức thực hiện những quy định của pháp luật về bảo vệ sức khoẻ nhân dân và tham gia tích cực vào sự nghiệp bảo vệ sức khoẻ nhân dân trong phạm vi điều lệ của tổ chức mình.\n2- Hội chữ thập đỏ Việt Nam tuyên truyền, phổ biến những kiến thức y học thường thức cho hội viên và nhân dân, vận động nhân dân thực hiện các biện pháp giữ gìn sức khoẻ cho bản thân và cho mọi người, hiến máu cứu người; tổ chức cứu trợ nhân dân khi có tai nạn, thiên tai, dịch bệnh và chiến tranh xảy ra.\nChương 2:\nVỆ SINH TRONG SINH HOẠT VÀ LAO ĐỘNG, VỆ SINH CÔNG CỘNG, PHÒNG VÀ CHỐNG DỊCH BỆNH \nĐiều 6. Giáo dục vệ sinh.\n1- Các cơ quan y tế, văn hoá, giáo dục, thể dục thể thao, thông tin đại chúng và các tổ chức xã hội có trách nhiệm tuyên truyền, giáo dục cho nhân dân kiến thức về y học và vệ sinh thường thức, vệ sinh môi trường, vệ sinh phụ nữ, vệ sinh thai nghén và nuôi dạy con.\n2- Bộ giáo dục xây dựng chương trình giáo dục vệ sinh cho học sinh phổ thông, mẫu giáo, nhà trẻ, tạo thói quen giữ gìn vệ sinh chung, vệ sinh trong sinh hoạt và học tập.\nĐiều 7. Vệ sinh lương thực, thực phẩm, các loại nước uống và rượu.\n1- Các tổ chức Nhà nước, tập thể, tư nhân khi sản xuất, chế biến, bao bì đóng gói, bảo quản, vận chuyển lương thực, thực phẩm, các loại nước uống và rượu phải bảo đảm tiêu chuẩn vệ sinh. Khi đưa các hoá chất mới, nguyên liệu mới hoặc các chất phụ gia mới vào chế biến, bảo quản lương thực, thực phẩm, các loại nước uống, rượu và sản phẩm các loại bao bì đóng gói phải được phép của Sở y tế.\n2- Nghiêm cấm sản xuất, lưu thông, xuất khẩu, nhập khẩu những mặt hàng lương thực, thực phẩm, các loại nước uống và rượu không bảo đảm tiêu chuẩn vệ sinh.\n3- Người đang mắc bệnh truyền nhiễm không được làm những công việc có liên quan trực tiếp đến thực phẩm, các loại nước uống và rượu.\nĐiều 8. Vệ sinh nước và các nguồn nước dùng trong sinh hoạt của nhân dân.\n1- Các cơ quan, xí nghiệp cấp nước phải bảo đảm tiêu chuẩn vệ sinh nước dùng trong sinh hoạt của nhân dân.\n2- Nghiêm cấm các tổ chức Nhà nước, tập thể, tư nhân và mọi công dân làm ô nhiễm các nguồn nước dùng trong sinh hoạt của nhân dân.\nĐiều 9. Vệ sinh trong sản xuất, bảo quản, vận chuyển và sử dụng hoá chất.\n1- Các tổ chức Nhà nước, tập thể, tư nhân và mọi công dân khi sản xuất, bảo quản, vận chuyển, sử dụng phân bón, thuốc trừ sâu, diệt cỏ, diệt chuột, hoá chất kích thích sinh trưởng vật nuôi, cây trồng và các loại hoá chất khác phải bảo đảm tiêu chuẩn vệ sinh, không gây nguy hại đến sức khoẻ con người.\n2- Các cơ sở sản xuất mỹ phẩm, đồ chơi trẻ em, đồ dùng vệ sinh cá nhân bằng hoá chất phải bảo đảm tiêu chuẩn vệ sinh.\nĐiều 10. Vệ sinh các chất thải trong công nghiệp và trong sinh hoạt.\n1- Các xí nghiệp, các cơ sở sản xuất của Nhà nước, tập thể, tư nhân phải thực hiện những biện pháp xử lý chất thải trong công nghiệp để phòng, chống ô nhiễm không khí, đất và nước theo quy định của Hội đồng bộ trưởng.\n2- Các tổ chức Nhà nước, tổ chức xã hội, tập thể, tư nhân và mọi công dân không được để các chất phế thải trong sinh hoạt làm ô nhiễm môi trường sống ở các khu dân cư.\nĐiều 11. Vệ sinh trong chăn nuôi gia súc, gia cầm.\n1- Việc chăn nuôi gia súc, gia cầm phải bảo đảm vệ sinh chung. Không được giết mổ, mua, bán, ăn thịt gia súc, gia cầm bị bệnh truyền nhiễm gây nguy hại cho sức khoẻ con người.\n2- Nghiêm cấm việc thả rông chó ở thành phố, thị xã và thị trấn; chó nuôi phải được tiêm phòng theo quy định của cơ quan thú y.\nĐiều 12. Vệ sinh trong xây dựng.\nViệc quy hoạch xây dựng và cải tạo các khu dân cư, các công trình công nghiệp và các công trình dân dụng đều phải tuân theo tiêu chuẩn vệ sinh.\nĐiều 13. Vệ sinh trong trường học và nhà trẻ.\n1- Hội đồng nhân dân, Uỷ ban nhân dân các cấp, ngành giáo dục và các ngành có liên quan phải từng bước bảo đảm cơ sở vật chất, trang thiết bị, ánh sáng, đồ dùng giảng dạy, học tập ở trường học và nhà trẻ, không làm ảnh hưởng đến sức khoẻ của học sinh và giáo viên.\n2- Hiệu trưởng các trường học và Chủ nhiệm các nhà trẻ phải bảo đảm thực hiện chương trình học tập rèn luyện đã được quy định; bảo đảm vệ sinh trường, lớp và nhà trẻ.\nĐiều 14. Vệ sinh trong lao động.\n1- Các tổ chức Nhà nước, tập thể và tư nhân phải thực hiện các biện pháp bảo đảm an toàn lao động, bảo đảm tiêu chuẩn vệ sinh về độ nóng, ẩm, khói, bụi, tiếng ồn, rung chuyển và về các yếu tố độc hại khác trong lao động sản xuất để bảo vệ sức khoẻ, phòng, chống bệnh nghề nghiệp cho người lao động, không gây ảnh hưởng xấu đến môi trường xung quanh.\n2- Đơn vị và cá nhân sử dụng lao động phải tổ chức việc khám sức khoẻ định kỳ cho người lao động và phải phải bảo đảm trang bị bảo hộ lao động cần thiết cho người lao động.\nĐiều 15. Vệ sinh nơi công cộng.\n1- Mọi người phải có trách nhiệm thực hiện những quy định về vệ sinh nơi công cộng.\n2- Cấm phóng uế, vứt rác và các chất phế thải khác trên đường phố, vườn hoa, công viên và những nơi công cộng khác.\n3- Cấm hút thuốc trong phòng họp, ở rạp chiếu bóng, rạp hát và những nơi quy định khác.\nĐiều 16. Vệ sinh trong việc quàn, ướp, chôn, hoả táng, di chuyển thi hài, hài cốt.\n1- Việc quàn, ướp, chôn, hoả táng, di chuyển thi hài, hài cốt, phải tuân theo các quy định về vệ sinh phòng dịch. Nhà nước khuyến khích việc hoả táng thi hài và hài cốt.\n2- Khi di chuyển thi hài, hài cốt qua biên giới Việt Nam, phải có giấy phép theo quy định của Hội đồng bộ trưởng nước Cộng hoà xã hội chủ nghĩa Việt Nam.\nĐiều 17. Phòng và chống các bệnh nhiễm khuẩn, bệnh dịch.\n1- Y tế cơ sở phải tổ chức tiêm chủng các loại vắc xin phòng bệnh cho nhân dân.\n2- Các tổ chức Nhà nước, tập thể, tư nhân và mọi công dân phải thực hiện các biện pháp phòng, chống các bệnh nhiễm khuẩn, bệnh dịch. Khi phát hiện có bệnh dịch hoặc nghi có bệnh dịch trong đơn vị, địa phương, cơ quan y tế phải báo cáo kịp thời với Uỷ ban nhân dân cùng cấp và cơ quan y tế cấp trên.\n3- Uỷ ban nhân dân các cấp phải bảo đảm công tác phòng dịch, chống dịch tại địa phương.\n4- Căn cứ vào tính chất nguy hiểm, mức độ lây lan của từng vụ dịch, Chủ tịch Hội đồng bộ trưởng, Bộ trưởng Bộ y tế, Chủ tịch Uỷ ban nhân dân tỉnh, thành phố, đặc khu trực thuộc trung ương có quyền áp dụng những biện pháp đặc biệt để nhanh chóng dập tắt dịch.\nĐiều 18. Kiểm dịch.\n1- Động vật, thực vật, phương tiện vận chuyển hàng hoá ra vào biên giới và quá cảnh nước Cộng hoà xã hội chủ nghĩa Việt Nam đều phải được kiểm dịch.\n2- Động vật, thực vật, phương tiện vận chuyển, hàng hoá và bưu phẩm từ vùng có dịch chuyển ra vùng không có dịch đều phải được kiểm dịch tại các đầu mối giao thông và bưu điện.\nChương 3:\nTHỂ DỤC THỂ THAO, ĐIỀU DƯỠNG VÀ PHỤC HỒI CHỨC NĂNG \nĐiều 19. Tổ chức hoạt động thể dục thể thao.\n1- Các ngành, các cấp, các tổ chức Nhà nước, tổ chức xã hội, tập thể, tư nhân có trách nhiệm tạo điều kiện cần thiết và tổ chức, động viên mọi người tham gia hoạt động thể dục thể thao.\n2- Tổng cục thể dục thể thao phối hợp với các ngành có liên quan nghiên cứu, phố biến các phương pháp tập luyện, các môn tập, bài tập thể dục thể thao phù hợp với thể lực, lứa tuổi, ngành nghề, hướng dẫn chữa bệnh bằng thể dục; xây dựng và phát triển y học thể dục thể thao; đào tạo cán bộ, hướng dẫn viên, huấn luyện viên và giáo viên thể dục thể thao.\n3- Nghiêm cấm các hành vi thô bạo trong tập luyện và thi đấu thể dục thể thao.\nĐiều 20. Tổ chức nghỉ ngơi và điều dưỡng.\n1- Tổng liên đoàn Lao động Việt Nam, các ngành, các cấp, các tổ chức Nhà nước, các tổ chức xã hội, tổ chức tập thể có trách nhiệm mở rộng các cơ sở điều dưỡng, nhà nghỉ và câu lạc bộ sức khoẻ.\n2- Các tổ chức và tư nhân sử dụng lao động phải tạo điều kiện cho người lao động được điều dưỡng và nghỉ ngơi.\nĐiều 21. Phục hồi chức năng.\n1- Bộ y tế, Bộ lao động - thương binh và xã hội phải xây dựng và bảo đảm điều kiện cần thiết cho các cơ sở phục hồi chức năng hoạt động.\n2- Ngành y tế, ngành lao động - thương binh và xã hội phối hợp với các ngành liên quan, các tổ chức xã hội mở rộng hoạt động phục hồi chức năng dựa vào cộng đồng để phòng ngừa và hạn chế hậu quả tàn tật; áp dụng kỹ thuật thích hợp để đưa người tàn tật có khả năng trở lại cuộc sống bình thường.\nĐiều 22. Điều dưỡng, phục hồi sức khoẻ bằng yếu tố thiên nhiên.\nNguồn nước khoáng, mỏ bùn thuốc, khu vực bãi biển, vùng khí hậu và các yếu tố thiên nhiên khác có tác dụng dược lý đặc biệt phải được sử dụng vào việc điều dưỡng và phục hồi sức khoẻ.\nHội đồng bộ trưởng quy định việc xác định, xếp hạng, quản lý khai thác, sử dụng và bảo vệ các yếu tố thiên nhiên quy định tại Điều này.\nChương 4:\nKHÁM BỆNH VÀ CHỮA BỆNH \nĐiều 23. Quyền được khám bệnh và chữa bệnh.\n1- Mọi người khi ốm đau, bệnh tật, bị tai nạn được khám bệnh, chữa bệnh tại các cơ sở khám bệnh, chữa bệnh ở nơi công dân cư trú, lao động, học tập.\nNgười bệnh còn được chọn thầy thuốc hoặc lương y, chọn cơ sở khám bệnh, chữa bệnh và ra nước ngoài để khám bệnh, chữa bệnh theo quy định của Hội đồng bộ trưởng.\n2- Trong trường hợp cấp cứu, người bệnh được cấp cứu tại bất kỳ cơ sở khám bệnh, chữa bệnh nào. Các cơ sở khám bệnh, chữa bệnh phải tiếp nhận và xử trí mọi trường hợp cấp cứu.\nĐiều 24. Điều kiện hành nghề của thầy thuốc.\nNgười có bằng tốt nghiệp y khoa ở các trường đại học hoặc trung học và có giấy phép hành nghề do Bộ y tế hoặc Sở y tế cấp được khám bệnh, chữa bệnh tại các cơ sở y tế Nhà nước, tập thể, tư nhân.\nĐiều 25. Trách nhiệm của thầy thuốc.\n1- Thầy thuốc có nghĩa vụ khám bệnh chữa bệnh, kê đơn và hướng dẫn cách phòng bệnh, tự chữa bệnh cho người bệnh; phải giữ bí mật về những điều có liên quan đến bệnh tật hoặc đời tư mà mình được biết về người bệnh.\n2- Thầy thuốc phải có y đức, có tinh thần trách nhiệm, tận tình cứu chữa người bệnh; chấp hành nghiêm chỉnh các quy định chuyên môn nghiệp vụ, kỹ thuật y tế; chỉ sử dụng những phương pháp, phương tiện, dược phẩm được Bộ y tế cho phép.\n3- Nghiêm cấm hành vi vô trách nhiệm trong cấp cứu, khám bệnh, chữa bệnh làm tổn hại đến sức khoẻ, tính mạng, danh dự, nhân phẩm của người bệnh.\nĐiều 26. Giúp đỡ bảo vệ thầy thuốc và nhân viên y tế.\n1- Mọi tổ chức và công dân có trách nhiệm giúp đỡ, bảo vệ thầy thuốc và nhân viên y tế khi họ làm nhiệm vụ.\n2- Trong trường hợp khẩn cấp để đưa người bệnh hay người bị tai nạn đến cơ sở cấp cứu, thầy thuốc, nhân viên y tế được quyền sử dụng các phương tiện vận chuyển có mặt tại chỗ. Người điều khiển phương tiện phải thực hiện yêu cầu của người thầy thuốc và nhân viên y tế.\n3- Nghiêm cấm hành vi làm tổn hại đến sức khoẻ, tính mạng, danh dự, nhân phẩm của thầy thuốc và nhân viên y tế trong khi đang làm nhiệm vụ.\nĐiều 27. Trách nhiệm của người bệnh.\n1- Người bệnh có trách nhiệm tôn trọng thầy thuốc và nhân viên y tế; chấp hành những quy định trong khám bệnh, chữa bệnh.\n2- Người bệnh phải trả một phần chi phí y tế. Hội đồng bộ trưởng quy định chế độ thu chi phí y tế.\nĐiều 28. Chữa bệnh bằng phẵu thuật.\nThầy thuốc chỉ tiến hành phẵu thuật sau khi được sự đồng ý của người bệnh. Đối với người bệnh chưa thành niên, người bệnh đang bị hôn mê hay mắc bệnh tâm thần thì phải được sự đồng ý của thân nhân hoặc người giám hộ của người bệnh. Trong trường hợp mà thân nhân hay người giám hộ của người bệnh không đồng ý hoặc thân nhân hay người giám hộ vắng mặt, nếu không kịp thời phẵu thuật có thể nguy hại đến tính mạng người bệnh, thì thầy thuốc được quyền quyết định, nhưng phải có sự phê chuẩn của người phụ trách hay người được uỷ quyền của cơ sở y tế đó.\nĐiều 29. Bắt buộc chữa bệnh.\n1- Các cơ sở y tế phải tiến hành các biện pháp bắt buộc chữa bệnh đối với người mắc bệnh tâm thần thể nặng, bệnh lao, phong đang thời kỳ lây truyền, bệnh lây truyền qua đường sinh dục, bệnh nghiện ma tuý, bệnh SIDA và một số bệnh truyền nhiễm khác có thể gây nguy hại cho xã hội.\n2- Việc bắt buộc chữa bệnh tại các cơ sở y tế phải được thực hiện theo quy định của pháp luật.\nĐiều 30. Lấy và ghép mô hoặc một bộ phận của cơ thể con người.\n1- Thầy thuốc chỉ tiến hành lấy mô hoặc bộ phận của cơ thể người sống hay người chết dùng vào mục đích y tế sau khi đã được sự đồng ý của người cho, của thân nhân người chết hoặc người chết có di chúc để lại.\n2- Việc ghép mô hoặc một bộ phận cho cơ thể người bệnh phải được sự đồng ý của người bệnh hoặc thân nhân hay người giám hộ của người bệnh chưa thành niên.\n3- Bộ y tế quy định chế độ chăm sóc sức khoẻ người cho mô hoặc một bộ phận của cơ thể.\nĐiều 31. Giải phẵu tử thi.\nBệnh viện được quyền giải phẵu thi thể người chết tại bệnh viện trong trường hợp cần thiết để nâng cao chất lượng khám bệnh, chữa bệnh. Các trường đại học y khoa được dùng tử thi vô thừa nhận và tử thi của người có di chúc cho phép sử dụng vào mục đích học tập và nghiên cứu khoa học.\nĐiều 32 Khám bệnh, chữa bệnh cho người nước ngoài tại Việt Nam.\n1- Người nước ngoài đang ở trên lãnh thổ Việt Nam được khám bệnh, chữa bệnh tại các cơ sở y tế và phải chấp hành những quy định pháp luật về bảo vệ sức khoẻ nhân dân. Người nước ngoài có thể vào Việt Nam để khám bệnh, chữa bệnh.\n2- Hội đồng bộ trưởng quy định chế độ khám bệnh, chữa bệnh cho người nước ngoài tại Việt Nam.\nĐiều 33. Giám định y khoa.\n1- Hội đồng giám định y khoa xác định tình trạng sức khoẻ và khả năng lao động của người lao động theo yêu cầu của các tổ chức sử dụng lao động và người lao động.\n2- Các tổ chức sử dụng lao động và các cơ quan bảo hiểm xã hội phải căn cứ vào kết luận của Hội đồng giám định y khoa để thực hiện chính sách đối với người lao động.\nChương 5:\nY HỌC, DƯỢC HỌC CỔ TRUYỀN DÂN TỘC \nĐiều 34. Kế thừa và phát triển nền y học, dược học cổ truyền dân tộc.\n1- Bộ y tế, Hội y học cổ truyền dân tộc Việt Nam và Tổng hội y dược học Việt Nam có trách nhiệm tổ chức thực hiện việc kế thừa, phát triển nền y học, dược học cổ truyền dân tộc, kết hợp y học, dược học hiện đại với y học, dược học cổ truyền dân tộc trong mọi lĩnh vực hoạt động y tế và bảo đảm điều kiện hoạt động cho các bệnh viện, viện đầu ngành y học dân tộc.\n2- Ngành y tế, Uỷ ban nhân dân các cấp phải củng cố và mở rộng mạng lưới phục vụ y tế bằng y học, dược học cổ truyền dân tộc và phát triển nuôi trồng dược liệu trong địa phương mình.\nĐiều 35. Điều kiện hành nghề của lương y.\nNgười đã tốt nghiệp ở các trường, lớp hoặc được gia truyền về y học, dược học cổ truyền dân tộc, chữa bệnh bằng các phương pháp y học cổ truyền dân tộc hoặc bằng các bài thuốc gia truyền và có giấy phép hành nghề do Bộ y tế hoặc Sở y tế cấp được khám bệnh, chữa bệnh tại các cơ sở y tế Nhà nước, tập thể và tư nhân.\nĐiều 36. Trách nhiệm của lương y.\n1- Lương y có nhiệm vụ khám bệnh, chữa bệnh và hướng dẫn cách phòng bệnh, tự chữa bệnh cho người bệnh; phải có y đức, có tinh thần trách nhiệm tận tình cứu chữa người bệnh.\n2- Những bài thuốc mới, phương pháp chữa bệnh mới phải được Bộ y tế hoặc Sở y tế cùng với Hội y học cổ truyền dân tộc cùng cấp kiểm tra xác nhận mới được áp dụng vào khám bệnh, chữa bệnh cho nhân dân.\n3- Nghiêm cấm việc sử dụng các hình thức mê tín trong khám bệnh, chữa bệnh.\nĐiều 37. Giúp đỡ và bảo vệ lương y.\n1- Nhà nước bảo đảm quyền tác giả cho lương y về việc phổ biến những bài thuốc, vị thuốc và dược liệu quý, phương pháp chữa bệnh gia truyền có hiệu quả của mình.\n2- Mọi người có trách nhiệm giúp đỡ và bảo vệ lương y cũng như đối với thầy thuốc theo quy định tại Điều 26 của Luật này.\nChương 6:\nTHUỐC PHÒNG BỆNH, CHỮA BỆNH \nĐiều 38. Quản lý sản xuất, lưu thông, xuất khẩu, nhập khẩu thuốc và nguyên liệu làm thuốc.\n1- Bộ y tế thống nhất quản lý sản xuất, lưu thông, xuất khẩu, nhập khẩu thuốc và nguyên liệu làm thuốc, tổ chức bán và cung cấp thuốc thiết yếu trong phòng bệnh, chữa bệnh cho nhân dân.\n2- Các cơ sở của Nhà nước, tập thể, tư nhân được cơ quan y tế có thẩm quyền cho phép mới được sản xuất, lưu thông, xuất khẩu, nhập khẩu thuốc, nguyên liệu làm thuốc và chỉ được phép sản xuất, lưu thông, xuất khẩu, nhập khẩu các loại thuốc và nguyên liệu làm thuốc đã được Bộ y tế quy định.\n3- Người có bằng cấp chuyên môn về dược và được Bộ y tế hoặc Sở y tế cấp giấy phép mới được hành nghề dược.\n4- Các loại thuốc mới phải được Bộ y tế hoặc Sở y tế kiểm tra, xác định hiệu lực phòng bệnh, chữa bệnh, bảo đảm an toàn đối với người bệnh mới được đưa vào sản xuất, lưu thông, xuất khẩu, nhập khẩu.\nĐiều 39. Quản lý thuốc độc, thuốc và chất dễ gây nghiện, gây hưng phấn, ức chế tâm thần.\n1- Các loại thuốc có độc tính cao, các thuốc và chất dễ gây nghiện, gây hưng phấn, ức chế tâm thần chỉ được dùng để chữa bệnh và nghiên cứu khoa học.\n2- Bộ y tế quy định chế độ sản xuất, lưu thông, bảo quản, sử dụng, tồn trữ cá loại thuốc và các chất quy định tại khoản 1 của Điều này.\nĐiều 40. Chất lượng thuốc.\n1- Thuốc đưa vào lưu thông và sử dụng phải bảo đảm tiêu chuẩn chất lượng Nhà nước và an toàn cho người dùng.\n2- Nghiêm cấm việc sản xuất, lưu thông thuốc giả, thuốc không bảo đảm tiêu chuẩn chất lượng Nhà nước.\nChương 7:\nBẢO VỆ SỨC KHOẺ NGƯỜI CAO TUỔI, THƯƠNG BINH, BỆNH BINH, NGƯỜI TÀN TẬT VÀ ĐỒNG BÀO CÁC DÂN TỘC THIỂU SỐ \nĐiều 41. Bảo vệ sức khoẻ người cao tuổi, thương binh, bệnh binh và người tàn tật.\n1- Người cao tuổi, thương binh, bệnh binh và người tàn tật được ưu tiên trong khám bệnh, chữa bệnh, được tạo điều kiện thuận lợi để đóng góp cho xã hội phù hợp với sức khoẻ của mình.\n2- Bộ y tế, Tổng cục thể dục thể thao hướng dẫn phương pháp rèn luyện thân thể, nghỉ ngơi và giải trí để phòng, chống các bệnh người già.\nĐiều 42. Bảo vệ sức khoẻ đồng bào các dân tộc thiểu số.\n1- Nhà nước dành ngân sách thích đáng để củng cố mở rộng mạng lưới y tế khám bệnh, chữa bệnh cho đồng bào các dân tộc thiểu số, đặc biệt là y tế cơ sở ở vùng cao, vùng xã xôi hẻo lánh.\n2- Nhà nước có chế độ đãi ngộ thích đáng đối với cán bộ y tế công tác tại các vùng cao, vùng xa xôi hẻo lánh.\n3- Hội đồng bộ trưởng có trách nhiệm bảo đảm đủ thuốc phòng và chữa bệnh sốt rét, bướu cổ cho các vùng quy định tại khoản 1 của Điều này.\n4- Uỷ ban nhân dân các cấp, các ngành có liên quan và các tổ chức xã hội có trách nhiệm tuyên truyền giáo dục vệ sinh, xây dựng nếp sống văn minh, văn hoá mới cho đồng bào các dân tộc thiểu số.\nChương 8:\nTHỰC HIỆN KẾ HOẠCH HOÁ GIA ĐÌNH VÀ BẢO VỆ SỨC KHOẺ PHỤ NỮ, TRẺ EM \nĐiều 43. Thực hiện kế hoạch hoá gia đình.\n1- Mọi người có trách nhiệm thực hiện kế hoạch hoá gia đình, có quyền lựa chọn biện pháp sinh đẻ có kế hoạch theo nguyện vọng. Mỗi cặp vợ chống chỉ nên có từ một đến hai con.\n2- Nhà nước có chính sách, biện pháp khuyến khích và tạo điều kiện cần thiết cho mọi người thực hiện kế hoạch hoá gia đình. Các cơ sở chuyên khoa phụ sản của Nhà nước, tập thể và tư nhân phải thực hiện yêu cầu của mọi người về việc lựa chọn biện pháp sinh đẻ có kế hoạch theo nguyện vọng.\n3- Các cơ quan y tế, văn hoá, giáo dục, thông tin đại chúng và các tổ chức xã hội có trách nhiệm tuyên truyền, giáo dục kiến thức về dân số và kế hoạch hoá gia đình cho nhân dân.\n4- Nghiêm cấm hành vi gây trở ngại hoặc cưỡng bức trong việc thực hiện kế hoạch hoá gia đình.\nĐiều 44. Quyền của phụ nữ được khám bệnh, chữa bệnh phụ khoa và nạo thai, phá thai.\n1- Phụ nữ được quyền nạo thai, phá thai theo nguyện vọng, được khám bệnh, chữa bệnh phụ khoa, được theo dõi sức khoẻ trong thời kỳ thai nghén, được phục vụ y tế khi sinh con tại các cơ sở y tế.\n2- Bộ y tế có trách nhiệm củng cố, phát triển mạng lưới chuyên khoa phụ sản và sơ sinh đến tận cơ sở để bảo đảm phục vụ y tế cho phụ nữ.\n3- Nghiêm cấm các cơ sở y tế và cá nhân làm các thủ thuật nạo thai, phá thai, tháo vòng tránh thai nếu không có giấy phép do Bộ y tế hoặc Sở y tế cấp.\nĐiều 45. Sử dụng lao động nữ.\n1- Các tổ chức và cá nhân sử dụng lao động nữ phải thực hiện các quy định về bảo vệ sức khoẻ cho phụ nữ, bảo đảm chế độ đối với phụ nữ có thai, sinh con, nuôi con và áp dụng các biện pháp sinh đẻ có kế hoạch.\n2- Không được sử dụng lao động nữ vào những công việc nặng nhọc, độc hại. Bộ y tế, Bộ lao động - thương binh và xã hội quy định danh mục các công việc nặng nhọc, độc hại.\nĐiều 46. Bảo vệ sức khoẻ trẻ em.\n1- Trẻ em được y tế cơ sở quản lý sức khoẻ, được tiêm chủng phòng bệnh, phòng dịch, được khám bệnh, chữa bệnh.\n2- Ngành y tế có trách nhiệm phát triển, củng cố mạng lưới chăm sóc bảo vệ sức khoẻ trẻ em.\n3- Cha mẹ, người nuôi dưỡng trẻ em có trách nhiệm thực hiện những quy định về kiểm tra sức khoẻ và tiêm chủng theo kế hoạch của y tế cơ sở, chăm lo trẻ em khi đau ốm và thực hiện các quyết định của người thầy thuốc trong khám bệnh, chữa bệnh đối với trẻ em.\nĐiều 47. Chăm sóc trẻ em có khuyết tật.\nBộ y tế, Bộ lao động - thương binh và xã hội, Bộ giáo dục có trách nhiệm tổ chức chăm sóc và áp dụng các biện pháp phục hồi chức năng cho trẻ em có khuyết tật.\nChương 9:\nTHANH TRA NHÀ NƯỚC VỀ Y TẾ \nĐiều 48. Tổ chức và quyền hạn của thanh tra Nhà nước về y tế.\n1- Thanh tra Nhà nước về y tế thuộc ngành y tế bao gồm: Thanh tra vệ sinh, thanh tra khám bệnh, chữa bệnh và thanh tra dược.\nHội đồng bộ trưởng quy định tổ chức thanh tra Nhà nước về y tế.\n2- Thanh tra Nhà nước về y tế có quyền thanh tra, kiểm tra việc thực hiện những quy định của pháp luật về bảo vệ sức khoẻ nhân dân, về vệ sinh, phòng, chống dịch, khám bệnh, chữa bệnh và dược; quyết định các hình thức xử phạt hành chính; ra quyết định tạm đình chỉ hoặc đình chỉ hoạt động của những đơn vị, cá nhân vi phạm và chịu trách nhiệm về quyết định của mình.\n3- Các tổ chức Nhà nước, tổ chức xã hội, tập thể, tư nhân và mọi công dân nơi đang tiến hành thanh tra phải báo cáo tình hình, cung cấp tài liệu bằng văn bản những sự việc có liên quan đến nội dung thanh tra theo đúng thời hạn quy định và cử cán bộ tham gia đoàn thanh tra khi cần thiết.\nĐiều 49. Thanh tra vệ sinh.\nThanh tra vệ sinh thanh tra việc chấp hành pháp luật về vệ sinh của các tổ chức Nhà nước, tổ chức xã hội, tập thể, tư nhân và mọi công dân.\nĐiều 50. Thanh tra khám bệnh, chữa bệnh.\nThanh tra khám bệnh và chữa bệnh thanh tra việc chấp hành những quy định chuyên môn, nghiệp vụ và điều lệ kỹ thuật y tế của các cơ sở khám bệnh, chữa bệnh Nhà nước, tập thể và tư nhân.\nĐiều 51. Thanh tra dược.\nThanh tra dược thanh tra việc chấp hành những quy định chuyên môn, nghiệp vụ dược trong sản xuất, lưu thông, xuất khẩu, nhập khẩu thuốc và nguyên liệu làm thuốc của các cơ sở Nhà nước, tập thể, tư nhân.\nChương 10:\nKHEN THƯỞNG VÀ XỬ LÝ CÁC VI PHẠM \nĐiều 52. Khen thưởng.\nĐịa phương, đơn vị, cá nhân có thành tích trong công tác bảo vệ sức khoẻ nhân dân được Nhà nước khen thưởng vật chất và tinh thần.\nThầy thuốc, lương y, dược sĩ và nhân viên y tế khác có nhiều cống hiến trong sự nghiệp bảo vệ sức khoẻ nhân dân, có trình độ nghiệp vụ, chuyên môn kỹ thuật giỏi, có đạo đức, được nhân dân và đồng nghiệp tín nhiệm thì được xét tặng danh hiệu cao quý của Nhà nước.\nĐiều 53. Xử lý các vi phạm Người nào có những hành vi sau đây thì tuỳ theo mức độ nhẹ hoặc nặng sẽ bị xứ lý kỷ luật, bị xử lý hành chính hoặc bị truy cứu trách nhiệm hình sự.\n1- Vi phạm các quy định về giữ gìn vệ sinh nơi công cộng, phòng và chống dịch, bệnh.\n2- Vi phạm các quy định về khám bệnh, chữa bệnh, sản xuất thuốc và bán thuốc.\n3- Vi phạm các quy định về vệ sinh lương thực, thực phẩm, vệ sinh lao động và các quy định khác của Luật bảo vệ sức khoẻ nhân dân.\nNgoài những hình thức xử lý nói trên, người nào có hành vi vi phạm quy định tại các điểm 1, 2, 3 của Điều này nếu gây thiệt hại đến sức khoẻ, tính mạng, tài sản của người khác thì phải bồi thường thiệt hại theo quy định của pháp luật.\nChương 11:\nĐIỀU KHOẢN CUỐI CÙNG \nĐiều 54. Những quy định trước đây trái với Luật này đều bãi bỏ.\nĐiều 55. Hội đồng bộ trưởng quy định chi tiết thi hành Luật này.\nLuật này đã được Quốc hội nước Cộng hoà xã hội chủ nghĩa Việt Nam khoá VIII, kỳ họp thứ 5 thông qua ngày 30 tháng 6 năm 1989.\nVõ Chí Công\n(Đã ký)"
}