{
  "url": "https://thuvienphapluat.vn/van-ban/Quyen-dan-su/Luat-Xuat-ban-1993-22-L-CTN-38479.aspx",
  "title": "Luật Xuất bản 1993 22-L/CTN",
  "properties": {
    "Số hiệu": "22-L/CTN",
    "Loại văn bản": "Luật",
    "Nơi ban hành": "Quốc hội",
    "Người ký": "Lê Đức Anh",
    "Ngày ban hành": "07/07/1993",
    "Ngày hiệu lực": "Đã biết",
    "Ngày công báo": "Đã biết",
    "Số công báo": "Đã biết",
    "Tình trạng": "Đã biết"
  },
  "content": "QUỐC HỘI\n ********\nCỘNG HOÀ XÃ HỘI CHỦ NGHĨA VIỆT NAM\n Độc lập - Tự do - Hạnh phúc\n ********\nSố: 22-L/CTN Hà Nội, ngày 07 tháng 7 năm 1993 LUẬT XUẤT BẢN SỐ 22-L/CTN NGÀY 07/07/1993 CỦA QUỐC HỘI\nĐể bảo đảm quyền sáng tạo và\nphổ biến tác phẩm của công dân, cơ quan nhà nước, tổ chức chính trị, xã hội,\nkinh tế, lực lượng vũ trang dưới hình thức xuất bản phẩm, góp phần bảo đảm quyền tự do ngôn luận;\nĐể tăng cường quản lý nhà nước, phát huy vai trò của hoạt động xuất bản trong sự\nnghiệp xây dựng và bảo vệ Tổ quốc;\nCăn cứ vào Hiến pháp nước Cộng hoà xã hội chủ nghĩa Việt Nam năm 1992;\nLuật này quy định chế độ hoạt động xuất bản.\nChương 1:\nNHỮNG QUY ĐỊNH CHUNG\nĐiều 1.\nHoạt động xuất bản là hoạt động thuộc lĩnh vực văn hoá, tư tưởng thông qua việc sản xuất, phổ biến những xuất bản phẩm đến nhiều người, không phải là hoạt động đơn thuần kinh doanh.\nHoạt động xuất bản nhằm mục\nđích:\n1- Phổ biến những tác phẩm về\nchính trị, kinh tế, văn hoá, xã hội, khoa học, công nghệ, văn học, nghệ thuật;\ngiới thiệu những di sản văn hoá dân tộc, tinh hoa văn hoá thế giới; nâng cao dân trí, đáp ứng nhu cầu đời sống tinh thần của nhân dân, mở rộng giao lưu văn hoá với các nước, góp phần vào sự nghiệp xây dựng và bảo vệ Tổ quốc Việt Nam xã\nhội chủ nghĩa.\n2- Đấu tranh chống mọi tư tưởng và hành vi làm tổn hại lợi ích quốc gia, phá hoại nhân cách, đạo đức và lối sống tốt đẹp của người Việt Nam.\nĐiều 2.\nNhà nước bảo đảm quyền phổ biến tác phẩm dưới hình thức xuất bản phẩm của công dân, cơ quan nhà nước, tổ chức chính trị, xã hội, kinh tế, lực lượng vũ trang, sau đây gọi chung là công dân,\ntổ chức.\nNhà nước không kiểm duyệt tác phẩm trước khi xuất bản, trừ trường hợp cần thiết do Thủ tướng Chính phủ quyết định.\nĐiều 3.\nNhà nước thống nhất quản lý hoạt\nđộng xuất bản trong cả nước.\nNhà nước có chính sách tài trợ,\nđặt hàng, mua bản thảo đối với việc sáng tạo và phổ biến tác phẩm có giá trị; đầu tư cho việc ứng dụng khoa học - công nghệ hiện đại để nâng cao chất lượng hoạt\nđộng xuất bản.\nĐiều 4.\nHoạt động xuất bản quy định tại Luật này bao gồm các lĩnh vực xuất bản, in, phát hành xuất bản phẩm.\nXuất bản phẩm quy định tại Luật này là tác phẩm về chính trị, kinh tế, văn hoá, xã hội, khoa học, công nghệ,\nvăn học, nghệ thuật và các sản phẩm khác được xuất bản, in, nhân bản bằng các vật liệu, phương tiện kỹ thuật khác nhau, bằng tiếng Việt, tiếng các dân tộc thiểu số, tiếng nước ngoài, được xuất bản không định kỳ nhằm phổ biến cho nhiều người.\nChương 2:\nQUYỀN, NGHĨA VỤ CỦA CÔNG DÂN VÀ TỔ CHỨC ĐỐI VỚI HOẠT ĐỘNG XUẤT BẢN \nĐiều 5.\nCông dân, tổ chức có quyền phổ\nbiến tác phẩm dưới hình thức xuất bản phẩm thông qua nhà xuất bản, chịu trách nhiệm trước pháp luật về nội dung xuất bản phẩm của mình và được Nhà nước bảo hộ\nquyền tác giả.\nĐiều 6.\nCông dân có quyền hưởng thụ những giá trị văn hoá, nghệ thuật, thành tựu khoa học, công nghệ của dân tộc và thế\ngiới dưới hình thức xuất bản phẩm.\nNhà nước đầu tư phát triển hệ thống thư viện; khuyến khích và tạo điều kiện xuất bản các tác phẩm có giá trị; có\nchính sách ưu đãi đối với các xuất bản phẩm phục vụ các dân tộc thiểu số, thiếu niên, nhi đồng và lực lượng vũ trang.\nĐiều 7.\nCông dân, tổ chức có quyền phê\nbình hoạt động xuất bản, xuất bản phẩm; khiếu nại, tố cáo tổ chức, cá nhân vi phạm các quy định của Luật này; chịu trách nhiệm về việc phê bình, khiếu nại, tố\ncáo của mình.\nCông dân, tổ chức có quyền yêu cầu nhà xuất bản, tác giả cải chính trên báo chí, khởi kiện về dân sự hoặc yêu cầu cơ quan có thẩm quyền khởi tố về hình sự, khi xuất bản phẩm có nội dung sai sự\nthật, vu khống, xúc phạm danh dự, nhân phẩm và làm thiệt hại lợi ích của mình.\nĐiều 8.\nKhông một tổ chức, cá nhân nào\nđược cản trở quyền phổ biến tác phẩm, quyền hoạt động xuất bản hợp pháp của nhà\nxuất bản hoặc lợi dụng quyền phổ biến tác phẩm, quyền hoạt động xuất bản làm thiệt hại đến lợi ích Nhà nước, lợi ích hợp pháp của tổ chức, công dân.\nNhà xuất bản không được xuất bản,\ntái bản tác phẩm nếu không được sự đồng ý của tác giả hoặc người được thừa kế hợp pháp theo quy định của pháp luật về quyền tác giả.\nChương 3:\nTỔ CHỨC VÀ HOẠT ĐỘNG XUẤT BẢN Mục 1: XUẤT BẢN\nĐiều 9.\nNhà xuất bản là tổ chức thuộc cơ\nquan nhà nước, tổ chức chính trị - xã hội, hoạt động theo đúng tính chất và mục\nđích quy định tại Điều 1 của Luật này.\nĐiều 10.\nCơ quan chủ quản của nhà xuất bản là tổ chức đứng tên xin phép thành lập nhà xuất bản và quản lý trực tiếp nhà xuất bản. Cơ quan chủ quản có nhiệm vụ và quyền hạn:\n1- Xác định và chịu trách nhiệm chỉ đạo việc thực hiện tôn chỉ, mục đích của nhà xuất bản, xét duyệt kế hoạch đề\ntài, kế hoạch xuất bản trên cơ sở đã có bản thảo; bảo đảm những điều kiện cần thiết để nhà xuất bản hoạt động đúng tôn chỉ, mục đích;\n2- Bổ nhiệm, miễn nhiệm, cách chức giám đốc, tổng biên tập nhà xuất bản sau khi thoả thuận với cơ quan quản lý nhà\nnước về xuất bản.\nĐiều 11.\nGiám đốc, tổng biên tập nhà xuất bản phải là công dân Việt Nam, có địa chỉ thường trú tại Việt Nam, có đủ tiêu chuẩn theo quy định của Chính phủ.\nGiám đốc có trách nhiệm quản lý\nnhà xuất bản về mọi mặt; bảo đảm thực hiện tôn chỉ, mục đích, phục vụ đúng đối tượng của nhà xuất bản; xây dựng đội ngũ biên tập viên; ký duyệt bản thảo, bản mẫu trước khi đưa in; chịu trách nhiệm về mọi hoạt động của nhà xuất bản.\nGiám đốc, tổng biên tập nhà xuất bản chịu trách nhiệm trước pháp luật về xuất bản phẩm của nhà xuất bản. Cơ quan chủ quản, cơ quan quản lý nhà nước về xuất bản liên đới chịu trách nhiệm theo nhiệm vụ và quyền hạn của mình.\nĐiều 12.\nMuốn thành lập nhà xuất bản, cơ\nquan chủ quản phải có đơn gửi tới cơ quan quản lý nhà nước về xuất bản có thẩm quyền được quy định tại Điều 33 của Luật này. Trong đơn phải ghi rõ:\n1- Tên gọi, tôn chỉ, mục đích, đối tượng phục vụ, phạm vi phát hành xuất bản phẩm phù hợp với chức năng, nhiệm vụ\ncủa cơ quan chủ quản;\n2- Danh sách giám đốc, tổng biên tập;\n3- Trụ sở của nhà xuất bản, vốn và các điều kiện cần thiết khác bảo đảm cho hoạt động xuất bản.\nĐiều 13.\nSau khi được cơ quan quản lý nhà\nnước về xuất bản cấp giấy phép, cơ quan chủ quản hoàn thành các thủ tục thành lập nhà xuất bản thì nhà xuất bản mới được phép hoạt động.\nĐiều 14.\nTrong thời hạn một trăm tám mươi ngày, kể từ ngày được cấp giấy phép thành lập nhà xuất bản, nếu không có xuất bản phẩm nộp lưu chiểu thì giấy phép không còn hiệu lực và bị thu hồi.\nĐiều 15.\nĐối với nhà xuất bản đang hoạt động mà trong thời hạn chín mươi ngày không có xuất bản phẩm nộp lưu chiểu thì giấy phép thành lập nhà xuất bản không còn hiệu lực và bị thu hồi.\nKhi nhà xuất bản không thực hiện\nđúng tôn chỉ, mục đích quy định trong giấy phép thì cơ quan quản lý nhà nước về\nxuất bản quyết định đình chỉ hoạt động, thông báo cho cơ quan chủ quản và thu hồi giấy phép thành lập nhà xuất bản.\nĐiều 16.\nCơ quan chủ quản muốn thay đổi tên gọi, tôn chỉ, mục đích của nhà xuất bản, phải xin phép lại; thay đổi giám đốc,\ntổng biên tập, phải tuân theo khoản 2, Điều 10 của Luật này; thay đổi trụ sở\nnhà xuất bản thì chậm nhất là hai ngày sau khi đến trụ sở mới, phải báo cho cơ\nquan quản lý nhà nước về xuất bản.\nĐiều 17.\nViệc xuất bản, tái bản, nhân bản những văn kiện, tài liệu, sách giáo khoa, giáo trình, băng âm thanh, đĩa âm thanh, băng hình, đĩa hình của tác giả, tổ chức nào phải được tác giả, tổ chức\nđó đồng ý.\nĐối với những tác phẩm trước Cách mạng tháng Tám, trong vùng tạm bị chiếm cũ và sách dịch của nước ngoài cần phải thẩm định nội dung thì nhà xuất bản và cơ quan chủ quản của nhà xuất bản phải có nhận xét, đề nghị cơ quan quản lý nhà nước về xuất bản có thẩm quyền tổ\nchức thẩm định và quyết định việc xuất bản, tái bản.\nChính phủ quy định các loại tác phẩm cần thẩm định.\nĐiều 18.\nNhà xuất bản thực hiện việc xuất bản, tái bản tác phẩm theo hợp đồng đã ký kết với tác giả.\nNhà xuất bản có trách nhiệm xuất bản những tác phẩm của công dân, tổ chức có nội dung phù hợp với tôn chỉ, mục\nđích của nhà xuất bản và không vi phạm quy định tại Điều 22 của Luật này.\nCơ quan quản lý nhà nước về xuất bản có thẩm quyền quy định cụ thể nhà xuất bản làm nhiệm vụ xuất bản kinh bổn và các tác phẩm tôn giáo của các tổ chức tôn giáo một cách thuận tiện.\nNhững tỉnh, thành phố trực thuộc trung ương không có nhà xuất bản mà có tài liệu cần xuất bản không nhằm mục\nđích kinh doanh thì đề nghị với cơ quan quản lý nhà nước về xuất bản có thẩm quyền xem xét và giải quyết theo quy định của Chính phủ.\nViệc xuất bản, in, nhân bản các tài liệu, công trình nghiên cứu, giáo trình lưu hành nội bộ của các tổ chức do Chính phủ quy định.\nĐiều 19.\nViệc liên doanh với các tổ chức,\ncá nhân trong nước về in và phát hành; việc hợp tác với nước ngoài về xuất bản,\nin, phát hành phải được cơ quan quản lý nhà nước về xuất bản có thẩm quyền cho phép và phải tuân theo các quy định khác của pháp luật.\nĐiều 20.\n1- Xuất bản phẩm trên giấy phải ghi:\n- Tên xuất bản phảm, tác giả;\n- Tên nhà xuất bản;\n- Người chịu trách nhiệm xuất bản,\nngười biên tập, người trình bày, người sửa bản in;\n- Số đăng ký kế hoạch xuất bản;\n- Tên cơ sở in, sắp chữ, chế bản;\n- Số lượng bản in, ngày in xong,\nngày nộp lưu chiểu, giá bán lẻ;\n- Mã số phân loại.\nĐối với xuất bản phẩm tái bản,\nghi thêm số thứ tự của lần tái bản.\nĐối với sách dịch, ghi thêm tên nguyên bản, tác giả, ngôn ngữ của tác phẩm được dịch, nhà xuất bản nước ngoài,\nnăm xuất bản, người dịch, người hiệu đính.\n2- Xuất bản phẩm trên băng âm thanh, đĩa âm thanh, băng hình, đĩa hình, trên các vật liệu khác phải ghi:\n- Tên xuất bản phẩm, tác giả;\n- Tên tổ chức xuất bản;\n- Người chịu trách nhiệm xuất bản,\nngười biên tập;\n- Chương trình gốc;\n- Số đăng ký kế hoạch xuất bản;\n- Số lượng bản in, ngày in xong,\nngày nộp lưu chiểu, giá bán lẻ;\n- Mã số phân loại.\nĐiều 21.\nTrong thời hạn hai ngày kể từ\nkhi in xong, cơ sở in phải nộp lưu chiểu xuất bản phẩm; ít nhất là bảy ngày trước khi phát hành, nhà xuất bản phải nộp lưu chiểu xuất bản phẩm theo quy định của Chính phủ. Cơ quan quản lý nhà nước về xuất bản nhận xuất bản phẩm lưu chiểu có trách nhiệm kiểm tra nội dung và xử lý kịp thời nếu phát hiện thấy vi phạm Điều 22 của Luật này.\nĐiều 22.\nNghiêm cấm các xuất bản phẩm có\nnội dung:\n1- Chống lại Nhà nước Cộng hoà\nxã hội chủ nghĩa Việt Nam; phá hoại khối đoàn kết toàn dân;\n2- Tuyên truyền bạo lực, chiến tranh xâm lược, gây hận thù giữa các dân tộc và nhân dân các nước; truyền bá tư\ntưởng, văn hoá phản động, lối sống dâm ô đồi trụy, các hành vi tội ác, tệ nạn xã hội, mê tín dị đoan, phá hoại thuần phong mỹ tục;\n3- Tiết lộ bí mật của Đảng, Nhà\nnước, bí mật quân sự, an ninh, kinh tế, đối ngoại, bí mật đời tư của công dân và bí mật khác do pháp luật quy định;\n4- Xuyên tạc lịch sử, phủ nhận thành tựu cách mạng, xúc phạm vĩ nhân, anh hùng dân tộc, vu khống, xúc phạm uy tín của tổ chức, danh dự và nhân phẩm của công dân.\nMục 2: IN\nĐiều 23.\nCơ sở in, nhân bản của tổ chức,\ncá nhân chỉ được thành lập và hoạt động sau khi có giấy phép của cơ quan quản lý nhà nước về xuất bản có thẩm quyền và hoàn thành các thủ tục khác theo quy định của pháp luật.\nĐiều 24.\nCơ sở in, nhân bản chỉ được in,\nnhân bản xuất bản phẩm có giấy phép hợp pháp. Không được in, nhân bản xuất bản phẩm mà cơ quan quản lý nhà nước về xuất bản có thẩm quyền đã có quyết định thu hồi, tịch thu hoặc cấm lưu hành.\nĐiều 25.\nCơ sở in, nhân bản chỉ được in,\nnhân bản xuất bản phẩm sau khi đã ký kết hợp đồng kinh tế với nhà xuất bản theo quy định của Luật này và các quy định khác của pháp luật về hợp đồng.\nViệc in, nhân bản các sản phẩm khác do Chính phủ quy định.\nĐiều 26.\nCơ sở in, nhân bản khi phát hiện tác phẩm, tài liệu có nội dung vi phạm những quy định tại Điều 22 của Luật này phải báo cáo ngay với cơ quan quản lý nhà nước về xuất bản. Trong trường hợp cơ\nquan quản lý nhà nước về xuất bản có quyết định đình chỉ in thì nhà xuất bản có\ntác phẩm, tài liệu bị đình chỉ in phải bồi thường thiệt hại cho cơ sở in, nhân bản. Trường hợp cơ quan quản lý nhà nước về xuất bản quyết định sai thì phải bồi thường thiệt hại cho nhà xuất bản.\nMục 3: PHÁT HÀNH XUẤT BẢN PHẨM\nĐiều 27.\nTổ chức phát hành của Nhà nước có trách nhiệm phát hành xuất bản phẩm của các nhà xuất bản tới người sử dụng.\nChính phủ có chính sách tài trợ cho việc phát hành xuất bản phẩm tới vùng dân tộc thiểu số, vùng núi, hải đảo, vùng xa xôi hẻo lánh.\nĐiều 28.\nNhà xuất bản, ngoài việc ký hợp\nđồng với tổ chức phát hành của Nhà nước, được tự phát hành xuất bản phẩm của mình hoặc uỷ thác cho tổ chức, cá nhân được phép kinh doanh phát hành xuất bản phẩm.\nĐiều 29.\nTổ chức, cá nhân kinh doanh trong lĩnh vực phát hành xuất bản phẩm chỉ được phép hoạt động sau khi có giấy phép của cơ quan quản lý nhà nước về xuất bản có thẩm quyền và hoàn thành các thủ tục khác theo quy định của pháp luật.\nĐiều 30.\nViệc xuất khẩu, nhập khẩu xuất bản phẩm phải tuân theo quy định của Luật này và các quy định khác của pháp luật về\nxuất khẩu, nhập khẩu.\nĐiều 31.\nKhông một tổ chức, cá nhân nào\nđược phát hành xuất bản phẩm đã có quyết định thu hồi, tịch thu hoặc cấm lưu hành của cơ quan quản lý nhà nước về xuất bản.\nTổ chức, cá nhân phát hành, khi phát hiện xuất bản phẩm không hợp pháp, xuất bản phẩm có nội dung vi phạm những quy định tại Điều 22 của Luật này phải báo cáo với cơ quan quản lý nhà nước về\nxuất bản. Trong trường hợp cơ quan quản lý nhà nước về xuất bản có quyết định\nđình chỉ phát hành, thu hồi, tịch thu xuất bản phẩm thì nhà xuất bản có xuất bản phẩm phải bồi thường thiệt hại cho tổ chức, cá nhân phát hành. Trường hợp cơ\nquan quản lý nhà nước về xuất bản quyết định sai thì phải bồi thường thiệt hại cho nhà xuất bản.\nChương 4:\nQUẢN LÝ NHÀ NƯỚC VỀ XUẤT BẢN\nĐiều 32.\nChính phủ thống nhất quản lý nhà\nnước về hoạt động xuất bản trong cả nước; trình dự án luật, pháp lệnh về hoạt động xuất bản; quyết định về quy hoạch, kế hoạch phát triển sự nghiệp xuất bản,\nchính sách đầu tư, tài trợ, hợp tác với nước ngoài; ban hành quyết định về quản lý nhà nước và các chính sách khác về xuất bản, in, phát hành theo thẩm quyền quy định tại Luật Tổ chức Chính phủ.\nĐiều 33.\nBộ Văn hoá Thông tin là cơ quan của Chính phủ thực hiện việc thống nhất quản lý nhà nước về hoạt động xuất bản trong cả nước, có nhiệm vụ và quyền hạn:\n1- Thống nhất quản lý, xây dựng quy hoạch, kế hoạch phát triển sự nghiệp hoạt động xuất bản dài hạn và hàng năm; quản lý việc thực hiện kế hoạch xuất bản; tổ chức việc đào tạo và bồi dưỡng cán bộ hoạt động xuất bản;\n2- Xây dựng dự án luật, pháp lệnh và các dự án khác của Chính phủ trong lĩnh vực hoạt động xuất bản; ban hành quyết\nđịnh, thông tư, chỉ thị về hoạt động xuất bản;\n3- Cấp, thu hồi giấy phép thành lập nhà xuất bản, cơ sở in, cơ sở sản xuất băng âm thanh, đĩa âm thanh, băng hình, đĩa hình, tổ chức phát hành của Nhà nước thuộc bộ, ban, ngành, đoàn thể\ntrung ương và các tỉnh, thành phố trực thuộc trung ương;\nCấp, thu hồi giấy chấp nhận đăng ký kế hoạch xuất bản của nhà xuất bản;\nQuyết định thu hồi, tịch thu, cấm lưu hành, tiêu huỷ xuất bản phẩm;\nĐình chỉ hoạt động của nhà xuất bản, cơ sở in, cơ sở sản xuất băng âm thanh, đĩa âm thanh, băng hình, đĩa hình,\ntổ chức phát hành của các cơ quan nói trên khi vi phạm pháp luật;\nQuyết định việc cho tổ chức, cá\nnhân trong nước liên doanh trong các lĩnh vực in, phát hành và việc hợp tác với nước ngoài về các lĩnh vực xuất bản, in, phát hành;\n4- Hướng dẫn, thanh tra, kiểm tra việc thực hiện phương hướng, nhiệm vụ hoạt động xuất bản và các quy định của pháp luật về hoạt động xuất bản; thi hành các biện pháp để ngăn chặn những hoạt\nđộng xuất bản trái pháp luật; khen thưởng và xử lý vi phạm theo quy định của pháp luật.\nĐiều 34.\nUỷ ban nhân dân tỉnh, thành phố\ntrực thuộc trung ương thực hiện việc quản lý nhà nước về hoạt động xuất bản ở địa phương, có nhiệm vụ và quyền hạn:\n1- Xây dựng quy hoạch, kế hoạch phát triển sự nghiệp xuất bản, in và phát hành của địa phương;\n2- Cấp, thu hồi giấy phép đối với cơ sở in, nhân bản, phát hành của tập thể, cá nhân ở địa phương theo quy định của Bộ Văn hoá Thông tin;\n3- Hướng dẫn, thanh tra, kiểm tra việc xuất bản, in, nhân bản, phát hành trên địa bàn lãnh thổ; tạm đình chỉ\nviệc thực hiện giấy phép do cơ quan quản lý nhà nước về xuất bản có thẩm quyền cấp, nếu phát hiện thấy có vi phạm và báo cáo ngay với Bộ Văn hoá Thông tin; tịch thu, thu hồi, cấm lưu hành hoặc quyết định tiêu huỷ xuất bản phẩm thuộc thẩm quyền theo quy định của Chính phủ.\nSở Văn hoá Thông tin chịu trách nhiệm trước Uỷ ban nhân dân tỉnh, thành phố trực thuộc trung ương thực hiện việc quản lý nhà nước về hoạt động xuất bản ở địa phương.\nĐiều 35.\nTrong thời hạn sáu mươi ngày, kể\ntừ ngày nhận hồ sơ xin thành lập nhà xuất bản, cơ sở in, nhân bản, tổ chức phát hành, cơ quan quản lý nhà nước về xuất bản phải trả lời; nếu không cho phép thành lập phải nêu rõ lý do. Tổ chức bị từ chối cấp giấy phép thành lập nhà xuất bản và tổ chức, tập thể, cá nhân bị từ chối thành lập cơ sở in, nhân bản, tổ chức phát hành có quyền khiếu nại theo quy định của pháp luật.\nĐiều 36.\nBộ Văn hoá Thông tin xây dựng hệ\nthống tổ chức thanh tra chuyên ngành về hoạt động xuất bản trong cả nước.\nNhiệm vụ, quyền hạn của tổ chức thanh tra các cấp và của thanh tra viên theo quy định của Pháp lệnh thanh tra.\nNội dung thanh tra bao gồm:\n- Thanh tra việc quản lý nhà nước về xuất bản, in, phát hành;\n- Thanh tra việc thực hiện giấy phép của nhà xuất bản, cơ sở in, nhân bản, tổ chức phát hành;\n- Thanh tra việc thi hành Luật xuất bản.\nĐiều 37.\nTổ chức, cá nhân hoạt động trong các lĩnh vực xuất bản, in, phát hành có trách nhiệm đáp ứng yêu cầu của đoàn thanh tra, thanh tra viên khi thanh tra cơ sở mình; có quyền khiếu nại với cơ\nquan thanh tra chuyên ngành về xuất bản hoặc cơ quan quản lý nhà nước về xuất bản cấp trên những kết luận và xử lý của đoàn thanh tra hoặc thanh tra viên.\nTổ chức, cá nhân có quyền khiếu nại, tố cáo với cơ quan quản lý nhà nước về xuất bản hoặc cơ quan thanh tra chuyên ngành về xuất bản những vi phạm pháp luật của tổ chức, cá nhân trong hoạt\nđộng xuất bản.\nCơ quan nhận được khiếu nại, tố\ncáo có trách nhiệm xem xét, giải quyết theo quy định của pháp luật.\nChương 5:\nKHEN THƯỞNG VÀ XỬ LÝ VI PHẠM\nĐiều 38.\nTổ chức, cá nhân có thành tích trong hoạt động xuất bản, in, phát hành được khen thưởng theo quy định của Nhà\nnước.\nĐiều 39.\nGiám đốc, tổng biên tập nhà xuất bản, tác giả, người đứng đầu cơ quan chủ quản của nhà xuất bản, cơ quan quản lý\nnhà nước về xuất bản, cơ sở in, nhân bản, tổ chức phát hành và tổ chức, cá nhân khác vi phạm các quy định của Luật này, thì tuỳ theo tính chất, mức độ vi phạm mà phải cải chính trên báo chí, bị xử lý kỷ luật, xử phạt hành chính hoặc truy cứu trách nhiệm hình sự.\nĐiều 40.\nĐối với xuất bản phẩm vi phạm quy định tại các điều 20, 21 của Luật này thì tuỳ theo mức độ vi phạm mà bị tạm\nđình chỉ lưu hành, cấm lưu hành, thu hồi hoặc tịch thu.\nĐối với xuất bản phẩm không có\ngiấy phép xuất bản hoặc có nội dung vi phạm Điều 22 của Luật này thì bị cấm lưu hành, thu hồi, tịch thu hoặc tiêu huỷ.\nĐiều 41.\nTổ chức, cá nhân hoạt động xuất bản gây thiệt hại cho tổ chức, cá nhân khác thì phải bồi thường thiệt hại theo quy định của pháp luật dân sự.\nChương 6:\nĐIỀU KHOẢN THI HÀNH\nĐiều 42.\nCăn cứ vào Luật này, Chính phủ\nquy định việc phổ biến tác phẩm của tổ chức, công dân Việt Nam ra nước ngoài và\nviệc xuất bản, in, phát hành của tổ chức, người nước ngoài ở Việt Nam.\nĐiều 43.\nLuật này thay thế Sắc luật số\n003-SLt, ngày 18 tháng 6 năm 1957, quy định chế độ xuất bản.\nNhững quy định trước đây trái với Luật này đều bãi bỏ.\nĐiều 44.\nChính phủ quy định chi tiết thi hành Luật này.\nĐiều 45.\nLuật này có hiệu lực từ ngày ban hành.\nLuật này đã được Quốc hội nước Cộng hoà xã hội chủ nghĩa Việt Nam, khoá IX, kỳ họp thứ ba, thông qua ngày 7 tháng 7 năm 1993.\nLê\n Đức Anh\n (Đã\n ký)"
}