{
  "url": "https://thuvienphapluat.vn/van-ban/Bo-may-hanh-chinh/Luat-Thanh-tra-2004-22-2004-QH11-52185.aspx",
  "title": "Luật Thanh tra 2004 số 22/2004/QH11",
  "properties": {
    "Số hiệu": "22/2004/QH11",
    "Loại văn bản": "Luật",
    "Nơi ban hành": "Quốc hội",
    "Người ký": "Nguyễn Văn An",
    "Ngày ban hành": "15/06/2004",
    "Ngày hiệu lực": "Đã biết",
    "Ngày công báo": "Đã biết",
    "Số công báo": "Đã biết",
    "Tình trạng": "Đã biết"
  },
  "content": "QUỐC HỘI\n ********\nCỘNG HOÀ XÃ HỘI CHỦ NGHĨA VIỆT NAM\n Độc lập - Tự do - Hạnh phúc\n ********\nSố: 22/2004/QH11 Hà Nội, ngày 15 tháng 6 năm 2004 LUẬT CỦA QUỐC HỘI NƯỚC CỘNG HOÀ XÃ HỘI CHỦ\nNGHĨA VIỆT NAM SỐ 22/2004/QH11 VỀ THANH TRA NGÀY 15/06/2004 Căn cứ vào Hiến pháp nước Cộng hoà xã hội chủ nghĩa Việt Nam năm 1992 đã được sửa đổi, bổ sung theo Nghị quyết số 51/2001/QH10 ngày 25 tháng 12 năm 2001 của Quốc hội khoá X, kỳ họp thứ 10;\nLuật này quy định về thanh tra. \nChương 1:\nNHỮNG QUY ĐỊNH CHUNG\nĐiều 1. Phạm vi điều chỉnh Luật này quy định về tổ chức, hoạt\nđộng thanh tra nhà nước và thanh tra nhân dân.\nĐiều 2. Phạm vi thanh tra Cơ quan thanh tra nhà nước tiến hành thanh tra việc thực hiện chính sách, pháp luật, nhiệm vụ của cơ quan, tổ\nchức, cá nhân thuộc thẩm quyền quản lý của cơ quan quản lý nhà nước cùng cấp.\nBan thanh tra nhân dân giám sát việc thực hiện chính sách, pháp luật, việc giải quyết khiếu nại, tố cáo, việc thực hiện quy chế dân chủ ở cơ sở của cơ quan, tổ chức, cá nhân có trách nhiệm ở\nxã, phường, thị trấn, cơ quan nhà nước, đơn vị sự nghiệp, doanh nghiệp nhà nước.\nĐiều 3. Mục\nđích thanh tra Hoạt động thanh tra nhằm phòng ngừa, phát hiện và xử lý các hành vi vi phạm pháp luật; phát hiện những sơ hở\ntrong cơ chế quản lý, chính sách, pháp luật để kiến nghị với cơ quan nhà nước có thẩm quyền các biện pháp khắc phục; phát huy nhân tố tích cực; góp phần nâng cao hiệu lực, hiệu quả của hoạt động quản lý nhà nước; bảo vệ lợi ích của Nhà\nnước, quyền và lợi ích hợp pháp của cơ quan, tổ chức, cá nhân.\nĐiều 4. Giải thích từ ngữ\nTrong Luật này, các từ ngữ dưới\nđây được hiểu như sau:\n1. Thanh tra nhà nước là việc xem xét, đánh giá, xử lý của cơ quan quản lý nhà nước đối với việc thực hiện chính sách, pháp luật, nhiệm vụ của cơ quan, tổ chức, cá nhân chịu sự quản lý\ntheo thẩm quyền, trình tự, thủ tục được quy định trong Luật này và các quy định khác của pháp luật. Thanh tra nhà nước bao gồm thanh tra hành chính và thanh tra chuyên ngành.\n2. Thanh tra hành chính là hoạt\nđộng thanh tra của cơ quan quản lý nhà nước theo cấp hành chính đối với việc thực hiện chính sách, pháp luật, nhiệm vụ của cơ quan, tổ chức, cá nhân thuộc quyền quản lý trực tiếp.\n3. Thanh tra chuyên ngành là hoạt\nđộng thanh tra của cơ quan quản lý nhà nước theo ngành, lĩnh vực đối với cơ quan,\ntổ chức, cá nhân trong việc chấp hành pháp luật, những quy định về chuyên môn -\nkỹ thuật, quy tắc quản lý của ngành, lĩnh vực thuộc thẩm quyền quản lý.\n4. Thanh tra nhân dân là hình thức giám sát của nhân dân thông qua Ban thanh tra nhân dân đối với việc thực hiện chính sách, pháp luật, việc giải quyết khiếu nại, tố cáo, việc thực hiện quy chế\ndân chủ ở cơ sở của cơ quan, tổ chức, cá nhân có trách nhiệm ở xã, phường, thị\ntrấn, cơ quan nhà nước, đơn vị sự nghiệp, doanh nghiệp nhà nước.\nĐiều 5.\nNguyên tắc hoạt động thanh tra Hoạt động thanh tra phải tuân theo pháp luật; bảo đảm chính xác, khách quan, trung thực, công khai, dân chủ,\nkịp thời; không làm cản trở hoạt động bình thường của cơ quan, tổ chức, cá nhân là đối tượng thanh tra.\nĐiều 6.\nTrách nhiệm của Thủ trưởng cơ quan quản lý nhà nước Thủ tướng Chính phủ, Bộ trưởng,\nThủ trưởng cơ quan ngang bộ, Thủ trưởng cơ quan thuộc Chính phủ, Chủ tịch Uỷ\nban nhân dân tỉnh, thành phố trực thuộc trung ương, Thủ trưởng cơ quan chuyên môn thuộc Uỷ ban nhân dân tỉnh, thành phố trực thuộc trung ương, Chủ tịch Uỷ\nban nhân dân huyện, quận, thị xã, thành phố thuộc tỉnh trong phạm vi nhiệm vụ,\nquyền hạn của mình có trách nhiệm tổ chức, chỉ đạo hoạt động thanh tra, xử lý kịp thời các kết luận, kiến nghị của cơ quan thanh tra.\nĐiều 7.\nTrách nhiệm của Thủ trưởng cơ quan thanh tra, Trưởng Đoàn thanh tra, Thanh tra viên Thủ trưởng cơ quan thanh tra,\nTrưởng Đoàn thanh tra, Thanh tra viên trong hoạt động thanh tra phải tuân theo quy định của Luật này, các quy định khác của pháp luật và phải chịu trách nhiệm trước pháp luật về hành vi, quyết định của mình.\nĐiều 8.\nTrách nhiệm và quyền của cơ quan, tổ chức, cá nhân là đối tượng thanh tra và cơ\nquan, tổ chức, cá nhân có liên quan 1. Cơ quan, tổ chức, cá nhân là\nđối tượng thanh tra có trách nhiệm thực hiện yêu cầu, kiến nghị, quyết định về\nthanh tra, có quyền giải trình về nội dung thanh tra, có các quyền và trách nhiệm khác theo quy định của Luật này và các quy định khác của pháp luật.\n2. Cơ quan, tổ chức, cá nhân có\ncác thông tin, tài liệu liên quan đến nội dung thanh tra phải cung cấp đầy đủ,\nkịp thời theo yêu cầu của cơ quan thanh tra và chịu trách nhiệm về tính chính xác, trung thực của những thông tin, tài liệu đã cung cấp. \nĐiều 9. Phối hợp giữa cơ quan thanh tra với cơ quan, tổ chức hữu quan Cơ quan thanh tra trong phạm vi nhiệm vụ, quyền hạn của mình có trách nhiệm phối hợp với cơ quan công an, Viện kiểm sát, cơ quan, tổ chức hữu quan trong việc phòng ngừa, phát hiện, xử lý các hành vi vi phạm pháp luật và tội phạm.\nĐiều 10. Cơ\nquan thanh tra nhà nước 1. Các cơ quan thanh tra nhà nước bao gồm:\na) Cơ quan thanh tra được thành lập theo cấp hành chính;\nb) Cơ quan thanh tra được thành lập ở cơ quan quản lý theo ngành, lĩnh vực.\n2. Cơ quan thanh tra nhà nước chịu sự chỉ đạo trực tiếp của Thủ trưởng cơ quan quản lý nhà nước cùng cấp; đồng thời chịu sự chỉ đạo, hướng dẫn về công tác, tổ chức và nghiệp vụ của Thanh tra Chính phủ; chịu sự hướng dẫn về công tác, nghiệp vụ của cơ quan thanh tra cấp trên. \nĐiều 11.\nBan thanh tra nhân dân 1. Ban thanh tra nhân dân được thành lập ở xã, phường, thị trấn do Uỷ ban Mặt trận Tổ quốc Việt Nam xã, phường,\nthị trấn hướng dẫn tổ chức, chỉ đạo hoạt động.\nBan thanh tra nhân dân được thành lập ở cơ quan nhà nước, đơn vị sự nghiệp, doanh nghiệp nhà nước do Ban chấp hành Công đoàn cơ sở ở cơ quan, đơn vị, doanh nghiệp đó hướng dẫn tổ chức, chỉ\nđạo hoạt động.\n2. Chủ tịch Uỷ ban nhân dân xã,\nphường, thị trấn; người đứng đầu cơ quan nhà nước, đơn vị sự nghiệp, doanh nghiệp nhà nước có trách nhiệm tạo điều kiện để Ban thanh tra nhân dân thực hiện nhiệm vụ của mình.\nĐiều 12.\nCác hành vi bị nghiêm cấm 1. Lợi dụng chức vụ, quyền hạn thanh tra để thực hiện hành vi trái pháp luật, sách nhiễu, gây khó khăn, phiền hà cho đối tượng thanh tra. \n2. Thanh tra vượt quá thẩm quyền,\nphạm vi, nội dung trong quyết định thanh tra.\n3. Cố ý kết luận sai sự thật,\nquyết định, xử lý trái pháp luật, bao che cho người có hành vi vi phạm pháp luật.\n4. Tiết lộ thông tin, tài liệu về\nnội dung thanh tra trong quá trình thanh tra khi chưa có kết luận chính thức.\n5. Cung cấp thông tin, tài liệu không chính xác, thiếu trung thực; chiếm đoạt, thủ tiêu tài liệu, vật chứng liên quan đến nội dung thanh tra. \n6. Chống đối, cản trở, mua chuộc,\ntrả thù, trù dập người làm nhiệm vụ thanh tra, người cung cấp thông tin, tài liệu cho hoạt động thanh tra; gây khó khăn cho hoạt động thanh tra.\n7. Can thiệp trái pháp luật vào hoạt động thanh tra.\n8. Các hành vi khác bị nghiêm cấm trong hoạt động thanh tra theo quy định của pháp luật.\nChương 2:\nTỔ CHỨC, NHIỆM VỤ, QUYỀN HẠN CỦA CÁC CƠ QUAN THANH TRA NHÀ NƯỚC Mục 1: \nCƠ QUAN THANH TRA THEO CẤP HÀNH CHÍNH\nĐiều 13. Tổ\nchức cơ quan thanh tra theo cấp hành chính Các cơ quan thanh tra theo cấp hành chính gồm có:\n1. Thanh tra Chính phủ;\n2. Thanh tra tỉnh, thành phố trực thuộc trung ương (gọi chung là Thanh tra tỉnh);\n3. Thanh tra huyện, quận, thị\nxã, thành phố thuộc tỉnh (gọi chung là Thanh tra huyện).\nĐiều 14.\nThanh tra Chính phủ \n1. Thanh tra Chính phủ là cơ quan của Chính phủ, chịu trách nhiệm trước Chính phủ thực hiện quản lý nhà nước về công tác thanh tra và thực hiện nhiệm vụ, quyền hạn thanh tra trong phạm vi quản lý nhà nước của Chính phủ.\n2. Thanh tra Chính phủ có Tổng thanh tra, Phó Tổng thanh tra và Thanh tra viên.\nTổng thanh tra là thành viên Chính phủ, do Thủ tướng Chính phủ đề nghị Quốc hội phê chuẩn và Chủ tịch nước bổ\nnhiệm, miễn nhiệm, cách chức. Tổng thanh tra chịu trách nhiệm trước Quốc hội và\nThủ tướng Chính phủ về công tác thanh tra.\n3. Cơ cấu,\ntổ chức bộ máy của Thanh tra Chính phủ do Chính phủ quy định.\nĐiều 15.\nNhiệm vụ, quyền hạn của Thanh tra Chính phủ\n1. Thanh tra việc thực hiện chính sách, pháp luật, nhiệm vụ của các bộ, cơ quan ngang bộ, cơ quan thuộc Chính phủ, Uỷ ban nhân dân tỉnh, thành phố trực thuộc trung ương.\n2. Thanh tra vụ việc có liên quan đến trách nhiệm quản lý của nhiều bộ, cơ quan ngang bộ, cơ quan thuộc Chính phủ, của nhiều tỉnh, thành phố trực thuộc trung ương.\n3. Thanh tra vụ việc khác do Thủ\ntướng Chính phủ giao.\n4. Thực hiện nhiệm vụ giải quyết khiếu nại, tố cáo theo quy định của pháp luật về khiếu nại, tố cáo.\n5. Thực hiện nhiệm vụ phòng ngừa và chống tham nhũng theo quy định của pháp luật về chống tham nhũng.\n6. Xây dựng văn bản quy phạm pháp luật về thanh tra, về khiếu nại, tố cáo, chống tham nhũng trình cấp có thẩm quyền hoặc ban hành theo thẩm quyền; hướng dẫn, tuyên truyền, kiểm tra, thanh tra việc thực hiện pháp luật về thanh tra, về khiếu nại, tố cáo, chống tham nhũng.\n7. Chỉ đạo, hướng dẫn công tác,\ntổ chức và nghiệp vụ thanh tra; bồi dưỡng nghiệp vụ thanh tra đối với đội ngũ\ncán bộ, công chức làm công tác thanh tra.\n8. Tổng hợp, báo cáo kết quả về\ncông tác thanh tra, giải quyết khiếu nại, tố cáo, chống tham nhũng thuộc phạm vi quản lý nhà nước của Chính phủ; tổng kết kinh nghiệm về công tác thanh tra.\n9. Thực hiện hợp tác quốc tế về\ncông tác thanh tra, công tác giải quyết khiếu nại, tố cáo và chống tham nhũng.\n10. Thực hiện nhiệm vụ, quyền hạn khác theo quy định của pháp luật.\nĐiều 16. Nhiệm vụ, quyền hạn của Tổng thanh tra 1. Lãnh đạo, chỉ đạo công tác thanh tra trong phạm vi quản lý nhà nước của Chính phủ.\n2. Xây dựng chương trình, kế hoạch thanh tra trình Thủ tướng Chính phủ quyết định và tổ chức thực hiện chương trình, kế hoạch đó.\n3. Trình Thủ tướng Chính phủ hoặc tự mình quyết định việc thanh tra khi phát hiện có dấu hiệu vi phạm pháp luật.\n4. Đề nghị Bộ trưởng, Thủ trưởng cơ quan ngang bộ (gọi chung là Bộ trưởng), Chủ tịch Uỷ ban nhân dân tỉnh, thành phố trực thuộc trung ương thanh tra trong phạm vi quản lý của bộ, cơ quan ngang bộ (gọi chung là bộ), Uỷ ban nhân dân tỉnh, thành phố trực thuộc trung ương (gọi chung là Uỷ ban nhân dân cấp tỉnh).\n5. Kiến nghị Bộ trưởng đình chỉ\nviệc thi hành hoặc huỷ bỏ những quy định do bộ đó ban hành trái với các văn bản pháp luật của Nhà nước, của Tổng thanh tra về công tác thanh tra; nếu Bộ trưởng không đình chỉ hoặc huỷ bỏ văn bản đó thì trình Thủ tướng Chính phủ quyết định.\n6. Đình chỉ việc thi hành và đề\nnghị Thủ tướng Chính phủ bãi bỏ những quy định của Uỷ ban nhân dân cấp tỉnh, Chủ\ntịch Uỷ ban nhân dân cấp tỉnh trái với văn bản của Tổng thanh tra về công tác thanh tra.\n7. Kiến nghị Thủ tướng Chính phủ\nxem xét trách nhiệm, xử lý người có hành vi vi phạm thuộc quyền quản lý của Thủ\ntướng; phối hợp với người đứng đầu cơ quan, tổ chức trong việc xem xét trách nhiệm, xử lý người có hành vi vi phạm thuộc quyền quản lý của cơ quan, tổ chức\nđó.\n8. Xem xét những vấn đề mà Chánh thanh tra bộ không nhất trí với Bộ trưởng, Chánh thanh tra tỉnh không nhất trí với Chủ tịch Uỷ ban nhân dân cấp tỉnh về công tác thanh tra và đề nghị Bộ trưởng,\nChủ tịch Uỷ ban nhân dân cấp tỉnh xem xét lại; trường hợp Bộ trưởng, Chủ tịch Uỷ\nban nhân dân cấp tỉnh không xem xét hoặc đã xem xét nhưng Tổng thanh tra không nhất trí thì báo cáo Thủ tướng Chính phủ quyết định.\n9. Lãnh đạo cơ quan Thanh tra Chính phủ thực hiện nhiệm vụ, quyền hạn theo quy định của Luật này và các quy định khác của pháp luật.\nĐiều 17.\nThanh tra tỉnh 1. Thanh tra tỉnh là cơ quan chuyên môn thuộc Uỷ ban nhân dân cấp tỉnh, có trách nhiệm giúp Uỷ ban nhân dân cùng cấp quản lý nhà nước về công tác thanh tra và thực hiện nhiệm vụ, quyền hạn thanh tra hành chính trong phạm vi quản lý nhà nước của Uỷ ban nhân dân cấp tỉnh.\n2. Thanh tra tỉnh có Chánh thanh tra, Phó Chánh thanh tra và Thanh tra viên.\nChánh thanh tra tỉnh do Chủ tịch Uỷ ban nhân dân cùng cấp bổ nhiệm, miễn nhiệm, cách chức sau khi thống nhất với Tổng thanh tra.\n3. Thanh tra tỉnh chịu sự chỉ đạo trực tiếp của Chủ tịch Uỷ ban nhân dân cùng cấp, đồng thời chịu sự chỉ đạo, hướng dẫn về công tác, tổ chức và nghiệp vụ của Thanh tra Chính phủ. \nĐiều 18.\nNhiệm vụ, quyền hạn của Thanh tra tỉnh 1. Thanh tra việc thực hiện chính sách, pháp luật, nhiệm vụ của Uỷ ban nhân dân huyện, quận, thị xã, thành phố thuộc tỉnh (gọi chung là Uỷ ban nhân dân cấp huyện), của cơ quan chuyên môn thuộc Uỷ ban nhân dân cấp tỉnh (gọi chung là sở). \n2. Thanh tra vụ việc có liên quan đến trách nhiệm của nhiều Uỷ ban nhân dân huyện, quận, thị xã, thành phố\nthuộc tỉnh, nhiều sở.\n3. Thanh tra vụ việc khác do Chủ\ntịch Uỷ ban nhân dân cấp tỉnh giao.\n4. Thực hiện nhiệm vụ giải quyết khiếu nại, tố cáo theo quy định của pháp luật về khiếu nại, tố cáo. \n5. Thực hiện nhiệm vụ phòng ngừa và chống tham nhũng theo quy định của pháp luật về chống tham nhũng.\n6. Hướng dẫn công tác, nghiệp vụ\nthanh tra hành chính; phối hợp với cơ quan, tổ chức hữu quan hướng dẫn chế độ\nchính sách, tổ chức biên chế đối với Thanh tra huyện, Thanh tra của cơ quan chuyên môn thuộc Uỷ ban nhân dân cấp tỉnh (gọi chung là Thanh tra sở).\n7. Tổng hợp, báo cáo kết quả về\ncông tác thanh tra, giải quyết khiếu nại, tố cáo, chống tham nhũng thuộc phạm vi quản lý nhà nước của Uỷ ban nhân dân cấp tỉnh.\n8. Thực hiện nhiệm vụ, quyền hạn khác theo quy định của pháp luật.\nĐiều 19. Nhiệm vụ, quyền hạn của Chánh thanh tra tỉnh 1. Lãnh đạo, chỉ đạo công tác thanh tra trong phạm vi quản lý nhà nước của Uỷ ban nhân dân cấp tỉnh.\n2. Xây dựng chương trình, kế hoạch thanh tra trình Chủ tịch Uỷ ban nhân dân cấp tỉnh quyết định và tổ chức thực hiện chương trình, kế hoạch đó.\n3. Trình Chủ tịch Uỷ ban nhân dân cấp tỉnh quyết định việc thanh tra khi phát hiện có dấu hiệu vi phạm pháp luật.\n4. Đề nghị Thủ trưởng cơ quan chuyên môn của Uỷ ban nhân dân cấp tỉnh (gọi chung là Giám đốc sở), Chủ tịch Uỷ\nban nhân dân cấp huyện thanh tra trong phạm vi quản lý của sở, Uỷ ban nhân dân cấp huyện. \n5. Kiến nghị Chủ tịch Uỷ ban nhân dân cấp tỉnh xem xét trách nhiệm, xử lý người có hành vi vi phạm thuộc quyền quản lý của Chủ tịch Uỷ ban nhân dân cấp tỉnh; phối hợp với người đứng đầu cơ\nquan, tổ chức trong việc xem xét trách nhiệm, xử lý người có hành vi vi phạm thuộc quyền quản lý của cơ quan, tổ chức đó.\n6. Kiến nghị Chủ tịch Uỷ ban nhân dân cấp tỉnh giải quyết những vấn đề về công tác thanh tra; trường hợp kiến nghị đó không được chấp nhận thì báo cáo Tổng thanh tra.\n7. Xem xét những vấn đề mà Chánh thanh tra sở không nhất trí với Giám đốc sở, Chánh thanh tra huyện không nhất trí với Chủ tịch Uỷ ban nhân dân cấp huyện về công tác thanh tra và đề nghị\nGiám đốc sở, Chủ tịch Uỷ ban nhân dân cấp huyện xem xét lại; trường hợp Giám đốc sở, Chủ tịch Uỷ ban nhân dân cấp huyện không xem xét hoặc đã xem xét nhưng Chánh thanh tra tỉnh không nhất trí thì báo cáo Chủ tịch Uỷ ban nhân dân cấp tỉnh quyết định. \n8. Lãnh đạo cơ quan Thanh tra tỉnh thực hiện nhiệm vụ, quyền hạn theo quy định của Luật này và các quy định khác của pháp luật.\nĐiều 20.\nThanh tra huyện 1. Thanh tra huyện là cơ quan chuyên môn thuộc Uỷ ban nhân dân cấp huyện, có trách nhiệm giúp Uỷ ban nhân dân cùng cấp quản lý nhà nước về công tác thanh tra và thực hiện nhiệm vụ, quyền hạn thanh tra hành chính trong phạm vi quản lý nhà nước của Uỷ ban nhân dân cấp huyện.\n2. Thanh tra huyện có Chánh thanh tra, Phó Chánh thanh tra và Thanh tra viên.\nChánh thanh tra huyện do Chủ tịch Uỷ ban nhân dân cấp huyện bổ nhiệm, miễn nhiệm, cách chức sau khi thống nhất với Chánh thanh tra tỉnh.\n3. Thanh tra huyện chịu sự chỉ đạo trực tiếp của Chủ tịch Uỷ ban nhân cùng cấp, đồng thời chịu sự hướng dẫn về\ncông tác, nghiệp vụ thanh tra hành chính của Thanh tra tỉnh.\nĐiều 21.\nNhiệm vụ, quyền hạn của Thanh tra huyện 1. Thanh tra việc thực hiện chính sách, pháp luật, nhiệm vụ của Uỷ ban nhân dân xã, phường, thị trấn, của cơ quan chuyên môn thuộc Uỷ ban nhân dân cấp huyện.\n2. Thanh tra vụ việc có liên quan đến trách nhiệm của nhiều Uỷ ban nhân dân xã, phường, thị trấn, nhiều cơ\nquan chuyên môn thuộc Uỷ ban nhân dân cấp huyện. \n3. Thanh tra vụ việc khác do Chủ\ntịch Uỷ ban nhân dân cấp huyện giao.\n4. Thực hiện nhiệm vụ giải quyết khiếu nại, tố cáo theo quy định của pháp luật về khiếu nại, tố cáo.\n5. Thực hiện nhiệm vụ phòng ngừa và chống tham nhũng theo quy định của pháp luật về chống tham nhũng.\n6. Tổng hợp, báo cáo kết quả về\ncông tác thanh tra, giải quyết khiếu nại, tố cáo, chống tham nhũng thuộc phạm vi quản lý nhà nước của Uỷ ban nhân dân cấp huyện.\n7. Thực hiện nhiệm vụ, quyền hạn khác theo quy định của pháp luật.\nĐiều 22.\nNhiệm vụ, quyền hạn của Chánh thanh tra huyện 1. Lãnh đạo, chỉ đạo công tác thanh tra trong phạm vi quản lý nhà nước của Uỷ ban nhân dân cấp huyện.\n2. Xây dựng chương trình, kế hoạch thanh tra trình Chủ tịch Uỷ ban nhân dân cấp huyện quyết định và tổ chức thực hiện chương trình, kế hoạch đó.\n3. Trình Chủ tịch Uỷ ban nhân dân cấp huyện quyết định việc thanh tra khi phát hiện có dấu hiệu vi phạm pháp luật.\n4. Đề nghị Thủ trưởng cơ quan chuyên môn thuộc Uỷ ban nhân dân cấp huyện thanh tra trong phạm vi trách nhiệm của cơ quan đó. \n5. Kiến nghị Chủ tịch Uỷ ban nhân dân cấp huyện xem xét trách nhiệm, xử lý người có hành vi vi phạm thuộc quyền quản lý của Chủ tịch Uỷ ban nhân dân cấp huyện; phối hợp với người đứng đầu cơ quan, tổ chức trong việc xem xét trách nhiệm, xử lý người có hành vi vi phạm thuộc quyền quản lý của cơ quan, tổ chức đó.\n6. Kiến nghị Chủ tịch Uỷ ban nhân dân cấp huyện giải quyết những vấn đề về công tác thanh tra; trường hợp kiến nghị đó không được chấp nhận thì báo cáo Chánh thanh tra tỉnh.\n7. Lãnh đạo cơ quan Thanh tra huyện thực hiện nhiệm vụ, quyền hạn theo quy định của Luật này và các quy định khác của pháp luật.\nMục 2: \nCƠ QUAN THANH TRA THEO NGÀNH, LĨNH VỰC\nĐiều 23. Tổ\nchức cơ quan thanh tra theo ngành, lĩnh vực 1. Các cơ quan thanh tra theo ngành, lĩnh vực gồm có:\na) Thanh tra bộ, cơ quan ngang bộ\n(gọi chung là Thanh tra bộ). Thanh tra bộ có thanh tra hành chính và thanh tra chuyên ngành.\nCơ quan thuộc Chính phủ có chức năng quản lý nhà nước theo ngành, lĩnh vực được thành lập cơ quan thanh tra. Tổ\nchức, nhiệm vụ, quyền hạn của cơ quan thanh tra của cơ quan thuộc Chính phủ được áp dụng như đối với Thanh tra bộ;\nb) Thanh tra sở.\nThanh tra sở được thành lập ở những sở thực hiện nhiệm vụ quản lý nhà nước theo uỷ quyền của Uỷ ban nhân dân cùng cấp hoặc theo quy định của pháp luật. \n2. Chính phủ quy định cụ thể về\ntổ chức Thanh tra bộ và việc thành lập Thanh tra sở.\nĐiều 24.\nThanh tra bộ\n1. Thanh tra bộ là cơ quan của bộ,\ncó trách nhiệm giúp Bộ trưởng quản lý nhà nước về công tác thanh tra, thực hiện nhiệm vụ, quyền hạn thanh tra hành chính và thanh tra chuyên ngành trong các lĩnh vực thuộc phạm vi quản lý nhà nước của bộ.\n2. Thanh tra bộ có Chánh thanh tra, Phó Chánh thanh tra và Thanh tra viên. \nChánh thanh tra bộ do Bộ trưởng bổ nhiệm, miễn nhiệm, cách chức sau khi thống nhất với Tổng thanh tra.\n3. Thanh tra bộ chịu sự chỉ đạo trực tiếp của Bộ trưởng, đồng thời chịu sự chỉ đạo, hướng dẫn về công tác, tổ\nchức, nghiệp vụ của Thanh tra Chính phủ. \nĐiều 25.\nNhiệm vụ, quyền hạn của Thanh tra bộ\n1. Thanh tra việc thực hiện chính sách, pháp luật, nhiệm vụ của cơ quan, đơn vị thuộc quyền quản lý trực tiếp của bộ.\n2. Thanh tra việc chấp hành pháp luật chuyên ngành của cơ quan, tổ chức, cá nhân trong phạm vi quản lý nhà nước theo ngành, lĩnh vực do bộ phụ trách.\n3. Xử phạt vi phạm hành chính theo quy định của pháp luật về xử lý vi phạm hành chính.\n4. Thanh tra vụ việc khác do Bộ\ntrưởng giao.\n5. Thực hiện nhiệm vụ giải quyết khiếu nại, tố cáo theo quy định của pháp luật về khiếu nại, tố cáo.\n6. Thực hiện nhiệm vụ phòng ngừa và đấu tranh chống tham nhũng theo quy định của pháp luật về chống tham nhũng.\n7. Hướng dẫn nghiệp vụ thanh tra chuyên ngành đối với Thanh tra sở; hướng dẫn, kiểm tra các đơn vị thuộc bộ thực hiện quy định của pháp luật về công tác thanh tra.\n8. Tổng hợp, báo cáo kết quả về\ncông tác thanh tra, giải quyết khiếu nại, tố cáo, chống tham nhũng thuộc phạm vi quản lý nhà nước của bộ.\n9. Thực hiện nhiệm vụ, quyền hạn khác theo quy định của pháp luật.\nĐiều 26.\nNhiệm vụ, quyền hạn của Chánh thanh tra bộ\n1. Lãnh đạo, chỉ đạo công tác thanh tra trong phạm vi quản lý nhà nước của bộ.\n2. Xây dựng chương trình, kế hoạch thanh tra trình Bộ trưởng quyết định và tổ chức thực hiện chương trình, kế hoạch\nđó.\n3. Trình Bộ trưởng quyết định việc thanh tra khi phát hiện có dấu hiệu vi phạm pháp luật.\n4. Kiến nghị Bộ trưởng tạm đình chỉ việc thi hành quyết định sai trái về thanh tra của cơ quan, đơn vị thuộc quyền quản lý trực tiếp của bộ.\n5. Xử phạt vi phạm hành chính theo quy định của pháp luật về xử lý vi phạm hành chính.\n6. Kiến nghị Bộ trưởng xem xét trách nhiệm, xử lý người có hành vi vi phạm thuộc quyền quản lý của Bộ trưởng;\nphối hợp với người đứng đầu cơ quan, tổ chức trong việc xem xét trách nhiệm, xử\nlý người có hành vi vi phạm thuộc quyền quản lý của cơ quan, tổ chức đó.\n7. Kiến nghị Bộ trưởng giải quyết những vấn đề về công tác thanh tra; trường hợp kiến nghị đó không được chấp nhận thì báo cáo Tổng thanh tra.\n8. Lãnh đạo cơ quan Thanh tra bộ\nthực hiện nhiệm vụ, quyền hạn theo quy định của Luật này và các quy định khác của pháp luật.\nĐiều 27.\nThanh tra sở\n1. Thanh tra sở là cơ quan của sở,\ncó trách nhiệm giúp Giám đốc sở thực hiện nhiệm vụ, quyền hạn thanh tra hành chính và thanh tra chuyên ngành trong phạm vi nhiệm vụ, quyền hạn của Giám đốc sở.\n2. Thanh tra sở có Chánh thanh tra, Phó Chánh thanh tra và Thanh tra viên.\nChánh thanh tra sở do Giám đốc sở\nbổ nhiệm, miễn nhiệm, cách chức sau khi thống nhất với Chánh thanh tra tỉnh.\n3. Thanh tra sở chịu sự chỉ đạo trực tiếp của Giám đốc sở, đồng thời chịu sự hướng dẫn về công tác, nghiệp vụ\nthanh tra hành chính của Thanh tra tỉnh, về nghiệp vụ thanh tra chuyên ngành của Thanh tra bộ.\nĐiều 28.\nNhiệm vụ, quyền hạn của Thanh tra sở\n1. Thanh tra việc thực hiện chính sách, pháp luật, nhiệm vụ của cơ quan, đơn vị thuộc quyền quản lý trực tiếp của sở.\n2. Thanh tra việc chấp hành pháp luật chuyên ngành của cơ quan, tổ chức, cá nhân trong lĩnh vực quản lý do sở phụ\ntrách. \n3. Xử phạt vi phạm hành chính theo quy định của pháp luật về xử lý vi phạm hành chính.\n4. Thanh tra vụ việc khác do Giám đốc sở giao.\n5. Thực hiện nhiệm vụ giải quyết khiếu nại, tố cáo theo quy định của pháp luật về khiếu nại, tố cáo.\n6. Thực hiện nhiệm vụ phòng ngừa và đấu tranh chống tham nhũng theo quy định của pháp luật về chống tham nhũng.\n7. Hướng dẫn, kiểm tra các đơn vị\nthuộc sở thực hiện các quy định của pháp luật về công tác thanh tra.\n8. Tổng hợp, báo cáo kết quả về\ncông tác thanh tra, giải quyết khiếu nại, tố cáo, chống tham nhũng thuộc phạm vi quản lý của sở.\n9. Thực hiện nhiệm vụ, quyền hạn khác theo quy định của pháp luật.\nĐiều 29.\nNhiệm vụ, quyền hạn của Chánh thanh tra sở\n1. Lãnh đạo, chỉ đạo công tác thanh tra trong phạm vi quản lý của sở.\n2. Xây dựng chương trình, kế hoạch thanh tra trình Giám đốc sở quyết định và tổ chức thực hiện chương trình, kế hoạch\nđó.\n3. Trình Giám đốc sở quyết định việc thanh tra khi phát hiện có dấu hiệu vi phạm pháp luật.\n4. Kiến nghị Giám đốc sở tạm\nđình chỉ việc thi hành quyết định sai trái về thanh tra của đơn vị thuộc quyền quản lý của sở.\n5. Xử phạt vi phạm hành chính theo quy định của pháp luật về xử lý vi phạm hành chính.\n6. Kiến nghị Giám đốc sở xem xét trách nhiệm, xử lý người có hành vi vi phạm thuộc quyền quản lý của sở.\n7. Kiến nghị Giám đốc sở giải quyết những vấn đề về công tác thanh tra; trường hợp kiến nghị đó không được chấp nhận thì báo cáo Chánh thanh tra tỉnh.\n8. Lãnh đạo cơ quan Thanh tra sở\nthực hiện nhiệm vụ, quyền hạn theo quy định của Luật này và các quy định khác của pháp luật.\nMục 3: \nTHANH TRA VIÊN, CỘNG TÁC VIÊN THANH TRA\nĐiều 30.\nThanh tra viên Thanh tra viên là công chức nhà\nnước được bổ nhiệm vào ngạch thanh tra để thực hiện nhiệm vụ thanh tra. Thanh tra viên được cấp trang phục, thẻ thanh tra viên.\nNgạch thanh tra, việc bổ nhiệm,\nmiễn nhiệm, cách chức Thanh tra viên do Chính phủ quy định.\nĐiều 31.\nTiêu chuẩn chung của Thanh tra viên 1. Người được bổ nhiệm vào ngạch thanh tra phải có đủ các tiêu chuẩn sau đây:\na) Trung thành với Tổ quốc và Hiến pháp nước Cộng hoà xã hội chủ nghĩa Việt Nam; có phẩm chất đạo đức tốt, có ý thức trách nhiệm, liêm khiết, trung thực, công minh, khách quan;\nb) Tốt nghiệp đại học, có kiến thức quản lý nhà nước và kiến thức pháp luật; đối với Thanh tra viên chuyên ngành còn phải có kiến thức chuyên môn về chuyên ngành đó;\nc) Có nghiệp vụ thanh tra;\nd) Có ít nhất hai năm làm công tác thanh tra đối với người mới được tuyển dụng vào ngành thanh tra (không kể\nthời gian tập sự); nếu là cán bộ, công chức công tác ở cơ quan, tổ chức khác chuyển sang cơ quan thanh tra nhà nước thì phải có ít nhất một năm làm công tác thanh tra. \n2. Căn cứ vào tiêu chuẩn quy định tại khoản 1 Điều này, Chính phủ quy định tiêu chuẩn cụ thể đối với Thanh tra viên của từng ngạch thanh tra.\nĐiều 32. Cộng tác viên thanh tra Trong hoạt động thanh tra, cơ\nquan thanh tra có quyền trưng tập cộng tác viên. \nCộng tác viên thanh tra là người có chuyên môn, nghiệp vụ phù hợp với nhiệm vụ thanh tra.\nTiêu chuẩn cụ\nthể, chế độ, trách nhiệm đối với cộng tác viên thanh tra; việc trưng tập cộng tác viên thanh tra do Chính phủ quy định.\nĐiều 33.\nTrách nhiệm của Thanh tra viên, cộng tác viên thanh tra Khi tiến hành thanh tra, Thanh tra viên, cộng tác viên thanh tra phải tuân thủ pháp luật, chịu trách nhiệm trước pháp luật về thực hiện nhiệm vụ được giao; Thanh tra viên còn phải chịu trách nhiệm trước Thủ trưởng cơ quan quản lý trực tiếp về nhiệm vụ thanh tra.\nThanh tra viên, cộng tác viên thanh tra có hành vi vi phạm pháp luật thì tuỳ theo tính chất, mức độ vi phạm mà bị xử lý kỷ luật hoặc bị truy cứu trách nhiệm hình sự; nếu gây thiệt hại thì\nphải bồi thường hoặc bồi hoàn theo quy định của pháp luật.\nChương 3:\nHOẠT ĐỘNG THANH TRA Mục 1:\nHOẠT ĐỘNG THANH TRA HÀNH CHÍNH\nĐiều 34.\nHình thức thanh tra hành chính 1. Hoạt động thanh tra hành chính được thực hiện dưới hình thức thanh tra theo chương trình, kế hoạch và\nthanh tra đột xuất.\n2. Thanh tra theo chương trình,\nkế hoạch được tiến hành theo chương trình, kế hoạch đã được phê duyệt. \n3. Thanh tra đột xuất được tiến hành khi phát hiện cơ quan, tổ chức, cá nhân có dấu hiệu vi phạm pháp luật,\ntheo yêu cầu của việc giải quyết khiếu nại, tố cáo hoặc do Thủ trưởng cơ quan quản lý nhà nước có thẩm quyền giao.\nĐiều 35. Thẩm quyền phê duyệt chương trình, kế hoạch thanh tra; quyết định việc thanh tra hành chính Thủ tướng Chính phủ, Bộ trưởng,\nChủ tịch Uỷ ban nhân dân cấp tỉnh, Chủ tịch Uỷ ban nhân dân cấp huyện, Giám đốc sở theo quy định của Luật này có trách nhiệm phê duyệt chương trình, kế hoạch thanh tra của năm sau do Tổng thanh tra, Chánh thanh tra cùng cấp trình chậm nhất vào ngày 31 tháng 12 của năm trước; quyết định việc thanh tra theo đề nghị của Tổng thanh tra, Chánh thanh tra cùng cấp.\nĐiều 36. Thẩm quyền, căn cứ ra quyết định thanh tra hành chính 1. Hoạt động thanh tra chỉ được thực hiện khi có quyết định thanh tra.\n2. Thủ trưởng cơ quan thanh tra ra quyết định thanh tra và thành lập Đoàn thanh tra để thực hiện quyết định thanh tra. Khi xét thấy cần thiết, Thủ trưởng cơ quan quản lý\nnhà nước ra quyết định thanh tra và thành lập Đoàn thanh tra.\nĐoàn thanh tra có Trưởng Đoàn thanh tra và các thành viên. \n3. Việc ra quyết định thanh tra phải có một trong các căn cứ sau đây:\na) Chương trình, kế hoạch thanh tra đã được phê duyệt;\nb) Yêu cầu của Thủ trưởng cơ\nquan quản lý nhà nước;\nc) Khi phát hiện có dấu hiệu vi phạm pháp luật.\nĐiều 37. Nội dung quyết định thanh tra hành chính 1. Quyết định thanh tra phải ghi rõ:\na) Căn cứ pháp lý để thanh tra;\nb) Đối tượng, nội dung, phạm vi,\nnhiệm vụ thanh tra;\nc) Thời hạn tiến hành thanh tra;\nd) Trưởng Đoàn thanh tra và các thành viên khác của Đoàn thanh tra.\n2. Chậm nhất là ba ngày kể từ\nngày ký, quyết định thanh tra phải được gửi cho đối tượng thanh tra, trừ trường hợp thanh tra đột xuất.\nQuyết định thanh tra phải được công bố chậm nhất là mười lăm ngày, kể từ ngày ra quyết định thanh tra. Việc công bố quyết định thanh tra phải được lập thành văn bản.\nĐiều 38. Thời hạn thanh tra hành chính 1. Thời hạn thực hiện một cuộc thanh tra được quy định như sau:\na) Cuộc thanh tra do Thanh tra Chính phủ tiến hành không quá sáu mươi ngày, trường hợp phức tạp thì có thể kéo dài, nhưng không quá chín mươi ngày. Đối với cuộc thanh tra đặc biệt phức tạp,\nliên quan đến nhiều lĩnh vực, nhiều địa phương thì thời hạn thanh tra có thể\nkéo dài, nhưng không quá một trăm năm mươi ngày;\nb) Cuộc thanh tra do Thanh tra tỉnh,\nThanh tra bộ tiến hành không quá bốn mươi lăm ngày, trường hợp phức tạp thì có\nthể kéo dài, nhưng không quá bảy mươi ngày; \nc) Cuộc thanh tra do Thanh tra huyện, Thanh tra sở tiến hành không quá ba mươi ngày; ở miền núi, nơi nào đi lại khó khăn thì thời hạn thanh tra có thể kéo dài, nhưng không quá bốn mươi lăm ngày. \n2. Thời hạn của cuộc thanh tra\nđược tính từ ngày công bố quyết định thanh tra đến khi kết thúc việc thanh tra tại nơi được thanh tra.\n3. Việc kéo dài thời hạn thanh tra quy định tại khoản 1 Điều này do người có thẩm quyền ra quyết định thanh tra quyết định.\nĐiều 39.\nNhiệm vụ, quyền hạn của Trưởng Đoàn thanh tra hành chính 1. Trong quá trình thanh tra,\nTrưởng Đoàn thanh tra có những nhiệm vụ, quyền hạn sau đây:\na) Tổ chức, chỉ đạo các thành viên trong Đoàn thanh tra thực hiện đúng nội dung, đối tượng, thời hạn đã ghi trong quyết định thanh tra; \nb) Kiến nghị với người ra quyết\nđịnh thanh tra áp dụng các biện pháp theo thẩm quyền để bảo đảm thực hiện nhiệm vụ của Đoàn thanh tra;\nc) Yêu cầu đối tượng thanh tra cung cấp thông tin, tài liệu, báo cáo bằng văn bản, giải trình về những vấn đề liên quan đến nội dung thanh tra; khi cần thiết có thể tiến hành kiểm kê tài sản của đối tượng thanh tra liên quan đến nội dung thanh tra;\nd) Yêu cầu cơ quan, tổ chức, cá nhân có thông tin, tài liệu liên quan đến nội dung thanh tra cung cấp thông tin, tài liệu đó;\nđ) Yêu cầu người có thẩm quyền tạm giữ tiền, đồ vật, giấy phép được cấp hoặc sử dụng trái pháp luật khi xét thấy cần ngăn chặn ngay việc vi phạm pháp luật hoặc để xác minh tình tiết làm chứng cứ cho việc kết luận, xử lý; \ne) Quyết định niêm phong tài liệu của đối tượng thanh tra khi có căn cứ cho rằng có vi phạm pháp luật; \ng) Tạm đình chỉ hoặc kiến nghị người có thẩm quyền đình chỉ việc làm khi xét thấy việc làm\nđó gây thiệt hại nghiêm trọng đến lợi ích của Nhà nước, quyền và lợi ích hợp pháp của cơ quan, tổ chức, cá nhân;\nh) Kiến nghị người có thẩm quyền tạm đình chỉ việc thi hành quyết định kỷ luật, thuyên chuyển công tác, cho nghỉ\nhưu đối với người đang cộng tác với cơ quan thanh tra hoặc đang là đối tượng thanh tra nếu xét thấy việc thi hành quyết định đó gây trở ngại cho việc thanh tra;\ni) Báo cáo với người ra quyết định thanh tra về kết quả thanh tra và chịu trách nhiệm về tính chính xác, trung thực,\nkhách quan của báo cáo đó.\n2. Khi xét thấy không cần thiết\náp dụng các biện pháp quy định tại các điểm đ, e, g và h khoản 1 Điều này thì\nTrưởng Đoàn thanh tra phải quyết định hoặc kiến nghị huỷ bỏ ngay việc áp dụng các biện pháp đó.\n3. Khi thực hiện nhiệm vụ, quyền hạn quy định tại khoản 1 Điều này, Trưởng Đoàn thanh tra phải chịu trách nhiệm trước pháp luật về mọi quyết định của mình; nếu có hành vi vi phạm pháp luật thì tuỳ theo tính chất, mức độ vi phạm mà bị xử lý kỷ luật hoặc bị truy cứu trách nhiệm hình sự; nếu gây thiệt hại thì phải bồi thường hoặc bồi hoàn theo quy định của pháp luật.\nĐiều 40.\nNhiệm vụ, quyền hạn của thành viên Đoàn thanh tra hành chính 1. Trong quá trình thanh tra,\nThanh tra viên là thành viên Đoàn thanh tra có những nhiệm vụ, quyền hạn sau\nđây:\na) Thực hiện nhiệm vụ theo sự\nphân công của Trưởng Đoàn thanh tra;\nb) Yêu cầu đối tượng thanh tra cung cấp thông tin, tài liệu, báo cáo bằng văn bản, giải trình về những vấn đề liên quan đến nội dung thanh tra; yêu cầu cơ quan, tổ chức, cá nhân có thông tin, tài liệu liên quan đến nội dung thanh tra cung cấp thông tin, tài liệu đó;\nc) Kiến nghị Trưởng Đoàn thanh tra áp dụng các biện pháp thuộc nhiệm vụ, quyền hạn của Trưởng Đoàn thanh tra quy định tại Điều 39 của Luật này để bảo đảm thực hiện nhiệm vụ được giao;\nd) Kiến nghị việc xử lý về những vấn đề khác liên quan đến nội dung thanh tra;\nđ) Báo cáo kết quả thực hiện nhiệm vụ được giao với Trưởng Đoàn thanh tra, chịu trách nhiệm trước pháp luật và Trưởng\nĐoàn thanh tra về tính chính xác, trung thực, khách quan của nội dung đã báo cáo.\n2. Trong quá trình thanh tra,\ncác thành viên khác của Đoàn thanh tra thực hiện nhiệm vụ, quyền hạn quy định tại các điểm a, c, d và đ khoản 1 Điều này.\nĐiều 41.\nBáo cáo kết quả thanh tra hành chính 1. Chậm nhất là mười lăm ngày, kể\ntừ ngày kết thúc cuộc thanh tra, Trưởng Đoàn thanh tra phải có văn bản báo cáo kết quả thanh tra. Báo cáo kết quả thanh tra phải có các nội dung sau đây: \na) Kết luận cụ thể về từng nội dung đã tiến hành thanh tra;\nb) Xác định rõ tính chất, mức độ\nvi phạm, nguyên nhân, trách nhiệm của cơ quan, tổ chức, cá nhân có hành vi vi phạm (nếu có);\nc) ý kiến khác nhau giữa thành viên Đoàn thanh tra với Trưởng Đoàn thanh tra về nội dung báo cáo kết quả thanh tra (nếu có);\nd) Các biện pháp xử lý theo thẩm quyền đã được áp dụng; kiến nghị các biện pháp xử lý.\n2. Báo cáo kết quả thanh tra được gửi tới người ra quyết định thanh tra. Trong trường hợp người ra quyết định thanh tra là Thủ trưởng cơ quan quản lý nhà nước thì báo cáo kết quả thanh tra còn được gửi cho Thủ trưởng cơ quan thanh tra cùng cấp.\nĐiều 42.\nNhiệm vụ, quyền hạn của người ra quyết định thanh tra hành chính 1. Người ra quyết định thanh tra có những nhiệm vụ, quyền hạn sau đây:\na) Chỉ đạo, kiểm tra Đoàn thanh tra thực hiện đúng nội dung, thời hạn ghi trong quyết định thanh tra;\nb) Yêu cầu đối tượng thanh tra cung cấp thông tin, tài liệu, báo cáo bằng văn bản, giải trình về những vấn đề liên quan đến nội dung thanh tra; yêu cầu cơ quan, tổ chức, cá nhân có thông tin, tài liệu liên quan đến nội dung thanh tra cung cấp thông tin, tài liệu đó;\nc) Trưng cầu giám định về những vấn đề liên quan đến nội dung thanh tra;\nd) Yêu cầu người có thẩm quyền tạm giữ tiền, đồ vật, giấy phép được cấp hoặc sử dụng trái pháp luật khi xét thấy cần ngăn chặn ngay việc vi phạm pháp luật hoặc để xác minh tình tiết làm chứng cứ cho việc kết luận, xử lý; \nđ) Tạm đình chỉ hoặc kiến nghị người có thẩm quyền đình chỉ việc làm khi xét thấy việc làm\nđó gây thiệt hại nghiêm trọng đến lợi ích của Nhà nước, quyền và lợi ích hợp pháp của cơ quan, tổ chức, cá nhân;\ne) Kiến nghị người có thẩm quyền tạm đình chỉ việc thi hành quyết định kỷ luật, thuyên chuyển công tác, cho nghỉ\nhưu đối với người đang cộng tác với cơ quan thanh tra hoặc đang là đối tượng thanh tra nếu xét thấy việc thi hành quyết định đó gây trở ngại cho việc thanh tra;\ng) Kiến nghị người có thẩm quyền tạm đình chỉ công tác và xử lý đối với cán bộ, công chức cố ý cản trở việc thanh tra hoặc không thực hiện yêu cầu, kiến nghị, quyết định thanh tra;\nh) Ra quyết định xử lý theo thẩm quyền hoặc kiến nghị người có thẩm quyền xử lý; kiểm tra, đôn đốc việc thực hiện quyết định xử lý về thanh tra;\ni) Quyết định thu hồi tiền, tài sản bị chiếm đoạt, sử dụng trái phép hoặc bị thất thoát do hành vi trái pháp luật của đối tượng thanh tra gây ra theo quy định của pháp luật;\nk) Giải quyết khiếu nại, tố cáo liên quan đến trách nhiệm của Trưởng Đoàn thanh tra, các thành viên khác của\nĐoàn thanh tra;\nl) Kết luận về nội dung thanh tra;\nm) Chuyển hồ sơ vụ việc vi phạm pháp luật sang cơ quan điều tra trong thời hạn năm ngày, kể từ ngày phát hiện có dấu hiệu của tội phạm; đồng thời thông báo bằng văn bản cho Viện kiểm sát cùng cấp biết. \n2. Khi xét thấy không cần thiết\náp dụng các biện pháp quy định tại các điểm d, đ, e và g khoản 1 Điều này thì\nngười ra quyết định thanh tra phải quyết định hoặc kiến nghị huỷ bỏ ngay việc\náp dụng các biện pháp đó.\n3. Khi thực hiện nhiệm vụ, quyền hạn quy định tại khoản 1 Điều này, người ra quyết định thanh tra phải chịu trách nhiệm trước pháp luật về mọi quyết định của mình; nếu có hành vi vi phạm pháp luật thì tuỳ theo tính chất, mức độ vi phạm mà bị xử lý kỷ luật hoặc bị\ntruy cứu trách nhiệm hình sự; nếu gây thiệt hại thì phải bồi thường hoặc bồi hoàn theo quy định của pháp luật.\nĐiều 43. Kết luận thanh tra 1. Chậm nhất là mười lăm ngày, kể\ntừ ngày nhận được báo cáo kết quả thanh tra, người ra quyết định thanh tra phải ra văn bản kết luận thanh tra. Kết luận thanh tra phải có các nội dung sau đây:\na) Đánh giá việc thực hiện chính sách, pháp luật, nhiệm vụ của đối tượng thanh tra thuộc nội dung thanh tra;\nb) Kết luận về nội dung được thanh tra;\nc) Xác định rõ tính chất, mức độ\nvi phạm, nguyên nhân, trách nhiệm của cơ quan, tổ chức, cá nhân có hành vi vi phạm (nếu có);\nd) Các biện pháp xử lý theo thẩm quyền đã được áp dụng; kiến nghị các biện pháp xử lý.\n2. Trong quá trình ra văn bản kết luận thanh tra, người ra quyết định thanh tra có quyền yêu cầu Trưởng Đoàn thanh tra, thành viên Đoàn thanh tra báo cáo, yêu cầu đối tượng thanh tra giải trình để làm rõ thêm những vấn đề cần thiết phục vụ cho việc ra kết luận thanh tra.\n3. Kết luận thanh tra được gửi tới Thủ trưởng cơ quan quản lý nhà nước cùng cấp và đối tượng thanh tra. Trường hợp Thủ trưởng cơ quan quản lý nhà nước là người ra quyết định thanh tra thì kết luận thanh tra còn được gửi cho Thủ trưởng cơ quan thanh tra cùng cấp.\nĐiều 44. Việc xem xét, xử lý kết luận thanh tra Trong thời hạn mười lăm ngày, kể\ntừ ngày có kết luận thanh tra, Thủ trưởng cơ quan quản lý nhà nước cùng cấp có\ntrách nhiệm xem xét kết luận thanh tra; xử lý đối với cơ quan, tổ chức, cá nhân có vi phạm pháp luật; áp dụng các biện pháp theo thẩm quyền hoặc kiến nghị cơ\nquan nhà nước có thẩm quyền áp dụng biện pháp khắc phục, hoàn thiện cơ chế,\nchính sách, pháp luật.\nMục 2:\nHOẠT ĐỘNG THANH TRA CHUYÊN NGÀNH\nĐiều 45.\nHình thức thanh tra chuyên ngành Hoạt động thanh tra chuyên ngành\nđược thực hiện theo các hình thức quy định tại Điều 34 của Luật này.\nĐiều 46. Thẩm quyền phê duyệt chương trình, kế hoạch thanh tra; quyết định việc thanh tra chuyên ngành Bộ trưởng, Giám đốc sở có trách nhiệm phê duyệt chương trình, kế hoạch thanh tra chuyên ngành, quyết định việc thanh tra do Chánh thanh tra cùng cấp trình.\nĐiều 47. Thẩm quyền, căn cứ ra quyết định thanh tra, nội dung quyết định thanh tra chuyên ngành 1. Chánh thanh tra bộ, Chánh thanh tra sở ra quyết định thanh tra và thành lập Đoàn thanh tra để thực hiện quyết định thanh tra hoặc phân công Thanh tra viên chuyên ngành thực hiện nhiệm vụ thanh tra. Khi xét thấy cần thiết, Bộ trưởng, Giám đốc sở ra quyết định thanh tra và thành lập Đoàn thanh tra. Trong quyết định thanh tra phải có các nội dung theo quy định tại Điều 37 của Luật này.\nTrong trường hợp phân công thanh tra viên chuyên ngành tiến hành thanh tra độc lập thì người có thẩm quyền ra quyết định thanh tra phải xác định rõ phạm vi, nhiệm vụ, thời hạn tiến hành thanh tra. \n2. Ngoài những người có thẩm quyền quy định tại khoản 1 Điều này, Chính phủ quy định người được ra quyết định thanh tra, thành lập Đoàn thanh tra và phân công Thanh tra viên chuyên ngành đối với một số ngành, lĩnh vực.\n3. Căn cứ ra quyết định thanh tra chuyên ngành được thực hiện theo quy định tại khoản 3 Điều 36 của Luật này.\nĐiều 48. Thời hạn thanh tra chuyên ngành 1. Thời hạn một cuộc thanh tra chuyên ngành được tổ chức theo Đoàn thanh tra không quá ba mươi ngày, kể từ\nngày công bố quyết định thanh tra đến khi kết thúc việc thanh tra tại nơi được thanh tra.\n2. Trong trường hợp cần thiết,\nngười ra quyết định thanh tra có thể gia hạn một lần. Thời gian gia hạn không vượt quá thời hạn quy định tại khoản 1 Điều này.\nĐiều 49.\nNhiệm vụ, quyền hạn của Trưởng Đoàn thanh tra chuyên ngành Trong quá trình thanh tra chuyên ngành, Trưởng Đoàn thanh tra có những nhiệm vụ, quyền hạn sau đây:\n1. Yêu cầu đối tượng thanh tra xuất trình giấy phép, đăng ký kinh doanh, chứng chỉ hành nghề; \n2. Lập biên bản về việc vi phạm của đối tượng thanh tra;\n3. Xử phạt vi phạm hành chính theo quy định của pháp luật về xử lý vi phạm hành chính;\n4. Thực hiện nhiệm vụ, quyền hạn khác quy định tại Điều 39 của Luật này;\n5. Báo cáo với người ra quyết định thanh tra về kết quả thanh tra và chịu trách nhiệm về tính chính xác, trung thực,\nkhách quan của báo cáo đó. \nĐiều 50.\nNhiệm vụ, quyền hạn của Thanh tra viên chuyên ngành 1. Thanh tra viên chuyên ngành khi tiến hành thanh tra theo Đoàn thì thực hiện các nhiệm vụ, quyền hạn theo quy định tại khoản 1 Điều 40 của Luật này. \n2. Thanh tra viên chuyên ngành khi tiến hành thanh tra độc lập phải xuất trình thẻ Thanh tra viên chuyên ngành và có những nhiệm vụ, quyền hạn sau đây:\na) Yêu cầu đối tượng thanh tra xuất trình giấy phép, đăng ký kinh doanh, chứng chỉ hành nghề; \nb) Lập biên bản về việc vi phạm của đối tượng thanh tra; \nc) Xử phạt vi phạm hành chính theo quy định của pháp luật về xử lý vi phạm hành chính.\nTrong trường hợp phát hiện hành vi vi phạm pháp luật vượt quá thẩm quyền xử lý của mình thì thanh tra viên chuyên ngành phải báo cáo Chánh thanh tra quyết định;\nd) Báo cáo Chánh thanh tra về việc thực hiện nhiệm vụ được phân công. \nĐiều 51.\nBáo cáo kết quả thanh tra chuyên ngành Thời hạn báo cáo, nội dung báo cáo kết quả thanh tra chuyên ngành của Đoàn thanh tra được thực hiện theo quy định tại Điều 41 của Luật này.\nĐiều 52.\nNhiệm vụ, quyền hạn của người ra quyết định thanh tra chuyên ngành, trách nhiệm của Thủ trưởng cơ quan quản lý nhà nước 1. Người ra quyết định thanh tra chuyên ngành có những nhiệm vụ, quyền hạn quy định tại\nĐiều 42 và Điều 43 của Luật này; có\nquyền xử phạt vi phạm hành chính theo quy định của pháp luật về xử lý vi phạm hành chính.\n2. Thủ trưởng cơ quan quản lý\nnhà nước có trách nhiệm thực hiện quy định tại Điều 44 của Luật này.\nMục 3: \nQUYỀN VÀ NGHĨA VỤ CỦA ĐỐI TƯỢNG THANH TRA; GIẢI QUYẾT KHIẾU NẠI, TỐ CÁO VỀ THANH TRA\nĐiều 53.\nQuyền của đối tượng thanh tra 1. Đối tượng thanh tra có các quyền sau đây:\na) Giải trình về những vấn đề có\nliên quan đến nội dung thanh tra;\nb) Từ chối cung cấp thông tin,\ntài liệu thuộc bí mật nhà nước khi pháp luật có quy định và thông tin, tài liệu không liên quan đến nội dung thanh tra;\nc) Khiếu nại với người ra quyết\nđịnh thanh tra về quyết định, hành vi của Trưởng Đoàn thanh tra, Thanh tra viên, các thành viên khác của Đoàn thanh tra trong quá trình thanh tra khi có\ncăn cứ cho rằng quyết định, hành vi đó là trái pháp luật; khiếu nại với Thủ trưởng cơ quan thanh tra, Thủ trưởng cơ quan quản lý nhà nước có thẩm quyền về kết luận thanh tra, quyết định xử lý về thanh tra khi có căn cứ cho rằng kết luận, quyết\nđịnh đó là trái pháp luật. Trong khi chờ việc giải quyết thì người khiếu nại vẫn phải thực hiện các quyết định đó;\nd) Yêu cầu bồi thường thiệt hại theo quy định của pháp luật.\n2. Cá nhân là đối tượng thanh tra có quyền tố cáo về hành vi vi phạm pháp luật của Thủ trưởng cơ quan thanh tra, Trưởng Đoàn thanh tra, Thanh tra viên và các thành viên khác của Đoàn thanh tra.\nĐiều 54.\nNghĩa vụ của đối tượng thanh tra 1. Chấp hành quyết định thanh tra.\n2. Cung cấp kịp thời, đầy đủ,\nchính xác các thông tin, tài liệu theo yêu cầu của cơ quan Thanh tra, Đoàn thanh tra, Thanh tra viên và phải chịu trách nhiệm trước pháp luật về tính chính xác, trung thực của thông tin, tài liệu đã cung cấp.\n3. Chấp hành yêu cầu, kết luận thanh tra, quyết định xử lý của cơ quan thanh tra, Trưởng Đoàn thanh tra, Thanh tra viên và cơ quan nhà nước có thẩm quyền. \nĐiều 55. Giải quyết khiếu nại, tố cáo về thanh tra Việc khiếu nại, tố cáo và giải quyết khiếu nại, tố cáo được thực hiện theo quy định của pháp luật về khiếu nại,\ntố cáo.\nMục 4: HỒ SƠ\nTHANH TRA, TRÁCH NHIỆM CỦA CƠ QUAN ĐIỀU TRA\nĐiều 56. Hồ\nsơ thanh tra 1. Cuộc thanh tra phải được lập thành hồ sơ. Hồ sơ thanh tra gồm có:\na) Quyết định thanh tra; biên bản thanh tra do Đoàn thanh tra, Thanh tra viên lập; báo cáo, giải trình của đối tượng thanh tra; báo cáo kết quả thanh tra;\nb) Kết luận thanh tra;\nc) Văn bản về việc xử lý, kiến nghị việc xử lý;\nd) Các tài liệu khác có liên quan đến cuộc thanh tra.\n2. Việc quản lý, sử dụng hồ sơ\nthanh tra được thực hiện theo quy định của pháp luật về lưu trữ.\nĐiều 57.\nTrách nhiệm của cơ quan điều tra Cơ quan điều tra có trách nhiệm tiếp nhận hồ sơ vụ việc vi phạm pháp luật quy định tại điểm m khoản 1 Điều 42 của Luật này và xử lý theo quy định của pháp luật tố tụng hình sự.\nTrong thời hạn hai mươi ngày, kể\ntừ ngày nhận được hồ sơ, cơ quan điều tra phải thông báo bằng văn bản về việc xử\nlý cho cơ quan thanh tra; trường hợp vụ việc có nội dung, tình tiết phức tạp thì thời hạn trả lời có thể kéo dài, nhưng không quá sáu mươi ngày; quá thời hạn này mà cơ quan thanh tra không nhận được thông báo bằng văn bản về việc xử lý của cơ quan điều tra thì có quyền kiến nghị cơ quan điều tra cấp trên và Viện kiểm sát nhân dân cấp trên.\nChương 4:\nTHANH TRA NHÂN DÂN\nĐiều 58. Tổ\nchức Thanh tra nhân dân Thanh tra nhân dân được tổ chức dưới hình thức Ban thanh tra nhân dân.\nBan thanh tra nhân dân được thành lập ở xã, phường, thị trấn, cơ quan nhà nước, đơn vị sự nghiệp, doanh nghiệp nhà nước.\nĐiều 59. Nhiệm vụ, quyền hạn của Ban thanh tra nhân dân 1. Giám sát việc thực hiện chính sách, pháp luật, việc giải quyết khiếu nại, tố cáo, việc thực hiện quy chế dân chủ ở cơ sở của cơ quan, tổ chức, cá nhân có trách nhiệm ở xã, phường, thị trấn,\ncơ quan nhà nước, đơn vị sự nghiệp, doanh nghiệp nhà nước.\n2. Khi phát hiện có dấu hiệu vi phạm pháp luật thì kiến nghị người có thẩm quyền xử lý theo quy định của pháp luật và giám sát việc thực hiện kiến nghị đó.\n3. Khi cần thiết, được Chủ tịch Uỷ ban nhân dân xã, phường, thị trấn, người đứng đầu cơ quan nhà nước, đơn vị sự\nnghiệp, doanh nghiệp nhà nước giao xác minh những vụ việc nhất định.\n4. Kiến nghị với Chủ tịch Uỷ ban nhân dân xã, phường, thị trấn, người đứng đầu cơ quan nhà nước, đơn vị sự nghiệp,\ndoanh nghiệp nhà nước khắc phục sơ hở, thiếu sót được phát hiện qua việc giám sát; bảo đảm quyền và lợi ích hợp pháp của công dân và người lao động, biểu dương những đơn vị, cá nhân có thành tích. Trường hợp phát hiện người có hành vi vi phạm pháp luật thì kiến nghị cơ quan, tổ chức có thẩm quyền xem xét, xử\nlý.\nMục 1: BAN THANH TRA NHÂN DÂN Ở XÃ, PHƯỜNG, THỊ TRẤN\nĐiều 60. Tổ\nchức Ban thanh tra nhân dân ở xã, phường, thị trấn 1. Ban thanh tra nhân dân ở xã,\nphường, thị trấn do Hội nghị nhân dân hoặc Hội nghị đại biểu nhân dân tại thôn,\nlàng, ấp, bản, tổ dân phố bầu.\nCăn cứ vào địa bàn và số lượng dân cư, mỗi Ban thanh tra nhân dân ở xã, phường, thị trấn có từ năm đến mười một thành viên.\nThành viên Ban thanh tra nhân dân không phải là người đương nhiệm trong Uỷ ban nhân dân xã, phường, thị trấn.\nNhiệm kỳ của Ban thanh tra nhân dân xã, phường, thị trấn là hai năm.\n2. Trong nhiệm kỳ, thành viên Ban thanh tra nhân dân không hoàn thành nhiệm vụ hoặc không còn được nhân dân tín nhiệm thì Uỷ ban Mặt trận Tổ quốc Việt Nam xã, phường, thị trấn đề nghị Hội nghị nhân dân hoặc Hội nghị đại biểu nhân dân đã bầu ra thành viên đó bãi nhiệm và bầu người khác thay thế. \nĐiều 61. Hoạt\nđộng của Ban thanh tra nhân dân ở xã, phường, thị trấn 1. Ban thanh tra nhân dân ở xã,\nphường, thị trấn do Uỷ ban Mặt trận Tổ quốc Việt Nam cùng cấp trực tiếp chỉ đạo hoạt động.\n2. Ban thanh tra nhân dân căn cứ\nvào Nghị quyết của Hội đồng nhân dân xã, phường, thị trấn, chương trình hành động và sự chỉ đạo của Uỷ ban Mặt trận Tổ quốc Việt Nam xã, phường, thị trấn đề ra phương hướng, nội dung kế hoạch hoạt động của mình.\n3. Ban thanh tra nhân dân có\ntrách nhiệm báo cáo về hoạt động của mình với Uỷ ban Mặt trận Tổ quốc Việt Nam xã, phường, thị trấn. Khi cần thiết, Trưởng Ban thanh tra nhân dân được mời tham dự cuộc họp của Hội đồng nhân dân, Uỷ ban nhân dân, Uỷ ban Mặt trận Tổ quốc Việt Nam xã, phường, thị trấn. \nĐiều 62.\nTrách nhiệm của Uỷ ban nhân dân xã, phường, thị trấn 1. Thông báo cho Ban thanh tra nhân dân những chính sách, pháp luật chủ yếu liên quan đến tổ chức, hoạt động,\nnhiệm vụ của Hội đồng nhân dân, Uỷ ban nhân dân xã, phường, thị trấn; các mục tiêu và nhiệm vụ phát triển kinh tế - xã hội hàng năm của địa phương.\n2. Yêu cầu tổ chức, cá nhân có\nliên quan cung cấp đầy đủ và kịp thời các thông tin, tài liệu cần thiết cho Ban thanh tra nhân dân.\n3. Xem xét, giải quyết kịp thời các kiến nghị của Ban thanh tra nhân dân, thông báo kết quả giải quyết trong thời hạn chậm nhất không quá mười lăm ngày, kể từ ngày nhận được kiến nghị đó; xử lý\nngười có hành vi cản trở hoạt động của Ban thanh tra nhân dân hoặc người có\nhành vi trả thù, trù dập thành viên Ban thanh tra nhân dân.\n4. Thông báo cho Ban thanh tra nhân dân kết quả giải quyết khiếu nại, tố cáo, việc thực hiện quy chế dân chủ ở\ncơ sở.\n5. Hỗ trợ kinh phí, phương tiện\nđể Ban thanh tra nhân dân hoạt động theo quy định của pháp luật.\nĐiều 63.\nTrách nhiệm của Uỷ ban Mặt trận Tổ quốc Việt Nam xã, phường, thị trấn 1. Hướng dẫn việc tổ chức Hội nghị nhân dân hoặc Hội nghị đại biểu nhân dân ở thôn, làng, ấp, bản, tổ dân phố\nbầu Ban thanh tra nhân dân.\n2. Ra văn bản công nhận Ban thanh tra nhân dân và thông báo cho Hội đồng nhân dân, Uỷ ban nhân dân cùng cấp và nhân dân ở địa phương; tổ chức cuộc họp của Ban thanh tra nhân dân để Ban thanh tra nhân dân bầu Trưởng ban, Phó Trưởng ban, phân công nhiệm vụ cho từng thành viên.\n3. Hướng dẫn Ban thanh tra nhân dân xây dựng chương trình, nội dung công tác; định kỳ nghe báo cáo về hoạt động của Ban thanh tra nhân dân; đôn đốc việc giải quyết những kiến nghị của Ban thanh tra nhân dân.\n4. Động viên nhân dân ở địa phương ủng hộ, phối hợp, tham gia các hoạt động của Ban thanh tra nhân dân.\n5. Xác nhận biên bản, kiến nghị\ncủa Ban thanh tra nhân dân.\nMục 2: BAN THANH TRA NHÂN DÂN Ở CƠ QUAN NHÀ NƯỚC, ĐƠN VỊ SỰ NGHIỆP, DOANH NGHIỆP NHÀ NƯỚC\nĐiều 64. Tổ\nchức Ban thanh tra nhân dân ở cơ quan nhà nước, đơn vị sự nghiệp, doanh nghiệp nhà nước 1. Ban thanh tra nhân dân ở cơ\nquan nhà nước, đơn vị sự nghiệp, doanh nghiệp nhà nước do Hội nghị công nhân,\nviên chức hoặc Hội nghị đại biểu công nhân, viên chức bầu. \nBan thanh tra nhân dân có từ ba\nđến chín thành viên là người lao động hoặc đang công tác trong cơ quan nhà nước,\nđơn vị sự nghiệp, doanh nghiệp nhà nước.\nNhiệm kỳ của Ban thanh tra nhân dân là hai năm.\n2. Trong nhiệm kỳ, nếu thành viên Ban thanh tra nhân dân không hoàn thành nhiệm vụ hoặc không còn được tín nhiệm thì Ban chấp hành Công đoàn cơ sở đề nghị Hội nghị công nhân, viên chức hoặc Hội nghị đại biểu công nhân, viên chức bãi nhiệm và bầu người khác thay thế.\nĐiều 65. Hoạt\nđộng của Ban thanh tra nhân dân ở cơ quan nhà nước, đơn vị sự nghiệp, doanh nghiệp nhà nước 1. Ban thanh tra nhân dân ở cơ\nquan nhà nước, đơn vị sự nghiệp, doanh nghiệp nhà nước do Ban chấp hành Công\nđoàn cơ sở trực tiếp chỉ đạo hoạt động.\n2. Căn cứ vào nghị quyết Hội nghị\ncông nhân, viên chức hoặc Hội nghị đại biểu công nhân, viên chức của cơ quan nhà nước, đơn vị sự nghiệp, doanh nghiệp nhà nước và sự chỉ đạo của Ban chấp hành Công đoàn cơ sở, Ban thanh tra nhân dân lập chương trình công tác theo từng quý, từng năm.\n3. Ban thanh tra nhân dân có\ntrách nhiệm báo cáo về hoạt động của mình với Ban chấp hành Công đoàn cơ sở, Hội nghị công nhân, viên chức hoặc Hội nghị đại biểu công nhân, viên chức của cơ\nquan nhà nước, đơn vị sự nghiệp, doanh nghiệp nhà nước.\nĐiều 66.\nTrách nhiệm của người đứng đầu cơ quan nhà nước, đơn vị sự nghiệp, doanh nghiệp nhà nước 1. Thông báo cho Ban thanh tra nhân dân về các chế độ, chính sách và những thông tin cần thiết khác; bảo đảm quyền lợi đối với thành viên Ban thanh tra nhân dân trong thời gian thành viên\nđó thực hiện nhiệm vụ.\n2. Yêu cầu các đơn vị, cá nhân thuộc quyền quản lý cung cấp kịp thời, đầy đủ các thông tin, tài liệu liên quan trực tiếp đến nội dung giám sát để Ban thanh tra nhân dân thực hiện nhiệm vụ.\n3. Xem xét, giải quyết kịp thời các kiến nghị của Ban thanh tra nhân dân; thông báo kết quả giải quyết trong thời hạn chậm nhất không quá mười lăm ngày, kể từ ngày nhận được kiến nghị đó; xử lý\nngười có hành vi cản trở hoạt động của Ban thanh tra nhân dân hoặc người có\nhành vi trả thù, trù dập thành viên Ban thanh tra nhân dân.\n4. Thông báo cho Ban thanh tra nhân dân kết quả giải quyết khiếu nại, tố cáo, việc thực hiện quy chế dân chủ ở\ncơ sở.\n5. Hỗ trợ kinh phí, phương tiện\nđể Ban thanh tra nhân dân hoạt động theo quy định của pháp luật.\nĐiều 67.\nTrách nhiệm của Ban chấp hành Công đoàn cơ sở\n1. Phối hợp với người đứng đầu cơ quan nhà nước, đơn vị sự nghiệp, doanh nghiệp nhà nước tổ chức Hội nghị công nhân, viên chức hoặc Hội nghị đại biểu công nhân, viên chức bầu Ban thanh tra nhân dân.\n2. Ra văn bản công nhận Ban thanh tra nhân dân và thông báo cho cán bộ, công nhân, viên chức trong cơ quan nhà nước, đơn vị sự nghiệp, doanh nghiệp nhà nước; tổ chức cuộc họp của Ban thanh tra nhân dân để Ban thanh tra nhân dân bầu Trưởng ban, Phó Trưởng ban,\nphân công nhiệm vụ cho từng thành viên.\n3. Hướng dẫn Ban thanh tra nhân dân xây dựng chương trình, nội dung công tác, định kỳ nghe báo cáo kết quả hoạt\nđộng và giải quyết kiến nghị của Ban thanh tra nhân dân đối với Ban chấp hành Công đoàn cơ sở.\n4. Động viên người lao động ở cơ\nquan nhà nước, đơn vị sự nghiệp, doanh nghiệp nhà nước ủng hộ, tham gia hoạt động của Ban thanh tra nhân dân.\n5. Xác nhận biên bản, kiến nghị\ncủa Ban thanh tra nhân dân.\nChương 5:\nĐIỀU KHOẢN THI HÀNH\nĐiều 68. Hoạt\nđộng thanh tra trong các cơ quan khác của Nhà nước; tổ chức và hoạt động thanh tra trong Quân đội nhân dân, Công an nhân dân 1. Căn cứ vào quy định của Luật này và các quy định khác của pháp luật, trong phạm vi nhiệm vụ, quyền hạn của mình, Toà án nhân dân tối cao, Viện kiểm sát nhân dân tối cao, các cơ quan khác của Nhà nước tổ chức và chỉ đạo hoạt động thanh tra trong ngành, cơ quan mình.\n2. Tổ chức và hoạt động thanh tra trong Quân đội nhân dân, Công an nhân dân do Chính phủ quy định.\nĐiều 69. Hiệu lực thi hành Luật này có hiệu lực thi hành từ\nngày 01 tháng 10 năm 2004.\nPháp lệnh thanh tra ngày 29 tháng 3 năm 1990 hết hiệu lực kể từ ngày Luật này có hiệu lực thi hành.\nĐiều 70. Hướng dẫn thi hành Chính phủ quy định chi tiết thi hành Luật này.\nUỷ ban trung ương Mặt trận Tổ quốc Việt Nam, Tổng Liên đoàn lao động Việt Nam phối hợp với Chính phủ hướng dẫn cụ\nthể về tổ chức và hoạt động của các Ban thanh tra nhân dân.\nLuật này đã được Quốc hội nước Cộng hòa xã hội chủ nghĩa Việt Nam khóa XI, kỳ họp thứ 5 thông qua ngày 15 tháng 6 năm 2004.\nNguyễn Văn An\n (Đã\n ký)"
}