{
  "url": "https://thuvienphapluat.vn/van-ban/Quyen-dan-su/Luat-Bao-chi-1989-29-LCT-HDNN8-37876.aspx",
  "title": "Luật Báo chí 1989 29-LCT/HĐNN8",
  "properties": {
    "Số hiệu": "29-LCT/HĐNN8",
    "Loại văn bản": "Luật",
    "Nơi ban hành": "Quốc hội",
    "Người ký": "Võ Chí Công",
    "Ngày ban hành": "28/12/1989",
    "Ngày hiệu lực": "Đã biết",
    "Ngày công báo": "Đã biết",
    "Số công báo": "Đã biết",
    "Tình trạng": "Đã biết"
  },
  "content": "QUỐC HỘI\n --------\nCỘNG HOÀ XÃ HỘI CHỦ NGHĨA VIỆT NAM\n Độc lập - Tự do - Hạnh phúc\n ---------------\nSố:\n 29-LCT/HĐNN8 Hà\n Nội, ngày 28 tháng 12 năm 1989 LUẬT CỦA QUỐC HỘI SỐ 29-LCT/HĐNN8 NGÀY 28/12/1989 VỀ BÁO CHÍ\nĐể bảo đảm quyền tự do báo chí, quyền tự do ngôn luận trên báo chí của công dân, phù hợp với lợi ích của chủ nghĩa xã hội và của nhân dân ;\nĐể phát huy vai trò của báo chí trong sự nghiệp xây dựng chủ nghĩa xã hội và bảo vệ Tổ quốc theo đường lối đổi mới của Đảng cộng sản Việt Nam ;\nCăn cứ vào\nĐiều 4, Điều 67 và Điều 83 của Hiến pháp nước Cộng hoà xã hội chủ\nnghĩa Việt Nam ;\nLuật này quy định chế độ báo chí.\nChương 1:\nNHỮNG QUY ĐỊNH CHUNG \nĐiều 1. Vai trò, chức năng của báo chí\nBáo chí ở nước Cộng hoà xã hội chủ nghĩa Việt Nam là phương tiện thông tin đại chúng thiết yếu đối với đời sống xã hội ; là cơ quan ngôn luận của các tổ chức của Đảng, cơ quan Nhà nước, tổ chức xã hội (dưới đây gọi chung là tổ chức) ; là diễn đàn của nhân dân.\nĐiều 2. Bảo\nđảm quyền tự do báo chí, quyền tự do ngôn luận trên báo chí\nNhà nước tạo điều kiện thuận lợi\nđể công dân thực hiện quyền tự do báo chí, quyền tự do ngôn luận trên báo chí\nvà để báo chí phát huy đúng vai trò của mình.\nBáo chí, nhà báo hoạt động trong khuôn khổ pháp luật và được Nhà nước bảo hộ ; không một tổ chức, cá nhân nào được hạn chế, cản trở báo chí, nhà báo hoạt động. Không ai được lạm dụng quyền tự do báo chí, quyền tự do ngôn luận trên báo chí để xâm phạm lợi ích của Nhà nước, tập thể và công dân.\nBáo chí không bị kiểm duyệt trước khi in, phát sóng.\nĐiều 3. Các loại hình báo chí\nBáo chí nói trong Luật này là\nbáo chí Việt Nam, gồm : báo in (báo, tạp chí, bản tin thời sự, bản tin thông tấn)\n; báo nói (chương trình phát thanh) ; báo hình (chương trình truyền hình, chương trình nghe - nhìn thời sự được thực hiện bằng các phương tiện kỹ thuật khác nhau), bằng tiếng Việt, tiếng các dân tộc thiểu số Việt Nam, tiếng nước ngoài.\nChương 2:\nQUYỀN TỰ DO BÁO CHÍ, QUYỀN TỰ DO NGÔN LUẬN TRÊN BÁO CHÍ CỦA CÔNG DÂN \nĐiều 4. Quyền tự do báo chí, quyền tự do ngôn luận trên báo chí của công dân Công dân có quyền 1- Được thông tin qua báo chí về\nmọi mặt của tình hình đất nước và thế giới ;\n2- Tiếp xúc, cung cấp thông tin cho cơ quan báo chí và nhà báo; gửi tin, bài, ảnh và tác phẩm khác cho báo chí\nmà không chịu sự kiểm duyệt của tổ chức, cá nhân nào và chịu trách nhiệm trước pháp luật về nội dung thông tin ;\n3- Phát biểu ý kiến về tình hình\nđất nước và thế giới ;\n4- Tham gia ý kiến xây dựng và\nthực hiện đường lối, chủ trương,\nchính sách của Đảng, pháp luật của Nhà nước ;\n5- Góp ý kiến, phê bình, kiến nghị, khiếu nại, tố cáo trên báo chí đối với các tổ chức của Đảng, cơ quan Nhà\nnước, tổ chức xã hội và thành viên của các tổ chức đó.\nĐiều 5.\nTrách nhiệm của báo chí đối với quyền tự do báo chí, quyền tự do ngôn luận trên báo chí của công dân Cơ quan báo chí có trách nhiệm :\n1- Đăng, phát sóng tác phẩm, ý\nkiến của công dân ; trong trường hợp không đăng, phát sóng phải trả lời và nói rõ lý do ;\n2- Trả lời hoặc yêu cầu tổ chức,\nngười có chức vụ trả lời bằng thư hoặc trên báo chí về kiến nghị, khiếu nại, tố\ncáo của công dân gửi đến.\nChương 3:\nNHIỆM VỤ VÀ QUYỀN HẠN CỦA BÁO CHÍ \nĐiều 6. Nhiệm vụ và quyền hạn của báo chí\nBáo chí có nhiệm vụ và quyền hạn sau đây :\n1- Thông tin trung thực về mọi mặt của tình hình đất nước và thế giới ;\n2- Tuyên truyền, phổ biến đường lối, chủ trương, chính sách của Đảng, pháp luật của Nhà nước, thành tựu văn hoá, khoa học, kỹ thuật trong nước và thế giới theo tôn chỉ, mục đích của cơ\nquan báo chí ; góp phần nâng cao kiến thức, đáp ứng nhu cầu văn hoá lành mạnh của nhân dân, bảo vệ truyền thống tốt đẹp của dân tộc, xây dựng và phát triển dân chủ xã hội chủ nghĩa, tăng cường khối đoàn kết toàn dân, xây dựng chủ nghĩa xã\nhội và bảo vệ Tổ quốc ;\n3- Phản ánh và hướng dẫn dư luận xã hội ; làm diễn đàn thực hiện quyền tự do ngôn luận của nhân dân ;\n4- Phát hiện, biểu dương gương tốt,\nnhân tố mới ; đấu tranh chống các hành vi vi phạm pháp luật và các hiện tượng tiêu cực xã hội khác ;\n5- Mở rộng sự hiểu biết lẫn nhau giữa các nước và các dân tộc, tham gia vào sự nghiệp của nhân dân thế giới vì\nhoà bình, độc lập dân tộc, dân chủ và tiến bộ xã hội.\nĐiều 7. Cung cấp thông tin cho báo chí\nTrong phạm vi quyền hạn, nhiệm vụ\ncủa mình, các tổ chức có quyền và nghĩa vụ cung cấp thông tin cho báo chí, giúp cho báo chí thông tin chính xác, kịp thời và chịu trách nhiệm trước pháp luật về\nnội dung thông tin.\nĐối với vụ án đang được điều tra hoặc chưa xét xử thì các cơ quan tiến hành tố tụng có quyền không cung cấp thông tin cho báo chí, nhưng báo chí có quyền thông tin theo các nguồn tài liệu của mình và chịu trách nhiệm trước pháp luật về nội dung thông tin.\nBáo chí có quyền và nghĩa vụ\nkhông tiết lộ tên người cung cấp thông tin nếu có hại cho người đó, trừ trường hợp có yêu cầu của Viện trưởng Viện kiểm sát nhân dân hoặc Chánh án Toà án nhân dân cấp tỉnh và tương đương trở lên cần thiết cho việc điều tra, xét xử tội phạm nghiêm trọng.\nĐiều 8. Trả\nlời trên báo chí\nNgười đứng đầu cơ quan báo chí\ncó quyền yêu cầu các tổ chức, người có chức vụ trả lời vấn đề mà công dân nêu ra trên báo chí ; các tổ chức, người có chức vụ có trách nhiệm trả lời trên báo chí.\nTổ chức, công dân có quyền yêu cầu cơ quan báo chí trả lời về vấn đề mà báo chí đã thông tin ; cơ quan báo chí có\ntrách nhiệm trả lời.\nCơ quan báo chí phát hiện hoặc nhận được khiếu nại, tố cáo của công dân về những việc có dấu hiệu phạm tội thì\nphải báo ngay cho cơ quan điều tra hoặc Viện kiểm sát bằng văn bản ; cơ quan điều tra, Viện kiểm sát có trách nhiệm thụ lý và trả lời cho báo chí cách giải quyết.\nĐiều 9. Cải chính trên báo chí\nBáo chí thông tin sai sự thật,\nxuyên tạc, vu khống xúc phạm danh dự của tổ chức, danh dự, nhân phẩm của công dân thì phải cải chính và xin lỗi hoặc đăng, phát sóng lời cải chính của tổ chức,\ncông dân. Trong trường hợp báo chí không cải chính hoặc cải chính không thoả\nđáng ; không đăng, phát sóng lời cải chính của tổ chức, công dân mà không có lý\ndo chính đáng thì họ có quyền khiếu nại với cơ quan chủ quản báo chí hoặc yêu cầu Toà án xét xử.\nLời cải chính của cơ quan báo chí của tổ chức, công dân phải được đăng, phát sóng kịp thời và tương xứng với thông tin cần cải chính.\nĐiều 10. Những\nđiều không được thông tin trên báo chí\nĐể quyền tự do ngôn luận trên báo chí được sử dụng đúng đắn, báo chí phải tuân theo những điều sau đây :\n1- Không được kích động nhân dân chống Nhà nước Cộng hoà xã hội chủ nghĩa Việt Nam, phá hoại khối đoàn kết toàn dân ;\n2- Không được kích động bạo lực,\ntuyên truyền chiến tranh xâm lược, gây hận thù giữa các dân tộc và nhân dân các nước, kích động dâm ô, đồi trụy, tội ác ;\n3- Không được tiết lộ bí mật Nhà\nnước : bí mật quân sự, an ninh, kinh tế, đối ngoại và những bí mật khác do pháp luật quy định ;\n4- Không được đưa tin sai sự thật,\nxuyên tạc, vu khống nhằm xúc phạm danh dự của tổ chức, danh dự, nhân phẩm của công dân.\nChương 4:\nTỔ CHỨC BÁO CHÍ VÀ NHÀ\nBÁO \nĐiều 11. Cơ\nquan báo chí\nCơ quan báo chí là cơ quan thực hiện một loại hình báo chí nói tại Điều 3 của Luật này.\nĐiều 12. Cơ\nquan chủ quản báo chí\nCơ quan chủ quản báo chí là tổ\nchức đứng tên xin cấp giấy phép hoạt động của báo chí và trực tiếp quản lý cơ\nquan báo chí.\nCơ quan chủ quản báo chí có nhiệm vụ và quyền hạn sau đây :\n1- Xác định, chỉ đạo thực hiện tôn chỉ, mục đích, đối tượng phục vụ và phạm vi phát hành chủ yếu, công suất,\nthời gian, tần số, phạm vi toả sóng và ngôn ngữ thể hiện của cơ quan báo chí được quy định trong giấy phép ;\n2- Bổ nhiệm, miễn nhiệm người đứng\nđầu cơ quan báo chí thuộc quyền mình, sau khi trao đổi ý kiến với cơ quan quản lý Nhà nước về báo chí.\nĐiều 13.\nNgười đứng đầu cơ quan báo chí\n1- Người đứng đầu cơ quan báo chí là Tổng biên tập (báo in) hoặc Tổng giám đốc, Giám đốc (đài phát thanh, đài truyền hình, cơ sở thực hiện chương trình nghe - nhìn thời sự) ;\n2- Người đứng đầu cơ quan báo chí phải là người có quốc tịch Việt Nam, có địa chỉ thường trú tại Việt Nam, có\nđủ các tiêu chuẩn chính trị, đạo đức và nghiệp vụ báo chí do Nhà nước quy định\n;\n3- Người đứng\nđầu cơ quan báo chí lãnh đạo và quản lý cơ quan báo chí về mọi mặt, bảo đảm thực hiện tôn chỉ, mục đích của cơ quan báo chí và chịu trách nhiệm trước thủ trưởng cơ quan chủ quản và trước pháp luật về mọi hoạt động của cơ quan báo chí.\nĐiều 14.\nNhà báo Nhà báo phải là người có quốc tịch Việt Nam, có địa chỉ thường trú tại Việt Nam, có đủ các tiêu chuẩn chính trị, đạo\nđức và nghiệp vụ báo chí do Nhà nước quy định, đang hoạt động hoặc công tác thường xuyên với một cơ quan báo chí Việt Nam và được cấp thẻ nhà báo.\nĐiều 15.\nQuyền và nghĩa vụ của nhà báo Nhà báo có quyền và nghĩa vụ sau\nđây :\n1- Nhà báo có quyền và nghĩa vụ\nthông tin trung thực, phản ánh ý kiến, nguyện vọng của nhân dân, góp phần thực hiện quyền tự do báo chí, quyền tự do ngôn luận trên báo chí của công dân ;\n2- Nhà báo có quyền hoạt động báo chí trên lãnh thổ Cộng hoà xã hội chủ nghĩa Việt Nam ;\n3- Nhà báo chịu trách nhiệm về nội dung tác phẩm báo chí của mình ; có quyền khước từ việc biên soạn hoặc tham gia biên soạn tác phẩm báo chí trái với Luật này ;\n4- Nhà báo được hưởng một chế độ\nưu tiên, ưu đãi cần thiết cho hoạt động báo chí theo quy định của Hội đồng bộ trưởng ;\nKhông ai được đe doạ, uy hiếp tính mạng, xúc phạm danh dự, nhân phẩm của nhà báo hoặc phá huỷ, thu giữ phương tiện, tài liệu, cản trở nhà báo trong hoạt động nghề nghiệp đúng pháp luật.\nKhông ai được lạm dụng danh nghĩa nhà báo để làm việc vi phạm pháp luật.\nĐiều 16. Hội nhà báo Việt Nam Hội nhà báo Việt Nam có quyền và\nnghĩa vụ tham gia xây dựng và góp phần thực hiện chính sách thông tin - báo chí\n; bảo vệ các quyền và lợi ích hợp pháp của nhà báo.\nChương 5:\nQUẢN LÝ NHÀ NƯỚC VỀ BÁO CHÍ \nĐiều 17. Quản lý Nhà nước về báo chí\nQuản lý Nhà nước về báo chí bao gồm :\n1- Xây dựng pháp luật, quy hoạch, kế hoạch, chính sách phát triển sự nghiệp báo chí, chính sách tài trợ báo chí, chính sách đối với nhà báo ;\n2- Ban hành quy chế hoạt động báo chí, cấp giấy phép hoạt động báo chí ;\n3- Hướng dẫn, kiểm tra việc thực hiện phương hướng, nhiệm vụ báo chí và các quy định pháp luật về báo chí ; xử\nlý các vi phạm theo quy định của pháp luật.\nTrong phạm vi nhiệm vụ, quyền hạn của mình, Hội đồng bộ trưởng thực hiện quyền quản lý Nhà\nnước về báo chí trong cả nước, Uỷ ban nhân dân tỉnh, thành phố trực thuộc trung\nương và cấp tương đương thực hiện quyền quản lý Nhà nước về báo chí ở địa phương theo sự phân cấp do Hội đồng bộ trưởng quy định.Bổ sung\nĐiều 18. Điều kiện hoạt động của báo chí\nTổ chức muốn thành lập cơ quan báo chí phải có đủ các điều kiện sau đây :\n1- Có người đủ tiêu chuẩn để đứng\nđầu cơ quan báo chí theo quy định tại Điều 13 của Luật này ;\n2- Xác định rõ tên gọi, tôn chỉ,\nmục đích, đối tượng phục vụ, phạm vi phát hành chủ yếu, công suất, thời gian, tần số, phạm vi toả sóng và ngôn ngữ thể hiện của cơ quan báo chí ;\n3- Có trụ sở chính và có các điều kiện cần thiết khác bảo đảm cho hoạt động của cơ quan báo chí.\nĐiều 19. Cấp giấy phép hoạt động báo chí\nCơ quan báo chí phải có giấy phép do cơ quan quản lý Nhà nước về báo chí cấp mới được hoạt động. Trong trường hợp không cấp giấy phép thì chậm nhất là ba mươi ngày, kể từ ngày nhận được đơn xin phép, cơ quan quản lý Nhà nước về báo chí phải trả lời, nói rõ lý do. Tổ chức bị từ chối cấp giấy phép có quyền khiếu nại với Chủ tịch Hội\nđồng bộ trưởngBổ sung.\nĐiều 20. Hiệu lực của giấy phép Cơ quan báo chí phải thực hiện\nđúng những điều ghi trong giấy phép ; nếu muốn thay đổi tên gọi, tôn chỉ, mục\nđích, đối tượng phục vụ, ngôn ngữ thể hiện, phạm vi phát hành chủ yếu, kỳ hạn xuất bản thì phải xin phép lại.\nViệc xác định, thay đổi công suất,\nthời gian, tần số, phạm vi toả sóng phải được phép của cơ quan quản lý Nhà nước về tần số vô tuyền điện.\nKhông được chuyển nhượng giấy phép hoạt động báo chí cho cơ quan, tổ chức khác.\nĐiều 21. Xuất bản ấn phẩm báo chí khác, phát sóng chương trình đặc biệt, chương trình phụ\nCơ quan báo chí, tổ chức khác muốn xuất bản đặc san, số phụ ; đài phát thanh, đài truyền hình muốn phát sóng chương trình đặc biệt, chương trình phụ khác với tôn chỉ, mục đích, ngôn ngữ thể hiện ghi trong giấy phép thì phải xin phép cơ quan quản lý Nhà nước về báo chí.\nĐiều 22. In báo chí, phát sóng chương trình phát thanh, truyền hình Cơ sở in có trách nhiệm thực hiện hợp đồng, bảo đảm thời gian phát hành của báo chí ; không được in báo chí không có giấy phép, không được in lại tác phẩm báo chí đã có lệnh cấm lưu hành của cơ\nquan quản lý Nhà nước về báo chí.\nCơ sở kỹ thuật phát sóng cho đài phát thanh, đài truyền hình có trách nhiệm bảo đảm phạm vi toả sóng quy định.\nĐài phát thanh, đài truyền hình,\ncơ sở thực hiện chương trình nghe - nhìn thời sự không được phát nội dung tác phẩm báo chí đã có lệnh cấm lưu hành hoặc tịch thu.\nĐiều 23.\nLưu chiểu Báo chí in phải nộp lưu chiểu trước khi phát hành ; báo nói, báo hình phải lưu giữ bản thảo, phim nhựa, băng,\nđĩa, ghi âm, ghi hình theo quy định của Hội đồng bộ trưởng.\nĐiều 24.\nPhát hành báo chí\nCơ quan báo chí được tổ chức phát hành hoặc uỷ thác cho tổ chức, cá nhân có đăng ký phát hành.\nKhông ai được cản trở việc phát hành báo chí tới người đọc, nếu không có lệnh cấm lưu hành.\nKhông một tổ chức, cá nhân nào\nđược lưu hành ấn phẩm báo chí không có giấy phép xuất bản hoặc đã có lệnh cấm.\nĐiều 25. Quảng cáo Báo chí được đăng, phát sóng quảng cáo và thu tiền quảng cáo. Nội dung quảng cáo phải tách biệt với nội dung tuyên truyền và không được vi phạm quy định tại Điều 10 của Luật này.\nĐiều 26. Họp báo Tổ chức, công dân muốn họp báo phải báo trước cho cơ quan quản lý Nhà nước về báo chí. Nghiêm cấm họp báo có nội dung vi phạm quy định tại Điều 10 của Luật này.\nChương 6:\nKHEN THƯỞNG VÀ XỬ LÝ VI PHẠM \nĐiều 27.\nKhen thưởng Cơ quan báo chí, nhà báo, tổ chức và công dân có thành tích và cống hiến vào hoạt động báo chí thì được khen thưởng theo quy định của Nhà nước. Nhà báo có thành tích xuất sắc thì được tặng danh hiệu vinh dự Nhà nước.\nĐiều 28. Xử\nlý vi phạm 1- Cơ quan báo chí, tổ chức khác vi phạm quy định về giấy phép hoạt động báo chí, về nội dung thông tin trên báo chí, về cải chính do thông tin sai sự thật, xuyên tạc, vu khống và các quy định khác của Luật này thì tuỳ theo mức độ nhẹ hoặc nặng mà bị cảnh cáo, phạt tiền,\nthu hồi, tịch thu ấn phẩm, băng, đĩa ghi âm, ghi hình, đình bản tạm thời hoặc thu hồi giấy phép theo quy định của pháp luật xử phạt vi phạm hành chính.\nCơ quan báo chí, công dân thông tin gây thiệt hại cho tổ chức, công dân khác thì phải bồi thường thiệt hại theo quy định của pháp luật dân sự.\n2- Người chịu trách nhiệm chính về những hành vi quy định tại khoản 1 Điều này thì tuỳ theo mức độ nhẹ hoặc nặng mà bị xử lý kỷ luật, xử phạt hành chính hoặc truy cứu trách nhiệm hình sự.\n3- Người vi phạm các quy định về\ncung cấp thông tin, trả lời trên báo chí, thành lập cơ quan báo chí, phát hành,\nquảng cáo, họp báo, cản trở hoạt động báo chí, xúc phạm danh dự, nhân phẩm nhà báo và các quy định khác của Luật này thì tuỳ theo mức độ nhẹ hoặc nặng mà bị xử lý\nkỷ luật, xử phạt hành chính hoặc truy cứu trách nhiệm hình sự.\nChương 7:\nĐIỀU KHOẢN CUỐI CÙNG \nĐiều 29 Luật này thay thế Luật số 100 SL-L002 ngày 20 tháng 5 năm 1957 quy định chế độ báo chí.\nNhững quy định trước đây trái với Luật này đều bãi bỏ.\nĐiều 30 Căn cứ vào quy định của Luật này, Hội đồng bộ trưởng ban hành quy chế hoạt động của báo chí nước ngoài tại Việt Nam và quy chế hoạt động của báo chí Việt Nam liên quan đến nước ngoài.\nĐiều 31 Hội đồng bộ\ntrưởng quy định chi tiết thi hành Luật này. \nLuật này đã được Quốc hội nước Cộng hoà xã hội chủ nghĩa Việt Nam khoá VIII, kỳ họp thứ 6 thông qua ngày 28 tháng 12 năm 1989. \nVõ\n Chí Công\n (Đã\n ký)"
}