{
  "url": "https://thuvienphapluat.vn/van-ban/Bo-may-hanh-chinh/Luat-To-chuc-Toa-an-nhan-dan-1992-2-L-CTN-38247.aspx",
  "title": "Luật Tổ chức Toà án nhân dân 1992 2/L-CTN",
  "properties": {
    "Số hiệu": "2/L-CTN",
    "Loại văn bản": "Luật",
    "Nơi ban hành": "Quốc hội",
    "Người ký": "Lê Đức Anh",
    "Ngày ban hành": "06/10/1992",
    "Ngày hiệu lực": "Đã biết",
    "Ngày công báo": "Đã biết",
    "Số công báo": "Đã biết",
    "Tình trạng": "Đã biết"
  },
  "content": "QUỐC HỘI\n ********\nCỘNG HOÀ XÃ HỘI CHỦ NGHĨA VIỆT NAM\n Độc lập - Tự do - Hạnh phúc\n ********\nSố: 2/L-CTN Hà Nội, ngày 06 tháng 10 năm 1992 LUẬT TỔ\nCHỨC TOÀ ÁN NHÂN DÂN CỦA QUỐC HỘI SỐ 2/L-CTN NGÀY 06/10/1992 Căn cứ vào Hiến pháp năm 1992 của nước Cộng hoà xã hội chủ nghĩa Việt Nam, Luật này quy định về tổ chức và hoạt\nđộng của các Toà án nhân dân. \nChương 1:\nNHỮNG QUY ĐỊNH CHUNG\nĐiều 1 Toà án nhân dân tối cao, các Toà\nán nhân dân địa phương, các Toà án quân sự và các Toà án khác do Luật định là\ncác cơ quan xét xử của nước Cộng hoà xã hội chủ nghĩa Việt Nam.\nCác Toà án xét xử những vụ án hình sự, dân sự, hôn nhân và gia đình, lao động và những vụ án khác theo quy định của pháp luật.\nTrong phạm vi chức năng của mình, Toà án có nhiệm vụ bảo vệ pháp chế xã hội chủ nghĩa; bảo vệ chế độ xã hội chủ nghĩa và quyền làm chủ của nhân dân; bảo vệ tài sản của Nhà nước, của tập thể; bảo vệ tính mạng, tài sản, tự do, danh dự và nhân phẩm của công dân.\nBằng hoạt động của mình, Toà án góp phần giáo dục công dân trung thành với Tổ quốc, chấp hành nghiêm chỉnh pháp luật, tôn trọng những quy tắc của cuộc sống xã hội, ý thức đấu tranh chống và\nphòng ngừa tội phạm, các vi phạm pháp luật khác.\nĐiều 2 1- Ở nước Cộng hoà xã hội chủ\nnghĩa Việt Nam có các Toà án sau đây:\n- Toà án nhân dân tối cao;\n- Các Toà án nhân dân tỉnh,\nthành phố trực thuộc trung ương;\n- Các Toà án nhân dân huyện, quận,\nthị xã, thành phố thuộc tỉnh;\n- Các Toà án quân sự;\n- Các Toà án khác do Luật định.\nTrong tình hình đặc biệt, Quốc hội có thể quyết định thành lập Toà án đặc biệt.\n2- ở cơ sở, thành lập các tổ chức thích hợp của nhân dân để giải quyết những việc vi phạm pháp luật và tranh chấp nhỏ trong nhân dân. Tổ chức và hoạt động của tổ chức này do Uỷ ban thường vụ Quốc hội quy định.\nĐiều 3 Chế độ bổ nhiệm Thẩm phán được thực hiện đối với các Toà án các cấp.\nChế độ cử Hội thẩm được thực hiện\nđối với Toà án nhân dân tối cao và các Toà án quân sự. Chế độ bầu Hội thẩm được thực hiện đối với các Toà án nhân dân địa phương.\nĐiều 4 Việc xét xử của Toà án nhân dân có Hội thẩm nhân dân tham gia, việc xét xử của các Toà án quân sự có Hội thẩm quân nhân tham gia theo quy định của pháp luật tố tụng. Khi xét xử, Hội thẩm ngang quyền với Thẩm phán.\nĐiều 5 Khi xét xử, Thẩm phán và Hội thẩm\nđộc lập và chỉ tuân theo pháp luật.\nĐiều 6 Toà án xét xử tập thể và quyết định theo đa số.\nThành phần Hội đồng xét xử ở mỗi cấp xét xử do pháp luật tố tụng quy định.\nĐiều 7 Toà án xét xử công khai, trừ trường hợp cần xét xử kín để giữ gìn bí mật Nhà nước hoặc thuần phong mỹ tục của dân tộc.\nĐiều 8 Toà án xét xử theo nguyên tắc mọi công dân đều bình đẳng trước pháp luật, không phân biệt nam, nữ, dân tộc, tín ngưỡng, tôn giáo, thành phần xã hội, địa vị xã hội.\nĐiều 9 Toà án bảo đảm quyền bào chữa của bị cáo, quyền bảo vệ quyền và lợi ích hợp pháp của đương sự.\nĐiều 10 Toà án bảo đảm cho những người tham gia tố tụng quyền dùng tiếng nói, chữ viết của dân tộc mình trước Toà án.\nĐiều 11 Bản án, quyết định của Toà án đã\ncó hiệu lực pháp luật phải được các cơ quan Nhà nước, đơn vị vũ trang, tổ chức kinh tế, tổ chức xã hội và mọi người tôn trọng.\nCá nhân, cơ quan, tổ chức có\nnghĩa vụ chấp hành bản án, quyết định của Toà án phải nghiêm chỉnh chấp hành.\nTrong phạm vi chức năng của mình, Toà án nhân dân và các cơ quan, tổ chức được giao nhiệm vụ thi hành bản\nán, quyết định của Toà án phải nghiêm chỉnh thi hành và chịu trách nhiệm trước pháp luật về việc thực hiện nhiệm vụ đó.\nĐiều 12 Trong trường hợp cần thiết, cùng với việc ra bản án, quyết định, Toà án ra kiến nghị yêu cầu cơ quan, tổ chức hữu quan áp dụng biện pháp khắc phục nguyên nhân, điều kiện phát sinh tội phạm hoặc vi phạm pháp luật tại cơ quan, tổ chức đó. Cơ quan, tổ chức nhận được kiến nghị,\ncó trách nhiệm nghiên cứu thực hiện và trong thời hạn ba mươi ngày, kể từ ngày nhận được kiến nghị phải thông báo cho Toà án về việc đó.\nĐiều 13 Toà án phối hợp với cơ quan Nhà\nnước, Mặt trận Tổ quốc Việt Nam và các tổ chức thành viên của Mặt trận, đơn vị\nvũ trang, tổ chức kinh tế trong việc phát huy tác dụng giáo dục của phiên toà\nvà tạo điều kiện thuận lợi cho việc thi hành bản án, quyết định của Toà án.\nĐiều 14 Toà án cùng với Viện kiểm sát,\ncác cơ quan Công an, Thanh tra, Tư pháp, cơ quan hữu quan khác, Mặt trận Tổ quốc Việt Nam và các tổ chức thành viên của Mặt trận nghiên cứu và thực hiện những chủ trương, biện pháp nhằm phòng ngừa và chống tội phạm, các vi phạm pháp luật khác.\nĐiều 15 Chánh án Toà án nhân dân tối cao chịu trách nhiệm và báo cáo công tác trước Quốc hội; trong thời gian Quốc hội không họp thì chịu trách nhiệm và báo cáo công tác trước Uỷ ban thường vụ Quốc hội và Chủ tịch nước; trả lời chất vấn của đại biểu Quốc hội.\nChánh án Toà án nhân dân địa phương chịu trách nhiệm và báo cáo công tác trước Hội đồng nhân dân cùng cấp; trả\nlời chất vấn của đại biểu Hội đồng nhân dân.\nĐiều 16 Việc quản lý các Toà án nhân dân\nđịa phương về mặt tổ chức do Bộ trưởng Bộ Tư pháp đảm nhiệm có sự phối hợp chặt chẽ với Chánh án Toà án nhân dân tối cao. Quy chế phối hợp giữa Bộ trưởng Bộ tư\npháp và Chánh án Toà án nhân dân tối cao trong việc quản lý các Toà án nhân dân\nđịa phương về mặt tổ chức do Uỷ ban thường vụ Quốc hội quy định.\nChương 2:\nTOÀ ÁN NHÂN DÂN TỐI CAO\nĐiều 17 1- Toà án nhân dân tối cao là cơ\nquan xét xử cao nhất của nước Cộng hoà xã hội chủ nghĩa Việt Nam.\n2- Cơ cấu tổ\nchức của Toà án nhân dân tối gồm:\n- Hội đồng Thẩm phán Toà án nhân dân tối cao;\n- Uỷ ban Thẩm phán Toà án nhân dân tối cao;\n- Toà án quân sự trung ương, Toà\nhình sự, Toà dân sự và các Toà phúc thẩm Toà án nhân dân tối cao; trong trường hợp cần thiết, ủy ban thường vụ Quốc hội quyết định thành lập các Toà chuyên trách khác theo đề nghị của Chánh án Toà án nhân tối cao;\n- Bộ máy giúp việc.\n3- Toà án nhân dân tối cao có\nChánh án, các Phó Chánh án, Thẩm phán, Hội thẩm, Thư ký Toà án.\nĐiều 18 Toà án nhân dân tối cao hướng dẫn các Toà án áp dụng thống nhất pháp luật, tổng kết kinh nghiệm xét xử của các Toà án;\nToà án nhân dân tối cao giám đốc việc xét xử của các Toà án các cấp; giám đốc việc xét xử của Toà án đặc biệt và\ncác Toà án khác, trừ trường hợp có quy định khác khi thành lập các Toà án đó;\nToà án nhân dân tối cao trình Quốc hội dự án Luật và trình Uỷ ban thường vụ Quốc hội dự án pháp lệnh theo quy định của pháp luật.\nĐiều 19 Toà án nhân dân tối cao có thẩm quyền:\n1- Sơ thẩm đồng thời chung thẩm những vụ án theo quy định của pháp luật tố tụng;\n2- Phúc thẩm những vụ án mà bản\nán, quyết định sơ thẩm chưa có hiệu lực pháp luật của Toà án cấp dưới trực tiếp bị kháng cáo, kháng nghị;\n3- Giám đốc thẩm, tái thẩm những vụ án mà bản án, quyết định đã có hiệu lực pháp luật bị\nkháng nghị theo quy định của pháp luật tố tụng.Bổ sung\nĐiều 20 1- Hội đồng Thẩm phán Toà án nhân dân tối cao là cơ quan xét xử cao nhất theo thủ tục giám đốc thẩm, tái thẩm,\nđồng thời là cơ quan hướng dẫn công tác xét xử của các Toà án các cấp.\n2- Hội đồng Thẩm phán Toà án nhân dân tối cao gồm có:\n- Chánh án, các Phó Chánh án Toà\nán nhân dân tối cao;\n- Các Chánh toà, Phó Chánh toà\ncác Toà chuyên trách của Toà án nhân dân tối cao;\n- Một số Thẩm phán Toà án nhân dân tối cao được Chánh án Toà án nhân dân tối cao cử và trình Uỷ ban thường vụ\nQuốc hội phê chuẩn.\nĐiều 21 1- Hội đồng Thẩm phán Toà án nhân dân tối cao có nhiệm vụ, quyền hạn sau đây:\n- Giám đốc thẩm, tái thẩm những vụ án mà bản án, quyết định đã có hiệu lực pháp luật của Uỷ ban Thẩm phán Toà\nán nhân dân tối cao bị kháng nghị;\n- Hướng dẫn các Toà án áp dụng thống nhất pháp luật;\n- Tổng kết kinh nghiệm xét xử;\n- Chuẩn bị dự án luật để trình Quốc hội, dự án pháp lệnh để trình Uỷ ban thường vụ Quốc hội.\n2- Quyết định của Hội đồng Thẩm phán Toà án nhân dân tối cao phải được quá nửa tổng số thành viên Hội đồng Thẩm phán biểu quyết tán thành. Viện trưởng Viện kiểm sát nhân dân tối cao, Bộ trưởng Bộ tư pháp có trách nhiệm tham dự các phiên họp của Hội đồng thẩm phán Toà án nhân dân tối cao khi thảo luận việc hướng dẫn áp dụng pháp luật, tổng kết kinh nghiệm xét xử.\nĐiều 22 1- Uỷ ban Thẩm phán Toà án nhân dân tối cao là tổ chức thường trực của Hội đồng Thẩm phán Toà án nhân dân tối cao.\n2- Uỷ ban Thẩm phán Toà án nhân dân tối cao gồm có: Chánh án, các Phó Chánh án, Chánh toà các Toà chuyên trách của Toà án nhân dân tối cao.\n3- Uỷ ban Thẩm phán Toà án nhân dân tối cao có nhiệm vụ, quyền hạn sau đây:\n- Giám đốc thẩm, tái thẩm những vụ án mà bản án, quyết định đã có hiệu lực pháp luật bị kháng nghị theo quy định của pháp luật tố tụng;\n- Hướng dẫn các Toà án thực hiện nghị quyết của Hội đồng Thẩm phán Toà án nhân dân tối cao;\n- Thông qua báo cáo của Chánh án Toà án nhân dân tối cao về công tác xét xử của các Toà án để trình Quốc hội, Uỷ\nban thường vụ Quốc hội và Chủ tịch nước.\n4- Quyết định của Uỷ ban Thẩm phán Toà án nhân dân tối cao phải được quá nửa tổng số thành viên biểu quyết tán thành.\nĐiều 23 1- Toà hình sự, Toà dân sự Toà\nán nhân dân tối cao có Chánh toà, các Phó Chánh toà, Thẩm phán, Thư ký Toà án.\n2- Toà hình sự, Toà dân sự Toà\nán nhân dân tối cao có nhiệm vụ, quyền hạn sau đây:\n- Sơ thẩm đồng thời chung thẩm những vụ án theo quy định của pháp luật tố tụng;\n- Giám đốc thẩm, tái thẩm những vụ án mà bản án, quyết định đã có hiệu lực pháp luật bị kháng nghị theo quy định của pháp luật tố tụng.\nĐiều 24 1- Các Toà phúc thẩm Toà án nhân dân tối cao có Chánh toà, các Phó Chánh toà, Thẩm phán, Thư ký Toà án.\n2- Các Toà\nphúc thẩm Toà án nhân dân tối cao phúc thẩm những vụ án mà bản án, quyết định sơ thẩm chưa có hiệu lực pháp luật của Toà án cấp dưới trực tiếp bị kháng cáo,\nkháng nghị.\nĐiều 25 Chánh án Toà án nhân dân tối cao có nhiệm vụ, quyền hạn sau đây:\n1- Tổ chức công tác xét xử của Toà án nhân dân tối cao;\n2- Chủ toạ các phiên họp của Hội\nđồng Thẩm phán và Uỷ ban Thẩm phán Toà án nhân dân tối cao;\n3- Kháng nghị theo thủ tục giám\nđốc thẩm, tái thẩm bản án, quyết định đã có hiệu lực pháp luật của các Toà án các cấp theo quy định của pháp luật tố tụng;\n4- Trình Chủ tịch nước ý kiến của mình về những trường hợp người bị kết án xin ân giảm án tử hình;\n5- Bổ nhiệm, miễn nhiệm, cách chức Chánh toà, Phó Chánh toà các Toà chuyên trách, Vụ trưởng, Phó Vụ trưởng và các chức vụ khác trong Toà án nhân dân tối cao, trừ Phó Chánh án, Thẩm phán;\n6- Tổ chức bồi dưỡng nghiệp vụ\ncho Thẩm phán, Hội thẩm và cán bộ của các Toà án;\n7- Báo cáo công tác xét xử của các Toà án trước Quốc hội, Uỷ ban thường vụ Quốc hội và Chủ\ntịch nước;\n8- Chỉ đạo việc soạn thảo các dự\nán luật, pháp lệnh do Toà án nhân dân tối cao trình Quốc hội và Uỷ ban thường vụ\nQuốc hội;\n9- Quy định bộ máy giúp việc của Toà án nhân dân tối cao và trình Uỷ ban thường vụ Quốc hội phê chuẩn.\nĐiều 26 Phó Chánh án Toà án nhân dân tối cao có nhiệm vụ và quyền hạn sau đây:\n1- Giúp Chánh án làm nhiệm vụ\ntheo sự phân công của Chánh án;\n2- Kháng nghị\ntheo thủ tục giám đốc thẩm bản án, quyết định đã có hiệu lực pháp luật của các Toà án cấp dưới.\nChương 3:\nTOÀ ÁN NHÂN DÂN ĐỊA PHƯƠNG Mục A: CÁC TOÀ\nÁN NHÂN DÂN TỈNH, THÀNH PHỐ TRỰC THUỘC TRUNG ƯƠNG\nĐiều 27 1- Cơ cấu tổ\nchức của Toà án nhân dân tỉnh, thành phố trực thuộc trung ương gồm:\n- Uỷ ban Thẩm phán;\n- Toà hình sự, Toà dân sự;\n- Bộ máy giúp việc.\n2- Toà án nhân dân tỉnh, thành phố trực thuộc trung ương có Chánh án, các Phó Chánh án, Thẩm phán, Hội thẩm nhân dân, Thư ký Toà án.\nĐiều 28 Toà án nhân dân tỉnh, thành phố\ntrực thuộc trung ương có thẩm quyền:\n1- Sơ thẩm những vụ án theo quy\nđịnh của pháp luật tố tụng;\n2- Phúc thẩm những vụ án mà bản án,\nquyết định sơ thẩm chưa có hiệu lực pháp luật của Toà án cấp dưới bị kháng cáo,\nkháng nghị;\n3- Giám đốc thẩm, tái thẩm những vụ án mà bản án, quyết định đã có hiệu lực pháp luật của Toà án cấp dưới bị\nkháng nghị.\nĐiều 29 1- Uỷ ban Thẩm phán Toà án nhân dân tỉnh, thành phố trực thuộc trung ương gồm có Chánh án, các Phó Chánh án,\nChánh toà các Toà chuyên trách của Toà án nhân dân tỉnh, thành phố trực thuộc trung ương.\n2- Uỷ ban Thẩm phán Toà án nhân dân tỉnh, thành phố trực thuộc trung ương có nhiệm vụ, quyền hạn sau đây:\n- Giám đốc thẩm, tái thẩm những vụ án mà bản án, quyết định đã có hiệu lực pháp luật của Toà án cấp dưới bị\nkháng nghị;\n- Bảo đảm việc áp dụng thống nhất pháp luật tại Toà án cấp mình và các Toà án cấp dưới;\n- Tổng kết kinh nghiệm xét xử;\n- Thông qua báo cáo của Chánh án Toà án nhân dân tỉnh, thành phố trực thuộc Trung ương về công tác xét xử của các Toà án ở địa phương để báo cáo trước Hội đồng nhân dân cùng cấp và với Toà\nán nhân dân tối cao.\n3- Quyết định của Uỷ ban Thẩm phán Toà án nhân dân tỉnh, thành phố trực thuộc trung ương phải được quá nửa tổng số thành viên biểu quyết tán thành.\nĐiều 30 1- Các Toà chuyên trách của Toà\nán nhân dân tỉnh, thành phố trực thuộc trung ương có Chánh toà, Phó Chánh toà,\ncác Thẩm phán, Thư ký Toà án.\n2- Các Toà chuyên trách của Toà\nán nhân dân tỉnh, thành phố trực thuộc trung ương có nhiệm vụ, quyền hạn sau\nđây:\n- Sơ thẩm những vụ án do pháp luật tố tụng quy định;\n- Phúc thẩm những vụ án mà bản\nán, quyết định sơ thẩm chưa có hiệu lực pháp luật của Toà án cấp dưới bị kháng cáo, kháng nghị.\nĐiều 31 1- Chánh án Toà án nhân dân tỉnh, thành phố trực thuộc trung ương có nhiệm vụ, quyền hạn sau đây:\n- Tổ chức công tác xét xử;\n- Chủ toạ các phiên họp của Uỷ\nban Thẩm phán;\n- Kháng nghị theo thủ tục giám đốc thẩm, tái thẩm bản án, quyết định đã có hiệu lực pháp luật của các Toà án cấp dưới theo quy định của pháp luật tố tụng;\n- Bổ nhiệm, miễn nhiệm, cách chức Chánh toà, Phó Chánh toà các Toà chuyên trách và các chức vụ khác trong Toà án cấp mình, trừ Phó Chánh án, Thẩm phán;\n- Tổ chức bồi dưỡng nghiệp vụ\ncho Thẩm phán, Hội thẩm và cán bộ Toà án cấp mình và cấp dưới;\n- Báo cáo công tác xét xử của các Toà án địa phương trước Hội đồng nhân dân cùng cấp và với Toà án nhân dân tối cao.\n2- Phó Chánh án giúp Chánh án làm nhiệm vụ theo sự phân công của Chánh án.\nMục B: TOÀ ÁN NHÂN DÂN HUYỆN, QUẬN , THỊ XÃ THÁNH PHỐ THUỘC TỈNH \nĐiều 32 1- Toà án nhân dân huyện, quận,\nthị xã, thành phố thuộc tỉnh có Chánh án, một hoặc hai Phó Chánh án, các Thẩm phán, Hội thẩm nhân dân, Thư ký Toà án.\n2- Toà án nhân dân huyện, quận,\nthị xã, thành phố thuộc tỉnh có thẩm quyền sơ thẩm những vụ án theo quy định của pháp luật tố tụng.\nĐiều 33 1- Chánh án Toà án nhân dân huyện,\nquận, thị xã, thành phố thuộc tỉnh có nhiệm vụ, quyền hạn sau đây:\n- Tổ chức công tác xét xử;\n- Báo cáo công tác xét xử của Toà án trước Hội đồng nhân dân cùng cấp và với Toà án cấp trên trực tiếp.\n2- Phó Chánh án giúp Chánh án làm nhiệm vụ theo sự phân công của Chánh án.\nChương 4:\nTOÀ ÁN QUÂN SỰ\nĐiều 34 1- Các Toà án quân sự được tổ chức trong Quân đội nhân dân Việt Nam để xét xử những vụ án mà bị cáo là quân nhân tại ngũ và những vụ án khác theo quy định của pháp luật.\n2- Các Toà án quân sự gồm có:\n- Toà án quân sự trung ương;\n- Các Toà án quân sự quân khu và\ntương đương;\n- Các Toà án quân sự khu vực.\n3- Quân nhân, công nhân và viên chức quốc phòng làm việc tại Toà án quân sự có các quyền và nghĩa vụ theo chế độ\ncủa Quân đội.\nĐiều 35 1- Các Toà án quân sự có Chánh\nán, các Phó Chánh án, Thẩm phán, Hội thẩm quân nhân, Thư ký Toà án.\n2- Chánh án Toà án quân sự trung\nương là Phó Chánh án Toà án nhân dân tối cao, Thẩm phán Toà án quân sự trung\nương là Thẩm phán Toà án nhân dân tối cao.\nĐiều 36 Tổ chức và hoạt động của các Toà\nán quân sự do Uỷ ban thường vụ Quốc hội quy định.\nChương 5:\nTHẨM PHÁN VÀ HỘI THẨM PHÁN\nĐiều 37 Công dân Việt Nam trung thành với Tổ quốc, có phẩm chất, đạo đức tốt, có kiến thức pháp lý, có tinh thần kiên quyết bảo vệ pháp chế xã hội chủ nghĩa thì có thể được tuyển chọn và bổ nhiệm làm Thẩm phán, được bầu hoặc cử làm Hội thẩm.\nTiêu chuẩn cụ thể của Thẩm phán,\nHội thẩm của Toà án mỗi cấp, thủ tục tuyển chọn, bổ nhiệm, miễn nhiệm, cách chức Thẩm phán, bầu hoặc cử, miễn nhiệm, bãi nhiệm Hội thẩm, tổ chức và hoạt động của Hội đồng tuyển chọn Thẩm phán, quyền và nghĩa vụ của Thẩm phán, Hội thẩm do Uỷ\nban thường vụ Quốc hội quy định.\nĐiều 38 Chánh án Toà án nhân dân tối cao do Quốc hội bầu, miễn nhiệm và bãi nhiệm theo đề nghị của Chủ tịch nước.\nNhiệm kỳ của Chánh án Toà án nhân dân tối cao theo nhiệm kỳ của Quốc hội.\nPhó Chánh án và Thẩm phán Toà án nhân dân tối cao, Chánh án, Phó Chánh án, Thẩm phán Toà án nhân dân tỉnh, thành phố trực thuộc trung ương, huyện, quận, thị xã, thành phố thuộc tỉnh và các Toà\nán quân sự do Chủ tịch nước bổ nhiệm, miễn nhiệm, cách chức.\nNhiệm kỳ của Phó Chánh án và Thẩm phán Toà án nhân dân tối cao, Chánh án, Phó Chánh án và Thẩm phán Toà án nhân dân địa phương, Toà án quân sự là năm năm.\nĐiều 39 Hội thẩm nhân dân Toà án nhân dân tối cao do Uỷ ban thường vụ Quốc hội cử theo sự giới thiệu của Đoàn Chủ tịch Uỷ\nban trung ương Mặt trận Tổ quốc Việt Nam và do Uỷ ban thường vụ Quốc hội miễn nhiệm, bãi nhiệm.\nHội thẩm quân nhân Toà án quân sự\nTrung ương do Uỷ ban thường vụ Quốc hội cử theo sự giới thiệu của Tổng cục chính trị Quân đội nhân dân Việt Nam và do Uỷ ban thường vụ Quốc hội miễn nhiệm,\nbãi nhiệm.\nHội thẩm nhân dân Toà án nhân dân địa phương do Hội đồng nhân dân cùng cấp bầu theo sự giới thiệu của Uỷ ban Mặt trận Tổ quốc cùng cấp và do Hội đồng nhân dân cùng cấp miễn nhiệm, bãi nhiệm.\nHội thẩm quân nhân Toà án quân sự\nquân khu và tương đương do Chủ nhiệm Tổng cục chính trị Quân đội nhân dân Việt Nam cử theo sự giới thiệu của cơ quan chính trị quân khu, quân đoàn, quân chủng,\ntổng cục hoặc cấp tương đương và do Chủ nhiệm Tổng cục chính trị Quân đội nhân dân Việt Nam miễn nhiệm, bãi nhiệm.\nHội thẩm quân nhân Toà án quân sự\nkhu vực do Chủ nhiệm Chính trị quân khu, quân đoàn, quân chủng, tổng cục hoặc cấp tương đương cử theo sự giới thiệu của cơ quan chính trị sư đoàn hoặc cấp tương\nđương và do Chủ nhiệm chính trị quân khu, quân đoàn, quân chủng, tổng cục hoặc cấp tương đương, miễn nhiệm, bãi nhiệm.\nNhiệm kỳ của Hội thẩm nhân dân Toà án nhân dân tối cao và Hội thẩm quân nhân là năm năm.\nNhiệm kỳ của Hội thẩm nhân dân Toà án nhân dân địa phương theo nhiệm kỳ của Hội đồng nhân dân cùng cấp.\nĐiều 40 Số lượng Thẩm phán và Hội thẩm của Toà án nhân dân tối cao do Uỷ ban thường vụ Quốc hội quyết định theo đề nghị của Chánh án Toà án nhân dân tối cao.\nSố lượng Thẩm phán và Hội thẩm nhân dân của các Toà án nhân dân địa phương do Uỷ ban thường vụ Quốc hội quyết\nđịnh theo đề nghị của Bộ trưởng Bộ tư pháp sau khi đã thống nhất ý kiến với Chánh án Toà án nhân dân tối cao.\nSố lượng Thẩm phán và Hội thẩm quân nhân của các Toà án quân sự quân khu và tương đương, Toà án quân sự khu vực do Uỷ ban thường vụ Quốc hội quyết định theo đề nghị của Bộ trưởng Bộ tư pháp sau khi đã thống nhất ý kiến với Bộ trưởng Bộ quốc phòng và Chánh án Toà án nhân dân tối cao.\nĐiều 41 Các cơ quan Nhà nước, đơn vị vũ\ntrang, tổ chức kinh tế, tổ chức xã hội có người được bầu hoặc cử làm Hội thẩm có trách nhiệm tạo điều kiện cho Hội thẩm làm nhiệm vụ xét xử.\nHội thẩm được bồi dưỡng về nghiệp vụ và được hưởng phụ cấp khi làm nhiệm vụ xét xử.\nChương 6:\nVIỆC BAỎ ĐẢM HOẠT ĐỘNG CUẢ THẨM PHÁN\nĐiều 42 Chế độ tiền lương, phụ cấp, giấy chứng minh, trang phục đối với các Toà án do Uỷ ban thường vụ Quốc hội quy định.\nĐiều 43 Biên chế của Toà án nhân dân tối cao do Uỷ ban thường vụ Quốc hội quyết định theo đề nghị của Chánh án Toà án nhân dân tối cao.\nTổng biên chế của các Toà án nhân dân địa phương do Chính phủ quyết định theo đề nghị của Bộ trưởng Bộ tư\npháp sau khi trao đổi thống nhất ý kiến với Chánh án Toà án nhân dân tối cao.\nBộ trưởng Bộ tư pháp phối hợp với Chánh án Toà án nhân dân tối cao quy định biên chế cho từng Toà án nhân dân địa phương.\nĐiều 44 Kinh phí hoạt động của Toà án nhân dân tối cao, của các Toà án nhân dân địa phương và của các Toà án quân sự\ndo Chính phủ trình dự toán để Quốc hội quyết định.\nĐiều 45 Cơ quan công an có nhiệm vụ áp giải bị cáo và bảo vệ phiên toà của Toà án nhân dân tối cao và Toà án nhân dân\nđịa phương.\nLực lượng cảnh vệ trong quân đội có nhiệm vụ áp giải bị cáo và bảo vệ phiên toà của Toà án quân sự.\nChương 7:\nĐIỀU KHOẢN CUỐI CÙNG\nĐiều 46 Luật này thay thế các luật đã\nban hành trước đây về tổ chức Toà án; những quy định trước đây trái với Luật này đều bãi bỏ.\nLuật này đã được Quốc hội nước Cộng hoà xã hội chủ nghĩa Việt Nam khoá IX, kỳ họp thứ nhất, thông qua ngày 6 tháng 10 năm 1992. \nLê\n Đức Anh\n (Đã\n ký)"
}