{
  "url": "https://thuvienphapluat.vn/van-ban/Thuong-mai/Luat-Thuong-mai-2005-36-2005-QH11-2633.aspx",
  "title": "Luật Thương mại 2005 số 36/2005/QH11 mới nhất",
  "properties": {
    "Số hiệu": "36/2005/QH11",
    "Loại văn bản": "Luật",
    "Nơi ban hành": "Quốc hội",
    "Người ký": "Nguyễn Văn An",
    "Ngày ban hành": "14/06/2005",
    "Ngày hiệu lực": "Đã biết",
    "Ngày công báo": "Đã biết",
    "Số công báo": "Đã biết",
    "Tình trạng": "Đã biết"
  },
  "content": "QUỐC HỘI\n --------\nCỘNG HÒA XÃ HỘI CHỦ\n NGHĨA VIỆT NAM\n Độc lập - Tự do - Hạnh phúc \n ---------------\nSố: 36/2005/QH11 Hà Nội, ngày 14 tháng 06 năm 2005 LUẬT THƯƠNG MẠI Căn cứ vào Hiến pháp nước Cộng hòa xã hội chủ nghĩa Việt Nam năm 1992 đã được sửa đổi, bổ sung theo Nghị quyết số\n51/2001/QH10 ngày 25 tháng 12 năm 2001 của Quốc hội khoá X, kỳ họp thứ 10;\nLuật này quy định về hoạt động thương mại.\nChương I NHỮNG QUY ĐỊNH CHUNG MỤC 1. PHẠM VI ĐIỀU CHỈNH VÀ ĐỐI TƯỢNG ÁP DỤNG\nĐiều 1. Phạm vi điều chỉnh 1. Hoạt động thương mại thực hiện trên lãnh thổ nước Cộng hoà xã hội chủ nghĩa Việt Nam.\n2. Hoạt động thương mại thực hiện ngoài lãnh thổ nước Cộng hoà xã hội chủ nghĩa Việt Nam trong trường hợp các bên thoả thuận chọn áp dụng Luật này hoặc luật nước ngoài, điều ước quốc tế mà Cộng hoà xã hội chủ nghĩa Việt Nam là thành viên có quy định áp dụng Luật này.\n3. Hoạt động không nhằm mục đích sinh lợi của một bên trong giao dịch với thương nhân thực hiện trên lãnh thổ nước Cộng hoà xã hội chủ nghĩa Việt Nam trong trường hợp bên thực hiện hoạt động không nhằm mục đích sinh lợi đó chọn áp dụng Luật này.\nĐiều 2. Đối tượng áp dụng 1. Thương nhân hoạt động thương mại theo quy định tại Điều 1 của Luật này.\n2. Tổ chức, cá nhân khác hoạt động có liên quan đến thương mại.\n3. Căn cứ\nvào những nguyên tắc của Luật này, Chính phủ quy định cụ thể việc áp dụng Luật này đối với cá nhân hoạt động thương mại một cách độc lập, thường xuyên không phải đăng ký kinh doanh.\nĐiều 3. Giải thích từ ngữ\nTrong Luật này, các từ ngữ dưới\nđây được hiểu như sau:\n1. Hoạt động thương mại là hoạt động nhằm mục đích sinh lợi, bao gồm mua bán hàng hoá, cung ứng dịch vụ, đầu tư, xúc tiến thương mại và các hoạt động nhằm mục đích sinh lợi khác.\n2. Hàng hóa bao gồm:\na) Tất cả các loại động sản, kể cả\nđộng sản hình thành trong tương lai;\nb) Những vật gắn liền với đất\nđai.\n3. Thói quen trong hoạt động thương mại là quy tắc xử sự có nội dung rõ ràng được hình thành và lặp lại nhiều lần trong một thời gian dài giữa các bên, được các bên mặc nhiên thừa nhận để\nxác định quyền và nghĩa vụ của các bên trong hợp đồng thương mại.\n4. Tập quán thương mại là thói quen được thừa nhận rộng rãi trong hoạt động thương mại trên một vùng, miền hoặc một lĩnh vực thương mại, có nội dung rõ ràng được các bên thừa nhận để xác định quyền và nghĩa vụ của các bên trong hoạt động thương mại.\n5. Thông điệp dữ liệu là thông tin được tạo ra, gửi đi, nhận và lưu giữ bằng phương tiện điện tử.\n6. Văn phòng đại diện của thương nhân nước ngoài tại Việt Nam là\nđơn vị phụ thuộc của thương nhân nước ngoài, được thành lập theo quy định của pháp luật Việt Nam để tìm hiểu thị trường và thực hiện một số hoạt động xúc tiến thương mại mà pháp luật Việt Nam cho phép.\n7. Chi nhánh của thương nhân nước ngoài tại Việt Nam là đơn vị phụ thuộc của thương nhân nước ngoài, được thành lập và hoạt động thương mại tại Việt Nam theo quy định của pháp luật Việt Nam hoặc điều ước quốc tế mà Cộng hòa xã hội chủ nghĩa Việt Nam là thành viên.\n8. Mua bán hàng hoá là hoạt động thương mại, theo đó bên bán có nghĩa vụ giao hàng,\nchuyển quyền sở hữu hàng hóa cho bên mua và nhận thanh toán; bên mua có nghĩa vụ\nthanh toán cho bên bán, nhận hàng và quyền sở hữu hàng hoá theo thỏa thuận.\n9. Cung ứng dịch vụ là hoạt động thương mại, theo đó một bên (sau đây gọi là bên cung ứng dịch vụ) có nghĩa vụ thực hiện dịch vụ cho một bên khác và nhận thanh toán; bên sử dụng dịch vụ (sau đây gọi là khách hàng) có nghĩa vụ thanh toán cho bên cung ứng dịch vụ và sử dụng dịch vụ theo thỏa thuận.\n10. Xúc tiến thương mại là hoạt động thúc đẩy, tìm kiếm cơ hội mua bán hàng hoá và cung\nứng dịch vụ, bao gồm hoạt động khuyến mại, quảng cáo thương mại, trưng bày, giới thiệu hàng hoá, dịch vụ và hội chợ, triển lãm thương mại.\n11. Các hoạt động trung gian thương mại là hoạt động của thương nhân để thực hiện các giao dịch thương mại cho một hoặc một số thương nhân được xác định, bao gồm hoạt động đại diện cho thương nhân, môi giới thương mại, uỷ thác mua bán hàng hoá và đại lý thương mại.\n12. Vi phạm hợp đồng là việc một bên không thực hiện, thực hiện không đầy đủ hoặc thực hiện không đúng nghĩa vụ\ntheo thoả thuận giữa các bên hoặc theo quy định của Luật này.\n13. Vi phạm cơ bản là sự vi phạm hợp đồng của một bên gây thiệt hại cho bên kia đến mức làm cho bên kia không đạt được mục đích của việc giao kết hợp đồng.\n14. Xuất xứ hàng hoá là nước hoặc vùng lãnh thổ nơi sản xuất ra toàn bộ hàng hoá hoặc nơi thực hiện công đoạn chế\nbiến cơ bản cuối cùng đối với hàng hoá trong trường hợp có nhiều nước hoặc vùng lãnh thổ tham gia vào quá trình sản xuất hàng hoá đó.\n15. Các hình thức có giá trị\ntương đương văn bản bao gồm điện báo, telex, fax, thông điệp dữ liệu và các hình thức khác theo quy định của pháp luật.\nĐiều 4. Áp dụng Luật thương mại và pháp luật có liên quan 1. Hoạt động thương mại phải tuân theo Luật thương mại và pháp luật có liên quan.\n2. Hoạt động thương mại đặc thù\nđược quy định trong luật khác thì áp dụng quy định của luật đó.\n3. Hoạt động thương mại không được quy định trong Luật thương mại và trong các luật khác thì áp dụng quy định của Bộ luật dân sự.\nĐiều 5. Áp dụng điều ước quốc tế, pháp luật nước ngoài và tập quán thương mại quốc tế\n1. Trường hợp điều ước quốc tế mà\nCộng hoà xã hội chủ nghĩa Việt Nam là thành viên có quy định áp dụng pháp luật nước ngoài, tập quán thương mại quốc tế hoặc có quy định khác với quy định của Luật này thì áp dụng quy định của điều ước quốc tế đó.\n2. Các bên trong giao dịch thương mại có yếu tố nước ngoài được thoả thuận áp dụng pháp luật nước ngoài, tập quán thương mại quốc tế nếu pháp luật nước ngoài, tập quán thương mại quốc tế đó\nkhông trái với các nguyên tắc cơ bản của pháp luật Việt Nam.\nĐiều 6. Thương nhân 1. Thương nhân bao gồm tổ chức kinh tế được thành lập hợp pháp, cá nhân hoạt động thương mại một cách độc lập,\nthường xuyên và có đăng ký kinh doanh.\n2. Thương nhân có quyền hoạt động thương mại trong các ngành nghề, tại các địa bàn, dưới các hình thức và theo các phương thức mà pháp luật không cấm.\n3. Quyền hoạt động thương mại hợp pháp của thương nhân được Nhà nước bảo hộ.\n4. Nhà nước thực hiện độc quyền Nhà nước có thời hạn về hoạt động thương mại đối với một số hàng hóa, dịch vụ\nhoặc tại một số địa bàn để bảo đảm lợi ích quốc gia. Chính phủ quy định cụ thể\ndanh mục hàng hóa, dịch vụ, địa bàn độc quyền Nhà nước.\nĐiều 7. Nghĩa vụ đăng ký kinh doanh của thương nhân Thương nhân có nghĩa vụ đăng ký\nkinh doanh theo quy định của pháp luật. Trường hợp chưa đăng ký kinh doanh,\nthương nhân vẫn phải chịu trách nhiệm về mọi hoạt động của mình theo quy định của Luật này và quy định khác của pháp luật.\nĐiều 8. Cơ quan quản lý nhà nước về hoạt động thương mại 1. Chính phủ thống nhất quản lý\nnhà nước về hoạt động thương mại.\n2. Bộ Thương mại chịu trách nhiệm trước Chính phủ thực hiện việc quản lý nhà nước về hoạt động mua bán hàng hóa và các hoạt động thương mại cụ thể được quy định tại Luật này.\n3. Bộ, cơ quan ngang bộ trong phạm vi nhiệm vụ, quyền hạn của mình có trách nhiệm thực hiện việc quản lý nhà nước về các hoạt động thương mại trong lĩnh vực được phân công.\n4. Uỷ ban nhân dân các cấp thực hiện việc quản lý nhà nước về các hoạt động thương mại tại địa phương theo sự\nphân cấp của Chính phủ.\nĐiều 9. Hiệp hội thương mại 1. Hiệp hội thương mại được thành lập để bảo vệ quyền và lợi ích hợp pháp của thương nhân, động viên thương nhân tham gia phát triển thương mại, tuyên truyền, phổ biến các quy định của pháp luật về thương mại.\n2. Hiệp hội thương mại được tổ chức và hoạt động theo quy định của pháp luật về hội.\nMỤC 2. NHỮNG NGUYÊN TẮC CƠ BẢN TRONG HOẠT ĐỘNG THƯƠNG MẠI\nĐiều 10. Nguyên tắc bình đẳng trước pháp luật của thương nhân trong hoạt động thương mại Thương nhân thuộc mọi thành phần kinh tế bình đẳng trước pháp luật trong hoạt động thương mại.\nĐiều 11. Nguyên tắc tự do, tự nguyện thoả thuận trong hoạt động thương mại 1. Các bên có quyền tự do thoả\nthuận không trái với các quy định của pháp luật, thuần phong mỹ tục và đạo đức xã\nhội để xác lập các quyền và nghĩa vụ của các bên trong hoạt động thương mại.\nNhà nước tôn trọng và bảo hộ các quyền đó.\n2. Trong hoạt động thương mại,\ncác bên hoàn toàn tự nguyện, không bên nào được thực hiện hành vi áp đặt, cưỡng\nép, đe doạ, ngăn cản bên nào.\nĐiều 12. Nguyên tắc áp dụng thói quen trong hoạt động thương mại được thiết lập giữa các bên Trừ trường hợp có thoả thuận khác, các bên được coi là mặc nhiên áp dụng thói quen trong hoạt động thương mại\nđã được thiết lập giữa các bên đó mà các bên đã biết hoặc phải biết nhưng không\nđược trái với quy định của pháp luật.\nĐiều 13. Nguyên tắc áp dụng tập quán trong hoạt động thương mại Trường hợp pháp luật không có quy\nđịnh, các bên không có thoả thuận và không có thói quen đã được thiết lập giữa các bên thì áp dụng tập quán thương mại nhưng không được trái với những nguyên tắc quy định trong Luật này và trong Bộ luật dân sự.\nĐiều 14. Nguyên tắc bảo vệ lợi ích chính đáng của người tiêu dùng 1. Thương nhân thực hiện hoạt động thương mại có nghĩa vụ thông tin đầy đủ, trung thực cho người tiêu dùng về hàng hoá và dịch vụ mà mình kinh doanh và phải chịu trách nhiệm về tính chính xác của các thông tin đó.\n2. Thương nhân thực hiện hoạt động thương mại phải chịu trách nhiệm về chất lượng, tính hợp pháp của hàng hoá, dịch vụ mà mình kinh doanh.\nĐiều 15. Nguyên tắc thừa nhận giá trị pháp lý của thông điệp dữ liệu trong hoạt động thương mại Trong hoạt động thương mại, các thông điệp dữ liệu đáp ứng các điều kiện, tiêu chuẩn kỹ thuật theo quy định của pháp luật thì được thừa nhận có giá trị pháp lý tương đương văn bản.\nMỤC 3.\nTHƯƠNG NHÂN NƯỚC NGOÀI HOẠT ĐỘNG THƯƠNG MẠI TẠI VIỆT NAM\nĐiều 16. Thương nhân nước ngoài hoạt động thương mại tại Việt Nam 1. Thương nhân nước ngoài là\nthương nhân được thành lập, đăng ký kinh doanh theo quy định của pháp luật nước ngoài hoặc được pháp luật nước ngoài công nhận.\n2. Thương nhân nước ngoài được đặt Văn phòng đại diện, Chi nhánh tại Việt Nam; thành lập tại Việt Nam doanh nghiệp có vốn đầu tư nước ngoài theo các hình thức do pháp luật Việt Nam quy định.\n3. Văn phòng đại diện, Chi nhánh của thương nhân nước ngoài tại Việt Nam có các quyền và nghĩa vụ theo quy định của pháp luật Việt Nam. Thương nhân nước ngoài phải chịu trách nhiệm trước pháp luật Việt Nam về toàn bộ hoạt động của Văn phòng đại diện, Chi nhánh của mình tại Việt Nam.\n4. Doanh nghiệp có vốn đầu tư nước ngoài được thương nhân nước ngoài thành lập tại Việt Nam theo quy định của pháp luật Việt Nam hoặc điều ước quốc tế mà Cộng hoà xã hội chủ nghĩa Việt Nam là thành viên thì được coi là thương nhân Việt Nam.\nĐiều 17. Quyền của Văn phòng đại diện 1. Hoạt động đúng mục đích, phạm vi và thời hạn được quy định trong giấy phép thành lập Văn phòng đại diện.\n2. Thuê trụ sở, thuê, mua các phương tiện, vật dụng cần thiết cho hoạt động của Văn phòng đại diện.\n3. Tuyển dụng lao động là người Việt Nam, người nước ngoài để làm việc tại Văn phòng đại diện theo quy định của pháp luật Việt Nam.\n4. Mở tài khoản bằng ngoại tệ, bằng\nđồng Việt Nam có gốc ngoại tệ tại ngân hàng được phép hoạt động tại Việt Nam và\nchỉ được sử dụng tài khoản này vào hoạt động của Văn phòng đại diện.\n5. Có con dấu mang tên Văn phòng\nđại diện theo quy định của pháp luật Việt Nam.\n6. Các quyền khác theo quy định của pháp luật.\nĐiều 18. Nghĩa vụ của Văn phòng đại diện 1. Không được thực hiện hoạt động sinh lợi trực tiếp tại Việt Nam.\n2. Chỉ được thực hiện các hoạt động xúc tiến thương mại trong phạm vi mà Luật này cho phép.\n3. Không được giao kết hợp đồng,\nsửa đổi, bổ sung hợp đồng đã giao kết của thương nhân nước ngoài, trừ trường hợp Trưởng Văn phòng đại diện có giấy uỷ quyền hợp pháp của thương nhân nước ngoài hoặc các trường hợp quy định tại các khoản 2, 3 và 4 Điều 17 của Luật này.\n4. Nộp thuế, phí, lệ phí và thực hiện các nghĩa vụ tài chính khác theo quy định của pháp luật Việt Nam.\n5. Báo cáo hoạt động của Văn phòng đại diện theo quy định của pháp luật Việt Nam.\n6. Các nghĩa vụ khác theo quy định của pháp luật.\nĐiều 19. Quyền của Chi nhánh 1. Thuê trụ sở, thuê, mua các phương tiện, vật dụng cần thiết cho hoạt động của Chi nhánh.\n2. Tuyển dụng lao động là người Việt Nam, người nước ngoài để làm việc tại Chi nhánh theo quy định của pháp luật Việt Nam.\n3. Giao kết hợp đồng tại Việt Nam phù hợp với nội dung hoạt động được quy định trong giấy phép thành lập Chi nhánh và theo quy định của Luật này.\n4. Mở tài khoản bằng đồng Việt Nam, bằng ngoại tệ tại ngân hàng được phép hoạt động tại Việt Nam.\n5. Chuyển lợi nhuận ra nước ngoài theo quy định của pháp luật Việt Nam.\n6. Có con dấu mang tên Chi nhánh theo quy định của pháp luật Việt Nam.\n7. Thực hiện các hoạt động mua bán hàng hóa và các hoạt động thương mại khác phù hợp với giấy phép thành lập theo quy định của pháp luật Việt Nam và điều ước quốc tế mà Cộng hòa xã hội chủ\nnghĩa Việt Nam là thành viên.\n8. Các quyền khác theo quy định của pháp luật.\nĐiều 20. Nghĩa vụ của Chi nhánh 1. Thực hiện chế độ kế toán theo quy định của pháp luật Việt Nam; trường hợp cần áp dụng chế độ kế toán thông dụng khác thì phải được Bộ Tài chính nước Cộng hòa xã hội chủ nghĩa Việt Nam chấp thuận.\n2. Báo cáo hoạt động của Chi nhánh theo quy định của pháp luật Việt Nam.\n3. Các nghĩa vụ khác theo quy định của pháp luật.\nĐiều 21. Quyền và nghĩa vụ của doanh nghiệp có vốn đầu tư nước ngoài Quyền và nghĩa vụ của doanh nghiệp có vốn đầu tư nước ngoài được xác định theo quy định của pháp luật Việt Nam hoặc\nđiều ước quốc tế mà Cộng hòa xã hội chủ nghĩa Việt Nam là thành viên.\nĐiều 22. Thẩm quyền cho phép thương nhân nước ngoài hoạt động thương mại tại Việt Nam 1. Chính phủ thống nhất quản lý\nviệc cho phép thương nhân nước ngoài hoạt động thương mại tại Việt Nam.\n2. Bộ Kế hoạch và Đầu tư chịu trách nhiệm trước Chính phủ quản lý việc cấp giấy phép cho thương nhân nước ngoài đầu tư vào Việt Nam theo quy định của pháp luật Việt Nam.\n3. Bộ\nThương mại chịu trách nhiệm trước Chính phủ quản lý việc cấp giấy phép thành lập Văn phòng đại diện của thương nhân nước ngoài tại Việt Nam; thành lập Chi nhánh, doanh nghiệp liên doanh, doanh nghiệp 100% vốn nước ngoài tại Việt Nam trong trường hợp thương nhân đó chuyên thực hiện hoạt động mua bán hàng hóa và\ncác hoạt động liên quan trực tiếp đến mua bán hàng hóa theo pháp luật Việt Nam và phù hợp với điều ước quốc tế mà Cộng hòa xã hội chủ nghĩa Việt Nam là thành viên.\n4. Trường hợp pháp luật chuyên ngành có quy định cụ thể về thẩm quyền của bộ, cơ quan ngang bộ chịu trách nhiệm trước Chính phủ quản lý việc cấp giấy phép cho thương nhân nước ngoài hoạt động thương mại tại Việt Nam thì thực hiện theo quy định của pháp luật chuyên ngành\nđó.\nĐiều 23. Chấm dứt hoạt động tại Việt Nam của thương nhân nước ngoài 1. Thương nhân nước ngoài chấm dứt hoạt động tại Việt Nam trong các trường hợp sau đây:\na) Hết thời hạn hoạt động ghi trong giấy phép;\nb) Theo đề nghị của thương nhân và được cơ quan quản lý nhà nước có thẩm quyền chấp nhận;\nc) Theo quyết định của cơ quan quản lý nhà nước có thẩm quyền do vi phạm pháp luật và quy định của giấy phép;\nd) Do thương nhân bị tuyên bố phá\nsản;\nđ) Khi thương nhân nước ngoài chấm dứt hoạt động theo quy định của pháp luật nước ngoài đối với hình thức Văn phòng đại diện, Chi nhánh và tham gia hợp đồng hợp tác kinh doanh với bên Việt Nam;\ne) Các trường hợp khác theo quy định của pháp luật.\n2. Trước khi chấm dứt hoạt động tại Việt Nam, thương nhân nước ngoài có nghĩa vụ thanh toán các khoản nợ và các nghĩa vụ khác với Nhà nước, tổ chức, cá nhân có liên quan tại Việt Nam.\nChương II MUA BÁN HÀNG HÓA MỤC 1.\nCÁC QUY ĐỊNH CHUNG ĐỐI VỚI HOẠT ĐỘNG MUA BÁN HÀNG HÓA\nĐiều 24. Hình thức hợp đồng mua bán hàng hoá\n1. Hợp đồng mua bán hàng hoá được thể hiện bằng lời nói, bằng văn bản hoặc được xác lập bằng hành vi cụ thể.\n2. Đối với các loại hợp đồng mua bán hàng hoá mà pháp luật quy định phải được lập thành văn bản thì phải tuân theo các quy định đó.\nĐiều 25. Hàng hoá cấm kinh doanh, hàng hoá hạn chế kinh doanh, hàng hóa kinh doanh có điều kiện 1. Căn cứ vào điều kiện kinh tế -\nxã hội của từng thời kỳ và điều ước quốc tế mà Cộng hòa xã hội chủ nghĩa Việt Nam là thành viên, Chính phủ quy định cụ thể danh mục hàng hoá cấm kinh doanh,\nhàng hoá hạn chế kinh doanh, hàng hoá kinh doanh có điều kiện và điều kiện để\nđược kinh doanh hàng hóa đó.\n2. Đối với hàng hoá hạn chế kinh doanh, hàng hoá kinh doanh có điều kiện, việc mua bán chỉ được thực hiện khi hàng hoá và các bên mua bán hàng hóa đáp ứng đầy đủ các điều kiện theo quy định của pháp luật.\nĐiều 26. Áp dụng biện pháp khẩn cấp đối với hàng hóa lưu thông trong nước 1. Hàng hóa đang được lưu thông hợp pháp trong nước bị áp dụng một hoặc các biện pháp buộc phải thu hồi, cấm lưu thông, tạm ngừng lưu thông, lưu thông có điều kiện hoặc phải có giấy phép đối với một trong các trường hợp sau đây:\na) Hàng hóa đó là nguồn gốc hoặc phương tiện lây truyền các loại dịch bệnh;\nb) Khi xảy ra tình trạng khẩn cấp.\n2. Các điều kiện cụ thể, trình tự,\nthủ tục và thẩm quyền công bố việc áp dụng biện pháp khẩn cấp đối với hàng hóa lưu thông trong nước được thực hiện theo quy định của pháp luật.\nĐiều 27. Mua bán hàng hoá quốc tế\n1. Mua bán hàng hoá quốc tế được thực hiện dưới các hình thức xuất khẩu, nhập khẩu, tạm nhập, tái xuất, tạm xuất,\ntái nhập và chuyển khẩu.\n2. Mua bán hàng hoá quốc tế phải\nđược thực hiện trên cơ sở hợp đồng bằng văn bản hoặc bằng hình thức khác có giá\ntrị pháp lý tương đương.\nĐiều 28. Xuất khẩu, nhập khẩu hàng hoá\n1. Xuất khẩu hàng hóa là việc hàng hoá được đưa ra khỏi lãnh thổ Việt Nam hoặc đưa vào khu vực đặc biệt nằm trên lãnh thổ Việt Nam được coi là khu vực hải quan riêng theo quy định của pháp luật.\n2. Nhập khẩu hàng hóa là việc hàng hoá được đưa vào lãnh thổ Việt Nam từ nước ngoài hoặc từ\nkhu vực đặc biệt nằm trên lãnh thổ Việt Nam được coi là khu vực hải quan riêng theo quy định của pháp luật.\n3. Căn cứ vào điều kiện kinh tế - xã hội của từng thời kỳ và điều ước quốc tế mà Cộng hòa xã hội chủ\nnghĩa Việt Nam là thành viên, Chính phủ quy định cụ thể danh mục hàng hóa cấm xuất khẩu, cấm nhập khẩu, danh mục hàng hóa xuất khẩu, nhập khẩu theo giấy phép của cơ quan nhà nước có thẩm quyền và thủ tục cấp giấy phép.\nĐiều 29. Tạm nhập, tái xuất, tạm xuất, tái nhập hàng hoá\n1. Tạm nhập, tái xuất hàng hóa là\nviệc hàng hoá được đưa từ nước ngoài hoặc từ các khu vực đặc biệt nằm trên lãnh thổ Việt Nam được coi là khu vực hải quan riêng theo quy định của pháp luật vào Việt Nam, có làm thủ tục nhập khẩu vào Việt Nam và làm thủ tục xuất khẩu chính hàng hoá đó ra khỏi Việt Nam.\n2. Tạm xuất, tái nhập hàng hóa là\nviệc hàng hoá được đưa ra nước ngoài hoặc đưa vào các khu vực đặc biệt nằm trên lãnh thổ Việt Nam được coi là khu vực hải quan riêng theo quy định của pháp luật,\ncó làm thủ tục xuất khẩu ra khỏi Việt Nam và làm thủ tục nhập khẩu lại chính hàng hoá đó vào Việt Nam.\n3. Chính phủ quy định chi tiết về hoạt động tạm nhập, tái xuất, tạm xuất, tái nhập hàng hóa.\nĐiều 30. Chuyển khẩu hàng hoá\n1. Chuyển khẩu hàng hóa là việc mua hàng từ một nước, vùng lãnh thổ để bán sang một nước, vùng lãnh thổ ngoài lãnh thổ Việt Nam mà không làm thủ tục nhập khẩu vào Việt Nam và không làm thủ\ntục xuất khẩu ra khỏi Việt Nam.\n2. Chuyển khẩu hàng hóa được thực hiện theo các hình thức sau đây:\na) Hàng hóa được vận chuyển thẳng từ nước xuất khẩu đến nước nhập khẩu không qua cửa khẩu Việt Nam;\nb) Hàng hóa được vận chuyển từ nước xuất khẩu đến nước nhập khẩu có qua cửa khẩu Việt Nam nhưng không làm thủ tục nhập khẩu vào Việt Nam và không làm thủ tục xuất khẩu ra khỏi Việt Nam;\nc) Hàng hóa được vận chuyển từ nước xuất khẩu đến nước nhập khẩu có qua cửa khẩu Việt Nam và đưa vào kho ngoại quan, khu vực trung chuyển hàng hoá tại các cảng Việt Nam, không làm thủ tục nhập khẩu vào Việt Nam và không làm thủ tục xuất khẩu ra khỏi Việt Nam.\n3. Chính phủ quy định chi tiết về hoạt động chuyển khẩu hàng hóa.\nĐiều 31. Áp dụng các biện pháp khẩn cấp đối với hoạt động mua bán hàng hóa quốc tế\nTrong trường hợp cần thiết, để bảo vệ an ninh quốc gia và các lợi ích quốc gia khác phù hợp với pháp luật Việt Nam và điều ước quốc tế mà Cộng hòa xã hội chủ nghĩa Việt Nam là thành viên, Thủ tướng Chính phủ quyết định áp dụng các biện pháp khẩn cấp đối với hoạt động mua bán hàng hóa quốc tế.\nĐiều 32. Nhãn hàng hóa lưu thông trong nước và hàng hóa xuất khẩu, nhập khẩu 1. Nhãn hàng hoá là bản viết, bản in, bản vẽ, bản chụp của chữ, hình vẽ, hình ảnh được dán, in, đính, đúc, chạm,\nkhắc trực tiếp trên hàng hoá, bao bì thương phẩm của hàng hoá hoặc trên các chất liệu khác được gắn lên hàng hoá, bao bì thương phẩm của hàng hoá.\n2. Hàng hóa lưu thông trong nước,\nhàng hóa xuất khẩu, nhập khẩu phải có nhãn hàng hóa, trừ một số trường hợp theo quy định của pháp luật.\n3. Các nội dung cần ghi trên nhãn hàng hóa và việc ghi nhãn hàng hóa được thực hiện theo quy định của Chính phủ.\nĐiều 33. Giấy chứng nhận xuất xứ hàng hoá và quy tắc xuất xứ hàng hóa 1. Hàng hoá xuất khẩu, nhập khẩu phải có giấy chứng nhận xuất xứ trong các trường hợp sau đây:\na) Hàng hóa được hưởng ưu đãi về\nthuế hoặc ưu đãi khác;\nb) Theo quy định của pháp luật Việt Nam hoặc điều ước quốc tế mà Cộng hòa xã hội chủ nghĩa Việt Nam là thành viên.\n2. Chính phủ quy định chi tiết về quy tắc xuất xứ hàng hoá xuất khẩu, nhập khẩu.\nMỤC 2.\nQUYỀN VÀ NGHĨA VỤ CỦA CÁC BÊN TRONG HỢP ĐỒNG MUA BÁN HÀNG HÓA\nĐiều 34. Giao hàng và chứng từ liên quan đến hàng hóa 1. Bên bán phải giao hàng, chứng từ theo thỏa thuận trong hợp đồng về số lượng, chất lượng, cách thức đóng gói,\nbảo quản và các quy định khác trong hợp đồng.\n2. Trường hợp không có thỏa thuận cụ thể, bên bán có nghĩa vụ giao hàng và chứng từ liên quan theo quy định của Luật này.\nĐiều 35. Địa điểm giao hàng 1. Bên bán có nghĩa vụ giao hàng\nđúng địa điểm đã thoả thuận.\n2. Trường hợp không có thoả thuận về địa điểm giao hàng thì địa điểm giao hàng được xác định như sau:\na) Trường hợp hàng hoá là vật gắn liền với đất đai thì bên bán phải giao hàng tại nơi có hàng hoá đó;\nb) Trường hợp trong hợp đồng có\nquy định về vận chuyển hàng hoá thì bên bán có nghĩa vụ giao hàng cho người vận chuyển đầu tiên;\nc) Trường hợp trong hợp đồng không có quy định về vận chuyển hàng hoá, nếu vào thời điểm giao kết hợp đồng,\ncác bên biết được địa điểm kho chứa hàng, địa điểm xếp hàng hoặc nơi sản xuất,\nchế tạo hàng hoá thì bên bán phải giao hàng tại địa điểm đó;\nd) Trong các trường hợp khác, bên bán phải giao hàng tại địa điểm kinh doanh của bên bán, nếu không có địa điểm kinh doanh thì phải giao hàng tại nơi cư trú của bên bán được xác định tại thời\nđiểm giao kết hợp đồng mua bán.\nĐiều 36. Trách nhiệm khi giao hàng có liên quan đến người vận chuyển 1. Trường hợp hàng hóa được giao cho người vận chuyển nhưng không được xác định rõ bằng ký mã hiệu trên hàng hóa, chứng từ vận chuyển hoặc cách thức khác thì bên bán phải thông báo cho bên mua về việc đã giao hàng cho người vận chuyển và phải xác định rõ tên và cách thức nhận biết hàng hoá được vận chuyển.\n2. Trường hợp bên bán có nghĩa vụ\nthu xếp việc chuyên chở hàng hoá thì bên bán phải ký kết các hợp đồng cần thiết\nđể việc chuyên chở được thực hiện tới đích bằng các phương tiện chuyên chở\nthích hợp với hoàn cảnh cụ thể và theo các điều kiện thông thường đối với phương thức chuyên chở đó.\n3. Trường hợp bên bán không có\nnghĩa vụ mua bảo hiểm cho hàng hoá trong quá trình vận chuyển, nếu bên mua có\nyêu cầu thì bên bán phải cung cấp cho bên mua những thông tin cần thiết liên quan đến hàng hoá và việc vận chuyển hàng hoá để tạo điều kiện cho bên mua mua bảo hiểm cho hàng hoá đó.\nĐiều 37. Thời hạn giao hàng 1. Bên bán phải giao hàng vào\nđúng thời điểm giao hàng đã thoả thuận trong hợp đồng.\n2. Trường hợp chỉ có thỏa thuận về\nthời hạn giao hàng mà không xác định thời điểm giao hàng cụ thể thì bên bán có\nquyền giao hàng vào bất kỳ thời điểm nào trong thời hạn đó và phải thông báo trước cho bên mua.\n3. Trường hợp không có thỏa thuận về thời hạn giao hàng thì bên bán phải giao hàng trong một thời hạn hợp lý sau khi giao kết hợp đồng.\nĐiều 38. Giao hàng trước thời hạn đã thỏa thuận Trường hợp bên bán giao hàng trước thời hạn đã thỏa thuận thì bên mua có quyền nhận hoặc không nhận hàng nếu các bên không có thoả thuận khác.\nĐiều 39. Hàng hoá không phù hợp với hợp đồng 1. Trường hợp hợp đồng không có quy\nđịnh cụ thể thì hàng hoá được coi là không phù hợp với hợp đồng khi hàng hoá đó\nthuộc một trong các trường hợp sau đây:\na) Không phù hợp với mục đích sử\ndụng thông thường của các hàng hoá cùng chủng loại;\nb) Không phù hợp với bất kỳ mục\nđích cụ thể nào mà bên mua đã cho bên bán biết hoặc bên bán phải biết vào thời\nđiểm giao kết hợp đồng;\nc) Không bảo đảm chất lượng như\nchất lượng của mẫu hàng hoá mà bên bán đã giao cho bên mua;\nd) Không được bảo quản, đóng gói theo cách thức thông thường đối với loại hàng hoá đó hoặc không theo cách thức thích hợp để bảo quản hàng hoá trong trường hợp không có cách thức bảo quản thông thường.\n2. Bên mua có quyền từ chối nhận hàng nếu hàng hoá không phù hợp với hợp đồng theo quy định tại khoản 1 Điều này.\nĐiều 40. Trách nhiệm đối với hàng hoá không phù hợp với hợp đồng Trừ trường hợp các bên có thoả\nthuận khác, trách nhiệm đối với hàng hóa không phù hợp với hợp đồng được quy định như sau:\n1. Bên bán không chịu trách nhiệm về bất kỳ khiếm khuyết nào của hàng hoá nếu vào thời điểm giao kết hợp đồng bên mua đã biết hoặc phải biết về những khiếm khuyết đó;\n2. Trừ trường hợp quy định tại khoản 1 Điều này, trong thời hạn khiếu nại theo quy định của Luật này, bên bán phải chịu trách nhiệm về bất kỳ khiếm khuyết nào của hàng hoá đã có trước thời\nđiểm chuyển rủi ro cho bên mua, kể cả trường hợp khiếm khuyết đó được phát hiện sau thời điểm chuyển rủi ro;\n3. Bên bán phải chịu trách nhiệm về khiếm khuyết của hàng hóa phát sinh sau thời điểm chuyển rủi ro nếu khiếm khuyết đó do bên bán vi phạm hợp đồng.\nĐiều 41. Khắc phục trong trường hợp giao thiếu hàng, giao hàng không phù hợp với hợp đồng 1. Trừ trường hợp có thỏa thuận khác, nếu hợp đồng chỉ quy định thời hạn giao hàng và không xác định thời điểm giao hàng cụ thể mà bên bán giao hàng trước khi hết thời hạn giao hàng và giao thiếu hàng hoặc giao hàng không phù hợp với hợp đồng thì bên bán vẫn có thể\ngiao phần hàng còn thiếu hoặc thay thế hàng hoá cho phù hợp với hợp đồng hoặc khắc phục sự không phù hợp của hàng hoá trong thời hạn còn lại.\n2. Khi bên bán thực hiện việc khắc phục quy định tại khoản 1 Điều này mà gây bất lợi hoặc làm phát sinh chi phí bất hợp lý cho bên mua thì bên mua có quyền yêu cầu bên bán khắc phục bất lợi hoặc chịu chi phí đó.\nĐiều 42. Giao chứng từ liên quan đến hàng hoá\n1. Trường hợp có thỏa thuận về việc giao chứng từ thì bên bán có nghĩa vụ giao chứng từ liên quan đến hàng hoá cho bên mua trong thời hạn, tại địa điểm và bằng phương thức đã thỏa thuận.\n2. Trường hợp không có thỏa thuận về thời hạn, địa điểm giao chứng từ liên quan đến hàng hoá cho bên mua thì bên bán phải giao chứng từ liên quan đến hàng hoá cho bên mua trong thời hạn và tại\nđịa điểm hợp lý để bên mua có thể nhận hàng.\n3. Trường hợp bên bán đã giao chứng từ liên quan đến hàng hoá trước thời hạn thỏa thuận thì bên bán vẫn có thể khắc phục những thiếu sót của các chứng từ này trong thời hạn còn lại.\n4. Khi bên bán thực hiện việc khắc phục những thiếu sót quy định tại khoản 3 Điều này mà gây bất lợi hoặc làm phát sinh chi phí bất hợp lý cho bên mua thì bên mua có quyền yêu cầu bên bán khắc phục bất lợi hoặc chịu chi phí đó.\nĐiều 43. Giao thừa hàng 1. Trường hợp bên bán giao thừa hàng thì bên mua có quyền từ chối hoặc chấp nhận số hàng thừa đó.\n2. Trường hợp bên mua chấp nhận số\nhàng thừa thì phải thanh toán theo giá thoả thuận trong hợp đồng nếu các bên không có thoả thuận khác.\nĐiều 44. Kiểm tra hàng hoá trước khi giao hàng 1. Trường hợp các bên có thoả thuận\nđể bên mua hoặc đại diện của bên mua tiến hành kiểm tra hàng hoá trước khi giao hàng thì bên bán phải bảo đảm cho bên mua hoặc đại diện của bên mua có điều kiện tiến hành việc kiểm tra.\n2. Trừ trường hợp có thỏa thuận khác, bên mua hoặc đại diện của bên mua trong trường hợp quy định tại khoản 1\nĐiều này phải kiểm tra hàng hóa trong một thời gian ngắn nhất mà hoàn cảnh thực tế cho phép; trường hợp hợp đồng có quy định về việc vận chuyển hàng hóa thì việc kiểm tra hàng hoá có thể được hoãn lại cho tới khi hàng hoá được chuyển tới địa\nđiểm đến.\n3. Trường hợp bên mua hoặc đại diện của bên mua không thực hiện việc kiểm tra hàng hóa trước khi giao hàng theo thỏa thuận thì bên bán có quyền giao hàng theo hợp đồng.\n4. Bên bán không phải chịu trách nhiệm về những khiếm khuyết của hàng hoá mà bên mua hoặc đại diện của bên mua\nđã biết hoặc phải biết nhưng không thông báo cho bên bán trong thời hạn hợp lý\nsau khi kiểm tra hàng hoá.\n5. Bên bán phải chịu trách nhiệm về những khiếm khuyết của hàng hoá mà bên mua hoặc đại diện của bên mua đã kiểm tra nếu các khiếm khuyết của hàng hoá không thể phát hiện được trong quá trình kiểm tra bằng biện pháp thông thường và bên bán đã biết hoặc phải biết về các khiếm khuyết đó nhưng không thông báo cho bên mua.\nĐiều 45. Nghĩa vụ bảo đảm quyền sở hữu đối với hàng hoá\nBên bán phải bảo đảm:\n1. Quyền sở hữu của bên mua đối với hàng hóa đã bán không bị tranh chấp bởi bên thứ ba;\n2. Hàng hóa đó phải hợp pháp;\n3. Việc chuyển giao hàng hoá là hợp pháp.\nĐiều 46. Nghĩa vụ bảo đảm quyền sở hữu trí tuệ đối với hàng hoá\n1. Bên bán không được bán hàng hóa vi phạm quyền sở hữu trí tuệ. Bên bán phải chịu trách nhiệm trong trường hợp có tranh chấp liên quan đến quyền sở hữu trí tuệ đối với hàng hóa đã bán.\n2. Trường hợp bên mua yêu cầu bên bán phải tuân theo bản vẽ kỹ thuật, thiết kế, công thức hoặc những số liệu chi tiết do bên mua cung cấp thì bên mua phải chịu trách nhiệm về các khiếu nại liên quan đến những vi phạm quyền sở hữu trí tuệ phát sinh từ việc bên bán đã\ntuân thủ những yêu cầu của bên mua.\nĐiều 47. Yêu cầu thông báo 1. Bên bán mất quyền viện dẫn quy\nđịnh tại khoản 2 Điều 46 của Luật này nếu bên bán không thông báo ngay cho bên mua về khiếu nại của bên thứ ba đối với hàng hoá được giao sau khi bên bán đã biết hoặc phải biết về khiếu nại đó, trừ trường hợp bên mua đã biết hoặc phải biết về khiếu nại của bên thứ ba.\n2. Bên mua mất quyền viện dẫn quy\nđịnh tại Điều 45 và khoản 1 Điều 46 của Luật này nếu bên mua không thông báo ngay cho bên bán về khiếu nại của bên thứ ba đối với hàng hoá\nđược giao sau khi bên mua đã biết hoặc phải biết về khiếu nại đó, trừ trường hợp bên bán biết hoặc phải biết về khiếu nại của bên thứ ba.\nĐiều 48. Nghĩa vụ của bên bán trong trường hợp hàng hóa là đối tượng của biện pháp bảo đảm thực hiện nghĩa vụ dân sự\nTrường hợp hàng hoá được bán là đối tượng của biện pháp bảo đảm thực hiện nghĩa vụ dân sự thì bên bán phải thông báo cho bên mua về biện pháp bảo đảm và phải được sự đồng ý của bên nhận bảo đảm về việc bán hàng hóa đó.\nĐiều 49. Nghĩa vụ bảo hành hàng hoá\n1. Trường hợp hàng hoá mua bán có\nbảo hành thì bên bán phải chịu trách nhiệm bảo hành hàng hoá đó theo nội dung và thời hạn đã thỏa thuận.\n2. Bên bán phải thực hiện nghĩa vụ\nbảo hành trong thời gian ngắn nhất mà hoàn cảnh thực tế cho phép.\n3. Bên bán phải chịu các chi phí\nvề việc bảo hành, trừ trường hợp có thoả thuận khác.\nĐiều 50. Thanh toán 1. Bên mua có nghĩa vụ thanh toán tiền mua hàng và nhận hàng theo thỏa thuận.\n2. Bên mua phải tuân thủ các phương thức thanh toán, thực hiện việc thanh toán theo trình tự, thủ tục đã thỏa thuận và theo quy định của pháp luật.\n3. Bên mua vẫn phải thanh toán tiền mua hàng trong trường hợp hàng hoá mất mát, hư hỏng sau thời điểm rủi ro được chuyển từ bên bán sang bên mua, trừ trường hợp mất mát, hư hỏng do lỗi của bên bán gây ra.\nĐiều 51. Việc ngừng thanh toán tiền mua hàng Trừ trường hợp có thoả thuận khác, việc ngừng thanh toán tiền mua hàng được quy định như sau:\n1. Bên mua có bằng chứng về việc bên bán lừa dối thì có quyền tạm ngừng việc thanh toán;\n2. Bên mua có bằng chứng về việc hàng hóa đang là đối tượng bị tranh chấp thì có quyền tạm ngừng thanh toán cho\nđến khi việc tranh chấp đã được giải quyết;\n3. Bên mua có bằng chứng về việc bên bán đã giao hàng không phù hợp với hợp đồng thì có quyền tạm ngừng thanh toán cho đến khi bên bán đã khắc phục sự không phù hợp đó;\n4. Trường hợp tạm ngừng thanh toán theo quy định tại khoản 2 và khoản 3 Điều này mà bằng chứng do bên mua đưa ra không xác thực, gây thiệt hại cho bên bán thì bên mua phải bồi thường thiệt hại đó và chịu các chế tài khác theo quy định của Luật này.\nĐiều 52. Xác định giá\nTrường hợp không có thoả thuận về\ngiá hàng hoá, không có thoả thuận về phương pháp xác định giá và cũng không có\nbất kỳ chỉ dẫn nào khác về giá thì giá của hàng hoá được xác định theo giá của loại hàng hoá đó trong các điều kiện tương tự về phương thức giao hàng, thời điểm mua bán hàng hoá, thị trường địa lý, phương thức thanh toán và các điều kiện khác có ảnh hưởng đến giá.\nĐiều 53. Xác định giá theo trọng lượng Trừ trường hợp có thoả thuận khác, nếu giá được xác định theo trọng lượng của hàng hoá thì trọng lượng đó là\ntrọng lượng tịnh.\nĐiều 54. Địa điểm thanh toán Trường hợp không có thỏa thuận về\nđịa điểm thanh toán cụ thể thì bên mua phải thanh toán cho bên bán tại một trong các địa điểm sau đây:\n1. Địa điểm kinh doanh của bên bán được xác định vào thời điểm giao kết hợp đồng, nếu không có địa điểm kinh doanh thì tại nơi cư trú của bên bán;\n2. Địa điểm giao hàng hoặc giao chứng từ, nếu việc thanh toán được tiến hành đồng thời với việc giao hàng hoặc giao chứng từ.\nĐiều 55. Thời hạn thanh toán Trừ trường hợp có thoả thuận khác, thời hạn thanh toán được quy định như sau:\n1. Bên mua phải thanh toán cho bên bán vào thời điểm bên bán giao hàng hoặc giao chứng từ liên quan đến hàng hoá;\n2. Bên mua không có nghĩa vụ\nthanh toán cho đến khi có thể kiểm tra xong hàng hoá trong trường hợp có thỏa thuận theo quy định tại Điều 44 của Luật này.\nĐiều 56. Nhận hàng Bên mua có nghĩa vụ nhận hàng theo thoả thuận và thực hiện những công việc hợp lý để giúp bên bán giao hàng.\nĐiều 57. Chuyển rủi ro trong trường hợp có địa điểm giao hàng xác định Trừ trường hợp có thoả thuận khác, nếu bên bán có nghĩa vụ giao hàng cho bên mua tại một địa điểm nhất định thì rủi ro về mất mát hoặc hư hỏng hàng hoá được chuyển cho bên mua khi hàng hoá đã được giao cho bên mua hoặc người được bên mua uỷ quyền đã nhận hàng tại\nđịa điểm đó, kể cả trong trường hợp bên bán được uỷ quyền giữ lại các chứng từ\nxác lập quyền sở hữu đối với hàng hoá.\nĐiều 58. Chuyển rủi ro trong trường hợp không có địa điểm giao hàng xác định Trừ trường hợp có thoả thuận khác, nếu hợp đồng có quy định về việc vận chuyển hàng hoá và bên bán không có\nnghĩa vụ giao hàng tại một địa điểm nhất định thì rủi ro về mất mát hoặc hư hỏng hàng hoá được chuyển cho bên mua khi hàng hoá đã được giao cho người vận chuyển\nđầu tiên.\nĐiều 59. Chuyển rủi ro trong trường hợp giao hàng cho người nhận hàng để giao mà không phải là người vận chuyển Trừ trường hợp có thoả thuận khác, nếu hàng hoá đang được người nhận hàng để giao nắm giữ mà không phải là\nngười vận chuyển thì rủi ro về mất mát hoặc hư hỏng hàng hoá được chuyển cho bên mua thuộc một trong các trường hợp sau đây:\n1. Khi bên mua nhận được chứng từ\nsở hữu hàng hoá;\n2. Khi người nhận hàng để giao xác nhận quyền chiếm hữu hàng hoá của bên mua.\nĐiều 60. Chuyển rủi ro trong trường hợp mua bán hàng hoá đang trên\nđường vận chuyển Trừ trường hợp có thỏa thuận khác, nếu đối tượng của hợp đồng là hàng hoá đang trên đường vận chuyển thì rủi ro về mất mát hoặc hư hỏng hàng hoá được chuyển cho bên mua kể từ thời điểm giao kết hợp đồng.\nĐiều 61. Chuyển rủi ro trong các trường hợp khác Trừ trường hợp có thoả thuận khác, việc chuyển rủi ro trong các trường hợp khác được quy định như sau:\n1. Trong trường hợp không được quy định tại các điều 57, 58, 59 và 60 của Luật này thì rủi ro về mất mát hoặc hư hỏng hàng hoá được chuyển cho bên mua, kể từ thời điểm hàng hóa thuộc quyền định đoạt của bên mua và bên mua vi phạm hợp đồng do không nhận hàng;\n2. Rủi ro về mất mát hoặc hư hỏng hàng hoá không được chuyển cho bên mua, nếu hàng hoá không được xác định rõ\nràng bằng ký mã hiệu, chứng từ vận tải, không được thông báo cho bên mua hoặc không được xác định bằng bất kỳ cách thức nào khác.\nĐiều 62. Thời điểm chuyển quyền sở hữu hàng hoá\nTrừ trường hợp pháp luật có quy định khác hoặc các bên có thỏa thuận khác, quyền sở hữu được chuyển từ bên bán sang bên mua kể từ thời điểm hàng hóa được chuyển giao.\nMỤC 3.\nMUA BÁN HÀNG HÓA QUA SỞ GIAO DỊCH HÀNG HÓA\nĐiều 63. Mua bán hàng hóa qua Sở giao dịch hàng hóa 1. Mua bán hàng hóa qua Sở giao dịch hàng hóa là hoạt động thương mại, theo đó các bên thỏa thuận thực hiện việc mua bán một lượng nhất định của một loại hàng hóa nhất định qua Sở giao dịch hàng hoá theo những tiêu chuẩn của Sở giao dịch hàng hoá với giá được thỏa thuận tại thời điểm giao kết hợp đồng và thời gian giao hàng được xác định tại một thời\nđiểm trong tương lai.\n2. Chính phủ quy định chi tiết về hoạt động mua bán hàng hóa qua Sở giao dịch hàng hóa.\nĐiều 64. Hợp đồng mua bán hàng hóa qua Sở giao dịch hàng hoá\n1. Hợp đồng mua bán hàng hóa qua Sở giao dịch hàng hoá bao gồm hợp đồng kỳ hạn và hợp đồng quyền chọn.\n2. Hợp đồng kỳ hạn là thỏa thuận,\ntheo đó bên bán cam kết giao và bên mua cam kết nhận hàng hoá tại một thời điểm trong tương lai theo hợp đồng.\n3. Hợp đồng về quyền chọn mua hoặc quyền chọn bán là thỏa thuận, theo đó bên mua quyền có quyền được mua hoặc được bán một hàng hóa xác định với mức giá định trước (gọi là giá giao kết) và phải trả một khoản tiền nhất định để mua quyền này (gọi là tiền mua quyền). Bên mua quyền có quyền chọn thực hiện hoặc không thực hiện việc mua hoặc bán hàng hóa\nđó.\nĐiều 65. Quyền và nghĩa vụ của các bên trong hợp đồng kỳ hạn 1. Trường hợp người bán thực hiện việc giao hàng theo hợp đồng thì bên mua có nghĩa vụ nhận hàng và thanh toán.\n2. Trường hợp các bên có thoả thuận về việc bên mua có thể thanh toán bằng tiền và không nhận hàng thì bên mua phải thanh toán cho bên bán một khoản tiền bằng mức chênh lệch giữa giá thoả thuận trong hợp đồng và giá thị trường do Sở giao dịch hàng hoá công bố tại thời điểm hợp đồng được thực hiện.\n3. Trường hợp các bên có thoả thuận về việc bên bán có thể thanh toán bằng tiền và không giao hàng thì bên bán phải thanh toán cho bên mua một khoản tiền bằng mức chênh lệch giữa giá thị trường do Sở giao dịch hàng hoá công bố tại thời điểm hợp đồng được thực hiện và giá\nthoả thuận trong hợp đồng.\nĐiều 66. Quyền và nghĩa vụ của các bên trong hợp đồng quyền chọn 1. Bên mua quyền chọn mua hoặc quyền chọn bán phải trả tiền mua quyền chọn để được trở thành bên giữ quyền chọn mua hoặc giữ quyền chọn bán. Số tiền phải trả cho việc mua quyền chọn do các bên thoả thuận.\n2. Bên giữ quyền chọn mua có quyền mua nhưng không có nghĩa vụ phải mua hàng hoá đã giao kết trong hợp đồng. Trường hợp bên giữ quyền chọn mua quyết định thực hiện hợp đồng thì bên bán có nghĩa vụ\nphải bán hàng hoá cho bên giữ quyền chọn mua. Trường hợp bên bán không có hàng hoá để giao thì phải thanh toán cho bên giữ quyền chọn mua một khoản tiền bằng mức chênh lệch giữa giá thoả thuận trong hợp đồng và giá thị trường do Sở giao dịch hàng hoá công bố tại thời điểm hợp đồng được thực hiện.\n3. Bên giữ quyền chọn bán có quyền bán nhưng không có nghĩa vụ phải bán hàng hoá đã giao kết trong hợp đồng. Trường hợp bên giữ quyền chọn bán quyết định thực hiện hợp đồng thì bên mua có nghĩa vụ\nphải mua hàng hoá của bên giữ quyền chọn bán. Trường hợp bên mua không mua hàng thì phải thanh toán cho bên giữ quyền chọn bán một khoản tiền bằng mức chênh lệch giữa giá thị trường do Sở giao dịch hàng hoá công bố tại thời điểm hợp đồng được thực hiện và giá thoả thuận trong hợp đồng.\n4. Trường hợp bên giữ quyền chọn mua hoặc giữ quyền chọn bán quyết định không thực hiện hợp đồng trong thời hạn hợp đồng có hiệu lực thì hợp đồng đương nhiên hết hiệu lực.\nĐiều 67. Sở giao dịch hàng hoá\n1. Sở giao dịch hàng hoá có các chức năng sau đây:\na) Cung cấp các điều kiện vật chất\n- kỹ thuật cần thiết để giao dịch mua bán hàng hoá;\nb) Điều hành các hoạt động giao dịch;\nc) Niêm yết các mức giá cụ thể\nhình thành trên thị trường giao dịch tại từng thời điểm.\n2. Chính phủ quy định chi tiết điều kiện thành lập Sở giao dịch hàng hóa, quyền hạn, trách nhiệm của Sở giao dịch hàng hóa và việc phê chuẩn Điều lệ hoạt động của Sở giao dịch hàng hóa.\nĐiều 68. Hàng hoá giao dịch tại Sở giao dịch hàng hóa Danh mục hàng hoá giao dịch tại Sở\ngiao dịch hàng hóa do Bộ trưởng Bộ Thương mại quy định.\nĐiều 69. Thương nhân môi giới mua bán hàng hoá qua Sở Giao dịch hàng hoá\n1. Thương nhân môi giới mua bán hàng hoá qua Sở giao dịch hàng hoá chỉ được phép hoạt động tại Sở Giao dịch hàng hoá khi đáp ứng đủ các điều kiện theo quy định của pháp luật. Chính phủ quy định chi tiết điều kiện hoạt động của thương nhân môi giới mua bán hàng hoá qua Sở\ngiao dịch hàng hoá.\n2. Thương nhân môi giới mua bán hàng hoá qua Sở giao dịch hàng hoá chỉ được phép thực hiện các hoạt động môi giới mua bán hàng hoá qua Sở giao dịch hàng hoá và không được phép là một bên của hợp\nđồng mua bán hàng hoá qua Sở giao dịch hàng hoá.\n3. Thương nhân môi giới mua bán hàng hoá qua Sở giao dịch hàng hoá có nghĩa vụ đóng tiền ký quỹ tại Sở giao dịch hàng hoá để bảo đảm thực hiện các nghĩa vụ phát sinh trong quá trình hoạt động môi giới mua bán hàng hoá. Mức tiền ký quỹ do Sở giao dịch hàng hoá quy định.\nĐiều 70. Các hành vi bị cấm đối với thương nhân môi giới hàng hoá\nqua Sở giao dịch hàng hoá\n1. Lôi kéo khách hàng ký kết hợp\nđồng bằng cách hứa bồi thường toàn bộ hoặc một phần thiệt hại phát sinh hoặc bảo\nđảm lợi nhuận cho khách hàng.\n2. Chào hàng hoặc môi giới mà\nkhông có hợp đồng với khách hàng.\n3. Sử dụng giá giả tạo hoặc các biện pháp gian lận khác khi môi giới cho khách hàng.\n4. Từ chối hoặc tiến hành chậm trễ\nmột cách bất hợp lý việc môi giới hợp đồng theo các nội dung đã thoả thuận với khách hàng.\n5. Các hành vi bị cấm khác quy định tại khoản 2 Điều 71 của Luật này.\nĐiều 71. Các hành vi bị cấm trong hoạt động mua bán hàng hoá qua Sở\ngiao dịch hàng hóa 1. Nhân viên của Sở giao dịch hàng hoá không được phép môi giới, mua bán hàng hoá qua Sở giao dịch hàng hoá.\n2. Các bên liên quan đến hoạt động mua bán hàng hoá qua Sở giao dịch hàng hoá không được thực hiện các hành vi sau\nđây:\na) Gian lận, lừa dối về khối lượng hàng hóa trong các hợp đồng kỳ hạn hoặc hợp đồng quyền chọn được giao dịch hoặc có thể được giao dịch và gian lận, lừa dối về giá thực tế của loại hàng hoá\ntrong các hợp đồng kỳ hạn hoặc hợp đồng quyền chọn;\nb) Đưa tin sai lệch về các giao dịch,\nthị trường hoặc giá hàng hoá mua bán qua Sở giao dịch hàng hóa;\nc) Dùng các biện pháp bất hợp pháp để gây rối loạn thị trường hàng hóa tại Sở giao dịch hàng hoá;\nd) Các hành vi bị cấm khác theo quy định của pháp luật.\nĐiều 72. Thực hiện biện pháp quản lý trong trường hợp khẩn cấp 1. Trường hợp khẩn cấp là trường hợp xảy ra hiện tượng rối loạn thị trường hàng hoá làm cho giao dịch qua Sở\ngiao dịch hàng hóa không phản ánh được chính xác quan hệ cung cầu.\n2. Trong trường hợp khẩn cấp, Bộ\ntrưởng Bộ Thương mại có quyền thực hiện các biện pháp sau đây:\na) Tạm ngừng việc giao dịch qua Sở\ngiao dịch hàng hoá;\nb) Hạn chế các giao dịch ở một khung giá hoặc một số lượng hàng hóa nhất định;\nc) Thay đổi lịch giao dịch;\nd) Thay đổi Điều lệ hoạt động của Sở giao dịch hàng hoá;\nđ) Các biện pháp cần thiết khác theo quy định của Chính phủ.\nĐiều 73. Quyền hoạt động mua bán hàng hóa qua Sở giao dịch hàng hóa ở nước ngoài Thương nhân Việt Nam được quyền hoạt động mua bán hàng hóa qua Sở giao dịch hàng hóa ở nước ngoài theo quy định của Chính phủ.\nChương III CUNG ỨNG DỊCH VỤ\nMỤC 1.\nCÁC QUY ĐỊNH CHUNG ĐỐI VỚI HOẠT ĐỘNG CUNG ỨNG DỊCH VỤ\nĐiều 74. Hình thức hợp đồng dịch vụ\n1. Hợp đồng dịch vụ được thể hiện bằng lời nói, bằng văn bản hoặc được xác lập bằng hành vi cụ thể.\n2. Đối với các loại hợp đồng dịch vụ mà pháp luật quy định phải được lập thành văn bản thì phải tuân theo các quy\nđịnh đó.\nĐiều 75. Quyền cung ứng và sử dụng dịch vụ của thương nhân 1. Trừ trường hợp pháp luật hoặc\nđiều ước quốc tế mà Cộng hòa xã hội chủ nghĩa Việt Nam là thành viên có quy định khác, thương nhân có các quyền cung ứng dịch vụ sau đây:\na) Cung ứng dịch vụ cho người cư\ntrú tại Việt Nam sử dụng trên lãnh thổ Việt Nam;\nb) Cung ứng dịch vụ cho người không cư trú tại Việt Nam sử dụng trên lãnh thổ Việt Nam;\nc) Cung ứng dịch vụ cho người cư\ntrú tại Việt Nam sử dụng trên lãnh thổ nước ngoài;\nd) Cung ứng dịch vụ cho người không cư trú tại Việt Nam sử dụng trên lãnh thổ nước ngoài.\n2. Trừ trường hợp pháp luật hoặc\nđiều ước quốc tế mà Cộng hòa xã hội chủ nghĩa Việt Nam là thành viên có quy định khác, thương nhân có các quyền sử dụng dịch vụ sau đây:\na) Sử dụng dịch vụ do người cư trú\ntại Việt Nam cung ứng trên lãnh thổ Việt Nam;\nb) Sử dụng dịch vụ do người không cư trú tại Việt Nam cung ứng trên lãnh thổ Việt Nam;\nc) Sử dụng dịch vụ do người cư\ntrú tại Việt Nam cung ứng trên lãnh thổ nước ngoài;\nd) Sử dụng dịch vụ do người không cư trú tại Việt Nam cung ứng trên lãnh thổ nước ngoài.\n3. Chính phủ quy định cụ thể đối tượng người cư trú, người không cư trú để thực hiện các chính sách thuế, quản lý xuất khẩu, nhập khẩu đối với các loại hình dịch vụ.\nĐiều 76. Dịch vụ cấm kinh doanh, dịch vụ hạn chế kinh doanh và dịch vụ kinh doanh có điều kiện 1. Căn cứ vào điều kiện kinh tế -\nxã hội của từng thời kỳ và điều ước quốc tế mà Cộng hòa xã hội chủ nghĩa Việt Nam là thành viên, Chính phủ quy định cụ thể danh mục dịch vụ cấm kinh doanh, dịch vụ hạn chế kinh doanh, dịch vụ kinh doanh có điều kiện và điều kiện để được kinh doanh dịch vụ đó.\n2. Đối với dịch vụ hạn chế kinh doanh, dịch vụ kinh doanh có điều kiện, việc cung ứng dịch vụ chỉ được thực hiện khi dịch vụ và các bên tham gia hoạt động cung ứng dịch vụ đáp ứng đầy đủ các\nđiều kiện theo quy định của pháp luật.\nĐiều 77. Áp dụng các biện pháp khẩn cấp đối với hoạt động cung ứng hoặc sử dụng dịch vụ\nTrong trường hợp cần thiết, để bảo vệ an ninh quốc gia và các lợi ích quốc gia khác phù hợp với pháp luật Việt Nam và điều ước quốc tế mà Cộng hòa xã hội chủ nghĩa Việt Nam là thành viên, Thủ tướng Chính phủ quyết định áp dụng các biện pháp khẩn cấp đối với hoạt động cung ứng hoặc sử dụng dịch vụ, bao gồm việc tạm thời cấm cung ứng hoặc sử dụng đối với một hoặc một số loại dịch vụ hoặc các biện pháp khẩn cấp khác đối với một hoặc một số thị trường cụ thể trong một thời gian nhất định.\nMỤC 2.\nQUYỀN VÀ NGHĨA VỤ CỦA CÁC BÊN TRONG HỢP ĐỒNG DỊCH VỤ\nĐiều 78. Nghĩa vụ của bên cung ứng dịch vụ\nTrừ trường hợp có thoả thuận khác, bên cung ứng dịch vụ có các nghĩa vụ sau đây:\n1. Cung ứng các dịch vụ và thực hiện những công việc có liên quan một cách đầy đủ, phù hợp với thoả thuận và\ntheo quy định của Luật này;\n2. Bảo quản và giao lại cho khách hàng tài liệu và phương tiện được giao để thực hiện dịch vụ sau khi hoàn thành công việc;\n3. Thông báo ngay cho khách hàng trong trường hợp thông tin, tài liệu không đầy đủ, phương tiện không bảo đảm để\nhoàn thành việc cung ứng dịch vụ;\n4. Giữ bí mật về thông tin mà\nmình biết được trong quá trình cung ứng dịch vụ nếu có thoả thuận hoặc pháp luật có quy định.\nĐiều 79. Nghĩa vụ của bên cung ứng dịch vụ theo kết quả công việc Trừ trường hợp có thoả thuận khác, nếu tính chất của loại dịch vụ được cung ứng yêu cầu bên cung ứng dịch vụ\nphải đạt được một kết quả nhất định thì bên cung ứng dịch vụ phải thực hiện việc cung ứng dịch vụ với kết quả phù hợp với các điều khoản và mục đích của hợp đồng.\nTrong trường hợp hợp đồng không có quy định cụ thể về tiêu chuẩn kết quả cần đạt\nđược, bên cung ứng dịch vụ phải thực hiện việc cung ứng dịch vụ với kết quả phù\nhợp với tiêu chuẩn thông thường của loại dịch vụ đó.\nĐiều 80. Nghĩa vụ của bên cung ứng dịch vụ theo nỗ lực và khả năng cao nhất Trừ trường hợp có thoả thuận khác, nếu tính chất của loại dịch vụ được cung ứng yêu cầu bên cung ứng dịch vụ\nphải nỗ lực cao nhất để đạt được kết quả mong muốn thì bên cung ứng dịch vụ phải thực hiện nghĩa vụ cung ứng dịch vụ đó với nỗ lực và khả năng cao nhất.\nĐiều 81. Hợp tác giữa các bên cung ứng dịch vụ\nTrường hợp theo thỏa thuận hoặc dựa vào tình hình cụ thể, một dịch vụ do nhiều bên cung ứng dịch vụ cùng tiến hành hoặc phối hợp với bên cung ứng dịch vụ khác thì mỗi bên cung ứng dịch vụ có các nghĩa vụ sau đây:\n1. Trao đổi, thông tin cho nhau về\ntiến độ công việc và yêu cầu của mình có liên quan đến việc cung ứng dịch vụ, đồng thời phải cung ứng dịch vụ vào thời gian và theo phương thức phù hợp để không gây cản trở đến hoạt động của bên cung ứng dịch vụ đó;\n2. Tiến hành bất kỳ hoạt động hợp tác cần thiết nào với các bên cung ứng dịch vụ khác.\nĐiều 82. Thời hạn hoàn thành dịch vụ\n1. Bên cung ứng dịch vụ phải hoàn thành dịch vụ đúng thời hạn đã thoả thuận trong hợp đồng.\n2. Trường hợp không có thỏa thuận về thời hạn hoàn thành dịch vụ thì bên cung ứng dịch vụ phải hoàn thành dịch vụ\ntrong một thời hạn hợp lý trên cơ sở tính đến tất cả các điều kiện và hoàn cảnh mà bên cung ứng dịch vụ biết được vào thời điểm giao kết hợp đồng, bao gồm bất kỳ nhu cầu cụ thể nào của khách hàng có liên quan đến thời gian hoàn thành dịch vụ.\n3. Trường hợp một dịch vụ chỉ có\nthể được hoàn thành khi khách hàng hoặc bên cung ứng dịch vụ khác đáp ứng các\nđiều kiện nhất định thì bên cung ứng dịch vụ đó không có nghĩa vụ hoàn thành dịch vụ của mình cho đến khi các điều kiện đó được đáp ứng.\nĐiều 83. Yêu cầu của khách hàng liên quan đến những thay đổi trong quá trình cung ứng dịch vụ\n1. Trong quá trình cung ứng dịch vụ, bên cung ứng dịch vụ phải tuân thủ những yêu cầu hợp lý của khách hàng liên quan đến những thay đổi trong quá trình cung ứng dịch vụ.\n2. Trừ trường hợp có thoả thuận khác, khách hàng phải chịu những chi phí hợp lý cho việc thực hiện những yêu cầu thay đổi của mình.\nĐiều 84. Tiếp tục cung ứng dịch vụ sau khi hết thời hạn hoàn thành việc cung ứng dịch vụ\nSau khi hết thời hạn hoàn thành việc cung ứng dịch vụ mà dịch vụ vẫn chưa hoàn thành, nếu khách hàng không phản\nđối thì bên cung ứng dịch vụ phải tiếp tục cung ứng theo nội dung đã thoả thuận và phải bồi thường thiệt hại, nếu có.\nĐiều 85. Nghĩa vụ của khách hàng Trừ trường hợp có thoả thuận khác, khách hàng có các nghĩa vụ sau đây:\n1. Thanh toán tiền cung ứng dịch vụ như đã thoả thuận trong hợp đồng;\n2. Cung cấp kịp thời các kế hoạch,\nchỉ dẫn và những chi tiết khác để việc cung ứng dịch vụ được thực hiện không bị\ntrì hoãn hay gián đoạn;\n3. Hợp tác trong tất cả những vấn\nđề cần thiết khác để bên cung ứng có thể cung ứng dịch vụ một cách thích hợp;\n4. Trường hợp một dịch vụ do nhiều bên cung ứng dịch vụ cùng tiến hành hoặc phối hợp với bên cung ứng dịch vụ khác,\nkhách hàng có nghĩa vụ điều phối hoạt động của các bên cung ứng dịch vụ để\nkhông gây cản trở đến công việc của bất kỳ bên cung ứng dịch vụ nào.\nĐiều 86. Giá dịch vụ\nTrường hợp không có thoả thuận về\ngiá dịch vụ, không có thoả thuận về phương pháp xác định giá dịch vụ và cũng không có bất kỳ chỉ dẫn nào khác về giá dịch vụ thì giá dịch vụ được xác định theo giá của loại dịch vụ đó trong các điều kiện tương tự về phương thức cung ứng,\nthời điểm cung ứng, thị trường địa lý, phương thức thanh toán và các điều kiện khác có ảnh hưởng đến giá dịch vụ.\nĐiều 87. Thời hạn thanh toán Trường hợp không có thỏa thuận và\ngiữa các bên không có bất kỳ thói quen nào về việc thanh toán thì thời hạn thanh toán là thời điểm việc cung ứng dịch vụ được hoàn thành.\nChương IV XÚC TIẾN THƯƠNG MẠI MỤC 1. KHUYẾN MẠI\nĐiều 88. Khuyến mại 1. Khuyến mại là hoạt động xúc tiến thương mại của thương nhân nhằm xúc tiến việc mua bán hàng hoá, cung ứng dịch vụ\nbằng cách dành cho khách hàng những lợi ích nhất định.\n2. Thương nhân thực hiện khuyến mại là thương nhân thuộc một trong các trường hợp sau\nđây:\na) Thương nhân trực tiếp khuyến mại hàng hóa, dịch vụ mà mình kinh doanh;\nb) Thương nhân kinh doanh dịch vụ\nkhuyến mại thực hiện khuyến mại cho hàng hóa, dịch vụ của thương nhân khác theo thỏa thuận với thương nhân đó.\nĐiều 89. Kinh doanh dịch vụ khuyến mại Kinh doanh dịch vụ khuyến mại là\nhoạt động thương mại, theo đó một thương nhân thực hiện khuyến mại cho hàng hóa, dịch vụ của thương nhân khác trên cơ sở hợp đồng.\nĐiều 90. Hợp đồng dịch vụ khuyến mại Hợp đồng dịch vụ khuyến mại phải\nđược lập thành văn bản hoặc bằng hình thức khác có giá trị pháp lý tương đương.\nĐiều 91. Quyền khuyến mại của thương nhân 1. Thương nhân Việt Nam, Chi nhánh của thương nhân Việt Nam, Chi nhánh của thương nhân nước ngoài tại Việt Nam có quyền tự tổ chức khuyến mại hoặc thuê thương nhân kinh doanh dịch vụ\nkhuyến mại thực hiện việc khuyến mại cho mình.\n2. Văn phòng đại diện của thương nhân không được khuyến mại hoặc thuê thương nhân khác thực hiện khuyến mại tại Việt Nam cho thương nhân mà mình đại diện.\nĐiều 92. Các hình thức khuyến mại 1. Đưa hàng hoá mẫu, cung ứng dịch vụ mẫu để khách hàng dùng thử không phải trả tiền.\n2. Tặng hàng hoá cho khách hàng, cung ứng dịch vụ không thu tiền.\n3. Bán hàng, cung ứng dịch vụ với giá thấp hơn giá bán hàng, giá cung ứng dịch vụ trước\nđó, được áp dụng trong thời gian khuyến mại đã đăng ký hoặc thông báo. Trường hợp hàng hóa, dịch vụ thuộc diện Nhà nước quản lý giá thì việc khuyến mại theo hình thức này được thực hiện theo quy định của Chính phủ.\n4. Bán hàng, cung ứng dịch vụ có kèm theo phiếu mua hàng, phiếu sử dụng dịch vụ để\nkhách hàng được hưởng một hay một số lợi ích nhất định.\n5. Bán hàng, cung ứng dịch vụ có kèm phiếu dự thi cho khách hàng để chọn người trao thưởng theo thể lệ và giải thưởng đã công bố.\n6. Bán hàng, cung ứng dịch vụ kèm theo việc tham dự các chương trình mang tính may rủi mà việc tham gia chương trình gắn liền với việc mua hàng hóa, dịch vụ và việc trúng thưởng dựa trên sự may mắn của người tham gia theo thể lệ và giải thưởng\nđã công bố.\n7. Tổ chức chương trình khách hàng thường xuyên, theo đó việc tặng thưởng cho khách hàng căn cứ trên số lượng hoặc trị giá mua hàng hóa, dịch vụ mà khách hàng thực hiện\nđược thể hiện dưới hình thức thẻ khách hàng, phiếu ghi nhận sự mua hàng hoá, dịch vụ hoặc các hình thức khác.\n8. Tổ chức cho khách hàng tham gia các chương trình văn hóa, nghệ thuật, giải trí và các sự\nkiện khác vì mục đích khuyến mại.\n9. Các hình thức khuyến mại khác nếu được cơ quan quản lý nhà nước về thương mại chấp thuận.\nĐiều 93. Hàng hóa, dịch vụ được khuyến mại 1. Hàng hóa, dịch vụ được khuyến mại là hàng hóa, dịch vụ được thương nhân sử dụng các hình thức khuyến mại để\nxúc tiến việc bán, cung ứng hàng hóa, dịch vụ đó.\n2. Hàng hóa, dịch vụ được khuyến mại phải là hàng hóa, dịch vụ được kinh doanh hợp pháp.\nĐiều 94. Hàng hoá, dịch vụ dùng để khuyến mại, mức giảm giá khuyến mại 1. Hàng hoá, dịch vụ dùng để khuyến mại là hàng hoá, dịch vụ được thương nhân dùng để tặng, thưởng, cung ứng không thu tiền cho khách hàng.\n2. Hàng hoá, dịch vụ được thương nhân dùng để khuyến mại có thể là hàng hoá, dịch vụ mà thương nhân đó đang kinh doanh hoặc hàng hoá, dịch vụ khác.\n3. Hàng hóa, dịch vụ được dùng để\nkhuyến mại phải là hàng hóa, dịch vụ được kinh doanh hợp pháp.\n4. Chính phủ quy định cụ thể hạn mức tối đa về giá trị của hàng hóa, dịch vụ dùng để\nkhuyến mại, mức giảm giá tối đa đối với hàng hóa, dịch vụ được khuyến mại mà\nthương nhân được thực hiện trong hoạt động khuyến mại.\nĐiều 95. Quyền của thương nhân thực hiện khuyến mại 1. Lựa chọn hình thức, thời gian,\nđịa điểm khuyến mại, hàng hóa, dịch vụ dùng để khuyến mại.\n2. Quy định các lợi ích cụ thể mà\nkhách hàng được hưởng phù hợp với khoản 4 Điều 94 của Luật này.\n3. Thuê thương nhân kinh doanh dịch vụ khuyến mại thực hiện việc khuyến mại cho mình.\n4. Tổ chức thực hiện các hình thức khuyến mại quy định tại Điều 92 của Luật này.\nĐiều 96. Nghĩa vụ của thương nhân thực hiện khuyến mại 1. Thực hiện đầy đủ các trình tự,\nthủ tục theo quy định của pháp luật để thực hiện các hình thức khuyến mại.\n2. Thông báo công khai các nội dung thông tin về hoạt động khuyến mại cho khách hàng theo quy định tại Điều 97 của Luật này.\n3. Thực hiện đúng chương trình khuyến mại đã thông báo và các cam kết với khách hàng.\n4. Đối với một số hình thức khuyến mại quy định tại khoản 6 Điều 92 của Luật này, thương nhân phải trích 50% giá trị giải thưởng đã công bố vào ngân sách nhà nước trong trường hợp không có người trúng thưởng.\nBộ trưởng Bộ Thương mại quy định các hình thức khuyến mại cụ thể thuộc các chương trình mang tính may rủi phải thực hiện quy định này.\n5. Tuân thủ các thỏa thuận trong hợp đồng dịch vụ khuyến mại nếu thương nhân thực hiện khuyến mại là thương nhân kinh doanh dịch vụ khuyến mại.\nĐiều 97. Thông tin phải thông báo công khai 1. Đối với tất cả hình thức khuyến mại quy định tại Điều 92 của Luật này, thương nhân thực hiện khuyến mại phải thông báo công khai các thông tin sau đây:\na) Tên của hoạt động khuyến mại;\nb) Giá bán hàng hóa, giá cung ứng dịch vụ khuyến mại và các chi phí có liên quan để giao hàng hóa, dịch vụ được khuyến mại cho khách hàng;\nc) Tên, địa chỉ, số điện thoại của thương nhân thực hiện khuyến mại;\nd) Thời gian khuyến mại, ngày bắt\nđầu, ngày kết thúc và địa bàn hoạt động khuyến mại;\nđ) Trường hợp lợi ích của việc tham gia khuyến mại gắn với các điều kiện cụ thể thì trong thông báo phải nêu rõ hoạt động khuyến mại đó có kèm theo điều kiện và nội dung cụ thể của các điều kiện.\n2. Ngoài các thông tin quy định tại khoản 1 Điều này, thương nhân còn phải thông báo công khai các thông tin liên quan đến hoạt động khuyến mại sau đây:\na) Giá bán hàng hóa, giá cung ứng dịch vụ được tặng cho khách hàng đối với hình thức khuyến mại quy định tại khoản 2 Điều 92 của Luật này;\nb) Trị giá tuyệt đối hoặc phần trăm thấp hơn giá bán hàng hóa, giá cung ứng dịch vụ bình thường trước thời gian khuyến mại đối với hình thức khuyến mại quy định tại khoản 3 Điều 92 của Luật này;\nc) Giá trị bằng tiền hoặc lợi ích cụ thể mà khách hàng được hưởng từ phiếu mua hàng, phiếu sử dụng dịch vụ; địa\nđiểm bán hàng, cung ứng dịch vụ và các loại hàng hóa, dịch vụ mà khách hàng có\nthể nhận được từ phiếu mua hàng, phiếu sử dụng dịch vụ đối với hình thức khuyến mại quy định tại khoản 4 Điều 92 của Luật này;\nd) Loại giải thưởng và giá trị của từng loại giải thưởng; thể lệ tham gia các chương trình khuyến mại, cách thức lựa chọn người trúng thưởng đối với các hình thức khuyến mại quy định tại khoản 5, khoản 6 Điều 92 của Luật này;\nđ) Các chi phí mà khách hàng phải tự chịu đối với các hình thức khuyến mại quy định tại khoản 7,\nkhoản 8 Điều 92 của Luật này.\nĐiều 98. Cách thức thông báo 1. Việc thông báo khuyến mại hàng hoá theo quy định tại Điều 97 của Luật này được thực hiện bằng một trong các cách thức sau đây:\na) Tại địa điểm bán hàng hóa và\nnơi để hàng hoá bày bán;\nb) Trên hàng hoá hoặc bao bì hàng hóa;\nc) Dưới bất kỳ cách thức nào khác nhưng phải được đính kèm với hàng hóa khi hàng hóa được bán.\n2. Việc thông báo khuyến mại dịch vụ theo quy định tại Điều 97 của Luật này phải được thực hiện dưới một trong các cách thức sau đây:\na) Tại địa điểm cung ứng dịch vụ;\nb) Cách thức khác nhưng phải được cung cấp kèm với dịch vụ khi dịch vụ đó được cung ứng.\nĐiều 99. Bảo đảm bí mật thông tin về chương trình, nội dung khuyến mại Trường hợp chương trình khuyến mại phải được sự chấp thuận của cơ quan nhà nước có thẩm quyền thì cơ quan đó phải giữ bí mật chương trình, nội dung khuyến mại do thương nhân cung cấp cho đến khi chương trình được cơ quan nhà nước có thẩm quyền chấp thuận.\nĐiều 100. Các hành vi bị cấm trong hoạt động khuyến mại 1. Khuyến mại cho hàng hoá, dịch vụ cấm kinh doanh; hàng hóa, dịch vụ hạn chế kinh doanh; hàng hoá chưa được phép lưu thông, dịch vụ chưa được phép cung ứng.\n2. Sử dụng hàng hóa, dịch vụ dùng\nđể khuyến mại là hàng hóa, dịch vụ cấm kinh doanh; hàng hóa, dịch vụ hạn chế\nkinh doanh; hàng hóa chưa được phép lưu thông, dịch vụ chưa được phép cung ứng.\n3. Khuyến mại hoặc sử dụng rượu,\nbia để khuyến mại cho người dưới 18 tuổi.\n4. Khuyến mại hoặc sử dụng thuốc lá, rượu có độ cồn từ 30 độ trở\nlên để khuyến mại dưới mọi hình thức.\n5. Khuyến mại thiếu trung thực hoặc gây hiểu lầm về hàng hoá, dịch vụ để lừa dối khách hàng.\n6. Khuyến mại để tiêu thụ hàng hoá kém chất lượng, làm phương hại đến môi trường, sức khoẻ con người và lợi\ních công cộng khác.\n7. Khuyến mại tại trường học, bệnh viện, trụ sở của cơ quan nhà nước, tổ chức chính trị,\ntổ chức chính trị - xã hội, đơn vị vũ trang nhân dân.\n8. Hứa tặng, thưởng nhưng không thực hiện hoặc thực hiện không đúng.\n9. Khuyến mại nhằm cạnh tranh không lành mạnh.\n10. Thực hiện khuyến mại mà giá\ntrị hàng hóa, dịch vụ dùng để khuyến mại vượt quá hạn mức tối đa hoặc giảm giá\nhàng hóa, dịch vụ được khuyến mại quá mức tối đa theo quy định tại khoản 4 Điều 94 của Luật này.\nĐiều 101. Đăng ký hoạt động khuyến mại, thông báo kết quả khuyến mại với cơ\nquan quản lý nhà nước về thương mại 1. Trước khi thực hiện hoạt động khuyến mại, thương nhân phải đăng ký và sau khi kết thúc hoạt động khuyến mại,\nthương nhân phải thông báo kết quả với cơ quan quản lý nhà nước về thương mại.\n2. Chính phủ quy định cụ thể việc đăng ký hoạt động khuyến mại và thông báo kết quả hoạt\nđộng khuyến mại của các thương nhân với cơ quan quản lý nhà nước về thương mại.\nMỤC 2. QUẢNG CÁO THƯƠNG MẠI\nĐiều 102. Quảng cáo thương mại Quảng cáo thương mại là hoạt động xúc tiến thương mại của thương nhân để giới thiệu với khách hàng về hoạt động kinh doanh hàng hoá, dịch vụ của mình.\nĐiều 103. Quyền quảng cáo thương mại 1. Thương nhân Việt Nam, Chi nhánh của thương nhân Việt Nam, Chi nhánh của thương nhân nước ngoài được phép hoạt động thương mại tại Việt Nam có quyền quảng cáo về hoạt động kinh doanh hàng hoá, dịch vụ của mình hoặc thuê thương nhân kinh doanh dịch vụ quảng cáo thực hiện việc quảng cáo thương mại cho mình.\n2. Văn phòng đại diện của thương nhân không được trực tiếp thực hiện hoạt động quảng cáo thương mại. Trong trường hợp được thương nhân ủy quyền, Văn phòng đại diện có quyền ký hợp đồng với thương nhân kinh doanh dịch vụ quảng cáo thương mại để\nthực hiện quảng cáo cho thương nhân mà mình đại diện.\n3. Thương nhân nước ngoài muốn quảng cáo thương mại về hoạt động kinh doanh hàng hoá, dịch vụ của mình tại Việt Nam phải thuê thương nhân kinh doanh dịch vụ quảng cáo thương mại Việt Nam thực hiện.\nĐiều 104. Kinh doanh dịch vụ quảng cáo thương mại Kinh doanh dịch vụ quảng cáo thương mại là hoạt động thương mại của thương nhân để thực hiện việc quảng cáo thương mại cho thương nhân khác.\nĐiều 105. Sản phẩm quảng cáo thương mại Sản phẩm quảng cáo thương mại gồm những thông tin bằng hình ảnh, hành động, âm thanh, tiếng nói, chữ viết, biểu tượng, màu sắc, ánh sáng chứa đựng nội dung quảng cáo thương mại.\nĐiều 106. Phương tiện quảng cáo thương mại 1. Phương tiện quảng cáo thương mại là công cụ được sử dụng để giới thiệu các sản phẩm quảng cáo thương mại.\n2. Phương tiện quảng cáo thương mại bao gồm:\na) Các phương tiện thông tin đại chúng;\nb) Các phương tiện truyền tin;\nc) Các loại xuất bản phẩm;\nd) Các loại bảng, biển, băng,\npa-nô, áp-phích, vật thể cố định, các phương tiện giao thông hoặc các vật thể\ndi động khác;\nđ) Các phương tiện quảng cáo thương mại khác.\nĐiều 107. Sử dụng phương tiện quảng cáo thương mại 1. Việc sử dụng phương tiện quảng cáo thương mại quy định tại Điều 106 của Luật này phải tuân thủ các quy định của cơ quan quản lý nhà nước có thẩm quyền.\n2. Việc sử dụng phương tiện quảng cáo thương mại phải bảo đảm các yêu cầu sau đây:\na) Tuân thủ các quy định của pháp luật về báo chí, xuất bản, thông tin, chương trình hoạt động văn hoá, thể thao,\nhội chợ, triển lãm;\nb) Tuân thủ quy định về địa điểm quảng cáo, không gây ảnh hưởng xấu đến cảnh quan, môi trường, trật tự an toàn giao thông, an toàn xã hội;\nc) Đúng mức độ, thời lượng, thời điểm quy định đối với từng loại phương tiện thông tin đại chúng.\nĐiều 108. Bảo hộ quyền sở hữu trí tuệ đối với sản phẩm quảng cáo thương mại Thương nhân có quyền đăng ký bảo hộ quyền sở hữu trí tuệ đối với sản phẩm quảng cáo thương mại theo quy định của pháp luật.\nĐiều 109. Các quảng cáo thương mại bị cấm 1. Quảng cáo làm tiết lộ bí mật nhà nước, phương hại đến độc lập, chủ quyền, an ninh quốc gia và trật tự, an toàn xã hội.\n2. Quảng cáo có sử dụng sản phẩm quảng cáo, phương tiện quảng cáo trái với truyền thống lịch sử, văn hoá, đạo đức,\nthuần phong mỹ tục Việt Nam và trái với quy định của pháp luật.\n3. Quảng cáo hàng hoá, dịch vụ mà\nNhà nước cấm kinh doanh, hạn chế kinh doanh hoặc cấm quảng cáo.\n4. Quảng cáo thuốc lá, rượu có độ cồn từ 30 độ trở lên và các sản phẩm, hàng hoá chưa được phép lưu thông, dịch vụ chưa được phép cung ứng trên thị trường Việt Nam tại thời điểm quảng cáo.\n5. Lợi dụng quảng cáo thương mại gây thiệt hại đến lợi ích của Nhà nước, tổ chức, cá nhân.\n6. Quảng cáo bằng việc sử dụng phương pháp so sánh trực tiếp hoạt động sản xuất, kinh doanh hàng hoá, dịch vụ của mình với hoạt động sản xuất, kinh doanh hàng hoá, dịch vụ cùng loại của thương nhân khác.\n7. Quảng cáo sai sự thật về một trong các nội dung số lượng, chất lượng, giá, công dụng, kiểu dáng, xuất xứ\nhàng hóa, chủng loại, bao bì, phương thức phục vụ, thời hạn bảo hành của hàng hoá, dịch vụ.\n8. Quảng cáo cho hoạt động kinh doanh của mình bằng cách sử dụng sản phẩm quảng cáo vi phạm quyền sở hữu trí tuệ;\nsử dụng hình ảnh của tổ chức, cá nhân khác để quảng cáo khi chưa được tổ chức,\ncá nhân đó đồng ý.\n9. Quảng cáo nhằm cạnh tranh không lành mạnh theo quy định của pháp luật.\nĐiều 110. Hợp đồng dịch vụ quảng cáo thương mại Hợp đồng dịch vụ quảng cáo thương mại phải được lập thành văn bản hoặc bằng hình thức khác có giá trị pháp lý\ntương đương.\nĐiều 111. Quyền của bên thuê quảng cáo thương mại Trừ trường hợp có thoả thuận khác, bên thuê quảng cáo thương mại có các quyền sau đây:\n1. Lựa chọn người phát hành quảng cáo thương mại, hình thức, nội dung, phương tiện, phạm vi và thời gian quảng cáo thương mại;\n2. Kiểm tra, giám sát việc thực hiện hợp đồng dịch vụ quảng cáo thương mại.\nĐiều 112. Nghĩa vụ của bên thuê quảng cáo thương mại Trừ trường hợp có thoả thuận khác, bên thuê quảng cáo thương mại có các nghĩa vụ sau đây:\n1. Cung cấp cho bên cung ứng dịch vụ quảng cáo thương mại thông tin trung thực, chính xác về hoạt động kinh doanh hàng hoá, dịch vụ thương mại và chịu trách nhiệm về các thông tin này;\n2. Trả thù lao dịch vụ quảng cáo thương mại và các chi phí hợp lý khác.\nĐiều 113. Quyền của bên cung ứng dịch vụ quảng cáo thương mại Trừ trường hợp có thoả thuận khác, bên cung ứng dịch vụ quảng cáo thương mại có các quyền sau đây:\n1. Yêu cầu bên thuê quảng cáo thương mại cung cấp thông tin quảng cáo trung thực, chính xác và theo đúng thoả\nthuận trong hợp đồng;\n2. Nhận thù lao dịch vụ quảng cáo thương mại và các chi phí hợp lý khác.\nĐiều 114. Nghĩa vụ của bên cung ứng dịch vụ quảng cáo thương mại Trừ trường hợp có thỏa thuận khác, bên cung ứng dịch vụ quảng cáo thương mại có các nghĩa vụ sau đây:\n1. Thực hiện sự lựa chọn của bên thuê quảng cáo về người phát hành quảng cáo thương mại, hình thức, nội dung,\nphương tiện, phạm vi và thời gian quảng cáo thương mại;\n2. Tổ chức quảng cáo trung thực,\nchính xác về hoạt động kinh doanh hàng hoá, dịch vụ thương mại theo thông tin mà bên thuê quảng cáo đã cung cấp;\n3. Thực hiện các nghĩa vụ khác đã\nthoả thuận trong hợp đồng dịch vụ quảng cáo thương mại.\nĐiều 115. Người phát hành quảng cáo thương mại Người phát hành quảng cáo thương mại là người trực tiếp phát hành sản phẩm quảng cáo thương mại.\nĐiều 116. Nghĩa vụ của người phát hành quảng cáo thương mại Người phát hành quảng cáo thương mại có các nghĩa vụ sau đây:\n1. Tuân thủ các quy định về sử dụng phương tiện quảng cáo thương mại quy định tại Điều 107 của Luật này;\n2. Thực hiện hợp đồng phát hành quảng cáo đã giao kết với bên thuê phát hành quảng cáo;\n3. Thực hiện các nghĩa vụ khác theo quy định của pháp luật.\nMỤC 3. TRƯNG BÀY, GIỚI THIỆU HÀNG HÓA, DỊCH VỤ\nĐiều 117. Trưng bày, giới thiệu hàng hoá, dịch vụ\nTrưng bày, giới thiệu hàng hoá, dịch vụ là hoạt động xúc tiến thương mại của thương nhân dùng hàng hoá, dịch vụ và\ntài liệu về hàng hoá, dịch vụ để giới thiệu với khách hàng về hàng hoá, dịch vụ\nđó.\nĐiều 118. Quyền trưng bày, giới thiệu hàng hoá, dịch vụ\n1. Thương nhân Việt Nam, Chi nhánh của thương nhân Việt Nam, Chi nhánh của thương nhân nước ngoài tại Việt Nam có quyền trưng bày, giới thiệu hàng hoá, dịch vụ; lựa chọn các hình thức trưng bày, giới thiệu phù hợp; tự mình tổ chức hoặc thuê thương nhân kinh doanh dịch vụ trưng bày, giới thiệu hàng hoá, dịch vụ để trưng bày, giới thiệu hàng hoá, dịch vụ của mình.\n2. Văn phòng đại diện của thương nhân không được trực tiếp trưng bày, giới thiệu hàng hoá, dịch vụ của thương nhân do mình đại diện, trừ việc trưng bày, giới thiệu tại trụ sở của Văn phòng đại diện đó. Trong trường hợp được thương nhân ủy quyền,\nVăn phòng đại diện có quyền ký hợp đồng với thương nhân kinh doanh dịch vụ\ntrưng bày, giới thiệu hàng hóa, dịch vụ để thực hiện trưng bày, giới thiệu hàng hóa, dịch vụ cho thương nhân mà mình đại diện.\n3. Thương nhân nước ngoài chưa được phép hoạt động thương mại tại Việt nam muốn trưng bày, giới thiệu hàng hoá, dịch vụ của mình tại Việt Nam phải thuê thương nhân kinh doanh dịch vụ trưng bày, giới thiệu hàng hoá, dịch vụ Việt Nam thực hiện.\nĐiều 119. Kinh doanh dịch vụ trưng bày, giới thiệu hàng hoá, dịch vụ\nKinh doanh dịch vụ trưng bày, giới thiệu hàng hoá, dịch vụ là hoạt động thương mại, theo đó một thương nhân thực hiện cung ứng dịch vụ trưng bày, giới thiệu hàng hoá, dịch vụ cho thương nhân khác.\nĐiều 120. Các hình thức trưng bày, giới thiệu hàng hoá, dịch vụ\n1. Mở phòng trưng bày, giới thiệu hàng hoá, dịch vụ.\n2. Trưng bày, giới thiệu hàng hoá, dịch vụ tại các trung tâm thương mại hoặc trong các hoạt động giải trí, thể\nthao, văn hoá, nghệ thuật.\n3. Tổ chức hội nghị, hội thảo có\ntrưng bày, giới thiệu hàng hoá, dịch vụ.\n4. Trưng bày, giới thiệu hàng hóa, dịch vụ trên Internet và các hình thức khác theo quy định của pháp luật.\nĐiều 121. Điều kiện đối với hàng hoá, dịch vụ trưng bày, giới thiệu 1. Hàng hoá, dịch vụ trưng bày,\ngiới thiệu phải là những hàng hoá, dịch vụ kinh doanh hợp pháp trên thị trường.\n2. Hàng hoá, dịch vụ trưng bày,\ngiới thiệu phải tuân thủ các quy định của pháp luật về chất lượng hàng hóa và\nghi nhãn hàng hoá.\nĐiều 122. Điều kiện đối với hàng hoá nhập khẩu vào Việt Nam để trưng bày, giới thiệu Hàng hoá nhập khẩu vào Việt Nam để\ntrưng bày, giới thiệu tại Việt Nam, ngoài việc đáp ứng các điều kiện quy định tại\nĐiều 121 của Luật này còn phải đáp ứng các điều kiện sau\nđây:\n1. Là hàng hoá được phép nhập khẩu vào Việt Nam;\n2. Hàng hoá tạm nhập khẩu để\ntrưng bày, giới thiệu phải tái xuất khẩu sau khi kết thúc việc trưng bày, giới thiệu nhưng không quá sáu tháng, kể từ ngày tạm nhập khẩu; nếu quá thời hạn trên thì phải làm thủ tục gia hạn tại hải quan nơi tạm nhập khẩu;\n3. Hàng hóa tạm nhập khẩu để\ntrưng bày, giới thiệu nếu tiêu thụ tại Việt Nam thì phải tuân thủ các quy định của pháp luật Việt Nam đối với hàng hóa nhập khẩu.\nĐiều 123. Các trường hợp cấm trưng bày, giới thiệu hàng hoá, dịch vụ\n1. Tổ chức trưng bày, giới thiệu hàng hoá, dịch vụ hoặc sử dụng hình thức, phương tiện trưng bày, giới thiệu hàng hoá, dịch vụ làm phương hại đến an ninh quốc gia, trật tự, an toàn xã hội,\ncảnh quan, môi trường, sức khoẻ con người.\n2. Trưng bày, giới thiệu hàng hoá, dịch vụ hoặc sử dụng hình thức, phương tiện trưng bày, giới thiệu trái với truyền thống lịch sử, văn hoá, đạo đức, thuần phong mỹ tục Việt Nam.\n3. Trưng bày, giới thiệu hàng hoá, dịch vụ làm lộ bí mật nhà nước.\n4. Trưng bày, giới thiệu hàng hoá\ncủa thương nhân khác để so sánh với hàng hoá của mình, trừ trường hợp hàng hoá\nđem so sánh là hàng giả, hàng vi phạm quyền sở hữu trí tuệ theo quy định của pháp luật.\n5. Trưng bày, giới thiệu mẫu hàng hoá không đúng với hàng hoá đang kinh doanh về chất lượng, giá, công dụng, kiểu dáng, chủng loại, bao bì, thời hạn bảo hành và các chỉ tiêu chất lượng khác nhằm lừa dối khách hàng.\nĐiều 124. Hợp đồng dịch vụ trưng bày, giới thiệu hàng hoá, dịch vụ\nHợp đồng dịch vụ trưng bày, giới thiệu hàng hoá, dịch vụ phải được lập thành văn bản hoặc bằng hình thức khác có\ngiá trị pháp lý tương đương.\nĐiều 125. Quyền của bên thuê dịch vụ trưng bày, giới thiệu hàng hoá,\ndịch vụ\nTrừ trường hợp có thỏa thuận khác, bên thuê dịch vụ trưng bày, giới thiệu hàng hoá, dịch vụ có các quyền sau\nđây:\n1. Yêu cầu bên cung ứng dịch vụ\ntrưng bày, giới thiệu hàng hoá, dịch vụ thực hiện thoả thuận trong hợp đồng;\n2. Kiểm tra, giám sát việc thực hiện hợp đồng trưng bày, giới thiệu hàng hoá, dịch vụ.\nĐiều 126. Nghĩa vụ của bên thuê dịch vụ trưng bày, giới thiệu hàng hoá, dịch vụ\nTrừ trường hợp có thỏa thuận khác,\nbên thuê dịch vụ trưng bày, giới thiệu hàng hoá, dịch vụ có các nghĩa vụ sau\nđây:\n1. Cung cấp đầy đủ hàng hoá, dịch vụ trưng bày, giới thiệu hoặc phương tiện cho bên cung ứng dịch vụ theo thoả\nthuận trong hợp đồng;\n2. Cung cấp thông tin về hàng hoá, dịch vụ trưng bày, giới thiệu và chịu trách nhiệm về các thông tin này;\n3. Trả thù lao dịch vụ và các chi phí hợp lý khác.\nĐiều 127. Quyền của bên cung ứng dịch vụ trưng bày, giới thiệu hàng hoá, dịch vụ\nTrừ trường hợp có thỏa thuận khác,\nbên cung ứng dịch vụ trưng bày, giới thiệu hàng hoá, dịch vụ có các quyền sau\nđây:\n1. Yêu cầu bên thuê dịch vụ cung cấp hàng hoá, dịch vụ trưng bày, giới thiệu theo thời hạn đã thoả thuận trong hợp\nđồng;\n2. Yêu cầu bên thuê dịch vụ cung cấp thông tin về hàng hoá, dịch vụ trưng bày, giới thiệu và các phương tiện cần thiết khác theo thoả thuận trong hợp đồng;\n3. Nhận thù lao dịch vụ và các chi phí hợp lý khác.\nĐiều 128. Nghĩa vụ của bên cung ứng dịch vụ trưng bày, giới thiệu hàng hoá, dịch vụ\nTrừ trường hợp có thỏa thuận khác, bên cung ứng dịch vụ trưng bày, giới thiệu hàng hoá, dịch vụ có các nghĩa vụ sau đây:\n1. Thực hiện việc trưng bày, giới thiệu hàng hoá, dịch vụ theo thoả thuận trong hợp đồng;\n2. Bảo quản hàng hoá trưng bày,\ngiới thiệu, tài liệu, phương tiện được giao trong thời gian thực hiện hợp đồng;\nkhi kết thúc việc trưng bày, giới thiệu hàng hoá, dịch vụ, phải giao lại đầy đủ\nhàng hoá, tài liệu, phương tiện trưng bày, giới thiệu cho bên thuê dịch vụ;\n3. Thực hiện việc trưng bày, giới thiệu hàng hoá, dịch vụ theo những nội dung đã được thoả thuận với bên thuê dịch vụ trưng bày, giới thiệu hàng hoá, dịch vụ.\nMỤC 4. HỘI CHỢ, TRIỂN LÃM THƯƠNG MẠI\nĐiều 129. Hội chợ, triển lãm thương mại Hội chợ, triển lãm thương mại là\nhoạt động xúc tiến thương mại được thực hiện tập trung trong một thời gian và tại một địa điểm nhất định để thương nhân trưng bày, giới thiệu hàng hoá, dịch vụ\nnhằm mục đích thúc đẩy, tìm kiếm cơ hội giao kết hợp đồng mua bán hàng hoá, hợp\nđồng dịch vụ.\nĐiều 130. Kinh doanh dịch vụ hội chợ, triển lãm thương mại 1. Kinh doanh dịch vụ hội chợ,\ntriển lãm thương mại là hoạt động thương mại, theo đó thương nhân kinh doanh dịch vụ này cung ứng dịch vụ tổ chức hoặc tham gia hội chợ, triển lãm thương mại cho thương nhân khác để nhận thù lao dịch vụ tổ chức hội chợ, triển lãm thương mại.\n2. Hợp đồng dịch vụ tổ chức, tham gia hội chợ, triển lãm thương mại phải được lập thành văn bản hoặc bằng hình thức khác có giá trị pháp lý tương đương.\nĐiều 131. Quyền tổ chức, tham gia hội chợ, triển lãm thương mại 1. Thương nhân Việt Nam, Chi nhánh của thương nhân Việt Nam, Chi nhánh của thương nhân nước ngoài tại Việt Nam có quyền trực tiếp tổ chức, tham gia hội chợ, triển lãm thương mại về hàng hóa, dịch vụ mà mình kinh doanh hoặc thuê thương nhân kinh doanh dịch vụ hội chợ,\ntriển lãm thương mại thực hiện.\n2. Văn phòng đại diện của thương nhân không được trực tiếp tổ chức, tham gia hội chợ, triển lãm thương mại.\nTrong trường hợp được thương nhân ủy quyền, Văn phòng đại diện có quyền ký hợp\nđồng với thương nhân kinh doanh dịch vụ hội chợ, triển lãm thương mại để tổ chức,\ntham gia hội chợ, triển lãm thương mại cho thương nhân mà mình đại diện.\n3. Thương nhân nước ngoài có quyền trực tiếp tham gia hoặc thuê thương nhân kinh doanh dịch vụ hội chợ, triển lãm thương mại Việt Nam thay mặt mình tham gia hội chợ, triển lãm thương mại tại Việt Nam. Trong trường hợp muốn tổ chức hội chợ, triển lãm thương mại tại Việt Nam thì thương nhân nước ngoài phải thuê thương nhân kinh doanh dịch vụ hội chợ,\ntriển lãm thương mại Việt Nam thực hiện.\nĐiều 132. Tổ chức hội chợ, triển lãm thương mại tại Việt Nam 1. Hội chợ, triển lãm thương mại tổ chức tại Việt Nam phải được đăng ký và phải được xác nhận bằng văn bản của cơ quan quản lý nhà nước về thương mại tỉnh, thành phố trực thuộc trung ương nơi tổ chức hội chợ, triển lãm thương mại.\n2. Chính phủ quy định cụ thể trình tự, thủ tục, nội dung đăng ký và xác nhận việc tổ chức hội chợ, triển lãm thương mại tại Việt Nam quy định tại khoản 1 Điều này.\nĐiều 133. Tổ chức, tham gia hội chợ, triển lãm thương mại ở nước ngoài 1. Thương nhân không kinh doanh dịch vụ hội chợ, triển lãm thương mại khi trực tiếp tổ chức hoặc tham gia hội chợ,\ntriển lãm thương mại ở nước ngoài về hàng hoá, dịch vụ mà mình kinh doanh phải tuân theo các quy định về xuất khẩu hàng hoá.\n2. Thương nhân kinh doanh dịch vụ\nhội chợ, triển lãm thương mại khi tổ chức cho thương nhân khác tham gia hội chợ,\ntriển lãm thương mại phải đăng ký với Bộ Thương mại.\n3. Thương nhân không đăng ký kinh doanh dịch vụ hội chợ, triển lãm thương mại không được tổ chức cho thương nhân khác tham gia hội chợ, triển lãm thương mại ở nước ngoài.\n4. Chính phủ quy định cụ thể trình tự, thủ tục, nội dung đăng ký tổ chức, tham gia hội chợ, triển lãm thương mại ở nước ngoài quy định tại khoản 1 và khoản 2 Điều này.\nĐiều 134. Hàng hoá, dịch vụ trưng bày, giới thiệu tại hội chợ, triển lãm thương mại tại Việt Nam 1. Hàng hoá, dịch vụ không được phép tham gia hội chợ, triển lãm thương mại bao gồm:\na) Hàng hóa, dịch vụ thuộc diện cấm kinh doanh, hạn chế kinh doanh, chưa được phép lưu thông theo quy định của pháp luật;\nb) Hàng hóa, dịch vụ do thương nhân ở nước ngoài cung ứng thuộc diện cấm nhập khẩu theo quy định của pháp luật;\nc) Hàng giả, hàng vi phạm quyền sở hữu trí tuệ, trừ trường hợp trưng bày, giới thiệu để\nso sánh với hàng thật.\n2. Ngoài việc tuân thủ các quy định về hội chợ, triển lãm thương mại của Luật này, hàng hóa, dịch vụ thuộc diện quản lý chuyên ngành phải tuân thủ các quy định về quản lý chuyên ngành đối với hàng hoá, dịch vụ đó.\n3. Hàng hóa tạm nhập khẩu để tham gia hội chợ, triển lãm thương mại tại Việt Nam phải\nđược tái xuất khẩu trong thời hạn ba mươi ngày, kể từ ngày kết thúc hội chợ,\ntriển lãm thương mại.\n4. Việc tạm nhập, tái xuất hàng hóa tham gia hội chợ, triển lãm thương mại tại Việt Nam phải tuân theo các quy định của pháp luật về hải quan và các quy định khác của pháp luật có liên quan.\nĐiều 135. Hàng hóa, dịch vụ tham gia hội chợ, triển lãm thương mại ở\nnước ngoài 1. Tất cả các loại hàng hóa, dịch vụ đều được tham gia hội chợ, triển lãm thương mại ở nước ngoài, trừ hàng hóa,\ndịch vụ thuộc diện cấm xuất khẩu theo quy định của pháp luật.\n2. Hàng hóa, dịch vụ thuộc diện cấm xuất khẩu chỉ được tham gia hội chợ, triển lãm thương mại ở nước ngoài khi được sự chấp thuận của Thủ tướng Chính phủ.\n3. Thời hạn tạm xuất khẩu hàng hóa để tham gia hội chợ, triển lãm thương mại ở nước ngoài là một năm kể từ\nngày hàng hóa được tạm xuất khẩu; nếu quá thời hạn nói trên mà chưa được tái nhập khẩu thì hàng hóa đó phải chịu thuế và các nghĩa vụ tài chính khác theo quy định của pháp luật Việt Nam.\n4. Việc tạm xuất, tái nhập hàng hóa tham gia hội chợ, triển lãm thương mại ở nước ngoài phải tuân thủ các quy định của pháp luật về hải quan và các quy định khác của pháp luật có liên quan.\nĐiều 136. Bán, tặng hàng hoá, cung ứng dịch vụ tại hội chợ, triển lãm thương mại tại Việt Nam 1. Hàng hoá, dịch vụ trưng bày,\ngiới thiệu tại hội chợ, triển lãm thương mại tại Việt Nam được phép bán, tặng,\ncung ứng tại hội chợ, triển lãm thương mại; đối với hàng hóa nhập khẩu phải\nđăng ký với hải quan, trừ trường hợp quy định tại khoản 2 Điều này.\n2. Hàng hóa thuộc diện nhập khẩu phải có giấy phép của cơ quan nhà nước có thẩm quyền chỉ được bán, tặng sau khi\nđược cơ quan nhà nước có thẩm quyền chấp thuận bằng văn bản.\n3. Việc bán, tặng hàng hoá tại hội chợ, triển lãm thương mại quy định tại khoản 2 Điều 134 của Luật này phải tuân thủ các quy định về quản lý chuyên ngành nhập khẩu đối với hàng hóa đó.\n4. Hàng hóa được bán, tặng, dịch vụ được cung ứng tại hội chợ, triển lãm thương mại tại Việt Nam phải chịu thuế\nvà các nghĩa vụ tài chính khác theo quy định của pháp luật.\nĐiều 137. Bán, tặng hàng hóa, cung ứng dịch vụ của Việt Nam tham gia hội chợ, triển lãm thương mại ở nước ngoài 1. Hàng hóa, dịch vụ của Việt Nam tham gia hội chợ, triển lãm thương mại ở nước ngoài được phép bán, tặng, cung ứng tại hội chợ, triển lãm, trừ trường hợp quy định tại khoản 2 và khoản 3 Điều này.\n2. Việc bán, tặng hàng hóa thuộc diện cấm xuất khẩu nhưng đã được tạm xuất khẩu để tham gia hội chợ, triển lãm thương mại ở nước ngoài chỉ được thực hiện sau khi có sự chấp thuận của Thủ tướng Chính phủ.\n3. Hàng hóa thuộc diện xuất khẩu phải có giấy phép của cơ quan nhà nước có thẩm quyền chỉ được bán, tặng sau khi\nđược cơ quan nhà nước có thẩm quyền chấp thuận bằng văn bản.\n4. Hàng hóa, dịch vụ của Việt Nam tham gia hội chợ, triển lãm thương mại ở nước ngoài được bán, tặng, cung ứng ở\nnước ngoài phải chịu thuế và các nghĩa vụ tài chính khác theo quy định của pháp luật.\nĐiều 138. Quyền và nghĩa vụ của tổ chức, cá nhân tham gia hội chợ,\ntriển lãm thương mại tại Việt Nam 1. Thực hiện các quyền và nghĩa vụ\ntheo thỏa thuận với thương nhân tổ chức hội chợ, triển lãm thương mại.\n2. Bán, tặng hàng hoá, cung ứng dịch vụ được trưng bày, giới thiệu tại hội chợ, triển lãm thương mại theo quy định của pháp luật.\n3. Được tạm nhập, tái xuất hàng hoá, tài liệu về hàng hoá, dịch vụ để trưng bày tại hội chợ, triển lãm thương mại.\n4. Tuân thủ các quy định về tổ chức hội chợ, triển lãm thương mại tại Việt Nam.\nĐiều 139. Quyền và nghĩa vụ của thương nhân tổ chức, tham gia hội chợ,\ntriển lãm thương mại ở nước ngoài 1. Được tạm xuất, tái nhập hàng hoá và tài liệu về hàng hoá, dịch vụ để trưng bày, giới thiệu tại hội chợ, triển lãm thương mại.\n2. Phải tuân thủ các quy định về\nviệc tổ chức, tham gia hội chợ, triển lãm thương mại ở nước ngoài.\n3. Được bán, tặng hàng hoá trưng bày, giới thiệu tại hội chợ, triển lãm thương mại ở nước ngoài; phải nộp thuế\nvà thực hiện các nghĩa vụ tài chính khác theo quy định của pháp luật Việt Nam.\nĐiều 140. Quyền và nghĩa vụ của thương nhân kinh doanh dịch vụ hội chợ, triển lãm thương mại 1. Niêm yết chủ đề, thời gian tiến hành hội chợ, triển lãm thương mại tại nơi tổ chức hội chợ, triển lãm thương mại đó trước ngày khai mạc hội chợ, triển lãm thương mại.\n2. Yêu cầu bên thuê dịch vụ cung cấp hàng hoá để tham gia hội chợ, triển lãm thương mại theo thời hạn đã thoả\nthuận trong hợp đồng.\n3. Yêu cầu bên thuê dịch vụ cung cấp thông tin về hàng hoá, dịch vụ để tham gia hội chợ, triển lãm thương mại và\ncác phương tiện cần thiết khác theo thoả thuận trong hợp đồng.\n4. Nhận thù lao dịch vụ và các chi phí hợp lý khác.\n5. Thực hiện việc tổ chức hội chợ,\ntriển lãm thương mại theo thoả thuận trong hợp đồng.\nChương V CÁC HOẠT ĐỘNG TRUNG GIAN THƯƠNG MẠI MỤC 1. ĐẠI DIỆN CHO THƯƠNG NHÂN\nĐiều 141. Đại diện cho thương nhân 1. Đại diện cho thương nhân là việc một thương nhân nhận uỷ nhiệm (gọi là bên đại diện) của thương nhân khác (gọi là bên giao đại diện) để thực hiện các hoạt động thương mại với danh nghĩa,\ntheo sự chỉ dẫn của thương nhân đó và được hưởng thù lao về việc đại diện.\n2. Trong trường hợp thương nhân cử\nngười của mình để làm đại diện cho mình thì áp dụng quy định của Bộ luật dân sự.\nĐiều 142. Hợp đồng đại diện cho thương nhân Hợp đồng đại diện cho thương nhân phải được lập thành văn bản hoặc bằng hình thức khác có giá trị pháp lý tương\nđương.\nĐiều 143. Phạm vi đại diện Các bên có thể thoả thuận về việc bên đại diện được thực hiện một phần hoặc toàn bộ hoạt động thương mại thuộc phạm vi hoạt động của bên giao đại diện.\nĐiều 144. Thời hạn đại diện cho thương nhân 1. Thời hạn đại diện do các bên thoả thuận.\n2. Trường hợp không có thoả thuận,\nthời hạn đại diện chấm dứt khi bên giao đại diện thông báo cho bên đại diện về\nviệc chấm dứt hợp đồng đại diện hoặc bên đại diện thông báo cho bên giao đại diện về việc chấm dứt hợp đồng.\n3. Trừ trường hợp có thoả thuận khác, nếu bên giao đại diện đơn phương thông báo chấm dứt hợp đồng đại diện theo quy định tại khoản 2 Điều này thì bên đại diện có quyền yêu cầu bên giao đại diện trả một khoản thù lao do việc bên giao đại diện giao kết các hợp đồng với khách hàng mà bên đại diện đã giao dịch và những khoản thù lao khác mà đáng lẽ\nmình được hưởng.\n4. Trường hợp thời hạn đại diện chấm dứt theo quy định tại khoản 2 Điều này theo yêu cầu của bên đại diện thì\nbên đại diện bị mất quyền hưởng thù lao đối với các giao dịch mà đáng lẽ mình\nđược hưởng nếu các bên không có thoả thuận khác.\nĐiều 145. Nghĩa vụ của bên đại diện Trừ trường hợp có thỏa thuận khác, bên đại diện có các nghĩa vụ sau đây:\n1. Thực hiện các hoạt động thương mại với danh nghĩa và vì lợi ích của bên giao đại diện;\n2. Thông báo cho bên giao đại diện về cơ hội và kết quả thực hiện các hoạt động thương mại đã được uỷ quyền;\n3. Tuân thủ chỉ dẫn của bên giao\nđại diện nếu chỉ dẫn đó không vi phạm quy định của pháp luật;\n4. Không được thực hiện các hoạt\nđộng thương mại với danh nghĩa của mình hoặc của người thứ ba trong phạm vi đại diện;\n5. Không được tiết lộ hoặc cung cấp cho người khác các bí mật liên quan đến hoạt động thương mại của bên giao đại diện trong thời gian làm đại diện và trong thời hạn hai năm, kể từ khi chấm dứt hợp đồng đại diện;\n6. Bảo quản tài sản, tài liệu được giao để thực hiện hoạt động đại diện.\nĐiều 146. Nghĩa vụ của bên giao đại diện Trừ trường hợp có thỏa thuận khác, bên giao đại diện có các nghĩa vụ sau đây:\n1. Thông báo ngay cho bên đại diện về việc giao kết hợp đồng mà bên đại diện đã giao dịch, việc thực hiện hợp đồng mà bên đại diện đã giao kết, việc chấp nhận hay không chấp nhận các hoạt động ngoài phạm vi đại diện mà bên đại diện thực hiện;\n2. Cung cấp tài sản, tài liệu,\nthông tin cần thiết để bên đại diện thực hiện hoạt động đại diện;\n3. Trả thù lao và các chi phí hợp lý khác cho bên đại diện;\n4. Thông báo kịp thời cho bên đại diện về khả năng không giao kết được, không thực hiện được hợp đồng trong phạm vi đại diện.\nĐiều 147. Quyền hưởng thù lao đại diện 1. Bên đại diện được hưởng thù\nlao đối với hợp đồng được giao kết trong phạm vi đại diện. Quyền được hưởng thù\nlao phát sinh từ thời điểm do các bên thoả thuận trong hợp đồng đại diện.\n2. Trường hợp không có thỏa thuận,\nmức thù lao cho bên đại diện được xác định theo quy định tại Điều 86 của Luật này.\nĐiều 148. Thanh toán chi phí phát sinh Trừ trường hợp có thoả thuận khác, bên đại diện có quyền yêu cầu được thanh toán các khoản chi phí phát sinh hợp lý để thực hiện hoạt động đại diện.\nĐiều 149. Quyền cầm giữ\nTrừ trường hợp có thỏa thuận khác, bên đại diện có quyền cầm giữ tài sản, tài liệu được giao để bảo đảm việc thanh toán các khoản thù lao và chi phí đã đến hạn.\nMỤC 2. MÔI GIỚI THƯƠNG MẠI\nĐiều 150. Môi giới thương mại Môi giới thương mại là hoạt động thương mại, theo đó một thương nhân làm trung gian (gọi là bên môi giới) cho các bên mua bán hàng hoá, cung ứng dịch vụ (gọi là bên được môi giới) trong việc\nđàm phán, giao kết hợp đồng mua bán hàng hoá, dịch vụ và được hưởng thù lao theo hợp đồng môi giới.\nĐiều 151. Nghĩa vụ của bên môi giới thương mại Trừ trường hợp có thỏa thuận khác, bên môi giới thương mại có các nghĩa vụ sau đây:\n1. Bảo quản các mẫu hàng hoá, tài liệu được giao để thực hiện việc môi giới và phải hoàn trả cho bên được môi giới sau khi hoàn thành việc môi giới;\n2. Không được tiết lộ, cung cấp thông tin làm phương hại đến lợi ích của bên được môi giới;\n3. Chịu trách nhiệm về tư cách pháp lý của các bên được môi giới, nhưng không chịu trách nhiệm về khả năng thanh toán của họ;\n4. Không được tham gia thực hiện hợp đồng giữa các bên được môi giới, trừ trường hợp có uỷ quyền của bên được môi giới.\nĐiều 152. Nghĩa vụ của bên được môi giới Trừ trường hợp có thỏa thuận khác, bên được môi giới có các nghĩa vụ sau đây:\n1. Cung cấp các thông tin, tài liệu,\nphương tiện cần thiết liên quan đến hàng hoá, dịch vụ;\n2. Trả thù lao môi giới và các chi phí hợp lý khác cho bên môi giới.\nĐiều 153. Quyền hưởng thù lao môi giới 1. Trừ trường hợp có thỏa thuận khác,\nquyền hưởng thù lao môi giới phát sinh từ thời điểm các bên được môi giới đã ký\nhợp đồng với nhau.\n2. Trường hợp không có thỏa thuận,\nmức thù lao môi giới được xác định theo quy định tại Điều 86 của Luật này.\nĐiều 154. Thanh toán chi phí phát sinh liên quan đến việc môi giới Trừ trường hợp có thỏa thuận khác, bên được môi giới phải thanh toán các chi phí phát sinh hợp lý liên quan\nđến việc môi giới, kể cả khi việc môi giới không mang lại kết quả cho bên được môi giới.\nMỤC 3. ỦY THÁC MUA BÁN HÀNG HÓA\nĐiều 155. Uỷ thác mua bán hàng hóa Uỷ thác mua bán hàng hoá là hoạt\nđộng thương mại, theo đó bên nhận uỷ thác thực hiện việc mua bán hàng hoá với danh nghĩa của mình theo những điều kiện đã thoả thuận với bên uỷ thác và được nhận thù lao uỷ thác.\nĐiều 156. Bên nhận uỷ thác Bên nhận uỷ thác mua bán hàng hoá\nlà thương nhân kinh doanh mặt hàng phù hợp với hàng hoá được uỷ thác và thực hiện mua bán hàng hoá theo những điều kiện đã thoả thuận với bên uỷ thác.\nĐiều 157. Bên uỷ thác Bên uỷ thác mua bán hàng hoá là thương nhân hoặc không phải là thương nhân giao cho bên nhận uỷ thác thực hiện mua bán hàng hoá theo yêu cầu của mình và phải trả thù lao uỷ thác.\nĐiều 158. Hàng hoá uỷ thác Tất cả hàng hoá lưu thông hợp pháp đều có thể được uỷ thác mua bán.\nĐiều 159. Hợp đồng uỷ thác Hợp đồng uỷ thác mua bán hàng hoá\nphải được lập thành văn bản hoặc bằng hình thức khác có giá trị pháp lý tương\nđương.\nĐiều 160. Uỷ thác lại cho bên thứ ba Bên nhận uỷ thác không được uỷ\nthác lại cho bên thứ ba thực hiện hợp đồng uỷ thác mua bán hàng hoá đã ký, trừ\ntrường hợp có sự chấp thuận bằng văn bản của bên uỷ thác.\nĐiều 161. Nhận uỷ thác của nhiều bên Bên nhận uỷ thác có thể nhận uỷ\nthác mua bán hàng hoá của nhiều bên uỷ thác khác nhau.\nĐiều 162. Quyền của bên uỷ thác Trừ trường hợp có thoả thuận khác, bên uỷ thác có các quyền sau đây:\n1. Yêu cầu bên nhận uỷ thác thông báo đầy đủ về tình hình thực hiện hợp đồng uỷ thác;\n2. Không chịu trách nhiệm trong trường hợp bên nhận uỷ thác vi phạm pháp luật, trừ trường hợp quy định tại khoản 4 Điều 163 của Luật này.\nĐiều 163. Nghĩa vụ của bên uỷ thác Trừ trường hợp có thoả thuận khác, bên uỷ thác có các nghĩa vụ sau đây:\n1. Cung cấp thông tin, tài liệu và phương tiện cần thiết cho việc thực hiện hợp đồng uỷ thác;\n2. Trả thù lao uỷ thác và các chi phí hợp lý khác cho bên nhận ủy thác;\n3. Giao tiền, giao hàng theo đúng thoả thuận;\n4. Liên đới chịu trách nhiệm trong trường hợp bên nhận uỷ thác vi phạm pháp luật mà nguyên nhân do bên uỷ\nthác gây ra hoặc do các bên cố ý làm trái pháp luật.\nĐiều 164. Quyền của bên nhận uỷ thác Trừ trường hợp có thoả thuận khác, bên nhận uỷ thác có các quyền sau đây:\n1. Yêu cầu bên uỷ thác cung cấp thông tin, tài liệu cần thiết cho việc thực hiện hợp đồng uỷ thác;\n2. Nhận thù lao uỷ thác và các chi phí hợp lý khác;\n3. Không chịu trách nhiệm về hàng hoá đã bàn giao đúng thoả thuận cho bên uỷ thác.\nĐiều 165. Nghĩa vụ của bên nhận uỷ thác Trừ trường hợp có thoả thuận khác, bên nhận uỷ thác có các nghĩa vụ sau đây:\n1. Thực hiện mua bán hàng hoá\ntheo thỏa thuận;\n2. Thông báo cho bên uỷ thác về\ncác vấn đề có liên quan đến việc thực hiện hợp đồng uỷ thác;\n3. Thực hiện các chỉ dẫn của bên uỷ thác phù hợp với thoả thuận;\n4. Bảo quản tài sản, tài liệu được giao để thực hiện hợp đồng uỷ thác;\n5. Giữ bí mật về những thông tin có liên quan đến việc thực hiện hợp đồng uỷ thác;\n6. Giao tiền, giao hàng theo đúng thoả thuận;\n7. Liên đới chịu trách nhiệm về\nhành vi vi phạm pháp luật của bên ủy thác, nếu nguyên nhân của hành vi vi phạm pháp luật đó có một phần do lỗi của mình gây ra.\nMỤC 4. ĐẠI LÝ THƯƠNG MẠI\nĐiều 166. Đại lý thương mại\nĐại lý thương mại là hoạt động thương mại, theo đó bên giao đại lý và bên đại lý thoả thuận việc bên đại lý\nnhân danh chính mình mua, bán hàng hoá cho bên giao đại lý hoặc cung ứng dịch vụ\ncủa bên giao đại lý cho khách hàng để hưởng thù lao.\nĐiều 167. Bên giao đại lý, bên đại lý\n1. Bên giao đại lý là thương nhân giao hàng hoá cho đại lý bán hoặc giao tiền mua hàng cho đại lý mua hoặc là\nthương nhân uỷ quyền thực hiện dịch vụ cho đại lý cung ứng dịch vụ.\n2. Bên đại lý là thương nhân nhận hàng hoá để làm đại lý bán, nhận tiền mua hàng để làm đại lý mua hoặc là bên nhận uỷ quyền cung ứng dịch vụ.\nĐiều 168. Hợp đồng đại lý\nHợp đồng đại lý phải được lập thành văn bản hoặc bằng hình thức khác có giá trị pháp lý tương đương.\nĐiều 169. Các hình thức đại lý\n1. Đại lý bao tiêu là hình thức đại lý mà bên đại lý thực hiện việc mua, bán trọn vẹn một khối lượng hàng hoá hoặc cung ứng đầy đủ một dịch vụ cho bên giao đại lý.\n2. Đại lý độc quyền là hình thức đại lý mà tại một khu vực địa lý nhất định bên giao đại lý chỉ giao cho một đại lý\nmua, bán một hoặc một số mặt hàng hoặc cung ứng một hoặc một số loại dịch vụ nhất\nđịnh.\n3. Tổng đại lý mua bán hàng hoá,\ncung ứng dịch vụ là hình thức đại lý mà bên đại lý tổ chức một hệ thống đại lý\ntrực thuộc để thực hiện việc mua bán hàng hoá, cung ứng dịch vụ cho bên giao đại lý.\nTổng đại lý đại diện cho hệ thống\nđại lý trực thuộc. Các đại lý trực thuộc hoạt động dưới sự quản lý của tổng đại lý và với danh nghĩa của tổng đại lý.\n4. Các hình thức đại lý khác mà\ncác bên thỏa thuận.\nĐiều 170. Quyền sở hữu trong đại lý thương mại Bên giao đại lý là chủ sở hữu đối với hàng hoá hoặc tiền giao cho bên đại lý.\nĐiều 171. Thù lao đại lý\n1. Trừ trường hợp có thoả thuận khác, thù lao đại lý được trả cho bên đại lý dưới hình thức hoa hồng hoặc chênh lệch giá.\n2. Trường hợp bên giao đại lý ấn định giá mua, giá bán hàng hóa hoặc giá cung ứng dịch vụ\ncho khách hàng thì bên đại lý được hưởng hoa hồng tính theo tỷ lệ phần trăm trên giá mua, giá bán hàng hóa hoặc giá cung ứng dịch vụ.\n3. Trường hợp bên giao đại lý\nkhông ấn định giá mua, giá bán hàng hoá hoặc giá cung ứng dịch vụ cho khách hàng mà chỉ ấn định giá giao đại lý cho bên đại lý thì bên đại lý được hưởng chênh lệch giá. Mức chênh lệch giá được xác định là mức chênh lệch giữa giá\nmua, giá bán, giá cung ứng dịch vụ cho khách hàng so với giá do bên giao đại lý\nấn định cho bên đại lý.\n4. Trường hợp các bên không có\nthoả thuận về mức thù lao đại lý thì mức thù lao được tính như sau:\na) Mức thù lao thực tế mà các bên\nđã được trả trước đó;\nb) Trường hợp không áp dụng được\nđiểm a khoản này thì mức thù lao đại lý là mức thù lao trung bình được áp dụng cho cùng loại hàng hoá, dịch vụ mà bên giao đại lý đã trả cho các đại lý khác;\nc) Trường hợp không áp dụng được\nđiểm a và điểm b khoản này thì mức thù lao đại lý là mức thù lao thông thường\nđược áp dụng cho cùng loại hàng hoá, dịch vụ trên thị trường.\nĐiều 172. Quyền của bên giao đại lý\nTrừ trường hợp có thỏa thuận khác, bên giao đại lý có các quyền sau đây:\n1. ấn định giá mua, giá bán hàng hoá, giá cung ứng dịch vụ đại lý cho khách hàng;\n2. Ấn định giá giao đại lý;\n3. Yêu cầu bên đại lý thực hiện biện pháp bảo đảm theo quy định của pháp luật;\n4. Yêu cầu bên đại lý thanh toán tiền hoặc giao hàng theo hợp đồng đại lý;\n5. Kiểm tra, giám sát việc thực hiện hợp đồng của bên đại lý.\nĐiều 173. Nghĩa vụ của bên giao đại lý\nTrừ trường hợp có thỏa thuận khác, bên giao đại lý có các nghĩa vụ sau đây:\n1. Hướng dẫn, cung cấp thông tin,\ntạo điều kiện cho bên đại lý thực hiện hợp đồng đại lý;\n2. Chịu trách nhiệm về chất lượng hàng hóa của đại lý mua bán hàng hóa, chất lượng dịch vụ của đại lý cung ứng dịch vụ;\n3. Trả thù lao và các chi phí hợp lý khác cho bên đại lý;\n4. Hoàn trả cho bên đại lý tài sản của bên đại lý dùng để bảo đảm (nếu có) khi kết thúc hợp đồng đại lý;\n5. Liên đới chịu trách nhiệm về\nhành vi vi phạm pháp luật của bên đại lý, nếu nguyên nhân của hành vi vi phạm pháp luật đó có một phần do lỗi của mình gây ra.\nĐiều 174. Quyền của bên đại lý\nTrừ trường hợp các bên có thỏa thuận khác, bên đại lý có các quyền sau đây:\n1. Giao kết hợp đồng đại lý với một hoặc nhiều bên giao đại lý, trừ trường hợp quy định tại khoản 7\nĐiều 175 của Luật này;\n2. Yêu cầu bên giao đại lý giao hàng hoặc tiền theo hợp đồng đại lý; nhận lại tài sản dùng để bảo đảm (nếu có) khi kết thúc hợp đồng đại lý;\n3. Yêu cầu bên giao đại lý hướng dẫn, cung cấp thông tin và các điều kiện khác có liên quan để thực hiện hợp đồng\nđại lý;\n4. Quyết định giá bán hàng hóa,\ncung ứng dịch vụ cho khách hàng đối với đại lý bao tiêu;\n5. Hưởng thù lao, các quyền và lợi\ních hợp pháp khác do hoạt động đại lý mang lại.\nĐiều 175. Nghĩa vụ của bên đại lý\nTrừ trường hợp có thỏa thuận khác, bên đại lý có các nghĩa vụ sau đây:\n1. Mua, bán hàng hóa, cung ứng dịch vụ cho khách hàng theo giá hàng hóa, giá cung ứng dịch vụ do bên giao đại lý ấn\nđịnh;\n2. Thực hiện đúng các thỏa thuận về giao nhận tiền, hàng với bên giao đại lý;\n3. Thực hiện các biện pháp bảo đảm thực hiện nghĩa vụ dân sự theo quy định của pháp luật;\n4. Thanh toán cho bên giao đại lý\ntiền bán hàng đối với đại lý bán; giao hàng mua đối với đại lý mua; tiền cung ứng dịch vụ đối với đại lý cung ứng dịch vụ;\n5. Bảo quản hàng hoá sau khi nhận\nđối với đại lý bán hoặc trước khi giao đối với đại lý mua; liên đới chịu trách nhiệm về chất lượng hàng hóa của đại lý mua bán hàng hóa, chất lượng dịch vụ của\nđại lý cung ứng dịch vụ trong trường hợp có lỗi do mình gây ra;\n6. Chịu sự kiểm tra, giám sát của bên giao đại lý và báo cáo tình hình hoạt động đại lý với bên giao đại lý;\n7. Trường hợp pháp luật có quy định cụ thể về việc bên đại lý chỉ được giao kết hợp đồng đại lý với một bên giao đại lý đối với một loại hàng hóa hoặc dịch vụ nhất định thì phải tuân thủ quy định của pháp luật đó.\nĐiều 176. Thanh toán trong đại lý\nTrừ trường hợp có thoả thuận khác, việc thanh toán tiền hàng, tiền cung ứng dịch vụ và thù lao đại lý được thực hiện theo từng đợt sau khi bên đại lý hoàn thành việc mua, bán một khối lượng hàng hoá hoặc cung ứng một khối lượng dịch vụ nhất định.\nĐiều 177. Thời hạn đại lý\n1. Trừ trường hợp có thoả thuận khác, thời hạn đại lý chỉ chấm dứt sau một thời gian hợp lý nhưng không sớm hơn sáu mươi ngày, kể từ ngày một trong hai bên thông báo bằng văn bản cho bên kia về việc chấm dứt hợp đồng đại lý.\n2. Trừ trường hợp có thỏa thuận khác, nếu bên giao đại lý thông báo chấm dứt hợp đồng theo quy định tại khoản 1\nĐiều này thì bên đại lý có quyền yêu cầu bên giao đại lý bồi thường một khoản tiền cho thời gian mà mình đã làm đại lý cho bên giao đại lý đó.\nGiá trị của khoản bồi thường là một tháng thù lao đại lý trung bình trong thời gian nhận đại lý cho mỗi năm mà bên\nđại lý làm đại lý cho bên giao đại lý. Trong trường hợp thời gian đại lý dưới một năm thì khoản bồi thường được tính là một tháng thù lao đại lý trung bình trong thời gian nhận đại lý.\n3. Trường hợp hợp đồng đại lý được chấm dứt trên cơ sở yêu cầu của bên đại lý thì bên đại lý không có quyền yêu cầu bên giao đại lý bồi thường cho thời gian mà mình đã làm đại lý cho bên giao đại lý.\nChương VI MỘT SỐ HOẠT ĐỘNG THƯƠNG MẠI CỤ THỂ KHÁC MỤC 1. GIA CÔNG TRONG THƯƠNG MẠI\nĐiều 178. Gia công trong thương mại Gia công trong thương mại là hoạt\nđộng thương mại, theo đó bên nhận gia công sử dụng một phần hoặc toàn bộ nguyên liệu, vật liệu của bên đặt gia công để thực hiện một hoặc nhiều công đoạn trong quá trình sản xuất theo yêu cầu của bên đặt gia công để hưởng thù lao.\nĐiều 179. Hợp đồng gia công Hợp đồng gia công phải được lập thành văn bản hoặc bằng hình thức khác có giá trị pháp lý tương đương.\nĐiều 180. Hàng hóa gia công 1. Tất cả các loại hàng hóa đều có thể được gia công, trừ trường hợp hàng hóa thuộc diện cấm kinh doanh.\n2. Trường hợp gia công hàng hóa cho thương nhân nước ngoài để tiêu thụ ở nước ngoài thì hàng hóa thuộc diện cấm kinh doanh, cấm xuất khẩu, cấm nhập khẩu có thể được gia công nếu được cơ quan nhà nước có thẩm quyền cho phép.\nĐiều 181. Quyền và nghĩa vụ của bên đặt gia công 1. Giao một phần hoặc toàn bộ nguyên liệu, vật liệu gia công theo đúng hợp đồng gia công hoặc giao tiền để mua vật liệu theo số lượng, chất lượng và mức giá thoả thuận.\n2. Nhận lại toàn bộ sản phẩm gia công, máy móc, thiết bị cho thuê hoặc cho mượn, nguyên liệu,\nphụ liệu, vật tư, phế liệu sau khi thanh lý hợp đồng gia công, trừ trường hợp có thoả thuận khác.\n3. Bán,\ntiêu huỷ, tặng biếu tại chỗ sản phẩm gia công, máy móc, thiết bị cho thuê hoặc cho mượn, nguyên liệu, phụ liệu, vật tư dư thừa, phế phẩm, phế liệu theo thoả\nthuận và phù hợp với quy định của pháp luật.\n4. Cử người đại diện để kiểm tra,\ngiám sát việc gia công tại nơi nhận gia công, cử chuyên gia để hướng dẫn kỹ thuật sản xuất và kiểm tra chất lượng sản phẩm gia công theo thoả thuận trong hợp đồng gia công.\n5. Chịu trách nhiệm đối với tính hợp pháp về quyền sở hữu trí tuệ của hàng hoá gia công, nguyên liệu, vật liệu,\nmáy móc, thiết bị dùng để gia công chuyển cho bên nhận gia công.\nĐiều 182. Quyền và nghĩa vụ của bên nhận gia công 1. Cung ứng một phần hoặc toàn bộ\nnguyên liệu, vật liệu để gia công theo thỏa thuận với bên đặt gia công về số lượng,\nchất lượng, tiêu chuẩn kỹ thuật và giá.\n2. Nhận thù lao gia công và các chi phí hợp lý khác.\n3. Trường hợp nhận gia công cho tổ chức, cá nhân nước ngoài, bên nhận gia công được xuất khẩu tại chỗ sản phẩm gia công, máy móc, thiết bị thuê hoặc mượn, nguyên liệu,\nphụ liệu, vật tư dư thừa, phế phẩm, phế liệu theo uỷ quyền của bên đặt gia công.\n4. Trường hợp nhận gia công cho tổ\nchức, cá nhân nước ngoài, bên nhận gia công được miễn thuế nhập khẩu đối với máy móc, thiết bị, nguyên liệu, phụ liệu, vật tư tạm nhập khẩu theo định mức để\nthực hiện hợp đồng gia công theo quy định của pháp luật về thuế.\n5. Chịu trách nhiệm về tính hợp pháp của hoạt động gia công hàng hoá trong trường hợp hàng hoá gia công thuộc diện cấm kinh doanh, cấm xuất khẩu, cấm nhập khẩu.\nĐiều 183. Thù lao gia công 1. Bên nhận gia công có thể nhận thù lao gia công bằng tiền hoặc bằng sản phẩm gia công, máy móc, thiết bị dùng\nđể gia công.\n2. Trường hợp gia công hàng hóa cho tổ chức, cá nhân nước ngoài, nếu bên nhận gia công nhận thù lao gia công bằng sản phẩm gia công, máy móc, thiết bị dùng để gia công thì phải tuân thủ các quy\nđịnh về nhập khẩu đối với sản phẩm, máy móc, thiết bị đó.\nĐiều 184. Chuyển giao công nghệ trong gia công với tổ chức, cá nhân nước ngoài Việc chuyển giao công nghệ trong gia công với tổ chức, cá nhân nước ngoài được thực hiện theo thoả thuận trong hợp\nđồng gia công và phải phù hợp với các quy định của pháp luật Việt Nam về chuyển giao công nghệ.\nMỤC 2. ĐẤU GIÁ HÀNG HÓA\nĐiều 185. Đấu giá hàng hoá\n1. Đấu giá hàng hoá là hoạt động thương mại, theo đó người bán hàng tự mình hoặc thuê người tổ chức đấu giá thực hiện việc bán hàng hoá công khai để chọn người mua trả giá cao nhất.\n2. Việc đấu giá hàng hoá được thực hiện theo một trong hai phương thức sau đây:\na) Phương thức trả giá lên là\nphương thức bán đấu giá, theo đó người trả giá cao nhất so với giá khởi điểm là\nngười có quyền mua hàng;\nb) Phương thức đặt giá xuống là\nphương thức bán đấu giá, theo đó người đầu tiên chấp nhận ngay mức giá khởi điểm hoặc mức giá được hạ thấp hơn mức giá khởi điểm là người có quyền mua hàng.\nĐiều 186. Người tổ chức đấu giá, người bán hàng 1. Người tổ chức đấu giá là\nthương nhân có đăng ký kinh doanh dịch vụ đấu giá hoặc là người bán hàng của mình trong trường hợp người bán hàng tự tổ chức đấu giá.\n2. Người bán hàng là chủ sở hữu hàng hoá, người được chủ sở hữu hàng hoá uỷ quyền bán hoặc người có quyền bán hàng hoá của người khác theo quy định của pháp luật.\nĐiều 187. Người tham gia đấu giá, người điều hành đấu giá\n1. Người tham gia đấu giá hàng hoá là tổ chức, cá nhân đăng ký tham gia cuộc đấu giá.\n2. Người điều hành đấu giá là người tổ chức đấu giá hoặc người được người tổ chức đấu giá uỷ quyền điều hành bán đấu giá.\nĐiều 188. Nguyên tắc đấu giá\nViệc đấu giá hàng hoá trong thương mại phải được thực hiện theo nguyên tắc công khai, trung thực, bảo đảm quyền, lợi ích hợp pháp của các bên tham gia.\nĐiều 189. Quyền của người tổ chức đấu giá\nTrừ trường hợp có thoả thuận khác,\nngười tổ chức đấu giá có các quyền sau đây:\n1. Yêu cầu người bán hàng cung cấp\nđầy đủ, chính xác, kịp thời các thông tin cần thiết liên quan đến hàng hoá đấu giá, tạo điều kiện cho người tổ chức đấu giá hoặc người tham gia đấu giá kiểm tra hàng hoá đấu giá và giao hàng hoá được bán đấu giá cho người mua hàng trong trường hợp người tổ chức đấu giá không phải là người bán hàng đấu giá;\n2. Xác định giá khởi điểm trong trường hợp người tổ chức đấu giá là người bán hàng đấu giá hoặc được người bán hàng uỷ quyền;\n3. Tổ chức cuộc đấu giá;\n4. Yêu cầu người mua hàng thực hiện việc thanh toán;\n5. Nhận thù lao dịch vụ đấu giá\ndo người bán hàng trả theo quy định tại Điều 211 của Luật này.\nĐiều 190. Nghĩa vụ của người tổ chức đấu giá\n1. Tổ chức đấu giá hàng hoá theo đúng nguyên tắc, thủ tục do pháp luật quy định và theo phương thức đấu giá thoả thuận với người bán hàng.\n2. Thông báo, niêm yết công khai,\nđầy đủ, chính xác các thông tin cần thiết có liên quan đến hàng hoá đấu giá.\n3. Bảo quản hàng hoá đấu giá khi\nđược người bán hàng giao giữ.\n4. Trưng bày hàng hoá, mẫu hàng hóa hoặc tài liệu giới thiệu về hàng hóa cho người tham gia đấu giá xem xét.\n5. Lập văn bản bán đấu giá hàng hoá và gửi đến người bán hàng, người mua hàng và các bên có liên quan quy định tại Điều 203 của Luật này.\n6. Giao hàng hóa đấu giá cho người mua phù hợp với hợp đồng tổ chức dịch vụ đấu giá hàng hoá.\n7. Làm thủ tục chuyển quyền sở hữu\nđối với hàng hoá bán đấu giá phải đăng ký quyền sở hữu theo quy định của pháp luật, trừ trường hợp có thỏa thuận khác với người bán hàng.\n8. Thanh toán cho người bán hàng tiền hàng đã bán, kể cả khoản tiền chênh lệch thu được từ người rút lại giá đã\ntrả quy định tại khoản 3 Điều 204 của Luật này hoặc trả lại hàng hoá không bán được cho người bán hàng theo thoả thuận. Trường hợp không có\nthoả thuận thì phải thanh toán tiền cho người bán hàng chậm nhất là ba ngày làm việc sau khi nhận được tiền của người mua hàng hoặc phải trả lại ngay hàng hoá\ntrong thời hạn hợp lý sau cuộc đấu giá.\nĐiều 191. Quyền của người bán hàng không phải là người tổ chức đấu giá\nTrừ trường hợp có thoả thuận khác, người bán hàng có các quyền sau đây:\n1. Nhận tiền hàng đã bán đấu giá\nvà khoản chênh lệch thu được trong trường hợp quy định tại khoản 3 Điều 204 của Luật này hoặc nhận lại hàng hoá trong trường hợp đấu giá\nkhông thành;\n2. Giám sát việc tổ chức bán đấu giá hàng hoá.\nĐiều 192. Nghĩa vụ của người bán hàng không phải là người tổ chức đấu giá\nTrừ trường hợp có thoả thuận khác, người bán hàng có các nghĩa vụ sau đây:\n1. Giao hàng hoá cho người tổ chức\nđấu giá, tạo điều kiện để người tổ chức đấu giá, người tham gia đấu giá xem xét hàng hoá và cung cấp đầy đủ, chính xác, kịp thời các thông tin cần thiết liên quan đến hàng hoá đấu giá;\n2. Trả thù lao dịch vụ tổ chức đấu giá theo quy định tại Điều 211 của Luật này.\nĐiều 193. Hợp đồng dịch vụ tổ chức đấu giá hàng hoá\n1. Hợp đồng dịch vụ tổ chức đấu giá hàng hoá phải được lập thành văn bản hoặc bằng hình thức khác có giá trị\npháp lý tương đương.\n2. Trường hợp hàng hoá được đấu giá là đối tượng cầm cố, thế chấp thì hợp đồng dịch vụ tổ chức đấu giá phải được sự đồng ý của bên nhận cầm cố, thế chấp và bên bán phải thông báo cho các bên tham gia đấu giá về hàng hóa đang bị cầm cố, thế chấp.\n3. Trường hợp trong hợp đồng cầm cố, thế chấp có thoả thuận về việc bán đấu giá mà người cầm cố, thế chấp vắng mặt không có lý do chính đáng hoặc từ chối giao kết hợp đồng dịch vụ tổ chức đấu giá hàng hoá thì hợp đồng dịch vụ tổ chức đấu giá được giao kết giữa người nhận cầm cố, thế chấp với người tổ chức đấu giá.\nĐiều 194. Xác định giá khởi điểm 1. Người bán hàng phải xác định giá khởi điểm. Trong trường hợp người tổ chức đấu giá được uỷ quyền xác định giá khởi điểm thì phải thông báo cho người bán hàng trước khi niêm yết việc bán\nđấu giá.\n2. Trường hợp hàng hoá đấu giá là\nđối tượng cầm cố, thế chấp thì người nhận cầm cố, thế chấp phải thoả thuận với người cầm cố, thế chấp xác định giá khởi điểm.\n3. Trường hợp trong hợp đồng cầm cố, thế chấp có thoả thuận về việc bán đấu giá mà người cầm cố, thế chấp vắng mặt không có lý do chính đáng hoặc từ chối giao kết hợp đồng dịch vụ tổ chức đấu giá hàng hoá thì giá khởi điểm do người nhận cầm cố, thế chấp xác định.\nĐiều 195. Thông báo cho người có quyền lợi và nghĩa vụ liên quan đến hàng hóa là đối tượng cầm cố, thế chấp Trường hợp hàng hoá là đối tượng cầm cố, thế chấp, thì đồng thời với việc niêm yết đấu giá hàng hoá, người tổ chức\nđấu giá phải thông báo cho những người có quyền lợi và nghĩa vụ liên quan trong thời hạn chậm nhất là bảy ngày làm việc trước khi tiến hành bán đấu giá hàng hóa đó theo quy định tại Điều 197 của Luật này.\nĐiều 196. Thời hạn thông báo và niêm yết đấu giá hàng hoá\n1. Chậm nhất là bảy ngày làm việc trước khi tiến hành bán đấu giá hàng hoá, người tổ chức đấu giá phải niêm yết việc bán đấu giá tại nơi tổ chức đấu giá, nơi trưng bày hàng hoá và nơi đặt trụ\nsở của người tổ chức đấu giá theo quy định tại Điều 197 của Luật này.\n2. Trường hợp người tổ chức đấu giá hàng hóa là người bán hàng thì thời hạn niêm yết đấu giá hàng hóa do người bán hàng tự quyết định.\nĐiều 197. Nội dung thông báo và niêm yết đấu giá hàng hóa Thông báo và niêm yết đấu giá\nhàng hóa phải có đầy đủ các nội dung sau đây:\n1. Thời gian, địa điểm đấu giá;\n2. Tên, địa chỉ của người tổ chức\nđấu giá;\n3. Tên, địa chỉ của người bán hàng;\n4. Danh mục hàng hoá, số lượng,\nchất lượng hàng hóa;\n5. Giá khởi điểm;\n6. Thông tin cần thiết liên quan\nđến hàng hoá;\n7. Địa điểm, thời gian trưng bày hàng hoá;\n8. Địa điểm, thời gian tham khảo hồ sơ hàng hoá;\n9. Địa điểm, thời gian đăng ký\nmua hàng hoá.\nĐiều 198. Những người không được tham gia đấu giá\n1. Người không có năng lực hành vi dân sự, người mất năng lực hành vi dân sự, người bị hạn chế năng lực hành vi dân sự theo quy định của Bộ luật dân sự hoặc người tại thời điểm đấu giá không nhận thức, làm chủ được hành vi của mình.\n2. Những người làm việc trong tổ\nchức bán đấu giá hàng hoá; cha, mẹ, vợ, chồng, con của những người đó.\n3. Người đã trực tiếp thực hiện việc giám định hàng hoá bán đấu giá; cha, mẹ, vợ, chồng, con của người đó.\n4. Những người không có quyền mua hàng hoá đấu giá theo quy định của pháp luật.\nĐiều 199. Đăng ký tham gia đấu giá\n1. Người tổ chức đấu giá có thể\nyêu cầu người muốn tham gia đấu giá phải đăng ký tham gia trước khi bán đấu giá.\n2. Người tổ chức đấu giá có thể\nyêu cầu người tham gia đấu giá nộp một khoản tiền đặt trước, nhưng không quá 2%\ngiá khởi điểm của hàng hoá được đấu giá.\n3. Trường hợp người tham gia đấu giá mua được hàng hoá bán đấu giá thì khoản tiền đặt trước được trừ vào giá\nmua, nếu không mua được thì khoản tiền đặt trước được trả lại cho người đã nộp khoản tiền đặt trước đó ngay sau khi cuộc đấu giá kết thúc.\n4. Trường hợp người đăng ký tham gia đấu giá đã nộp một khoản tiền đặt trước nhưng sau đó không dự cuộc đấu giá\nthì người tổ chức đấu giá có quyền thu khoản tiền đặt trước đó.\nĐiều 200. Trưng bày hàng hoá đấu giá\nHàng hoá, mẫu hàng hoá, tài liệu giới thiệu về hàng hoá và các thông tin cần thiết khác về hàng hoá đó phải được trưng bày tại địa điểm được thông báo từ khi niêm yết.\nĐiều 201. Tiến hành cuộc đấu giá\nCuộc đấu giá được tiến hành theo trình tự sau đây:\n1. Người điều hành đấu giá điểm danh người đã đăng ký tham gia đấu giá hàng hoá;\n2. Người điều hành đấu giá giới thiệu từng hàng hoá bán đấu giá, nhắc lại giá khởi điểm, trả lời các câu hỏi của người tham gia đấu giá và yêu cầu người tham gia đấu giá trả giá;\n3. Đối với phương thức trả giá\nlên, người điều hành đấu giá phải nhắc lại một cách rõ ràng, chính xác giá đã\ntrả sau cùng cao hơn giá người trước đã trả ít nhất là ba lần, mỗi lần cách nhau ít nhất ba mươi giây. Người điều hành đấu giá chỉ được công bố người mua hàng hoá bán đấu giá, nếu sau ba lần nhắc lại giá người đó đã trả mà không có\nngười nào trả giá cao hơn;\n4. Đối với phương thức đặt giá xuống,\nngười điều hành đấu giá phải nhắc lại một cách rõ ràng, chính xác từng mức giá\nđược hạ xuống thấp hơn giá khởi điểm ít nhất là ba lần, mỗi lần cách nhau ít nhất ba mươi giây. Người điều hành đấu giá phải công bố ngay người đầu tiên chấp nhận mức giá khởi điểm hoặc mức giá hạ thấp hơn mức giá khởi điểm là người có quyền mua hàng hóa đấu giá;\n5. Trường hợp có nhiều người đồng thời trả mức giá cuối cùng đối với phương thức trả giá lên hoặc mức giá đầu tiên đối với phương thức đặt giá xuống, người điều hành đấu giá phải tổ chức rút thăm giữa những người đó và công bố người rút trúng thăm được mua là người mua hàng hoá bán đấu giá;\n6. Người điều hành đấu giá phải lập văn bản bán đấu giá hàng hoá ngay tại cuộc đấu giá, kể cả trong trường hợp đấu giá không thành. Văn bản bán đấu giá phải ghi rõ kết quả đấu giá, có chữ ký của người điều hành đấu giá, người mua hàng và hai người chứng kiến trong số những người tham gia đấu giá; đối với hàng hoá bán đấu giá phải có công chứng nhà nước theo quy định của pháp luật thì văn bản bán đấu giá cũng phải được công chứng.\nĐiều 202. Đấu giá không thành Cuộc đấu giá được coi là không thành trong các trường hợp sau đây:\n1. Không có người tham gia đấu giá, trả giá;\n2. Giá cao nhất đã trả thấp hơn mức giá khởi điểm đối với phương thức trả giá lên.\nĐiều 203. Văn bản bán đấu giá hàng hoá\n1. Văn bản bán đấu giá hàng hoá\nlà văn bản xác nhận việc mua bán. Văn bản bán đấu giá hàng hoá phải có các nội dung sau đây:\na) Tên, địa chỉ của người tổ chức\nđấu giá;\nb) Tên, địa chỉ của người điều hành đấu giá;\nc) Tên, địa chỉ của người bán hàng;\nd) Tên, địa chỉ của người mua hàng;\nđ) Thời gian, địa điểm đấu giá;\ne) Hàng hoá bán đấu giá;\ng) Giá đã bán;\nh) Tên, địa chỉ của hai người chứng kiến.\n2. Văn bản bán đấu giá hàng hoá phải\nđược gửi đến người bán hàng, người mua hàng và các bên có liên quan.\n3. Trường hợp đấu giá không thành, trong văn bản bán đấu giá hàng hoá phải nêu rõ kết quả là đấu giá không thành và phải có các nội dung quy định tại các điểm a, b, c, đ, e và h khoản 1\nĐiều này.\nĐiều 204. Rút lại giá đã trả\n1. Trường hợp đấu giá theo phương thức trả giá lên, nếu người trả giá cao nhất rút ngay lại giá đã trả thì cuộc đấu giá vẫn được tiếp tục từ giá của người trả giá liền kề trước đó. Trường hợp bán\nđấu giá theo phương thức đặt giá xuống, nếu người đầu tiên chấp nhận mức giá\nrút ngay lại giá đã chấp nhận thì cuộc đấu giá vẫn được tiếp tục từ giá đã đặt liền kề trước đó.\n2. Người rút lại giá đã trả hoặc người rút lại việc chấp nhận giá không được tiếp tục tham gia đấu giá.\n3. Trường hợp giá bán hàng hoá thấp hơn giá mà người rút lại giá đã trả đối với phương thức trả giá lên hoặc giá mà\nngười rút lại việc chấp nhận đối với phương thức đặt giá xuống thì người đó phải trả khoản tiền chênh lệch cho người tổ chức đấu giá, nếu hàng hoá bán được giá\ncao hơn thì người rút lại không được hưởng khoản tiền chênh lệch đó.\n4. Trường hợp cuộc đấu giá không thành thì người rút lại giá đã trả phải chịu chi phí cho việc bán đấu giá và\nkhông được hoàn trả khoản tiền đặt trước.\nĐiều 205. Từ chối mua 1. Trừ trường hợp có thoả thuận khác, sau khi tuyên bố kết thúc cuộc đấu giá, người mua hàng bị ràng buộc trách nhiệm; nếu sau đó người mua hàng từ chối mua hàng thì phải được người bán hàng chấp thuận, nhưng phải chịu mọi chi phí liên quan đến việc tổ chức bán đấu giá.\n2. Trong trường hợp người mua được hàng hoá đấu giá đã nộp một khoản tiền đặt trước mà từ chối mua thì không được hoàn trả khoản tiền đặt trước đó. Khoản tiền đặt trước đó thuộc về người bán hàng.\nĐiều 206. Đăng ký quyền sở hữu 1. Văn bản bán đấu giá hàng hoá\nđược dùng làm căn cứ để chuyển quyền sở hữu đối với hàng hoá đấu giá mà theo quy định của pháp luật phải đăng ký quyền sở hữu.\n2. Căn cứ vào văn bản bán đấu giá\nhàng hoá và các giấy tờ hợp lệ khác, cơ quan nhà nước có thẩm quyền có trách nhiệm đăng ký quyền sở hữu hàng hoá cho người mua hàng theo quy định của pháp luật.\n3. Người bán hàng và người tổ chức\nđấu giá có nghĩa vụ làm thủ tục chuyển quyền sở hữu hàng hoá cho người mua hàng. Chi phí làm thủ tục chuyển quyền sở hữu được trừ vào tiền bán hàng hoá,\ntrừ trường hợp có thoả thuận khác.\nĐiều 207. Thời điểm thanh toán tiền mua hàng hoá\nThời điểm thanh toán tiền mua hàng hoá do người tổ chức đấu giá và người mua hàng hoá đấu giá thoả thuận; nếu không có thoả thuận thì thời điểm thanh toán tiền mua hàng hoá là thời điểm theo quy định tại Điều 55 của Luật này.\nĐiều 208. Địa điểm thanh toán tiền mua hàng hoá\nĐịa điểm thanh toán tiền mua hàng hoá do người tổ chức đấu giá và người mua hàng thoả thuận; nếu không có thoả\nthuận thì địa điểm thanh toán là trụ sở kinh doanh của người tổ chức đấu giá.\nĐiều 209. Thời hạn giao hàng hoá bán đấu giá\nTrừ trường hợp có thoả thuận khác giữa người tổ chức đấu giá và người mua hàng, thời hạn giao hàng hoá bán đấu giá được quy định như sau:\n1. Đối với hàng hoá không phải\nđăng ký quyền sở hữu thì người tổ chức đấu giá phải giao ngay hàng hoá cho người mua hàng sau khi lập văn bản bán đấu giá;\n2. Đối với hàng hoá có đăng ký\nquyền sở hữu thì người tổ chức đấu giá phải tiến hành ngay việc làm thủ tục chuyển quyền sở hữu và giao hàng cho người mua hàng ngay sau khi hoàn thành thủ\ntục chuyển quyền sở hữu.\nĐiều 210. Địa điểm giao hàng hoá bán đấu giá\n1. Trường hợp hàng hoá là những vật gắn liền với đất đai thì địa điểm giao hàng là nơi có hàng hóa đó.\n2. Trường hợp hàng hoá là động sản thì địa điểm giao hàng là nơi tổ chức đấu giá, trừ trường hợp người tổ chức đấu giá và người mua hàng có thoả thuận khác.\nĐiều 211. Thù lao dịch vụ đấu giá hàng hoá\nTrường hợp không có thoả thuận về\nmức thù lao dịch vụ đấu giá hàng hóa thì thù lao được xác định như sau:\n1. Trường hợp cuộc đấu giá thành công thì thù lao dịch vụ đấu giá được xác định theo Điều 86 của Luật này;\n2. Trường hợp đấu giá không thành thì người bán hàng phải trả mức thù lao bằng 50% của mức thù lao quy định tại khoản 1 Điều này.\nĐiều 212. Chi phí liên quan đến đấu giá hàng hoá\nTrừ trường hợp có thoả thuận khác giữa người bán hàng và người tổ chức đấu giá, chi phí liên quan đến đấu giá hàng hóa được xác định như sau:\n1. Người bán hàng phải chịu chi phí vận chuyển hàng hoá đến địa điểm đã thoả thuận và chi phí bảo quản hàng hoá\ntrong trường hợp không giao hàng hoá cho người tổ chức đấu giá bảo quản;\n2. Người tổ chức đấu giá chịu chi phí bảo quản hàng hoá được giao, chi phí niêm yết, thông báo, tổ chức bán đấu giá và các chi phí có liên quan khác.\nĐiều 213. Trách nhiệm đối với hàng hóa bán đấu giá không phù hợp với thông báo, niêm yết 1. Trong thời hạn quy định tại Điều 318 của Luật này, người mua hàng có quyền trả lại hàng hóa cho người tổ chức đấu giá và yêu cầu bồi thường thiệt hại nếu hàng hóa bán\nđấu giá không phù hợp với thông báo, niêm yết.\n2. Trường hợp người tổ chức đấu giá quy định tại khoản 1 Điều này không phải là người bán hàng và nội dung thông báo, niêm yết không phù hợp là do lỗi của người bán hàng thì người tổ chức\nđấu giá có quyền trả lại hàng hóa và yêu cầu người bán hàng bồi thường thiệt hại.\nMỤC 3. ĐẤU THẦU HÀNG HÓA, DỊCH VỤ\nĐiều 214. Đấu thầu hàng hoá, dịch vụ\n1. Đấu thầu hàng hoá, dịch vụ là\nhoạt động thương mại, theo đó một bên mua hàng hoá, dịch vụ thông qua mời thầu\n(gọi là bên mời thầu) nhằm lựa chọn trong số các thương nhân tham gia đấu thầu\n(gọi là bên dự thầu) thương nhân đáp ứng tốt nhất các yêu cầu do bên mời thầu đặt ra và được lựa chọn để ký kết và thực hiện hợp đồng (gọi là bên trúng thầu).\n2. Các quy định về đấu thầu trong Luật này không áp dụng đối với đấu thầu mua sắm công theo quy định của pháp luật.\nĐiều 215. Hình thức đấu thầu 1. Việc đấu thầu hàng hoá, dịch vụ\nđược thực hiện theo một trong hai hình thức sau đây:\na) Đấu thầu rộng rãi là hình thức\nđấu thầu mà bên mời thầu không hạn chế số lượng các bên dự thầu;\nb) Đấu thầu hạn chế là hình thức\nđấu thầu mà bên mời thầu chỉ mời một số nhà thầu nhất định dự thầu.\n2. Việc chọn hình thức đấu thầu rộng rãi hoặc đấu thầu hạn chế do bên mời thầu quyết định.\nĐiều 216. Phương thức đấu thầu 1. Phương thức đấu thầu bao gồm đấu thầu một túi hồ sơ và đấu thầu hai túi hồ sơ. Bên mời thầu có quyền lựa chọn phương thức đấu thầu và phải thông báo trước cho các bên dự thầu.\n2. Trong trường hợp đấu thầu theo phương thức đấu thầu một túi hồ sơ, bên dự thầu nộp hồ sơ dự thầu gồm đề xuất về\nkỹ thuật, đề xuất về tài chính trong một túi hồ sơ theo yêu cầu của hồ sơ mời thầu và việc mở thầu được tiến hành một lần.\n3. Trong trường hợp đấu thầu theo phương thức đấu thầu hai túi hồ sơ thì bên dự thầu nộp hồ sơ dự thầu gồm đề xuất về kỹ thuật, đề xuất về tài chính trong từng túi hồ sơ riêng biệt được nộp trong cùng một thời điểm và việc mở thầu được tiến hành hai lần. Hồ sơ đề xuất về kỹ thuật sẽ được mở trước.\nĐiều 217. Sơ tuyển các bên dự thầu Bên mời thầu có thể tổ chức sơ\ntuyển các bên dự thầu nhằm lựa chọn những bên dự thầu có khả năng đáp ứng các\nđiều kiện mà bên mời thầu đưa ra.\nĐiều 218. Hồ sơ mời thầu 1. Hồ sơ mời thầu bao gồm:\na) Thông báo mời thầu;\nb) Các yêu cầu liên quan đến hàng hóa, dịch vụ được đấu thầu;\nc) Phương pháp đánh giá, so sánh,\nxếp hạng và lựa chọn nhà thầu;\nd) Những chỉ dẫn khác liên quan đến việc đấu thầu.\n2. Chi phí về việc cung cấp hồ sơ\ncho bên dự thầu do bên mời thầu quy định.\nĐiều 219. Thông báo mời thầu 1. Thông báo mời thầu gồm các nội dung chủ yếu sau đây:\na) Tên, địa chỉ của bên mời thầu;\nb) Tóm tắt nội dung đấu thầu;\nc) Thời hạn, địa điểm và thủ tục nhận hồ sơ mời thầu;\nd) Thời hạn, địa điểm, thủ tục nộp hồ sơ dự thầu;\nđ) Những chỉ dẫn để tìm hiểu hồ\nsơ mời thầu.\n2. Bên mời thầu có trách nhiệm thông báo rộng rãi trên các phương tiện thông tin đại chúng đối với trường hợp\nđấu thầu rộng rãi hoặc gửi thông báo mời đăng ký dự thầu đến các nhà thầu đủ điều kiện trong trường hợp đấu thầu hạn chế.\nĐiều 220. Chỉ dẫn cho bên dự thầu Bên mời thầu có trách nhiệm chỉ dẫn cho bên dự thầu về các điều kiện dự thầu, các thủ tục được áp dụng trong quá\ntrình đấu thầu và giải đáp các câu hỏi của bên dự thầu.\nĐiều 221. Quản lý hồ sơ dự thầu Bên mời thầu có trách nhiệm quản lý hồ sơ dự thầu.\nĐiều 222. Bảo đảm dự thầu 1. Bảo đảm dự thầu được thực hiện dưới hình thức đặt cọc, ký quỹ hoặc bảo lãnh dự thầu.\n2. Bên mời thầu có thể yêu cầu bên dự thầu nộp tiền đặt cọc, ký quỹ hoặc bảo lãnh dự thầu khi nộp hồ sơ dự thầu.\nTỷ lệ tiền đặt cọc, ký quỹ dự thầu do bên mời thầu quy định, nhưng không quá 3%\ntổng giá trị ước tính của hàng hoá, dịch vụ đấu thầu.\n3. Bên mời thầu quy định hình thức,\nđiều kiện đặt cọc, ký quỹ hoặc bảo lãnh dự thầu. Trong trường hợp đặt cọc, ký\nquỹ thì tiền đặt cọc, ký quỹ dự thầu được trả lại cho bên dự thầu không trúng thầu trong thời hạn bảy ngày làm việc, kể từ ngày công bố kết quả đấu thầu.\n4. Bên dự thầu không được nhận lại tiền đặt cọc, ký quỹ dự thầu trong trường hợp rút hồ sơ dự thầu sau thời điểm hết hạn nộp hồ sơ dự thầu (gọi là thời điểm đóng thầu), không ký hợp đồng hoặc từ\nchối thực hiện hợp đồng trong trường hợp trúng thầu.\n5. Bên nhận bảo lãnh cho bên dự\nthầu có nghĩa vụ bảo đảm dự thầu cho bên được bảo lãnh trong phạm vi giá trị\ntương đương với số tiền đặt cọc, ký quỹ.\nĐiều 223. Bảo mật thông tin đấu thầu 1. Bên mời thầu phải bảo mật hồ\nsơ dự thầu.\n2. Tổ chức, cá nhân có liên quan\nđến việc tổ chức đấu thầu và xét chọn thầu phải giữ bí mật thông tin liên quan\nđến việc đấu thầu.\nĐiều 224. Mở thầu 1. Mở thầu là việc tổ chức mở hồ\nsơ dự thầu tại thời điểm đã được ấn định hoặc trong trường hợp không có thời điểm\nđược ấn định trước thì thời điểm mở thầu là ngay sau khi đóng thầu.\n2. Những hồ sơ dự thầu nộp đúng hạn phải được bên mời thầu mở công khai. Các bên dự thầu có quyền tham dự mở thầu.\n3. Những hồ sơ dự thầu nộp không\nđúng hạn không được chấp nhận và được trả lại cho bên dự thầu dưới dạng chưa mở.\nĐiều 225. Xét hồ sơ dự thầu khi mở thầu 1. Bên mời thầu xét tính hợp lệ của hồ sơ dự thầu.\n2. Bên mời thầu có thể yêu cầu các bên dự thầu giải thích những nội dung chưa rõ trong hồ sơ dự thầu. Việc yêu cầu và giải thích hồ sơ dự thầu phải được lập thành văn bản.\nĐiều 226. Biên bản mở thầu 1. Khi mở thầu, bên mời thầu và\ncác bên dự thầu có mặt phải ký vào biên bản mở thầu.\n2. Biên bản mở thầu phải có các nội dung sau đây:\na) Tên hàng hoá, dịch vụ đấu thầu;\nb) Ngày, giờ, địa điểm mở thầu;\nc) Tên, địa chỉ của bên mời thầu,\ncác bên dự thầu;\nd) Giá bỏ thầu của các bên dự thầu;\nđ) Các nội dung sửa đổi, bổ sung và các nội dung có liên quan, nếu có.\nĐiều 227. Đánh giá và so sánh hồ sơ dự thầu 1. Hồ sơ dự thầu được đánh giá và\nso sánh theo từng tiêu chuẩn làm căn cứ để đánh giá toàn diện.\nCác tiêu chuẩn đánh giá hồ sơ dự\nthầu do bên mời thầu quy định.\n2. Các tiêu chuẩn quy định tại khoản 1 Điều này được đánh giá bằng phương pháp cho điểm theo thang điểm hoặc phương pháp khác đã được ấn định trước khi mở thầu.\nĐiều 228. Sửa đổi hồ sơ dự thầu 1. Các bên dự thầu không được sửa\nđổi hồ sơ dự thầu sau khi đã mở thầu.\n2. Trong quá trình đánh giá và so sánh các hồ sơ dự thầu, bên mời thầu có thể yêu cầu bên dự thầu làm rõ các vấn\nđề có liên quan đến hồ sơ dự thầu. Yêu cầu của bên mời thầu và ý kiến trả lời của bên dự thầu phải được lập thành văn bản.\n3. Trường hợp bên mời thầu sửa đổi một số nội dung trong hồ sơ mời thầu, bên mời thầu phải gửi nội dung đã sửa đổi bằng văn bản đến tất cả các bên dự thầu trước thời hạn cuối cùng nộp hồ sơ dự\nthầu ít nhất là mười ngày để các bên dự thầu có điều kiện hoàn chỉnh thêm hồ sơ\ndự thầu của mình.\nĐiều 229. Xếp hạng và lựa chọn nhà thầu 1. Căn cứ vào kết quả đánh giá hồ\nsơ dự thầu, bên mời thầu phải xếp hạng và lựa chọn các bên dự thầu theo phương pháp đã được ấn định.\n2. Trong trường hợp có nhiều bên tham gia dự thầu có số điểm, tiêu chuẩn trúng thầu ngang nhau thì bên mời thầu có quyền chọn nhà thầu.\nĐiều 230. Thông báo kết quả đấu thầu và ký kết hợp đồng 1. Ngay sau khi có kết quả đấu thầu,\nbên mời thầu có trách nhiệm thông báo kết quả đấu thầu cho bên dự thầu.\n2. Bên mời thầu tiến hành hoàn thiện và ký kết hợp đồng với bên trúng thầu trên cơ sở sau đây:\na) Kết quả đấu thầu;\nb) Các yêu cầu nêu trong hồ sơ mời thầu;\nc) Nội dung nêu trong hồ sơ dự thầu.\nĐiều 231. Bảo đảm thực hiện hợp đồng 1. Các bên có thể thỏa thuận bên trúng thầu phải đặt cọc, ký quỹ hoặc được bảo lãnh để bảo đảm thực hiện hợp đồng.\nSố tiền đặt cọc, ký quỹ do bên mời thầu quy định, nhưng không quá 10% giá trị hợp\nđồng.\n2. Biện pháp bảo đảm thực hiện hợp\nđồng có hiệu lực cho đến thời điểm bên trúng thầu hoàn thành nghĩa vụ hợp đồng.\n3. Trừ trường hợp có thoả thuận khác, bên trúng thầu được nhận lại tiền đặt cọc, ký quỹ bảo đảm thực hiện hợp đồng khi thanh lý hợp đồng. Bên trúng thầu không được nhận lại tiền đặt cọc, ký quỹ\nbảo đảm thực hiện hợp đồng nếu từ chối thực hiện hợp đồng sau khi hợp đồng được giao kết.\n4. Sau khi nộp tiền đặt cọc, ký quỹ\nbảo đảm thực hiện hợp đồng, bên trúng thầu được hoàn trả tiền đặt cọc, ký quỹ dự\nthầu.\nĐiều 232. Đấu thầu lại Việc đấu thầu lại được tổ chức khi có một trong các trường hợp sau đây:\n1. Có sự vi phạm các quy định về\nđấu thầu;\n2. Các bên dự thầu đều không đạt yêu cầu đấu thầu.\nMỤC 4. DỊCH VỤ LOGISTICS\nĐiều 233. Dịch vụ logistics Dịch vụ logistics là hoạt động thương mại, theo đó thương nhân tổ chức thực hiện một hoặc nhiều công việc bao gồm nhận hàng, vận chuyển, lưu kho, lưu bãi, làm thủ tục hải quan, các thủ tục giấy tờ khác, tư vấn khách hàng, đóng gói bao bì, ghi ký mã hiệu, giao hàng hoặc các dịch vụ khác có liên quan đến hàng hoá theo thoả thuận với khách hàng để hưởng thù lao. Dịch vụ logistics được phiên âm theo tiếng Việt là dịch vụ lô-gi-stíc.\nĐiều 234. Điều kiện kinh doanh dịch vụ logistics 1. Thương nhân kinh doanh dịch vụ\nlogistics là doanh nghiệp có đủ điều kiện kinh doanh dịch vụ logistics theo quy\nđịnh của pháp luật.\n2. Chính phủ quy định chi tiết điều kiện kinh doanh dịch vụ logistics.\nĐiều 235. Quyền và nghĩa vụ của thương nhân kinh doanh dịch vụ\nlogistics 1. Trừ trường hợp có thỏa thuận khác, thương nhân kinh doanh dịch vụ logistics có các quyền và nghĩa vụ sau\nđây:\na) Được hưởng thù lao dịch vụ và\ncác chi phí hợp lý khác;\nb) Trong quá trình thực hiện hợp\nđồng, nếu có lý do chính đáng vì lợi ích của khách hàng thì thương nhân kinh doanh dịch vụ logistics có thể thực hiện khác với chỉ dẫn của khách hàng, nhưng phải thông báo ngay cho khách hàng;\nc) Khi xảy ra trường hợp có thể dẫn\nđến việc không thực hiện được một phần hoặc toàn bộ những chỉ dẫn của khách hàng thì phải thông báo ngay cho khách hàng để xin chỉ dẫn;\nd) Trường hợp không có thoả thuận về thời hạn cụ thể thực hiện nghĩa vụ với khách hàng thì phải thực hiện các nghĩa vụ của mình trong thời hạn hợp lý.\n2. Khi thực hiện việc vận chuyển hàng hóa, thương nhân kinh doanh dịch vụ logistics phải tuân thủ các quy định của pháp luật và tập quán vận tải.\nĐiều 236. Quyền và nghĩa vụ của khách hàng Trừ trường hợp có thỏa thuận khác, khách hàng có các quyền và nghĩa vụ sau đây:\n1. Hướng dẫn, kiểm tra, giám sát việc thực hiện hợp đồng;\n2. Cung cấp đầy đủ chỉ dẫn cho thương nhân kinh doanh dịch vụ logistics;\n3. Thông tin chi tiết, đầy đủ,\nchính xác và kịp thời về hàng hoá cho thương nhân kinh doanh dịch vụ logistics;\n4. Đóng gói, ghi ký mã hiệu hàng hoá theo hợp đồng mua bán hàng hoá, trừ trường hợp có thỏa thuận để thương nhân kinh doanh dịch vụ logistics đảm nhận công việc này;\n5. Bồi thường thiệt hại, trả các chi phí hợp lý phát sinh cho thương nhân kinh doanh dịch vụ logistics nếu người\nđó đã thực hiện đúng chỉ dẫn của mình hoặc trong trường hợp do lỗi của mình gây ra;\n6. Thanh toán cho thương nhân kinh doanh dịch vụ logistics mọi khoản tiền đã đến hạn thanh toán.\nĐiều 237. Các trường hợp miễn trách nhiệm đối với thương nhân kinh doanh dịch vụ logistics 1. Ngoài những trường hợp miễn trách nhiệm quy định tại Điều 294 của Luật này, thương nhân kinh doanh dịch vụ logistics không phải chịu trách nhiệm về những tổn thất đối với hàng hoá phát sinh trong các trường hợp sau đây:\na) Tổn thất là do lỗi của khách hàng hoặc của người được khách hàng uỷ quyền;\nb) Tổn thất phát sinh do thương nhân kinh doanh dịch vụ logistics làm đúng theo những chỉ dẫn của khách hàng hoặc của người được khách hàng uỷ quyền;\nc) Tổn thất là do khuyết tật của hàng hoá;\nd) Tổn thất phát sinh trong những trường hợp miễn trách nhiệm theo quy định của pháp luật và tập quán vận tải nếu thương nhân kinh doanh dịch vụ logistics tổ chức vận tải;\nđ) Thương nhân kinh doanh dịch vụ\nlogistics không nhận được thông báo về khiếu nại trong thời hạn mười bốn ngày,\nkể từ ngày thương nhân kinh doanh dịch vụ logistics giao hàng cho người nhận;\ne) Sau khi bị khiếu nại, thương nhân kinh doanh dịch vụ logistics không nhận được thông báo về việc bị kiện tại Trọng tài hoặc Toà án trong thời hạn chín tháng, kể từ ngày giao hàng.\n2. Thương nhân kinh doanh dịch vụ\nlogistics không phải chịu trách nhiệm về việc mất khoản lợi đáng lẽ được hưởng của khách hàng, về sự chậm trễ hoặc thực hiện dịch vụ logistics sai địa điểm không do lỗi của mình.\nĐiều 238. Giới hạn trách nhiệm 1. Trừ trường hợp có thoả thuận khác, toàn bộ trách nhiệm của thương nhân kinh doanh dịch vụ logistics không vượt quá giới hạn trách nhiệm đối với tổn thất toàn bộ hàng hoá.\n2. Chính phủ quy định chi tiết giới hạn trách nhiệm đối với thương nhân kinh doanh dịch vụ logistics phù hợp với các quy định của pháp luật và tập quán quốc tế.\n3. Thương nhân kinh doanh dịch vụ\nlogistics không được hưởng quyền giới hạn trách nhiệm bồi thường thiệt hại, nếu người có quyền và lợi ích liên quan chứng minh được sự mất mát, hư hỏng hoặc giao trả hàng chậm là do thương nhân kinh doanh dịch vụ logistics cố ý hành động hoặc không hành động để gây ra mất mát, hư hỏng, chậm trễ hoặc đã hành động hoặc không hành động một cách mạo hiểm và biết rằng sự mất mát, hư hỏng, chậm trễ đó\nchắc chắn xảy ra.\nĐiều 239. Quyền cầm giữ và định đoạt hàng hoá\n1. Thương nhân kinh doanh dịch vụ\nlogistics có quyền cầm giữ một số lượng hàng hoá nhất định và các chứng từ liên quan đến số lượng hàng hoá đó để đòi tiền nợ đã đến hạn của khách hàng nhưng phải thông báo ngay bằng văn bản cho khách hàng.\n2. Sau thời hạn bốn mươi lăm ngày kể từ ngày thông báo cầm giữ hàng hoá hoặc chứng từ liên quan đến hàng hoá, nếu khách hàng không trả tiền nợ thì thương nhân kinh doanh dịch vụ logistics có\nquyền định đoạt hàng hoá hoặc chứng từ đó theo quy định của pháp luật; trong trường hợp hàng hoá có dấu hiệu bị hư hỏng thì thương nhân kinh doanh dịch vụ\nlogistics có quyền định đoạt hàng hoá ngay khi có bất kỳ khoản nợ đến hạn nào của khách hàng.\n3. Trước khi định đoạt hàng hoá,\nthương nhân kinh doanh dịch vụ logistics phải thông báo ngay cho khách hàng biết về việc định đoạt hàng hoá đó.\n4. Mọi chi phí cầm giữ, định đoạt hàng hoá do khách hàng chịu.\n5. Thương nhân kinh doanh dịch vụ\nlogistics được sử dụng số tiền thu được từ việc định đoạt hàng hoá để thanh toán các khoản mà khách hàng nợ mình và các chi phí có liên quan; nếu số tiền thu được từ việc định đoạt vượt quá giá trị các khoản nợ thì số tiền vượt quá\nphải được trả lại cho khách hàng. Kể từ thời điểm đó, thương nhân kinh doanh dịch vụ logistics không phải chịu trách nhiệm đối với hàng hoá hoặc chứng từ đã được\nđịnh đoạt.\nĐiều 240. Nghĩa vụ của thương nhân kinh doanh dịch vụ logistics khi cầm giữ hàng hoá\nKhi chưa thực hiện quyền định đoạt hàng hoá theo quy định tại Điều 239 của Luật này, thương nhân kinh doanh dịch vụ logistics thực hiện quyền cầm giữ hàng hoá có các nghĩa vụ sau đây:\n1. Bảo quản, giữ gìn hàng hoá;\n2. Không được sử dụng hàng hoá nếu không được bên có hàng hoá bị cầm giữ đồng ý;\n3. Trả lại hàng hoá khi các điều kiện cầm giữ, định đoạt hàng hoá quy định tại Điều 239 của Luật này không còn;\n4. Bồi thường thiệt hại cho bên có\nhàng hoá bị cầm giữ nếu làm mất mát hoặc hư hỏng hàng hoá cầm giữ.\nMỤC 5. QUÁ CẢNH HÀNG HÓA QUA LÃNH THỔ VIỆT NAM VÀ DỊCH VỤ QUÁ CẢNH HÀNG HÓA\nĐiều 241. Quá cảnh hàng hóa Quá cảnh hàng hóa là việc vận chuyển hàng hóa thuộc sở hữu của tổ chức, cá nhân nước ngoài qua lãnh thổ Việt Nam, kể cả việc trung chuyển, chuyển tải, lưu kho, chia tách lô hàng, thay đổi phương thức vận tải hoặc các công việc khác được thực hiện trong thời gian quá\ncảnh.\nĐiều 242. Quyền quá cảnh hàng hóa 1. Mọi hàng hóa thuộc sở hữu của tổ chức, cá nhân nước ngoài đều được quá cảnh lãnh thổ Việt Nam và chỉ cần làm thủ tục hải quan tại cửa khẩu nhập và cửa khẩu xuất theo quy định của pháp luật,\ntrừ các trường hợp sau đây:\na) Hàng hóa là các loại vũ khí, đạn dược, vật liệu nổ và các loại hàng hóa có độ nguy hiểm cao khác, trừ trường hợp\nđược Thủ tướng Chính phủ cho phép;\nb) Hàng hóa thuộc diện cấm kinh doanh, cấm xuất khẩu, cấm nhập khẩu chỉ được quá cảnh lãnh thổ Việt Nam khi được Bộ trưởng Bộ Thương mại cho phép.\n2. Hàng hóa quá cảnh khi xuất khẩu,\nphương tiện vận tải chở hàng quá cảnh khi xuất cảnh khỏi lãnh thổ Việt Nam phải\nđúng là toàn bộ hàng hóa đã nhập khẩu, phương tiện vận tải đã nhập cảnh vào lãnh thổ Việt Nam.\n3. Tổ chức,\ncá nhân nước ngoài muốn quá cảnh hàng hoá qua lãnh thổ Việt Nam phải thuê\nthương nhân Việt Nam kinh doanh dịch vụ quá cảnh thực hiện, trừ trường hợp quy\nđịnh tại khoản 4 Điều này.\n4. Việc tổ chức, cá nhân nước ngoài tự mình thực hiện quá cảnh hàng hóa qua lãnh thổ Việt Nam, thuê thương nhân nước ngoài thực hiện quá cảnh hàng hoá qua lãnh thổ Việt Nam được thực hiện theo điều ước quốc tế mà Cộng hòa xã hội chủ nghĩa Việt Nam là thành viên và phải tuân thủ quy định của pháp luật Việt Nam về xuất cảnh, nhập cảnh và giao thông vận tải.\nĐiều 243. Tuyến đường quá cảnh 1. Hàng hóa chỉ được quá cảnh qua các cửa khẩu quốc tế và theo đúng những tuyến đường nhất định trên lãnh thổ Việt Nam.\n2. Căn cứ điều ước quốc tế mà Cộng hòa xã hội chủ nghĩa Việt Nam là thành viên, Bộ trưởng Bộ Giao thông vận tải quy\nđịnh cụ thể tuyến đường được vận chuyển hàng hoá quá cảnh.\n3. Trong thời gian quá cảnh, việc thay đổi tuyến đường được vận chuyển hàng hoá quá cảnh phải được sự đồng ý của Bộ trưởng Bộ Giao thông vận tải.\nĐiều 244. Quá cảnh bằng đường hàng không Quá cảnh bằng đường hàng không được thực hiện theo quy định của điều ước quốc tế về hàng không mà Cộng hòa xã hội chủ nghĩa Việt Nam là thành viên.\nĐiều 245. Giám sát hàng hóa quá cảnh Hàng hóa quá cảnh lãnh thổ Việt Nam phải chịu sự giám sát của cơ quan Hải quan Việt Nam trong toàn bộ thời gian quá cảnh.\nĐiều 246. Thời gian quá cảnh 1. Thời gian quá cảnh lãnh thổ Việt Nam tối đa là ba mươi ngày kể từ ngày hoàn thành thủ tục hải quan tại cửa khẩu nhập, trừ trường hợp hàng hóa được lưu kho tại Việt Nam hoặc bị hư hỏng, tổn thất trong quá trình quá cảnh.\n2. Đối với trường hợp hàng hóa được lưu kho tại Việt Nam hoặc bị hư hỏng, tổn thất trong thời gian quá cảnh cần phải có thêm thời gian để lưu kho, khắc phục hư hỏng, tổn thất thì thời gian quá cảnh\nđược gia hạn tương ứng với thời gian cần thiết để thực hiện các công việc đó và\nphải được cơ quan Hải quan nơi làm thủ tục quá cảnh chấp thuận; trường hợp hàng hóa quá cảnh theo giấy phép của Bộ trưởng Bộ Thương mại thì phải được Bộ trưởng Bộ Thương mại chấp thuận.\n3. Trong thời gian lưu kho và khắc phục hư hỏng, tổn thất quy định tại khoản 2 Điều này, hàng hóa và phương tiện vận tải chở hàng quá cảnh vẫn phải chịu sự giám sát của cơ quan Hải quan Việt Nam.\nĐiều 247. Hàng hoá quá cảnh tiêu thụ tại Việt Nam 1. Hàng hoá quá cảnh thuộc diện quy định tại điểm a và điểm b khoản 1 Điều 242 của Luật này không được phép tiêu thụ tại Việt Nam.\n2. Trừ trường hợp quy định tại khoản 1 Điều này, hàng hoá quá cảnh được phép tiêu thụ tại Việt Nam nếu được sự\nchấp thuận bằng văn bản của Bộ trưởng Bộ Thương mại.\n3. Việc tiêu thụ hàng hoá quá cảnh tại Việt Nam phải tuân theo quy định của pháp luật Việt Nam về nhập khẩu hàng hoá, thuế, phí, lệ phí và các nghĩa vụ tài chính khác.\nĐiều 248. Những hành vi bị cấm trong quá cảnh 1. Thanh toán thù lao quá cảnh bằng hàng hóa quá cảnh.\n2. Tiêu thụ trái phép hàng hóa,\nphương tiện vận tải chở hàng quá cảnh.\nĐiều 249. Dịch vụ quá cảnh hàng hóa Dịch vụ quá cảnh hàng hóa là hoạt\nđộng thương mại, theo đó thương nhân thực hiện việc quá cảnh cho hàng hóa thuộc sở hữu của tổ chức, cá nhân nước ngoài qua lãnh thổ Việt Nam để hưởng thù lao.\nĐiều 250. Điều kiện kinh doanh dịch vụ quá cảnh Thương nhân kinh doanh dịch vụ\nquá cảnh phải là doanh nghiệp có đăng ký kinh doanh dịch vụ vận tải, kinh doanh dịch vụ logistics theo quy định tại Điều 234 của Luật này.\nĐiều 251. Hợp đồng dịch vụ quá cảnh Hợp đồng dịch vụ quá cảnh phải được lập thành văn bản hoặc bằng hình thức khác có giá trị pháp lý tương đương.\nĐiều 252. Quyền và nghĩa vụ của bên thuê dịch vụ quá cảnh 1. Trừ trường hợp có thỏa thuận khác, bên thuê dịch vụ quá cảnh có các quyền sau đây:\na) Yêu cầu bên cung ứng dịch vụ\nquá cảnh tiếp nhận hàng hóa tại cửa khẩu nhập theo thời gian đã thỏa thuận;\nb) Yêu cầu bên cung ứng dịch vụ quá\ncảnh thông báo kịp thời về tình trạng của hàng hóa quá cảnh trong thời gian quá\ncảnh lãnh thổ Việt Nam;\nc) Yêu cầu bên cung ứng dịch vụ\nquá cảnh thực hiện mọi thủ tục cần thiết để hạn chế những tổn thất, hư hỏng đối với hàng hóa quá cảnh trong thời gian quá cảnh lãnh thổ Việt Nam.\n2. Trừ trường hợp có thỏa thuận khác, bên thuê dịch vụ quá cảnh có các nghĩa vụ sau đây:\na) Đưa hàng hóa đến cửa khẩu nhập của Việt Nam theo đúng thời gian đã thỏa thuận;\nb) Cung cấp đầy đủ cho bên cung ứng dịch vụ quá cảnh các thông tin cần thiết về hàng hóa;\nc) Cung cấp đầy đủ các chứng từ cần thiết để bên cung ứng dịch vụ quá cảnh làm thủ tục nhập khẩu, vận chuyển trong lãnh thổ Việt Nam và làm thủ tục xuất khẩu;\nd) Thanh toán thù lao quá cảnh và\ncác chi phí hợp lý khác cho bên cung ứng dịch vụ quá cảnh.\nĐiều 253. Quyền và nghĩa vụ của bên cung ứng dịch vụ quá cảnh 1. Trừ trường hợp có thỏa thuận khác, bên cung ứng dịch vụ quá cảnh có các quyền sau đây:\na) Yêu cầu bên thuê dịch vụ quá cảnh\nđưa hàng hóa đến cửa khẩu nhập của Việt Nam theo đúng thời gian đã thỏa thuận;\nb) Yêu cầu bên thuê dịch vụ quá cảnh cung cấp đầy đủ thông tin cần thiết về hàng hóa;\nc) Yêu cầu bên thuê dịch vụ quá cảnh cung cấp đầy đủ chứng từ cần thiết để làm thủ tục nhập khẩu, vận chuyển trong lãnh thổ Việt Nam và làm thủ tục xuất khẩu;\nd) Được nhận thù lao quá cảnh và\ncác chi phí hợp lý khác.\n2. Trừ trường hợp có thỏa thuận khác, bên cung ứng dịch vụ quá cảnh có các nghĩa vụ sau đây:\na) Tiếp nhận hàng hóa tại cửa khẩu nhập theo thời gian đã thỏa thuận;\nb) Làm thủ tục nhập khẩu và xuất khẩu hàng hóa quá cảnh ra khỏi lãnh thổ Việt Nam;\nc) Chịu trách nhiệm đối với hàng hóa quá cảnh trong thời gian quá cảnh lãnh thổ Việt Nam;\nd) Thực hiện các công việc cần thiết để hạn chế những tổn thất, hư hỏng đối với hàng hóa quá cảnh trong thời gian quá cảnh lãnh thổ Việt Nam;\nđ) Nộp phí, lệ phí và thực hiện các nghĩa vụ tài chính khác đối với hàng hóa quá cảnh theo quy định của pháp luật Việt Nam;\ne) Có trách nhiệm hợp tác với cơ\nquan nhà nước có thẩm quyền của Việt Nam để xử lý những vấn đề có liên quan đến hàng hóa quá cảnh.\nMỤC 6. DỊCH VỤ GIÁM ĐỊNH\nĐiều 254. Dịch vụ giám định Dịch vụ giám định là hoạt động thương mại, theo đó một thương nhân thực hiện những công việc cần thiết để xác\nđịnh tình trạng thực tế của hàng hoá, kết quả cung ứng dịch vụ và những nội dung khác theo yêu cầu của khách hàng.\nĐiều 255. Nội dung giám định Giám định bao gồm một hoặc một số\nnội dung về số lượng, chất lượng, bao bì, giá trị hàng hoá, xuất xứ hàng hoá, tổn thất, độ an toàn, tiêu chuẩn vệ sinh, phòng dịch, kết quả thực hiện dịch vụ,\nphương pháp cung ứng dịch vụ và các nội dung khác theo yêu cầu của khách hàng.\nĐiều 256. Thương nhân kinh doanh dịch vụ giám định thương mại Chỉ các thương nhân có đủ điều kiện theo quy định của pháp luật và được cấp giấy chứng nhận đăng ký kinh doanh dịch vụ giám định thương mại mới được phép thực hiện dịch vụ giám định và cấp chứng thư giám định.\nĐiều 257. Điều kiện kinh doanh dịch vụ giám định thương mại Thương nhân kinh doanh dịch vụ giám\nđịnh thương mại phải có đủ các điều kiện sau đây:\n1. Là doanh nghiệp được thành lập theo quy định của pháp luật;\n2. Có\ngiám định viên đủ tiêu chuẩn theo quy định tại Điều 259 của Luật này;\n3. Có khả năng thực hiện quy trình, phương pháp giám định hàng hoá, dịch vụ theo quy định của pháp luật,\ntiêu chuẩn quốc tế hoặc đã được các nước áp dụng một cách phổ biến trong giám định hàng hoá, dịch vụ đó.\nĐiều 258. Phạm vi kinh doanh dịch vụ giám định thương mại Thương nhân kinh doanh dịch vụ\ngiám định thương mại chỉ được cung cấp dịch vụ giám định trong các lĩnh vực giám định khi có đủ các điều kiện quy định tại khoản 2 và khoản 3 Điều 257 của Luật này.\nĐiều 259. Tiêu chuẩn giám định viên 1. Giám định viên phải có đủ các tiêu chuẩn sau đây:\na) Có trình độ đại học hoặc cao đẳng phù hợp với yêu cầu của lĩnh vực giám định;\nb) Có chứng chỉ chuyên môn về\nlĩnh vực giám định trong trường hợp pháp luật quy định phải có chứng chỉ chuyên môn;\nc) Có ít nhất ba năm công tác trong lĩnh vực giám định hàng hoá, dịch vụ.\n2. Căn cứ vào các tiêu chuẩn quy\nđịnh tại khoản 1 Điều này, giám đốc doanh nghiệp kinh doanh dịch vụ giám định công nhận giám định viên và chịu trách nhiệm trước pháp luật về quyết định của mình.\nĐiều 260. Chứng thư giám định 1. Chứng thư giám định là văn bản xác định tình trạng thực tế của hàng hóa, dịch vụ theo các nội dung giám định\nđược khách hàng yêu cầu.\n2. Chứng thư giám định phải có chữ\nký của người đại diện có thẩm quyền của thương nhân kinh doanh dịch vụ giám định,\nchữ ký, họ tên của giám định viên và phải được đóng dấu nghiệp vụ được đăng ký\ntại cơ quan có thẩm quyền.\n3. Chứng thư giám định chỉ có giá\ntrị đối với những nội dung được giám định.\n4. Thương nhân kinh doanh dịch vụ\ngiám định chịu trách nhiệm về tính chính xác của kết quả và kết luận trong Chứng thư giám định.\nĐiều 261. Giá trị pháp lý của chứng thư giám định đối với bên yêu cầu giám định Chứng thư giám định có giá trị\npháp lý đối với bên yêu cầu giám định nếu bên yêu cầu giám định không chứng minh được kết quả giám định không khách quan, không trung thực hoặc sai về kỹ\nthuật, nghiệp vụ giám định.\nĐiều 262. Giá trị pháp lý của chứng thư giám định đối với các bên trong hợp đồng 1. Trong trường hợp các bên có\nthoả thuận về việc sử dụng chứng thư giám định của một thương nhân kinh doanh dịch vụ giám định cụ thể thì chứng thư giám định đó có giá trị pháp lý đối với tất cả\ncác bên nếu không chứng minh được kết quả giám định không khách quan, không trung thực hoặc sai về kỹ thuật, nghiệp vụ giám định.\n2. Trong trường hợp các bên không có thoả thuận về việc sử dụng chứng thư giám định của một thương nhân kinh doanh dịch vụ giám định cụ thể thì chứng thư giám định chỉ có giá trị pháp lý đối với bên yêu cầu giám định theo quy định tại Điều 261 của Luật này. Bên kia trong hợp đồng có quyền yêu cầu giám định lại.\n3. Khi chứng thư giám định lại có\nkết quả khác với chứng thư giám định ban đầu thì xử lý như sau:\na) Trường hợp thương nhân kinh doanh dịch vụ giám định cấp chứng thư giám định ban đầu thừa nhận kết quả của chứng thư giám định lại thì kết quả của chứng thư giám định lại có giá trị pháp lý với tất cả các bên;\nb) Trường hợp thương nhân kinh doanh dịch vụ giám định cấp chứng thư giám định ban đầu không thừa nhận kết quả\ncủa chứng thư giám định lại thì các bên thoả thuận lựa chọn một thương nhân kinh doanh dịch vụ giám định khác giám định lại lần thứ hai. Kết quả giám định lại lần thứ hai có giá trị pháp lý với tất cả các bên.\nĐiều 263. Quyền và nghĩa vụ của thương nhân kinh doanh dịch vụ giám\nđịnh 1. Thương nhân kinh doanh dịch vụ\ngiám định có các quyền sau đây:\na) Yêu cầu khách hàng cung cấp đầy\nđủ, chính xác, kịp thời các tài liệu cần thiết để thực hiện dịch vụ giám định;\nb) Nhận thù lao dịch vụ giám định và các chi phí hợp lý khác.\n2. Thương nhân kinh doanh dịch vụ\ngiám định có các nghĩa vụ sau đây:\na) Chấp hành các tiêu chuẩn và\ncác quy định khác của pháp luật có liên quan đến dịch vụ giám định;\nb) Giám định trung thực, khách quan, độc lập, kịp thời, đúng quy trình, phương pháp giám định;\nc) Cấp chứng thư giám định;\nd) Trả tiền phạt vi phạm, bồi thường thiệt hại theo quy định tại Điều 266 của Luật này.\nĐiều 264. Quyền của khách hàng Trừ trường hợp có thoả thuận khác, khách hàng có các quyền sau đây:\n1. Yêu cầu thương nhân kinh doanh dịch vụ giám định thực hiện việc giám định theo nội dung đã thoả thuận;\n2. Yêu cầu giám định lại nếu có\nlý do chính đáng để cho rằng thương nhân kinh doanh dịch vụ giám định không thực hiện đúng các yêu cầu của mình hoặc thực hiện giám định thiếu khách quan, trung thực hoặc sai về kỹ thuật, nghiệp vụ giám định;\n3. Yêu cầu trả tiền phạt vi phạm,\nbồi thường thiệt hại theo quy định tại Điều 266 của Luật này.\nĐiều 265. Nghĩa vụ của khách hàng Trừ trường hợp có thoả thuận khác, khách hàng có các nghĩa vụ sau đây:\n1. Cung cấp đầy đủ, chính xác, kịp thời các tài liệu cần thiết cho thương nhân kinh doanh dịch vụ giám định khi có\nyêu cầu;\n2. Trả thù lao dịch vụ giám định và các chi phí hợp lý khác.\nĐiều 266. Phạt vi phạm, bồi thường thiệt hại trong trường hợp kết quả\ngiám định sai 1. Trường hợp thương nhân kinh doanh dịch vụ giám định cấp chứng thư giám định có kết quả sai do lỗi vô ý của mình thì phải trả tiền phạt cho khách hàng. Mức phạt do các bên thỏa thuận,\nnhưng không vượt quá mười lần thù lao dịch vụ giám định.\n2. Trường hợp thương nhân kinh doanh dịch vụ giám định cấp chứng thư giám định có kết quả sai do lỗi cố ý của mình thì phải bồi thường thiệt hại phát sinh cho khách hàng trực tiếp yêu cầu giám định.\n3. Khách hàng có nghĩa vụ chứng minh kết quả giám định sai và lỗi của thương nhân kinh doanh dịch vụ giám định.\nĐiều 267. Uỷ quyền giám định Trường hợp thương nhân kinh doanh dịch vụ giám định nước ngoài được thuê thực hiện giám định mà chưa được phép hoạt\nđộng tại Việt Nam thì thương nhân đó được ủy quyền cho thương nhân kinh doanh dịch vụ giám định đã được phép hoạt động tại Việt Nam thực hiện dịch vụ giám định nhưng vẫn phải chịu trách nhiệm về kết quả giám định.\nĐiều 268. Giám định theo yêu cầu của cơ quan nhà nước 1. Thương nhân kinh doanh dịch vụ\ngiám định có đủ điều kiện, tiêu chuẩn phù hợp với yêu cầu giám định có trách nhiệm giám định theo yêu cầu của cơ quan nhà nước.\n2. Cơ quan nhà nước yêu cầu giám\nđịnh có trách nhiệm trả thù lao giám định cho thương nhân kinh doanh dịch vụ\ngiám định theo thỏa thuận giữa hai bên trên cơ sở giá thị trường.\nMỤC 7. CHO THUÊ HÀNG HÓA\nĐiều 269. Cho thuê hàng hoá\nCho thuê hàng hoá là hoạt động thương mại, theo đó một bên chuyển quyền chiếm hữu và sử dụng hàng hoá (gọi là\nbên cho thuê) cho bên khác (gọi là bên thuê) trong một thời hạn nhất định để nhận tiền cho thuê.\nĐiều 270. Quyền và nghĩa vụ của bên cho thuê\nTrừ trường hợp có thoả thuận khác, bên cho thuê có các quyền và nghĩa vụ sau đây:\n1. Giao hàng hoá cho thuê theo\nđúng hợp đồng cho thuê với bên thuê;\n2. Bảo đảm cho bên thuê quyền chiếm hữu và sử dụng hàng hoá cho thuê không bị tranh chấp bởi bên thứ ba liên quan trong thời gian thuê;\n3. Bảo đảm hàng hoá cho thuê phù\nhợp với mục đích sử dụng của bên thuê theo thoả thuận của các bên;\n4. Bảo dưỡng và sửa chữa hàng hóa cho thuê trong thời hạn hợp lý. Trường hợp việc sửa chữa và bảo dưỡng hàng hóa cho thuê gây phương hại đến việc sử dụng hàng hóa đó của bên thuê thì phải có\ntrách nhiệm giảm giá thuê hoặc kéo dài thời hạn cho thuê tương ứng với thời gian bảo dưỡng, sửa chữa;\n5. Nhận tiền cho thuê theo thoả\nthuận hoặc theo quy định của pháp luật;\n6. Nhận lại hàng hoá cho thuê khi kết thúc thời hạn cho thuê.\nĐiều 271. Quyền và nghĩa vụ của bên thuê\nTrừ trường hợp có thoả thuận khác, bên thuê có các quyền và nghĩa vụ sau đây:\n1. Chiếm hữu và sử dụng hàng hoá\ncho thuê theo hợp đồng cho thuê và theo quy định của pháp luật. Trong trường hợp không có thỏa thuận cụ thể về cách thức sử dụng hàng hóa cho thuê thì hàng hóa cho thuê phải được sử dụng theo cách thức phù hợp với tính chất của hàng hóa\nđó;\n2. Giữ gìn và bảo quản hàng hoá\ncho thuê trong thời hạn thuê và trả lại hàng hoá đó cho bên cho thuê khi hết thời hạn;\n3. Yêu cầu bên cho thuê thực hiện việc bảo dưỡng, sửa chữa hàng hóa; nếu bên cho thuê không thực hiện nghĩa vụ\nnày trong một thời hạn hợp lý thì bên thuê có thể tiến hành bảo dưỡng, sửa chữa hàng hóa cho thuê và bên cho thuê phải chịu các chi phí hợp lý của việc bảo dưỡng,\nsửa chữa đó;\n4. Trả tiền thuê hàng hoá theo thoả thuận hoặc theo quy định của pháp luật;\n5. Không được bán, cho thuê lại hàng hoá đã thuê.\nĐiều 272. Sửa chữa, thay đổi tình trạng ban đầu của hàng hóa cho thuê\n1. Bên thuê không được sửa chữa,\nthay đổi tình trạng ban đầu của hàng hóa cho thuê nếu không được bên cho thuê\nchấp thuận.\n2. Trường hợp bên thuê thực hiện việc sửa chữa, thay đổi tình trạng ban đầu của hàng hóa cho thuê mà không có sự\nchấp thuận của bên cho thuê thì bên cho thuê có quyền yêu cầu bên thuê khôi phục lại tình trạng ban đầu của hàng hóa cho thuê hoặc yêu cầu bồi thường thiệt hại.\nĐiều 273. Trách nhiệm đối với tổn thất trong thời hạn thuê\n1. Trừ trường hợp có thoả thuận khác, bên cho thuê phải chịu tổn thất đối với hàng hoá cho thuê trong thời hạn thuê nếu bên thuê không có lỗi gây ra tổn thất đó.\n2. Trong trường hợp quy định tại khoản 1 Điều này, bên cho thuê có trách nhiệm sửa chữa hàng hoá cho thuê trong thời hạn hợp lý để bảo đảm mục đích sử dụng của bên thuê.\nĐiều 274. Chuyển rủi ro đối với hàng hóa cho thuê\nTrường hợp các bên có thỏa thuận về việc chuyển rủi ro cho bên thuê nhưng không xác định thời điểm chuyển rủi ro thì thời điểm chuyển rủi ro được xác định như sau:\n1. Trường hợp hợp đồng cho thuê\ncó liên quan đến việc vận chuyển hàng hoá:\na) Nếu hợp đồng không yêu cầu giao hàng hoá cho thuê tại một địa điểm cụ thể thì rủi ro sẽ chuyển cho bên thuê khi hàng hoá cho thuê được giao cho người vận chuyển đầu tiên;\nb) Nếu hợp đồng yêu cầu phải giao hàng hoá cho thuê tại một địa điểm cụ thể thì rủi ro chuyển cho bên thuê hoặc người được bên thuê ủy quyền nhận hàng tại địa điểm đó;\n2. Trường hợp hàng hoá cho thuê\nđược nhận bởi người nhận hàng để giao mà không phải là người vận chuyển thì rủi ro chuyển cho bên thuê khi người nhận hàng xác nhận quyền chiếm hữu hàng hoá\ncho thuê của bên thuê;\n3. Trong các trường hợp khác không được quy định tại khoản 1 và khoản 2 Điều này thì rủi ro được chuyển cho bên thuê khi bên thuê nhận hàng hoá cho thuê.\nĐiều 275. Hàng hoá cho thuê không phù hợp với hợp đồng Trường hợp không có thỏa thuận cụ\nthể, hàng hoá được coi là không phù hợp với hợp đồng khi hàng hoá đó thuộc một trong các trường hợp sau đây:\n1. Không phù hợp với mục đích sử\ndụng thông thường của các hàng hoá cùng chủng loại;\n2. Không phù hợp với mục đích cụ\nthể mà bên thuê đã cho bên cho thuê biết hoặc bên cho thuê phải biết vào thời\nđiểm giao kết hợp đồng;\n3. Không bảo đảm chất lượng như\nchất lượng của mẫu hàng mà bên cho thuê đã giao cho bên thuê.\nĐiều 276. Từ chối nhận hàng 1. Bên cho thuê phải dành cho bên thuê một thời gian hợp lý sau khi nhận được hàng hoá để kiểm tra.\n2. Bên thuê có quyền từ chối nhận hàng hoá trong các trường hợp sau đây:\na) Bên cho thuê không dành cho bên thuê điều kiện, thời gian hợp lý để kiểm tra hàng hoá;\nb) Khi kiểm tra hàng hóa, bên thuê phát hiện thấy hàng hoá không phù hợp với hợp đồng.\nĐiều 277. Khắc phục, thay thế hàng hoá cho thuê không phù hợp với hợp\nđồng 1. Trong trường hợp bên thuê từ\nchối nhận hàng hoá cho thuê do không phù hợp với hợp đồng, nếu thời hạn thực hiện việc giao hàng vẫn còn thì bên cho thuê có thể thông báo ngay cho bên thuê về\nviệc khắc phục hoặc thay thế hàng hoá và thực hiện việc khắc phục hoặc thay thế\nhàng hoá đó trong khoảng thời gian còn lại.\n2. Khi bên cho thuê thực hiện việc khắc phục quy định tại khoản 1 Điều này mà gây bất lợi hoặc làm phát sinh chi phí bất hợp lý cho bên thuê thì bên thuê có quyền yêu cầu bên cho thuê khắc phục bất lợi hoặc trả chi phí phát sinh đó.\nĐiều 278. Chấp nhận hàng hoá cho thuê\n1. Bên thuê được coi là đã chấp nhận hàng hoá cho thuê sau khi bên thuê có cơ hội hợp lý để kiểm tra hàng hoá\ncho thuê và thực hiện một trong các hành vi sau đây:\na) Không từ chối hàng hoá cho thuê;\nb) Xác nhận sự phù hợp của hàng hoá cho thuê với thoả thuận trong hợp đồng;\nc) Xác nhận việc sẽ nhận hàng hoá\nđó, dù không phù hợp với thoả thuận trong hợp đồng.\n2. Trường hợp bên thuê phát hiện ra sự không phù hợp với hợp đồng của hàng hóa sau khi đã chấp nhận hàng hóa mà\nsự không phù hợp đó có thể được xác định thông qua việc kiểm tra một cách hợp lý trước khi chấp nhận hàng hóa thì bên thuê không được dựa vào sự không phù hợp\nđó để trả lại hàng.\nĐiều 279. Rút lại chấp nhận 1. Bên thuê có thể rút lại chấp nhận đối với một phần hoặc toàn bộ hàng hoá cho thuê nếu sự không phù hợp của hàng hoá cho thuê làm cho bên thuê không đạt được mục đích giao kết hợp đồng và\nthuộc một trong các trường hợp sau đây:\na) Bên cho thuê không khắc phục một cách hợp lý theo quy định tại Điều 277 của Luật này;\nb) Bên thuê không phát hiện được sự không phù hợp của hàng hoá xuất phát từ bảo đảm của bên cho thuê.\n2. Việc rút lại chấp nhận phải được thực hiện trong khoảng thời gian hợp lý, nhưng không quá ba tháng, kể từ thời\nđiểm bên thuê chấp nhận hàng hoá.\nĐiều 280. Trách nhiệm đối với khiếm khuyết của hàng hoá cho thuê\nTrừ trường hợp có thoả thuận khác, trách nhiệm đối với khiếm khuyết của hàng hoá cho thuê được quy định như\nsau:\n1. Trong thời hạn thuê, bên cho thuê phải chịu trách nhiệm về bất kỳ khiếm khuyết nào của hàng hoá cho thuê đã\ncó vào thời điểm hàng hóa được giao cho bên thuê, trừ trường hợp quy định tại khoản 2 và khoản 3 Điều này;\n2. Bên cho thuê không chịu trách nhiệm về bất kỳ khiếm khuyết nào của hàng hoá đã có trước thời điểm giao kết hợp\nđồng mà bên thuê đã biết hoặc phải biết về những khiếm khuyết đó;\n3. Bên cho thuê không chịu trách nhiệm đối với những khiếm khuyết của hàng hoá được phát hiện sau khi bên thuê\nchấp nhận hàng hoá cho thuê mà khiếm khuyết đó có thể được bên thuê phát hiện nếu thực hiện việc kiểm tra một cách hợp lý trước khi chấp nhận hàng hóa;\n4. Bên cho thuê phải chịu trách nhiệm về bất kỳ khiếm khuyết nào phát sinh sau thời điểm chuyển rủi ro nếu khiếm khuyết đó xuất phát từ việc bên cho thuê vi phạm nghĩa vụ đã cam kết của mình.\nĐiều 281. Cho thuê lại 1. Bên thuê chỉ được cho thuê lại hàng hoá khi có sự chấp thuận của bên cho thuê. Bên thuê phải chịu trách nhiệm về hàng hoá cho thuê lại trừ trường hợp có thoả thuận khác với bên cho thuê.\n2. Trong trường hợp bên thuê cho thuê lại hàng hóa cho thuê mà không có sự chấp thuận của bên cho thuê thì bên cho thuê có quyền hủy hợp đồng cho thuê. Người thuê lại phải có trách nhiệm trả\nlại ngay hàng hóa cho bên cho thuê.\nĐiều 282. Lợi ích phát sinh trong thời hạn thuê\nTrừ trường hợp có thỏa thuận khác, mọi lợi ích phát sinh từ hàng hóa cho thuê trong thời hạn thuê thuộc về\nbên thuê.\nĐiều 283. Thay đổi quyền sở hữu trong thời hạn thuê\nMọi thay đổi về quyền sở hữu đối với hàng hóa cho thuê không ảnh hưởng đến hiệu lực của hợp đồng cho thuê.\nMỤC 8. NHƯỢNG QUYỀN THƯƠNG MẠI\nĐiều 284. Nhượng quyền thương mại Nhượng quyền thương mại là hoạt động thương mại, theo đó bên nhượng quyền cho phép và yêu cầu bên nhận quyền tự mình tiến hành việc mua bán hàng hoá, cung ứng dịch vụ theo các điều kiện sau đây:\n1. Việc mua bán hàng hoá, cung ứng dịch vụ được tiến hành theo cách thức tổ chức kinh doanh do bên nhượng quyền quy định và được gắn với nhãn hiệu hàng hoá, tên thương mại, bí quyết kinh doanh, khẩu hiệu kinh doanh, biểu tượng kinh doanh, quảng cáo của bên nhượng quyền;\n2. Bên nhượng quyền có quyền kiểm soát và trợ giúp cho bên nhận quyền trong việc điều hành công việc kinh doanh.\nĐiều 285. Hợp đồng nhượng quyền thương mại Hợp đồng nhượng quyền thương mại phải được lập thành văn bản hoặc bằng hình thức khác có giá trị pháp lý tương\nđương.\nĐiều 286. Quyền của thương nhân nhượng quyền Trừ trường hợp có thỏa thuận khác, thương nhân nhượng quyền có các quyền sau đây:\n1. Nhận tiền nhượng quyền;\n2. Tổ chức quảng cáo cho hệ thống nhượng quyền thương mại và mạng lưới nhượng quyền thương mại;\n3. Kiểm tra định kỳ hoặc đột xuất hoạt động của bên nhận quyền nhằm bảo đảm sự thống nhất của hệ thống nhượng quyền thương mại và sự ổn định về chất lượng hàng hoá, dịch vụ.\nĐiều 287. Nghĩa vụ của thương nhân nhượng quyền Trừ trường hợp có thỏa thuận khác, thương nhân nhượng quyền có các nghĩa vụ sau đây:\n1. Cung cấp tài liệu hướng dẫn về\nhệ thống nhượng quyền thương mại cho bên nhận quyền;\n2. Đào tạo ban đầu và cung cấp trợ\ngiúp kỹ thuật thường xuyên cho thương nhân nhận quyền để điều hành hoạt động theo đúng hệ thống nhượng quyền thương mại;\n3. Thiết kế và sắp xếp địa điểm bán hàng, cung ứng dịch vụ bằng chi phí của thương nhân nhận quyền;\n4. Bảo đảm quyền sở hữu trí tuệ đối với đối tượng được ghi trong hợp đồng nhượng quyền;\n5. Đối xử bình đẳng với các thương nhân nhận quyền trong hệ thống nhượng quyền thương mại.\nĐiều 288. Quyền của thương nhân nhận quyền Trừ trường hợp có thỏa thuận khác, thương nhân nhận quyền có các quyền sau đây:\n1. Yêu cầu thương nhân nhượng quyền cung cấp đầy đủ trợ giúp kỹ thuật có liên quan đến hệ thống nhượng quyền thương mại;\n2. Yêu cầu thương nhân nhượng quyền\nđối xử bình đẳng với các thương nhân nhận quyền khác trong hệ thống nhượng quyền thương mại.\nĐiều 289. Nghĩa vụ của thương nhân nhận quyền Trừ trường hợp có thỏa thuận khác,\nthương nhân nhận quyền có các nghĩa vụ sau đây:\n1. Trả tiền nhượng quyền và các khoản thanh toán khác theo hợp đồng nhượng quyền thương mại;\n2. Đầu tư đủ cơ sở vật chất, nguồn tài chính và nhân lực để tiếp nhận các quyền và bí quyết kinh doanh mà bên nhượng quyền chuyển giao;\n3. Chấp nhận sự kiểm soát, giám sát và hướng dẫn của bên nhượng quyền; tuân thủ các yêu cầu về thiết kế, sắp xếp\nđịa điểm bán hàng, cung ứng dịch vụ của thương nhân nhượng quyền;\n4. Giữ bí mật về bí quyết kinh doanh đã được nhượng quyền, kể cả sau khi hợp đồng nhượng quyền thương mại kết thúc hoặc chấm dứt;\n5. Ngừng sử dụng nhãn hiệu hàng hoá, tên thương mại, khẩu hiệu kinh doanh, biểu tượng kinh doanh và các quyền sở\nhữu trí tuệ khác (nếu có) hoặc hệ thống của bên nhượng quyền khi kết thúc hoặc chấm dứt hợp đồng nhượng quyền thương mại;\n6. Điều hành hoạt động phù hợp với hệ thống nhượng quyền thương mại;\n7. Không được nhượng quyền lại trong trường hợp không có sự chấp thuận của bên nhượng quyền.\nĐiều 290. Nhượng quyền lại cho bên thứ ba 1. Bên nhận quyền có quyền nhượng quyền lại cho bên thứ ba (gọi là bên nhận lại quyền) nếu được sự chấp thuận của bên nhượng quyền.\n2. Bên nhận lại quyền có các quyền và nghĩa vụ của bên nhận quyền quy định tại Điều 288 và Điều 289 của Luật này.\nĐiều 291. Đăng ký nhượng quyền thương mại 1. Trước khi nhượng quyền thương mại, bên dự kiến nhượng quyền phải đăng ký với Bộ Thương mại.\n2. Chính phủ quy định chi tiết điều kiện kinh doanh theo phương thức nhượng quyền thương mại và trình tự, thủ tục\nđăng ký nhượng quyền thương mại.\nChương VII CHẾ TÀI TRONG THƯƠNG MẠI VÀ GIẢI QUYẾT TRANH CHẤP TRONG THƯƠNG MẠI MỤC 1. CHẾ TÀI TRONG THƯƠNG MẠI\nĐiều 292. Các loại chế tài trong thương mại 1. Buộc thực hiện đúng hợp đồng.\n2. Phạt vi phạm.\n3. Buộc bồi thường thiệt hại.\n4. Tạm ngừng thực hiện hợp đồng.\n5. Đình chỉ thực hiện hợp đồng.\n6. Huỷ bỏ hợp đồng.\n7. Các biện pháp khác do các bên thoả thuận không trái với nguyên tắc cơ bản của pháp luật Việt Nam, điều ước quốc tế mà Cộng hòa xã hội chủ nghĩa Việt Nam là thành viên và tập quán thương mại quốc tế.\nĐiều 293. Áp dụng chế tài trong thương mại đối với vi phạm không cơ\nbản Trừ trường hợp có thoả thuận khác, bên bị vi phạm không được áp dụng chế tài tạm ngừng thực hiện hợp đồng,\nđình chỉ thực hiện hợp đồng hoặc huỷ bỏ hợp đồng đối với vi phạm không cơ bản.\nĐiều 294. Các trường hợp miễn trách nhiệm đối với hành vi vi phạm 1. Bên vi phạm hợp đồng được miễn trách nhiệm trong các trường hợp sau đây:\na) Xảy ra trường hợp miễn trách nhiệm mà các bên đã thoả thuận;\nb) Xảy ra sự kiện bất khả kháng;\nc) Hành vi vi phạm của một bên hoàn toàn do lỗi của bên kia;\nd) Hành vi vi phạm của một bên do thực hiện quyết định của cơ quan quản lý nhà nước có thẩm quyền mà các bên không thể biết được vào thời điểm giao kết hợp đồng.\n2. Bên vi phạm hợp đồng có nghĩa vụ chứng minh các trường hợp miễn trách nhiệm.\nĐiều 295. Thông báo và xác nhận trường hợp miễn trách nhiệm 1. Bên vi phạm hợp đồng phải thông báo ngay bằng văn bản cho bên kia về trường hợp được miễn trách nhiệm và\nnhững hậu quả có thể xảy ra.\n2. Khi trường hợp miễn trách nhiệm chấm dứt, bên vi phạm hợp đồng phải thông báo ngay cho bên kia biết; nếu bên vi phạm không thông báo hoặc thông báo không kịp thời cho bên kia thì phải bồi thường thiệt hại.\n3. Bên vi phạm có nghĩa vụ chứng minh với bên bị vi phạm về trường hợp miễn trách nhiệm của mình.\nĐiều 296. Kéo dài thời hạn, từ chối thực hiện hợp đồng trong trường hợp bất khả kháng 1. Trong trường hợp bất khả\nkháng, các bên có thể thoả thuận kéo dài thời hạn thực hiện nghĩa vụ hợp đồng;\nnếu các bên không có thoả thuận hoặc không thỏa thuận được thì thời hạn thực hiện nghĩa vụ hợp đồng được tính thêm một thời gian bằng thời gian xảy ra trường hợp bất khả kháng cộng với thời gian hợp lý để khắc phục hậu quả, nhưng không được kéo dài quá các thời hạn sau đây:\na) Năm tháng đối với hàng hoá, dịch vụ mà thời hạn giao hàng, cung ứng dịch vụ được thoả thuận không quá mười hai tháng, kể từ khi giao kết hợp đồng;\nb) Tám tháng đối với hàng hoá, dịch vụ mà thời hạn giao hàng, cung ứng dịch vụ được thoả thuận trên mười hai tháng,\nkể từ khi giao kết hợp đồng.\n2. Trường hợp kéo dài quá các thời hạn quy định tại khoản 1 Điều này, các bên có quyền từ chối thực hiện hợp đồng và không bên nào có quyền yêu cầu bên kia bồi thường thiệt hại.\n3. Trường hợp từ chối thực hiện hợp\nđồng thì trong thời hạn không quá mười ngày, kể từ ngày kết thúc thời hạn quy định tại khoản 1 Điều này bên từ chối phải thông báo cho bên kia biết trước khi bên kia bắt đầu thực hiện các nghĩa vụ hợp đồng.\n4. Việc kéo dài thời hạn thực hiện nghĩa vụ hợp đồng quy định tại khoản 1 Điều này không áp dụng đối với hợp đồng mua bán hàng hóa, cung ứng dịch vụ có thời hạn cố định về giao hàng hoặc hoàn thành dịch vụ.\nĐiều 297. Buộc thực hiện đúng hợp đồng 1. Buộc thực hiện đúng hợp đồng là việc bên bị vi phạm yêu cầu bên vi phạm thực hiện đúng hợp đồng hoặc dùng các biện pháp khác để hợp đồng được thực hiện và bên vi phạm phải chịu chi phí\nphát sinh.\n2. Trường hợp bên vi phạm giao thiếu hàng hoặc cung ứng dịch vụ không đúng hợp đồng thì phải giao đủ hàng hoặc cung ứng dịch vụ theo đúng thoả thuận trong hợp đồng. Trường hợp bên vi phạm giao hàng hoá, cung ứng dịch vụ kém chất lượng thì phải loại trừ khuyết tật của hàng hoá, thiếu sót của dịch vụ hoặc giao hàng khác thay thế, cung ứng dịch vụ theo\nđúng hợp đồng. Bên vi phạm không được dùng tiền hoặc hàng khác chủng loại, loại dịch vụ khác để thay thế nếu không được sự chấp thuận của bên bị vi phạm.\n3. Trong trường hợp bên vi phạm không thực hiện theo quy định tại khoản 2 Điều này thì bên bị vi phạm có quyền mua hàng, nhận cung ứng dịch vụ của người khác để thay thế theo đúng loại hàng hoá, dịch vụ ghi trong hợp đồng và bên vi phạm phải trả khoản tiền chênh lệch và các chi phí liên quan nếu có; có quyền tự sửa chữa khuyết tật của hàng hoá,\nthiếu sót của dịch vụ và bên vi phạm phải trả các chi phí thực tế hợp lý.\n4. Bên bị vi phạm phải nhận hàng,\nnhận dịch vụ và thanh toán tiền hàng, thù lao dịch vụ, nếu bên vi phạm đã thực hiện đầy đủ nghĩa vụ theo quy định tại khoản 2 Điều này.\n5. Trường hợp bên vi phạm là bên mua thì bên bán có quyền yêu cầu bên mua trả tiền, nhận hàng hoặc thực hiện các nghĩa vụ khác của bên mua được quy định trong hợp đồng và trong Luật này.\nĐiều 298. Gia hạn thực hiện nghĩa vụ\nTrường hợp buộc thực hiện đúng hợp\nđồng, bên bị vi phạm có thể gia hạn một thời gian hợp lý để bên vi phạm thực hiện nghĩa vụ hợp đồng.\nĐiều 299. Quan hệ giữa chế tài buộc thực hiện đúng hợp đồng và các loại chế tài khác 1. Trừ trường hợp có thoả thuận khác, trong thời gian áp dụng chế tài buộc thực hiện đúng hợp đồng, bên bị vi phạm có quyền yêu cầu bồi thường thiệt hại và phạt vi phạm nhưng không được áp dụng các chế tài khác.\n2. Trường hợp bên vi phạm không thực hiện chế tài buộc thực hiện đúng hợp đồng trong thời hạn mà bên bị vi phạm\nấn định, bên bị vi phạm được áp dụng các chế tài khác để bảo vệ quyền lợi chính\nđáng của mình.\nĐiều 300. Phạt vi phạm Phạt vi phạm là việc bên bị vi phạm yêu cầu bên vi phạm trả một khoản tiền phạt do vi phạm hợp đồng nếu trong hợp đồng có thoả thuận, trừ các trường hợp miễn trách nhiệm quy định tại Điều 294 của Luật này.\nĐiều 301. Mức phạt vi phạm Mức phạt đối với vi phạm nghĩa vụ\nhợp đồng hoặc tổng mức phạt đối với nhiều vi phạm do các bên thoả thuận trong hợp\nđồng, nhưng không quá 8% giá trị phần nghĩa vụ hợp đồng bị vi phạm, trừ trường hợp quy định tại Điều 266 của Luật này.\nĐiều 302. Bồi thường thiệt hại 1. Bồi thường thiệt hại là việc bên vi phạm bồi thường những tổn thất do hành vi vi phạm hợp đồng gây ra cho bên bị vi phạm.\n2. Giá trị bồi thường thiệt hại bao gồm giá trị tổn thất thực tế, trực tiếp mà bên bị vi phạm phải chịu do bên vi phạm gây ra và khoản lợi trực tiếp mà bên bị vi phạm đáng lẽ được hưởng nếu không có hành vi vi phạm.\nĐiều 303. Căn cứ phát sinh trách nhiệm bồi thường thiệt hại Trừ các trường hợp miễn trách nhiệm quy định tại Điều 294 của Luật này, trách nhiệm bồi thường thiệt hại phát sinh khi có đủ các yếu tố sau đây:\n1. Có hành vi vi phạm hợp đồng;\n2. Có thiệt hại thực tế;\n3. Hành vi vi phạm hợp đồng là\nnguyên nhân trực tiếp gây ra thiệt hại.\nĐiều 304. Nghĩa vụ chứng minh tổn thất Bên yêu cầu bồi thường thiệt hại phải chứng minh tổn thất, mức độ tổn thất do hành vi vi phạm gây ra và khoản lợi trực tiếp mà bên bị vi phạm đáng lẽ được hưởng nếu không có hành vi vi phạm.\nĐiều 305. Nghĩa vụ hạn chế tổn thất Bên yêu cầu bồi thường thiệt hại phải áp dụng các biện pháp hợp lý để hạn chế tổn thất kể cả tổn thất đối với khoản lợi trực tiếp đáng lẽ được hưởng do hành vi vi phạm hợp đồng gây ra; nếu bên yêu cầu bồi thường thiệt hại không áp dụng các biện pháp đó, bên vi phạm hợp\nđồng có quyền yêu cầu giảm bớt giá trị bồi thường thiệt hại bằng mức tổn thất\nđáng lẽ có thể hạn chế được.\nĐiều 306. Quyền yêu cầu tiền lãi do chậm thanh toán Trường hợp bên vi phạm hợp đồng chậm thanh toán tiền hàng hay chậm thanh toán thù lao dịch vụ và các chi phí hợp lý khác thì bên bị vi phạm hợp đồng có quyền yêu cầu trả\ntiền lãi trên số tiền chậm trả đó theo lãi suất nợ quá hạn trung bình trên thị\ntrường tại thời điểm thanh toán tương ứng với thời gian chậm trả, trừ trường hợp có thoả thuận khác hoặc pháp luật có quy định khác.\nĐiều 307. Quan hệ giữa chế tài phạt vi phạm và chế tài bồi thường thiệt hại 1. Trường hợp các bên không có thỏa thuận phạt vi phạm thì bên bị vi phạm chỉ có quyền yêu cầu bồi thường thiệt hại,\ntrừ trường hợp Luật này có quy định khác.\n2. Trường hợp các bên có thỏa thuận phạt vi phạm thì bên bị vi phạm có quyền áp dụng cả chế tài phạt vi phạm và buộc bồi thường thiệt hại, trừ trường hợp Luật này có quy định khác.\nĐiều 308. Tạm ngừng thực hiện hợp đồng Trừ các trường hợp miễn trách nhiệm quy định tại Điều 294 của Luật này, tạm ngừng thực hiện hợp\nđồng là việc một bên tạm thời không thực hiện nghĩa vụ trong hợp đồng thuộc một trong các trường hợp sau đây:\n1. Xảy ra hành vi vi phạm mà các bên đã thoả thuận là điều kiện để tạm ngừng thực hiện hợp đồng;\n2. Một bên vi phạm cơ bản nghĩa vụ\nhợp đồng.\nĐiều 309. Hậu quả pháp lý của việc tạm ngừng thực hiện hợp đồng 1. Khi hợp đồng bị tạm ngừng thực hiện thì hợp đồng vẫn còn hiệu lực.\n2. Bên bị vi phạm có quyền yêu cầu bồi thường thiệt hại theo quy định của Luật này.\nĐiều 310. Đình chỉ thực hiện hợp đồng Trừ các trường hợp miễn trách nhiệm quy định tại Điều 294 của Luật này, đình chỉ thực hiện hợp\nđồng là việc một bên chấm dứt thực hiện nghĩa vụ hợp đồng thuộc một trong các trường hợp sau đây:\n1. Xảy ra hành vi vi phạm mà các bên đã thoả thuận là điều kiện để đình chỉ hợp đồng;\n2. Một bên vi phạm cơ bản nghĩa vụ\nhợp đồng.\nĐiều 311. Hậu quả pháp lý của việc đình chỉ thực hiện hợp đồng 1. Khi hợp đồng bị đình chỉ thực hiện thì hợp đồng chấm dứt từ thời điểm một bên nhận được thông báo đình chỉ.\nCác bên không phải tiếp tục thực hiện nghĩa vụ hợp đồng. Bên đã thực hiện nghĩa vụ có quyền yêu cầu bên kia thanh toán hoặc thực hiện nghĩa vụ đối ứng.\n2. Bên bị vi phạm có quyền yêu cầu bồi thường thiệt hại theo quy định của Luật này.\nĐiều 312. Huỷ bỏ hợp đồng 1. Huỷ bỏ hợp đồng bao gồm hủy bỏ\ntoàn bộ hợp đồng và hủy bỏ một phần hợp đồng.\n2. Hủy bỏ toàn bộ hợp đồng là việc bãi bỏ hoàn toàn việc thực hiện tất cả các nghĩa vụ hợp đồng đối với toàn bộ hợp\nđồng.\n3. Hủy bỏ một phần hợp đồng là việc bãi bỏ thực hiện một phần nghĩa vụ hợp đồng, các phần còn lại trong hợp đồng vẫn còn hiệu lực.\n4. Trừ các trường hợp miễn trách nhiệm quy định tại Điều 294 của Luật này, chế tài hủy bỏ hợp\nđồng được áp dụng trong các trường hợp sau đây:\na) Xảy ra hành vi vi phạm mà các bên đã thoả thuận là điều kiện để hủy bỏ hợp đồng;\nb) Một bên vi phạm cơ bản nghĩa vụ\nhợp đồng.\nĐiều 313. Huỷ bỏ hợp đồng trong trường hợp giao hàng, cung ứng dịch vụ từng phần 1. Trường hợp có thoả thuận về\ngiao hàng, cung ứng dịch vụ từng phần, nếu một bên không thực hiện nghĩa vụ của mình trong việc giao hàng, cung ứng dịch vụ và việc này cấu thành một vi phạm cơ bản đối với lần giao hàng, cung ứng dịch vụ đó thì bên kia có quyền tuyên bố\nhuỷ bỏ hợp đồng đối với lần giao hàng, cung ứng dịch vụ.\n2. Trường hợp một bên không thực hiện nghĩa vụ đối với một lần giao hàng, cung ứng dịch vụ là cơ sở để bên kia kết luận rằng vi phạm cơ bản sẽ xảy ra đối với những lần giao hàng, cung ứng dịch vụ\nsau đó thì bên bị vi phạm có quyền tuyên bố huỷ bỏ hợp đồng đối với những lần giao hàng, cung ứng dịch vụ sau đó, với điều kiện là bên đó phải thực hiện quyền này trong thời gian hợp lý.\n3. Trường hợp một bên đã tuyên bố\nhuỷ bỏ hợp đồng đối với một lần giao hàng, cung ứng dịch vụ thì bên đó vẫn có\nquyền tuyên bố huỷ bỏ hợp đồng đối với những lần giao hàng, cung ứng dịch vụ đã\nthực hiện hoặc sẽ thực hiện sau đó nếu mối quan hệ qua lại giữa các lần giao hàng dẫn đến việc hàng hoá đã giao, dịch vụ đã cung ứng không thể được sử dụng theo đúng mục đích mà các bên đã dự kiến vào thời điểm giao kết hợp đồng.\nĐiều 314. Hậu quả pháp lý của việc huỷ bỏ hợp đồng 1. Trừ trường hợp quy định tại Điều 313 của Luật này, sau khi huỷ bỏ hợp đồng, hợp đồng không có hiệu lực từ thời điểm giao kết, các bên không phải tiếp tục thực hiện các nghĩa vụ đã thoả thuận trong hợp đồng, trừ thỏa thuận về các quyền và nghĩa vụ\nsau khi huỷ bỏ hợp đồng và về giải quyết tranh chấp.\n2. Các bên có quyền đòi lại lợi\ních do việc đã thực hiện phần nghĩa vụ của mình theo hợp đồng; nếu các bên đều có nghĩa vụ hoàn trả thì nghĩa vụ của họ phải được thực hiện đồng thời; trường hợp không thể hoàn trả bằng chính lợi ích đã nhận thì bên có nghĩa vụ phải hoàn trả bằng tiền.\n3. Bên bị vi phạm có quyền yêu cầu bồi thường thiệt hại theo quy định của Luật này.\nĐiều 315. Thông báo tạm ngừng thực hiện hợp đồng, đình chỉ thực hiện hợp đồng hoặc huỷ bỏ hợp đồng Bên tạm ngừng thực hiện hợp đồng,\nđình chỉ thực hiện hợp đồng hoặc huỷ bỏ hợp đồng phải thông báo ngay cho bên kia biết về việc tạm ngừng, đình chỉ hoặc huỷ bỏ hợp đồng. Trong trường hợp không thông báo ngay mà gây thiệt hại cho bên kia thì bên tạm ngừng thực hiện hợp\nđồng, đình chỉ thực hiện hợp đồng hoặc huỷ bỏ hợp đồng phải bồi thường thiệt hại.\nĐiều 316. Quyền yêu cầu bồi thường thiệt hại khi đã áp dụng các chế\ntài khác Một bên không bị mất quyền yêu cầu bồi thường thiệt hại đối với tổn thất do vi phạm hợp đồng của bên kia khi đã áp dụng các chế tài khác.\nMỤC 2. GIẢI QUYẾT TRANH CHẤP TRONG THƯƠNG MẠI\nĐiều 317. Hình thức giải quyết tranh chấp 1. Thương lượng giữa các bên.\n2. Hoà giải giữa các bên do một cơ quan, tổ chức hoặc cá nhân được các bên thỏa thuận chọn làm trung gian hoà giải.\n3. Giải quyết tại Trọng tài hoặc Toà án.\nThủ tục giải quyết tranh chấp trong thương mại tại Trọng tài, Toà án được tiến hành theo các thủ tục tố tụng của Trọng tài, Toà án do pháp luật quy định.\nĐiều 318. Thời hạn khiếu nại Trừ trường hợp quy định tại điểm đ khoản 1 Điều 237 của Luật này, thời hạn khiếu nại do các bên thỏa thuận, nếu các bên không có thoả thuận thì thời hạn khiếu nại được quy định như sau:\n1. Ba tháng, kể từ ngày giao hàng\nđối với khiếu nại về số lượng hàng hoá;\n2. Sáu tháng, kể từ ngày giao hàng đối với khiếu nại về chất lượng hàng hoá; trong trường hợp hàng hoá có bảo hành thì thời hạn khiếu nại là ba tháng, kể từ ngày hết thời hạn bảo hành;\n3. Chín tháng, kể từ ngày bên vi phạm phải hoàn thành nghĩa vụ theo hợp đồng hoặc trong trường hợp có bảo hành thì kể từ ngày hết thời hạn bảo hành đối với khiếu nại về các vi phạm khác.\nĐiều 319. Thời hiệu khởi kiện Thời hiệu khởi kiện áp dụng đối với các tranh chấp thương mại là hai năm, kể từ thời điểm quyền và lợi ích hợp pháp bị xâm phạm, trừ trường hợp quy định tại điểm e khoản 1 Điều 237 của Luật này.\nChương VIII XỬ LÝ VI PHẠM PHÁP LUẬT VỀ THƯƠNG MẠI\nĐiều 320. Hành vi vi phạm pháp luật về thương mại 1. Các hành vi vi phạm pháp luật về thương mại bao gồm:\na) Vi phạm quy định về đăng ký\nkinh doanh; giấy phép kinh doanh của thương nhân; thành lập và hoạt động của Văn phòng đại diện, Chi nhánh của thương nhân Việt Nam và của thương nhân nước ngoài;\nb) Vi phạm quy định về hàng hóa,\ndịch vụ kinh doanh trong nước và hàng hóa, dịch vụ xuất khẩu, nhập khẩu; tạm nhập,\ntái xuất, tạm xuất, tái nhập; chuyển khẩu; quá cảnh;\nc) Vi phạm chế độ thuế, hóa đơn,\nchứng từ, sổ và báo cáo kế toán;\nd) Vi phạm quy định về giá hàng hóa, dịch vụ;\nđ) Vi phạm quy định về ghi nhãn hàng hóa lưu thông trong nước và hàng hóa xuất khẩu, nhập khẩu;\ne) Buôn lậu, kinh doanh hàng nhập lậu, buôn bán hàng giả hoặc nguyên liệu, vật liệu phục vụ cho sản xuất hàng giả,\nkinh doanh trái phép;\ng) Vi phạm các quy định liên quan\nđến chất lượng hàng hóa, dịch vụ kinh doanh trong nước và hàng hóa, dịch vụ xuất khẩu, nhập khẩu;\nh) Gian lận, lừa dối khách hàng khi mua bán hàng hóa, cung ứng dịch vụ;\ni) Vi phạm các quy định liên quan\nđến bảo vệ quyền lợi của người tiêu dùng;\nk) Vi phạm quy định về quyền sở hữu trí tuệ đối với hàng hóa, dịch vụ kinh doanh trong nước và xuất khẩu, nhập khẩu;\nl) Vi phạm quy định về xuất xứ hàng hóa;\nm) Các vi phạm khác trong hoạt động thương mại theo quy định của pháp luật.\n2. Chính phủ quy định cụ thể các hành vi vi phạm pháp luật về thương mại được quy định tại khoản 1 Điều này.\nĐiều 321. Hình thức xử lý vi phạm pháp luật về thương mại 1. Tuỳ theo tính chất, mức độ vi phạm và hậu quả xảy ra, tổ chức, cá nhân bị xử lý theo một trong các hình thức sau đây:\na) Xử phạt theo quy định của pháp luật về xử lý vi phạm hành chính;\nb) Trường hợp hành vi vi phạm có\nđủ yếu tố cấu thành tội phạm thì người vi phạm bị truy cứu trách nhiệm hình sự\ntheo quy định của pháp luật.\n2. Trường hợp hành vi vi phạm gây thiệt hại đến lợi ích của Nhà nước, quyền và lợi ích hợp pháp của tổ chức, cá\nnhân thì phải bồi thường thiệt hại theo quy định của pháp luật.\nĐiều 322. Xử phạt vi phạm hành chính trong hoạt động thương mại Chính phủ quy định cụ thể về xử\nphạt vi phạm hành chính trong hoạt động thương mại.\nChương IX\nĐIỀU KHOẢN THI HÀNH\nĐiều 323. Hiệu lực thi hành Luật này có hiệu lực thi hành từ\nngày 01 tháng 01 năm 2006.\nLuật này thay thế Luật thương mại ngày 10 tháng 5 năm 1997.\nĐiều 324. Quy định chi tiết và hướng dẫn thi hành Chính phủ quy định chi tiết và hướng dẫn thi hành Luật này.\nLuật này đã được Quốc hội nước Cộng hoà xã hội chủ nghĩa Việt Nam khoá XI, kỳ họp thứ 7 thông qua ngày 14 tháng 6 năm 2005.\nCHỦ TỊCH QUỐC HỘI Nguyễn Văn An"
}