{
  "url": "https://thuvienphapluat.vn/van-ban/Trach-nhiem-hinh-su/Bo-luat-To-tung-hinh-su-1990-sua-doi-39-LCT-HDNN8-37891.aspx",
  "title": "Bộ luật Tố tụng hình sự 1990 sửa đổi 39-LCT/HĐNN8",
  "properties": {
    "Số hiệu": "39-LCT/HĐNN8",
    "Loại văn bản": "Luật",
    "Nơi ban hành": "Quốc hội",
    "Người ký": "Võ Chí Công",
    "Ngày ban hành": "30/06/1990",
    "Ngày hiệu lực": "Đã biết",
    "Ngày công báo": "Đã biết",
    "Số công báo": "Đã biết",
    "Tình trạng": "Đã biết"
  },
  "content": "QUỐC HỘI\n ********\nCỘNG HOÀ XÃ HỘI CHỦ NGHĨA VIỆT NAM\n Độc lập - Tự do - Hạnh phúc\n ********\nSố:\n 39-LCT/HĐNN8 Hà\n Nội, ngày 30 tháng 6 năm 1990 LUẬT CỦA QUỐC HỘI SỐ 39-LCT/HĐNN8 NGÀY 30/06/1990 VỀ SỬA ĐỔI, BỔ SUNG MỘT SỐ ĐIỀU CỦA BỘ\nLUẬT TỐ TỤNG HÌNH SỰ\nCăn cứ vào Điều 83 của Hiến pháp nước Cộng hoà xã hội chủ nghĩa Việt Nam;\nLuật này sửa đổi, bổ sung một số điều của Bộ luật tố tụng hình sự được Quốc hội nước Cộng hoà xã hội chủ nghĩa Việt Nam thông qua ngày 28 tháng 6 năm 1988.\nĐiều 1. Sửa\nđổi, bổ sung một số điều của Bộ luật tố tụng hình sự như sau: \n1- Tại các Điều 20, 28, 42, 159, 166, 174, 184, 191, 198, 203, 205, 217, 218,\n249, 251 và 263 thay các chữ \"quyền và lợi ích hợp pháp\" bằng chữ \"quyền lợi, nghĩa vụ\".\n2- Khoản 3 Điều 29 về quyền đề nghị thay đổi người tiến hành tố tụng, được sửa đổi, bổ sung như sau:\n\"3. Người bào chữa; người bảo vệ quyền lợi của người bị hại, nguyên đơn dân sự, bị đơn dân sự\".\n3- Điểm d khoản 1 Điều 62 về việc bắt bị\ncan, bị cáo để tạm giam, được sửa đổi, bổ sung như sau:\n\"d) Trưởng công an, Phó trưởng công an cấp huyện; Thủ trưởng, Phó thủ trưởng cơ quan điều tra cấp tỉnh trở\nlên; Thủ trưởng, Phó thủ trưởng cơ quan điều tra các cấp trong Quân đội nhân dân. Trong trường hợp này, lệnh bắt phải được Viện kiểm sát cùng cấp phê chuẩn trước khi thi hành\".\n4- Điểm b, điểm c khoản 1 và điểm a, điểm b khoản 2 Điều 63 về việc bắt người trong trường hợp khẩn cấp, được sửa đổi, bổ\nsung như sau:\n\"b) Khi người bị hại hoặc người có mặt tại nơi xảy ra tội phạm chính mắt trông thấy và xác nhận đúng là\nngười đã thực hiện tội phạm mà xét thấy cần ngăn chặn ngay việc người đó trốn;\nc) Khi thấy có dấu vết của tội phạm ở người hoặc tại chỗ ở của người bị nghi thực hiện tội phạm và xét thấy cần ngăn chặn ngay việc người đó trốn hoặc tiêu huỷ chứng cứ.\n2. Những người sau đây có quyền ra lệnh bắt người trong trường hợp khẩn cấp:\na) Trưởng Công an, Phó trưởng Công an cấp huyện; Thủ trưởng, Phó thủ trưởng cơ quan điều tra cấp tỉnh trở\nlên; Thủ trưởng, Phó thủ trưởng cơ quan điều tra các cấp trong Quân đội nhân dân;\nb) Người chỉ huy đơn vị quân đội\nđộc lập cấp trung đoàn và tương đương; người chỉ huy đồn biên phòng ở hải đảo và biên giới;\"\n5- Khoản 2 Điều 68 về tạm giữ, được sửa đổi,\nbổ sung như sau:\n\"2. Những người có quyền ra lệnh bắt khẩn cấp quy định tại khoản 2 Điều 63 của Bộ luật này có quyền ra lệnh tạm giữ\".\n6- Khoản 2 Điều 69 về thời hạn tạm giữ, được sửa đổi, bổ sung như sau:\n\"2. Trong trường hợp cần thiết, cơ quan ra lệnh tạm giữ có thể gia hạn tạm giữ, nhưng không quá ba ngày.\nTrong trường hợp đặc biệt, cơ quan ra lệnh tạm giữ có thể gia hạn tạm giữ lần thứ hai và cũng không được quá ba ngày. Mọi trường hợp gia hạn tạm giữ đều phải\nđược Viện kiểm sát cùng cấp phê chuẩn\".\n7- Khoản 1 Điều 70 về tạm giam, được sửa đổi,\nbổ sung như sau:\n\"1. Tạm giam có thể được áp dụng đối với bị can, bị cáo phạm tội trong những trường hợp nghiêm trọng hoặc bị\ncan, bị cáo về tội mà Bộ luật hình sự quy định hình phạt tù trên một năm và có\ncăn cứ để cho rằng người đó có thể trốn hoặc cản trở việc điều tra, xét xử hoặc có thể tiếp tục phạm tội\".\n8- Tên điều và\nkhoản 2, khoản 3 Điều 93 về quyền hạn điều tra của Bộ đội biên phòng,\nHải quan, Kiểm lâm, được sửa đổi, bổ sung như sau:\n\"Điều 93. Quyền hạn điều tra của Bộ đội biên phòng, Hải quan, Kiểm lâm và các cơ quan khác của lực lượng Cảnh sát nhân dân, lực lượng An ninh nhân dân, Quân đội nhân dân được giao nhiệm vụ tiến hành một số hoạt động điều tra.\n2- Trong lực lượng Cảnh sát nhân dân, lực lượng An ninh nhân dân, Quân đội nhân dân, ngoài các cơ quan điều tra quy định tại Điều 92 của Bộ luật này, các cơ quan khác được giao nhiệm vụ tiến hành một số hoạt động điều tra trong khi làm nhiệm vụ của mình, nếu phát hiện sự\nviệc có dấu hiệu phạm tội, thì có quyền: khởi tố vụ án, tiến hành những hoạt động\nđiều tra ban đầu và chuyển hồ sơ cho cơ quan điều tra có thẩm quyền trong thời hạn bảy ngày, kể từ ngày ra quyết định khởi tố vụ án.\n3. Nhiệm vụ, quyền hạn cụ thể\ntrong hoạt động điều tra của Bộ đội biên phòng, Hải quan, Kiểm lâm và các cơ\nquan khác của Lực lượng Cảnh sát nhân dân, Lực lượng An ninh nhân dân, Quân đội nhân dân được giao nhiệm vụ tiến hành một số hoạt động điều tra, do Hội đồng Nhà nước quy định\".\n9- Điểm a khoản 3 Điều 141 về nhiệm vụ, quyền hạn của Viện kiểm sát đối với hoạt động điều tra, được sửa đổi, bổ sung như\nsau:\n\"a) Kiểm sát việc khởi tố,\ntự mình khởi tố vụ án hình sự, khởi tố bị can và chuyển đến cơ quan điều tra để\nyêu cầu tiến hành điều tra; trực tiếp điều tra trong những trường hợp quy định tại khoản 3 Điều 92 của Bộ luật này;\"\n10- Đoạn 2 khoản 1 và khoản 2 Điều 142 về quyết\nđịnh của Viện kiểm sát sau khi kết thúc điều tra, được sửa đổi, bổ sung như\nsau:\n\"Trong trường hợp cần thiết,\nViện trưởng Viện kiểm sát có thể gia hạn thêm, nhưng không quá ba mươi ngày.\"\n\"2. Sau khi nhận hồ sơ vụ\nán, Viện kiểm sát có quyền quyết định việc áp dụng, thay đổi hoặc huỷ bỏ biện pháp ngăn chặn. Thời hạn tạm giam không được quá thời hạn quy định tại đoạn 1 khoản 1 Điều này. Trong trường hợp cần thiết, Viện trưởng Viện kiểm sát có thể\ngia hạn, nhưng không được quá ba mươi ngày.\"\n11- Đoạn 2 khoản 2 Điều 151 về thời hạn chuẩn bị\nxét xử, được sửa đổi, bổ sung như sau:\n\"Đối với những vụ án phức tạp,\nChánh án Toà án có thể quyết định kéo dài thời hạn chuẩn bị xét xử, nhưng không\nđược quá ba mươi ngày.\"\n12- Điều 152 về áp dụng, thay đổi hoặc huỷ\nbỏ biện pháp ngăn chặn, được sửa đổi, bổ sung như sau:\n\"Sau khi nhận hồ sơ vụ án,\nToà án có quyền quyết định việc áp dụng, thay đổi hoặc huỷ bỏ biện pháp ngăn chặn.\nViệc áp dụng, thay đổi hoặc huỷ bỏ biện pháp tạm giam do Chánh án hoặc Phó\nchánh án Toà án quyết định.\nThời hạn tạm giam để chuẩn bị\nxét xử không được quá thời hạn chuẩn bị xét xử quy định tại Điều 151 của Bộ luật này.\nĐối với bị cáo đang bị tạm giam mà đến ngày mở phiên toà thời hạn tạm giam đã hết, nếu xét thấy cần tiếp tục tạm giam để hoàn thành việc xét xử, thì Toà án ra lệnh tạm giam cho đến khi kết thúc phiên toà.\"\n13- Đoạn 1\nĐiều 205 về những người có quyền kháng cáo, được sửa đổi, bổ sung như sau:\n\"Bị cáo, người bị hại, người\nđại diện hợp pháp của họ có quyền kháng cáo bản án hoặc quyết định sơ thẩm\".\n14- Khoản 1 Điều 208 về thời hạn kháng cáo,\nkháng nghị, được sửa đổi, bổ sung như sau:\n\"1. Thời hạn kháng cáo là\nmười lăm ngày, kể từ ngày tuyên án. Đối với bị cáo, đương sự vắng mặt tại phiên toà thì thời hạn kháng cáo tính từ ngày bản sao bản án được giao cho họ hoặc được niêm yết.\nThời hạn kháng nghị của Viện kiểm sát cùng cấp là mười lăm ngày, của Viện kiểm sát cấp trên trực tiếp là ba mươi ngày, kể từ ngày tuyên án.\"\n15- Điều 215 về thời hạn xét xử phúc thẩm,\nđược sửa đổi, bổ sung như sau:\n\"Toà án nhân dân cấp tỉnh,\nToà án quân sự cấp quân khu phải mở phiên toà phúc thẩm trong thời hạn không quá sáu mươi ngày; Toà án quân sự cấp cao, Toà phúc thẩm Toà án nhân dân tối cao phải mở phiên toà phúc thẩm trong thời hạn không quá chín mươi ngày, kể từ\nngày nhận được hồ sơ vụ án\".\n16- Khoản 2 Điều 217 về những người tham gia phiên toà phúc thẩm được sửa đổi, bổ sung như sau:\n\"2. Người bào chữa, người bảo vệ quyền lợi của đương sự, người kháng cáo, người có quyền lợi, nghĩa vụ liên quan đến việc kháng cáo, kháng nghị được triệu tập tham gia phiên toà. Nếu có\nngười vắng mặt mà có lý do chính đáng thì Hội đồng xét xử có thể vẫn tiến hành xét xử, nhưng không được ra bản án hoặc quyết định không có lợi cho bị cáo hoặc\nđương sự vắng mặt; trong các trường hợp khác thì phải hoãn phiên toà.\nThời hạn hoãn phiên toà theo quy\nđịnh tại khoản 1, khoản 2 Điều này hoặc tại các Điều 30, 31 và 33 của Bộ luật này không được quá ba mươi ngày, kể từ ngày ra quyết định hoãn phiên toà.\"\n17- Khoản 1 Điều 232 về tạm đình chỉ thi hành án phạt tù, được sửa đổi, bổ sung như sau:\n\"1. Theo đề nghị của Viện kiểm sát hoặc của Ban giám thị trại giam, Chánh án Toà án đã ra quyết định thi hành án có thể cho người bị kết án không phải là phần tử nguy hiểm được tạm\nđình chỉ chấp hành hình phạt tù trong các trường hợp quy định tại Điều 231 của Bộ luật này. Việc tạm đình chỉ để xét xử theo thủ tục giám đốc thẩm hoặc tái thẩm phải do người đã kháng nghị hoặc do toà án cấp giám đốc thẩm hoặc tái thẩm quyết\nđịnh.\"\n18- Khoản 1 Điều 238 về thủ tục giảm thời hạn hoặc miễn chấp hành hình phạt, được sửa đổi, bổ sung như sau:\n\"1. Toà án có thẩm quyền quyết định giảm thời hạn chấp hành hình phạt tù là Toà án nhân dân cấp tỉnh,\nToà án quân sự cấp quân khu, nơi người bị kết án chấp hành hình phạt.\nToà án có thẩm quyền quyết định miễn chấp hành hình phạt tù, hình phạt cải tạo ở đơn vị kỷ luật của quân đội là\nToà án nhân dân cấp tỉnh, Toà án quân sự cấp quân khu, nơi người bị kết án cư\ntrú hoặc làm việc.\nViệc giảm thời hạn hoặc miễn chấp hành các hình phạt khác hoặc giảm thời gian thử thách thuộc thẩm quyền quyết định của Toà án nhân dân cấp huyện, Toà án quân sự khu vực, nơi người bị kết án chấp hành hình phạt hoặc chịu thử thách.\"\n19- Điều 247 về thời hạn kháng nghị giám đốc thẩm, được bổ sung khoản 3 mới như sau:\n\"3. Việc kháng nghị về dân sự trong vụ án hình sự đối với nguyên đơn dân sự, bị đơn dân sự, người có quyền lợi, nghĩa vụ liên quan đến vụ án được tiến hành theo quy định của pháp luật về\ntố tụng dân sự.\"\n20- Điều 265 về thời hạn kháng nghị tái thẩm,\nđược bổ sung khoản 3 mới như sau:\n\"3. Việc kháng nghị về dân sự trong vụ án hình sự đối với nguyên đơn dân sự, bị đơn dân sự, người có quyền lợi, nghĩa vụ liên quan đến vụ án được tiến hành theo quy định của pháp luật về\ntố tụng dân sự.\"\nĐiều 2. Bổ\nsung một số điều mới như sau:\n1- \"Điều 42a. Người bảo vệ quyền lợi của đương sự.\n1. Người bị hại, nguyên đơn dân sự, bị đơn dân sự, người có quyền lợi, nghĩa vụ liên quan đến vụ án có quyền nhờ\nluật sư, bào chữa viên nhân dân hoặc người khác được cơ quan điều tra, Viện kiểm sát, Toà án chấp nhận, bảo vệ quyền lợi cho mình.\n2. Người bảo vệ quyền lợi của\nđương sự được tham gia tố tụng từ khi khởi tố bị can.\n3. Người bảo vệ quyền lợi của\nđương sự có quyền cung cấp chứng cứ, đề đạt yêu cầu; được đọc hồ sơ vụ án, ghi chép những điều cần thiết sau khi kết thúc điều tra; tham gia phiên toà; khiếu nại các quyết định của cơ quan tiến hành tố tụng. Người bảo vệ quyền lợi của người bị hại, nguyên đơn dân sự, bị đơn dân sự có quyền đề nghị thay đổi người tiến hành tố tụng, người giám định, người phiên dịch theo quy định của Bộ luật này.\nĐối với đương sự là người chưa thành niên hoặc người có nhược điểm về thể chất hoặc tâm thần, thì người bảo vệ\nquyền lợi của họ có quyền có mặt khi cơ quan tiến hành tố tụng lấy lời khai của người mà mình bảo vệ; có quyền kháng cáo phần bản án, quyết định của Toà án có\nliên quan đến quyền lợi, nghĩa vụ của người mình bảo vệ.\n4. Người bảo vệ quyền lợi của\nđương sự có nghĩa vụ sử dụng các biện pháp do pháp luật quy định để góp phần làm rõ sự thật của vụ án; giúp đương sự về mặt pháp lý nhằm bảo vệ quyền lợi hợp pháp của họ.\"\n2- \"Điều 168a. Thời hạn hoãn phiên toà.\nTrong trường hợp phải hoãn phiên toà theo quy định tại các Điều 30, 31, 33, 162, 164, 165, 166, 167 và 168 của Bộ\nluật này, thì thời hạn hoãn phiên toà sơ thẩm không được quá ba mươi ngày, kể từ\nngày ra quyết định hoãn phiên toà.\"\n3- \"Điều 215a. Việc Toà án cấp phúc thẩm áp dụng, thay đổi hoặc huỷ bỏ biện pháp ngăn chặn.\nSau khi nhận hồ sơ vụ án, toà án cấp phúc thẩm có quyền quyết định việc áp dụng, thay đổi hoặc huỷ bỏ biện pháp ngăn chặn.\nThời hạn tạm giam không được quá\nthời hạn quy định tại Điều 215 của Bộ luật này.\nĐối với bị cáo đang bị tạm giam mà đến ngày mở phiên toà thời hạn tạm giam đã hết, nếu xét thấy cần tiếp tục tạm giam để hoàn thành việc xét xử, thì Toà án ra lệnh tạm giam cho đến khi kết thúc phiên toà.\" \nLuật này đã được Quốc hội nước Cộng hoà xã hội chủ nghĩa Việt Nam khoá VIII, kỳ họp thứ 7 thông qua ngày 30 tháng 6 năm 1990. \nVõ\n Chí Công\n (Đã\n ký)"
}