{
  "url": "https://thuvienphapluat.vn/van-ban/Doanh-nghiep/Luat-Dau-tu-nuoc-ngoai-tai-Viet-Nam-1990-sua-doi-41-LCT-HDNN8-37892.aspx",
  "title": "Luật Đầu tư nước ngoài tại Việt Nam 1990 sửa đổi 41-LCT/HĐNN8",
  "properties": {
    "Số hiệu": "41-LCT/HĐNN8",
    "Loại văn bản": "Luật",
    "Nơi ban hành": "Quốc hội",
    "Người ký": "Võ Chí Công",
    "Ngày ban hành": "30/06/1990",
    "Ngày hiệu lực": "Đã biết",
    "Ngày công báo": "Đã biết",
    "Số công báo": "Đã biết",
    "Tình trạng": "Đã biết"
  },
  "content": "QUỐC HỘI\n ********\nCỘNG HOÀ XÃ HỘI CHỦ NGHĨA VIỆT NAM\n Độc lập - Tự do - Hạnh phúc\n ********\nSố:\n 41-LCT/HĐNN8 Hà\n Nội, ngày 30 tháng 6 năm 1990 LUẬT CỦA QUỐC HỘI SỐ 41-LCT/HĐNN8 NGÀY 30/06/1990 VỀ SỬA ĐỔI,\nBỔ SUNG MỘT SỐ ĐIỀU CỦA LUẬT ĐẦU TƯ NƯỚC NGOÀI TẠI VIỆT NAM\nĐể khuyến khích và tạo thêm điều kiện thuận lợi cho các tổ chức, cá nhân nước ngoài đầu tư vào Việt Nam và cho các tổ chức kinh tế Việt Nam thuộc mọi thành phần kinh tế mở rộng hợp tác đầu tư với nước ngoài;\nCăn cứ vào Điều 83 của Hiến pháp nước Cộng hoà xã hội chủ nghĩa Việt Nam;\nLuật này sửa đổi, bổ sung một số điều của Luật đầu tư nước ngoại tại Việt Nam\nđược Quốc hội nước Cộng hoà xã hội chủ nghĩa Việt Nam thông qua ngày 29 tháng 12 năm 1987. \nĐiều 1 Các Điều 2, 3, 5, 6, 7, 8, 10,\n11, 12, 16, 25, 27, 29, 30 và 37 được sửa đổi, bổ sung như sau:\n1- Các điểm 2, 4, 5, 6 và 10 Điều 2 được sửa đổi,\nbổ sung như sau:\n\"2.\n\"Bên Việt Nam\" là một bên gồm một hoặc nhiều tổ chức kinh tế Việt Nam có tư cách pháp nhân thuộc các thành phần kinh tế\".\n\"4. \"Hai bên\" là\nBên Việt Nam và Bên nước ngoài.\n\"Nhiều bên\" là Bên Việt Nam và các Bên nước ngoài, hoặc là Bên nước ngoài và Bên Việt Nam, hoặc là các Bên Việt Nam và các Bên nước ngoài\".\n\"5. \"Hợp đồng hợp tác kinh doanh\" là văn bản ký giữa hai bên hoặc nhiều bên về hợp tác kinh doanh\".\n\"6. \"Hợp đồng liên doanh\" là văn bản ký giữa hai bên hoặc nhiều bên về việc thành lập xí nghiệp liên doanh, hoặc là văn bản ký giữa xí nghiệp liên doanh với tổ chức, cá nhân nước ngoài để thành lập xí nghiệp liên doanh mới tại Việt Nam\".\n\"10. \"Xí nghiệp liên doanh\" là xí nghiệp do hai bên hoặc nhiều bên hợp tác thành lập tại Việt Nam trên cơ sở hợp đồng liên doanh hoặc hiệp định ký giữa Chính phủ Cộng hoà xã\nhội chủ nghĩa Việt Nam với Chính phủ nước ngoài, hoặc là xí nghiệp mới do xí\nnghiệp liên doanh hợp tác với tổ chức, cá nhân nước ngoài thành lập tại Việt Nam trên cơ sở hợp đồng liên doanh\".\n2- Điều 3 được bổ sung một đoạn vào cuối Điều như sau:\n\"Các tổ chức kinh tế tư\nnhân Việt Nam được hợp tác kinh doanh với tổ chức, cá nhân nước ngoài trong lĩnh vực và điều kiện do Hội đồng bộ trưởng quy định\".\n3- Điều 5 được sửa đổi, bổ sung như sau:\n\"Hai bên hoặc nhiều bên được hợp tác kinh doanh trên cơ sở hợp đồng hợp tác kinh doanh như hợp tác sản xuất chia sản phẩm và các hình thức hợp tác kinh doanh khác.\nĐối tượng, nội dung kinh doanh,\nquyền lợi, nghĩa vụ, trách nhiệm của mỗi bên và quan hệ giữa các bên do các bên thoả thuận và ghi trong hợp đồng hợp tác kinh doanh\".\n4- Điều 6 được sửa đổi, bổ sung như sau:\n\"Hai bên hoặc nhiều bên được hợp tác với nhau để thành lập xí nghiệp liên doanh.\nXí nghiệp liên doanh được hợp tác với tổ chức, cá nhân nước ngoài để thành lập xí nghiệp liên doanh mới tại Việt Nam.\nXí nghiệp liên doanh có tư cách pháp nhân theo pháp luật Việt Nam\".\n5- Điều 8 được sửa đổi, bổ sung như sau:\n\"Phần góp vốn của Bên nước ngoài hoặc các Bên nước ngoài vào vốn pháp định của xí nghiệp liên doanh không bị hạn chế về mức cao nhất, theo sự thoả thuận của các bên nhưng không dưới 30%\nvốn pháp định.\nĐối với xí nghiệp liên doanh nhiều bên, tỷ lệ góp vốn tối thiểu của mỗi Bên nước ngoài và mỗi Bên Việt Nam do Hội\nđồng bộ trưởng quy định.\nGiá trị phần góp vốn của mỗi bên\nđược xác định trên cơ sở giá thị trường quốc tế và được ghi vào văn bản thành lập bằng tiền Việt Nam hoặc tiền nước ngoài do các bên thoả thuận\".\n6- Điều 12 được sửa đổi, bổ sung như sau:\n\"Cơ quan lãnh đạo của xí nghiệp liên doanh là Hội đồng quản trị.\nCác bên chỉ định người của mình tham gia Hội đồng quản trị theo tỷ lệ tương ứng với phần góp vốn vào vốn pháp định của xí nghiệp liên doanh.\nTrong trường hợp liên doanh hai bên thì mỗi bên ít nhất có hai thành viên trong Hội đồng quản trị.\nTrong trường hợp liên doanh nhiều bên thì mỗi bên ít nhất có một thành viên trong Hội đồng quản trị.\nNếu trong xí nghiệp liên doanh có một Bên Việt Nam và nhiều Bên nước ngoài hoặc một Bên nước ngoài và nhiều Bên Việt Nam, thì Bên Việt Nam hoặc Bên nước ngoài ít nhất có hai thành viên trong Hội đồng quản trị.\nChủ tịch Hội đồng quản trị do các bên thoả thuận cử ra.\nTổng giám đốc và các Phó tổng giám đốc do Hội đồng quản trị cử ra để điều hành các hoạt động hàng ngày của xí\nnghiệp và chịu trách nhiệm trước Hội đồng quản trị về hoạt động của xí nghiệp.\nTổng giám đốc hoặc Phó tổng giám\nđốc thứ nhất là công dân Việt Nam\".\n7- Đoạn 4 Điều 16 được sửa đổi, bổ sung như sau:\n\"Lương và các khoản phụ cấp của người lao động Việt Nam được trả bằng tiền Việt Nam hoặc tiền nước ngoài trích từ tài khoản của xí nghiệp mở tại Ngân hàng\".\n8- Đoạn 1 Điều 27 được sửa đổi, bổ sung như sau:\n\"Tuỳ thuộc vào lĩnh vực đầu tư, địa bàn đầu tư, quy mô vốn đầu tư, khối lượng hàng xuất khẩu,\nkhối lượng hàng thay thế hàng nhập khẩu thiết yếu mà trong nước chưa sản xuất\nđược hoặc sản xuất chưa đủ, tính chất và thời gian hoạt động, cơ quan Nhà nước quản lý đầu tư nước ngoài có thể miễn thuế lợi tức cho xí nghiệp liên doanh trong một thời gian tối đa là 2 năm, kể từ năm bắt đầu kinh doanh có lãi và giảm 50% thuế\nlợi tức trong một thời gian tối đa là 2 năm tiếp theo\".\n9- Điều 29 được sửa đổi, bổ sung như sau:\n\"Xí nghiệp có vốn đầu tư nước ngoài và các bên nước ngoài hợp tác kinh doanh trên cơ sở hợp\nđồng sử dụng đất đai, mặt nước, mặt biển của Việt Nam, thì phải trả tiền thuê ;\ntrong trường hợp khai thác tài nguyên thì phải nộp thuế tài nguyên\".\n10- Tại các\nĐiều 7, 10, 11, 25, 30 và 37 các chữ \"hai bên\" được thay bằng \"các bên\".\nĐiều 2 Hội đồng bộ trưởng sửa đổi, bổ\nsung các văn bản quy định chi tiết thi hành Luật đầu tư nước ngoài tại Việt Nam phù hợp với Luật này. \nLuật này đã được Quốc hội nước Cộng hoà xã hội chủ nghĩa Việt Nam khoá VIII, kỳ họp thứ 7 thông qua ngày 30 tháng 6 năm 1990. \nVõ\n Chí Công\n (Đã\n ký)"
}