{
  "url": "https://thuvienphapluat.vn/van-ban/Bo-may-hanh-chinh/Luat-Sy-quan-Quan-doi-nhan-dan-Viet-Nam-1990-sua-doi-45-LCT-HDNN8-38056.aspx",
  "title": "Luật Sỹ quan Quân đội nhân dân Việt Nam 1990 sửa đổi 45-LCT/HĐNN8",
  "properties": {
    "Số hiệu": "45-LCT/HĐNN8",
    "Loại văn bản": "Luật",
    "Nơi ban hành": "Quốc hội",
    "Người ký": "Võ Chí Công",
    "Ngày ban hành": "21/12/1990",
    "Ngày hiệu lực": "Đã biết",
    "Ngày công báo": "Đã biết",
    "Số công báo": "Đã biết",
    "Tình trạng": "Đã biết"
  },
  "content": "QUỐC HỘI\n ********\nCỘNG HOÀ XÃ HỘI CHỦ NGHĨA VIỆT NAM\n Độc lập - Tự do - Hạnh phúc\n ********\nSố:\n 45-LCT/HĐNN8 Hà\n Nội, ngày 21 tháng 12 năm 1990 LUẬT CỦA QUỐC HỘI SỐ 45-LCT/HĐNN8 NGÀY 21/12/1990 VỀ VIỆC SỬA ĐỔI, BỔ SUNG MỘT SỐ ĐIỀU CỦA LUẬT VỀ SĨ QUAN QUÂN ĐỘI NHÂN DÂN VIỆT NAM Căn cứ vào Điều 83 của Hiến pháp nước Cộng hoà xã hội chủ nghĩa Việt Nam;\nLuật này sửa đổi, bổ sung một số điều của Luật về sĩ quan Quân đội nhân dân Việt Nam được Quốc hội nước Cộng hoà xã hội chủ nghĩa Việt Nam thông qua ngày 30 tháng 12 năm 1981. \nĐiều 1. Sửa đổi,\nbổ sung một số điều của Luật về sĩ quan Quân đội nhân dân Việt Nam như sau:\n1- Khoản 2 Điều 7 về hệ thống quân hàm sĩ\nquan Quân đội nhân dân Việt Nam, được sửa đổi, bổ sung như sau:\n\"2. Cấp tá có 4 bậc:\nĐại tá;\nThượng tá;\nTrung tá;\nThiếu tá.\"\n2- Điều 9 về thời hạn xét thăng quân hàm, được sửa đổi, bổ sung như sau:\n\"Điều 9.\nThời hạn xét thăng quân hàm được quy định như sau:\nThiếu uý lên trung uý: 2 năm;\nTrung uý lên thượng uý: 3 năm;\nThượng uý lên đại uý: 3 năm;\nĐại uý lên thiếu tá: 4 năm;\nThiếu tá lên trung tá: 4 năm;\nTrung tá lên thượng tá: 4 năm;\nThượng tá lên đại tá: 4 năm.\nViệc xét thăng quân hàm cấp tướng không quy định thời hạn.\nThời gian học tập tại trường được tính vào thời hạn để xét thăng quân hàm.\nTrong thời chiến, thời hạn xét thăng quân hàm có thể được rút ngắn theo quy định của Hội đồng bộ trưởng.\"\n3- Đoạn 2 Điều 12 về hệ thống chức vụ trong quân đội,\nđược sửa đổi, bổ sung như sau:\n\"Mỗi chức vụ được bố trí nhiều nhất ba bậc quân hàm kế tiếp. Trong trường hợp sĩ quan có\nbậc quân hàm cao nhất của chức vụ đang đảm nhiệm, đủ tiêu chuẩn và đã đến thời hạn xét thăng quân hàm, nhưng không có nhu cầu bổ nhiệm chức vụ cao hơn, thì\nkhông thăng quân hàm mà được xét nâng mức lương theo quy định về chế độ tiền lương của sĩ quan.\"\n4- Điều 32 về hạn tuổi phục vụ của sĩ quan,\nđược sửa đổi, bổ sung như sau:\n\"Điều 32.\nHạn tuổi phục vụ của sĩ quan tại ngũ và sĩ quan dự bị được quy định như sau:\nCấp bậc tại ngũ\nTuổi hạng một Tuổi dự bị\n hạng hai Tuổi dự bị\nCấp uý\n Thiếu tá \n Trung tá \n Thượng tá \n Đại tá\n Thiếu tướng và chuẩn đô đốc hải quân 38 43 48 52 55 60 43 48 52 55 58 63 48 52 55 58 60 65\nĐối với sĩ quan có bậc quân hàm từ trung tướng và phó đô đốc hải quân trở lên thì không quy định hạn tuổi phục vụ; trong trường hợp vì điều kiện sức khoẻ hoặc do năng lực mà không đảm đương được nhiệm vụ, thì thực hiện chế độ\nnghỉ hưu.\"\n5- Điều 33 về việc kéo dài tuổi phục vụ tại ngũ của sĩ quan, được sửa đổi, bổ sung như sau:\n\"Điều 33.\nCăn cứ vào nhu cầu của Quân đội và phẩm chất, năng lực, sức khoẻ của từng sĩ quan, hạn tuổi phục vụ tại ngũ của sĩ quan có thể kéo dài đến hết hạn tuổi dự bị hạng một; đối với sĩ quan làm công tác nghiên cứu khoa học và giáo viên các trường trong quân đội, thì có thể\nkéo dài đến hết hạn tuổi dự bị hạng hai; trong trường hợp đặc biệt thì có thể\nkéo dài trên hạn tuổi dự bị hạng hai.\nNgười có thẩm quyền thăng quân hàm đối với sĩ quan ở cấp bậc nào, thì có quyền kéo dài hạn tuổi phục vụ tại ngũ đối với sĩ quan ở cấp bậc đó.\"\n6- Điều 39 về chế độ tiền lương và phụ cấp của sĩ quan, được sửa đổi, bổ sung như sau:\n\"Điều 39.\nSĩ quan tại ngũ được hưởng chế độ\ntiền lương và phụ cấp do Hội đồng bộ trưởng quy định.\nBảng lương của sĩ quan căn cứ\nvào cấp bậc quân hàm và chức vụ được quy định phù hợp với tính chất nhiệm vụ của quân đội.\nPhụ cấp thâm niên được tính theo thời gian sĩ quan phục vụ tại ngũ; sĩ quan làm nhiệm vụ có tính chất đặc thù\ncòn được hưởng các khoản phụ cấp khác.\"\nLuật này đã được Quốc hội nước Cộng hoà xã hội chủ nghĩa Việt Nam khoá VIII, kỳ họp thứ 8, thông qua ngày 21 tháng 12 năm 1990.\nVõ\n Chí Công\n (Đã\n ký)"
}