{
  "url": "https://thuvienphapluat.vn/van-ban/Bo-may-hanh-chinh/Luat-Nghia-vu-quan-su-1990-sua-doi-46-LCT-HDNN8-38055.aspx",
  "title": "Luật Nghĩa vụ quân sự 1990 sửa đổi 46-LCT/HĐNN8",
  "properties": {
    "Số hiệu": "46-LCT/HĐNN8",
    "Loại văn bản": "Luật",
    "Nơi ban hành": "Quốc hội",
    "Người ký": "Võ Chí Công",
    "Ngày ban hành": "21/12/1990",
    "Ngày hiệu lực": "Đã biết",
    "Ngày công báo": "Đã biết",
    "Số công báo": "Đã biết",
    "Tình trạng": "Đã biết"
  },
  "content": "QUỐC HỘI\n ********\nCỘNG HOÀ XÃ HỘI CHỦ NGHĨA VIỆT NAM\n Độc lập - Tự do - Hạnh phúc\n ********\nSố: 46-LCT/HĐNN8 Hà Nội, ngày 21 tháng 12 năm 1990 LUẬT CỦA QUỐC HỘI SỐ 46-LCT/HĐNN8 NGÀY 21/12/1990 VỀ SỬA ĐỔI, BỔ\nSUNG MỘT SỐ ĐIỀU CỦA LUẬT NGHĨA VỤ QUÂN SỰ \nCăn cứ vào Điều 83 của Hiến pháp nước Cộng hoà xã hội chủ nghĩa Việt Nam;\nLuật này sửa đổi, bổ sung một số điều của Luật nghĩa vụ quân sự được Quốc hội nước Cộng hoà xã hội chủ nghĩa Việt Nam thông qua ngày 30 tháng 12 năm 1981. \nĐiều 1. Sửa\nđổi, bổ sung một số điều của Luật nghĩa vụ quân sự như sau:\n1/ Điều 14 về thời hạn phục vụ tại ngũ của hạ\nsĩ quan và binh sĩ, được sửa đổi, bổ sung như sau:\n\"Điều 14.\nThời hạn phục vụ tại ngũ trong thời bình của hạ sĩ quan và binh sĩ là hai năm.\nThời hạn phục vụ tại ngũ trong thời bình của hạ sĩ quan chỉ huy, hạ sĩ quan và binh sĩ chuyên môn kỹ thuật do Quân đội đào tạo, hạ sĩ quan và binh sĩ trên tầu hải quân là ba năm.\"\n2/ Đoạn 4 Điều 21 về trách nhiệm của Uỷ ban nhân dân các cấp trong việc gọi công dân nhập ngũ, được sửa đổi, bổ sung như\nsau:\n\"Uỷ ban nhân dân các cấp có\ntrách nhiệm chỉ đạo, tổ chức thực hiện việc tuyển chọn và gọi công dân nhập ngũ\ntrong địa phương mình, bảo đảm công khai, dân chủ và công bằng; đúng thời gian,\nđủ số lượng, đúng tiêu chuẩn theo quy định của pháp luật. Các đơn vị nhận quân có trách nhiệm phối hợp với Uỷ ban nhân dân các cấp thực hiện nhiệm vụ\nnày\".\n3/ Điều 29 về những người được hoãn gọi nhập ngũ, được sửa đổi, bổ sung như sau:\n\"Điều 29.\nTrong thời bình, những người đây sau được hoãn gọi nhập ngũ:\n1- Người chưa đủ sức khoẻ phục vụ\ntại ngũ theo kết luận của Hội đồng khám sức khoẻ;\n2- Con của liệt sĩ;\n3- Anh hoặc em trai còn lại duy nhất của liệt sĩ;\n4- Một con trai của thương binh hạng một, hạng hai và bệnh binh hàng một;\n5- Người là lao động duy nhất phải trực tiếp nuôi người khác trong gia đình không còn sức lao động hoặc chưa đến tuổi lao động;\n6- Người có anh, chị hoặc em ruột trong cùng một hộ gia đình là hạ sĩ quan, binh sĩ đang phục vụ tại ngũ;\n7- Giáo viên, nhân viên y tế,\nthanh niên xung phong đang làm việc ở một số vùng cao xa xôi, hẻo lánh do Hội đồng bộ trưởng quy định;\n8- Người đang nghiên cứu công trình khoa học cấp Nhà nước được Bộ trưởng, Chủ nhiệm Uỷ ban Nhà nước hoặc người có chức tương đương chứng nhận;\n9- Người đang học ở các trường phổ thông; đang học ở các trường dạy nghề, trường trung học chuyên nghiệp, trường cao đẳng, trường đại học thuộc hệ tập trung dài hạn do Nhà nước quản lý.\nHàng năm, những người nói ở các\nđiểm 1, 5, 6, 7, 8 và 9 của Điều này phải được kiểm tra, nếu không còn lý do hoãn thì được gọi nhập ngũ; hết 27 tuổi mà vẫn không được gọi nhập ngũ thì chuyển sang ngạch dự bị\".\n4/ Điều 32 về việc xuất ngũ của hạ sĩ quan và binh sĩ, được sửa đổi, bổ sung như sau:\n\"Điều 32.\nHạ sĩ quan và binh sĩ đã phục vụ\ntại ngũ đủ thời hạn quy định ở Điều 14 của Luật này thì được xuất ngũ. Theo lệnh của Bộ trưởng Bộ quốc phòng, người chỉ huy đơn vị từ cấp trung đoàn và tương\nđương trở lên có trách nhiệm thực hiện việc xuất ngũ cho hạ sĩ quan và binh sĩ\nthuộc quyền.\nThời gian xuất ngũ của hạ sĩ\nquan và binh sĩ phải được thông báo trước một tháng cho quân nhân, Uỷ ban nhân dân huyện, quận, thị xã, thành phố thuộc tỉnh và\nđơn vị cơ sở, nơi quân nhân cư trú hoặc làm việc trước khi nhập ngũ. Người chỉ\nhuy của đơn vị cấp trung đoàn và tương đương trở lên có hạ sĩ quan và binh sĩ\nxuất ngũ phải tổ chức tiễn và đưa họ về bàn giao cho Uỷ ban nhân dân địa phương\nđã giao quân. Uỷ ban nhân dân huyện, quận, thị xã, thành phố thuộc tỉnh có\ntrách nhiệm tổ chức tiếp nhận hạ sĩ quan và binh sĩ xuất ngũ về địa phương mình.\"\n5/ Điều 38 về hạn tuổi phục vụ của hạ sĩ\nquan và binh sĩ ở ngạch dự bị, được sửa đổi như sau:\n\"Điều 38.\nHạn tuổi phục vụ của hạ sĩ quan và binh sĩ ở ngạch dự bị được quy định như sau:\nNam giới,\nđến hết 45 tuổi;\nNữ giới, đến hết 40 tuổi;\"\n6/ Điều 39 về chia nhóm quân nhân dự bị nam giới, được sửa đổi như sau:\n\"Điều 39.\nCăn cứ vào lứa tuổi, hạ sĩ quan và binh sĩ dự bị nam giới ở mỗi hạng được chia thành 2 nhóm:\nNhóm A gồm những người đến hết 35 tuổi;\nNhóm B gồm những người từ 36 tuổi\nđến hết 45 tuổi.\"\n7/ Bỏ khoản 3 Điều 40 về việc huấn luyện quân nhân dự bị ở nhóm C.\n8/ Điều 53 về quyền lợi của hạ sĩ quan và\nbinh sĩ tại ngũ, được sửa đổi, bổ sung như sau:\n\"Điều 53.\nHạ sĩ quan và binh sĩ tại ngũ:\n1- Được bảo đảm cung cấp kịp thời,\nđủ số lượng, đúng chất lượng về lương thực, thực phẩm, quân trang, thuốc phòng bệnh, chữa bệnh, được bảo đảm chỗ ở, phụ cấp hàng tháng và nhu cầu về văn hoá,\ntinh thần phù hợp với tính chất nhiệm vụ của quân đội theo chế độ, tiêu chuẩn,\nđịnh lượng do Hội đồng bộ trưởng quy định;\n2- Từ năm thứ 2 trở đi, được nghỉ\nphép theo quy định của Hội đồng bộ trưởng;\n3- Từ tháng thứ\n25 trở đi, được hưởng thêm 100% phụ cấp hàng tháng;\n4- Được tính nhân khẩu ở gia\nđình khi gia đình được cấp hoặc điều chỉnh diện tích nhà ở, đất xây dựng nhà ở\nvà đất canh tác;\n5- Được tính thời gian phục vụ tại ngũ vào thời gian công tác;\n6- Được ưu tiên mua vé khi đi lại bằng các phương tiện giao thông thuộc các thành phần kinh tế;\n7- Được ưu đãi về bưu phí theo quy định của Hội đồng bộ trưởng.\"\n9/ Điều 54 về quyền lợi của gia đình quân nhân tại ngũ, được sửa đổi, bổ sung như sau:\n\"Điều 54.\nQuyền lợi của gia đình hạ sĩ\nquan và binh sĩ tại ngũ được quy định như sau:\n1- Bố hoặc vợ được tạm miễn tham gia lao động công ích trong những trường hợp gia đình thực sự có khó khăn và được Uỷ ban nhân dân xã, phường, thị trấn chứng nhận;\n2- Bố, mẹ, vợ và con được hưởng chế độ trợ cấp khó khăn đột xuất theo chính sách chung của Nhà nước; được miễn viện phí khi khám bệnh và chữa bệnh tại các bệnh viện của Nhà nước;\n3- Con gửi ở nhà trẻ, học tại các trường mẫu giáo, trường phổ thông của Nhà nước được miễn học phí và tiền\nđóng góp xây dựng trường.\"\n10/ Điều 55 về chế độ đối với hạ sĩ quan và\nbinh sĩ xuất ngũ, được sửa đổi, bổ sung như sau:\n\"Điều 55.\nHạ sĩ quan và binh sĩ khi xuất ngũ được cấp tiền tầu xe, phụ cấp đi đường và trợ cấp xuất ngũ do Hội đồng bộ trưởng quy định.\nHạ sĩ quan và binh sĩ kể từ ngày có quyết định xuất ngũ được tạm miễn làm nghĩa vụ lao động công ích; cứ mỗi năm phục vụ tại ngũ thì được miễn thời gian nghĩa vụ lao động công ích của một năm.\nThời gian hạ sĩ quan, binh sĩ dự\nbị tập trung huấn luyện và kiểm tra sẵn sàng chiến đấu được trừ vào thời gian nghĩa vụ lao động công ích hàng năm.\"\nĐiều 2. Các Điều 69, 70, 71 về việc xử lý các vi phạm được thay bằng Điều 69 mới như\nsau:\n\"Điều 69.\n1- Người nào vi phạm các quy định về đăng ký nghĩa vụ quân sự, tuyển chọn và gọi công dân nhập ngũ, gọi quân nhân dự bị tập trung huấn luyện; lợi dụng chức vụ, quyền hạn làm trái hoặc cản trở\nviệc thực hiện các quy định trên đây hoặc vi phạm các quy định khác của Luật này, thì tuỳ theo mức độ nhẹ hoặc nặng mà bị xử lý kỷ luật, xử phạt hành chính hoặc bị truy cứu trách nhiệm hình sự.\n2- Quân nhân nào vi phạm các quy\nđịnh về việc tuyển chọn và gọi công dân nhập ngũ, về việc xuất ngũ của hạ sĩ\nquan, binh sĩ, về chế độ, quyền lợi của quân nhân hoặc vi phạm các quy định khác của Luật này, thì tuỳ theo mức độ nhẹ hoặc nặng mà bị xử lý theo Điều lệnh kỷ luật của quân đội hoặc bị truy cứu trách nhiệm hình sự.\" \nLuật này đã được Quốc hội nước Cộng hoà xã hội chủ nghĩa Việt Nam khoá VIII, kỳ họp thứ 8, thông qua ngày 21 tháng 12 năm 1990.\nVõ\n Chí Công\n (Đã\n ký)"
}