{
  "url": "https://thuvienphapluat.vn/van-ban/Doanh-nghiep/Luat-Cong-ty-1990-47-LCT-HDNN8-38053.aspx",
  "title": "Luật Công ty 1990 47-LCT/HĐNN8",
  "properties": {
    "Số hiệu": "47-LCT/HĐNN8",
    "Loại văn bản": "Luật",
    "Nơi ban hành": "Quốc hội",
    "Người ký": "Võ Chí Công",
    "Ngày ban hành": "21/12/1990",
    "Ngày hiệu lực": "Đã biết",
    "Ngày công báo": "Đã biết",
    "Số công báo": "Đã biết",
    "Tình trạng": "Đã biết"
  },
  "content": "QUỐC HỘI\n ********\nCỘNG HOÀ XÃ HỘI CHỦ NGHĨA VIỆT NAM\n Độc lập - Tự do - Hạnh phúc\n ********\nSố: 47-LCT/HĐNN8 Hà Nội, ngày 21 tháng 12 năm 1990 LUẬT CỦA QUỐC HỘI SỐ 47-LCT/HĐNN8 NGÀY 21/12/1990 VỀ CÔNG TY\nĐể thực hiện đường lối phát triển nền kinh tế hàng hoá nhiều thành phần, huy động và sử dụng có hiệu quả các nguồn vốn, lao động và tài nguyên của đất nước, tạo thêm việc làm; bảo hộ lợi ích hợp pháp của người góp vốn đầu tư, đẩy nhanh tốc độ phát triển kinh tế; tăng cường hiệu lực quản lý Nhà nước đối với các hoạt động kinh doanh;\nCăn cứ vào Điều 83 của Hiến pháp nước Cộng hoà xã hội chủ nghĩa Việt Nam;\nLuật này quy định về Công ty trách nhiệm hữu hạn và Công ty cổ phần. \nChương 1:\nNHỮNG QUY ĐỊNH CHUNG\nĐiều 1 Công dân Việt Nam đủ 18 tuổi, tổ chức kinh tế Việt Nam có tư cách pháp nhân thuộc các thành phần kinh tế, tổ chức xã hội có quyền góp vốn đầu tư hoặc tham gia thành lập công ty trách nhiệm hữu hạn, công ty cổ phần theo quy định của Luật này.\nĐiều 2 Công ty trách nhiệm hữu hạn và công ty cổ phần, gọi chung là công ty, là doanh nghiệp trong đó các thành viên cùng góp vốn, cùng chia nhau lợi nhuận, cùng chịu lỗ\ntương ứng với phần vốn góp và chỉ chịu trách nhiệm về các khoản nợ của công ty trong phạm vi phần vốn của mình góp vào công ty.\nĐiều 3 Trong Luật này, các từ ngữ dưới đây được hiểu như sau:\n1- \"Kinh doanh\" là việc thực hiện một, một số hoặc tất cả các công đoạn của quá trình đầu tư, từ sản xuất\nđến tiêu thụ sản phẩm hoặc thực hiện dịch vụ trên thị trường nhằm mục đích sinh lợi.\n2- \"Doanh nghiệp\" là\nđơn vị kinh doanh được thành lập nhằm mục đích chủ yếu là thực hiện các hoạt động kinh doanh.\n3- \"Vốn pháp định\" là mức vốn tối thiểu phải có để thành lập công ty do pháp luật quy định đối với từng ngành, nghề.\n4- \"Vốn điều lệ\" là số\nvốn do các thành viên đóng góp và được ghi vào Điều lệ công ty.\nĐiều 4 Nhà nước công nhận sự tồn tại lâu dài và phát triển của công ty, thừa nhận sự bình đẳng trước pháp luật của công ty với các doanh nghiệp khác và tính sinh lợi hợp pháp của việc kinh doanh.\nTrong khuôn khổ pháp luật, công ty có quyền tự do kinh doanh và chủ động trong mọi hoạt động kinh doanh.\nĐiều 5 Quyền sở hữu về tư liệu sản xuất, quyền thừa kế về vốn, tài sản, các quyền và lợi ích hợp pháp khác của các thành viên công ty được Nhà nước bảo hộ.\nĐiều 6 Nghiêm cấm cơ quan Nhà nước, đơn vị thuộc lực lượng vũ trang nhân dân sử dụng tài sản của Nhà nước và công quỹ để góp vốn vào công ty hoặc tham gia thành lập công ty nhằm thu lợi riêng cho cơ quan, đơn vị mình.\nViên chức tại chức trong bộ máy Nhà nước, sĩ quan tại ngũ trong lực lượng vũ trang nhân dân không được phép tham gia thành lập hoặc quản lý công ty.\nĐiều 7 Người mất trí, người đang bị truy cứu trách nhiệm hình sự hoặc người bị kết án tù mà chưa\nđược xoá án, thì không được phép tham gia thành lập hoặc quản lý công ty.\nĐiều 8 Thành viên công ty có quyền:\n1- Sở hữu một phần tài sản của công ty tương ứng với phần vốn góp vào công ty;\n2- Tham dự Đại hội đồng, tham gia thảo luận, biểu quyết các vấn đề thuộc thẩm quyền của Đại hội đồng; có số\nphiếu biểu quyết tương ứng với phần vốn góp vào công ty;\n3- Được chia lợi nhuận hoặc chịu lỗ tương ứng với phần vốn góp vào công ty;\n4- Nhóm thành viên đại diện cho\nít nhất 1/4 số vốn điều lệ có quyền yêu cầu triệu tập Đại hội đồng để xem xét và giải quyết những việc mà Hội đồng quản trị hoặc Giám đốc bỏ qua. Trong trường hợp này, Hội đồng quản trị hoặc Giám đốc phải triệu tập Đại hội đồng trong thời hạn ba mươi ngày, kể từ ngày nhóm thành viên yêu cầu.\nĐiều 9 Phần vốn góp của mỗi thành viên có thể bằng tiền Việt Nam, ngoại tệ, vàng, tài sản bằng hiện vật hoặc bằng bản quyền sở hữu công nghiệp.\nPhần vốn góp bằng hiện vật hoặc bản quyền sở hữu công nghiệp phải được Đại hội đồng thành lập xem xét, chấp thuận,\nđịnh giá và được ghi vào Điều lệ công ty; phần vốn góp này phải được nộp đủ\nngay khi công ty chính thức thành lập.\nĐiều 10\nĐiều lệ\ncông ty là bản cam kết của tất cả thành viên về thành lập và hoạt động của công ty, được thông qua tại Đại hội đồng thành lập.\nĐiều lệ công ty phải có nội dung chủ yếu sau đây:\n1- Hình thức, mục tiêu, tên gọi,\ntrụ sở, thời hạn hoạt động của công ty;\n2- Họ, tên các sáng lập viên;\n3- Vốn điều lệ, trong đó ghi rõ\ntrị giá phần vốn góp bằng hiện vật hoặc bằng bản quyền sở hữu công nghiệp;\n4- Phần góp vốn của mỗi thành viên\nđối với công ty trách nhiệm hữu hạn; mệnh giá cổ phiếu và số cổ phiếu phát hành\nđối với công ty cổ phần;\n5- Thể thức hoạt động và thông qua quyết định của Đại hội đồng;\n6- Cơ cấu quản lý và kiểm soát công ty;\n7- Các loại quỹ, mức giới hạn các quỹ được lập tại công ty;\n8- Thể lệ quyết toán và phân chia lợi nhuận;\n9- Các trường hợp sáp nhập, chuyển\nđổi hình thức, giải thể công ty và thể thức thanh lý tài sản công ty.\nĐiều 11 Ngoài một số ngành, nghề mà pháp luật cấm kinh doanh, việc thành lập công ty trong các ngành, nghề dưới đây phải được Chủ tịch Hội đồng bộ trưởng cho phép:\n1- Sản xuất và lưu thông thuốc nổ,\nthuốc độc, hoá chất độc;\n2- Khai thác các loại khoáng sản quý;\n3- Sản xuất và cung ứng điện, nước có quy mô lớn;\n4- Sản xuất các phương tiện phát sóng truyền tin, dịch vụ bưu chính viễn thông, truyền thanh, truyền hình, xuất bản;\n5- Vận tải viễn dương và vận tải hàng không;\n6- Chuyên kinh doanh xuất khẩu,\nnhập khẩu;\n7- Du lịch quốc tế.\nĐiều 12 Theo quy\nđịnh của pháp luật, công ty có quyền:\n1- Lựa chọn ngành, nghề và quy mô kinh doanh;\n2- Lựa chọn hình thức và cách thức huy động vốn;\n3- Lựa chọn khách hàng; trực tiếp giao dịch, ký kết hợp đồng với khách hàng;\n4- Tuyển dụng và thuê mướn lao động theo yêu cầu kinh doanh;\n5- Sử dụng ngoại tệ thu được;\n6- Quyết định việc sử dụng phần thu nhập còn lại;\n7- Chủ động trong mọi hoạt động kinh doanh đã đăng ký.\nĐiều 13 Công ty có nghĩa vụ:\n1- Kinh doanh theo ngành, nghề\nghi trong giấy phép;\n2- Ưu tiên sử dụng lao động trong nước; bảo đảm quyền, lợi ích của người lao động theo quy định của pháp luật lao động; tôn trọng quyền của tổ chức công đoàn theo Luật công đoàn;\n3- Bảo đảm chất lượng hàng hoá\ntheo tiêu chuẩn đã đăng ký;\n4- Tuân thủ quy định của Nhà nước về bảo vệ môi trường, bảo vệ di tích lịch sử, văn hoá, danh lam thắng cảnh và\ntrật tự, an toàn xã hội;\n5- Ghi chép sổ sách kế toán và\nquyết toán theo quy định của pháp luật về kế toán, thống kê và chịu sự kiểm tra của cơ quan tài chính;\n6- Nộp thuế và thực hiện các nghĩa vụ khác theo quy định của pháp luật;\n7- Trích 5% lãi ròng hàng năm để\nlập quỹ dự trữ bắt buộc cho đến mức bằng 10% vốn điều lệ của công ty.\nChương 2:\nTHÀNH LẬP, ĐĂNG KÝ KINH DOANH, GIẢI THỂ, PHÁ SẢN CÔNG TY \nĐiều 14 Muốn thành lập công ty, các sáng lập viên phải gửi đơn xin phép thành lập đến Uỷ ban nhân dân tỉnh, thành phố trực thuộc trung ương hoặc đơn vị hành chính tương đương, nơi dự định đặt trụ sở chính.\nĐơn xin thành lập công ty phải ghi rõ:\n1- Họ, tên, tuổi, địa chỉ thường trú của các sáng lập viên;\n2- Tên gọi, trụ sở dự định của công ty;\n3- Mục tiêu, ngành, nghề kinh doanh;\n4- Vốn điều lệ và cách thức góp vốn;\n5- Biện pháp bảo vệ môi trường;\n6- Chương trình xây dựng công ty.\nĐơn phải kèm theo phương án kinh doanh ban đầu và dự thảo Điều lệ công ty.\nĐiều 15 Công dân,\ntổ chức có quyền tham gia thành lập công ty phải có các điều kiện sau đây mới\nđược cấp giấy phép thành lập:\n1- Mục tiêu, ngành, nghề kinh doanh rõ ràng, có phương án kinh doanh ban đầu; có trụ sở giao dịch;\n2- Có vốn điều lệ phù hợp với quy mô và ngành, nghề kinh doanh. Vốn điều lệ không được thấp hơn vốn pháp định do Hội đồng bộ trưởng quy định;\n3- Người quản lý, điều hành hoạt\nđộng kinh doanh phải có trình độ chuyên môn tương ứng mà pháp luật đòi hỏi đối với một số ngành, nghề.\nĐiều 16 Uỷ ban nhân dân nhận đơn phải cấp hoặc từ chối cấp giấy phép thành lập công ty trong thời hạn sáu mươi ngày, kể từ ngày nhận đơn; nếu từ chối cấp giấy phép thì phải nói rõ lý do.\nTrong trường hợp người xin phép thành lập công ty thấy việc từ chối cấp giấy phép là không thoả\nđáng, thì có quyền khiếu nại lên Trọng tài kinh tế Nhà nước.\nĐiều 17 Công ty phải\nđăng ký kinh doanh tại Trọng tài kinh tế tỉnh, thành phố trực thuộc trung ương hoặc đơn vị hành chính tương đương. Hồ sơ đăng ký kinh doanh bao gồm: giấy phép thành lập, Điều lệ công ty và giấy tờ chứng thực trụ sở giao dịch của công ty.\nViệc đăng ký kinh doanh của công ty trách nhiệm hữu hạn phải được tiến hành trong thời hạn một trăm tám mươi ngày, kể từ ngày được cấp giấy phép thành lập.\nViệc đăng ký kinh doanh của công ty cổ phần phải được tiến hành trong thời hạn một năm, kể từ ngày được cấp giấy phép thành lập.\nQuá thời hạn nói tại đoạn 2 và\nđoạn 3, Điều này mà chưa đăng ký kinh doanh, nếu muốn tiếp tục thành lập công ty thì các sáng lập viên phải làm lại thủ tục xin phép thành lập. Trong trường hợp có lý do chính đáng, Uỷ ban nhân dân đã cấp giấy phép thành lập có thể gia hạn giấy phép thành lập không quá chín mươi ngày.\nĐiều 18 Khi đăng ký kinh doanh, công ty được ghi tên vào sổ đăng ký kinh doanh và được cấp giấy chứng nhận đăng ký kinh doanh. Kể từ thời điểm đó, công ty có tư cách pháp nhân và được tiến hành hoạt động kinh doanh.\nTrong thời hạn bảy ngày, kể từ ngày cấp giấy chứng nhận đăng ký kinh doanh, Trọng tài kinh tế\nphải gửi bản sao giấy chứng nhận đăng ký kinh doanh kèm theo hồ sơ của công ty cho các cơ quan thuế, tài chính, thống kê và cơ quan quản lý ngành kinh tế, kỹ\nthuật cùng cấp.\nĐiều 19 Trong thời hạn ba mươi ngày, kể từ ngày được cấp giấy chứng nhận đăng ký kinh doanh, công ty phải đăng báo địa phương và báo hàng ngày của trung ương trong năm số liên tiếp các đặc điểm chủ yếu sau đây:\n1- Tên, loại hình công ty, trụ sở\nvà mục tiêu, ngành, nghề kinh doanh;\n2- Họ, tên, địa chỉ thường trú của các sáng lập viên;\n3- Vốn điều lệ;\n4- Ngày được cấp giấy phép thành lập, ngày được cấp giấy chứng nhận đăng ký kinh doanh, số đăng ký kinh doanh;\n5- Thời điểm bắt đầu hoạt động.\nĐiều 20 Trong trường hợp cần đặt chi nhánh hoặc văn phòng đại diện ngoài tỉnh, thành phố trực thuộc trung ương hoặc đơn vị hành chính tương đương, nơi đặt trụ sở chính, công ty phải:\n1- Xin phép Uỷ ban nhân dân tỉnh, thành phố trực thuộc Trung ương hoặc đơn vị hành chính tương đương, nơi đặt chi nhánh hoặc văn phòng đại diện và đăng ký kinh doanh tại Trọng tài kinh tế cùng cấp, như quy định tại các Điều 14, 17 và 18 của Luật này;\n2- Thông báo bằng văn bản cho Uỷ\nban nhân dân đã cấp giấy phép thành lập công ty về việc mở chi nhánh hoặc văn phòng đại diện trong thời hạn mười lăm ngày, kể từ ngày chi nhánh hoặc văn phòng đại diện được cấp giấy đăng ký.\nĐiều 21 Khi thay\nđổi mục tiêu, ngành, nghề kinh doanh, vốn điều lệ và các nội dung khác trong hồ\nsơ đăng ký kinh doanh, công ty phải khai báo lại với Trọng tài kinh tế và phải\nđăng báo theo quy định tại Điều 19 của Luật này.\nĐiều 22 Công ty chỉ được giải thể trong các trường hợp sau đây:\n1- Kết thúc thời hạn hoạt động\nđã ghi trong Điều lệ công ty;\n2- Hoàn thành mục tiêu đã định;\n3- Mục tiêu của công ty không thể\nthực hiện được nữa hoặc không còn có lợi;\n4- Công ty bị lỗ 3/4 số vốn điều lệ hoặc đang gặp khó khăn không thể vượt qua;\n5- Có yêu cầu chính đáng của nhóm thành viên đại diện 2/3 số vốn điều lệ.\nViệc giải thể công ty trong bất kỳ trường hợp nào đều phải được sự đồng ý của nhóm thành viên đại diện cho ít nhất 3/4 số vốn điều lệ của công ty.\nĐiều 23\nĐơn xin giải thể công ty phải gửi đến Uỷ ban nhân dân đã cấp giấy phép thành lập, đồng thời phải đăng báo địa phương và báo hàng ngày của trung ương năm số liên tiếp.\nĐơn và thông báo phải ghi rõ trình tự và thủ tục thanh lý tài sản, thời hạn thanh toán các khoản nợ của công ty, thanh lý các hợp đồng mà công ty đã ký kết.\nUỷ ban nhân dân chỉ chấp thuận\nđơn xin giải thể nếu sau mười lăm ngày, kể từ ngày kết thúc thời hạn thanh toán các khoản nợ và thanh lý các hợp đồng đã ghi trong đơn và thông báo việc xin phép giải thể mà không có đơn khiếu nại.\nViệc giải thể của công ty được bắt\nđầu khi đơn xin giải thể được chấp thuận.\nĐiều 24 Công ty gặp khó khăn hoặc bị thua lỗ trong hoạt động kinh doanh đến mức tại một thời điểm tổng số trị giá các tài sản còn lại của công ty không đủ thanh toán tổng số các khoản nợ đến hạn, là\ncông ty đang lâm vào tình trạng phá sản.\nCông ty nói tại đoạn 1, Điều này có thể bị Trọng tài kinh tế tỉnh, thành phố trực thuộc trung ương hoặc đơn vị\nhành chính tương đương, nơi công ty đặt trụ sở chính tuyên bố phá sản theo đơn xin phá sản của công ty; hoặc đơn yêu cầu của một hoặc nhiều chủ nợ; hoặc kiến nghị của cơ quan có thẩm quyền.\nTrình tự và thủ tục phá sản thực hiện theo quy định của pháp luật về phá sản.\nChương 3:\nCÔNG TY TRÁCH NHIỆM HỮU HẠN \nĐiều 25 Công ty trách nhiệm hữu hạn là công ty trong đó:\n1- Phần vốn góp của tất cả các thành viên phải được đóng đủ ngay khi thành lập công ty. Các phần vốn góp được ghi rõ trong Điều lệ công ty. Công ty không được phép phát hành bất kỳ một loại chứng khoán nào;\n2- Việc chuyển nhượng phần vốn góp vào giữa các thành viên được thực hiện tự do. Việc chuyển nhượng phần vốn góp cho người không phải là thành viên phải được sự nhất trí của nhóm thành viên đại diện cho ít nhất 3/4 số vốn điều lệ của công ty.\nĐiều 26 Công ty trách nhiệm hữu hạn có thể đặt tên theo mục đích hoạt động kinh doanh hoặc tên của một hoặc một số thành viên.\nTrên bảng hiệu, hoá đơn, quảng cáo, báo cáo, tài liệu, giấy tờ giao dịch khác của công ty đều phải ghi tên công ty kèm theo các chữ \"trách nhiệm hữu hạn\" và vốn điều lệ.\nĐiều 27 Trong trường hợp có không quá mười một thành viên, việc thành lập và tổ chức hoạt động của công ty phải tuân theo quy định sau đây:\n1- Sau khi nhận được giấy phép thành lập và phần vốn góp của mỗi thành viên đã được đóng đủ, toàn thể thành viên họp để xem xét, chấp thuận và định giá các phần vốn góp bằng hiện vật, bằng bản quyền sở hữu công nghiệp và thông qua Điều lệ công ty; phân công nhau đảm nhận các chức trách quản lý và kiểm soát công ty; cử một người trong số họ hoặc thuê người khác làm Giám đốc công ty;\n2- Trong quá trình hoạt động, tất cả thành viên phải được tham gia quyết định các vấn đề sau đây:\na) Phương hướng và nhiệm vụ phát triển công ty;\nb) Cử hoặc miễn nhiệm Giám đốc công ty;\nc) Sửa đổi Điều lệ công ty;\nd) Thông qua quyết toán năm tài chính và phân chia lợi nhuận cho các thành viên;\nđ) Sử dụng quỹ dự trữ;\ne) Sáp nhập, chuyển đổi hình thức,\ngiải thể hoặc gia hạn hoạt động của công ty.\nThể thức thông qua quyết định về\ncác vấn đề nói tại khoản này phải được quy định rõ trong Điều lệ công ty.\n3- Giám đốc được uỷ nhiệm đầy đủ\nquyền hạn để điều hành hoạt động kinh doanh của công ty và có quyền hành động nhân danh công ty trong mọi trường hợp.\nGiám đốc chịu trách nhiệm cá\nnhân hoặc liên đới với những người cùng quản lý trước toàn thể thành viên về những việc mình làm nhân danh công ty.\nGiám đốc được hưởng lương theo quyết định của các thành viên.\nĐiều 28 Công ty có mười hai thành viên trở lên phải tiến hành các Đại hội đồng, bầu Hội đồng quản trị và các kiểm soát viên. Chức năng, nhiệm vụ quyền hạn của các Đại hội đồng,\nHội đồng quản trị và kiểm soát viên áp dụng như quy định tại các Điều 37, 38, 39,\n40, 41, 42 và 43 của Luật này.\nĐiều 29 Công ty có thể tăng vốn điều lệ bằng cách gọi thêm vốn góp trong các thành viên hoặc kết nạp thêm thành viên mới hoặc trích từ quỹ dự trữ theo quyết định của Đại hội đồng.\nChương 4:\nCÔNG TY CỔ PHẦN \nĐiều 30 Công ty cổ\nphần là công ty trong đó:\n1- Số thành viên gọi là cổ đông mà công ty phải có trong suốt thời gian hoạt động ít nhất là bảy;\n2- Vốn điều lệ của công ty được chia thành nhiều phần bằng nhau gọi là cổ phần. Giá trị mỗi cổ phần gọi là mệnh giá cổ phiếu. Mỗi cổ đông có thể mua một hoặc nhiều cổ phiểu;\n3- Cổ phiếu được phát hành có thể\ncó ghi tên hoặc không ghi tên. Cổ phiếu của sáng lập viên, của thành viên Hội đồng quản trị phải là những cổ phiếu có ghi tên;\n4- Cổ phiếu không ghi tên được tự\ndo chuyển nhượng. Cổ phiếu có ghi tên chỉ được chuyển nhượng, nếu được sự đồng\ný của Hội đồng quản trị, trừ trường hợp quy định tại Điều 39 của Luật này.\nĐiều 31 Công ty cổ\nphần được tự do đặt tên.\nTrên bảng hiệu, hoá đơn, quảng cáo, báo cáo, tài liệu, giấy tờ giao dịch khác của công ty đều phải ghi tên công ty kèm theo các chữ \"Công ty cổ phần\" và vốn điều lệ.\nĐiều 32 Ngoài quy\nđịnh về thủ tục thành lập và đăng ký kinh doanh nói tại Chương II của Luật này,\nviệc thành lập công ty cổ phần còn phải tuân theo các quy định sau đây:\n1- Các sáng lập viên phải cùng nhau đăng ký mua ít nhất 20% số cổ phiếu dự tính phát hành của công ty. Trong trường hợp các sáng lập viên không đăng ký mua tất cả cổ phiếu công ty, thì họ\nphải công khai gọi vốn từ những người khác;\n2- Trong trường hợp công khai gọi vốn từ những người khác, thì sau khi được cấp giấy phép thành lập, các sáng lập viên phải nộp tại Trọng tài kinh tế đã cấp giấy chứng nhận đăng ký kinh doanh một bản dự thảo điều lệ, danh sách sáng lập viên, địa chỉ thường trú và nghề nghiệp của họ;\n3- Việc gọi vốn từ những người khác phải được thông báo công khai, bảo đảm cho những người quan tâm hiểu rõ,\nhiểu đúng mục tiêu và triển vọng phát triển của công ty;\n4- Việc đăng ký mua cổ phiếu được xác nhận bằng một tờ phiếu có chữ ký của người nhận mua hoặc người được uỷ nhiệm mua và của ít nhất một sáng lập viên.\nTờ phiếu này phải ghi rõ:\na) Tên công ty;\nb) Mục tiêu hoạt động của công ty;\nc) Trụ sở dự định của công ty;\nd) Tổng số vốn gọi góp;\nđ) Tổng số cổ phiếu dự tính phát hành;\ne) Nơi gửi số tiền đã góp;\ng) Ngày và nơi nộp dự thảo điều lệ;\nh) Họ, tên, tuổi, địa chỉ thường trú và nghề nghiệp của người đăng ký mua cổ phiếu và số cổ phiếu đăng ký mua; số\ncổ phiếu được đóng bằng tiền mặt, bằng hiện vật hoặc bản quyền sở hữu công nghiệp và cam kết đóng hết số còn lại theo quyết định gọi vốn của Hội đồng quản trị;\n5- Các sáng lập viên phải gửi tất cả số tiền đóng góp của người đăng ký mua cổ phiếu vào tài khoản phong toả tại một ngân hàng ở trong nước kèm theo danh sách những người đăng ký mua cổ phiếu và số tiền mà mỗi người đã góp. Số tiền gửi chỉ được lấy ra khi công ty đã được cấp giấy chứng nhận đăng ký kinh doanh hoặc sau một năm, kể từ ngày được cấp giấy phép thành lập mà công ty không thành lập được;\n6- Các sáng lập viên triệu tập Đại hội đồng thành lập để thông qua điều lệ của công ty và các thủ tục cần thiết khác, khi:\na) Số cổ phiếu dự tính phát hành\nđã được đăng ký mua hết;\nb) Những người đăng ký mua cổ\nphiếu đã đóng bằng tiền mặt ít nhất 1/2 trị giá số cổ phiếu mà họ đăng đăng ký\nmua và cam kết đóng đủ bằng tiền mặt;\nc) Tài sản bằng hiện vật, bản quyền sở hữu công nghiệp dùng để mua cổ phiếu đã được đóng đủ.\nĐiều 33 Sau một năm, kể từ ngày được cấp giấy phép thành lập mà công ty không thành lập được,\nthì người đăng ký mua cổ phiếu có quyền yêu cầu các sáng lập viên trả lại số tiền\nđã góp. Các sáng lập viên phải trả cho họ số tiền đã góp trong thời hạn ba mươi ngày, kể từ ngày nhận được yêu cầu và phải chịu mọi chi phí liên quan đến việc vận động thành lập công ty.\nĐiều 34 Công ty cổ\nphần có thể được Uỷ ban nhân dân tỉnh, thành phố trực thuộc trung ương hoặc đơn vị hành chính tương đương, nơi công ty đặt trụ sở chính cho phép phát hành cổ\nphiếu hoặc trái phiếu.\nĐiều 35 Công ty chỉ được cấp giấy phép phát hành cổ phiếu mới, nếu có đủ các điều kiện sau đây:\n1- Đã thu hết tiền cổ phiếu phát hành trong đợt trước;\n2- Chứng minh được hoạt động kinh doanh của công ty đang được quản lý tốt và có hiệu quả;\n3- Được ngân hàng đảm nhiệm giúp\nđỡ dịch vụ ngân quỹ và kế toán liên quan đến việc phát hành cổ phiếu;\n4- Có chương trình và kế hoạch cụ\nthể công khai gọi vốn trong công chúng. Chương trình và kế hoạch này phải bảo đảm cho mọi người quan tâm hiểu rõ, hiểu đúng tình hình kinh doanh, thực trạng tình hình tài chính, triển vọng phát triển của công ty để họ có cơ sở quyết định mua cổ phiếu.\nGiấy phép phát hành cổ phiếu mới phải quy định rõ tổng số vốn gọi thêm, số cổ phiếu được phát hành, thời hạn thực hiện việc gọi thêm vốn.\nĐiều 36 Công ty chỉ được cấp giấy phép phát hành trái phiếu, nếu có đủ các điều kiện sau đây:\n1- Có phương án kinh doanh cụ thể\nđòi hỏi vốn lớn;\n2- Đã hoạt động ít nhất là hai năm và chứng minh được hoạt động kinh doanh của công ty đang được quản lý tốt,\ncó hiệu quả;\n3- Được ngân hàng nơi công ty mở\ntài khoản chứng nhận số tiền còn lại ở ngân hàng và được cơ quan công chứng chứng nhận trị giá số tài sản bằng hiện vật của công ty đủ bảo đảm cho tổng số vốn dự\nđịnh vay. Việc bảo đảm cho số vốn dự định vay còn có thể được một hoặc nhiều ngân hàng bảo lãnh;\n4- Được ngân hàng đảm nhiệm giúp\nđỡ dịch vụ ngân quỹ và kế toán liên quan đến việc phát hành trái phiếu.\nGiấy phép phát hành trái phiếu phải quy định rõ mức vốn được vay qua phát hành trái phiếu, mức lãi và thời hạn hoàn trả vốn.\nTrên mỗi trái phiếu phải ghi rõ\nsố thứ tự, giá trị của trái phiếu, tổng số vốn huy động bằng trái phiếu, mức lãi và thời hạn thanh toán.\nĐiều 37\nĐại hội đồng cổ đông là cơ quan quyết định cao nhất của công ty, gồm:\n1- Đại hội đồng thành lập được triệu tập để tiến hành các thủ tục thành lập, thảo luận và thông qua Điều lệ\ncông ty. Đại hội đồng thành lập phải có nhóm cổ đông đại diện cho ít nhất 3/4 số\nvốn điều lệ của công ty và biểu quyết theo đa số phiếu quá bán;\n2- Đại hội đồng bất thường được triệu tập để sửa đổi Điều lệ công ty;\n3- Đại hội đồng thường được triệu tập vào cuối mỗi năm tài chính hoặc bất kỳ lúc nào mà Hội đồng quản trị hoặc kiểm soát viên thấy cần thiết, để giải quyết các công việc thuộc hoạt động kinh doanh của công ty trong khuôn khổ điều lệ, trong đó có các việc chủ yếu sau\nđây:\na) Quyết định phương hướng, nhiệm vụ phát triển công ty và kế hoạch kinh doanh hàng năm;\nb) Thảo luận và thông qua bản tổng kết năm tài chính;\nc) Bầu, bãi miễn thành viên Hội\nđồng quản trị và kiểm soát viên;\nd) Quyết định số lợi nhuận trích lập các quỹ của công ty, số lợi nhuận chia cho các cổ đông, phân chia trách nhiệm về các thiệt hại xảy ra đối với công ty trong kinh doanh;\nđ) Xem xét, quyết định giải pháp khắc phục các biến động lớn về tài chính của công ty;\ne) Xem xét sai phạm của Hội đồng quản trị gây thiệt hại cho công ty.\nThể thức triệu tập các Đại hội đồng,\nphần vốn điều lệ mà các cổ đông hoặc người được uỷ quyền tham dự phải có để các cuộc họp của Đại hội đồng có giá trị và thể thức thông qua quyết định của Đại hội\nđồng, phải được quy định rõ trong Điều lệ công ty.\nĐiều 38 Hội đồng quản trị là cơ quan quản lý công ty, gồm từ ba đến mười hai thành viên.\nHội đồng quản trị có toàn quyền nhân danh công ty để quyết định mọi vấn đề liên quan đến mục đích, quyền lợi của công ty, trừ những vấn đề thuộc thẩm quyền của Đại hội đồng.\nHội đồng quản trị bầu một thành viên làm chủ tịch. Chủ tịch Hội đồng quản trị có thể kiêm Giám đốc (Tổng Giám đốc)\ncông ty, nếu Điều lệ công ty không quy định khác.\nĐiều 39 Hội đồng quản trị chịu trách nhiệm trước Đại hội đồng về những sai phạm trong quản lý,\nvi phạm điều lệ, vi phạm pháp luật gây thiệt hại cho công ty.\nThành viên Hội đồng quản trị được hưởng lương hoặc thù lao theo quyết định của Đại hội đồng.\nĐiều lệ công ty có thể quy định số cổ phiếu tối thiểu mà các cổ đông là thành viên Hội đồng quản trị phải có. Số\ncổ phiếu này phải ghi tên, không được chuyển nhượng trong suốt thời gian tại chức và trong thời hạn hai năm, kể từ ngày thôi giữ chức thành viên Hội đồng quản trị.\nĐiều 40 Trong trường hợp chủ tịch Hội đồng quản trị không kiêm Giám đốc (Tổng Giám đốc) công ty, thì\nHội đồng quản trị cử một người trong số họ hoặc thuê người khác làm Giám đốc (Tổng Giám đốc).\nGiám đốc (Tổng Giám đốc) là người\nđiều hành hoạt động kinh doanh hàng ngày của công ty và chịu trách nhiệm trước Hội đồng quản trị về việc thực hiện các nhiệm vụ và quyền hạn được giao.\nĐiều 41 Công ty có hai kiểm soát viên do Đại hội đồng bầu ra, trong đó ít nhất một kiểm soát viên phải có chuyên môn về kế toán. Kiểm soát viên có nhiệm vụ và quyền hạn sau\nđây:\n1- Kiểm tra sổ sách kế toán, tài sản, các bảng tổng kết năm chính của công ty và triệu tập Đại hội đồng, khi xét thấy cần thiết;\n2- Trình Đại hội đồng báo cáo thẩm tra các bảng tổng kết năm tài chính của công ty;\n3- Báo cáo về những sự kiện tài chính bất thường xảy ra; về những ưu, khuyết điểm trong quản lý tài chính của Hội\nđồng quản trị.\nĐiều 42 Kiểm soát viên được hưởng thù lao do Đại hội đồng quyết định và chịu trách nhiệm trước Đại hội đồng về những sai phạm của mình trong quá trình thực hiện nhiệm vụ gây thiệt cho công ty.\nĐiều 43 Kiểm soát viên không thể đồng thời là thành viên Hội đồng quản trị, Giám đốc (Tổng Giám đốc)\ncông ty; không thể là vợ, chồng của các thành viên Hội đồng quản trị, Giám đốc\n(Tổng Giám đốc) công ty.\nChương 5:\nXỬ LÝ VI PHẠM \nĐiều 44 Người thành lập công ty mà không có giấy phép; kinh doanh không đăng ký, kinh doanh không đúng ngành, nghề ghi trong giấy phép; khai man phần vốn góp khi thành lập công ty; khai man số người mua cổ phiếu; lừa dối người khác để bán cổ phiếu;\nphát hành trái phiếu, cổ phiếu mới mà không có giấy phép hoặc vi phạm quy định khác của Luật này, thì tuỳ theo mức độ nhẹ hoặc nặng mà bị xử phạt hành chính hoặc bị truy cứu trách nhiệm hình sự theo quy định của pháp luật.\nĐiều 45 Người lợi dụng chức vụ, quyền hạn cấp giấy phép thành lập công ty cho người, tổ chức bị cấm,\ncho người không được phép thành lập công ty; không cấp giấy phép, giấy đăng ký\nkinh doanh cho người, tổ chức đủ điều kiện thành lập công ty hoặc đăng ký kinh doanh; chứng nhận sai về vốn gửi ở ngân hàng hoặc về trị giá tài sản bằng hiện vật của công ty; hoặc vi phạm các quy định khác của Luật này, thì tuỳ theo mức\nđộ nhẹ hoặc nặng mà bị xử lý kỷ luật hoặc bị truy cứu trách nhiệm hình sự theo quy định của pháp luật.\nChương 6:\nĐIỀU KHOẢN CUỐI CÙNG \nĐiều 46 Luật này có hiệu lực kể từ ngày 15 tháng 4 năm 1991.\nCác quy định trước đây trái với Luật này đều bãi bỏ.\nTrong thời hạn một trăm tám mươi ngày, kể từ ngày 15 tháng 4 năm 1991, các công ty đã được cơ\nquan có thẩm quyền cấp giấy phép thành lập trước ngày đó, phải làm lại các thủ\ntục thành lập và đăng ký kinh doanh theo quy định của Luật này.\nLuật này đã được Quốc hội nước Cộng hoà xã hội chủ nghĩa Việt Nam khoá VIII, kỳ họp thứ 8 thông qua ngày 21 tháng 12 năm 1990. \nVõ\n Chí Công\n (Đã\n ký)"
}