{
  "url": "https://thuvienphapluat.vn/van-ban/Tai-nguyen-Moi-truong/Luat-Bao-ve-va-phat-trien-rung-1991-58-LCT-HDNN8-38067.aspx",
  "title": "Luật Bảo vệ và phát triển rừng 1991 58-LCT/HĐNN8",
  "properties": {
    "Số hiệu": "58-LCT/HĐNN8",
    "Loại văn bản": "Luật",
    "Nơi ban hành": "Quốc hội",
    "Người ký": "Võ Chí Công",
    "Ngày ban hành": "12/08/1991",
    "Ngày hiệu lực": "Đã biết",
    "Ngày công báo": "Đã biết",
    "Số công báo": "Đã biết",
    "Tình trạng": "Đã biết"
  },
  "content": "QUỐC HỘI\n ********\nCỘNG HOÀ XÃ HỘI CHỦ NGHĨA VIỆT NAM\n Độc lập - Tự do - Hạnh phúc\n ********\nSố: 58-LCT/HĐNN8 Hà Nội, ngày 12 tháng 8 năm 1991 LUẬT BẢO VỆ VÀ PHÁT TRIỂN RỪNGCỦA QUỐC HỘI SỐ 58-LCT/HĐNN8 NGÀY 12/08/1991 Rừng là tài nguyên quý báu của\nđất nước, có khả năng tái tạo, là bộ phận quan trọng của môi trường sinh thái,\ncó giá trị to lớn đối với nền kinh tế quốc dân, gắn liền với đời sống của nhân dân và sự sống còn của dân tộc.\nĐể tăng cường hiệu lực quản lý Nhà nước về rừng, ngăn chặn tình trạng phá rừng,\nnâng cao trách nhiệm và khuyến khích các tổ chức, cá nhân bảo vệ, phát triển rừng,\nphát huy các lợi ích của rừng phục vụ sự nghiệp xây dựng và bảo vệ Tổ quốc;\nCăn cứ vào Điều 83 của Hiến pháp nước Cộng hoà xã hội chủ nghĩa Việt Nam;\nLuật này quy định việc quản lý, bảo vệ, phát triển và sử dụng rừng.\nChương 1:\nNHỮNG QUY ĐỊNH CHUNG \nĐiều 1 Rừng được quy định trong Luật này gồm rừng tự nhiên và rừng trồng trên đất lâm nghiệp, gồm có thực vật rừng,\nđộng vật rừng và những yếu tố tự nhiên có liên quan đến rừng.\nĐất lâm nghiệp gồm:\n1- Đất có rừng;\n2- Đất không có rừng được quy hoạch\nđể gây trồng rừng, dưới đây gọi là đất trồng rừng.\nĐiều 2 Nhà nước thống nhất quản lý rừng và đất trồng rừng.\nNhà nước giao rừng, đất trồng rừng cho tổ chức, cá nhân - dưới đây gọi là chủ rừng - để bảo vệ, phát triển và sử dụng rừng ổn định, lâu dài theo quy hoạch, kế hoạch của Nhà nước.\nTổ chức, cá nhân đang sử dụng hợp pháp rừng, đất trồng rừng được tiếp tục sử dụng theo quy định của Luật này.\nĐiều 3 Rừng tự nhiên, rừng được gây trồng bằng vốn của Nhà nước thuộc sở hữu Nhà nước.\nRừng được gây trồng trên đất được Nhà nước giao không phải bằng vốn của Nhà nước, thì sản phẩm thực vật rừng thuộc sở hữu của tổ chức, cá nhân bỏ vốn.\nĐối với động vật rừng, trừ những loài quý, hiếm mà Nhà nước quy định phải bảo vệ và cấm săn bắt,\nchủ rừng được khai thác và phát triển nguồn động vật rừng thông thường, nhưng phải tuân theo quy định của pháp luật; trong trường hợp bảo vệ, phát triển được loài quý, hiếm, chủ rừng được hưởng chính sách ưu đãi.\nNhà nước bảo hộ quyền lợi hợp pháp của chủ rừng.\nĐiều 4 Nhà nước khuyến khích tổ chức,\ncá nhân đầu tư lao động, vật tư, tiền vốn, áp dụng tiến bộ khoa học, công nghệ\nvào việc gây trồng rừng, bảo vệ rừng, khai thác và chế biến lâm sản theo hướng phát triển nông - lâm - ngư nghiệp gắn với công nghiệp chế biến.\nĐiều 5 Cơ quan Nhà nước, tổ chức kinh tế,\ntổ chức xã hội, đơn vị lực lượng vũ trang nhân dân và mọi công dân có nghĩa vụ\nbảo vệ, phát triển rừng, bảo vệ môi trường sinh thái.\nĐiều 6 Nghiêm cấm mọi hành vi huỷ hoại tài nguyên rừng.\nĐiều 7 Căn cứ vào mục đích sử dụng chủ\nyếu, rừng được phân thành các loại sau đây:\n1- Rừng phòng hộ;\n2- Rừng đặc dụng;\n3- Rừng sản xuất.\nViệc xác định các loại rừng,\nchuyển mục đích sử dụng từ loại rừng này sang loại rừng khác do cơ quan Nhà nước có thẩm quyền quyết định.\nChương 2:\nQUẢN LÝ NHÀ NƯỚC VỀ RỪNG VÀ ĐẤT TRỒNG RỪNG\nĐiều 8 Nội dung quản lý Nhà nước về rừng và đất trồng rừng bao gồm:\n1- Điều tra, xác định các loại rừng,\nphân định ranh giới rừng, đất trồng rừng trên bản đồ và trên thực địa đến đơn vị\nhành chính cấp xã; thống kê, theo dõi diễn biến tình hình rừng, đất trồng rừng;\n2- Lập qui hoạch, kế hoạch bảo vệ,\nphát triển rừng và sử dụng rừng, đất trồng rừng trên phạm vi cả nước và ở từng\nđịa phương;\n3- Quy định và tổ chức thực hiện các chế độ, thể lệ về quản lý, bảo vệ, phát triển rừng và sử dụng rừng, đất trồng rừng;\n4- Giao rừng, đất trồng rừng;\nthu hồi rừng, đất trồng rừng;\n5- Đăng ký, lập và giữ sổ địa chính, cấp giấy chứng nhận quyền sử dụng rừng, đất trồng rừng;\n6- Kiểm tra, thanh tra việc chấp hành các chế độ, thể lệ về quản lý, bảo vệ, phát triển rừng và sử dụng rừng, đất trồng rừng và xử lý các vi phạm chế độ, thể lệ đó;\n7- Giải quyết tranh chấp về rừng,\nđất trồng rừng.\nĐiều 9 Hội đồng bộ trưởng thực hiện việc thống nhất quản lý Nhà nước về rừng và đất trồng rừng trong phạm vi cả nước.\nUỷ ban nhân dân các cấp thực hiện chức năng quản lý Nhà nước về rừng và đất trồng rừng trong phạm vi địa phương mình theo quy hoạch, kế hoạch, chế độ, thể lệ của Nhà nước.\nBộ Lâm nghiệp và cơ quan quản lý\nNhà nước về lâm nghiệp ở địa phương giúp Hội đồng bộ trưởng và Uỷ ban nhân dân các cấp tổ chức thực hiện việc quản lý Nhà nước về rừng và đất trồng rừng trong phạm vi cả nước và ở từng địa phương, theo chức năng, nhiệm vụ, quyền hạn của mình.\nĐiều 10 Việc quyết định giao rừng, đất trồng rừng phải căn cứ vào:\n1- Quy hoạch, kế hoạch bảo vệ,\nphát triển rừng và sử dụng rừng, đất trồng rừng đã được cơ quan Nhà nước có thẩm quyền xét duyệt;\n2- Quỹ rừng, đất trồng rừng;\n3- Yêu cầu, khả năng của tổ chức,\ncá nhân trong việc quản lý, sử dụng rừng, đất trồng rừng.\nĐiều 11 Thẩm quyền xác lập các khu rừng và giao rừng, đất trồng rừng được quy định như sau:\n1- Chủ tịch Hội đồng bộ trưởng quyết định xác lập và giao:\na) Các khu rừng phòng hộ, rừng đặc dụng có tầm quan trọng quốc gia cho các Ban quản lý thuộc Bộ lâm nghiệp hoặc cơ\nquan khác thuộc Hội đồng bộ trưởng;\nb) Các khu rừng sản xuất quan trọng cho tổ chức lâm nghiệp quốc doanh trong trường hợp cần thiết.\n2- Chủ tịch Uỷ ban nhân dân cấp tỉnh quyết định xác lập và giao:\na) Các khu rừng phòng hộ, rừng đặc dụng có tầm quan trọng quốc gia theo uỷ quyền của Hội đồng bộ trưởng, các khu rừng phòng hộ, rừng đặc dụng có tầm quan trọng địa phương cho các ban quản lý thuộc Uỷ ban nhân dân cấp tỉnh;\nb) Các khu rừng sản xuất ở địa phương cho tổ chức kinh tế, tổ chức xã hội, đơn vị lực lượng vũ trang nhân dân,\ndoanh nghiệp tư nhân theo quy hoạch của Nhà nước.\n3- Chủ tịch Uỷ ban nhân dân cấp huyện quyết định giao rừng sản xuất cho hợp tác xã, tập đoàn sản xuất và cá\nnhân theo quy hoạch của tỉnh.\nBộ Lâm nghiệp và cơ quan quản lý\nNhà nước về lâm nghiệp ở địa phương phối hợp với cơ quan quản lý đất đai cùng cấp giúp Chủ tịch Hội đồng bộ trưởng và Chủ tịch Uỷ ban nhân dân các cấp trong việc giao rừng, đất trồng rừng theo quy hoạch.\nĐiều 12 Những diện tích rừng, đất trồng rừng chưa giao cho tổ chức, cá nhân nào thì Bộ lâm nghiệp và cơ quan quản lý\nNhà nước về lâm nghiệp ở địa phương giúp Hội đồng bộ trưởng và Uỷ ban nhân dân các cấp tổ chức quản lý và có kế hoạch từng bước đưa vào sử dụng.\nĐiều 13 Việc giao rừng, đất trồng rừng để\nsử dụng vào mục đích khác phải tuân theo quy định tại khoản 2 và\nđiểm b, khoản 3, Điều 13 của Luật đất đai.\nTổ chức, cá nhân được giao rừng,\nđất trồng rừng để sử dụng vào mục đích khác phải đền bù, bồi hoàn giá trị của rừng,\nđất trồng rừng, thành quả lao động, kết quả đầu tư theo thời giá thị trường và\nhiện trạng của rừng, đất trồng rừng theo quy định của pháp luật.\nĐiều 14 Nhà nước thu hồi toàn bộ hoặc một phần rừng, đất trồng rừng đã giao sử dụng trong những trường hợp sau đây:\n1- Tổ chức bị giải thể hoặc cá\nnhân là chủ rừng đã chết mà không có người được tiếp tục sử dụng theo quy định của pháp luật;\n2- Chủ rừng tự nguyện trả lại rừng,\nđất trồng rừng;\n3- Trong mười hai tháng liền chủ\nrừng không tiến hành các hoạt động bảo vệ, chăm sóc, gây trồng rừng theo phương\nán đã được cơ quan Nhà nước có thẩm quyền xét duyệt mà không có lý do chính\nđáng;\n4- Chủ rừng sử dụng rừng, đất trồng rừng không đúng mục đích hoặc vi phạm nghiêm trọng quy định của pháp luật về bảo vệ, phát triển rừng và sử dụng rừng, đất trồng rừng;\n5- Cần sử dụng rừng, đất trồng rừng cho nhu cầu quan trọng của Nhà nước, của xã hội hoặc cho nhu cầu khẩn cấp của chiến tranh hoặc chống thiên tai.\nĐiều 15 Thẩm quyền thu hồi rừng, đất trồng rừng được quy định như sau:\n1- Cơ quan Nhà nước có thẩm quyền giao rừng, đất trồng rừng nào thì có quyền thu hồi rừng, đất trồng rừng đó;\ntrong trường hợp cần thu hồi rừng, đất trồng rừng cho nhu cầu quan trọng của Nhà nước, của xã hội quy định tại điểm 5, Điều 14 của Luật này, thì quyết định thu hồi phải được cơ quan chính quyền cấp trên trực tiếp phê chuẩn.\n2- Chủ tịch Uỷ ban nhân dân cấp huyện trở lên có quyền quyết định thu hồi rừng, đất trồng rừng cho nhu cầu khẩn cấp quy định tại điểm 5, Điều 14 của Luật này và phải báo cáo ngay với cơ quan chính quyền cấp trên trực tiếp.\nĐiều 16 Thẩm quyền giải quyết tranh chấp về quyền sử dụng đất có rừng, đất trồng rừng được áp dụng theo quy định tại Điều 21 của Luật đất đai.\nĐiều 17 Các tranh chấp về thực vật rừng,\nđộng vật rừng, công trình kiến trúc, tài sản khác và về việc đền bù thiệt hại,\nbồi hoàn thành quả lao động, kết quả đầu tư trên đất có rừng, đất trồng rừng do Toà án nhân dân giải quyết.\nKhi giải quyết các tranh chấp nói tại Điều này mà có liên quan đến quyền sử dụng đất có rừng, đất trồng rừng,\nthì Toà án nhân dân giải quyết cả quyền sử dụng đất có rừng, đất trồng rừng đó.\nChương 3: \nBẢO VÊ RỪNG \nĐiều 18 Uỷ ban nhân dân các cấp theo chức năng, nhiệm vụ, quyền hạn của mình và chủ rừng phải tổ chức quản lý, bảo vệ vốn rừng hiện có; phòng, chống các hành vi gây thiệt hại đến rừng; thực hiện các biện pháp bảo vệ, nuôi dưỡng, phát triển thực vật rừng, động vật rừng; bảo vệ nguồn nước, bảo vệ đất, chống xói mòn.\nĐiều 19 Việc khai thác các loại thực vật rừng, săn bắt động vật rừng phải tuân theo quy định của Nhà nước về quản lý, bảo vệ thực vật rừng, động vật rừng.\nNhững loài thực vật rừng, động vật rừng quý, hiếm phải được quản lý, bảo vệ theo chế độ đặc biệt.\nDanh mục và chế độ quản lý, bảo vệ những loài thực vật rừng, động vật rừng quý,\nhiếm do Hội đồng bộ trưởng quy định.\nĐiều 20 Nghiêm cấm mọi hành vi phá rừng,\nđốt rừng; lấn, chiếm rừng, đất trồng rừng; khai thác, mua bán, vận chuyển lâm sản,\nsăn bắt động vật rừng, chăn thả gia súc vào rừng trái quy định của pháp luật.\nĐiều 21\nỞ vùng rừng núi, căn cứ vào quy hoạch lâm nghiệp, Uỷ ban nhân dân cấp huyện quy vùng và hướng dẫn nhân dân làm nương rẵy định canh, thâm canh, luân canh, chăn thả gia súc, sản xuất nông -\nlâm - ngư nghiệp kết hợp.\nĐiều 22 Chủ rừng phải thực hiện các biện pháp phòng cháy, chữa cháy rừng và phải chịu trách nhiệm về việc gây ra cháy rừng.\nCơ quan quản lý Nhà nước về lâm nghiệp các cấp có trách nhiệm xây dựng và chỉ đạo thực hiện phương án phòng cháy, chữa cháy rừng; tổ chức công tác dự báo cháy rừng; tổ chức lực lượng và\ntrang bị các phương tiện, kỹ thuật cần thiết về phòng cháy, chữa cháy rừng. Các cơ quan quản lý Nhà nước thuộc ngành có liên quan có trách nhiệm phối hợp với cơ quan quản lý Nhà nước về lâm nghiệp trong công tác phòng cháy, chữa cháy rừng.\nMọi tổ chức, cá nhân hoạt động ở\ntrong rừng và ven rừng phải tuân theo các quy định về phòng cháy, chữa cháy rừng của cơ quan quản lý Nhà nước về lâm nghiệp.\nKhi xảy ra cháy rừng, Uỷ ban nhân dân các cấp có quyền huy động mọi lực lượng, phương tiện cần thiết để kịp thời chữa cháy rừng.\nĐiều 23 Chủ rừng phải thực hiện các biện pháp phòng, trừ sâu, bệnh hại rừng.\nCơ quan quản lý Nhà nước về lâm nghiệp các cấp có trách nhiệm phối hợp với cơ quan có liên quan tổ chức công tác dự báo sâu, bệnh hại rừng; hướng dẫn các biện pháp phòng, trừ sâu, bệnh hại rừng; tổ chức diệt trừ khi có dịch sâu, bệnh hại rừng.\nNhà nước khuyến khích áp dụng các biện pháp lâm sinh, sinh học vào việc phòng, trừ sâu, bệnh hại rừng.\nĐiều 24 Mọi tổ chức, cá nhân khi cần tiến hành các hoạt động ở trong rừng, thì phải tuân thủ các quy định về bảo vệ rừng;\nnếu hoạt động dài ngày hoặc có thể gây thiệt hại đến rừng, đất trồng rừng, thì\nphải được chủ rừng chấp thuận hoặc được cơ quan quản lý Nhà nước về lâm nghiệp có thẩm quyền cho phép.\nMọi tổ chức, cá nhân tiến hành các hoạt động ở vùng lân cận rừng mà có ảnh hưởng đến việc bảo vệ, phát triển rừng,\nthì phải tuân theo các quy định về bảo vệ rừng, bảo vệ môi trường sinh thái.\nTrong trường hợp tổ chức, cá\nnhân nói tại đoạn 1, đoạn 2, Điều này gây thiệt hại đến rừng, đất trồng rừng,\nthì phải đền bù.\nĐiều 25 Việc xuất khẩu thực vật rừng, động vật rừng phải được Bộ Lâm nghiệp cho phép.\nViệc nhập nội giống thực vật rừng,\nđộng vật rừng phải bảo đảm những nguyên tắc sinh học và những quy định về kiểm dịch quốc gia, không gây hại đến hệ sinh thái và phải được Bộ Lâm nghiệp cho phép.\nChương 4:\nPHÁT TRIỂN RỪNG, SỦ DỤNG RỪNG VÀ ĐẤT TRỒNG RỪNG Mục 1: RỪNG PHÒNG HỘ \nĐiều 26 Rừng phòng hộ được sử dụng chủ yếu\nđể bảo vệ nguồn nước, bảo vệ đất, chống xói mòn, hạn chế thiên tai, điều hoà\nkhí hậu, góp phần bảo vệ môi trường sinh thái.\nRừng phòng hộ được phân thành các loại: rừng phòng hộ đầu nguồn; rừng phòng hộ chắn gió, chắn cát bay; rừng phòng hộ chắn sóng, lấn biển; rừng phòng hộ bảo vệ môi trường sinh thái.\nĐiều 27 Nhà nước có chính sách điều hoà,\nhuy động, thu hút các nguồn vốn của tổ chức, cá nhân trong nước và ngoài nước để\nđầu tư xây dựng rừng phòng hộ ổn định, lâu dài.\nĐiều 28\nỞ mỗi khu rừng phòng hộ phải thành lập Ban quản lý.\nBan quản lý khu rừng phòng hộ phải lập và trình cơ quan Nhà nước có thẩm quyền xét duyệt phương án quản lý, sử dụng rừng, đất trồng rừng và thực hiện phương án đã được duyệt.\nĐiều 29 Việc quản lý, sử dụng rừng phòng hộ phải tuân theo quy định sau đây:\n1- Có kế hoạch, biện pháp bảo vệ,\nnuôi dưỡng rừng hiện có, gây trồng rừng trên đất trống, đồi núi trọc, kinh doanh đặc sản rừng, động vật rừng và kết hợp sản xuất nông nghiệp, nuôi trồng thuỷ sản;\nRừng phòng hộ đầu nguồn phải xây dựng rừng thành rừng tập trung, liên vùng, rừng nhiều tầng;\nRừng phòng hộ chắn gió, chắn cát bay, chắn sóng, lấn biển, bảo vệ môi trường sinh thái phải được xây dựng thành các đai rừng phù hợp với điều kiện tự nhiên ở từng vùng;\n2- Trong quá trình bảo vệ, nuôi dưỡng, gây trồng rừng phòng hộ, việc tận thu lâm sản và sản xuất kinh doanh kết hợp không được gây hại đến tác dụng phòng hộ của rừng; mọi trường hợp khai thác lâm sản, phải theo đúng phương án quản lý, sử dụng rừng phòng hộ đã được cơ\nquan Nhà nước có thẩm quyền xét duyệt và chấp hành quy phạm, quy trình kỹ thuật lâm nghiệp;\n3- Tổ chức, cá nhân được giao hoặc nhận khoán bảo vệ, gây trồng và chăm sóc rừng phòng hộ được hưởng sản phẩm do mình kết hợp làm ra.\nĐiều 30 Cơ quan Nhà nước có thẩm quyền khi xét duyệt phương án quản lý, sử dụng các khu rừng phòng hộ mà có liên quan\nđến lĩnh vực quản lý của ngành khác, thì phải tham khảo ý kiến của cơ quan quản lý cùng cấp của ngành đó.\nMục 2: RỪNG ĐẶC DỤNG \nĐiều 31 Rừng đặc dụng được sử dụng chủ yếu\nđể bảo tồn thiên nhiên, mẫu chuẩn hệ sinh thái rừng của quốc gia, nguồn gien thực vật, động vật rừng; nghiên cứu khoa học; bảo vệ di tích lịch sử, văn hoá và\ndanh lam thắng cảnh; phục vụ nghỉ ngơi, du lịch.\nRừng đặc dụng được phân thành các loại: vườn quốc gia; khu rừng bảo tồn thiên nhiên; khu rừng văn hoá - xã hội,\nnghiên cứu thí nghiệm.\nRanh giới của khu rừng đặc dụng phải được xác định bằng hệ thống biển báo, mốc kiên cố.\nĐiều 32 Nhà nước có chính sách điều hoà,\nhuy động, thu hút các nguồn vốn của tổ chức, cá nhân trong nước và ngoài nước để\nđầu tư xây dựng, bảo tồn lâu dài các khu rừng đặc dụng.\nĐiều 33\nỞ mỗi khu rừng đặc dụng phải thành lập Ban quản lý.\nBan quản lý khu rừng đặc dụng phải lập và trình cơ quan Nhà nước có thẩm quyền xét duyệt phương án quản lý, sử dụng và thực hiện phương án đã được duyệt.\nĐiều 34 Việc quản lý, sử dụng rừng đặc dụng phải tuân theo quy chế rừng đặc dụng. Ban quản lý khu rừng đặc dụng được tiến hành một số hoạt động dịch vụ về nghiên cứu khoa học, văn hoá, xã hội và du lịch theo quy định của pháp luật.\nTổ chức, cá nhân tiến hành các hoạt động ở khu rừng đặc dụng phải được phép của Ban quản lý khu rừng và phải tuân theo nội quy bảo vệ khu rừng đó.\nĐiều 35 Các khu vực bảo tồn nguyên vẹn thuộc các vườn quốc gia, khu rừng bảo tồn thiên nhiên phải được quản lý, bảo vệ\nnghiêm ngặt; nghiêm cấm mọi hành vi gây tác hại đến rừng.\nViệc tiến hành các hoạt động tham quan, nghiên cứu khoa học trong khu vực bảo tồn nguyên vẹn phải được phép của Ban quản lý khu rừng và phải tuân theo quy định sau đây:\n1- Không được làm thay đổi cảnh quan tự nhiên của khu rừng;\n2- Không được mang hoá chất độc hại, chất nổ, chất dễ cháy vào rừng và không được đốt lửa ở trong rừng;\n3- Không được gây ô nhiễm môi trường sinh thái;\n4- Khi cần lấy mẫu thực vật rừng,\nđộng vật rừng, khoáng vật ở trong rừng để phục vụ nghiên cứu khoa học, phải được cơ quan quản lý Nhà nước về lâm nghiệp có thẩm quyền cho phép.\nMục 3: RỪNG SẢN XUẤT \nĐiều 36 Rừng sản xuất được sử dụng chủ yếu\nđể sản xuất, kinh doanh gỗ, các lâm nghiệp khác, đặc sản rừng, động vật rừng và\nkết hợp phòng hộ, bảo vệ môi trường sinh thái.\nRừng sản xuất được Nhà nước giao cho tổ chức, cá nhân thuộc các thành phần kinh tế có đủ điều kiện quy định tại điểm 3, Điều 10 của Luật này để sản xuất, kinh doanh theo hướng thâm canh, nông -\nlâm - ngư nghiệp kết hợp.\nNhà nước khuyến khích và giúp đỡ\ntổ chức, cá nhân nhận đất gây trồng rừng ở những vùng đất trống, đồi núi trọc;\ncó chính sách hỗ trợ nhân dân ở nơi có nhiều khó khăn trong việc gây trồng rừng,\ntổ chức sản xuất, chế biến và tiêu thụ sản phẩm, xây dựng đồng bộ kết cấu hạ tầng.\nBộ Lâm nghiệp và cơ quan quản lý\nNhà nước về lâm nghiệp ở địa phương có nhiệm vụ quy hoạch và xây dựng hệ thống rừng giống quốc gia và khu vực để chọn lọc, lai tạo, nhân giống và nhập nội các loại giống cần thiết, bảo đảm cung cấp giống tốt cho cả nước.\nĐiều 37 Chủ rừng được Nhà nước giao rừng tự nhiên, khi tiến hành sản xuất, kinh doanh, phải tuân theo quy định sau đây:\n1- Lập và trình cơ quan Nhà nước có thẩm quyền xét duyệt phương án sản xuất, kinh doanh và chịu trách nhiệm trước Nhà nước về vốn rừng được giao; tổ chức bảo vệ, nuôi dưỡng, khai thác hợp lý,\nduy trì và phát triển vốn rừng đó;\n2- Những diện tích rừng nghèo kiệt,\nphải khoanh đóng bảo vệ, nuôi dưỡng làm giầu rừng hoặc trồng lại rừng;\n3- Khai thác rừng phải có thiết kế khai thác được cơ quan Nhà nước có thẩm quyền xét duyệt và chấp hành quy phạm,\nquy trình kỹ thuật lâm nghiệp; sau khai thác phải đóng cửa rừng và tổ chức bảo vệ, nuôi dưỡng cho đến kỳ khai thác sau.\nĐiều 38 Chủ rừng được Nhà nước giao đất trồng rừng, khi tiến hành sản xuất, kinh doanh, phải tuân theo quy định sau\nđây:\n1- Có kế hoạch gây trồng, chăm sóc, bảo vệ phù hợp với quy hoạch lâm nghiệp từng vùng;\n2- Khai thác rừng đủ tuổi khai thác;\n3- Sau khai thác phải trồng lại rừng vào thời vụ trồng ngay sau đó hoặc thực hiện biện pháp tái sinh tự nhiên ngay trong quá trình khai thác.\nĐiều 39 Việc khai thác các loại đặc sản rừng ở rừng sản xuất cũng như ở các loại rừng khác phải tuân theo quy định của Nhà nước về quản lý, bảo vệ, phát triển và sử dụng đặc sản rừng.\nChương 5:\nQUYỀN LỢI VÀ NGHĨA VU CỦA CHỦ RỪNG \nĐiều 40 Chủ rừng có những quyền lợi sau\nđây:\n1- Được sử dụng rừng, đất trồng rừng ổn định, lâu dài theo quy hoạch, kế hoạch của Nhà nước; được chủ động trong sản xuất, kinh doanh, trong quản lý, sử dụng rừng theo quy định của pháp luật;\n2- Được hưởng thành quả lao động,\nkết quả đầu tư trên diện tích rừng, đất trồng rừng được giao; để thừa kế, chuyển nhượng, bán thành quả lao động, kết quả đầu tư cho người khác theo quy định của pháp luật;\n3- Được đền bù, bồi hoàn thành quả lao động, kết quả đầu tư trên đất có rừng, đất trồng rừng được giao theo thời giá thị trường và hiện trạng của rừng, đất trồng rừng trong trường hợp thu hồi rừng, đất trồng rừng quy định tại các điểm 1, 2 và 5, Điều 14 của Luật này,\ntheo quy định của pháp luật;\n4- Được hướng dẫn về kỹ thuật, hỗ\ntrợ về vốn theo chính sách của Nhà nước và được hưởng lợi ích do các công trình công cộng bảo vệ, cải tạo rừng, đất trồng rừng mang lại;\n5- Được Nhà nước bảo hộ quyền và\nlợi ích hợp pháp trên diện tích rừng, đất trồng rừng được giao.\nĐiều 41 Chủ rừng có những nghĩa vụ sau\nđây:\n1- Sử dụng rừng, đất trồng rừng\nđúng mục đích, đúng ranh giới đã quy định trong quyết định giao rừng, đất trồng rừng và theo quy chế quản lý, sử dụng đối với từng loại rừng;\n2- Chấp hành quy định của pháp luật về quản lý, bảo vệ, phát triển rừng và sử dụng rừng, đất trồng rừng;\n3- Đền bù, bồi hoàn theo thời giá thị trường và hiện trạng của rừng, đất trồng rừng cho chủ có rừng, đất trồng rừng bị thu hồi để giao cho mình, theo quy định của pháp luật;\n4- Nộp thuế theo quy định của pháp luật.\nChương 6:\nQUAN HỆ VÀ HỢP TÁC QUỐC TẾ TRONG VIỆC BẢO VỆ, PHÁT TRIỂN RỪNG VÀ SỬ DỤNG RỪNG, ĐẤT TRỒNG RỪNG \nĐiều 42 Nhà nước Cộng hoà xã hội chủ\nnghĩa Việt Nam mở rộng quan hệ và hợp tác với các nước, tổ chức quốc tế, tổ chức,\ncá nhân nước ngoài trong lĩnh vực điều tra cơ bản, nghiên cứu khoa học, chuyển giao công nghệ, đào tạo kỹ thuật, nghiệp vụ, bảo vệ rừng, gây trồng rừng và chế\nbiến lâm sản.\nĐiều 43 Nhà nước Cộng hoà xã hội chủ\nnghĩa Việt Nam có chính sách khuyến khích tổ chức, cá nhân nước ngoài đầu tư\nvào việc bảo vệ rừng, gây trồng rừng và chế biến lâm sản theo quy định của Luật này và Luật đầu tư nước ngoài tại Việt Nam.\nViệc giao rừng, đất trồng rừng cho tổ chức, cá nhân nước ngoài sử dụng do Hội đồng bộ trưởng quyết định.\nHội đồng bộ trưởng ban hành những quy định nhằm tạo điều kiện thuận lợi cho người Việt Nam định cư ở nước ngoài đầu tư về nước để phát triển lâm nghiệp.\nĐiều 44 Các quan hệ quốc tế, các văn bản thoả thuận về hợp tác quốc tế, các hợp đồng có liên quan đến việc sử dụng rừng,\nđất trồng rừng tại Việt Nam phải phù hợp với quy định của Luật này và pháp luật của Việt Nam có liên quan, trừ trường hợp điều ước quốc tế mà Việt Nam ký kết hoặc tham gia có quy định khác.\nChương 7:\nTỔ CHỨC KIỂM LÂM\nĐiều 45 Kiểm lâm là lực lượng chuyên trách có chức năng quản lý rừng và bảo vệ rừng, được tổ chức thành hệ thống, đặt dưới sự lãnh đạo thống nhất của Bộ trưởng Bộ Lâm nghiệp và sự chỉ đạo, kiểm tra của cơ quan chính quyền địa phương.\nĐiều 46 1- Kiểm lâm có nhiệm vụ:\na) Kiểm tra, thanh tra việc thi hành pháp luật về rừng; đấu tranh ngăn ngừa những hành vi vi phạm pháp luật về\nrừng;\nb) Thực hiện việc quản lý rừng và bảo vệ rừng;\nc) Tuyên truyền, vận động nhân dân bảo vệ và xây dựng vốn rừng.\n2- Khi thi hành nhiệm vụ, nhân viên kiểm lâm có quyền:\na) Yêu cầu tổ chức, cá nhân liên quan cung cấp tài liệu cần thiết cho việc kiểm tra, thanh tra; tiến hành kiểm tra hiện trường;\nb) Tạm thời đình chỉ hoặc đình chỉ những hành vi có dấu hiệu vi phạm pháp luật hoặc những hoạt động có nguy cơ\ngây thiệt hại đến tài nguyên rừng; kiến nghị với cơ quan Nhà nước có thẩm quyền xử lý;\nc) Xử phạt vi phạm hành chính;\nkhởi tố, điều tra hình sự đối với những hành vi vi phạm pháp luật về rừng, theo quy định của pháp luật.\n3- Cơ quan Nhà nước, tổ chức kinh tế, tổ chức xã hội, đơn vị lực lượng vũ trang nhân dân và mọi công dân có\ntrách nhiệm giúp đỡ, bảo vệ, giám sát nhân viên kiểm lâm trong khi thi hành nhiệm vụ.\nĐiều 47 Nhân viên kiểm lâm được trang bị\nđồng phục, phù hiệu, cấp hiệu và những phương tiện cần thiết để hoạt động.\nĐiều 48 Hội đồng bộ trưởng quy định hệ\nthống tổ chức, nhiệm vụ, quyền hạn của lực lượng kiểm lâm; tiêu chuẩn về năng lực,\nphẩm chất và chế độ đãi ngộ đối với nhân viên kiểm lâm.\nChương 8:\nKHEN THƯỞNG VÀ XỬ LÝ VI PHẠM \nĐiều 49 Tổ chức, cá nhân có thành tích xuất sắc trong việc bảo vệ và phát triển tài nguyên rừng, ngăn chặn các hành vi gây thiệt hại đến rừng, đất trồng rừng thì được khen thưởng; những người tham gia bảo vệ rừng, đấu tranh chống các hành vi vi phạm pháp luật về rừng mà bị\nthiệt hại về tài sản hoặc tính mạng, thì được đền bù, đãi ngộ, theo chế độ\nchung của Nhà nước.\nĐiều 50 Người phá rừng, đốt rừng, huỷ hoại tài nguyên rừng; săn bắt trái phép động vật rừng; mua bán, kinh doanh, vận chuyển trái phép lâm sản hoặc vi phạm các quy định khác của pháp luật về rừng, thì tuỳ\ntheo mức độ mà bị xử phạt vi phạm hành chính hoặc truy cứu trách nhiệm hình sự\ntheo quy định của pháp luật.\nĐiều 51 Người lợi dụng chức vụ, quyền hạn hoặc vượt quá quyền hạn giao rừng, đất trồng rừng, thu hồi rừng, đất trồng rừng;\ncho phép chuyển mục đích sử dụng rừng, đất trồng rừng hoặc cho phép sử dụng rừng,\nlâm sản trái với quy định của pháp luật; thiếu tinh thần trách nhiệm hoặc lợi dụng chức vụ, quyền hạn trong việc thi hành pháp luật về rừng; bao che cho người vi phạm pháp luật về rừng hoặc vi phạm những quy định khác của Luật này, thì tuỳ\ntheo mức độ mà bị xử lý kỷ luật hoặc truy cứu trách nhiệm hình sự theo quy định của pháp luật.\nĐiều 52 Người có hành vi vi phạm pháp luật về rừng mà gây thiệt hại cho Nhà nước, tổ chức, cá nhân, thì ngoài việc bị xử\nlý theo quy định tại Điều 50 và Điều 51 của Luật này còn phải bồi thường thiệt hại theo quy định của pháp luật.\nChương 9:\nĐIỀU KHOẢN CUỐI CÙNG \nĐiều 53 Hội đồng bộ trưởng quy định chi tiết thi hành Luật này và ban hành chế độ quản lý, bảo vệ, phát triển và sử dụng\nđối với cây lâm nghiệp trồng tập trung hoặc phân tán trên đất không phải đất lâm nghiệp.\nĐiều 54 Những quy định trước đây trái với Luật này đều bãi bỏ.\nLuật này đã được Quốc hội nước Cộng hoà xã hội chủ nghĩa Việt Nam khoá VIII, kỳ họp thứ 9 thông qua ngày 12 tháng 8 năm 1991. \nVõ\n Chí Công\n (Đã\n ký)"
}