{
  "url": "https://thuvienphapluat.vn/van-ban/Bo-may-hanh-chinh/Luat-To-chuc-Quoc-hoi-1992-66-LCT-HDNN8-38240.aspx",
  "title": "Luật Tổ chức Quốc hội 1992 66-LCT/HĐNN8",
  "properties": {
    "Số hiệu": "66-LCT/HĐNN8",
    "Loại văn bản": "Luật",
    "Nơi ban hành": "Quốc hội",
    "Người ký": "Võ Chí Công",
    "Ngày ban hành": "15/04/1992",
    "Ngày hiệu lực": "Đã biết",
    "Ngày công báo": "Đã biết",
    "Số công báo": "Đã biết",
    "Tình trạng": "Đã biết"
  },
  "content": "QUỐC HỘI\n ********\nCỘNG HOÀ XÃ HỘI CHỦ NGHĨA VIỆT NAM\n Độc lập - Tự do - Hạnh phúc\n ********\nSố: 66-LCT/HĐNN8 Hà Nội, ngày 15 tháng 4 năm 1992 LUẬT CỦA QUỐC HỘI SỐ 66-LCT/HĐNN8 NGÀY 15/04/1992 VỀ TỔ CHỨC QUỐC HỘI Căn cứ vào Chương VI Hiến pháp năm 1992 của nước Cộng hoà xã hội chủ nghĩa Việt Nam, Luật này quy định về tổ chức và hoạt động của Quốc hội, Uỷ ban thường vụ Quốc hội, Hội đồng và các Uỷ ban của Quốc hội; về nhiệm vụ, quyền hạn của các đại biểu Quốc hội. \nChương 1:\nNHỮNG QUY ĐỊNH CHUNG\nĐiều 1 Quốc hội là cơ quan đại biểu cao nhất của nhân dân, cơ quan quyền lực Nhà nước cao nhất của nước Cộng hoà xã hội chủ nghĩa Việt Nam.\nQuốc hội là cơ quan duy nhất có\nquyền lập hiến và lập pháp.\nQuốc hội quyết định những chính sách cơ bản về đối nội và đối ngoại, nhiệm vụ kinh tế - xã hội, quốc phòng, an ninh của đất nước, những nguyên tắc chủ yếu về tổ chức và hoạt động của bộ máy Nhà nước, về quan hệ xã hội và hoạt động của công dân;\nQuốc hội thực hiện quyền giám sát tối cao đối với toàn bộ hoạt động của Nhà nước.\nĐiều 2 Quốc hội có những nhiệm vụ và\nquyền hạn sau đây:\n1- Làm Hiến pháp và sửa đổi Hiến pháp; làm Luật và sửa đổi Luật; quyết định chương trình xây dựng luật, pháp lệnh;\n2- Thực hiện quyền giám sát tối cao việc tuân theo Hiến pháp, Luật và Nghị quyết của Quốc hội; xét báo cáo hoạt động của Chủ tịch nước, Uỷ ban thường vụ Quốc hội, Chính phủ, Toà án nhân dân tối cao, Viện kiểm sát nhân dân tối cao;\n3- Quyết định kế hoạch phát triển kinh tế - xã hội của đất nước;\n4- Quyết định chính sách tài chính, tiền tệ quốc gia; quyết định dự toán ngân sách Nhà nước và phân bổ ngân sách Nhà nước, phê chuẩn quyết toán ngân sách Nhà nước; quy định, sửa đổi hoặc bãi bỏ các thứ thuế;\n5- Quyết định chính sách dân tộc của Nhà nước;\n6- Quy định tổ chức và hoạt động của Quốc hội, Chủ tịch nước, Chính phủ, Toà án nhân dân, Viện kiểm sát nhân dân và chính quyền địa phương;\n7- Bầu, miễn nhiệm, bãi nhiệm Chủ\ntịch nước, Phó Chủ tịch nước, Chủ tịch Quốc hội, các Phó Chủ tịch Quốc hội và\ncác ủy viên Uỷ ban thường vụ Quốc hội, Thủ tướng Chính phủ, Chánh án Toà án nhân dân tối cao, Viện trưởng Viện kiểm sát nhân dân tối cao; phê chuẩn đề nghị\ncủa Chủ tịch nước về việc thành lập Hội đồng quốc phòng và an ninh; phê chuẩn đề\nnghị của Thủ tướng Chính phủ về việc bổ nhiệm, miễn nhiệm, cách chức Phó Thủ tướng,\nBộ trưởng và các thành viên khác của Chính phủ;\n8- Quyết định thành lập, bãi bỏ\ncác Bộ và các cơ quan ngang Bộ của Chính phủ; thành lập mới, nhập, chia, điều chỉnh địa giới tỉnh, thành phố trực thuộc trung ương; thành lập hoặc giải thể\nđơn vị hành chính - kinh tế đặc biệt;\n9- Bãi bỏ các văn bản của Chủ tịch nước, Uỷ ban thường vụ Quốc hội, Chính phủ, Thủ tướng Chính phủ, Toà án nhân dân tối cao và Viện kiểm sát nhân dân tối cao trái với Hiến pháp, luật và nghị\nquyết của Quốc hội;\n10- Quyết định đại xá;\n11- Quy định hàm, cấp trong các lực lượng vũ trang nhân dân, hàm, cấp ngoại giao và những hàm, cấp Nhà nước khác; quy định huân chương, huy chương và danh hiệu vinh dự Nhà nước;\n12- Quyết định vấn đề chiến tranh và hoà bình; quy định về tình trạng khẩn cấp, các biện pháp đặc biệt khác bảo đảm quốc phòng và an ninh quốc gia;\n13- Quyết định chính sách cơ bản về đối ngoại; phê chuẩn hoặc bãi bỏ các điều ước quốc tế đã ký kết hoặc tham gia theo đề nghị của Chủ tịch nước;\n14- Quyết định việc trưng cầu ý\ndân.\nĐiều 3 Quốc hội tổ chức và hoạt động theo nguyên tắc tập trung dân chủ; làm việc theo chế độ hội nghị và quyết định theo đa số.\nHiệu quả hoạt động của Quốc hội\nđược bảo đảm bằng hiệu quả của các kỳ họp của Quốc hội, hoạt động của Uỷ ban thường vụ Quốc hội, Hội đồng, Uỷ ban của Quốc hội, Đoàn đại biểu Quốc hội và\ncác đại biểu Quốc hội.\nĐiều 4 Khi thực hiện nhiệm vụ, quyền hạn của mình, Quốc hội, Uỷ ban thường vụ Quốc hội, Hội đồng, Uỷ ban của Quốc hội và\ncác đại biểu Quốc hội dựa vào sự tham gia của Uỷ ban Mặt trận Tổ quốc Việt Nam,\ncác tổ chức xã hội và của công dân.\nCơ quan Nhà nước, tổ chức xã hội,\ntổ chức kinh tế, đơn vị vũ trang, trong phạm vi chức năng, nhiệm vụ của mình,\ncó trách nhiệm tạo điều kiện để Hội đồng, ban và các đại biểu Quốc hội làm nhiệm vụ.\nChương 2:\nCHỦ TỊCH QUỐC HỘI VÀ UỶ\nBAN THƯỜNG VỤ QUỐC HỘI \nĐiều 5 Uỷ ban thường vụ Quốc hội gồm có\nChủ tịch Quốc hội, các Phó Chủ tịch Quốc hội và các ủy viên, do Chủ tịch Quốc hội làm Chủ tịch, các Phó Chủ tịch Quốc hội làm Phó Chủ tịch.\nThành viên của Uỷ ban thường vụ\nQuốc hội không thể đồng thời là thành viên Chính phủ và làm việc theo chế độ\nchuyên trách.\nNhiệm kỳ của Uỷ ban thường vụ Quốc hội theo nhiệm kỳ của Quốc hội. Khi Quốc hội hết nhiệm kỳ, Uỷ ban thường vụ Quốc hội tiếp tục làm nhiệm vụ cho đến khi Quốc hội khoá mới bầu ra Uỷ ban thường vụ\nQuốc hội mới.\nĐiều 6 Uỷ ban thường vụ Quốc hội có những nhiệm vụ và quyền hạn sau đây:\n1- Công bố và chủ trì việc bầu cử\nđại biểu Quốc hội;\n2- Tổ chức việc chuẩn bị, triệu tập và chủ trì các kỳ họp Quốc hội;\n3- Giải thích Hiến pháp, luật,\npháp lệnh;\n4- Ra pháp lệnh về những vấn đề\nđược Quốc hội giao;\n5- Giám sát việc thi hành Hiến pháp, luật, nghị quyết của Quốc hội, pháp lệnh, nghị quyết của Uỷ ban thường vụ\nQuốc hội; giám sát hoạt động của Chính phủ, Toà án nhân dân tối cao, Viện kiểm sát nhân dân tối cao, đình chỉ việc thi hành các văn bản của Chính phủ, Thủ tướng Chính phủ, Toà án nhân dân tối cao, Viện kiểm sát nhân dân tối cao trái với Hiến pháp, luật, nghị quyết của Quốc hội và trình Quốc hội quyết định việc huỷ bỏ\ncác văn bản đó; huỷ bỏ các văn bản của Chính phủ, Thủ tướng Chính phủ, Toà án nhân dân tối cao, Viện kiểm sát nhân dân tối cao trái với pháp lệnh, nghị quyết của Uỷ ban thường vụ Quốc hội;\n6- Giám sát và hướng dẫn hoạt động của Hội đồng nhân dân; bãi bỏ các nghị quyết sai trái của Hội đồng nhân dân tỉnh,\nthành phố trực thuộc trung ương; giải tán Hội đồng nhân dân tỉnh, thành phố trực thuộc trung ương trong trường hợp Hội đồng nhân dân đó làm thiệt hại nghiêm trọng\nđến lợi ích của nhân dân;\n7- Chỉ đạo, điều hoà, phối hợp hoạt động của Hội đồng dân tộc và các Uỷ ban của Quốc hội; hướng dẫn và bảo đảm\nđiều kiện hoạt động của các đại biểu Quốc hội;\n8- Trong thời gian Quốc hội không họp, phê chuẩn đề nghị của Thủ tướng Chính phủ về việc bổ nhiệm, miễn nhiệm,\ncách chức Phó Thủ tướng, Bộ trưởng, các thành viên khác của Chính phủ và báo cáo với Quốc hội tại kỳ họp gần nhất của Quốc hội;\n9- Trong thời gian Quốc hội không họp, quyết định việc tuyên bố tình trạng chiến tranh khi nước nhà bị xâm lược và trình Quốc hội phê chuẩn quyết định đó tại kỳ họp gần nhất của Quốc hội;\n10- Quyết định tổng động viên hoặc\nđộng viên cục bộ; ban bố tình trạng khẩn cấp trong cả nước hoặc ở từng địa phương;\n11- Thực hiện quan hệ đối ngoại của Quốc hội;\n12- Tổ chức trưng cầu ý dân theo quyết định của Quốc hội.\nĐiều 7 Chủ tịch Quốc hội có những nhiệm vụ và quyền hạn sau đây:\n1- Chủ toạ các phiên họp của Quốc hội, bảo đảm thi hành Quy chế đại biểu Quốc hội, Nội quy kỳ họp Quốc hội; ký chứng thực luật, nghị quyết của Quốc hội;\n2- Lãnh đạo công tác của Uỷ ban thường vụ Quốc hội; chỉ đạo việc chuẩn bị, triệu tập và chủ toạ các phiên họp của Uỷ ban thường vụ Quốc hội;\n3- Triệu tập và chủ toạ hội nghị\nChủ tịch Hội đồng dân tộc, Chủ nhiệm Uỷ ban của Quốc hội bàn chương trình hoạt\nđộng của Quốc hội, của Hội đồng và Uỷ ban của Quốc hội; tham dự phiên họp của Hội\nđồng dân tộc và các Uỷ ban của Quốc hội, khi xét thấy cần thiết;\n4- Giữ mối quan hệ với các đại biểu Quốc hội;\n5- Chỉ đạo và tổ chức việc thực hiện ngân sách của Quốc hội;\n6- Chỉ đạo việc thực hiện công tác đối ngoại của Quốc hội; thay mặt Quốc hội trong quan hệ đối ngoại của Quốc hội; lãnh đạo hoạt động của đoàn Quốc hội Việt Nam trong Liên minh Quốc hội thế\ngiới.\nCác Phó Chủ tịch Quốc hội giúp Chủ tịch làm nhiệm vụ theo sự phân công của Chủ tịch.\nĐiều 8 Uỷ ban thường vụ Quốc hội chỉ đạo,\nđiều hoà và phối hợp hoạt động của Hội đồng dân tộc và các Uỷ ban của Quốc hội,\ntriệu tập và chủ trì các kỳ họp của Quốc hội.\nTrong việc chuẩn bị kỳ họp Quốc hội, Uỷ ban thường vụ Quốc hội có những nhiệm vụ và quyền hạn sau đây:\n1- Dự kiến chương trình kỳ họp theo đề nghị của Chủ tịch nước, của Thủ tướng Chính phủ, Chánh án Toà án nhân dân tối cao, Viện trưởng Viện kiểm sát nhân dân tối cao, Hội đồng dân tộc, các Uỷ ban của Quốc hội và các đại biểu Quốc hội;\n2- Chỉ đạo, điều hoà, phối hợp hoạt động của các cơ quan hữu quan trong việc chuẩn bị nội dung kỳ họp; xem xét việc chuẩn bị các dự án luật, các báo cáo và các dự án khác trình Quốc hội;\n3- Quyết định các vấn đề khác liên quan đến kỳ họp Quốc hội.\nĐiều 9 Uỷ ban thường vụ Quốc hội trình Quốc hội quyết định chương trình xây dựng luật, pháp lệnh theo đề nghị của các cơ\nquan, tổ chức và cá nhân có quyền trình dự án luật quy định tại Điều 62 của Luật này.\nĐiều 10 Uỷ ban thường vụ Quốc hội ra pháp lệnh căn cứ vào chương trình xây dựng luật, pháp lệnh đã được Quốc hội thông qua.\nCơ quan, tổ chức, cá nhân có quyền trình dự án luật ra trước Quốc hội đều có quyền trình dự án pháp lệnh ra trước Uỷ ban thường vụ Quốc hội.\nDự án pháp lệnh phải được Hội đồng dân tộc hoặc Uỷ ban hữu quan của Quốc hội thẩm tra trước khi trình Uỷ ban thường vụ Quốc hội. Khi xét thấy cần thiết, Uỷ ban thường vụ Quốc hội quyết định gửi dự\nán pháp lệnh lấy ý kiến đại biểu Quốc hội trước khi thông qua.\nĐiều 11 Uỷ ban thường vụ Quốc hội giám sát hoạt động của Chính phủ, Toà án nhân dân tối cao, Viện kiểm sát nhân dân tối cao trong việc thi hành Hiến pháp, luật, pháp lệnh, nghị quyết của Quốc hội và\nUỷ ban thường vụ Quốc hội.\nUỷ ban thường vụ Quốc hội quyết\nđịnh chương trình giám sát hàng quý và hàng năm; tự mình hoặc giao cho Hội đồng dân tộc và Uỷ ban hữu quan của Quốc hội thực hiện chương trình giám sát; xem xét, thảo luận các báo cáo và kiến nghị trong hoạt động giám sát; yêu cầu cá\nnhân, tổ chức và cơ quan Nhà nước hữu quan thực hiện những kiến nghị mà Uỷ ban thường vụ Quốc hội xét thấy cần thiết.\nĐiều 12 Uỷ ban thường vụ Quốc hội giám sát và hướng dẫn hoạt động của Hội đồng nhân dân; tự mình hoặc theo đề nghị của Thủ tướng Chính phủ, Viện trưởng Viện kiểm sát nhân dân tối cao, Hội đồng dân tộc,\nUỷ ban của Quốc hội hoặc đại biểu Quốc hội bãi bỏ các nghị quyết sai trái của Hội\nđồng nhân dân tỉnh, thành phố trực thuộc trung ương; giải tán Hội đồng nhân dân tỉnh, thành phố trực thuộc trung ương, trong trường hợp Hội đồng nhân dân đó\nlàm thiệt hại nghiêm trọng đến lợi ích của nhân dân.\nĐiều 13 Uỷ ban thường vụ Quốc hội tự\nmình hoặc theo đề nghị của Hội đồng dân tộc, Uỷ ban của Quốc hội hoặc đại biểu Quốc hội huỷ bỏ văn bản của Chính phủ, Thủ tướng Chính phủ, Toà án nhân dân tối cao và Viện kiểm sát nhân dân tối cao trái với pháp lệnh và nghị quyết của Uỷ\nban thường vụ Quốc hội; đình chỉ việc thi hành văn bản của Chính phủ, Thủ tướng Chính phủ, Toà án nhân dân tối cao và Viện kiểm sát nhân dân tối cao trái với Hiến pháp, luật và nghị quyết của Quốc hội và trình Quốc hội quyết định việc huỷ\nbỏ tại kỳ họp gần nhất.\nĐiều 14 Trong thời gian Quốc hội không họp,\nUỷ ban thường vụ Quốc hội phê chuẩn đề nghị của Thủ tướng Chính phủ về việc bổ\nnhiệm, miễn nhiệm, cách chức Phó Thủ tướng, Bộ trưởng, các thành viên khác của Chính phủ và báo cáo với Quốc hội tại kỳ họp gần nhất.\nĐiều 15 Trong thời gian quốc hội không họp,\ntheo đề nghị của Hội đồng quốc phòng và an ninh, quyết định việc tuyên bố tình trạng chiến tranh khi nước nhà bị xâm lược và trình Quốc hội phê chuẩn tại kỳ họp gần nhất; quyết định tổng động viện hoặc động viên cục bộ, ban bố tình trạng khẩn cấp trong cả nước hoặc ở từng địa phương.\nĐiều 16 Trong thời gian giữa hai kỳ họp Quốc hội, Uỷ ban thường vụ Quốc hội xem xét việc Thủ tướng và các thành viên khác của Chính phủ, Chánh án Toà án nhân dân tối cao, Viện trưởng Viện kiểm sát nhân dân tối cao trả lời chất vấn và thực hiện kiến nghị của Hội đồng dân tộc,\ncác Uỷ ban của Quốc hội và đại biểu quốc hội.\nĐiều 17 Uỷ ban thường vụ Quốc hội họp mỗi tháng ít nhất một lần. Chủ tịch Quốc hội dự kiến chương trình làm việc, chỉ đạo việc chuẩn bị, triệu tập và chủ toạ các phiên họp của Uỷ ban thường vụ Quốc hội.\nTài liệu của phiên họp phải được gửi đến các thành viên Uỷ ban thường vụ Quốc hội chậm nhất là bảy ngày, trước ngày họp.\nĐiều 18 Uỷ ban thường vụ quốc hội làm việc theo chế độ hội nghị và quyết định theo đa số. Pháp lệnh, nghị quyết của Uỷ ban thường vụ Quốc hội phải được quá nửa tổng số thành viên của Uỷ ban thường vụ Quốc hội biểu quyết tán thành. Pháp lệnh, nghị quyết phải được công bố chậm nhất là\nmười lăm ngày, kể từ ngày được thông qua, trừ trường hợp Chủ tịch nước trình Quốc hội xem xét lại.\nChương 3:\nHỘI ĐỒNG DÂ TỘC VÀ CÁC UỶ\nBAN CUẢ QUỐC HỘI \nĐiều 19 Hội đồng dân tộc và các Uỷ ban của Quốc hội là những cơ quan của Quốc hội có nhiệm vụ thẩm tra dự án luật, kiến nghị về luật, dự án pháp lệnh và các dự án khác; thẩm tra những báo cáo được Quốc hội hoặc Uỷ ban thường vụ Quốc hội giao; trình Quốc hội, Uỷ ban thường vụ Quốc hội ý kiến về chương trình xây dựng luật, pháp lệnh; thực hiện quyền giám sát,\nkiến nghị những vấn đề trong phạm vi nhiệm vụ, quyền hạn của mình.\nĐiều 20 Hội đồng dân tộc có những nhiệm vụ và quyền hạn sau đây:\n1- Thẩm tra các dự án luật, kiến nghị về luật, dự án pháp lệnh và các dự án khác liên quan đến vấn đề dân tộc;\n2- Giám sát việc thực hiện luật,\npháp lênh, nghị quyết của Quốc hội và Uỷ ban thường vụ Quốc hội thuộc lĩnh vực dân tộc, chương trình, kế hoạch phát triển kinh tế - xã hội miền núi, vùng có đồng bào dân tộc thiểu số và việc thực hiện ngân sách trong lĩnh vực này;\n3- Kiến nghị với Quốc hội những vấn đề thuộc chính sách dân tộc, về phát triển kinh tế - xã hội ở miền núi và\nvùng có đồng bào dân tộc thiểu số.\nĐiều 21 Quốc hội thành lập các Uỷ ban sau đây:\n1- Uỷ ban pháp luật;\n2- Uỷ ban kinh tế và ngân sách;\n3- Uỷ ban quốc phòng và an ninh;\n4- Uỷ ban văn hoá, giáo dục,\nthanh niên, thiếu niên và nhi đồng;\n5- Uỷ ban về các vấn đề xã hội;\n6- Uỷ ban khoa học, công nghệ và\nmôi trường;\n7- Uỷ ban đối ngoại.\nĐiều 22 Khi xét thấy cần thiết, Quốc hội thành lập Uỷ ban lâm thời để nghiên cứu, thẩm tra một dự án hoặc điều tra về một vấn đề nhất định.\nĐiều 23 Uỷ ban pháp luật có những nhiệm vụ và quyền hạn sau đây:\n1- Thẩm tra dự án luật, kiến nghị\nvề luật, dự án pháp lệnh về tổ chức bộ máy Nhà nước, về hình sự, dân sự, hành chính, chương trình xây dựng luật, pháp lệnh và các dự án khác do Quốc hội, Uỷ\nban thường vụ Quốc hội giao; tham gia thẩm tra các dự án do Hội đồng dân tộc hoặc Uỷ ban khác của Quốc hội thẩm tra nhằm bảo đảm tính hợp hiến, hợp pháp và tính thống nhất của hệ thống pháp luật;\n2- Thẩm tra đề án thành lập, bãi bỏ các bộ và cơ quan ngang bộ; nhập, chia, thành lập mới, điều chỉnh địa giới tỉnh,\nthành phố trực thuộc trung ương;\n3- Giám sát việc thực hiện luật,\npháp lệnh, nghị quyết của Quốc hội, Uỷ ban thường vụ Quốc hội thuộc các lĩnh vực tổ chức bộ máy Nhà nước, về hình sự, dân sự, hành chính; giám sát việc ban hành nghị quyết, nghị định của chính phủ, quyết định, chỉ thị của Thủ tướng Chính phủ;\ncác văn bản của Toà án nhân dân tối cao và Viện kiểm sát nhân dân tối cao hướng dẫn việc áp dụng pháp luật trong hoạt động kiểm sát, xét xử; giám sát hoạt động của Toà án nhân dân tối cao và Viện kiểm sát nhân dân tối cao;\n4- Kiến nghị các biện pháp cần thiết nhằm hoàn chỉnh hệ thống pháp luật.\nĐiều 24 Uỷ ban kinh tế và ngân sách có\nnhững nhiệm vụ và quyền hạn sau đây:\n1- Thẩm tra dự án luật, kiến nghị\nvề luật, dự án pháp lệnh và các dự án khác thuộc lĩnh vực quản lý kinh tế, hoạt\nđộng kinh doanh, ngân sách, tài chính và tiền tệ;\n2- Thẩm tra dự án, kế hoạch phát triển kinh tế - xã hội, dự toán ngân sách Nhà nước và phân bổ ngân sách Nhà nước;\ncác báo cáo của chính phủ về việc thực hiện kế hoạch phát triển kinh tế - xã hội,\nngân sách Nhà nước và quyết toán ngân sách Nhà nước;\n3- Giám sát việc thực hiện luật,\npháp lệnh, nghị quyết của Quốc hội, Uỷ ban thường vụ Quốc hội thuộc lĩnh vực quản lý kinh tế, hoạt động kinh doanh, ngân sách, tài chính và tiền tệ; giám sát hoạt\nđộng của Chính phủ trong việc thực hiện kế hoạch Nhà nước về phát triển kinh tế\n- xã hội và ngân sách Nhà nước;\n4- Kiến nghị với Quốc hội các vấn\nđề về kế hoạch phát triển kinh tế - xã hội, về quản lý kinh tế, ngân sách, tài chính và tiền tệ.\nĐiều 25 Uỷ ban quốc phòng và an ninh có\nnhững nhiệm vụ và quyền hạn sau đây:\n1- Thẩm tra các dự án luật, kiến nghị về luật, dự án pháp lệnh và các dự án khác thuộc lĩnh vực quốc phòng và an ninh;\n2- Giám sát việc thực hiện luật,\npháp lệnh, nghị quyết của Quốc hội, Uỷ ban thường vụ Quốc hội thuộc lĩnh vực quốc phòng, an ninh; giám sát việc thực hiện nhiệm vụ quốc phòng, an ninh và việc thực hiện ngân sách trong lĩnh vực này;\n3- Kiến nghị với Quốc hội các vấn\nđề về chính sách quốc phòng, an ninh, những biện pháp cần thiết nhằm thực hiện nhiệm vụ, quyền hạn của Quốc hội và Uỷ ban thường vụ Quốc hội trong lĩnh vực quốc phòng, an ninh.\nĐiều 26 Uỷ ban văn hoá, giáo dục, thanh niên, thiếu niên và nhi đồng có những nhiệm vụ và quyền hạn sau đây:\n1- Thẩm tra dự án luật, kiến nghị\nvề luật, dự án pháp lệnh và các dự án khác thuộc lĩnh vực văn hoá, giáo dục,\nthông tin, thể thao, thanh niên, thiếu niên và nhi đồng;\n2- Giám sát việc thực hiện luật,\npháp lệnh, nghị quyết của Quốc hội, Uỷ ban thường vụ Quốc hội thuộc các lĩnh vực văn hoá, giáo dục, thanh niên, thiếu niên và nhi đồng; giám sát việc thực hiện chính sách văn hoá - giáo dục trong các kế hoạch, chương trình phát triển kinh tế - xã hội của đất nước; chính sách đối với thanh niên, thiếu niên và nhi đồng và việc thực hiện ngân sách trong các lĩnh vực này;\n3- Kiến nghị với Quốc hội về các vấn đề phát triển văn hoá - giáo dục của đất nước; chính sách đối với thanh niên, thiếu niên và nhi đồng.\nĐiều 27 Uỷ ban về các vấn đề xã hội có\nnhững nhiệm vụ và quyền hạn sau đây:\n1- Thẩm tra dự án luật, kiến nghị\nvề luật, dự án pháp lệnh và các dự án khác thuộc lĩnh vực các vấn đề xã hội;\n2- Giám sát việc thực hiện luật,\npháp lệnh, nghị quyết của Quốc hội, Uỷ ban thường vụ Quốc hội thuộc lĩnh vực các vấn đề xã hội; giám sát việc thực hiện các chính sách xã hội trong các kế\nhoạch, chương trình phát triển kinh tế - xã hội của đất nước và việc thực hiện ngân sách trong lĩnh vực này;\n3- Kiến nghị với quốc hội các biện pháp để giải quyết các vấn đề về xã hội.\nĐiều 28 Uỷ ban khoa học, công nghệ và\nmôi trường có những nhiệm vụ và quyền hạn sau đây:\n1- Thẩm tra dự án luật, kiến nghị\nvề luật, dự án pháp lệnh và các dự án khác thuộc lĩnh vực khoa học, công nghệ\nvà bảo vệ môi trường sinh thái;\n2- Giám sát việc thực hiện luật,\npháp lệnh, nghị quyết của Quốc hội, Uỷ ban thường vụ Quốc hội thuộc lĩnh vực khoa học, công nghệ và bảo vệ môi trường sinh thái; giám sát việc thực hiện chính sách phát triển khoa học, công nghệ và bảo vệ môi trường sinh thái trong các kế hoạch, chương trình phát triển kinh tế - xã hội của đất nước và việc thực hiện ngân sách trong lĩnh vực này;\n3- Kiến nghị với Quốc hội về\nchính sách đầu tư phát triển khoa học, công nghệ và bảo vệ môi trường sinh thái.\nĐiều 29 Uỷ ban đối ngoại có những nhiệm vụ và quyền hạn sau đây:\n1- Thẩm tra dự án luật, kiến nghị\nvề luật, dự án pháp lệnh và các dự án khác thuộc lĩnh vực hoạt động đối ngoại của Nhà nước, công pháp và tư pháp quốc tế; báo cáo của Chính phủ về công tác đối ngoại trình Quốc hội;\n2- Giám sát việc thực hiện luật,\npháp lệnh, nghị quyết của Quốc hội, Uỷ ban thường vụ Quốc hội thuộc lĩnh vực đối ngoại; giám sát hoạt động của Chính phủ trong việc thực hiện chính sách đối ngoại của Nhà nước; hoạt động đối ngoại của các ngành và địa phương;\n3- Thực hiện và giúp Quốc hội thực hiện quan hệ đối ngoại với Quốc hội các nước và Liên minh Quốc hội thế giới;\n4- Kiến nghị với Quốc hội những vấn đề thuộc chính sách đối ngoại của Nhà nước, về quan hệ với Quốc hội các nước,\nvới Liên minh Quốc hội thế giới và với các tổ chức quốc tế.\nĐiều 30 Chương trình hoạt động của Hội đồng dân tộc và các Uỷ ban của Quốc hội do hội đồng và Uỷ ban quyết định, căn cứ vào Hiến pháp, luật, pháp lệnh, nghị quyết của Quốc hội, Uỷ ban thường vụ Quốc hội và theo sự chỉ đạo, điều hoà của Uỷ ban thường vụ Quốc hội.\nĐiều 31 Hội đồng dân tộc và các Uỷ ban của Quốc hội có quyền yêu cầu các thành viên chính phủ, Chánh án Toà án nhân dân tối cao, Viện trưởng Viện kiểm sát nhân dân tối cao và những viên chức Nhà nước hữu quan cung cấp tài liệu hoặc đến trình bày những vấn đề mà Hội đồng hoặc Uỷ ban xem xét, thẩm tra. Người nhận được yêu cầu của Hội đồng hoặc Uỷ ban của Quốc hội phải đáp ứng yêu cầu đó.\nĐiều 32 Khi cần thiết, Hội đồng dân tộc và các Uỷ ban của Quốc hội cử các thành viên của mình đến cơ quan, tổ chức hữu quan để điều tra, xem xét về vấn đề mà Hội đồng hoặc Uỷ ban quan tâm. Cơ quan, tổ\nchức hữu quan có trách nhiệm tạo điều kiện để thành viên của Hội đồng hoặc Uỷ\nban thực hiện nhiệm vụ.\nĐiều 33 Hội đồng dân tộc và các Uỷ ban của Quốc hội có quyền kiến nghị với Thủ tướng Chính phủ và các thành viên khác của Chính phủ, Chánh án Toà án nhân dân tối cao, Viện trưởng Viện kiểm sát nhân dân tối cao, Chủ tịch Uỷ ban nhân dân tỉnh, thành phố trực thuộc trung ương về những vấn đề thuộc nhiệm vụ, quyền hạn của Hội đồng, Uỷ ban. Người nhận được kiến nghị\ncó trách nhiệm xem xét và trả lời trong thời hạn chậm nhất là mười lăm ngày, kể\ntừ ngày nhận được kiến nghị. Quá thời hạn này mà người nhận được kiến nghị\nkhông trả lời hoặc trong trường hợp Hội đồng, Uỷ ban không tán thành với nội dung trả lời, thì Hội đồng hoặc Uỷ ban có quyền kiến nghị với Chủ tịch Quốc hội yêu cầu trả lời tại phiên họp Uỷ ban thường vụ Quốc hội hoặc tại kỳ họp Quốc hội gần nhất.\nĐiều 34 Hội đồng dân tộc và các Uỷ ban của Quốc hội thành lập các tiểu ban để nghiên cứu, chuẩn bị các vấn đề thuộc lĩnh vực hoạt động của Hội đồng, Uỷ ban. Trưởng tiểu ban phải là thành viên của Hội đồng hoặc Uỷ ban, các thành viên khác có thể không phải là thành viên của Hội đồng,\nUỷ ban hoặc không phải là đại biểu Quốc hội.\nChương 4:\nĐẠI BIỂU QUỐC HỘI \nĐiều 35\nĐại biểu Quốc hội là người đại diện cho ý chí và nguyện vọng của nhân dân, không chỉ đại diện cho nhân dân ở\nđơn vị bầu cử ra mình mà còn đại diện cho nhân dân cả nước; là người thay mặt nhân dân thực hiện quyền lực Nhà nước trong Quốc hội.\nĐiều 36 Nhiệm kỳ của đại biểu mỗi khóa Quốc hội bắt đầu từ kỳ họp thứ nhất của khóa Quốc hội đó đến kỳ họp thứ nhất của Quốc hội khoá sau.\nNhiệm kỳ của đại biểu Quốc hội\nđược bầu bổ sung bắt đầu từ kỳ họp sau cuộc bầu cử bổ sung đến kỳ họp thứ nhất của Quốc hội khoá sau.\nĐiều 37 Trong số các đại biểu Quốc hội, có\nnhững đại biểu làm việc theo chế độ chuyên trách và có những đại biểu làm việc theo chế độ không chuyên trách. Số lượng đại biểu Quốc hội làm việc theo chế độ\nchuyên trách do Quốc hội quyết định.\nĐiều 38\nĐại biểu Quốc hội chịu trách nhiệm trước cử tri, đồng thời chịu trách nhiệm trước Quốc hội về việc thực hiện nhiệm vụ đại biểu của mình.\nĐại biểu Quốc hội phải gương mẫu trong việc chấp hành Hiến pháp, pháp luật, có cuộc sống lành mạnh và tôn trọng các quy tắc sinh hoạt công cộng, bảo vệ quyền và lợi ích hợp pháp của công dân,\ngóp phần phát huy quyền làm chủ của nhân dân.\nĐại biểu Quốc hội có nhiệm vụ\ntuyên truyền, phổ biến pháp luật, động viên nhân dân chấp hành pháp luật và\ntham gia quản lý Nhà nước.\nĐiều 39\nĐại biểu Quốc hội có nhiệm vụ\ntham gia kỳ họp của Quốc hội, tham gia thảo luận và quyết định các vấn đề thuộc nhiệm vụ, quyền hạn của Quốc hội quy định tại Điều 1 và Điều 2 của Luật này.\nĐiều 40 Trong kỳ họp của Quốc hội, đại biểu có nhiệm vụ tham gia các phiên họp toàn thể của Quốc hội; các cuộc họp của Hội đồng, các Uỷ ban của Quốc hội, của tổ hoặc Đoàn đại biểu Quốc hội; thảo luận và biểu quyết các vấn đề ghi trong chương trình kỳ họp.\nĐiều 41\nĐại biểu Quốc hội có quyền trình dự án luật, kiến nghị về luật ra trước Quốc hội, dự án pháp lệnh ra trước Uỷ\nban thường vụ Quốc hội theo trình tự và thủ tục do pháp luật quy định.\nĐiều 42\nĐại biểu Quốc hội có quyền chất vấn Chủ tịch nước, Chủ tịch Quốc hội, Thủ tướng Chính phủ và các thành viên khác của Chính phủ, Chánh án Toà án nhân dân tối cao, Viện trưởng Viện kiếm sát nhân dân tối cao. Người bị chất vấn phải trả lời về những vấn đề mà đại biểu Quốc hội chất vấn.\nTrong thời gian Quốc hội họp, đại biểu Quốc hội gửi chất vấn đến Chủ tịch Quốc hội. Người bị chất vấn phải trả lời trước Quốc hội tại kỳ họp đó. Trong trường hợp cần điều tra thì Quốc hội có thể\nquyết định cho trả lời trước Uỷ ban thường vụ Quốc hội hoặc tại kỳ họp sau của Quốc hội hoặc cho trả lời bằng văn bản.\nTrong thời gian giữa hai kỳ họp Quốc hội, chất vấn được gửi đến Uỷ ban thường vụ Quốc hội để chuyển đến cơ quan hoặc người bị chất vấn và quyết định thời hạn trả lời chất vấn.\nNếu đại biểu không đồng ý với nội dung trả lời thì có quyền đề nghị Chủ tịch Quốc hội đưa ra thảo luận trước Quốc hội hoặc Uỷ ban thường vụ Quốc hội.\nKhi cần thiết, Quốc hội hoặc Uỷ\nban thường vụ Quốc hội ra nghị quyết về việc trả lời chất vấn và trách nhiệm của người bị chất vấn.\nĐiều 43\nĐại biểu Quốc hội phải liên hệ\nchặt chẽ với cử tri, chịu sự giám sát của cử tri, thường xuyên tiếp xúc với cử\ntri, tìm hiểu tâm tư, nguyện vọng của cử tri; thu thập và phản ánh trung thực ý\nkiến của cử tri với Quốc hội và cơ quan Nhà nước hữu quan.\nMỗi năm ít nhất một lần đại biểu phải báo cáo trước cử tri về việc thực hiện nhiệm vụ đại biểu của mình. Cử tri có thể trực tiếp hoặc thông qua Mặt trận Tổ quốc yêu cầu đại biểu báo cáo công tác và có thể nhận xét đối với việc thực hiện nhiệm vụ của đại biểu Quốc hội.\nĐiều 44 Khi nhận được kiến nghị, khiếu nại,\ntố cáo của nhân dân, đại biểu Quốc hội có trách nhiệm nghiên cứu, chuyển đến cơ\nquan hữu quan, đôn đốc và theo dõi việc giải quyết. Cơ quan Nhà nước hữu quan phải thông báo cho đại biểu Quốc hội về kết quả giải quyết kiến nghị, khiếu nại,\ntố cáo đó.\nNếu xét thấy việc giải quyết kiến nghị, khiếu nại, tố cáo không thoả đáng, đại biểu Quốc hội có quyền gặp thủ trưởng cơ quan hữu quan để tìm hiều, yêu cầu xem xét lại. Trong trường hợp cần thiết đại biểu Quốc hội có quyền yêu cầu thủ trưởng cơ quan hữu quan cấp trên của cơ quan\nđó giải quyết.\nĐại biểu Quốc hội có trách nhiệm thông báo cho người kiến nghị, khiếu nại, tố cáo biết kết quả giải quyết.\nĐiều 45 Khi phát hiện có hành vi vi phạm pháp luật, gây thiệt hại đến lợi ích của Nhà nước, quyền lợi hợp pháp của tổ chức xã hội, tổ chức kinh tế, đơn vị vũ trang hoặc của công dân đại biểu Quốc hội có\nquyền yêu cầu cơ quan, tổ chức, đơn vị hữu quan và những người có trách nhiệm thi hành những biện pháp cần thiết để kịp thời chấm dứt hành vi trái phạm pháp luật đó. Cơ quan, đơn vị, tổ chức hoặc người có trách nhiệm phải thông báo cho đại biểu Quốc hội biết kết quả giải quyết.\nĐiều 46 Khi thực hiện nhiệm vụ đại biểu,\nđại biểu Quốc hội có quyền liên hệ với các cơ quan Nhà nước, tổ chức xã hội, tổ\nchức kinh tế, đơn vị vũ trang. Người đứng đầu cơ quan, tổ chức, đơn vị đó,\ntrong phạm vi chức năng, nhiệm vụ của mình, có trách nhiệm tiếp và đáp ứng những yêu cầu của đại biểu Quốc hội.\nĐiều 47\nĐại biểu Quốc hội có quyền tham dự Hội nghị Hội đồng nhân dân các cấp nơi mình được bầu, có quyền phát biểu ý\nkiến nhưng không biểu quyết.\nChủ tịch Hội đồng nhân dân các cấp thông báo cho đại biểu Quốc hội biết ngày họp Hội đồng nhân dân cấp mình, mời đại biểu tới dự và cung cấp tài liệu cần thiết.\nĐiều 48 Các đại biểu Quốc hội được bầu trong một tỉnh hoặc thành phố trực thuộc trung ương hợp thành Đoàn đại biểu Quốc hội. Đoàn đại biểu Quốc hội có Trưởng đoàn, có thể có Phó Trưởng đoàn để tổ chức hoạt động của Đoàn, giữ mối liên hệ với Chủ tịch Quốc hội, Uỷ ban thường vụ Quốc hội, cơ quan chính quyền địa phương, Uỷ ban Mặt trận Tổ quốc và các cơ quan, tổ\nchức khác ở địa phương về các vấn đề liên quan đến hoạt động của đại biểu Quốc hội.\nMỗi Đoàn có thể có từ một đến hai đại biểu làm việc theo chế độ chuyên trách.\nĐiều 49\nĐại biểu Quốc hội không còn xứng\nđáng với sự tín nhiệm của nhân dân thì tuỳ mức độ phạm sai lầm mà bị Quốc hội hoặc cử tri bãi nhiệm.\nUỷ ban thường vụ Quốc hội quyết\nđịnh việc đưa ra Quốc hội bãi nhiệm hoặc cử tri bãi nhiệm đại biểu Quốc hội,\ntheo đề nghị của Uỷ ban Trung ương Mặt trận Tổ quốc Việt nam, Mặt trận Tổ quốc tỉnh hoặc của cử tri.\nTrong trường hợp Quốc hội bãi nhiệm đại biểu Quốc hội thì việc bãi nhiệm phải được hai phần ba tổng số đại biểu Quốc hội biểu quyết tán thành.\nTrong trường hợp cử tri bãi nhiệm\nđại biểu Quốc hội thì việc bãi nhiệm được tiến hành theo thể thức do Uỷ ban thường vụ Quốc hội quy định.\nĐiều 50\nĐại biểu Quốc hội có thể xin thôi làm nhiệm vụ đại biểu vì lý do sức khoẻ hoặc vì lý do khác. Việc chấp nhận\nđại biểu Quốc hội xin thôi làm nhiệm vụ do Quốc hội quyết định; trong thời gian giữa hai kỳ họp Quốc hội thì do Uỷ ban thường vụ Quốc hội quyết định và báo cáo với Quốc hội tại kỳ họp gần nhất.\nĐại biểu Quốc hội phạm tội bị\nToà án phạt tù thì mất quyền đại biểu Quốc hội, kể từ ngày bản án có hiệu lực pháp luật.\nĐiều 51 Không có sự đồng ý của Quốc hội và trong thời gian Quốc hội không họp, không có sự đồng ý của Uỷ ban thường vụ\nQuốc hội thì không được bắt giam, truy tố đại biểu Quốc hội và không được khám xét nơi ở và nơi làm việc của đại biểu Quốc hội. Việc đề nghị bắt giam, truy tố,\nkhám xét nơi ở và nơi làm việc của đại biểu Quốc hội thuộc thẩm quyền của Viện trưởng viện kiểm sát nhân dân tối cao.\nNếu vì phạm tội quả tang mà đại biểu Quốc hội bị tạm giữ, thì cơ quan tạm giữ phải lập tức báo cáo để Quốc hội hoặc Uỷ ban thường vụ Quốc hội xét và quyết định.\nĐại biểu Quốc hội không thể bị\ncơ quan, đơn vị nơi đại biểu làm việc cách chức, buộc thôi việc, nếu không được Uỷ ban thường vụ Quốc hội đồng ý.\nĐiều 52\nĐại biểu Quốc hội hoạt động chuyên trách được bố trí nơi làm việc và các điều kiện cần thiết khác cho hoạt\nđộng đại biểu của mình.\nCơ quan Nhà nước, tổ chức xã hội,\ntổ chức kinh tế nơi đại biểu Quốc hội làm việc trước khi đại biểu hoạt động chuyên trách, có trách nhiệm tiếp nhận và bố trí việc làm cho đại biểu Quốc hội sau khi hết nhiệm kỳ.\nThời gian đại biểu Quốc hội hoạt\nđộng chuyên trách được tính vào thời gian công tác liên tục.\nĐại biểu Quốc hội hoạt động theo chế độ không chuyên trách được dành ít nhất một phần ba thời gian làm việc để\nlàm nhiệm vụ đại biểu. Cơ quan, tổ chức nơi đại biểu làm việc phải tạo điều kiện\nđể đại biểu làm nhiệm vụ.\nLương và các khoản phụ cấp khác của đại biểu Quốc hội do Uỷ ban thường vụ Quốc hội quy định.\nChương 5:\nKỲ HỌP QUỐC HỘI\nĐiều 53 Quốc hội họp thường lệ mỗi năm hai kỳ.\nTrong các trường hợp do Chủ tịch nước, Thủ tướng Chính phủ hoặc ít nhất một phần ba tổng số đại biểu Quốc hội yêu cầu hoặc theo quyết định của mình Uỷ ban thương vụ Quốc hội triệu tập kỳ họp bất thường.\nĐiều 54 Uỷ ban thường vụ Quốc hội dự kiến chương trình làm việc của các kỳ họp quốc hội; Uỷ ban thường vụ Quốc hội khoá\ntrước dự kiến chương trình làm việc của kỳ họp thứ nhất của Quốc hội khoá mới.\nĐiều 55 Uỷ ban thường vụ Quốc hội quyết\nđịnh triệu tập kỳ họp Quốc hội thường lệ chậm nhất là ba mươi ngày; kỳ họp Quốc hội bất thường chậm nhất là bảy ngày, trước ngày khai mạc kỳ họp.\nDự kiến chương trình làm việc của kỳ họp được gửi đến đại biểu Quốc hội cùng với quyết định triệu tập kỳ họp.\nĐiều 56 Kỳ họp thứ nhất của mỗi khoá Quốc hội do Uỷ ban thường vụ Quốc hội khoá trước triệu tập, chậm nhất là sáu mươi ngày,\nkể từ ngày bầu cử đại biểu Quốc hội.\nKỳ họp thứ nhất của mỗi khoá Quốc hội do Chủ tịch Quốc hội khoá trước khai mạc và chủ toạ cho đến khi Quốc hội bầu Chủ tịch Quốc hội khoá mới.\nĐiều 57 Chương trình làm việc của kỳ họp Quốc hội do Quốc hội quyết định.\nĐại biểu Quốc hội có quyền đề\nnghị sửa đổi, bổ sung chương trình kỳ họp đã được thông qua. Việc sửa đổi, bổ\nsung chương trình kỳ họp phải được quá nửa tổng số đại biểu Quốc hội biểu quyết tán thành.\nĐiều 58 Quốc hội họp công khai.\nTrong trường hợp cần thiết, theo\nđề nghị của Chủ tịch nước, Uỷ ban thường vụ Quốc hội, Thủ tướng chính phủ hoặc của một phần ba tổng số đại biểu Quốc hội, Quốc hội quyết định họp kín.\nĐiều 59 Các vấn đề trong chương trình kỳ\nhọp Quốc hội được thảo luận và quyết định tại các phiên họp toàn thể. Trong trường hợp cần thiết, Quốc hội quyết định thảo luận tại Hội đồng dân tộc và các Uỷ\nban, tại các tổ đại biểu Quốc hội, Đoàn đại biểu quốc hội.\nĐiều 60 Thành viên chính phủ không phải là đại biểu Quốc hội được mời tham dự các phiên họp toàn thể của Quốc hội; được phát biểu ý kiến về vấn đề thuộc ngành, lĩnh vực mà thành viên đó phụ trách,\ntheo yêu cầu của Quốc hội hoặc được Quốc hội đồng ý theo đề nghị của thành viên\nđó.\nĐiều 61\nĐại diện cơ quan nhà nước, tổ chức xã hội, tổ chức kinh tế, đơn vị vũ trang, cơ quan báo chí, công dân và khách quốc tế có thể được mời dự các phiên họp công khai của Quốc hội.\nĐiều 62 Chủ tịch nước, Uỷ ban thường vụ\nQuốc hội, Hội đồng dân tộc và các Uỷ ban của Quốc hội, Chính phủ, Toà án nhân dân tối cao, Viện kiểm sát nhân dân tối cao, Mặt trận Tổ quốc Việt Nam, các tổ\nchức thành viên của Mặt trận, các đại biểu Quốc hội có quyền trình dự án luật ra trước Quốc hội.\nQuyền trình dự án luật được thực hiện bằng việc trình dự án luật mới, dự án luật sửa đổi, bổ sung luật hiện hành.\nĐại biểu Quốc hội thực hiện quyền kiến nghị về luật thông qua việc kiến nghị ban hành luật mới hoặc sửa đổi, bổ\nsung luật hiện hành.\nĐiều 63 Quốc hội quyết định chương trình xây dựng luật, pháp lệnh của cả khoá quốc hội và chương trình hàng năm theo đề\nnghị của Uỷ ban thường vụ Quốc hội.\nCác dự án luật trước khi trình ra Quốc hội phải được Hội đồng dân tộc hoặc Uỷ ban hữu quan của Quốc hội thẩm tra, Uỷ ban thường vụ Quốc hội cho ý kiến và được gửi đến đại biểu Quốc hội chậm nhất là hai mươi ngày, trước ngày khai mạc kỳ họp.\nĐiều 64 Quốc hội xem xét dự án luật sau khi đã nghe thuyết trình của cơ quan, tổ chức hoặc cá nhân trình dự án; báo cáo thẩm tra của Hội đồng hoặc Uỷ ban chủ trì thẩm tra và biểu quyết thông qua sau khi Quốc hội đã thảo luận. Căn cứ vào ý kiến thảo luận của đại biểu Quốc hội,\nchủ toạ phiên họp đề nghị các vấn đề cần biểu quyết và cách biểu quyết để Quốc hội quyết định. Quốc hội thông qua dự án luật bằng cách biểu quyết từng điều, từng chương, sau đó biểu quyết toàn bộ hoặc biểu quyết toàn bộ dự án một lần.\nĐiều 65 Quốc hội quyết định kế hoạch phát triển kinh tế - xã hội dài hạn và hàng năm của đất nước; chính sách tài chính, tiền tệ quốc gia, dự toán ngân sách và phân bổ ngân sách Nhà nước.\nChính phủ trình Quốc hội dự án kế\nhoạch, dự toán ngân sách và phân bổ ngân sách của năm sau tại kỳ họp Quốc hội cuối năm trước.\nQuốc hội phê chuẩn quyết toán ngân sách nhà nước do Chính phủ trình chậm nhất là một năm, sau khi năm ngân sách kết thúc.\nCác dự án phải được gửi đến đại biểu Quốc hội chậm nhất là mười ngày, trước ngày khai mạc kỳ họp.\nĐiều 66 Quốc hội xem xét các dự án sau khi nghe thuyết trình của Chính phủ, báo cáo thẩm tra của Hội đồng hoặc Uỷ ban hữu quan và biểu quyết thông qua sau khi Quốc hội đã thảo luận.\nQuốc hội thông qua các dự án bằng cách biểu quyết từng vấn đề, sau đó biểu quyết toàn bộ, hoặc biểu quyết toàn bộ\nmột lần.\nĐiều 67 Quốc hội xem xét, thảo luận báo cáo công tác của Uỷ ban thường vụ Quốc hội, Thủ tướng Chính phủ, Chánh án Toà\nán nhân dân tối cao và Viện trưởng Viện kiểm sát nhân dân tối cao tại kỳ họp cuối năm. Tại kỳ họp giữa năm, các cơ quan này gửi báo cáo công tác đến các đại biểu Quốc hội; khi cần thiết, Quốc hội có thể xem xét, thảo luận.\nQuốc hội có thể ra nghị quyết về\ncông tác của các cơ quan đã báo cáo.\nĐiều 68 Tại kỳ họp cuối cùng của mỗi khoá Quốc hội, Quốc hội xem xét, thảo luận báo cáo công tác cả nhiệm kỳ của Quốc hội, Chủ tịch nước, Uỷ ban thường vụ Quốc hội, Thủ tướng Chính phủ, Chánh án Toà án nhân dân tối cao, Viện trưởng Viện kiểm sát nhân dân tối cao.\nBáo cáo công tác cả nhiệm kỳ của Quốc hội do Chủ tịch Quốc hội chuẩn bị căn cứ vào báo cáo của Uỷ ban thường vụ\nQuốc hội, Hội đồng dân tộc, các Uỷ ban của quốc hội và các Đoàn đại biểu Quốc hội.\nĐiều 69 Tại phiên họp đầu tiên của kỳ họp thứ nhất mỗi khoá Quốc hội, Quốc hội bầu Uỷ ban thẩm tra tư cách đại biểu Quốc hội gồm Chủ nhiệm, một Phó chủ nhiệm và các ủy viên trong số đại biểu Quốc hội do Chủ tịch Quốc hội khoá trước giới thiệu.\nCăn cứ vào báo của Uỷ ban thẩm tra tư cách đại biểu, Quốc hội xác nhận tư cách đại biểu của các đại biểu Quốc hội đã được bầu hoặc tuyên bố những trường hợp cá biệt mà việc bầu cử đại biểu không có giá trị.\nUỷ ban thẩm tra tư cách đại biểu Quốc hội hết nhiệm vụ khi việc thẩm tra tư cách đại biểu đã hoàn thành.\nĐiều 70 Quốc hội bầu Chủ tịch Quốc hội,\ncác Phó Chủ tịch Quốc hội và các Uỷ viên Uỷ ban thường vụ Quốc hội, trong số\ncác đại biểu Quốc hội theo danh sách đề cử chức vụ từng người do Uỷ ban thường vụ Quốc hội khoá trước giới thiệu.\nSố Phó Chủ tịch Quốc hội và các Uỷ viên Uỷ ban thường vụ Quốc hội do Quốc hội quyết định.\nĐiều 71 Quốc hội bầu Chủ tịch nước trong số các đại biểu Quốc hội do Uỷ ban thường vụ Quốc hội giới thiệu.\nTheo đề nghị của Chủ tịch nước,\nQuốc hội bầu Phó Chủ tịch nước trong số các đại biểu Quốc hội; phê chuẩn việc thành lập Hội đồng quốc phòng và an ninh.\nĐiều 72 Quốc hội bầu Chủ tịch, các Phó\nChủ tịch và các Uỷ viên Hội đồng dân tộc trong số các đại biểu Quốc hội, theo danh sách đề cử chức vụ từng người, do Chủ tịch Quốc hội giới thiệu.\nSố Phó Chủ tịch, Uỷ viên Hội đồng dân tộc và số thành viên làm việc theo chế độ chuyên trách do Quốc hội quyết định.\nĐiều 73 Quốc hội bầu Chủ nhiệm, các Phó\nChủ nhiệm và các Uỷ viên của mỗi Uỷ ban của Quốc hội trong số các đại biểu Quốc hội, theo danh sách đề cử chức vụ từng người do Chủ tịch Quốc hội giới thiệu.\nSố Phó Chủ nhiệm, Uỷ viên của mỗi Uỷ ban và số thành viên làm việc theo chế độ chuyên trách do Quốc hội quyết định.\nĐiều 74 Quốc hội bầu Thủ tướng Chính phủ\ntrong số các đại biểu Quốc hội do chủ tịch nước giới thiệu.\nQuốc hội phê chuẩn đề nghị của Thủ tướng Chính phủ về việc bổ nhiệm các Phó Thủ tướng, Bộ trưởng và các thành viên khác của Chính phủ theo danh sách đề cử chức vụ từng người.\nĐiều 75 Quốc hội bầu Chánh án Toà án nhân dân tối cao và Viện trưởng Viện kiểm sát nhân dân tối cao, trong số các đại biểu Quốc hội do Chủ tịch nước giới thiệu.\nĐiều 76 Quốc hội bầu Đoàn thư ký kỳ họp của mỗi khoá Quốc hội, gồm Trưởng đoàn thư ký và các thư ký trong số các đại biểu Quốc hội theo danh sách do Chủ tịch quốc hội giới thiệu.\nĐoàn thư ký có những nhiệm vụ và\nquyền hạn sau đây:\n1- Làm biên bản mỗi phiên họp,\nbiên bản kỳ họp, chuẩn bị thông cáo về phiên họp của Quốc hội; tổng hợp ý kiến của đại biểu Quốc hội tại kỳ họp Quốc hội;\n2- Phối hợp với Hội đồng dân tộc,\nUỷ ban của Quốc hội và các cơ quan hữu quan để chỉnh lý các dự án luật, dự thảo nghị quyết trình Quốc hội;\n3- Thực hiện những công tác khác do Chủ tịch Quốc hội giao. Chủ tịch Quốc hội khoá trước chỉ định Thư ký lâm thời các phiên họp của kỳ họp thứ nhất của Quốc hội khoá mới cho đến khi Quốc hội bầu\nĐoàn thư ký.\nĐiều 77 Tại kỳ họp thứ nhất của mỗi khoá\nQuốc hội, Uỷ ban thường vụ Quốc hội, Thủ tướng Chính phủ, Chánh án Toà án nhân dân tối cao và Viện trưởng Viện kiểm sát nhân dân tối cao báo cáo công tác từ kỳ\nhọp cuối cùng của Quốc hội khoá trước đến kỳ họp thứ nhất của Quốc hội khoá mới.\nĐiều 78 Luật, nghị quyết của Quốc hội phải\nđược quá nửa tổng số đại biểu Quốc hội biểu quyết tán thành. Trong trường hợp bãi nhiệm đại biểu quốc hội, rút ngắn hoặc kéo dài nhiệm kỳ của Quốc hội hoặc sửa\nđổi Hiến pháp, thì phải được ít nhất hai phần ba tổng số đại biểu Quốc hội biểu quyết tán thành.\nLuật, nghị quyết của Quốc hội phải\nđược Chủ tịch Quốc hội ký chứng thực và Chủ tịch nước công bố chậm nhất là mười lăm ngày, kể từ ngày thông qua.\nChương 6:\nBỘ MÁY GIÚP VIỆC VÀ NGÂN SÁCH CUẢ QUỐC HỘI\nĐiều 79 Uỷ ban thường vụ Quốc hội tổ chức bộ máy giúp việc của Quốc hội, Uỷ ban thường vụ Quốc hội, của Hội đồng dân tộc,\ncác Uỷ ban của Quốc hội.\nTổ chức, nhiệm vụ của các cơ quan này do Uỷ ban thường vụ Quốc hội quy định.\nĐiều 80 Ngân sách của Quốc hội là một khoản\nđộc lập trong ngân sách Nhà nước do Quốc hội thảo luận và quyết định tại kỳ họp cuối năm.\nChủ tịch Quốc hội chỉ đạo và tổ\nchức việc thực hiện ngân sách của Quốc hội.\nChương 7:\nĐIỀU KHOẢN CUỐI CÙNG \nĐiều 81 Luật này thay thế Luật tổ chức Quốc hội và Hội đồng Nhà nước ngày 3 tháng 7 năm 1981.\nLuật này đã được Quốc hội nước Cộng hòa xã hội chủ nghĩa Việt Nam khóa VIII, kỳ họp thứ 11, thông qua ngày 15 tháng 4 năm 1992. \nVõ\n Chí Công\n (Đã\n ký)"
}