{
  "url": "https://thuvienphapluat.vn/van-ban/Trach-nhiem-hinh-su/Bo-luat-to-tung-hinh-su-1988-7-LCT-HDNN8-37474.aspx",
  "title": "Bộ luật tố tụng hình sự 1988 7-LCT/HĐNN8",
  "properties": {
    "Số hiệu": "7-LCT/HĐNN8",
    "Loại văn bản": "Luật",
    "Nơi ban hành": "Quốc hội",
    "Người ký": "Võ Chí Công",
    "Ngày ban hành": "28/06/1988",
    "Ngày hiệu lực": "Đã biết",
    "Ngày công báo": "Đã biết",
    "Số công báo": "Đã biết",
    "Tình trạng": "Đã biết"
  },
  "content": "QUỐC HỘI\n ********\nCỘNG HOÀ XÃ HỘI CHỦ NGHĨA VIỆT NAM\n Độc lập - Tự do - Hạnh phúc\n ********\nSố:\n 7-LCT/HĐNN8 Hà\n Nội, ngày 28 tháng 6 năm 1988 BỘ LUẬT TỐ TỤNG HÌNH SỰ CỦA NƯỚC CỘNG HOÀ XÃ HỘI CHỦ NGHĨA VIỆT NAM LỜI NÓI ĐẦU Bộ luật tố tụng hình sự của nước Cộng hoà xã hội chủ nghĩa Việt Nam quy định trình tự, thủ tục tiến hành các hoạt\nđộng khởi tố, điều tra, truy tố, xét xử và thi hành án hình sự.\nThấu suốt tư tưởng \"lấy dân làm gốc\", Bộ luật đáp ứng yêu cầu bảo vệ chế độ xã hội chủ nghĩa, phát triển nền dân chủ xã hội chủ nghĩa, bảo vệ các quyền và lợi ích hợp pháp của công dân, xử lý kiên quyết và triệt để mọi hành vi phạm tội.\nKế thừa và phát triển pháp luật tố tụng hình sự của Nhà nước ta từ Cách mạng tháng Tám đến nay, với tinh thần đổi mới trên mọi mặt của đời sống xã hội, Bộ luật quy định rõ chức năng, nhiệm vụ,\nquyền hạn của các cơ quan tiến hành tố tụng, đề cao vai trò của các tổ chức xã\nhội và công dân trong việc tham gia tố tụng, kết hợp sức mạnh của pháp chế xã hội chủ nghĩa với sức mạnh của quần chúng nhân dân trong đấu tranh chống và phòng ngừa tội phạm.\nViệc thi hành nghiêm chỉnh Bộ luật tố tụng hình sự là nhiệm vụ chung của các cơ quan Nhà nước, các tổ chức xã hội và của toàn thể nhân dân. \nPhần thứ nhất:\nNHỮNG QUY ĐỊNH CHUNG Chương 1:\nNHỮNG NGUYÊN TẮC CƠ BẢN \nĐiều 1. Nhiệm vụ của Bộ luật tố tụng hình sự.\nBộ luật tố tụng hình sự quy định trình tự, thủ tục khởi tố, điều tra, truy tố, xét xử và thi hành án hình sự; chức năng, nhiệm vụ, quyền hạn và mối quan hệ giữa các cơ quan tiến hành tố tụng;\nquyền và nghĩa vụ của những người tham gia tố tụng và của các cơ quan Nhà nước,\ntổ chức xã hội và công dân, nhằm phát hiện chính xác, nhanh chóng và xử lý công minh, kịp thời mọi hành vi phạm tội, không để lọt tội phạm, không làm oan người vô tội.\nBộ luật góp phần bảo vệ chế độ\nxã hội chủ nghĩa, bảo vệ các quyền và lợi ích hợp pháp của công dân, giáo dục công dân nghiêm chỉnh chấp hành pháp luật và tôn trọng quy tắc của cuộc sống xã\nhội chủ nghĩa.\nĐiều 2. Bảo\nđảm pháp chế xã hội chủ nghĩa trong tố tụng hình sự.\nMọi hoạt động tố tụng hình sự phải\nđược tiến hành theo quy định của Bộ luật này.\nĐiều 3. Tôn trọng và bảo vệ các quyền cơ bản của công dân.\nKhi tiến hành tố tụng, điều tra viên, kiểm sát viên, thẩm phán, hội thẩm nhân dân trong phạm vi trách nhiệm của mình phải tôn trọng các quyền và lợi ích hợp pháp của công dân, thường xuyên kiểm tra tính hợp pháp và sự cần thiết của những biện pháp đã áp dụng, kịp thời huỷ\nbỏ hoặc thay đổi những biện pháp đó, nếu xét thấy có vi phạm pháp luật hoặc không còn cần thiết nữa.\nĐiều 4. Bảo\nđảm quyền bình đẳng của mọi công dân trước pháp luật.\nTố tụng hình sự tiến hành theo nguyên tắc mọi công dân đều bình đẳng trước pháp luật, không phân biệt nam nữ,\ndân tộc, tín ngưỡng tôn giáo, thành phần, địa vị xã hội. Bất cứ người nào phạm tội đều bị xử lý theo pháp luật.\nĐiều 5. Bảo\nđảm quyền bất khả xâm phạm về thân thể của công dân.\nKhông ai có thể bị bắt, nếu không có quyết định của Toà án, quyết định hoặc phê chuẩn của Viện kiểm sát. Việc bắt và giam giữ người phải theo đúng quy định của Bộ luật này.\nNghiêm cấm mọi hình thức truy bức,\nnhục hình.\nĐiều 6. Bảo hộ tính mạng, sức khoẻ, tài sản, danh dự và nhân phẩm của công dân.\nCông dân có quyền được pháp luật bảo hộ về tính mạng, sức khoẻ, tài sản, danh dự và nhân phẩm.\nMọi hành vi xâm phạm tính mạng,\nsức khoẻ, tài sản, danh dự và nhân phẩm của công dân đều bị xử lý theo pháp luật.\nĐiều 7. Bảo\nđảm quyền bất khả xâm phạm về chỗ ở, an toàn và bí mật thư tín, điện thoại, điện tín của công dân.\nKhông ai được xâm phạm chỗ ở, an toàn và bí mật thư tín, điện thoại, điện tín của công dân.\nViệc khám xét chỗ ở, khám xét, tạm giữ và thu giữ thư tín, điện tín khi tiến hành tố tụng phải theo đúng quy định của Bộ luật này.\nĐiều 8. Việc tham gia tố tụng hình sự của các tổ chức xã hội và công dân.\nMặt trận Tổ quốc, Công đoàn, Hội nông dân, Đoàn thanh niên cộng sản Hồ Chí Minh, Hội liên hiệp phụ nữ, các tổ chức xã hội khác và công dân đều có quyền và nghĩa vụ tham gia tố tụng hình sự theo quy định của Bộ luật này, góp phần đấu tranh chống và phòng ngừa tội phạm, bảo vệ các quyền và lợi ích hợp pháp của công dân.\nCơ quan điều tra, Viện kiểm sát và Toà án có trách nhiệm tạo điều kiện thuận lợi để các tổ chức xã hội và công dân tham gia tố tụng hình sự.\nTrong các giai đoạn của tố tụng hình sự, nếu Mặt trận Tổ quốc và các thành viên của Mặt trận phát hiện những hành vi trái pháp luật của cơ quan tiến hành tố tụng thì có quyền kiến nghị với các cơ quan có thẩm quyền quy định tại Bộ luật này. Các cơ quan đó phải xem xét, giải quyết và trả lời cho các tổ chức xã hội đã kiến nghị biết.\nĐiều 9. Sự\nphối hợp giữa các cơ quan tiến hành tố tụng với các cơ quan khác của Nhà nước.\nTrong phạm vi trách nhiệm của mình, các cơ quan Nhà nước phối hợp với cơ quan điều tra, Viện kiểm sát và Toà\nán trong việc đấu tranh chống và phòng ngừa tội phạm.\nCác cơ quan Nhà nước phải thông báo ngay cho cơ quan điều tra, Viện kiểm sát biết mọi hành vi phạm tội xảy ra trong cơ quan, đơn vị mình, thực hiện yêu cầu của các cơ quan hoặc người tiến hành tố tụng.\nĐiều 10.\nKhông ai có thể bị coi là có tội, nếu chưa có bản án kết tội đã có hiệu lực của Toà án.\nKhông ai có thể bị coi là có tội và phải chịu hình phạt, khi chưa có bản án kết tội của Toà án đã có hiệu lực pháp luật.Bổ sung\nĐiều 11.\nXác định sự thật của vụ án.\nCơ quan điều tra, Viện kiểm sát và Toà án phải áp dụng mọi biện pháp hợp pháp để xác định sự thật của vụ án một cách khách quan, toàn diện và đầy đủ, làm rõ những chứng cứ xác định có tội và\nchứng cứ xác định vô tội, những tình tiết tăng nặng và những tình tiết giảm nhẹ\ntrách nhiệm của bị can, bị cáo.\nTrách nhiệm chứng minh tội phạm thuộc các cơ quan tiến hành tố tụng. Bị can, bị cáo có quyền nhưng không buộc phải chứng minh là mình vô tội.\nĐiều 12. Bảo\nđảm quyền bào chữa của bị can, bị cáo.\nBị can, bị cáo có quyền tự bào chữa hoặc nhờ người khác bào chữa.\nCơ quan điều tra, Viện kiểm sát và Toà án có nhiệm vụ bảo đảm cho bị can, bị cáo thực hiện quyền bào chữa của họ.\nĐiều 13.\nTrách nhiệm khởi tố và xử lý vụ án hình sự.\nKhi phát hiện có dấu hiệu tội phạm thì cơ quan điều tra, Viện kiểm sát và Toà án, trong phạm vi quyền hạn của mình có trách nhiệm khởi tố vụ án và áp dụng các biện pháp do Bộ luật này quy định để\nxác định tội phạm và xử lý người phạm tội.\nKhông được khởi tố vụ án ngoài những căn cứ và trình tự do Bộ luật này quy định.\nĐiều 14. Bảo\nđảm sự vô tư của những người tiến hành hoặc tham gia tố tụng hình sự.\nThẩm phán, hội thẩm nhân dân, kiểm sát viên, điều tra viên, thư ký phiên toà, người phiên dịch, người giám định không được tiến hành hoặc tham gia tố tụng, nếu có lý do xác đáng để cho rằng họ\ncó thể không vô tư trong khi thực hiện nhiệm vụ của mình.\nĐiều 15.\nPhát hiện và khắc phục nguyên nhân và điều kiện phạm tội.\nTrong quá trình tiến hành tố tụng hình sự, cơ quan điều tra, Viện kiểm sát và Toá án có nhiệm vụ tìm ra những nguyên nhân và điều kiện phạm tội, yêu cầu các cơ quan, tổ chức hữu quan áp dụng các biện pháp khắc phục và ngăn ngừa.\nCác cơ quan, tổ chức hữu quan phải trả lời về việc thực hiện yêu cầu của cơ quan điều tra, Viện kiểm sát, Toà án.\nĐiều 16. Thực hiện chế độ xét xử có hội thẩm nhân dân tham gia.\nViệc xét xử ở Toà án có hội thẩm nhân dân tham gia theo quy định của Bộ luật này. Khi xét xử, hội thẩm nhân dân ngang quyền với thẩm phán.\nĐiều 17. Thẩm phán và hội thẩm nhân dân xét xử độc lập và chỉ tuân theo pháp luật.\nKhi xét xử, thẩm phán và hội thẩm nhân dân độc lập và chỉ tuân theo pháp luật.\nĐiều 18.\nToà án xét xử tập thể.\nToà án xét xử tập thể và quyết định theo đa số.\nĐiều 19.\nXét xử công khai.\nViệc xét xử của Toà án được tiến hành công khai, mọi người đều có quyền tham dự.\nTrong trường hợp đặc biệt, cần giữ gìn bí mật Nhà nước hoặc giữ gìn đạo đức xã hội thì Toà án xét xử kín,\nnhưng phải tuyên án công khai.\nĐiều 20. Bảo\nđảm quyền bình đẳng trước Toà án.\nKiểm sát viên, bị cáo, người bào chữa, người bị hại, nguyên đơn dân sự, bị đơn dân sự, người có quyền và lợi ích hợp pháp liên quan đến vụ án và những người đại diện hợp pháp của họ đều có quyền bình đẳng trong việc đưa ra chứng cứ, đưa ra yêu cầu và tranh luận trước Toà án.\nĐiều 21. Tiếng nói và chữ viết dùng trong tố tụng hình sự.\nTiếng nói và chữ viết dùng trong tố tụng hình sự là tiếng Việt. Người tiến hành và người tham gia tố tụng có quyền dùng tiếng nói và chữ viết của dân tộc mình; trong trường hợp này phải có phiên dịch.\nĐiều 22.\nGiám đốc việc xét xử.\nToà án cấp trên giám đốc việc xét xử của Toà án cấp dưới, Toà án nhân dân tối cao giám đốc việc xét xử của Toà án nhân dân và Toà án quân sự các cấp để bảo đảm việc áp dụng pháp luật được nghiêm chỉnh và thống nhất.\nĐiều 23. Kiểm sát việc tuân theo pháp luật trong tố tụng hình sự.\nViện kiểm sát có nhiệm vụ kiểm sát việc tuân theo pháp luật trong tố tụng hình sự, thực hành quyền công tố, bảo\nđảm cho pháp luật được chấp hành nghiêm chỉnh và thống nhất.\nTrong các giai đoạn của tố tụng hình sự, Viện kiểm sát có trách nhiệm áp dụng những biện pháp do Bộ luật này quy định để loại trừ việc vi phạm pháp luật của bất kỳ cá nhân hoặc tổ chức nào.\nKhi thực hiện nhiệm vụ của mình,\nkiểm sát viên chỉ tuân theo pháp luật, chịu sự chỉ đạo trực tiếp của Viện trưởng Viện kiểm sát cùng cấp và sự lãnh đạo thống nhất của Viện trưởng Viện kiểm sát nhân dân tối cao.\nĐiều 24. Bảo\nđảm quyền khiếu nại và tố cáo của công dân đối với hoạt động của các cơ quan tiến hành tố tụng.\nCông dân có quyền khiếu nại và tố\ncáo những việc làm trái pháp luật của cơ quan điều tra, Viện kiểm sát và Toà án hoặc của bất kỳ cá nhân nào thuộc các cơ quan đó.\nCơ quan có thẩm quyền phải xem xét và giải quyết nhanh chóng các khiếu nại và tố cáo, thông báo bằng văn bản kết quả cho người khiếu nại và tố cáo biết và có biện pháp khắc phục.\nCơ quan đã làm oan phải khôi phục danh dự, quyền lợi và bồi thường cho người bị thiệt hại. Cá nhân có hành vi trái pháp luật thì tuỳ trường hợp mà bị xử lý kỷ luật hoặc bị truy cứu trách nhiệm hình sự.\nĐiều 25. Bảo\nđảm hiệu lực của bản án và quyết định của Toà án.\nBản án và quyết định của Toà án\nđã có hiệu lực pháp luật phải được thi hành và phải được các cơ quan Nhà nước,\ntổ chức xã hội và mọi công dân tôn trọng. Cá nhân và tổ chức hữu quan trong phạm vi trách nhiệm của mình, phải chấp hành nghiêm chỉnh bản án và quyết định của Toà án và phải chịu trách nhiệm trước pháp luật về việc chấp hành đó.\nĐiều 26. Hiệu lực của Bộ luật tố tụng hình sự.\nBộ luật tố tụng hình sự được áp dụng đối với hoạt động tố tụng do cơ quan điều tra, Viện kiểm sát và Toà án nước Cộng hoà xã hội chủ nghĩa Việt Nam tiến hành.\nĐối với người nước ngoài phạm tội trên lãnh thổ Việt Nam mà là công dân của nước đã ký kết hiệp định tương trợ tư\npháp với nước Cộng hoà xã hội chủ nghĩa Việt Nam thì hoạt động tố tụng được tiến hành theo quy định của hiệp định tương trợ tư pháp.\nĐối với người nước ngoài phạm tội trên lãnh thổ Việt Nam thuộc đối tượng được hưởng các đặc quyền ngoại giao hoặc quyền ưu đãi, miễn trừ về lãnh sự theo pháp luật Việt Nam, theo các hiệp định quốc tế mà nước Cộng hoà xã hội chủ nghĩa Việt Nam đã ký kết hay công nhận hoặc theo tục lệ quốc tế, thì vụ án được giải quyết bằng con đường ngoại giao.\nChương 2:\nCƠ QUAN TIẾN HÀNH TỐ TỤNG,\nNGƯỜI TIẾN HÀNH TỐ TỤNG VÀ VIỆC THAY ĐỔI NGƯỜI TIẾN HÀNH TỐ TỤNG \nĐiều 27. Cơ\nquan tiến hành tố tụng và người tiến hành tố tụng.\n1- Các cơ quan tiến hành tố tụng gồm có:\na) Cơ quan điều tra;\nb) Viện kiểm sát;\nc) Toà án.\n2- Những người tiến hành tố tụng gồm có:\na) Điều tra viên;\nb) Kiểm sát viên;\nc) Thẩm phán;\nd) Hội thẩm nhân dân;\nđ) Thư ký phiên toà.\nĐiều 28. Những trường hợp phải thay đổi người tiến hành tố tụng.\nNgười tiến hành tố tụng phải từ\nchối tiến hành tố tụng hoặc bị thay đổi, nếu:\n1- Họ đồng thời là người bị hại,\nnguyên đơn dân sự, bị đơn dân sự; người có quyền và lợi ích hợp pháp liên quan đến vụ án; là người đại diện hợp pháp, người thân thích của những người đó hoặc của bị can, bị cáo;\n2- Họ đã tham gia với tư cách là\nngười bào chữa, người làm chứng, người giám định, người phiên dịch trong vụ án\nđó;\n3- Có căn cứ rõ ràng khác để cho rằng họ có thể không vô tư trong khi làm nhiệm vụ.\nĐiều 29.\nQuyền đề nghị thay đổi người tiến hành tố tụng.\nNhững người sau đây có quyền đề\nnghị thay đổi người tiến hành tố tụng:\n1- Kiểm sát viên;\n2- Bị can, bị cáo, người bị hại,\nnguyên đơn dân sự, bị đơn dân sự và người đại diện hợp pháp của họ;\n3- Người bào chữa.\nĐiều 30.\nThay đổi thẩm pháp hoặc Hội thẩm nhân dân.\n1- Thẩm phán hoặc Hội thẩm nhân dân phải từ chối tham gia xét xử hoặc bị thay đổi, nếu:\na) Thuộc một trong những trường hợp quy định tại Điều 28 Bộ luật này;\nb) Họ cùng trong một hội đồng xét xử và là người thân thích với nhau;\nc) Đã tham gia xét xử sơ thẩm hoặc phúc thẩm hoặc đã tiến hành tố tụng trong vụ án đó với tư cách là điều tra viên, kiểm sát viên, thư ký phiên toà.\nThành viên Uỷ ban thẩm phán Toà\nán nhân dân tối cao đã tham gia xét xử vụ án theo trình tự giám đốc tại Uỷ ban thẩm phán vẫn được tham gia xét xử lại vụ án tại Hội đồng thẩm phán.\n2- Việc thay đổi thẩm phán, hội thẩm nhân dân trước khi mở phiên toà do Chánh án Toà án quyết định.\nViệc thay đổi thẩm phán, hội thẩm nhân dân tại phiên toà do Hội đồng xét xử quyết định trước khi bắt đầu xét hỏi bằng cách biểu quyết tại phòng nghị án. Khi xem xét việc thay đổi thành viên nào thì thành viên đó được trình bày ý kiến của mình, Hội đồng quyết định theo\nđa số.\nViệc cử thành viên mới của Hội đồng xét xử do Chánh án Toà án quyết định.\nĐiều 31.\nThay đổi kiểm sát viên.\n1- Kiểm sát viên phải từ chối tiến hành tố tụng hoặc bị thay đổi, nếu:\na) Thuộc một trong những trường hợp quy định tại Điều 28 Bộ luật này;\nb) Đã tiến hành tố tụng trong vụ\nán đó với tư cách là điều tra viên, thẩm phán, hội thẩm nhân dân hoặc thư ký\nphiên toà.\n2- Việc thay đổi kiểm sát viên trước khi mở phiên toà do Viện trưởng Viện kiểm sát cùng cấp quyết định. Nếu kiểm sát viên bị thay đổi là Viện trưởng Viện kiểm sát thì do Viện trưởng Viện kiểm sát cấp trên quyết định. Trong trường hợp phải thay đổi kiểm sát viên tại phiên toà thì Hội đồng xét xử ra quyết định hoãn phiên toà.\nViệc cử kiểm sát viên khác do Viện trưởng Viện kiểm sát cùng cấp hoặc cấp trên quyết định.\nĐiều 32.\nThay đổi điều tra viên.\n1- Điều tra viên phải từ chối tiến hành tố tụng hoặc bị thay đổi, nếu:\na) Thuộc một trong những trường hợp quy định tại Điều 28 Bộ luật này;\nb) Đã tiến hành tố tụng trong vụ\nán đó với tư cách là kiểm sát viên, thẩm phán, hội thẩm nhân dân hoặc thư ký\nphiên toà.\n2- Việc thay đổi điều tra viên do thủ trưởng cơ quan điều tra quyết định.\nNếu điều tra viên bị thay đổi là\nthủ trưởng cơ quan điều tra thì việc điều tra vụ án được giao cho cơ quan điều tra cấp trên.\nĐiều 33.\nThay đổi thư ký phiên toà.\n1- Thư ký\nphiên toà phải từ chối tiến hành tố tụng hoặc bị thay đổi, nếu:\na) Thuộc một trong những trường hợp quy định tại Điều 28 Bộ luật này;\nb) Đã tiến hành tố tụng trong vụ\nán đó với tư cách là kiểm sát viên, điều tra viên, thẩm phán hoặc hội thẩm nhân dân.\n2- Việc thay đổi thư ký phiên toà do Hội đồng xét xử quyết định.\nViệc cử thư ký khác do Chánh án Toà án quyết định.\nChương 3:\nNGƯỜI THAM GIA TỐ TỤNG \nĐiều 34. Bị\ncan, bị cáo.\n1- Bị can là người đã bị khởi tố\nvề hình sự.\nBị cáo là người đã bị Toà án quyết\nđịnh đưa ra xét xử.\n2- Bị can có quyền biết mình bị\nkhởi tố về tội gì; đưa ra chứng cứ và nhữyêu cầu; đề nghị thay đổi người tiến hành tố tụng, người giám định, người phiên dịch theo quy định của Bộ luật này;\ntự bào chữa hoặc nhờ người khác bào chữa.\nBị can được giao nhận bản sao quyết định khởi tố, quyết định áp dụng biện pháp ngăn chặn; được giao nhận bản kết luận điều tra sau khi kết thúc điều tra, bản cáo trạng sau khi Viện kiểm sát quyết định truy tố; có quyền khiếu nại các quyết định của cơ quan điều tra và Viện kiểm sát.\n3- Bị cáo được giao nhận quyết định\nđưa vụ án ra xét xử; được tham gia phiên toà; được đề nghị thay đổi người tiến hành tố tụng, người giám định, người phiên dịch theo quy định của Bộ luật này;\nđưa ra chứng cứ và những yêu cầu; tự bào chữa hoặc nhờ người khác bào chữa; nói lời sau cùng trước khi nghị án; được kháng cáo bản án và quyết định của Toà án.\n4- Bị can, bị cáo phải có mặt theo giấy triệu tập của cơ quan điều tra, Viện kiểm sát và Toà án; trong trường hợp vắng mặt không có lý do chính đáng thì có thể bị áp giải.\nĐiều 35.\nNgười bào chữa.\n1- Người bào chữa có thể là:\na) Luật sư;\nb) Người đại diện hợp pháp của bị\ncan, bị cáo;\nc) Bào chữa viên nhân dân.\n2- Những người sau đây không được bào chữa:\na) Người đã tiến hành tố tụng trọng vụ án đó hoặc là người thân thích của người này;\nb) Người tham gia tố tụng trong vụ án với tư cách là người làm chứng, người giám định hoặc người phiên dịch.\n3- Một người bào chữ có thể bào chữa cho nhiều bị can, bị cáo trong cùng một vụ án, nếu quyền và lợi ích của họ\nkhông đối lập nhau. Nhiều người bào chữa có thể bào chữa cho một bị can, bị\ncáo.\n4- Thủ trưởng cơ quan điều tra,\nViện trưởng Viện kiểm sát, Chánh án Toà án hoặc Hội đồng xét xử cấp giấy chứng nhận người bào chữa trong vụ án để họ thực hiện nhiệm vụ bào chữa.\nĐiều 36.\nQuyền và nghĩa vụ của người bào chữa.\n1- Người bào chữa tham gia tố tụng từ khi khởi tố bị can. Trong trường hợp cần phải giữ bí mật điều tra đối với tội đặc biệt nguy hiểm xâm phạm an ninh quốc gia thì Viện trưởng Viện kiểm sát nhân dân quyết định để người bào chữa tham gia tố tụng từ\nkhi kết thúc điều tra.\n2- Người bào chữa có quyền có mặt khi hỏi cung bị can và nếu điều tra viên đồng ý thì được hỏi bị can và có mặt trong những hoạt động điều tra khác.\nNgười bào chữa có quyền đề nghị\nthay đổi người tiến hành tố tụng, người giám định, người phiên dịch theo quy định của Bộ luật này; đưa ra chứng cứ và những yêu cầu; gặp bị can, bị cáo đang bị tạm giam; được đọc hồ sơ vụ án và ghi chép những điều cần thiết sau khi kết thúc điều tra; có quyền tham gia xét hỏi và tranh luận tại phiên toà; khiếu nại các quyết\nđịnh của cơ quan tiến hành tố tụng, kháng cáo bản án và quyết định của Toà án nếu bị cáo là người chưa thành niên hoặc người có nhược điểm về thể chất hoặc tâm thần, quy định tại điểm b, khoản 2 Điều 37 Bộ luật này.\n3- Người bào chữa có nghĩa vụ sử\ndụng mọi biện pháp do pháp luật quy định để làm sáng tỏ những tình tiết xác định bị can, bị cáo vô tội, những tình tiết giảm nhẹ trách nhiệm của bị can, bị cáo;\ngiúp bị can, bị cáo về mặt pháp lý nhằm bảo vệ quyền và lợi ích hợp pháp của họ.\nNgười bào chữa không được từ chối bào chữa cho bị can, bị cáo mà mình đã đảm nhận, nếu không có lý do chính đáng.\nNgười bào chữa không được tiết lộ\nbí mật mà mình biết được trong khi làm nhiệm vụ.\nĐiều 37. Lựa chọn và thay đổi người bào chữa.\n1- Người bào chữa do bị can, bị\ncáo hoặc người đại diện hợp pháp của họ lựa chọn.\n2- Trong những trường hợp sau đây, nếu bị can, bị cáo hoặc người đại diện hợp pháp của họ\nkhông mời người bào chữa thì cơ quan điều tra, Viện kiểm sát hoặc Toà án phải yêu cầu Đoàn luật sư cử người bào chữa cho họ:\na) Bị can, bị cáo về tội theo khung hình phạt có mức cao nhất là tử hình được quy định tại Bộ luật hình sự.\nb) Bị can, bị cáo là người chưa thành niên, người có nhược điểm về thể chất hoặc tâm thần.\nTrong những trường hợp quy định tại điểm a và b, khoản 2 Điều này, bị can, bị cáo và người\nđại diện hợp pháp của họ vẫn có quyền yêu cầu thay đổi hoặc từ chối người bào chữa.\nĐiều 38.\nNgười bị tạm giữ.\n1- Người bị tạm giữ là người bị\nbắt trong trường hợp khẩn cấp hoặc phạm tội quả tang và đối với họ đã có quyết\nđịnh tạm giữ, nhưng chưa bị khởi tố.\n2- Người bị tạm giữ có quyền được biết lý do mình bị tạm giữ; được giải thích quyền và nghĩa vụ; trình bày lời khai; đưa ra những yêu cầu; khiếu nại về việc tạm giữ và những quyết định khác có liên quan. Người bị tạm giữ có nghĩa vụ thực hiện các quy định về tạm giữ.\nĐiều 39.\nNgười bị hại.\n1- Người bị hại là người bị thiệt hại về thể chất, về tinh thần hoặc về tài sản do tội phạm gây ra.\n2- Người bị hại hoặc người đại diện hợp pháp của họ có quyền đưa ra chứng cứ và những yêu cầu; được thông báo về kết quả điều tra; đề nghị thay đổi người tiến hành tố tụng, người giám định,\nngười phiên dịch theo quy định của Bộ luật này; có quyền đề nghị mức bồi thường và các biện pháp bảo đảm bồi thường; tham gia phiên toà; khiếu nại quyết định của cơ quan điều tra, Viện kiểm sát; kháng cáo bản án và quyết định của Toà án về\nphần bồi thường cũng như về hình phạt đối với bị cáo.\nTrong trường hợp người bị hại chết thì người đại diện hợp pháp của họ có những quyền quy định tại Điều này.\n3- Người bị hại phải có mặt theo giấy triệu tập của cơ quan điều tra, Viện kiểm sát, Toà án; nếu từ chối khai báo mà không có lý do chính đáng thì có thể phải chịu trách nhiệm theo Điều 242 Bộ luật hình sự.\n4- Trong trường hợp vụ án được khởi tố theo yêu cầu của người bị hại quy định tại Điều 88 Bộ luật này thì người bị hại hoặc người đại diện hợp pháp của họ trình bày lời buộc tội tại phiên toà.\nĐiều 40.\nNguyên đơn dân sự.\n1- Nguyên đơn dân sự là cá nhân,\ncơ quan hoặc tổ chức bị thiệt hại về vật chất do tội phạm gây ra và có đơn yêu cầu bồi thường thiệt hại.\n2- Nguyên đơn dân sự hoặc người\nđại diện hợp pháp của họ có quyền đưa ra chứng cứ và những yêu cầu; được thông báo về kết quả điều tra; đề nghị thay đổi người tiến hành tố tụng, người giám định,\nngười phiên dịch theo quy định của Bộ luật này; có quyền đề nghị mức bồi thường,\nvà các biện pháp bảo đảm bồi thường; tham gia phiên toà; khiếu nại quyết định của cơ quan điều tra, Viện kiểm sát; kháng cáo bản án và quyết định của Toà án về\nphần bồi thường thiệt hại.\nĐiều 41. Bị\nđơn dân sự.\n1- Bị đơn dân sự là cá nhân, cơ\nquan, tổ chức mà pháp luật quy định phải chịu trách nhiệm vật chất đối với thiệt hại do hành vi phạm tội gây ra.\n2- Bị đơn dân sự hoặc người đại diện hợp pháp của họ có quyền khiếu nại việc đòi bồi thường của nguyên đơn dân sự; đưa ra chứng cứ và những yêu cầu; được thông báo kết quả điều tra có liên quan đến việc đòi bồi thường; đề nghị thay đổi người tiến hành tố tụng, người giám định, người phiên dịch theo quy định của Bộ luật này; tham gia phiên toà;\nkhiếu nại quyết định của cơ quan điều tra, Viện kiểm sát; kháng cáo bản án và\nquyết định của Toà án về phần bồi thường thiệt hại.\nĐiều 42.\nNgười có quyền và lợi ích hợp pháp liên quan đến vụ án.\nNgười có quyền và lợi ích hợp pháp liên quan đến vụ án hoặc người đại diện hợp pháp của họ\nđược tham gia phiên toà; đưa ra chứng cứ và những yêu cầu; kháng cáo bản án hoặc quyết định của Toà án về những vấn đề trực tiếp liên quan đến quyền và lợi ích hợp pháp của mình.Bổ sung\nĐiều 43.\nNgười làm chứng.\n1- Người nào biết được những tình tiết có liên quan đến vụ án đều có thể được triệu tập đến làm chứng.\n2- Người làm chứng phải có mặt theo giấy triệu tập của cơ quan điều tra, Viện kiểm sát, Toà án; có nghĩa vụ\nkhai trung thực tất cả những tình tiết mà mình biết về vụ án.\n3- Những người sau đây không được làm chứng:\na) Người bào chữa của bị can, bị\ncáo;\nb) Người do có nhược điểm về thể\nchất hoặc tâm thần mà không có khả năng nhận thức được những tình tiết của vụ\nán hoặc không có khả năng khai báo đúng đắn.\n4- Người làm chứng từ chối hoặc trốn tránh việc khai báo mà không có lý do chính đáng, thì\nphải chịu trách nhiệm theo Điều 242 Bộ luật hình sự; khai gian dối thì phải chịu trách nhiệm theo Điều 241 Bộ luật hình sự.\nĐiều 44.\nNgười giám định.\n1- Người giám định là người có\nkiến thức cần thiết về lĩnh vực cần giám định mà cơ quan tiến hành tố tụng trưng cầu.\n2- Người giám định có quyền tìm hiểu tài liệu của vụ án có liên quan đến đối tượng phải giám định; yêu cầu cơ\nquan trưng cầu giám định cung cấp những tài liệu cần thiết cho việc kết luận;\ntham dự vào việc hỏi cung, lấy lời khai và đặt câu hỏi về những vấn đề có liên quan đến đối tượng giám định.\n3- Người giám định phải có mặt theo giấy triệu tập của cơ quan điều tra, Viện kiểm sát, Toà án.\nNgười giám định từ chối kết luận giám định mà không có lý do chính đáng thì phải chịu trách nhiệm theo Điều 242 Bộ luật hình sự. Người giám định kết luận gian dối thì phải chịu trách nhiệm theo Điều 241 Bộ luật hình sự.\n4- Người giám định phải từ chối tham tố tụng hoặc bị thay đổi, nếu:\na) Thuộc một trong những trường hợp quy định tại khoản 1 và khoản 3 Điều 28 Bộ luật này;\nb) Đã tiến hành tố tụng với tư\ncách là điều tra viên, kiểm sát viên, thẩm phán, hội thẩm nhân dân, thư ký\nphiên toà hoặc đã tham gia với tư cách là người bào chữa, người làm chứng, người phiên dịch trong vụ án đó. Việc thay đổi người giám định do cơ quan trưng cầu quyết định.\n5- Bắt buộc phải trưng cầu giám định khi cần xác định:\na) Nguyên nhân chết người, tính chất thương tích, mức độ tổn hại sức khoẻ hoặc khả năng lao động;\nb) Tình trạng tâm thần của bị\ncan, bị cáo trong trường hợp có sự nghi ngờ về năng lực trách nhiệm hình sự của họ;\nc) Tình trạng tâm thần của người làm chứng hoặc người bị hại trong trường hợp có sự nghi ngờ về khả năng nhận thức và khai báo đúng đắn đối với những tình tiết của vụ án.\nĐiều 45.\nNgười phiên dịch.\n1- Người phiên dịch do cơ quan\nđiều tra, Viện kiểm sát hoặc Toà án yêu cầu trong trường hợp có người tiến hành hoặc người tham gia tố tụng không sử dụng được tiếng Việt.\n2- Người phiên dịch phải có mặt theo giấy triệu tập và thực hiện nhiệm vụ được giao; nếu dịch gian dối thì người phiên dịch phải chịu trách nhiệm theo Điều 241 Bộ luật hình sự.\n3- Người phiên dịch phải từ chối tham gia tố tụng hoặc bị thay đổi, nếu:\na) Thuộc một trong những trường hợp quy định tại khoản 1 và khoản 3 Điều 28 Bộ luật này;\nb) Đã tiến hành tố tụng với tư\ncách là điều tra viên, kiểm sát viên, thẩm phán, hội thẩm nhân dân, thư ký\nphiên toà hoặc đã tham gia với tư cách là người bào chữa, người giám định, người làm chứng trong vụ án đó.\nViệc thay đổi người phiên dịch do cơ quan yêu cầu quyết định.\n4- Những quy định của Điều này cũng được áp dụng đối với người biết dấu hiệu của người câm và người điếc.\nĐiều 46.\nTrách nhiệm giải thích và bảo đảm thực hiện các quyền và nghĩa vụ của những người tham gia tố tụng.\nCác cơ quan tiến hành tố tụng có\ntrách nhiệm giải thích và bảo đảm thực hiện các quyền và nghĩa vụ của những người tham gia tố tụng. Việc giải thích phải được ghi vào biên bản.\nChương 4:\nCHỨNG CỨ \nĐiều 47. Những vấn đề phải chứng minh trong vụ án hình sự.\nKhi điều tra, truy tố và xét xử\nvụ án hình sự, cơ quan điều tra, Viện kiểm sát và Toà án phải chứng minh:\n1- Có hành vi phạm tội xảy ra hay không, thời gian, địa điểm và những tình tiết khác của hành vi phạm tội;\n2- Ai là người thực hiện hành vi phạm tội; có lỗi hay không có lỗi, do cố ý hay vô ý; có năng lực trách nhiệm hình sự hay không; mục đích hoặc động cơ phạm tội;\n3- Những tình tiết tăng nặng,\ntình tiết giảm nhẹ trách nhiệm của bị can, bị cáo và những đặc điểm về nhân thân bị can, bị cáo;\n4- Tính chất và mức độ thiệt hại do hành vi phạm tội gây ra.\nĐiều 48. Chứng cứ.\n1- Chứng cứ là những gì có thật,\nđược thu thập theo trình tự do Bộ luật này quy định mà cơ quan điều tra, Viện kiểm sát và Toà án dùng làm căn cứ để xác định có hay không có hành vi phạm tội,\nngười thực hiện hành vi phạm tội cũng như những tình tiết khác cần thiết cho việc giải quyết đúng đắn vụ án.\n2- Chứng cứ được xác định bằng:\na) Vật chứng;\nb) Lời khai của người làm chứng,\nngười bị hại, nguyên đơn dân sự, bị đơn dân sự, người bị tạm giữ, bị can, bị\ncáo;\nc) Kết luận giám định;\nd) Biên bản về hoạt động điều tra, xét xử và các tài liệu khác.\nĐiều 49.\nThu thập chứng cứ.\n1- Để thu thập chứng cứ, cơ quan\nđiều tra, Viện kiểm sát và Toà án có quyền triệu tập những người biết về vụ án\nđể hỏi và nghe họ trình bày về những vấn đề có liên quan đến vụ án, trưng cầu giám định, tiến hành khám xét, khám nghiệm và các hoạt động điều tra khác theo quy định của Bộ luật này; yêu cầu các cơ quan, tổ chức và cá nhân cung cấp tài liệu, trình bày những tình tiết làm sáng tỏ vụ án.\n2- Những người tham gia tố tụng,\ncơ quan, tổ chức hoặc bất cứ cá nhân nào đều có thể đưa ra tài liệu, đồ vật và\ntrình bày những vấn đề có liên quan đến vụ án.\nĐiều 50.\nĐánh giá chứng cứ.\nĐiều tra viên, kiểm sát viên, thẩm phán và hội thẩm nhân dân xác định và đánh giá mọi chứng cứ với đầy đủ tinh thần trách nhiệm, sau khi nghiên cứu một cách tổng hợp, khách quan, toàn diện và đầy\nđủ tất cả các tình tiết của vụ án.\nĐiều 51. Lời khai của người làm chứng.\n1- Người làm chứng trình bày những gì mà họ biết về vụ án, nhân thân của bị can, bị cáo, người bị hại; quan hệ giữa họ với bị can, bị cáo, người bị hại và trả lời những câu hỏi đặt ra.\n2- Không được dùng làm chứng cứ\nnhững tình tiết do người làm chứng trình bày, nếu họ không thể nói rõ vì sao biết\nđược tình tiết đó.\nĐiều 52. Lời khai của người bị hại.\n1- Người bị hại trình bày về những tình tiết của vụ án, quan hệ giữa họ với bị can, bị cáo và trả lời những câu hỏi\nđặt ra.\n2- Không được dùng làm chứng cứ\nnhững tình tiết do người bị hại trình bày, nếu họ không thể nói rõ vì sao biết\nđược tình tiết đó.\nĐiều 53. Lời khai của người bị tạm giữ.\nNgười bị tạm giữ trình bày về những tình tiết liên quan đến việc họ bị nghi thực hiện tội phạm.\nĐiều 54. Lời khai của bị can, bị cáo.\n1- Bị can, bị cáo trình bày về\nnhững tình tiết của vụ án.\n2- Lời nhận tội của bị can, bị\ncáo chỉ có thể được coi là chứng cứ, nếu phù hợp với các chứng cứ khác của vụ\nán.\nKhông được dùng lời nhận tội của bị can, bị cáo làm chứng cứ duy nhất để kết tội.\nĐiều 55. Kết luận giám định.\n1- Người giám định kết luận về vấn\nđề được yêu cầu giám định và phải chịu trách nhiệm cá nhân về kết luận đó.\nNếu việc giám định do một nhóm người giám định tiến hành thì tất cả các thành viên đều ký vào bản kết luận chung. Trong trường hợp có ý kiến khác nhau thì mỗi người ghi riêng ý kiến kết luận của mình.\n2- Trong trường hợp cơ quan tiến hành tố tụng không đồng ý với kết luận giám định thì phải nêu rõ lý do, nếu kết luận chưa rõ hoặc chưa đầy đủ thì quyết định giám định bổ\nsung hoặc giám định lại theo thủ tục chung.\nĐiều 56. Vật chứng.\nVật chứng là những vật được dùng làm công cụ, phương tiện phạm tội; vật mang dấu vết tội phạm, vật là đối tượng của tội phạm cũng như tiền bạc và những vật khác có giá trị chứng minh tội phạm và người phạm tội.\nĐiều 57. Thu thập và bảo quản vật chứng.\n1- Vật chứng cần được thu thập kịp thời, đầy đủ, được mô tả đúng thực trạng vào biên bản và đưa vào hồ sơ vụ án.\nTrong trường hợp vật chứng không thể đưa vào hồ sơ vụ án thì phải chụp ảnh để đưa vào hồ sơ và vật chứng phải được niêm phong, bảo quản.\n2- Vật chứng phải được bảo quản nguyên vẹn, không để mất mát, lẵn lộn và hư hỏng. Hồ sơ vụ án ở cơ quan nào thì\ncơ quan đó có trách nhiệm bảo quản vật chứng. Vật chứng là tiền, vàng, bạc, kim khí quý, đá quý, đồ cổ, chất nổ, chất cháy, chất độc, chất phóng xạ phải được giám định ngay sau khi thu thập và phải chuyển ngay để bảo quản tại ngân hàng hoặc tại các cơ quan chuyên trách khác.\n3- Người có trách nhiệm bảo quản vật chứng mà để mất mát, hư hỏng thì phải bồi thường; trong trường hợp huỷ hoại hoặc cố ý làm hư hỏng vật chứng nhằm làm sai lệch hồ sơ vụ án thì phải chịu trách nhiệm theo Điều 236 Bộ luật hình sự.\nĐiều 58. Xử\nlý vật chứng.\n1- Việc xử lý vật chứng do Thủ\ntrưởng, Phó thủ trưởng cơ quan điều tra, Viện trưởng, Phó viện trưởng Viện kiểm sát cùng cấp quyết định, nếu vụ án được đình chỉ ở giai đoạn điều tra; do Chánh\nán, Phó chánh án Toà án cùng cấp hoặc Hội đồng xét xử quyết định ở giai đoạn xét xử. Việc thi hành các quyết định về xử lý vật chứng phải được ghi vào biên bản.\n2- Vật chứng được xử lý như sau:\na) Vật chứng là công cụ, phương tiện phạm tội, vật cấm lưu hành thì bị tịch thu, sung quỹ Nhà nước;\nb) Vật chứng là những vật, tiền bạc thuộc sở hữu xã hội chủ nghĩa hoặc thuộc sở hữu của người khác bị người phạm tội chiếm đoạt hoặc dùng làm công cụ phạm tội thì trả lại cho chủ sở hữu hoặc người quản lý hợp pháp; trong trường hợp không xác định được chủ sở hữu hoặc người quản lý hợp pháp thì sung quỹ Nhà nước;\nc) Vật chứng là tiền bạc hoặc tài sản do phạm tội mà có thì bị tịch thu sung quỹ Nhà nước;\nd) Vật chứng không có giá trị hoặc không sử dụng được thì bị tịch thu và tiêu huỷ.\n3- Trong quá trình điều tra,\ntruy tố, xét xử, những người có thẩm quyền quy định tại khoản 1 Điều này có quyền quyết định trả lại những vật chứng quy định tại điểm b, khoản 2 Điều này cho chủ\nsở hữu hoặc người quản lý hợp pháp, nếu xét thấy không ảnh hưởng đến việc xử lý\nvụ án.\n4- Trong trường hợp có tranh chấp về quyền sở hữu đối với vật chứng thì giải quyết theo tố tụng dân sự.\nĐiều 59.\nBiên bản về hoạt động điều tra và xét xử.\nNhững tình tiết được ghi trong các biên bản bắt người, khám xét, khám nghiệm hiện trường, khám nghiệm tử thi,\nđối chất, nhận dạng, thực nghiệm điều tra, biên bản phiên toà và các hoạt động tố tụng khác tiến hành theo quy định của Bộ luật này có thể được coi là chứng cứ.\nĐiều 60.\nCác tài liệu khác trong vụ án.\nNhững tình tiết có liên quan đến vụ án được ghi trong các tài liệu do cơ quan, tổ chức hoặc cá nhân cung cấp có\nthể được coi là chứng cứ.\nTrong trường hợp những tài liệu này có những dấu hiệu quy định tại Điều 56 Bộ luật này thì được coi là vật chứng.\nChương 5:\nNHỮNG BIỆN PHÁP NGĂN CHẶN\nĐiều 61.\nCăn cứ áp dụng biện pháp ngăn chặn.\nĐể kịp thời ngăn chặn tội phạm hoặc khi có căn cứ chứng tỏ bị can, bị cáo sẽ gây khó khăn cho việc điều tra,\ntruy tố, xét xử hoặc sẽ tiếp tục phạm tội, cũng như khi cần bảo đảm thi hành án thì cơ quan điều tra, Viện kiểm sát hoặc Toà án có thể áp dụng một trong những biện pháp ngăn chặn sau đây: bắt, tạm giữ, tạm giam, cấm đi khỏi nơi cư trú, bảo lĩnh, đặt tiền hoặc tài sản có giá trị để bảo đảm.\nĐiều 62. Việc bắt bị can, bị cáo để tạm giam.\n1- Những người sau đây có quyền ra lệnh bắt người:\na) Viện trưởng, Phó viện trưởng Viện kiểm sát nhân dân và Viện kiểm sát quân sự các cấp;\nb) Chánh án, Phó chánh án Toà án nhân dân và Toà án quân sự các cấp;\nc) Thẩm phán Toà án nhân dân cấp tỉnh hoặc Toà án quân sự cấp quân khu trở lên chủ toạ phiên toà;\nd) Trưởng công an, Phó trưởng công an cấp huyện, Thủ trưởng, Phó thủ trưởng cơ quan điều tra cấp tỉnh và cấp quân khu trở lên. Trong trường hợp này lệnh bắt phải được Viện kiểm sát cùng cấp phê chuẩn trước khi thi hành.\n2- Lệnh bắt phải ghi rõ ngày,\ntháng, năm, họ tên, chức vụ của người ra lệnh; họ tên, địa chỉ của người bị bắt và lý do bắt. Lệnh bắt phải có chữ ký của người ra lệnh và có đóng dấu.\nNgười thi hành lệnh phải đọc và\ngiải thích lệnh cho người bị bắt và phải lập biên bản về việc bắt.\nKhi tiến hành bắt người, phải có\nđại diện chính quyền xã, phường, thị trấn hoặc đại diện của cơ quan, tổ chức nơi người bị bắt cư trú hoặc làm việc và người láng giềng của người bị bắt chứng kiến.\n3- Không được bắt người vào ban\nđêm, trừ trường hợp khẩn cấp hoặc phạm tội quả tang quy định tại Điều 63 và Điều 64 Bộ luật này.\nĐiều 63. Việc bắt người trong trường hợp khẩn cấp.\n1- Trong những trường hợp sau\nđây thì được bắt khẩn cấp:\na) Khi có căn cứ để cho rằng người đó đang chuẩn bị thực hiện tội phạm nghiêm trọng;\nb) Khi người bị hại hoặc người có mặt tại nơi xảy ra tội phạm chính mắt trông thấy và xác nhận\nđúng là người đã thực hiện tội phạm mà xét thấy đó là tội phạm nghiêm trọng và\ncần ngăn chặn ngay việc người đó trốn;\nc) Khi thấy có dấu vết của tội phạm ở người hoặc tại chỗ ở của người bị nghi thực hiện tội phạm nghiêm trọng và xét thấy cần ngăn chặn ngay việc người đó trốn hoặc tiêu huỷ chứng cứ.\n2- Những người sau đây có quyền ra lệnh bắt người trong trường hợp khẩn cấp:\na) Trưởng công an, Phó trưởng công an cấp huyện, Thủ trưởng, Phó thủ trưởng cơ quan điều tra cấp tỉnh và cấp quân khu trở lên;\nb) Người chỉ\nhuy của đơn vị quân đội độc lập cấp trung đoàn; người chỉ huy đồn biên phòng ở\nhải đảo hoặc biên giới;\nc) Người chỉ huy máy bay, tàu biển,\nkhi máy bay, tàu biển đã rời khỏi sân bay, bến cảng.\n3- Nội dung lệnh bắt và việc thi hành lệnh bắt người trong trường hợp khẩn cấp phải tuân theo đúng quy định tại khoản 2 Điều 62 Bộ luật này.\n4- Trong mọi trường hợp, việc bắt khẩn cấp phải được báo ngay cho Viện kiểm sát cùng cấp bằng văn bản để xét phê chuẩn. Nếu Viện kiểm sát không phê chuẩn thì trả tự do ngay cho người bị bắt.\nĐiều 64. Việc bắt người phạm tội quả tang hoặc đang bị truy nã.\n1- Đối với người đang thực hiện tội phạm hoặc ngay sau khi thực hiện tội phạm thì bị phát hiện hoặc bị đuổi bắt,\ncũng như người đang bị truy nã thì bất kỳ người nào cũng có quyền bắt và giải ngay đến cơ quan công an, Viện kiểm sát hoặc Uỷ ban nhân dân nơi gần nhất. Các cơ quan này phải lập biên bản và giải ngay người bị bắt đến cơ quan điều tra có\nthẩm quyền.\n2- Khi bắt người phạm tội quả\ntang hoặc người đang bị truy nã thì người nào cũng có quyền tước vũ khí của người bị bắt.\nĐiều 65. Những việc cần làm ngay sau khi nhận người bị bắt.\n1- Sau khi nhận người bị bắt trong trường hợp khẩn cấp hoặc phạm tội quả tang, cơ quan điều tra phải lấy lời khai ngay và trong thời hạn 24 giờ phải ra quyết định tạm giữ hoặc trả tự do cho người bị bắt.\n2- Đối với người bị truy nã thì\nsau khi lấy lời khai, cơ quan điều tra phải thông báo ngay cho cơ quan đã ra lệnh truy nã và giải ngay người đó đến trại giam nơi gần nhất.\nĐiều 66.\nBiên bản.\n1- Người thi hành lệnh bắt trong mọi trường hợp đều phải lập biên bản.\nBiên bản phải ghi rõ ngày, giờ,\ntháng, năm, địa điểm bắt, nơi lập biên bản; những việc đã làm, tình hình diễn biến trong khi thi hành lệnh bắt, những đồ vật, tài liệu bị tạm giữ và những khiếu nại của người bị bắt.\nBiên bản phải được đọc cho người bị bắt và những người chứng kiến nghe. Người bị bắt, người thi hành lệnh bắt và\nngười chứng kiến phải cùng ký tên vào biên bản, nếu ai có ý kiến khác hoặc không đồng ý với nội dung biên bản thì có quyền ghi vào biên bản và ký tên.\nViệc tạm giữ đồ vật của người bị\nbắt phải được tiến hành theo quy định của Bộ luật này.\n2- Khi giao và nhận người bị bắt,\nhai bên bàn giao và nhận phải lập biên bản.\nNgoài những điểm đã quy định tại khoản 1 Điều này, biên bản giao nhận còn phải ghi rõ việc bàn giao các biên bản lấy lời khai, đồ vật đã thu thập được, tình trạng sức khoẻ của người bị bắt và\nmọi tình tiết xảy ra lúc giao nhận.\nĐiều 67.\nThông báo về việc bắt.\nNgười ra lệnh bắt phải thông báo ngay cho gia đình người đã bị bắt, chính quyền xã, phường, thị trấn hoặc cơ\nquan, tổ chức nơi người đó cư trú hoặc làm việc biết. Nếu thông báo cản trở việc\nđiều tra thì sau khi cản trở đó không còn nữa, người ra lệnh bắt phải thông báo ngay.\nĐiều 68. Tạm giữ.\n1- Tạm giữ có thể được áp dụng đối với những người bị bắt trong trường hợp khẩn cấp hoặc phạm tội quả tang quy định tại Điều 63 và Điều 64 Bộ luật này.\n2- Trưởng công an, Phó trưởng công an cấp huyện, Thủ trưởng, Phó thủ trưởng cơ quan điều tra cấp tỉnh và cấp quân khu trở lên có quyền ra lệnh tạm giữ.\n3- Trong thời hạn 24 giờ, lệnh tạm giữ phải được gửi cho Viện kiểm sát cùng cấp. Nếu xét thấy việc tạm giữ không cần thiết thì Viện kiểm sát ra quyết định huỷ bỏ lệnh tạm giữ và trả tự do ngay cho người bị tạm giữ.\nLệnh tạm giữ phải ghi rõ lý do tạm giữ, ngày hết hạn tạm giữ và phải giao cho người bị tạm giữ một bản.\nĐiều 69. Thời hạn tạm giữ.\n1- Thời hạn tạm giữ không được quá ba ngày đêm, kể từ khi cơ quan điều tra nhận người bị bắt.\n2- Trong trường hợp cần thiết và được Viện kiểm sát cùng cấp phê chuẩn, cơ quan ra lệnh tạm giữ\ncó thể gia hạn tạm giữ nhưng không quá ba ngày đêm.\n3- Khi hết thời hạn tạm giữ, nếu không đủ căn cứ khởi tố bị can thì phải trả tự do ngay cho người đã bị tạm giữ.\n4- Thời gian tạm giữ được tính vào thời hạn tạm giam.\nĐiều 70. Tạm giam.\n1- Tạm giam có thể được áp dụng đối với bị can, bị cáo phạm tội trong những trường hợp đặc biệt nghiêm trọng hoặc bị can, bị cáo về tội mà Bộ luật hình sự quy định hình phạt tù trên một năm và có căn cứ để cho rằng người đó có thể trốn hoặc cản trở\nviệc điều tra, xét xử hoặc có thể tiếp tục phạm tội.\n2- Đối với bị can, bị cáo là phụ nữ có thai hoặc đang thời kỳ nuôi con dưới mười hai tháng,\nlà người già yếu, người bị bệnh nặng mà nơi cư trú rõ ràng, trừ trường hợp đặc biệt thì không tạm giam mà áp dụng biện pháp ngăn chặn khác.\n3- Những người có thẩm quyền ra lệnh bắt được quy định tại Điều 62 Bộ luật này có quyền ra lệnh tạm giam. Lệnh tạm giam của những người được quy định tại điểm d, khoản 1 Điều 62 Bộ luật này phải được Viện kiểm sát cùng cấp phê chuẩn trước khi thi hành.\n4- Cơ quan ra lệnh tạm giam phải thông báo ngay cho gia đình người bị tạm giam và cho chính quyền xã, phường, thị\ntrấn hoặc cơ quan, tổ chức nơi người bi tạm giam cư trú hoặc làm việc biết.\nĐiều 71. Thời hạn tạm giam.\n1- Thời hạn tạm giam để điều tra không được quá hai tháng đối với tội ít nghiêm trọng; không được quá bốn tháng\nđối với tội nghiêm trọng.\n2- Trong trường hợp vụ án có nhiều tình tiết phức tạp, xét cần phải có thời gian dài hơn cho việc điều tra thì Viện trưởng Viện kiểm sát nhân dân cấp tỉnh trở lên và Viện trưởng Viện kiểm sát quân sự cấp quân khu trở lên có quyền gia hạn tạm giam, nhưng không được quá\nhai tháng đối với tội ít nghiêm trọng, không được quá bốn tháng đối với tội nghiêm trọng. Viện trưởng Viện kiểm sát nhân dân tối cao và Viện trưởng Viện kiểm sát quân sự trung ương có thể gia hạn thêm đối với tội nghiêm trọng, nhưng không được quá bốn tháng.\nTrong trường hợp cần thiết, đối với tội đặc biệt nguy hiểm xâm phạm an ninh quốc gia thì Viện trưởng Viện kiểm sát nhân dân tối cao có quyền gia hạn thêm.\n3- Trong khi tạm giam, nếu xét thấy không cần thiết phải tiếp tục tạm giam thì cơ quan điều tra phải kịp thời\nđề nghị Viện kiểm sát huỷ bỏ việc tạm giam để trả tự do cho người bị tạm giam hoặc xét cần thì áp dụng biện pháp ngăn chặn khác.\nKhi đã hết thời hạn tạm giam thì\nngười ra lệnh tạm giam phải trả tự do cho người bị tạm giam hoặc xét cần thì áp dụng biện pháp ngăn chặn khác.\nĐiều 72. Chế\nđộ tạm giữ, tạm giam.\nChế độ tạm giữ, tạm giam khác với chế độ đối với người đang chấp hành hình phạt tù.\nNơi tạm giữ, tạm giam, chế độ\nsinh hoạt, nhận quà, liên hệ với gia đình được thực hiện theo quy định của Hội đồng bộ trưởng.\nĐiều 73. Việc chăm nom thân nhân và bảo quản tài sản của người bị tạm giữ, tạm giam.\n1- Khi người bị tạm giữ, tạm giam có con chưa thành niên dưới 14 tuổi và thân nhân là người tàn tật, già yếu,\nkhông có người chăm sóc, thì cơ quan ra lệnh tạm giữ, tạm giam giao những người\nđó cho người thân thích hoặc cho chính quyền sở tại chăm nom.\n2- Trong trường hợp người bị tạm giữ, tạm giam có nhà hoặc tài sản khác mà không có người trông nom thì cơ quan ra lệnh tạm giữ, tạm giam phải áp dụng những biện pháp bảo quản thích đáng.\n3- Cơ quan ra lệnh tạm giữ, tạm giam thông báo cho người bị tạm giữ, tạm giam biết những biện pháp đã được áp dụng.\nĐiều 74. Cấm\nđi khỏi nơi cư trú.\nBị can, bị cáo phải làm giấy cam\nđoan không đi khỏi nơi cư trú của mình và phải có mặt khi có giấy triệu tập.\nTrong trường hợp bị can, bị cáo cần phải tạm thời di khỏi nơi cư trú thì phải\nđược phép của cơ quan đã áp dụng biện pháp ngăn chặn.\nBị can, bị cáo vi phạm cam đoan sẽ bị áp dụng biện pháp ngăn chặn khác.\nĐiều 75. Bảo lĩnh.\n1- Cá nhân hoặc tổ chức có thể\nnhận bảo lĩnh bị can, bị cáo. Khi nhận bảo lĩnh, cá nhân hoặc tổ chức phải làm giấy cam đoan không để bị can, bị cáo tiếp tục phạm tội và bảo đảm sự có mặt của bị can, bị cáo theo giấy triệu tập của cơ quan điều tra, Viện kiểm sát hoặc Toà\nán. Khi làm giấy cam đoan, cá nhân hoặc tổ chức nhận bảo lĩnh được thông báo về\nnhững tình tiết của vụ án có liên quan đến việc nhận bảo lĩnh. Trong trường hợp cá nhân nhận bảo lĩnh thì ít nhất phải có hai người.\n2- Cá nhân hoặc tổ chức nhận bảo lĩnh phải chịu trách nhiệm về vi phạm nghĩa vụ đã cam\nđoan.\nĐiều 76. Đặt tiền hoặc tài sản để bảo đảm.\n1- Đối với bị can hoặc bị cáo là\nngười nước ngoài thì cơ quan điều tra, Viện kiểm sát và Toà án có thể cho họ đặt tiền hoặc tài sản có giá trị để bảo đảm sự có mặt theo giấy triệu tập.\nQuyết định của cơ quan điều tra về việc cho đặt tiền hoặc tài sản phải được Viện kiểm sát cùng cấp phê chuẩn trước khi thi hành.\n2- Phải lập biên bản về việc đặt tiền hoặc tài sản và giao cho bị can hoặc bị cáo một bản. Biên bản phải ghi rõ\nsố lượng tiền, tên và tình trạng tài sản đã được đặt.\n3- Trong trường hợp bị can hoặc bị cáo vắng mặt không có lý do chính đáng theo giấy triệu tập của cơ quan điều tra, Viện kiểm sát, Toà án thì số tiền hoặc tài sản đó bị sung quỹ Nhà nước.\nĐiều 77. Huỷ\nbỏ hoặc thay thế biện pháp ngăn chặn.\n1- Khi vụ án bị đình chỉ thì mọi biện pháp ngăn chặn đã áp dụng đều phải được huỷ bỏ.\n2- Cơ quan điều tra, Viện kiểm sát, Toà án huỷ bỏ biện pháp ngăn chặn khi thấy không còn cần thiết hoặc có thể\nthay thế bằng một biện pháp ngăn chặn khác.\nĐối với những biện pháp ngăn chặn do Viện kiểm sát phê chuẩn thì việc huỷ bỏ hoặc thay thế phải do Viện kiểm sát quyết định.\nChương 6:\nBIÊN BẢN, THỜI HẠN, ÁN PHÍ \nĐiều 78.\nBiên bản.\n1- Khi tiến hành các hoạt động tố\ntụng, bắt buộc phải lập biên bản theo mẫu quy định thống nhất.\nTrong biên bản ghi rõ địa điểm,\nngày, giờ, tháng, năm tiến hành tố tụng, thời gian bắt đầu và thời gian kết thúc, nội dung của hoạt động tố tụng, những người tiến hành, tham gia hoặc có\nliên quan đến hoạt động tố tụng, những khiếu nại, yêu cầu hoặc đề nghị của họ.\n2- Biên bản phiên toà phải có chữ\nký của chủ toạ và thư ký; biên bản các hoạt động tố tụng khác phải có chữ ký của những người mà Bộ luật này quy định trong từng trường hợp. Những điểm sửa chữa trong biên bản cũng phải được xác nhận bằng chữ ký của họ.\nĐiều 79.\nTính thời hạn.\n1- Thời hạn mà Bộ luật này quy định\nđược tính theo giờ, ngày và tháng. Đêm được tính từ 22 giờ đến 6 giờ sáng ngày hôm sau.\nKhi tính thời hạn theo ngày thì\nthời hạn sẽ hết vào lúc 24 giờ; khi tính thời hạn theo tháng thì thời hạn hết vào ngày trùng của tháng sau; nếu tháng đó không có ngày trùng, thì thời hạn hết vào ngày cuối của tháng đó; nếu thời hạn hết vào ngày không làm việc thì ngày làm việc đầu tiên tiếp theo được tính là ngày cuối cùng của thời hạn.\n2- Trong trường hợp có đơn hoặc giấy tờ được gửi qua bưu điện thì thời hạn được tính theo dấu bưu điện. Nếu có\nđơn hoặc giấy tờ được gửi qua Ban giám thị trại giam thì thời hạn được tính từ\nngày Ban giám thị trại giam nhận đơn hoặc giấy tờ đó.\nĐiều 80. Phục hồi thời hạn.\nNếu quá hạn mà có lý do chính\nđáng thì cơ quan tiến hành tố tụng phải phục hồi thời hạn.\nĐiều 81. Án phí.\nÁn phí là tất cả chi phí để tiến hành tố tụng hình sự bao gồm tiền thù lao cho người làm chứng, người bị hại,\nngười giám định, người phiên dịch, người bào chữa trong trường hợp Toà án chỉ định và các khoản chi phí khác.\nĐiều 82.\nTrách nhiệm chịu án phí.\n1- Án phí do người bị kết án hoặc Nhà nước chịu.\n2- Người bị kết án phải trả án phí theo quyết định của Toà án.\n3- Trong trường hợp vụ án được khởi tố theo yêu cầu của người bị hại, nếu Toà án tuyên bị cáo vô tội thì người bị hại phải trả án phí.\nPhần thứ\nhai:\nKHỞI TỐ VÀ ĐIỀU TRA VỤ ÁN HÌNH SỰ \nChương 7:\nKHỞI TỐ VỤ ÁN HÌNH SỰ \nĐiều 83.\nCăn cứ khởi tố vụ án hình sự.\nChỉ được khởi tố vụ án hình sự\nkhi đã xác định có dấu hiệu tội phạm. Việc xác định dấu hiệu tội phạm dựa trên những cơ sở sau đây:\n1- Tố giác của công dân;\n2- Tin báo của cơ quan Nhà nước hoặc tổ chức xã hội;\n3- Tin báo trên các phương tiện thông tin đại chúng;\n4- Cơ quan điều tra, Viện kiểm sát, Toà án, đơn vị Bộ đội biên phòng, cơ quan Hải quan và cơ quan Kiểm lâm trực tiếp phát hiện dấu hiệu của tội phạm;\n5- Người phạm tội tự thú.\nĐiều 84. Tố\ngiác và tin báo về tội phạm.\nCông dân có thể tố giác tội phạm với cơ quan điều tra, Viện kiểm sát, Toà án hoặc với các cơ quan khác của Nhà\nnước hoặc tổ chức xã hội. Nếu tố giác bằng miệng thì cơ quan tiếp nhận phải lập biên bản và có chữ ký của người tố giác.\nCơ quan hoặc tổ chức khi phát hiện hoặc nhận được tố giác của công dân phải báo tin ngay về tội phạm cho cơ quan\nđiều tra hoặc Viện kiểm sát bằng văn bản.\nĐiều 85.\nNgười phạm tội tự thú.\nKhi người phạm tội đến tự thú,\ncơ quan tiếp nhận phải lập biên bản ghi rõ họ tên, tuổi, nghề nghiệp, chỗ ở và\nnhững lời khai của người tự thú.\nĐiều 86.\nNhiệm vụ giải quyết tố giác và tin báo về tội phạm.\nTrong thời hạn không quá hai mươi ngày kể từ khi nhận được tố giác hoặc tin báo, cơ quan điều tra, Viện kiểm sát, trong phạm vi trách nhiệm của mình phải kiểm tra, xác minh nguồn tin và\nquyết định việc khởi tố hoặc không khởi tố vụ án hình sự.\nTrong trường hợp sự việc bị tố\ngiác hoặc tin báo có nhiều tình tiết phức tạp hoặc phải kiểm tra, xác minh tại nhiều địa điểm thì thời hạn để giải quyết tố giác và tin báo có thể dài hơn,\nnhưng không quá hai tháng.\nĐiều 87.\nQuyết định khởi tố vụ án hình sự.\n1- Khi xác định có dấu hiệu tội phạm thì cơ quan điều tra, Viện kiểm sát phải ra quyết định khởi tố vụ án hình sự. Đơn vị Bộ đội biên phòng, cơ quan Hải quan, cơ quan Kiểm lâm ra quyết định khởi tố vụ án trong những trường hợp quy định tại Điều 93 Bộ luật này.\nToà án ra quyết định khởi tố vụ\nán nếu qua việc xét xử tại phiên toà mà phát hiện được tội phạm hoặc người phạm tội mới cần phải điều tra.\n2- Quyết định khởi tố vụ án hình sự phải ghi rõ thời gian, căn cứ khởi tố và điều khoản của Bộ luật hình sự được\náp dụng.\n3- Trong thời hạn 24 giờ, quyết\nđịnh khởi tố của Viện kiểm sát được gửi đến cơ quan điều tra để tiến hành điều tra; quyết định khởi tố của cơ quan điều tra, đơn vị Bộ đội biên phòng, cơ quan Hải quan, cơ quan Kiểm lâm được gửi đến Viện kiểm sát để kiểm sát việc khởi tố;\nquyết định khởi tố của Toà án được gửi đến Viện kiểm sát để xem xét, quyết định việc điều tra.\nĐiều 88. Khởi tố vụ án hình sự theo yêu cầu của người bị hại.\n1- Những vụ\nán về các tội phạm được quy định tại khoản 1 Điều 109; đoạn 1, khoản 1 Điều 112; đoạn 1, khoản 1 Điều 113; khoản 1 Điều 116; khoản 1 Điều 117 và Điều 126 Bộ\nluật hình sự chỉ được khởi tố khi có yêu cầu của người bị hại.\n2- Trong trường hợp người bị hại rút yêu cầu trước ngày mở phiên toà thì vụ án phải được\nđình chỉ.\nTrong trường hợp cần thiết, tuy người bị hại rút yêu cầu, Viện kiểm sát hoặc Toà án vẫn có thể tiếp tục tiến hành tố tụng đối với vụ án.\nĐiều 89. Những căn cứ không được khởi tố vụ án hình sự.\nKhông được khởi tố vụ án hình sự\nkhi có một trong những căn cứ sau đây:\n1- Không có sự việc phạm tội;\n2- Hành vi không cấu thành tội phạm;\n3- Người thực hiện hành vi nguy hiểm cho xã hội chưa đến tuổi chịu trách nhiệm hình sự;\n4- Người mà hành vi phạm tội của họ đã có bản án hoặc quyết đình đình chỉ vụ án có hiệu lực pháp luật;\n5- Đã hết thời hiệu truy cứu trách nhiệm hình sự;\n6- Tội phạm đã được đại xá;\n7- Người thực hiện hành vi nguy hiểm cho xã hội đã chết, trừ trường hợp cần tái thẩm đối với người khác.\nĐiều 90.\nQuyết định không khởi tố vụ án hình sự.\n1- Khi có một trong những căn cứ\nquy định tại Điều 89 Bộ luật này thì cơ quan có quyền khởi tố ra quyết định không khởi tố vụ án hình sự; nếu đã khởi tố thì phải huỷ bỏ quyết định khởi tố\nvà thông báo cho cơ quan, tổ chức, cá nhân đã tố giác hoặc báo tin về tội phạm biết rõ lý do; nếu xét cần xử lý bằng biện pháp khác thì chuyển hồ sơ cho cơ\nquan hoặc tổ chức hữu quan giải quyết.\n2- Cơ quan, tổ chức, cá nhân đã\ntố giác hoặc báo tin về tội phạm có thể khiếu nại quyết định không khởi tố vụ\nán với Viện kiểm sát. Quyết định không khởi tố vụ án của Viện kiểm sát cấp dưới có thể bị khiếu nại với Viện kiểm sát cấp trên.\nĐiều 91. Kiểm sát việc khởi tố vụ án hình sự.\n1- Viện kiểm sát kiểm sát việc tuân theo pháp luật, bảo đảm việc khởi tố vụ án hình sự có căn cứ và hợp pháp.\n2- Trong trường hợp quyết định khởi tố của cơ quan điều tra, đơn vị Bộ đội biên phòng, cơ quan Hải quan và cơ\nquan Kiểm lâm không có căn cứ thì Viện kiểm sát ra quyết định huỷ bỏ quyết định khởi tố đó; nếu quyết định không khởi tố vụ án hình sự của các cơ quan đó không có căn cứ, thì Viện kiểm sát huỷ bỏ quyết định đó và ra quyết định khởi tố vụ\nán.\n3- Trong trường hợp quyết định khởi tố của Toà án không có căn cứ thì Viện kiểm sát kháng nghị lên Toà án cấp trên.\nChương 8:\nCƠ QUAN ĐIỀU TRA VÀ QUY\nĐỊNH CHUNG VỀ ĐIỀU TRA \nĐiều 92. Cơ\nquan điều tra và thẩm quyền điều tra.\nCơ quan điều tra của Lực lượng Cảnh sát nhân dân và Lực lượng An ninh nhân dân điều tra tất cả các tội phạm, trừ những tội phạm thuộc thẩm quyền của cơ quan điều tra trong Quân đội và những trường hợp do cơ quan điều tra của Viện kiểm sát nhân dân điều tra.\n2- Cơ quan điều tra trong Quân đội\nđiều tra các tội phạm thuộc thẩm quyền xét xử của Toà án quân sự.\n3- Cơ quan điều tra của Viện kiểm sát nhân dân điều tra trong những trường hợp sau đây, khi Viện trưởng xét thấy cần thiết:\na) Khi phát hiện việc điều tra có vi phạm pháp luật nghiêm trọng;\nb) Khi tiến hành kiểm sát việc kiểm sát việc tuân theo pháp luật, phát hiện những vụ phạm tội rõ ràng, không cần thiết phải chuyển cho cơ quan điều tra khác;\nc) Khi phát hiện tội phạm trong hoạt động tư pháp.\nViện trưởng Viện kiểm sát nhân dân tối cao có thể giao cho cơ quan điều tra của Viện kiểm sát điều tra trong những trường hợp khác.\n4- Cơ quan điều tra có thẩm quyền\nđiều tra những vụ án hình sự mà tội phạm xảy ra trên địa phận của mình. Trong trường hợp không xác định được địa điểm xảy ra tội phạm thì việc điều tra thuộc thẩm quyền của cơ quan điều tra nơi phát hiện tội phạm, nơi bị can cư trú hoặc bị bắt.\n5- Tổ chức, nhiệm vụ, quyền hạn cụ thể của các cơ quan điều tra do Hội đồng Nhà nước quy\nđịnh.\nĐiều 93.\nQuyền hạn điều tra của Bộ đội biên phòng, Hải quan, Kiểm lâm.\n1- Khi phát hiện những hành vi phạm tội đến mức phải truy cứu trách nhiệm hình sự trong lĩnh vực quản lý của mình thì đơn vị Bộ đội biên phòng, cơ quan Hải quan và cơ\nquan Kiểm lâm có thẩm quyền:\na) Đối với hành vi phạm tội quả\ntang, chứng cứ rõ ràng, ít nghiêm trọng thì ra quyết định khởi tố vụ án, tiến hành điều tra và chuyển hồ sơ cho Viện kiểm sát có thẩm quyền trong thời hạn mười lăm ngày, kể từ ngày ra quyết định khởi tố vụ án;\nb) Đối với hành vi phạm tội nghiêm trọng hoặc phức tạp thì ra quyết định khởi tố vụ án, tiến hành những hoạt\nđộng điều tra ban đầu và chuyển hồ sơ cho cơ quan điều tra có thẩm quyền trong thời hạn bảy ngày kể từ ngày ra quyết định khởi tố vụ án.\n2- Nhiệm vụ, quyền hạn cụ thể\ntrong hoạt động điều tra của Bộ đội biên phòng, Hải quan và Kiểm lâm do Hội đồng Nhà nước quy định.\nĐiều 94.\nQuyền hạn và trách nhiệm của Thủ trưởng cơ quan điều tra và điều tra viên.\n1- Thủ trưởng cơ quan điều tra ra quyết định khởi tố vụ án, khởi tố bị can; quyết định áp dụng, thay đổi hoặc huỷ bỏ biện pháp ngăn chặn, truy nã bị can, khám xét, thay đổi điều tra viên trong những trường hợp được Bộ luật này quy định; trực tiếp tiến hành điều tra;\nra quyết định tạm đình chỉ hoặc đình chỉ điều tra.\nĐiều tra viên được phân công điều tra vụ án có quyền tiến hành các biện pháp điều tra do Bộ luật này quy định và\nphải chịu trách nhiệm về những hoạt động điều tra của mình.\n2- Những quyết định, yêu cầu của Thủ trưởng cơ quan điều tra, của điều tra viên trong khi tiến hành điều tra vụ\nán phải được cơ quan, tổ chức và công dân chấp hành.\nĐiều 95. Nhập hoặc tách vụ án hình sự để tiến hành điều tra.\nCó thể nhập để tiến hành điều tra trong cùng một vụ án những trường hợp bị can phạm nhiều tội, nhiều bị can cùng tham gia một tội phạm hoặc cùng với bị can còn có những người khác che giấu tội phạm hoặc không tố giác tội phạm quy định tại Điều 246 và Điều 247 Bộ luật hình sự.\nChỉ được tách vụ án trong những trường hợp thật cần thiết khi không thể hoàn thành sớm việc điều tra đối với tất cả các tội phạm và nếu việc tách đó không ảnh hưởng đến việc xác định sự thật khách quan và toàn diện của vụ án.\nĐiều 96. Uỷ\nthác điều tra.\nKhi cần thiết, cơ quan điều tra có thể uỷ thác cho cơ quan điều tra khác tiến hành một số hoạt động điều tra.\nQuyết định uỷ thác điều tra phải ghi rõ yêu cầu cụ thể. Cơ quan điều tra được uỷ\nthác có trách nhiệm thực hiện nhanh chóng và đầy đủ những việc được uỷ thác.\nViệc uỷ thác điều tra giữa nước Cộng hoà xã hội chủ nghĩa Việt Nam và những nước đã ký kết hiệp định tương trợ\ntư pháp với nước Cộng hoà xã hội chủ nghĩa Việt Nam được tiến hành theo quy định của hiệp định đó.\nĐiều 97. Thời hạn điều tra.\n1- Thời hạn điều tra vụ án hình sự không được quá bốn tháng kể từ khi khởi tố vụ án hình sự cho đến khi kết thúc điều tra.\n2- Trong trường hợp cần gia hạn\nđiều tra do tính chất phức tạp của vụ án, trong thời hạn mười ngày trước khi hết hạn điều tra, cơ quan điều tra phải có văn bản đề nghị Viện trưởng Viện kiểm sát gia hạn điều tra. Việc gia hạn điều tra được quy định như sau:\na) Viện trưởng Viện kiểm sát nhân dân cấp tỉnh, Viện trưởng Viện kiểm sát quân sự cấp quân khu gia hạn điều tra không quá bốn tháng đối với vụ án do cấp dưới hoặc cấp mình điều tra;\nb) Viện trưởng Viện kiểm sát nhân dân tối cao và Viện trưởng Viện kiểm sát quân sự trung ương gia hạn điều tra hai lần, mỗi lần không quá bốn tháng đối với những vụ án do cấp mình điều tra và một lần không quá bốn tháng đối với vụ án do cấp tỉnh và cấp quân khu điều tra;\nc) Trong trường hợp đặc biệt, Viện trưởng Viện kiểm sát nhân dân tối cao có quyền gia hạn điều tra thêm một lần không quá bốn tháng. Đối với tội đặc biệt nguy hiểm xâm phạm an ninh quốc gia thì Viện trưởng Viện kiểm sát nhân dân tối cao có quyền gia hạn thêm.\n3- Khi đã hết thời gian gia hạn\nđiều tra mà không chứng minh được bi can đã thực hiện tội phạm thì cơ quan điều tra phải ra quyết định đình chỉ điều tra.\nĐiều 98. Thời hạn phục hồi điều tra, điều tra bổ sung, điều tra lại.\n1- Trong trường hợp phục hồi điều tra quy định tại Điều 140 Bộ luật này thì thời hạn điều tra tiếp không được quá\nba tháng. Việc gia hạn điều tra tiến hành theo thủ tục chung quy định tại khoản 2 Điều 97 Bộ luật này, nhưng không quá ba tháng.\n2- Trong trường hợp vụ án do Viện kiểm sát trả lại để điều tra bổ sung thì thời hạn điều tra bổ sung không được quá hai tháng; nếu do Toà án trả lại để điều tra bổ sung thì thời hạn điều tra bổ sung không được quá một tháng. Thời hạn điều tra bổ sung tính từ ngày cơ quan\nđiều tra nhận lại hồ sơ vụ án và yêu cầu điều tra.\n3- Trong trường hợp vụ án được trả lại để điều tra lại thì thời hạn điều tra và việc gia hạn điều tra theo thủ\ntục chung.\nThời hạn điều tra được tính từ\nkhi cơ quan điều tra nhận hồ sơ và yêu cầu điều tra lại.\nĐiều 99. Giải quyết các yêu cầu của người tham gia tố tụng.\nKhi người tham gia tố tụng có\nyêu cầu về những vấn đề liên quan đến vụ án thì cơ quan điều tra, Viện kiểm sát trong phạm vi trách nhiệm của mình, giải quyết yêu cầu của họ và báo cho họ biết kết quả. Trong trường hợp không chấp nhận yêu cầu thì cơ quan điều tra hoặc Viện kiểm sát ra quyết định và nêu rõ lý do.\nĐiều 100.\nSự tham dự của người chứng kiến.\nNgười chứng kiến được mời tham dự\nhoạt động điều tra trong những trường hợp do Bộ luật này quy định.\nNgười chứng kiến có trách nhiệm xác nhận nội dung và kết quả công việc mà điều tra viên đã tiến hành trong khi mình có mặt và có thể nêu ý kiến cá nhân. ý kiến này được ghi vào biên bản.\nĐiều 101.\nKhông được tiết lộ bí mật về điều tra.\nĐiều tra viên, kiểm sát viên phải báo trước cho người tham gia tố tụng không được tiết lộ bí mật về điều tra. Việc báo này phải được ghi vào biên bản.\nĐiều tra viên, kiểm sát viên hoặc người tham gia tố tụng tiết lộ bí mật về điều tra thì tuỳ trường hợp phải chịu trách nhiệm theo các Điều 92, 93, 222, 223, 262, 263 Bộ\nluật hình sự.\nĐiều 102.\nBiên bản điều tra.\n1- Khi tiến hành điều tra phải lập biên bản theo quy định tại Điều 78 Bộ luật này.\nNgười lập biên bản phải đọc lại biên bản cho người tham gia tố tụng nghe, giải thích cho họ biết quyền được bổ\nsung và nhận xét về biên bản. Nhận xét đó được ghi vào biên bản. Người tham gia tố tụng cùng ký tên vào biên bản với người lập biên bản.\n2- Trong trường hợp người tham gia tố tụng từ chối ký vào biên bản, thì việc đó phải được ghi vào biên bản và\nnêu rõ lý do.\n3- Nếu người tham gia tố tụng vì\nnhược điểm về thể chất, tâm thần hoặc vì lý do khác mà không thể ký vào biên bản thì phải ghi rõ lý do; người lập biên bản và người chứng kiến cùng ký xác nhận.\nNgười không biết chữ thì điểm chỉ\nvào biên bản.\nChương 9:\nKHỞI TỐ BỊ CAN VÀ HỎI CUNG BỊ CAN \nĐiều 103.\nKhởi tố bị can.\n1- Khi có đủ căn cứ để xác định một người đã thực hiện hành vi phạm tội thì cơ quan điều tra ra quyết định khởi tố bị can.\n2- Quyết định khởi tố bị can ghi rõ: thời gian, địa điểm ra quyết định; họ tên, chức vụ người ra quyết định; họ\ntên, ngày, tháng, năm sinh; nghề nghiệp, hoàn cảnh gia đình của bị can; bị can bị khởi tố về tội gì, theo điều khoản nào của Bộ luật hình sự; thời gian, địa\nđiểm phạm tội và những tình tiết khác của tội phạm.\nNếu bị can bị khởi tố về nhiều tội khác nhau, thì trong quyết định khởi tố bị can phải ghi rõ từng tội danh và điều khoản của Bộ luật hình sự được áp dụng.\n3- Cơ quan ra quyết định khởi tố\nbị can phải giao quyết định và giải thích quyền và nghĩa vụ cho bị can. Bị can ký vào biên bản giao nhận.\n4- Quyết định khởi tố bị can phải\nđược gửi ngay cho Viện kiểm sát cùng cấp.\nĐiều 104.\nThay đổi hoặc bổ sung quyết định khởi tố bị can.\nNếu thấy cần thay đổi hoặc bổ\nsung quyết định khởi tố bị can thì cơ quan điều tra ra quyết định thay đổi hoặc bổ sung quyết định khởi tố. Quyết định này phải được gửi ngay cho Viện kiểm sát cùng cấp và bị can.\nĐiều 105.\nTạm đình chỉ chức vụ bị can đang đảm nhiệm.\nKhi xét thấy việc bị can tiếp tục giữ chức vụ gây khó khăn cho việc điều tra thì cơ quan điều tra, Viện kiểm sát có quyền kiến nghị với cơ quan cấp quản lý bị can tạm đình chỉ chức vụ của bị\ncan. Trong thời hạn bảy ngày, các cơ quan này phải trả lời cho cơ quan điều tra, Viện kiểm sát đã có kiến nghị biết.\nĐiều 106.\nGiấy triệu tập bị can.\n1- Giấy triệu tập bị can cần ghi rõ họ tên, chỗ ở của bị can; ngày, giờ, tháng, năm, địa điểm có mặt, gặp ai và\ntrách nhiệm về việc vắng mặt không có lý do chính đáng.\n2- Giấy triệu tập bị can được gửi cho chính quyền xã, phường, thị trấn nơi bị can cư trú hoặc cho Thủ trưởng cơ\nquan, tổ chức nơi bị can làm việc để giao cho bị can.\nKhi nhận giấy triệu tập, bị can phải ký nhận, có ghi rõ ngày, giờ nhận. Nếu bị can không ký nhận thì phải lập biên bản về việc đó và gửi cho cơ quan điều tra. Nếu bị can vắng mặt thì có thể\ngiao giấy triệu tập cho một người đã thành niên trong gia đình. Bị can đang bị\ntạm giam được triệu tập, thông qua Ban giám thị trại giam.\n3- Bị can phải có mặt theo giấy triệu tập. Trong trường hợp vắng mặt không có lý do chính đáng hoặc có biểu hiện trốn tránh thì cơ quan điều tra ra quyết định áp giải. Quyết định này phải được\nđọc cho bị can nghe trước khi áp giải.\nĐiều 107.\nHỏi cung bị can.\n1- Việc hỏi cung bị can phải do\nđiều tra viên tiến hành ngay sau khi có quyết định khởi tố bị can. Có thể hỏi cung bị can tại nơi tiến hành điều tra hoặc tại nơi ở của người đó.\nTrước khi hỏi cung, điều tra viên phải đọc quyết định khởi tố bị can và giải thích cho bị can biết rõ quyền và nghĩa vụ.\nNếu vụ án có nhiều bị can thì hỏi riêng từng người và không để họ tiếp xúc với nhau. Có thể cho bị can tự viết lời khai của mình.\n2- Không hỏi cung vào ban đêm,\ntrừ trường hợp không thể trì hoãn được, nhưng phải ghi rõ lý do vào biên bản.\n3- Điều tra viên bức cung hoặc dùng nhục hình đối với bị can thì phải chịu trách nhiệm theo Điều 234 và Điều 235 Bộ luật hình sự.\nĐiều 108.\nBiên bản hỏi cung bị can.\n1- Biên bản hỏi cung bị can phải lập theo quy định của Điều 78 Bộ luật này.\nMỗi lần hỏi cung đều phải lập biên bản. Biên bản phải ghi đầy đủ lời trình bày của bị can, các câu hỏi và câu trả lời.\n2- Sau khi hỏi cung, điều tra viên đọc lại biên bản cho bị can nghe hoặc để bị can tự đọc. Trong trường hợp có bổ sung và sửa chữa biên bản, thì bị can và điều tra viên cùng ký xác nhận.\nNếu biên bản có nhiều trang thì bị can ký vào từng trang của biên bản. Trong trường hợp bị can tự viết lời khai thì điều tra viên và bị can cùng ký xác nhận tờ khai đó.\nNếu việc hỏi cung được ghi âm thì sau khi hỏi cung, phải phát lại để bị can và điều tra viên cùng nghe. Biên bản phải ghi lại nội dung việc hỏi cung, bị can và điều tra viên cùng ký xác nhận.\nTrong trường hợp hỏi cung bị can có người phiên dịch thì điều tra viên phải giải thích quyền và nghĩa vụ của người phiên dịch, đồng thời giải thích cho bị can biết được quyền yêu cầu thay đổi người phiên dịch. Người phiên dịch và bị can cùng ký vào từng trang của biên bản hỏi cung.\n3- Khi hỏi cung có mặt người bào chữa, người đại diện hợp pháp của bị can thì điều tra viên phải giải thích cho họ biết quyền và nghĩa vụ trong khi hỏi cung bị can. Bị can, người bào chữa,\nngười đại diện hợp pháp cùng ký vào biên bản hỏi cung.\nChương 10:\nLẤY LỜI KHAI NGƯỜI LÀM CHỨNG, NGƯỜI BỊ HẠI ĐỐI CHẤT VÀ NHẬN DẠNG \nĐiều 109.\nTriệu tập người làm chứng.\n1- Giấy triệu tập người làm chứng phải ghi rõ họ tên, chỗ ở của người làm chứng; ngày, giờ, tháng, năm, địa điểm có mặt; gặp ai và trách nhiệm về việc vắng mặt không có lý do chính đáng.\n2- Giấy triệu tập được giao trực tiếp cho người làm chứng hoặc thông qua chính quyền xã, phường, thị trấn hoặc cơ quan, tổ chức nơi người làm chứng cư trú hoặc làm việc. Các cơ quan, tổ chức\nđó có trách nhiệm tạo điều kiện cho người làm chứng thực hiện nghĩa vụ.\nTrong mọi trường hợp, việc giao giấy triệu tập phải được ký nhận.\n3- Giấy triệu tập người làm chứng chưa đủ 16 tuổi được giao cho cha, mẹ hoặc người đại diện hợp pháp khác của họ.\nĐiều 110.\nLấy lời khai của người làm chứng.\n1- Có thể lấy lời khai người làm chứng tại nơi tiến hành điều tra hoặc tại chỗ ở của người đó.\n2- Nếu vụ án có nhiều người làm chứng thì phải lấy lời khai riêng từng người và không để cho họ tiếp xúc với nhau trong thời gian lấy lời khai.\n3- Trước khi lấy lời khai, điều tra viên phải giải thích cho người làm chứng biết quyền và nghĩa vụ. Việc này phải\nđược ghi vào biên bản.\n4- Trước khi hỏi về nội dung vụ\nán, điều tra viên cần xác minh mối quan hệ giữa người làm chứng với bị can, người bị hại và những tình tiết khác về nhân thân người làm chứng. Điều tra viên cần yêu cầu người làm chứng kể hoặc viết lại những gì mà họ biết về vụ án, sau dó mới\nđặt câu hỏi. Không được đặt câu hỏi có tính chất gợi ý.\n5- Khi lấy lời khai của người làm chứng dưới 16 tuổi phải mời cha mẹ, người đại diện hợp pháp khác hoặc thầy giáo, cô giáo của người đó tham dự.\nĐiều 111.\nBiên bản ghi lời khai của người làm chứng.\nBiên bản ghi lời khai của người làm chứng phải được lập theo quy định tại Điều 78 và Điều 108 Bộ luật này.\nĐiều 112.\nLấy lời khai của người bị hại.\nViệc lấy lời khai của người bị hại\nđược tiến hành theo quy định tại các Điều 109, 110 và 111 Bộ luật này.\nĐiều 113.\nĐối chất.\n1- Trong trường hợp có sự mâu thuẵn trong lời khai giữa hai hay nhiều người thì điều tra viên tiến hành đối chất.\n2- Nếu có người làm chứng hoặc người bị hại tham gia đối chất thì trước tiên điều tra viên phải giải thích cho họ biết trách nhiệm về việc từ chối, trốn tránh khai báo hoặc cố tình khai báo gian dối. Việc này phải được ghi vào biên bản.\n3- Khi bắt đầu đối chất, điều tra viên hỏi về mối quan hệ giữa những người tham gia đối chất, sau đó hỏi họ về\nnhững tình tiết cần làm sáng tỏ. Khi đã nghe những lời khai trong đối chất, điều tra viên có thể hỏi thêm từng người.\nĐiều tra viên cũng có thể để cho những người tham gia đối chất hỏi lẵn nhau; câu hỏi và trả lời của những người này phải được ghi vào biên bản.\nChỉ sau khi những người tham gia\nđối chất đã khai xong mới được nhắc lại những lời khai lần trước của họ.\n4- Biên bản đối chất phải lập theo quy định tại Điều 78 và Điều 108 Bộ luật này.\nĐiều 114.\nNhận dạng.\n1- Khi cần thiết, điều tra viên có thể mời người hoặc đưa vật, ảnh cho người làm chứng, người bị hại hoặc bị\ncan nhận dạng.\nĐiều tra viên phải hỏi trước người nhận dạng về những tình tiết, vết tích và đặc điểm mà nhờ đó họ có thể nhận dạng\nđược.\n2- Số người, vật hoặc ảnh đưa ra\nđể nhận dạng ít nhất phải là ba và về bề ngoài phải tương tự giống nhau. Đối với việc nhận dạng tử thi thì không thể áp dụng nguyên tắc này.\nTrong trường hợp đặc biệt có thể\ncho xác nhận người qua tiếng nói.\n3- Nếu nhân chứng hay người bị hại là người nhận dạng, thì trước khi tiến hành, điều tra viên phải giải thích cho họ biết trách nhiệm về việc từ chối, trốn tránh khai báo hoặc cố tình khai báo gian dối. Việc giải thích đó phải được ghi vào biên bản.\n4- Trong khi tiến hành nhận dạng,\nđiều tra viên không được đặt câu hỏi có tính chất gợi ý. Sau khi người nhận dạng\nđã xác nhận một người, một vật hay một ảnh trong số được đưa ra để nhận dạng thì điều tra viên yêu cầu họ giải thích là họ đã căn cứ vào các vết tích hoặc đặc\nđiểm gì mà xác nhận người, vật, hay ảnh đó.\nViệc tiến hành nhận dạng phải có\nmặt người chứng kiến.\n5- Biên bản nhận dạng phải được lập theo quy định tại Điều 78 và Điều 108 Bộ luật này. Trong biên bản cần ghi rõ nhân thân của người nhận dạng và của những người được đưa ra để nhận dạng;\nnhững đặc điểm của vật, ảnh được đưa ra để nhận dạng; các lời khai báo, trình bày của người nhận dạng.\nChương 11:\nKHÁM XÉT, THU GIỮ, TẠM GIỮ, KÊ BIÊN TÀI SẢN \nĐiều 115.\nCăn cứ khám người, chỗ ở, địa điểm, đồ vật, thư tín, bưu kiện, bưu phẩm.\n1- Việc khám người, chỗ ở, địa\nđiểm chỉ được tiến hành khi có căn cứ để nhận định trong người, chỗ ở, địa điểm của một người có công cụ, phương tiện phạm tội, đồ vật, tài sản do phạm tội mà\ncó hoặc đồ vật, tài liệu khác có liên quan đến vụ án.\nViệc khám chỗ ở, địa điểm cũng\nđược tiến hành khi cần phát hiện người đang bị truy nã.\n2- Khi cần phải thu thập những tài liệu hoặc đồ vật liên quan đến vụ án thì có thể khám thư tín, điện tín, bưu kiện, bưu phẩm.\nĐiều 116.\nThẩm quyền ra lệnh khám xét.\n1- Những người được quy định tại khoản 1 Điều 62 Bộ luật này có quyền ra lệnh khám xét trong mọi trường hợp. Lệnh khám xét của những người được quy định tại điểm d, khoản 1 Điều 62 Bộ luật này phải được Viện kiểm sát cùng cấp phê chuẩn trước khi tiến hành.\n2- Trong trường hợp không thể\ntrì hoãn, những người được quy định tại khoản 2 Điều 63 Bộ luật này có quyền ra lệnh khám xét. Sau khi khám xong, trong thời hạn 24 giờ, người ra lệnh khám phải báo bằng văn bản cho Viện kiểm sát cùng cấp.\nĐiều 117.\nKhám người.\n1- Khi bắt đầu khám người, phải\nđọc lệnh khám và đưa cho đương sự đọc lệnh khám đó; giải thích cho đương sự và\nnhững người có mặt biết quyền và nghĩa vụ của họ.\nNgười tiến hành khám phải yêu cầu\nđương sự đưa ra những đồ vật có liên quan đến vụ án, nếu đương sự từ chối thì tiến hành khám.\n2- Khi khám người, nam khám nam,\nnữ khám nữ và phải có người cùng giới chứng kiến.\n3- Có thể tiến hành khám người mà không cần có lệnh trong trường hợp bắt người hoặc khi có căn cứ để khẳng định người có mặt tại nơi khám xét giấu trong người đồ vật cần thu giữ.\nĐiều 118.\nKhám chỗ ở, địa điểm.\n1- Việc khám chỗ ở, địa điểm, chỗ\nlàm việc được tiến hành theo quy định tại các Điều 115, 116 và 117 Bộ luật này.\n2- Khi khám chỗ ở, địa điểm phải có mặt người chủ hoặc người đã thành niên trong gia đình họ, có đại diện chính quyền xã, phường hoặc thị trấn và người láng giềng chứng kiến; trong trường hợp\nđương sự và người trong gia đình họ cố tình vắng mặt, bỏ trốn hoặc đi vắng lâu ngày mà việc khám xét không thể trì hoãn thì phải có đại diện chính quyền và\nhai người láng giềng chứng kiến.\n3- Không được khám chỗ ở vào ban\nđêm, trừ trường hợp không thể trì hoãn, nhưng phải ghi rõ lý do vào biên bản.\n4- Khi khám chỗ làm việc của một người thì phải có mặt người đó, trừ trường hợp không thể trì hoãn, nhưng phải ghi rõ lý do vào biên bản.\nViệc khám chỗ làm việc phải có đại diện của cơ quan hoặc tổ chức chứng kiến.\n5- Khi tiến hành khám chỗ ở, địa\nđiểm, những người có mặt không được tự ý rời khỏi nơi đang bị khám, không được liên hệ, trao đổi với nhau hoặc với những người khác cho đến khi khám xong.\nĐiều 119.\nThu giữ thư tín, điện tín, bưu kiện, bưu phẩm tại bưu điện.\nKhi cần thiết phải thu giữ thư\ntín, điện tín, bưu kiện, bưu phẩm tại bưu điện thì cơ quan điều tra ra lệnh thu giữ. Lệnh này phải được Viện kiểm sát cùng cấp phê chuẩn trước khi thi hành, trừ\ntrường hợp không thể trì hoãn nhưng phải ghi rõ lý do vào biên bản và sau khi thu giữ phải báo ngay cho Viện kiểm sát cùng cấp biết.\nNgười thi hành lệnh phải thông báo cho người phụ trách cơ quan bưu điện hữu quan trước khi tiến hành thu giữ.\nNgười phụ trách cơ quan bưu điện hữu quan phải giúp đỡ người thi hành lệnh thu giữ hoàn thành nhiệm vụ.\nKhi thu giữ thư tín, điện tín,\nbưu kiện, bưu phẩm phải có đại diện của cơ quan bưu điện chứng kiến và ký xác nhận vào biên bản.\nCơ quan ra lệnh thu giữ phải thông báo cho người có thư tín, điện tín, bưu kiện, bưu phẩm bị thu giữ biết,\ntrừ trường hợp việc thông báo cản trở điều tra thì sau khi cản trở đó không còn nữa, người ra lệnh thu giữ phải thông báo ngay.\nĐiều 120.\nTạm giữ đồ vật, tài liệu khi khám xét.\nKhi khám xét, điều tra viên được tạm giữ đồ vật là vật chứng và tài liệu có liên quan trực tiếp đến vụ án. Đối với\nđồ vật thuộc loại cấm tàng trữ, lưu hành thì phải thu giữ và chuyển ngay cho cơ\nquan quản lý có thẩm quyền. Trong trường hợp cần thiết phải niêm phong thì tiến hành trước mặt chủ đồ vật hoặc đại diện gia đình, đại diện chính quyền và người chứng kiến.\nViệc tạm giữ đồ vật, tài liệu khi tiến hành khám xét phải được lập biên bản. Biên bản tạm giữ được lập thành bốn bản: một bản giao cho người chủ đồ vật, tài liệu; một bản đưa vào hồ sơ vụ\nán; một bản gửi cho Viện kiểm sát cùng cấp và một bản giao cho cơ quan quản lý\nđồ vật, tài liệu bị tạm giữ.\nĐiều 121.\nKê biên tài sản.\n1- Việc kê biên tài sản chỉ áp dụng\nđối với bị can, bị cáo về tội mà Bộ luật hình sự quy định có thể tịch thu tài sản hoặc phạt tiền cũng như đối với người phải chịu trách nhiệm bồi thường thiệt hại theo quy định của pháp luật.\nNhững người có thẩm quyền quy định tại khoản 1 Điều 62 Bộ luật này có quyền ra lệnh kê biên tài sản. Lệnh kê biên của những người được quy định tại điểm d, khoản 1 Điều 62 Bộ luật này phải được Viện kiểm sát cùng cấp phê chuẩn trước khi thi hành.\n2- Chỉ kê biên phần tài sản tương ứng với mức có thể bị tịch thu, phạt tiền hoặc bồi thường thiệt hại.\nTài sản bị kê biên được giao cho chủ tài sản hoặc thân nhân của họ bảo quản. Người được giao bảo quản mà có hành vi chuyển nhượng, đánh tráo, cất giấu, huỷ hoại tài sản bị kê biên thì phải chịu trách nhiệm theo Điều 244 Bộ luật hình sự.\n3- Khi tiến hành kê biên tài sản,\nphải có mặt đương sự hoặc người đã thành niên trong gia đình, đại diện chính quyền xã, phường hoặc thị trấn và người láng giềng chứng kiến. Người tiến hành kê biên phải lập biên bản, ghi rõ tên và tình trạng từng tài sản bị kê biên.\nBiên bản phải lập theo quy định tại Điều 78 Bộ luật này, đọc cho đương sự và những người có mặt nghe và cùng ký tên. Những khiếu nại của đương sự được ghi vào biên bản, có chữ ký xác nhận của họ và của người tiến hành kê biên.\nBiên bản kê biên được lập thành ba bản: một bản được giao ngay cho đương sự sau khi kê biên xong; một bản gửi cho Viện kiểm sát cùng cấp và một bản đưa vào hồ sơ vụ án.\n4- Khi xét thấy việc kê biên không còn cần thiết thì người có thẩm quyền quy định tại khoản 1 Điều này phải kịp thời ra quyết định huỷ bỏ lệnh kê biên.\nĐiều 122.\nTrách nhiệm bảo quản đồ vật, tài liệu, thư tín, điện tín, bưu kiện, bưu phẩm bị\nthu giữ, tạm giữ hoặc bị niêm phong.\nĐồ vật, tài liệu, thư tín, điện tín, bưu kiện, bưu phẩm bị thu giữ, tạm giữ hoặc bị niêm phong theo quy định tại các Điều 57, 119 và 120 Bộ luật này phải được bảo quản nguyên vẹn.\nNgười được giao bảo quản mà phá\nhuỷ niêm phong, tiêu dùng, chuyển nhượng, đánh tráo, cất giấu hoặc huỷ hoại tài sản được giao bảo quản thì phải chịu trách nhiệm theo Điều 244 Bộ luật hình sự.\nĐiều 123.\nBiên bản khám xét, thu giữ, tạm giữ đồ vật, tài liệu, thư tín, điện tín, bưu kiện,\nbưu phẩm.\nKhi tiến hành khám xét, thu giữ,\ntạm giữ phải lập biên bản theo quy định tại Điều 78 Bộ luật này.\nĐiều 124.\nTrách nhiệm của người ra lệnh và thi hành lệnh khám xét, kê biên tài sản, thu giữ, tạm giữ đồ vật, tài liệu, thư tín, điện tín, bưu kiện, bưu phẩm.\nNgười ra lệnh, người tiến hành khám xét, kê biên tài sản, thu giữ, tạm giữ đồ vật, tài liệu, thư tín, điện tín, bưu kiện, bưu phẩm trái pháp luật thì tuỳ trường hợp mà bị xử lý kỷ luật hoặc phải chịu trách nhiệm theo quy định của Bộ luật hình sự.\nChương 12:\nKHÁM NGHIỆM HIỆN TRƯỜNG,\nKHÁM NGHIỆM TỬ THI THỰC NGHIỆM ĐIỀU TRA, GIÁM ĐỊNH\nĐiều 125.\nKhám nghiệm hiện trường.\n1- Cơ quan điều tra tiến hành khám nghiệm nơi xảy ra, nơi phát hiện tội phạm nhằm phát hiện dấu vết của tội phạm, vật chứng và làm sáng tỏ các tình tiết có ý nghĩa đối với vụ án.\n2- Khám nghiệm hiện trường có thể\ntiến hành trước khi khởi tố vụ án hình sự. Trước khi tiến hành khám nghiệm, điều tra viên phải báo cho Viện kiểm sát cùng cấp biết. Khi khám nghiệm phải có người chứng kiến; có thể để cho bị can, người bị hại, người làm chứng và mời nhà\nchuyên môn tham dự việc khám nghiệm.\n3- Khi khám nghiệm hiện trường,\nđiều tra viên tiến hành chụp ảnh, vẽ sơ đồ, mô tả hiện trường, đo đạc, dựng mô\nhình, thu lượm và xem xét tại chỗ dấu vết của tội phạm, đồ vật, tài liệu có\nliên quan đến vụ án, ghi rõ kết quả xem xét vào biên bản khám nghiệm hiện trường.\nTrong trường hợp không thể xem xét ngay được thì đồ vật và tài liệu thu giữ phải được bảo quản, giữ nguyên trạng hoặc niêm phong đưa về nơi tiến hành điều tra.\nĐiều 126.\nKhám nghiệm tử thi.\nKhi phát hiện tử thi, điều tra viên tiến hành khám nghiệm có bác sĩ pháp y tham gia và phải có người chứng kiến.\nTrong trường hợp cần phải khai quật tử thi thì phải có quyết định của cơ quan điều tra và phải thông báo cho gia đình nạn nhân. việc khai quật tử thi phải được tiến hành có bác sĩ pháp y tham gia.\nKhi cần thiết có thể triệu tập người giám định và phải có người chứng kiến.\nTrong mọi trường hợp, việc khám nghiệm tử thi phải được báo trước cho Viện kiểm sát cùng cấp biết.\nĐiều 127.\nXem xét dấu vết trên thân thể.\n1- Điều tra viên tiến hành xem xét thân thể người bị bắt, bị tạm giữ, bị can, người bị hại, người làm chứng để\nphát hiện trên người họ dấu vết của tội phạm hoặc các dấu vết khác có ý nghĩa đối với vụ án. Trong trường hợp cần thiết thì trưng cầu giám định pháp y.\n2- Việc xem xét thân thể phải do người cùng giới tiến hành và phải có mặt người cùng giới chứng kiến. Trong trường hợp cần thiết thì có bác sĩ tham gia.\nKhông được xâm phạm đến nhân phẩm hoặc sức khoẻ của người bị xem xét thân thể.\nĐiều 128.\nThực nghiệm điều tra.\n1- Để kiểm tra và xác minh những tài liệu, những tình tiết có ý nghĩa đối với vụ án, cơ quan điều tra có quyền thực nghiệm điều tra bằng cách cho dựng lại hiện trường, diễn lại hành vi, tình huống hoặc mọi tình tiết khác của một sự việc nhất định và tiến hành các hoạt động thực nghiệm cần thiết. Khi thấy cần, có thể đo đạc, chụp ảnh, vẽ sơ đồ.\n2- Khi tiến hành thực nghiệm điều tra, phải có người chứng kiến. Trong trường hợp cần thiết, người bị tạm giữ, bị\ncan, người bị hại, người làm chứng cũng có thể tham gia.\nKhông được xâm phạm đến nhân phẩm,\ndanh dự, gây ảnh hưởng đến sức khoẻ của những người tham gia việc thực nghiệm\nđiều tra.\nĐiều 129.\nBiên bản khám nghiệm hiện trường, khám nghiệm tử thi, xem xét dấu vết trên thân thể và thực nghiệm điều tra.\nKhi tiến hành khám nghiện hiện trường, khám nghiệm tử thi, xem xét dấu vết trên thân thể và thực nghiệm điều tra phải lập biên bản theo quy định tại Điều 78 Bộ luật này.\nĐiều 130.\nTrưng cầu giám định.\n1- Khi có những vấn đề cần được xác định theo quy định tại khoản 5 Điều 44 Bộ luật này cũng như khi xét thấy cần thiết thì Thủ trưởng cơ quan điều tra ra quyết định trưng cầu giám định.\n2- Quyết định trưng cầu giám định phải nêu rõ yêu cầu giám định vấn đề gì; họ tên người được trưng cầu hoặc tên cơ quan tiến hành giám định; ghi rõ quyền và nghĩa vụ của người giám định đã được quy định tại Điều 44 Bộ luật này.\nĐiều 131.\nViệc tiến hành giám định.\nViệc giám định có thể tiến hành tại cơ quan giám định hoặc tại nơi tiến hành điều tra vụ án ngay sau khi có quyết\nđịnh trưng cầu giám định.\nĐiều tra viên có quyền tham dự\ngiám định, nhưng phải báo trước cho người giám định biết.\nĐiều 132.\nNội dung kết luận giám định.\n1- Nội dung kết luận giám định phải ghi rõ: thời gian, địa điểm tiến hành giám định; họ tên, trình độ văn hoá,\ntrình độ chuyên môn của người giám định; những người tham gia khi tiến hành giám định; những dấu vết, đồ vật, tài liệu và tất cả những gì đã được giám định,\nnhững phương pháp được áp dụng và giải đáp những vấn đề đã được đặt ra có căn cứ\ncụ thể.\n2- Để làm sáng tỏ hoặc bổ sung nội dung kết luận giám định, cơ quan điều tra có thể hỏi thêm người giám định về những tình tiết cần thiết và có thể quyết định giám định bổ sung hoặc giám định lại.\nĐiều 133.\nQuyền của bị can đối với kết luận giám định.\n1- Sau khi đã tiến hành giám định,\nnếu bị can yêu cầu thì được thông báo về nội dung kết luận giám định.\nBị can được trình bày những ý kiến của mình về kết luận giám định, yêu cầu giám định bổ sung hoặc giám định lại.\nNhững điều này được ghi vào biên bản.\n2- Trong trường hợp cơ quan điều tra không chấp nhận yêu cầu của bị can thì phải nêu rõ lý do và báo cho bị can biết.\nĐiều 134.\nGiám định bổ sung hoặc giám định lại.\nViệc giám định bổ sung hoặc giám\nđịnh lại được tiến hành theo thủ tục chung.\nViệc giám định lại phải do người giám định khác tiến hành.\nChương 13:\nTẠM ĐÌNH CHỈ ĐIỀU TRA VÀ KẾT THÚC ĐIỀU TRA\nĐiều 135.\nTạm đình chỉ điều tra.\n1- Khi bị can bị bệnh tâm thần hoặc bệnh hiểm nghèo khác có chứng nhận của Hội đồng giám định pháp y thì có thể\ntạm đình chỉ điều tra trước khi hết hạn điều tra. Trong trường hợp chưa xác định\nđược bị can hoặc không biết rõ bị can đang ở đâu thì tạm đình chỉ điều tra khi\nđã hết thời hạn điều tra.\nTrong trường hợp vụ án có nhiều bị can mà lý do tạm đình chỉ điều tra không liên quan đến tất cả các bị can,\nthì có thể tạm đình chỉ điều tra đối với từng bị can.\nNếu không biết bị can đang ở đâu thì cơ quan điều tra phải ra quyết định truy nã trước khi tạm đình chỉ điều tra.\n2- Cơ quan điều tra ra quyết định tạm đình chỉ điều tra phải gửi quyết định này cho Viện kiểm sát cùng cấp và\nthông báo cho bị can, người bị hại biết.\nĐiều 136.\nTruy nã bị can.\nQuyết định truy nã phải ghi rõ họ\ntên, tuổi, trú quán, đặc điểm để nhận dạng bị can, dán ảnh kèm theo, nếu có và\ntội phạm mà bị can đã bị khởi tố.\nQuyết định truy nã được thông báo trên các phương tiện thông tin đại chúng để mọi người phát hiện, bắt, giữ\nngười bị truy nã.\nĐiều 137.\nKết thúc điều tra.\n1- Việc điều tra kết thúc khi cơ\nquan điều tra ra quyết định đề nghị truy tố hoặc đình chỉ điều tra.\n2- Trong trường hợp cơ quan điều tra đề nghị truy tố thì hồ sơ vụ án được chuyển sang Viện kiểm sát và cơ quan\nđiều tra phải báo ngay cho bị can và người bào chữa biết.\nĐiều 138.\nĐề nghị truy tố.\n1- Khi có đầy đủ chứng cứ để xác\nđịnh có tội phạm và bị can thì cơ quan điều tra làm bản kết luận điều tra và đề\nnghị truy tố. Bản kết luận điều tra trình bày diễn biến hành vi tội phạm, nêu rõ các chứng cứ chứng minh tội phạm, những ý kiến đề xuất giải quyết vụ án, có\nnêu rõ lý do và căn cứ.\nBản kết luận điều tra, đề nghị\ntruy tố cùng hồ sơ vụ án được gửi đến Viện kiểm sát cùng cấp.\n2- Kèm theo kết luận điều tra có\nbản kê về thời hạn điều tra, biện pháp ngăn chặn đã được áp dụng có ghi rõ thời gian tạm giữ, tạm giam, vật chứng, việc kiện dân sự, biện pháp để bảo đảm việc phạt tiền, bồi thường và tịch thu tài sản, nếu có.\n3- Bản kết luận điều tra phải ghi rõ ngày, tháng, năm, họ tên, chức vụ và chữ ký của người làm kết luận.\nĐiều 139.\nĐình chỉ điều tra.\n1- Cơ quan điều tra ra quyết định\nđình chỉ điều tra trong những trường hợp sau đây:\na) Có một trong những căn cứ quy\nđịnh tại Điều 89 Bộ luật này;\nb) Đã hết thời hạn điều tra mà\nkhông chứng minh được bị can đã thực hiện tội phạm.\n2- Quyết định đình chỉ điều tra ghi rõ thời gian, địa điểm ra quyết định, lý do đình chỉ điều tra, việc huỷ bỏ\nbiện pháp ngăn chặn, trả lại đồ vật đã tạm giữ, nếu có và những vấn đề khác có\nliên quan.\nCơ quan điều tra phải gửi quyết\nđịnh đình chỉ điều tra cho Viện kiểm sát cùng cấp và báo ngay bị can, người bị\nhại biết.\nNếu trong một vụ án có nhiều bị\ncan mà căn cứ để đình chỉ điều tra không liên quan đến tất cả các bị can, thì\ncó thể đình chỉ điều tra đối với từng bị can.\n3- Trong trường hợp được quy định tại đoạn 1, khoản 1 Điều 48 Bộ luật hình sự, thì cơ quan\nđiều tra ra quyết định đình chỉ điều tra vụ án và có thể chuyển giao hồ sơ cho cơ quan Nhà nước hoặc tổ chức xã hội xử lý.\nĐiều 140.\nPhục hồi điều tra.\n1- Khi có lý do để huỷ bỏ quyết\nđịnh đình chỉ hoặc tạm đình chỉ điều tra, thì cơ quan điều tra ra quyết định phục hồi điều tra, nếu chưa hết thời hiệu truy cứu trách nhiệm hình sự. Quyết định này phải được gửi cho Viện kiểm sát cùng cấp.\n2- Nếu việc điều tra bị đình chỉ\ntheo điểm 5 và điểm 6 Điều 89 Bộ luật này mà bị can không đồng ý và yêu cầu điều tra lại thì cơ quan điều tra hoặc Viện kiểm sát ra quyết định phục hồi điều tra.\nChương 14:\nKIỂM SÁT ĐIỀU TRA. QUYẾT\nĐỊNH VIỆC TRUY TỐ\nĐiều 141.\nNhiệm vụ, quyền hạn của Viện kiểm sát đối với hoạt động điều tra.\n1- Viện kiểm sát kiểm sát việc tuân theo pháp luật, thực hành quyền công tố, bảo đảm việc điều tra được khách quan, toàn diện và đầy đủ. Viện kiểm sát phải kịp thời phát hiện những vi phạm pháp luật trong quá trình điều tra và đề ra biện pháp khắc phục.\n2- Viện kiểm sát có nhiệm vụ:\na) Áp dụng mọi biện pháp do Bộ\nluật này quy định để mọi hành vi phạm tội đều phải được điều tra và xử lý kịp thời, không để lọt người phạm tội, không làm oan người vô tội;\nb) Bảo đảm không để một người nào bị bắt, tạm giữ, tạm giam, bị hạn chế các quyền công dân, bị xâm phạm tính mạng, tài sản, danh dự và nhân phẩm một cách trái pháp luật;\nc) Bảo đảm hoạt động điều tra phải\nđược tiến hành theo quy định của Bộ luật này. Trong việc điều tra phải thu thập cả chứng cứ xác định có tội và chứng cứ xác định vô tội, làm rõ những tình tiết tăng nặng và những tình tiết giảm nhẹ trách nhiệm của bị can và tìm ra những nguyên nhân, điều kiện phạm tội;\nd) Bảo đảm việc truy cứu trách nhiệm hình sự đối với bị can là có căn cứ và hợp pháp.\n3- Viện kiểm sát có quyền:\na) Kiểm sát việc khởi tố, tự mình khởi tố vụ án hình sự và chuyển đến cơ quan điều tra để\nyêu cầu tiến hành điều tra; trực tiếp điều tra trong những trường hợp quy định tại khoản 3 Điều 92 Bộ luật này;\nb) Phê chuẩn hoặc không phê chuẩn quyết định của cơ quan điều tra đã được quy định tại Bộ luật này;\nc) Quyết định\náp dụng, thay đổi hoặc huỷ bỏ các biện pháp ngăn chặn; yêu cầu cơ quan điều tra truy nã bị can;\nd) Đề ra yêu cầu điều tra, trả lại hồ sơ vụ án yêu cầu điều tra bổ sung; yêu cầu cơ quan điều tra cung cấp tài liệu cần thiết về tội phạm và việc làm vi phạm pháp luật của điều tra viên, nếu có;\nđ) Kiểm sát việc khám xét, khám nghiệm, việc hỏi cung bị can và các hoạt động điều tra khác của cơ quan điều tra; trực tiếp hỏi cung bị can khi thấy cần thiết;\ne) Quyết định truy tố, đình chỉ\nhoặc tạm đình chỉ điều tra, chuyển vụ án, huỷ bỏ các quyết định trái pháp luật của các cơ quan điều tra;\ng) Yêu cầu Thủ trưởng cơ quan điều tra thay đổi điều tra viên vi phạm pháp luật trong khi tiến hành điều tra.\n4- Các cơ quan điều tra có trách nhiệm thực hiện các yêu cầu và quyết định của Viện kiểm sát. Đối với những yêu cầu và quyết định quy định tại các điểm b, c, e khoản 3 Điều này, nếu không nhất trí, cơ quan điều tra vẫn phải chấp hành, nhưng có quyền đề nghị Viện trưởng Viện kiểm sát cấp trên trực tiếp xét và quyết định. Trong thời hạn hai mươi ngày, Viện trưởng Viện kiểm sát cấp trên trực tiếp phải xét và giải quyết đề nghị của cơ\nquan điều tra.\nĐiều 142.\nQuyết định của Viện kiểm sát sau khi kết thúc điều tra.\n1- Trong thời hạn không quá ba mươi ngày kể từ khi nhận được hồ sơ vụ án và bản kết luận điều tra, Viện kiểm sát phải ra một trong những quyết định sau đây:\na) Truy tố bị\ncan trước Toà án bằng bản cáo trạng;\nb) Trả lại hồ sơ để điều tra bổ\nsung;\nc) Đình chỉ hoặc tạm đình chỉ vụ\nán.\nTrong trường hợp cần thiết, Viện trưởng Viện kiểm sát cấp trên trực tiếp có thể gia hạn thêm nhưng không quá ba mươi ngày.\nViện kiểm sát phải thông báo cho bị can và người bào chữa biết những quyết định nói trên. Bản cáo trạng, quyết định\nđình chỉ điều tra hoặc tạm đình chỉ điều tra phải được giao cho bị can. Người bào chữa được đọc bản cáo trạng, ghi chép những điều cần thiết và đề xuất yêu cầu.\n2- Trong trường hợp bị can đang bị tạm giam mà thời hạn tạm giam để điều tra đã hết, nếu xét thấy cần tiếp tục tạm giam để hoàn thành bản cáo trạng thì Viện kiểm sát có thể ra lệnh tạm giam, nhưng không được quá ba mươi ngày.\n3- Trong trường hợp truy tố thì\ntrong thời hạn ba ngày kể từ khi ra quyết định, Viện kiểm sát phải gửi hồ sơ và\nquyết định truy tố đến Toà án.\nĐiều 143.\nBản cáo trạng.\n1- Nội dung bản cáo trạng phải ghi rõ ngày, giờ, tháng, năm, địa điểm xảy ra tội phạm; thủ đoạn, mục đích, hậu quả của tội phạm và những tình tiết quan trọng khác; những chứng cứ xác định tội trạng của bị can, những tình tiết tăng nặng và tình tiết giảm nhẹ; nhân thân của bị can và mọi tình tiết khác có ý nghĩa đối với vụ án.\nPhần kết luận của cáo trạng ghi rõ tội danh và điều khoản Bộ luật hình sự được áp dụng.\n2- Người lập bản cáo trạng phải ghi rõ ngày, tháng, năm lập cáo trạng; họ tên, chức vụ và ký\nvào bản cáo trạng.Bổ sung\nĐiều 144.\nKhiếu nại đối với hoạt động của điều tra viên, kiểm sát viên.\n1- Khiếu nại đối với hoạt động của\nđiều tra viên được gửi đến cơ quan điều tra hoặc Viện kiểm sát cùng cấp.\nKhiếu nại đối với hoạt động của kiểm sát viên được gửi cho Viện trưởng Viện kiểm sát đó hoặc Viện kiểm sát cấp trên. Nếu khiếu nại bằng miệng thì phải lập biên bản có chữ ký của người khiếu nại và người nhận khiếu nại.\n2- Khiếu nại phải được giải quyết trong thời hạn mười lăm ngày kể từ khi nhận được khiếu nại. Trong trường hợp bác bỏ khiếu nại phải nêu rõ lý do.\nPhần thứ ba:\nXÉT XỬ SƠ THẨM Chương 15:\nTHẨM QUYỀN CỦA TOÀ ÁN CÁC CẤP \nĐiều 145.\nThẩm quyền xét xử của Toà án các cấp.\n1- Toà án nhân dân cấp huyện và Toà án quân sự khu vực xét xử sơ thẩm những tội phạm mà Bộ\nluật hình sự quy định hình phạt từ bảy năm tù trở xuống, trừ những tội sau đây:\na) Các tội đặc biệt nguy hiểm xâm phạm an ninh quốc gia;\nb) Các tội quy định tại các Điều 89, 90, 91, 92, 93, 101 (khoản 3), 102, 179, 231, 232 Bộ luật hình sự.\n2- Toà án nhân dân cấp tỉnh và Toà án quân sự cấp quân khu xét xử sơ thẩm những vụ án hình sự về những tội phạm không thuộc thẩm quyền của Toà án nhân dân cấp huyện và Toà án quân sự khu vực hoặc những vụ án thuộc thẩm quyền của Toà án cấp dưới mà mình lấy lên để xét xử.\n3- Toà hình sự Toà án nhân dân tối cao, Toà án quân sự cấp cao xét xử sơ thẩm đồng thời chung thẩm những vụ án đặc biệt nghiêm trọng, phức tạp.\n4- Toà án quân sự xét xử những bị cáo thuộc thẩm quyền xét xử của mình theo quy định của pháp luật.\nĐiều 146.\nThẩm quyền theo lãnh thổ.\n1- Toà án có thẩm quyền xét xử vụ\nán hình sự là Toà án nơi tội phạm được thực hiện. Trong trường hợp không xác định\nđược nơi thực hiện tội phạm thì Toà án có thẩm quyền xét xử là Toà án nơi kết thúc việc điều tra.\n2- Bị cáo phạm tội ở nước ngoài nếu xét xử ở Việt Nam thì do Toà án nhân dân cấp tỉnh nơi cư trú cuối cùng của bị cáo ở trong nước xét xử. Nếu không xác định được nơi cư trú cuối cùng ở\ntrong nước của bị cáo thì tuỳ trường hợp, Chánh án Toà án nhân dân tối cao ra quyết định giao cho Toà án nhân dân thành phố Hà Nội hoặc Toà án nhân dân thành phố Hồ Chí Minh xét xử.\nBị cáo phạm tội ở nước ngoài, nếu thuộc thẩm quyền xét xử của Toà án quân sự thì do Toà án quân sự cấp quân khu trở lên xét xử, theo quyết định của Chánh án Toà án quân sự\ncấp cao.\nĐiều 147.\nThẩm quyền xét xử những tội phạm xảy ra trên máy bay hoặc tàu biển của nước Cộng hoà xã hội chủ nghĩa Việt Nam đang hoạt động ngoài không phận hoặc lãnh hải Việt Nam.\nNhững tội phạm xảy ra trên máy bay hoặc tàu biển của nước Cộng hoà xã hội chủ nghĩa Việt Nam đang hoạt động ở\nnước ngoài thuộc thẩm quyền của Toà án Việt Nam, nơi có sân bay hoặc bến cảng trở về đầu tiên, hoặc nơi máy bay, tàu biển đó được đăng ký.\nĐiều 148.\nViệc xét xử bị cáo phạm nhiều tội thuộc thẩm quyền của các Toà án khác cấp.\nKhi bị cáo phạm nhiều tội, trong\nđó có tội phạm thuộc thẩm quyền xét xử của Toà án cấp trên thì Toà án cấp trên xét xử toàn bộ vụ án.\nĐiều 149.\nChuyển vụ án.\nKhi thấy vụ án không thuộc thẩm quyền của mình thì Toà án chuyển vụ án cho Toà án có thẩm quyền xét xử. Việc chuyển vụ án cho Toà án ngoài phạm vi tỉnh, thành phố trực thuộc trung ương,\nđơn vị hành chính tương đương và ngoài phạm vi quân khu do Toà án nhân dân cấp tỉnh và Toà án quân sự cấp quân khu quyết định.\nChỉ được chuyển vụ án cho Toà án khác khi vụ án chưa được xét xử. Trong trường hợp này, việc chuyển vụ án do Chánh án Toà án quyết định. Nếu vụ án thuộc thẩm quyền của Toà án quân sự hoặc Toà án cấp trên thì vụ án đã được đưa ra xét xử vẫn phải chuyển cho Toà án có\nthẩm quyền. Trong trường hợp này, việc chuyển vụ án do Hội đồng xét xử quyết định.\nViệc chuyển vụ án phải được thông báo cho Viện kiểm sát cùng cấp.\nĐiều 150.\nGiải quyết việc tranh chấp về thẩm quyền xét xử.\n1- Việc tranh chấp về thẩm quyền xét xử do Chánh án Toà án cấp trên trực tiếp quyết định.\n2- Việc tranh chấp về thẩm quyền xét xử giữa Toà án nhân dân và Toà án quân sự do Chánh án Toà án nhân dân tối cao quyết định.\nChương 16:\nCHUẨN BỊ XÉT XỬ\nĐiều 151.\nThời hạn chuẩn bị xét xử.\n1- Sau khi nhận hồ sơ vụ án, thẩm phán được phân công chủ toạ phiên toà có nhiệm vụ nghiên cứu hồ sơ, giải quyết các khiếu nại và yêu cầu của những người tham gia tố tụng và tiến hành những việc khác cần thiết cho việc mở phiên toà.\n2- Trong thời hạn bốn mươi lăm ngày đối với tội ít nghiêm trọng, ba tháng đối với tội nghiêm trọng kể từ ngày nhận hồ sơ vụ án, thẩm phán phải ra một trong những quyết định sau đây:\na) Đưa vụ án ra xét xử;\nb) Trả hồ\nsơ để điều tra bổ sung;\nc) Tạm đình chỉ vụ án;\nd) Đình chỉ vụ án.\nĐối với những vụ án phức tạp, Chánh án Toà án cấp trên trực tiếp có thể quyết định kéo dài thời hạn chuẩn bị xét xử thêm một tháng.\nSau khi đã có quyết định đưa vụ\nán ra xét xử, phải mở phiên toà trong thời hạn mười lăm ngày; trong trường hợp có lý do chính đáng thì có thể mở phiên toà trong thời hạn ba mươi ngày.\nĐối với vụ\nán được trả lại để điều tra bổ sung thì trong thời hạn mười lăm ngày sau khi nhận lại hồ sơ, thẩm phán phải ra quyết định đưa vụ án ra xét xử.\nĐiều 152.\nÁp dụng, thay đổi hoặc huỷ bỏ biện pháp ngăn chặn.\nNgay sau khi nhận hồ sơ, thẩm phán phải quyết định việc áp dụng, thay đổi hoặc huỷ bỏ biện pháp ngăn chặn. Việc\náp dụng, thay đổi hoặc huỷ bỏ biện pháp tạm giam do Chánh án hoặc Phó chánh án Toà\nán cùng cấp quyết định.\nThời hạn tạm giam kể từ ngày Toà\nán nhận được hồ sơ và cáo trạng đến ngày mở phiên toà xét xử không được quá bốn mươi lăm ngày đối với vụ án do Toà án cấp huyện và Toà án quân sự khu vực thụ\nlý; ba tháng đối với vụ án do Toà án nhân dân cấp tỉnh trở lên và Toà án quân sự\ncấp quân khu trở lên thụ lý. Trong trường hợp đặc biệt, Chánh án Toà án cấp trên trực tiếp có quyền gia hạn thêm một lần, nhưng không được quá một tháng.\nĐối với vụ án do Toà hình sự Toà\nán nhân dân tối cao hoặc Toà án quân sự cấp cao xét xử sơ thẩm đồng thời chung thẩm thì Chánh án Toà án nhân dân tối cao có thể gia hạn thêm, nhưng không được quá một tháng.\nĐiều 153.\nNội dung của quyết định đưa vụ án ra xét xử.\nQuyết định đưa vụ án ra xét xử\nphải ghi rõ:\n1- Họ tên, ngày, tháng, năm sinh, nơi sinh, nghề nghiệp, nơi cư trú của bị cáo;\n2- Tội danh và điều khoản Bộ luật hình sự mà Viện kiểm sát viện dẫn đối với hành vi của bị cáo;\n3- Ngày, giờ, tháng, năm, địa điểm mở phiên toà;\n4- Xử công khai hay xử kín;\n5- Họ tên thẩm phán, hội thẩm nhân dân, thư ký phiên toà;\n6- Họ tên kiểm sát viên thực hành quyền công tố tại phiên toà;\n7- Họ tên người bào chữa, nếu có;\n8- Họ tên người phiên dịch, nếu có;\n9- Họ tên những người được triệu tập để xét hỏi tại phiên toà;\n10- Vật chứng cần đưa ra xem xét tại phiên toà.\nĐiều 154.\nQuyết định trả hồ sơ để điều tra bổ sung.\n1- Thẩm phán ra quyết định trả hồ\nsơ cho Viện kiểm sát để điều tra bổ sung trong những trường hợp sau đây:\na) Khi cần xem xét thêm những chứng cứ quan trọng đối với vụ án mà không thể bổ sung tại phiên toà được;\nb) Khi có căn cứ để cho rằng bị\ncáo phạm một tội khác hoặc có đồng phạm khác;\nc) Khi phát hiện có vi phạm nghiêm trọng thủ tục tố tụng.\nNhững vấn đề cần điều tra bổ\nsung phải được nói rõ trong quyết định yêu cầu điều tra bổ sung.\n2- Nếu kết quả điều tra bổ sung dẫn tới đình chỉ vụ án thì Viện kiểm sát ra quyết định đình chỉ vụ án và báo cho Toà án biết.\nTrong trường hợp Viện kiểm sát không bổ sung được những vấn đề mà Toà án yêu cầu bổ sung và vẫn giữ nguyên quyết\nđịnh truy tố thì Toà án vẫn tiến hành xét xử.\nĐiều 155.\nQuyết định tạm đình chỉ hoặc đình chỉ vụ án.\nThẩm phán ra quyết định tạm đình chỉ vụ án khi có căn cứ quy định tại Điều 135; ra quyết định đình chỉ vụ án khi có một trong những căn cứ quy định tại các điểm 3, 4, 5, 6, 7 Điều 89 Bộ luật này.\nQuyết định đình chỉ vụ án phải ghi rõ nội dung theo quy định tại khoản 2 Điều 139 Bộ luật này.\nĐiều 156.\nViện kiểm sát rút quyết định truy tố.\nNếu xét thấy có những căn cứ quy\nđịnh tại Điều 89 Bộ luật này hoặc khi có căn cứ để miễn trách nhiệm hình sự cho bị cáo, Viện kiểm sát rút quyết định truy tố trước khi mở phiên toà và đề nghị\nToà án đình chỉ vụ án.\nĐiều 157.\nViệc giao các quyết định của Toà án.\n1- Quyết định đưa vụ án ra xét xử\nđược giao cho bị cáo, người đại diện hợp pháp của họ và người bào chữa, chậm nhất là mười ngày trước khi mở phiên toà.\nTrong trường hợp xét xử vắng mặt bị cáo thì quyết định đưa vụ án ra xét xử và bản cáo trạng được giao cho người bào chữa hoặc người đại diện hợp pháp của bị cáo; quyết định đưa vụ án ra xét xử\ncòn phải được niêm yết tại trụ sở chính quyền xã, phường, thị trấn nơi cư trú\nhoặc nơi làm việc cuối cùng của bị cáo.\n2- Các quyết định của Toà án về\ntạm đình chỉ hoặc đình chỉ vụ án phải được giao cho bị cáo, người bào chữa, người bị hại, người đại diện hợp pháp của bị cáo; những người khác tham gia tố tụng thì được gửi giấy báo.\nĐiều 158.\nTriệu tập những người cần xét hỏi đến phiên toà.\nCăn cứ vào quyết định đưa vụ án ra xét xử, thẩm phán triệu tập những người cần xét hỏi đến phiên toà.\nChương 17:\nQUY ĐỊNH CHUNG VỀ THỦ TỤC TỐ TỤNG TẠI PHIÊN TOÀ \nĐiều 159.\nXét xử trực tiếp, bằng lời nói và liên tục.\n1- Toà án phải trực tiếp xác định những tình tiết của vụ án bằng cách hỏi và nghe ý kiến của bị cáo, người bị hại,\nnguyên đơn dân sự, bị đơn dân sự, người có quyền và lợi ích hợp pháp liên quan đến vụ án, người làm chứng, người giám định, xem xét vật chứng và nghe lời bào chữa. Bản án chỉ được căn cứ vào những chứng cứ đã được xem xét tại phiên toà.\n2- Việc xét xử phải tiến hành liên tục, trừ thời gian nghỉ.\nĐiều 160.\nThành phần Hội đồng xét xử sơ thẩm.\nHội đồng xét xử sơ thẩm gồm một thẩm phán và hai hội thẩm nhân dân. Trong trường hợp vụ án có tính chất nghiêm trọng, phức tạp, thì Hội đồng xét xử có thể gồm hai thẩm phán và ba hội thẩm nhân dân.\nĐối với vụ án mà bị cáo bị đưa ra xét xử về tội theo khung hình phạt có mức cao nhất là tử hình thì Hội đồng xét xử gồm hai thẩm phán và ba hội thẩm nhân dân.\nThẩm phán chủ toạ phiên toà điều khiển và giữ kỷ luật phiên toà.Bổ sung\nĐiều 161.\nThay thế thành viên của Hội đồng xét xử trong trường hợp đặc biệt 1- Các thành viên của Hội đồng xét xử phải xét xử vụ án từ khi bắt đầu cho đến khi kết thúc.\n2- Trong quá trình xét xử, nếu có thẩm phán hoặc hội thẩm nhân dân không tiếp tục tham gia xét xử được thì Toà\nán vẫn có thể xét xử vụ án nếu có thẩm phán hoặc hội thẩm nhân dân dự khuyết.\nThẩm phán hoặc hội thẩm nhân dân dự khuyết phải có mặt tại phiên toà từ đầu thì\nmới được tham gia xét xử.\n3- Trong trường hợp không có thẩm phán, hội thẩm nhân dân dự khuyết để thay thế hoặc phải thay đổi chủ toạ phiên toà thì vụ án phải được xét xử lại từ đầu.\nĐiều 162.\nSự có mặt của bị cáo tại phiên toà.\n1- Bị cáo phải có mặt tại phiên toà theo giấy triệu tập của Toà án; nếu vắng mặt không có\nlý do chính đáng thì bị áp giải; nếu bị cáo vắng mặt có lý do chính đáng thì phải hoãn phiên toà.\nNếu bị cáo bị bệnh tâm thần hoặc bị bệnh hiểm nghèo khác thì Hội đồng xét xử tạm đình chỉ vụ án cho đến khi bị\ncáo khỏi bệnh.\nNếu bị cáo trốn tránh thì Hội đồng xét xử tạm đình chỉ vụ án và yêu cầu cơ quan điều tra truy nã bị cáo.\n2- Toà án chỉ có thể xử vắng mặt bị cáo trong những trường hợp sau đây:\na) Bị cáo trốn tránh và việc truy nã không có kết quả;\nb) Bị cáo đang ở nước ngoài và\nkhông thể triệu tập đến phiên toà;\nc) Nếu sự vắng mặt của bị cáo không trở ngại cho việc xét xử và họ đã được giao giấy triệu tập hợp lệ.\nĐiều 163.\nGiám sát bị cáo tại phiên toà.\n1- Bị cáo đang bị tạm giam khi ra phiên toà chỉ được tiếp xúc với người bào chữa. Việc tiếp xúc với những người khác phải được phép của chủ toạ phiên toà.\n2- Bị cáo không bị tạm giam phải có mặt tại phiên toà trong suốt thời gian xử án.\nĐiều 164.\nSự có mặt của kiểm sát viên.\n1- Kiểm sát viên Viện kiểm sát cùng cấp phải tham gia phiên toà. Đối với vụ án có tính chất nghiêm trọng, phức tạp thì hai kiểm sát viên có thể cùng tham gia phiên toà.\n2- Nếu kiểm sát viên vắng mặt hoặc bị thay đổi thì Hội đồng xét xử hoãn phiên toà và báo ngay cho Viện kiểm sát cùng cấp.\nĐiều 165.\nSự có mặt của người bào chữa.\nNgười bào chữa có nghĩa vụ tham gia phiên toà. Nếu người bào chữa vắng mặt, nhưng có gửi trước bản bào chữa thì\nToà án vẫn mở phiên toà xét xử.\nTrong trường hợp người bào chữa quy định tại khoản 2 Điều 37 Bộ luật này vắng mặt, thì Hội đồng xét xử phải hoãn phiên toà.\nĐiều 166. Sự\ncó mặt của người bị hại, nguyên đơn dân sự, bị đơn dân sự, người có quyền và lợi ích hợp pháp liên quan đến vụ án hoặc những người đại diện hợp pháp của họ.\n1- Nếu người bị hại, nguyên đơn dân sự, bị đơn dân sự, người có quyền và lợi ích hợp pháp liên quan đến vụ án hoặc những người đại diện hợp pháp của họ vắng mặt thì tuỳ\ntrường hợp, Hội đồng xét xử quyết định hoãn phiên toà hoặc vẫn tiến hành xét xử.\n2- Nếu thấy sự vắng mặt của người bị hại, nguyên đơn dân sự hoặc bị đơn dân sự chỉ trở ngại cho việc giải quyết vấn\nđề bồi thường thì Hội đồng xét xử có thể tách việc bồi thường để xét xử sau theo thủ tục tố tụng dân sự.\nĐiều 167.\nSự có mặt của người làm chứng.\nNgười làm chứng tham gia phiên toà để làm sáng tỏ các tình tiết của vụ án. Nếu người làm chứng vắng mặt nhưng trước đó đã có lời khai ở cơ quan điều tra thì chủ toạ phiên toà công bố những lời khai đó. Nếu người làm chứng về những vấn đề quan trọng vắng mặt thì tuỳ\ntrường hợp, Hội đồng xét xử quyết định hoãn phiên toà hoặc vẫn tiến hành xét xử.\nĐiều 168.\nSự có mặt của người giám định.\n1- Người giám định tham gia phiên toà khi được Toà án triệu tập.\n2- Nếu người giám định vắng mặt thì tuỳ trường hợp, Hội đồng xét xử quyết định hoãn phiên toà hoặc vẫn tiến hành xét xử.Bổ sung\nĐiều 169.\nViện kiểm sát rút quyết định truy tố hoặc định tội danh nhẹ hơn tại phiên toà.\nTại phiên toà, sau khi xét hỏi,\nkiểm sát viên có thể rút một phần hay toàn bộ quyết định truy tố hoặc kết luận về một tội danh nhẹ hơn, nhưng Hội đồng xét xử vẫn phải xét xử toàn bộ vụ án.\nĐiều 170.\nGiới hạn của việc xét xử.\nToà án chỉ xét xử những bị cáo và những hành vi theo tội danh mà Viện kiểm sát truy tố và Toà án đã quyết định\nđưa ra xét xử.\nĐiều 171.\nNội quy phiên toà.\n1- Trước khi bắt đầu phiên toà,\nthư ký phải phổ biến nội quy phiên toà.\n2- Mọi người ở trong phòng xử án\nđều phải có thái độ tôn trọng Hội đồng xét xử, giữ gìn trật tự và tuân theo sự\nđiều khiển của chủ toạ phiên toà.\n3- Mọi người ở trong phòng xử án\nđều phải đứng dậy khi Hội đồng xét xử vào phòng xử án. Chỉ những người được Toà\nán triệu tập để xét hỏi mới được phát biểu và người nào muốn phát biểu phải được chủ toạ phiên toà cho phép. Người phát biểu phải đứng khi được hỏi, trừ trường hợp vì lý do sức khoẻ được chủ toạ phiên toà cho phép ngồi để phát biểu.\n4- Những người dưới 16 tuổi không được vào phòng xử án, trừ trường hợp được Toà án triệu tập để xét hỏi.\nĐiều 172.\nNhững biện pháp đối với người vi phạm trật tự phiên toà.\nNhững người vi phạm trật tự\nphiên toà thì tuỳ trường hợp, có thể bị chủ toạ phiên toà cảnh cáo, phạt tiền,\nbuộc rời khỏi phòng xử án hoặc bị bắt giữ.\nCảnh sát nhân dân có nhiệm vụ bảo vệ phiên toà và thi hành lệnh của chủ toạ phiên toà về việc buộc rời khỏi phòng xử án hoặc bắt giữ người gây rối trật tự tại phiên toà.\nĐiều 173.\nViệc ra bản án và các quyết định của Toà án.\n1- Bản án của Toà án quyết định việc bị cáo có phạm tội hay không phạm tội, hình phạt và các biện pháp tư pháp khác. Bản án phải được thảo luận và thông qua tại phòng nghị án.\n2- Quyết định về việc thay đổi thành viên của Hội đồng xét xử, kiểm sát viên, người giám định,\nngười phiên dịch, thư ký phiên toà; chuyển vụ án, yêu cầu điều tra bổ sung, tạm\nđình chỉ hoặc đình chỉ vụ án và về việc bắt giam hoặc trả tự do cho bị cáo phải\nđược thảo luận và thông qua tại phòng nghị án và phải được viết thành văn bản.\n3- Quyết định về vấn đề khác được Hội đồng xét xử thảo luận và thông qua tại phòng xử án, không phải viết thành văn bản, nhưng phải được ghi vào biên bản phiên toà.\nĐiều 174.\nBiên bản phiên toà.\n1- Biên bản phiên toà phải ghi rõ ngày, giờ, tháng, năm, địa điểm của phiên toà và mọi diễn biến ở phiên toà từ\nkhi bắt đầu cho đến khi tuyên án.\n2- Những câu hỏi và những câu trả\nlời đều phải được ghi vào biên bản.\n3- Sau khi kết thúc phiên toà,\nchủ toạ phiên toà phải kiểm tra biên bản và cùng với thư ký phiên toà ký vào biên bản đó.\n4- Bị cáo, người bào chữa, người bị hại, nguyên đơn dân sự, bị đơn dân sự, người có quyền và lợi\ních hợp pháp liên quan đến vụ án hoặc đại diện hợp pháp của những người đó\nđược xem biên bản phiên toà, có quyền yêu cầu ghi những sửa đổi, bổ sung vào biên bản phiên toà và ký xác nhận.\nChương 18:\nTHỦ TỤC BẮT ĐẦU PHIÊN TOÀ \nĐiều 175.\nThủ tục bắt đầu phiên toà.\nKhi bắt đầu phiên toà, chủ toạ\nphiên toà đọc quyết định đưa vụ án ra xét xử.\nSau khi nghe thư ký báo cáo danh sách những người được triệu tập đã có mặt, chủ toạ phiên toà kiểm tra căn cước của những người đó và giải thích cho họ biết quyền và nghĩa vụ của họ tại phiên toà.\nTrong trường hợp bị cáo chưa được giao nhận bản cáo trạng theo quy định tại khoản 2 Điều 34 và quyết định đưa vụ\nán ra xét xử trong thời hạn quy định tại khoản 1 Điều 157 Bộ luật này và nếu bị\ncáo yêu cầu thì Hội đồng xét xử phải hoãn phiên toà.\nĐiều 176.\nGiải quyết việc đề nghị thay đổi thẩm phán, hội thẩm nhân dân, kiểm sát viên,\nngười giám định, người phiên dịch, thư ký phiên toà.\nKiểm sát viên và những người tham gia tố tụng phải được hỏi xem họ có đề nghị thay đổi thẩm phán, hội thẩm nhân dân, kiểm sát viên, người giám định, người phiên dịch, thư ký phiên toà\nhay không. Nếu có người yêu cầu thì Hội đồng xét xử xem xét và quyết định.\nĐiều 177.\nGiải thích quyền và nghĩa vụ của người phiên dịch và người giám định.\nNếu có người phiên dịch và người giám định tham gia phiên toà thì chủ toạ phiên toà giới thiệu họ tên, nghề nghiệp hoặc chức vụ của những người đó và giải thích rõ những quyền và nghĩa vụ của họ.\nNhững người này phải cam đoan làm tròn nhiệm vụ.\nĐiều 178.\nGiải thích nghĩa vụ và cách ly người làm chứng.\n1- Sau khi đã hỏi họ tên, tuổi,\nnghề nghiệp, nơi thường trú của từng người làm chứng, chủ toạ phiên toà giải thích rõ nghĩa vụ tố tụng của họ. Người làm chứng phải cam đoan không khai gian dối. Riêng người làm chứng chưa thành niên không phải cam đoan.\n2- Trước khi người làm chứng được hỏi về vụ án, chủ toạ phiên toà có thể quyết định những biện pháp để cho những người làm chứng không nghe được lời khai của nhau hoặc tiếp xúc với những người có liên quan. Trong trường hợp lời khai của bị cáo và người làm chứng có ảnh hưởng lẵn nhau thì chủ toạ phiên toà có thể quyết định cách ly bị cáo với người làm chứng trước khi hỏi người làm chứng.\nĐiều 179.\nGiải quyết những yêu cầu về xem xét chứng cứ và hoãn phiên toà khi có người vắng mặt.\nChủ toạ phiên toà phải hỏi kiểm sát viên và những người tham gia tố tụng xem có ai đề nghị triệu tập thêm người làm chứng hoặc đề nghị đưa thêm vật chứng và tài liệu ra xem xét hay không. Nếu có người tham gia tố tụng vắng mặt thì chủ toạ phiên toà cũng phải hỏi xem có\nai đề nghị hoãn phiên toà hay không. Nếu có người yêu cầu thì Hội đồng xét xử\nxem xét và quyết định.\nChương 19:\nTHỦ TỤC XÉT HỎI TẠI PHIÊN TOÀ\nĐiều 180.\nĐọc bản cáo trạng.\nTrước khi tiến hành xét hỏi, kiểm sát viên đọc bản cáo trạng và trình bày những ý kiến bổ sung, nếu có.\nĐiều 181.\nTrình tự xét hỏi.\n1- Hội đồng xét xử phải xác định\nđầy đủ các tình tiết về từng sự việc và về từng tội của vụ án theo thứ tự xét hỏi hợp lý.\n2- Khi xét hỏi từng người, chủ\ntoạ phiên toà hỏi trước rồi đến các hội thẩm nhân dân, sau đó đến kiểm sát viên, người bào chữa. Những người tham gia phiên toà cũng có quyền đề nghị với chủ toạ phiên toà hỏi thêm về những tình tiết cần làm sáng tỏ. Người giám định\nđược hỏi về những vấn đề có liên quan đến việc giám định.\n3- Trong khi xét hỏi, Hội đồng xét xử xem xét những vật chứng có liên quan trong vụ án.\nĐiều 182.\nCông bố những lời khai tại cơ quan điều tra.\n1- Nếu người được xét hỏi có mặt tại phiên toà thì Hội đồng xét xử và kiểm sát viên không được nhắc hoặc công bố\nlời khai của họ tại cơ quan điều tra, trước khi họ khai tại phiên toà về những tình tiết của vụ án.\n2- Chỉ được công bố những lời khai tại cơ quan điều tra trong những trường hợp sau đây:\na) Lời khai của người được xét hỏi tại phiên toà có mâu thuẵn với lời khai của họ tại cơ quan điều tra;\nb) Người được xét hỏi không khai tại phiên toà;\nc) Người được xét hỏi vắng mặt hoặc đã chết.\nĐiều 183.\nHỏi bị cáo.\n1- Hội đồng xét xử phải hỏi riêng từng bị cáo. Nếu lời khai của bị cáo này có thể ảnh hưởng đến lời khai của bị cáo khác thì chủ toạ phiên toà phải cách ly họ. Trong trường hợp này, bị cáo bị cách ly được thông báo lại nội dung lời khai của bị cáo trước có quyền đặt câu hỏi đối với bị cáo đó.\n2- Bị cáo trình bày ý kiến về bản cáo trạng và những tình tiết của vụ án. Hội đồng xét xử hỏi thêm về những điểm mà bị cáo trình bày chưa đầy đủ hoặc có mâu thuẵn.\n3- Nếu bị cáo không trả lời các câu hỏi thì Hội đồng xét xử vẫn tiếp tục hỏi những người khác và xem xét vật chứng.\nĐiều 184.\nHỏi người bị hại, nguyên đơn dân sự, bị đơn dân sự, người có quyền và lợi ích hợp pháp liên quan đến vụ án hoặc người đại diện hợp pháp của những người đó.\nNgười bị hại, nguyên đơn dân sự,\nbị đơn dân sự và người có quyền và lợi ích hợp pháp có\nliên quan đến vụ án hoặc người đại diện hợp pháp của những người đó trình bày về\nnhững tình tiết của vụ án có liên quan đến họ. Sau đó, Hội đồng xét xử hỏi thêm về những điểm mà họ trình bày chưa đầy đủ hoặc có mâu thuẵn.\nĐiều 185.\nHỏi người làm chứng.\n1- Hội đồng xét xử phải hỏi riêng từng người làm chứng và không để cho những người làm chứng khác biết được nội dung xét hỏi đó.\n2- Khi hỏi người làm chứng, Hội\nđồng xét xử phải hỏi rõ về quan hệ giữa họ với bị cáo và các đương sự trong vụ\nán. Chủ toạ phiên toà yêu cầu họ trình bày rõ những tình tiết vụ án mà họ đã biết,\nsau đó hỏi thêm về những điểm mà họ khai chưa đầy đủ hoặc có mâu thuẵn.\n3- Nếu người làm chứng là người chưa thành niên thì chủ toạ phiên toà có thể yêu cầu cha, mẹ, người đỡ đầu hoặc thầy giáo, cô giáo giúp đỡ để hỏi.\n4- Sau khi đã trình bày xong,\nngười làm chứng ở lại phòng xử án để có thể được hỏi thêm.\nĐiều 186.\nXem xét vật chứng.\n1- Vật chứng, ảnh hoặc biên bản xác nhận vật chứng được đưa ra để xem xét tại phiên toà.\nKhi cần thiết, Hội đồng xét xử\ncó thể cùng với kiểm sát viên và những người tham gia phiên toà đến xem xét tại chỗ những vật chứng không thể đưa đến phiên toà được.\n2- Kiểm sát viên, người bào chữa và những người tham gia phiên toà có quyền trình bày những nhận xét của mình về\nvật chứng. Hội đồng xét xử có thể hỏi thêm họ về những vấn đề có liên quan đến vật chứng.\nĐiều 187.\nXem xét tại chỗ.\nNếu xét thấy cần thiết, Hội đồng xét xử có thể cùng với kiểm sát viên và những người tham gia phiên toà đến xem xét nơi đã xảy ra tội phạm hoặc những địa điểm khác có liên quan đến vụ án. Việc xem xét tại chỗ phải được lập biên bản theo thủ tục chung.\nĐiều 188.\nViệc trình bày, công bố các tài liệu của vụ án và nhận xét hoặc báo cáo của các cơ quan, tổ chức.\nNhận xét, báo cáo của cơ quan hoặc tổ chức về những tình tiết của vụ án do đại diện của cơ quan hoặc tổ chức đó\ntrình bày; trong trường hợp không có đại diện của cơ quan hoặc tổ chức đó tham dự thì Hội đồng xét xử công bố nhận xét hoặc báo cáo tại phiên toà.\nCác tài liệu đã có trong hồ sơ\nhoặc mới đưa ra khi xét hỏi đều phải được công bố tại phiên toà.\nKiểm sát viên, bị cáo, người bào chữa và những người tham gia phiên toà có quyền nhận xét về những tài liệu đó\nvà hỏi thêm những vấn đề có liên quan.\nĐiều 189.\nHỏi người giám định.\n1- Người giám định trình bày kết luận của mình về vấn đề được giao giám định.\n2- Tại phiên toà, người giám định có quyền giải thích, bổ sung trên cơ sở kết luận giám định.\n3- Nếu người giám định vắng mặt thì chủ toạ phiên toà công bố kết luận giám định.\n4- Kiểm sát viên, người bào chữa và những người tham gia phiên toà có quyền nhận xét về\nkết luận giám định, được hỏi những vấn đề còn chưa rõ hoặc có mâu thuẵn trong kết luận giám định.\n5- Khi xét thấy cần thiết, Hội đồng xét xử quyết định giám định bổ sung hoặc giám định lại.\nĐiều 190.\nKết thúc xét hỏi.\nKhi nhận thấy các tình tiết của vụ\nán đã được xem xét đầy đủ thì chủ toạ phiên toà hỏi kiểm sát viên, bị cáo, người bào chữa và những người khác tham gia phiên toà xem họ có yêu cầu xét hỏi vấn đề\ngì nữa không. Nếu có người yêu cầu và xét thấy yêu cầu đó là cần thiết thì chủ\ntoạ phiên toà quyết định tiếp tục việc xét hỏi.\nChương 20:\nTRANH LUẬN TẠI PHIÊN TOÀ\nĐiều 191.\nTrình tự phát biểu khi tranh luận.\n1- Sau khi kết thúc việc xét hỏi tại phiên toà, kiểm sát viên trình bày lời luận tội, đề nghị kết tội bị cáo theo toàn bộ hay một phần nội dung cáo trạng hoặc kết luận về tội danh nhẹ hơn;\nnếu thấy không có căn cứ để kết tội thì rút toàn bộ quyết định truy tố và đề\nnghị Hội đồng xét xử tuyên bố bị cáo không có tội.\n2- Bị cáo trình bày lời bào chữa,\nnếu bị cáo có người bào chữa thì người này bào chữa cho bị cáo. Bị cáo có quyền bổ sung ý kiến bào chữa.\n3- Người bị hại, nguyên đơn dân sự, bị đơn dân sự và người có quyền và lợi ích hợp pháp liên quan đến vụ án hoặc người đại diện hợp pháp của họ được trình bày ý kiến để\nbảo vệ quyền và lợi ích của mình.\nĐiều 192.\nĐối đáp.\nNgười tham gia tranh luận có quyền\nđáp lại ý kiến của người khác nhưng chỉ được phát biểu một lần đối với mỗi ý kiến mà mình không đồng ý. Chủ toạ phiên toà không được hạn chế thời gian tranh luận,\nnhưng có quyền cắt những ý kiến không có liên quan đến vụ án.\nĐiều 193.\nTrở lại việc xét hỏi.\nNếu qua tranh luận mà xét thấy cần xem xét thêm chứng cứ thì Hội đồng xét xử có thể quyết định trở lại xét hỏi.\nXét hỏi xong phải tiếp tục tranh luận.\nĐiều 194.\nBị cáo nói lời sau cùng.\nSau khi những người tham gia tranh luận không trình bày gì thêm, chủ toạ phiên toà tuyên bố kết thúc tranh luận.\nBị cáo được nói lời sau cùng.\nKhông được đặt câu hỏi khi bị cáo nói lời sau cùng. Hội đồng xét xử có quyền yêu cầu bị cáo không được trình bày những điểm không liên quan đến vụ án, nhưng không được hạn chế thời gian đối với bị cáo. Nếu trong lời nói sau cùng, bị cáo trình bày thêm tình tiết mới có ý nghĩa quan trọng đối với vụ án thì Hội đồng xét xử phải quyết định trở lại việc xét hỏi.\nĐiều 195.\nXem xét việc rút truy tố.\n1- Khi kiểm sát viên rút một phần quyết định truy tố hoặc kết luận về một tội danh nhẹ hơn thì Hội đồng xét xử vẫn tiếp tục xét xử vụ án.\n2- Trong trường hợp kiểm sát viên rút toàn bộ quyết định truy tố thì trước khi nghị án,\nHội đồng xét xử yêu cầu những người tham gia tố tụng tại phiên toà trình bày ý\nkiến về việc rút truy tố đó.\nChương 21:\nNGHỊ ÁN VÀ TUYÊN ÁN\nĐiều 196.\nNghị án.\n1- Chỉ có thẩm phán và hội thẩm nhân dân mới có quyền nghị án. Các thành viên của Hội đồng xét xử phải giải quyết tất cả các vấn đề của vụ án bằng cách biểu quyết theo đa số về từng vấn đề một.\nThẩm phán biểu quyết sau cùng. Người có ý kiến thiểu số có quyền trình bày ý kiến của mình bằng văn bản và được để vào hồ sơ.\n2- Trong trường hợp kiểm sát viên rút toàn bộ quyết định truy tố thì Hội đồng xét xử vẫn giải quyết những vấn đề của vụ án theo trình tự quy định tại khoản 1 Điều này.\nNếu có căn cứ xác định bị cáo không có tội thì Hội đồng xét xử tuyên bố vô tội;\nnếu thấy việc rút truy tố không có căn cứ thì quyết định tạm đình chỉ vụ án và\nkiến nghị với Viện kiểm sát cấp trên.\n3- Khi nghị\nán, chỉ được căn cứ vào các chứng cứ và tài liệu đã được thẩm tra tại phiên toà.\n4- Khi nghị án phải có biên bản ghi lại các ý kiến đã thảo luận và quyết định của Hội đồng xét xử.\nĐiều 197.\nTrở lại việc xét hỏi và tranh luận.\nQua việc nghị án nếu thấy có\ntình tiết của vụ án chưa được xét hỏi hoặc xét hỏi chưa đầy đủ thì Hội đồng xét xử quyết định trở lại xét hỏi và tranh luận.\nĐiều 198.\nNội dung bản án.\n1- Toà án ra bản án nhân danh nước Cộng hoà xã hội chủ nghĩa Việt Nam.\n2- Trong bản án cần phải ghi rõ:\nngày, giờ, tháng, năm và địa điểm phiên toà, họ tên của các thành viên Hội đồng xét xử và thư ký phiên toà; họ tên của kiểm sát viên; họ tên, ngày, tháng, năm sinh,\nnơi sinh, nơi cư trú, nghề nghiệp, trình độ văn hoá, thành phần xã hội và tiền\nán của bị cáo; ngày bị cáo bị tạm giữ, tạm giam; họ tên, tuổi, nghề nghiệp, nơi sinh, nơi cư trú của người đại diện hợp pháp của bị cáo; họ tên của người bào chữa; họ tên, tuổi, nghề nghiệp, nơi cư trú của người bị hại, nguyên đơn dân sự,\nbị đơn dân sự, người có quyền và lợi ích hợp pháp liên quan đến vụ án và những người đại diện hợp pháp của họ.\n3- Trong bản án phải trình bày việc phạm tội của bị cáo, phân tích những chứng cứ xác định có tội và chứng cứ\nxác định vô tội, xác định bị cáo có phạm tội hay không và nếu bị cáo phạm tội thì phạm tội gì, theo điều khoản nào của của Bộ luật hình sự, tình tiết tăng nặng,\ntình tiết giảm nhẹ và cần phải xử lý như thế nào. Nếu bị cáo không phạm tội thì\nbản án phải ghi rõ những căn cứ xác định bị cáo vô tội và phải giải quyết việc khôi phục danh dự, quyền và lợi ích hợp pháp của họ. Phần cuối cùng của bản án ghi những quyết định của Toà án và quyền kháng cáo đối với bản án.\nĐiều 199.\nQuyết định yêu cầu sửa chữa những khuyết điểm trong công tác quản lý.\n1- Cùng với việc ra bản án, Toà\nán ra quyết định yêu cầu cơ quan hoặc tổ chức hữu quan áp dụng những biện pháp cần thiết để khắc phục những nguyên nhân và điều kiện phát sinh tội phạm tại các cơ quan, tổ chức đó. Trong thời hạn ba mươi ngày kể từ ngày nhận được quyết định của Toà án, cơ quan, tổ chức đó phải báo cho Toà án biết những biện pháp được\náp dụng.\n2- Quyết định của Toà án có thể\nđược đọc tại phiên toà cùng với bản án hoặc chỉ gửi riêng cho cơ quan hoặc tổ\nchức hữu quan.\nĐiều 200.\nTuyên án.\nKhi tuyên án mọi người trong phòng xử án phải đứng dậy. Chủ toạ phiên toà đọc bản án và sau khi đọc xong có\nthể giải thích thêm về việc chấp hành bản án và quyền kháng cáo.\nNếu bị cáo không biết tiếng Việt thì sau khi tuyên án, người phiên dịch phải đọc lại cho bị cáo nghe toàn bộ bản\nán sang thứ tiếng mà bị cáo biết.\nĐiều 201.\nTrả tự do cho bị cáo.\nTrong những trường hợp sau đây Hội\nđồng xét xử phải tuyên bố trả tự do ngay tại phiên toà cho bị cáo đang bị tạm giam, nếu họ không bị tạm giam về một tội phạm khác:\n1- Bị cáo không có tội;\n2- Bị cáo được miễn trách nhiệm hình sự hoặc được miễn hình phạt;\n3- Bị cáo bị xử phạt bằng các hình phạt không phải là hình phạt tù;\n4- Bị cáo bị xử phạt tù nhưng được hưởng án treo;\n5- Thời hạn phạt tù bằng hoặc ngắn hơn thời gian bị cáo đã bị tạm giam.\nĐiều 202.\nBắt giam bị cáo sau khi tuyên án.\nNếu bị cáo không bị tạm giam nhưng bị phạt tù thì họ chỉ bị bắt giam để chấp hành hình phạt khi bản án đã có\nhiệu lực pháp luật.\nToà án có thể quyết định bắt giam ngay bị cáo nếu có căn cứ cho thấy bị cáo có thể trốn hoặc tiếp tục gây\nán.\nĐiều 203.\nViệc giao bản án.\nChậm nhất là mười lăm ngày sau khi tuyên án, Toà án phải giao bản sao bản án cho bị cáo, Viện kiểm sát cùng cấp,\nngười bào chữa, gửi bản sao bản án cho những người bị xử vắng mặt và thông báo cho chính quyền xã, phường, thị trấn hoặc cơ quan, tổ chức nơi bị cáo cư trú hoặc làm việc.\nTrong trường hợp xử vắng mặt bị\ncáo theo quy định tại điểm a hoặc điểm b, khoản 2 Điều 162 Bộ luật này thì\ntrong thời hạn nói trên bản sao bản án phải được niêm yết tại trụ sở chính quyền xã, phường, thị trấn nơi cư trú hoặc nơi làm việc cuối cùng của bị cáo.\nNgười bị hại, nguyên đơn dân sự,\nbị đơn dân sự, người có quyền và lợi ích hợp pháp có\nliên quan đến vụ án hoặc đại diện hợp pháp của họ có quyền yêu cầu Toà án cấp trích lục bản án hoặc bản sao bản án.\nPhần thứ tư:\nXÉT LẠI BẢN ÁN VÀ QUYẾT ĐỊNH CHƯA CÓ HIỆU LỰC PHÁP LUẬT THEO THỦ TỤC PHÚC THẨM Chương 22:\nTÍNH CHẤT CỦA PHÚC THẨM VÀ QUYỀN KHÁNG CÁO, KHÁNG NGHỊ \nĐiều 204.\nTính chất của phúc thẩm.\nPhúc thẩm là việc Toà án cấp trên trực tiếp xét lại những bản án hoặc quyết định sơ thẩm chưa có hiệu lực pháp luật bị kháng cáo hoặc kháng nghị.\nĐiều 205.\nNhững người có quyền kháng cáo.\nBị cáo, người bị hại và người đại diện hợp pháp của người bị hại có quyền kháng cáo bản án hoặc quyết định sơ thẩm.\nNgười bào chữa có quyền kháng cáo để bảo vệ lợi ích của người chưa thành niên hoặc người có nhược điểm về thể\nchất hoặc tâm thần.\nNguyên đơn dân sự, bị đơn dân sự\nvà người đại diện hợp pháp của họ có quyền kháng cáo phần bản án hoặc quyết định có liên quan đến việc bồi thường thiệt hại.\nNgười có quyền và lợi ích hợp pháp liên quan đến vụ án và người đại diện hợp pháp của họ\ncó quyền kháng cáo phần bản án hoặc quyết định có liên quan đến quyền và lợi ích hợp pháp của họ.\nNgười được Toà án tuyên là vô tội có quyền kháng cáo phần lý do bản án sơ thẩm đã tuyên là họ vô tội.\nĐiều 206.\nKháng nghị của Viện kiểm sát.\nViện kiển sát cùng cấp và cấp trên trực tiếp có quyền kháng nghị những bản án hoặc quyết định sơ thẩm.\nĐiều 207.\nThủ tục kháng cáo và kháng nghị.\n1- Người kháng cáo phải gửi đơn\nđến Toà án đã xử sơ thẩm hoặc Toà án cấp phúc thẩm. Trong trường hợp bị cáo\nđang bị tạm giam, Ban giám thị trại giam phải bảo đảm cho bị cáo thực hiện quyền kháng cáo.\nNgười kháng cáo cũng có thể\ntrình bày trực tiếp với Toà án đã xử sơ thẩm về việc kháng cáo. Toà án phải lập biên bản về việc kháng cáo đó.\n2- Viện kiểm sát kháng nghị bằng văn bản, có nói rõ lý do. Kháng nghị được gửi đến Toà án đã\nxử sơ thẩm.\nĐiều 208.\nThời hạn kháng cáo, kháng nghị.\n1- Thời hạn kháng cáo, kháng nghị là mười lăm ngày kể từ ngày tuyên án. Trong trường hợp Toà án xử vắng mặt thì thời hạn đó tính từ ngày bản sao bản án được giao cho\nđương sự hoặc từ ngày niêm yết.\n2- Nếu đơn kháng cáo gửi qua bưu\nđiện thì ngày kháng cáo được tính căn cứ vào ngày bưu điện nơi gửi đóng dấu ở\nphong bì. Trong trường hợp đơn kháng cáo gửi qua Ban giám thị trại giam, thì\nngày kháng cáo được tính căn cứ vào ngày Ban giám thị trại giam nhận được đơn.\nĐiều 209.\nKháng cáo quá hạn.\n1- Việc kháng cáo quá hạn có thể\nđược chấp nhận, nếu có lý do chính đáng.\n2- Toà án cấp phúc thẩm xét lý\ndo kháng cáo quá hạn và ra quyết định chấp nhận hoặc không chấp nhận việc kháng cáo quá hạn.\nĐiều 210.\nThông báo về việc kháng cáo, kháng nghị.\n1- Việc kháng cáo, kháng nghị phải\nđược Toà án cấp sơ thẩm thông báo cho Viện kiểm sát và những người tham gia tố\ntụng biết.\n2- Người được thông báo về việc kháng cáo, kháng nghị có quyền gửi ý kiến của mình cho Toà án cấp phúc thẩm.\nĐiều 211.\nHậu quả của việc kháng cáo, kháng nghị.\n1- Những phần của bản án bị\nkháng cáo, kháng nghị thì chưa được đưa ra thi hành, trừ trường hợp quy định tại khoản 2 Điều 226 Bộ luật này. Khi có kháng cáo, kháng nghị đối với toàn bộ bản\nán thì toàn bộ bản án chưa được đưa ra thi hành.\n2- Toà án cấp sơ thẩm phải gửi hồ\nsơ vụ án và kháng cáo, kháng nghị cho Toà án cấp phúc thẩm trong thời hạn bảy ngày kể từ ngày hết hạn kháng cáo, kháng nghị.\nĐiều 212.\nBổ sung, thay đổi, rút kháng cáo, kháng nghị.\n1- Trước khi bắt đầu hoặc tại phiên toà phúc thẩm, người kháng cáo hoặc Viện kiểm sát có quyền bổ sung, thay\nđổi kháng cáo, kháng nghị nhưng không được làm xấu hơn tình trạng của bị cáo;\nrút một phần hoặc toàn bộ kháng cáo, kháng nghị.\n2- Trong trường hợp rút toàn bộ kháng cáo, kháng nghị tại phiên toà thì việc xét xử phúc thẩm phải được đình chỉ.\nĐiều 213.\nKháng cáo, kháng nghị những quyết định của Toà án cấp sơ thẩm.\n1- Viện kiểm sát kháng nghị các quyết định của Toà án cấp sơ thẩm cùng cấp trong thời hạn bảy ngày kể từ ngày Toà án ra quyết định.\n2- Quyết định tạm đình chỉ hoặc\nđình chỉ vụ án của Toà án cấp sơ thẩm có thể bị kháng cáo trong thời hạn bảy ngày kể từ ngày nhận được quyết định.\nChương 23:\nXÉT XỬ PHÚC THẨM \nĐiều 214.\nPhạm vi xét xử phúc thẩm.\nToà án cấp phúc thẩm xem xét nội dung kháng cáo, kháng nghị. Nếu xét thấy cần thiết thì Toà án cấp phúc thẩm có\nthể xem xét các phần khác không bị kháng cáo, kháng nghị của bản án.\nĐiều 215.\nThời hạn xét xử phúc thẩm.\nToà án nhân dân cấp tỉnh, Toà án quân sự cấp quân khu phải xét xử phúc thẩm trong thời hạn không quá ba mươi ngày; Toà phúc thẩm Toà án nhân dân tối cáo và Toà án quân sự\ncấp cao phải xét xử phúc thẩm trong thời hạn không quá sáu mươi ngày kể từ\nngày nhận được hồ sơ vụ án.Bổ sung\nĐiều 216.\nThành phần Hội đồng xét xử phúc thẩm.\nHội đồng xét xử phúc thẩm gồm ba thẩm phán và trong trường hợp cần thiết có thể có thêm hai hội thẩm nhân dân.\nĐiều 217.\nNhững người tham gia phiên toà phúc thẩm.\n1- Tại phiên toà phúc thẩm, sự\ntham gia của Kiểm sát viên Viện kiểm sát cùng cấp là bắt buộc; nếu vắng mặt thì\nphải hoãn phiên toà.\n2- Người bào chữa, người kháng cáo, người có quyền và lợi ích hợp pháp có liên quan đến việc kháng cáo, kháng nghị phải được tham gia phiên toà; nếu họ vắng mặt mà có\nlý do chính đáng thì phải hoãn phiên toà.\n3- Sự tham gia phiên toà của những người khác do Toà án cấp phúc thẩm quyết định, nếu xét thấy sự có mặt của họ là\ncần thiết.\nĐiều 218.\nBổ sung, xem xét chứng cứ tại Toà án cấp phúc thẩm.\n1- Trước khi xét xử hoặc trong khi xét hỏi tại phiên toà, Viện kiểm sát có thể tự mình hoặc theo yêu cầu của Toà án bổ sung những chứng cứ mới; người đã kháng cáo và người có quyền và lợi ích hợp pháp liên quan đến việc kháng cáo,\nkháng nghị cũng có quyền bổ sung chứng cứ mới.\n2- Chứng cứ cũ và chứng cứ mới đều phải được xem xét tại phiên toà. Bản án của Toà án cấp phúc thẩm phải căn cứ\nvào cả chứng cứ cũ và chứng cứ mới.\nĐiều 219.\nThủ tục phiên toà phúc thẩm.\nPhiên toà phúc thẩm cũng tiến hành như phiên toà sơ thẩm nhưng trước khi xét hỏi, một thành viên của Hội đồng xét xử phải trình bày tóm tắt nội dung vụ án, quyết định của bản án sơ thẩm và\nnội dung của kháng cáo hoặc kháng nghị.\nĐiều 220.\nBản án phúc thẩm.\nToà án cấp phúc thẩm có quyền quyết định:\n1- Bác kháng cáo, kháng nghị và\ngiữ nguyên bản án sơ thẩm;\n2- Sửa bản án sơ thẩm;\n3- Huỷ bản\nán sơ thẩm và chuyển hồ sơ vụ án để điều tra lại hoặc xét xử lại;\n4- Huỷ bản\nán sơ thẩm và đình chỉ vụ án.\nĐiều 221.\nSửa bản án sơ thẩm.\n1- Toà án cấp phúc thẩm có quyền sửa bản án sơ thẩm như sau:\na) Miễn trách nhiệm hình sự hoặc hình phạt cho bị cáo;\nb) Áp dụng điều khoản Bộ luật hình sự về tội nhẹ hơn;\nc) Giảm hình phạt cho bị cáo;\nd) Giảm mức bồi thường thiệt hại và sửa quyết định xử lý vật chứng.\n2- Nếu có căn cứ, Toà án cấp phúc thẩm có thể giảm hình phạt hoặc áp dụng điều khoản Bộ luật hình sự về tội nhẹ\nhơn cho cả những bị cáo không kháng cáo hoặc không bị kháng cáo, kháng nghị.\n3- Trong trường hợp Viện kiểm sát kháng nghị hoặc người bị hại kháng cáo yêu cầu thì Toà\nán cấp phúc thẩm có thể tăng hình phạt, áp dụng điều khoản Bộ luật hình sự về tội nặng hơn; tăng mức bồi thường thiệt hại, nếu có kháng nghị của Viện kiểm sát hoặc kháng cáo của người bị hại, nguyên đơn dân sự; nếu có căn cứ, Toà án vẫn có thể\ngiảm hình phạt, áp dụng điều khoản Bộ luật hình sự về tội nhẹ hơn và giảm mức bồi thường thiệt hại.\nĐiều 222.\nHuỷ án sơ thẩm để điều tra lại hoặc xét xử lại.\n1- Toà án cấp phúc thẩm huỷ án sơ thẩm để tiến hành lại tố tụng từ giai đoạn điều tra khi nhận thấy việc điều tra ở cấp sơ thẩm không đầy đủ mà cấp phúc thẩm không thể bổ sung được.\nNếu thành phần Hội đồng xét xử\nsơ thẩm không đúng luật định hoặc có vi phạm nghiêm trọng khác về thủ tục tố tụng thì Toà án cấp phúc thẩm huỷ bản án sơ thẩm để xét xử lại ở cấp sơ thẩm với thành phần Hội đồng xét xử mới.\n2- Khi huỷ án sơ thẩm để điều tra lại hoặc xét xử lại, Toà án cấp phúc thẩm cần ghi rõ lý do của việc huỷ án sơ thẩm.\n3- Khi huỷ án sơ thẩm để xét xử\nlại, Toà án cấp phúc thẩm không quyết định trước những chứng cứ mà Toà án cấp sơ thẩm cần phải chấp nhận hoặc cần phải bác bỏ, cũng như không quyết định trước về điều khoản Bộ luật hình sự và hình phạt mà Toà án cấp sơ thẩm sẽ phải áp dụng.Bổ sung\nĐiều 223.\nHuỷ bản án sơ thẩm và đình chỉ vụ án.\nKhi có một trong những căn cứ\nquy định tại điểm 1 và điểm 2 Điều 89 Bộ luật này thì Toà án cấp phúc thẩm huỷ\nbản án sơ thẩm, tuyên bố bị cáo không có tội và đình chỉ vụ án; nếu có một trong những căn cứ quy định tại các điểm 3, 4, 5, 6, 7 Điều 89 Bộ luật này thì\nhuỷ bản án sơ thẩm và đình chỉ vụ án.\nĐiều 224.\nĐiều tra lại hoặc xét xử lại vụ án hình sự.\nSau khi Toà án cấp phúc thẩm huỷ\nán mà vụ án phải điều tra lại hoặc xét xử lại thì cơ quan điều tra tiến hành điều tra lại và Toà án cấp sơ thẩm xét xử lại vụ án theo thủ tục chung.\nĐiều 225.\nPhúc thẩm những quyết định của Toà án cấp sơ thẩm.\n1- Đối với những quyết định của Toà án cấp sơ thẩm bị kháng nghị hoặc kháng cáo, Toà án cấp phúc thẩm không phải mở phiên toà, nhưng nếu xét cần thì có thể triệu tập những người tham gia tố tụng cần thiết để nghe ý kiến của họ trước khi Toà án ra quyết định.\n2- Toà án cấp phúc thẩm phải ra quyết định giải quyết việc kháng cáo hoặc kháng nghị trong thời hạn mười ngày kể\ntừ ngày nhận được hồ sơ của vụ án.\n3- Khi xét những quyết định của Toà án cấp sơ thẩm bị kháng cáo, kháng nghị, Toà án cấp phúc thẩm có những quyền hạn quy định tại Điều 220 Bộ luật này.\nPhần thứ\nnăm:\nTHI HÀNH BẢN ÁN VÀ QUYẾT ĐỊNH CỦA TOÀ ÁN Chương 24:\nNHỮNG QUY ĐỊNH CHUNG VỀ\nTHI HÀNH BẢN ÁN VÀ QUYẾT ĐỊNH CỦA TOÀ ÁN\nĐiều 226.\nNhững bản án và quyết định được thi hành.\n1- Những bản\nán và quyết định được thi hành là những bản án và quyết định đã có hiệu lực pháp luật, bao gồm:\na) Những bản án và quyết định sơ\nthẩm đồng thời là chung thẩm;\nb) Những bản án và quyết định của Toà án cấp sơ thẩm không bị kháng cáo, kháng nghị theo trình tự phúc thẩm;\nc) Những bản án và quyết định của Toà án cấp phúc thẩm;\nd) Những quyết định của Toà án cấp giám đốc thẩm hoặc tái thẩm.\n2- Trong trường hợp bị cáo đang bị tạm giam mà Toà án cấp sơ thẩm quyết định đình chỉ vụ\nán, không kết tội, miễn trách nhiệm hình sự, miễn hình phạt cho bị cáo, hình phạt không phải là tù giam hoặc phạt tù nhưng cho hưởng án treo hoặc khi thời hạn phạt tù bằng hoặc ngắn hơn thời hạn đã tạm giam thì bản án hoặc quyết định của Toà\nán được thi hành ngay, mặc dù vẫn có thể bị kháng nghị, kháng cáo.\n3- Trong thời hạn mười lăm ngày kể từ khi bản án hoặc quyết định của Toà án có hiệu lực pháp luật, Chánh án Toà án đã xử sơ thẩm phải ra quyết định thi hành án hoặc uỷ\nthác cho Toà án khác cùng cấp ra quyết định thi hành án.\nQuyết định thi hành án phải ghi rõ họ tên người ra quyết định; tên cơ quan có nhiệm vụ thi hành án hoặc quyết định;\nhọ tên, ngày, tháng, năm sinh, nơi cư trú của người bị kết án; bản án hoặc quyết\nđịnh mà người bị kết án phải chấp hành.\nTrong trường hợp người bị kết án\nđang tại ngoại thì quyết định thi hành án phạt tù phải ghi rõ thời hạn người đó\nphải có mặt ở cơ quan công an để thi hành án là bảy ngày kể từ ngày nhận được quyết định.\nQuyết định thi hành án, trích lục bản án hoặc quyết định phải được gửi cho Viện kiểm sát cùng cấp nơi thi hành\nán, cơ quan thi hành án và người bị kết án.\nĐiều 227.\nCơ quan, tổ chức có nhiệm vụ thi hành bản án và quyết định của Toà án.\n1- Cơ quan công an thi hành án phạt tù có thời hạn, tù chung thân và tham gia Hội đồng thi hành án tử hình theo quy định tại Điều 229 Bộ luật này.\n2- Chính quyền xã, phường, thị trấn hoặc cơ quan, tổ chức nơi người bị kết án cư trú hoặc làm việc có nhiệm vụ theo dõi, giám sát việc cải tạo của những người được hưởng\nán treo hoặc bị phạt cải tạo không giam giữ.\n3- Việc thi hành án quản chế, cấm cư trú, tước một số quyền công dân, cấm đảm nhiệm một số chức vụ hoặc cấm làm một số nghề nhất định do chính quyền xã, phường, thị trấn hoặc cơ quan, tổ chức nơi thi hành án đảm nhiệm.\n4- Cơ sở chuyên khoa y tế thi hành quyết định về bắt buộc chữa bệnh.\n5- Chính quyền xã, phường, thị trấn hoặc cơ quan, tổ chức có nhiệm vụ giúp chấp hành viên của Toà án thi hành án phạt tiền, tịch thu tài sản và bồi thường thiệt hại. Nếu cần phải áp dụng biện pháp cưỡng chế thi hành án thì cơ quan công an và các cơ quan Nhà nước hữu quan khác có nhiệm vụ phối hợp.\n6- Việc thi hành bản án và quyết định của Toà án quân sự do các tổ chức trong Quân đội đảm nhiệm.\n7- Các cơ quan thi hành án phải báo cho Chánh án Toà án đã ra quyết định thi hành án về việc bản án hoặc quyết\nđịnh đã được thi hành; nếu chưa thi hành được thì phải nói rõ lý do.\nChương 25:\nTHI HÀNH HÌNH PHẠT TỬ\nHÌNH \nĐiều 228.\nThủ tục xem xét bản án tử hình trước khi đưa ra thi hành.\n1- Sau khi bản án tử hình có hiệu lực pháp luật, hồ sơ vụ án phải được gửi ngay lên Chánh án Toà án nhân dân tối cao và bản sao bản án phải được gửi ngay lên Viện trưởng Viện kiểm sát nhân dân tối cao.\nTrong thời hạn hai tháng kể từ\nngày nhận được bản án và hồ sơ vụ án, Chánh án Toà án nhân dân tối cao và Viện trưởng Viện kiểm sát nhân dân tối cao phải quyết định kháng nghị hoặc không kháng nghị giám đốc thẩm hoặc tái thẩm.\nTrong thời hạn bảy ngày kể từ\nkhi bản án có hiệu lực pháp luật, người bị kết án được gửi đơn xin ân giảm lên Hội đồng Nhà nước.\n2- Bản án tử hình được thi hành, nếu không có kháng nghị của Chánh án Toà án nhân dân tối cao hoặc của Viện trưởng Viện kiểm sát nhân dân tối cao theo thủ tục giám đốc thẩm hoặc tái thẩm.\nTrong trường hợp người bị kết án xin ân giảm án tử hình thì bản án tử hình được thi hành sau khi Hội đồng Nhà nước bác đơn xin ân giảm.\nĐiều 229.\nThi hành hình phạt tử hình.\n1- Chánh án Toà án đã xử sơ thẩm ra quyết định thi hành án và thành lập Hội đồng thi hành\nán tử hình gồm đại diện Toà án, Viện kiểm sát và Công an. Hội đồng thi hành án phải kiểm tra căn cước của người bị kết án trước khi thi hành án.\n2- Trước khi thi hành án phải giao cho người bị kết án đọc quyết định thi hành án, quyết\nđịnh không kháng nghị của Chánh án Toà án nhân dân tối cao và Viện trưởng Viện kiểm sát nhân dân tối cao và nếu người bị kết án đã có đơn xin ân giảm án tử\nhình thì giao cho họ đọc bản sao quyết định của Hội đồng Nhà nước bác đơn xin ân giảm.\n3- Hình phạt tử hình được thi hành bằng xử bắn.\n4- Việc thi hành án tử hình phải\nđược lập biên bản ghi rõ việc đã giao các quyết định cho người bị kết án xem,\nnhững lời nói của họ và những thư từ, đồ vật mà họ gửi lại cho thân nhân.\n5- Trong trường hợp có tình tiết đặc biệt, Hội đồng thi hành án hoãn thi hành và báo cáo lên Chánh án Toà án nhân dân tối cao.\nChương 26:\nTHI HÀNH HÌNH PHẠT TÙ\nVÀ CÁC HÌNH PHẠT KHÁC \nĐiều 230.\nThi hành án phạt tù.\n1- Trong trường hợp người bị kết\nán đang bị tạm giam thì theo yêu cầu của thân nhân người bị kết án, cơ quan công an phải cho phép người bị kết án gặp thân nhân trước khi thi hành án.\nBan giám thị trại giam phải thông báo cho gia đình người bị kết án biết nơi người đó chấp hành hình phạt.\n2- Trong trường hợp người bị kết\nán đang tại ngoại, nếu quá thời hạn mà không có mặt ở cơ quan công an để chấp hành án thì người bị kết án sẽ bị áp giải.\n3- Chánh\nán Toà án đã ra quyết định thi hành án phải theo dõi việc thi hành án. Cơ quan công an phải báo cho Toà án biết việc bắt người bị kết án để thi hành án hoặc lý do chưa bắt được và biện pháp cần áp dụng để bảo đảm việc thi hành án.\nĐiều 231.\nHoãn thi hành án phạt tù.\nĐối với người bị kết án đang được tại ngoại, Chánh án Toà án có thể tự mình hoặc theo đề nghị của Viện kiểm sát,\ncơ quan công an hoặc người bị kết án, cho hoãn chấp hành hình phạt trong những trường hợp sau đây:\n1- Người bị kết án bị ốm nặng được hoãn chấp hành hình phạt cho đến khi sức khoẻ phục hồi;\n2- Người bị\nkết án là phụ nữ có thai hoặc mới sinh đẻ thì được hoãn chấp hành hình phạt từ\nba tháng đến một năm;\n3- Người bị kết án là người lao\nđộng duy nhất trong gia đình nếu ở tù sẽ làm cho gia đình đặc biệt khó khăn,\nthì có thể được hoãn chấp hành hình phạt đến một năm, trừ trường hợp là phần tử\nnguy hiểm cho xã hội hoặc bị kết án về tội đặc biệt nguy hiểm xâm phạm an ninh quốc gia hoặc tội nghiêm trọng khác;\n4- Quân nhân bị kết án về một tội\nít nghiêm trọng, nếu do nhu cầu chiến đấu hoặc phục vụ chiến đấu mà được người chỉ huy từ cấp trung đoàn trở lên đề nghị thì có thể được hoãn chấp hành hình phạt từ sáu tháng đến một năm.\nĐiều 232.\nTạm đình chỉ thi hành án phạt tù.\n1- Theo đề\nnghị của Viện kiểm sát hoặc của Ban giám thị trại giam, Chánh án Toà án đã ra quyết định thi hành án có thể cho người bị kết án không phải là phần tử nguy hiểm\nđược tạm đình chỉ chấp hành hình phạt tù trong các trường hợp quy định tại các\nđiểm 1, 2 và 4 Điều 231 Bộ luật này. Việc tạm đình chỉ để xét xử theo thủ tục giám đốc thẩm phải do Toà án cấp trên trực tiếp quyết định.\n2- Thời gian được tạm đình chỉ\nchấp hành hình phạt không tính vào thời gian chấp hành hình phạt.\nĐiều 233.\nQuản lý người được hoãn hoặc được tạm đình chỉ chấp hành hình phạt tù.\n1- Người được hoãn hoặc được tạm\nđình chỉ chấp hành hình phạt tù được giao cho chính quyền xã, phường, thị trấn hoặc cơ quan, tổ chức nơi họ cư trú hoặc làm việc quản lý. Họ không được tự ý\nđi nơi khác, nếu không được phép của chính quyền xã, phường, thị trấn hoặc cơ\nquan, tổ chức quản lý họ.\n2- Nếu trong thời gian được hoãn hoặc tạm đình chỉ chấp hành hình phạt mà người bị kết\nán có hành vi vi phạm pháp luật nghiêm trọng hoặc định trốn thì Chánh án Toà án\nđã cho hoãn hoặc tạm đình chỉ thi hành án huỷ quyết định đó và ra lệnh bắt họ\nchấp hành hình phạt.\nĐiều 234.\nThi hành hình phạt tù cho hưởng án treo, hình phạt cải tạo không giam giữ và cải tạo ở đơn vị kỷ luật của quân đội.\n1- Người bị kết án phạt tù được hưởng án treo và người bị kết án cải tạo không giam giữ được giao cho chính quyền xã, phường, thị trấn, hoặc cơ quan, tổ chức nơi họ cư trú hoặc làm việc để giám sát, giáo dục.\n2- Người bị kết án cải tạo ở đơn vị kỷ luật của quân đội được giao cho đơn vị kỷ luật của quân\nđội.Bổ sung\nĐiều 235.\nThi hành hình phạt quản chế hoặc cấm cư trú.\nĐối với người bị phạt quản chế\nthì sau khi chấp hành xong hình phạt tù, người bị kết án được giao cho chính quyền xã, phường, thị trấn nơi họ cư trú để thi hành hình phạt quản chế. Người bị phạt cấm cư trú thì không được về những địa phương bị cấm cư trú mà phải đến\nở nơi khác.\nĐiều 236.\nThi hành hình phạt tiền hoặc tịch thu tài sản.\nQuyết định đưa bản án phạt tiền hoặc tịch thu tài sản ra thi hành phải được gửi cho chấp hành viên và chính quyền xã, phường, thị trấn nơi người bị kết án cư trú.\nViệc tịch thu tài sản được tiến hành theo quy định tại Điều 32 Bộ luật hình sự.\nChương 27:\nGIẢM THỜI HẠN HOẶC MIỄN CHẤP HÀNH HÌNH PHẠT \nĐiều 237.\nĐiều kiện để được giảm thời hạn hoặc miễn chấp hành hình phạt.\n1- Người đang chấp hành hình phạt tù, cải tạo không giam giữ, cải tạo ở đơn vị kỷ luật của quân\nđội, cấm cư trú hoặc quản chế có thể được giảm thời hạn chấp hành hình phạt theo quy định tại các Điều 49, 50, 51, 66 và 69 Bộ luật hình sự. Nếu họ chưa chấp hành hình phạt thì có thể được miễn chấp hành toàn bộ hình phạt theo quy định tại khoản 2 Điều 51 Bộ luật hình sự.\n2- Người bị kết án tù được hưởng\nán treo có thể được rút ngắn thời gian thử thách theo quy định tại Điều 44 Bộ luật hình sự.\nĐiều 238.\nThủ tục giảm thời hạn hoặc miễn chấp hành hình phạt.\n1- Toà án có\nthẩm quyền quyết định giảm thời hạn hoặc miễn chấp hành hình phạt tù là Toà án nhân dân cấp tỉnh, Toà án quân sự cấp quân khu nơi người bị kết án chấp hành hình phạt.\nViệc giảm thời hạn hoặc miễn chấp hành các hình phạt khác hoặc giảm thời gian thử thách thuộc thẩm quyền quyết định của Toà án nhân dân cấp huyện, Toà án quân sự khu vực nơi người bị kết án chấp hành hình phạt hoặc chịu thử thách.\n2- Hồ sơ đề\nnghị xét giảm thời hạn chấp hành hình phạt hoặc rút ngắn thời gian thử thách phải có đề nghị hoặc nhận xét của cơ quan, tổ chức có nhiệm vụ thi hành án quy định tại Điều 227 Bộ luật này.\n3- Khi Toà án xét giảm thời hạn hoặc miễn chấp hành hình phạt, một thành viên của Toà án trình bày vấn đề cần được xem xét, đại diện Viện kiểm sát phát biểu ý kiến, Toà án ra quyết định chấp nhận hoặc bác đề nghị giảm thời hạn,\nmiễn chấp hành hình phạt hoặc rút ngắn thời gian thử thách.\nChương 28:\nXOÁ ÁN \nĐiều 239.\nĐương nhiên xoá án.\nTheo yêu cầu của người được\nđương nhiên xoá án theo quy định tại Điều 53 Bộ luật hình sự, Chánh án của Toà án đã xử sơ thẩm vụ án cấp giấy chứng nhận là họ đã được xoá án.\nĐiều 240.\nXoá án do Toà án quyết định.\n1- Trong những trường hợp quy định tại Điều 54 và Điều 55 Bộ luật hình sự, việc xoá án do Toà án quyết định. Người bị kết\nán phải có đơn gửi cho Toà án đã xử sơ thẩm vụ án kèm theo nhận xét của chính quyền xã, phường, thị trấn hoặc cơ quan, tổ chức nơi họ cư trú hoặc làm việc.\n2- Chánh án Toà án chuyển hồ sơ\ncho Viện kiểm sát để phát biểu ý kiến bằng văn bản về đơn xin xoá\nán. Nếu xét thấy đủ điều kiện thì Chánh án ra quyết định xoá\nán; trong trường hợp chưa đủ điều kiện thì ra quyết định bác đơn xin xoá án.\nPhần thứ\nsáu:\nXÉT LẠI BẢN ÁN VÀ QUYẾT ĐỊNH\nĐÃ CÓ HIỆU LỰC PHÁP LUẬT Chương 29:\nGIÁM ĐỐC THẨM \nĐiều 241.\nTính chất của giám đốc thẩm.\nGiám đốc thẩm là xét lại bản án hoặc quyết định đã có hiệu lực pháp luật nhưng bị kháng nghị vì phát hiện có vi phạm pháp luật trong việc xử lý vụ án.\nĐiều 242.\nCăn cứ để kháng nghị theo thủ tục giám đốc thẩm.\nBản án hoặc quyết định của Toà\nán đã có hiệu lực pháp luật bị kháng nghị theo thủ tục giám đốc thẩm, khi có một trong những căn cứ sau đây:\n1- Việc điều tra xét hỏi tại phiên toà phiến diện hoặc không đầy đủ;\n2- Kết luận trong bản án hoặc quyết định không phù hợp với những tình tiết khách quan của vụ án;\n3- Có sự vi phạm nghiêm trọng thủ\ntục tố tụng trong khi điều tra, truy tố hoặc xét xử;\n4- Có những sai lầm nghiêm trọng trong việc áp dụng Bộ luật hình sự.\nĐiều 243.\nPhát hiện bản án hoặc quyết định đã có hiệu lực pháp luật cần xét lại theo thủ\ntục giám đốc thẩm.\nNgười bị kết án, các cơ quan Nhà\nnước, tổ chức xã hội và mọi công dân có quyền phát hiện những vi phạm pháp luật trong các bản án và quyết định của Toà án đã có hiệu lực pháp luật với những người quy định tại Điều 244 Bộ luật này.\nTrong trường hợp phát hiện thấy những vi phạm pháp luật trong bản án hoặc quyết định đã có hiệu lực pháp luật, Viện kiểm sát và Toà án phải báo cho người có quyền kháng nghị quy định tại Điều 244 Bộ luật này.\nĐiều 244.\nNhững người có quyền kháng nghị theo thủ tục giám đốc thẩm.\nNhững người sau đây có quyền kháng nghị theo thủ tục giám đốc thẩm:\n1- Chánh án Toà án nhân dân tối cao và Viện trưởng Viện kiểm sát nhân dân tối cao có quyền kháng nghị bản án hoặc quyết định đã có hiệu lực pháp luật của Toà án các cấp;\n2- Phó chánh án Toà án nhân dân tối cao và Phó viện trưởng Viện kiểm sát nhân dân tối cao có quyền kháng nghị\nnhững bản án hoặc quyết định đã có hiệu lực pháp luật của Toà án cấp dưới;\n3- Chánh án Toà\nán quân sự cấp cao và Viện trưởng Viện kiểm sát quân sự trung ương có quyền kháng nghị những bản án hoặc quyết định đã có hiệu lực pháp luật của Toà án quân sự cấp dưới;\n4- Chánh án Toà án nhân dân cấp tỉnh và Viện trưởng Viện kiểm sát nhân dân cấp tỉnh, Chánh án Toà án quân sự cấp quân khu và Viện trưởng Viện kiểm sát quân sự cấp quân khu có quyền kháng nghị\nnhững bản án hoặc quyết định đã có hiệu lực pháp luật của các Toà án cấp dưới.\nĐiều 245.\nTạm đình chỉ thi hành bản án hoặc quyết định bị kháng nghị.\nNhững người đã kháng nghị bản án hoặc quyết định đã có hiệu lực pháp luật có quyền quyết định tạm đình chỉ thi hành bản án hoặc quyết định đó.\nĐiều 246.\nKháng nghị.\n1- Kháng nghị theo thủ tục giám\nđốc thẩm phải nói rõ lý do và được gửi cho:\na) Toà án đã ra bản án hoặc quyết\nđịnh bị kháng nghị;\nb) Toà án sẽ xử giám đốc thẩm;\nc) Người bị kết án và những người có quyền và lợi ích liên quan đến việc kháng nghị.\n2- Khi không có những căn cứ để\nkháng nghị theo thủ tục giám đốc thẩm, người có quyền kháng nghị phải trả lời cho người hoặc cơ quan, tổ chức đã phát hiện biết rõ lý do.\n3- Trước khi bắt đầu phiên toà\ngiám đốc thẩm, người đã kháng nghị có quyền bổ sung hoặc rút kháng nghị.\nĐiều 247.\nThời hạn kháng nghị.\n1- Việc kháng nghị theo hướng không có lợi cho người bị kết án chỉ được tiến hành trong thời hạn một năm kể từ\nngày bản án hoặc quyết định có hiệu lực pháp luật.\n2- Việc kháng nghị theo hướng có\nlợi cho người bị kết án có thể được tiến hành bất cứ lúc nào, kể cả trường hợp người bị kết án đã chết mà cần minh oan cho họ.Bổ sung\nĐiều 248.\nThẩm quyền giám đốc thẩm.\n1- Uỷ ban thẩm phán Toà án nhân dân cấp tỉnh giám đốc thẩm những bản án hoặc quyết định đã có hiệu lực pháp luật của Toà án nhân dân cấp huyện; Uỷ ban thẩm phán Toà án quân sự cấp quân khu giám đốc thẩm những bản án hoặc quyết định đã có hiệu lực pháp luật của các Toà\nán quân sự khu vực.\n2- Toà hình sự Toà án nhân dân tối cao giám đốc thẩm những bản án hoặc quyết định đã có hiệu lực pháp luật của các Toà án nhân dân cấp tỉnh; Toà án quân sự cấp cao giám đốc thẩm những bản án hoặc quyết định đã có hiệu lực pháp luật của Toà án quân sự cấp quân khu.\n3- Uỷ ban thẩm phán Toà án nhân dân tối cao giám đốc thẩm những bản án hoặc quyết định đã có hiệu lực pháp luật của các Toà thuộc Toà án nhân dân tối cao.\n4- Hội đồng thẩm phán Toà án nhân dân tối cao giám đốc thẩm những quyết định của Uỷ ban thẩm phán Toà án nhân dân tối cao bị kháng nghị.\nĐiều 249.\nNhững người tham gia phiên toà giám đốc thẩm.\nPhiên toà giám đốc thẩm phải có\nsự tham gia của Viện trưởng Viện kiểm sát cùng cấp hoặc kiểm sát viên được Viện trưởng uỷ quyền.\nKhi xét thấy cần thiết, Toà án phải triệu tập người bị kết án, người bào chữa và có thể triệu tập những người có quyền và lợi ích liên quan đến việc kháng nghị tham gia phiên toà giám đốc thẩm.\nĐiều 250.\nThành phần Hội đồng giám đốc thẩm.\nHội đồng giám đốc thẩm Toà hình sự Toà án nhân dân tối cao hoặc Toà án quân sự cấp cao gồm có ba thẩm phán. Nếu Uỷ ban thẩm phán hoặc Hội đồng thẩm phán giám đốc thẩm thì\nsố thành viên tham gia xét xử phải chiếm hai phần ba tổng số các thành viên của Uỷ ban thẩm phán hoặc Hội đồng thẩm phán. Quyết định giám đốc thẩm của Uỷ ban thẩm phán hoặc Hội đồng thẩm phán phải được quá nửa tổng số thành viên tán thành thì mới có giá trị.\nĐiều 251.\nThủ tục phiên toà giám đốc thẩm.\nTrong phiên toà, một thành viên của Hội đồng giám đốc thẩm trình bày tóm tắt nội dung vụ án, nội dung của kháng nghị\nvà đại diện Viện kiểm sát phát biểu ý kiến.\nNếu đã triệu tập người bị kết\nán, người bào chữa, người có quyền và lợi ích hợp pháp liên quan đến việc kháng nghị thì những người này được trình bày ý kiến trước khi đại diện Viện kiểm sát phát biểu. Trong trường hợp họ vắng mặt thì Hội đồng giám đốc thẩm vẫn có thể tiến hành xét xử.\nĐiều 252.\nThời hạn xét xử giám đốc thẩm.\nPhiên toà giám đốc thẩm phải được tiến hành trong thời hạn bốn tháng kể từ ngày nhận kháng nghị.\nĐiều 253.\nPhạm vi giám đốc thẩm.\nHội đồng giám đốc thẩm phải xem xét toàn bộ vụ án mà không chỉ hạn chế trong nội dung của kháng nghị.\nĐiều 254.\nQuyết định giám đốc thẩm.\nHội đồng giám đốc thẩm có quyền ra quyết định:\n1- Không chấp nhận kháng nghị và\ngiữ nguyên bản án hoặc quyết định đã có hiệu lực pháp luật;\n2- Huỷ bản\nán hoặc quyết định đã có hiệu lực pháp luật và đình chỉ vụ án;\n3- Huỷ bản\nán hoặc quyết định đã có hiệu lực pháp luật để điều tra lại hoặc xét xử lại;\n4- Sửa bản án hoặc quyết định đã\ncó hiệu lực pháp luật.\nĐiều 255.\nHuỷ bản án hoặc quyết định đã có hiệu lực pháp luật và đình chỉ vụ án.\nHội đồng giám đốc thẩm huỷ bản\nán hoặc quyết định đã có hiệu lực pháp luật và đình chỉ vụ án, nếu có một trong những căn cứ quy định tại Điều 89 Bộ luật này.\nĐiều 256.\nHuỷ bản án hoặc quyết định để điều tra lại hoặc xét xử lại.\nHội đồng giám đốc thẩm huỷ bản\nán hoặc quyết định bị kháng nghị để điều tra lại hoặc xét xử lại trong những trường hợp quy định tại Điều 242 Bộ luật này. Nếu cần xét xử lại thì tuỳ trường hợp, Hội đồng giám đốc thẩm có thể quyết định xét xử lại từ cấp sơ thẩm hoặc phúc thẩm. Nếu bản án hoặc quyết định phúc thẩm có sai lầm nhưng bản án hoặc quyết định sơ thẩm đúng thì Hội đồng giám đốc thẩm chỉ huỷ bản án hoặc quyết định có sai lầm đó và giữ nguyên bản án hoặc quyết định sơ thẩm.\nĐiều 257.\nSửa bản án hoặc quyết định có hiệu lực pháp luật.\nHội đồng giám đốc thẩm không được tăng hình phạt hoặc áp dụng điều khoản Bộ luật hình sự về tội nặng hơn, nhưng có\nquyền sửa hình phạt và áp dụng điều khoản Bộ luật hình sự về tội nhẹ hơn đối với những người bị kháng nghị và cả những người không bị kháng nghị theo hướng đó.\nĐiều 258.\nHiệu lực của quyết định giám đốc thẩm.\nQuyết định của Hội đồng giám đốc thẩm có hiệu lực pháp luật kể từ ngày ra quyết định.\nĐiều 259.\nĐiều tra lại, xét xử lại vụ án ở Toà án cấp sơ thẩm hoặc phúc thẩm sau khi Hội\nđồng giám đốc thẩm sau khi Hội đồng giám đốc thẩm huỷ bản án.\nNếu Hội đồng giám đốc thẩm quyết\nđịnh phải điều tra lại thì trong thời hạn năm ngày hồ sơ vụ án phải được trả lại cho Viện kiểm sát cùng cấp để điều tra lại theo thủ tục chung.\nNếu Hội đồng giám đốc thẩm quyết\nđịnh xét xử lại ở cấp sơ thẩm hoặc phúc thẩm thì việc xét xử được tiến hành theo thủ tục chung.\nChương 30:\nTÁI THẨM \nĐiều 260.\nTính chất của tái thẩm.\nThủ tục tái thẩm được áp dụng đối với bản án hoặc quyết định đã có hiệu lực pháp luật nhưng bị kháng nghị vì có\nnhững tình tiết mới được phát hiện có thể làm thay đổi cơ bản nội dung của bản\nán hoặc quyết định mà Toà án không biết được khi ra bản án quyết định đó.\nĐiều 261.\nNhững căn cứ để kháng nghị theo thủ tục tái thẩm.\nNhững tình tiết được dùng làm căn cứ để kháng nghị tái thẩm là:\n1- Lời khai của người làm chứng,\nkết luận giám định hoặc lời dịch của người phiên dịch có những điểm quan trọng\nđược phát hiện là không đúng sự thật;\n2- Điều tra viên, kiểm sát viên,\nthẩm phán, hội thẩm nhân dân đã có kết luận không đúng làm cho vụ án bị xét xử\nsai;\n3- Vật chứng hoặc những tài liệu khác trong vụ án bị giả mạo hoặc không đúng sự thật.\nĐiều 262.\nThông báo và xác minh những tình tiết mới được phát hiện.\n1- Người bị kết án, cơ quan Nhà\nnước, tổ chức xã hội và mọi công dân có quyền thông báo cho Viện kiểm sát hoặc Toà án những tình tiết mới được phát hiện của vụ án. Viện trưởng Viện kiểm sát có thẩm quyền kháng nghị tái thẩm ra quyết định xác minh những tình tiết đó.\n2- Nếu có một trong những căn cứ\nquy định tại Điều 261 Bộ luật này thì Viện trưởng Viện kiểm sát ra quyết định kháng nghị tái thẩm và chuyển hồ sơ vụ án cho Toà án có thẩm quyền. Nếu không có căn cứ thì Viện trưởng Viện kiểm sát trả lời cho những cơ quan, tổ chức hoặc người đã phát hiện biết.\nĐiều 263.\nNhững người có quyền kháng nghị tái thẩm.\nViện trưởng Viện kiểm sát nhân dân tối cao có quyền kháng nghị tái thẩm đối với những bản án hoặc quyết định\nđã có hiệu lực pháp luật của Toà án nhân dân hoặc Toà án quân sự các cấp. Viện trưởng Viện kiểm sát quân sự trung ương có quyền kháng nghị tái thẩm đối với những bản án hoặc quyết định đã có hiệu lực pháp luật của Toà án quân sự các cấp.\nViện trưởng Viện kiểm sát nhân dân cấp tỉnh có quyền kháng nghị tái thẩm đối với những bản án hoặc quyết định\nđã có hiệu lực pháp luật của Toà án nhân dân cấp huyện. Viện trưởng Viện kiểm sát quân sự cấp quân khu có quyền kháng nghị tái thẩm đối với những bản án hoặc quyết\nđịnh đã có hiệu lực pháp luật của Toà án quân sự khu vực.\n3- Bản kháng nghị phải được gửi cho người bị kết án và những người có quyền và lợi ích liên quan đến việc kháng nghị.\nĐiều 264.\nTạm đình chỉ thi hành bản án hoặc quyết định đã bị kháng nghị tái thẩm.\nNhững người đã kháng nghị theo thủ tục tái thẩm có quyền tạm đình chỉ thi hành bản án hoặc quyết định bị kháng nghị.\nĐiều 265.\nThời hạn kháng nghị tái thẩm.\n1- Tái thẩm theo hướng không có\nlợi cho người bị kết án phải tiến hành trong thời hiệu truy cứu trách nhiệm hình sự quy định tại Điều 45 Bộ luật hình sự và không được quá một năm kể từ ngày Viện kiểm sát nhận được tin báo về tình tiết mới được phát hiện.\n2- Tái thẩm theo hướng có lợi cho người bị kết án thì không hạn chế về thời gian và được tiến hành trong cả\ntrường hợp người bị kết án đã chết mà cần minh oan cho họ.Bổ sung\nĐiều 266.\nThẩm quyền tái thẩm.\n1- Uỷ ban thẩm phán Toà án nhân dân cấp tỉnh tái thẩm những bản án hoặc quyết định đã có hiệu lực pháp luật của Toà án nhân dân cấp huyện; Uỷ ban thẩm phán Toà án quân sự cấp quân khu tái thẩm những bản án hoặc quyết định đã có hiệu lực pháp luật của Toà án quân sự khu vực.\n2- Toà hình sự Toà án nhân dân tối cao tái thẩm những bản án hoặc quyết định đã có hiệu lực pháp luật của Toà án nhân dân cấp tỉnh; Toà án quân sự cấp cao tái thẩm những bản án hoặc quyết định đã có hiệu lực pháp luật của Toà án quân sự cấp quân khu.\n3- Uỷ ban thẩm phán Toà án nhân dân tối cao tái thẩm những bản án hoặc quyết định đã có hiệu lực pháp luật của các Toà thuộc Toà án nhân dân tối cao.\n4- Hội đồng thẩm phán Toà án nhân dân tối cao tái thẩm đối với các quyết định đã có hiệu lực pháp luật của Uỷ\nban thẩm phán Toà án nhân dân tối cao.\nĐiều 267.\nViệc tiến hành tái thẩm.\nNhững quy định tại các Điều 249,\n250, 251 và 252 Bộ luật này cũng áp dụng đối với việc tái thẩm vụ án.\nĐiều 268.\nCác quyết định của Hội đồng tái thẩm.\nHội đồng tái thẩm có quyền ra quyết định:\n1- Bác kháng nghị và giữ nguyên bản án hoặc quyết định đã có hiệu lực pháp luật;\n2- Huỷ bản án hoặc quyết định bị\nkháng nghị để điều tra lại hoặc xét xử lại;\n3- Huỷ bản án hoặc quyết định bị\nkháng nghị và đình chỉ vụ án.\nĐiều 269.\nHiệu lực của quyết định tái thẩm.\nQuyết định của Hội đồng tái thẩm có hiệu lực pháp luật kể từ ngày ra quyết định.\nĐiều 270.\nĐiều tra lại hoặc xét xử lại vụ án.\nSau khi bản án hoặc quyết định bị\nhuỷ, việc điều tra lại hoặc xét xử sơ thẩm lại được tiến hành theo thủ tục chung.\nPhần thứ bảy:\nTHỦ TỤC ĐẶC BIỆT Chương 31:\nTHỦ TỤC VỀ NHỮNG VỤ ÁN MÀ BỊ CAN, BỊ CÁO LÀ NGƯỜI CHƯA THÀNH NIÊN \nĐiều 271.\nPhạm vi áp dụng.\nThủ tục tố tụng đối với những vụ\nán mà bị can, bị cáo là người chưa thành niên được áp dụng theo quy định của Chương này, đồng thời theo những quy định khác của Bộ luật này không trái với những quy định của Chương này.\nĐiều 272.\nĐiều tra, truy tố và xét xử.\n1- Điều tra viên, kiểm sát viên,\nthẩm phán tiến hành tố tụng về những vụ án người chưa thành niên phạm tội phải là người có những hiểu biết cần thiết về tâm lý học, về khoa học giáo dục cũng như về hoạt động đấu tranh phòng và chống tội phạm của người chưa thành niên.\n2- Khi tiến hành điều tra, truy tố và xét xử cần phải xác định rõ:\na) Tuổi, trình độ phát triển về\nthể chất và tinh thần, mức độ nhận thức về hành vi phạm tội của người chưa thành niên;\nb) Điều kiện sinh sống và giáo dục;\nc) Có hay không có những người lớn tuổi xúi giục;\nd) Nguyên nhân và điều kiện phạm tội.\nĐiều 273.\nBắt, tạm giữ, tạm giam.\nNếu có đủ căn cứ quy định tại các Điều 62, 63, 64, 68 và 71 Bộ luật này thì có thể bắt, tạm giữ, tạm giam người chưa thành niên, nhưng chỉ trong những trường hợp phạm tội nghiêm trọng và theo quy định tại Điều 58 Bộ luật hình sự.\nĐiều 274.\nViệc giám sát bị can, bị cáo chưa thành niên.\n1- Cơ quan điều tra, Viện kiểm sát và Toà án có thể ra quyết định giao bị can, bị cáo chưa thành niên cho cha, mẹ\nhoặc người đỡ đầu của họ giám sát để bảo đảm sự có mặt của bị can, bị cáo khi có giấy triệu tập của cơ quan tiến hành tố tụng.\n2- Những người được giao nhiệm vụ\ngiám sát có nghĩa vụ giám sát chặt chẽ người chưa thành niên, theo dõi tư cách,\nđạo đức và giáo dục người đó.\nĐiều 275.\nBào chữa.\nCơ quan điều tra, Viện kiểm sát,\nToà án phải yêu cầu Đoàn luật sư cử người bào chữa cho bị can, bị cáo, nếu bị\ncan, bị cáo không tự lựa chọn được. Đại diện hợp pháp của bị can, bị cáo có thể\nlựa chọn người bào chữa hoặc tự mình bào chữa cho bị can, bị cáo.\nĐiều 276.\nViệc tham gia tố tụng của gia đình, nhà trường và tổ chức xã hội.\n1- Đại diện của gia đình bị can,\nbị cáo, thầy giáo, cô giáo, đại diện của nhà trường, Đoàn thanh niên cộng sản Hồ\nChí Minh và tổ chức xã hội khác nơi bị can, bị cáo học tập, lao động và sinh sống có quyền và nghĩa vụ tham gia tố tụng theo quyết định của cơ quan điều tra, Viện kiểm sát và Toà án.\n2- Trong trường hợp cần thiết,\nviệc hỏi cung bị can tại cơ quan điều tra phải có mặt đại diện của gia đình bị\ncan. Đại diện gia đình có thể hỏi bị can nếu được điều tra viên đồng ý, được trình bày chứng cứ, đưa ra yêu cầu, khiếu nại; đọc hồ sơ vụ án khi kết thúc điều tra.\n3- Tại phiên toà xét xử phải có\nmặt đại diện của gia đình bị cáo, đại diện của nhà trường hoặc tổ chức xã hội.\nĐiều 277.\nXét xử.\n1- Thành phần Hội đồng xét xử phải có một hội thẩm nhân dân là giáo viên hoặc là cán bộ\nĐoàn thanh niên cộng sản Hồ Chí Minh.\nTrong trường hợp cần thiết, Toà\nán có thể quyết định xét xử kín.\n2- Khi xét xử, nếu thấy không cần thiết phải quyết định hình phạt đối với bị cáo thì Toà án áp dụng một trong những biện pháp tư pháp quy định tại Điều 60 Bộ luật hình sự.\nĐiều 278.\nChấp hành hình phạt tù.\n1- Người chưa thành niên phạm tội chấp hành hình phạt tù theo chế độ giam giữ riêng do pháp luật quy định.\nKhông được giam chung người chưa thành niên với người thành niên.\n2- Người chưa thành niên bị kết\nán phải được học nghề hoặc học văn hoá trong thời gian chấp hành hình phạt tù.\n3- Nếu người chưa thành niên\nđang chấp hành hình phạt tù đã đủ 18 tuổi thì phải chuyển người đó sang chế độ\ngiam người đã thành niên.\n4- Đối với người chưa thành niên\nđã chấp hành xong hình phạt tù, Ban giám thị trại giam phải phối hợp với chính quyền và tổ chức xã hội ở xã, phường, thị trấn để giúp người đó trở về sống bình thường trong xã hội.\nĐiều 279.\nChấm dứt việc chấp hành biện pháp tư pháp và giảm thời hạn chấp hành hình phạt.\nNgười chưa thành niên bị kết án có thể được chấm dứt việc chấp hành biện pháp tư pháp hoặc được giảm thời hạn chấp hành hình phạt khi có đủ các điều kiện quy định tại các Điều 61, 62 hoặc 66 Bộ luật hình sự.\nĐiều 280.\nXoá án.\nViệc xoá án\nđối với người chưa thành niên phạm tội được tiến hành theo thủ tục chung khi có\nđủ điều kiện quy định tại Điều 67 Bộ luật hình sự.\nChương 32 THỦ TỤC ÁP DỤNG BIỆN PHÁP BẮT BUỘC CHỮA BỆNH \nĐiều 281.\nĐiều kiện và thẩm quyền áp dụng biện pháp bắt buộc chữa bệnh.\n1- Khi có nghi ngờ người thực hiện hành vi nguy hiểm cho xã hội không có năng lực chịu trách nhiệm hình sự theo quy định tại Điều 12 Bộ luật hình sự thì tuỳ theo giai\nđoạn tố tụng, cơ quan điều tra, Viện kiểm sát, Toà án phải trưng cầu giám định pháp y.\nCăn cứ vào kết luận của Hội đồng giám định pháp y, Viện kiểm sát hoặc Toà án quyết định áp dụng biện pháp bắt buộc chữa bệnh.\n2- Việc áp dụng biện pháp bắt buộc chữa bệnh do Viện kiểm sát quyết định trong giai đoạn điều tra hoặc do Toà án quyết định trong giai đoạn xét xử hoặc thi hành án.\nĐiều 282.\nĐiều tra.\n1- Đối với vụ án có căn cứ quy định tại khoản 1 Điều 281 Bộ luật này, cơ quan điều tra phải làm sáng tỏ:\na) Hành vi nguy hiểm cho xã hội\nđã xảy ra;\nb) Tình trạng tâm thần và bệnh tâm thần của người có hành vi nguy hiểm cho xã hội;\nc) Người có hành vi nguy hiểm cho xã hội có mất khả năng nhận thức hoặc điều khiển hành vi của mình hay không.\n2- Khi tiến hành tố tụng, cơ\nquan điều tra phải bảo đảm có người bào chữa tham gia tố tụng từ khi xác định là người có hành vi nguy hiểm cho xã hội mắc bệnh tâm thần. Đại diện hợp pháp của người đó có thể tham gia tố tụng trong trường hợp cần thiết.\nĐiều 283.\nKết thúc điều tra.\nKhi xét kết luận điều tra, Viện kiểm sát có thể ra một trong những quyết định sau đây:\n1- Tạm đình chỉ hoặc đình chỉ vụ\nán;\n2- Đình chỉ vụ án và quyết định\náp dụng biện pháp bắt buộc chữa bệnh;\n3- Truy tố bị can trước Toà án.\nĐiều 284.\nXét xử.\n1- Toà án có thể ra một trong những quyết định sau đây:\na) Miễn trách nhiệm hình sự hoặc miễn hình phạt và áp dụng biện pháp bắt buộc chữa bệnh;\nb) Đình chỉ vụ án và áp dụng biện pháp bắt buộc chữa bệnh;\nc) Tạm đình chỉ vụ án và áp dụng biện pháp bắt buộc chữa bệnh;\nd) Trả lại hồ sơ để điều tra lại hoặc điều tra bổ sung.\n2- Ngoài quyết định áp dụng biện pháp bắt buộc chữa bệnh, Toà án có thể giải quyết vấn đề bồi thường thiệt hại hoặc vấn đề khác liên quan đến vụ án.\nĐiều 285.\nKhiếu nại, kháng nghị, kháng cáo.\n1- Khi quyết định của Viện kiểm sát về việc áp dụng biện pháp bắt buộc chữa bệnh bị khiếu nại thì vụ án phải được\nđưa ra xét xử sơ thẩm ở Toà án cùng cấp.\n2- Việc kháng nghị hoặc kháng cáo đối với quyết định của Toà án về việc áp dụng biện pháp bắt buộc chữa bệnh\nđược tiến hành như đối với bản án sơ thẩm.\n3- Quyết định áp dụng biện pháp bắt buộc chữa bệnh vẫn có hiệu lực thi hành mặc dù có khiếu nại, kháng nghị,\nkháng cáo.\nĐiều 286.\nThực hiện và đình chỉ thực hiện biện pháp bắt buộc chữa bệnh.\n1- Biện pháp bắt buộc chữa bệnh\nđược thực hiện ở một cơ sở chuyên khoa y tế do Viện kiểm sát hoặc Toà án chỉ định.\n2- Khi có báo cáo của cơ sở chữa bệnh, đơn yêu cầu của thân nhân người bị bắt buộc chữa bệnh hoặc yêu cầu của Viện kiểm sát thì trên cơ sở kết luận của Hội đồng giám định y khoa, Viện kiểm sát hoặc Toà án đã ra quyết định áp dụng biện pháp bắt buộc chữa bệnh có thể ra quyết\nđịnh đình chỉ thực hiện biện pháp bắt buộc chữa bệnh, đồng thời có thể quyết định phục hồi tố tụng đã bị tạm đình chỉ.\nBộ luật này đã được Quốc hội nước Cộng hoà xã hội chủ nghĩa Việt Nam khoá VIII, kỳ họp thứ 3 thông qua ngày 28 tháng 6 năm 1988. \nVõ\n Chí Công\n (Đã\n ký)"
}