{
  "url": "https://thuvienphapluat.vn/van-ban/Tai-nguyen-Moi-truong/Nghi-dinh-45-2023-ND-CP-huong-dan-Luat-Dau-khi-571537.aspx",
  "title": "Nghị định 45/2023/NĐ-CP hướng dẫn Luật Dầu khí mới nhất",
  "properties": {
    "Số hiệu": "45/2023/NĐ-CP",
    "Loại văn bản": "Nghị định",
    "Nơi ban hành": "Chính phủ",
    "Người ký": "Trần Hồng Hà",
    "Ngày ban hành": "01/07/2023",
    "Ngày hiệu lực": "Đã biết",
    "Ngày công báo": "Đã biết",
    "Số công báo": "Đã biết",
    "Tình trạng": "Đã biết"
  },
  "content": "CHÍNH PHỦ\n -------\nCỘNG HÒA XÃ HỘI CHỦ NGHĨA VIỆT NAM\n Độc lập - Tự do - Hạnh phúc \n ---------------\nSố: 45/2023/NĐ-CP Hà Nội, ngày 01 tháng 7 năm 2023 NGHỊ ĐỊNH QUY\nĐỊNH CHI TIẾT MỘT SỐ ĐIỀU CỦA LUẬT DẦU KHÍ\nCăn cứ Luật Tổ chức Chính phủ ngày 19 tháng 6 năm 2015; Luật sửa\nđổi, bổ sung một số điều của Luật Tổ chức Chính phủ và Luật Tổ chức chính quyền\nđịa phương ngày 22 tháng 11 năm 2019;\nCăn cứ Luật Dầu khí ngày 14 tháng 11 năm 2022;\nTheo đề nghị của Bộ trưởng Bộ Công Thương;\nChính phủ ban hành Nghị định quy định chi tiết một số điều của Luật Dầu khí.\nChương I NHỮNG QUY ĐỊNH CHUNG\nĐiều 1. Phạm vi điều chỉnh và đối tượng áp dụng 1. Nghị định này quy định chi tiết một số điều của Luật Dầu khí về điều tra cơ bản về dầu khí;\ndanh mục lô dầu khí; lựa chọn nhà thầu ký kết hợp đồng dầu khí; hợp đồng dầu khí; an toàn trong hoạt động dầu khí; hồ sơ, trình tự, thủ tục triển khai hoạt\nđộng dầu khí, dự án dầu khí; ưu đãi trong hoạt động dầu khí; khai thác tận thu mỏ, cụm mỏ, lô dầu khí; quyết toán chi phí hoạt động dầu khí, trong phạm vi đất liền, hải đảo và vùng biển của nước Cộng hòa xã hội chủ nghĩa Việt Nam.\n2. Nghị định này áp dụng đối với cơ quan, tổ chức,\ncá nhân Việt Nam và nước ngoài có liên quan đến điều tra cơ bản về dầu khí và\nhoạt động dầu khí tại Việt Nam.\nĐiều 2. Giải thích từ ngữ\nTrong Nghị định này, các từ ngữ dưới đây được hiểu như sau:\n1. Bên dự thầu là các tổ chức, cá nhân đăng ký tham dự quá trình lựa chọn nhà thầu ký kết hợp đồng dầu khí.\n2. Bộ hồ sơ điện tử là bộ hồ sơ được lập từ các văn bản điện tử của bộ hồ sơ gốc, ngoại trừ các tài liệu mật theo quy định.\n3. Bộ hồ sơ gốc bao gồm các văn bản, giấy tờ, tài liệu là bản gốc, bản chính hoặc bản sao hợp lệ. Đối với các văn bản, giấy tờ,\ntài liệu bằng tiếng nước ngoài thì bản gốc phải được thực hiện thủ tục hợp pháp hóa lãnh sự, trừ trường hợp được miễn hợp pháp hóa lãnh sự theo quy định của pháp luật Việt Nam và các điều ước quốc tế mà Việt Nam là thành viên.\n4. Cam kết công việc tối thiểu và cam kết tài chính tối thiểu là khối lượng công việc tối thiểu và số tiền tối thiểu tương ứng mà\nnhà thầu cam kết thực hiện trong thời gian cụ thể được quy định tại hợp đồng dầu khí.\n5. Hồ sơ hợp lệ là hồ sơ có đủ thành phần giấy tờ\ntheo quy định tại Luật Dầu khí và Nghị định này.\n6. Tỷ lệ chia dầu lãi, khí lãi là tỷ lệ xác định phần chia sản phẩm giữa các bên liên quan theo thang sản lượng, sau khi đã phân bổ sản phẩm để nộp thuế tài nguyên và thu hồi chi phí được thỏa thuận trong hợp đồng dầu khí.\nChương II\nĐIỀU TRA CƠ BẢN VỀ DẦU KHÍ\nĐiều 3. Xây dựng, phê duyệt danh mục đề án điều tra cơ bản về dầu khí\n1. Danh mục đề án điều tra cơ bản về dầu khí được xây dựng và phê duyệt cho giai đoạn 05 năm phù hợp với chiến lược, quy hoạch và\nkế hoạch thực hiện quy hoạch về năng lượng, tài nguyên khoáng sản; được rà soát,\ncập nhật hằng năm.\n2. Trước ngày 01 tháng 3 của năm cuối giai đoạn phát triển kinh tế - xã hội 05 năm theo Nghị quyết của Quốc hội, các tổ chức\nđáp ứng điều kiện quy định tại Điều 12 Luật Dầu khí và Điều 4 Nghị định này gửi đề xuất đề án điều tra cơ bản về dầu khí cho giai đoạn phát triển kinh tế - xã hội 05 năm tiếp theo đến Tập đoàn Dầu khí Việt Nam để xem xét, đánh giá, tổng hợp và đề xuất danh mục đề án điều tra cơ bản về dầu khí, bao gồm cả đề án do Tập đoàn Dầu khí Việt Nam và đề án do cơ\nquan nhà nước chủ trì thực hiện.\n3. Trước ngày 01 tháng 5 của năm cuối giai đoạn phát triển kinh tế - xã hội 05 năm theo Nghị quyết của Quốc hội, Tập đoàn Dầu khí Việt Nam gửi Bộ Công Thương 02 bộ hồ sơ (gồm 01 bộ hồ sơ gốc và 01 bộ hồ sơ\nbản sao, gửi trực tiếp hoặc qua bưu chính) đề xuất danh mục đề án điều tra cơ bản về dầu khí. Hồ sơ bao gồm:\na) Văn bản của Tập đoàn Dầu khí Việt Nam đề xuất danh mục đề án điều tra cơ bản về dầu khí;\nb) Văn bản của tổ chức đề xuất đề án điều tra cơ bản về dầu khí, bao gồm: các nội dung chính của đề án theo quy định tại khoản 1 Điều 10 Luật Dầu khí; tài liệu chứng minh đáp ứng đủ điều kiện thực hiện đề án theo quy định tại Điều 12 Luật Dầu khí\nvà Điều 4 Nghị định này; phương án sơ bộ phối hợp thực hiện với các tổ chức, cá nhân liên quan trong trường hợp đề án điều tra cơ bản về dầu khí được đề xuất thực hiện tại khu vực đã được giao hoặc đang thực hiện công tác điều tra cơ bản địa chất về khoáng sản, thăm dò, khai thác khoáng sản theo quy định của pháp luật về khoáng sản;\nc) Đánh giá của Tập đoàn Dầu khí Việt Nam về hồ sơ\nđề xuất của từng đề án; văn bản tiếp thu, giải trình của tổ chức đề xuất đề án\n(nếu có);\nd) Các văn bản, tài liệu khác có liên quan.\n4. Trong thời hạn 05 ngày làm việc kể từ ngày nhận\nđược hồ sơ hợp lệ, Bộ Công Thương gửi hồ sơ lấy ý kiến của Bộ Tài nguyên và Môi trường, Bộ Kế hoạch và Đầu tư, Bộ Tài chính, Bộ Quốc phòng, Bộ Ngoại giao, Bộ\nCông an, Bộ Giao thông vận tải, và các bộ, ngành, địa phương có liên quan.\n5. Trong thời hạn 15 ngày kể từ ngày nhận được hồ\nsơ lấy ý kiến của Bộ Công Thương, các bộ, ngành, địa phương phải có ý kiến bằng văn bản về nội dung thuộc phạm vi quản lý nhà nước của mình gửi Bộ Công Thương.\n6. Trong thời hạn 45 ngày kể từ ngày nhận được hồ\nsơ hợp lệ, Bộ Công Thương hoàn thành đánh giá và hoàn chỉnh danh mục đề án điều tra cơ bản về dầu khí, trình Thủ tướng Chính phủ xem xét, phê duyệt. Hồ sơ bao gồm:\na) Tờ trình Thủ tướng Chính phủ đề nghị phê duyệt danh mục đề án điều tra cơ bản về dầu khí;\nb) Hồ sơ theo quy định tại khoản 3 Điều này;\nc) Báo cáo tổng hợp tiếp thu, giải trình ý kiến của các bộ, ngành và bản sao văn bản góp ý của các bộ, ngành.\n7. Căn cứ danh mục đề án điều tra cơ bản về dầu khí\nđã được Thủ tướng Chính phủ phê duyệt:\na) Bộ Công Thương thông báo đến cơ quan, tổ chức chủ\ntrì thực hiện đề án điều tra cơ bản về dầu khí để lập và trình đề cương chi tiết và dự toán chi phí thực hiện đề án theo quy định tại Điều 5 Nghị\nđịnh này, đồng thời thông báo đến Tập đoàn Dầu khí Việt Nam;\nb) Bộ Tài chính chủ trì tổng hợp phần kinh phí thực hiện các đề án điều tra cơ bản về dầu khí sử dụng vốn ngân sách nhà nước vào dự\ntoán ngân sách nhà nước hằng năm, báo cáo Chính phủ trình Quốc hội theo quy định của Luật Ngân sách nhà nước.\n8. Hằng năm, Tập đoàn Dầu khí Việt Nam rà soát danh mục đề án điều tra cơ bản về dầu khí và tình hình triển khai thực hiện từng đề\nán để báo cáo Bộ Công Thương, trình Thủ tướng Chính phủ phê duyệt điều chỉnh danh mục đề án điều tra cơ bản về dầu khí (nếu cần thiết). Hồ sơ, trình tự, thủ\ntục thẩm định và phê duyệt điều chỉnh danh mục đề án điều tra cơ bản về dầu khí\nđược thực hiện theo quy định tại các khoản 3, 4, 5 và 6 Điều này.\nĐiều 4. Điều kiện của tổ chức chủ trì thực hiện điều tra cơ bản về dầu khí\nTổ chức chủ trì thực hiện điều tra cơ bản về dầu khí\nphải có đủ năng lực tài chính, kỹ thuật và kinh nghiệm trong điều tra cơ bản về\ndầu khí, đáp ứng các điều kiện sau:\n1. Chứng minh đủ năng lực tài chính để thực hiện đề\nán điều tra cơ bản về dầu khí theo một hoặc đồng thời các hình thức sau:\na) Tự thu xếp bằng nguồn lực của tổ chức hoặc bảo lãnh của công ty mẹ;\nb) Bảo lãnh hoặc cam kết tài trợ, cấp vốn của tổ chức tín dụng, tổ chức tài chính.\n2. Có phương án huy động máy móc, thiết bị, nhân lực\nđáp ứng yêu cầu kỹ thuật thực hiện đề án.\n3. Đã tham gia ít nhất 01 đề án điều tra cơ bản về\ndầu khí hoặc 01 đề án điều tra cơ bản địa chất về khoáng sản hoặc 01 hợp đồng dầu khí.\n4. Có cam kết thực hiện các yêu cầu về quốc phòng,\nan ninh theo quy định của pháp luật và không đang trong thời gian bị cấm hoạt động trong điều tra cơ bản về dầu khí và hoạt động dầu khí.\nĐiều 5. Hồ sơ, trình tự, thủ tục thẩm định và phê duyệt đề cương chi tiết và dự toán chi phí đề án điều tra cơ bản về dầu khí\n1. Đề cương chi tiết và dự toán chi phí của đề án\nđiều tra cơ bản về dầu khí bao gồm các nội dung chính sau đây:\na) Cơ sở pháp lý và luận cứ khoa học của việc lập đề\nán;\nb) Khu vực thực hiện điều tra (vị trí địa lý, tọa độ,\ndiện tích điều tra);\nc) Đặc điểm địa lý tự nhiên, kinh tế - xã hội khu vực\nđiều tra;\nd) Cơ sở tài liệu kỹ thuật để lập đề án;\nđ) Đối tượng, mục tiêu, nhiệm vụ của đề án;\ne) Phương pháp kỹ thuật và khối lượng công việc dự\nkiến thực hiện; tiêu chuẩn, quy chuẩn kỹ thuật, định mức kinh tế, kỹ thuật (nếu có) dự kiến áp dụng trong thực hiện đề án;\ng) Dự kiến kết quả sẽ đạt được và sản phẩm sau khi kết thúc đề án;\nh) Kế hoạch và tiến độ thực hiện;\ni) Nguồn kinh phí và dự toán chi phí;\nk) Phương án phối hợp thực hiện với các tổ chức, cá\nnhân liên quan trong trường hợp đề án điều tra cơ bản về dầu khí được đề xuất thực hiện tại khu vực đã được giao hoặc đang thực hiện công tác điều tra cơ bản\nđịa chất về khoáng sản, thăm dò, khai thác khoáng sản theo quy định của pháp luật về khoáng sản.\nl) Nội dung khác (nếu có).\n2. Trong thời hạn 60 ngày kể từ ngày nhận được thông báo của Bộ Công Thương theo quy định tại điểm a khoản 7 Điều 3 Nghị định này, trên cơ sở đề cương chi tiết và dự toán chi phí của đề án\nđiều tra cơ bản về dầu khí do tổ chức chủ trì thực hiện đề án lập và được Tập\nđoàn Dầu khí Việt Nam cho ý kiến, tổ chức chủ trì thực hiện đề án điều tra cơ bản về dầu khí trình Bộ Công Thương 02 bộ hồ sơ (gồm 01 bộ hồ sơ gốc và 01 bộ hồ sơ\nbản sao, gửi trực tiếp hoặc qua bưu chính) đề nghị phê duyệt đề cương chi tiết và dự toán chi phí đề án. Hồ sơ bao gồm:\na) Văn bản đề nghị phê duyệt đề cương chi tiết và dự\ntoán chi phí đề án điều tra cơ bản về dầu khí;\nb) Đề cương chi tiết và dự toán chi phí của đề án theo quy định tại khoản 1 Điều này; các phụ lục, bản vẽ, các tài liệu kèm theo\n(nếu có);\nc) Văn bản thông báo của Bộ Công Thương gửi tổ chức chủ trì thực hiện đề án điều tra cơ bản về dầu khí;\nd) Văn bản xác định nguồn vốn cho đề án trong trường hợp kinh phí thực hiện đề án điều tra cơ bản về dầu khí sử dụng ngân sách nhà\nnước phù hợp với nguyên tắc, tiêu chí, định mức phân bổ trong từng giai đoạn được cơ quan có thẩm quyền phê duyệt;\nđ) Ý kiến của Tập đoàn Dầu khí Việt Nam về đề cương chi tiết và dự toán chi phí đề án điều tra cơ bản về dầu khí do tổ chức chủ trì\nthực hiện đề án lập; văn bản tiếp thu, giải trình của tổ chức chủ trì thực hiện\nđề án (nếu có);\ne) Dự thảo thỏa thuận giữa Tập đoàn Dầu khí Việt Nam với tổ chức ngoài cơ quan, doanh nghiệp nhà nước chủ trì thực hiện đề án nếu thuộc trường hợp quy định tại điểm b khoản 3 Điều 10 Luật Dầu khí, bao gồm các nội dung chính: khu vực thực hiện điều tra; quyền và nghĩa vụ của Tập đoàn Dầu khí Việt Nam và tổ chức trong quá trình thực hiện đề án;\ncam kết của tổ chức về việc lưu giữ, bảo quản mẫu vật, tài liệu, thông tin, dữ\nliệu, trong quá trình thực hiện đề án; các điều khoản chung của thỏa thuận;\ng) Các văn bản, tài liệu khác có liên quan.\n3. Việc thẩm định đề cương chi tiết và dự toán chi phí đề án điều tra cơ bản về dầu khí được thực hiện theo hình thức hội đồng thẩm\nđịnh. Bộ trưởng Bộ Công Thương ban hành quyết định thành lập và quy chế hoạt động của hội đồng thẩm định (bao gồm đại diện các bộ, ngành liên quan) và tổ chuyên viên giúp việc hội đồng thẩm định.\n4. Trong thời hạn 45 ngày kể từ ngày nhận được hồ\nsơ hợp lệ, hội đồng thẩm định hoàn thành thẩm định đề cương chi tiết và dự toán chi phí đề án điều tra cơ bản về dầu khí, trình Bộ trưởng Bộ Công Thương xem xét, phê duyệt.\n5. Trong thời hạn 05 ngày làm việc kể từ ngày nhận\nđược văn bản thẩm định của hội đồng thẩm định, Bộ trưởng Bộ Công Thương ban hành quyết định phê duyệt đề cương chi tiết và dự toán chi phí đề án điều tra cơ bản về dầu khí.\nĐiều 6. Triển khai thực hiện đề\nán điều tra cơ bản về dầu khí\n1. Tổ chức chủ trì thực hiện đề án điều tra cơ bản về dầu khí có trách nhiệm:\na) Thực hiện đúng đề án đã được phê duyệt;\nb) Thông báo bằng văn bản tới Bộ Công Thương, Bộ\nTài nguyên và Môi trường, Bộ Giao thông vận tải, Bộ Quốc phòng, Bộ Công an, Bộ\nNgoại giao, Ủy ban nhân dân cấp tỉnh liên quan và Tập đoàn Dầu khí Việt Nam ít nhất 15 ngày trước khi thực hiện hạng mục công việc tại thực địa.\n2. Trong quá trình thực hiện điều tra cơ bản về dầu khí nếu phát hiện thấy các tài nguyên, khoáng sản khác thì tổ chức, cá nhân phải có ngay báo cáo bằng văn bản gửi Bộ Công Thương, Bộ Tài nguyên và Môi trường, Ủy ban nhân dân cấp tỉnh nơi tiến hành công việc và Tập đoàn Dầu khí Việt Nam; bảo vệ khoáng sản chưa khai thác theo quy định của pháp luật về khoáng sản, nghiêm cấm hành vi lợi dụng điều tra cơ bản về dầu khí để khai thác khoáng sản.\n3. Trong quá trình thực hiện đề án điều tra cơ bản về dầu khí, tổ chức chủ trì thực hiện đề án có thể đề nghị điều chỉnh đề cương chi tiết và dự toán chi phí của đề án phù hợp với tình hình thực tế khi triển khai thực địa. Tổ chức chủ trì thực hiện đề án có văn bản đề xuất điều chỉnh đề\ncương chi tiết và dự toán chi phí của đề án, trong đó nêu rõ tiến độ và khối lượng công việc đã thực hiện, lý do và nội dung đề xuất điều chỉnh đề án, gửi Tập\nđoàn Dầu khí Việt Nam xem xét, đánh giá và báo cáo Bộ Công Thương phê duyệt theo quy trình tương tự được quy định tại các khoản 3, 4 và 5 Điều 5 Nghị định này.\nĐiều 7. Kiểm tra, giám sát việc thực hiện đề án điều tra cơ bản về dầu khí\n1. Hằng quý (trước ngày làm việc cuối cùng của tháng cuối quý) hoặc đột xuất theo yêu cầu của Bộ Công Thương, tổ chức chủ trì\nthực hiện đề án điều tra cơ bản về dầu khí có trách nhiệm gửi báo cáo bằng văn bản về tình hình triển khai đề án đến Bộ Công Thương và Tập đoàn Dầu khí Việt Nam phục vụ công tác giám sát.\n2. Bộ Công Thương chủ trì phối hợp với các bộ,\nngành, địa phương có liên quan và Tập đoàn Dầu khí Việt Nam hoặc giao cho Tập\nđoàn Dầu khí Việt Nam chủ trì kiểm tra tình hình thực hiện đề án điều tra cơ bản về dầu khí theo kế hoạch và nội dung kiểm tra do Bộ trưởng Bộ Công Thương phê\nduyệt.\n3. Tập đoàn Dầu khí Việt Nam có trách nhiệm phối hợp với cơ quan, đơn vị chức năng của các bộ, ngành, địa phương có liên quan triển khai công tác giám sát trên thực địa đối với các đề án điều tra cơ bản về dầu khí.\nĐiều 8. Nghiệm thu, phê duyệt kết quả thực hiện đề án điều tra cơ bản về dầu khí\n1. Công tác nghiệm thu kết quả thực hiện đề án điều tra cơ bản về dầu khí bao gồm các nội dung chính sau:\na) Đánh giá khối lượng, chất lượng, tiến độ thực hiện các hạng mục công việc theo đề cương chi tiết được phê duyệt;\nb) Đánh giá việc tuân thủ các quy định kỹ thuật,\ntính trung thực trong việc thu thập, thành lập tài liệu; tính đúng đắn, khoa học trong việc phân tích, xử lý và tổng hợp số liệu;\nc) Đánh giá mức độ tin cậy của các kết quả điều tra; các phát hiện mới về địa chất dầu khí (nếu có); các kết luận về đặc điểm địa chất, địa vật lý và các đặc điểm kỹ thuật khác của đối tượng điều tra;\nd) Đánh giá việc thực hiện các chế độ tài chính và\ncác quy định, định mức kinh tế, kỹ thuật, đơn giá hiện hành;\nđ) Thẩm định nội dung chi từ nguồn ngân sách nhà nước\n(nếu có), nội dung chi của Tập đoàn Dầu khí Việt Nam (nếu có);\ne) Đánh giá việc thực hiện thỏa thuận giữa Tập đoàn Dầu khí Việt Nam và tổ chức ngoài cơ quan, doanh nghiệp nhà nước chủ trì thực hiện đề án nếu thuộc trường hợp quy định tại điểm b khoản 3 Điều 10 Luật Dầu khí.\n2. Nghiệm thu kết quả thực hiện đề án điều tra cơ bản về dầu khí được chia làm hai cấp, gồm nghiệm thu cấp cơ sở và nghiệm thu cấp bộ,\ncụ thể:\na) Nghiệm thu cấp cơ sở do tổ chức chủ trì thực hiện\nđề án điều tra cơ bản về dầu khí thực hiện;\nb) Nghiệm thu cấp bộ do Bộ Công Thương tiến hành sau khi có kết quả nghiệm thu cấp cơ sở. Hội đồng nghiệm thu cấp bộ do Bộ trưởng Bộ Công Thương quyết định thành lập. Kết quả nghiệm thu cấp bộ là cơ sở để phê\nduyệt kết quả thực hiện đề án điều tra cơ bản về dầu khí.\n3. Trong thời hạn 30 ngày kể từ ngày kết thúc đề án\nđiều tra cơ bản về dầu khí, tổ chức chủ trì thực hiện đề án tổ chức nghiệm thu cấp cơ sở.\n4. Trong thời hạn 45 ngày kể từ ngày hoàn thành nghiệm thu cấp cơ sở, sau khi lấy ý kiến của Tập đoàn Dầu khí Việt Nam về kết quả thực hiện đề án điều tra cơ bản về dầu khí, tổ chức chủ trì thực hiện đề án\nđiều tra cơ bản về dầu khí trình Bộ Công Thương 02 bộ hồ sơ (gồm 01 bộ hồ sơ gốc và 01 bộ hồ sơ bản sao, gửi trực tiếp hoặc qua bưu chính) đề nghị nghiệm thu cấp bộ và phê duyệt kết quả thực hiện đề án điều tra cơ bản về dầu khí. Hồ sơ bao gồm:\na) Văn bản đề nghị nghiệm thu cấp bộ và phê duyệt kết quả thực hiện đề án điều tra cơ bản về dầu khí;\nb) Báo cáo kết quả đề án; phụ lục, bản vẽ và các tài liệu khác kèm theo.\nc) Báo cáo tóm tắt kết quả đề án;\nd) Báo cáo thẩm tra của tư vấn do tổ chức chủ trì\nthuê thực hiện (nếu cần thiết);\nđ) Biên bản nghiệm thu cấp cơ sở;\ne) Ý kiến của Tập đoàn Dầu khí Việt Nam về kết quả\nthực hiện đề án điều tra cơ bản về dầu khí; văn bản tiếp thu, giải trình của tổ\nchức chủ trì thực hiện đề án (nếu có);\ng) Quyết định phê duyệt hoặc phê duyệt điều chỉnh đề\nán của cơ quan có thẩm quyền;\nh) Các văn bản, tài liệu khác có liên quan.\n5. Trong thời hạn 45 ngày kể từ ngày nhận được hồ\nsơ hợp lệ, Bộ Công Thương hoàn thành công tác nghiệm thu cấp bộ và phê duyệt kết quả đề án điều tra cơ bản về dầu khí.\n6. Trong thời hạn 180 ngày kể từ ngày nhận được văn bản phê duyệt kết quả thực hiện đề án điều tra cơ bản về dầu khí, tổ chức chủ\ntrì thực hiện đề án điều tra cơ bản về dầu khí hoàn thành quyết toán chi phí thực hiện đề án điều tra cơ bản về dầu khí theo quy định; gửi Bộ Công Thương kết quả\nquyết toán nội dung chi từ nguồn ngân sách nhà nước (nếu có), nội dung chi của Tập đoàn Dầu khí Việt Nam (nếu có) để xem xét, phê duyệt.\nĐiều 9. Giao nộp kết quả điều tra cơ bản về dầu khí\n1. Trong thời hạn 60 ngày kể từ ngày nhận được văn bản phê duyệt kết quả đề án điều tra cơ bản về dầu khí, tổ chức chủ trì thực hiện\nđề án điều tra cơ bản về dầu khí có trách nhiệm chuyển mẫu vật (nếu có) về Tập\nđoàn Dầu khí Việt Nam để lưu giữ và bảo quản, đồng thời, nộp 01 bộ hồ sơ bản giấy và 01 bộ hồ sơ điện tử (không bao gồm các tài liệu mật theo quy định, nếu có)\nbáo cáo kết quả điều tra cơ bản về dầu khí đến Bộ Công Thương, Bộ Tài nguyên và\nMôi trường và Tập đoàn Dầu khí Việt Nam, bao gồm tài liệu tổng hợp và tài liệu nguyên thủy, cụ thể:\na) Tài liệu tổng hợp gồm: thuyết minh và các tài liệu tổng hợp được trình bày dưới dạng phụ lục, bản đồ, ảnh minh họa thể hiện đầy đủ\ncác kết quả thực hiện;\nb) Tài liệu nguyên thủy là các loại tài liệu được thu thập tại thực địa, bao gồm: các loại nhật ký, sổ thực địa, các loại bản đồ,\nsơ đồ, ảnh chụp, băng từ ghi nhận địa chấn, đĩa; các kết quả đo đạc.\n2. Trong thời hạn 60 ngày kể từ ngày nhận được hồ\nsơ nộp báo cáo kết quả điều tra cơ bản về dầu khí, Bộ Tài nguyên và Môi trường có trách nhiệm cập nhật các thông tin, kết quả điều tra cơ bản về dầu khí vào hệ\nthống cơ sở dữ liệu thông tin quốc gia về địa chất và khoáng sản (trừ các thông tin được yêu cầu quản lý theo chế độ mật).\nĐiều 10. Bảo quản mẫu vật, tài liệu, thông tin, dữ liệu kết quả điều tra cơ bản về dầu khí\n1. Thời hạn lưu giữ, bảo quản mẫu vật, tài liệu,\nthông tin dữ liệu được xác lập đối với từng loại theo quy định hiện hành: lưu giữ, bảo quản vĩnh viễn hoặc lưu giữ, bảo quản có thời hạn. Cơ quan lưu giữ, bảo quản có trách nhiệm thống kê các loại mẫu vật, tài liệu, thông tin, dữ liệu hết giá trị sử dụng trình cơ quan có thẩm quyền phê duyệt để hủy bỏ nhằm tối ưu chi phí quản lý.\n2. Mẫu vật, tài liệu, thông tin, dữ liệu được phân loại theo cấp độ mật (nếu có yêu cầu) và có chính sách bảo vệ an toàn thông tin cho từng loại tương ứng phù hợp với các quy định của pháp luật.\n3. Tập đoàn Dầu khí Việt Nam có trách nhiệm tiếp nhận,\nquản lý các mẫu vật, tài liệu do các tổ chức chủ trì thực hiện đề án điều tra cơ bản về dầu khí giao nộp theo quy định tại khoản 1 Điều 14 Luật Dầu khí và tổ chức vận hành hệ thống để có thể khai thác thông tin, tài liệu\nđã tiếp nhận phù hợp với các quy định của pháp luật.\nĐiều 11. Khai thác, sử dụng mẫu vật, tài liệu, thông tin, dữ liệu và báo cáo kết quả điều tra cơ bản về dầu khí\n1. Các tổ chức, cá nhân được tiếp cận, tham khảo,\nkhai thác và sử dụng mẫu vật, tài liệu, thông tin, dữ liệu, báo cáo kết quả điều tra cơ bản về dầu khí dưới hình thức dịch vụ công với mức phí khai thác và sử dụng tài liệu dầu khí theo quy định của pháp luật về phí và lệ phí, trừ quy định tại khoản 2 Điều này.\n2. Các tổ chức chủ trì thực hiện đề án điều tra cơ\nbản về dầu khí thông qua thỏa thuận ký với Tập đoàn Dầu khí Việt Nam được phép sử dụng, khai thác mẫu vật, tài liệu, thông tin, dữ liệu và báo cáo kết quả điều tra cơ bản về dầu khí theo thỏa thuận đã ký; được đề xuất thu hồi chi phí khi tham gia đấu thầu, ký kết hợp đồng dầu khí tại lô dầu khí trong khu vực đã thực hiện điều tra cơ bản theo đề án.\nChương III DANH MỤC LÔ DẦU KHÍ, LỰA CHỌN NHÀ THẦU ĐỂ KÝ KẾT HỢP ĐỒNG DẦU KHÍ\nĐiều 12. Hồ sơ, trình tự, thủ\ntục thẩm định và phê duyệt danh mục các lô dầu khí\n1. Căn cứ quy định tại Điều 7 Luật Dầu khí, Tập đoàn Dầu khí Việt Nam xây dựng danh mục các lô dầu khí mới hoặc danh mục điều chỉnh các lô dầu khí, trình Bộ Công Thương 02 bộ hồ sơ (gồm 01 bộ\nhồ sơ gốc và 01 bộ hồ sơ bản sao, gửi trực tiếp hoặc qua bưu chính) để thẩm định.\nHồ sơ bao gồm:\na) Tờ trình đề nghị phê duyệt danh mục các lô dầu khí mới hoặc danh mục điều chỉnh các lô dầu khí;\nb) Thông tin về các lô dầu khí mới được hình thành hoặc về việc điều chỉnh các lô dầu khí, bao gồm tên, tọa độ, diện tích;\nc) Các văn bản, tài liệu khác có liên quan.\n2. Trong thời hạn 05 ngày làm việc kể từ ngày nhận\nđược hồ sơ hợp lệ, Bộ Công Thương gửi hồ sơ lấy ý kiến của Bộ Tài nguyên và Môi trường, Bộ Kế hoạch và Đầu tư, Bộ Tư pháp, Bộ Quốc phòng, Bộ Ngoại giao, Bộ\nCông an, Bộ Giao thông vận tải, Bộ Xây dựng và các bộ, ngành, địa phương có\nliên quan.\n3. Trong thời hạn 15 ngày kể từ ngày nhận được hồ\nsơ lấy ý kiến của Bộ Công Thương, các bộ, ngành, địa phương phải có ý kiến bằng văn bản về nội dung thuộc phạm vi quản lý nhà nước của mình gửi Bộ Công Thương.\n4. Trong thời hạn 45 ngày kể từ ngày nhận được hồ\nsơ hợp lệ, Bộ Công Thương hoàn thành thẩm định và hoàn chỉnh danh mục các lô dầu khí mới hoặc danh mục các lô dầu khí điều chỉnh, trình Thủ tướng Chính phủ xem xét, phê duyệt. Hồ sơ bao gồm:\na) Tờ trình Thủ tướng Chính phủ về kết quả thẩm định và đề nghị phê duyệt danh mục các lô dầu khí mới hoặc danh mục điều chỉnh các lô dầu khí;\nb) Hồ sơ theo quy định tại khoản 1 Điều này;\nc) Báo cáo tổng hợp tiếp thu, giải trình ý kiến của các bộ, ngành và bản sao văn bản góp ý của các bộ, ngành.\nĐiều 13. Hồ sơ, trình tự, thủ\ntục thẩm định và phê duyệt kế hoạch lựa chọn nhà thầu để ký hợp đồng dầu khí\n1. Căn cứ quy định tại điểm a khoản 1 Điều 24 Luật Dầu khí, Tập đoàn Dầu khí Việt Nam lập kế hoạch lựa chọn nhà\nthầu để ký hợp đồng dầu khí, trình Bộ Công Thương 02 bộ hồ sơ (gồm 01 bộ hồ sơ\ngốc và 01 bộ hồ sơ bản sao, gửi trực tiếp hoặc qua bưu chính) để thẩm định. Hồ\nsơ bao gồm:\na) Tờ trình đề nghị phê duyệt kế hoạch lựa chọn nhà\nthầu để ký hợp đồng dầu khí;\nb) Kế hoạch lựa chọn nhà thầu để ký hợp đồng dầu khí, bao gồm các nội dung chính được quy định tại khoản 2 Điều 17 Luật Dầu khí và lý do đề xuất hình thức lựa chọn nhà thầu tương ứng đối với từng lô dầu khí mở; danh sách nhà thầu đề xuất mời tham dự thầu đối với hình thức đấu thầu hạn chế hoặc chào thầu cạnh tranh; loại hợp đồng dầu khí áp dụng và lý do đề xuất loại hợp đồng dầu khí đó; điều kiện về năng lực tài chính, kỹ thuật và kinh nghiệm để được tham dự thầu; dự thảo hồ sơ mời thầu, hồ\nsơ mời chào thầu cạnh tranh, hồ sơ yêu cầu chỉ định thầu theo quy định tại các điểm a và b khoản 1 Điều 21 Luật Dầu khí;\nc) Các văn bản, tài liệu khác có liên quan.\n2. Nội dung thẩm định kế hoạch lựa chọn nhà thầu để\nký hợp đồng dầu khí là kiểm tra, đánh giá các nội dung chính của kế hoạch lựa chọn nhà thầu quy định tại khoản 2 Điều 17 Luật Dầu khí.\n3. Trong thời hạn 05 ngày làm việc kể từ ngày nhận\nđược hồ sơ hợp lệ, Bộ Công Thương gửi hồ sơ lấy ý kiến của Bộ Kế hoạch và Đầu tư, Bộ Tài chính, Bộ Tư pháp, Bộ Quốc phòng, Bộ Ngoại giao, Bộ Công an và các bộ,\nngành có liên quan.\n4. Trong thời hạn 15 ngày kể từ ngày nhận được hồ\nsơ lấy ý kiến của Bộ Công Thương, các bộ, ngành phải có ý kiến bằng văn bản về\nnội dung thuộc phạm vi quản lý nhà nước của mình gửi Bộ Công Thương.\n5. Trong thời hạn 45 ngày kể từ ngày nhận được hồ\nsơ hợp lệ, Bộ Công Thương hoàn thành thẩm định kế hoạch lựa chọn nhà thầu để ký\nhợp đồng dầu khí, trình Thủ tướng Chính phủ xem xét, phê duyệt. Hồ sơ bao gồm:\na) Tờ trình Thủ tướng Chính phủ về kết quả thẩm định và đề nghị phê duyệt kế hoạch lựa chọn nhà thầu để ký hợp đồng dầu khí;\nb) Hồ sơ theo quy định tại khoản 1 Điều này;\nc) Báo cáo tổng hợp tiếp thu, giải trình ý kiến của các bộ, ngành và bản sao văn bản góp ý của các bộ, ngành.\n6. Điều này không áp dụng cho trường hợp chỉ định thầu theo quy định tại khoản 2 Điều 40 Luật Dầu khí.\nĐiều 14. Thông báo mời thầu, mời chào thầu cạnh tranh 1. Thông báo mời thầu được đăng liên tục trong 05 ngày liên tiếp trên 05 báo phát hành hằng ngày và được đăng tải trên 05 trang mạng thông tin có uy tín, trong đó phải có ít nhất 01 báo phát hành bằng tiếng Anh\nđăng tải trên mạng thông tin trong nước hoặc nước ngoài bằng tiếng Việt và tiếng Anh. Thông báo mời thầu cũng có thể được gửi trực tiếp cho các tổ chức, cá nhân quan tâm đến các lô dầu khí trong danh sách mời thầu hoặc trên các trang mạng chuyên cung cấp thông tin về các sự kiện dầu khí trên thế giới.\n2. Thông báo mời chào thầu cạnh tranh được gửi trực tiếp cho các tổ chức, cá nhân quan tâm đến lô dầu khí được áp dụng hình thức chào thầu cạnh tranh.\n3. Thông báo mời thầu, chào thầu cạnh tranh bao gồm các nội dung sau:\na) Thông tin về lô dầu khí mở mời thầu hoặc mời chào thầu cạnh tranh;\nb) Danh mục các tài liệu được phép tiếp cận và các thông tin khác có liên quan;\nc) Thời gian tham khảo tài liệu;\nd) Hồ sơ, biểu mẫu liên quan (nếu có).\nĐiều 15. Đăng ký dự thầu 1. Bên dự thầu gửi đăng ký dự thầu đến Tập đoàn Dầu khí Việt Nam. Thời hạn đăng ký không quá 45 ngày, kể từ ngày cuối cùng đăng thông báo mời thầu hoặc kể từ ngày cuối cùng thông báo mời chào thầu cạnh tranh.\n2. Khi đăng ký dự thầu, bên dự thầu phải cung cấp thông tin tóm tắt về năng lực tài chính, năng lực kỹ thuật, dự kiến về việc hình thành liên danh nhà thầu (nếu có) và các thông tin khác theo yêu cầu tại thông báo mời thầu hoặc chào thầu cạnh tranh.\n3. Sau khi nhận được đăng ký dự thầu, nếu đáp ứng yêu cầu tại Điều 16 Luật Dầu khí, bên dự thầu được nhận hồ\nsơ mời thầu hoặc hồ sơ mời chào thầu cạnh tranh và được quyền tiếp cận các tài liệu theo danh mục đã công bố trong thông báo mời thầu hoặc mời chào thầu cạnh tranh.\nĐiều 16. Phát hành hồ sơ mời thầu, hồ sơ mời chào thầu cạnh tranh, hồ sơ yêu cầu 1. Tập đoàn Dầu khí Việt Nam chuẩn bị hồ sơ mời thầu\nđối với hình thức đấu thầu rộng rãi, đấu thầu hạn chế hoặc hồ sơ chào thầu cạnh tranh đối với hình thức chào thầu cạnh tranh hoặc hồ sơ yêu cầu đối với hình thức chỉ định thầu và phát hành cho các bên dự thầu.\n2. Nội dung hồ sơ mời thầu bao gồm:\na) Các chỉ tiêu kinh tế, kỹ thuật cơ bản của hợp đồng dầu khí, bao gồm: tỷ lệ chia dầu lãi, khí lãi; cam kết công việc tối thiểu và\ncam kết tài chính tối thiểu; tỷ lệ quyền lợi tham gia của Tập đoàn Dầu khí Việt Nam hoặc công ty chi nhánh thuộc Tập đoàn Dầu khí Việt Nam được chỉ định tham gia với tư cách là nhà thầu; quyền tham gia của nước chủ nhà (thông qua Tập\nđoàn Dầu khí Việt Nam) khi có phát hiện thương mại đầu tiên trong diện tích hợp\nđồng dầu khí (nếu áp dụng); tỷ lệ thu hồi chi phí; cam kết về các nghĩa vụ tài chính khác (các loại hoa hồng, chi phí đào tạo, đóng góp quỹ nghiên cứu khoa học và phát triển công nghệ dầu khí); thuế tài nguyên, thuế thu nhập doanh nghiệp,\nthuế xuất khẩu dầu thô (bao gồm cả condensate) và khí thiên nhiên, các loại thuế,\nphí, lệ phí phải nộp khác theo quy định của pháp luật về thuế, phí, lệ phí;\nb) Yêu cầu về năng lực tài chính, kỹ thuật, kinh nghiệm triển khai hoạt động dầu khí và văn bản về việc hình thành liên danh nhà\nthầu (nếu có);\nc) Tiêu chí lựa chọn nhà thầu và phương pháp đánh giá hồ sơ dự thầu theo quy định tại Điều 18 Nghị định này;\nd) Thời gian tiến hành quá trình lựa chọn nhà thầu và các chi tiết khác về thủ tục lựa chọn nhà thầu;\nđ) Tài liệu, thông tin cơ bản về lô dầu khí;\ne) Yêu cầu các tài liệu pháp lý của bên dự thầu: giấy chứng nhận đăng ký hoạt động, điều lệ hoạt động, báo cáo tài chính 03 năm gần nhất hoặc bảo lãnh của công ty mẹ của bên dự thầu là tổ chức; căn cước công dân hoặc hộ chiếu đối với bên dự thầu là cá nhân và các tài liệu khác có liên quan của bên dự thầu hoặc từng bên tham gia trong liên danh tham dự thầu (ngoại trừ\ntrường hợp lựa chọn nhà thầu ký kết hợp đồng dầu khí theo quy định tại Điều 40 Luật Dầu khí);\ng) Hướng dẫn đối với bên dự thầu;\nh) Mẫu hợp đồng dầu khí đang có hiệu lực hoặc đề xuất\náp dụng;\ni) Yêu cầu về bảo đảm dự thầu (nếu cần thiết) theo mẫu, bao gồm các nội dung về hình thức, giá trị và thời hạn của bảo đảm dự thầu;\nk) Đánh giá ban đầu về tiềm năng dầu khí của lô dầu khí liên quan;\nl) Các văn bản, tài liệu khác có liên quan.\n3. Nội dung hồ sơ mời chào thầu cạnh tranh bao gồm các nội dung quy định tại các điểm a, b, c, đ, e, g, h, i, k, l khoản 2 Điều này.\n4. Nội dung hồ sơ yêu cầu chỉ định thầu bao gồm các nội dung quy định tại các điểm a, b, c, đ, e, g, h, i, k, l khoản 2 Điều này và\ncác nội dung chuyển tiếp từ hợp đồng dầu khí đang triển khai sang hợp đồng dầu khí mới (nếu có) đối với trường hợp chỉ định thầu theo quy định tại điểm c khoản 1 Điều 21 Luật Dầu khí.\nĐiều 17. Nhận hồ sơ dự thầu, hồ\nsơ chào thầu cạnh tranh, hồ sơ đề xuất; mở thầu và quản lý hồ sơ dự thầu 1. Bên dự thầu gửi hồ sơ dự thầu đối với hình thức\nđấu thầu rộng rãi, đấu thầu hạn chế hoặc hồ sơ chào thầu cạnh tranh đối với hình thức chào thầu cạnh tranh hoặc hồ sơ đề xuất đối với hình thức chỉ định thầu\nđến Tập đoàn Dầu khí Việt Nam trong thời hạn được ghi trong hồ sơ mời thầu hoặc hồ sơ mời chào thầu cạnh tranh hoặc hồ sơ yêu cầu. Tập đoàn Dầu khí Việt Nam quyết định thời hạn nộp hồ sơ dự thầu hoặc hồ sơ chào thầu cạnh tranh hoặc hồ\nsơ đề xuất và quy định cụ thể trong thông báo mời tham gia nhưng không quá 120 ngày, kể từ ngày phát hành hồ sơ mời thầu hoặc hồ sơ mời chào thầu cạnh tranh hoặc hồ sơ yêu cầu.\n2. Yêu cầu đối với hồ sơ dự thầu hoặc hồ sơ chào thầu cạnh tranh hoặc hồ sơ đề xuất a) Được lập theo quy định tại hồ sơ mời thầu, hồ sơ\nmời chào thầu cạnh tranh, hồ sơ yêu cầu;\nb) Được coi là hợp lệ khi đáp ứng đầy đủ những yêu cầu tương ứng của hồ sơ mời thầu hoặc hồ sơ mời chào thầu cạnh tranh hoặc hồ sơ\nyêu cầu, nộp đúng thời gian và cách thức đã được quy định.\n3. Mở thầu và quản lý hồ sơ dự thầu hoặc hồ sơ chào thầu cạnh tranh hoặc hồ sơ đề xuất a) Việc tổ chức mở thầu phải đúng thời gian và cách thức quy định trong hồ sơ mời thầu hoặc hồ sơ mời chào thầu cạnh tranh hoặc hồ\nsơ yêu cầu;\nb) Thành phần tham dự mở thầu bao gồm đại diện Tập\nđoàn Dầu khí Việt Nam, Bộ Công Thương, Bộ Công an và các bộ, ngành có liên quan\n(nếu cần thiết), đại diện bên dự thầu;\nc) Hồ sơ dự thầu hoặc hồ sơ chào thầu cạnh tranh hoặc hồ sơ đề xuất sau khi được mở phải được quản lý theo chế độ mật theo quy định của pháp luật về bảo vệ bí mật nhà nước trong suốt quá trình lựa chọn nhà thầu;\nd) Sau thời điểm mở thầu, việc bổ sung tài liệu của bên dự thầu đối với hồ sơ dự thầu hoặc hồ sơ chào thầu cạnh tranh hoặc hồ sơ đề\nxuất không có giá trị pháp lý, trừ trường hợp tài liệu bổ sung theo quy định tại khoản 3 Điều 19 Nghị định này.\nĐiều 18. Tiêu chí lựa chọn nhà\nthầu và phương pháp đánh giá hồ sơ dự thầu, hồ sơ chào thầu cạnh tranh, hồ sơ đề\nxuất 1. Tiêu chí lựa chọn nhà thầu bao gồm:\na) Tiêu chí về năng lực, kinh nghiệm của nhà thầu bao gồm: năng lực kỹ thuật, tài chính, khả năng thu xếp vốn để triển khai hoạt\nđộng dầu khí; kinh nghiệm thực hiện các hoạt động dầu khí, hợp đồng dầu khí\n(trường hợp liên danh, năng lực, kinh nghiệm của nhà thầu được xác định bằng tổng năng lực, kinh nghiệm của các thành viên liên danh); các hợp đồng, thỏa thuận liên quan đã và đang thực hiện (nếu có);\nb) Tiêu chí về điều kiện kỹ thuật phù hợp với từng lô\ndầu khí bao gồm: cam kết công việc tối thiểu (thu nổ mới, tái xử lý tài liệu địa chấn, số lượng giếng khoan); cam kết công việc phát triển mỏ, khai thác; phương\nán triển khai và công nghệ tối ưu cho hoạt động dầu khí, đáp ứng yêu cầu về bảo vệ môi trường, giảm thiểu phát thải khí carbon dioxide;\nc) Tiêu chí về điều kiện kinh tế phù hợp với từng lô dầu khí bao gồm: các mức thuế phù hợp với pháp luật về thuế, phụ thu khi giá\ndầu tăng cao; tỷ lệ chia dầu lãi, khí lãi cho nước chủ nhà; tỷ lệ quyền lợi tham gia của nước chủ nhà (thông qua Tập đoàn Dầu khí Việt Nam) khi có phát hiện thương mại đầu tiên trong diện tích hợp đồng dầu khí (nếu áp dụng); tỷ lệ quyền lợi tham gia của Tập đoàn Dầu khí Việt Nam hoặc công ty con của Tập đoàn Dầu khí Việt Nam được chỉ định tham gia với tư cách là nhà thầu; tỷ lệ thu hồi chi phí; cam kết tài chính tương ứng với các cam kết công việc tối thiểu; cam kết về\ncác nghĩa vụ tài chính khác (các loại hoa hồng, chi phí đào tạo, đóng góp quỹ\nnghiên cứu khoa học và phát triển công nghệ dầu khí).\n2. Phương pháp đánh giá hồ sơ dự thầu, hồ sơ chào thầu cạnh tranh, hồ sơ đề xuất bao gồm:\na) Đối với tiêu chí năng lực, kinh nghiệm: đánh giá\ntheo tiêu chí đạt và không đạt;\nb) Đối với tiêu chí về điều kiện kỹ thuật phù hợp với từng lô dầu khí: đáp ứng yêu cầu về cam kết công việc tối thiểu và đánh giá\ntheo chấm điểm với thang điểm 100;\nc) Đối với tiêu chí về điều kiện kinh tế phù hợp với từng lô dầu khí: đánh giá theo chấm điểm với thang điểm 100;\nd) Tổng hợp kết quả: tổng điểm sẽ được tính như\nsau: Tổng điểm = Tổng điểm tiêu chí về điều kiện kỹ thuật nhân (x) với trọng số\ntiêu chí về điều kiện kỹ thuật cộng (+) Tổng điểm tiêu chí về điều kiện kinh tế\nnhân (x) với trọng số tiêu chí về điều kiện kinh tế. Trong đó trọng số tiêu chí\nvề điều kiện kỹ thuật tối thiểu là 0,3 tùy thuộc vào đặc thù của từng lô dầu khí; trọng số tiêu chí về điều kiện kỹ thuật cộng (+) trọng số tiêu chí về điều kiện kinh tế = 1;\nđ) Bên dự thầu được lựa chọn thắng thầu khi đồng thời\nđạt được các kết quả sau: năng lực, kinh nghiệm “đạt”; đáp ứng yêu cầu về cam kết công việc tối thiểu và tổng điểm tiêu chí về điều kiện kỹ thuật đạt mức tối thiểu theo quy định tại hồ sơ mời thầu; tổng điểm tiêu chí về điều kiện kinh tế đạt mức tối thiểu theo quy định tại hồ sơ mời thầu; tổng điểm theo mục d khoản 2 Điều này cao nhất.\n3. Khi lập hồ sơ mời thầu, hồ sơ mời chào thầu cạnh tranh, hồ sơ yêu cầu, Tập đoàn Dầu khí Việt Nam phải xây dựng và phê duyệt tiêu chí lựa chọn nhà thầu và phương pháp đánh giá hồ sơ dự thầu, hồ sơ chào thầu cạnh tranh, hồ sơ đề xuất phù hợp với đặc thù của từng lô dầu khí.\nĐiều 19. Đánh giá hồ sơ dự thầu,\nhồ sơ chào thầu cạnh tranh, hồ sơ đề xuất 1. Tập đoàn Dầu khí Việt Nam thành lập tổ chuyên gia để đánh giá hồ sơ dự thầu hoặc hồ sơ chào thầu cạnh tranh hoặc hồ sơ đề xuất.\nTổ chuyên gia gồm các cá nhân có năng lực, kinh nghiệm và có chứng chỉ đào tạo về đấu thầu theo quy định của pháp luật về đấu thầu, làm việc theo quy chế do Tập\nđoàn Dầu khí Việt Nam ban hành.\n2. Việc đánh giá hồ sơ dự thầu hoặc hồ sơ chào thầu cạnh tranh hoặc hồ sơ đề xuất phải dựa trên các tiêu chí lựa chọn nhà thầu và\nphương pháp đánh giá trong kế hoạch lựa chọn nhà thầu và hồ sơ mời thầu hoặc hồ\nsơ mời chào thầu cạnh tranh hoặc hồ sơ yêu cầu đã được phê duyệt.\n3. Tập đoàn Dầu khí Việt Nam có thể yêu cầu bên dự\nthầu làm rõ hồ sơ dự thầu hoặc hồ sơ chào thầu cạnh tranh hoặc hồ sơ đề xuất bằng văn bản. Trong thời hạn 05 ngày kể từ ngày nhận được yêu cầu của Tập đoàn Dầu khí Việt Nam, bên dự thầu phải có văn bản trả lời. Việc làm rõ hồ sơ dự thầu hoặc hồ sơ chào thầu cạnh tranh hoặc hồ sơ đề xuất là cung cấp thông tin để giải thích nội dung được yêu cầu, không làm thay đổi nội dung chính của hồ sơ dự thầu hoặc hồ sơ chào thầu cạnh tranh hoặc hồ sơ đề xuất.\n4. Việc đánh giá thầu được tiến hành trong thời gian không quá 30 ngày kể từ ngày mở thầu.\nĐiều 20. Hồ sơ, trình tự, thủ\ntục thẩm định và phê duyệt kết quả lựa chọn nhà thầu ký kết hợp đồng dầu khí\n1. Trong thời hạn 15 ngày kể từ ngày hoàn thành\nđánh giá kết quả lựa chọn nhà thầu ký kết hợp đồng dầu khí, Tập đoàn Dầu khí Việt Nam trình Bộ Công Thương 02 bộ hồ sơ (gồm 01 bộ hồ sơ gốc và 01 bộ hồ sơ bản sao, gửi trực tiếp hoặc qua bưu chính) đề nghị phê duyệt kết quả lựa chọn nhà\nthầu ký kết hợp đồng dầu khí để thẩm định. Hồ sơ bao gồm:\na) Tờ trình kết quả đánh giá thầu và kiến nghị lựa chọn nhà thầu ký kết hợp đồng dầu khí kèm theo bộ điều kiện kinh tế, kỹ thuật của hợp đồng dầu khí;\nb) Hồ sơ mời thầu hoặc hồ sơ mời chào thầu cạnh tranh hoặc hồ sơ yêu cầu;\nc) Các hồ sơ dự thầu hoặc hồ sơ chào thầu cạnh tranh hoặc hồ sơ đề xuất;\nd) Biên bản mở thầu;\nđ) Biên bản đánh giá thầu, bảng điểm chấm thầu;\ne) Các văn bản của Tập đoàn Dầu khí Việt Nam yêu cầu làm rõ hồ sơ dự thầu hoặc hồ sơ chào thầu cạnh tranh hoặc hồ sơ đề xuất và văn bản trả lời của bên dự thầu (nếu có);\ng) Các văn bản, tài liệu khác có liên quan.\n2. Nội dung thẩm định kết quả lựa chọn nhà thầu ký\nkết hợp đồng dầu khí bao gồm:\na) Đánh giá căn cứ của việc tổ chức lựa chọn nhà thầu;\nb) Đánh giá việc tuân thủ quy định về thời gian trong quá trình lựa chọn nhà thầu;\nc) Đánh giá sự phù hợp của phương pháp đánh giá và\ntiêu chí lựa chọn nhà thầu;\nd) Đánh giá việc tuân thủ quy định của pháp luật trong quá trình đánh giá hồ sơ dự thầu, hồ sơ chào thầu cạnh tranh, hồ sơ đề xuất;\nđ) Xem xét những ý kiến khác nhau (nếu có) của tổ\nchuyên gia;\ne) Các nội dung liên quan khác.\n3. Trong thời hạn 05 ngày làm việc kể từ ngày nhận\nđược hồ sơ hợp lệ, Bộ Công Thương gửi hồ sơ lấy ý kiến của Bộ Kế hoạch và Đầu tư,\nBộ Tài chính, Bộ Tư pháp, Bộ Quốc phòng, Bộ Ngoại giao, Bộ Công an, Ủy ban Quản lý vốn nhà nước tại doanh nghiệp (trong trường hợp Tập đoàn Dầu khí Việt Nam tham gia hợp đồng dầu khí với tư cách nhà thầu) và các bộ, ngành có liên quan.\n4. Trong thời hạn 15 ngày kể từ ngày nhận được hồ\nsơ lấy ý kiến của Bộ Công Thương, các bộ, ngành phải có ý kiến bằng văn bản về\nnội dung thuộc phạm vi quản lý nhà nước của mình gửi Bộ Công Thương.\n5. Trong thời hạn 45 ngày kể từ ngày nhận được hồ\nsơ hợp lệ, Bộ Công Thương hoàn thành thẩm định kết quả lựa chọn nhà thầu ký kết hợp đồng dầu khí, trình Thủ tướng Chính phủ xem xét, phê duyệt. Hồ sơ bao gồm:\na) Tờ trình Thủ tướng Chính phủ về kết quả thẩm định và đề nghị phê duyệt kết quả lựa chọn nhà thầu ký kết hợp đồng dầu khí;\nb) Hồ sơ theo quy định tại khoản 1 Điều này;\nc) Báo cáo tổng hợp tiếp thu, giải trình ý kiến của các bộ, ngành và bản sao văn bản góp ý của các bộ, ngành.\n6. Trong thời hạn 15 ngày kể từ ngày nhận được văn bản phê duyệt kết quả lựa chọn nhà thầu của Thủ tướng Chính phủ, Tập đoàn Dầu khí Việt Nam thông báo cho bên dự thầu được lựa chọn vế kết quả lựa chọn nhà thầu,\nđiều kiện kinh tế, kỹ thuật cơ bản của hợp đồng dầu khí và kế hoạch đàm phán hợp\nđồng dầu khí.\n7. Trong thời hạn 90 ngày kể từ ngày kể từ ngày nhận\nđược thông báo kết quả lựa chọn nhà thầu của Tập đoàn Dầu khí Việt Nam, nhà thầu và Tập đoàn Dầu khí Việt Nam hoàn thành đàm phán hợp đồng dầu khí. Nếu quá thời hạn nêu trên mà chưa thể thống nhất nội dung dự thảo hợp đồng dầu khí, Tập đoàn Dầu khí Việt Nam báo cáo Bộ Công Thương lý do và đề xuất gia hạn thời gian đàm phán để Bộ Công Thương xem xét, quyết định.\nChương IV HỢP ĐỒNG DẦU KHÍ\nĐiều 21. Hồ sơ, trình tự, thủ\ntục thẩm định và phê duyệt nội dung hợp đồng dầu khí\n1. Trong thời hạn 30 ngày kể từ ngày hoàn thành đàm phán hợp đồng dầu khí, Tập đoàn Dầu khí Việt Nam trình Bộ Công Thương 02 bộ hồ\nsơ (gồm 01 bộ hồ sơ gốc và 01 bộ hồ sơ bản sao, gửi trực tiếp hoặc qua bưu chính) đề nghị phê duyệt nội dung hợp đồng dầu khí để thẩm định. Hồ sơ bao gồm:\na) Tờ trình đề nghị phê duyệt nội dung hợp đồng dầu khí;\nb) Dự thảo hợp đồng dầu khí đã được Tập đoàn Dầu khí Việt Nam và nhà thầu thống nhất; bản giải trình các nội dung khác biệt giữa dự thảo hợp đồng dầu khí trong hồ sơ mời thầu hoặc hồ sơ mời chào thầu cạnh tranh hoặc hồ sơ yêu cầu và dự thảo hợp đồng dầu khí đã được thỏa thuận;\nc) Bản sao có chứng thực giấy chứng nhận đăng ký hoạt\nđộng đối với tổ chức; bản sao có chứng thực giấy chứng minh nhân dân hoặc căn cước công dân hoặc hộ chiếu đối với nhà đầu tư là cá nhân tham gia hợp đồng dầu khí;\nd) Thư bảo lãnh thực hiện nghĩa vụ hợp đồng của nhà\nthầu hoặc từng nhà thầu trong liên danh nhà thầu do tổ chức tín dụng, chi nhánh ngân hàng nước ngoài hoặc công ty mẹ của nhà thầu hoặc từng nhà thầu trong liên danh nhà thầu phát hành theo yêu cầu của Tập đoàn Dầu khí Việt Nam trên cơ sở kết quả đánh giá báo cáo tài chính của nhà thầu;\nđ) Tài liệu của nhà thầu hoặc từng nhà thầu trong liên danh, bao gồm: điều lệ công ty, báo cáo tài chính trong 03 năm gần nhất và\ncác tài liệu pháp lý khác có liên quan làm cơ sở đàm phán hợp đồng dầu khí, bản sao kê khai nghĩa vụ thuế năm gần nhất trong trường hợp là đối tượng điều chỉnh của pháp luật về thuế của Việt Nam.\ne) Các văn bản, tài liệu khác có liên quan.\n2. Trong thời hạn 05 ngày làm việc kể từ ngày nhận\nđược hồ sơ hợp lệ, Bộ Công Thương gửi hồ sơ lấy ý kiến của Bộ Kế hoạch và Đầu tư, Bộ Tài chính, Bộ Tư pháp, Bộ Quốc phòng, Bộ Ngoại giao, Bộ Công an, Ủy ban Quản lý vốn nhà nước tại doanh nghiệp (trong trường hợp Tập đoàn Dầu khí Việt Nam tham gia hợp đồng dầu khí với tư cách nhà thầu) và các bộ, ngành có liên quan.\n3. Trong thời hạn 15 ngày kể từ ngày nhận được hồ\nsơ lấy ý kiến của Bộ Công Thương, các bộ, ngành phải có ý kiến bằng văn bản về\nnội dung thuộc phạm vi quản lý nhà nước của mình gửi Bộ Công Thương.\n4. Trong thời hạn 45 ngày kể từ ngày nhận được hồ\nsơ hợp lệ, Bộ Công Thương hoàn thành thẩm định nội dung hợp đồng dầu khí, trình Thủ tướng Chính phủ xem xét, phê duyệt. Hồ sơ bao gồm:\na) Tờ trình Thủ tướng Chính phủ về kết quả thẩm định và đề nghị phê duyệt nội dung hợp đồng dầu khí;\nb) Hồ sơ theo quy định tại khoản 1 Điều này;\nc) Báo cáo tổng hợp tiếp thu, giải trình ý kiến của các bộ, ngành và bản sao văn bản góp ý của các bộ, ngành.\n5. Trong thời hạn 05 ngày làm việc kể từ ngày nhận\nđược văn bản phê duyệt nội dung hợp đồng dầu khí của Thủ tướng Chính phủ, Tập\nđoàn Dầu khí Việt Nam và nhà thầu tiến hành ký kết hợp đồng dầu khí.\nĐiều 22. Hồ sơ, trình tự, thủ\ntục cấp giấy chứng nhận đăng ký đầu tư\n1. Trong thời hạn 05 ngày làm việc kể từ ngày hoàn thành ký kết hợp đồng dầu khí, Tập đoàn Dầu khí Việt Nam trình Bộ Công Thương 01 bộ hồ sơ gốc đề nghị cấp giấy chứng nhận đăng ký đầu tư cho nhà thầu thực hiện hoạt động dầu khí. Hồ sơ bao gồm:\na) Văn bản đề nghị cấp giấy chứng nhận đăng ký đầu tư đối với hợp đồng dầu khí đã ký cho nhà thầu thực hiện hoạt động dầu khí;\nb) Bản gốc hợp đồng dầu khí đã được ký kết giữa Tập\nđoàn Dầu khí Việt Nam và nhà thầu.\n2. Trong thời hạn 15 ngày kể từ ngày nhận được hồ\nsơ hợp lệ, Bộ Công Thương cấp giấy chứng nhận đăng ký đầu tư cho nhà thầu và Tập\nđoàn Dầu khí Việt Nam, đồng thời gửi bản chính đến Bộ Tài chính, Bộ Kế hoạch và\nĐầu tư, Bộ Tư pháp và cơ quan thuế.\n3. Trong thời hạn 30 ngày kể từ ngày nhà thầu hoàn tất các nghĩa vụ của hợp đồng dầu khí hoặc ngày chấm dứt hiệu lực hợp đồng dầu khí\ntheo quy định tại Điều 35 Luật Dầu khí tùy thuộc thời điểm nào đến muộn hơn, nhà thầu phải nộp lại các bản gốc, bản chính giấy chứng nhận\nđăng ký đầu tư, giấy chứng nhận đăng ký đầu tư điều chỉnh (nếu có) cho Tập đoàn Dầu khí Việt Nam để gửi Bộ Công Thương.\nĐiều 23. Hồ sơ, trình tự, thủ\ntục thẩm định và phê duyệt điều chỉnh nội dung hợp đồng dầu khí và cấp giấy chứng nhận đăng ký đầu tư điều chỉnh 1. Căn cứ quy định tại khoản 1 Điều 28 Luật Dầu khí, trên cơ sở đề nghị của nhà thầu được Tập đoàn Dầu khí Việt Nam thông qua, Tập đoàn Dầu khí Việt Nam trình Bộ Công Thương 02 bộ hồ sơ (gồm 01 bộ hồ sơ gốc và 01 bộ hồ sơ bản sao, gửi trực tiếp hoặc qua bưu chính) đề\nnghị phê duyệt điều chỉnh nội dung hợp đồng dầu khí và cấp giấy chứng nhận đăng ký đầu tư điều chỉnh. Hồ sơ bao gồm:\na) Văn bản đề nghị phê duyệt điều chỉnh nội dung hợp\nđồng dầu khí và cấp giấy chứng nhận đăng ký đầu tư điều chỉnh, trong đó nêu rõ\nlý do; giải trình các nội dung điều chỉnh của hợp đồng dầu khí; đánh giá của Tập\nđoàn Dầu khí Việt Nam đối với đề xuất của nhà thầu;\nb) Thỏa thuận bổ sung điều chỉnh nội dung hợp đồng dầu khí đã được Tập đoàn Dầu khí Việt Nam và nhà thầu thống nhất;\nc) Các văn bản, tài liệu khác có liên quan.\n2. Trình tự thẩm định và phê duyệt điều chỉnh nội dung hợp đồng dầu khí được thực hiện theo quy định tại các khoản 2, 3 và 4 Điều 21 Nghị định này.\n3. Trong thời hạn 05 ngày làm việc kể từ ngày nhận\nđược văn bản phê duyệt điều chỉnh nội dung hợp đồng dầu khí của Thủ tướng Chính phủ, Bộ Công Thương cấp giấy chứng nhận đăng ký đầu tư điều chỉnh cho nhà thầu và Tập đoàn Dầu khí Việt Nam, đồng thời gửi bản chính đến Bộ Tài chính, Bộ Kế\nhoạch và Đầu tư, Bộ Tư pháp và cơ quan thuế.\nĐiều 24. Hợp đồng chia sản phẩm dầu khí\n1. Hợp đồng chia sản phẩm dầu khí phải tuân thủ hợp\nđồng mẫu quy định tại Phụ lục kèm theo Nghị định này.\n2. Tập đoàn Dầu khí Việt Nam và nhà thầu chỉ đàm phán các nội dung được trích yếu “phụ thuộc vào kết quả đấu thầu hoặc đàm phán”\nvà một số nội dung khác quy định tại Điều 20.7 của hợp đồng mẫu.\nĐiều 25. Hồ sơ, trình tự, thủ\ntục chấp thuận gia hạn thời hạn của giai đoạn tìm kiếm thăm dò dầu khí\n1. Giai đoạn tìm kiếm thăm dò dầu khí quy định tại khoản 1 Điều 31 Luật Dầu khí có thể được chia thành các giai\nđoạn thành phần.\n2. Chậm nhất 60 ngày trước ngày kết thúc từng giai\nđoạn thành phần hoặc ngày kết thúc giai đoạn tìm kiếm thăm dò dầu khí, trên cơ\nsở đề nghị của nhà thầu được Tập đoàn Dầu khí Việt Nam thông qua, Tập đoàn Dầu khí Việt Nam trình Bộ Công Thương 02 bộ hồ sơ (gồm 01 bộ hồ sơ gốc và 01 bộ hồ\nsơ bản sao, gửi trực tiếp hoặc qua bưu chính) đề nghị chấp thuận gia hạn thời hạn của giai đoạn tìm kiếm thăm dò dầu khí. Hồ sơ bao gồm:\na) Văn bản đề nghị chấp thuận gia hạn thời hạn của giai đoạn tìm kiếm thăm dò dầu khí, trong đó nêu rõ lý do; kế hoạch triển khai hoạt động dầu khí trong thời gian gia hạn; các cam kết công việc bổ sung, cam kết tài chính tương ứng và các đề xuất khác dự kiến thực hiện trong thời gian được gia hạn (nếu có);\nb) Đánh giá của Tập đoàn Dầu khí Việt Nam về đề xuất của nhà thầu; văn bản tiếp thu, giải trình của nhà thầu (nếu có);\nc) Các văn bản, tài liệu khác có liên quan.\n3. Trong thời hạn 05 ngày làm việc kể từ ngày nhận\nđược hồ sơ hợp lệ, Bộ Công Thương gửi hồ sơ lấy ý kiến của Bộ Kế hoạch và Đầu tư, Bộ Tài chính, Bộ Tư pháp, Bộ Quốc phòng, Bộ Ngoại giao, Bộ Công an, Ủy ban Quản lý vốn nhà nước tại doanh nghiệp (trong trường hợp Tập đoàn Dầu khí Việt Nam tham gia hợp đồng dầu khí với tư cách nhà thầu) và các bộ, ngành có liên quan.\n4. Trong thời hạn 15 ngày kể từ ngày nhận được hồ\nsơ lấy ý kiến của Bộ Công Thương, các bộ, ngành phải có ý kiến bằng văn bản về\nnội dung thuộc phạm vi quản lý nhà nước của mình gửi Bộ Công Thương.\n5. Trong thời hạn 45 ngày kể từ ngày nhận được hồ\nsơ hợp lệ, Bộ Công Thương ban hành văn bản chấp thuận gia hạn thời hạn của giai\nđoạn tìm kiếm thăm dò dầu khí.\nĐiều 26. Hồ sơ, trình tự, thủ\ntục thẩm định và chấp thuận gia hạn thời hạn của hợp đồng dầu khí\n1. Chậm nhất 01 năm trước ngày kết thúc hợp đồng dầu khí, trên cơ sở đề nghị của nhà thầu được Tập đoàn Dầu khí Việt Nam thông qua,\nTập đoàn Dầu khí Việt Nam trình Bộ Công Thương 02 bộ hồ sơ (gồm 01 bộ hồ sơ gốc và 01 bộ hồ sơ bản sao, gửi trực tiếp hoặc qua bưu chính) đề nghị chấp thuận gia hạn thời hạn của hợp đồng dầu khí. Hồ sơ bao gồm:\na) Văn bản đề nghị chấp thuận gia hạn thời hạn của hợp đồng dầu khí, trong đó nêu rõ lý do; kế hoạch triển khai hoạt động dầu khí\ntrong thời gian gia hạn; các cam kết công việc tối thiểu và cam kết tài chính tối thiểu trong thời gian được gia hạn (nếu có);\nb) Đánh giá của Tập đoàn Dầu khí Việt Nam về đề xuất của nhà thầu; văn bản tiếp thu, giải trình của nhà thầu (nếu có);\nc) Các văn bản, tài liệu khác có liên quan.\n2. Trong thời hạn 05 ngày làm việc kể từ ngày nhận\nđược hồ sơ hợp lệ, Bộ Công Thương gửi hồ sơ lấy ý kiến của Bộ Kế hoạch và Đầu tư, Bộ Tài chính, Bộ Tư pháp, Bộ Quốc phòng, Bộ Ngoại giao, Bộ Công an, Ủy ban Quản lý vốn nhà nước tại doanh nghiệp (trong trường hợp Tập đoàn Dầu khí Việt Nam tham gia hợp đồng dầu khí với tư cách nhà thầu) và các bộ, ngành có liên quan.\n3. Trong thời hạn 15 ngày kể từ ngày nhận được hồ\nsơ lấy ý kiến của Bộ Công Thương, các bộ, ngành phải có ý kiến bằng văn bản về nội dung thuộc phạm vi quản lý nhà nước của mình gửi Bộ Công Thương.\n4. Trong thời hạn 45 ngày kể từ ngày nhận được hồ\nsơ hợp lệ, Bộ Công Thương ban hành văn bản chấp thuận gia hạn thời hạn của hợp\nđồng dầu khí.\nĐiều 27. Hồ sơ, trình tự, thủ\ntục thẩm định và chấp thuận gia hạn thời hạn của giai đoạn tìm kiếm thăm dò dầu khí, thời hạn hợp đồng dầu khí trong trường hợp đặc biệt 1. Chậm nhất 60 ngày trước ngày kết thúc giai đoạn tìm kiếm thăm dò dầu khí hoặc 01 năm trước ngày kết thúc hợp đồng dầu khí, trên cơ sở đề nghị của nhà thầu được Tập đoàn Dầu khí Việt Nam thông qua, Tập đoàn Dầu khí Việt Nam trình Bộ Công Thương 02 bộ hồ sơ (gồm 01 bộ hồ sơ gốc và 01 bộ hồ\nsơ bản sao, gửi trực tiếp hoặc qua bưu chính) đề nghị gia hạn thời hạn tìm kiếm thăm dò dầu khí hoặc gia hạn thời hạn hợp đồng dầu khí trong trường hợp đặc biệt\nđể thẩm định. Hồ sơ bao gồm:\na) Văn bản đề nghị chấp thuận gia hạn thời hạn của giai đoạn tìm kiếm thăm dò dầu khí hoặc gia hạn thời hạn của hợp đồng dầu khí,\ntrong đó nêu rõ lý do và việc đáp ứng điều kiện quy định tại khoản 4 Điều 31 Luật Dầu khí; kế hoạch triển khai hoạt động dầu khí trong thời gian gia hạn; các cam kết công việc bổ sung, cam kết tài chính tương ứng và các\nđề xuất khác dự kiến thực hiện trong thời gian được gia hạn (nếu có);\nb) Đánh giá của Tập đoàn Dầu khí Việt Nam về đề xuất của nhà thầu; văn bản tiếp thu, giải trình của nhà thầu (nếu có);\nc) Các văn bản, tài liệu khác có liên quan.\n2. Trong thời hạn 05 ngày làm việc kể từ ngày nhận\nđược hồ sơ hợp lệ, Bộ Công Thương gửi hồ sơ lấy ý kiến của Bộ Kế hoạch và Đầu tư, Bộ Tài chính, Bộ Tư pháp, Bộ Quốc phòng, Bộ Ngoại giao, Bộ Công an, Ủy ban Quản lý vốn nhà nước tại doanh nghiệp (trong trường hợp Tập đoàn Dầu khí Việt Nam tham gia hợp đồng dầu khí với tư cách nhà thầu) và các bộ, ngành có liên quan.\n3. Trong thời hạn 15 ngày kể từ ngày nhận được hồ\nsơ lấy ý kiến của Bộ Công Thương, các bộ, ngành phải có ý kiến bằng văn bản về\nnội dung thuộc phạm vi quản lý nhà nước của mình gửi Bộ Công Thương.\n4. Trong thời hạn 45 ngày kể từ ngày nhận được hồ\nsơ hợp lệ, Bộ Công Thương hoàn thành thẩm định đề nghị gia hạn thời hạn tìm kiếm thăm dò dầu khí hoặc gia hạn thời hạn hợp đồng dầu khí trong trường hợp đặc biệt,\ntrình Thủ tướng Chính phủ xem xét, chấp thuận. Hồ sơ bao gồm:\na) Văn bản báo cáo Thủ tướng Chính phủ kết quả thẩm\nđịnh và đề nghị chấp thuận gia hạn thời hạn tìm kiếm thăm dò dầu khí hoặc gia hạn thời hạn hợp đồng dầu khí trong trường hợp đặc biệt;\nb) Hồ sơ theo quy định tại khoản 1 Điều này;\nc) Báo cáo tổng hợp tiếp thu, giải trình ý kiến của các bộ, ngành và bản sao văn bản góp ý của các bộ, ngành.\nĐiều 28. Hồ sơ, trình tự, thủ\ntục thẩm định và chấp thuận giữ lại diện tích phát hiện khí\n1. Chậm nhất 90 ngày kể từ ngày tuyên bố phát hiện thương mại, trên cơ sở đề nghị của nhà thâu được Tập đoàn Dầu khí Việt Nam thông qua, Tập đoàn Dầu khí Việt Nam trình Bộ Công Thương 02 bộ hồ sơ (gồm 01 bộ\nhồ sơ gốc và 01 bộ hồ sơ bản sao, gửi trực tiếp hoặc qua bưu chính) đề nghị chấp thuận giữ lại diện tích phát hiện khí trong thời hạn không quá 05 năm. Hồ sơ\nbao gồm:\na) Văn bản đề nghị chấp thuận giữ lại diện tích phát hiện khí, trong đó nêu rõ lý do và việc đáp ứng điều kiện quy định tại khoản 5 Điều 31 Luật Dầu khí; kế hoạch triển khai phát triển phát hiện khí; cam kết công việc bổ sung và cam kết tài chính tương ứng dự kiến thực hiện trong thời gian giữ lại diện tích phát hiện khí (nếu có);\nb) Đánh giá của Tập đoàn Dầu khí Việt Nam về đề xuất của nhà thầu; văn bản tiếp thu, giải trình của nhà thầu (nếu có);\nc) Các văn bản, tài liệu khác có liên quan.\n2. Trong thời hạn 05 ngày làm việc kể từ ngày nhận\nđược hồ sơ hợp lệ, Bộ Công Thương gửi hồ sơ lấy ý kiến của Bộ Kế hoạch và Đầu tư, Bộ Tài chính, Bộ Tư pháp, Bộ Quốc phòng, Bộ Ngoại giao, Bộ Công an, Ủy ban Quản lý vốn nhà nước tại doanh nghiệp (trong trường hợp Tập đoàn Dầu khí Việt Nam tham gia hợp đồng dầu khí với tư cách nhà thầu) và các bộ, ngành có liên quan.\n3. Trong thời hạn 15 ngày kể từ ngày nhận được hồ\nsơ lấy ý kiến của Bộ Công Thương, các bộ, ngành phải có ý kiến bằng văn bản về\nnội dung thuộc phạm vi quản lý nhà nước của mình gửi Bộ Công Thương.\n4. Trong thời hạn 45 ngày kể từ ngày nhận được hồ\nsơ hợp lệ, Bộ Công Thương ban hành văn bản chấp thuận giữ lại diện tích phát hiện khí trong thời hạn không quá 05 năm.\n5. Chậm nhất 90 ngày trước ngày kết thúc thời gian giữ lại diện tích phát hiện khí đã được Bộ Công Thương chấp thuận, nếu có yêu cầu tiếp tục giữ lại diện tích phát hiện khí trong thời hạn không quá 02 năm theo quy định tại khoản 5 Điều 31 Luật Dầu khí, trên cơ sở đề\nnghị của nhà thầu được Tập đoàn Dầu khí Việt Nam thông qua, Tập đoàn Dầu khí Việt Nam trình Bộ Công Thương 02 bộ hồ sơ (gồm 01 bộ hồ sơ gốc và 01 bộ hồ sơ bản sao, gửi trực tiếp hoặc qua bưu chính) đề nghị chấp thuận kéo dài thời gian giữ\nlại diện tích phát hiện khí đến Bộ Công Thương để thẩm định. Hồ sơ bao gồm:\na) Văn bản đề nghị chấp thuận kéo dài thời gian giữ\nlại diện tích phát hiện khí, trong đó nêu rõ lý do và việc đáp ứng điều kiện quy định tại khoản 5 Điều 31 Luật Dầu khí; kế hoạch triển khai phát triển phát hiện khí; cam kết công việc bổ sung và cam kết tài chính tương ứng dự kiến thực hiện trong thời gian giữ lại diện tích phát hiện khí (nếu có);\nb) Đánh giá của Tập đoàn Dầu khí Việt Nam về đề xuất của nhà thầu; văn bản tiếp thu, giải trình của nhà thầu (nếu có);\nc) Các văn bản, tài liệu khác có liên quan.\n6. Trong thời hạn 05 ngày làm việc kể từ ngày nhận\nđược hồ sơ hợp lệ, Bộ Công Thương gửi hồ sơ lấy ý kiến của Bộ Kế hoạch và Đầu tư, Bộ Tài chính, Bộ Tư pháp, Bộ Quốc phòng, Bộ Ngoại giao, Bộ Công an, Ủy ban Quản lý vốn nhà nước tại doanh nghiệp (trong trường hợp Tập đoàn Dầu khí Việt Nam tham gia hợp đồng dầu khí với tư cách nhà thầu) và các bộ, ngành có liên quan.\n7. Trong thời hạn 15 ngày kể từ ngày nhận được hồ\nsơ lấy ý kiến của Bộ Công Thương, các bộ, ngành phải có ý kiến bằng văn bản về\nnội dung thuộc phạm vi quản lý nhà nước của mình gửi Bộ Công Thương.\n8. Trong thời hạn 45 ngày kể từ ngày nhận được hồ\nsơ hợp lệ, Bộ Công Thương hoàn thành thẩm định đề nghị kéo dài thời gian giữ lại diện tích phát hiện khí, trình Thủ tướng Chính phủ xem xét, chấp thuận. Hồ sơ\nbao gồm:\na) Văn bản báo cáo Thủ tướng Chính phủ kết quả thẩm\nđịnh và đề nghị chấp thuận kéo dài thời gian giữ lại diện tích phát hiện khí;\nb) Hồ sơ theo quy định tại khoản 5 Điều này;\nc) Báo cáo tổng hợp tiếp thu, giải trình ý kiến của các bộ, ngành và bản sao văn bản góp ý của các bộ, ngành.\nĐiều 29. Hồ sơ, trình tự, thủ\ntục chấp thuận tạm dừng thực hiện một số quyền và nghĩa vụ trong hợp đồng dầu khí do nguyên nhân bất khả kháng 1. Trong trường hợp bất khả kháng, Tập đoàn Dầu khí\nViệt Nam và nhà thầu thỏa thuận phương thức tạm dừng thực hiện một số quyền và\nnghĩa vụ trong hợp đồng dầu khí.\n2. Trong thời hạn 30 ngày kể từ ngày đạt được thống nhất với nhà thầu, Tập đoàn Dầu khí Việt Nam trình Bộ Công Thương 02 bộ hồ sơ\n(gồm 01 bộ hồ sơ gốc và 01 bộ hồ sơ bản sao, gửi trực tiếp hoặc qua bưu chính)\nđề nghị chấp thuận phương thức tạm dừng thực hiện một số quyền và nghĩa vụ\ntrong hợp đồng dầu khí do nguyên nhân bất khả kháng để xem xét, chấp thuận. Hồ\nsơ bao gồm:\na) Văn bản đề nghị chấp thuận phương thức tạm dừng thực hiện một số quyền và nghĩa vụ trong hợp đồng dầu khí do nguyên nhân bất khả\nkháng;\nb) Văn bản đề xuất của nhà thầu (nếu có);\nc) Các văn bản, tài liệu khác có liên quan.\n3. Trong thời hạn 05 ngày làm việc kể từ ngày nhận\nđược hồ sơ hợp lệ, Bộ Công Thương gửi hồ sơ lấy ý kiến của Bộ Kế hoạch và Đầu tư, Bộ Tài chính, Bộ Tư pháp, Bộ Quốc phòng, Bộ Ngoại giao, Bộ Công an, Ủy ban Quản lý vốn nhà nước tại doanh nghiệp (trong trường hợp Tập đoàn Dầu khí Việt Nam tham gia hợp đồng dầu khí với tư cách nhà thầu) và các bộ, ngành có liên quan.\n4. Trong thời hạn 15 ngày kể từ ngày nhận được hồ\nsơ lấy ý kiến của Bộ Công Thương, các bộ, ngành phải có ý kiến bằng văn bản về\nnội dung thuộc phạm vi quản lý nhà nước của mình gửi Bộ Công Thương.\n5. Trong thời hạn 45 ngày kể từ ngày nhận được hồ\nsơ hợp lệ, Bộ Công Thương ban hành văn bản chấp thuận phương thức tạm dừng thực hiện một số quyền và nghĩa vụ trong hợp đồng dầu khí do nguyên nhân bất khả\nkháng.\nĐiều 30. Hồ sơ, trình tự, thủ\ntục thẩm định và chấp thuận tạm dừng thực hiện một số quyền và nghĩa vụ trong hợp\nđồng dầu khí vì lý do quốc phòng, an ninh 1. Căn cứ tình hình thực tế và báo cáo của các cơ\nquan có thẩm quyền về quốc phòng, an ninh, để đảm bảo môi trường hòa bình, ổn định và lợi ích quốc gia, dân tộc, Thủ tướng Chính phủ quyết định tạm dừng thực hiện một số quyền và nghĩa vụ trong hợp đồng dầu khí vì lý do quốc phòng, an ninh theo quy định tại khoản 7 Điều 31 Luật Dầu khí và giao Tập\nđoàn Dầu khí Việt Nam thông báo cho nhà thầu.\n2. Trên cơ sở kết quả đàm phán với nhà thầu, Tập\nđoàn Dầu khí Việt Nam trình Bộ Công Thương 02 bộ hồ sơ (gồm 01 bộ hồ sơ gốc và\n01 bộ hồ sơ bản sao, gửi trực tiếp hoặc qua bưu chính) đề nghị tạm dừng một số\nquyền và nghĩa vụ trong hợp đồng dầu khí vì lý do quốc phòng, an ninh để thẩm định.\nHồ sơ bao gồm:\na) Văn bản báo cáo kết quả đàm phán về việc tạm dừng một số quyền và nghĩa vụ trong hợp đồng dầu khí vì lý do quốc phòng, an ninh,\ntrong đó nêu rõ thông tin về hợp đồng dầu khí; đánh giá nguyên nhân; thời gian\nđề xuất tạm dừng thực hiện một số quyền và nghĩa vụ trong hợp đồng dầu khí;\nb) Các văn bản, tài liệu khác có liên quan.\n3. Trong thời hạn 05 ngày làm việc kể từ ngày nhận\nđược hồ sơ hợp lệ, Bộ Công Thương gửi hồ sơ lấy ý kiến của Bộ Kế hoạch và Đầu tư, Bộ Tài chính, Bộ Tư pháp, Bộ Quốc phòng, Bộ Ngoại giao, Bộ Công an, Ủy ban Quản lý vốn nhà nước tại doanh nghiệp (trong trường hợp Tập đoàn Dầu khí Việt Nam tham gia hợp đồng dầu khí với tư cách nhà thầu) và các bộ, ngành có liên quan.\n4. Trong thời hạn 15 ngày kể từ ngày nhận được hồ\nsơ lấy ý kiến của Bộ Công Thương, các bộ, ngành phải có ý kiến bằng văn bản về\nnội dung thuộc phạm vi quản lý nhà nước của mình gửi Bộ Công Thương.\n5. Trong thời hạn 45 ngày kể từ ngày nhận được hồ\nsơ hợp lệ, Bộ Công Thương hoàn thành thẩm định báo cáo về việc tạm dừng thực hiện một số quyền và nghĩa vụ trong hợp đồng dầu khí vì lý do quốc phòng, an ninh,\ntrình Thủ tướng Chính phủ xem xét, chấp thuận. Hồ sơ bao gồm:\na) Văn bản báo cáo Thủ tướng Chính phủ về kết quả\nthẩm định và đề nghị chấp thuận phương thức tạm dừng thực hiện một số quyền và\nnghĩa vụ trong hợp đồng dầu khí vì lý do quốc phòng, an ninh;\nb) Hồ sơ theo quy định tại khoản 2 Điều này;\nc) Báo cáo tổng hợp tiếp thu, giải trình ý kiến của các bộ, ngành và bản sao văn bản góp ý của các bộ, ngành.\nĐiều 31. Hoàn trả diện tích hợp\nđồng dầu khí và hồ sơ, trình tự, thủ tục chấp thuận giữ lại hoặc tạm hoãn nghĩa vụ hoàn trả diện tích hợp đồng dầu khí\n1. Nhà thầu phải hoàn trả diện tích không nhỏ hơn 20% diện tích hợp đồng dầu khí ban đầu vào cuối mỗi giai đoạn thành phần của giai đoạn tìm kiếm thăm dò dầu khí trừ các diện tích phát triển mỏ dầu khí và\ndiện tích được giữ lại hoặc tạm hoãn nghĩa vụ hoàn trả theo quy định tại khoản 3 Điều 32 Luật Dầu khí.\n2. Nhà thầu có quyền hoàn trả diện tích hợp đồng dầu khí vào bất kỳ lúc nào trong giai đoạn tìm kiếm thăm dò dầu khí. Diện tích đã tự\nnguyện hoàn trả được trừ khỏi nghĩa vụ hoàn trả diện tích của giai đoạn liên quan. Việc tự nguyện hoàn trả diện tích hợp đồng dầu khí không làm giảm các nghĩa vụ đã cam kết đối với giai đoạn liên quan cũng như diện tích đã hoàn trả\nđó.\n3. Diện tích hợp đồng dầu khí hoàn trả phải thuận lợi cho các hoạt động dầu khí tiếp sau.\n4. Hằng năm, Tập đoàn Dầu khí Việt Nam tổng hợp tình hình hoàn trả diện tích hợp đồng dầu khí của các nhà thầu, báo cáo Bộ Công Thương để theo dõi; đề xuất danh mục điều chỉnh các lô dầu khí (nếu cần thiết)\ntheo quy định của Điều 12 Nghị định này.\n5. Trường hợp có yêu cầu giữ lại toàn bộ diện tích hợp đồng dầu khí hoặc tạm hoãn nghĩa vụ hoàn trả diện tích hợp đồng dầu khí,\ntrên cơ sở đề nghị của nhà thầu được Tập đoàn Dầu khí Việt Nam thông qua, Tập\nđoàn Dầu khí Việt Nam trình Bộ Công Thương gửi 02 bộ hồ sơ (gồm 01 bộ hồ sơ gốc và 01 bộ hồ sơ bản sao, gửi trực tiếp hoặc qua bưu chính) đề nghị chấp thuận giữ\nlại toàn bộ diện tích hợp đồng dầu khí hoặc tạm hoãn nghĩa vụ hoàn trả diện tích hợp đồng dầu khí để xem xét, chấp thuận. Hồ sơ bao gồm:\na) Văn bản đề nghị chấp thuận giữ lại toàn bộ diện tích hợp đồng dầu khí hoặc tạm hoãn nghĩa vụ hoàn trả diện tích hợp đồng dầu khí, trong đó nêu rõ lý do, thời gian giữ lại toàn bộ diện tích hợp đồng hoặc tạm hoãn nghĩa vụ hoàn trả diện tích hợp đồng; kế hoạch triển khai hoạt động dầu khí trong thời gian giữ lại diện tích; cam kết công việc bổ sung và cam kết tài chính tương ứng dự kiến thực hiện trong thời gian giữ lại diện tích hợp đồng hoặc tạm hoãn nghĩa vụ hoàn trả diện tích;\nb) Đánh giá của Tập đoàn Dầu khí Việt Nam về đề xuất của nhà thầu; văn bản tiếp thu, giải trình của nhà thầu (nếu có);\nc) Các văn bản, tài liệu khác có liên quan.\n6. Trong thời hạn 05 ngày làm việc kể từ ngày nhận\nđược hồ sơ hợp lệ, Bộ Công Thương gửi hồ sơ lấy ý kiến của Bộ Kế hoạch và Đầu tư, Bộ Tài chính, Bộ Tư pháp, Bộ Quốc phòng, Bộ Ngoại giao, Bộ Công an, Ủy ban Quản lý vốn nhà nước tại doanh nghiệp (trong trường hợp Tập đoàn Dầu khí Việt Nam tham gia hợp đồng dầu khí với tư cách nhà thầu) và các bộ, ngành có liên quan.\n7. Trong thời hạn 15 ngày kể từ ngày nhận được hồ\nsơ lấy ý kiến của Bộ Công Thương, các bộ, ngành phải có ý kiến bằng văn bản về\nnội dung thuộc phạm vi quản lý nhà nước của mình gửi Bộ Công Thương.\n8. Trong thời hạn 45 ngày kể từ ngày nhận được hồ\nsơ hợp lệ, Bộ Công Thương ban hành văn bản chấp thuận giữ lại toàn bộ diện tích hợp đồng dầu khí hoặc tạm hoãn nghĩa vụ hoàn trả diện tích hợp đồng dầu khí.\nĐiều 32. Hồ sơ, trình tự, thủ\ntục thẩm định và phê duyệt mở rộng diện tích hợp đồng dầu khí, hợp nhất phát hiện dầu khí, mỏ dầu khí\n1. Căn cứ quy định tại khoản 4 và\nkhoản 5 Điều 32 Luật Dầu khí, trên cơ sở đề nghị của nhà thầu được Tập đoàn Dầu khí Việt Nam thông qua, Tập đoàn Dầu khí Việt Nam trình Bộ Công Thương 02 bộ\nhồ sơ (gồm 01 bộ hồ sơ gốc và 01 bộ hồ sơ bản sao, gửi trực tiếp hoặc qua bưu chính) đề nghị phê duyệt mở rộng diện tích hợp đồng dầu khí hoặc hợp nhất phát hiện dầu khí, mỏ dầu khí để thẩm định. Hồ sơ bao gồm:\na) Văn bản đề nghị phê duyệt mở rộng diện tích hợp\nđồng dầu khí hoặc hợp nhất phát hiện dầu khí, mỏ dầu khí, trong đó nêu rõ lý\ndo, kết quả nghiên cứu, đánh giá về diện tích đề nghị mở rộng hoặc phương án hợp nhất phát hiện dầu khí, mỏ dầu khí;\nb) Đánh giá của Tập đoàn Dầu khí Việt Nam về đề xuất của nhà thầu; văn bản tiếp thu, giải trình của nhà thầu (nếu có);\nc) Các văn bản, tài liệu khác có liên quan.\n2. Trong thời hạn 05 ngày làm việc kể từ ngày nhận\nđược hồ sơ hợp lệ, Bộ Công Thương gửi hồ sơ lấy ý kiến của Bộ Kế hoạch và Đầu tư, Bộ Tài chính, Bộ Tư pháp, Bộ Quốc phòng, Bộ Ngoại giao, Bộ Công an, Ủy ban Quản lý vốn nhà nước tại doanh nghiệp (trong trường hợp Tập đoàn Dầu khí Việt Nam tham gia hợp đồng dầu khí với tư cách nhà thầu) và các bộ, ngành có liên quan.\n3. Trong thời hạn 15 ngày kể từ ngày nhận được hồ\nsơ lấy ý kiến của Bộ Công Thương, các bộ, ngành phải có ý kiến bằng văn bản về\nnội dung thuộc phạm vi quản lý nhà nước của mình gửi Bộ Công Thương.\n4. Trong thời hạn 45 ngày kể từ ngày nhận được hồ\nsơ hợp lệ, Bộ Công Thương hoàn thành thẩm định đề nghị mở rộng diện tích hợp đồng dầu khí hoặc hợp nhất phát hiện dầu khí, mỏ dầu khí, trình Thủ tướng Chính phủ\nxem xét, phê duyệt. Hồ sơ bao gồm:\na) Văn bản báo cáo Thủ tướng Chính phủ kết quả thẩm\nđịnh và đề nghị phê duyệt mở rộng diện tích hợp đồng dầu khí hoặc hợp nhất phát hiện dầu khí, mỏ dầu khí;\nb) Hồ sơ theo quy định tại khoản 1 Điều này;\nc) Báo cáo tổng hợp tiếp thu, giải trình ý kiến của các bộ, ngành và bản sao văn bản góp ý của các bộ, ngành.\n5. Thỏa thuận nguyên tắc hợp nhất phát hiện dầu khí, mỏ dầu khí sẽ được nhà thầu trình trong kế hoạch đại cương phát triển mỏ dầu khí; thỏa thuận hợp nhất phát hiện dầu khí, mỏ dầu khí sẽ được nhà thầu trình trong kế hoạch khai thác sớm mỏ dầu khí, kế hoạch phát triển mỏ dầu khí.\nĐiều 33. Hồ sơ, trình tự, thủ\ntục thẩm định và phê duyệt chuyển nhượng quyền và nghĩa vụ trong hợp đồng dầu khí và cấp giấy chứng nhận đăng ký đầu tư điều chỉnh 1. Căn cứ khoản 1 Điều 36 Luật Dầu khí, trên cơ sở đề nghị của nhà thầu được Tập đoàn Dầu khí Việt Nam thông qua, Tập đoàn Dầu khí Việt Nam trình Bộ Công Thương 02 bộ hồ sơ (gồm 01 bộ hồ\nsơ gốc và 01 bộ hồ sơ bản sao, gửi trực tiếp hoặc qua bưu chính) đề nghị phê\nduyệt chuyển nhượng quyền và nghĩa vụ trong hợp đồng dầu khí để thẩm định. Hồ\nsơ bao gồm:\na) Văn bản đề nghị phê duyệt chuyển nhượng quyền và\nnghĩa vụ trong hợp đồng dầu khí và cấp giấy chứng nhận đăng ký đầu tư điều chỉnh,\ntrong đó nêu rõ lý do và việc đáp ứng điều kiện tại khoản 1 Điều 36 Luật Dầu khí;\nb) Đánh giá của Tập đoàn Dầu khí Việt Nam về đề xuất của nhà thầu; văn bản tiếp thu, giải trình của nhà thầu (nếu có);\nc) Bản sao có chứng thực giấy chứng nhận đăng ký hoạt\nđộng, điều lệ công ty và báo cáo tài chính 03 năm gần nhất của bên nhận chuyển nhượng là tổ chức; bản sao có chứng thực giấy chứng minh nhân dân hoặc căn cước công dân hoặc hộ chiếu và tài liệu chứng minh khả năng tài chính đối với bên nhận chuyển nhượng là cá nhân;\nd) Hợp đồng hoặc thỏa thuận chuyển nhượng quyền và\nnghĩa vụ trong hợp đồng dầu khí, trong đó quy định cụ thể về trách nhiệm thực hiện nghĩa vụ thuế chuyển nhượng của các bên liên quan và các nghĩa vụ tài chính khác theo quy định của pháp luật Việt Nam;\nđ) Thỏa thuận sửa đổi hợp đồng dầu khí đã được thống nhất giữa Tập đoàn Dầu khí Việt Nam và nhà thầu;\ne) Bảo lãnh thực hiện nghĩa vụ hợp đồng của bên nhận chuyển nhượng quyền lợi tham gia trong hợp đồng dầu khí do ngân hàng thương mại phát hành hoặc bảo lãnh của công ty mẹ của bên nhận chuyển nhượng hoặc hình thức bảo lãnh khác theo yêu cầu của Tập đoàn Dầu khí Việt Nam (nếu cần thiết trên cơ\nsở đánh giá báo cáo tài chính);\ng) Tờ khai thuế và giải trình số thuế chuyển nhượng\n(nếu có) theo quy định pháp luật về thuế; thông báo của cơ quan thuế về việc đã\nnhận được hồ sơ khai thuế theo quy định pháp luật về thuế;\nh) Các văn bản, tài liệu khác có liên quan.\n2. Trong thời hạn 05 ngày làm việc kể từ ngày nhận\nđược hồ sơ hợp lệ, Bộ Công Thương gửi hồ sơ lấy ý kiến của Bộ Kế hoạch và Đầu tư, Bộ Tài chính, Bộ Tư pháp, Bộ Quốc phòng, Bộ Ngoại giao, Bộ Công an, Ủy ban Quản lý vốn nhà nước tại doanh nghiệp (trong trường hợp Tập đoàn Dầu khí Việt Nam tham gia hợp đồng dầu khí với tư cách nhà thầu) và các bộ, ngành có liên quan.\n3. Trong thời hạn 15 ngày kể từ ngày nhận được hồ\nsơ lấy ý kiến của Bộ Công Thương, các bộ, ngành phải có ý kiến bằng văn bản về\nnội dung thuộc phạm vi quản lý nhà nước của mình gửi Bộ Công Thương.\n4. Trong thời hạn 45 ngày kể từ ngày nhận được hồ\nsơ hợp lệ, Bộ Công Thương hoàn thành thẩm định đề nghị chuyển nhượng quyền và\nnghĩa vụ trong hợp đồng dầu khí, trình Thủ tướng Chính phủ xem xét, phê duyệt.\nHồ sơ bao gồm:\na) Tờ trình Thủ tướng Chính phủ về kết quả thẩm định và đề nghị phê duyệt chuyển nhượng quyền và nghĩa vụ trong hợp đồng dầu khí;\nb) Hồ sơ theo quy định tại khoản 1 Điều này;\nc) Báo cáo tổng hợp tiếp thu, giải trình ý kiến của các bộ, ngành và bản sao văn bản góp ý của các bộ, ngành.\n5. Trong thời hạn 05 ngày làm việc sau khi nhận được phê duyệt của Thủ tướng Chính phủ về việc chuyển nhượng quyền và nghĩa vụ trong hợp đồng dầu khí, Bộ Công Thương cấp giấy chứng nhận đăng ký đầu tư điều chỉnh cho nhà thầu và Tập đoàn Dầu khí Việt Nam, đồng thời gửi bản chính đến Bộ Tài chính, Bộ Kế hoạch và Đầu tư, Bộ Tư pháp và cơ quan thuế.\n6. Trường hợp thay đổi chủ sở hữu của nhà thầu đang nắm giữ quyền lợi tham gia trong hợp đồng dầu khí, nhà thầu thực hiện việc kê\nkhai và nộp thuế thay cho chủ sở hữu đối với phần thu nhập phát sinh có liên quan đến hợp đồng dầu khí ở Việt Nam (nếu có) hoặc báo cáo gửi cơ quan thuế\ntrong trường hợp không thuộc đối tượng chịu thuế theo quy định của pháp luật Việt Nam. Tờ khai thuế hoặc báo cáo gửi cơ quan thuế và thông báo của cơ quan thuế về\nviệc đã nhận được tài liệu do nhà thầu gửi là các tài liệu được yêu cầu gửi kèm hồ sơ báo cáo cơ quan có thẩm quyền về việc thay đổi chủ sở hữu. Đối với trường hợp chuyển nhượng diễn ra ở ngoài Việt Nam, hồ sơ phải có đầy đủ các thông tin:\nquốc gia, lãnh thổ, thời điểm hoàn thành giao dịch chuyển nhượng; việc thực hiện nghĩa vụ thuế đối với giao dịch chuyển nhượng có bao gồm giá trị tài sản, quyền lợi tham gia hợp đồng dầu khí tại Việt Nam hay không; trong trường hợp có bao gồm giá trị tài sản, quyền lợi tham gia hợp đồng dầu khí tại Việt Nam thì cần nêu rõ căn cứ, cách thức xác định giá trị đối với phần tài sản, quyền lợi tại Việt Nam. Trường hợp công ty mẹ, chủ sở hữu trực tiếp của nhà thầu đã cấp thư bảo lãnh thực hiện hợp đồng dầu khí trước đó, nhà thầu phải cung cấp thư bảo lãnh của chủ sở hữu mới và phải được Tập đoàn Dầu khí Việt Nam chấp thuận.\n7. Trường hợp nhà thầu thực hiện việc sáp nhập, hợp nhất, chia, tách, đổi tên, chuyển quốc tịch công ty hoặc các hình thức khác làm thay đổi các thông tin cơ bản của nhà thầu được ghi nhận trong giấy chứng nhận\nđăng ký đầu tư hoặc trong hợp đồng dầu khí, trừ trường hợp quy định tại khoản 6\nĐiều này, nhà thầu phải thực hiện thủ tục điều chỉnh giấy chứng nhận đăng ký đầu tư và phải kê khai và nộp các loại thuế nếu có phát sinh thu nhập chịu thuế\ntheo quy định của pháp luật Việt Nam và các điều ước quốc tế mà Việt Nam là\nthành viên.\n8. Trong thời hạn 15 ngày kể từ ngày nhà thầu thay\nđổi địa chỉ hoặc người đại diện theo pháp luật, nhà thầu phải gửi văn bản thông báo tới Bộ Công Thương, Tập đoàn Dầu khí Việt Nam và các nhà thầu có liên quan trong hợp đồng dầu khí.\n9. Nhà thầu chịu trách nhiệm về tính trung thực,\nchính xác trong việc khai thuế và nộp thuế (nếu có) hoặc báo cáo gửi cơ quan thuế trong trường hợp không thuộc đối tượng chịu thuế theo quy định của pháp luật;\nbị xử lý theo quy định của pháp luật nếu kê khai, báo cáo không trung thực.\nĐiều 34. Hồ sơ, trình tự, thủ\ntục thẩm định và phê duyệt thực hiện quyền tham gia, quyền ưu tiên mua trước quyền lợi tham gia, tiếp nhận quyền lợi tham gia trong hợp đồng dầu khí của Tập đoàn Dầu khí Việt Nam 1. Căn cứ quy định tại khoản 1, khoản 2 Điều 39 Luật Dầu khí, trên cơ sở các điều kiện được thỏa thuận giữa nhà\nthầu và Tập đoàn Dầu khí Việt Nam, Tập đoàn Dầu khí Việt Nam trình Bộ Công Thương 02 bộ hồ sơ (gồm 01 bộ hồ sơ gốc và 01 bộ hồ sơ bản sao, gửi trực tiếp hoặc qua bưu chính) đề nghị phê duyệt thực hiện quyền tham gia vào hợp đồng dầu khí hoặc quyền ưu tiên mua trước quyền lợi tham gia mà nhà thầu có ý định chuyển nhượng trong hợp đồng dầu khí đã được ký kết hoặc tiếp nhận toàn bộ quyền lợi của nhà thầu trong trường hợp nhà thầu quyết định rút khỏi hợp đồng dầu khí vì lý\ndo đặc biệt để thẩm định. Hồ sơ bao gồm:\na) Văn bản đề nghị phê duyệt thực hiện quyền tham gia hoặc quyền ưu tiên mua trước quyền lợi tham gia hoặc tiếp nhận quyền lợi tham gia trong hợp đồng dầu khí và cấp giấy chứng nhận đăng ký đầu tư điều chỉnh,\nbao gồm báo cáo đánh giá cơ hội đầu tư;\nb) Thông báo của Tập đoàn Dầu khí Việt Nam về việc thực hiện quyền tham gia hoặc thỏa thuận giữa Tập đoàn Dầu khí Việt Nam và nhà\nthầu về việc thực hiện quyền ưu tiên mua trước quyền lợi tham gia hoặc tiếp nhận quyền lợi tham gia trong hợp đồng dầu khí; văn bản của Thủ tướng Chính phủ yêu cầu Tập đoàn Dầu khí Việt Nam tiếp nhận quyền lợi tham gia của nhà thầu rút khỏi hợp đồng dầu khí vì lý do đặc biệt;\nc) Thỏa thuận sửa đổi hợp đồng dầu khí đã được thống nhất giữa Tập đoàn Dầu khí Việt Nam và nhà thầu;\nd) Các văn bản, tài liệu khác có liên quan.\n2. Trong thời hạn 05 ngày làm việc kể từ ngày nhận\nđược hồ sơ hợp lệ, Bộ Công Thương gửi hồ sơ lấy ý kiến của Bộ Kế hoạch và Đầu tư, Bộ Tài chính, Bộ Tư pháp, Bộ Quốc phòng, Bộ Ngoại giao, Bộ Công an, Ủy ban Quản lý vốn nhà nước tại doanh nghiệp và các bộ, ngành có liên quan.\n3. Trong thời hạn 15 ngày kể từ ngày nhận được hồ\nsơ lấy ý kiến của Bộ Công Thương, các bộ, ngành phải có ý kiến bằng văn bản về\nnội dung thuộc phạm vi quản lý nhà nước của mình gửi Bộ Công Thương.\n4. Trong thời hạn 45 ngày kể từ ngày nhận được hồ\nsơ hợp lệ, Bộ Công Thương hoàn thành thẩm định đề nghị thực hiện quyền tham gia hoặc quyền ưu tiên mua trước quyền lợi tham gia hoặc tiếp nhận quyền lợi tham gia trong hợp đồng dầu khí của Tập đoàn Dầu khí Việt Nam, trình Thủ tướng Chính phủ xem xét, phê duyệt. Hồ sơ bao gồm:\na) Văn bản báo cáo Thủ tướng Chính phủ kết quả thẩm\nđịnh và đề nghị phê duyệt thực hiện quyền tham gia hoặc quyền ưu tiên mua trước quyền lợi tham gia hoặc tiếp nhận quyền lợi tham gia trong hợp đồng dầu khí của Tập đoàn Dầu khí Việt Nam;\nb) Hồ sơ theo quy định tại khoản 1 Điều này;\nc) Báo cáo tổng hợp tiếp thu, giải trình ý kiến của các bộ, ngành và bản sao văn bản góp ý của các bộ, ngành.\n5. Trong thời hạn 05 ngày làm việc kể từ ngày nhận\nđược phê duyệt của Thủ tướng Chính phủ về việc thực hiện quyền tham gia hoặc quyền ưu tiên mua trước quyền lợi tham gia hoặc tiếp nhận quyền lợi tham gia trong hợp đồng dầu khí của Tập đoàn Dầu khí Việt Nam, Bộ Công Thương cấp giấy chứng nhận đăng ký đầu tư điều chỉnh cho nhà thầu và Tập đoàn Dầu khí Việt Nam,\nđồng thời gửi bản chính đến Bộ Tài chính, Bộ Kế hoạch và Đầu tư, Bộ Tư pháp và\ncơ quan thuế.\nĐiều 35. Hồ sơ, trình tự, thủ\ntục thành lập, chấm dứt, thay đổi văn phòng điều hành của người điều hành nước ngoài trong hợp đồng dầu khí\n1. Trong thời hạn 60 ngày kể từ ngày giấy chứng nhận\nđăng ký đầu tư có hiệu lực, người điều hành nộp 01 bộ hồ sơ gốc đăng ký thành lập văn phòng điều hành đến Sở Kế hoạch và Đầu tư nơi đặt văn phòng điều hành. Hồ\nsơ bao gồm:\na) Văn bản đăng ký thành lập văn phòng điều hành do\nđại diện có thẩm quyền của người điều hành ký;\nb) Bản sao có chứng thực giấy chứng nhận đăng ký đầu tư;\nc) Quyết định bổ nhiệm hoặc hợp đồng thuê đối với trường văn phòng điều hành của người điều hành;\nd) Bản sao có chứng thực chứng minh nhân dân hoặc căn cước công dân hoặc hộ chiếu của trường văn phòng điều hành.\n2. Trong thời hạn 15 ngày kể từ ngày nhận được hồ\nsơ hợp lệ, Sở Kế hoạch và Đầu tư cấp giấy chứng nhận đăng ký hoạt động văn phòng điều hành.\n3. Thời hạn hoạt động của văn phòng điều hành theo hiệu lực của giấy chứng nhận đăng ký đầu tư hoặc giấy chứng nhận đăng ký đầu tư\nđiều chỉnh, trừ trường hợp được gia hạn để hoàn thành các nghĩa vụ với nước chủ\nnhà sau khi kết thúc hợp đồng dầu khí.\n4. Sở Kế hoạch và Đầu tư gửi Bộ Công Thương, Bộ Kế\nhoạch và Đầu tư, Bộ Tài chính, Bộ Tư pháp và Tập đoàn Dầu khí Việt Nam bản sao giấy chứng nhận đăng ký hoạt động văn phòng điều hành.\n5. Trường hợp thay đổi địa chỉ văn phòng điều hành,\nthay đổi trưởng văn phòng điều hành, tiếp nhận lại văn phòng điều hành do thay\nđổi người điều hành và thay đổi các thông tin khác trên giấy chứng nhận đăng ký\nhoạt động văn phòng điều hành đã được cấp, trong thời hạn 15 ngày kể từ ngày có\nthay đổi, người điều hành thực hiện thủ tục điều chỉnh các thông tin trên giấy chứng nhận đăng ký hoạt động văn phòng điều hành đã được cấp theo quy trình tại khoản 1 Điều này và thông báo với cơ quan thuế các nội dung thay đổi.\n6. Trường hợp chấm dứt hoạt động của văn phòng điều hành, người điều hành gửi 01 bộ hồ sơ gốc đề nghị chấm dứt văn phòng điều hành\nđến Sở Kế hoạch và Đầu tư nơi đặt văn phòng điều hành. Hồ sơ bao gồm:\na) Thông báo chấm dứt hoạt động của văn phòng điều hành do đại diện có thẩm quyền của người điều hành ký;\nb) Danh sách người lao động và quyền lợi tương ứng hiện hành của người lao động;\nc) Con dấu và giấy chứng nhận mẫu dấu (nếu có);\nd) Giấy xác nhận của cơ quan thuế về việc văn phòng\nđiều hành đã hoàn thành nghĩa vụ thuế và đóng mã số thuế trong trường hợp kết thúc hợp đồng dầu khí;\nđ) Bản chính giấy đăng ký thành lập văn phòng điều hành.\n7. Trong thời hạn 15 ngày kể từ ngày nhận được hồ\nsơ hợp lệ, Sở Kế hoạch và Đầu tư có văn bản thông báo xóa tên văn phòng điều hành và gửi đến người điều hành, Bộ Công Thương, Bộ Kế hoạch và Đầu tư, Bộ Tài chính, Bộ Tư pháp, Tập đoàn Dầu khí Việt Nam và cơ quan thuế.\n8. Văn phòng điều hành có trách nhiệm hoàn thành các nghĩa vụ theo quy định của pháp luật Việt Nam trước khi chấm dứt hoạt động.\nĐiều 36. Hồ sơ, trình tự, thủ\ntục thẩm định và phê duyệt kế hoạch xử lý tiếp theo đối với mỏ, cụm mỏ, lô dầu khí khi hợp đồng dầu khí hết thời hạn 1. Trường hợp nhà thầu đang thực hiện hợp đồng dầu khí đề xuất ký hợp đồng dầu khí mới khi hợp đồng dầu khí hiện hữu hết thời hạn theo quy định tại khoản 2 Điều 40 Luật Dầu khí, Tập đoàn Dầu khí Việt Nam thực hiện quy trình chỉ định thầu theo quy định tại Điều 21 Luật Dầu khí và Nghị định này. Tập đoàn Dầu khí Việt Nam phê duyệt và\nphát hành hồ sơ yêu cầu.\n2. Trường hợp các bên nhà thầu đang thực hiện hợp đồng dầu khí có đề xuất ký hợp đồng dầu khí mới với các điều kiện kinh tế, kỹ thuật khác nhau, Tập đoàn Dầu khí Việt Nam báo cáo Bộ Công Thương thẩm định, trình Thủ\ntướng Chính phủ phê duyệt áp dụng hình thức chào thầu cạnh tranh đối với các bên nhà thầu nêu trên theo quy định tại Nghị định này.\n3. Trường hợp nhà thầu đang thực hiện hợp đồng dầu khí không đề xuất ký hợp đồng dầu khí mới, tối thiểu 06 tháng trước thời điểm hợp\nđồng dầu khí hết thời hạn, Tập đoàn Dầu khí Việt Nam trình Bộ Công Thương 02 bộ\nhồ sơ (gồm 01 bộ hồ sơ gốc và 01 bộ hồ sơ bản sao, gửi trực tiếp hoặc qua bưu chính) đề xuất phê duyệt kế hoạch xử lý tiếp theo đối với mỏ, cụm mỏ, lô dầu khí khi hợp đồng dầu khí hết thời hạn để thẩm định. Hồ sơ bao gồm:\na) Tờ trình đề nghị phê duyệt kế hoạch xử lý tiếp theo đối với mỏ, cụm mỏ, lô dầu khí khi hợp đồng dầu khí hết thời hạn, trong đó\nđánh giá tình trạng mỏ, cụm mỏ, lô dầu khí; ước tính tài nguyên, trữ lượng dầu khí còn lại;\nb) Dự kiến phương án triển khai khi hợp đồng dầu khí hết thời hạn theo một trong các phương án: không tiếp tục khai thác mỏ, cụm mỏ, lô dầu khí; hoặc tiếp tục khai thác mỏ, cụm mỏ, lô dầu khí trên cơ sở hợp đồng dầu khí mới với điều kiện kinh tế, kỹ thuật phù hợp; hoặc giao Tập đoàn Dầu khí\nViệt Nam khai thác tận thu mỏ, cụm mỏ, lô dầu khí;\nc) Dự thảo cơ chế tài chính để điều hành hoạt động dầu khí trong giai đoạn từ khi tiếp nhận mỏ, cụm mỏ, lô dầu khí đến khi hợp đồng dầu khí mới được ký kết;\nd) Các văn bản, tài liệu khác có liên quan.\n4. Trong thời hạn 05 ngày làm việc kể từ ngày nhận\nđược hồ sơ hợp lệ, Bộ Công Thương gửi hồ sơ lấy ý kiến của Bộ Kế hoạch và Đầu tư, Bộ Tài chính, Bộ Tư pháp, Bộ Quốc phòng, Bộ Ngoại giao, Bộ Công an, Ủy ban Quản lý vốn nhà nước tại doanh nghiệp và các bộ, ngành có liên quan.\n5. Trong thời hạn 15 ngày kể từ ngày nhận được hồ\nsơ lấy ý kiến của Bộ Công Thương, các bộ, ngành phải có ý kiến bằng văn bản về\nnội dung thuộc phạm vi quản lý nhà nước của mình gửi Bộ Công Thương.\n6. Trong thời hạn 45 ngày kể từ ngày nhận được hồ\nsơ hợp lệ, Bộ Công Thương hoàn thành thẩm định kế hoạch xử lý tiếp theo đối với mỏ, cụm mỏ, lô dầu khí trước khi hợp đồng dầu khí hết thời hạn, trình Thủ tướng Chính phủ xem xét, phê duyệt. Hồ sơ bao gồm:\na) Tờ trình Thủ tướng Chính phủ về kết quả thẩm định và đề nghị phê duyệt kế hoạch xử lý tiếp theo đối với mỏ, cụm mỏ, lô dầu khí\nkhi hợp đồng dầu khí hết thời hạn;\nb) Hồ sơ theo quy định tại khoản 3 Điều này;\nc) Báo cáo tổng hợp tiếp thu, giải trình ý kiến của các bộ, ngành và bản sao văn bản góp ý của các bộ, ngành.\n7. Căn cứ quyết định của Thủ tướng Chính phủ phê\nduyệt kế hoạch xử lý tiếp theo đối với mỏ, cụm mỏ, lô dầu khí khi hợp đồng dầu khí hết thời hạn:\na) Trường hợp không tiếp tục khai thác mỏ, cụm mỏ,\nlô dầu khí, nhà thầu có trách nhiệm tiến hành thu dọn các công trình dầu khí theo kế hoạch thu dọn công trình dầu khí đã được phê duyệt;\nb) Trường hợp tiếp tục khai thác mỏ, cụm mỏ, lô dầu khí, Tập đoàn Dầu khí Việt Nam tiếp nhận nguyên trạng mỏ, cụm mỏ, lô dầu khí từ\nnhà thầu và thực hiện điều hành hoạt động dầu khí theo cơ chế tài chính quy định tại Điều 37 Nghị định này cho đến khi hợp đồng dầu khí mới\nđược ký kết nhưng không quá 02 năm; lựa chọn và chỉ định đơn vị vận hành hoạt động dầu khí trong thời gian này (nếu cần thiết). Hết thời hạn 02 năm kể từ khi tiếp nhận mỏ, cụm mỏ, lô dầu khí mà không có nhà thầu quan tâm hoặc không lựa chọn\nđược nhà thầu ký kết hợp đồng dầu khí mới, Tập đoàn Dầu khí Việt Nam báo cáo Bộ\nCông Thương thẩm định, trình Thủ tướng Chính phủ phê duyệt kế hoạch xử lý tiếp theo đối với mỏ, cụm mỏ, lô dầu khí theo một trong hai phương án quy định tại khoản 3 Điều 41 Luật Dầu khí. Hồ sơ, trình tự, thủ tục thẩm định và phê duyệt kế hoạch xử lý tiếp theo đối với mỏ, cụm mỏ, lô dầu khí được thực hiện theo quy định tại các khoản 3, 4, 5 và 6 Điều này;\nc) Trường hợp khai thác tận thu mỏ, cụm mỏ, lô dầu khí, Tập đoàn Dầu khí Việt Nam tiến hành hoạt động dầu khí theo quy định tại Chương VIII Nghị định này.\nĐiều 37. Cơ chế tài chính để\nđiều hành hoạt động dầu khí trong giai đoạn từ khi tiếp nhận mỏ, cụm mỏ, lô dầu khí đến khi hợp đồng dầu khí mới được ký kết Cơ chế tài chính điều hành hoạt động dầu khí trong giai đoạn từ khi tiếp nhận mỏ, cụm mỏ, lô dầu khí đến khi hợp đồng dầu khí mới\nđược ký kết theo quy định tại khoản 3 Điều 41 Luật Dầu khí\nvà điểm b khoản 7 Điều 36 Nghị định này được thực hiện như\nsau: chênh lệch giữa doanh thu và chi phí thực hiện hoạt động dầu khí (bao gồm cả khoản trích nộp quy bảo đảm nghĩa vụ tài chính cho hoạt động thu dọn công trình dầu khí, nếu cần thiết) được nộp vào ngân sách nhà nước trên nguyên tắc bảo\nđảm hiệu quả và kiểm soát chặt chẽ chi phí hoạt động dầu khí. Chi phí thực hiện hoạt động dầu khí trong trường hợp này là các chi phí được trừ khi xác định thu nhập chịu thuế thu nhập doanh nghiệp theo quy định của pháp luật về thuế thu nhập doanh nghiệp, pháp luật về dầu khí, các văn bản quy phạm pháp luật có liên quan và các điều ước quốc tế mà Việt Nam là thành viên. Cơ chế tài chính điều hành hoạt động dầu khí trong khi chờ hợp đồng dầu khí mới được ký kết bao gồm các nội dung chính sau:\n1. Doanh thu bán dầu khí từ hoạt động dầu khí và\ncác doanh thu khác (nếu có) được sử dụng cho các mục đích sau:\na) Thanh toán và hoàn trả toàn bộ các chi phí hợp lý, hợp lệ đã thực hiện trong quá trình triển khai hoạt động dầu khí theo chương trình hoạt động và ngân sách được phê duyệt;\nb) Tạm ứng các chi phí ước tính sẽ phát sinh cho kỳ\ntiếp theo phù hợp với chương trình hoạt động và ngân sách đã được phê duyệt;\nc) Trang trải chi phí đã thực hiện đầu tư bổ sung nhằm gia tăng trữ lượng, duy trì sản lượng khai thác dầu khí; giá trị trích lập quỹ bảo đảm nghĩa vụ thu dọn công trình dầu khí đối với các hạng mục công trình\nđầu tư bổ sung (nếu có).\n2. Thực hiện nộp ngân sách nhà nước hằng năm đối với các khoản tiền sau:\na) Toàn bộ doanh thu sau khi đã sử dụng cho các mục\nđích được quy định tại khoản 1 Điều này;\nb) Phần ngân sách dư còn lại (nếu có) trong trường hợp chi phí thực hiện cuối kỳ ít hơn ngân sách thực tế đã được phê duyệt;\nc) Các khoản lãi phát sinh (nếu có) tính trên số dư\ncác khoản dự phòng được phép để lại khi kết thúc năm tài chính;\nd) Giá trị còn lại (nếu có) của quỹ bảo đảm nghĩa vụ\nthu dọn công trình dầu khí sau khi hoàn thành thu dọn công trình dầu khí, được xác định trên cơ sở kết quả kiểm toán theo quy định;\nđ) Giá trị chênh lệch (nếu có) giữa doanh thu có được từ việc thanh lý tài sản không còn cần dùng cho hoạt động dầu khí; các thiết bị,\nphương tiện, vật tư và phế thải thu gom được trong quá trình thu dọn công trình dầu khí; chi phí thực tế hợp lý, hợp lệ tương ứng trong từng trường hợp.\n3. Trách nhiệm của Tập đoàn Dầu khí Việt Nam a) Xây dựng và phê duyệt chương trình hoạt động và\nngân sách hằng năm;\nb) Xây dựng và phê duyệt quy trình lựa chọn nhà thầu cung cấp dịch vụ, mua sắm hàng hóa trong hoạt động khai thác tận thu mỏ, cụm mỏ,\nlô dầu khí phù hợp với quy định của Luật Dầu khí và nguyên tắc áp dụng đối với hợp đồng dầu khí;\nc) Định kỳ hằng quý báo cáo Bộ Công Thương tình hình thực hiện hoạt động dầu khí;\nd) Đề xuất phương án xử lý tiếp theo phù hợp với quy định tại khoản 3 Điều 41 Luật Dầu khí.\nĐiều 38. Cơ chế quản lý, hạch toán, sử dụng tài sản và tiếp nhận toàn bộ quyền lợi tham gia từ nhà thầu trong trường hợp đặc biệt 1. Trường hợp nhà thầu quyết định rút khỏi hợp đồng dầu khí vì lý do đặc biệt quy định tại khoản 2 Điều 39 Luật Dầu khí, Tập đoàn Dầu khí Việt Nam tiếp nhận toàn bộ quyền lợi tham gia của nhà\nthầu trong hợp đồng dầu khí và tiếp nhận nguyên trạng thông tin, dữ liệu, tài liệu, mẫu vật, công trình dầu khí và tài sản khác (nếu có) theo thỏa thuận ký với nhà thầu.\n2. Giá trị tài sản nhà nước do Tập đoàn Dầu khí Việt Nam tiếp nhận và quản lý theo quy định tại khoản 1 Điều này là giá trị được Tập\nđoàn Dầu khí Việt Nam thay mặt Nhà nước thanh toán cho nhà thầu từ nguồn ngân sách nhà nước theo thỏa thuận ký giữa Tập đoàn Dầu khí Việt Nam và nhà thầu.\n3. Tập đoàn Dầu khí Việt Nam tổ chức quản lý và lập báo cáo riêng để theo dõi quyền lợi tham gia tiếp nhận từ nhà thầu và thông tin, dữ liệu, tài liệu, mẫu vật, công trình dầu khí và tài sản khác (nếu có)\nquy định tại khoản 1 Điều này và được quy định cụ thể tại Quyết định của Thủ tướng Chính phủ giao Tập đoàn Dầu khí Việt Nam tiếp nhận toàn bộ quyền lợi tham gia từ\nnhà thầu trong trường hợp đặc biệt, không phản ánh vào vốn nhà nước đầu tư tại doanh nghiệp và báo cáo tài chính của Tập đoàn Dầu khí Việt Nam.\n4. Hằng năm, Tập đoàn Dầu khí Việt Nam xây dựng kế\nhoạch chi phí quản lý, theo dõi tài sản và chi phí cho các vấn đề phát sinh có\nliên quan để duy trì hợp đồng dầu khí, được xử lý theo quy định tại điểm d khoản 4 Điều 64 Luật Dầu khí và kết quả kiểm toán được Hội đồng thành viên Tập đoàn Dầu khí Việt Nam phê duyệt.\n5. Bộ Tài chính chủ trì, phối hợp với Ủy ban Quản lý vốn nhà nước tại doanh nghiệp hướng dẫn, giám sát việc quản lý tài sản quy định tại khoản 1 Điều này của Tập đoàn Dầu khí Việt Nam.\nChương V AN TOÀN TRONG HOẠT ĐỘNG DẦU KHÍ\nĐiều 39. Tài liệu về quản lý\nan toàn 1. Khi tiến hành hoạt động dầu khí, nhà thầu có\ntrách nhiệm xây dựng các tài liệu về quản lý an toàn theo quy định tại điểm a khoản 4 Điều 8 Luật Dầu khí bao gồm:\na) Chương trình quản lý an toàn;\nb) Báo cáo đánh giá rủi ro;\nc) Kế hoạch ứng cứu khẩn cấp.\n2. Chương trình quản lý an toàn gồm các nội dung chính sau:\na) Chính sách và các mục tiêu về an toàn;\nb) Tổ chức công tác an toàn, phân công trách nhiệm về\ncông tác an toàn;\nc) Chương trình huấn luyện an toàn; yêu cầu về năng lực, trình độ và kinh nghiệm của người lao động;\nd) Danh mục các văn bản quy phạm pháp luật, quy chuẩn kỹ thuật quốc gia, tiêu chuẩn quốc gia, quy định an toàn, các điều ước quốc tế\nmà Việt Nam là thành viên hoặc các tiêu chuẩn khác phù hợp với thông lệ công nghiệp dầu khí quốc tế được chấp nhận chung;\nđ) Đánh giá sự tuân thủ pháp luật bao gồm các yêu cầu phải thực hiện theo quy định về giấy phép, giấy chứng nhận chất lượng an toàn kỹ\nthuật và bảo vệ môi trường;\ne) Quản lý an toàn của các nhà thầu dịch vụ, tổ chức,\ncá nhân.\n3. Báo cáo đánh giá rủi ro bao gồm các nội dung chính sau:\na) Xác định mục đích và các mục tiêu đánh giá rủi ro;\nb) Mô tả các hoạt động, các công trình dầu khí;\nc) Xác định, phân tích, đánh giá rủi ro định tính và định lượng;\nd) Các biện pháp giảm thiểu rủi ro.\n4. Kế hoạch ứng cứu khẩn cấp phải dựa trên kết quả\nbáo cáo đánh giá rủi ro bao gồm các nội dung chính sau:\na) Mô tả và phân loại các tình huống khẩn cấp có thể\nxảy ra;\nb) Sơ đồ tổ chức, phân cấp trách nhiệm, trách nhiệm của từng cá nhân, hệ thống báo cáo khi xảy ra sự cố, tai nạn hoặc xuất hiện các tình huống nguy hiểm;\nc) Quy trình ứng cứu các tình huống;\nd) Mô tả các nguồn lực bên trong và bên ngoài sẵn có hoặc sẽ huy động để ứng cứu hiệu quả các tình huống khẩn cấp;\nđ) Địa chỉ liên lạc và thông tin trong ứng cứu khẩn cấp với các bộ phận nội bộ và báo cáo các cơ quan có thẩm quyền liên quan;\ne) Kế hoạch huấn luyện và diễn tập ứng cứu khẩn cấp;\ng) Kế hoạch khôi phục hoạt động của công trình dầu khí bao gồm công tác điều tra, đánh giá nguyên nhân, hậu quả để tái lập và nâng cao mức an toàn của công trình;\nh) Kế hoạch ứng cứu khẩn cấp phải phù hợp với hệ thống\nứng cứu khẩn cấp của Ủy ban Quốc gia ứng phó sự cố, thiên tai và tìm kiếm cứu nạn,\nđịa phương và Tập đoàn Dầu khí Việt Nam (đối với các đơn vị thuộc Tập đoàn Dầu khí Việt Nam, các liên doanh dầu khí và các nhà thầu dầu khí);\ni) Các tổ chức, cá nhân hoạt động dầu khí có thể hợp tác để xây dựng kế hoạch ứng cứu khẩn cấp chung.\n5. Bộ Công Thương hướng dẫn chi tiết nội dung các tài liệu quản lý an toàn trong hoạt động dầu khí.\nĐiều 40. Hồ sơ, trình tự, thủ\ntục thẩm định và phê duyệt các tài liệu về quản lý an toàn 1. Trước khi tiến hành các hoạt động khoan tìm kiếm thăm dò dầu khí, xây dựng mới hoặc hoán cải công trình dầu khí, thu dọn công trình dầu khí khi kết thúc hoạt động dầu khí, trên cơ sở các tài liệu về quản lý an toàn quy định tại Điều 39 Nghị định này do nhà thầu lập và được Tập đoàn Dầu khí Việt Nam thông qua, Tập đoàn Dầu khí Việt Nam trình Bộ\nCông Thương 01 bộ hồ sơ gốc đề nghị phê duyệt các tài liệu về quản lý an toàn.\nHồ sơ bao gồm:\na) Tờ trình đề nghị phê duyệt các tài liệu về quản lý an toàn;\nb) Nội dung tài liệu về quản lý an toàn theo quy định tại Điều 39 Nghị định này;\nc) Đánh giá của Tập đoàn Dầu khí Việt Nam về đề xuất của nhà thầu; văn bản tiếp thu, giải trình của nhà thầu (nếu có);\nd) Các văn bản, tài liệu khác có liên quan.\n2. Nội dung thẩm định các tài liệu về quản lý an toàn bao gồm:\na) Đánh giá sự phù hợp của hồ sơ, tài liệu theo quy\nđịnh của Luật Dầu khí và Nghị định này;\nb) Đánh giá sự phù hợp, tính chính xác của nội dung trong các tài liệu;\nc) Xem xét thực tế tại công trình dầu khí (nếu cần thiết).\n3. Việc thẩm định các tài liệu về quản lý an toàn\nđược thực hiện theo hình thức hội đồng thẩm định. Bộ trưởng Bộ Công Thương ban hành quyết định thành lập và quy chế hoạt động của hội đồng thẩm định (bao gồm\nđại diện của các bộ, ngành, tổ chức liên quan, nếu cần thiết).\n4. Trong thời hạn 30 ngày kể từ ngày nhận được hồ\nsơ hợp lệ, hội đồng thẩm định hoàn thành thẩm định các tài liệu về quản lý an toàn, trình Bộ trưởng Bộ Công Thương xem xét, phê duyệt.\n5. Trong thời hạn 05 ngày làm việc kể từ ngày nhận\nđược văn bản thẩm định của hội đồng thẩm định, Bộ trưởng Bộ Công Thương ban hành quyết định phê duyệt các tài liệu về quản lý an toàn.\nĐiều 41. Hệ thống quản lý về\nan toàn 1. Nhà thầu phải xây dựng, duy trì và cập nhật hệ\nthống quản lý về an toàn để đảm bảo an toàn cho toàn bộ các hoạt động dầu khí từ\nkhi bắt đầu giai đoạn tìm kiếm thăm dò dầu khí đến khi kết thúc giai đoạn thu dọn công trình dầu khí.\n2. Nội dung chính của hệ thống quản lý an toàn bao gồm:\na) Chính sách, mục tiêu về an toàn, môi trường lao\nđộng và chương trình, kế hoạch thực hiện các mục tiêu đó;\nb) Danh mục cập nhật các văn bản quy phạm pháp luật có liên quan, các tiêu chuẩn, quy chuẩn kỹ thuật áp dụng;\nc) Các quy trình vận hành, xử lý sự cố và bảo trì\ncông trình, máy, thiết bị; các quy định về quản lý, kiểm tra, kiểm định, chứng nhận chất lượng an toàn kỹ thuật và bảo vệ môi trường cho công trình, máy, thiết bị, hóa chất nguy hiểm;\nd) Các quy định an toàn; biển báo an toàn cho dây chuyền, máy, thiết bị, vật tư, hóa chất, các công việc có yêu cầu nghiêm ngặt về\nan toàn; quản lý lưu giữ tài liệu và báo cáo;\nđ) Hệ thống tổ chức công tác an toàn: phân cấp trách nhiệm, thực hiện nhiệm vụ, các kênh báo cáo; yêu cầu về kỹ năng chuyên môn, kinh nghiệm phù hợp với vị trí công việc;\ne) Đánh giá kết quả thực hiện chương trình quản lý\nan toàn và các giải pháp hoàn thiện, nâng cao chất lượng quản lý an toàn. Năng lực về quản lý an toàn, sức khỏe, môi trường của các nhà thầu phải được kiểm soát đảm bảo phù hợp với hệ thống quản lý an toàn của tổ chức, cá nhân;\ng) Mọi sự thay đổi về tổ chức, kỹ thuật, công nghệ\nvà các yêu cầu khác có ảnh hưởng tới mức độ rủi ro phải được tổ chức, cá nhân cập nhật, đánh giá và kiểm soát nhằm bảo đảm hệ thống quản lý an toàn được thực hiện liên tục, thống nhất.\nĐiều 42. Quản lý rủi ro về an toàn 1. Nhà thầu phải bảo đảm mọi rủi ro phải được xác định,\nphân tích, đánh giá đối với tất cả công trình dầu khí, máy móc, thiết bị, hóa chất, vật liệu nguy hiểm. Kết quả của việc đánh giá rủi ro được sử dụng làm số\nliệu đầu vào để tổ chức thực hiện công tác ứng cứu khẩn cấp.\n2. Công tác quản lý rủi ro bao gồm:\na) Đánh giá rủi ro định tính và định lượng đối với các giai đoạn của hoạt động dầu khí làm cơ sở để triển khai các biện pháp nhằm kiểm soát, giảm thiểu các rủi ro và chứng minh các rủi ro nằm trong mức chấp nhận\nđược theo các quy chuẩn kỹ thuật quốc gia;\nb) Báo cáo đánh giá rủi ro phải được cập nhật định kỳ 05 năm một lần hoặc khi có hoán cải, thay đổi lớn về công nghệ vận hành và tổ\nchức, nhằm tạo cơ sở để đưa ra các quyết định liên quan đến an toàn trong hoạt\nđộng dầu khí;\nc) Nhà thầu phải xác định các vị trí, các điều kiện cụ thể có rủi ro cao cần phải quan tâm về mặt an toàn khi tiến hành hoạt động để\ncó các biện pháp giảm thiểu.\nĐiều 43. Ứng cứu khẩn cấp 1. Nhà thầu phải xây dựng và duy trì hệ thống ứng cứu sự cố khẩn cấp để tiến hành có hiệu quả các hoạt động ứng cứu khi xảy ra các sự\ncố, tai nạn gây nguy hại cho người, môi trường hoặc tài sản. Tùy theo mức độ của sự cố, tai nạn mà nhà thầu phải thông báo cho cơ quan có thẩm quyền theo quy định.\n2. Việc luyện tập và diễn tập xử lý các tình huống khẩn cấp tại các công trình dầu khí phải được tiến hành thường xuyên bảo đảm người lao động hiểu rõ và nắm vững các quy trình ứng cứu với các tình huống khẩn cấp cụ thể. Căn cứ kết quả đánh giá rủi ro để xác định hình thức và tần suất luyện tập. Kết quả luyện tập, diễn tập phải được đánh giá và ghi chép để hoàn thiện kế hoạch ứng cứu khẩn cấp.\n3. Những người lần đầu tiên đến công trình dầu khí\nphải được hướng dẫn chi tiết về tổ chức ứng cứu khẩn cấp, các trang thiết bị an toàn và các lối thoát nạn.\nĐiều 44. An toàn trong thiết kế,\nchế tạo, xây dựng, vận hành công trình dầu khí\n1. Công trình dầu khí phải được thiết kế, chế tạo,\nxây dựng theo quy chuẩn kỹ thuật quốc gia, tiêu chuẩn quốc gia hoặc tiêu chuẩn quốc tế, tiêu chuẩn khu vực, tiêu chuẩn nước ngoài được thừa nhận và áp dụng rộng rãi tuân thủ quy định của pháp luật Việt Nam và các điều ước quốc tế mà Việt Nam là thành viên, bảo đảm các yêu cầu sau:\na) An toàn về công nghệ;\nb) An toàn về xây dựng;\nc) An toàn về phòng chống cháy nổ;\nd) Vùng và hành lang an toàn;\nđ) Các quy định về bảo vệ môi trường;\ne) Chịu được các tải trọng dự kiến trong quá trình vận hành và khi xảy ra sự cố;\ng) Không tạo ra sự cố dây chuyền từ sự cố đơn lẻ.\n2. Việc thiết kế, chế tạo, xây dựng, chạy thử, nghiệm thu công trình dầu khí phải được kiểm tra, chứng nhận bởi cơ quan có thẩm quyền theo quy định của pháp luật đảm bảo sự phù hợp với các quy chuẩn kỹ thuật, tiêu chuẩn công bố áp dụng, tuân thủ quy định của pháp luật Việt Nam và các điều ước quốc tế mà Việt Nam là thành viên.\n3. Trước khi chạy thử, nhà thầu phải tiến hành các công việc kiểm tra, kiểm định, thử nghiệm đối với từng hạng mục công trình và\nphải bảo đảm kế hoạch ứng cứu khẩn cấp, công tác phòng cháy và chữa cháy đã sẵn sàng được triển khai theo quy định. Trong quá trình chạy thử, tổ chức, cá nhân phải áp dụng các biện pháp tăng cường nhằm sẵn sàng ứng cứu kịp thời và có hiệu quả các sự cố, tai nạn có thể xảy ra.\n4. Công trình dầu khí chỉ được đưa vào vận hành sau khi kết quả kiểm tra, kiểm định, thử nghiệm công trình và các nội dung an toàn\nđáp ứng được các yêu cầu đề ra.\n5. Công trình dầu khí phải được vận hành, bảo dưỡng,\nkiểm tra, sửa chữa theo đúng quy định, phù hợp với các quy trình, quy chuẩn kỹ\nthuật, tiêu chuẩn áp dụng được phê duyệt. Nhà thầu phải dừng ngay các hoạt động nếu các hoạt động đó có thể gây nguy hiểm đối với con người, môi trường và công trình dầu khí mà không thể kiểm soát được.\nChương VI TRÌNH TỰ, THỦ TỤC PHÊ\nDUYỆT TRIỂN KHAI HOẠT ĐỘNG DẦU KHÍ\nĐiều 45. Hồ sơ, trình tự, thủ\ntục thẩm định và chấp thuận dự án phát triển mỏ dầu khí có chuỗi đồng bộ các hạng mục công trình, thiết bị dầu khí trên đất liền và trên biển 1. Căn cứ quy định tại khoản 1 Điều 42 Luật Dầu khí, trên cơ sở đề nghị của nhà thầu được Tập đoàn Dầu khí Việt Nam thông qua, Tập đoàn Dầu khí Việt Nam trình Bộ Công Thương 02 bộ hồ sơ (gồm 01 bộ hồ sơ gốc và 01 bộ hồ sơ bản sao, gửi trực tiếp hoặc qua bưu chính) đề\nnghị chấp thuận thực hiện dự án phát triển mỏ dầu khí có chuỗi đồng bộ các hạng mục công trình, thiết bị dầu khí trên đất liền và trên biển để thẩm định. Hồ sơ\nbao gồm:\na) Văn bản đề nghị chấp thuận thực hiện dự án phát triển mỏ dầu khí có chuỗi đồng bộ các hạng mục công trình, thiết bị trên đất liền và trên biển, trong đó nêu rõ lý do và đánh giá, so sánh hiệu quả kinh tế của phương án thực hiện dự án dầu khí có chuỗi đồng bộ với các phương án khác;\nb) Dự thảo nội dung điều chỉnh hợp đồng dầu khí để\nthực hiện dự án phát triển mỏ dầu khí có chuỗi đồng bộ các hạng mục công trình,\nthiết bị trên đất liền và trên biển;\nc) Đánh giá của Tập đoàn Dầu khí Việt Nam về đề xuất của nhà thầu; văn bản tiếp thu, giải trình của nhà thầu (nếu có);\nd) Đề xuất nhu cầu chuyển mục đích sử dụng rừng, đất\n(nếu có) kèm theo báo cáo thuyết minh, bản đồ hiện trạng rừng, đất và các hồ\nsơ, tài liệu khác theo yêu cầu của pháp luật về lâm nghiệp, đất đai và pháp luật có liên quan;\nđ) Các văn bản, tài liệu khác có liên quan.\n2. Trong thời hạn 05 ngày làm việc kể từ ngày nhận\nđược hồ sơ hợp lệ, Bộ Công Thương gửi hồ sơ lấy ý kiến của Bộ Kế hoạch và Đầu tư, Bộ Tài chính, Bộ Tư pháp, Bộ Xây dựng, Bộ Tài nguyên và Môi trường, Bộ Nông nghiệp và Phát triển nông thôn, Bộ Quốc phòng, Bộ Ngoại giao, Bộ Công an, Ủy ban Quản lý vốn nhà nước tại doanh nghiệp (trong trường hợp Tập đoàn Dầu khí Việt Nam tham gia hợp đồng dầu khí với tư cách nhà thầu) và các bộ, ngành, địa phương có liên quan.\n3. Trong thời hạn 15 ngày kể từ ngày nhận được hồ\nsơ lấy ý kiến của Bộ Công Thương, các bộ, ngành, địa phương phải có ý kiến bằng văn bản về nội dung thuộc phạm vi quản lý nhà nước của mình gửi Bộ Công Thương,\ntrong đó Bộ Tài nguyên và Môi trường, Bộ Nông nghiệp và Phát triển nông thôn có\ný kiến về việc chuyển mục đích sử dụng rừng, đất (nếu có) theo quy định của pháp luật về lâm nghiệp, pháp luật về đất đai và pháp luật khác có liên quan.\n4. Trong thời hạn 45 ngày kể từ ngày nhận được hồ\nsơ hợp lệ, Bộ Công Thương hoàn thành thẩm định đề xuất thực hiện dự án phát triển mỏ dầu khí có chuỗi đồng bộ các hạng mục công trình, thiết bị dầu khí trên đất liền và trên biển, trình Thủ tướng Chính phủ xem xét, chấp thuận chủ trương. Hồ\nsơ bao gồm:\na) Văn bản báo cáo Thủ tướng Chính phủ kết quả thẩm\nđịnh và đề nghị chấp thuận chủ trương thực hiện dự án phát triển mỏ dầu khí có\nchuỗi đồng bộ các hạng mục công trình, thiết bị trên đất liền và trên biển;\nb) Hồ sơ theo quy định tại khoản 1 Điều này;\nc) Báo cáo tổng hợp tiếp thu, giải trình ý kiến của các bộ, ngành và bản sao văn bản góp ý của các bộ, ngành.\n5. Đối với việc chuyển mục đích sử dụng rừng, đất (nếu có) của dự án phát triển mỏ dầu khí có chuỗi đồng bộ các hạng mục công trình,\nthiết bị trên đất liền và trên biển, hồ sơ, trình tự, thủ tục thẩm định và chấp thuận chủ trương được thực hiện theo quy định của pháp luật về lâm nghiệp, đất\nđai. Trường hợp việc chấp thuận chủ trương chuyển mục đích sử dụng rừng, đất (nếu có) thuộc thẩm quyền của Quốc hội, hồ sơ gồm:\na) Tờ trình của Chính phủ gửi Quốc hội đề nghị chấp thuận chủ trương chuyển mục đích sử dụng rừng, đất của dự án phát triển mỏ dầu khí có chuỗi đồng bộ các hạng mục công trình, thiết bị trên đất liền và trên biển;\nb) Hồ sơ, tài liệu theo quy định của pháp luật về\nlâm nghiệp, đất đai;\nc) Các văn bản, tài liệu khác có liên quan.\n6. Sau khi chủ trương chuyển mục đích sử dụng rừng,\nđất và kế hoạch đại cương phát triển mỏ dầu khí được phê duyệt, hồ sơ, trình tự,\nthủ tục quyết định việc thu hồi, chuyển mục đích sử dụng rừng, đất của Ủy ban nhân dân cấp tỉnh để triển khai dự án phát triển mỏ dầu khí có chuỗi đồng bộ\ncác hạng mục công trình, thiết bị dầu khí trên đất liền và trên biển được thực hiện theo quy định của pháp luật về lâm nghiệp, đất đai và pháp luật có liên quan.\n7. Trong thời gian thực hiện việc thu hồi, chuyển mục\nđích sử dụng rừng, đất để triển khai dự án phát triển mỏ dầu khí, Tập đoàn Dầu khí Việt Nam và nhà thầu được phép tiến hành khảo sát, đo đạc để thu thập số liệu phục vụ lập kế hoạch phát triển mỏ dầu khí.\nĐiều 46. Hồ sơ, trình tự, thủ\ntục thẩm định và chấp thuận chủ trương chuyển mục đích sử dụng rừng, đất của dự\nán phát triển mỏ dầu khí trên đất liền 1. Trường hợp dự án phát triển mỏ dầu khí trên đất liền có yêu cầu chuyển mục đích sử dụng rừng, đất theo quy định tại khoản 2 Điều 42 Luật Dầu khí, trên cơ sở đề xuất của nhà thầu,\nTập đoàn Dầu khí Việt Nam trình cơ quan có thẩm quyền thẩm định và chấp thuận chủ trương chuyển mục đích sử dụng rừng, đất theo quy định của pháp luật về lâm nghiệp, đất đai.\n2. Trường hợp việc chấp thuận chủ trương chuyển mục\nđích sử dụng rừng, đất thuộc thẩm quyền của Quốc hội theo quy định tại điểm a khoản 2 Điều 42 Luật Dầu khí, hồ sơ của Chính phủ trình Quốc hội chấp thuận chủ trương chuyển mục đích sử dụng rừng, đất tương tự như\nquy định tại khoản 5 Điều 45 Nghị định này.\n3. Trình tự thẩm định và chấp thuận chủ trương chuyển mục đích sử dụng rừng, đất của dự án phát triển mỏ dầu khí trên đất liền được thực hiện theo quy định của pháp luật về lâm nghiệp, đất đai và pháp luật khác có liên quan.\n4. Sau khi chủ trương chuyển mục đích sử dụng rừng,\nđất và kế hoạch đại cương phát triển mỏ dầu khí được phê duyệt, hồ sơ, quy trình quyết định việc thu hồi, chuyển mục đích sử dụng rừng, đất của Ủy ban nhân dân cấp tỉnh để triển khai dự án phát triển mỏ dầu khí trên đất liền được thực hiện theo quy định của pháp luật về lâm nghiệp, đất đai và pháp luật có\nliên quan.\nĐiều 47. Hồ sơ, trình tự, thủ\ntục thẩm định và phê duyệt báo cáo tài nguyên, trữ lượng dầu khí, báo cáo tài nguyên, trữ lượng dầu khí cập nhật 1. Trong thời hạn 120 ngày kể từ ngày hoàn thành thẩm lượng phát hiện dầu khí, trên cơ sở báo cáo tài nguyên, trữ lượng dầu khí do nhà thầu lập được Tập đoàn Dầu khí Việt Nam thông qua, Tập đoàn Dầu khí Việt Nam trình Bộ Công Thương 02 bộ hồ sơ (gồm 01 bộ hồ sơ gốc và 01 bộ hồ sơ bản sao, gửi trực tiếp hoặc qua bưu chính) đề nghị phê duyệt báo cáo tài nguyên, trữ\nlượng dầu khí. Hồ sơ bao gồm:\na) Tờ trình đề nghị phê duyệt báo cáo tài nguyên,\ntrữ lượng dầu khí của phát hiện dầu khí đã được thẩm lượng;\nb) Đánh giá của Tập đoàn Dầu khí Việt Nam về đề xuất của nhà thầu; văn bản tiếp thu, giải trình của nhà thầu (nếu có);\nc) Báo cáo tài nguyên, trữ lượng dầu khí bao gồm các nội dung chính được quy định tại Điều 45 Luật Dầu khí;\nd) Bản tóm tắt báo cáo tài nguyên, trữ lượng dầu khí;\nđ) Các văn bản, tài liệu khác có liên quan.\n2. Việc thẩm định báo cáo tài nguyên, trữ lượng dầu khí được thực hiện theo hình thức hội đồng thẩm định. Bộ trưởng Bộ Công Thương ban hành quyết định thành lập và quy chế hoạt động của hội đồng thẩm định (bao gồm đại diện của các bộ, ngành, tổ chức liên quan) và tổ chuyên viên giúp việc hội đồng thẩm định.\n3. Trong quá trình thẩm định, trường hợp cần thiết,\nBộ Công Thương có thể yêu cầu Tập đoàn Dầu khí Việt Nam lựa chọn tổ chức tư vấn có đủ điều kiện năng lực để thẩm tra báo cáo tài nguyên, trữ lượng dầu khí.\nKinh phí thuê tư vấn thẩm tra được lấy từ nguồn chi phí quản lý, giám sát các hợp\nđồng dầu khí quy định tại điểm c khoản 4 Điều 64 Luật Dầu khí.\nTổ chức tư vấn thẩm tra phải độc lập về pháp lý, tài chính với nhà thầu. Thời gian thẩm tra không quá 90 ngày.\n4. Trong thời hạn 45 ngày kể từ ngày nhận được hồ\nsơ hợp lệ (bao gồm báo cáo thẩm tra của tổ chức tư vấn, nếu có yêu cầu), hội đồng thẩm định hoàn thành thẩm định báo cáo tài nguyên, trữ lượng dầu khí, trình Bộ\ntrưởng Bộ Công Thương xem xét, phê duyệt.\n5. Trong thời hạn 05 ngày làm việc kể từ ngày nhận\nđược văn bản thẩm định của hội đồng thẩm định, Bộ trưởng Bộ Công Thương ban hành quyết định phê duyệt báo cáo tài nguyên, trữ lượng dầu khí.\n6. Hồ sơ, trình tự, thủ tục thẩm định và phê duyệt báo cáo tài nguyên, trữ lượng dầu khí cập nhật quy định tại khoản 5 Điều 45 Luật Dầu khí được thực hiện theo quy định tại Điều này.\n7. Bộ Công Thương quy định chi tiết về phân cấp và\nlập báo cáo tài nguyên, trữ lượng dầu khí.\nĐiều 48. Hồ sơ, trình tự, thủ\ntục thẩm định và phê duyệt kế hoạch đại cương phát triển mỏ dầu khí, điều chỉnh kế hoạch đại cương phát triển mỏ dầu khí\n1. Trong thời hạn 12 tháng kể từ ngày báo cáo tài nguyên, trữ lượng dầu khí được phê duyệt, trên cơ sở kế hoạch đại cương phát triển mỏ dầu khí do nhà thầu lập được Tập đoàn Dầu khí Việt Nam thông qua, Tập\nđoàn Dầu khí Việt Nam trình Bộ Công Thương 02 bộ hồ sơ (gồm 01 bộ hồ sơ gốc và\n01 bộ hồ sơ bản sao, gửi trực tiếp hoặc qua bưu chính) đề nghị phê duyệt kế hoạch\nđại cương phát triển mỏ dầu khí. Hồ sơ bao gồm:\na) Tờ trình đề nghị phê duyệt kế hoạch đại cương phát triển mỏ dầu khí;\nb) Đánh giá của Tập đoàn Dầu khí Việt Nam về đề xuất của nhà thầu; văn bản tiếp thu, giải trình của nhà thầu (nếu có);\nc) Kế hoạch đại cương phát triển mỏ dầu khí gồm các nội dung chính được quy định tại Điều 46 Luật Dầu khí. Trường hợp phát triển mỏ khí, phương án tiêu thụ khí sơ bộ cần có các thông tin sơ bộ\nvề khách hàng tiêu thụ khí, thời hạn bán khí dự kiến và các điều kiện cần thiết khác của phương án tiêu thụ khí;\nd) Bản tóm tắt kế hoạch đại cương phát triển mỏ dầu khí;\nđ) Thỏa thuận nguyên tắc hợp nhất phát hiện dầu khí, mỏ dầu khí giữa các bên liên quan (nếu có) trên cơ sở phê duyệt của Thủ tướng Chính phủ về hợp nhất phát hiện dầu khí, mỏ dầu khí theo quy định tại Điều 32 Nghị định này;\ne) Thỏa thuận nguyên tắc phát triển chung mỏ dầu khí (nếu có);\ng) Các văn bản, tài liệu khác có liên quan.\n2. Việc thẩm định kế hoạch đại cương phát triển mỏ\ndầu khí được thực hiện theo hình thức hội đồng thẩm định. Bộ trưởng Bộ Công Thương ban hành quyết định thành lập và quy chế hoạt động của hội đồng thẩm định\n(bao gồm đại diện của các bộ, ngành, tổ chức liên quan) và tổ chuyên viên giúp việc hội đồng thẩm định.\n3. Trường hợp Tập đoàn Dầu khí Việt Nam tham gia hợp\nđồng dầu khí với tư cách nhà thầu, ngoài việc thẩm định kế hoạch đại cương phát triển mỏ dầu khí bằng hình thức hội đồng thẩm định, Bộ Công Thương lấy ý kiến bằng văn bản của Ủy ban Quản lý vốn nhà nước tại doanh nghiệp về việc sử dụng vốn của Tập đoàn Dầu khí Việt Nam.\n4. Trong thời hạn 45 ngày kể từ ngày nhận được hồ sơ\nhợp lệ, hội đồng thẩm định hoàn thành thẩm định kế hoạch đại cương phát triển mỏ\ndầu khí, trình Bộ trưởng Bộ Công Thương xem xét, phê duyệt.\n5. Trong thời hạn 05 ngày làm việc kể từ ngày nhận\nđược văn bản thẩm định của hội đồng thẩm định, Bộ trưởng Bộ Công Thương ban hành quyết định phê duyệt kế hoạch đại cương phát triển mỏ dầu khí.\n6. Hồ sơ, trình tự, thủ tục thẩm định và phê duyệt\nđiều chỉnh kế hoạch đại cương phát triển mỏ dầu khí đối với các trường hợp điều chỉnh thuộc thẩm quyền phê duyệt của Bộ Công Thương quy định tại khoản 5 Điều 46 Luật Dầu khí được thực hiện theo quy định tại Điều này.\n7. Hồ sơ, trình tự, thủ tục thẩm định và phê duyệt\nđiều chỉnh kế hoạch đại cương phát triển mỏ dầu khí đối với các trường hợp điều chỉnh thuộc thẩm quyền phê duyệt của Tập đoàn Dầu khí Việt Nam quy định tại khoản 5 Điều 46 Luật Dầu khí được thực hiện theo quy trình do Tập đoàn Dầu khí Việt Nam ban hành.\nĐiều 49. Hồ sơ, trình tự, thủ\ntục thẩm định và phê duyệt kế hoạch khai thác sớm mỏ dầu khí, điều chỉnh kế hoạch khai thác sớm mỏ dầu khí\n1. Nhà thầu đề xuất kế hoạch khai thác sớm mỏ dầu khí trong các trường hợp sau:\na) Các thông tin hiện có không cho phép xác định phương án khai thác hợp lý theo thông lệ công nghiệp dầu khí quốc tế mà cần phải thu thập bổ sung số liệu trên cơ sở theo dõi động thái khai thác thực tế của mỏ,\ntầng sản phẩm và vỉa;\nb) Tỷ lệ cấp tài nguyên (dầu khí tại chỗ) P1/2P không thấp hơn 40%; nếu tỷ lệ này thấp hơn 40% thì phải được Bộ Công Thương chấp thuận.\n2. Trong thời hạn 18 tháng kể từ ngày kế hoạch đại cương phát triển mỏ dầu khí được phê duyệt, trên cơ sở kế hoạch khai thác sớm mỏ\ndầu khí do nhà thầu trình lập được Tập đoàn Dầu khí Việt Nam thông qua, Tập\nđoàn Dầu khí Việt Nam trình Bộ Công Thương 02 bộ hồ sơ (gồm 01 bộ hồ sơ gốc và\n01 bộ hồ sơ bản sao, gửi trực tiếp hoặc qua bưu chính) đề nghị phê duyệt kế hoạch khai thác sớm mỏ dầu khí. Hồ sơ bao gồm:\na) Tờ trình đề nghị phê duyệt kế hoạch khai thác sớm mỏ dầu khí;\nb) Đánh giá của Tập đoàn Dầu khí Việt Nam về đề xuất của nhà thầu; văn bản tiếp thu, giải trình của nhà thầu (nếu có);\nc) Kế hoạch khai thác sớm mỏ dầu khí gồm các nội dung chính được quy định tại Điều 47 Luật Dầu khí;\nd) Bản tóm tắt kế hoạch khai thác sớm mỏ dầu khí;\nđ) Thỏa thuận hợp nhất phát hiện dầu khí, mỏ dầu khí giữa các bên liên quan (nếu có) trên cơ sở thỏa thuận nguyên tắc hợp nhất phát hiện dầu khí, mỏ dầu khí đã được phê duyệt theo quy định tại Điều 48 Nghị định này;\ne) Thỏa thuận phát triển chung mỏ dầu khí (nếu có)\ntrên cơ sở thỏa thuận nguyên tắc phát triển chung mỏ dầu khí đã được phê duyệt theo quy định tại Điều 48 Nghị định này;\ng) Các văn bản, tài liệu khác có liên quan.\n3. Việc thẩm định kế hoạch khai thác sớm mỏ dầu khí\nđược thực hiện theo hình thức hội đồng thẩm định. Bộ trưởng Bộ Công Thương ban hành quyết định thành lập và quy chế hoạt động của hội đồng thẩm định (bao gồm\nđại diện của các bộ, ngành, tổ chức liên quan) và tổ chuyên viên giúp việc hội\nđồng thẩm định.\n4. Trường hợp Tập đoàn Dầu khí Việt Nam tham gia hợp\nđồng dầu khí với tư cách nhà thầu, ngoài việc thẩm định kế hoạch đại cương phát triển mỏ dầu khí bằng hình thức hội đồng thẩm định, Bộ Công Thương lấy ý kiến bằng văn bản của Ủy ban Quản lý vốn nhà nước tại doanh nghiệp về việc sử dụng vốn của Tập đoàn Dầu khí Việt Nam.\n5. Trong quá trình thẩm định, trường hợp cần thiết,\nBộ Công Thương có thể yêu cầu Tập đoàn Dầu khí Việt Nam lựa chọn tổ chức tư vấn có đủ điều kiện năng lực để thẩm tra kế hoạch khai thác sớm mỏ dầu khí. Kinh phí thuê tư vấn thẩm tra được lấy từ nguồn chi phí quản lý, giám sát các hợp đồng dầu khí quy định tại điểm c khoản 4 Điều 64 Luật Dầu khí. Tổ\nchức tư vấn thẩm tra phải độc lập về pháp lý, tài chính với nhà thầu. Thời gian thẩm tra không quá 90 ngày.\n6. Trong thời hạn 45 ngày kể từ ngày nhận được hồ\nsơ hợp lệ (bao gồm báo cáo thẩm tra của tổ chức tư vấn, nếu có yêu cầu), hội đồng thẩm định hoàn thành thẩm định kế hoạch khai thác sớm mỏ dầu khí, trình Bộ trưởng Bộ Công Thương xem xét, phê duyệt.\n7. Trong thời hạn 05 ngày làm việc kể từ ngày nhận\nđược văn bản thẩm định của hội đồng thẩm định, Bộ trưởng Bộ Công Thương ban hành quyết định phê duyệt kế hoạch khai thác sớm mỏ dầu khí.\n8. Hồ sơ, trình tự, thủ tục thẩm định và phê duyệt\nđiều chỉnh kế hoạch khai thác sớm mỏ dầu khí đối với các trường hợp điều chỉnh thuộc thẩm quyền phê duyệt của Bộ Công Thương quy định tại khoản 6 Điều 47 Luật Dầu khí được thực hiện theo quy định tại Điều này.\n9. Hồ sơ, trình tự, thủ tục thẩm định và phê duyệt\nđiều chỉnh kế hoạch khai thác sớm mỏ dầu khí đối với các trường hợp điều chỉnh thuộc thẩm quyền phê duyệt của Tập đoàn Dầu khí Việt Nam quy định tại khoản 5 Điều 47 Luật Dầu khí được xác định trên tổng mức đầu tư cộng dồn trong lần phê duyệt kế hoạch khai thác sớm mỏ dầu khí gần nhất và\nđược thực hiện theo quy trình do Tập đoàn Dầu khí Việt Nam ban hành.\nĐiều 50. Hồ sơ, trình tự, thủ\ntục thẩm định và phê duyệt kế hoạch phát triển mỏ dầu khí, điều chỉnh kế hoạch phát triển mỏ dầu khí\n1. Trong thời hạn 18 tháng kể từ ngày kế hoạch đại cương phát triển mỏ dầu khí được phê duyệt hoặc trong thời hạn 06 tháng trước khi kết thúc kế hoạch khai thác sớm mỏ dầu khí, trên cơ sở kế hoạch phát triển mỏ dầu khí do nhà thầu lập được Tập đoàn Dầu khí Việt Nam thông qua, Tập đoàn Dầu khí\nViệt Nam trình Bộ Công Thương 02 bộ hồ sơ (gồm 01 bộ hồ sơ gốc và 01 bộ hồ sơ bản sao, gửi trực tiếp hoặc qua bưu chính) đề nghị phê duyệt kế hoạch phát triển mỏ\ndầu khí. Hồ sơ bao gồm:\na) Tờ trình đề nghị phê duyệt kế hoạch phát triển mỏ\ndầu khí;\nb) Đánh giá của Tập đoàn Dầu khí Việt Nam về đề xuất của nhà thầu; văn bản tiếp thu, giải trình của nhà thầu (nếu có);\nc) Kế hoạch phát triển mỏ dầu khí gồm các nội dung chính được quy định tại Điều 48 Luật Dầu khí;\nd) Bản tóm tắt kế hoạch phát triển mỏ dầu khí;\nđ) Thỏa thuận hợp nhất phát hiện dầu khí, mỏ dầu khí giữa các bên liên quan (nếu có) trên cơ sở thỏa thuận nguyên tắc hợp nhất phát hiện dầu khí, mỏ dầu khí đã được phê duyệt theo quy định tại Điều 48 Nghị định này;\ne) Thỏa thuận phát triển chung mỏ dầu khí (nếu có)\ntrên cơ sở thỏa thuận nguyên tắc phát triển chung mỏ dầu khí đã được phê duyệt theo quy định tại Điều 48 Nghị định này;\ng) Các văn bản, tài liệu khác có liên quan.\n2. Việc thẩm định kế hoạch phát triển mỏ dầu khí được thực hiện theo hình thức hội đồng thẩm định. Bộ trưởng Bộ Công Thương ban hành quyết định thành lập và quy chế hoạt động của hội đồng thẩm định (bao gồm đại diện của các bộ, ngành, tổ chức liên quan) và tổ chuyên viên giúp việc hội đồng thẩm định.\n3. Trường hợp Tập đoàn Dầu khí Việt Nam tham gia hợp\nđồng dầu khí với tư cách nhà thầu, ngoài việc thẩm định kế hoạch phát triển mỏ\ndầu khí bằng hình thức hội đồng thẩm định, Bộ Công Thương lấy ý kiến bằng văn bản của Ủy ban Quản lý vốn nhà nước tại doanh nghiệp về việc sử dụng vốn của Tập\nđoàn Dầu khí Việt Nam.\n4. Trong quá trình thẩm định, trường hợp cần thiết,\nBộ Công Thương có thể yêu cầu Tập đoàn Dầu khí Việt Nam lựa chọn tổ chức tư vấn có đủ điều kiện năng lực để thẩm tra kế hoạch phát triển mỏ dầu khí. Kinh phí\nthuê tư vấn thẩm tra được lấy từ nguồn chi phí quản lý, giám sát các hợp đồng dầu khí quy định tại điểm c khoản 4 Điều 64 Luật Dầu khí. Tổ chức tư vấn thẩm tra phải độc lập về pháp lý, tài chính với nhà thầu. Thời gian thẩm tra không quá 90 ngày.\n5. Trong thời hạn 45 ngày kể từ ngày nhận được hồ\nsơ hợp lệ (bao gồm báo cáo thẩm tra của tổ chức tư vấn, nếu có yêu cầu), hội đồng thẩm định hoàn thành thẩm định kế hoạch phát triển mỏ dầu khí, trình Bộ trưởng Bộ Công Thương xem xét, phê duyệt.\n6. Trong thời hạn 05 ngày làm việc kể từ ngày nhận\nđược văn bản thẩm định của hội đồng thẩm định, Bộ trưởng Bộ Công Thương ban hành quyết định phê duyệt kế hoạch phát triển mỏ dầu khí.\n7. Hồ sơ, trình tự, thủ tục thẩm định và phê duyệt\nđiều chỉnh kế hoạch phát triển mỏ dầu khí đối với các trường hợp điều chỉnh thuộc thẩm quyền phê duyệt của Bộ Công Thương quy định tại khoản 6 Điều 48 Luật Dầu khí được thực hiện theo quy định tại Điều này.\n8. Hồ sơ, trình tự, thủ tục thẩm định và phê duyệt\nđiều chỉnh kế hoạch phát triển mỏ dầu khí đối với các trường hợp điều chỉnh thuộc thẩm quyền phê duyệt của Tập đoàn Dầu khí Việt Nam quy định tại khoản 5 Điều 48 Luật Dầu khí được xác định trên tổng mức đầu tư cộng dồn trong lần phê duyệt kế hoạch phát triển mỏ dầu khí gần nhất và được thực hiện theo quy trình do Tập đoàn Dầu khí Việt Nam ban hành.\nĐiều 51. Hồ sơ, trình tự, thủ\ntục thẩm định và phê duyệt kế hoạch thu dọn công trình dầu khí, điều chỉnh kế\nhoạch thu dọn công trình dầu khí\n1. Trong thời hạn 01 năm kể từ ngày có dòng dầu,\nkhí đầu tiên được khai thác thương mại từ diện tích hợp đồng dầu khí, trên cơ sở\nkế hoạch thu dọn công trình dầu khí do nhà thầu lập được Tập đoàn Dầu khí Việt Nam thông qua, Tập đoàn Dầu khí Việt Nam trình 02 bộ hồ sơ (gồm 01 bộ hồ sơ gốc và 01 bộ hồ sơ bản sao, gửi trực tiếp hoặc qua bưu chính) đề nghị phê duyệt kế\nhoạch thu dọn công trình dầu khí. Hồ sơ bao gồm:\na) Tờ trình đề nghị phê duyệt kế hoạch thu dọn công trình dầu khí;\nb) Đánh giá của Tập đoàn Dầu khí Việt Nam về đề xuất của nhà thầu; văn bản tiếp thu, giải trình của nhà thầu (nếu có);\nc) Kế hoạch thu dọn công trình dầu khí gồm các nội dung chính được quy định tại Điều 50 Luật Dầu khí;\nd) Bản tóm tắt kế hoạch thu dọn công trình dầu khí;\nđ) Các văn bản, tài liệu khác có liên quan.\n2. Việc thẩm định kế hoạch thu dọn công trình dầu khí được thực hiện theo hình thức hội đồng thẩm định. Bộ trưởng Bộ Công Thương ban hành quyết định thành lập và quy chế hoạt động của hội đồng thẩm định (bao gồm đại diện của các bộ, ngành, tổ chức liên quan) và tổ chuyên viên giúp việc hội đồng thẩm định.\n3. Trong thời hạn 45 ngày kể từ ngày nhận được hồ\nsơ hợp lệ, hội đồng thẩm định hoàn thành thẩm định kế hoạch thu dọn công trình dầu khí, trình Bộ trưởng Bộ Công Thương xem xét, phê duyệt.\n4. Trong thời hạn 05 ngày làm việc kể từ ngày nhận\nđược văn bản thẩm định của hội đồng thẩm định, Bộ trưởng Bộ Công Thương ban hành quyết định phê duyệt kế hoạch thu dọn công trình dầu khí.\n5. Hồ sơ, trình tự, thủ tục thẩm định và phê duyệt\nđiều chỉnh kế hoạch thu dọn công trình dầu khí đối với các trường hợp điều chỉnh thuộc thẩm quyền phê duyệt của Bộ Công Thương quy định tại khoản 8 Điều 50 Luật Dầu khí được thực hiện theo quy định tại Điều này.\n6. Hồ sơ, trình tự, thủ tục thẩm định và phê duyệt\nđiều chỉnh kế hoạch thu dọn công trình dầu khí đối với các trường hợp điều chỉnh thuộc thẩm quyền phê duyệt của Tập đoàn Dầu khí Việt Nam quy định tại khoản 6 Điều 50 Luật Dầu khí được thực hiện theo quy trình do Tập đoàn Dầu khí Việt Nam ban hành.\nĐiều 52. Quỹ bảo đảm nghĩa vụ\nthu dọn công trình dầu khí\n1. Đồng tiền trích lập quỹ bảo đảm nghĩa vụ thu dọn công trình dầu khí là đồng Đô la Mỹ.\n2. Mức trích lập quỹ bảo đảm nghĩa vụ thu dọn công trình dầu khí hàng năm (bao gồm thuế giá trị gia tăng) được xác định theo công thức sau:\nEn =\nAn x (Bn\n - C(n-1) - I(n-1))\nDn Trong đó:\nEn: Mức trích lập quỹ năm n, đơn vị tính là USD;\nAn: Sản lượng dầu khí khai thác năm n,\nđược xác định bằng sản lượng khai thác thực trong năm tương ứng, đơn vị tính là\nthùng dầu quy đổi;\nBn: Tổng chi phí thu dọn công trình dầu khí cập nhật tại năm n, Bn = (b1 - b2), trong\nđó:\nb1: Tổng chi phí thu dọn công trình dầu khí ước tính trong kế hoạch thu dọn công trình dầu khí (được phê duyệt gần nhất),\nđơn vị tính là USD;\nb2: Ước tính chi phí được xác định trong kế hoạch thu dọn công trình dầu khí (được phê duyệt gần nhất) tương ứng với hạng mục thiết bị, tài sản hoặc công trình đã được thu dọn đến năm (n-1), đơn vị\ntính là USD;\nC(n-1): Số dư quỹ bảo đảm nghĩa vụ thu dọn công trình dầu khí tại thời điểm ngày 31 tháng 12 năm (n-1) được xác định bằng tổng số dư của tất cả các tài khoản mà Tập đoàn Dầu khí Việt Nam gửi quỹ của mỏ\ndầu khí tương ứng, được các tổ chức tín dụng liên quan xác nhận bằng văn bản,\nđơn vị tính là USD;\nI(n-1): Số lãi tiền gửi ngân hàng mà tổ\nchức, cá nhân được nhận sau khi Tập đoàn Dầu khí Việt Nam thay mặt thực hiện các nghĩa vụ với ngân sách nhà nước (nếu có) cho năm n-1;\nDn: Trữ lượng dầu khí có thể thu hồi còn lại, Dn = d1-d2, trong đó:\nd1: Trữ lượng dầu khí có thể thu hồi được xác định trong kế hoạch phát triển mỏ dầu khí hoặc kế hoạch khai thác sớm mỏ dầu khí đã được phê duyệt bởi các cơ quan có thẩm quyền tính đến cuối năm thứ n,\nđơn vị tính là thùng dầu quy đổi;\nd2: Tổng sản lượng dầu khí đã được khai thác cộng dồn từ (các) mỏ dầu khí liên quan tính đến năm (n-1), đơn vị tính là\nthùng dầu quy đổi.\n3. Trước khi chấm dứt khai thác mỏ dầu khí hoặc chấm dứt hợp đồng dầu khí trước thời hạn, nhà thầu phải trích lập đủ giá trị quỹ bảo\nđảm nghĩa vụ thu dọn công trình dầu khí theo kế hoạch thu dọn công trình dầu khí cuối cùng được cấp thẩm quyền phê duyệt.\n4. Trong thời hạn 01 năm trước khi kết thúc hợp đồng dầu khí hoặc kết thúc thời hạn khai thác dầu khí theo kế hoạch phát triển mỏ dầu khí hoặc kế hoạch phát triển mỏ dầu khí điều chỉnh đã được phê duyệt, nhà thầu phải cập nhật kế hoạch thu dọn công trình dầu khí, trình cơ quan có thẩm quyền phê duyệt theo quy định tại Điều 51 Nghị định này.\n5. Trường hợp số dư của quỹ bảo đảm nghĩa vụ thu dọn công trình dầu khí thấp hơn dự toán chi phí theo kế hoạch thu dọn công trình dầu khí cuối cùng đã được phê duyệt, trong thời hạn 06 tháng trước khi kết thúc hợp\nđồng dầu khí hoặc kết thúc thời hạn khai thác dầu khí, mỗi nhà thầu phải đóng góp bổ sung quỹ theo tỷ lệ quyền lợi tham gia trong hợp đồng dầu khí. Trường hợp cần thiết, Tập đoàn Dầu khí Việt Nam yêu cầu nhà thầu mở bảo lãnh ngân hàng để\nbảo đảm hoàn thành nghĩa vụ thu dọn công trình dầu khí với số tiền bảo lãnh tương đương số tiền còn thiếu.\n6. Trường hợp số dư của quỹ bảo đảm nghĩa vụ thu dọn công trình dầu khí lớn hơn dự toán chi phí theo kế hoạch thu dọn công trình dầu khí cuối cùng đã được phê duyệt, khoản chênh lệch sẽ được xử lý khi quyết toán theo quy định tại Điều 54 Nghị định này hoặc được trả lại cho nhà thầu tại thời điểm Tập đoàn Dầu khí Việt Nam tiếp nhận quyền sử dụng quỹ\nđảm bảo nghĩa vụ thu dọn công trình dầu khí (trong trường hợp nhà thầu được phép để lại toàn bộ hoặc một phần công trình dầu khí) với điều kiện nhà thầu phải hoàn thành các nghĩa vụ tài chính với nước chủ nhà theo quy định của hợp đồng dầu khí và pháp luật có liên quan. Phần chênh lệch đã trả lại cho nhà thầu sẽ được xử lý theo nguyên tắc theo quy định tại khoản 5 Điều 54 Nghị định này.\n7. Nếu trong hợp đồng dầu khí đã ký kết có thỏa thuận khác về biện pháp bảo đảm nghĩa vụ thu dọn công trình dầu khí so với quy định của Nghị định này thì nhà thầu thực hiện theo thỏa thuận trong hợp đồng dầu khí đó.\nĐiều 53. Quản lý và sử dụng quỹ\nbảo đảm nghĩa vụ thu dọn công trình dầu khí\n1. Quỹ bảo đảm nghĩa vụ thu dọn công trình dầu khí\nđược sử dụng cho mục đích thu dọn công trình dầu khí. Nhà thầu được sử dụng số\ntiền trong quỹ để thực hiện nghĩa vụ thu dọn công trình dầu khí theo kế hoạch thu dọn công trình dầu khí đã được phê duyệt.\n2. Trường hợp nhà thầu không thể triển khai thu dọn công trình dầu khí theo kế hoạch thu dọn công trình dầu khí đã được phê duyệt do Tập đoàn Dầu khí Việt Nam không thể hoàn trả đủ giá trị quỹ bảo đảm nghĩa vụ\nthu dọn công trình dầu khí đã trích nộp, nhà thầu được giải thoát khỏi nghĩa vụ\nthu dọn công trình dầu khí tương ứng với phần không thể hoàn trả và Tập đoàn Dầu khí Việt Nam chịu trách nhiệm thu dọn các hạng mục công trình dầu khí chưa được thu dọn đó.\n3. Trường hợp nhà thầu không phải thu dọn hoặc chỉ\nthu dọn một phần công trình dầu khí, toàn bộ hoặc một phần quỹ bảo đảm nghĩa vụ\nthu dọn công trình dầu khí tương ứng với toàn bộ hoặc một phần công trình dầu khí được yêu cầu để lại vẫn do Tập đoàn Dầu khí Việt Nam quản lý và được sử dụng trực tiếp để thu dọn khi công trình dầu khí không còn cần cho hoạt động dầu khí\nhoặc không thể tiếp tục hoạt động an toàn. Trong trường hợp này, Tập đoàn Dầu khí Việt Nam phối hợp với nhà thầu xác định giá trị quỹ bảo đảm nghĩa vụ thu dọn công trình dầu khí tại thời điểm tiếp nhận quyền sử dụng quỹ và nhà thầu có\ntrách nhiệm trích nộp phần quỹ còn thiếu, được xác định theo quy trình quy định tại Điều 52 Nghị định này. Sau khi nhà thầu hoàn thành trích nộp bổ sung giá trị quỹ bảo đảm nghĩa vụ thu dọn công trình dầu khí còn thiếu và bàn giao quyền sử dụng quỹ cho Tập đoàn Dầu khí Việt Nam, nhà thầu được giải thoát nghĩa vụ đối với toàn bộ hoặc phần công trình dầu khí chưa được thu dọn, đồng thời được giải thoát nghĩa vụ đóng góp phần chi phí thu dọn thực tế\ncó thể còn thiếu trong tương lai khi triển khai hoạt động thu dọn công trình dầu khí (nếu có).\n4. Hằng năm, Tập đoàn Dầu khí Việt Nam thực hiện việc kiểm toán và xác nhận giá trị đã trích nộp quỹ bảo đảm nghĩa vụ thu dọn công trình dầu khí, giá trị giải ngân từ quỹ và chi phí thực tế mà nhà thầu đã thực hiện.\nĐiều 54. Quyết toán quỹ bảo đảm nghĩa vụ thu dọn công trình dầu khí\n1. Trong thời hạn 09 tháng kể từ ngày kết thúc thu dọn toàn bộ hoặc một phần công trình dầu khí trong diện tích hợp đồng dầu khí,\nnhà thầu phải lập báo cáo hoàn thành thu dọn toàn bộ hoặc một phần công trình dầu khí, trình Tập đoàn Dầu khí Việt Nam phê duyệt và báo cáo Bộ Công Thương để\ntheo dõi.\n2. Nội dung chính của báo cáo hoàn thành thu dọn công trình dầu khí bao gồm:\na) Mô tả công trình dầu khí và hoạt động thu dọn thực tế đã được thực hiện;\nb) Tiến độ thực hiện việc thu dọn;\nc) Đánh giá nội dung thay đổi giữa hoạt động thu dọn thực tế với phương án được phê duyệt (nếu có);\nd) Chi phí thu dọn thực tế;\nđ) Tóm tắt các công tác bảo đảm an toàn môi trường\nđã được thực hiện bao gồm: phương án thu gom, vận chuyển, xử lý các loại rác thải,\nphế thải đã thực hiện;\ne) Cam kết trách nhiệm đối với công trình để lại (nếu có).\n3. Giá trị thanh lý các phế liệu thu được trong và\nsau quá trình thu dọn công trình dầu khí được ghi nhận và xử lý khi quyết toán quỹ bảo đảm nghĩa vụ thu dọn công trình dầu khí theo quy định tại các khoản 4 và 5 Điều này.\n4. Trong thời hạn 30 ngày kể từ ngày Tập đoàn Dầu khí Việt Nam phê duyệt báo cáo hoàn thành thu dọn công trình dầu khí, Nhà thầu phối hợp với Tập đoàn Dầu khí Việt Nam quyết toán chi phí thực hiện thu dọn công trình dầu khí (bao gồm giá trị thanh lý các phế liệu được quy định tại khoản 3 Điều này).\n5. Trường hợp nhà thầu thực hiện thu dọn công trình dầu khí vào cuối thời hạn hợp đồng dầu khí, sau khi quyết toán và hoàn thành nghĩa vụ tài chính của hợp đồng dầu khí, số dư quỹ bảo đảm nghĩa vụ thu dọn công trình dầu khí sẽ được xử lý như sau:\na) Nếu nhà thầu đã thu hồi toàn bộ số tiền trích quỹ\nbảo đảm nghĩa vụ thu dọn công trình dầu khí, số dư quỹ, sau khi hoàn thành nghĩa vụ tài chính theo quy định của hợp đồng dầu khí, sẽ được chia cho nhà thầu và Tập đoàn Dầu khí Việt Nam theo tỷ lệ chia dầu lãi áp dụng cho thang sản lượng cao nhất đã thực hiện trong hạn của hợp đồng dầu khí;\nb) Nếu nhà thầu chưa thu hồi hết số tiền trích quỹ\nbảo đảm nghĩa vụ thu dọn công trình dầu khí, số tiền còn lại trong quỹ sẽ được\nưu tiên hoàn trả cho nhà thầu để bù đắp phần trích quỹ chưa được thu hồi này.\nPhần dư của quỹ bảo đảm nghĩa vụ thu dọn công trình dầu khí sau khi thực hiện việc bù đắp này (nếu có), sau khi hoàn thành nghĩa vụ tài chính theo quy định của hợp đồng dầu khí, sẽ được chia cho nhà thầu và Tập đoàn Dầu khí Việt Nam theo tỷ\nlệ chia dầu lãi áp dụng cho thang sản lượng cao nhất đã thực hiện trong thời hạn của hợp đồng dầu khí.\n6. Trường hợp Tập đoàn Dầu khí Việt Nam tiếp nhận quỹ bảo đảm nghĩa vụ thu dọn công trình dầu khí và trực tiếp thực hiện thu dọn công trình dầu khí, sau quyết toán, số dư quỹ sẽ được nộp vào ngân sách nhà nước.\n7. Hằng năm, Tập đoàn Dầu khí Việt Nam báo cáo Bộ\nCông Thương, Bộ Tài chính về tình hình quản lý, sử dụng và quyết toán quỹ bảo đảm nghĩa vụ tài chính cho việc thu dọn công trình dầu khí.\nĐiều 55. Hồ sơ, trình tự, thủ\ntục chấp thuận để lại, hoãn thu dọn hoặc thực hiện thu dọn một phần hoặc toàn bộ\ncông trình dầu khí\n1. Căn cứ quy định tại khoản 2 Điều 52 Luật Dầu khí, trên cơ sở đề xuất của nhà thầu được Tập đoàn Dầu khí Việt Nam thông qua, Tập đoàn Dầu khí Việt Nam trình Bộ Công Thương 02 bộ hồ sơ (gồm 01 bộ hồ sơ gốc và 01 bộ hồ sơ bản sao, gửi trực tiếp hoặc qua bưu chính) đề\nnghị chấp thuận đề lại, hoãn thu dọn hoặc thực hiện thu dọn một phần hoặc toàn bộ công trình dầu khí. Hồ sơ bao gồm:\na) Văn bản đề nghị để lại một phần hoặc toàn bộ\ncông trình dầu khí hay hoãn thu dọn một phần hoặc toàn bộ công trình dầu khí;\nb) Đánh giá của Tập đoàn Dầu khí Việt Nam về đề xuất của nhà thầu; văn bản tiếp thu, giải trình của nhà thầu (nếu có);\nc) Các văn bản, tài liệu khác có liên quan.\n2. Trong thời hạn 05 ngày làm việc kể từ ngày nhận\nđược hồ sơ hợp lệ, Bộ Công Thương gửi hồ sơ lấy ý kiến của Bộ Tài nguyên và Môi trường, Bộ Giao thông vận tải, Bộ Kế hoạch và Đầu tư, Bộ Quốc phòng và các bộ,\nngành có liên quan.\n3. Trong thời hạn 15 ngày kể từ ngày nhận được hồ\nsơ lấy ý kiến của Bộ Công Thương, các bộ, ngành phải có ý kiến bằng văn bản về\nnội dung thuộc phạm vi quản lý nhà nước của mình gửi Bộ Công Thương.\n4. Trong thời hạn 45 ngày kể từ ngày nhận được hồ\nsơ hợp lệ, Bộ Công Thương ban hành văn bản chấp thuận để lại một phần hoặc toàn bộ công trình dầu khí hay hoãn thu dọn một phần hoặc toàn bộ công trình dầu khí.\n5. Trường hợp Tập đoàn Dầu khí Việt Nam có đề xuất\nđể lại một phần hoặc toàn bộ công trình dầu khí hoặc hoãn thu dọn một phần hoặc toàn bộ công trình dầu khí, quy trình đề xuất và phê duyệt được thực hiện theo quy định tại các khoản 1, 2, 3 và 4 Điều này.\n6. Trường hợp cơ quan có thẩm quyền yêu cầu để lại toàn bộ hoặc một phần công trình dầu khí, Bộ Công Thương có văn bản thông báo gửi Tập đoàn Dầu khí Việt Nam và nhà thầu ít nhất 06 tháng trước khi bắt đầu triển khai hoạt động thu dọn theo tiến độ đã được phê duyệt.\n7. Bộ Công Thương quy định chi tiết về bảo quản và\nhủy bỏ giếng khoan dầu khí, thu dọn công trình dầu khí.\nChương VII\nƯU ĐÃI TRONG HOẠT ĐỘNG DẦU KHÍ\nĐiều 56. Tiêu chí xác định các lô dầu khí tại vùng nước sâu, xa bờ, khu vực có điều kiện địa lý đặc biệt khó\nkhăn, địa chất phức tạp; mỏ dầu khí cận biên 1. Lô dầu khí tại vùng nước sâu, xa bờ, khu vực có\nđiều kiện địa lý đặc biệt khó khăn, địa chất phức tạp là các lô có:\na) Điểm nông nhất của lô dầu khí sâu từ 150 m trở\nlên;\nb) Điểm gần bờ nhất của lô dầu khí cách bờ từ 150 km trở lên.\n2. Mỏ dầu khí cận biên là mỏ dầu khí có tỷ suất hoàn vốn nội tại cho toàn đời dự án tiệm cận dưới 10% tính theo USD và nhỏ hơn chi phí sử dụng vốn bình quân.\nĐiều 57. Hồ sơ, trình tự, thủ\ntục thẩm định và phê duyệt danh mục các lô, mỏ dầu khí được hưởng chính sách ưu\nđãi đầu tư và ưu đãi đầu tư đặc biệt 1. Căn cứ đối tượng ưu đãi quy định tại Điều 53 Luật Dầu khí, Tập đoàn Dầu khí Việt Nam xây dựng danh mục các lô, mỏ dầu khí được hưởng chính sách ưu đãi đầu tư và ưu đãi đầu tư đặc biệt, trình Bộ Công Thương 02 bộ hồ sơ (gồm 01 bộ hồ sơ gốc và 01 bộ hồ sơ bản sao, gửi trực tiếp hoặc qua bưu chính) để thẩm định. Hồ sơ bao gồm:\na) Tờ trình đề nghị phê duyệt danh mục các lô, mỏ dầu khí được hưởng chính sách ưu đãi đầu tư và ưu đãi đầu tư đặc biệt;\nb) Đánh giá sự phù hợp với tiêu chí quy định tại Điều 53 Luật Dầu khí kèm theo tính toán cụ thể đối với từng lô, mỏ dầu khí trong các danh mục tương ứng (bao gồm nội dung đánh giá hiệu quả\nkinh tế của dự án);\nc) Các văn bản, tài liệu khác có liên quan.\n2. Trong thời hạn 05 ngày làm việc kể từ ngày nhận\nđược hồ sơ hợp lệ, Bộ Công Thương gửi hồ sơ lấy ý kiến của Bộ Kế hoạch và Đầu tư, Bộ Tài chính, Bộ Tư pháp, Bộ Tài nguyên và Môi trường, Bộ Quốc phòng, Bộ\nCông an và các bộ, ngành có liên quan.\n3. Trong thời hạn 15 ngày kể từ ngày nhận được hồ\nsơ lấy ý kiến của Bộ Công Thương, các bộ, ngành phải có ý kiến bằng văn bản về\nnội dung thuộc phạm vi quản lý nhà nước của mình gửi Bộ Công Thương.\n4. Trong thời hạn 45 ngày kể từ ngày nhận được hồ\nsơ hợp lệ, Bộ Công Thương hoàn thành thẩm định danh mục các lô, mỏ dầu khí được hưởng chính sách ưu đãi đầu tư và ưu đãi đầu tư đặc biệt, trình Thủ tướng Chính phủ xem xét, phê duyệt. Hồ sơ bao gồm:\na) Tờ trình Thủ tướng Chính phủ về kết quả thẩm định và đề nghị phê duyệt danh mục các lô, mỏ dầu khí được hưởng chính sách ưu đãi đầu tư và ưu đãi đầu tư đặc biệt;\nb) Hồ sơ theo quy định tại khoản 1 Điều này;\nc) Báo cáo tổng hợp tiếp thu, giải trình ý kiến của các bộ, ngành và bản sao văn bản góp ý của các bộ, ngành.\n5. Hằng năm, Tập đoàn Dầu khí Việt Nam rà soát,\nđánh giá tình hình đàm phán, ký kết hợp đồng dầu khí và triển khai hoạt động dầu khí tại các lô, mỏ dầu khí, đề xuất điều chỉnh danh mục các lô, mỏ dầu khí được hưởng chính sách ưu đãi đầu tư và ưu đãi đầu tư đặc biệt (nếu cần thiết), báo cáo Bộ Công Thương thẩm định, trình Thủ tướng Chính phủ phê duyệt theo quy định tại Điều này.\nChương VIII KHAI THÁC TẬN THU MỎ, CỤM MỎ, LÔ DẦU KHÍ\nĐiều 58. Nguyên tắc khai thác tận thu mỏ, cụm mỏ, lô dầu khí\n1. Việc khai thác tận thu mỏ, cụm mỏ, lô dầu khí được thực hiện theo cơ chế điều hành khai thác tận thu mỏ, cụm mỏ, lô dầu khí do Thủ\ntướng Chính phủ ban hành theo quy định tại Điều 60 Nghị định này phù hợp với đặc thù của từng mỏ, cụm mỏ, lô dầu khí.\n2. Hoạt động dầu khí đối với mỏ, cụm mô, lô dầu khí\nkhai thác tận thu phải đảm bảo an toàn, tiết kiệm, hiệu quả, kiểm soát chặt chẽ\nchi phí, trên cơ sở định mức kinh tế, kỹ thuật được cơ quan có thẩm quyền chấp thuận hoặc ban hành, phù hợp với các quy định của pháp luật có liên quan.\n3. Tập đoàn Dầu khí Việt Nam trực tiếp quản lý, điều hành khai thác tận thu mỏ, cụm mỏ, lô dầu khí; được lựa chọn và chỉ định đơn vị\nvận hành đủ năng lực tài chính, kỹ thuật và kinh nghiệm trong hoạt động dầu khí, đảm bảo tận thu nguồn tài nguyên dầu khí hiệu quả.\n4. Hồ sơ, trình tự, thủ tục thẩm định và phê duyệt\nđầu tư bổ sung được thực hiện theo quy định tại khoản 5 Điều 44 Luật Dầu khí, Điều 48 và Điều 50 Nghị định này.\nĐiều 59. Nội dung chính của cơ\nchế điều hành khai thác tận thu mỏ, cụm mỏ, lô dầu khí\n1. Thông tin tổng quan về mỏ, cụm mỏ, lô dầu khí\nkhai thác tận thu.\n2. Nguyên tắc điều hành hoạt động dầu khí đối với mỏ,\ncụm mỏ, lô dầu khí khai thác tận thu theo quy định tại Điều 58 Nghị định này.\n3. Doanh thu bán dầu khí từ hoạt động khai thác tận thu mỏ, cụm mỏ, lô dầu khí và các doanh thu khác (nếu có) được sử dụng cho các mục đích sau:\na) Thanh toán và hoàn trả toàn bộ các chi phí hợp lý, hợp lệ đã thực hiện trong quá trình triển khai hoạt động dầu khí theo chương trình hoạt động và ngân sách được phê duyệt;\nb) Tạm ứng để chi trả các chi phí ước tính sẽ phát sinh cho kỳ tiếp theo phù hợp với chương trình hoạt động và ngân sách đã được phê duyệt; tạm ứng để chi trả các chi phí mua sắm vật tư, sử dụng dịch vụ phục vụ cho hoạt động dầu khí trong thời gian chưa bán được sản phẩm và trong trường hợp doanh thu bán dầu khí không đủ để thanh toán chi phí hợp lý, hợp lệ cho hoạt\nđộng dầu khí hoặc những phát sinh không thể dự báo trước hoặc cho hoạt động thu dọn công trình dầu khí trong trường hợp quỹ bảo đảm nghĩa vụ thu dọn công trình dầu khí không đủ để trang trải cho hoạt động thu dọn công trình dầu khí;\nc) Trang trải chi phí đã thực hiện đầu tư bổ sung nhằm duy trì sản lượng khai thác dầu khí; giá trị trích lập quỹ bảo đảm nghĩa vụ\nthu dọn công trình dầu khí đối với các hạng mục công trình đầu tư bổ sung (nếu có).\n4. Thực hiện nộp ngân sách nhà nước hằng năm đối với các khoản tiền sau:\na) Toàn bộ doanh thu sau khi đã sử dụng cho các mục\nđích được quy định tại khoản 3 Điều này;\nb) Phần ngân sách dư còn lại (nếu có) trong trường hợp chi phí thực hiện cuối kỳ ít hơn ngân sách thực tế đã được phê duyệt;\nc) Các khoản lãi phát sinh (nếu có) tính trên số dư\ncác khoản dự phòng được phép để lại khi kết thúc năm tài chính;\nd) Giá trị còn lại của quỹ bảo đảm nghĩa vụ thu dọn công trình dầu khí sau khi hoàn thành nghĩa vụ thu dọn công trình dầu khí (nếu có) được xác định trên cơ sở kết quả kiểm toán theo quy định;\nđ) Giá trị chênh lệch (nếu có) giữa doanh thu có được từ việc thanh lý tài sản không còn cần dùng cho hoạt động dầu khí; các thiết bị,\nphương tiện, vật tư và phế thải thu gom được trong quá trình thu dọn công trình dầu khí; chi phí thực tế hợp lý, hợp lệ tương ứng trong từng trường hợp.\n5. Hoạt động khai thác tận thu mỏ, cụm mỏ, lô dầu khí chấm dứt khi xảy ra một trong các trường hợp sau:\na) Dự báo doanh thu không đủ để thanh toán các chi phí;\nb) Tình hạng công trình, thiết bị của mỏ, cụm mỏ,\nlô dầu khí không bảo đảm an toàn;\nc) Các trường hợp bất khả kháng dẫn đến không thể\ntiếp tục hoạt động khai thác dầu khí.\n6. Trách nhiệm của Tập đoàn Dầu khí Việt Nam trong khai thác tận thu mỏ, cụm mỏ, lô dầu khí\na) Tổ chức thực hiện khai thác tận thu mỏ, cụm mỏ,\nlô dầu khí bảo đảm an toàn, hiệu quả;\nb) Xây dựng và phê duyệt chương trình hoạt động và\nngân sách hằng năm;\nc) Xây dựng và phê duyệt quy trình lựa chọn nhà thầu cung cấp dịch vụ, mua sắm hàng hóa trong hoạt động khai thác tận thu mỏ, cụm mỏ,\nlô dầu khí phù hợp với quy định của Luật Dầu khí và nguyên tắc áp dụng đối với hợp đồng dầu khí;\nd) Định kỳ hằng quý, báo cáo Thủ tướng Chính phủ về\ntình hình thực hiện khai thác tận thu mỏ, cụm mỏ, lô dầu khí, trong đó đánh giá\nkết quả lãi hoặc lỗ, các biến động đột biến của hoạt động khai thác tận thu mỏ,\ncụm mỏ, lô dầu khí (nếu có) và giải pháp xử lý tiếp theo;\nđ) Quyết định chấm dứt hoạt động khai thác tận thu và thu dọn công trình dầu khí;\ne) Thực hiện kiểm toán tài chính và kiểm toán kết thúc giai đoạn (nếu có); trên cơ sở các báo cáo kiểm toán nêu trên, phê duyệt báo cáo quyết toán thực hiện khai thác tận thu mỏ, cụm mỏ, lô dầu khí; phê duyệt quyết toán chi phí thu dọn công trình dầu khí;\ng) Tiến hành thu dọn công trình dầu khí theo quy định của Luật Dầu khí và Nghị định này sau khi kết thúc khai thác tận thu mỏ, cụm mỏ, lô dầu khí.\nĐiều 60. Hồ sơ, trình tự, thủ\ntục thẩm định và phê duyệt cơ chế điều hành khai thác tận thu mỏ, cụm mỏ, lô dầu khí\n1. Căn cứ quy định tại điểm c khoản 2, điểm b khoản 3 Điều 41 Luật Dầu khí, Tập đoàn Dầu khí Việt Nam xây dựng cơ chế điều hành khai thác tận thu mỏ, cụm mỏ, lô dầu khí phù hợp với tính chất,\nđặc thù của từng mỏ, cụm mỏ, lô dầu khí, trình Bộ Công Thương 02 bộ hồ sơ (gồm 01 bộ hồ sơ gốc và 01 bộ hồ sơ bản sao, gửi trực tiếp hoặc qua bưu chính) đề\nnghị phê duyệt cơ chế điều hành khai thác tận thu mỏ, cụm mỏ, lô dầu khí để thẩm\nđịnh. Hồ sơ bao gồm:\na) Tờ trình đề nghị phê duyệt cơ chế điều hành khai thác tận thu mỏ, cụm mỏ, lô dầu khí;\nb) Dự thảo cơ chế điều hành khai thác tận thu mỏ, cụm mỏ, lô dầu khí, bao gồm các nội dung chính theo quy định tại Điều 59 Nghị định này;\nc) Các văn bản, tài liệu khác có liên quan.\n2. Trong thời hạn 05 ngày làm việc kể từ ngày nhận\nđược đủ hồ sơ hợp lệ, Bộ Công Thương gửi hồ sơ lấy ý kiến Bộ Kế hoạch và Đầu tư, Bộ Tài chính, Bộ Tư pháp, Bộ Tài nguyên và Môi trường, Ủy ban Quản lý vốn nhà nước tại doanh nghiệp và các bộ, ngành có liên quan.\n3. Trong thời hạn 15 ngày kể từ ngày nhận được văn bản lấy ý kiến kèm theo hồ sơ của Bộ Công Thương, các bộ, ngành có ý kiến bằng văn bản về nội dung thuộc phạm vi quản lý nhà nước của mình, gửi Bộ Công Thương.\n4. Trong thời hạn 45 ngày kể từ ngày nhận được đủ hồ\nsơ hợp lệ, Bộ Công Thương hoàn thành thẩm định cơ chế điều hành khai thác tận thu mỏ, cụm mỏ, lô dầu khí, trình Thủ tướng Chính phủ phê duyệt. Hồ sơ bao gồm:\na) Tờ trình Thủ tướng Chính phủ về kết quả thẩm định và đề nghị phê duyệt cơ chế điều hành khai thác tận thu mỏ, cụm mỏ, lô dầu khí;\nb) Hồ sơ theo quy định tại khoản 1 Điều này;\nc) Báo cáo tổng hợp tiếp thu, giải trình ý kiến của các bộ, ngành và bản sao văn bản góp ý của các bộ, ngành.\nĐiều 61. Cơ chế quản lý, hạch toán, sử dụng tài sản tiếp nhận từ nhà thầu để khai thác tận thu mỏ, cụm mỏ, lô\ndầu khí\n1. Để tiến hành khai thác tận thu mỏ, cụm mỏ, lô dầu khí, Tập đoàn Dầu khí Việt Nam tiếp nhận nguyên trạng thông tin, dữ liệu, tài liệu, mẫu vật, công trình dầu khí và tài sản khác đã được lắp đặt, đầu tư của hợp\nđồng dầu khí đã kết thúc theo thỏa thuận ký với nhà thầu; được sử dụng thông tin, dữ liệu, tài liệu, mẫu vật, công trình dầu khí và tài sản khác mà không phải trả tiền.\n2. Tập đoàn Dầu khí Việt Nam tổ chức quản lý và lập báo cáo riêng để theo dõi thông tin, dữ liệu, tài liệu, mẫu vật, công trình dầu khí và tài sản khác đã tiếp nhận theo quy định tại khoản 1 Điều này và cập nhật giá trị đầu tư tăng thêm, được quy định cụ thể tại Quyết định của Thủ tướng Chính phủ phê duyệt cơ chế điều hành khai thác tận thu mỏ, cụm mỏ, lô dầu khí,\nkhông phản ánh vào vốn nhà nước đầu tư tại doanh nghiệp và báo cáo tài chính của Tập đoàn Dầu khí Việt Nam.\n3. Khi kết thúc khai thác tận thu mỏ, cụm mỏ, lô dầu khí và hoàn thành thu dọn công trình dầu khí, Tập đoàn Dầu khí Việt Nam tiếp tục quản lý thông tin, dữ liệu, tài liệu, mẫu vật và tài sản khác (nếu có) theo quy\nđịnh của Luật Dầu khí và Nghị định này.\nChương IX QUYẾT TOÁN ĐỐI VỚI HOẠT\nĐỘNG DẦU KHÍ THEO HỢP ĐỒNG DẦU KHÍ\nĐiều 62. Quyết toán chi phí hoạt\nđộng dầu khí theo hợp đồng dầu khí\n1. Việc quyết toán chi phí hoạt động dầu khí theo hợp\nđồng dầu khí được được thực hiện theo giai đoạn hoặc giai đoạn thành phần của hợp\nđồng dầu khí hoặc khi kết thúc dự án dầu khí, dự án thành phần của dự án dầu khí và khi kết thúc hợp đồng dầu khí phù hợp với quy định của hợp đồng dầu khí\nđã ký và Luật Dầu khí.\n2. Nhà thầu có trách nhiệm lập báo cáo quyết toán chi phí hoạt động dầu khí khi kết thúc giai đoạn hoặc giai đoạn thành phần của hợp đồng dầu khí; khi kết thúc dự án dầu khí, dự án thành phần của dự án dầu khí và khi kết thúc thời hạn của hợp đồng dầu khí.\n3. Tập đoàn Dầu khí Việt Nam có trách nhiệm tổ chức thẩm tra, phê duyệt báo cáo quyết toán chi phí hoạt động dầu khí do nhà thầu lập và trình, trên cơ sở kết quả kiểm toán chi phí hoạt động dầu khí do Tập đoàn Dầu khí Việt Nam thực hiện phù hợp với hợp đồng dầu khí đã ký và Luật Dầu khí. Tập đoàn Dầu khí Việt Nam được phép thuê kiểm toán độc lập (nếu cần thiết) để kiểm toán báo cáo quyết toán chi phí hoạt động dầu khí do nhà thầu trình.\nChương X\nĐIỀU KHOẢN THI HÀNH\nĐiều 63. Hiệu lực thi hành 1. Nghị định này có hiệu lực thi hành kể từ ngày 01 tháng 7 năm 2023 thay thế Nghị định số 95/2015/NĐ-CP ngày 16 tháng 10 năm 2015 của Chính phủ quy định chi tiết một số điều của Luật Dầu khí và Nghị định số 33/2013/NĐ-CP ngày 22 tháng 4 năm 2013 của Chính phủ ban hành hợp đồng mẫu hợp đồng chia sản phẩm dầu khí.\n2. Các Bộ trưởng, Thủ trưởng cơ quan ngang bộ, Thủ\ntrưởng cơ quan thuộc Chính phủ, Chủ tịch Ủy ban nhân dân các tỉnh, thành phố trực thuộc trung ương chịu trách nhiệm thi hành Nghị định này.\nĐiều 64. Điều khoản chuyển tiếp 1. Đối với hợp đồng dầu khí đã được cấp giấy chứng nhận đăng ký đầu tư trước ngày Nghị định này có hiệu lực, thẩm quyền, hồ sơ,\ntrình tự, thủ tục thẩm định, phê duyệt báo cáo, kế hoạch, chương trình mới hoặc báo cáo, kế hoạch, chương trình điều chỉnh sau ngày Nghị định này có hiệu lực\nđược thực hiện theo quy định tại Nghị định này.\n2. Công ty điều hành chung đại diện cho nhà thầu điều hành hoạt động dầu khí được thành lập trước ngày Nghị định này có hiệu lực được tiếp tục hoạt động phù hợp với quy định của hợp đồng dầu khí.\nNơi nhận:\n - Ban Bí thư Trung ương Đảng;\n - Thủ tướng, các Phó Thủ tướng Chính phủ;\n - Các bộ, cơ quan ngang bộ, cơ quan thuộc Chính phủ;\n - HĐND, UBND các tỉnh, thành phố trực thuộc trung ương;\n - Văn phòng Trung ương và các Ban của Đảng;\n - Văn phòng Tổng Bí thư;\n - Văn phòng Chủ tịch nước;\n - Hội đồng Dân tộc và các Ủy ban của Quốc hội;\n - Văn phòng Quốc hội;\n - Tòa án nhân dân tối cao;\n - Viện kiểm sát nhân dân tối cao;\n - Kiểm toán nhà nước;\n - Ủy ban Giám sát tài chính Quốc gia;\n - Ngân hàng Chính sách xã hội;\n - Ngân hàng Phát triển Việt Nam;\n - Ủy ban trung ương Mặt trận Tổ quốc Việt Nam;\n - Cơ quan trung ương của các đoàn thể;\n - VPCP: BTCN, các PCN, Trợ lý TTg, TGĐ Cổng TTĐT, các Vụ, Cục, đơn vị trực thuộc, Công báo;\n - Lưu: VT, CN (02b), Thọ.\nTM. CHÍNH PHỦ\n KT. THỦ TƯỚNG PHÓ THỦ TƯỚNG Trần Hồng Hà\nPHỤ LỤC HỢP ĐỒNG MẪU CỦA HỢP ĐỒNG CHIA SẢN PHẨM DẦU KHÍ\n(Kèm theo Nghị định số 45/2023/NĐ-CP ngày 01 tháng 7 năm 2023 của Chính phủ)\nHỢP ĐỒNG CHIA SẢN PHẨM DẦU KHÍ\nGIỮA TẬP ĐOÀN DẦU KHÍ\nVIỆT NAM VỚI\n………………………\nVÀ\n………………………\nĐỐI VỚI LÔ\n……………….\nCỘNG HÒA XÃ HỘI CHỦ NGHĨA VIỆT NAM Hà Nội, năm 20….\nMỤC LỤC Chương I ĐỊNH NGHĨA, PHỤ LỤC VÀ PHẠM VI HỢP ĐỒNG \nĐiều 1.1. Định nghĩa \nĐiều 1.2. Nguyên tắc cơ bản của hợp đồng \nĐiều 1.3. Quyền lợi tham gia Chương II THỜI HẠN, CAM KẾT CÔNG VIỆC TỐI THIỂU VÀ\nHOÀN TRẢ DIỆN TÍCH HỢP ĐỒNG \nĐiều 2.1. Thời hạn \nĐiều 2.2. Cam kết công việc và tài chính tối thiểu \nĐiều 2.3. Hoàn trả diện tích Chương III ỦY BAN QUẢN LÝ \nĐiều 3.1. Thành lập Ủy ban Quản lý \nĐiều 3.2. Quyền và nghĩa vụ của Ủy ban Quản lý \nĐiều 3.3. Cơ chế hoạt động của Ủy ban Quản lý \nChương IV CHƯƠNG TRÌNH HOẠT ĐỘNG VÀ NGÂN SÁCH \nĐiều 4.1. Chương trình tìm kiếm thăm dò dầu khí \nĐiều 4.2. Thẩm lượng và Báo cáo tài nguyên, trữ lượng dầu khí \nĐiều 4.3. Kế hoạch đại cương phát triển mỏ dầu khí\nvà Kế hoạch phát triển mỏ dầu khí \nĐiều 4.4. Kế hoạch khai thác sớm mỏ dầu khí \nĐiều 4.5. Các phát hiện tiếp theo \nĐiều 4.6. Chương trình hoạt động và Ngân sách hằng năm \nĐiều 4.7. Phát hiện khí tiềm năng \nĐiều 4.8. Hướng dẫn của PETROVIETNAM Chương V QUYỀN VÀ NGHĨA VỤ CỦA CÁC BÊN \nĐiều 5.1. Nhà thầu\nĐiều 5.2. PETROVIETNAM Chương VI PHÂN BỔ DẦU KHÍ \nĐiều 6.1. Phân bổ Dầu thô \nĐiều 6.2. Phân bổ Khí thiên nhiên Chương VII THUẾ, PHÍ VÀ LỆ PHÍ \nĐiều 7.1. Nghĩa vụ thuế, phí và lệ phí \nĐiều 7.2. Thuế tài nguyên \nĐiều 7.3. Thuế thu nhập doanh nghiệp\nĐiều 7.4. Thuế xuất khẩu \nĐiều 7.5. Thuế thu nhập do chuyển nhượng \nĐiều 7.6. Thuế giá trị gia tăng \nĐiều 7.7. Phí bảo vệ môi trường \nĐiều 7.8. Phụ thu đối với dầu lãi \nĐiều 7.9. Các loại thuế, phí và lệ phí khác \nĐiều 7.10. Áp dụng các ưu đãi khi có thay đổi pháp luật Chương VIII ĐỊNH GIÁ TRỊ, ĐO LƯỜNG VÀ XỬ LÝ DẦU KHÍ. \nĐiều 8.1. Định giá trị Dầu thô \nĐiều 8.2. Định giá trị Khí thiên nhiên và Khí đồng hành \nĐiều 8.3. Đo lường dầu khí \nĐiều 8.4. Lịch trình khai thác \nĐiều 8.5. Lấy dầu và tiêu thụ khí \nChương IX HOA HỒNG VÀ CHI PHÍ TÀI LIỆU. \nĐiều 9.1. Hoa hồng \nĐiều 9.2. Chi phí tài liệu Chương X ĐÀO TẠO, TUYỂN DỤNG VÀ DỊCH VỤ \nĐiều 10.1. Đào tạo \nĐiều 10.2. Tuyển dụng và Dịch vụ. \nChương XI KẾ TOÁN, KIỂM TOÁN VÀ QUYẾT TOÁN \nĐiều 11.1. Kế toán \nĐiều 11.2. Kiểm toán \nĐiều 11.3. Quyết toán Chi phí hoạt động dầu khí \nChương XII THAM GIA CỦA PETROVIETNAM VÀ CHUYỂN NHƯỢNG\nĐiều 12.1. Tham gia của PETROVIETNAM \nĐiều 12.2. Chuyển nhượng Chương XIII THANH TOÁN, TIỀN TỆ VÀ HỐI ĐOÁI \nĐiều 13.1. Thanh toán \nĐiều 13.2. Tiền tệ và hối đoái Chương XIV SỞ HỮU TÀI SẢN, TÀI SẢN THUÊ VÀ THU DỌN \nĐiều 14.1. Sở hữu tài sản \nĐiều 14.2. Tài sản thuê \nĐiều 14.3. Thu dọn Chương XV TRỌNG TÀI, MIỄN TRỪ CÓ TÍNH CHỦ QUYỀN VÀ\nQUYẾT ĐỊNH CỦA CHUYÊN GIA\nĐiều 15.1. Trọng tài \nĐiều 15.2. Miễn trừ có tính chủ quyền \nĐiều 15.3. Quyết định của chuyên gia Chương XVI CHẤM DỨT VÀ VI PHẠM \nĐiều 16.1. Chấm dứt \nĐiều 16.2. Vi phạm Chương XVII TIÊU THỤ TRONG NƯỚC \nĐiều 17.1. Bán Dầu thô trong nước \nĐiều 17.2. Nghĩa vụ bán Khí thiên nhiên Chương XVIII ỔN ĐỊNH VÀ HỢP NHẤT \nĐiều 18.1. Ổn định \nĐiều 18.2. Hợp nhất và mở rộng Chương XIX BẤT KHẢ KHÁNG \nĐiều 19.1. Các sự kiện Bất khả kháng \nĐiều 19.2. Ảnh hưởng và thông báo Chương XX NHỮNG QUY ĐỊNH KHÁC \nĐiều 20.1. Thông báo \nĐiều 20.2. Luật áp dụng \nĐiều 20.3. Bảo hiểm\nĐiều 20.4. Người điều hành \nĐiều 20.5. Quan hệ và trách nhiệm \nĐiều 20.6. Bảo mật \nĐiều 20.7. Các thỏa thuận khác Chương XXI ĐIỀU KHOẢN THI HÀNH \nĐiều 21.1. Hiệu lực \nĐiều 21.2. Tính toàn vẹn \nĐiều 21.3. Sửa đổi và bổ sung \nĐiều 21.4. Mâu thuẫn \nĐiều 21.5. Khước từ \nĐiều 21.6. Tính tách biệt của các điều khoản \nĐiều 21.7. Thông cáo \nĐiều 21.8. Bản gốc và Ngôn ngữ \nCác Phụ lục\n[Do Các Bên thoả thuận]\nPhụ lục A: Bản đồ và Tọa độ của Diện tích hợp đồng;\nPhụ lục B: Thể thức kế toán;\nPhụ lục C: Các thông tin cơ bản để cấp Giấy chứng nhận đăng ký đầu tư\nHỢP ĐỒNG CHIA SẢN PHẨM DẦU KHÍ NÀY được ký kết ngày ... tháng... năm .... bởi và giữa:\nTẬP ĐOÀN DẦU KHÍ VIỆT NAM, một công ty trách nhiệm hữu hạn một thành viên, được thành lập và hoạt động theo pháp luật của nước Cộng hòa xã hội chủ nghĩa Việt Nam, có trụ sở đăng ký tại số 18 Láng Hạ, quận Ba\nĐình, Hà Nội, nước Cộng hoà xã hội chủ nghĩa Việt Nam (sau đây gọi tắt là\n“PETROVIETNAM”), là bên thứ nhất, và\n[…………………….. ], [……………………… ] được thành lập và hoạt\nđộng theo luật của [……………………… ] và có địa chỉ đăng ký tại […………………… ] [sau đây gọi tắt là “………………….. ”].[...] và [....] sau đây được gọi chung là “NHÀ THẦU”\nvà riêng là “Bên Nhà thầu”, là bên thứ hai.\nCác bên thứ nhất và thứ hai sau đây được gọi riêng là “Bên” và gọi chung là “Các Bên” tùy theo ngữ cảnh.\nCĂN CỨ\nXét rằng, PETROVIETNAM có quyền được quy định tại\nĐiều 61 của Luật Dầu khí và NHÀ THẦU mong muốn ký kết Hợp đồng Chia sản phẩm dầu khí để tiến hành các hoạt động tìm kiếm thăm dò, thẩm lượng, phát triển và khai thác dầu khí trong Diện tích hợp đồng.\nXét rằng, Các Bên mong muốn xác lập các điều khoản và điều kiện của Hợp đồng này phù hợp với Luật Dầu khí để đạt được các mục tiêu và mục đích được đề ra trong Hợp đồng này.\nNay, vì vậy, Các Bên thoả thuận như sau:\nChương I\nĐỊNH NGHĨA, PHỤ LỤC VÀ PHẠM VI HỢP ĐỒNG\nĐiều 1.1. Định nghĩa Các thuật ngữ được sử dụng trong Hợp đồng và các Phụ\nlục của Hợp đồng này, phù hợp với quy định của Luật Dầu khí, sẽ có nghĩa như được quy định dưới đây:\n1.1.1. “Bất khả kháng” được định nghĩa tại Chương XIX.\n1.1.2. “Bên” được giải thích trong phần mở đầu của Hợp đồng này và/hoặc những người kế thừa và/hoặc bên nhận chuyển nhượng hợp pháp của họ.\n1.1.3. “Bên nước ngoài” là cá nhân và/hoặc pháp nhân được thành lập và đăng ký theo pháp luật nước ngoài tạo thành NHÀ THẦU và/hoặc những người kế thừa và/hoặc bên nhận chuyển nhượng hợp pháp của họ, trừ\nPETROVIETNAM, các Công ty chi nhánh của PETROVIETNAM hoặc các công ty được thành lập theo pháp luật Việt Nam.\n1.1.4. “Các Bên” được giải thích trong phần mở đầu của Hợp đồng này và/hoặc những người kế thừa và/hoặc nhận chuyển nhượng hợp pháp của họ.\n1.1.5. “Công ty chi nhánh” là của một Bên trong Hợp\nđồng này, là một tổ chức hoặc cá nhân nào khác (i) chi phối Bên tương ứng hoặc\n(ii) chịu sự chi phối của Bên tương ứng nào trong Hợp đồng này hoặc (iii) chịu sự chi phối của một tổ chức hoặc cá nhân chi phối Bên tương ứng. Chi phối ở đây\nđược hiểu là quyền sở hữu từ trên năm mươi phần trăm (50%) quyền biểu quyết của tổ chức, cá nhân đó hoặc có quyền trực tiếp hay gián tiếp bổ nhiệm tất cả hoặc\nđa số các thành viên ban điều hành của Công ty chi nhánh.\n1.1.6. “Chi phí hoạt động dầu khí” là mọi chi tiêu do NHÀ THẦU thực hiện và gánh chịu để tiến hành hoạt động dầu khí theo Hợp đồng này, bao gồm nhưng không giới hạn các hoạt động được liệt kê tại các Điều từ\n1.1.30 đến 1.1.33, được xác định phù hợp với Thể thức kế toán trong Phụ lục B và được thu hồi phù hợp với Điều 6.1.2, Điều 6.2.2 và Điều 11.2.2.\n1.1.7. “Chính phủ” là Chính phủ nước Cộng hòa xã hội chủ nghĩa Việt Nam.\n1.1.8. “Chuẩn mực Kế toán Việt Nam” (VAS) là các chuẩn mực kế toán được sử dụng phổ biến và được chấp nhận rộng rãi trong thông lệ kế toán ở Việt Nam.\n1.1.9. “Chuyên gia” là chuyên gia được chỉ định phù\nhợp với Điều 15.3.\n1.1.10. “Chương” có nghĩa là chương của Hợp đồng này.\n1.1.11. “Chương trình hoạt động và Ngân sách” là\nchương trình chi tiết hoạt động dầu khí được lập theo Hợp đồng này cho mỗi Năm với ngân sách dự kiến tương ứng được quy định tại Chương IV.\n1.1.12. “Cố ý điều hành sai” là bất kỳ hành động nào hoặc sự bỏ qua không hành động bởi bất kỳ nhân viên nào của NHÀ THẦU do cố\ntình gây nên, do coi thường hoặc chú ý dẫn đến các hậu quả có hại có thể xảy ra\nđối với an toàn và tài sản của cá nhân hoặc thực thể khác liên quan đến hoạt động dầu khí được tiến hành hoặc sẽ được tiến hành theo Hợp đồng này mà NHÀ THẦU đó\nđã biết, hoặc lẽ ra phải biết 1.1.13. “Dầu lãi” là phần sản lượng Dầu thô còn lại sau khi trừ đi Dầu thuế tài nguyên và Dầu thu hồi chi phí từ Sản lượng dầu thực theo quy định tại Điều 6.1.\n1.1.14. “Dầu thu hồi chi phí” và “Khí thu hồi chi phí” là phần Sản lượng dầu thực hoặc Sản lượng khí thực, tùy từng trường hợp,\nmà từ đó NHÀ THẦU thực hiện thu hồi chi phí theo quy định tại Điều 6.1.2 và Điều 6.2.2.\n1.1.15. “Dầu thuế tài nguyên” và “Khí thuế tài nguyên” là phần Sản lượng dầu thực hoặc Sản lượng khí thực, tùy từng trường hợp,\nđược phân bổ để hoàn thành các nghĩa vụ Thuế Tài nguyên theo quy định tại Điều 6.1.1 và Điều 6.1.2 tương ứng.\n1.1.16. “Diện tích hợp đồng” là diện tích ban đầu với tọa độ được xác định và mô tả trong Phụ lục A và sẽ được điều chỉnh tùy từng thời\nđiểm phù hợp với các quy định tại Điều 2.3.\n1.1.17. “Diện tích phát triển” là phần của Diện tích hợp đồng được giữ lại để phát triển một Phát hiện thương mại được xác định rõ hơn tại các Điều 2.1.3 và 2.3.4.\n1.1.18. “Điểm giao nhận” là điểm mà tại đó dầu khí\nchạm mặt bích ngoài của tàu dầu hoặc phương tiện tàng chứa dùng để lấy hoặc tiêu thụ dầu khí hoặc những điểm khác theo thoả thuận của Các Bên.\n1.1.19. “Điều” nghĩa là điều của Hợp đồng này.\n1.1.20. “Đô la Mỹ” hoặc “USD” là đồng tiền hợp pháp của Hợp chủng quốc Hoa Kỳ.\n1.1.21. “Đồng” hoặc “VNĐ” là đồng tiền hợp pháp của nước Cộng hòa xã hội chủ nghĩa Việt Nam.\n1.1.22. “Giá thị trường” là giá dầu thô được lấy hoặc tiêu thụ bởi các Bên Nhà thầu tại Điểm giao nhận như được xác định cho tất cả\ncác mục đích theo Hợp đồng này và phù hợp với Điều 8.1.\n1.1.23. “Giai đoạn tìm kiếm thăm dò” là giai đoạn trong đó Hoạt động tìm kiếm thăm dò dầu khí được tiến hành trong các giai đoạn thành phần phù hợp với quy định tại Điều 2.1.1.\n1.1.24. “Giấy chứng nhận đăng ký đầu tư” là giấy chứng nhận đăng ký đầu tư do Bộ Công Thương cấp đối với Hợp đồng này và các sửa đổi,\nbổ sung (nếu có).\n1.1.25. “Giếng” là một lỗ được khoan vào lòng đất nhằm mục đích tìm kiếm thăm dò, thẩm lượng và khai thác dầu khí.\n1.1.26. “Giếng phát triển” là Giếng được khoan vào vỉa sản phẩm, tầng sản phẩm hoặc mỏ để tiến hành các hoạt động sau đây: khai thác sản phẩm hoặc chất lưu; quan sát, theo dõi động thái của vỉa sản phẩm; bơm\nép chất lưu vào vỉa hoặc tầng sản phẩm; bơm thải chất lưu vào giếng.\n1.1.27. “Giếng thăm dò” nghĩa là Giếng tìm kiếm hoặc Giếng thẩm lượng.\n1.1.28. “Giếng thẩm lượng” là Giếng được khoan để\nthu thập thông tin về quy mô trữ lượng và tính chất của vỉa sản phẩm, tầng sản phẩm hay của mỏ.\n1.1.29. “Giếng tìm kiếm” là Giếng (dù là giếng khô\nhay giếng có phát hiện) được khoan trong Diện tích hợp đồng nhằm tìm kiếm một tích tụ Dầu khí tại một cấu tạo hoặc các cấu tạo khác biệt với bất kỳ cấu tạo nào đã được NHÀ THẦU khoan trước đây.\n1.1.30. “Hoạt động khai thác dầu khí” là hoạt động\nđược nhà thầu tiến hành nhằm thu hồi dầu khí từ mỏ dầu khí trong Diện tích hợp\nđồng, bao gồm: việc vận hành và bảo dưỡng các phương tiện, thiết bị cần thiết;\nlập lịch trình, điều khiển, đo lường, thử vỉa và gọi dòng; thu gom, xử lý, tàng trữ và vận chuyển dầu thô, khí đồng hành và khí thiên nhiên từ bể chứa dầu khí\nđến Điểm giao nhận.\n1.1.31. “Hoạt động phát triển mỏ dầu khí” là hoạt động\nđược Nhà thầu tiến hành gồm lập kế hoạch, thiết kế, mua sắm, chế tạo, xây dựng,\nlắp đặt công trình dầu khí để khai thác dầu khí nhằm mục đích phát triển các tích tụ dầu khí trong Diện tích phát triển. Hoạt động phát triển mỏ dầu khí bao gồm, nhưng không giới hạn ở: các nghiên cứu và khảo sát mỏ, địa chất và địa vật lý; khoan, thử vỉa, hoàn thiện giếng, tái hoàn thiện giếng, khoan lại các Giếng phát triển, khoan và hoàn thiện các Giếng khai thác; lập kế hoạch, thiết kế,\nxây dựng và ký kết hợp đồng để vận chuyển và lắp đặt các đường ống thu gom sản phẩm, lắp đặt các phương tiện và thiết bị ngoài khơi, trên bờ, các bộ chiết tách, bồn chứa, máy bơm, hút nhân tạo, các phương tiện, thiết bị khai thác, thu gom, bơm ép khác và các hoạt động liên quan cần thiết để khai thác, chế biến, xử\nlý, vận chuyển, tàng trữ, giao nhận dầu khí và các hoạt động khác cần thiết cho việc phát triển tích tụ dầu khí một cách an toàn và hiệu quả.\n1.1.32. “Hoạt động thu dọn công trình dầu khí” là hoạt\nđộng được tiến hành để phá bỏ, dỡ đi, phá hủy, hoán cải, bảo quản tạm thời, lâu dài hoặc các biện pháp kỹ thuật khác phù hợp với quy định của pháp luật và\nThông lệ công nghiệp dầu khí quốc tế đối với các công trình dầu khí không còn cần thiết cho hoạt động dầu khí do NHÀ THẦU xây dựng liên quan đến hoạt động dầu khí phù hợp với quy định tại Điều 14.3.\n1.1.33. “Hoạt động tìm kiếm thăm dò dầu khí” là hoạt\nđộng được tiến hành phù hợp với Hợp đồng này nhằm mục đích phát hiện các tích tụ\ndầu khí, thẩm lượng các tích tụ dầu khí đó, các đặc tính của (các) tầng chứa liên quan và các trạng thái biến đổi của chúng có thể xảy ra khi được khai thác. Hoạt động tìm kiếm thăm dò dầu khí có thể bao gồm nhưng không giới hạn ở:\ncác khảo sát địa chất, địa vật lý, địa hóa, khảo sát trên không và các khảo sát khác, các phân tích và các nghiên cứu; khoan, khoan sâu thêm, khoan xiên, đóng giếng, thử vỉa, hoàn thiện giếng, hoàn thiện lại giếng, khoan lại giếng, hủy các Giếng thăm dò, lấy mẫu và thử địa tầng, thử vỉa các giếng đó và tất cả các công việc liên quan tới các hoạt động đó.\n1.1.34. “Hợp đồng” là Hợp đồng Chia sản phẩm dầu khí này và các Phụ lục kèm theo cùng với các sửa đổi, bổ sung phù hợp với pháp luật Việt Nam và Hợp đồng này.\n1.1.35. “Khai thác thương mại” là khai thác dầu khí\ntừ một Phát hiện thương mại và giao nhận dầu khí đó tại Điểm giao nhận theo một chương trình khai thác và tiêu thụ định kỳ sau khi Kế hoạch phát triển mỏ dầu khí của Phát hiện thương mại đó được phê duyệt.\n1.1.36. “Khí lãi” là phần Sản lượng khí thực còn lại sau khi trừ đi Khí thuế tài nguyên và Khí thu hồi chi phí theo quy định tại Điều 6.2.\n1.1.37. “SOFR” là lãi suất cho vay qua đêm sử dụng trái phiếu Chính phủ Hoa Kỳ làm tài sản đảm bảo. SOFR kỳ hạn ba (3) tháng được tính toán dựa trên thị trường phái sinh SOFR tương lai được công bố bởi CME Group - là Cơ quan quản lý chỉ số được ủy quyền và giám sát bởi Cơ quan quản lý\ntài chính của Anh (FCA).\n1.1.38. “Lịch trình khai thác” là bản tóm tắt kế hoạch khai thác dầu thô theo Thùng mỗi ngày hoặc sản lượng khí thiên nhiên theo Mét khối mỗi ngày, được NHÀ THẦU chuẩn bị, được Ủy ban Quản lý chấp thuận và\nPETROVIETNAM phê duyệt phù hợp với Chương trình hoạt động và Ngân sách cho Hoạt\nđộng phát triển mỏ và Hoạt động khai thác dầu khí trong mỗi Diện tích phát triển.\n1.1.39. “Luật Dầu khí” là Luật Dầu khí số 12/2022/QH15 do Quốc hội nước Cộng hòa xã hội chủ nghĩa Việt Nam thông qua ngày 14 tháng 11 năm 2022, có hiệu lực thi hành kể\ntừ ngày 01 tháng 7 năm 2023 và các bổ sung, sửa đổi sau đó.\n1.1.40. “Luật Đầu tư” là Luật Đầu tư do Quốc hội nước Cộng hòa xã hội chủ\nnghĩa Việt Nam thông qua ngày 17 tháng 6 năm 2020, có hiệu lực thi hành kể từ\nngày 01 tháng 01 năm 2021 và các bổ sung, sửa đổi sau đó.\n1.1.41. “Mét khối” là một mét khối Khí thiên nhiên ở\náp suất khí quyển một trăm linh một phẩy ba hai năm (101,325) kilopascals và tại nhiệt độ 15 độ Celsius (15°C).\n1.1.42. “Mét khối/ngày” là số mét khối Khí thiên nhiên khai thác mỗi ngày từ Diện tích hợp đồng hoặc Mỏ dầu khí.\n1.1.43. “Năm” là khoảng thời gian mười hai (12)\ntháng liên tục bắt đầu từ mồng 1 tháng Một và kết thúc vào ngày 31 tháng Mười Hai theo Dương lịch.\n1.1.44. “Năm Hợp đồng” là khoảng thời gian mười hai\n(12) tháng liên tiếp theo Dương lịch bắt đầu từ Ngày hiệu lực của Hợp đồng này.\n1.1.45. “Ngày hiệu lực” là ngày Bộ Công Thương cấp Giấy chứng nhận đăng ký đầu tư đối với Hợp đồng này.\n1.1.46. “Ngày khai thác thương mại đầu tiên” là\nngày sau ngày thứ ba mươi (30) kể từ khi Dầu khí được khai thác liên tục từ Diện tích hợp đồng, thông qua một hệ thống khai thác bao gồm nhưng không giới hạn: Một hoặc nhiều Giếng Phát triển được nối vào một tàu nổi chứa sản phẩm trung chuyển hoặc thông qua đường ống tới một trạm tàng chứa và xuất khẩu trên bờ, nhưng ngoại trừ bất kỳ các lần thử giếng dài hạn nào.\n1.1.47. “Ngày làm việc” là bất kỳ ngày nào mà trong\nđó các ngân hàng thương mại tại Việt Nam thông thường mở cửa để giao dịch đầy đủ.\n1.1.48. “Ngân sách” là toàn bộ chi phí dự kiến cần thiết để tiến hành hoạt động dầu khí theo một Chương trình hoạt động cụ thể.\n1.1.49. “Người điều hành” là tổ chức được chỉ định tại Điều 20.4, đại diện cho các Bên Nhà thầu tham gia Hợp đồng để điều hành hoạt\nđộng dầu khí và thực hiện một số nghĩa vụ, trách nhiệm trong phạm vi được ủy quyền theo quy định của Hợp đồng.\n1.1.50. “NHÀ THẦU” hoặc “Bên Nhà thầu” có nghĩa như\nđược giải thích trong đoạn đầu của Hợp đồng này và/hoặc những người kế thừa và/hoặc bên nhận chuyển nhượng hợp pháp của Bên đó và phù hợp với Chương XII,\ncó thể bao gồm cả Công ty chi nhánh do PETROVIETNAM chỉ định.\n1.1.51. “Nhân viên điều hành cao cấp” nghĩa là bất kỳ nhân viên điều hành nào của NHÀ THẦU, có chức năng như một cán bộ quản lý,\ngiám sát viên hoặc quản lý viên được bổ nhiệm, có trách nhiệm hoặc phụ trách việc khoan, xây dựng hoặc khai thác tại hiện trường và các hoạt động liên quan, hoặc bất kỳ hoạt động thực địa nào khác và bất kỳ nhân viên nào của NHÀ THẦU có vị\ntrí quản lý ngang bằng hoặc cao hơn giám sát viên hoặc quản lý viên được nêu ở\ntrên.\n1.1.52. “Phát hiện dầu khí” là tích tụ dầu khí được phát hiện bằng giếng khoan.\n1.1.53. “Phát hiện thương mại” là một Phát hiện dầu khí mà theo quan điểm riêng của NHÀ THẦU có thể khai thác một cách kinh tế.\n1.1.54. “Quý” là khoảng thời gian ba (3) tháng Dương lịch liên tiếp bắt đầu từ ngày 01 tháng Một, ngày 01 tháng Tư, ngày 01 tháng Bảy và ngày 01 tháng Mười.\n1.1.55. “Quyền lợi tham gia” là quyền, lợi ích,\nnghĩa vụ và trách nhiệm của NHÀ THẦU trong Hợp đồng. Phân quyền lợi tham gia của mỗi Bên nhà thầu tại từng thời điểm được biểu thị bằng tỷ lệ phần trăm, được ghi trong Hợp đồng và Giấy chứng nhận đăng ký đầu tư.\n1.1.56. “Sản lượng dầu thực” là sản lượng Dầu thô\nkhai thác và thu được từ Diện tích hợp đồng, không bao gồm lượng Dầu thô được sử\ndụng vì mục đích hoạt động dầu khí hoặc những tiêu hao thông thường cho hoạt động dầu khí trong Diện tích hợp đồng.\n1.1.57. “Sản lượng khí thực” là sản lượng Khí thiên nhiên, Khí than, Khí đá phiến hoặc Khí sét khai thác và thu được từ Diện tích hợp\nđồng, không bao gồm lượng Khí thiên nhiên được đưa trở lại mỏ hoặc được dùng hoặc\nđược đốt vì mục đích hoạt động dầu khí hoặc những tiêu hao thông thường cho hoạt\nđộng dầu khí trong Diện tích hợp đồng.\n1.1.58. “Thùng/ngày” là số thùng Dầu thô khai thác\nđược mỗi ngày từ Diện tích hợp đồng hoặc Mỏ dầu khí.\n1.1.59. “Thể thức kế toán” là tài liệu mô tả cách thức ghi chép sổ sách và hạch toán kế toán trong quá trình triển khai hoạt động dầu khí vì mục đích của Hợp đồng này, tuân thủ pháp luật Việt Nam và phù hợp với Chuẩn mực Kế toán Việt Nam (VAS) và chuẩn mực báo cáo tài chính quốc tế (IFRS).\n1.1.60. “Thỏa thuận mua bán khí” là thỏa thuận quy\nđịnh việc tiêu thụ Khí thiên nhiên được khai thác phù hợp với từng Kế hoạch phát triển mỏ dầu khí, như được quy định tại Điều 8.5.\n1.1.61. “Thoả thuận điều hành chung” là thoả thuận quy định việc quản lý các hoạt động của NHÀ THẦU và quy định các quyền và nghĩa vụ tương ứng với Quyền lợi tham gia của mỗi Bên Nhà thầu trong quá trình triển khai hoạt động dầu khí.\n1.1.62. “Thỏa thuận lấy dầu” là thỏa thuận quy định việc lấy và giao nhận Dầu thô được khai thác phù hợp với Kế hoạch phát triển mỏ\ndầu khí, như được quy định tại Điều 8.5.\n1.1.63. “Thông tin Mật” là các tài liệu, thông tin kỹ thuật, công nghệ và thương mại thuộc sở hữu của NHÀ THẦU có được sau Ngày hiệu lực, bao gồm nhưng không giới hạn ở tất cả các bằng sáng chế, sở hữu trí tuệ,\nbí quyết kỹ thuật, thiết kế, ý tưởng, Chương trình hoạt động và Ngân sách, báo cáo tài chính, hóa đơn, thông tin bán hàng và giá cả, các dữ liệu liên quan đến khả năng khai thác, tiếp thị và dịch vụ mà NHÀ THẦU chuẩn bị sau Ngày hiệu lực liên quan đến hoạt động dầu khí và các điều khoản và điều kiện của Hợp đồng này.\n1.1.64. “Thuế tài nguyên” là khoản thu bằng tiền mặt hoặc bằng sản phẩm, tùy theo sự lựa chọn của Chính phủ, được các Bên Nhà thầu nộp phù hợp với Điều 6.1.1 và Điều 6.2.1 để được quyền khai thác Dầu khí từ Diện tích hợp đồng.\n1.1.65. “Thùng” là một đơn vị đo Dầu thô bằng một trăm năm mươi tám phẩy chín tám bảy (158,987) lít ở áp suất khí quyển một trăm linh một phẩy ba hai năm (101,325) kilopascal và ở nhiệt độ mười lăm độ Celsius\n(15°C).\n1.1.66. “Ủy ban Quản lý” là Ủy ban được thành lập theo quy định tại Chương III.\nĐiều 1.2. Nguyên tắc cơ bản của hợp đồng 1.2.1. Hợp đồng này là Hợp đồng Chia sản phẩm dầu khí phù hợp với quy định của Luật Dầu khí\nvà pháp luật khác có liên quan tại Việt Nam.\n1.2.2. Hợp đồng này xác lập các nguyên tắc và điều kiện, theo đó NHÀ THẦU được trao độc quyền tiến hành hoạt động dầu khí nhằm tìm kiếm thăm dò, thẩm lượng, phát triển và khai thác dầu khí trong Diện tích hợp đồng và các hoạt động khác có liên quan bao gồm quyền xuất khẩu, bán hoặc định đoạt dầu khí theo quy định của Hợp đồng.\n1.2.3. NHÀ THẦU có nghĩa vụ tiến hành hoạt động dầu khí bằng chi phí của mình một cách an toàn và hiệu quả và tự chịu rủi ro, phù hợp với quy định của Hợp đồng này, luật pháp Việt Nam và Thông lệ công nghiệp dầu khí quốc tế.\n1.2.4. Chi phí hoạt động dầu khí do NHÀ THẦU gánh chịu và được thu hồi phù hợp với các quy định của Hợp đồng.\nĐiều 1.3. Quyền lợi tham gia Quyền lợi tham gia của các Bên Nhà thầu vào Ngày hiệu lực như sau:\n- [………………………………..]: [……]%\n- [………………………………. ]: [……]%\nChương II THỜI HẠN, CAM KẾT CÔNG VIỆC TỐI THIỂU VÀ HOÀN TRẢ DIỆN TÍCH HỢP ĐỒNG\nĐiều 2.1. Thời hạn 2.1.1. Thời hạn của Hợp đồng này là [...](...) Năm Hợp\nđồng kể từ Ngày hiệu lực và có thể được gia hạn không quá năm (5) năm nếu Các Bên thỏa thuận và được Bộ Công Thương phê duyệt Phụ thuộc vào các Điều 2.1.4 và\n2.1.5 dưới đây, Giai đoạn tìm kiếm thăm dò của Hợp đồng này là [...] (...) Năm Hợp đồng kể từ Ngày hiệu lực, có thể được gia hạn nhưng không quá [...](...)\nnăm, được chia thành các giai đoạn thành phần: [...] (...) Năm Hợp đồng cho giai đoạn thứ nhất (Giai đoạn Một), và [...] (...) Năm cho giai đoạn thứ hai\n(Giai đoạn Hai), và [...] (...) Năm cho giai đoạn thứ ba (Giai đoạn Ba). Quyết\nđịnh bước vào Giai đoạn Hai hoặc Giai đoạn Ba sẽ do NHÀ THẦU lựa chọn và thông báo bằng văn bản cho PETROVIETNAM không muộn hơn mười lăm (15) ngày trước khi hết hạn Giai đoạn Một hoặc Giai đoạn Hai tương ứng.\n2.1.2. Phụ thuộc vào các quy định tại các Điều 2.1.4, 2.1.5 và 2.3.4.1, Hợp đồng này được chấm dứt nếu vào thời điểm kết thúc Giai đoạn tìm kiếm thăm dò (bao gồm thời gian gia hạn, nếu có) mà không có Phát hiện thương mại nào trong Diện tích hợp đồng được tuyên bố.\n2.1.3. Ngay sau khi xác định Phát hiện thương mại trong bất kỳ phần nào của Diện tích hợp đồng, việc phát triển Phát hiện thương mại đó phải được bắt đầu phù hợp với quy định tại Chương IV. Trong các phần khác của Diện tích hợp đồng, ngoài một hoặc nhiều Diện tích phát triển, việc tìm kiếm thăm dò có thể đồng thời được tiếp tục thực hiện phụ thuộc vào quy định tại Điều 2.1.4, 2.1.5 và Điều 2.3.\n2.1.4. Chậm nhất chín mươi (90) ngày trước khi kết thúc bất kỳ giai đoạn nào trong Giai đoạn tìm kiếm thăm dò theo quy định tại Điều 2.1.1:\n2.1.4.1. Nếu NHÀ THẦU tìm thấy một Phát hiện dầu khí trong Diện tích hợp đồng mà thời hạn của bất kỳ giai đoạn liên quan nào không đủ để NHÀ THẦU thẩm lượng Phát hiện dầu khí đó thì thời hạn của giai đoạn này sẽ được gia hạn một cách hợp lý với sự chấp thuận của PETROVIETNAM và sự\nphê duyệt của cấp thẩm quyền để NHÀ THẦU thẩm lượng Phát hiện dầu khí đó.\n2.1.4.2. Nếu một hoặc nhiều Giếng thăm dò đã nằm trong kế hoạch hoặc đang trong quá trình khoan, thời hạn của bất kỳ giai đoạn liên quan nào cũng được gia hạn một cách hợp lý với sự chấp thuận của PETROVIETNAM và sự phê duyệt của Bộ Công Thương để NHÀ THẦU hoàn thành hoạt động khoan và đánh giá kết quả khoan.\nThời hạn gia hạn nói trên không vượt quá năm (05)\nnăm [hoặc mười (10) năm đối với lô dầu khí được hưởng chính sách ưu đãi đầu tư hoặc ưu đãi đầu tư đặc biệt].\n2.1.5. Phụ thuộc vào sự chấp thuận của PETROVIETNAM và sự phê duyệt của cơ quan có thẩm quyền đối với đề nghị của NHÀ THẦU về\nchương trình hoạt động bổ sung cho Hoạt động tìm kiếm thăm dò dầu khí trong Diện tích hợp đồng vào thời điểm Giai đoạn tìm kiếm thăm dò chấm dứt, Giai đoạn tìm kiếm thăm dò sẽ được gia hạn thêm một thời gian hợp lý để NHÀ THẦU tiến hành chương trình công việc bổ sung đó.\n2.1.6. Trường hợp Giai đoạn tìm kiếm thăm dò được gia hạn cho mục đích của các hoạt động thẩm lượng theo Điều 2.1.4 hoặc trong các tình huống được xác định tại Điều 2.1.5, thời gian gia hạn đó được tính vào thời gian gia hạn tối đa của Giai đoạn tìm kiếm thăm dò như quy định tại Điều 2.1.1 và thời hạn của Hợp đồng sẽ được gia hạn thêm một khoảng thời gian tương ứng với thời gian được gia hạn của Giai đoạn tìm kiếm thăm dò.\n2.1.7. Trong trường hợp Bất khả kháng, Các Bên có\nthể thỏa thuận phương thức tạm dừng việc thực hiện một số quyền và nghĩa vụ\ntrong Hợp đồng và phụ thuộc vào phê duyệt của cơ quan có thẩm quyền theo quy định của Luật Dầu khí. Thời gian tạm dừng thực hiện một số quyền và nghĩa vụ trong Hợp đồng do nguyên nhân Bất khả kháng được tính từ khi sự kiện Bất khả kháng được tuyên bố cho đến khi sự kiện Bất khả\nkháng chấm dứt.\nĐiều 2.2. Cam kết công việc và tài chính tối thiểu 2.2.1. NHÀ THẦU phải bắt đầu các hoạt động dầu khí\ntheo Hợp đồng này không chậm hơn ba mươi (30) ngày kể từ ngày PETROVIETNAM phê\nduyệt Chương trình hoạt động và Ngân sách.\n2.2.2. NHÀ THẦU phải tiến hành các cam kết công việc tối thiểu với cam kết tài chính tối thiểu như sau:\n[Theo các điều kiện kinh tế, kỹ thuật cơ bản đối với Hợp đồng đã được Thủ tướng Chính phủ phê duyệt]\nGiai đoạn Một:\nCông việc Cam kết công việc tối thiểu Cam kết tài chính tối thiểu (USD)\nTổng Giai đoạn Hai:\nCông việc Cam kết công việc tối thiểu Cam kết tài chính tối thiểu (USD)\nTổng Giai đoạn Ba:\nCông việc Cam kết công việc tối thiểu Cam kết tài chính tối thiểu (USD)\nTổng Trường hợp NHÀ THẦU thực hiện vượt quá cam kết công việc tối thiểu cho mỗi giai đoạn, công việc vượt quá đó sẽ được trừ vào công việc tối thiểu có tính chất tương tự cho giai đoạn kế tiếp nếu và khi NHÀ THẦU quyết\nđịnh chuyển sang giai đoạn kế tiếp.\n2.2.3. Các cam kết tài chính tối thiểu được quy định tại Điều 2.2.2 chỉ nhằm mục đích hướng dẫn cho việc thực hiện chương trình tìm kiếm thăm dò trong bất kỳ giai đoạn liên quan nào. Tuy nhiên, trường hợp NHÀ THẦU không hoàn thành cam kết công việc tối thiểu cho bất kỳ giai đoạn liên quan nào, NHÀ THẦU phải trả cho PETROVIETNAM một khoản tiền tương đương với giá trị\ncủa bất kỳ phần cam kết công việc tối thiểu nào chưa hoàn thành trong thời hạn chín mươi (90) ngày kể từ ngày kết thúc giai đoạn đó.\n2.2.4. Nếu NHÀ THẦU hoàn thành các cam kết công việc tối thiểu với chi phí ít hơn các cam kết tài chính tối thiểu được nêu trong Điều 2.2.2, NHÀ THẦU được xem là đã hoàn thành các nghĩa vụ tài chính của mình và\nkhông có nghĩa vụ phải trả cho PETROVIETNAM toàn bộ hoặc bất kỳ phần nào trong số tiền mà cam kết tài chính tối thiểu vượt quá các chi phí thực tế khi thực hiện các cam kết công việc tối thiểu đó.\n2.2.5. Để tránh hiểu nhầm, các chương trình công việc bổ sung trong thời gian gia hạn Giai đoạn tìm kiếm thăm dò được quy định tại Điều 2.1.5 hoặc trong thời gian được phép giữ lại một phần của Diện tích hợp đồng được quy định tại Điều 2.3.4.12 hoặc trong thời gian tạm dừng nghĩa vụ hoàn trả diện tích, sẽ được xem là cam kết công việc tối thiểu cho thời gian gia hạn, giữ lại hoặc tạm dừng nghĩa vụ hoàn trả diện tích. Trường hợp NHÀ THẦU không hoàn thành khối lượng công việc đã cam kết tương ứng với khoảng thời gian gia hạn, giữ lại hoặc tạm dừng nghĩa, vụ hoàn trả diện tích được phép, Điều 2.2.3 sẽ được áp dụng với những sửa đổi thích hợp.\n2.2.6. NHÀ THẦU được phép đề nghị chuyển đổi công việc cam kết đã xác định trong Hợp đồng nhằm mục đích nâng cao hiệu quả hoặc tạo\nđiều kiện thuận lợi hơn quá trình triển khai hoạt động dầu khí theo quy định của Hợp đồng. NHÀ THẦU có văn bản đề nghị chuyển đổi công việc cam kết trình PETROVIETNAM, trong đó nêu rõ công việc cam kết muốn chuyển đổi, lý do đề nghị\nchuyển đổi, cơ sở của việc chuyển đổi, kế hoạch thực hiện công việc cam kết sau chuyển đổi. PETROVIETNAM báo cáo Bộ Công Thương thẩm định, trình Thủ tướng Chính phủ chấp thuận. Công việc cam kết sau chuyển đổi và cam kết tài chính tối thiểu tương ứng được xem là cam kết công việc và cam kết tài chính tối thiểu của NHÀ THẦU trong Hợp đồng.\nĐiều 2.3. Hoàn trả diện tích 2.3.1. Trước hoặc vào lúc kết thúc Giai đoạn Một cộng với bất kỳ gia hạn nào của Giai đoạn này, nếu NHÀ THẦU lựa chọn bước vào Giai\nđoạn Hai, NHÀ THẦU phải hoàn trả không ít hơn hai mươi phần trăm (20%) Diện tích hợp đồng. Trước hoặc vào lúc kết thúc Giai đoạn Hai cộng với bất kỳ thời gian gia hạn nào của Giai đoạn này, nếu NHÀ THẦU lựa chọn bước vào Giai đoạn Ba\n(nếu áp dụng), NHÀ THẦU phải hoàn trả thêm không ít hơn hai mươi phần trăm\n(20%) của Diện tích hợp đồng.\nTrường hợp NHÀ THẦU lựa chọn không bước vào Giai đoạn Hai vào lúc trước khi kết thúc Giai đoạn Một hoặc lựa chọn không bước vào Giai\nđoạn Ba (nếu áp dụng) vào lúc trước khi kết thúc Giai đoạn Hai, NHÀ THẦU sẽ được giải thoát khỏi cam kết công việc được xác định một cách tương ứng đối với Giai\nđoạn tiếp theo.\n2.3.2. Bất kỳ phần nào của Diện tích hợp đồng được hoàn trả theo Điều 2.3.1 trên đây sẽ không bao phủ bất kỳ Diện tích phát triển,\nDiện tích phát hiện khí nào đã xác định.\n2.3.3. Vào bất kỳ thời điểm nào sớm hơn thời điểm\nđược quy định tại Điều 2.3.1, bằng một văn bản thông báo trước ba mươi (30)\nngày cho PETROVIETNAM, NHÀ THẦU có quyền hoàn trả một phần Diện tích hợp đồng phù hợp với Điều 2.3.5, phần diện tích hoàn trả đó sẽ được trừ vào phần của Diện tích hợp đồng mà NHÀ THẦU sau đó phải hoàn trả theo quy định của Điều 2.3.1 và\nĐiều 2.3.4. Việc hoàn trả trước thời hạn không giải thoát NHÀ THẦU khỏi bất kỳ\nnghĩa vụ còn nợ và/hoặc nghĩa vụ phát sinh nào từ hoạt động dầu khí đối với phần Diện tích hợp đồng hoàn trả liên quan.\n2.3.4.\n2.3.4.1. Không ảnh hưởng tới các quy định tại Điều 2.1.4 và Điều 2.1.5, không phụ thuộc vào quy định tại Điều 3.1, trước hoặc vào lúc kết thúc Giai đoạn tìm kiếm thăm dò cộng với bất kỳ gia hạn nào của Giai đoạn này, NHÀ THẦU sẽ hoàn trả tất cả các phần còn lại của Diện tích hợp đồng trừ\ncác diện tích được NHÀ THẦU lựa chọn sau đây:\n2.3.4.1.1. Tất cả các Diện tích phát triển và tất cả\ncác Diện tích phát hiện khi được xác định tại Điều 4.7; hoặc 2.3.4.1.2. Trường hợp NHÀ THẦU muốn nhận lại bất kỳ\nphần nào của Diện tích hợp đồng ngoài Diện tích phát triển hoặc Diện tích phát hiện khí mà phần diện tích đó đã hoàn trà trước đây hoặc NHÀ THẦU không thể giữ\nlại được theo Điều 2.3.4.1.1 và chưa được giao cho nhà thầu khác, NHÀ THẦU phải trình PETROVIETNAM một Chương trình hoạt động và Ngân sách bổ sung cho các hoạt\nđộng dầu khí, nêu rõ: phần diện tích mong muốn được nhận lại của Diện tích hợp\nđồng ban đầu hoặc phần diện tích muốn mở rộng thuộc phần diện tích đã hoàn trả\ntrước đó; các Hoạt động tìm kiếm thăm dò dầu khí bổ sung mà NHÀ THẦU dự kiến tiến hành đối với phần diện tích được nhận lại và Ngân sách do NHÀ THẦU dự kiến để\nhoàn tất các hoạt động đó. PETROVIETNAM sẽ trình cấp thẩm quyền xem xét việc cho phép NHÀ THẦU nhận lại phần diện tích mong muốn trong từng trường hợp cụ thể\ntheo trình tự, thủ tục mở rộng diện tích hợp đồng dầu khí quy định tại khoản 6\nĐiều 32 Luật Dầu khí cùng với Chương trình hoạt động và Ngân sách bổ sung cam kết.\n2.3.4.2. NHÀ THẦU phải tiến hành các Hoạt động tìm kiếm thăm dò dầu khí phù hợp với Chương trình hoạt động và Ngân sách bổ sung đã\nđược phê duyệt theo Điều 2.3.4.1.2, kể cả các sửa đổi (nếu có) được NHÀ THẦU và\nPETROVIETNAM thoả thuận.\n2.3.4.3. Trường hợp kết quả Hoạt động tìm kiếm thăm dò dầu khí theo Điều 2.3.4.2 cho thấy:\n2.3.4.3.1. Bất kỳ một Phát hiện thương mại mới nào\nđược xác định thì một Diện tích phát triển cho Phát hiện thương mại đó sẽ được xác lập một cách hợp lý vì mục đích của Hợp đồng này;\n2.3.4.3.2. Bất kỳ một Phát hiện thương mại hiện hữu nào trong Diện tích hợp đồng được xác định vượt ra ngoài Diện tích phát triển\nđã được xác lập ban đầu thì Diện tích phát triển ban đầu đó sẽ được điều chỉnh một cách hợp lý theo thoả thuận chung của Các Bên;\n2.3.4.3.3. Bất kỳ Phát hiện khí thiên nhiên mới nào\nđược xác định thì Diện tích phát triển của Phát hiện đó có thể được coi là Diện tích phát hiện khí phù hợp với Điều 4.7.\nNgay sau khi hoàn tất việc đánh giá kết quả các Chương trình hoạt động và xác định được Diện tích phát triển mới hoặc điều chỉnh bất kỳ Diện tích phát triển hiện hữu nào phát sinh từ đó hoặc xác định bất kỳ một Diện tích phát hiện khí mới nào, NHÀ THẦU phải hoàn trả tất cả các phần còn lại của Diện tích hợp đồng không thuộc (các) Diện tích phát triển mới hoặc đã được\nđiều chỉnh hoặc (các) Diện tích phát hiện khí mới.\n2.3.5. NHÀ THẦU phải thông báo trước cho PETROVIETNAM ngày hoàn trả (các) phần diện tích sẽ được hoàn trả. NHÀ THẦU và\nPETROVIETNAM phải thoả thuận về hình dạng và kích thước của từng phần riêng rẽ\ncủa Diện tích hợp đồng sẽ được hoàn trả. Trước bất kỳ lần hoàn trả nào hoặc trước khi chấm dứt Hợp đồng này, theo yêu cầu của PETROVIETNAM, NHÀ THẦU phải thu dọn tất cả các thiết bị hoặc công trình do NHÀ THẦU lắp đặt hoặc xây dựng nhưng không còn cần cho hoạt động dầu khí nữa ra khỏi phần diện tích sẽ được hoàn trả.\nChương III\nỦY BAN QUẢN LÝ\nĐiều 3.1. Thành lập Ủy ban Quản lý\nTrong thời hạn ba mươi (30) ngày kể từ Ngày hiệu lực,\nCác Bên sẽ thành lập một Ủy ban Quản lý theo Hợp đồng này. Ủy ban Quản lý có\ntrách nhiệm hỗ trợ PETROVIETNAM và NHÀ THẦU kiểm tra, giám sát các hoạt động dầu khí trong Diện tích hợp đồng phù hợp với Chương trình hoạt động và Ngân sách đã\nđược phê duyệt và Hợp đồng này.\nỦy ban Quản lý bao gồm [……….. ](...) thành viên,\n[………………. ] (...) thành viên do PETROVIETNAM chỉ định và [ ………….........]\n(...) thành viên do NHÀ THẦU chỉ định. Số lượng các thành viên của Ủy ban Quản lý có thể tăng hoặc giảm tùy từng thời điểm do Các Bên thoả thuận. NHÀ THẦU sẽ\nchỉ định một trong số các thành viên của mình làm Chủ tịch trong các buổi họp trước khi có tuyên bố Phát hiện thương mại đầu tiên và PETROVIETNAM sẽ chỉ định một trong số các thành viên của mình làm Chủ tịch trong các buổi họp của Ủy ban Quản lý sau đó. Mỗi thành viên có quyền bỏ một (1) phiếu. Các buổi họp của Ủy ban Quản lý phải cần tối thiểu là [...](...) thành viên, ít nhất mỗi Bên có\n[...] (...) thành viên tham dự. Trong trường hợp không thể tham gia cuộc họp Ủy ban Quản lý, mỗi thành viên có thể ủy quyền bằng văn bản cho thành viên khác hoặc người khác đại diện và bỏ phiếu thay.\nĐiều 3.2. Quyền và nghĩa vụ của Ủy ban Quản lý\nỦy ban Quản lý có các quyền và nghĩa vụ như sau:\n- Thông qua và xác nhận việc thực hiện Chương trình hoạt động và Ngân sách hằng năm, kể cả các sửa đổi, bổ sung (nếu có);\n- Phê duyệt quy trình mua sắm lựa chọn nhà cung cấp dịch vụ hàng hóa phục vụ hoạt động dầu khí;\n- Thông qua chương trình tìm kiếm thăm dò, kế hoạch thẩm lượng do NHÀ THẦU đề xuất;\n- Thông qua Báo cáo tài nguyên, trữ lượng dầu khí của Phát hiện dầu khí và các Báo cáo điều chỉnh do NHÀ THẦU lập;\n- Thông qua Kế hoạch đại cương phát triển mỏ dầu khí và các Kế hoạch điều chỉnh (nếu có) trong khoảng thời gian được quy định trong Hợp đồng;\n- Thông qua Kế hoạch khai thác sớm mỏ dầu khí và\ncác Kế hoạch điều chỉnh (nếu có) trong khoảng thời gian được quy định trong Hợp\nđồng;\n- Thông qua Kế hoạch phát triển mỏ dầu khí và các Kế\nhoạch điều chỉnh (nếu có) trong khoảng thời gian được quy định trong Hợp đồng;\n- Thông qua Kế hoạch Thu dọn công trình dầu khí và\ncác Kế hoạch điều chỉnh (nếu có) trong khoảng thời gian được quy định trong Hợp\nđồng;\n- Thông qua Lịch trình khai thác hằng năm và các điều chỉnh/sửa đổi trong khoảng thời gian được quy định trong Hợp đồng;\n- Thông qua đề xuất hoàn trả, tạm dừng nghĩa vụ\nhoàn trả, giữ lại, nhận lại, mở rộng Diện tích hợp đồng, hợp nhất mỏ dầu khí,\ncác đề xuất gia hạn thời gian của giai đoạn thành phần Giai đoạn tìm kiếm thăm dò, các cam kết công việc bổ sung hoặc hoán đổi trong thời gian gia hạn của Người\nđiều hành;\n- Thành lập các tiểu ủy ban (sub-commitee) cần thiết theo yêu cầu và phù hợp với quy định của Hợp đồng;\n- Ủy ban Quản lý sẽ giám sát và kiểm tra kế toán đối với các chi phí, khoản chi, chi tiêu và duy trì sổ sách đối với hoạt động dầu khí phù hợp với các điều khoản của Hợp đồng này và Thể thức kế toán;\n- Quyết định các vấn đề khác thuộc thẩm quyền của Ủy ban Quản lý theo Hợp đồng này.\nĐiều 33. Cơ chế hoạt động của Ủy ban Quản lý\n33.1. Ủy ban Quản lý sẽ họp ít nhất mỗi Năm một lần,\ntrừ khi có thoả thuận khác. Bất kỳ Bên nào cũng có thể triệu tập hợp Ủy ban quản lý bằng một văn bản thông báo gửi cho Chủ tịch nêu rõ mục đích của cuộc họp. Chủ\ntịch sau đó phải triệu tập hợp trong thời hạn ba mươi (30) ngày từ khi nhận được thông báo kể trên hoặc trong thời hạn ngắn hơn nhưng không ít hơn bảy (7) ngày theo yêu cầu của Bên đưa ra đề xuất triệu tập hợp, nếu khoảng thời gian ba mươi\n(30) ngày có thể gây phương hại đáng kể tới vấn đề cần thảo luận.\n3.3.2. Trường hợp Ủy ban Quản lý thoả thuận rằng, bất kỳ vấn đề nào có thể được quyết định mà không cần triệu tập hợp, các thành viên\nỦy ban Quản lý có thể bỏ phiếu của mình về vấn đề đó bằng bất kỳ cách nào được các thành viên Ủy ban Quản lý chấp nhận và gửi đến cho Người điều hành. Ngay sau khi nhận được tất cả phiếu, Người điều hành sẽ thông báo cho Các Bên về quyết\nđịnh đã đạt được. Quyết định đó sẽ ràng buộc Các Bên như được bỏ phiếu trong một cuộc họp. Người điều hành phải lưu hồ sơ của mỗi lần bỏ phiếu đó. Hết thời hạn\nđược yêu cầu, nếu bất kỳ thành viên Ủy ban Quản lý nào không có văn bản thông báo về quyết định của mình đối với vấn đề được đệ trình thì coi như vấn đề đã\nđược thành viên đó thông qua.\n3.3.3. Các đại diện của mỗi Bên tham dự buổi họp Ủy ban Quản lý có thể kèm theo các cố vấn với số lượng hợp lý. Các cố vấn này sẽ\nkhông có quyền bỏ phiếu tại cuộc họp. Các chi phí hợp lý cho mỗi thành viên và\ncố vấn tham dự các buổi họp Ủy ban Quản lý do NHÀ THẦU gánh chịu và được coi là\nChi phí hoạt động dầu khí được thu hồi.\n3.3.4. Các quyết định của Ủy ban Quản lý số dựa trên cơ sở bỏ phiếu nhất trí của thành viên có mặt và đại diện được ủy quyền ngoại trừ các vấn đề về tìm kiếm thăm dò và thẩm lượng trước tuyên bố Phát hiện thương mại đầu tiên thì sẽ được Ủy ban Quản lý quyết định trên cơ sở đa số phiếu hoặc như Các Bên có thể thỏa thuận khác.\nChương IV CHƯƠNG TRÌNH HOẠT\nĐỘNG VÀ NGÂN SÁCH\nĐiều 4.1. Chương trình tìm kiếm thăm dò dầu khí\n4.1.1. Trong thời hạn sáu (06) tháng kể từ Ngày hiệu lực, NHÀ THẦU lập Chương trình tìm kiếm thăm dò dầu khí làm định hướng cho Hoạt\nđộng tìm kiếm thăm dò dầu khí trong Diện tích hợp đồng theo từng giai đoạn thành phần, bao gồm nhưng không giới hạn các nội dung chính được quy định tại khoản 2 Điều 44 Luật Dầu khí.\n4.1.2. Trong thời hạn ba mươi (30) ngày kể từ ngày nhận được Chương trình tìm kiếm thăm dò dầu khí hoặc Chương trình tìm kiếm thăm dò cập nhật (tùy thuộc vào bất kỳ sửa đổi nào mà Ủy ban Quản lý có thể yêu cầu),\nỦy ban Quản lý sẽ xem xét, thông qua Chương trình tìm kiếm thăm dò dầu khí đó.\nNếu Ủy ban Quản lý không có văn bản thông qua Chương trình tìm kiếm thăm dò dầu khí trong thời hạn ba mươi (30) ngày nêu trên thì Chương trình tìm kiếm thăm dò\ndầu khí coi như đã được Ủy ban Quản lý thông qua.\n4.1.3. Trong thời hạn mười (10) ngày sau khi Ủy ban Quản lý thông qua, NHÀ THẦU phải trình Chương trình tìm kiếm thăm dò dầu khí\ncho PETROVIETNAM xem xét, phê duyệt.\n4.1.4. Trong trường hợp có sự thay đổi các nội dung chính của Chương trình tìm kiếm thăm dò dầu khí quy định tại 4.1.1, NHÀ THẦU thực hiện thủ tục xin phê duyệt điều chỉnh Chương trình tìm kiếm thăm dò dầu khí\ntương tự như thủ tục và quy trình phê duyệt Chương trình tìm kiếm thăm dò dầu khí được quy định tại Điều này.\n4.1.5. Trong quá trình phát triển mỏ dầu khí, khai thác dầu khí, NHÀ THẦU có thể đề xuất tiến hành hoạt động thăm dò dầu khí bổ\nsung và lập Chương trình tìm kiếm thăm dò dầu khí bổ sung với nội dung chính như quy định tại Điều 4.1.1 với những điều chỉnh thích hợp. NHÀ THẦU thực hiện thủ tục xin phê duyệt Chương trình tìm kiếm thăm dò dầu khí bổ sung tương tự\nnhư thủ tục và quy trình phê duyệt Chương trình tìm kiếm thăm dò dầu khí được quy định tại Điều này.\nĐiều 4.2. Thẩm lượng và Báo cáo tài nguyên, trữ\nlượng dầu khí\nNếu NHÀ THẦU xác định có một Phát hiện dầu khí, NHÀ\nTHẦU phải thông báo cho Ủy ban Quản lý và PETROVIETNAM ngay khi có thể.\nTrong thời hạn chín mươi (90) ngày sau khi có thông báo trên, NHÀ THẦU phải trình Ủy ban Quản lý kế hoạch thẩm lượng Phát hiện dầu khí liên quan, Ủy ban Quản lý xem xét và thông qua kế hoạch thẩm lượng do NHÀ\nTHẦU đề xuất trong thời hạn ba mươi (30) ngày kể từ ngày nhận. Trong thời hạn mười (10) ngày sau khi được Ủy ban Quản lý thông qua, NHÀ THẦU trình PETROVIETNAM kế hoạch thẩm lượng đó để có được phê duyệt cuối cùng.\nPETROVIETNAM xem xét và phê duyệt kế hoạch thẩm lượng do NHÀ THẦU trình trong thời hạn ba mươi (30) ngày kể từ khi nhận được.\nNHÀ THẦU phải thực hiện ngay kế hoạch thẩm lượng đã\nđược PETROVIETNAM phê duyệt Trong thời hạn chín mươi (90) ngày sau khi hoàn thành kế hoạch thẩm lượng nêu trên hoặc một khoảng thời gian khác được sự chấp thuận của PETROVIETNAM, NHÀ THẦU phải trình Ủy ban Quản lý và PETROVIETNAM Báo cáo tài nguyên, trữ lượng dầu khí của Phát hiện dầu khí đã thẩm lượng, đảm bảo các nội dung yêu cầu được quy định của pháp luật dầu khí.\nTrường hợp kết quả thẩm lượng, theo quan điểm riêng của NHÀ THẦU, cho thấy:\n4.2.1. Phát hiện dầu có tính thương mại, NHÀ THẦU gửi thông báo cho Ủy ban Quản lý và PETROVIETNAM về Phát hiện thương mại đó, đồng thời\nđưa ra đề xuất về việc xác định Diện tích phát triển cho Phát hiện thương mại\nđã được tuyên bố phù hợp với các quy định của Hợp đồng này và Thông lệ công nghiệp dầu khí quốc tế. Ngày gửi thông báo sẽ là Ngày tuyên bố Phát hiện thương mại.\n4.2.2. Phát hiện khí có tiềm năng thương mại, NHÀ\nTHẦU tuân thủ các quy định tại Điều 4.7 Hợp đồng này.\nỦy ban Quản lý xem xét và thông qua Báo cáo tài nguyên, trữ lượng dầu khí của Phát hiện thương mại do NHÀ THẦU trình trong thời hạn ba mươi (30) ngày kể từ ngày nhận được văn bản. Trong thời hạn mười (10)\nngày sau khi được Ủy ban Quản lý thông qua, NHÀ THẦU trình PETROVIETNAM Báo cáo tài nguyên, trữ lượng dầu khí đó để PETROVIETNAM xem xét, báo cáo Bộ Công Thương phê duyệt phù hợp các quy định pháp luật về quản lý tài nguyên, trữ lượng dầu khí hiện hành.\nĐiều 4.3. Kế hoạch đại cương phát triển mỏ dầu khí và Kế hoạch phát triển mỏ dầu khí\nTrong thời hạn chín (09) tháng kể từ ngày Báo cáo tài nguyên, trữ lượng dầu khí cho bất kỳ Phát hiện thương mại nào trong Diện tích hợp đồng được phê duyệt, NHÀ THẦU phải trình Ủy ban Quản lý Kế hoạch đại cương phát triển mỏ dầu khí chính thức và đầy đủ cho Phát hiện thương mại đó.\nTrong thời hạn ba mươi (30) ngày kể từ ngày nhận được Kế hoạch đại cương phát triển mỏ dầu khí, Ủy ban Quản lý sẽ xem xét (hoặc tùy thuộc vào bất kỳ sửa đổi nào mà Ủy ban Quản lý có thể yêu cầu), thông qua Kế hoạch\nđại cương phát triển mỏ dầu khí đó; Nếu Ủy ban Quản lý không có văn bản thông qua Kế hoạch đại cương phát triển mỏ dầu khí trong thời hạn ba mươi (30) ngày nói trên thì Kế hoạch đại cương phát triển mỏ dầu khí coi như đã được Ủy ban Quản lý thông qua.\nTrong thời hạn mười (10) ngày sau khi Ủy ban Quản lý thông qua, NHÀ THẦU phải trình Kế hoạch đại cương phát triển mỏ dầu khí cho PETROVIETNAM xem xét, chấp thuận và trình Bộ Công Thương phê duyệt, tùy thuộc vào bất kỳ sửa đổi nào mà PETROVIETNAM có thể yêu cầu. Trong thời hạn bốn mươi lăm (45) ngày kể từ ngày NHÀ THẦU trình hoặc trong thời hạn bốn mươi lăm (45)\nngày kể từ ngày nhận được kế hoạch sửa đổi theo các yêu cầu của PETROVIETNAM hoặc cơ quan có thẩm quyền (nếu có), tùy từng trường hợp, PETROVIETNAM trình Bộ Công Thương phê duyệt Kế hoạch đại cương phát triển mỏ dầu khí này.\nTrường hợp có sự thay đổi các nội dung chính của Kế\nhoạch đại cương phát triển mỏ dầu khí, NHÀ THẦU thực hiện thủ tục xin phê duyệt\nđiều chỉnh Kế hoạch đại cương phát triển mỏ dầu khí tương tự như thủ tục và quy trình được quy định tại Điều này và quy định tại khoản 5 Điều 46 Luật Dầu khí.\nTrong thời hạn mười tám (18) tháng kể từ ngày Kế hoạch\nđại cương phát triển mỏ dầu khí hoặc Kế hoạch đại cương phát triển mỏ dầu khí\nđiều chỉnh được phê duyệt, NHÀ THẦU phải trình Ủy ban Quản lý Kế hoạch phát triển mỏ dầu khí cho Phát hiện thương mại liên quan. Kế hoạch phát triển mỏ dầu khí được xây dựng trên cơ sở phương án được lựa chọn của Kế hoạch đại cương phát triển mỏ\ndầu khí hoặc Kế hoạch đại cương phát triển mỏ dầu khí điều chỉnh đã được phê\nduyệt nhằm mục tiêu phát triển và khai thác tối ưu, bao gồm nhưng không giới hạn các nội dung chính được quy định tại khoản 2 Điều 48 Luật Dầu khí và các thông tin khác do Ủy ban Quản lý có thể yêu cầu.\nTrong thời hạn ba mươi (30) ngày kể từ ngày NHÀ THẦU trình hoặc trong thời hạn ba mươi (30) ngày kể từ ngày nhận được Kế hoạch phát triển mỏ dầu khí với những điều chỉnh theo yêu cầu của Ủy ban Quản lý, tùy từng trường hợp, Ủy ban Quản lý sẽ xem xét, thông qua Kế hoạch phát triển mỏ dầu khí\nđó. Nếu NHÀ THẦU không nhận được trả lời của Ủy ban Quản lý trong thời hạn ba mươi (30) ngày nói trên thì Kế hoạch phát triển mỏ dầu khí coi như đã được Ủy ban Quản lý thông qua.\nTrong thời hạn mười (10) ngày kể từ khi được Ủy ban Quản lý thông qua, NHÀ THẦU phải trình Kế hoạch phát triển mỏ dầu khí cho PETROVIETNAM xem xét, chấp thuận. Trong thời hạn sáu (06) tháng kể từ khi NHÀ\nTHẦU trình PETROVIETNAM, tùy thuộc vào bất kỳ chỉnh sửa, bổ sung nào có thể được yêu cầu, NHÀ THẦU phải nỗ lực cùng với PETROVIETNAM hoàn thiện Kế hoạch phát triển mỏ dầu khí để trình Bộ Công Thương xem xét, phê duyệt.\nTrong trường hợp có sự thay đổi các nội dung chính của Kế hoạch phát triển mỏ dầu khí, NHÀ THẦU thực hiện thủ tục xin phê duyệt điều chỉnh Kế hoạch phát triển mỏ dầu khí tương tự như thủ tục và quy trình được quy\nđịnh tại Điều này và phù hợp với quy định tại khoản 5 và khoản 6 Điều 48 Luật Dầu khí.\nĐiều 4.4. Kế hoạch khai thác sớm mỏ dầu khí\nTrong trường hợp Nhà thầu mong muốn tiến hành khai thác sớm mỏ dầu khí, trên cơ sở Kế hoạch đại cương phát triển mỏ dầu khí đã được phê duyệt, NHÀ THẦU lập Kế hoạch khai thác sớm mỏ dầu khí trình PETROVIETNAM xem xét để trình Bộ Công Thương phê duyệt theo quy định tại Điều 47 của Luật Dầu khí với quy trình tương tự như đối với Kế hoạch phát triển mỏ dầu khí theo quy định của Hợp đồng này.\nĐiều 4.5. Các phát hiện tiếp theo\nĐối với các phát hiện tiếp theo, NHÀ THẦU phải tuân thủ các quy định tại các Điều 4.2, 4.3 và 4.4 với những sửa đổi phù hợp.\nĐiều 4.6. Chương trình hoạt động và Ngân sách hằng năm 4.6.1. Trong thời hạn sáu mươi (60) ngày kể từ Ngày hiệu lực trong năm đầu tiên và sau đó là ít nhất chín mươi (90) ngày trước khi bắt đầu mỗi Năm hoặc vào thời điểm khác mà Các Bên có thể thoả thuận, NHÀ THẦU phải chuẩn bị và trình Chương trình hoạt động và Ngân sách hằng năm cho Diện tích hợp đồng cho Năm kế tiếp theo phù hợp với quy định của Hợp đồng và các chương trình, báo cáo, kế hoạch đã được phê duyệt (nếu có), để PETROVIETNAM xem xét và phê duyệt.\n4.6.2. Trong thời hạn sáu mươi (60) ngày trước khi có dòng dầu khí khai thác đầu tiên hoặc chín mươi (90) ngày trước khi bắt đầu mỗi Năm kế tiếp, NHÀ THẦU phải trình Ủy ban Quản lý thông qua và PETROVIETNAM phê\nduyệt Lịch trình khai thác hằng năm trong Chương trình hoạt động và Ngân sách\n(trong các Năm kế tiếp) trên cơ sở kế hoạch khai thác đã được dự kiến trong Kế\nhoạch phát triển mỏ dầu khí hoặc Kế hoạch phát triển mỏ dầu khí điều chỉnh đã\nđược phê duyệt, các thông tin cập nhật có được trong quá trình triển khai Hoạt\nđộng phát triển mỏ dầu khí và Hoạt động khai thác dầu khí và phù hợp với Thông lệ công nghiệp dầu khí quốc tế.\n4.6.3. Chương trình hoạt động và Ngân sách quy định tại các điều 4.6.1 và 4.6.2 được Ủy ban Quản lý thông qua trong thời hạn ba mươi (30) ngày kể từ khi NHÀ THẦU trình. Trong thời hạn mười (10) ngày kể từ\nngày Ủy ban Quản lý thông qua, NHÀ THẦU phải trình PETROVIETNAM phê duyệt.\nPETROVIETNAM phải xem xét và phê duyệt trong thời hạn ba mươi (30) ngày kể từ\nngày nhận được các thông tin bổ sung, điều chỉnh như được yêu cầu. NHÀ THẦU sẽ\nthực hiện Chương trình hoạt động và Ngân sách đã được duyệt và không cần phải xin thêm bất cứ sự đồng ý hoặc phê duyệt nào nữa đối với khoản tăng chi phí so với mức Ngân sách đã được Ủy ban Quản lý và PETROVIETNAM phê duyệt cho Năm liên quan, không vượt quá 10% đối với bất cứ hạng mục nào trong Ngân sách liên quan với điều kiện là tổng các khoản chi tăng thêm không vượt quá 5% tổng Ngân sách\nđã được phê duyệt của năm tương ứng.\n4.6.4. Quy trình phê duyệt đối với Chương trình hoạt\nđộng và Ngân sách sửa đổi, bổ sung sẽ được áp dụng quy trình tương tự như quy định tại các Điều 4.6.1, 4.6.2 và 4.6.3 với những điều chỉnh phù hợp.\nĐiều 4.7. Phát hiện khí tiềm năng Trường hợp NHÀ THẦU xác định có một khối lượng Khí\nthiên nhiên [Khí sét, Khí than, Khí đá phiến] có tiềm năng thương mại trong Diện tích hợp đồng:\n4.7.1. Nếu đã có thị trường tiêu thụ và đã có các\nđiều kiện về đường ống, phương tiện xử lý thích hợp, NHÀ THẦU phải cam kết sớm\nđưa Phát hiện khí tiềm năng đó vào khai thác. Các Bên sẽ cố gắng tối đa để tìm kiếm thị trường khí. NHÀ THẦU phải tiến hành phát triển Phát hiện khí đó phù hợp với quy định của Điều 4.3 và Điều 4.4 để đáp ứng yêu cầu của các thỏa thuận thương mại có liên quan; hoặc 4.7.2. Nếu thị trường tiêu thụ khí và chưa có các\nđiều kiện về đường ống, phương tiện xử lý thích hợp, phù hợp với quy định tại khoản 5 Điều 31 Luật Dầu khí, NHÀ THẦU được phép giữ lại các Diện tích phát hiện khí có tiềm năng thương mại tương ứng tùy thuộc vào phê duyệt của cơ quan có thẩm quyền. Trong thời gian giữ lại Diện tích phát hiện khí có tiềm năng thương mại, NHÀ THẦU phải tiến hành các công việc cam kết trong thời gian tương ứng nhằm khẳng định tính thương mại của Phát hiện khí tiềm năng đó.\nĐiều 4.8. Hướng dẫn của PETROVIETNAM PETROVIETNAM, tùy từng thời điểm, có thể ban hành các thể thức và hướng dẫn cụ thể cho việc thực hiện các quy định của Chương này.\nChương V QUYỀN VÀ NGHĨA VỤ\nCỦA CÁC BÊN\nĐiều 5.1. Nhà thầu 5.1.1. Quyền của NHÀ THẦU 5.1.1.1. Được hưởng mọi ưu đãi, khuyến khích và bảo\nđảm đầu tư vì mục đích hoạt động dầu khí được quy định tại Hợp đồng này, Giấy chứng nhận đăng ký đầu tư, Luật Đầu tư, Luật Dầu khí và các văn bản quy phạm pháp luật có liên quan của Việt Nam.\n5.1.1.2. Sử dụng các mẫu vật, thông tin, dữ liệu thu được để tiến hành các hoạt động dầu khí.\n5.1.1.3. Tuyển dụng người lao động trên cơ sở ưu tiên tuyển dụng người lao động Việt Nam.\n5.1.1.4. Thuê tổ chức, cá nhân cung cấp dịch vụ dầu khí, hàng hóa phục vụ hoạt động dầu khí theo quy định của Luật Dầu khí và phù hợp với thông lệ công nghiệp dầu khí quốc tế.\n5.1.1.5. Miễn thuế nhập khẩu, thuế xuất khẩu để phục vụ hoạt động dầu khí theo quy định của Luật Thuế\nxuất khẩu, thuế nhập khẩu.\n5.1.1.6. Sở hữu phần sản phẩm dầu khí và các sản phẩm khác khai thác được theo hợp đồng dầu khí sau khi hoàn thành các nghĩa vụ tài chính theo quy định của pháp luật; được phép bán chung các sản phẩm này theo từng lần và từng thời điểm xuất bán mà không bị coi là vi phạm pháp luật về cạnh tranh.\n5.1.1.7. Xuất khẩu, bán tại thị trường Việt Nam phần sản phẩm thuộc sở hữu theo thỏa thuận trong hợp đồng dầu khí, trừ trường hợp nhà\nthầu phải thực hiện nghĩa vụ bán tại thị trường Việt Nam theo quy định tại khoản 8 Điều 59 của Luật Dầu khí. Nhà thầu không cần xin giấy phép xuất khẩu khi xuất khẩu phần sản phẩm thuộc sở hữu.\n5.1.1.8. Thu hồi chi phí hoạt động dầu khí theo thỏa thuận trong hợp đồng dầu khí.\n5.1.1.9. Tiếp cận, sử dụng đối với hệ thống giao thông, cơ sở hạ tầng, công trình dầu khí sẵn có theo quy định của pháp luật; tiếp cận, sử dụng các cơ sở hạ tầng, công trình dầu khí sẵn có để phục vụ cho việc thực hiện các hoạt động dầu khí thông qua hợp đồng hoặc thỏa thuận với đơn vị\nchủ sở hữu hoặc quản lý vận hành các cơ sở hạ tầng, công trình dầu khí trên cơ\nsở bảo đảm lợi ích của các bên phù hợp với quy định của pháp luật.\n5.1.1.10. Mua ngoại tệ tại ngân hàng thương mại để\nthực hiện góp vốn tham gia hợp đồng dầu khí và thực hiện nghĩa vụ nộp ngân sách nhà nước phù hợp với quy định của pháp luật về quản lý ngoại hối.\n5.1.1.11. Được sử dụng Đô la Mỹ để thực hiện nghĩa vụ tài chính theo quy định của Hợp đồng này bảo đảm phù hợp với quy định hiện hành về quản lý ngoại hối và pháp luật có liên quan.\n5.1.1.12. Quyền khác theo quy định của Luật Dầu khí.\n5.1.2. Nghĩa vụ của NHÀ THẦU 5.1.2.1. Tuân thủ pháp luật Việt Nam.\n5.1.2.2. Trước khi họp Ủy ban Quản lý lần đầu tiên,\nNHÀ THẦU phải trình chế độ kế toán, kiểm toán để Ủy ban Quản lý xem xét và\ntrình PETROVIETNAM phê duyệt.\n5.1.2.3. Tiến hành hoạt động dầu khí và các hoạt động liên quan, cung cấp tất cả các trợ giúp kỹ thuật và nhân lực, ứng trước mọi khoản chi phí và cam kết tài chính cần thiết để thực hiện hoạt động dầu khí và các hoạt\nđộng khác theo Chương trình hoạt động và Ngân sách đã được phê duyệt.\n5.1.2.4. Chuẩn bị, trình Ủy ban Quản lý và\nPETROVIETNAM các Chương trình hoạt động và Ngân sách hằng năm; nghiêm chỉnh thực thi các Chương trình hoạt động và Ngân sách phù hợp với Thông lệ công nghiệp dầu khí quốc tế sau khi các Chương trình hoạt động và Ngân sách đó đã được phê duyệt 5.1.2.5. Chịu trách nhiệm đối với việc đặt, mua hoặc thuê các dịch vụ, mua các loại vật tư, thiết bị và hàng hóa; ký kết các hợp đồng thương mại cần thiết cho việc thực hiện Hoạt động dầu khí theo Chương trình hoạt\nđộng và Ngân sách đã được phê duyệt tuân thủ quy định tại Điều 4.6 và các nguyên tắc sau đây:\n5.1.2.5.1. NHÀ THẦU phải xây dựng Quy chế lựa chọn nhà thầu cung cấp dịch vụ, mua sắm hàng hóa phục vụ hoạt động dầu khí trình Ủy ban Quản lý xem xét và PETROVIETNAM phê duyệt. Quy chế phải đảm bảo nguyên tắc chung cạnh tranh, công bằng, minh bạch, hiệu quả.\n5.1.2.5.2. Hằng năm, NHÀ THẦU phải lập kế hoạch đấu thầu tổng thể về việc mua và/hoặc thuê các dịch vụ, hàng hóa và trình PETROVIETNAM phê duyệt. Việc chia tách các gói thầu (nếu có) phải căn cứ theo tính chất kỹ thuật, bảo đảm tính đồng bộ và có quy mô gói thầu hợp lý.\n5.1.2.5.3. Đối với một hợp đồng mà NHÀ THẦU ước tính có giá trị dưới [……………………] Đô la Mỹ (……………………… USD) cho các Hoạt động tìm kiếm thăm dò dầu khí và thẩm lượng, và dưới [……………………. ] Đô la Mỹ (\n……………………….USD) cho các Hoạt động phát triển mỏ dầu khí, Hoạt động khai thác dầu khí và Hoạt động thu dọn công trình dầu khí [phụ thuộc vào đàm phán],\nNHÀ THẦU có quyền giao thầu hợp đồng đó, với điều kiện là các hoạt động liên quan phải thuộc Chương trình hoạt động và Ngân sách đã được phê duyệt.\n5.1.2.5.4. Đối với hợp đồng mà NHÀ THẦU ước tính có\ngiá trị bằng hoặc vượt quá giá trị được quy định tại Điều 5.1.2.5.3, NHÀ THẦU phải tổ chức đấu thầu hoặc NHÀ THẦU phải đưa ra được những lý do hợp lý chứng minh rằng việc đấu thầu sẽ bất lợi cho hoạt động thực tiễn hoặc vì lý do tiến độ\nhoặc sẽ ảnh hưởng đến lợi ích thương mại và được PETROVIETNAM chấp thuận.\nPETROVIETNAM xem xét, phê duyệt trong thời hạn mười (10) ngày làm việc kể từ\nngày nhận được đề nghị của NHÀ THẦU hoặc khoảng thời gian ngắn hơn theo yêu cầu công việc và không được từ chối vô lý. Trong trường hợp lựa chọn nhà cung cấp hàng hóa, dịch vụ thông qua đấu thầu, NHÀ THẦU phải:\n5.1.2.5.4.1. Trình PETROVIETNAM:\n5.1.2.5.4.1.1. Kế hoạch đấu thầu (bao gồm nhưng không giới hạn các nội dung như tên gói thầu, giá gói thầu, hạng mục và giá trị\nngân sách, hình thức lựa chọn nhà thầu, phương thức đấu thầu, thời gian lựa chọn nhà thầu, hình thức hợp đồng, thời gian thực hiện hợp đồng và danh sách mời thầu trong trường hợp đấu thầu hạn chế) để PETROVIETNAM phê duyệt. Trong trường hợp\nđấu thầu hạn chế, NHÀ THẦU tuân thủ yêu cầu của PETROVIETNAM về việc bổ sung hoặc loại bỏ một hoặc một số cá nhân và/hoặc tổ chức trong danh sách mời thầu với điều kiện PETROVIETNAM cung cấp lý do hợp lý về việc bổ sung hoặc loại bỏ đó.\n5.1.2.5.4.1.2. Hồ sơ mời thầu (bao gồm nhưng không giới hạn các nội dung về phạm vi công việc, yêu cầu kỹ thuật; tiêu chí đánh giá\nthầu) để PETROVIETNAM xem xét, có ý kiến về Hồ sơ mời thầu (nếu có) trước khi mời thầu.\n5.1.2.5.4.1.3. Báo cáo đánh giá và kiến nghị trao thầu cho cá nhân hoặc tổ chức được chọn (cùng với các hồ sơ chào thầu đã nhận)\nđể PETROVIETNAM xem xét, phê duyệt. NHÀ THẦU có trách nhiệm giải trình, làm rõ\ncác yêu cầu (nếu có) của PETROVIETNAM đối với các tài liệu do NHÀ THẦU trình.\n5.1.2.5.4.2. PETROVIETNAM phải thông báo cho NHÀ THẦU về phê duyệt của mình hoặc có ý kiến khác đối với kế hoạch đấu thầu tổng thể, kế\nhoạch đấu thầu, hồ sơ mời thầu của NHÀ THẦU, Báo cáo đánh giá và kiến nghị trao thầu trong thời hạn mười bốn (14) ngày kể từ ngày PETROVIETNAM nhận được hồ sơ\nhợp lệ và không được từ chối vô lý. Trong trường hợp NHÀ THẦU không nhận được ý\nkiến của PETROVIETNAM bằng văn bản trong khoảng thời gian mười bốn (14) ngày được nhắc tới trên đây, đề xuất của NHÀ THẦU coi như đã được PETROVIETNAM đồng ý.\n5.1.2.5.5. Ưu tiên sử dụng vật tư, thiết bị và dịch vụ Việt Nam trên cơ sở cạnh tranh về giá cả, chất lượng và thời hạn giao hàng;\nNHÀ THẦU phải cụ thể hóa những tiêu chí ưu tiên sử dụng dịch vụ Việt Nam trong hồ sơ mời thầu.\n5.1.2.5.6. Cung cấp cho PETROVIETNAM bản sao hợp đồng thương mại đã ký trên cơ sở tuân thủ các quy định tại Điều 5.1.2.4 trong thời hạn mười (10) ngày kể từ ngày ký hợp đồng liên quan.\n5.1.2.5.7. Quy trình lựa chọn nhà cung cấp trong trường hợp khác được áp dụng theo quy trình trên với những sửa đổi phù hợp.\n5.1.2.6. Trình cơ quan có thẩm quyền và\nPETROVIETNAM Báo cáo đánh giá tác động môi trường đối với các hoạt động dầu khí\nphù hợp với quy định của pháp luật Việt Nam.\nĐưa ra các giải pháp cần thiết về bảo vệ hàng hải,\nngư nghiệp và môi trường; ngăn chặn, kiểm soát thích đáng ô nhiễm đối với môi trường biển, sông ngòi, đất đai phù hợp với chương trình bảo hiểm và kế hoạch hành động về môi trường, an toàn và sức khỏe do Ủy ban Quản lý thông qua; thông báo cho PETROVIETNAM và các cơ quan hữu quan khác theo chỉ dẫn của PETROVIETNAM về các giải pháp đó. Trong trường hợp đã thực hiện các giải pháp cần thiết như\nđã được thông báo nhưng ô nhiễm môi trường vẫn xảy ra, NHÀ THẦU có nghĩa vụ phải\náp dụng mọi biện pháp hữu hiệu để giảm thiểu những tác động của ô nhiễm, khắc phục các hậu quả xảy ra và phải trả tiền bồi thường hợp lý đối với các hậu quả\nđó theo quy định của pháp luật Việt Nam, NHÀ THẦU có thể sử dụng các dịch vụ và\nnguồn lực của các trung tâm ứng phó sự cố tràn dầu địa phương, khu vực và quốc tế trong lĩnh vực này.\n5.1.2.7. Có quyền sở hữu đối với toàn bộ tài sản có\nđược và được sử dụng trong hoạt động dầu khí cho đến khi các tài sản đó trở\nthành sở hữu của PETROVIETNAM phù hợp với thể thức được quy định trong Điều 14.1; duy trì quyền kiểm soát toàn bộ các tài sản thuê đã đưa vào Việt Nam phù\nhợp với Điều 14.2 và được chuyển các tài sản thuê đó ra khỏi Việt Nam, được miễn các loại thuế phù hợp với các thủ tục và quy định của Việt Nam về xuất khẩu, nhập khẩu.\n5.1.2.8. NHÀ THẦU và nhà cung cấp hàng hóa dịch vụ\nphục vụ hoạt động dầu khí trong Hợp đồng có quyền nhập khẩu vào Việt Nam phù hợp với các quy định của pháp luật Việt Nam, mọi vật tư, thiết bị và các dịch vụ cần thiết cho hoạt động dầu khí và tái xuất toàn bộ hoặc bất kỳ phần nào chưa dùng hết, ngoại trừ các vật tư thiết bị đã được tính vào Chi phí hoạt động dầu khí\nphù hợp với pháp luật Việt Nam.\n5.1.2.9. Vào bất kỳ thời điểm nào, có quyền ra, vào Diện tích hợp đồng, tiếp cận các thiết bị, phương tiện được sử dụng cho hoạt động dầu khí ở bất kỳ vị trí nào trong Diện tích hợp đồng.\n5.1.2.10. Được tiếp cận và sử dụng tất cả các tài liệu và thông tin sẵn có về địa chất, địa vật lý, giếng khoan, khai thác, môi trường và các tài liệu, thông tin khác về Diện tích hợp đồng do PETROVIETNAM lưu giữ, trừ những thông tin, tài liệu thuộc phạm vi bí mật nhà nước phải được cơ quan có thẩm quyền chấp thuận.\n5.1.2.11. Tùy thuộc vào việc phê duyệt hợp lý của PETROVIETNAM, có thể tiếp cận và có quyền tham khảo các tài liệu và thông tin sẵn có về địa chất, địa vật lý, giếng khoan, khai thác, môi trường và các tài liệu,\nthông tin khác liên quan đến các khu vực liền kề với Diện tích hợp đồng mà\nPETROVIETNAM đang giữ hoặc sẽ có, với điều kiện các khu vực đó không phải là đối tượng của hợp đồng giữa PETROVIETNAM với các bên thứ ba. Đối với các tài liệu liên quan đến các khu vực liền kề mà PETROVIETNAM đã có hợp đồng với các bên thứ\nba, PETROVIETNAM sẽ nỗ lực tối đa để có được sự đồng ý của bên thứ ba đó cho phép tiết lộ các tài liệu và thông tin có liên quan trong phạm vi có thể.\n5.1.2.12. Nộp cho PETROVIETNAM các tài liệu, các báo cáo nghiên cứu về kết quả xử lý, thử vỉa và các phân tích tài liệu, mẫu vật gốc thuộc Diện tích hợp đồng, bao gồm nhưng không giới hạn, các tài liệu phân tích về địa chất, địa vật lý, địa hoá, khoan, Giếng, khai thác, thiết kế công nghệ mà NHÀ THẦU hoặc các nhà cung cấp của NHÀ THẦU đã thực hiện. Trong thời hạn bốn mươi lăm (45) ngày kể từ khi hoàn thành mỗi công việc xử lý, thử vỉa hoặc các phân tích nói trên, NHÀ THẦU phải chuyển giao cho PETROVIETNAM một bộ tài liệu gốc và ít nhất năm mươi phần trăm (50%) mẫu vật có được từ hoạt động đó\nphù hợp với Thông lệ công nghiệp dầu khí quốc tế và tối đa năm mươi phần trăm\n(50%) mẫu vật còn lại có thể được NHÀ THẦU thực hiện ở ngoài Việt Nam, nếu phù\nhợp và với điều kiện thêm rằng NHÀ THẦU có thể giữ lại các bản sao của các tài liệu gốc đó và tối đa năm mươi phần trăm (50%) mẫu vật cần thiết cho mục đích\nđiều hành và trong trường hợp đó PETROVIETNAM sẽ được tiếp cận vào bất kỳ lúc nào các tài liệu và mẫu vật mà NHÀ THẦU giữ lại. NHÀ THẦU sẽ cung cấp bản sao các tài liệu theo yêu cầu của PETROVIETNAM và chi phí cho việc sao chép đó sẽ\nđược coi là Chi phí hoạt động dầu khí được thu hồi. NHÀ THẦU sẽ chuyển trả cho PETROVIETNAM toàn bộ tài liệu và các mẫu vật ngay sau khi các tài liệu và mẫu vật\nđó không còn cần thiết cho hoạt động dầu khí hoặc sau khi phần Diện tích hợp đồng liên quan đến các tài liệu và mẫu vật đó đã được hoàn trả.\n5.1.2.13. Mở tài khoản, mua ngoại tệ, chuyển thu nhập hợp pháp ra nước ngoài và chuyển tiền góp vốn theo quy định tại Điều 58, Điều 59 Luật Dầu khí và quy định khác của pháp luật có liên quan.\n5.1.2.14. Khấu trừ và nộp thuế thu nhập của nhân viên, người lao động Việt Nam và nước ngoài do NHÀ THẦU tuyển dụng liên quan đến hoạt động dầu khí theo quy định của pháp luật Việt Nam.\n5.1.2.15. Cung cấp cho PETROVIETNAM các Báo cáo và\nthông tin sau đây:\n5.1.2.15.1. Báo cáo hàng ngày về các hoạt động địa chấn trong khi làm địa chấn.\n5.1.2.15.2. Báo cáo hằng ngày về địa chất, thử vỉa và khoan trong khi khoan.\n5.1.2.15.3. Báo cáo hằng tuần về tình hình triển khai các hoạt động phát triển.\n5.1.2.15.4. Báo cáo hằng tháng về hoạt động dầu khí\ntrong thời hạn bảy (7) Ngày làm việc sau khi kết thúc mỗi tháng.\n5.1.2.15.5. Báo cáo hằng năm, về hoạt động dầu khí\ntrong thời hạn ba mươi (30) Ngày làm việc sau khi kết thúc mỗi Năm.\n5.1.2.15.6. Báo cáo tổng kết: Trong thời hạn ba mươi (30) ngày làm việc sau khi kết thúc các hoạt động địa chấn, khoan, nghiên cứu địa chất, phân tích mẫu; trong thời hạn chín mươi (90) ngày làm việc sau khi kết thúc các Hoạt động phát triển mỏ dầu khí hoặc các hoạt động chính yếu khác.\n5.1.2.15.7. Các báo cáo và kê khai về tài chính theo quy định của Thể thức kế toán.\n5.1.2.15.8. Các Báo cáo về Chương trình tìm kiếm thăm dò dầu khí, Báo cáo tài nguyên, trữ lượng, Kế hoạch thẩm lượng, Kế hoạch phát triển mỏ và khai thác dầu khí.\n5.1.2.15.9. Báo cáo khác theo quy định của pháp luật về dầu khí hoặc theo yêu cầu của cơ quan quản lý có thẩm quyền khi được yêu cầu.\n5.1.2.16. Hướng dẫn cho nhân viên và các nhà cung cấp nước ngoài của mình tuân thủ các quy định của pháp luật Việt Nam và tập quán địa phương; thông báo cho các nhân viên và nhà cung cấp nói trên về các quy định liên quan của Hợp đồng này được áp dụng đối với họ.\n5.1.2.17. Có biện pháp tác động để các nhà cung cấp nước ngoài hoạt động tại Việt Nam nộp tất cả các loại thuế liên quan theo quy định của pháp luật Việt Nam. Các khoản thuế đó do NHÀ THẦU trả hoặc tính gộp vào chi phí trả cho nhà cung cấp theo các điều khoản hợp đồng được áp dụng, được tính là Chi phí hoạt động dầu khí vì mục đích thu hồi.\n5.1.2.18. Trong khi tiến hành hoạt động dầu khí nếu gặp phải bất kỳ vật chất khác biệt nào bao gồm nhưng không giới hạn ở các khoáng sản rắn có giá trị, NHÀ THẦU phải thông báo và nộp mẫu vật đó cho PETROVIETNAM.\n5.1.2.19. Tạo điều kiện bằng chi phí của mình tới\n[………… ] (…………. ) Đô la Mỹ cho mỗi Năm Hợp đồng cho các đại diện được chỉ định bởi PETROVIETNAM để giám sát các hoạt động dầu khí. Chi phí đó được coi là Chi phí\nhoạt động dầu khí được thu hồi.\n5.1.2.20. Tùy thuộc vào sự phê duyệt của các cơ\nquan có thẩm quyền của Việt Nam, có quyền xây dựng, lắp đặt, vận hành, bảo dưỡng các đường ống, cáp, các công trình dầu khí và phụ trợ cần thiết cho hoạt động dầu khí (bao gồm nhưng không giới hạn các trạm điện, các phương tiện liên lạc, giao thông, hàng hải và các phương tiện khác) ở trong và ngoài Diện tích hợp đồng và\nđược sử dụng miễn phí các công trình, thiết bị đó.\nĐối với các công trình đường giao thông, sân bay, bến cảng và các phương tiện giao thông và vận tải khác do NHÀ THẦU đầu tư xây dựng,\nNHÀ THẦU được quyền sử dụng và áp dụng các chính sách ưu đãi theo quy định của pháp luật hiện hành.\n5.1.2.21. Tùy thuộc vào sự phê duyệt của các cơ\nquan có thẩm quyền của Việt Nam, có quyền sử dụng các bến cảng, sân bay, đường thủy, đường bộ và các phương tiện khác tại Việt Nam với điều kiện phải thanh toán các loại phí theo quy định của pháp luật Việt Nam.\n5.1.2.22. Tùy thuộc vào sự phê duyệt của các cơ quan có thẩm quyền của Việt Nam, với sự hỗ trợ của PETROVIETNAM, có quyền tiếp cận và sử dụng các vùng biển và vùng đất không bị cấm tại Việt Nam vì mục đích hoạt\nđộng dầu khí.\n5.1.2.23. Có quyền chuyển khỏi Việt Nam các tài liệu,\nmẫu dầu khí, nước, chất lưu thành hệ và các mẫu đá, bao gồm nhưng không giới hạn\nở các mẫu vụn, mẫu lõi và mẫu sườn có được từ Diện tích hợp đồng và các diện tích hợp nhất có liên quan khác theo Điều 18.2 để kiểm tra, phân tích hoặc xử\nlý ở ngoài Việt Nam, theo mức độ cần thiết của hoạt động dầu khí, phù hợp với quy định của pháp luật Việt Nam.\n5.1.2.24. Trong bất kỳ trường hợp nào, khi có sự\nthay đổi về các thông tin liên quan đến mỗi Bên Nhà thầu (như được liệt kê tại Phụ lục C kèm theo Hợp đồng này) Nhà thầu cần phải thông báo cho PETROVIETNAM bằng văn bản trong thời hạn sáu mươi (60) ngày kể từ ngày sự thay đổi đó chính thức\nđược xác nhận và NHÀ THẦU phải hoàn tất các thủ tục pháp lý cần thiết để được cấp Giấy chứng nhận đăng ký đầu tư điều chỉnh cho Hợp đồng này (nếu cần thiết) phù\nhợp với quy định pháp lý hiện hành.\nĐiều 5.2. PETROVIETNAM 5.2.1. Quyền của PETROVIETNAM 5.2.1.1. Vào mọi thời điểm hợp lý và tự chịu rủi ro, có quyền tiếp cận Diện tích hợp đồng, kiểm tra, thanh tra hoạt động dầu khí, bao gồm cả việc kiểm tra các tài liệu, hồ sơ liên quan đến hoạt động dầu khí và các phương tiện sử dụng cho hoạt động dầu khí sau khi đã gửi thông báo trước bằng văn bản cho NHÀ THẦU về ngày yêu cầu tiếp cận, tên của các đại diện có thẩm quyền tiếp cận, với điều kiện là việc tiếp cận đó không làm ảnh hưởng đến việc thực hiện hoạt động dầu khí.\n5.2.1.2. Vào mọi thời điểm, có quyền sở hữu đối với tất cả các tài liệu và mẫu vật gốc, bao gồm nhưng không giới hạn ở các tài liệu và mẫu vật về địa chất, địa vật lý, địa hóa, khoan, giếng, khai thác, công nghệ\nvà các tài liệu, mẫu vật khác có được từ Diện tích hợp đồng hoặc do NHÀ THẦU thu thập được từ hoạt động dầu khí cũng như các tài liệu minh giải và các tài liệu phát sinh khác.\n5.2.1.3. Tùy thuộc vào các thoả thuận với NHÀ THẦU,\ncó quyền sử dụng các tài sản do NHÀ THẦU mua để phục vụ hoạt động dầu khí để phục vụ cho mục đích riêng của mình, với điều kiện việc sử dụng các tài sản đó không làm ảnh hưởng đến hoạt động dầu khí của NHÀ THẦU.\n5.2.1.4. Trong thời hạn Hợp đồng, có quyền sở hữu,\nquyền lấy, bán hoặc định đoạt bằng cách khác phần Dầu lãi và Khí lãi được chia cho nước chủ nhà, được Chính phủ ủy quyền lấy, bán hoặc định đoạt bằng cách khác đối với Dầu thuế tài nguyên và Khí thuế tài nguyên.\n5.2.1.5. Thực hiện các chấp nhận/phê duyệt cần thiết trong quá trình triển khai hoạt động dầu khí theo đề nghị của NHÀ THẦU và phù hợp với quy định tại Luật Dầu khí.\n5.2.1.6. Thực hiện kiểm toán Chi phí hoạt động dầu khí và quyết toán Chi phí hoạt động dầu khí phù hợp với quy định của Chương XI.\n5.2.1.7. Có thể ban hành, tùy từng thời điểm, các thể thức và hướng dẫn cụ thể cho việc thực hiện các quy định của Hợp đồng này phù hợp với quy định của Chương V.\n5.2.2. Nghĩa vụ của PETROVIETNAM PETROVIETNAM sẽ trợ giúp NHÀ THẦU liên hệ với các cơ quan có thẩm quyền của Việt Nam trong quá trình triển khai hoạt động dầu khí. Theo yêu cầu của NHÀ THẦU, với điều kiện NHÀ THẦU cung cấp đầy đủ các tài liệu cần thiết liên quan, PETROVIETNAM sẽ hỗ trợ cho NHÀ THẦU trong việc:\n5.2.2.1. Có được nơi đặt văn phòng, thuê nhà ở cá nhân,\nphương tiện vận chuyển, các phương tiện thông tin liên lạc cần thiết cho hoạt động dầu khí với giá cả hợp lý.\n5.2.2.2. Có được các phê duyệt và giấy phép cần thiết\nđể mở, duy trì và sử dụng các tài khoản ngân hàng tại Việt Nam và nước ngoài và\ncác thủ tục về ngoại hối.\n5.2.2.3. Tiến hành các thủ tục hải quan và xin giấy phép để gửi ra nước ngoài các tài liệu, số liệu, mẫu và mẫu vật để kiểm tra,\nphân tích hoặc xử lý.\n5.2.2.4. Có được các phương tiện, dịch vụ, vật tư,\nthiết bị và cung ứng trong nước (do Việt Nam sản xuất hoặc sẵn có ở Việt Nam) với chất lượng đảm bảo, giá cả cạnh tranh và thời gian cung cấp hợp lý; thị thực xuất nhập cảnh và các giấy phép làm việc; vận chuyển đi lại, bảo vệ an ninh; các dịch vụ hải quan và kiểm dịch; các dịch vụ y tế và quyền sử dụng đường giao thông cho các đại diện được ủy quyền, các giám đốc, các nhân viên cùng những người đi kèm của NHÀ THẦU và các nhà cung cấp; thiết lập các khu vực dành riêng trên biển bao quanh các phương tiện hoặc thiết bị lắp đặt để dùng cho hoạt động dầu khí;\ntuyển dụng người Việt Nam làm nhân viên cho NHÀ THẦU vì mục đích hoạt động dầu khí.\nCác lệ phí áp dụng cho việc sử dụng các phương tiện và dịch vụ để cung cấp vật tư, thiết bị, cung ứng nhân lực, thị thực cá nhân, giấy phép hoặc bảo vệ an ninh và các quyền khác theo yêu cầu của NHÀ THẦU theo Hợp đồng này do PETROVIETNAM hoặc bất kỳ cơ quan nào của Chính phủ Việt Nam thực cấp hoặc giao sẽ được tính cùng với những mức giá áp dụng cho các công ty nước ngoài khác tại Việt Nam phù hợp với các quy định hiện hành của Việt Nam.\n5.2.2.5. Trừ trường hợp quy định tại Chương XVII,\nthu xếp các thủ tục cần thiết để NHÀ THẦU có thể xuất khẩu phần dầu khí được hưởng theo Hợp đồng và giữ lại ở nước ngoài phần doanh thu có được từ đó.\n5.2.2.6. Các nghĩa vụ khác theo quy định của pháp luật về dầu khí.\nCác khoản chi do PETROVIETNAM ứng trước theo yêu cầu của NHÀ THẦU để thực hiện các hỗ trợ như quy định tại Điều 5.2.2 sẽ được NHÀ THẦU hoàn lại cho PETROVIETNAM trong thời hạn ba mươi (30) ngày kể từ ngày nhận được hồ sơ hợp lệ (hóa đơn và các tài liệu giải trình liên quan) và sẽ được coi là\nChi phí hoạt động dầu khí được thu hồi.\nChương VI PHÂN BỔ DẦU KHÍ\nĐiều 6.1. Phân bổ Dầu thô\nSản lượng dầu thực trong mỗi Quý, được Các Bên lấy theo Thoả thuận lấy dầu được xác lập phù hợp với quy định tại Điều 8.5, sẽ được chia và phân bổ như sau:\n6.1.1. Phân bổ Dầu thuế tài nguyên 6.1.1.1. Dầu thuế tài nguyên được phân bổ trên cơ sở\nlũy tiến từng phần của tổng Sản lượng dầu thực khai thác được trong mỗi kỳ nộp thuế tính theo Sản lượng dầu thực bình quân mỗi ngày khai thác thực của toàn bộ\nDiện tích hợp đồng theo biểu thuế sau:\n[Theo điều kiện kinh tế, kỹ thuật cơ bản đã được Thủ tướng Chính phủ phê duyệt ]\nSản lượng Dầu thực trung bình ngày theo Quý trong Diện tích hợp đồng (tính theo Thùng/ngày khai thác thực)\nDầu Thuế Tài nguyên \n (% Sản lượng dầu thực theo quy định của pháp luật)\n6.1.1.2. Tùy thuộc vào Điều 6.1.1.3., mỗi Bên Nhà\nthầu sẽ:\n6.1.1.2.1. Có quyền lấy theo Thỏa thuận lấy dầu, phần chia ước tính Dầu thuế tài nguyên tương ứng với tỷ lệ phần Quyền lợi tham gia của mình trong mỗi quý.\n6.1.1.2.2. Phù hợp với các quy định về thuế tài nguyên, hoàn trả Thuế tài nguyên tạm tính thu từ Dầu thô hằng tháng theo từng chuyến theo tỷ lệ được quy định tại Điều 6.1.1.1 đối với chuyến liên quan trên cơ sở giá của bên đó đã nhận hoặc đã quy trừ về giá tại Điểm giao nhận trong tháng liên quan do đã bán hoặc đã định đoạt bằng cách khác đối với Dầu Thô có\nđược theo Hợp đồng này.\n6.1.1.2.3. Phù hợp với các quy định về thuế tài nguyên, hoàn trả Thuế tài nguyên thực thu được từ Dầu thô trên cơ sở giá của bên đó đã nhận hoặc đã quy trừ về giá tại Điểm giao nhận trong Quý với kết toán thích hợp, theo từng chuyến đối với phân chia Dầu thuế tài nguyên tương ứng với tỷ lệ Quyền lợi tham gia của Bên đó đã nhận và bán hoặc được định đoạt bằng cách khác đối với Dầu thô có được theo Hợp đồng này.\n6.1.1.3. Ít nhất ba (03) tháng trước khi bắt đầu mỗi Năm, bằng cách gửi văn bản thông báo cho NHÀ THẦU, thông qua PETROVIETNAM,\nChính phủ có quyền lựa chọn lấy và nhận bằng sản phẩm tại Điểm giao nhận toàn bộ\nhoặc một phần Dầu thuế tài nguyên ước tính sẵn có để lấy trong Năm đó dựa trên cơ sở Lịch trình khai thác cho Năm đó đã được PETROVIETNAM phê duyệt. Dầu thuế\ntài nguyên đó sẽ được Chính phủ lấy trong mỗi Quý của Năm đó phù hợp với Thỏa thuận lấy dầu. Nếu Dầu thuế tài nguyên được giao cho Chính phủ bằng sản phẩm,\nNHÀ THẦU không có trách nhiệm nộp Thuế tài nguyên đối với Dầu thuế tài nguyên\nđó.\n6.1.1.4. Nếu Chính phủ thực hiện quyền lựa chọn của mình theo Điều 6.1.1.3, PETROVIETNAM với tư cách là đại diện cho Chính phủ, có\nthể yêu cầu và ký một thỏa thuận với NHÀ THẦU hoặc bất kỳ Bên Nước ngoài nào,\ntheo đó NHÀ THẦU hoặc Bên Nhà thầu đó sẽ (i) lấy và bán thay như là đại lý của PETRO VIETNAM hoặc (ii) mua như một khách hàng chính và lấy toàn bộ hoặc một phần Dầu thuế tài nguyên bằng sản phẩm thuộc quyền của Chính phủ theo mức giá sẽ thoả\nthuận và phù hợp với các điều khoản và điều kiện thông lệ đang thịnh hành áp dụng cho đại lý hoặc người mua.\n6.1.2. Phân bổ Dầu thu hồi chi phí\n6.1.2.1. Dầu thu hồi chi phí được phân bổ từ Sản lượng dầu thực để NHÀ THẦU thu hồi Chi phí hoạt động dầu khí (không tính lãi) trong mỗi Quý với điều kiện là khối lượng được phân bổ cho Dầu thu hồi chi phí không vượt quá [........] phần trăm (...%) Sản lượng dầu thực trong Quý đó. [Theo các\nđiều kiện kinh tế, kỹ thuật cơ bản đối với Hợp đồng đã được Thủ tướng Chính phủ\nphê duyệt].\n6.1.2.2. Phụ thuộc vào Điều 6.1.2.1 và Điều 6.1.2.4, mỗi Bên Nhà thầu có quyền lấy trong từng Quý phần chia Dầu thu hồi chi phí ước tính của mình phù hợp với Thỏa thuận lấy dầu và thu hồi không tính lãi phần chia của mình đối với Chi phí hoạt động dầu khí đã thanh toán hoặc được quy định khác một cách rõ ràng cho tới và bao gồm cả Quý đó từ việc bán hoặc định\nđoạt bằng cách khác đối với phần Dầu thu hồi chi phí đã thực lấy theo các điều khoản của Thỏa thuận lấy dầu trong Quý đó.\n6.1.2.3. Chi phí hoạt động dầu khí được thu hồi từ\nDầu thu hồi chi phí được áp dụng trên cơ sở chi trước - thu hồi trước. Chi phí\nhoạt động dầu khí chưa được thu hồi trong một Quý có thể được chuyển sang các Quý kế tiếp không tính lãi cho đến khi được thu hồi đủ hoặc cho đến khi kết thúc Hợp đồng, tùy thuộc thời điểm nào xảy ra trước.\n6.1.2.4. Sổ sách kế toán về các Chi phí hoạt động dầu khí được điều chỉnh lại mỗi Quý sau khi giá trị áp dụng của Giá thị trường thực nhận đã được xác định cuối cùng và các sửa đổi phù hợp đã được thực hiện cho Quý đó.\n6.1.3. Phân bổ Dầu lãi 6.1.3.1. Sau khi phân bổ Dầu thuế tài nguyên và Dầu thu hồi chi phí, phần còn lại của Sản lượng dầu thực được coi là Dầu lãi và sẽ\nđược chia giữa PETROVIETNAM và NHÀ THẦU như sau:\n[Theo các điều kiện kinh tế, kỹ thuật cơ bản đối với Hợp đồng đã được Thủ tướng Chính phủ phê duyệt]\nSản lượng dầu thực trung bình ngày theo Quý trong Diện tích hợp đồng (tính theo Thùng/ngày khai thác thực)\nDầu lãi (tỷ lệ\n phần trăm)\nPETROVIETNAM NHÀ THẦU 6.1.3.2. Mỗi Bên sẽ có quyền lấy phần chia Dầu lãi ước tính trong một Quý phù hợp với Thỏa thuận lấy dầu.\n6.1.4. Cách thức Phân bổ\nViệc phân bổ Sản lượng dầu thực thành Dầu thuế tài nguyên, Dầu thu hồi chi phí và Dầu lãi được thực hiện theo Quý và sẽ được tạm tính vào thời điểm lấy dầu, bằng cách dùng khối lượng ước tính Sản lượng dầu thực sẵn có để lấy cho Quý đó trên cơ sở Lịch trình khai thác cho Quý đó đã được phê\nduyệt và được điều chỉnh cuối cùng sau khi kết thúc Năm.\nĐiều 6.2. Phân bổ Khí thiên nhiên 6.2.1. Phân bổ Khí thuế tài nguyên 6.2.1.1. Khí thuế tài nguyên được phân bổ trên cơ sở\nlũy tiến từng phần của tổng Sản lượng khí thực khai thác trong mỗi kỳ nộp thuế\ntính theo Sản lượng khí thực bình quân mỗi ngày khai thác được của toàn bộ Diện tích hợp đồng theo biểu thuế sau:\n[Theo các điều kiện kinh tế, kỹ thuật cơ bản đối với Hợp đồng đã được Thủ tướng Chính phủ phê duyệt]\nSản lượng khí\n thực theo Quý trong Diện tích hợp đồng \n (tính theo Triệu m3/ngày khai thác thực)\nKhí thuế tài nguyên \n (% Sản lượng khí thực theo quy định của pháp luật)\n6.2.1.2. Các Bên thỏa thuận rằng các quy định của\nĐiều 6.1.1.2 và Điều 6.1.1.3 sẽ áp dụng cho Khí thiên nhiên với những sửa đổi phù hợp.\nĐể tránh hiểu nhầm, NHÀ THẦU được sử dụng Khí thiên nhiên, không phải nộp Thuế tài nguyên, để tiến hành hoạt động dầu khí phù hợp với Thông lệ công nghiệp dầu khí quốc tế, bao gồm nhưng không giới hạn ở:\n6.2.1.2.1. Sử dụng trong các phương tiện khai thác,\nxử lý và các công trình phụ trợ.\n6.2.1.2.2. Tạo điều kiện hoặc nâng cao sản lượng dầu thô.\n6.2.1.2.3. Duy trì áp suất bằng các công nghệ thu hồi thứ cấp hoặc tam cấp.\n6.2.1.2.4. Xử lý để chiết tách dầu thô.\n6.2.1.2.5. Bơm lại xuống vỉa; hoặc 6.2.1.2.6. Đốt bỏ trong trường hợp không có giải pháp kinh tế khác phụ thuộc vào sự phê duyệt của PETROVIETNAM đối với Khí đồng hành. Trong trường hợp khẩn cấp, NHÀ THẦU có thể đốt bỏ Khí đồng hành nhưng ngay sau đó phải báo cáo PETROVIETNAM về quyết định đốt bỏ đó.\n6.2.2. Phân bổ Khí thu hồi chi phí\n6.2.2.1. Khí thu hồi chi phí sẽ được phân bổ từ Sản lượng khí thực để NHÀ THẦU thu hồi chi phí hoạt động dầu khí (không tính lãi)\ntrong mỗi Quý với điều kiện là khối lượng được phân bổ cho Khí thu hồi chi phí\nkhông vượt quá [........] phần trăm (...%) Sản lượng khí thực trong Quý đó. [Theo các điều kiện kinh tế, kỹ thuật cơ bản đối với Hợp đồng đã được Thủ tướng Chính phủ phê duyệt].\n6.2.2.2. Các Bên thỏa thuận rằng các quy định của các Điều 6.1.2.2, 6.1.2.3 và 6.1.2.4, sẽ áp dụng cho Khí thiên nhiên với những sửa đổi phù hợp.\n6.2.3. Phân bổ Khí lãi 6.2.3.1. Sau khi phân bổ Khí thuế tài nguyên và Khí\nthu hồi chi phí, phần còn lại của Sản lượng khí thực sẽ được coi là Khí lãi và\nsẽ được chia giữa PETROVIETNAM và NHÀ THẦU như sau:\n[Theo các điều kiện kinh tế, kỹ thuật cơ bản đối với Hợp đồng đã được Thủ tướng Chính phủ phê duyệt]\nSản lượng khí\n thực trung bình ngày theo Quý trong Diện tích hợp đồng \n (tính theo Triệu m3/ngày khai thác thực)\nKhí lãi (tỷ lệ\n phần trăm)\nPETROVIETNAM NHÀ THẦU 6.2.3.2. Các Bên thỏa thuận rằng các quy định của\nĐiều 6.1.3.2 sẽ áp dụng cho Khí thiên nhiên với những sửa đổi phù hợp.\n6.2.4. Phân bổ\nViệc phân bổ Sản lượng khí thực thành Khí thuế tài nguyên và Khí thu hồi chi phí và Khí lãi sẽ được thực hiện theo Quý và sẽ được tạm tính vào thời điểm lấy khí, dựa trên khối lượng ước tính Sản lượng khí thực sẵn có để lấy và tiêu thụ cho Quý đó trên cơ sở Lịch trình khai thác cho Quý đó\nđã được phê duyệt và được điều chỉnh cuối cùng sau khi kết thúc Năm.\nChương VII THUẾ, PHÍ VÀ LỆ\nPHÍ\nĐiều 7.1. Nghĩa vụ thuế, phí và lệ phí\nCác Bên Nhà thầu là đối tượng chịu thuế theo Hợp đồng này và tuân thủ các quy định của pháp luật về thuế đối với các tổ chức, cá nhân tiến hành hoạt động dầu khí tại Việt Nam, có trách nhiệm hoàn thành các báo cáo kê khai thuế, nộp thuế, lưu giữ các sổ sách và báo cáo liên quan. Việc tạm tính, nộp thuế, đồng tiền nộp thuế và quyết toán thuế tuân theo quy định của pháp luật Việt Nam hiện hành.\nĐiều 7.2. Thuế tài nguyên Mỗi Bên Nhà thầu chịu trách nhiệm thanh toán đối với thuế tài nguyên của mình phù hợp với quy định tại các Điều 6.1.1 và Điều 6.2.1.\nĐiều 7.3. Thuế thu nhập doanh nghiệp Mỗi Bên Nhà thầu chịu trách nhiệm thanh toán đối với thuế thu nhập doanh nghiệp của mình với thuế suất [................] phần trăm\n(...%) thu nhập chịu thuế thực phù hợp với quy định của pháp luật thuế Việt Nam. [Theo các điều kiện kinh tế, kỹ thuật cơ bản đối với Hợp đồng đã được Thủ tướng Chính phủ phê duyệt]\nTrong đó, Mỗi Bên Nhà thầu chịu trách nhiệm thanh toán đối với thuế thu nhập doanh nghiệp của mình với thuế suất [............]\nphần trăm (...%) theo quy định tại Hợp đồng dầu khí này đối với chi phí được phép thu hồi mà Bên Nhà thầu được tiếp nhận từ nhà thầu khác nhưng không phải trả toàn bộ hoặc một phần chi phí hoạt động dầu khí tương ứng với quyền lợi tiếp nhận liên quan, nếu không có thỏa thuận khác.\nĐiều 7.4. Thuế xuất khẩu Mỗi Bên Nhà thầu nộp thuế xuất khẩu theo quy định của pháp luật đối với phần Dầu thô thực được lấy và xuất khẩu ra khỏi Việt Nam, ngoại trừ Dầu thô để trả Thuế tài nguyên, với thuế suất [...........] phần trăm\n(...%). [Theo các điều kiện kinh tế, kỹ thuật cơ bản đối với Hợp đồng đã được Thủ tướng Chính phủ phê duyệt]\nMỗi Bên Nhà thầu sẽ chịu thuế xuất khẩu theo quy định của pháp luật đối với phần Khí thiên nhiên thực được lấy và xuất khẩu ra khỏi Việt Nam, ngoại trừ Khí thiên nhiên để trả Thuế tài nguyên, với thuế suất\n(......) phần trăm (...%). [Theo các điều kiện kinh tế, kỹ thuật cơ bản đối với Hợp đồng đã được Thủ tướng Chính phủ phê duyệt]\nCác thuế trên sẽ không được thu hồi, nhưng được khấu trừ vì mục đích xác định thu nhập chịu thuế thu nhập doanh nghiệp theo quy định của pháp luật Việt Nam hiện hành và các điều ước quốc tế mà Việt Nam là thành viên.\nĐiều 7.5. Thuế thu nhập do chuyển nhượng Mỗi Bên Nhà thầu nộp thuế thu nhập đối với thu nhập phát sinh do chuyển nhượng theo quy định của Điều 12.2 và các loại phí có liên quan theo quy định của pháp luật Việt Nam hiện hành và các điều ước quốc tế mà\nViệt Nam là thành viên.\nĐiều 7.6. Thuế giá trị gia tăng Mỗi Bên Nhà thầu nộp thuế giá trị gia tăng (VAT)\ntheo quy định của Luật Thuế VAT của Việt Nam hiện hành và các điều ước quốc tế\nmà Việt Nam là thành viên.\nĐiều 7.7. Phí bảo vệ môi trường Mỗi Bên Nhà thầu sẽ trả khoản phí bảo vệ môi trường khi khai thác Dầu thô, Khí thiên nhiên theo quy định của pháp luật Việt Nam hiện hành và các điều ước quốc tế mà Việt Nam là thành viên. Khoản phí bảo vệ môi trường này được coi là chi phí hoạt động dầu khí được phép thu hồi.\nĐiều 7.8. Phụ thu đối với dầu lãi Mỗi Bên Nhà thầu có tránh nhiệm nộp phụ thu đối với phần dầu lãi được chia khi giá Dầu thô biến động tăng phù hợp với quy định của pháp luật Việt Nam có hiệu lực tại thời điểm phát sinh và các điều ước quốc tế\nmà Việt Nam là thành viên. Khoản phụ thu này không được thu hồi, nhưng được khấu trừ vì mục đích xác định thu nhập chịu thuế thu nhập doanh nghiệp theo quy định của pháp luật Việt Nam hiện hành và các điều ước quốc tế mà Việt Nam là thành viên.\nĐiều 7.9. Các loại thuế, phí và lệ phí khác Mỗi Bên Nhà thầu sẽ nộp các loại thuế khác, tiền thuê đất, phí và lệ phí khác phù hợp với quy định của pháp luật Việt Nam hiện hành và các điều ước quốc tế mà Việt Nam là thành viên. Mỗi Bên Nhà thầu không phải nộp tiền thuê mặt nước. Các khoản phải nộp theo Điều này nếu không được tính là chi phí thu hồi thì sẽ được khấu trừ vì mục đích xác định thu nhập chịu thuế thu nhập doanh nghiệp theo quy định của pháp luật Việt Nam hiện hành và\ncác điều ước quốc tế mà Việt Nam là thành viên.\nĐiều 7.10. Áp dụng các ưu đãi khi có thay đổi pháp luật Nếu pháp luật thuế Việt Nam quy định những mức thuế\nsuất hoặc có chế độ ưu đãi hơn cho công nghiệp dầu khí, NHÀ THẦU với sự hỗ trợ\ncủa PETROVIETNAM và phê duyệt của cơ quan có thẩm quyền được áp dụng những mức thuế suất hoặc chế độ ưu đãi đó.\nChương VIII\nĐỊNH GIÁ TRỊ, ĐO LƯỜNG VÀ XỬ LÝ DẦU KHÍ\nĐiều 8.1. Định giá trị Dầu thô\n8.1.1. Vì mục đích của Hợp đồng này, giá trị Dầu thô trong bất kỳ Quý nào sẽ là Giá thị trường. Tất cả các Bên Nhà thầu sẽ cố gắng tối đa để đạt được Giá thị trường cao nhất có thể. Giá thị trường sẽ được xác định bằng Đô la Mỹ và tính theo từng Quý như sau:\n8.1.1.1. Đối với tất cả các lần bán Dầu thô theo Giao dịch sòng phẳng, Giá thị trường sẽ là giá thực tế tính bằng Đô la Mỹ mà mỗi Bên nhận được trong Quý đó từ mỗi lần bán với hình thức giao nhận trên cơ sở Miễn vận phí đến tàu (FOB) hoặc Miễn vận phí đến đường ống (FIP) tại Điểm giao nhận hoặc nếu bán trên cơ sở khác thì được tính quy trừ theo giá FOB/FIP tương đương tại Điểm giao nhận.\n8.1.1.2. Đối với những lần bán Dầu thô theo Giao dịch không sòng phẳng hoặc có liên quan đến Dầu thô do một Bên Nhà thầu giữ lại thì\nBên Nhà thầu đó, trừ khi có thoả thuận khác, phải thoả thuận với PETROVIETNAM về\ncơ sở tính Giá thị trường FOB bằng Đô la Mỹ cho mỗi lần bán hoặc xuất khẩu Dầu thô trong Quý trước khi bắt đầu Quý liên quan. Các Bên quyết định Giá thị trường bằng Đô la Mỹ phù hợp với các nguyên tắc sau:\n8.1.1.2.1. Bằng cách tham khảo giá bình quân số học\nđược ghi trên Khoảng ngày vận đơn trong Ấn phẩm dầu cho giá bán FOB Dầu thô\ntương ứng được khai thác từ Diện tích hợp đồng với các điều chỉnh thích hợp hoặc nếu Các Bên liên quan không thoả thuận được Ấn phẩm dầu hoặc có thoả thuận nhưng Ấn phẩm dầu không đăng giá;\n8.1.1.2.2. Bằng cách tham khảo bình quân số học của giá bán FOB trên thị trường hiện hành được ghi trong Khoảng ngày vận đơn trong Quý đó cho một loại dầu đại diện hoặc một nhóm gồm hai (2) hoặc ba (3) loại dầu thô đại diện đăng trong Tạp chí Platt’s Crude Oil Marketwire mà dầu thô hoặc các loại dầu thô vào thời điểm tính đang được bán nhiều ở khu vực châu Á Thái Bình Dương và phải có cấp độ, tỷ trọng, chất lượng và khối lượng dễ so sánh nhất với dầu thô và được điều chỉnh theo những khác biệt về địa điểm, chất lượng,\nphương tiện cảng nạp xuất, những điều kiện tín dụng, công suất và các yếu tố\nthích hợp khác ảnh hưởng đến chi phí của người mua, sau khi các điều chỉnh thích hợp được tính vào chi phí và phí tổn theo Điều 8.1.1.1, nhưng đối với việc xác định như vậy về Giá thị trường thì không tính đến bất kỳ lần bán nào giữa chính phủ với chính phủ hoặc giữa công ty dầu quốc gia với công ty dầu quốc gia hoặc bán mang tính trao đổi hàng hóa. Bên Nhà thầu sẽ thông báo bằng văn bản cho PETROVIETNAM về việc định giá trị Dầu thô phù hợp với Điều 8.1.1.2.2.\n8.1.1.3. Vì mục đích xác định tạm thời Giá thị trường bình quân gia quyền bằng Đô la Mỹ phù hợp với Điều 8.1.3, Giá thị trường bình quân gia quyền sẽ được tính bằng cách xác định trung bình của các giá bán tương\nđương FOB đối với các chuyến lấy dầu từ Điểm giao nhận cho Quý ngay trước Quý\nđược đánh giá phù hợp với Điều 8.1.1.\n8.1.1.4. Trong trường hợp một Bên Nhà thầu đã bán hoặc định đoạt bằng cách khác về Dầu thô trong một Giao dịch không sòng phẳng cho một Công ty chi nhánh thì phải tính như Giá thị trường đối với Dầu thô đó\nsau Ngày vận đơn ba mươi (30) ngày.\n8.1.1.5. Vì mục đích của Điều 8.1.1:\n8.1.1.5.1. “Giao dịch sòng phẳng” là việc bán tại thị trường Việt Nam và trên thị trường quốc tế bằng đồng tiền tự do chuyển đổi giữa người bán và người mua tự nguyện và không có liên quan, nhưng không bao gồm việc bán bởi một Bên cho một Công ty chi nhánh của họ, bán giữa các chính phủ\nhoặc các tổ chức do chính phủ sở hữu hoặc giao dịch trao đổi hoặc đổi hàng và\ncác lần bán không theo giá thị trường tự do quốc tế.\n8.1.1.5.2. “Ngày vận đơn” là ngày ghi trên vận đơn\nđược phát hành cho một chuyến chở Dầu thô từ Điểm giao nhận.\n8.1.1.5.3. “Khoảng ngày vận đơn” là giai đoạn từ mười\n(10) ngày trước ngày vận đơn đến mười (10) ngày sau Ngày vận đơn.\n8.1.1.5.4. “FOB” có nghĩa như được xác định trong INCOTERMS 2020 và các sửa đổi nếu có.\n8.1.1.5.5. “Ấn phẩm dầu” là một ấn phẩm hoặc một dịch vụ hữu tuyến cáp trong ngành dầu khí được quốc tế chấp nhận rộng rãi và bao gồm các báo cáo về giá bán FOB hiện hành của thị trường được Các Bên liên quan thoả\nthuận và chấp nhận.\n8.1.2. Trường hợp sau hai (02) lần được PETROVIETNAM yêu cầu mà một Bên Nhà thầu vẫn bán với giá thấp một cách đáng kể\nphần Dầu Thô được phân bổ của mình theo Hợp đồng này (Bên bán thấp),\nPETROVIETNAM có quyền yêu cầu Bên bán thấp đó thảo luận về những sửa đổi thích hợp đối với Giá thị trường đang áp dụng cho thời kỳ được áp dụng (không quá sáu\n(6) tháng trước khi có yêu cầu đó), trong đó có xét đến giá FOB thực nhận của PETROVIETNAM đối với những lần PETROVIETNAM bán Dầu thô từ Diện tích hợp đồng trong thời kỳ đó, Giá thị trường bình quân gia quyền của Các Bên khác thực nhận cho thời kỳ đó và các điều kiện thị trường hiện hành vào thời điểm đó. Nếu PETROVIETNAM và Bên bán thấp không đạt được thoả thuận để có những sửa đổi thích\nđáng cho Giá thị trường đang áp dụng cho thời kỳ được áp dụng trong thời hạn bốn mươi lăm (45) ngày kể từ ngày PETROVIETNAM có văn bản thông báo cho Bên bán thấp thì vấn đề nêu trên sẽ được chuyển đến Chuyên gia theo quy định của Hợp đồng này để giải quyết. Chuyên gia sẽ xác định giá trị của Giá thị trường cho thời kỳ\nđang áp dụng theo các nguyên tắc được quy định trong Điều 8.1.1.\n8.1.3. Trong khi chờ xác định giá trị của Giá thị\ntrường đối với Dầu thô theo Điều 8.1.2 đối với một thời kỳ nào đó, Giá thị trường bình quân gia quyền tính bằng Đô la Mỹ cho thời kỳ liên quan do NHÀ THẦU và\nPETROVIETNAM nhận được (nhưng không bao gồm Bên bán thấp) sẽ được tạm thời áp dụng cho Bên bán thấp cho đến khi Giá thị trường áp dụng cho thời kỳ đó được xác định cuối cùng. Bất kỳ điều chỉnh nào đối với Giá thị trường tạm thời nói trên và\nthanh toán, nếu cần, sẽ được thực hiện trong thời hạn ba mươi (30) ngày kể từ\nkhi Giá thị trường áp dụng được xác định cuối cùng.\n8.1.4. Trường hợp PETROVIETNAM không chấp nhận Giá\nthị trường đối với Dầu thô của một Bên Nhà thầu theo Điều 8.1.1 và PETRO VIETNAM và Bên Nhà thầu đó không thể đạt được thỏa thuận về việc định giá đó\ntrong thời hạn bốn mươi lăm (45) ngày kể từ khi PETROVIETNAM nhận được văn bản thông báo về việc định giá của Bên Nhà thầu đó, vấn đề này sẽ được chuyển tới Chuyên gia theo Hợp đồng này để giải quyết. Chuyên gia sẽ đưa ra quyết định phù\nhợp với các nguyên tắc trong Điều 8.1.1.\n8.1.5. Từng Bên Nhà thầu phải thông báo kịp thời cho PETROVIETNAM bằng văn bản với các chi tiết đầy đủ, phù hợp với Thể thức kế\ntoán, toàn bộ những lần bán Dầu thô đã nhận được theo Thỏa thuận lấy dầu.\nĐiều 8.2. Định giá trị Khí thiên nhiên và Khí đồng hành 8.2.1. Giá đối với Khí thiên nhiên được xác định dựa trên giá thoả thuận giữa người bán và người mua (bao gồm nhưng không chỉ giới hạn giá Condensate tạo thành từ khí), phù hợp với các quy định của pháp luật Việt Nam, có tính đến thời điểm tính giá, thị trường, chất lượng, khối lượng khi và\ncác yếu tố liên quan khác.\n8.2.2. Khí đồng hành sẽ được định giá phù hợp với quy định của pháp luật và thông lệ ở Việt Nam.\nĐiều 8.3. Đo lường dầu khí\n8.3.1. Đối với tất cả các đo lường dầu khí cần cho mục đích của Hợp đồng này, NHÀ THẦU phải sử dụng các phương pháp và thiết bị\nphù hợp với Thông lệ công nghiệp dầu khí quốc tế. PETROVIETNAM có thể chỉ định một đại diện thường trực là người có quyền theo dõi các công việc đo lường, kiểm tra và thử bất kỳ thiết bị nào có thể được sử dụng vào việc đo lường, với chi phí và rủi ro do PETROVIETNAM tự chịu. Đại diện này phải tuân thủ tất cả các nội quy an toàn cần thiết và thông lệ về phòng cháy, các tai nạn khác và sẽ tiến hành các cuộc kiểm tra, đo thử vào những thời điểm theo các cách thức sao cho hoạt động đó ảnh hưởng tối thiểu đến các hoạt động dầu khí.\n8.3.2. Nếu sau khi kiểm tra hoặc đo thử mà phát hiện thấy có bất kỳ thiết bị nào bị hư hỏng, NHÀ THẦU sẽ phải tìm cách sửa chữa trong thời gian hợp lý và nếu khi kiểm tra hoặc đo thử thấy có sai lệch trong bất kỳ thiết bị nào thì sai lệch đó sẽ được coi là đã tồn tại trong một khoảng thời gian bảy (7) ngày trước khi phát hiện thấy sai lệch đó hoặc từ ngày kiểm tra hoặc thử thiết bị đó lần cuối, tùy từng thời gian nào ngắn hơn và tất cả các điều chỉnh từ đó sẽ được tính vào bất kỳ lần thanh toán hoặc giao nhận dầu khí nào bị ảnh hưởng bởi sai sót đó.\n8.3.3. Trong trường hợp bất kỳ thiết bị đo nào cần\nđược hiệu chỉnh, sửa chữa hoặc thay thế, NHÀ THẦU sẽ gửi trước thông báo bằng văn bản cho người có thẩm quyền đại diện cho PETROVIETNAM để chứng kiến việc hiệu chỉnh, sửa chữa hoặc thay thế nói trên.\nĐiều 8.4. Lịch trình khai thác 8.4.1. Lịch trình khai thác hằng năm do NHÀ THẦU trình Ủy ban Quản lý thông qua và PETROVIETNAM phê duyệt cuối cùng sẽ bao gồm nhưng không giới hạn: Lịch trình khai thác dự tính của NHÀ THẦU trong đó nêu rõ\nsản lượng dự kiến biểu thị bằng số Thùng mỗi ngày hoặc Mét khối mỗi ngày, sản lượng và cấp độ của mỗi loại dầu khí trong năm liên quan, phù hợp với hiệu suất khai thác tối đa của mỗi Phát hiện thương mại đã xác định trong Kế hoạch phát triển mỏ dầu khí và phù hợp với Thông lệ công nghiệp dầu khí quốc tế.\n8.4.2. NHÀ THẦU phải nỗ lực hợp lý để đảm bảo rằng sản lượng và cấp độ của mỗi loại dầu khí trong bất kỳ Năm nào cũng sẽ gần nhất với những khối lượng đã dự kiến cho giai đoạn đó trong Lịch trình khai thác đã\nđược phê duyệt theo quy định tại Điều 8.4.1.\n8.4.3. Sau khi bắt đầu lấy dầu thường kỳ, NHÀ THẦU phải chuẩn bị và cung cấp Kế hoạch khai thác hàng Quý cho PETROVIETNAM không chậm hơn bốn mươi lăm (45) ngày trước khi bắt đầu mỗi Quý, trong đó nêu rõ:\n8.4.3.1. Sản lượng dầu thực và Sản lượng khí thực trong Quý tiếp theo biểu thị bằng số Thùng mỗi ngày hoặc Mét khối mỗi ngày và cấp\nđộ của mỗi loại phù hợp với Chương trình hoạt động và Ngân sách và Lịch trình khai thác đã được phê duyệt.\n8.4.3.2. Ước tính về số lượng, loại và mức Sản lượng dầu thực và Sản lượng khí thực sẵn có để nhận và/hoặc tiêu thụ từ Diện tích hợp\nđồng, bao gồm cả Dầu thuế tài nguyên, Dầu thu hồi chi phí, Dầu lãi và Khí thuế\ntài nguyên, Khí thu hồi chi phí và Khí lãi.\nĐiều 8.5. Lấy dầu và tiêu thụ khí\n8.5.1. Nguyên tắc lấy dầu và tiêu thụ khí\n8.5.1.1. Tùy thuộc vào phương thức phân bổ quy định tại Chương VI, PETROVIETNAM, mỗi Bên Nhà thầu và Chính phủ (nếu Chính phủ quyết\nđịnh nhận và lấy Dầu thuế tài nguyên bằng sản phẩm) có quyền lấy tổng các phần Dầu thô cho mỗi chuyến mà mình nhận bao gồm:\n8.5.1.1.1. Dầu thuế tài nguyên (nếu áp dụng), Dầu thu hồi chi phí (nếu áp dụng) và phần Dầu lãi được chia đối với trường hợp của PETROVIETNAM và mỗi Bên Nhà thầu.\n8.5.1.1.2. Dầu thuế tài nguyên nếu lấy bằng sản phẩm\nđối với trường hợp của Chính phủ.\n8.5.1.2. Phần được hưởng của mỗi Bên trong khi tiêu thụ khí thiên nhiên được phân bổ phù hợp với Điều 6.2 sẽ được giao nhận phù hợp với Thỏa thuận mua bán khí.\n8.5.1.3. Phần Dầu thô mà Các Bên được phân bổ sẽ được\nđiều chỉnh vào cuối mỗi Quý bằng cách tăng phần được phân bổ của Bên lấy thiếu vào đầu Quý tiếp theo bằng khối lượng lấy thiếu của Bên đó ở cuối Quý trước và\ngiảm phần được phân bổ của Bên lấy thừa vào lúc bắt đầu Quý tiếp theo bằng khối lượng đã lấy thừa của Bên đó ở cuối Quý trước phù hợp với Thỏa thuận lấy dầu.\nVì mục đích của Điều 8.5.1.3, “Bên lấy thiếu” là\nBên trong Quý lấy ít hơn phần được hưởng của mình từ Diện tích hợp đồng và “Bên lấy thừa” là Bên trong Quý lấy nhiều hơn phần được hưởng của mình.\n8.5.1.4. Mỗi lần lấy Dầu thô được coi là xảy ra vào Ngày vận đơn theo định nghĩa trong Điều 8.1.1.5.2.\n8.5.2. Trong thời hạn hai mươi mốt (21) ngày sau mỗi Quý, Người điều hành phải gửi đến PETROVIETNAM và mỗi Bên Nhà thầu một báo cáo nêu rõ khối lượng, loại, cấp độ dầu thô hoặc khối lượng khí thiên nhiên được khai thác từ Diện tích hợp đồng, các phần được hưởng của mỗi Bên Nhà thầu và\nPETROVIETNAM, những lần nhận Dầu thô của Các Bên bằng cách tham chiếu Ngày vận\nđơn liên quan theo định nghĩa trong Điều 8.1.1.5.2 hoặc khối lượng Khí Thiên nhiên được khai thác mà mỗi Bên Nhà thầu và PETROVIETNAM được nhận từ Diện tích hợp đồng và kết quả phần Dầu thô mà PETROVIETNAM và mỗi Bên Nhà thầu lấy thiếu hoặc lấy thừa vào đầu và cuối Quý.\n8.5.3. Ủy ban Quản lý sẽ xem xét và thông qua Thỏa thuận lấy dầu và/hoặc Thoả thuận mua bán khí thiên nhiên hoặc khí than (nếu áp dụng), tùy từng trường hợp, nhưng trong bất kỳ trường hợp nào các thỏa thuận đó\ncũng phải được thông qua không muộn hơn chín mươi (90) ngày đối với Dầu thô hoặc một trăm tám mươi (180) ngày đối với khí thiên nhiên và khí than trước ngày bắt\nđầu đưa mỏ vào khai thác như đã được dự kiến trong Kế hoạch phát triển mỏ dầu khí đã được phê duyệt.\nThỏa thuận lấy dầu phải tránh làm gián đoạn việc khai thác dầu khí và sao cho mỗi chuyến tàu dầu rời khỏi cảng xuất với mức chuyên chở tối ưu theo tiêu chuẩn đối với Dầu thô do Người điều hành xác định một cách kịp thời để tránh cắt giảm sản lượng do các khó khăn trong việc tàng trữ dầu thô và giảm thiểu tiền phạt phải chịu do giao nhận chậm. Thỏa thuận lấy dầu phải quy định các vấn đề về lịch trình của tàu chở dầu, hoạt động của cảng xuất, khối lượng ấn định, các thủ tục và phương pháp chi tiết để cân đối bất kỳ tình trạng nhận thừa, nhận thiếu có thể xảy ra theo quy định của Điều 8.5 này.\n8.5.4. Nội dung cơ bản của Thỏa thuận lấy dầu hoặc Thỏa thuận mua bán khí thiên nhiên 8.5.4.1. Thoả thuận lấy dầu hoặc Thoả thuận mua bán khí thiên nhiên cũng phải quy định:\n8.5.4.1.1. Người điều hành phải là người điều phối việc lấy dầu và tiêu thụ khí.\n8.5.4.1.2. Người điều hành phải xác lập các tiêu chuẩn tối thiểu về an toàn trong vận hành và về môi trường cho việc lấy dầu hoặc tiêu thụ khí phù hợp với quy định của pháp luật Việt Nam và Thông lệ công nghiệp dầu khí quốc tế.\n8.5.4.1.3. PETROVIETNAM và mỗi Bên Nhà thầu và\nChính phủ (nếu Chính phủ quyết định nhận và lấy Dầu thuế tài nguyên bằng sản phẩm)\ncó quyền và nghĩa vụ tiếp nhận tại Điểm giao nhận và định đoạt cùng nhau hoặc riêng rẽ phần Dầu thô bằng sản phẩm của mình.\n8.5.4.1.4. Quyền sở hữu và rủi ro đối với dầu khí\nđược chuyển qua Bên được quyền nhận dầu khí đó tại Điểm giao nhận.\n8.5.4.1.5. Các chi phí liên quan đến việc bán Dầu thô, Khí thiên nhiên sẽ do các Bên Nhà thầu hoặc Các Bên gánh chịu, tùy từng trường hợp, không được coi là chi phí thu hồi theo quy định của Hợp đồng nhưng\nđược khấu trừ vì mục đích xác định thu nhập chịu thuế thu nhập doanh nghiệp theo quy định của pháp luật Việt Nam hiện hành và các điều ước quốc tế mà Việt Nam là thành viên.\n8.5.4.2. Khi cần thiết và theo yêu cầu của bất kỳ\nBên nào, Ủy ban Quản lý xem xét, sửa đổi và bổ sung các điều khoản trong Thoả\nthuận lấy dầu hoặc Thỏa thuận mua bán khí.\nChương IX HOA HỒNG VÀ CHI PHÍ TÀI LIỆU\nĐiều 9.1. Hoa hồng 9.1.1. NHÀ THẦU sẽ trả cho PETROVIETNAM một khoản tiền hoa hồng chữ ký là [......] Đô la Mỹ (.......USD) trong thời hạn ba mươi\n(30) ngày kể từ Ngày hiệu lực của Hợp đồng này. [Theo các điều kiện kinh tế,\nkỹ thuật cơ bản đối với Hợp đồng đã được Thủ tướng Chính phủ phê duyệt]\n9.1.2. NHÀ THẦU sẽ trả cho PETROVIETNAM một khoản tiền là [.........] Đô la Mỹ (......USD) trong thời hạn ba mươi (30) ngày kể từ\nngày NHÀ THẦU tuyên bố Phát hiện thương mại đầu tiên trong Diện tích hợp đồng.\n[Theo các điều kiện kinh tế, kỹ thuật cơ bản đối với Hợp đồng đã được Thủ tướng Chính phủ phê duyệt]\n9.1.3. NHÀ THẦU sẽ trả cho PETROVIETNAM một khoản tiền là [.........] Đô la Mỹ (.............USD) trong thời hạn ba mươi (30)\nngày kể từ ngày khai thác thương mại đầu tiên trong Diện tích hợp đồng. [Theo các điều kiện kinh tế, kỹ thuật cơ bản đối với Hợp đồng đã được Thủ tướng Chính phủ phê duyệt]\n9.1.4. NHÀ THẦU sẽ trả cho PETROVIETNAM một lần một khoản tiền hoa hồng theo thang sản lượng tăng lên (nếu áp dụng) trong thời hạn ba mươi (30) ngày sau khi sản lượng hằng ngày từ Diện tích hợp đồng lần đầu tiên đạt mức trung bình trên mức sản lượng tương ứng trong bảng dưới đây sau khoảng thời gian liên tục ba mươi (30) ngày đối với Dầu thô và Khí thiên nhiên tương ứng:\n[Theo các điều kiện kinh tế, kỹ thuật cơ bản đối với Hợp đồng đã được Thủ tướng Chính phủ phê duyệt] \n9.1.4.1. Đối với Dầu thô: \nSản lượng dầu thực trung bình ngày theo Quý trong Diện tích hợp đồng \n (tính theo Thùng/ngày khai thác thực)\nTiền hoa hồng 9.1.4.2. Đối với Khí thiên nhiên/Khí than Sản lượng khí\n thực trung bình ngày theo Quý trong Diện tích Hợp đồng \n (tính theo Triệu m3/ngày khai thác thực)\nTiền hoa hồng 9.1.5. Các khoản tiền hoa hồng trả cho PETROVIETNAM theo quy định tại Điều 9.1 không được tính là chi phí thu hồi và không được khấu trừ thuế vì mục đích xác định thu nhập chịu thuế thu nhập doanh nghiệp theo quy\nđịnh của pháp luật Việt Nam hiện hành.\nĐiều 9.2. Chi phí tài liệu Chi phí tài liệu (nếu áp dụng): NHÀ THẦU sẽ\ntrả cho PETROVIETNAM một khoản chi phí tài liệu là [..............] Đô la Mỹ\n(..............USD) để truy cập tất cả các tài liệu và thông tin liên quan đến Diện tích hợp đồng mà PETROVIETNAM lưu giữ và có quyền sử dụng các tài liệu và\nthông tin đó trong thời hạn của Hợp đồng này với điều kiện là quyền sở hữu các tài liệu đó sẽ luôn thuộc về PETROVIETNAM. [Theo các điều kiện kinh tế, kỹ\nthuật cơ bản đối với Hợp đồng đã được Thủ tướng Chính phủ phê duyệt]\nChi phí tài liệu trả cho PETROVIETNAM theo quy định tại Điều 9.2 không được tính là chi phí thu hồi và không được khấu trừ thuế vì\nmục đích xác định thu nhập chịu thuế thu nhập doanh nghiệp theo quy định của pháp luật Việt Nam hiện hành.\nChương X\nĐÀO TẠO, TUYỂN DỤNG VÀ DỊCH VỤ\nĐiều 10.1. Đào tạo 10.1.1. NHÀ THẦU cam kết trả cho PETROVIETNAM một khoản tiền là [...] Đô la Mỹ (........USD) cho mỗi Năm Hợp đồng trước khi có\nPhát hiện thương mại đầu tiên và một khoản tiền là [...] Đô la Mỹ (........USD)\ncho mỗi Năm Hợp đồng sau đó để đào tạo cán bộ quản lý và nhân viên PETROVIETNAM. [Theo các điều kiện kinh tế, kỹ thuật cơ bản đối với Hợp đồng\nđã được Thủ tướng Chính phủ phê duyệt]\n10.1.2. NHÀ THẦU thực hiện việc thanh toán chi phí\nđào tạo cho các cơ sở đào tạo do Các Bên thỏa thuận hoặc do PETROVIETNAM chỉ định.\nTheo đề nghị của PETROVIETNAM, NHÀ THẦU sẽ trả cho PETROVIETNAM hoặc chuyển sang Năm Hợp đồng kế tiếp bất kỳ phần còn lại nào của cam kết chi tiêu đào tạo hằng năm. Bất kỳ chi tiêu đào tạo nào trong một Năm Hợp đồng vượt quá số tiền\nđược quy định trong Điều 10.1.1 sẽ được chuyển sang và được trừ vào cam kết theo Điều 10.1.1 trong (các) Năm Hợp đồng tiếp theo.\n10.1.3. NHÀ THẦU cam kết trả PETROVIETNAM một khoản tiền tương ứng với [.......] phần trăm (.......%) Chi phí hoạt động dầu khí hằng năm kể từ thời điểm khai thác dòng dầu/khí đầu tiên hoặc một khoản tiền là\n[...] Đô la Mỹ (......USD) cho mỗi Năm Hợp đồng cho quỹ nghiên cứu khoa học và\nphát triển công nghệ dầu khí. [Theo các điều kiện kinh tế, kỹ thuật cơ bản đối với Hợp đồng đã được Thủ tướng Chính phủ phê duyệt]\n10.1.4. Các khoản tiền trả cho PETROVIETNAM theo quy định tại Điều 10.1.1 và Điều 10.1.3 không được tính là chi phí thu hồi và\nkhông được khấu trừ thuế vì mục đích xác định thu nhập chịu thuế thu nhập doanh nghiệp theo quy định của pháp luật Việt Nam hiện hành.\nĐiều 10.2. Tuyển dụng và Dịch vụ\n10.2.1. Trong Chương trình hoạt động và Ngân sách hằng năm, NHÀ THẦU phải xây dựng chương trình sử dụng nhân lực bao gồm nhưng không giới hạn việc tuyển dụng lao động địa phương, đào tạo nhân viên Việt Nam, lộ\ntrình và tỷ lệ thay thế lao động nước ngoài bằng lao động địa phương.\nNHÀ THẦU phải thực hiện chương trình sử dụng nhân lực theo kế hoạch đã được phê duyệt.\n10.2.2. NHÀ THẦU sẽ ưu tiên sử dụng các dịch vụ của các công ty Việt Nam trong khi tiến hành hoạt động dầu khí trên nguyên tắc các dịch vụ đó đảm bảo cạnh tranh về giá cả, chất lượng, tiến độ và khả năng sẵn có.\nChương XI KẾ TOÁN, KIỂM TOÁN VÀ QUYẾT TOÁN\nĐiều 11.1. Kế toán 11.1.1. NHÀ THẦU, thông qua Người điều hành, phải tuân thủ Chuẩn mực Kế toán Việt Nam, quy định của pháp luật Việt Nam về kế\ntoán.\n11.1.2. NHÀ THẦU, thông qua Người điều hành, phải ghi nhận toàn bộ Chi phí hoạt động dầu khí, sản lượng Dầu thô và/hoặc Khí thiên nhiên mà Các Bên nhận được và doanh thu của từng Bên tương ứng theo Chuẩn mực Kế\ntoán Việt Nam, quy định của pháp luật Việt Nam về kế toán và phù hợp với Thông lệ công nghiệp dầu khí quốc tế.\nĐiều 11.2. Kiểm toán 11.2.1. Ủy ban quản lý sẽ lựa chọn một doanh nghiệp kiểm toán độc lập hoạt động hợp pháp tại Việt Nam có đủ năng lực để tiến hành kiểm toán báo cáo tài chính hằng năm của NHÀ THẦU phù hợp quy định của pháp luật Việt Nam và Thông lệ công nghiệp dầu khí quốc tế. Các chi phí liên quan đến kiểm toán độc lập do NHÀ THẦU gánh chịu và được tính là Chi phí hoạt động dầu khí vì\nmục đích thu hồi.\n11.2.2.\n11.2.2.1. PETROVIETNAM có quyền vào bất cứ lúc nào,\nbằng chi phí và rủi ro của mình, thông báo bằng văn bản cho NHÀ THẦU trước ít nhất ba mươi (30) ngày, tiếp cận và kiểm toán các sổ sách, ghi chép, tài liệu và chứng từ gốc của NHÀ THẦU bởi các kiểm toán viên nội bộ của họ hoặc các kiểm toán viên của bên thứ ba; với điều kiện là việc kiểm toán đó không nhiều hơn một\n(01) lần một (01) Năm. Việc kiểm toán đó phải được hoàn tất trong thời hạn mười hai (12) tháng sau khi gửi thông báo được nhắc tới trên đây.\n11.2.2.2. Bất kỳ khoản chi phí nào trên Báo cáo tài chính không được kiểm toán của PETROVIETNAM chấp nhận tại thời điểm kiểm toán sẽ\nđược đưa ra bằng văn bản (Kết luận kiểm toán) trong thời hạn sáu mươi (60) ngày sau khi kết thúc kiểm toán và nêu rõ các lý do cụ thể.\nNếu Kết luận kiểm toán không được đưa ra trong thời hạn sáu mươi (60) ngày sau khi kết thúc kiểm toán, các sổ kế toán, báo cáo tài chính của NHÀ THẦU sẽ được coi là chính xác vì tất cả các mục đích.\n11.2.2.3. Nếu NHÀ THẦU không đưa ra phản đối về các nội dung trong Kết luận kiểm toán trong thời hạn sáu mươi (60) ngày kể từ ngày nhận được Kết luận kiểm toán thì kết quả kiểm toán của PETROVIETNAM là cuối cùng và ràng buộc Các Bên. Nếu Nhà thầu đưa ra phản đối trong thời hạn sáu mươi\n(60) ngày kể từ ngày nhận được Kết luận kiểm toán, thì PETROVIETNAM và NHÀ THẦU sẽ cố gắng giải quyết thông qua hòa giải để đạt được thoả thuận chung. Trong thời hạn một trăm tám mươi (180) ngày kể từ ngày nhận được văn bản phản đối nêu trên mà Các Bên không đạt được thỏa thuận chung thì vấn đề tranh chấp sẽ được giải quyết bằng trọng tài theo Điều 15.1.\n11.2.2.4. Để tránh hiểu nhầm, bất kỳ chi phí nào do PETROVIETNAM loại hoặc treo trong Kết luận kiểm toán sẽ không được thu hồi cho\nđến khi tranh chấp được giải quyết xong theo Điều 11.2.2.3.\nĐiều 11.3. Quyết toán Chi phí hoạt động dầu khí\n11.3.1. Việc thực hiện quyết toán Chi phí hoạt động dầu khí phải bảo đảm nguyên tắc chi phí quyết toán phản ánh trung thực, đầy đủ,\nhợp lý, hợp lệ theo quy định của pháp luật Việt Nam.\n11.3.2. NHÀ THẦU tiến hành quyết toán Chi phí hoạt\nđộng dầu khí sau khi hoàn thành công việc và tùng giai đoạn của Hợp đồng hoặc từng giai đoạn thành phần phù hợp với quy định tại Hợp đồng hoặc Kế hoạch phát triển mỏ được phê duyệt khi hoàn thành hoặc khi kết thúc Hợp đồng, phù hợp với quy định của pháp luật dầu khí.\n11.3.3. Căn cứ vào các kết quả kiểm toán tài chính hàng năm và/hoặc kiểm toán kết thúc từng giai đoạn liên quan của Hợp đồng hoặc từng giai đoạn thành phần phù hợp với quy định tại Hợp đồng hoặc khi kết thúc Hợp\nđồng; Chương trình hoạt động và Ngân sách liên quan đã được phê duyệt; và/hoặc Kế hoạch phát triển mỏ dầu khí và các điều chỉnh (nếu có), PETROVIETNAM phê duyệt báo cáo quyết toán do NHÀ THẦU lập và trình phù hợp với quy định tại Hợp đồng và pháp luật dầu khí của Việt Nam.\nChương XII THAM GIA CỦA PETROVIETNAM VÀ CHUYỂN NHƯỢNG\nĐiều 12.1. Tham gia của PETROVIETNAM 12.1.1. Trong thời hạn chín mươi (90) ngày kể từ\nkhi NHÀ THẦU tuyên bố Phát hiện thương mại đầu tiên, PETROVIETNAM có quyền lựa chọn tham gia tới [...........] phần trăm (...%) Quyền lợi tham gia trong toàn bộ quyền và nghĩa vụ của NHÀ THẦU theo Hợp đồng này (sau đây gọi tắt là Quyền lợi tham gia của PETROVIETNAM). Quyền lựa chọn đó sẽ bị hủy bỏ nếu PETROVIETNAM không có văn bản thông báo ý định tham gia của mình cho NHÀ THẦU trong thời hạn một trăm tám mươi (180) ngày kể từ ngày NHÀ THẦU tuyên bố Phát hiện thương mại\nđầu tiên (sau đây gọi tắt là Ngày bắt đầu), nếu không có thỏa thuận khác. Tùy thuộc vào quyết định của PETROVIETNAM, Quyền lợi tham gia của PETROVIETNAM có\nthể được quản lý và thực hiện trực tiếp bởi PETROVIETNAM hoặc thông qua một Công ty chi nhánh của mình.\nTrường hợp PETROVIETNAM thực hiện quyền lựa chọn của mình, PETROVIETNAM hoặc Công ty chi nhánh của PETROVIETNAM, tùy từng trường hợp,\nCác Bên sẽ thực hiện các thủ tục cần thiết đề sửa đổi Giấy chứng nhận đăng ký đầu tư và các Bên Nhà thầu sẽ xem xét, sửa đổi (một cách phù hợp) và thông qua một Thỏa thuận điều hành chung hoặc Thỏa thuận sửa đổi đối với Thỏa thuận điều hành chung, tùy từng trường hợp.\n12.1.2. Toàn bộ chi phí ứng với phần tham gia của PETROVIETNAM hoặc Công ty chi nhánh của PETROVIETNAM do NHÀ THẦU gánh chịu trong quá trình thực hiện Hợp đồng này từ Ngày hiệu lực tới Ngày bắt đầu, sẽ do NHÀ THẦU gánh chịu. Nếu PETROVIETNAM thông báo ý định tham gia theo quy định tại\nĐiều 12.1.1, NHÀ THẦU sẽ được hoàn trả toàn bộ phần chi phí ứng trước đó phù hợp với các quy định sau:\n12.1.2.1. Đối với chi phí tương ứng với phần tham gia của PETROVIETNAM hoặc Công ty chi nhánh của PETROVIETNAM trong toàn bộ chi phí do NHÀ THẦU gánh chịu theo Hợp đồng này (trừ hoa hồng và chi phí tài liệu theo Chương IX, chi phí đào tạo theo Chương X) từ Ngày hiệu lực tới Ngày bắt đầu,\nNHÀ THẦU sẽ được quyền lấy [.................phần trăm (....%) phần chia của PETROVIETNAM hoặc Công ty chi nhánh của PETROVIETNAM trong Dầu thu hồi chi phí\nvà/hoặc Khí thu hồi chi phí thuộc quyền của NHÀ THẦU cho tới khi NHÀ THẦU thu hồi\nđủ không tính lãi đối với phần góp đó;\n12.1.2.2. Đối với chi phí tương ứng với phần tham gia của PETROVIETNAM hoặc Công ty chi nhánh của PETROVIETNAM trong toàn bộ chi phí do NHÀ THẦU gánh chịu theo Hợp đồng này (ngoại trừ hoa hồng và chi phí tài liệu theo Chương IX, chi phí đào tạo theo Chương X) từ Ngày bắt đầu cho tới và\nbao gồm cả ngày PETROVIETNAM thông báo ý định tham gia, PETROVIETNAM hoặc Công ty chi nhánh của PETROVIETNAM, tùy từng trường hợp, sẽ trả một lần cho Người điều hành toàn bộ khoản tiền nói trên trong thời hạn ba mươi (30) ngày kể từ ngày Người điều hành thay mặt cho NHÀ THẦU gửi yêu cầu nộp tiền;\n12.1.2.3. Đối với chi phí tương ứng với phần tham gia của PETROVIETNAM hoặc Công ty chi nhánh của PETROVIETNAM trong toàn bộ chi phí do NHÀ THẦU gánh chịu theo Hợp đồng này (ngoại trừ hoa hồng và chi phí tài liệu theo Chương IX, chi phí đào tạo theo Chương X và chi phí trích lập quỹ\nnghiên cứu khoa học và phát triển kỹ thuật dầu khí theo Chương X) sau ngày PETROVIETNAM thông báo ý định tham gia, PETROVIETNAM hoặc Công ty chi nhánh của PETROVIETNAM sẽ đóng góp trên cơ sở gọi vốn hiện hành, phù hợp với quy định của Thỏa thuận điều hành chung;\n1 2.1.2.4. Các Bên cam kết rằng PETROVIETNAM sẽ\nkhông có nghĩa vụ tài chính nào theo quy định của Chương này nếu không có Phát hiện thương mại nào trong Diện tích hợp đồng được tuyên bố.\n12.1.3. Trường hợp Công ty chi nhánh của PETROVIETNAM tham gia trong tổ hợp nhà thầu ngay từ khi ký Hợp đồng và (các) Bên Nhà thầu còn lại trong tổ hợp có nghĩa vụ gánh vốn toàn bộ hoặc một phần cho Công ty chi nhánh của PETROVIETNAM thì tỷ lệ tham gia, tỷ lệ gánh vốn, phương thức gánh vốn, phương thức thu hồi chi phí đối với phần gánh vốn và việc tham gia của PETROVIETNAM theo quy định tại Điều 12.1 do Các Bên thỏa thuận trong Hợp\nđồng.\nĐiều 12.2. Chuyển nhượng 12.2.1. Mỗi Bên Nhà thầu có quyền bán, chuyển nhượng,\nsang tên hoặc định đoạt bằng cách khác toàn bộ hoặc một phần quyền, quyền lợi và nghĩa vụ của mình theo Hợp đồng này cho Công ty chi nhánh của mình với thông báo bằng văn bản cho PETROVIETNAM. Việc bán, chuyển nhượng, chuyển giao, sang tên hoặc định đoạt bằng cách khác nêu trên phải được Thủ tướng Chính phủ phê\nduyệt và có hiệu lực theo quy định tại Giấy chứng nhận đăng ký đầu tư điều chỉnh.\n12.2.2. Tùy thuộc vào quyền ưu tiên mua trước của PETROVIETNAM theo Luật Dầu khí và sau đó\nlà của các Bên Nhà thầu khác theo Thỏa thuận điều hành chung trên cơ sở các điều kiện chuyển nhượng như đã được thỏa thuận giữa Bên Nhà thầu có ý định chuyển nhượng và bên thứ ba (bên nhận chuyển nhượng tiềm năng không phải là Công ty chi nhánh của Bên chuyển nhượng), mỗi Bên Nhà thầu sẽ có quyền bán, chuyển nhượng,\nsang tên hoặc định đoạt bằng cách khác toàn bộ hoặc một phần quyền, quyền lợi và nghĩa vụ của mình theo Hợp đồng này cho bên thứ ba phụ thuộc vào sự phê duyệt của Thủ tướng Chính phủ. PETROVIETNAM phải có văn bản thông báo cho Bên Nhà thầu có ý định chuyển nhượng về quyết định của mình đối với quyền ưu tiên mua trước trong thời hạn một trăm hai mươi (120) ngày hoặc một khoảng thời gian khác do các bên liên quan thỏa thuận, kể từ ngày nhận được thông báo ý định chuyển nhượng và hợp đồng chuyển nhượng đã ký giữa Bên Nhà thầu có ý định chuyển nhượng với bên thứ ba. Nếu Bên Nhà thầu có ý định chuyển nhượng không nhận được văn bản thông báo của PETROVIETNAM trong thời hạn một trăm hai mươi (120) ngày được nhắc tới trên đây hoặc một khoảng thời gian khác như đã được thỏa thuận trước đó thì\ncoi như PETROVIETNAM đã từ bỏ quyền ưu tiên mua trước.\n12.2.3. Phù hợp với quy định tại Điều 12.2.1 và Điều 12.2.2, Bên nhận chuyển nhượng tiềm năng phải:\n12.2.3.1. Có đủ năng lực kỹ thuật và tài chính để\nthực hiện các nghĩa vụ của mình theo Hợp đồng này;\n12.2.3.2. Chấp nhận và tuân thủ đối với Quyền lợi tham gia được chuyển nhượng theo mọi điều kiện và điều khoản của Hợp đồng này;\nvà\n12.2.3.3. Theo yêu cầu và phụ thuộc vào sự chấp thuận của PETROVIETNAM, cung cấp cho PETROVIETNAM bảo lãnh của công ty mẹ hoặc bảo lãnh của tổ chức tín dụng tương ứng với Quyền lợi tham gia của bên nhận chuyển nhượng.\n12.2.4. Vì mục đích của Điều 12.2, việc thay đổi quyền sở hữu hoặc quyền kiểm soát của một Bên Nhà thầu (trừ trường hợp tái cơ cấu,\ndàn xếp tài chính nội bộ của Bên Nhà thầu đó hoặc hợp nhất của công ty mẹ của Bên Nhà thầu đó), Bên Nhà thầu liên quan phải thực hiện thủ tục kê khai và nộp thuế thu nhập phát sinh từ việc thay đổi quyền kiểm soát (nếu có) theo quy định của pháp luật Việt Nam và các điều ước quốc tế mà Việt Nam là thành viên.\nChương XIII THANH TOÁN, TIỀN TỆ VÀ HỐI ĐOÁI\nĐiều 13.1. Thanh toán 13.1.1. Phù hợp với các quy định hiện hành của Việt Nam về quản lý ngoại hối, các thanh toán đến hạn nào của một Bên cho Bên kia hoặc từ một Bên Nhà thầu cho Người điều hành, theo Hợp đồng này có thể được thực hiện bằng Đô la Mỹ hoặc bằng một hoặc các ngoại tệ tự do chuyển đổi khác mà Bên nhận hoặc Người điều hành có thể chấp nhận được vào từng thời điểm, tại một ngân hàng và tài khoản ngân hàng do Bên nhận hoặc Người điều hành chỉ định.\nKhông phụ thuộc vào Điều 5.1.2.13, Người điều hành phải mở tài khoản chung tại các ngân hàng được phép hoạt động tại Việt Nam để\nphục vụ mục đích góp vốn.\n13.1.2. Trừ khi có quy định khác trong Hợp đồng này hoặc trong Thể thức kế toán, bất kỳ thanh toán nào cần thực hiện theo Hợp đồng này phải thực hiện trong thời hạn ba mươi (30) ngày sau khi kết thúc tháng mà\ntrong đó phát sinh nghĩa vụ phải thanh toán.\nĐiều 13.2. Tiền tệ và hối đoái 13.2.1. Theo các quy định trong Hợp đồng này và phù\nhợp với các quy định hiện hành của pháp luật Việt Nam về quản lý ngoại hối, NHÀ\nTHẦU và Người điều hành có các quyền sau đây:\n13.2.1.1. Thực hiện bất kỳ thanh toán nào, duy trì,\nquản lý các tài khoản ngân hàng bằng bất kỳ loại tiền nào trong nước Việt Nam và tự do chuyển đổi bất kỳ khoản tiền nào của mình thành tiền Việt Nam hoặc sang bất kỳ ngoại tệ nào khác sẵn có được áp dụng với tỷ giá mua bán của ngân hàng thương mại nơi thực hiện giao dịch chuyển đổi và được tự do giữ lại hoặc định\nđoạt bất kỳ khoản tiền nào NHÀ THẦU và Người điều hành đang giữ.\n13.2.1.2. Thực hiện thanh toán, duy trì, quản lý\ncác tài khoản ngân hàng bằng ngoại tệ ở ngoài Việt Nam theo quy định của pháp luật về quản lý ngoại hối.\n13.2.1.3. Được chuyển ra khỏi Việt Nam thu nhập bằng ngoại tệ từ việc bán Dầu thu hồi chi phí, Dầu lãi, Khí thu hồi chi phí, Khí lãi và các thu nhập hợp pháp khác thu được trong quá trình hoạt động dầu khí với điều kiện Nhà thầu hoàn thành các nghĩa vụ tài chính theo quy định của pháp luật Việt Nam.\n13.2.1.4. Tự do chuyển đổi ngoại tệ quy định tại Điều 13.2.1.3 thành những tiền tệ khác.\n13.2.1.5. Tự do duy trì và điều hành các tài khoản trong sổ sách hoặc trong ghi chép của mình.\n13.2.2. Trong khi thực hiện các quyền và nghĩa vụ của mình theo Hợp đồng này, NHÀ THẦU có quyền thanh toán ở nước ngoài bằng bất kỳ\nloại tiền nào các chi tiêu đã gánh chịu để mua vật tư, thiết bị, dịch vụ và các khoản thanh toán khác liên quan đến hoạt động dầu khí. NHÀ THẦU, Người điều hành và các nhà cung cấp nước ngoài và các nhân viên nước ngoài của mình được quyền nhận toàn bộ hoặc một phần các khoản thanh toán của mình ở ngoài Việt Nam với điều kiện họ phải mang vào hoặc để lại Việt Nam một lượng tiền có thể chuyển\nđổi tự do đủ để thanh toán cho các chi tiêu trong đó có thuế thu nhập cá nhân của người nước ngoài làm việc tại Việt Nam.\n13.2.3. Mọi vấn đề khác có liên quan đến hối đoái và việc chuyển tiền ra nước ngoài phát sinh dưới bất kỳ hình thức nào liên quan\nđến Hợp đồng này, NHÀ THẦU và Người điều hành (và nhân viên nước ngoài của họ)\nvà các nhà cung cấp (và nhân viên nước ngoài của họ) có quyền được hưởng đối xử\nthuận lợi không kém các công ty nước ngoài hoặc người nước ngoài bình thường khác đang kinh doanh ở Việt Nam.\nChương XIV SỞ HỮU TÀI SẢN,\nTÀI SẢN THUÊ VÀ THU DỌN\nĐiều 14.1. Sở hữu tài sản 14.1.1. Tùy thuộc vào Điều 14.3, quyền sở hữu đối với tài sản của NHÀ THẦU sử dụng để phục vụ cho hoạt động dầu khí trong Diện tích hợp\nđồng và được tính vào Chi phí hoạt động dầu khí sẽ đương nhiên được chuyển cho PETROVIETNAM khi tổng chi phí của các tài sản này đã được NHÀ THẦU thu hồi đủ\ntheo các Điều 6.1.2 và Điều 6.2.2 hoặc vào ngày kết thúc Hợp đồng, tùy theo trường hợp nào xảy ra trước. Không phụ thuộc vào các quy định trên, NHÀ THẦU được quyền sử dụng miễn phí các tài sản nói trên trong phạm vi các tài sản đó vẫn cần thiết cho hoạt động dầu khí theo Hợp đồng này.\nĐối với các tài sản sử dụng chung cho nhiều hợp đồng dầu khí, khi Hợp đồng này kết thúc thì việc xử lý các tài sản nói trên được thực hiện theo hướng dẫn của PETROVIETNAM phù hợp với Điều 5.2.1.6.\n14.1.2. Trường hợp bất kỳ tài sản nào đã được thu hồi chi phí nhưng không còn cần thiết cho hoạt động dầu khí, NHÀ THẦU phải trao các tài sản đó cho PETROVIETNAM. Trường hợp PETROVIETNAM không muốn nhận các tài sản\nđó thì NHÀ THẦU có thể thay mặt PETROVIETNAM định đoạt các tài sản đó. Tất cả\ndoanh thu thực từ việc bán hoặc định đoạt bằng cách khác đối với những tài sản\nđó sẽ được trả cho PETROVIETNAM phù hợp với quy định của pháp luật Việt Nam.\n14.1.3. Trường hợp bất kỳ tài sản nào chưa được thu hồi chi phí đầy đủ nhưng không còn cần thiết cho hoạt động dầu khí nữa, NHÀ THẦU có thể định đoạt các tài sản đó phụ thuộc vào sự phê duyệt của PETROVIETNAM. Tất cả doanh thu thực từ việc định đoạt những tài sản đó sẽ được giảm trừ vào Chi phí hoạt động dầu khí.\nĐiều 14.2. Tài sản thuê\n14.2.1. Điều 14.1 không áp dụng đối với bất kỳ tài sản nào được sử dụng trong hoạt động dầu khí do NHÀ THẦU hoặc Người điều hành thuê, kể cả các tài sản thuê hoặc sở hữu của nhà cung cấp hoặc của bất kỳ người nào khác thực hiện dịch vụ cho NHÀ THẦU hoặc Người điều hành.\n14.2.2. NHÀ THẦU, Người điều hành, các nhà cung cấp và bất kỳ người nào thực hiện dịch vụ cho NHÀ THẦU hoặc cho Người điều hành, được giữ quyền kiểm soát, được nhập khẩu và tái xuất toàn bộ các tài sản thuê để thực hiện hoạt động dầu khí theo Hợp đồng này.\n14.2.3. Tiền thuê tài sản sử dụng cho hoạt động dầu khí do NHÀ THẦU hoặc Người điều hành gánh chịu sẽ được coi là Chi phí hoạt động dầu khí.\nĐiều 14.3. Thu dọn 14.3.1. Trường hợp bất kỳ công trình dầu khí nào do NHÀ THẦU xây dựng hoặc khoan vì mục đích của Hợp đồng này phải thu dọn trong thời hạn của Hợp đồng hoặc khi chấm dứt Hợp đồng theo quy định tại Chương XVI, theo văn bản yêu cầu của PETROVIETNAM, NHÀ THẦU phải thực hiện việc thu dọn các công trình dầu khí đó bằng cách hoặc bịt giếng, phá hủy, di chuyển, tháo dỡ, cải tạo,\nthay thế hoặc bảo quản tạm thời hay lâu dài hoặc bằng cách khác phù hợp với quy\nđịnh liên quan của pháp luật Việt Nam và Thông lệ công nghiệp dầu khí quốc tế.\n14.3.2. NHÀ THẦU, không chậm hơn chín (09) tháng kể\ntừ ngày có dòng dầu, khí đầu tiên đối với mỗi mỏ dầu hoặc mỏ khí, phải trình và\nđược Ủy ban Quản lý phê duyệt Kế hoạch thu dọn công trình dầu khí mà họ phải thực hiện sau khi hoàn tất khai thác đối với mỏ dầu hoặc mỏ khí liên quan, Ủy ban Quản lý xem xét Kế hoạch thu dọn công trình dầu khí do NHÀ THẦU chuẩn bị và trình theo quy định tại Hợp đồng này. Phụ thuộc vào bất kỳ sửa đổi nào được thực hiện phù hợp với Thông lệ công nghiệp dầu khí quốc tế, Ủy ban Quản lý phải thông qua trong thời hạn ba mươi (30) ngày kể từ khi NHÀ THẦU trình. Kế hoạch thu dọn công trình dầu khí do NHÀ THẦU trình bao gồm nhưng không chỉ giới hạn ở các nội dung chính theo quy định tại khoản 4 Điều 50 Luật Dầu khí.\nKhông muộn hơn một (01) năm kể từ ngày có dòng dầu,\nkhí đầu tiên đối với mỗi mỏ dầu hoặc mỏ khí, Kế hoạch thu dọn công trình dầu khí đã được Ủy ban quản lý thông qua đó sẽ được gửi tới PETROVIETNAM xem xét để\ntrình Bộ Công Thương thẩm định, phê duyệt.\n14.3.3. Không phụ thuộc vào việc phê duyệt Kế hoạch thu dọn công trình dầu khí của cơ quan có thẩm quyền, không muộn hơn một (01)\nnăm kể từ ngày có dòng dầu, khí đầu tiên đối với mỗi mò dầu hoặc mỏ khí, NHÀ THẦU,\nthông qua Người điều hành, phải thực hiện tạm trích lập quỹ bảo đảm nghĩa vụ\nthu dọn công trình dầu khí theo phương án thu dọn trong Kế hoạch phát triển mỏ\ndầu khí hoặc Kế hoạch phát triển mỏ dầu khí điều chỉnh đã được phê duyệt. Việc trích lập quỹ bảo đảm nghĩa vụ thu dọn công trình dầu khí nói trên sẽ được điều chỉnh, bổ sung theo Kế hoạch thu dọn công trình dầu khí hoặc Kế hoạch thu dọn công trình dầu khí điều chỉnh được cơ quan có thẩm quyền phê duyệt theo quy định của Luật Dầu khí. Việc trích lập quỹ bảo đảm nghĩa vụ thu dọn công trình dầu khí và các chỉ tiêu phát sinh để thực hiện thu dọn trong quá trình thực hiện Hợp đồng là trách nhiệm của mỗi Bên Nhà thầu tương ứng với tỷ lệ quyền lợi tham gia và được tính vào Chi phí hoạt động dầu khí vì mục đích thu hồi của Hợp đồng này.\n14.3.4. Trong quá trình phát triển, khai thác dầu khí nếu xét thấy công trình dầu khí bị sự cố không có khả năng sửa chữa, khắc phục hoặc không bảo đảm an toàn để duy trì hoạt động, NHÀ THẦU trình PETROVIETNAM xem xét, phê duyệt phương án thu dọn.\n14.3.5. Trước khi kết thúc Hợp đồng hoặc kết thúc thời hạn giai đoạn khai thác mỏ dầu khí, NHÀ THẦU phải hoàn thành trích nộp quỹ\nbảo đảm nghĩa vụ thu dọn công trình dầu khí như được xác định trong kế hoạch thu dọn công trình dầu khí cập nhật gần nhất được cấp thẩm quyền phê duyệt.\n14.3.6. Trường hợp NHÀ THẦU phát triển mỏ theo giai\nđoạn thông qua Kế hoạch khai thác sớm mỏ dầu khí, việc trích lập quỹ bảo đảm nghĩa vụ thu dọn công trình dầu khí được thực hiện theo quy định tại các Điều từ\n14.3.1 đến 14.3.5 với những điều chỉnh phù hợp.\nChương XV TRỌNG TÀI, MIỄN TRỪ CÓ TÍNH CHỦ QUYỀN VÀ QUYẾT ĐỊNH CỦA CHUYÊN GIA\nĐiều 15.1. Trọng tài 15.1.1. Các Bên sẽ cố gắng thông qua đàm phán để giải quyết những bất đồng và tranh chấp liên quan đến hoặc phát sinh từ Hợp đồng này.\n15.1.2. Trừ các tranh chấp được chuyển đến Chuyên gia để xem xét theo quy định tại Điều 15.3, trong trường hợp các bất đồng hoặc tranh chấp không thể giải quyết thông qua đàm phán bởi Các Bên trong thời hạn chín mươi (90) ngày sau khi có thông báo của bất kỳ Bên nào về một tranh chấp thì những bất đồng hoặc tranh chấp đó sẽ được giải quyết thông qua phân xử của hội đồng trọng tài. Các Bên của các phía tranh chấp sẽ chỉ định mỗi phía một trọng tài viên. Hai trọng tài viên được chọn, bằng thỏa thuận chung, sẽ chỉ định một trọng tài viên thứ ba để làm chủ tịch của hội đồng trọng tài. Trong trường hợp hai trọng tài do Các Bên chỉ định không thể thoả thuận việc chọn trọng tài thứ\nba trong thời hạn ba mươi (30) ngày từ khi trọng tài thứ hai được chỉ định thì\nchủ tịch hội đồng trọng tài sẽ được chỉ định bởi Trung tâm Trọng tài Quốc tế/Việt Nam... (tùy theo thỏa thuận). Phân xử trọng tài sẽ được tiến hành bằng [ ...]\n(tiếng Anh hoặc Tiếng Việt), phù hợp với Quy tắc Trọng tài của [....] (tùy theo thỏa thuận). Địa điểm giải quyết tranh chấp bằng thủ tục trọng tài sẽ ở\n[.......]. Bất kỳ phán quyết nào của hội đồng trọng tài sẽ là cuối cùng, buộc Các Bên phải thi hành.\nChi phí trọng tài liên quan đến giải quyết tranh chấp giữa Các Bên trong Hợp đồng sẽ do bên thua kiện gánh chịu.\nChi phí trọng tài liên quan đến giải quyết tranh chấp giữa Các Bên trong Hợp đồng sẽ không được coi là Chi phí hoạt động dầu khí được thu hồi.\nĐiều 15.2. Miễn trừ có tính chủ quyền Các Bên thoả thuận tất cả các giao dịch được dự liệu trong Hợp đồng này sẽ được coi là các hoạt động thương mại. Trong phạm vi mà một Bên có quyền trong bất kỳ tài phán nào, đòi hỏi cho mình hoặc bất kỳ đại lý,\nchi nhánh, của cải, tài sản nào của mình, quyền miễn trừ, cho dù mang tính chất chủ quyền quốc gia hoặc bằng cách khác hoặc phát sinh từ một hành động của nhà\nnước hay chủ quyền, khỏi các vụ kiện, thi hành, tịch biên hoặc các quá trình tố\ntụng với bất kỳ bản chất nào, Bên đó khước từ rõ ràng và dứt khoát quyền miễn trừ và đồng ý không đòi hỏi hoặc cho phép ai thay mặt mình hoặc bất kỳ đại lý\nhoặc chi nhánh nào của mình đòi hỏi quyền miễn trừ này. Không làm hạn chế\nnguyên tắc chung nói trên, mỗi Bên qua đây khước từ một cách rõ ràng bất kỳ quyền\nđòi hỏi miễn trừ nào theo pháp luật Việt Nam hoặc của bất kỳ tài phán nào trên thế giới.\nĐiều 15.3. Quyết định của chuyên gia Bất kỳ tranh chấp, tranh cãi hoặc khiếu nại kỹ thuật nào liên quan đến việc áp dụng Thông lệ công nghiệp dầu khí guốc tế hoặc bất kỳ\ntranh chấp nào liên quan đến bất đồng kỹ thuật đối với khối lượng, đo lường và\nđịnh giá trị Dầu thô hoặc Khí thiên nhiên theo Hợp đồng này hoặc bất kỳ quyết định nào đối với một tranh chấp được dẫn chiếu cụ thể trong Hợp đồng này hoặc bất kỳ\nvấn đề nào khác được quy định trong Hợp đồng này có thể được chuyển đến Chuyên gia quyết định mà Các Bên không thể giải quyết thông qua hòa giải trong một thời gian hợp lý, sẽ được đưa ra để quyết định bởi Chuyên gia [...do các Bên thoả\nthuận...] chỉ định. Chuyên gia đưa ra quyết định của mình phù hợp với các quy định trong Hợp đồng này. Các đại diện của Các Bên có quyền thảo luận với Chuyên gia và cung cấp cho Chuyên gia các tài liệu và thông tin, với điều kiện là Chuyên gia có thể áp đặt các giới hạn hợp lý đối với quyền này. Chuyên gia được tự do\nđánh giá mức độ quan trọng hoặc mức độ liên quan đối với bất kỳ tài liệu, thông tin hoặc bằng chứng khác. Quyết định của Chuyên gia sẽ là cuối cùng và buộc Các Bên phải thi hành. Chuyên gia sẽ quyết định về việc phân bổ chi phí Chuyên gia mà mỗi Bên phải gánh chịu, chi phí này sẽ được tính vào Chi phí hoạt động dầu khí được thu hồi. Nếu Các Bên không thống nhất được rằng một tranh chấp hoặc khiếu nại có liên quan chủ yếu đến các vấn đề kỹ thuật hay không, và họ không giải quyết được tranh chấp đó trong thời hạn sáu mươi (60) ngày thì tranh chấp\nđó sẽ được giải quyết cuối cùng bởi Trọng tài phù hợp với Điều 15.1.\nChương XVI CHẤM DỨT VÀ VI PHẠM\nĐiều 16.1. Chấm dứt 16.1.1. Không ảnh hưởng đến Điều 16.2, nếu có những hoàn cảnh không đảm bảo để tiếp tục hoạt động dầu khí và sau khi tham vấn với PETROVIETNAM, NHÀ THẦU vào bất kỳ thời điểm nào bằng việc gửi văn bản thông báo cho PETROVIETNAM trước chín mươi (90) ngày về ý định từ bỏ các quyền và được giải thoát khỏi các nghĩa vụ của mình theo Hợp đồng này, trừ các quyền và nghĩa vụ\ncòn lại của thời gian trước khi có việc từ bỏ đó cũng như các quyền và nghĩa vụ\ntiếp tục khác đã được dự liệu trong Hợp đồng này.\nTrong trường hợp NHÀ THẦU đề nghị chấm dứt Hợp đồng phù hợp với các quy định của Hợp đồng này hoặc khi hết thời hạn Hợp đồng, NHÀ\nTHẦU phải hoàn tất các nghĩa vụ và trách nhiệm theo quy định của Hợp đồng và Luật Dầu khí. Việc chấm dứt hiệu lực của Hợp\nđồng sẽ có hiệu lực vào ngày được ghi trong quyết định chấm dứt hiệu lực Hợp đồng của Bộ Công Thương.\n16.1.2. Không ảnh hưởng đến Điều 16.2, PETROVIETNAM có quyền chấm dứt Hợp đồng bằng thông báo cho NHÀ THẦU trước chín mươi (90)\nngày mà không phải bồi thường cho Nhà thầu bất kỳ tổn thất nào trong các trường hợp sau:\n16.1.2.1. Trường hợp NHÀ THẦU không triển khai Hoạt\nđộng phát triển mỏ dầu khí theo Kế hoạch phát triển mỏ dầu khí đã được phê duyệt trong thời hạn mười hai (12) tháng kể từ ngày Kế hoạch phát triển mỏ dầu khí\nliên quan được phê duyệt hoặc ngừng các Hoạt động phát triển mỏ dầu khí theo tiến\nđộ đã được phê duyệt trong Kế hoạch phát triển mỏ dầu khí trong thời hạn sáu\n(06) tháng liên tục, trừ trường hợp việc chậm tiến độ nêu trên gây ra bởi (i) sự\nkiện Bất khả kháng theo quy định tại Chương XIX; (ii) bởi một quyết định của cơ\nquan có thẩm quyền; hoặc (iii) được PETROVIETNAM chấp thuận.\n16.1.2.2. Trong trường hợp NHÀ THẦU đưa mỏ vào khai thác chậm hơn mười hai (12) tháng so với tiến độ đã được phê duyệt hoặc NHÀ THẦU ngừng Hoạt động khai thác dầu khí trong thời hạn ba (03) tháng liên tục ngoại trừ việc ngừng (i) được phê duyệt trước bởi PETROVIETNAM; (ii) bởi một quyết định của cơ quan có thẩm quyền; (iii) vì lý do Bất khả kháng;\n16.1.2.3. Nếu một Bên Nhà thầu bị phá sản, mất khả\nnăng thanh toán hoặc bị giải thể, với điều kiện là thông báo kết thúc nói trên chỉ có hiệu lực nếu các Bên Nhà thầu còn lại không có ý định tiếp nhận quyền và\nnghĩa vụ theo Hợp đồng này của Bên Nhà thầu bị vỡ nợ hoặc bị giải thể và các Bên Nhà thầu phải thông báo quyết định đó cho PETROVIETNAM trong thời hạn chín mươi (90) ngày nói trên.\n16.1.2.4. Nếu tất cả các Bên Nhà thầu cùng bị phá sản,\nmất khả năng thanh toán hoặc bị giải thể.\nĐiều 16.2. Vi phạm 16.2.1. Trường hợp một Bên (Bên vi phạm), vi phạm nghiêm trọng bất kỳ nghĩa vụ nào của mình theo Hợp đồng này thì Bên kia (Bên không vi phạm) có thể gửi thông báo yêu cầu Bên vi phạm sửa chữa vi phạm đó. Nếu Bên vi phạm không sửa chữa hoặc không sửa chữa được hoặc không bắt đầu hoặc không tiếp tục sửa chữa một cách nghiêm túc vi phạm đó trong thời hạn ba mươi\n(30) ngày kể từ ngày Bên không vi phạm thông báo vi phạm và Bên vi phạm nhận được thông báo đó, Bên không vi phạm có thể, vào bất kỳ lúc nào sau khi hết hạn ba mươi (30) ngày trên, chấm dứt Hợp đồng này bằng cách gửi thông báo chấm dứt cho Bên vi phạm. Nếu phát sinh tranh chấp giữa Các Bên về việc một Bên vi phạm nghiêm trọng bất kỳ nghĩa vụ nào của mình theo Hợp đồng này hoặc nếu một Bên có\nquyền chấm dứt Hợp đồng này dựa theo những quy định của Điều này thì bất kỳ Bên nào cũng có thể yêu cầu đưa việc tranh chấp đó ra trọng tài theo Điều 15.1 của Hợp đồng này.\n16.2.2. Vì mục đích của Điều 16.2.1, một Bên sẽ bị\ncoi là vi phạm nghiêm trọng theo Hợp đồng này vào lúc xảy ra bất kỳ trường hợp nào trong các trường hợp dưới đây:\n16.2.2.1. Không thực hiện bất kỳ việc gọi vốn hoặc thanh toán khác theo quy định của Hợp đồng này trong thời hạn ba mươi (30) ngày sau ngày yêu cầu thanh toán đó đến hạn, trừ khi có thỏa thuận khác.\n16.2.2.2. Không thực hiện hoặc không tuân thủ bất kỳ\nnghĩa vụ quan trọng phải thực hiện và không tuân theo Hợp đồng này, mà việc không thực hiện hoặc không tuân thủ đó ảnh hưởng nghiêm trọng đến việc triển khai hoặc đến mục đích kinh tế, thương mại của Hợp đồng này, nếu việc không thực hiện đó vẫn tiếp tục không được sửa chữa trong thời hạn ba mươi (30) ngày sau khi nhận được thông báo từ Bên không vi phạm. Tuy nhiên, với điều kiện, nếu việc không thực hiện đó có thể sửa chữa (như quyết định bởi Bên không vi phạm),\nnhưng không thể sửa chữa được trong thời hạn ba mươi (30) ngày đó, thì không bị\ncoi là vi phạm nghiêm trọng nếu Bên vi phạm nhanh chóng bắt đầu và thực hiện một cách cẩn trọng để hoàn thành việc sửa vi phạm đó và hoàn thành việc sửa vi phạm trong thời hạn chín mươi (90) ngày sau khi có thông báo đó.\nChương XVII TIÊU THỤ TRONG NƯỚC\nĐiều 17.1. Bán Dầu thô trong nước 17.1.1. Dầu thô khai thác từ Diện tích hợp đồng phải\nđược ưu tiên bán tại thị trường Việt Nam theo yêu cầu của Chính phủ trên cơ sở\nkế hoạch khai thác hằng năm đã được phê duyệt. NHÀ THẦU và PETROVIETNAM sẽ trao\nđổi về kế hoạch mua Dầu thô hằng năm.\n17.1.2. Trong trường hợp khẩn cấp, theo yêu cầu của Chính phủ Việt Nam, PETROVIETNAM có thể, bằng một văn bản thông báo trước ba mươi (30) ngày yêu cầu NHÀ THẦU bán Dầu thô nhiều hơn so với kế hoạch đã thỏa thuận với PETROVIETNAM. Dầu thô này sẽ được cung cấp từ phần Sản lượng dầu thực mà NHÀ THẦU được quyền sở hữu theo Hợp đồng này.\n17.1.3. Trường hợp NHÀ THẦU cung cấp Dầu Thô để\ntiêu thụ trong nước thì giá thanh toán cho NHÀ THẦU sẽ được tính trên cơ sở giá\ncạnh tranh quốc tế phù hợp với Điều 8.1.1 và trả bằng Đô la Mỹ hoặc bất kỳ loại tiền tệ chuyển đổi tự do nào khác được thoả thuận giữa Các Bên và được tự do chuyển ra nước ngoài. Thanh toán cho việc cung cấp này sẽ được thực hiện trong thời hạn ba mươi (30) ngày kể từ ngày giao nhận Dầu thô liên quan.\nĐiều 17.2. Nghĩa vụ bán Khí thiên nhiên Theo yêu cầu của Chính phủ Việt Nam, NHÀ THẦU có\nnghĩa vụ bán phần Khí thiên nhiên thuộc sở hữu của mình tại thị trường Việt Nam trên cơ sở thỏa thuận tại các dự án phát triển, khai thác khí.\nChương XVIII\nỔN ĐỊNH VÀ HỢP NHẤT\nĐiều 18.1. Ổn định 18.1.1. Các Bên đặt các mối quan hệ của mình theo Hợp\nđồng này trên cơ sở các nguyên tắc thiện chí, tin tưởng lẫn nhau, cùng có lợi,\ntôn trọng các đảm bảo đầu tư và các quyền lợi khác được chấp thuận cho các nhà\nđầu tư theo quy định của pháp luật Việt Nam.\n18.1.2. PETROVIETNAM sẽ áp dụng tất cả các biện pháp cần thiết để bảo đảm cho mỗi Bên Nhà thầu được áp dụng trong thời hạn Hợp\nđồng tất cả các quyền lợi và nghĩa vụ về thuế theo quy định tại Điều 7.2, Điều 7.3 và Điều 7.4.\n18.1.3. Nếu sau Ngày hiệu lực, pháp luật hiện hành\nđược sửa đổi, hủy bỏ hoặc ban hành các luật và quy định mới ở Việt Nam hoặc áp dụng những thay đổi quy định của một luật hoặc giấy phép bị hủy bỏ hoặc các điều kiện do vậy bị sửa đổi mà ảnh hưởng bất lợi đến quyền lợi và nghĩa vụ thuế được quy định tại Điều 7.2, Điều 7.3 và Điều 7.4 thì ngay khi có thông báo của NHÀ\nTHẦU, Các Bên sẽ trao đổi với nhau để có những sửa đổi các nội dung cần thiết của Hợp đồng này để duy trì quyền, lợi ích và quyền lợi của NHÀ THẦU theo Hợp đồng,\nbao gồm phần chia Dầu lãi hoặc Khí lãi của NHÀ THẦU như tại Ngày hiệu lực cũng như đảm bảo rằng bất kỳ thu nhập, doanh thu hoặc lợi tức nào, bao gồm bất kỳ một hoặc nhiều quyền lợi nêu trên của NHÀ THẦU đã phát sinh hoặc sẽ phát sinh theo Hợp đồng này sẽ không bị giảm bớt so với dự định ban đầu do kết quả của những thay đổi hay vô hiệu hoá của pháp luật hoặc do hậu quả của những thay đổi, hủy bỏ đối với các phê duyệt hoặc giấy phép.\nĐiều 18.2. Hợp nhất và mở rộng 18.2.1. Nếu bất kỳ một tích tụ Dầu khí nào đã được chứng minh vượt quá Diện tích hợp đồng, lấn sang diện tích lân cận do một hoặc nhiều nhà thầu đã được cấp phép thì PETRO VIETNAM và NHÀ THẦU và các nhà thầu có liên quan trong các diện tích lân cận đó sẽ phải thoả thuận về một biện pháp hiệu quả\nnhất để cùng nhau thẩm lượng tích tụ đó và (các) thoả thuận về khả năng cùng nhau phát triển, khai thác, tàng chứa, vận chuyển Dầu khí từ tích tụ đó và cách thức, theo đó các chi phí và dầu khí được khai thác từ diện tích hợp nhất đó sẽ\nđược chia theo tỷ lệ công bằng. Tùy từng trường hợp nhưng không muộn hơn mười tám (18) tháng kể từ khi Báo cáo tài nguyên, trữ lượng dầu khí của Phát hiện dầu khí được cơ quan có thẩm quyền phê duyệt theo cách thức và thủ tục như được quy\nđịnh tại Điều 4.2 của Hợp đồng này với những điều chỉnh thích hợp, NHÀ THẦU phải nhận được văn bản phê duyệt của Thủ tướng Chính phủ phê duyệt theo quy định của pháp luật hiện hành. Phần diện tích hợp nhất được điều chỉnh bởi các hợp đồng tương ứng và thỏa thuận hợp nhất được phê duyệt bởi Bộ Công Thương.\n18.2.2. Nếu bất kỳ một tích tụ Dầu khi nào đã được chứng minh vượt quá Diện tích hợp đồng, lấn sang diện tích lân cận do một quốc gia khác quản lý, NHÀ THẦU và các nhà thầu có liên quan trong các diện tích lân cận đó phải đàm phán để đạt được thỏa thuận phát triển hợp nhất để cùng thẩm lượng,\nphát triển, khai thác tích tụ Dầu khí đó theo cách thức được chấp nhận chung trong ngành công nghiệp dầu khí, theo đó các chi phí và dầu khí được khai thác từ diện tích hợp nhất đó sẽ được chia theo tỷ lệ công bằng. Thỏa thuận phát triển hợp nhất như vậy phải được Chính phủ Việt Nam và quốc gia liên quan phê duyệt.\nPhần diện tích hợp nhất được điều chỉnh bởi các hợp đồng dầu khí tương ứng và\nthỏa thuận hợp nhất.\n18.2.3. Nếu bất kỳ một tích tụ dầu khí nào đã được chứng minh vượt quá Diện tích hợp đồng, lấn sang một diện tích lân cận khác mà\ntại thời điểm đó chưa thuộc bất kỳ hợp đồng nào được ký giữa PETROVIETNAM với bên thứ ba, và được coi là “mở” thì NHÀ THẦU được quyền, với tài liệu địa chấn và các giải pháp kỹ thuật có thể tại thời điểm đó và được phê duyệt bởi PETROVIETNAM, xác định giới hạn của tích tụ đó. NHÀ THẦU và PETROVIETNAM sẽ cố\ngắng để đạt được thỏa thuận bổ sung thay đổi ranh giới Diện tích hợp đồng nhằm bao trùm toàn bộ tích tụ mới được phát hiện đó và phải được Thủ tướng Chính phủ\nphê duyệt. Việc thay đổi nêu trên được giới hạn bởi diện tích cụ thể được xác định theo các giới hạn khai thác thẳng đứng và nằm ngang của tích tụ hoặc mỏ mới được phát hiện.\nChương XIX BẤT KHẢ KHÁNG\nĐiều 19.1. Các sự kiện Bất khả kháng Không Bên nào phải chịu trách nhiệm trước Bên khác vì\nviệc trì hoãn hoặc không thực hiện, gây ra bởi một sự kiện Bất khả kháng trong phạm vi sự trì hoãn hoặc không thực hiện đó và không bị quy là lỗi hoặc sự bất cẩn của một Bên đang tìm kiếm sự bảo hộ theo Chương XIX này. Theo ý nghĩa được sử dụng ở đây, một sự kiện Bất khả kháng là sự kiện xảy ra một cách khách quan không thể lường trước được, nằm ngoài sự kiểm soát hợp lý của Các Bên và không thể tránh được, bao gồm, nhưng không giới hạn ở các tai họa thiên nhiên như\ncháy, nổ, lụt lội hoặc động đất, các sự kiện khác như chiến tranh, phong toả hoặc cấm vận, chiếm đóng, nội chiến, nổi loạn, phá hoại hay rối loạn xã hội, đình công hay náo loạn lao động khác hoặc bất kỳ việc áp dụng các văn bản quy phạm pháp luật sẽ được công bố và ban hành mà có ảnh hưởng làm gián đoạn, gây trở ngại hoặc ngăn cản việc tiến hành hoạt động dầu khí. Để tránh hiểu nhầm, thiếu vốn sẽ\nkhông được coi là sự kiện Bất khả kháng.\nĐiều 19.2. Ảnh hưởng và thông báo 19.2.1. Nếu sự kiện Bất khả kháng xảy ra và ngăn cản bất kỳ Bên nào thực hiện đúng thời hạn các nghĩa vụ của mình theo Hợp đồng này,\nnhưng ngoại trừ bất kỳ sự thiếu vốn nào, Bên có các hoạt động bị ảnh hưởng sẽ\nđược miễn thực hiện cho đến khi sự kiện Bất khả kháng liên quan chấm dứt.\n19.2.2. Bên tuyên bố sự kiện Bất khả kháng có nghĩa vụ thông báo ngay lập tức bằng văn bản cho Các Bên khác về sự tồn tại của một sự\nkiện Bất khả kháng. Thông báo đưa ra sẽ bao gồm thông tin liên quan đến bản chất của tình huống và trong phạm vi có thể, dự kiến mức độ ảnh hưởng đến hoạt động của Bên đó cũng như dự kiến khi nào hoạt động theo Hợp đồng của Bên đó sẽ được khôi phục.\n19.2.3. Vào lúc xảy ra một sự kiện Bất khả kháng,\nthời gian để hoàn thành các nghĩa vụ liên quan theo Hợp đồng này sẽ được hoãn lại tương đương với khoảng thời gian xảy ra các tình huống đó và thời gian khắc phục hậu quả của sự kiện Bất khả kháng đó.\n19.2.4. Bên tuyên bố sự kiện Bất khả kháng, với sự\ntuân thủ nghiêm chỉnh các quy định của Hợp đồng này, sử dụng tất cả các nỗ lực hợp lý để loại bỏ các nguyên nhân của việc không thực hiện và hoàn tất thực hiện công việc của mình trong thời gian sớm nhất.\n19.2.5. Vào lúc chấm dứt sự kiện Bất khả kháng, Bên bị ảnh hưởng sẽ thông báo ngay cho Các Bên khác bằng văn bản. Thông báo đó sẽ\nnêu rõ thời gian được coi là cần thiết để hoàn thành các nghĩa vụ theo Hợp đồng này. Nếu Bên bị ảnh hưởng không gửi thông báo hoặc gửi thông báo một cách chậm trễ không hợp lý thì Bên đó sẽ phải bồi thường bất kỳ tổn thất nào mà Các Bên khác phải chịu như hậu quả trực tiếp của việc không thông báo hoặc thông báo chậm trễ đó.\nChương XX NHỮNG QUY ĐỊNH KHÁC\nĐiều 20.1. Thông báo Mọi thông báo do bất kỳ Bên nào yêu cầu hoặc gửi cho Các Bên kia sẽ coi như đã được gửi một cách hợp lệ khi đã được chuyển tận tay hoặc bằng các dịch vụ thư tín được thừa nhận hay telefax đến địa chỉ sau:\nGửi: TẬP ĐOÀN DẦU KHÍ VIỆT NAM 18 Láng Hạ, quận Ba Đình, Hà Nội Cộng hòa xã hội chủ nghĩa Việt Nam Người nhận: Tổng Giám đốc\nĐiện thoại: 84-4-38 252526 Fax: 84-4-38 265942 Gửi: NHÀ THẦU\nĐịa chỉ:\nNgười nhận:\nĐiện thoại:\nFax:\nBất kỳ Bên nào cũng có thể thay đổi địa chỉ trên bằng văn bản thông báo trước về thay đổi đó cho Các Bên khác.\nĐiều 20.2. Luật áp dụng Hợp đồng này sẽ được diễn giải và điều chỉnh bởi quy định pháp luật của nước Cộng hòa xã hội chủ nghĩa Việt Nam. Trường hợp pháp luật Việt Nam chưa có quy định cụ thể để điều chỉnh bất kỳ vấn đề nào có thể\nphát sinh thì những quy định liên quan của luật nước ngoài {Các Bên có thể thỏa thuận và chỉ rõ trong Hợp đồng} hoặc Thông lệ công nghiệp dầu khí quốc tế sẽ được\náp dụng, với điều kiện hậu quả của việc áp dụng đó không trái với các nguyên tắc cơ bản của pháp luật Việt Nam.\nĐiều 20.3. Bảo hiểm Hằng năm, NHÀ THẦU phải đề xuất lên Ủy ban Quản lý\nmột chương trình bảo hiểm cho những tổn thất hoặc thiệt hại đối với tất cả các giếng, công trình, thiết bị, phương tiện phục vụ hoạt động dầu khí, bảo hiểm trách nhiệm bồi thường thiệt hại về môi trường, bảo hiểm trách nhiệm đối với bên thứ ba, bảo hiểm con người và bảo hiểm khác phù hợp với quy định của pháp luật Việt Nam và Thông lệ công nghiệp dầu khí quốc tế.\nKhi được Ủy ban Quản lý chấp thuận, NHÀ THẦU phải chịu trách nhiệm mua và duy trì bảo hiểm đó, ưu tiên mua bảo hiểm của công ty bảo hiểm có năng lực và kinh nghiệm bảo hiểm trong lĩnh vực dầu khí đang hoạt động tại Việt Nam phù hợp với Luật Kinh doanh bảo hiểm của Việt Nam và các điều ước quốc tế mà Việt Nam là thành viên.\nĐiều 20.4. Người điều hành 20.4.1. …………………[Theo các điều kiện kinh tế, kỹ\nthuật cơ bản đối với Hợp đồng đã được Thủ tướng Chính phủ phê duyệt] là Người\nđiều hành được chỉ định và được chấp thuận theo các điều khoản của Hợp đồng này và Thỏa thuận điều hành chung (nếu có). Việc chỉ định bất kỳ Người điều hành kế\nnhiệm nào sẽ phù hợp với Hợp đồng này và Thỏa thuận điều hành chung (nếu có) và\ntùy thuộc vào sự chấp thuận của PETROVIETNAM và cơ quan có thẩm quyền của Việt Nam.\n20.4.2. Người điều hành được chỉ định để thay mặt NHÀ THẦU thực hiện các nghĩa vụ thuế, các công việc và nghĩa vụ theo Hợp đồng này. Các Bên cũng xác nhận thêm rằng nếu có trường hợp khẩn cấp hoặc bất thường\nđòi hỏi phải hành động ngay lập tức, bất kỳ Bên nào cũng có thể thực hiện tất cả\ncác hành động mà mình cho là thích hợp hoặc nên thực hiện để bảo vệ lợi ích của mình và lợi ích của các nhân viên của mình và thông báo ngay cho Bên kia về việc\nđó, bất kỳ các chi phí nào phát sinh liên quan đến việc đó sẽ được tính là Chi phí hoạt động dầu khí được phép thu hồi theo các Điều 6.1.2 và 6.2.2 và phụ thuộc vào kết quả kiểm toán được quy định tại Điều 11.2.\n20.4.3. Nhằm mục đích thực hiện hoạt động dầu khí\ntheo Hợp đồng này, Người điều hành nước ngoài sẽ phải thành lập một văn phòng\nđiều hành tại Việt Nam như được quy định cụ thể tại Giấy chứng nhận đăng ký đầu tư trong thời hạn chín mươi (90) ngày hoặc một khoảng thời gian khác được thống nhất bởi Các Bên kể từ Ngày hiệu lực. Người điều hành có thể sử dụng chung văn phòng với Công ty chi nhánh của mình tại Việt Nam (nếu có). Chi phí cho văn phòng sẽ được chia sẻ tương ứng theo các nguyên tắc được Ủy ban quản lý chấp nhận.\nTrường hợp thay đổi thông tin liên quan đến văn phòng điều hành hoặc tiếp nhận lại văn phòng điều hành do thay đổi người điều hành hoặc chấm dứt hoạt động của văn phòng điều hành, Người điều hành phải có văn bản thông báo cho cơ quan đăng ký đầu tư nơi đặt văn phòng điều hành và phải thực hiện các thủ tục cần thiết theo yêu cầu.\n20.4.4. Trường hợp một Bên Nhà thầu có văn bản chính thức đề nghị rút lui khỏi Hợp đồng này (“Bên Rút lui”), các Bên Nhà thầu còn lại được quyền ưu tiên tiếp nhận Quyền lợi tham gia của Bên Rút lui và phải bảo đảm không ảnh hưởng đến các nghĩa vụ đã cam kết theo quy định của Hợp đồng này. Không muộn hơn mười hai (12) tháng kể từ ngày nhận được thông báo của Bên Rút lui, các Bên Nhà thầu có liên quan phải hoàn tất các thủ tục pháp lý để\ntrình Thủ tướng Chính phủ phê duyệt sự rút lui và tiếp nhận đó. Trong trường hợp các Bên Nhà thầu không thể thỏa thuận được các văn bản pháp lý có liên quan trong khoảng thời gian mười hai (12) tháng kể từ ngày Bên Rút lui có văn bản chính thức xin rút lui, NHÀ THẦU phải báo cáo PETROVIETNAM để giải quyết hoặc tuyên bố kết thúc hợp đồng. Trường hợp các Bên Nhà thầu còn lại không nhận Quyền lợi tham gia của Bên Rút lui thì PETROVIETNAM có quyền chấm dứt Hợp đồng bằng thông báo cho NHÀ THẦU trước chín mươi (90) ngày mà không phải bồi thường cho Nhà thầu bất kỳ tổn thất nào.\nĐiều 20.5. Quan hệ và trách nhiệm 20.5.1. Các quyền, bổn phận, nghĩa vụ và trách nhiệm của Các Bên theo Hợp đồng này sẽ là riêng rẽ, không chung và tách biệt. Mỗi Bên không chịu trách nhiệm chung và chịu trách nhiệm tách biệt để thanh toán bất kỳ\nkhoản tiền tới hạn nào của bất kỳ Bên nào khác vì lý do hoạt động dầu khí được thực hiện theo Hợp đồng này. Mỗi Bên Nhà thầu sẽ chịu trách nhiệm riêng rẽ đối với Quyền lợi tham gia tương ứng trong các nghĩa vụ tương ứng của mình như quy\nđịnh trong Hợp đồng và chỉ chịu trách nhiệm trong phạm vi Quyền lợi tham gia tương ứng của mình đối với bất kỳ các khiếu nại, thiệt hại, phân xử hoặc phán quyết nào theo quy định trong Hợp đồng này.\n20.5.2. NHÀ THẦU phải chịu trách nhiệm với PETROVIETNAM hoặc bất kỳ bên thứ ba nào đối với bất kỳ thiệt hại hoặc tổn thất nào, bao gồm\nô nhiễm môi trường, phát sinh từ hoạt động dầu khí gây ra do Cố ý điều hành sai, sự bỏ qua không hành động và cẩu thả. Trong mọi trường hợp, NHÀ THẦU không chịu trách nhiệm đối với các tổn thất hoặc thiệt hại mang tính hệ quả.\nĐiều 20.6. Bảo mật 20.6.1. Trừ khi được quy định khác dưới đây, Hợp đồng này và toàn bộ các thông tin có được hoặc nhận được bởi bất kỳ Bên nào theo Hợp\nđồng này sẽ được giữ bí mật.\n20.6.2. Không phụ thuộc vào quy định của Điều 20.6.1, Các Bên có thể sử dụng bất kỳ Thông tin mật nào vì mục đích chuẩn bị,\ncông bố bất kỳ báo cáo và kê khai nào theo yêu cầu của pháp luật.\n20.6.3. PETROVIETNAM có thể công bố bất kỳ thông tin nào về địa chất, khoa học và kỹ thuật có liên quan tới một diện tích đã được hoàn trả vào bất kỳ thời điểm nào sau khi hoàn trả.\n20.6.4. PETROVIETNAM có thể tiết lộ Thông tin mật khi các tổ chức tài trợ hoặc các tư vấn của họ yêu cầu mà không cần phải có sự\nđồng ý trước bằng văn bản của NHÀ THẦU, ngoại trừ các thông tin về các bằng sáng chế, sở hữu trí tuệ, bí quyết kỹ thuật, thiết kế, ý tưởng của NHÀ THẦU có\nđược hoặc được phép sử dụng trong quá trình triển khai hoạt động dầu khí theo Hợp\nđồng này.\n20.6.5. NHÀ THẦU không được tiết lộ cho bên thứ ba Thông tin Mật nếu chưa được PETROVIETNAM đồng ý, sự đồng ý này sẽ không bị từ\nchối một cách vô lý trừ những trường hợp sau:\n20.6.5.1. Do yêu cầu phải tiết lộ cho cơ quan tài phán theo luật pháp hoặc của các quy định của thị trường chứng khoán.\n20.6.5.2. Cho Công ty chi nhánh, các cố vấn kỹ thuật của mình, bất kỳ tổ chức tài chính nào mà NHÀ THẦU đang tìm kiếm vốn vì mục\nđích thực hiện các nghĩa vụ của mình theo Hợp đồng này và cho bên nhận chuyển nhượng tiềm năng đối với quyền lợi trong Hợp đồng này, với điều kiện rằng NHÀ\nTHẦU phải có được cam kết bảo mật từ người tiếp nhận trước khi thông tin được tiết lộ và cung cấp cho PETROVIETNAM cam kết bảo mật đã ký.\n20.6.5.3. Cho các nhà cung cấp, trong phạm vi cần thiết cho hoạt động dầu khí liên quan, với điều kiện rằng NHÀ THẦU phải có được cam kết bảo mật từ các nhà cung cấp đó trước khi thông tin được tiết lộ.\n20.6.6. Các quy định nêu trên của Điều 20.6 này sẽ\ntiếp tục có hiệu lực sau khi Hợp đồng này kết thúc trong thời hạn năm (5) Năm.\nĐiều 20.7. Các thỏa thuận khác [phụ thuộc vào đàm phán]\nChương XXI\nĐIỀU KHOẢN THI HÀNH\nĐiều 21.1. Hiệu lực Hợp đồng này sẽ có hiệu lực vào và kể từ Ngày hiệu lực.\nĐiều 21.2. Tính toàn vẹn Hợp đồng này là một thỏa thuận toàn vẹn giữa Các Bên liên quan đến đối tượng của Hợp đồng. Bất kỳ sửa đổi hoặc thay đổi nào của Hợp\nđồng này sẽ không có giá trị trừ khi sửa đổi hoặc thay đổi đó được thực hiện bằng văn bản và được các đại diện có thẩm quyền hợp pháp của Các Bên ký. Không một thỏa thuận nào trước đây mà Các Bên tham gia được coi là một phần của Hợp đồng này trừ khi được kết hợp một cách cụ thể bằng tham chiếu.\nĐiều 21.3. Sửa đổi và bổ sung Các sửa đổi, bổ sung của Hợp đồng này được Các Bên thỏa thuận và được Thủ tướng Chính phủ phê duyệt phù hợp với các quy định của pháp luật Việt Nam.\nĐiều 21.4. Mâu thuẫn Trường hợp có mâu thuẫn giữa các quy định của Hợp đồng và các Phụ lục thì các quy định của Hợp đồng này được ưu tiên áp dụng.\nĐiều 21.5. Khước từ\nMọi khước từ bất kỳ vi phạm nào của Hợp đồng này bởi một Bên sẽ không có hiệu lực trừ khi được lập thành văn bản và do một đại diện có thẩm quyền hợp lệ của Bên đó ký. Sự khước từ đó sẽ không ảnh hưởng đến các quyền của Các Bên đối với bất kỳ vi phạm nào khác.\nĐiều 21.6. Tính tách biệt của các điều khoản Nếu bất kỳ điều khoản nào của Hợp đồng này trở nên vô hiệu hoặc không thể thực thi được, sự vô hiệu hoặc không thể thực thi đó sẽ\nkhông ảnh hưởng tới hiệu lực phần còn lại của Hợp đồng này. Các phần còn lại của Hợp đồng sẽ duy trì đầy đủ hiệu lực và giá trị như thể quy định vô hiệu hoặc không thể thực thi đó không phải là một phần của Hợp đồng này.\nĐiều 21.7. Thông cáo Các Bên sẽ hợp tác trong việc chuẩn bị các tuyên bố\nthông cáo chung được đăng tin vào một thời gian thỏa thuận. Sau Ngày hiệu lực,\nmọi thông cáo về hoạt động dầu khí sẽ được ban hành thông qua NHÀ THẦU với sự\nphê duyệt của PETROVIETNAM.\nĐiều 21.8. Bản gốc và Ngôn ngữ\nHợp đồng này sẽ được làm thành\n[............................] (...) bản gốc: bao gồm\n[..............................] (...) bản bằng tiếng Việt và\n[.................................] (...) bản bằng tiếng Anh (hoặc tiếng nước ngoài thông dụng khác do Các Bên thỏa thuận); cả [....] (....) bằng cả hai ngôn ngữ sẽ có giá trị như nhau và đầy đủ hiệu lực và hiệu lực thi hành.\nNgười điều hành được phép sử dụng ngôn ngữ tiếng Anh trong các văn bản giao dịch và trong ghi chép sổ sách kế toán, nhưng sẽ được dịch ra tiếng Việt đối với yêu cầu cụ thể của các cơ quan có thẩm quyền của Việt Nam.\nCHỨNG KIẾN TẠI ĐÂY, Các Bên dưới đây đã lập và ký kết Hợp đồng này theo ngày, tháng, năm được ghi lần đầu trên đây.\nTẬP ĐOÀN DẦU KHÍ VIỆT NAM Bởi: [....................................]\nTên: [....................................]\nChức danh: [....................................]\nNHÀ THẦU Bởi: [....................................]\nTên: [....................................]\nChức danh: [....................................]\nĐỂ THAM KHẢO PHỤ\nLỤC B THỂ THỨC KẾ TOÁN HỢP ĐỒNG CHIA SẢN PHẨM DẦU KHÍ\nLÔ .........\nCỘNG HÒA XÃ HỘI CHỦ\nNGHĨA VIỆT NAM PHỤ LỤC B THỂ THỨC KẾ TOÁN Phần Trang 1. CÁC QUY ĐỊNH CHUNG 2. PHÂN LOẠI, ĐỊNH NGHĨA VÀ PHÂN BỔ CHI PHÍ HOẠT\nĐỘNG DẦU KHÍ\n3. CHI PHÍ CÓ THỂ THU HỒI VÀ CHI PHÍ KHÔNG THỂ\nTHU HỒI CỦA NHÀ THẦU 4. THU HỒI CHI PHÍ VÀ THỜI ĐIỂM THU HỒI CHI PHÍ\n5. CÁC GHI CHÉP VÀ ĐỊNH GIÁ TÀI SẢN 6. BÁO CÁO KHAI THÁC 7. BÁO CÁO ĐỊNH GIÁ SẢN PHẨM 8. BÁO CÁO CÁC CHI TIÊU, CHI PHÍ CÓ THỂ THU HỒI VÀ GHI CÓ\n9. BÁO CÁO DẦU THUẾ TÀI NGUYÊN VÀ KHÍ THUẾ TÀI NGUYÊN 10. BÁO CÁO THU HỒI CHI PHÍ\n11. BÁO CÁO DẦU LÃI VÀ KHÍ LÃI 1. CÁC QUY ĐỊNH CHUNG 1.1 GIỚI THIỆU Thể thức Kế toán này phải được áp dụng và tuân theo trong việc thực hiện nghĩa vụ của Các Bên theo Hợp đồng mà Thể thức Kế toán này là một Phụ lục của Hợp đồng đó.\nNgười Điều hành sẽ thay mặt NHÀ THẦU thực hiện các chức năng được quy định trong Thể thức Kế toán này.\nTrong trường hợp có mâu thuẫn giữa Hợp đồng và Thể\nthức Kế toán này, các quy định của Hợp đồng sẽ được áp dụng.\n1.2 NGUYÊN TẮC Các hoạt động kế toán sẽ được thực hiện theo quy định của Hợp đồng này và các quy định liên quan của pháp luật Việt Nam, đặc biệt là\nquy định hướng dẫn kế toán đối với các Người Điều hành tiến hành Hoạt động Dầu khí tại Việt Nam.\n1.3 CÁC BÁO CÁO VÀ KÊ KHAI KẾ TOÁN 1.3.1. Các ghi chép và sổ sách kế toán sẽ được lập và lưu giữ trên Cơ sở Tích lũy phù hợp với quy định của Hợp đồng, các hệ thống và thể thức kế toán được công nhận và chấp nhận chung và phù hợp với Thông lệ\nCông nghiệp Dầu khí Quốc tế được Chấp nhận Chung.\n1.3.2. NHÀ THẦU phải lập các báo cáo định kỳ liên quan đến Hoạt động Dầu khí như sau:\n1.3.2.1. Báo cáo Khai thác (Phần 6);\n1.3.2.2. Báo cáo Định giá Sản phẩm (Phần 7);\n1.3.2.3. Báo cáo Chi tiêu, Chi phí có thể Thu hồi và Ghi có (Phần 8);\n13.2.4. Báo cáo Dầu Thuế Tài nguyên và Khí Thuế Tài nguyên (Phần 9);\n1.3.2.5. Báo cáo Thu hồi Chi phí (Phần 10);\n1.3.2.6. Báo cáo Dầu Lãi và Báo cáo Khí Lãi (Phần 11);\n1.3.2.7. Báo cáo quyết toán chi phí; và\n1.3.2.8. Bảng Cân đối Kế toán.\n1.3.3. Ngoài các ghi chép và báo cáo được quy định cụ thể tại Phần 1 này, NHÀ THẦU cũng phải chuẩn bị cho PETROVIETNAM các thông tin và dữ liệu mà PETROVIETNAM có thể yêu cầu một cách hợp lý và có liên quan trực tiếp đến nghĩa vụ của NHÀ THẦU theo Hợp đồng, trong chừng mực mà các dữ liệu và thông tin đó được thu thập và lưu giữ.\n1.3.4. Các báo cáo được đề cập tại các Khoản từ\n1.3.2.3 đến 1.3.2.5 của Phụ lục này sẽ được lập, trình bày và lưu giữ trên cả\nCơ sở Thực thanh và Cơ sở Tích lũy.\nĐể tính toán việc phân bổ Dầu khí và thuế theo Hợp\nđồng, Hệ thống Cơ sở Tích lũy sẽ được áp dụng. Để phục vụ mục đích xác nhận Chi phí Hoạt động Dầu khí của kiểm toán PETROVIETNAM theo Điều 11.2.2 của Hợp đồng.\nHệ thống Cơ sở Thực thanh sẽ được sử dụng. Các Bên tại đây khẳng định và xác nhận rằng (i) Hệ thống Cơ sở Tích lũy và (ii) Hệ thống Cơ sở Thực thanh có ý nghĩa\nđược nêu tại Khoản 1.5 của Phụ lục này. Báo cáo được đề cập tại các Khoản 1.3.2.3 đến 1.3.2.5 của Phụ lục này sẽ được lập, trình bày và lưu giữ trên Cơ sở\nThực thanh với sự chuyển đổi từ Cơ sở Tích lũy sang Cơ sở Thực thanh với bằng chứng về các khoản tiền đã không nhận được hoặc chưa thanh toán bởi NHÀ THẦU có\nnêu rõ các khoản phải thu và các khoản phải trả.\n1.4 NGÔN NGỮ VÀ ĐƠN VỊ KẾ TOÁN 1.4.1. Tất cả các sổ sách kế toán, dữ liệu về hoạt\nđộng, báo cáo và các thông tin trao đổi đều được lập bằng tiếng Anh và sẽ được ghi lại bằng Đô la Mỹ, Một hệ thống đơn vị nhất quán sẽ được sử dụng cho việc\nđo lường được yêu cầu theo Thể thức Kế toán này. Trường hợp cần thiết cho mục\nđích làm rõ, các đơn vị đo lường và tiền tệ khác có thể được duy trì trong các tài khoản và ghi chép. Trường hợp cần thiết theo yêu cầu cụ thể của các cơ quan có thẩm quyền của Việt Nam, các sổ sách kế toán, dữ liệu về hoạt động, báo cáo và các thông tin trao đổi sẽ được dịch sang tiếng Việt.\n1.4.2. Thể thức Kế toán này có mục đích để cả\nPETROVIETNAM và NHÀ THẦU không hưởng lợi hoặc chịu lỗ từ việc chuyển đổi tiền tệ\ntương ứng với chi phí hoặc cho lợi ích tương ứng của Bên kia. Việc chuyển đổi tiền tệ được ghi nhận theo tỷ giá thực tế trong lần chuyển đổi đó. Nếu có bất kỳ\nkhoản lợi nhuận hoặc thua lỗ nào phát sinh từ việc chuyển đổi tiền tệ, thì khoản lợi nhuận hoặc thua lỗ đó sẽ được ghi có hoặc ghi nợ vào các tài khoản theo Hợp\nđồng.\n1.4.3. Phụ thuộc vào Khoản 1.4.2 của Phụ lục này,\ncác khoản tiền thu và chi phí được thực hiện bằng tiền Đồng hoặc bằng các loại tiền tệ khác Đô la Mỹ sẽ được ghi nhận bằng Đô la Mỹ dựa trên cơ sở tỷ giá chuyển\nđổi thực tế hoặc, nếu không chuyển đổi, dựa trên giá trị trung bình của các tỷ\ngiá mua và bán do Ngân hàng Thương mại Cổ phần Ngoại Thương Việt Nam (“VCB”)\ncông bố vào ngày đầu tiên của tháng có phát sinh giao dịch. Ngoại trừ các nội dung được quy định trên đây, các bút toán được ghi nhận bằng tiền Đồng hoặc các loại tiền tệ khác Đô la Mỹ sẽ được ghi nhận bằng Đô la Mỹ dựa trên tỷ giá do VCB công bố vào ngày đầu tiên của tháng thực hiện bút toán đó.\n1.5 ĐỊNH NGHĨA Các thuật ngữ xuất hiện trong Thể thức Kế toán này mà đã được định nghĩa trong Hợp đồng sẽ có cùng nghĩa như đã được định nghĩa trong Hợp đồng. Một số thuật ngữ cụ thể được sử dụng trong Thể thức Kế toán này\nđược định nghĩa như sau:\n1.5.1. “Tài sản” nghĩa là bất kỳ hạng mục nào trị giá hơn ba mươi triệu Đồng (30.000.000 VNĐ) hoặc một nghìn ba trăm Đô\nla Mỹ (1.300 USD), và có tuổi thọ sử dụng hơn một (1) năm.\n1.5.2. “Hệ thống Cơ sở Tích lũy” hoặc “Cơ\nsở Tích lũy” nghĩa là hệ thống cơ sở tích lũy của thu nhập và chi phí ghi nhận thu nhập khi được hưởng và nghĩa vụ đối với chi phí khi phát sinh.\n1.5.3. “Hệ thống Cơ sở Thực thanh” hoặc “Cơ\nsở Thực thanh” nghĩa là hệ thống cơ sở thực thanh của thu nhập và chi phí\nghi nhận thu nhập khí được hưởng bằng tiền mặt, hoặc tương đương tiền mặt, và\ncác chi phí khi thanh toán.\n1.5.4. “Báo cáo Thu hồi Chi phí” nghĩa là\nbáo cáo được nêu tại Phần 10.\n1.5.5. “Chi phí Phát triển” nghĩa là các chi phí được nêu tại Khoản 2.2 của Phụ lục này.\n1.5.6. “Chi phí Tìm Kiếm Thăm dò” nghĩa là\ncác chi phí được nêu tại Khoản 2.1 của Phụ lục này.\n1.5.7. “G&A” nghĩa là Chi phí Chung và\nChi phí Hành chính,\n1.5.8. “Chi phí Chung và Chi phí Hành chính”\nnghĩa là các chi phí được nêu tại Khoản 2.4 của Phụ lục này.\n1.5.9. “Tài sản Cố định” nghĩa là tất cả các Tài sản không được định nghĩa là Tài sản Lưu động.\n1.5.10. “Tài sản Lưu động” bao gồm các Tài sản như công cụ khai thác và khoan trên bề mặt và/hoặc dưới lòng đất, thiết bị và\nphương tiện, xà lan, tầu nổi, thiết bị tự động, máy bay, thiết bị xây dựng, đồ\nđạc, thiết bị văn phòng và các thiết bị khác.\n1.5.11. “Chi phí Khai thác” nghĩa là các chi phí được nêu tại Khoản 2.3 của Phụ lục này.\n1.5.12. “Báo cáo Khai thác” nghĩa là báo cáo\nđược nêu tại Phần 6.\n1.5.13. “Báo cáo Khí Lãi” nghĩa là báo cáo\nđược nêu tại Phần 11.\n1.5.14. “Báo cáo Dầu Lãi” nghĩa là báo cáo\nđược nêu tại Phần 11.\n1.5.15. “Phần” là một phần của Thể thức Kế\ntoán này, trừ trường hợp được quy định cụ thể khác.\n1.5.16. “Báo cáo Chi tiêu, Chi phí có thể Thu hồi và Ghi có” nghĩa là báo cáo được nêu tại Phần 8.\n1.5.17. “Báo cáo Dầu Thuế Tài nguyên và Khí Thuế\nTài nguyên” nghĩa là báo cáo được nêu tại Phần 9.\n1.5.18. “Báo cáo Định giá Sản phẩm” nghĩa là\nbáo cáo được nêu tại Phần 7.\n1.5.19. “Khoản” nghĩa là một khoản trong Thể\nthức Kế toán này, trừ trường hợp được quy định cụ thể khác.\n2. PHÂN LOẠI, ĐỊNH NGHĨA VÀ PHÂN BỔ CHI PHÍ HOẠT\nĐỘNG DẦU KHÍ\nTất cả chi phí và phí tổn liên quan đến Hoạt động Dầu khí sẽ được coi là Chi phí Hoạt động Dầu khí như được giải thích và định nghĩa rõ hơn tại các Khoản 2.1 đến 2.5 (bao gồm cả Khoản 2.1 và Khoản 2.5) của Phụ lục này và tại Phần 3 (trừ những chi phí được loại một cách rõ ràng ra khỏi chi phí\nthu hồi theo Khoản 3.2 của Phụ lục này). Chi phí Hoạt động Dầu khí được phân loại và quy định chi tiết như sau:\n2.1 CHI PHÍ TÌM KIẾM THĂM DÒ\n“Chi phí Tìm kiếm Thăm dò” là tất cả các chi phí trực tiếp và chi phí gián tiếp được phân bổ gánh chịu trong quá trình tìm kiếm Dầu khí bao gồm, nhưng không giới hạn ở:\n2.1.1. Việc thu thập các dữ liệu địa vật lý, địa hóa học, địa chất và trắc địa, bao gồm cả việc xử lý, tái xử lý và minh giải các dữ liệu đó;\n2.1.2. nhân công, vật tư, vật tư mua dự trữ, thiết bị và dịch vụ được sử dụng trong việc khoan các Giếng Tìm kiếm Thăm dò;\n2.1.3. một phần chi phí (như được định nghĩa tại Khoản 2.4 của Phụ lục này) được phân bổ cho Chi phí Tìm kiếm Thăm dò theo thông lệ kế toán dầu khí quốc tế tiêu chuẩn; và\n2.1.4. phụ thuộc vào Điều 2.2.2 của Hợp đồng, bất kỳ\nkhoản chi phí nào khác phát sinh trong quá trình tìm kiếm Dầu khí sau (hoặc, nếu có được chấp thuận của PETROVIETNAM, trước) Ngày Hiệu lực, nhưng trước ngày Khai thác Thương mại trên Diện tích Phát triển có liên quan, bao gồm cả các chi phí thẩm lượng và không được đề cập tại Khoản 2.2 của Phụ lục này.\n2.2 CHI PHÍ PHÁT TRIỂN\n“Chi phí Phát triển” là tất cả các chi phí\ntrực tiếp và chi phí gián tiếp được phân bổ gánh chịu trong quá trình phát triển một hoặc nhiều vỉa Dầu khí trong một Diện tích Phát triển và tất cả các hệ thống bao tiêu, xử lý và/hoặc vận chuyển kèm theo, bao gồm, nhưng không giới hạn ở:\n2.2.1. Việc khoan các Giếng, ngoài các Giếng Thầm lượng, được hoàn thành như là các Giếng khai thác và việc khoan các Giếng nhằm mục đích khai thác từ một vỉa Dầu khí bất kể các Giếng đó khô hoặc khai thác được hoặc dùng để bơm ép nước hoặc Khí Thiên nhiên hoặc bất kỳ khí nào khác nhằm nâng cao việc thu hồi Dầu khí;\n2.2.2. hoàn thiện các Giếng bằng cách lắp đặt ống chống hoặc thiết bị hoặc bằng cách khác sau khi Giếng được khoan để đưa Giếng\nđó vào sử dụng như Giếng khai thác hoặc Giếng dùng để bơm ép nước hoặc Khí\nThiên nhiên hoặc bất kỳ khí, chất lỏng hoặc chất rắn nào khác nhằm nâng cao việc thu hồi Dầu khí;\n2.2.3. chi phí khoan vô hình như lao động, vật tư\ntiêu hao và các dịch vụ không có giá trị tận dụng lại mà phát sinh trong quá\ntrình khoan và khoan sâu thêm các Giếng cho các mục đích nêu tại các Khoản 2.2.1 và 2.2.2 của Phụ lục này;\n2.2.4. các chi phí cho những phương tiện tại mỏ như\nđường ống, ống dẫn, tổ hợp khai thác và xử lý, thiết bị đầu giếng, thiết bị ngầm,\nhệ thống thu hồi tăng cường, các giàn ngoài khơi, phương tiện nén, hệ thống nạp ngoài khơi kể cả các tàu chứa, phương tiện tàng trữ Dầu khí, các cầu tầu và cảng xuất hàng, hải cảng, sân bay và các phương tiện có liên quan, và các đường ra vào cho các hoạt động khai thác;\n2.2.5. nghiên cứu khả thi, thiết kế công nghệ và\nthiết kế mô hình cho các phương tiện được nêu tại Khoản 2.2.4 của Phụ lục này;\nvà\n2.2.6. một phần chi phí (như đề cập tại Khoản 2.4 của Phụ lục này) được phân bổ vào chi phí phát triển theo thông lệ kế toán dầu khí\nquốc tế tiêu chuẩn.\n2.3 CHI PHÍ KHAI THÁC\n“Chi phí Khai thác” là tất cả các chi phí trực tiếp và chi phí gián tiếp được phân bổ gánh chịu trong quá trình khai thác Dầu Thô và Khí Thiên nhiên trong Diện tích Hợp đồng mà không phải là Chi phí Tìm kiếm Thăm dò và Chi phí Phát triển, bao gồm cả phần chi phí G&A (như được định nghĩa tại Khoản 2.4 của Phụ lục này) có thể được phân bổ vào và áp dụng đối với chi phí khai thác.\n2.4 CHI PHÍ CHUNG VÀ CHI PHÍ HÀNH CHÍNH (“G&A”)\nChi phí chung và chi phí hành chính nghĩa là tất cả\ncác chi phí sau:\n2.4.1. G&A tại Việt Nam là tất cả các chi phí\nquản lý, hành chính và chi phí chung trực tiếp phát sinh tại văn phòng đại diện và các văn phòng thực địa của Người Điều hành tại Việt Nam bao gồm, nhưng không giới hạn ở các dịch vụ giám sát, kế toán, pháp lý, kỹ thuật và liên quan đến lao động.\nG&A phát sinh ngoài Việt Nam là tất cả các chi phí quản lý, hành chính và chi phí chung do Người Điều hành và các Chi nhánh của Người Điều hành gánh chịu ở ngoài Việt Nam và liên quan trực tiếp đến Hoạt động Dầu khí bao gồm, nhưng không giới hạn ở các dịch vụ giám sát, kế toán, pháp lý,\nkỹ thuật và liên quan đến lao động. Việc phân bổ các chi phí này vào Chi phí Hoạt\nđộng Dầu khí phụ thuộc vào các điều kiện quy định tại Khoản 3.1.4.2 của Phụ lục này.\n2.4.2. Chi phí Quản lý Chung của Người Điều hành:\nCác Chi phí Quản lý Chung của Người Điều hành đối với Hoạt động Dầu khí theo Thể thức Kế toán này sẽ được tính là Chi phí Hoạt động Dầu khí hàng tháng. Khoản phí này áp dụng đối với hoạt động tư vấn, dịch vụ và trợ\ngiúp có tính chất chung mà không được tính trực tiếp vào Chi phí Hoạt động Dầu khí bằng bất kỳ cách nào khác và sẽ được trả theo tỷ lệ sau đây đối với tổng Chi phí Hoạt động Dầu khí (không bao gồm G&A thuộc Khoản 2.4.2 của Phụ lục này) tính cho Hoạt động Dầu khí trong Năm:\nĐối với năm (05) Triệu Đô la Mỹ đầu tiên cho mỗi Năm 5%\nĐối với ba (03) Triệu Đô la Mỹ tiếp theo cho mỗi Năm 3%\nĐối với hai (02) Triệu Đô la Mỹ tiếp theo cho mỗi Năm 2%\nTrên mười (10) Triệu Đô la Mỹ cho mỗi Năm 1%\nNếu trong một Năm bất kỳ, khoản tiền tính cho các dịch vụ này trên cơ sở tỷ lệ phần trăm nêu trên ít hơn một trăm nghìn Đô la Mỹ\n(100.000 USD), thì khoản tiền đó sẽ được tăng lên đến một trăm nghìn Đô la Mỹ\n(100.000 USD), ngoại trừ cho Năm đầu tiên và Năm cuối cùng, khi đó một trăm nghìn Đô la Mỹ (100.000 USD) tối thiểu đó được chia theo tỷ lệ số tháng trong Năm tương ứng.\n2.4.3. Phân bổ “G&A”\nTất cả “G&A” sẽ được phân bổ và được chia định kỳ như quy định tại các Khoản 2.1.3, 2.2.6 và 2.3 của Phụ lục này cho Chi phí Tìm Kiếm Thăm dò, Chi phí Phát triển và Chi phí Khai thác một cách tương ứng.\n2.5 CHI PHÍ CHUNG Chi phí Phát triển và Chi phí Khai thác phát sinh liên quan đến các phương tiện sử dụng trong hơn một Diện tích Phát triển sẽ được chia cho các Diện tích Phát triển này có tính đến mức sử dụng ước tính của mỗi Diện tích Phát triển dựa trên cơ sở sẽ được thỏa thuận giữa NHÀ THẦU và\nPETROVIETNAM.\nTrong trường hợp Dầu Thô và Khí Thiên nhiên được khai thác từ một Phát hiện Thương mại trong Diện tích Hợp đồng, và trong phạm vi việc xác định phân bổ Chi phí Hoạt động Dầu khí đối với sản lượng Dầu Thô hoặc Khí Thiên nhiên là khó khăn và không thực tế, thì Chi phí Hoạt động Dầu khí\nphát sinh sẽ được phân bổ đối với sản lượng Dầu Thô hoặc Khí Thiên nhiên trên cơ sở doanh thu tương đối từ sản lượng Dầu Thô và Khí Thiên nhiên một cách tương ứng.\n3. CHI PHÍ CÓ THỂ THU HỒI VÀ CHI PHÍ KHÔNG THỂ\nTHU HỒI CỦA NHÀ THẦU 3.1 CHI PHÍ CÓ THỂ THU HỒI Phụ thuộc vào các quy định của Hợp đồng, NHÀ THẦU sẽ\ngánh chịu và thanh toán các chi phí và phí tổn sau đây liên quan đến Hoạt động Dầu khí theo Hợp đồng. Những chi phí và phí tổn nêu trên được thanh toán theo các Khoản từ 3.1.1 đến 3.1.9 (bao gồm cả Khoản 3.1.1 và Khoản 3.1.9) của Phụ lục này hoặc các phí tổn khác phát sinh theo Khoản 3.1.10 dưới đây sẽ được phân loại theo các đề mục được tham chiếu tới trong Phần 2 và số được thu hồi theo thể thức\nđược xác định tại Chương VI của Hợp đồng.\n3.1.1 QUYỀN VỀ BỀ MẶT Tất cả các chi phí trực tiếp phát sinh từ việc đạt\nđược, gia hạn hoặc từ bỏ các quyền về bề mặt có được sau Ngày Hiệu lực và được duy trì trong Diện tích Hợp đồng.\n3.1.2 CHI PHÍ NHÂN CÔNG VÀ CÁC CHI PHÍ LIÊN QUAN 3.1.2.1. Tổng số tiền lương và tiền công bao gồm cả\ntiền công bổ sung và phụ cấp cho các nhân viên của Người Điều hành và các Chi nhánh đã trực tiếp tham gia vào Hoạt động Dầu khí, bất kể nơi làm việc của các nhân viên đó, được hiểu rằng, trong trường hợp nếu những nhân viên này chỉ cống hiến một phần chứ không phải toàn bộ thời gian của họ cho Hoạt động Dầu khí,\nthì chỉ được tính phần tiền lương và tiền công áp dụng theo tỉ lệ thời gian.\n3.1.2.2. Tất cả các nhân viên, ngoại trừ nhân viên văn phòng và nhân viên không chuyên nghiệp, mà tham gia vào Hoạt động Dầu khí\nvà các chi phí nhân viên của những người này có thể thu hồi theo Khoản 3.1.2.1 của Phụ lục này sẽ duy trì các bảng chấm công hoặc cơ sở phân bổ hợp lý khác nhằm mục đích tính các chi phí nhân công đó. Những bảng chấm công này sẽ ghi thời gian làm việc cho Hoạt động Dầu khí cho dù các nhân viên liên quan có dành toàn bộ hay chỉ một phần thời gian cho Hoạt động Dầu khí và sẽ thể hiện toàn bộ thời gian làm việc cho các dự án khác nhau cấu thành Hoạt động Dầu khí.\n3.1.2.3. Chi phí của Người Điều hành đối với các khoản thanh toán ngày nghỉ lễ, nghỉ phép, nghỉ ốm và mất khả năng lao động và\ncác khoản thanh toán trợ cấp thôi việc theo hợp đồng hoặc các khoản thanh toán theo yêu cầu của pháp luật áp dụng đối với tiền lương và tiền công được tính theo Khoản 3.1.2.1 của Phụ lục này.\n3.1.2.4. Các chi phí hoặc khoản đóng góp được thực hiện theo các mức ấn định hoặc nghĩa vụ được áp dụng theo quy định của pháp luật Việt Nam áp dụng đối với chi phí tiền lương và tiền công của Người Điều hành được tính theo Khoản 3.1.2.1 của Phụ lục này.\n3.1.2.5. Chi phí của Người Điều hành đối với các chương trình bảo hiểm nhân thọ, viện phí, lương hưu và các khoản phúc lợi khác có tính chất tương tự thường được cấp cho nhân viên của Người Điều hành.\n3.1.2.6. Chi phí đi lại và chi phí cá nhân hợp lý của nhân viên của Người Điều hành và gia đình họ bao gồm cả các chi phí trả cho việc chuyển vùng và nghỉ hàng năm của nhân viên nước ngoài và gia đình họ được cử tới Việt Nam, tất cả các chi phí này đều phù hợp với chính sách và thể thức của Người\nĐiều hành.\n3.1.2.7. Tất cả các khoản thuế thu nhập cá nhân của Việt Nam áp dụng đối với nhân viên nước ngoài của Người Điều hành và được Người\nĐiều hành khấu trừ hoặc thanh toán hoặc hoàn trả bằng cách khác.\n3.1.2.8. Người Điều hành sẽ tính chi phí cho Hoạt động Dầu khí theo mức đơn vị hoặc mức giờ công thông thường đối với các dịch vụ do Người Điều hành hoặc các Chi nhánh của Người Điều hành cung cấp ở ngoài Việt Nam. Mức này sẽ bao gồm mọi chi phí nhân viên được trả bao gồm nhưng không giới hạn ở các Khoản 3.1.2.1, 3.1.2.2, 3.1.2.3, 3.1.2.4, 3.1.2.5 và 3.1.2.7 của Phụ\nlục này và phù hợp với Khoản 3.1.4.2 của Phụ lục này.\n3.13 VẬN CHUYỂN Các chi phí liên quan đến vận chuyển nhân viên, thiết bị, vật tư và cung ứng cần thiết để tiến hành Hoạt động Dầu khí (bao gồm cả, nếu\nđược áp dụng, chi phí đóng bao bì, xử lý, môi giới và bảo hiểm) nếu không được thu hồi theo bất kỳ quy định nào khác trong Thể thức Kế toán này.\n3.1.4 PHÍ DỊCH VỤ\n3.1.4.1. Chi phí thực tế của các hợp đồng cho các dịch vụ kỹ thuật và dịch vụ khác do Người Điều hành ký kết liên quan đến Hoạt động Dầu khí và được thực hiện với các bên thứ ba (bao gồm các Bên Nhà thầu nhưng không bao gồm Người Điều hành) không phải là Chi nhánh của Người Điều hành.\n3.1.4.2. Trong trường hợp các dịch vụ để hỗ trợ Hoạt\nđộng Dầu khí được cung cấp bởi một Chi nhánh của Người Điều hành, thì các khoản phí sẽ được tính dựa trên chi phí thực tế không có lãi cho Người Điều hành. Các khoản phí không được vượt quá giá mà Chi nhánh tính với các bên thứ ba đối với các dịch vụ có thể so sánh theo các điều khoản và điều kiện tương tự ở bất kỳ\nnơi nào khác. Nếu được yêu cầu, Người Điều hành sẽ cung cấp xác nhận hàng năm do kiểm toán viên độc lập của Chi nhánh cấp (kiểm toán viên độc lập đó là công ty kiểm toán công được quốc tế công nhận) xác nhận rằng việc tính toán các mức\nđược sử dụng trong việc xác định các phí không bao gồm bất kỳ yếu tố lợi nhuận nào và rằng các phí đó được tính toán theo các thông lệ kế toán được áp dụng thống nhất của Chi nhánh đó và được tính theo cách không phân biệt đối xử, theo hệ thống tính tiêu chuẩn của Chi nhánh đó, Các dịch vụ đó sẽ được cung cấp trong phạm vi các hợp đồng dịch vụ giữa Người Điều hành và Chi nhánh liên quan.\n3.1.4.3. Chi phí thực tế mà Người Điều hành phải gánh chịu để minh giải, tái xử lý, kiểm tra và mua dữ liệu địa chấn từ\nPETROVIETNAM trước Ngày Hiệu lực với chấp thuận bằng văn bản của PETROVIETNAM.\n3.1.5 VẬT TƯ\n3.1.5.1. Quy định chung Trong phạm vi có thể thực hiện và nhất quán với việc hoạt động có hiệu quả và kinh tế, NHÀ THẦU sẽ chỉ mua hoặc cung cấp để sử dụng cho các hoạt động theo Hợp đồng các loại vật tư như có thể cần thiết cho việc sử\ndụng trong một tương lai có thể dự đoán trước một cách hợp lý và để tránh việc tích lũy hàng tồn kho.\n3.1.5.2. Bảo hành vật tư\nNHÀ THẦU không bảo hành vật tư được cung cấp ngoài mức bảo đảm của các nhà cung cấp hay nhà sản xuất và, trong trường hợp vật tư\nhay thiết bị có khuyết tật, thì bất kỳ điều chỉnh nào mà NHÀ THẦU nhận được từ\nnhà cung cấp/nhà sản xuất hay đại lý của họ sẽ được ghi có vào Chi phí Hoạt động Dầu khí theo Hợp đồng.\n3.1.5.3. Trị giá của vật tư được tính vào Chi phí\nHoạt động Dầu khí theo Hợp đồng Trừ khi được quy định khác tại Khoản 3.1.5.4 của Phụ\nlục này, vật tư do NHÀ THẦU mua để sử dụng trong Hoạt động Dầu khí sẽ được định giá theo giá hóa đơn trừ đi chiết khấu thương mại (nếu có) cộng với phí mua và\ncung ứng, cước vận chuyển và các chi phí giao nhận giữa điểm cung cấp và điểm nhận hàng, tiền cước vận chuyển đến cảng nhận, phí bảo hiểm, các khoản thuế,\nthuế hải quan (nếu có), phí lãnh sự và các khoản khác áp dụng đối với vật tư nhập khẩu, và tùy trường hợp, chi phí bốc dỡ và vận chuyển từ điểm nhập khẩu đến kho hàng hay hiện trường.\n3.1.5.4. Vật tư mua từ các Chi nhánh Vật tư mua từ các Chi nhánh của NHÀ THẦU sẽ được tính theo giá được quy định tại Khoản 3.1.5.4.1 và Khoản 3.1.5.4.2 của Phụ lục này một cách thích ứng.\n3.1.5.4.1. Vật tư mới (Điều kiện “A”) được định giá\ntheo giá thấp hơn giữa giá của Chi nhánh của NHÀ THẦU hoặc giá quốc tế hiện hành.\n3.1.5.4.2. Vật tư đã qua sử dụng (Điều kiện “B” và\n“C”):\n3.1.5.4.2.1. vật tư còn trong tình trạng tốt, sử dụng\nđược và thích hợp cho việc tái sử dụng mà không cần phải tân trang sẽ được xếp loại là Điều kiện “B” và được định giá không cao hơn bảy mươi lăm phần trăm\n(75%) giá vật tư mới được quy định tại Khoản 3.1.5.4.1 của Phụ lục này.\n3.1.5.4.2.2. vật tư không thể xếp loại là Điều kiện\n“B” nhưng sau khi tân trang vẫn còn sử dụng được như chức năng ban đầu như vật tư đã qua sử dụng còn tốt, hoặc có thể sử dụng được như chức năng ban đầu nhưng về cơ bản không thích hợp để tân trang, sẽ được xếp loại là Điều kiện “C” và được\nđịnh giá không cao hơn năm mươi phần trăm (50%) giá của vật tư mới được quy định trong Khoản 3.1.5.4.1 của Phụ lục này. Bất kỳ chi phí tân trang nào sẽ được tính vào vật tư đã tân trang với điều kiện là giá trị vật tư theo Điều kiện “C”\ncộng với chi phí tân trang không vượt quá trị giá của vật tư theo Điều kiện “B”\ncùng chủng loại.\n3.1.5.4.2.3. vật tư không thể xếp loại là Điều kiện\n“B” hoặc Điều kiện “C” nhưng có thể được sử dụng mà không cần phải tân trang cho mục đích hoạt động khác với chức năng ban đầu của Người Điều hành sẽ được định giá không cao hơn bảy mươi lăm phần trăm (75%) giá vật tư mới phục vụ mục đích thực sử dụng của Người Điều hành quy định tại Khoản 3.1.5.4.1 của Phụ lục này.\n3.1.6 TIỀN THUÊ, THUẾ QUAN VÀ CÁC ĐỊNH THUẾ KHÁC Bất kỳ khoản tiền thuê, khoản thuế (bao gồm thuế\ngiá trị gia tăng), các khoản thuế hải quan và xuất khẩu, khoản nộp bắt buộc,\nphí tổn, phí, khoản đóng góp và bất kỳ định thuế và phí nào khác do Chính phủ đặt ra liên quan đến Hoạt động Dầu khí trong phạm vi mà NHÀ THẦU phải trả và không\nđược PETROVIETNAM hoàn lại cho NHÀ THẦU. Thuế thu nhập doanh nghiệp, Thuế Tài nguyên, thuế xuất khẩu đánh vào Dầu Thô của NHÀ THẦU trong mọi trường hợp đều không phải là chi phí có thể thu hồi của NHÀ THẦU.\n3.1.7 BẢO HIỂM VÀ TỔN THẤT Các khoản phí và chi phí bảo hiểm, trừ đi bất kỳ\nkhoản hoa hồng, giảm giá và chiết khấu, không kể khoản chiết khấu tiền mặt gánh chịu cho bảo hiểm, với điều kiện là việc bảo hiểm đó là thông lệ và đem lại sự\nbảo vệ thận trọng đối với các rủi ro. Nếu bảo hiểm đó được cung cấp toàn bộ hay một phần cho một Chi nhánh của NHÀ THẦU, thì phí bảo hiểm và phí tổn đó chỉ có\nthể thu hồi trong phạm vi được tính chung bởi các công ty bảo hiểm cạnh tranh ngoài Chi nhánh nói trên của NHÀ THẦU.\nPhí tổn và tổn thất gánh chịu nhưng không thể thu hồi theo các hợp đồng bảo hiểm mua theo Hợp đồng này, trong bất kỳ trường hợp nào,\nsẽ được thu hồi ngoại trừ trong các trường hợp khi các phí tổn và tổn thất đó\nphát sinh từ việc Cố ý Điều hành Sai của NHÀ THẦU như được nêu tại Điều 20.5.2.\ncủa Hợp đồng.\n3.1.8 CÁC CHI PHÍ PHÁP LÝ\nTất cả phí tổn và chi phí kiện tụng và các dịch vụ\npháp lý hoặc dịch vụ có liên quan cần thiết hay có lợi cho việc bảo đảm, hoàn thiện,\ngiữ lại và bảo vệ Diện tích Hợp đồng, để tiến hành Hoạt động Dầu khí, và để bào chữa hay khởi tố các vụ kiện, xét xử trọng tài hay các thủ tục giải quyết tranh chấp thay thế khác liên quan đến Hoạt động Dầu khí và/hoặc Hợp đồng, hay bất kỳ\nkhiếu nại của bên thứ ba nào liên quan đến Hoạt động Dầu khí và/hoặc Hợp đồng,\nhay các khoản tiền thanh toán liên quan đến các dịch vụ pháp lý cần thiết hay có lợi cho việc bảo vệ và tư vấn về quyền lợi của PETROVIETNAM và/hoặc NHÀ THẦU.\nTrường hợp các dịch vụ pháp lý về các vấn đề trên được các luật sư hưởng lương của Người Điều hành hay một Chi nhánh của Người Điều hành cung cấp, thì phí tổn và chi phí của các dịch vụ pháp lý đó sẽ được phân loại phù hợp với Khoản 3.1.2 hoặc Khoản 3.1.4 của Phụ lục này, tùy trường hợp.\n3.1.9 CHI PHÍ CHUNG VÀ CHI PHÍ HÀNH CHÍNH Tất cả các chi phí được nêu trong Khoản 2.4 của Phụ\nlục này.\n3.1.10 CÁC CHI PHÍ KHÁC 3.1.10.1 bất kỳ khoản chi phí nào không phải là chi phí được đề cập bởi các quy định trên đây của Phần 3 này, do NHÀ THẦU trả theo Ngân sách đã được phê duyệt hoặc do Ủy ban Quản lý phê duyệt bằng cách nào khác cho dù nội dung chi tiết của các chi phí đó có thể không được nêu trong các báo cáo hay thông tin trước đó;\n3.1.10.2. phụ thuộc vào các phê chuẩn được quy định trong Hợp đồng hoặc do Ủy ban Quản lý phê duyệt bằng cách khác, bất kỳ chi phí\nnào do NHÀ THẦU gánh chịu để tiến hành các Hoạt động Dầu khí cần thiết và thích\nđáng phù hợp với Thông lệ Dầu khí Quốc tế được Chấp nhận Chung;\n3.1.10.3. chi phí nghiên cứu và phát triển các thiết bị, vật tư và kỹ thuật mới để sử dụng cho việc thăm dò, phát triển và khai thác Dầu khí;\n3.1.10.4. chi phí xây dựng, bảo trì, tiền thuê, khoản thanh toán trước và tiền đặt cọc đã trả cho văn phòng, nhà ở, kho tàng, chi phí\nthiết bị, đồ đạc, xe cộ, máy vi tính, phần mềm và chi phí bảo trì của các mục nói trên;\n3.1.10.5. bất kỳ khoản thanh toán nào được thực hiện theo Điều 2.2.3 của Hợp đồng.\n3.1.10.6. tất cả các chi phí liên quan trực tiếp đến Hoạt động Thu dọn;\n3.1.10.7. văn phòng khu vực, lều trại, và các thiết bị phụ;\n3.1.10.8. sinh thái và môi trường (bao gồm bất kỳ\nkhoản thanh toán nào được thực hiện theo Điều 5.1.2.6 của Hợp đồng);\n3.1.10.9. nghiên cứu và phát triển;\n3.1.10.10. chi phí giáo dục, đào tạo và các chi phí\ntiện ích;\n3.1.10.11. chi phí kết thúc dự án; và\n3.1.10.12. các khoản thuế và phí khác, nếu có, đối với việc vận chuyển, lưu trữ, xử lý và bán Dầu khí trong trường hợp Dầu khí\nkhông được bán tại đầu giếng.\n3.2 CHI PHÍ KHÔNG THỂ THU HỒI THEO HỢP ĐỒNG 3.2.1. các chi phí gánh chịu trước Ngày Hiệu lực trừ\nkhi được quy định hoặc thỏa thuận khác đi một cách cụ thể;\n3.2.2. các khoản phạt tiền hình sự hoặc hình phạt\n(bao gồm nhưng không giới hạn tiền phạt bắt buộc) do Chính phủ, hoặc một cơ\nquan của Chính phủ quyết định;\n3.2.3. bất kỳ các chi phí, phí hoặc phí tổn nào bao gồm nhưng không giới hạn ở bất kỳ các khoản tài trợ và cho tặng liên quan đến quan hệ công chúng hoặc nâng cao hình ảnh công ty và tăng lợi ích cho công ty của NHÀ THẦU ngoại trừ các chi phí đóng góp mà đã được PETROVIETNAM chấp thuận;\n3.2.4. tất cả các khoản thuế đối với thu nhập hoặc lợi nhuận của NHÀ THẦU, thuế tài nguyên và thuế xuất khẩu theo bất kỳ pháp luật\nđược áp dụng nào; hoặc bất kỳ các phí tổn liên quan phát sinh trực tiếp hoặc theo cách khác (bao gồm cả các phí tổn phát sinh liên quan đến việc chuẩn bị và\nnộp tờ kê khai thuế, các tài khoản liên doanh để báo cáo công ty và phí trả cho tư vấn thuế);\n3.2.5. các chi phí, tổn thất hoặc thiệt hại gánh chịu hoặc bất kỳ trách nhiệm nào phải chịu do bất kỳ Cố ý Điều hành Sai của NHÀ THẦU\nđã được chứng minh và được dẫn chiếu đến tại Điều 20.5.2 của Hợp đồng, bao gồm bất kỳ khoản tiền nào được trả để giải quyết bất kỳ khiếu nại nào cáo buộc việc Cố ý Điều hành Sai cho dù việc Cố ý Điều hành Sai đó có được thừa nhận hay không,\nhoặc khoản tiền đó có được tuyên bố là được thanh toán trên cơ sở thiện chí hoặc cơ sở tương tự hay không;\n3.2.6. các chi phí thay thế và/hoặc sửa chữa đối với các tài sản hoặc các bất động sản khác mà không được bảo hiểm hoặc bảo hiểm dưới chuẩn và dẫn đến trách nhiệm pháp lý đối với các bên thứ ba trên cơ sở chịu trách nhiệm bất kể có lỗi hay không, trong mỗi trường hợp mà NHÀ THẦU đã không bảo hiểm hoặc bảo hiểm với số tiền ít hơn số tiền đã được Ủy ban Quản lý thông qua;\n3.2.7. phí kiểm toán và phí kế toán (trừ các khoản phí và các chi phí gánh chịu cho việc thực hiện các dịch vụ kiểm toán và kế\ntoán được yêu cầu bởi Hợp đồng) gánh chịu theo các yêu cầu về kiểm toán và kế\ntoán của bất kỳ pháp luật được áp dụng nào và tất cả các chi phí và phí tổn gánh chịu liên quan đến các yêu cầu về báo cáo doanh nghiệp trong nội bộ công ty\n(cho dù pháp luật có yêu cầu hay không);\n3.2.8. bất kỳ các chi phí và phí nào liên quan đến việc thành lập bất kỳ công ty có liên quan nào hoặc bất kỳ hợp danh hoặc thỏa thuận liên doanh nào;\n3.2.9. thanh toán bồi thường hoặc bồi thường thiệt hại theo Hợp đồng ngoại trừ các bồi thường hoặc bồi thường thiệt hại liên quan\nđến Hoạt động Dầu khí (trừ khi được PETROVIETNAM chấp thuận khác đi);\n3.2.10. bất kỳ các chi phí và phí nào đối với việc\nđiều hành tập trung hoặc văn phòng chính của NHÀ THẦU hoặc bất kỳ công ty liên quan nào của NHÀ THẦU cho dù trực tiếp hoặc gián tiếp liên quan đến nhưng không giới hạn ở bất kỳ việc sáp nhập, tái cơ cấu và/hoặc hợp nhất công ty trừ khi được PETROVIETNAM chấp thuận;\n3.2.11. tất cả các chi phí, phí tổn và phí liên quan đến việc giải quyết tranh chấp (không phải là các tranh chấp liên quan đến Hoạt động Dầu khí) bao gồm tất cả các chi phí và phí tổn phân xử trọng tài hoặc kiện tụng phát sinh từ hoặc liên quan đến Hợp đồng (cho dù có thắng kiện hay không) mà không được PETROVIETNAM chấp thuận trước;\n3.2.12. bất kỳ chi phí nào phát sinh mà không liên quan đến Hoạt động Dầu khí hoặc về các vấn đề hoặc các hoạt động vượt ngoài Điểm Giao nhận;\n3.2.13. các chi phí mà không có chứng từ hoặc chứng minh đầy đủ;\n3.2.14. tất cả các chi phí và phí tổn trực tiếp hoặc gián tiếp liên quan đến hoặc gắn liền với việc đào tạo nhân viên người nước ngoài;\n3.2.15. bất kỳ thanh toán nào theo Chương IX “Hoa hồng và Phí Tài liệu” (bao gồm cả phí ngân hàng và hoa hồng) hoặc chi phí đào tạo theo Chương X của Hợp đồng;\n3.2.16. bất kỳ chi phí nào phát sinh trực tiếp hoặc gián tiếp liên quan đến việc huy động vốn để tài trợ cho Hoạt động Dầu khí và\ncác loại phí và chi phí phụ khác liên quan đến việc đó được huy động bằng bất kỳ\nphương thức nào; và chi phí đó bao gồm tiền lãi ngoại trừ như được quy định hoặc thỏa thuận khác đi một cách cụ thể, phí ngân hàng, hoa hồng, phí và môi giới;\n3.2.17. chi phí hoạt động đối với các hạng mục không được bao gồm trong Ngân sách cho Năm liên quan hoặc chi phí đối với bất kỳ\nhạng mục nào đã được bao gồm trong ngân sách mà chưa có được sự chấp thuận của PETROVIETNAM; và\n3.2.18. bất kỳ chi phí nào khác không thuộc bất kỳ\ncác hạng mục nào nêu trên mà được ghi rõ ở những phần khác trong Hợp đồng là\nchi phí không thể thu hồi, hoặc các chi phí được ghi rõ là không phải là các chi phí được cho phép cho mục đích tính toán thu hồi chi phí hoặc các khoản tiền\nđược chi tiêu mà không có sự chấp thuận của PETROVIETNAM (trong trường hợp cần phải có sự chấp thuận như thế) hoặc được chi tiêu do vi phạm hoặc không tuân thủ\ncác nghĩa vụ của NHÀ THẦU theo Hợp đồng.\n3.3 CÁC GIAO DỊCH SAU ĐÂY SẼ ĐƯỢC GHI CÓ VÀO CHI PHÍ HOẠT ĐỘNG DẦU KHÍ THEO HỢP ĐỒNG 3.3.1. các khoản tiền ròng thu được từ bất kỳ khoản bảo hiểm hay yêu cầu bồi thường nào liên quan đến Hoạt động Dầu khí;\n3.3.2. doanh thu mà NHÀ THẦU nhận từ các bên thứ ba\nđối với việc sử dụng vật sở hữu hoặc tài sản được tính vào Chi phí Hoạt động Dầu khí theo Hợp đồng;\n3.3.3. bất kỳ khoản điều chỉnh nào mà NHÀ THẦU nhận từ các nhà cung cấp/nhà sản xuất hoặc đại lý của họ liên quan đến vật tư có khiếm khuyết, mà phí tổn của vật tư này trước đó được NHÀ THẦU tính vào Chi phí Hoạt\nđộng Dầu khí theo Hợp đồng;\n3.3.4. tiền thuê, khoản hoàn trả, tiền đặt cọc hoặc bất kỳ khoản ghi có nào khác mà NHÀ THẦU nhận được mà áp dụng cho bất kỳ khoản phí nào đã được tính vào Chi phí Hoạt động Dầu khí theo Hợp đồng, nhưng không bao gồm bất kỳ khoản tiền nào NHÀ THẦU nhận được theo một phán quyết trọng tài\nđược đề cập tại Khoản 3.2.11 của Thể thức Kế toán này;\n3.3.5. các khoản tiền ròng nhận được từ vật tư lưu kho được tính vào Chi phí Hoạt động Dầu khí theo Hợp đồng mà sau đó được định\nđoạt nhưng không được sử dụng trong Hoạt động Dầu khí và chưa được thu hồi hết.\n3.4 TÍNH KÉP GHI NỢ VÀ GHI CÓ\nKhông phụ thuộc vào bất kỳ điều khoản nào quy định khác đi trong Thể thức Kế toán này, ý định của Các Bên là không để có việc tính kép ghi nợ hoặc ghi có trong các tài khoản theo Hợp đồng.\n4. THU HỒI CHI PHÍ VÀ THỜI ĐIỂM THU HỒI CHI PHÍ\n4.1 Việc thu hồi Chi phí Hoạt động Dầu khí\ntheo Hợp đồng sẽ được thực hiện theo thể thức được quy định trong các Điều 6.1.2 và 6.2.2 của Hợp đồng. Bất kỳ các chi phí nào do PETROVIETNAM loại hoặc treo trong các báo cáo kiểm toán của mình sẽ không được thu hồi cho đến khi được Các Bên giải quyết. Các Bên hết sức nỗ lực để giải quyết và hoàn tất tất cả các chi phí tranh chấp trong thời gian sớm nhất có thể.\n4.2 Nguyên tắc ghi chép chi phí vật tư theo Hợp đồng 4.2.1. Chi phí mua vật tư để lưu kho và được xem là\nChi phí Tìm Kiếm Thăm dò hoặc Chi phí Phát triển phải được ghi chép như vốn lưu\nđộng và có thể được thu hồi khi được đưa vào sử dụng.\n4.2.2. Chi phí mua vật tư để lưu kho và được xem là\nChi phí Khai thác có thể được thu hồi kể từ ngày thanh toán cho vật tư đó.\n5. CÁC GHI CHÉP VÀ ĐỊNH GIÁ TÀI SẢN NHÀ THẦU sẽ lưu giữ các ghi chép chi tiết về tài sản\nđược sử dụng cho Hoạt động Dầu khí phù hợp theo Thông lệ Công nghiệp Dầu khí Quốc tế được Chấp nhận Chung và sẽ gửi cho PETROVIETNAM một báo cáo về tất cả các tài sản này vào mỗi Năm.\n5.1 KIỂM KÊ TÀI SẢN Vào các khoảng thời gian hợp lý nhưng ít nhất một lần trong mỗi Năm đối với các Tài sản Lưu động và ba (3) Năm một lần đối với Tài sản cố định, việc kiểm kê tài sản sử dụng cho Hoạt động Dầu khí nói trên sẽ do NHÀ\nTHẦU tiến hành. NHÀ THẦU sẽ gửi cho PETROVIETNAM văn bản thông báo trước ít nhất ba mươi (30) Ngày về ý định thực hiện việc kiểm kê đó và PETROVIETNAM, bằng chi phí riêng của mình, có quyền có mặt khi việc kiểm kê được tiến hành. Trong trường hợp PETROVIETNAM không tham gia, PETROVIETNAM được coi như đã chấp thuận việc kiểm kê do NHÀ THẦU tiến hành mà không có sự có mặt của PETROVIETNAM. NHÀ THẦU sẽ nêu các nguyên tắc được dùng làm cơ sở cho việc định giá hàng kiểm kê đó.\nKhi thực hiện việc chuyển nhượng các quyền theo Hợp đồng này, NHÀ THẦU có thể\ntiến hành việc kiểm kê đặc biệt theo yêu cầu của bên thụ nhượng; với điều kiện là chi phí kiểm kê đó do bên thụ nhượng chi trả.\n5.2 KIỂM KÊ VẬT TƯ\nÍt nhất một lần trong một Năm, và sau mỗi chiến dịch khoan, NHÀ THẦU sẽ tiến hành kiểm kê tất cả vật tư trong kho dùng cho các Hoạt\nđộng Dầu khí. NHÀ THẦU sẽ thông báo cho PETROVIETNAM và cho phép PETROVIETNAM,\nbằng chi phí riêng của mình, tham gia vào việc kiểm kê đó. Trong trường hợp PETROVIETNAM không tham gia, PETROVIETNAM được coi như đã chấp thuận việc kiểm kê do NHÀ THẦU tiến hành mà không có sự có mặt của PETROVIETNAM.\n6. BÁO CÁO KHAI THÁC 6.1 Sau khi bắt đầu Khai thác Thương mại tại mỗi Diện tích Phát triển, NHÀ THẦU sẽ trình một Báo cáo Khai thác hàng tháng cho từng Diện tích Phát triển lên PETROVIETNAM nêu rõ các thông tin sau đây:\n6.1.1. lượng Dầu Thô được khai thác và tàng trữ\ntrong tháng;\n6.1.2. lượng Khí Thiên nhiên được khai thác và tàng trữ trong tháng;\n6.1.3. lượng Dầu khí được sử dụng cho Hoạt động Dầu khí trong tháng;\n6.1.4. lượng Khí Thiên nhiên bị đốt bỏ;\n6.1.5. lượng Dầu Thô tích trữ vào đầu tháng;\n6.1.6. lượng Dầu Thô tích trữ vào cuối tháng;\n6.1.7. lượng Dầu Thô được mỗi Bên lấy trong tháng;\nvà\n6.1.8. lượng Khí Thiên nhiên được mỗi Bên bán trong tháng.\n6.2 Báo cáo Khai thác của mỗi tháng sẽ được trình lên PETROVIETNAM không chậm hơn mười lăm (15) Ngày sau khi kết thúc tháng\nđó.\n7. BÁO CÁO ĐỊNH GIÁ SẢN PHẨM 7.1 NHÀ THẦU sẽ chuẩn bị một “Báo cáo Định giá Sản phẩm” bao gồm việc xác định giá trị Dầu khí được lấy trong mỗi Quý.\nBáo cáo này bao gồm các thông tin sau đây:\n7.1.1. khối lượng và giá mà mỗi Bên thu được từ việc bán từng chuyến Dầu Thô cho các bên thứ ba trong Quý có liên quan;\n7.1.2. khối lượng và giá mà mỗi Bên thu được từ việc bán từng chuyến hàng Dầu Thô trong Quý có liên quan, không phải cho các bên thứ\nba; và\n7.1.3. khối lượng và giá mà mỗi Bên thu được từ mỗi\nđợt bán Khí Thiên nhiên cho các bên thứ ba trong Quý có liên quan.\n7.2 Báo cáo Định giá Sản phẩm của mỗi Quý sẽ\nđược trình lên PETROVIETNAM không muộn hơn ba mươi (30) Ngày sau khi kết thúc Quý đó và trong thời hạn sáu mươi (60) Ngày sau khi kết thúc mỗi Năm.\n8. BÁO CÁO CÁC CHI TIÊU, CHI PHÍ CÓ THỂ THU HỒI VÀ GHI CÓ\n8.1 Đối với mỗi tháng, Quý và Năm, NHÀ THẦU sẽ lập một “Báo cáo Chi tiêu, Chi phí có thể Thu hồi và Ghi có” theo Hợp\nđồng này. Báo cáo này phân biệt giữa Chi phí Tìm kiếm Thăm dò, Chi phí Phát triển và Chi phí Khai thác và sẽ xác định các hạng mục chi tiêu chính trong các nhóm này mà trùng khớp với các hạng mục thuộc Ngân sách hàng năm được phê duyệt. Báo cáo này sẽ bao gồm các nội dung sau đây:\n8.1.1. các chi tiêu, chi phí có thể thu hồi và ghi có (không bao gồm các khoản nhận được từ việc bán Dầu khí) đối với Quý liên quan;\n8.1.2. các chi tiêu và ghi có chi tiết cộng dồn\n(không bao gồm các khoản nhận được từ việc bán Dầu khí) đối với Ngân sách dành cho Năm liên quan;\n8.1.3. các chi tiêu và ghi có cộng dồn được dự báo gần đây nhất đối với cả Năm; và\n8.1.4. các chênh lệch giữa Ngân sách và dự báo mới nhất và giải trình về dự báo đó.\n8.2 Báo cáo Chi tiêu, Chi phí có thể Thu hồi và Ghi có cho từng tháng, từng Quý sẽ được trình lên PETROVIETNAM không muộn hơn mười lăm (15) Ngày sau khi kết thúc tháng, ba mươi (30) Ngày sau khi kết thúc Quý và trong thời hạn sáu mươi (60) Ngày sau khi kết thúc Năm, bao gồm báo cáo kiểm toán năm cho Năm liên quan được thực hiện bởi một công ty kiểm toán quốc tế do Ủy ban Quản lý chỉ định. Báo cáo kiểm toán năm của kiểm toán quốc tế được lựa chọn sẽ được nộp cho PETROVIETNAM không muộn hơn chín mươi (90) Ngày sau khi kết thúc năm đó.\n9. BÁO CÁO DẦU THUẾ TÀI NGUYÊN VÀ KHÍ THUẾ TÀI NGUYÊN 9.1 Đối với Diện tích Hợp đồng, NHÀ THẦU sẽ\nlập một “Báo cáo Dầu Thuế Tài nguyên và Khí Thuế Tài nguyên” bao gồm các thông tin sau đây:\n9.1.1. các điều chỉnh về Dầu Thô có hiệu lực trở về\ntrước đối với khối lượng và giá trị của Dầu Thuế Tài nguyên trong Năm trước đó;\n9.1.2. các điều chỉnh về Khí Thiên nhiên có hiệu lực trở về trước đối với Khí Thuế Tài nguyên trong Năm trước đó;\n9.1.3. nộp hàng quý cho PETROVETNAM khối lượng và\ngiá trị tạm tính Dầu Thuế Tài nguyên; và\n9.1.4. nộp hàng quý cho PETROVIETNAM khối lượng và\ngiá trị tạm tính Khí Thuế Tài nguyên.\n9.2 Báo cáo Dầu Thuế Tài nguyên và Khí Thuế\nTài nguyên tạm tính (i) cho từng Quý sẽ được trình lên PETROVIETNAM không muộn hơn ba mươi (30) Ngày sau khi kết thúc Quý; và (ii) cho từng Năm sẽ được trình lên PETROVIETNAM không muộn hơn sáu mươi (60) Ngày sau khi kết thúc quyết toán năm.\n10. BÁO CÁO THU HỒI CHI PHÍ\n10.1 Đối với Diện tích hợp đồng, NHÀ THẦU sẽ\nlập một “Báo cáo Thu hồi Chi phí” trong từng Quý bao gồm các thông tin sau đây:\n10.1.1. các điều chỉnh về Dầu Thô và/hoặc Khí Thiên nhiên có hiệu lực trở về trước đối với khối lượng và giá trị Dầu Thu hồi Chi phí\nvà/hoặc Khí Thu hồi Chi phí do NHÀ THẦU nhận và định đoạt trong Quý trước đó;\n10.1.2. Chi phí Hoạt động Dầu khí có thể thu hồi,\nđược chuyển sang từ Quý trước đó;\n10.1.3. Chi phí Hoạt động Dầu khí có thể thu hồi đã\nphát sinh, được phân tích theo nhóm chi phí hoạt động, trong Quý; trong Năm cho\nđến thời điểm báo cáo và từ Ngày đầu dự án cho đến thời điểm báo cáo;\n10.1.4. tổng chi phí có thể thu hồi trong Quý, là tổng số tiền của các Khoản 10.1.2 và 10.1.3 của Phụ lục này;\n10.1.5. khối lượng và giá trị Dầu Thu hồi Chi phí\ndo NHÀ THẦU thực nhận và định đoạt trong Quý, tùy trường hợp;\n10.1.6. khối lượng và giá trị Khí Thu hồi Chi phí\ndo NHÀ THẦU thực nhận và định đoạt trong Quý, tùy trường hợp;\n10.1.7. tổng chi phí đã thu hồi trong Quý; trong Năm cho đến thời điểm báo cáo và từ Ngày đầu dự án cho đến thời điểm báo cáo;\nvà\n10.1.8. Chi phí Hoạt động Dầu khí có thể thu hồi được chuyển sang Quý kế tiếp.\n10.2 NHÀ THẦU sẽ chuẩn bị “Báo cáo Thu hồi Chi phí” hoàn chỉnh của Năm đối với Diện tích Hợp đồng, trong đó có bao gồm các thông tin sau:\n10.2.1. số dư chi phí có thể thu hồi được chuyển sang từ Năm trước;\n10.2.2. số dư chi phí có thể thu hồi phát sinh trong Năm và từ Ngày đầu dự án đến thời điểm báo cáo;\n10.2.3. tổng số dư chi phí có thể thu hồi sẽ được thu hồi cho Năm (c = a + b);\n10.2.4. số chi phí được quyền thu hồi cho Năm\n(doanh thu * % chi phí có thể thu hồi được xác định trong Hợp đồng) không vượt quá tổng số dư chi phí có thể thu hồi quy định tại Khoản 10.2.3 của Phụ lục này;\n10.2.5. chi phí có thể thu hồi tạm thời đã thu hồi\nđược trong Năm;\n10.2.6. số chi phí thu hồi vượt quá/chưa đủ sẽ được\nđiều chỉnh khi quyết toán thuế thu nhập doanh nghiệp cho Năm (f = d - e); và\n10.2.7. số dư chi phí có thể thu hồi được chuyển sang Năm sau (g = c - d).\n10.3 Báo cáo Thu hồi Chi phí (i) cho từng Quý sẽ được trình lên PETROVIETNAM không muộn hơn ba mươi (30) Ngày sau khi kết thúc Quý; và (ii) cho Năm sẽ được trình lên PETROVIETNAM trong thời hạn sáu mươi (60) Ngày sau khi kết thúc mỗi Năm.\n11. BÁO CÁO DẦU LÃI VÀ KHÍ LÃI 11.1 Đối với Diện tích Hợp đồng, NHÀ THẦU sẽ\nlập một “Báo cáo Dầu Lãi” và, khi phù hợp, “Báo cáo Khí Lãi”, tùy từng trường hợp, bao gồm các thông tin sau đây:\n11.1.1. Sản lượng Dầu Thực trong Quý/Năm;\n11.1.2. Sản lượng Khí Thực trong Quý/Năm;\n11.1.3. Sản lượng Dầu Thực và Sản lượng Khí Thực tích lũy được cho đến khi kết thúc Quý/Năm;\n11.1.4. khối lượng Dầu Lãi phân bổ cho PETROVIETNAM và NHÀ THẦU trong Quý/Năm;\n11.1.5. khối lượng Khí Lãi phân bổ cho PETROVIETNAM và NHÀ THẦU trong Quý/Năm;\n11.1.6. khối lượng Dầu Lãi và Khí Lãi tích lũy được phân bổ cho PETROVIETNAM và NHÀ THẦU cho đến khi kết thúc Quý; và\n11.1.7. khối lượng Dầu Lãi và Khí Lãi do PETROVIETNAM và NHÀ THẦU nhận và định đoạt trong Quý/Năm.\n11.2 Báo cáo Dầu Lãi và Báo cáo Khí Lãi cho từng Quý sẽ được trình lên PETROVIETNAM không muộn hơn ba mươi (30) Ngày sau khi kết thúc Quý và trong thời hạn sáu mươi (60) Ngày sau khi kết thúc mỗi Năm\nđối với báo cáo cho từng Năm."
}