{
  "url": "https://thuvienphapluat.vn/van-ban/Tien-te-Ngan-hang/Thong-tu-13-2023-TT-NHNN-sua-doi-Thong-tu-cap-Giay-phep-cua-ngan-hang-thuong-mai-585053.aspx",
  "title": "Thông tư 13/2023/TT-NHNN sửa đổi Thông tư cấp Giấy phép của ngân hàng thương mại mới nhất",
  "properties": {
    "Số hiệu": "13/2023/TT-NHNN",
    "Loại văn bản": "Thông tư",
    "Nơi ban hành": "Ngân hàng Nhà nước Việt Nam",
    "Người ký": "Đoàn Thái Sơn",
    "Ngày ban hành": "31/10/2023",
    "Ngày hiệu lực": "Đã biết",
    "Ngày công báo": "Đã biết",
    "Số công báo": "Đã biết",
    "Tình trạng": "Đã biết"
  },
  "content": "NGÂN HÀNG NHÀ NƯỚC VIỆT NAM\n -------\nCỘNG HÒA XÃ HỘI CHỦ NGHĨA VIỆT NAM\n Độc lập - Tự do - Hạnh phúc \n ---------------\nSố:\n 13/2023/TT-NHNN Hà Nội, ngày 31 tháng 10 năm 2023 THÔNG TƯ\nSỬA ĐỔI, BỔ SUNG MỘT SỐ ĐIỀU CỦA CÁC THÔNG TƯ QUY ĐỊNH VỀ CẤP GIẤY PHÉP, TỔ CHỨC, HOẠT ĐỘNG VÀ HỒ\nSƠ, TRÌNH TỰ, THỦ TỤC CHẤP THUẬN MỘT SỐ NỘI DUNG THAY ĐỔI CỦA NGÂN HÀNG THƯƠNG MẠI, CHI NHÁNH NGÂN HÀNG NƯỚC NGOÀI Căn cứ Luật Ngân hàng Nhà nước Việt Nam ngày 16 tháng 6 năm 2010;\nCăn cứ Luật Các tổ chức tín dụng ngày 16 tháng 6 năm 2010 và Luật sửa đổi, bổ sung một số điều của Luật Các tổ chức tín dụng ngày 20 tháng 11 năm 2017;\nCăn cứ Nghị định số 102/2022/NĐ-CP ngày 12 tháng 12 năm 2022 của Chính phủ quy định chức năng, nhiệm vụ, quyền hạn và cơ cấu tổ chức của Ngân hàng Nhà nước Việt Nam;\nTheo\nđề nghị của Chánh Thanh tra, giám sát ngân hàng;\nThống\nđốc Ngân hàng Nhà nước Việt Nam ban hành Thông tư sửa đổi, bổ sung một số điều của các Thông tư quy định về cấp Giấy phép, tổ chức, hoạt động và hồ sơ, trình tự, thủ tục chấp thuận một số nội dung thay đổi của ngân hàng thương mại, chi nhánh ngân hàng nước ngoài.\nĐiều 1. Sửa đổi, bổ sung một số điều của Thông tư số\n40/2011/TT-NHNN ngày 15 tháng 12 năm 2011 của Thống đốc Ngân hàng Nhà nước Việt Nam quy định về việc cấp Giấy phép và tổ chức, hoạt động của ngân hàng thương mại,\nchi nhánh ngân hàng nước ngoài, văn phòng đại diện của tổ chức tín dụng nước ngoài, tổ chức nước ngoài khác có hoạt động ngân hàng tại Việt Nam 1. Sửa đổi, bổ sung khoản 5 và khoản 13 Điều 2 như sau:\n“5.\nNgân hàng liên doanh là ngân hàng thương mại được thành lập tại Việt Nam, bằng vốn góp của Bên Việt Nam (gồm tối thiểu một ngân hàng Việt Nam và tối\nđa một doanh nghiệp Việt Nam không phải ngân hàng) và Bên nước ngoài (gồm tối thiểu một ngân hàng nước ngoài và tối đa một doanh nghiệp nước ngoài không phải ngân hàng) trên cơ sở hợp đồng liên doanh; là pháp nhân Việt Nam, có trụ sở\nchính tại Việt Nam. Ngân hàng liên doanh được thành lập, tổ chức dưới hình thức công ty trách nhiệm hữu hạn hai thành viên trở lên nhưng không quá 05 thành viên, trong đó một thành viên và người có liên quan không được sở hữu vượt quá\n50% vốn điều lệ.”\n“13.\nThành viên góp vốn là ngân hàng, doanh nghiệp không phải ngân hàng góp vốn vào ngân hàng liên doanh; là tổ chức tín dụng nước ngoài góp vốn vào ngân hàng 100% vốn nước ngoài.”\n2. Sửa đổi, bổ sung điểm b(iii) và điểm b(vi) khoản 3 Điều 15 như sau:\n“(iii) Giấy phép thành lập hoặc chứng nhận đăng ký kinh doanh hoặc văn bản tương đương (trừ doanh nghiệp Việt Nam);”\n“(vi) Bản sao hộ chiếu của người đại diện theo pháp luật và người đại diện vốn góp của tổ chức tại ngân hàng (đối với người không có quốc tịch Việt Nam);”\n3. Bổ sung điểm b(iii) vào điểm b khoản 3 Điều 31 như sau:\n“(iii) Đối tác mới là doanh nghiệp không phải ngân hàng phải đáp ứng các điều kiện sau:\n- Được thành lập theo pháp luật Việt Nam hoặc pháp luật nước ngoài;\n- Trường hợp là doanh nghiệp Nhà nước, phải được cấp có thẩm quyền chấp thuận bằng văn bản cho phép tham gia góp vốn vào ngân hàng liên doanh theo quy định của pháp luật;\n- Trường hợp là doanh nghiệp được cấp Giấy phép thành lập và hoạt động trong lĩnh vực ngân hàng, chứng khoán, bảo hiểm, phải tuân thủ việc góp vốn theo các quy định liên quan của pháp luật;\n- Có vốn chủ sở hữu tối thiểu 1.000 tỷ đồng, tổng tài sản tối thiểu 2.000 tỷ đồng trong 03 năm liền kề năm nộp hồ sơ đề nghị chấp thuận mua bán, chuyển nhượng phần vốn góp đối với phần vốn góp từ trên 1% đến dưới 5% vốn điều lệ của ngân hàng liên doanh hoặc có vốn chủ sở hữu tối thiểu 200 tỷ đồng, tổng tài sản tối thiểu 400 tỷ đồng trong 03 năm liền kề năm nộp hồ\nsơ đề nghị chấp thuận mua bán, chuyển nhượng phần vốn góp đối với phần vốn góp từ 1% vốn điều lệ trở xuống của ngân hàng liên doanh;\n- Đối với doanh nghiệp hoạt động trong ngành nghề\nkinh doanh có yêu cầu vốn pháp định, phải đảm bảo vốn chủ sở hữu trừ đi vốn pháp định tối thiểu bằng số vốn góp cam kết theo số liệu từ báo cáo tài chính\nđã được kiểm toán độc lập và không có ý kiến ngoại trừ của đơn vị kiểm toán của năm liền kề năm nộp hồ sơ đề nghị chấp thuận mua bán, chuyển nhượng phần vốn góp;\n- Kinh doanh có lãi trong 03 năm liền kề năm nộp hồ\nsơ đề nghị chấp thuận mua bán, chuyển nhượng phần vốn góp;\n- Không được dùng vốn huy động, vốn vay của tổ chức,\ncá nhân khác để góp vốn;\n- Thực hiện đầy đủ các nghĩa vụ về thuế và bảo hiểm xã hội theo quy định đến thời điểm nộp hồ sơ đề nghị chấp thuận mua bán, chuyển nhượng phần vốn góp;\n- Không phải là cổ đông sáng lập, chủ sở hữu, thành viên sáng lập, cổ đông chiến lược của tổ chức tín dụng khác được thành lập và\nhoạt động tại Việt Nam.”\n4. Thay thế Phụ lục 02a, Phụ lục 03, Phụ lục 04, Phụ lục 05a, Phụ lục 05b, Phụ lục 07 bằng Phụ lục 02a, Phụ lục 03,\nPhụ lục 04, Phụ lục 05a,\nPhụ lục 05b, Phụ lục 07 ban hành kèm theo Thông tư này.\nĐiều 2. Bổ sung một số điều của Thông tư số 50/2018/TT-NHNN ngày 31 tháng 12 năm 2018 của Thống đốc Ngân hàng Nhà nước Việt Nam quy định về hồ sơ, trình tự, thủ tục chấp thuận một số nội dung thay đổi của ngân hàng thương mại, chi nhánh ngân hàng nước ngoài 1. Bổ sung điểm b(iii) vào điểm b khoản 2 Điều 16 như sau:\n“(iii) Đối với bên mua, nhận chuyển nhượng là doanh nghiệp không phải ngân hàng, hồ sơ bao gồm:\n- Giấy phép thành lập hoặc chứng nhận đăng ký doanh nghiệp hoặc văn bản tương đương (trừ doanh nghiệp Việt Nam);\n- Văn bản ủy quyền người đại diện vốn góp tại ngân hàng theo quy định của pháp luật;\n- Bản sao hộ chiếu của người đại diện theo pháp luật và người đại diện vốn góp của doanh nghiệp tại ngân hàng (đối với người không có quốc tịch Việt Nam);\n- Văn bản của cấp có\nthẩm quyền chấp thuận cho doanh nghiệp được tham gia góp vốn vào ngân hàng;\n- Báo cáo về việc\nđáp ứng các điều kiện đối với đối tác mới là doanh nghiệp không phải ngân hàng khi nhận chuyển nhượng phần vốn góp của ngân hàng liên doanh theo quy định của Ngân hàng Nhà nước về việc cấp Giấy phép và tổ chức, hoạt động của ngân hàng thương mại, chi nhánh ngân hàng nước ngoài, văn phòng đại diện của tổ chức tín dụng nước ngoài, tổ chức nước ngoài khác có hoạt động ngân hàng tại Việt Nam;\n- Báo cáo tài chính 03 năm liền kề trước năm nộp hồ sơ đề nghị chấp thuận mua bán, chuyển nhượng phần vốn góp đã được kiểm toán độc lập và không có ý kiến ngoại trừ của đơn vị kiểm toán;\n- Báo cáo khả năng tài chính tham gia góp vốn ngân hàng liên doanh của doanh nghiệp không phải ngân hàng theo mẫu quy định tại Phụ lục 01 ban hành kèm theo Thông tư này;\n- Bảng kê khai thông tin về lịch sử quan hệ tín dụng của doanh nghiệp theo mẫu quy định tại Phụ lục 02 ban hành kèm theo Thông tư này;\n- Văn bản của cơ\nquan thuế, cơ quan bảo hiểm xã hội xác nhận về việc thực hiện đầy đủ các nghĩa vụ thuế, bảo hiểm xã hội của doanh nghiệp;\n- Văn bản cam kết không phải là cổ đông sáng lập,\nchủ sở hữu, thành viên sáng lập, cổ đông chiến lược của tổ chức tín dụng khác\nđược thành lập và hoạt động tại Việt Nam.”\n2. Bổ sung Phụ lục 01, Phụ lục 02 ban hành kèm theo Thông tư này vào Thông tư số\n50/2018/TT-NHNN .\nĐiều 3. Trách nhiệm tổ chức thực hiện Chánh Văn phòng, Chánh Thanh tra, giám sát ngân hàng, Thủ trưởng các đơn vị thuộc Ngân hàng Nhà nước, ngân hàng thương mại, chi nhánh ngân hàng nước ngoài, văn phòng đại diện của tổ chức tín dụng nước ngoài,\ntổ chức nước ngoài khác có hoạt động ngân hàng và các tổ chức, cá nhân có liên quan chịu trách nhiệm tổ chức thực hiện Thông tư này.\nĐiều 4. Điều khoản thi hành 1. Thông tư này có hiệu lực thi hành từ ngày 14 tháng 12 năm 2023.\n2. Bãi bỏ khoản 9, khoản 19 Điều 1 và khoản 3 Điều 2 Thông tư số 28/2018/TT-NHNN ngày 30 tháng 11 năm 2018 của Thống đốc Ngân hàng Nhà nước Việt Nam sửa đổi, bổ sung một số điều của Thông tư số 40/2011/TT-NHNN ./.\nNơi nhận:\n - Như Điều 3;\n - Ban lãnh đạo NHNN;\n - Văn phòng Chính phủ;\n - Bộ Tư pháp (để kiểm tra);\n - Công báo;\n - Lưu: VP, PC, TTGSNH6 (03 bản).\nKT. THỐNG ĐỐC PHÓ THỐNG ĐỐC\nĐoàn Thái Sơn PHỤ LỤC 01 MẪU BÁO CÁO KHẢ\nNĂNG TÀI CHÍNH THAM GIA GÓP VỐN NGÂN HÀNG LIÊN DOANH CỦA DOANH NGHIỆP KHÔNG PHẢI NGÂN HÀNG\n(Ban hành kèm theo Thông tư số\n13/2023/TT-NHNN ngày 31/10/2023 của Thống đốc Ngân hàng Nhà nước Việt Nam)\nCỘNG HÒA XÃ HỘI CHỦ NGHĨA VIỆT NAM\nĐộc lập - Tự do - Hạnh phúc \n---------------\nKính gửi: Ngân hàng liên doanh………………………………\n1. Thông tin về doanh nghiệp:\n- Tên doanh nghiệp (tên đầy\nđủ và chính thức, ghi bằng chữ in hoa):\n- Số Giấy phép thành lập hoặc đăng ký doanh nghiệp hoặc văn bản tương đương, cơ quan cấp, ngày cấp:\n- Vốn điều lệ:\n- Địa chỉ trụ sở chính:\n- Số điện thoại:\n Số\nFax: \n- Tên người đại diện theo pháp luật:\n- Ngày tháng năm sinh:\n- Số chứng minh nhân dân hoặc số thẻ căn cước công dân, số định danh cá nhân; nơi ở hiện tại (trường hợp khác nơi đăng ký thường trú) (đối với người có quốc tịch Việt Nam):\n- Số hộ chiếu, ngày cấp,\nnơi cấp; quốc tịch (quốc tịch gốc, các quốc tịch hiện nay); nơi ở hiện tại (đối với người không có quốc tịch Việt Nam):\n2. Khả năng về tài chính để tham gia góp vốn vào Ngân hàng liên doanh: \n- Vốn chủ sở hữu (A):\n- Tài sản dài hạn trừ đi Nợ dài hạn dùng để đầu tư tài sản dài hạn (B):\n- Khả năng về tài chính để\ntham gia góp vốn vào Ngân hàng liên doanh (C = A - B):\n(Trường hợp doanh nghiệp hoạt động trong ngành nghề kinh doanh có yêu cầu vốn pháp định cần kê khai thêm các thông tin dưới đây)\n- Mức vốn pháp định theo yêu cầu của pháp luật hiện hành áp dụng đối với ngành nghề mà doanh nghiệp đang hoạt động (trường hợp doanh nghiệp hoạt động đa ngành thì kê khai mức vốn pháp định cao nhất) (D):\n- Vốn chủ sở hữu trừ mức vốn pháp định (E = A - D):\nKết luận: Đủ khả năng tài chính tham gia góp vốn vào Ngân hàng liên doanh (chỉ kết luận này khi C và E tối thiểu bằng mức vốn cam kết góp của doanh nghiệp).\n3. Cam kết\n- Không sử dụng vốn huy động,\nvốn vay của các tổ chức, cá nhân khác để góp vốn; Chịu trách nhiệm trước pháp luật về tính hợp pháp của nguồn vốn góp;\n- Tuân thủ các quy định tại\nĐiều lệ tổ chức và hoạt động ngân hàng, các quy định nội bộ của ngân hàng và\ncác quy định của pháp luật có liên quan;\n- Hoàn toàn chịu trách nhiệm về tính trung thực, chính xác của những hồ sơ gửi kèm (nếu có).\n…, ngày … tháng … năm …\n Người đại diện hợp pháp của doanh nghiệp\n (Ký, ghi rõ họ tên, chức vụ và đóng dấu)\nGhi chú: Vốn chủ sở hữu, Tài sản dài hạn, Nợ dài hạn dùng để đầu tư\ntài sản dài hạn lấy theo báo cáo tài chính năm liền kề năm nộp hồ sơ đề nghị chấp thuận mua bán, chuyển nhượng phần vốn góp đã được kiểm toán độc lập và không có ý\nkiến ngoại trừ của đơn vị kiểm toán.\nPHỤ LỤC 02 MẪU BẢNG KÊ KHAI THÔNG TIN VỀ\nLỊCH SỬ QUAN HỆ TÍN DỤNG CỦA DOANH NGHIỆP\n (Ban hành kèm theo Thông tư số 13/2023/TT-NHNN ngày 31/10/2023 của Thống\nđốc Ngân hàng Nhà nước Việt Nam)\nCỘNG HÒA XÃ HỘI CHỦ NGHĨA VIỆT NAM\nĐộc lập - Tự do - Hạnh phúc\n---------------\nBẢNG KÊ KHAI THÔNG TIN VỀ LỊCH SỬ QUAN HỆ TÍN DỤNG CỦA DOANH NGHIỆP 1. Tên doanh nghiệp:\n2. Mã số thuế:\n3. Lĩnh vực kinh doanh:\n4. Thông tin về lịch sử\nquan hệ tín dụng:\n- Tên tổ chức tín dụng,\nchi nhánh ngân hàng nước ngoài:\n- Địa chỉ:\n- Số Giấy phép thành lập hoặc số Giấy chứng nhận đăng ký doanh nghiệp hoặc văn bản tương đương, cơ quan cấp, ngày cấp:\n- Tiền gửi tại tổ chức tín dụng, chi nhánh ngân hàng nước ngoài tại thời điểm kê khai:\n- Dư nợ tín dụng tại tổ\nchức tín dụng, chi nhánh ngân hàng nước ngoài tại thời điểm kê khai:\n- Dư nợ quá hạn tại thời điểm kê khai:\n- Nợ xấu tại tổ chức tín dụng, chi nhánh ngân hàng nước ngoài:\n+ Thời điểm (Ghi rõ\ntháng, năm):\n+ Thực trạng xử lý nợ xấu\n(Ghi rõ đến thời điểm kê khai đã xử lý như thế nào):\n5. Cam kết hoàn toàn chịu trách nhiệm về tính trung thực, chính xác của bảng kê khai.\n…, ngày … tháng … năm Người đại diện hợp pháp của doanh nghiệp\n (Ký, ghi rõ họ tên, chức vụ và đóng dấu)\nPHỤ LỤC 02a MẪU ĐƠN ĐỀ NGHỊ CẤP GIẤY PHÉP THÀNH LẬP VÀ HOẠT ĐỘNG NGÂN HÀNG THƯƠNG MẠI\n(Ban hành kèm theo Thông tư số 13/2023/TT-NHNN ngày 31/10/2023 của Thống đốc Ngân hàng Nhà nước Việt Nam)\nCỘNG HÒA XÃ HỘI CHỦ NGHĨA VIỆT NAM\nĐộc lập - Tự do - Hạnh phúc\n--------------- \nĐƠN ĐỀ NGHỊ CẤP GIẤY PHÉP THÀNH LẬP VÀ HOẠT ĐỘNG NGÂN HÀNG Kính gửi: Thống đốc Ngân hàng Nhà nước Căn cứ Luật Ngân hàng Nhà\nnước Việt Nam số 46/2010/QH12 ngày 16 tháng 6 năm 2010;\nCăn cứ Luật các tổ chức tín dụng số 47/2010/QH12 ngày 16 tháng 6 năm 2010 (đã được sửa đổi, bổ sung);\nCăn cứ Thông tư số\n40/2011/TT-NHNN của Thống đốc Ngân hàng Nhà nước quy định về việc cấp Giấy phép và tổ chức, hoạt động của ngân hàng thương mại, chi nhánh ngân hàng nước ngoài,\nvăn phòng đại diện của tổ chức tín dụng nước ngoài, tổ chức nước ngoài khác có\nhoạt động ngân hàng tại Việt Nam (đã được sửa đổi, bổ sung);\nCăn cứ Biên bản cuộc họp cổ đông sáng lập, thành viên sáng lập hoặc văn bản của chủ sở hữu là ngân hàng\n… (đối với ngân hàng 100% vốn nước ngoài là công ty trách nhiệm hữu hạn một thành viên) ngày … tháng … năm … về việc thành lập Ngân hàng…;\nNay, các cổ đông sáng lập,\nthành viên sáng lập của Ngân hàng … thay mặt các cổ đông (thành viên) góp vốn thành lập hoặc chủ sở hữu là ngân hàng… đề nghị Thống đốc Ngân hàng Nhà nước xem xét cấp Giấy phép thành lập và hoạt động Ngân hàng thương mại với các nội dung sau đây:\n1. Tên của Ngân hàng:\n- Tên đầy đủ bằng tiếng Việt:\n- Tên đầy đủ bằng tiếng Anh:\n2. Tên tỉnh, thành phố\nnơi dự kiến đặt trụ sở chính:\n3. Nội dung hoạt động:\n4. Thời gian hoạt động:\n5. Vốn điều lệ: …đồng (bằng chữ…), trong đó tỷ lệ góp vốn của các cổ đông (thành viên) sáng lập như sau:\nSTT Tên tổ chức, cá nhân Số GP hoặc số đăng ký kinh doanh hoặc số chứng minh nhân dân hoặc số thẻ căn cước công dân, số định danh cá nhân, số hộ chiếu Số điện thoại Giá trị vốn góp Tỷ lệ vốn góp 1\nCông ty A 2\nNguyễn Văn B 3\n6. Danh sách dự kiến những người được bầu, bổ nhiệm làm thành viên Hội đồng quản trị, Hội đồng thành viên,\nthành viên Ban kiểm soát và Tổng giám đốc (Giám đốc) của ngân hàng thương mại\n(nêu rõ họ, tên và các chức danh đề nghị chấp thuận của từng thành viên).\nChúng tôi xin cam kết:\n- Chịu trách nhiệm trước pháp luật về tính chính xác, trung thực của nội dung trong đơn, hồ sơ đề nghị cấp Giấy phép.\n- Thực hiện đăng ký kinh doanh, đăng ký ngày khai trương và công bố thông tin theo quy định của pháp luật.\n- Chấp hành nghiêm chỉnh các quy định của pháp luật, của Ngân hàng Nhà nước và Điều lệ tổ chức và hoạt động ngân hàng.\n…, ngày… tháng… năm ...\nCác cổ đông sáng lập, thành viên sáng lập, chủ sở hữu Ngân hàng…\n(Cổ đông sáng lập là cá nhân ký và ghi đầy đủ họ và tên, Cổ\nđông sáng lập, thành viên sáng lập, chủ sở hữu là tổ chức do người đại diện theo pháp luật ký, đóng dấu và ghi đầy đủ họ tên)\nPHỤ LỤC 03 MẪU SƠ YẾU LÝ LỊCH TỰ KHAI\n(Ban hành kèm theo Thông tư số 13/2023/TT-NHNN ngày 31/10/2023 của Thống đốc Ngân hàng Nhà nước Việt Nam)\nCỘNG HÒA XÃ HỘI CHỦ NGHĨA VIỆT NAM\nĐộc lập - Tự do - Hạnh phúc\n---------------\nSƠ YẾU LÝ LỊCH\nẢnh hộ chiếu\n (4x6)\n1. Thông tin cá nhân\n- Họ và tên:\n- Ngày tháng năm sinh:\n- Nơi sinh:\n- Số chứng minh nhân dân hoặc số thẻ căn cước công dân, số định danh cá nhân; nơi ở hiện tại (trường hợp khác nơi đăng ký thường trú) (đối với người có quốc tịch Việt Nam):\n- Số hộ chiếu, ngày cấp,\nnơi cấp; quốc tịch (quốc tịch gốc, các quốc tịch hiện nay); nơi ở hiện tại (đối với người không có quốc tịch Việt Nam):\n- Tên và địa chỉ pháp nhân mà mình đại diện (trường hợp là người đại diện của pháp nhân):\n2. Trình độ học vấn Tên trường; tên thành phố,\nquốc gia nơi trường đặt trụ sở chính; tên khóa học; thời gian học; tên bằng (liệt kê những bằng cấp, chương trình đào tạo liên quan đến tiêu chuẩn, điều kiện của chức danh được bầu, bổ nhiệm)\n3. Quá trình công tác\n- Quá trình công tác, nghề\nnghiệp và chức vụ đã qua (từ năm 18 tuổi đến nay), làm gì, ở đâu, tóm tắt đặc điểm chính.\n- Chức vụ hiện nay đang nắm giữ tại ngân hàng và các tổ chức khác.\n- Đơn vị công tác; chức vụ;\ncác trách nhiệm chính (liệt kê các đơn vị công tác và chức danh nắm giữ tại các\nđơn vị này đảm bảo tính liên tục về mặt thời gian).\n- Khen thưởng, kỷ luật (nếu có).\n4. Phần vốn góp, cổ phần dự kiến sở hữu (trường hợp cổ đông là cá nhân) hoặc dự kiến được ủy quyền, ủy thác đứng tên (trường hợp là người đại diện của pháp nhân).\n5. Mối quan hệ (nếu là cổ\nđông sáng lập, người dự kiến được bầu, bổ nhiệm làm người quản lý, điều hành và\nmột số chức danh khác của ngân hàng thương mại):\nKê khai mối quan hệ với người có liên quan.\n6. Tôi,…………………. xin cam kết những lời khai trên là đúng sự thật. Tôi xin chịu hoàn toàn trách nhiệm đối với bất kỳ thông tin nào không đúng với sự thật tại bản khai này.\nXác nhận của cấp có thẩm quyền của đơn vị công tác hoặc chính quyền nơi cư trú\n…, ngày … tháng … năm….\n Người khai\n (Ký và ghi rõ họ và tên)\nPHỤ LỤC 04 MẪU DANH SÁCH CÁC CỔ ĐÔNG GÓP VỐN THÀNH LẬP NGÂN HÀNG THƯƠNG MẠI CỔ PHẦN\n(Ban hành kèm theo Thông tư số 13/2023/TT-NHNN ngày 31/10/2023 của Thống đốc Ngân hàng Nhà nước Việt Nam)\nDANH SÁCH CỔ ĐÔNG GÓP VỐN THÀNH LẬP NGÂN HÀNG…\nSTT Thông tin về tổ chức, cá nhân Số điện thoại Giá trị vốn góp Số cổ phần Loại cổ phần Tỷ lệ vốn góp I. Cổ đông sáng lập:\nTổ chức 1\nCông ty A 2\nCá nhân 3\nNguyễn Văn A 4\nII. Cổ đông góp vốn khác Tổ chức 5\nCông ty B 6\nCá nhân 7\nNguyễn Văn B 8\nTrưởng Ban trù bị\n (Ký và ghi rõ họ tên)\nHƯỚNG DẪN KÊ KHAI 1. Thông tin về tổ chức bao gồm:\na) Thông tin về tổ chức:\n- Tên tổ chức:\n- Địa điểm đặt trụ sở\nchính:\n- Số Giấy phép thành lập hoặc đăng ký kinh doanh hoặc văn bản tương đương, cơ quan cấp, ngày cấp:\nb) Thông tin về người đại diện vốn góp:\n- Họ và tên:\n- Ngày tháng năm sinh:\n- Số chứng minh nhân dân hoặc số thẻ căn cước công dân, số định danh cá nhân; nơi ở hiện tại (trường hợp khác nơi đăng ký thường trú) (đối với người có quốc tịch Việt Nam):\n- Số hộ chiếu, ngày cấp,\nnơi cấp; quốc tịch (quốc tịch gốc, các quốc tịch hiện nay); nơi ở hiện tại (đối với người không có quốc tịch Việt Nam):\n2. Thông tin về cá nhân bao gồm:\n- Họ và tên:\n- Ngày tháng năm sinh:\n- Số chứng minh nhân dân hoặc số thẻ căn cước công dân, số định danh cá nhân; nơi ở hiện tại (trường hợp khác nơi đăng ký thường trú) (đối với người có quốc tịch Việt Nam):\n- Số hộ chiếu, ngày cấp,\nnơi cấp; quốc tịch (quốc tịch gốc, các quốc tịch hiện nay); nơi ở hiện tại (đối với người không có quốc tịch Việt Nam):\nPHỤ LỤC 05a MẪU ĐƠN MUA CỔ PHẦN ĐỐI VỚI CÁ NHÂN\n(Ban hành kèm theo Thông tư số 13/2023/TT-NHNN ngày 31/10/2023 của Thống đốc Ngân hàng Nhà nước Việt Nam)\nCỘNG HÒA XÃ HỘI CHỦ NGHĨA VIỆT NAM\nĐộc lập - Tự do - Hạnh phúc\n---------------\n…, ngày … tháng … năm .......\nĐƠN MUA CỔ PHẦN Kính gửi: Ban trù bị thành lập Ngân hàng…\n1. Cá nhân đề nghị mua cổ\nphần:\n- Họ và tên (tên đầy đủ\nvà chính thức, ghi bằng chữ in hoa):\n- Ngày tháng năm sinh:\n- Số chứng minh nhân dân hoặc số thẻ căn cước công dân, số định danh cá nhân; nơi ở hiện tại (trường hợp khác nơi đăng ký thường trú) (đối với người có quốc tịch Việt Nam):\n- Số hộ chiếu, ngày cấp,\nnơi cấp; quốc tịch (quốc tịch gốc, các quốc tịch hiện nay); nơi ở hiện tại (đối với người không có quốc tịch Việt Nam):\n- Nơi công tác và chức vụ\nhiện tại:\n- Số điện thoại:\n2. Nội dung đăng ký mua cổ\nphần:\n- Số lượng cổ phần đăng ký mua, loại cổ phần, giá trị, tỷ lệ sở hữu so với vốn điều lệ:\n- Thời gian nộp tiền:\n3. Tình hình góp vốn, mua cổ phần tại các tổ chức khác:\n- Tên tổ chức tín dụng,\ndoanh nghiệp mà cá nhân đang có vốn góp:\n- Số vốn đã góp và tỷ lệ\nso với tổng vốn điều lệ của tổ chức tín dụng, doanh nghiệp đó:\n4. Cam kết:\nSau khi nghiên cứu Điều lệ\nngân hàng và các quy định của pháp luật có liên quan, tôi xin cam kết:\na) Mua đủ số cổ phần và\ngóp đúng thời hạn đã đăng ký;\nb) Không sử dụng vốn huy\nđộng, vốn vay của các tổ chức, cá nhân khác để góp vốn; Chịu trách nhiệm trước pháp luật về tính hợp pháp của nguồn vốn góp thành lập ngân hàng;\nc) Tuân thủ các quy định tại Điều lệ ngân hàng, các quy định nội bộ của ngân hàng và các quy định của pháp luật có liên quan;\nd) Hoàn toàn chịu trách nhiệm về tính trung thực, chính xác của những hồ sơ gửi kèm (nếu có).\nNgười mua cổ phần\n (Ký và ghi rõ họ tên)\nPHỤ LỤC 05b MẪU ĐƠN MUA CỔ PHẦN ĐỐI VỚI TỔ\nCHỨC\n(Ban hành kèm theo Thông tư số 13/2023/TT-NHNN ngày 31/10/2023 của Thống đốc Ngân hàng Nhà nước Việt Nam)\nCỘNG HÒA XÃ HỘI CHỦ NGHĨA VIỆT NAM\nĐộc lập - Tự do - Hạnh phúc\n---------------\n…, ngày … tháng … năm ....\nĐƠN MUA CỔ PHẦN Kính gửi: Ban trù bị thành lập Ngân hàng…\n1. Tổ chức đề nghị mua cổ\nphần:\n- Tên tổ chức (tên đầy đủ\nvà chính thức, ghi bằng chữ in hoa):\n- Số Quyết định thành lập hoặc số đăng ký kinh doanh, cơ quan cấp, ngày cấp:\n- Vốn điều lệ:\n- Địa chỉ trụ sở chính:\n- Số điện thoại:\n Số\nFax: \n2. Người đại diện theo pháp luật:\n- Họ và tên:\n- Ngày tháng năm sinh:\n- Chức vụ đang nắm giữ tại tổ chức:\n- Số chứng minh nhân dân hoặc số thẻ căn cước công dân, số định danh cá nhân; nơi ở hiện tại (trường hợp khác nơi đăng ký thường trú) (đối với người có quốc tịch Việt Nam):\n- Số hộ chiếu, ngày cấp,\nnơi cấp; quốc tịch (quốc tịch gốc, các quốc tịch hiện nay); nơi ở hiện tại (đối với người không có quốc tịch Việt Nam):\n3. Người được cử làm đại diện ủy quyền của tổ chức tại ngân hàng thương mại cổ phần:\n- Họ và tên:\n- Ngày tháng năm sinh:\n- Nơi công tác và chức vụ\nhiện tại:\n- Mối liên hệ với tổ chức\n(trong trường hợp không làm việc cho tổ chức đó):\n- Số chứng minh nhân dân hoặc số thẻ căn cước công dân, số định danh cá nhân; nơi ở hiện tại (trường hợp khác nơi đăng ký thường trú) (đối với người có quốc tịch Việt Nam):\n- Số hộ chiếu, ngày cấp,\nnơi cấp; quốc tịch (quốc tịch gốc, các quốc tịch hiện nay); nơi ở hiện tại (đối với người không có quốc tịch Việt Nam):\n4. Nội dung đăng ký mua cổ\nphần:\n- Số lượng cổ phần đăng ký mua, loại cổ phần, giá trị, tỷ lệ sở hữu so với vốn điều lệ:\n- Thời gian nộp tiền:\n5. Tình hình góp vốn, mua cổ phần tại các tổ chức khác:\n- Tên tổ chức tín dụng,\ndoanh nghiệp mà tổ chức đang có vốn góp:\n- Số vốn đã góp và tỷ lệ\nso với tổng vốn điều lệ của tổ chức tín dụng, doanh nghiệp đó:\n6. Cam kết:\nSau khi nghiên cứu Điều lệ\nngân hàng và các quy định của pháp luật có liên quan, chúng tôi xin cam kết:\na) Mua đủ số cổ phần và\ngóp đúng thời hạn đã đăng ký;\nb) Không sử dụng vốn huy\nđộng, vốn vay của các tổ chức, cá nhân khác để góp vốn; Chịu trách nhiệm trước pháp luật về tính hợp pháp của nguồn vốn góp thành lập ngân hàng;\nc) Tuân thủ các quy định tại Điều lệ ngân hàng, các quy định nội bộ của ngân hàng và các quy định của pháp luật có liên quan;\nd) Hoàn toàn chịu trách nhiệm về tính trung thực, chính xác của những hồ sơ gửi kèm (nếu có).\nNgười đại diện theo pháp luật của tổ chức\n (Ký và ghi rõ họ tên, chức vụ và đóng dấu)\nPHỤ LỤC 07 MẪU BẢN KÊ KHAI TÀI SẢN, THU NHẬP CỦA CỔ ĐÔNG SÁNG LẬP LÀ CÁ NHÂN CỦA NGÂN HÀNG THƯƠNG MẠI CỔ PHẦN\n(Ban hành kèm theo Thông tư số 13/2023/TT-NHNN ngày 31/10/2023 của Thống đốc Ngân hàng Nhà nước Việt Nam)\nCỘNG HÒA XÃ HỘI CHỦ NGHĨA VIỆT NAM\nĐộc lập - Tự do - Hạnh phúc\n---------------\nBẢNG KÊ KHAI TÀI SẢN Kính gửi: Ngân hàng Nhà nước Việt Nam\n- Họ và tên Người kê khai tài sản: ……………………\n- Ngày tháng năm sinh:\n………………………………………….\n- Số chứng minh nhân dân hoặc số thẻ căn cước công dân, số định danh cá nhân hoặc số hộ chiếu; nơi ở hiện tại (trường hợp khác nơi đăng ký thường trú):\n- Cơ quan/đơn vị công tác hoặc nơi làm việc: ……………………..\nTT Loại tài sản Thông tin mô tả về tài sản Nhà, công trình xây dựng\n- Số lượng: ………..cái 1.1. Nhà thứ nhất:\n + Loại nhà:………..\n + Diện tích đất:…………m2\n + Diện tích đất xây dựng:\n ……m2\n + Diện tích sử dụng:\n …………m2\n + Địa chỉ:……………………………………\n (Đính kèm bản sao có chứng thực giấy chủ quyền theo quy định của pháp luật)\n + Trị giá ngôi nhà và đất theo giá thị trường:………………..\n 1.2. Nhà thứ hai:\n + Loại nhà:………..\n + Diện tích đất: ………m2\n + Diện tích đất xây dựng:\n ……m2\n + Diện tích sử dụng:\n …………m2\n + Địa chỉ:……………………………………\n (Đính kèm bản sao có chứng thực giấy chủ quyền theo quy định của pháp luật)\n + Trị giá ngôi nhà và đất theo giá thị trường:………………..\n 1.3. Nhà thứ …:\nQuyền sử dụng đất\n- Số lượng: ……thửa 2.1. Thửa thứ nhất:\n + Loại đất:………..\n + Diện tích:………..m2\n + Địa chỉ:………………\n (Đính kèm bản sao có chứng thực giấy chứng nhận QSD đất theo quy định của pháp luật)\n + Trị giá thửa đất theo giá thị trường: ……..\n 2.2. Thửa thứ hai:\n + Loại đất:………..\n + Diện tích:………..m2\n + Địa chỉ:………………\n (Đính kèm bản sao có chứng thực giấy chứng nhận QSD đất theo quy định của pháp luật)\n + Trị giá thửa đất theo giá thị trường: ……..\n 2.3. Thửa thứ: …..;\nTài sản ở nước ngoài\n- Động sản:\n (Đính kèm bản sao có chứng thực giấy tờ liên quan)\n + Tên: ………………………………\n + Số lượng: ……………\n + Trị giá theo giá thị\n trường: ………….\n - Bất động sản:\n …………………………\n (Đính kèm bản sao có chứng thực giấy tờ liên quan)\n + Tên: …………………..\n + Địa chỉ: ……………….\n + Trị giá theo giá thị\n trường: ……………….\nTài khoản ở nước ngoài\n(Đính kèm bản sao có chứng thực giấy tờ liên quan)\n - Ngân hàng mở tài khoản:……….\n - Số dư tài khoản vào thời điểm kê khai:…….\nMô tô, ô tô, tàu, thuyền có giá trị từ 100 triệu đồng trở lên\n(Đính kèm bản sao có chứng thực giấy đăng ký của cơ quan chức năng)\n - Chủng loại, nhãn hiệu:\n …………\n - Số lượng: ………………..\n - Tổng giá trị theo giá\n thị trường: ………………\nKim khí quý, đá quý có\n giá trị từ 100 triệu đồng trở lên\n(Đính kèm bản sao có chứng thực giấy tờ liên quan nếu có)\n - Tổng giá trị ước tính: ……………\nTiền, sổ tiết kiệm, cổ\n phiếu, trái phiếu, các công cụ chuyển nhượng khác có giá trị từ 100 triệu đồng trở lên Tiền mặt:\n Tổng giá trị:………………..\nTiền gửi tại ngân hàng,\n tổ chức tín dụng (tài khoản, sổ tiết kiệm, sổ tín dụng…):\n (Đính kèm bản sao có chứng thực của ngân hàng)\n Tổng giá trị:………\n Cổ phiếu:\n (Đính kèm bản sao có chứng thực của công ty phát hành hoặc công ty chứng khoán)\n Tổng giá trị theo mệnh giá…………\n Tổng giá trị theo giá thị\n trường (Sàn giao dịch, OTC): ……….\nTrái phiếu:\n (Đính kèm bản sao có chứng thực của cơ quan phát hành hoặc công ty chứng khoán)\n Tổng giá trị theo mệnh giá…………\n Tổng giá trị theo giá\n thị trường (Sàn giao dịch, OTC):…………\nCác công cụ chuyển nhượng khác:\n Tổng giá trị theo mệnh giá…………\n Tổng giá trị theo giá\n thị trường:………….\nTài sản khác có giá trị\n từ 100 triệu đồng trở lên\n(Đính kèm bản sao có chứng thực giấy tờ liên quan)\n - Tên:…\n - Số lượng: …\n - Tổng giá trị ước tính: ………….\nTôi cam kết Bản tự kê khai tài sản trên đây là trung thực, đầy đủ. Nếu khai man, tôi xin hoàn toàn chịu trách nhiệm trước pháp luật.\n……, ngày … tháng … năm …\n Người kê khai tài sản, thu nhập\n (Ký, ghi rõ họ tên)\nHƯỚNG DẪN KÊ KHAI THEO MẪU 1. Đối với phần kê khai về\nnhà, công trình xây dựng khác:\n- Không phải kê khai nhà\ncông vụ\n- Nhà, công trình xây dựng phải kê khai gồm: nhà ở, nhà xưởng, nhà hàng, câu lạc bộ, các công trình xây dựng khác….\n- Nhà, công trình xây dựng tiếp theo (nếu có) thì kê khai như nhà, công trình xây dựng thứ nhất, thứ hai.\n2. Đối với phần kê khai 5, 6, 7, 8:\nChỉ kê khai nếu tổng giá\ntrị của mỗi loại tài sản từ 100 triệu đồng trở lên. Ví dụ: có 3 xe máy, nếu tổng giá trị của 3 xe máy từ 100 triệu đồng trở lên thì phải kê khai, nếu tổng giá\ntrị của 3 xe máy dưới 100 triệu đồng thì không phải kê khai.\n3. Đối với tài sản chung theo phần:\nKê khai rõ được phần thuộc sở hữu của người kê khai, giá trị ước tính của phần tài sản đó."
}