{
  "url": "https://thuvienphapluat.vn/van-ban/Linh-vuc-khac/Thong-tu-10-2023-TT-BKHCN-sua-doi-Thong-tu-26-2019-TT-BKHCN-570741.aspx",
  "title": "Thông tư 10/2023/TT-BKHCN sửa đổi Thông tư 26/2019/TT-BKHCN mới nhất",
  "properties": {
    "Số hiệu": "10/2023/TT-BKHCN",
    "Loại văn bản": "Thông tư",
    "Nơi ban hành": "Bộ Khoa học và Công nghệ",
    "Người ký": "Lê Xuân Định",
    "Ngày ban hành": "01/06/2023",
    "Ngày hiệu lực": "Đã biết",
    "Ngày công báo": "Đã biết",
    "Số công báo": "Đã biết",
    "Tình trạng": "Đã biết"
  },
  "content": "BỘ\n KHOA HỌC VÀ \n CÔNG NGHỆ\n -------\nCỘNG HÒA XÃ HỘI CHỦ NGHĨA VIỆT NAM\n Độc lập - Tự do - Hạnh phúc \n ---------------\nSố:\n 10/2023/TT-BKHCN Hà Nội, ngày 01 tháng 6 năm 2023 THÔNG TƯ\nSỬA\nĐỔI, BỔ SUNG MỘT SỐ ĐIỀU CỦA THÔNG TƯ SỐ 26/2019/TT-BKHCN NGÀY 25 THÁNG 12 NĂM 2019 CỦA BỘ TRƯỞNG BỘ KHOA HỌC VÀ\nCÔNG NGHỆ QUY ĐỊNH CHI TIẾT XÂY DỰNG, THẨM ĐỊNH VÀ BAN HÀNH QUY CHUẨN KỸ THUẬT Căn cứ Luật Tiêu chuẩn và Quy chuẩn kỹ thuật ngày 29 tháng 6 năm 2006;\nCăn cứ Nghị định số 95/2017/NĐ-CP ngày 16 tháng 8 năm 2017 của Chính phủ quy định chức năng, nhiệm vụ, quyền hạn và cơ cấu tổ chức của Bộ Khoa học và Công nghệ;\nCăn cứ Nghị định số 127/2007/NĐ-CP ngày 01 tháng 8 năm 2007 của Chính phủ quy định chi tiết thi hành một số điều của Luật Tiêu chuẩn và Quy chuẩn kỹ thuật;\nCăn cứ Nghị định số 78/2018/NĐ-CP ngày 16 tháng 5 năm 2018 của Chính phủ sửa đổi, bổ sung một số điều của Nghị định số 127/2007/NĐ-CP ngày 01 tháng 8 năm 2007 của Chính phủ quy định chi tiết thi hành một số điều Luật Tiêu chuẩn và Quy chuẩn kỹ thuật;\nTheo đề nghị của Tổng cục trưởng Tổng cục Tiêu chuẩn Đo lường Chất lượng và Vụ trưởng Vụ Pháp chế;\nBộ trưởng Bộ Khoa học và Công nghệ ban hành Thông tư sửa đổi, bổ sung một số điều của Thông tư số 26/2019/TT-BKHCN ngày 25 tháng 12 năm 2019 của Bộ\ntrưởng Bộ Khoa học và Công nghệ quy định chi tiết xây dựng, thẩm định và ban hành quy chuẩn kỹ thuật.\nĐiều 1. Sửa đổi, bổ sung một số\nđiều của Thông tư số 26/2019/TT-BKHCN ngày 25 tháng 12 năm 2019 của Bộ trưởng Bộ Khoa học và\nCông nghệ quy định chi tiết xây dựng, thẩm định và ban hành quy chuẩn kỹ thuật 1. Sửa đổi, bổ sung khoản 2 Điều 3 như sau:\n“2. Quy chuẩn kỹ thuật địa phương là quy chuẩn kỹ thuật do Ủy ban nhân dân tỉnh, thành phố trực thuộc Trung ương ban hành kèm theo văn bản quy phạm pháp luật để áp dụng trong phạm vi quản lý của địa phương\nđối với các sản phẩm, hàng hóa, dịch vụ, quá trình đặc thù của địa phương và\nyêu cầu cụ thể về kiểm soát an toàn, môi trường cho phù hợp với đặc điểm địa lý, khí hậu, thủy văn và trình độ phát triển kinh tế - xã hội của địa phương.\nQuy chuẩn kỹ thuật địa phương viết tắt là: QCĐP.”.\n2. Sửa đổi, bổ sung khoản 4 Điều 13 như sau:\n“4. Tùy theo mức độ phức tạp của đối tượng quản lý,\nnội dung quy định kỹ thuật, kết cấu của quy chuẩn kỹ thuật cơ bản được bố cục như sau:\na) Phần, chương, mục, điều, điểm, đoạn, phụ lục; hoặc b) Phần, điều, điểm, đoạn; hoặc c) Điều, điểm, đoạn.\nPhần, chương, mục, điều, phụ lục trong quy chuẩn kỹ\nthuật phải có tiêu đề. Tiêu đề là cụm từ chỉ nội dung chính của phần, chương, mục,\nđiều, phụ lục.\nBố cục và đánh số thứ tự trong quy chuẩn kỹ thuật\nđược thực hiện theo Mẫu quy định tại Phụ lục X kèm theo Thông tư này.”.\n3. Sửa đổi, bổ sung khoản 4 Điều 14 như sau:\n“4. Hồ sơ, thủ tục đăng ký quy chuẩn kỹ thuật đã\nban hành thực hiện theo quy định tại Điều 13 Nghị định số\n127/2007/NĐ-CP.\nBản đăng ký quy chuẩn kỹ thuật được lập theo Mẫu quy định tại Phụ lục XI kèm theo Thông tư này.”.\nĐiều 2. Bổ sung, thay thế, bãi bỏ một số quy định của Thông tư số 26/2019/TT-BKHCN ngày 25 tháng 12 năm 2019 của Bộ trưởng Bộ Khoa học và Công nghệ quy định chi tiết xây dựng, thẩm định và ban hành quy chuẩn kỹ thuật 1. Thay thế, bỏ một số từ, cụm từ tại các điều, khoản, điểm sau đây:\na) Bỏ cụm từ “có xác nhận của Ủy ban nhân dân tỉnh,\nthành phố trực thuộc Trung ương” tại điểm a6 khoản 4 Điều 8;\nb) Thay thế từ “Bước 4” bằng từ “Bước 5” tại khoản 5 Điều 8.\n2. Bãi bỏ khoản 3 Điều 11.\n3. Thay thế, bổ sung một số Phụ\nlục như sau:\na) Thay thế từ “QCVN” bằng từ “QCĐP” tại mục 5 và mục 8 Phụ lục IV;\nb) Bổ sung Phụ lục X vào sau Phụ lục IX;\nc) Bổ sung Phụ lục XI vào sau Phụ lục X.\nĐiều 3. Trách nhiệm tổ chức thực hiện 1. Tổng cục Tiêu chuẩn Đo lường Chất lượng thuộc Bộ\nKhoa học và Công nghệ có trách nhiệm hướng dẫn, triển khai thực hiện Thông tư\nnày.\n2. Bộ trưởng, Thủ trưởng cơ quan ngang bộ, Chủ tịch\nỦy ban nhân dân tỉnh, thành phố trực thuộc Trung ương chịu trách nhiệm tổ chức triển khai thực hiện Thông tư này.\nĐiều 4. Điều khoản thi hành 1. Thông tư này có hiệu lực từ ngày 18 tháng 7 năm 2023.\n2. Trong quá trình thực hiện có vấn đề phát sinh hoặc vướng mắc, cơ quan, tổ chức, cá nhân phản ánh kịp thời bằng văn bản về Bộ Khoa học và Công nghệ để xem xét, giải quyết./.\nNơi nhận:\n - Ban Bí thư Trung ương Đảng;\n - Thủ tướng Chính phủ;\n - Các Phó Thủ tướng Chính phủ;\n - Các Bộ, cơ quan ngang Bộ, cơ quan thuộc Chính phủ;\n - Văn phòng Trung ương và các Ban của Đảng;\n - Văn phòng Tổng Bí thư;\n - Văn phòng Quốc hội;\n - Văn phòng Chủ tịch nước;\n - Văn phòng Chính phủ;\n - Viện Kiểm sát nhân dân tối cao;\n - Tòa án nhân dân tối cao;\n - Kiểm toán Nhà nước;\n - Ủy ban Trung ương Mặt trận Tổ quốc Việt Nam;\n - Ủy ban Giám sát tài chính Quốc gia;\n - Cơ quan Trung ương của các tổ chức chính trị - xã hội;\n - HĐND, UBND các tỉnh, thành phố trực thuộc TW;\n - Cục kiểm tra văn bản QPPL (Bộ Tư pháp);\n - Công báo;\n - Cổng thông tin điện tử Bộ KH&CN;\n - Vụ Pháp chế (để kiểm tra);\n - Lưu: VT, PC, TĐC.\nKT. BỘ TRƯỞNG THỨ TRƯỞNG Lê Xuân Định PHỤ\nLỤC X\n(Ban hành kèm theo Thông tư số 10/2023/TT-BKHCN ngày 01/06/2023 của Bộ trưởng Bộ Khoa học và\nCông nghệ)\nMẫu: BỐ CỤC VÀ ĐÁNH SỐ THỨ TỰ QUY CHUẨN KỸ THUẬT Bố cục\nĐánh số\nPhần I\nChương I.I Mục I.I.I\nĐiều 1\nĐiểm (cấp 1)\n1.1\nĐiểm (cấp 2)\n1.1.1\nĐiểm (cấp 3)\n1.1.1.1\nĐiểm (cấp 4)\n1.1.1.1.1\nĐiểm (cấp 5)\n1.1.1.1.1.1\nĐoạn Không đánh số, sử dụng chữ hoặc dấu, ví dụ: a,\n b... hoặc -, +...\nPhụ lục A\nPHỤ\nLỤC XI\n(Ban hành kèm theo Thông tư số 10/2023/TT-BKHCN ngày 01/6/2023 của Bộ trưởng Bộ Khoa học và\nCông nghệ)\nMẫu: BẢN ĐĂNG KÝ QUY CHUẨN KỸ THUẬT CỘNG HÒA XÃ HỘI CHỦ NGHĨA VIỆT NAM\nĐộc lập - Tự do - Hạnh phúc\n---------------\nBẢN ĐĂNG KÝ QUY CHUẨN KỸ THUẬT Số:....(số thứ tự\nđăng ký/năm đăng ký)\n1.\nTên Bộ/cơ quan ngang Bộ/UBND tỉnh, thành phố ban hành quy chuẩn kỹ thuật:\n2.\nSố, ký hiệu của văn bản ban hành quy chuẩn kỹ thuật:\n3.\nKý hiệu quy chuẩn kỹ thuật:\n4.\nLần ban hành, sửa đổi (nếu có):\n5.\nTên của quy chuẩn kỹ thuật (bằng tiếng Việt):\n6.\nPhạm vi điều chỉnh:\n7.\nĐối tượng điều chỉnh:\n8.\nTóm tắt nội dung:\n9.\nSố trang:\n10.\nThời gian có hiệu lực:"
}