{
  "url": "https://thuvienphapluat.vn/van-ban/Bo-may-hanh-chinh/Thong-tu-11-2023-TT-BXD-vi-tri-viec-lam-cong-chuc-nghiep-vu-chuyen-nganh-Xay-dung-584258.aspx",
  "title": "Thông tư 11/2023/TT-BXD vị trí việc làm công chức nghiệp vụ chuyên ngành Xây dựng mới nhất",
  "properties": {
    "Số hiệu": "11/2023/TT-BXD",
    "Loại văn bản": "Thông tư",
    "Nơi ban hành": "Bộ Xây dựng",
    "Người ký": "Nguyễn Thanh Nghị",
    "Ngày ban hành": "20/10/2023",
    "Ngày hiệu lực": "Đã biết",
    "Ngày công báo": "Đã biết",
    "Số công báo": "Đã biết",
    "Tình trạng": "Đã biết"
  },
  "content": "BỘ\n XÂY DỰNG\n -------\nCỘNG HÒA XÃ HỘI CHỦ NGHĨA VIỆT NAM\n Độc lập - Tự do - Hạnh phúc \n ---------------\nSố:\n 11/2023/TT-BXD Hà\n Nội, ngày 20 tháng 10 năm 2023 THÔNG TƯ\nHƯỚNG DẪN VỀ VỊ TRÍ VIỆC LÀM CÔNG CHỨC NGHIỆP VỤ CHUYÊN NGÀNH XÂY DỰNG Căn cứ Nghị định số 52/2022/NĐ-CP ngày 08 tháng 8 năm 2022 của Chính phủ quy định chức năng, nhiệm vụ, quyền hạn và cơ cấu tổ\nchức của Bộ Xây dựng;\nCăn cứ Nghị định số 62/2020/NĐ-CP ngày 01 tháng 6 năm 2020 của Chính phủ về vị trí việc làm và biên chế công chức;\nTheo đề nghị của Vụ trưởng Vụ Tổ chức cán bộ;\nBộ trưởng Bộ Xây dựng ban hành Thông tư hướng dẫn về vị trí việc làm công chức nghiệp vụ chuyên ngành Xây dựng.\nĐiều 1. Phạm vi điều chỉnh Thông tư này hướng dẫn về danh mục vị trí việc làm,\nbản mô tả công việc và khung năng lực của vị trí việc làm công chức nghiệp vụ\nchuyên ngành Xây dựng.\nĐiều 2. Đối tượng áp dụng Thông tư này áp dụng đối với các cơ quan, tổ chức thực hiện chức năng quản lý nhà nước thuộc ngành, lĩnh vực Xây dựng, gồm:\n1. Các cơ quan, tổ chức hành chính thuộc các Bộ, cơ\nquan ngang Bộ giúp Bộ trưởng, Thủ trưởng cơ quan ngang Bộ quản lý nhà nước về\nngành, lĩnh vực xây dựng.\n2. Các cơ quan chuyên môn thực hiện chức năng tham mưu, giúp Ủy ban nhân dân cấp tỉnh quản lý nhà nước về ngành, lĩnh vực xây dựng.\n3. Các cơ quan chuyên môn thực hiện chức năng tham mưu, giúp Ủy ban nhân dân cấp huyện quản lý nhà nước về ngành, lĩnh vực xây dựng.\n4. Các tổ chức, cá nhân có liên quan.\nĐiều 3. Nguyên tắc và căn cứ\nxác định vị trí việc làm công chức nghiệp vụ chuyên ngành Xây dựng 1. Nguyên tắc xác định vị trí việc làm công chức nghiệp vụ chuyên ngành Xây dựng thực hiện theo quy định tại Điều 3 Nghị định số 62/2020/NĐ-CP ngày 01 tháng 6 năm 2020 của Chính phủ về vị\ntrí việc làm và biên chế công chức.\n2. Căn cứ xác định vị trí việc làm công chức nghiệp vụ chuyên ngành Xây dựng thực hiện theo quy định tại khoản 1 Điều 4 Nghị định số 62/2020/NĐ-CP ngày 01 tháng 6 năm 2020 của Chính phủ về vị\ntrí việc làm và biên chế công chức.\nĐiều 4. Danh mục vị trí việc làm, bản mô tả công việc và khung năng lực của vị trí việc làm công chức nghiệp vụ chuyên ngành Xây dựng 1. Danh mục vị trí việc làm công chức nghiệp vụ\nchuyên ngành Xây dựng quy định tại Phụ lục I kèm theo Thông tư này.\n2. Bản mô tả công việc và khung năng lực của từng vị\ntrí việc làm công chức nghiệp vụ chuyên ngành Xây dựng quy định tại Phụ lục II kèm theo Thông tư này.\n3. Khung cấp độ xác định yêu cầu về năng lực đối với vị trí việc làm công chức nghiệp vụ chuyên ngành Xây dựng quy định tại Phụ lục III kèm theo Thông tư này.\nĐiều 5. Tổ chức thực hiện 1. Căn cứ Thông tư này, các cơ quan, tổ chức nêu tại\nĐiều 2 Thông tư này xây dựng Đề án vị trí việc làm của cơ quan, tổ chức mình trình cấp có thẩm quyền thẩm định, phê duyệt theo quy định.\n2. Trường hợp các văn bản quy phạm pháp luật dẫn chiếu tại Thông tư này được sửa đổi, bổ sung hoặc thay thế thì thực hiện theo văn bản mới ban hành.\nĐiều 6. Điều khoản chuyển tiếp\nĐối với trường hợp công chức đang giữ ngạch công chức cao hơn so với ngạch công chức theo yêu cầu của vị trí việc làm được quy định tại Thông tư này thì được bảo lưu cho đến khi có hướng dẫn mới về chế độ tiền lương theo quy định.\nĐiều 7. Hiệu lực và trách nhiệm thi hành 1. Thông tư này có hiệu lực thi hành kể từ ngày 05 tháng 12 năm 2023.\n2. Các Bộ, cơ quan ngang Bộ, Ủy ban nhân dân tỉnh,\nthành phố trực thuộc Trung ương và các cơ quan, tổ chức, cá nhân có liên quan chịu trách nhiệm thi hành Thông tư này.\n3. Trong quá trình thực hiện nếu có khó khăn, vướng mắc, đề nghị phản ánh về Bộ Xây dựng để được hướng dẫn, xem xét, giải quyết./.\nNơi nhận:\n - Thủ tướng, các Phó Thủ tướng Chính phủ;\n - Văn phòng Chính phủ;\n - Các Bộ, cơ quan ngang Bộ, cơ quan thuộc Chính phủ;\n - HĐND, UBND các tỉnh, TP trực thuộc trung ương;\n - Sở Xây dựng, sở QH - KT các tỉnh, TP trực thuộc trung ương;\n - Công báo; Website Chính phủ; Cơ sở dữ liệu quốc gia về văn bản quy phạm pháp luật; Website Bộ Xây dựng;\n - Bộ Xây dựng: Bộ trưởng, các Thứ trưởng, các cơ quan, đơn vị thuộc Bộ;\n - Cục Kiểm tra VBQPPL (Bộ Tư pháp);\n - Lưu: VT, TCCB.\nBỘ\n TRƯỞNG Nguyễn Thanh Nghị\nPHỤ LỤC I DANH MỤC VỊ TRÍ VIỆC LÀM CÔNG CHỨC NGHIỆP VỤ CHUYÊN NGÀNH XÂY DỰNG\n(Ban hành kèm theo Thông tư số 11/2023/TT-BXD ngày 20/10/2023 của Bộ trưởng Xây dựng)\nTT Tên Vị trí việc làm Ngạch công chức tương ứng Cấp trung ương cấp tỉnh Cấp huyện Ghi chú\n1 Chuyên viên cao cấp Quản lý quy hoạch xây dựng Chuyên viên cao cấp X\nBiểu số 1 2\nChuyên viên chính Quản lý quy hoạch xây dựng Chuyên viên chính X\nX Biểu số 2 3\nChuyên viên Quản lý quy hoạch xây dựng Chuyên viên X\nX X\nBiểu số 3 4\nChuyên viên cao cấp Quản lý kiến trúc Chuyên viên cao cấp X\nBiểu số 4 5\nChuyên viên chính Quản lý kiến trúc Chuyên viên chính X\nX Biểu số 5 6\nChuyên viên Quản lý kiến trúc Chuyên viên X\nX X\nBiểu số 6 7\nChuyên viên cao cấp Quản lý hoạt động đầu tư xây dựng Chuyên viên cao cấp X\nBiểu số 7\nĐược sử dụng chung tại các cơ quan được giao nhiệm vụ quản lý hoạt động xây dựng chuyên ngành 8\nChuyên viên chính Quản lý hoạt động đầu tư xây dựng Chuyên viên chính X\nX Biểu số 8 9\nChuyên viên Quản lý hoạt động đầu tư xây dựng Chuyên viên X\nX X\nBiểu số 9 10 Chuyên viên cao cấp Quản lý phát triển đô thị\nChuyên viên cao cấp X\nBiểu số 10 11 Chuyên viên chính Quản lý phát triển đô thị\nChuyên viên chính X\nX Biểu số 1 1 12 Chuyên viên Quản lý phát triển đô thị\nChuyên viên X\nX X\nBiểu số 12 13 Chuyên viên cao cấp Quản lý hạ tầng kỹ thuật Chuyên viên cao cấp X\nBiểu số 13 14 Chuyên viên chính Quản lý hạ tầng kỹ thuật Chuyên viên chính X\nX Biểu số 14 15 Chuyên viên Quản lý hạ tầng kỹ thuật Chuyên viên X\nX X\nBiểu số 15 16 Chuyên viên cao cấp Quản lý nhà ở\nChuyên viên cao cấp X\nBiểu số 16 17 Chuyên viên chính Quản lý nhà ở\nChuyên viên chính X\nX Biểu số 17 18 Chuyên viên Quản lý nhà ở\nChuyên viên X\nX X\nBiểu số 18 19 Chuyên viên cao cấp Quản lý công sở\nChuyên viên cao cấp X\nBiểu số 19 20 Chuyên viên chính Quản lý công sở\nChuyên viên chính X\nX Biểu số 20 21 Chuyên viên Quản lý công sở\nChuyên viên X\nX X\nBiểu số 21 22 Chuyên viên cao cấp Quản lý thị trường bất động sản Chuyên viên cao cấp X\nBiểu số 22 23 Chuyên viên chính Quản lý thị trường bất động sản Chuyên viên chính X\nX Biểu số 23 24 Chuyên viên Quản lý thị trường bất động sản Chuyên viên X\nX Biểu số 24 25 Chuyên viên cao cấp Quản lý vật liệu xây dựng Chuyên viên cao cấp X\nBiểu số 25 26 Chuyên viên chính Quản lý vật liệu xây dựng Chuyên viên chính X\nX Biểu số 26 27 Chuyên viên Quản lý vật liệu xây dựng Chuyên viên X\nX X\nBiểu số 27 PHỤ LỤC II BAN MÔ TẢ CÔNG VIỆC VÀ KHUNG NĂNG LỰC CÁC VỊ TRÍ VIỆC LÀM CÔNG CHỨC NGHIỆP VỤ CHUYÊN NGÀNH XÂY DỰNG\n(Kèm theo Thông tư số 11/2023/TT-BXD ngày 20 tháng 10 năm 2023 của Bộ trưởng Bộ Xây dựng)\nBiểu số 1 TÊN CƠ QUAN:.... \n TÊN TỔ CHỨC:....\n -------\nCỘNG HÒA XÃ HỘI CHỦ NGHĨA VIỆT NAM\n Độc lập - Tự do - Hạnh phúc \n ---------------\nBẢN MÔ TẢ CÔNG VIỆC Tên VTVL: Chuyên viên cao cấp Quản lý quy hoạch xây dựng Mã vị trí việc làm:\nNgày bắt đầu thực hiện:\nĐịa điểm làm việc:\n(Địa chỉ trụ sở cơ quan)\nQuy trình công việc liên quan\n(Tên tài liệu, quy trình công việc liên quan đến vị trí này)\n1. Mục tiêu vị trí việc làm: (Tóm tắt tổng quan về vị trí việc làm)\nChủ trì tham mưu, tổng hợp và hoạch định chính sách,\nchiến lược có tính vĩ mô trong lĩnh vực quy hoạch xây dựng.\nChủ trì xây dựng chương trình, đề án, dự án, văn bản quy phạm pháp luật, quy hoạch chuyên ngành, văn bản hướng dẫn thực thi trong lĩnh vực quy hoạch xây dựng.\n2. Các công việc và tiêu chí đánh giá\nTT Các công việc Tiêu chí đánh giá hoàn thành công việc Mảng công việc Công việc cụ thể\n2.1 Xây dựng văn bản 1. Chủ trì tham mưu, tổng hợp và hoạch định chính sách, chiến lược có tính vĩ mô trong lĩnh vực quy hoạch xây dựng.\n 2. Chủ trì xây dựng chương trình, đề án, dự án cấp quốc gia, cấp bộ và các văn bản quy phạm pháp luật, quy hoạch chuyên ngành,\n văn bản hướng dẫn thực thi trong lĩnh vực quy hoạch xây dựng.\n 3. Tham mưu nghiên cứu, xây dựng hệ thống quy chuẩn,\n tiêu chuẩn, định mức kinh tế kỹ thuật trong lĩnh vực quy hoạch xây dựng.\n1. Dự thảo các văn bản[1] được cấp có thẩm quyền[2]\n ban hành.\n 2. Chương trình, đề án, dự án được nghiệm thu,\n ban hành.\n 3. Các quy hoạch được phê duyệt.\n 4. Quy chuẩn, tiêu chuẩn, định mức kinh tế kỹ thuật\n được ban hành.\n2.2 Hướng dẫn 1. Chủ trì việc phổ biến, hướng dẫn chủ trương,\n chính sách của Đảng và Nhà nước, luật, văn bản quy phạm pháp luật trong lĩnh vực quy hoạch xây dựng.\n 2. Hướng dẫn tổ chức, cá nhân về việc thực hiện quy định pháp luật trong lĩnh vực quy hoạch xây dựng.\n1. Văn bản hướng dẫn được xây dựng theo đúng nội dung quy định, đúng tiến độ.\n 2. Hội nghị phổ biến, hướng dẫn luật.\n2.3 Theo dõi, kiểm tra 1. Chủ trì việc phổ biến, hướng dẫn chủ trương,\n chính sách của Đảng và Nhà nước, văn bản quy phạm pháp luật trong lĩnh vực quy hoạch xây dựng.\n 2. Hướng dẫn tổ chức, cá nhân về việc thực hiện quy định pháp luật trong lĩnh vực quy hoạch xây dựng.\n1. Văn bản hướng dẫn được xây dựng theo đúng nội dung quy định, đúng tiến độ.\n 2. Tham gia thực hiện, phổ biến, hướng dẫn pháp luật theo lĩnh vực hoạt động.\n2.4 Thực thi 1. Chủ trì triển khai chương trình, dự án, đề án,\n đồ án quy hoạch đã được phê duyệt từ cấp bộ trở lên trong lĩnh vực quy hoạch xây dựng.\n 2. Chủ trì thực hiện các hoạt động nghiệp vụ theo quy định pháp luật.\n 3. Chủ trì thực hiện các quy trình, thủ tục theo\n đúng quy định.\n1. Kết quả triển khai công việc theo đúng kế hoạch:\n đảm bảo tiến độ, chất lượng theo quy định.\n 2. Các hoạt động nghiệp vụ, các quy trình, thủ tục\n được thực hiện theo đúng quy định.\n2.5 Nghiên cứu đề tài khoa học, dự án sự nghiệp kinh tế\nChủ trì hoặc tham gia nghiên cứu các đề tài khoa học, dự án sự nghiệp kinh tế cấp nhà nước, cấp bộ/tỉnh trong lĩnh vực quy hoạch xây dựng.\nĐề tài, dự án được nghiệm thu ở mức đạt trở lên.\n2.6 Phối hợp thực hiện Có trách nhiệm phối hợp thực hiện các công việc liên quan theo lĩnh vực nhiệm vụ được phân công.\nCông việc, nhiệm vụ được giao thông suốt, tạo được mối quan hệ công tác phát triển hiệu quả cao.\n2.7 Họp, hội nghị, hội thảo Chủ trì các báo cáo cuộc họp, hội nghị, hội thảo liên quan đến lĩnh vực chuyên môn ở trong và ngoài cơ quan theo phân công.\nTham dự đầy đủ, tiếp thu, trao đổi thông tin, triển khai thực hiện theo kết luận cuộc họp 2.8 Xây dựng và thực hiện kế hoạch công tác năm, quý,\n tháng, tuần của cá nhân.\nXây dựng, thực hiện kế hoạch theo đúng kế hoạch công tác của đơn vị, cơ quan và nhiệm vụ được giao.\n2.9 Thực hiện các nhiệm vụ khác do cấp trên trực tiếp giao.\n3. Các mối quan hệ trong công việc 3.1- Bên trong\nĐược quản lý trực tiếp và kiểm duyệt kết quả bởi Quan hệ phối hợp trực tiếp trong đơn vị\nCác đơn vị phối hợp chính Lãnh đạo trực tiếp Các công chức chuyên môn khác trong đơn vị\nCác cơ quan, tổ chức,\n đơn vị thuộc Bộ, địa phương có liên quan.\n (Lưu ý: Việc xác định đơn vị phối hợp chính cần căn cứ vào mối quan hệ của tổ chức sử dụng vị trí việc làm này)\n3.2- Bên ngoài Ban, bộ, ngành,\n địa phương có quan hệ chính Bản chất quan hệ\n• Các cơ quan, tổ chức, đơn vị có hoạt động liên quan đến ngành, lĩnh vực tổ chức bộ máy thuộc phạm vi quản lý của đơn vị.\n (Lưu ý: Việc xác định các cơ quan, tổ chức, đơn vị có quan hệ chính cần căn cứ vào chức năng; nhiệm vụ của tổ chức sử dụng vị\n trí việc làm này)\n• Tham gia các cuộc họp có liên quan.\n • Cung cấp các thông tin theo yêu cầu.\n • Thu thập các thông tin cần thiết cho việc thực hiện công việc chuyên môn.\n • Lấy các thông tin thống kê.\n • Thực hiện các báo cáo theo yêu cầu.\n4- Phạm vi quyền hạn TT Quyền hạn cụ thể\n4.1\nĐược chủ động về phương pháp thực hiện công việc\n được giao:\n4.2 Tham gia ý kiến hoặc kiến nghị về các việc chuyên môn của đơn vị.\n4.3\nĐược cung cấp các thông tin chỉ đạo điều hành của tổ chức trong phạm vi nhiệm vụ được giao.\n4.4\nĐược yêu cầu cung cấp thông tin và đánh giá mức độ\n xác thực của thông tin phục vụ cho nhiệm vụ được giao.\n4.5\nĐược tham gia các cuộc họp trong và ngoài cơ quan theo sự phân công của cấp trên.\n5- Các yêu cầu về trình độ, năng lực 5.1- Yêu cầu về trình độ\nNhóm yêu cầu Yêu cầu cụ thể\nTrình độ đào tạo\n• Tốt nghiệp đại học trở lên với ngành hoặc chuyên ngành đào tạo phù hợp với lĩnh vực công tác.\n • Có bằng tốt nghiệp cao cấp lý luận chính trị hoặc bằng cao cấp lý luận chính trị - hành chính hoặc có giấy xác nhận trình độ lý\n luận chính trị tương đương cao cấp lý luận chính trị của cơ quan có thẩm quyền.\nBồi dưỡng, chứng chỉ\n• Có chứng chỉ bồi dưỡng kiến thức, kỹ năng quản lý nhà nước đối với công chức ngạch chuyên viên cao cấp hoặc tương đương hoặc có bằng cao cấp lý luận chính trị - hành chính.\nKinh nghiệm (thành tích công tác)\n• Có thời gian giữ ngạch chuyên viên chính hoặc tương đương từ đủ 06 năm trở lên. Trường hợp có thời gian tương đương với ngạch chuyên viên chính thì thời gian giữ ngạch chuyên viên chính tối thiểu 01 năm\n (đủ 12 tháng).\n • Trong thời gian giữ ngạch chuyên viên chính hoặc tương đương đã chủ trì hoặc tham gia xây dựng, thẩm định, góp ý kiến ít nhất 02 văn bản quy phạm pháp luật hoặc đề tài, đề án, dự án, chương trình nghiên cứu khoa học cấp nhà nước, cấp bộ, cấp ban, cấp ngành mà cơ quan sử dụng công chức được giao chủ trì nghiên cứu, xây dựng đã được cấp có thẩm quyền ban hành hoặc nghiệm thu.\nPhẩm chất cá nhân\n• Tuyệt đối trung thành, tin tưởng, nghiêm túc chấp hành chủ trương, chính sách của Đảng, pháp luật của Nhà nước, quy định của cơ\n quan;\n • Tinh thần trách nhiệm cao với công việc với tập thể, phối hợp công tác tốt;\n • Trung thực, thẳng thắn, kiên định nhưng biết lắng nghe;\n • Điềm tĩnh, nguyên tắc, cẩn thận, bảo mật thông tin.\n • Khả năng đoàn kết nội bộ.\n • Chịu được áp lực trong công việc.\n • Tập trung, sáng tạo, tư duy độc lập và logic.\nCác yêu cầu khác\n• Có khả năng tham mưu, xây dựng, thực hiện, kiểm tra và đề xuất các chủ trương, chính sách, nghị quyết, kế hoạch, giải pháp đối với các vấn đề thực tiễn liên quan trong phạm vi chức năng, nhiệm vụ được giao.\n • Có khả năng cụ thể hoá và tổ chức thực hiện hiệu quả các chủ trương, đường lối của Đảng, chính sách pháp luật của Nhà nước ở\n lĩnh vực công tác được phân công.\n • Có khả năng đề xuất những chủ trương, xây dựng quy trình nội bộ và giải pháp giải quyết các vấn đề thực tiễn liên quan đến chức năng, nhiệm vụ của đơn vị.\n • Hiểu và vận dụng được các kiến thức chuyên sâu,\n nâng cao về lĩnh vực hoạt động và thực thi, kỹ năng xử lý các tình huống trong quá trình hướng dẫn, kiểm tra, giám sát, tham mưu, đề xuất và thực hiện công việc theo vị trí việc làm.\n • Hiểu và vận dụng được các kiến thức về phương pháp nghiên cứu, tổ chức, triển khai nghiên cứu, xây dựng các tài liệu, đề\n tài, đề án thuộc lĩnh vực chuyên môn đảm nhiệm.\n • Biết vận dụng các kiến thức cơ bản và nâng cao về ngành, lĩnh vực; có kỹ năng thuyết trình, giảng dạy, hướng dẫn nghiệp vụ về\n ngành, lĩnh vực.\n • Áp dụng thành thạo các kiến thức; kỹ thuật xây dựng, ban hành văn bản vào công việc theo yêu cầu của vị trí việc làm.\n5.2- Các năng lực Nhóm năng lực Tên năng lực Cấp độ\nNhóm năng lực chung\n• Đạo đức và bản lĩnh 4-5\n• Tổ chức thực hiện công việc 4-5\n• Kỹ thuật soạn thảo và ban hành văn bản 4-5\n• Giao tiếp ứng xử\n4-5\n• Quan hệ phối hợp 4-5\n• Sử dụng công nghệ thông tin Phù hợp với chức năng,\n nhiệm vụ của cơ quan, tổ chức, đơn vị sử dụng vị trí việc làm được cấp có thẩm quyền phê duyệt\n• Sử dụng ngoại ngữ\nNhóm năng lực chuyên môn\n• Khả năng xây dựng văn bản 4-5\n• Khả năng hướng dẫn thực hiện văn bản 4-5\n• Khả năng theo dõi, kiểm tra thực hiện văn bản 4-5\n• Khả năng thực thi 4-5\n• Khả năng phối hợp thực hiện 4-5 Nhóm năng lực quản lý\n• Tư duy chiến lược 3-4\n• Quản lý sự thay đổi 3-4\n• Ra quyết định 3-4\n• Quản lý nguồn lực 3-4\n• Phát triển công chức 3-4 Phê duyệt của lãnh\nđạo Biểu số 2 TÊN CƠ QUAN:.... \n TÊN TỔ CHỨC:....\n -------\nCỘNG HÒA XÃ HỘI CHỦ NGHĨA VIỆT NAM\n Độc lập - Tự do - Hạnh phúc \n ---------------\nBẢN MÔ TẢ CÔNG VIỆC Tên VTVL: Chuyên viên chính Quản lý quy hoạch xây dựng Mã vị trí việc làm:\nNgày bắt đầu thực hiện:\nĐịa điểm làm việc:\n(Địa chỉ trụ sở cơ quan)\nQuy trình công việc liên quan\n(Tên tài liệu, quy trình công việc liên quan đến vị trí này)\n1. Mục tiêu vị trí việc làm: (Tóm tắt tổng quan về vị trí việc làm)\nTham gia tham mưu, tổng hợp và hoạch định chính sách, chiến lược có tính vĩ mô trong lĩnh vực quy hoạch xây dựng.\nChủ trì hoặc tham gia xây dựng chương trình, đề án,\ndự án, các văn bản quy phạm pháp luật, quy hoạch chuyền ngành, văn bản hướng dẫn thực thi trong lĩnh vực quy hoạch xây dựng.\n2. Các công việc và tiêu chí đánh giá\nTT Các công việc Tiêu chí đánh giá hoàn thành công việc Mảng công việc Công việc cụ thể\n2.1 Xây dựng văn bản 1. Tham gia tham mưu, tổng hợp và hoạch định chính sách, chiến lược có tính vĩ mô trong lĩnh vực quy hoạch xây dựng.\n 2. Chủ trì hoặc tham gia xây dựng chương trình, đề\n án, dự án cấp bộ/tỉnh và các văn bản quy phạm pháp luật, quy hoạch chuyên ngành, văn bản hướng dẫn thực thi trong lĩnh vực quy hoạch xây dựng.\n 3. Tham mưu nghiên cứu, xây dựng hệ thống quy chuẩn,\n tiêu chuẩn, định mức kinh tế kỹ thuật trong lĩnh vực quy hoạch xây dựng.\n1. Dự thảo các văn bản được cấp có thẩm quyền ban hành.\n 2. Chương trình, đề án, dự án được nghiệm thu,\n ban hành.\n 3. Các quy hoạch được phê duyệt.\n 4. Quy chuẩn, tiêu chuẩn, định mức kinh tế kỹ thuật\n được ban hành.\n2.2 Hướng dẫn 1. Chủ trì hoặc tham gia việc phổ biến, hướng dẫn chủ trương, chính sách của Đảng và Nhà nước, văn bản quy phạm pháp luật trong lĩnh vực quy hoạch xây dựng 2. Hướng dẫn tổ chức, cá nhân về việc thực hiện quy định pháp luật trong lĩnh vực quy hoạch xây dựng.\n1. Văn bản hướng dẫn được xây dựng theo đúng nội dung quy định, đúng tiến độ.\n 2. Tham gia thực hiện, phổ biến, hướng dẫn pháp luật theo lĩnh vực hoạt động.\n2.3 Theo dõi, kiểm tra 1. Tham gia theo dõi, kiểm tra và tổng hợp kết quả\n thực hiện các chính sách, chiến lược có tính vĩ mô trong lĩnh vực quy hoạch xây dựng.\n 2. Chủ trì theo dõi, kiểm tra, tổng hợp việc thực thi pháp luật trong lĩnh vực quy hoạch xây dựng theo quy định của pháp luật.\nBáo cáo kết quả kiểm tra, đánh giá và có đề xuất kịp thời, đúng kế hoạch, được cấp thẩm quyền phê duyệt.\n2.4 Thực thi 1. Tham gia triển khai chương trình, dự án, đề\n án, đồ án quy hoạch đã được phê duyệt từ cấp bộ/tỉnh trong lĩnh vực quy hoạch xây dựng.\n 2. Chủ trì thực hiện các hoạt động nghiệp vụ theo quy định pháp luật.\n 3. Chủ trì thực hiện các quy trình, thủ tục theo\n đúng quy định 1. Kết quả triển khai công việc theo đúng kế hoạch:\n đảm bảo tiến độ, chất lượng theo quy định.\n 2. Các hoạt động nghiệp vụ, các quy trình, thủ tục\n được thực hiện theo đúng quy định.\n2.5 Nghiên cứu đề tài khoa học, dự án sự nghiệp kinh tế\nChủ trì hoặc tham gia nghiên cứu các đề tài khoa học, dự án sự nghiệp kinh tế cấp nhà nước, cấp bộ/tỉnh trong lĩnh vực quy hoạch xây dựng.\nĐề tài, dự án được nghiệm thu ở mức đạt trở lên 2.6 Phối hợp thực hiện Có trách nhiệm phối hợp thực hiện các công việc liên quan theo lĩnh vực nhiệm vụ được phân công.\nCông việc, nhiệm vụ được giao thông suốt, tạo được mối quan hệ công tác phát triển hiệu quả cao.\n2.7 Họp, hội nghị, hội thảo Tham dự các cuộc họp, hội nghị, hội thảo liên quan đến lĩnh vực chuyên môn ở trong và ngoài cơ quan theo phân công.\nTham dự đầy đủ, tiếp thu, trao đổi thông tin, triển khai thực hiện theo kết luận cuộc họp 2.8 Xây dựng và thực hiện kế hoạch công tác năm, quý,\n tháng, tuần của cá nhân.\nXây dựng, thực hiện kế hoạch theo đúng kế hoạch công tác của đơn vị, cơ quan và nhiệm vụ được giao.\n2.9 Thực hiện các nhiệm vụ khác do cấp trên trực tiếp giao.\n3. Các mối quan hệ trong công việc 3.1- Bên trong\nĐược quản lý trực tiếp và kiểm duyệt kết quả bởi Quan hệ phối hợp trực tiếp trong đơn vị\nCác đơn vị phối hợp chính Lãnh đạo trực tiếp Các công chức chuyên môn khác trong đơn vị\nCác cơ quan, tổ chức,\n đơn vị thuộc Bộ, địa phương có liên quan.\n (Lưu ý: Việc xác\n định đơn vị phối hợp chính cần căn cứ vào mỗi quan hệ của tổ chức sử dụng vị\n trí việc làm này)\n3.2- Bên ngoài Ban, bộ, ngành,\n địa phương có quan hệ chính Bản chất quan hệ\n• Các cơ quan, tổ chức, đơn vị có hoạt động liên quan\n đến ngành, lĩnh vực tổ chức bộ máy thuộc phạm vi quản lý của đơn vị.\n (Lưu ý: Việc xác định các cơ quan, tổ chức,\n đơn vị có quan hệ chính cần căn cứ vào chức năng; nhiệm vụ của tổ chức sử dụng vị trí việc làm này)\n• Tham gia các cuộc họp có liên quan.\n • Cung cấp các thông tin theo yêu cầu.\n • Thu thập các thông tin cần thiết cho việc thực hiện công việc chuyên môn.\n • Lấy các thông tin thống kê.\n • Thực hiện các báo cáo theo yêu cầu.\n4- Phạm vi quyền hạn TT Quyền hạn cụ thể\n4.1\nĐược chủ động về phương pháp thực hiện công việc\n được giao;\n4.2 Tham gia ý kiến hoặc kiến nghị về các việc chuyên môn của đơn vị.\n4.3\nĐược cung cấp các thông tin chỉ đạo điều hành của tổ chức trong phạm vi nhiệm vụ được giao.\n4.4\nĐược yêu cầu cung cấp thông tin và đánh giá mức độ\n xác thực của thông tin phục vụ cho nhiệm vụ được giao.\n4.5\nĐược tham gia các cuộc họp trong và ngoài cơ quan theo sự phân công của cấp trên.\n5- Các yêu cầu về trình độ, năng lực 5.1- Yêu cầu về trình độ\nNhóm yêu cầu Yêu cầu cụ thể\nTrình độ đào tạo\n• Tốt nghiệp đại học trở lên với ngành hoặc chuyên ngành đào tạo phù hợp với lĩnh vực công tác.\nBồi dưỡng, chứng chỉ\n• Có chứng chỉ bồi dưỡng kiến thức, kỹ năng quản lý\n nhà nước đối với công chức ngạch chuyên viên chính hoặc tương đương hoặc có bằng cao cấp lý luận chính trị - hành chính.\nKinh nghiệm (thành tích công tác)\n• Có thời gian giữ ngạch chuyên viên hoặc tương\n đương từ đủ 09 năm trở lên. Trường hợp có thời gian tương đương với ngạch chuyên viên thì thời gian giữ ngạch chuyên viên tối thiểu 01 năm (đủ 12 tháng).\n • Trong thời gian giữ ngạch chuyên viên hoặc tương đương đã chủ trì hoặc tham gia xây dựng, thẩm định, góp ý kiến ít nhất 01 văn bản quy phạm pháp luật hoặc đề tài, đề án, dự án, chương trình nghiên cứu khoa học cấp cơ sở trở lên mà cơ quan sử dụng công chức được giao chủ trì\n nghiên cứu, xây dựng đã được cấp có thẩm quyền ban hành hoặc nghiệm thu.\nPhẩm chất cá nhân\n• Tuyệt đối trung thành, tin tưởng, nghiêm túc chấp hành chủ trương, chính sách của Đảng, pháp luật của Nhà nước, quy định của cơ\n quan:\n • Tinh thần trách nhiệm cao với công việc với tập thể, phối hợp công tác tốt;\n • Trung thực, thẳng thắn, kiên định nhưng biết lắng nghe:\n • Điềm tĩnh, nguyên tắc, cẩn thận, bảo mật thông tin.\n • Khả năng đoàn kết nội bộ.\n • Chịu được áp lực trong công việc.\n • Tập trung, sáng tạo, tư duy độc lập và logic.\nCác yêu cầu khác\n• Có khả năng tham mưu, xây dựng, thực hiện, kiểm tra và đề xuất các chủ trương, chính sách, nghị quyết, kế hoạch, giải pháp đối với các vấn đề thực tiễn liên quan trong phạm vi chức năng, nhiệm vụ được giao.\n • Có khả năng cụ thể hoá và tổ chức thực hiện hiệu quả các chủ trương, đường lối của Đảng, chính sách pháp luật của Nhà nước ở\n lĩnh vực công tác được phân công.\n • Có khả năng đề xuất những chủ trương, xây dựng quy trình nội bộ và giải pháp giải quyết các vấn đề thực tiễn liên quan đến chức năng, nhiệm vụ của đơn vị.\n • Hiểu và vận dụng được các kiến thức chuyên sâu,\n nâng cao về lĩnh vực hoạt động và thực thi, kỹ năng xử lý các tình huống trong quá trình hướng dẫn, kiểm tra, giám sát, tham mưu, đề xuất và thực hiện công việc theo vị trí việc làm.\n • Hiểu và vận dụng được các kiến thức về phương pháp nghiên cứu, tổ chức, triển khai nghiên cứu, xây dựng các tài liệu, đề\n tài, đề án thuộc lĩnh vực chuyên môn đảm nhiệm.\n • Biết vận dụng các kiến thức cơ bản và nâng cao về ngành, lĩnh vực; có kỹ năng thuyết trình, giảng dạy, hướng dẫn nghiệp vụ về\n ngành, lĩnh vực.\n • Áp dụng thành thạo các kiến thức; kỹ thuật xây dựng, ban hành văn bản vào công việc theo yêu cầu của vị trí việc làm.\n5.2- Các năng lực Nhóm năng lực Tên năng lực Cấp độ\nNhóm năng lực chung\n• Đạo đức và bản lĩnh 3-4\n• Tổ chức thực hiện công việc 3-4\n• Kỹ thuật soạn thảo và ban hành văn bản 3-4\n• Giao tiếp ứng xử\n3-4\n• Quan hệ phối hợp 3-4\n• Sử dụng công nghệ thông tin Phù hợp với chức năng, nhiệm vụ của cơ quan, tổ chức, đơn vị sử dụng vị trí việc làm được cấp có thẩm quyền phê duyệt\n• Sử dụng ngoại ngữ\nNhóm năng lực chuyên môn\n• Khả năng xây dựng văn bản 3-4\n• Khả năng hướng dẫn thực hiện văn bản 3-4\n• Khả năng theo dõi, kiểm tra thực hiện văn bản 3-4\n• Khả năng thực thi 3-4\n• Khả năng phối hợp thực hiện 3-4 Nhóm năng lực quản lý\n• Tư duy chiến lược 2-3\n• Quản lý sự thay đổi 2-3\n• Ra quyết định 2-3\n• Quản lý nguồn lực 2-3\n• Phát triển công chức 2-3 Phê duyệt của lãnh\nđạo Biểu số 3 TÊN CƠ QUAN:.... \n TÊN TỔ CHỨC:....\n -------\nCỘNG HÒA XÃ HỘI CHỦ NGHĨA VIỆT NAM\n Độc lập - Tự do - Hạnh phúc \n ---------------\nBẢN MÔ TẢ CÔNG VIỆC Tên VTVL: Chuyên viên Quản lý quy hoạch xây dựng Mã vị trí việc làm:\nNgày bắt đầu thực hiện:\nĐịa điểm làm việc:\n(Địa chỉ trụ sở cơ quan)\nQuy trình công việc liên quan\n(Tên tài liệu, quy trình công việc liên quan đến vị trí này)\n1. Mục tiêu vị trí việc làm: (Tóm tắt tổng quan về vị trí việc làm)\nTham gia xây dựng chương trình, đề án, dự án, các văn bản quy phạm pháp luật, quy hoạch chuyên ngành, văn bản hướng dẫn thực thi trong lĩnh vực quy hoạch xây dựng.\nChủ trì hoặc tham gia nghiên cứu, đề xuất cấp thẩm quyền các giải pháp, biện pháp xử lý vấn đề cụ thể trong lĩnh vực công việc được phân công.\n2. Các công việc và tiêu chí đánh giá\nTT Các công việc Tiêu chí đánh giá hoàn thành công việc Mảng công việc Công việc cụ thể\n2.1 Xây dựng văn bản 1. Tham gia xây dựng chương trình, đề án, dự án cấp bộ/tỉnh và các văn bản quy phạm pháp luật, các quy hoạch chuyên ngành và văn bản hướng dẫn thực thi trong lĩnh vực quy hoạch xây dựng.\n 2. Tham gia nghiên cứu, xây dựng hệ thống quy chuẩn,\n tiêu chuẩn, định mức kinh tế kỹ thuật trong lĩnh vực quy hoạch xây dựng.\n 3. Chủ trì nghiên cứu, tham mưu cho UBND huyện các văn bản hướng dẫn việc tổ chức thực hiện các hoạt động trong lĩnh vực quản lý quy hoạch xây dựng trên địa bàn (đối với VTVL tại phòng chuyên môn thuộc UBND cấp huyện).\n1. Dự thảo các văn bản được cấp có thẩm quyền ban hành.\n 2. Chương trình, đề án, dự án được nghiệm thu,\n ban hành.\n 3. Các quy hoạch được phê duyệt.\n 4. Quy chuẩn, tiêu chuẩn, định mức kinh tế kỹ thuật\n được ban hành.\n2.2 Hướng dẫn 1. Tham gia việc phổ biến, hướng dẫn chủ trương,\n chính sách của Đảng và Nhà nước, văn bản quy phạm pháp luật trong lĩnh vực quy hoạch xây dựng.\n 2. Hướng dẫn tổ chức, cá nhân về việc thực hiện quy định pháp luật trong lĩnh vực quy hoạch xây dựng.\n1. Văn bản hướng dẫn được xây dựng theo đúng nội dung quy định, đúng tiến độ.\n 2. Tham gia thực hiện, phổ biến, hướng dẫn pháp luật theo lĩnh vực hoạt động.\n2.3 Theo dõi, kiểm tra Tham gia theo dõi, kiểm tra, tổng hợp việc thực thi pháp luật trong lĩnh vực quy hoạch xây dựng theo quy định của pháp luật.\nBáo cáo kết quả kiểm tra, đánh giá và có đề xuất kịp thời, đúng kế hoạch, được cấp thẩm quyền phê duyệt.\n2.4 Thực thi 1. Tham gia triển khai chương trình, dự án, đề\n án, đồ án quy hoạch đã được phê duyệt từ cấp bộ/tỉnh trong lĩnh vực quy hoạch xây dựng.\n 2. Thực hiện các hoạt động nghiệp vụ theo quy định pháp luật.\n 3. Chủ trì thực hiện các quy trình, thủ tục theo\n đúng quy định.\n1. Kết quả triển khai công việc theo đúng kế hoạch:\n đảm bảo tiến độ, chất lượng theo quy định.\n 2. Các hoạt động nghiệp vụ, các quy trình, thủ tục\n được thực hiện theo đúng quy định.\n2.5 Nghiên cứu đề tài khoa học, dự án sự nghiệp kinh tế\nTham gia nghiên cứu các đề tài khoa học, dự án sự\n nghiệp kinh tế cấp bộ/tỉnh, chủ trì nghiên cứu các đề tài, dự án cấp cơ sở\n trong lĩnh vực quy hoạch xây dựng\nĐề tài, dự án được nghiệm thu ở mức đạt trở lên 2.6 Phối hợp thực hiện Có trách nhiệm phối hợp thực hiện các công việc liên quan theo phân công.\nCông việc, nhiệm vụ được giao thông suốt, tạo được mối quan hệ công tác phát triển hiệu quả cao.\n2.7 Họp, hội nghị, hội thảo Tham dự các cuộc họp, hội nghị, hội thảo liên quan đến lĩnh vực chuyên môn ở trong và ngoài cơ quan theo phân công.\nTham dự đầy đủ, tiếp thu, trao đổi thông tin, triển khai thực hiện theo kết luận cuộc họp 2.8 Xây dựng và thực hiện kế hoạch công tác năm, quý,\n tháng, tuần của cá nhân.\nXây dựng, thực hiện kế hoạch theo đúng kế hoạch công tác của đơn vị, cơ quan và nhiệm vụ được giao.\n2.9 Thực hiện các nhiệm vụ khác do cấp trên trực tiếp giao.\n3. Các mối quan hệ trong công việc 3.1- Bên trong\nĐược quản lý trực tiếp và kiểm duyệt kết quả bởi Quan hệ phối hợp trực tiếp trong đơn vị\nCác đơn vị phối hợp chính Lãnh đạo trực tiếp Các công chức chuyên môn khác trong đơn vị\nCác cơ quan, tổ chức,\n đơn vị thuộc Bộ, địa phương có liên quan.\n (Lưu ý: Việc xác định đơn vị phối hợp chính cần căn cứ vào mối quan hệ của tổ chức sử dụng vị trí việc làm này)\n3.2- Bên ngoài Ban, bộ, ngành,\n địa phương có quan hệ chính Bản chất quan hệ\n• Các cơ quan, tổ chức, đơn vị có hoạt động liên quan đến ngành, lĩnh vực tổ chức bộ máy thuộc phạm vi quản lý của đơn vị.\n (Lưu ý: Việc xác định các cơ quan, tổ chức,\n đơn vị có quan hệ chính cần căn cứ vào chức năng; nhiệm vụ của tổ chức sử dụng vị trí việc làm này)\n• Tham gia các cuộc họp có liên quan.\n • Cung cấp các thông tin theo yêu cầu.\n • Thu thập các thông tin cần thiết cho việc thực hiện công việc chuyên môn.\n • Lấy các thông tin thống kê.\n • Thực hiện các báo cáo theo yêu cầu.\n4-Phạm vi quyền hạn TT Quyền hạn cụ thể\n4.1\nĐược chủ động về phương pháp thực hiện công việc\n được giao;\n4.2 Tham gia ý kiến hoặc kiến nghị về các việc chuyên môn của đơn vị.\n4.3\nĐược cung cấp các thông tin chỉ đạo điều hành của tổ chức trong phạm vi nhiệm vụ được giao.\n4.4\nĐược yêu cầu cung cấp thông tin và đánh giá mức độ\n xác thực của thông tin phục vụ cho nhiệm vụ được giao.\n4.5\nĐược tham gia các cuộc họp trong và ngoài cơ quan theo sự phân công của cấp trên.\n5- Các yêu cầu về trình độ, năng lực 5.1- Yêu cầu về trình độ\nNhóm yêu cầu Yêu cầu cụ thể\nTrình độ đào tạo\n• Tốt nghiệp đại học trở lên với ngành hoặc chuyên ngành đào tạo phù hợp với lĩnh vực công tác.\nBồi dưỡng, chứng chỉ\n• Có chứng chỉ bồi dưỡng kiến thức, kỹ năng quản lý\n nhà nước đối với công chức ngạch chuyên viên và tương đương.\nPhẩm chất cá nhân\n• Tuyệt đối trung thành, tin tưởng, nghiêm túc chấp hành chủ trương, chính sách của Đảng, pháp luật của Nhà nước, quy định của cơ\n quan:\n • Tinh thần trách nhiệm cao với công việc với tập thể, phối hợp công tác tốt:\n • Trung thực, thẳng thắn, kiên định nhưng biết lắng nghe:\n • Điềm tĩnh, nguyên tắc, cẩn thận, bảo mật thông tin.\n • Khả năng đoàn kết nội bộ.\n • Chịu được áp lực trong công việc.\n • Tập trung, sáng tạo, tư duy độc lập và logic.\nCác yêu cầu khác\n• Có khả năng tham mưu, xây dựng, thực hiện, kiểm tra và đề xuất các chủ trương, chính sách, nghị quyết, kế hoạch, giải pháp đối với các vấn đề thực tiễn liên quan trong phạm vi chức năng, nhiệm vụ được giao.\n • Có khả năng cụ thể hoá và tổ chức thực hiện hiệu quả các chủ trương, đường lối của Đảng, chính sách pháp luật của Nhà nước ở\n lĩnh vực công tác được phân công.\n • Có khả năng đề xuất những chủ trương, xây dựng quy trình nội bộ và giải pháp giải quyết các vấn đề thực tiễn liên quan đến chức năng, nhiệm vụ của đơn vị.\n • Hiểu và vận dụng được các kiến thức chuyên sâu,\n nâng cao về lĩnh vực hoạt động và thực thi, kỹ năng xử lý các tình huống trong quá trình hướng dẫn, kiểm tra, giám sát, tham mưu, đề xuất và thực hiện công việc theo vị trí việc làm.\n • Hiểu và vận dụng được các kiến thức về phương pháp nghiên cứu, tổ chức, triển khai nghiên cứu, xây dựng các tài liệu, đề\n tài, đề án thuộc lĩnh vực chuyên môn đảm nhiệm.\n • Biết vận dụng các kiến thức cơ bản và nâng cao về ngành, lĩnh vực; có kỹ năng thuyết trình, giảng dạy, hướng dẫn nghiệp vụ về\n ngành, lĩnh vực.\n • Áp dụng thành thạo các kiến thức: kỹ thuật xây dựng, ban hành văn bản vào công việc theo yêu cầu của vị trí việc làm.\n5.2- Các năng lực Nhóm năng lực Tên năng lực Cấp độ\nNhóm năng lực chung\n• Đạo đức và bản lĩnh 2-3\n• Tổ chức thực hiện công việc 2-3\n• Kỹ thuật soạn thảo và ban hành văn bản 2-3\n• Giao tiếp ứng xử\n2-3\n• Quan hệ phối hợp 2-3\n• Sử dụng công nghệ thông tin Phù hợp với chức năng,\n nhiệm vụ của cơ quan, tổ chức, đơn vị sử dụng vị trí việc làm được cấp có thẩm quyền phê duyệt\n• Sử dụng ngoại ngữ\nNhóm năng lực chuyên môn\n• Khả năng xây dựng văn bản 2-3\n• Khả năng hướng dẫn thực hiện văn bản 2-3\n• Khả năng theo dõi, kiểm tra thực hiện văn bản 2-3\n• Khả năng thực thi 2-3\n• Khả năng phối hợp thực hiện 2-3 Nhóm năng lực quản lý\n• Tư duy chiến lược 1-2\n• Quản lý sự thay đổi 1-2\n• Ra quyết định 1-2\n• Quản lý nguồn lực 1-2\n• Phát triển công chức 1-2 Phê duyệt của lãnh\nđạo Biểu số 4 TÊN CƠ QUAN:.... \n TÊN TỔ CHỨC:....\n -------\nCỘNG HÒA XÃ HỘI CHỦ NGHĨA VIỆT NAM\n Độc lập - Tự do - Hạnh phúc \n ---------------\nBẢN MÔ TẢ CÔNG VIỆC Tên VTVL: Chuyên viên cao cấp Quản lý Kiến trúc Mã vị trí việc làm:\nNgày bắt đầu thực hiện:\nĐịa điểm làm việc:\n(Địa chỉ trụ sở cơ quan)\nQuy trình công việc liên quan\n(Tên tài liệu, quy trình công việc liên quan đến vị trí này)\n1. Mục tiêu vị trí việc làm: (Tóm tắt tổng quan về vị trí việc làm)\nChủ trì tham mưu: tổng hợp và hoạch định chính sách, chiến lược có tính vĩ mô trong lĩnh vực kiến trúc.\nChủ trì xây dựng chương trình, đề án, dự án, các văn bản quy phạm pháp luật, quy hoạch chuyên ngành, văn bản hướng dẫn thực thi trong lĩnh vực kiến trúc.\n2. Các công việc và tiêu chí đánh giá\nTT Các công việc Tiêu chí đánh giá hoàn thành công việc Mảng công việc Công việc cụ thể\n2.1 Xây dựng văn bản 1. Chủ trì tham mưu, tổng hợp và hoạch định chính sách, chiến lược có tính vĩ mô trong lĩnh vực kiến trúc.\n 2. Chủ trì xây dựng chương trình, đề án, dự án cấp quốc gia, cấp bộ và các văn bản quy phạm pháp luật, thiết kế điển hình, quy hoạch chuyên ngành và văn bản hướng dẫn thực thi trong lĩnh vực kiến trúc.\n 3. Tham mưu nghiên cứu, xây dựng hệ thống quy chuẩn,\n tiêu chuẩn, định mức kinh tế kỹ thuật trong lĩnh vực kiến trúc.\n1. Dự thảo các văn bản1 được cấp có thẩm quyền2 ban hành.\n 2. Chương trình, đề án, dự án được nghiệm thu.\n ban hành.\n 3. Các quy hoạch được phê duyệt.\n 4. Quy chuẩn, tiêu chuẩn, định mức kinh tế kỹ thuật\n được ban hành.\n2.2 Hướng dẫn 1. Chủ trì việc phổ biến, hướng dẫn chủ trương,\n chính sách của Đảng và Nhà nước, văn bản quy phạm pháp luật trong lĩnh vực lĩnh vực kiến trúc.\n 2. Hướng dẫn tổ chức, cá nhân về việc thực hiện quy định pháp luật trong lĩnh vực lĩnh vực kiến trúc.\n1. Văn bản hướng dẫn được xây dựng theo dựng nội dung quy định, đúng tiến độ.\n 2. Tham gia thực hiện, phổ biến, hướng dẫn pháp luật theo lĩnh vực hoạt động.\n2.3 Theo dõi, kiểm tra 1. Chủ trì theo dõi, kiểm tra và tổng hợp kết quả\n thực hiện các chính sách, chiến lược có tính vĩ mô trong lĩnh vực kiến trúc.\n 2. Chủ trì theo dõi, kiểm tra, tổng hợp việc thực thi pháp luật trong lĩnh vực kiến trúc theo quy định của pháp luật.\nBáo cáo kết quả kiểm tra, đánh giá và có đề xuất kịp thời, đúng kế hoạch, được cấp thẩm quyền phê duyệt.\n2.4 Thực thi 1. Chủ trì triển khai chương trình, dự án, đề án\n đã được phê duyệt từ cấp bộ trở lên trong lĩnh vực kiến trúc.\n 2. Chủ trì thực hiện các hoạt động nghiệp vụ theo quy định pháp luật.\n 3. Chủ trì thực hiện các quy trình, thủ tục theo\n đúng quy định.\n1. Kết quả triển khai công việc theo đúng kế hoạch:\n đảm bảo tiến độ, chất lượng theo quy định.\n 2. Các hoạt động nghiệp vụ, các quy trình, thủ tục\n được thực hiện theo dựng quy định.\n2.5 Nghiên cứu đề tài khoa học, dự án sự nghiệp kinh tế\nChủ trì hoặc tham gia nghiên cứu các đề tài khoa học, dự án sự nghiệp kinh tế cấp nhà nước, cấp bộ trong lĩnh vực kiến trúc.\nĐề tài, dự án được nghiệm thu ở mức đạt trở lên.\n2.6 Phối hợp thực hiện Có trách nhiệm phối hợp thực hiện các công việc liên quan theo lĩnh vực nhiệm vụ được phân công.\nCông việc, nhiệm vụ được giao thông suốt, tạo được mối quan hệ công tác phát triển hiệu quả cao.\n2.7 Họp, hội nghị, hội thảo Chủ trì các báo cáo cuộc họp, hội nghị, hội thảo liên quan đến lĩnh vực chuyên môn ở trong và ngoài cơ quan theo phân công Tham dự đầy đủ, tiếp thu, trao đổi thông tin. triển khai thực hiện theo kết luận cuộc họp 2.8 Xây dựng và thực hiện kế hoạch công tác năm, quý,\n tháng, tuần của cá nhân Xây dựng, thực hiện kế hoạch theo dựng kế hoạch công tác của đơn vị, cơ quan và nhiệm vụ được giao.\n2.9 Thực hiện các nhiệm vụ khác do cấp trên trực tiếp giao.\n3. Các mối quan hệ trong công việc 3.1- Bên trong\nĐược quản lý trực tiếp và kiểm duyệt kết quả bởi Quan hệ phối hợp trực tiếp trong đơn vị\nCác đơn vị phối hợp chính Lãnh đạo trực tiếp Các công chức chuyên môn khác trong đơn vị\nCác cơ quan, tổ chức,\n đơn vị thuộc Bộ, địa phương có liên quan.\n (Lưu ý: Việc xác định đơn vị phối hợp chính cần căn cứ vào mối quan hệ của tổ chức sử dụng vị trí việc làm này)\n3.2- Bên ngoài Ban, bộ, ngành,\n địa phương có quan hệ chính Bản chất quan hệ\n• Các cơ quan, tổ chức, đơn vị có hoạt động liên quan đến ngành, lĩnh vực tổ chức bộ máy thuộc phạm vi quản lý của đơn vị.\n (Lưu ý: Việc xác định các cơ quan, tổ chức,\n đơn vị có quan hệ chính cần căn cứ vào chức năng; nhiệm vụ của tổ chức sử dụng vị trí việc làm này)\n• Tham gia các cuộc họp có liên quan.\n • Cung cấp các thông tin theo yêu cầu.\n • Thu thập các thông tin cần thiết cho việc thực hiện công việc chuyên môn.\n • Lấy các thông tin thống kê.\n • Thực hiện các báo cáo theo yêu cầu.\n4. Phạm vi quyền hạn TT Quyền hạn cụ thể\n4.1\nĐược chủ động về phương pháp thực hiện công việc\n được giao:\n4.2 Tham gia ý kiến hoặc kiến nghị về các việc chuyên môn của đơn vị.\n4.3\nĐược cung cấp các thông tin chỉ đạo điều hành của tổ chức trong phạm vi nhiệm vụ được giao.\n4.4\nĐược yêu cầu cung cấp thông tin và đánh giá mức độ\n xác thực của thông tin phục vụ cho nhiệm vụ được giao.\n4.5\nĐược tham gia các cuộc họp trong và ngoài cơ quan theo sự phân công của cấp trên.\n5. Các yêu cầu về trình độ, năng lực 5.1- Yêu cầu về trình độ\nNhóm yêu cầu Yêu cầu cụ thể\nTrình độ đào tạo\n• Tốt nghiệp đại học trở lên với ngành hoặc chuyên ngành đào tạo phù hợp với lĩnh vực công tác.\n • Có bằng tốt nghiệp cao cấp lý luận chính trị hoặc bằng cao cấp lý luận chính trị - hành chính hoặc có giấy xác nhận trình độ lý\n luận chính trị tương đương cao cấp lý luận chính trị của cơ quan có thẩm quyền.\nBồi dưỡng, chứng chỉ\n• Có chứng chỉ bồi dưỡng kiến thức, kỹ năng quản lý nhà nước đối với công chức ngạch chuyên viên cao cấp hoặc tương đương hoặc có bằng cao cấp lý luận chính trị - hành chính.\nKinh nghiệm (thành tích công tác)\n• Có thời gian giữ ngạch chuyên viên chính hoặc tương đương từ đủ 06 năm trở lên. Trường hợp có thời gian tương đương với ngạch chuyên viên chính thì thời gian giữ ngạch chuyên viên chính tối thiểu 01 năm\n (đủ 12 tháng).\n • Trong thời gian giữ ngạch chuyên viên chính hoặc tương đương đã chủ trì hoặc tham gia xây dựng, thẩm định, góp ý kiến ít nhất 02 văn bản quy phạm pháp luật hoặc đề tài, đề án, dự án, chương trình nghiên cứu khoa học cấp nhà nước, cấp bộ, cấp ban, cấp ngành mà cơ quan sử dụng công chức được giao chủ trì nghiên cứu, xây dựng đã được cấp có thẩm quyền ban hành hoặc nghiệm thu Phẩm chất cá nhân\n• Tuyệt đối trung thành, tin tưởng, nghiêm túc chấp hành chủ trương, chính sách của Đảng, pháp luật của Nhà nước, quy định của cơ\n quan:\n • Tinh thần trách nhiệm cao với công việc với tập thể, phối hợp công tác tốt;\n • Trung thực, thẳng thắn, kiên định nhưng biết lắng nghe;\n • Điềm tĩnh, nguyên tắc, cẩn thận, bảo mật thông tin.\n • Khả năng đoàn kết nội bộ.\n • Chịu được áp lực trong công việc.\n • Tập trung, sáng tạo, tư duy độc lập và logic.\nCác yêu cầu khác\n• Có khả năng tham mưu, xây dựng, thực hiện, kiểm tra và đề xuất các chủ trương, chính sách, nghị quyết, kế hoạch, giải pháp đối với các vấn đề thực tiễn liên quan trong phạm vi chức năng, nhiệm vụ được giao.\n • Có khả năng cụ thể hoá và tổ chức thực hiện hiệu quả các chủ trương, đường lối của Đảng, chính sách pháp luật của Nhà nước ở\n lĩnh vực công tác được phân công.\n • Có khả năng đề xuất những chủ trương, xây dựng quy trình nội bộ và giải pháp giải quyết các vấn đề thực tiễn liên quan đến chức năng, nhiệm vụ của đơn vị.\n • Hiểu và vận dụng được các kiến thức chuyên sâu,\n nâng cao về lĩnh vực hoạt động và thực thi, kỹ năng xử lý các tình huống trong quá trình hướng dẫn, kiểm tra, giám sát, tham mưu, đề xuất và thực hiện công việc theo vị trí việc làm.\n • Hiểu và vận dụng được các kiến thức về phương pháp nghiên cứu, tổ chức, triển khai nghiên cứu, xây dựng các tài liệu, đề\n tài, đề án thuộc lĩnh vực chuyên môn đảm nhiệm.\n • Biết vận dụng các kiến thức cơ bản và nâng cao về ngành, lĩnh vực: có kỹ năng thuyết trình, giảng dạy, hướng dẫn nghiệp vụ về\n ngành, lĩnh vực.\n • Áp dụng thành thạo các kiến thức: kỹ thuật xây dựng, ban hành văn bản vào công việc theo yêu cầu của vị trí việc làm.\n5.2- Các năng lực Nhóm năng lực Tên năng lực Cấp độ\nNhóm năng lực chung\n• Đạo đức và bản lĩnh 4-5\n• Tổ chức thực hiện công việc 4-5\n• Kỹ thuật soạn thảo và ban hành văn bản 4-5\n• Giao tiếp ứng xử\n4-5\n• Quan hệ phối hợp 4-5\n• Sử dụng công nghệ thông tin Phù hợp với chức năng, nhiệm vụ của cơ quan, tổ chức, đơn vị sử dụng vị trí việc làm được cấp có thẩm quyền phê duyệt\n• Sử dụng ngoại ngữ\nNhóm năng lực chuyên môn\n• Khả năng xây dựng văn bản 4-5\n• Khả năng hướng dẫn thực hiện văn bản 4-5\n• Khả năng theo dõi, kiểm tra thực hiện văn bản 4-5\n• Khả năng thực thi 4-5\n• Khả năng phối hợp thực hiện 4-5 Nhóm năng lực quản lý\n• Tư duy chiến lược 3-4\n• Quản lý sự thay đổi 3-4\n• Ra quyết định 3-4\n• Quản lý nguồn lực 3-4\n• Phát triển công chức 3-4 Phê duyệt của lãnh\nđạo Biểu số 5 TÊN CƠ QUAN:.... \n TÊN TỔ CHỨC:....\n -------\nCỘNG HÒA XÃ HỘI CHỦ NGHĨA VIỆT NAM\n Độc lập - Tự do - Hạnh phúc \n ---------------\nBẢN MÔ TẢ CÔNG VIỆC Tên VTVL: Chuyên viên chính Quản lý kiến trúc Mã vị trí việc làm:\nNgày bắt đầu thực hiện:\nĐịa điểm làm việc:\n(Địa chỉ trụ sở cơ quan)\nQuy trình công việc liên quan\n(Tên tài liệu, quy trình công việc liên quan đến vị trí này)\n1. Mục tiêu vị trí việc làm: (Tóm tắt tổng quan về vị trí việc làm)\nTham gia tham mưu, tổng hợp và hoạch định chính sách, chiến lược có tính vĩ mô trong lĩnh vực kiến trúc.\nChủ trì hoặc tham gia xây dựng chương trình, đề án,\ndự án, các văn bản quy phạm pháp luật, quy hoạch chuyên ngành, văn bản hướng dẫn thực thi trong lĩnh vực kiến trúc.\n2. Các công việc và tiêu chí đánh giá\nTT Các công việc Tiêu chí đánh giá hoàn thành công việc Mảng công việc Công việc cụ thể\n2.1 Xây dựng văn bản 1. Tham gia tham mưu, tổng hợp và hoạch định chính sách, chiến lược có tính vĩ mô trong lĩnh vực kiến trúc.\n 2. Chủ trì hoặc tham gia xây dựng chương trình, đề\n án, dự án cấp bộ/tỉnh và các văn bản quy phạm pháp luật, thiết kế điển hình,\n quy hoạch chuyên ngành, văn bản hướng dẫn thực thi trong lĩnh vực kiến trúc.\n 3. Tham mưu nghiên cứu, xây dựng hệ thống quy chuẩn,\n tiêu chuẩn, định mức kinh tế kỹ thuật trong lĩnh vực kiến trúc.\n1. Dự thảo các văn bản được cấp có thẩm quyền ban hành.\n 2. Chương trình, đề án, dự án được nghiệm thu,\n ban hành.\n 3. Các quy hoạch được phê duyệt.\n 4. Quy chuẩn, tiêu chuẩn, định mức kinh tế kỹ thuật\n được ban hành.\n2.2 Hướng dẫn 1. Chủ trì hoặc tham gia việc phổ biến, hướng dẫn chủ trương, chính sách của Đảng và Nhà nước, văn bản quy phạm pháp luật trong lĩnh vực kiến trúc.\n 2. Hướng dẫn tổ chức, cá nhân về việc thực hiện quy định pháp luật trong lĩnh vực kiến trúc.\n1. Văn bản hướng dẫn được xây dựng theo đúng nội dung quy định, đúng tiến độ.\n 2. Tham gia thực hiện, phổ biến, hướng dẫn pháp luật theo lĩnh vực hoạt động.\n2.3 Theo dõi, kiểm tra 1. Tham gia theo dõi, kiểm tra và tổng hợp kết quả\n thực hiện các chính sách, chiến lược có tính vĩ mô trong lĩnh vực kiến trúc.\n 2. Chủ trì theo dõi, kiểm tra, tổng hợp việc thực thi pháp luật trong lĩnh vực kiến trúc theo quy định của pháp luật.\nBáo cáo kết quả kiểm tra, đánh giá và có đề xuất kịp thời, đúng kế hoạch, được cấp thẩm quyền phê duyệt.\n2.4 Thực thi 1. Tham gia triển khai chương trình, dự án, đề\n án, đồ án quy hoạch đã được phê duyệt từ cấp bộ/tỉnh trong lĩnh vực kiến trúc.\n 2. Chủ trì thực hiện các hoạt động nghiệp vụ theo quy định pháp luật.\n 3. Chủ trì thực hiện các quy trình, thủ tục theo\n đúng quy định.\n1. Kết quả triển khai công việc theo đúng kế hoạch:\n đảm bảo tiến độ, chất lượng theo quy định.\n 2. Các hoạt động nghiệp vụ, các quy trình, thủ tục\n được thực hiện theo đúng quy định.\n2.5 Nghiên cứu đề tài khoa học, dự án sự nghiệp kinh tế\nChủ trì hoặc tham gia nghiên cứu các đề tài khoa học, dự án sự nghiệp kinh tế cấp nhà nước, cấp bộ/tỉnh trong lĩnh vực kiến trúc.\nĐề tài, dự án được nghiệm thu ở mức đạt trở lên 2.6 Phối hợp thực hiện Có trách nhiệm phối hợp thực hiện các công việc liên quan theo lĩnh vực nhiệm vụ được phân công.\nCông việc, nhiệm vụ được giao thông suốt, tạo được mối quan hệ công tác phát triển hiệu quả cao.\n2.7 Họp, hội nghị, hội thảo Tham dự các cuộc họp, hội nghị, hội thảo liên quan đến lĩnh vực chuyên môn ở trong và ngoài cơ quan theo phân công.\nTham dự đầy đủ, tiếp thu, trao đổi thông tin, triển khai thực hiện theo kết luận cuộc họp 2.8 Xây dựng và thực hiện kế hoạch công tác năm, quý,\n tháng, tuần của cá nhân.\nXây dựng, thực hiện kế hoạch theo đúng kế hoạch công tác của đơn vị, cơ quan và nhiệm vụ được giao.\n2.9 Thực hiện các nhiệm vụ khác do cấp trên trực tiếp giao.\n3. Các mối quan hệ trong công việc 3.1- Bên trong\nĐược quản lý trực tiếp và kiểm duyệt kết quả bởi Quan hệ phối hợp trực tiếp trong đơn vị\nCác đơn vị phối hợp chính Lãnh đạo trực tiếp Các công chức chuyên môn khác trong đơn vị\nCác cơ quan, tổ chức,\n đơn vị thuộc Bộ, địa phương có liên quan.\n (Lưu ý: Việc xác định đơn vị phối hợp chính cần căn cứ vào mối quan hệ của tổ chức sử dụng vị trí việc làm này)\n3.2- Bên ngoài Ban, bộ, ngành,\n địa phương có quan hệ chính Bản chất quan hệ\n• Các cơ quan, tổ chức, đơn vị có hoạt động, liên quan đến ngành, lĩnh vực tổ chức bộ máy thuộc phạm vi quản lý của đơn vị.\n (Lưu ý: Việc xác định các cơ quan, tổ chức,\n đơn vị có quan hệ chính cần căn cứ vào chức năng; nhiệm vụ của tổ chức sử dụng vị trí việc làm này)\n• Tham gia các cuộc họp có liên quan.\n • Cung cấp các thông tin theo yêu cầu.\n • Thu thập các thông tin cần thiết cho việc thực hiện công việc chuyên môn.\n • Lấy các thông tin thống kê.\n • Thực hiện các báo cáo theo yêu cầu.\n4. Phạm vi quyền hạn TT Quyền hạn cụ thể\n4.1\nĐược chủ động về phương pháp thực hiện công việc\n được giao;\n4.2 Tham gia ý kiến hoặc kiến nghị về các việc chuyên môn của đơn vị.\n4.3\nĐược cung cấp các thông tin chỉ đạo điều hành của tổ chức trong phạm vi nhiệm vụ được giao.\n4.4\nĐược yêu cầu cung cấp thông tin và đánh giá mức độ\n xác thực của thông tin phục vụ cho nhiệm vụ được giao.\n4.5\nĐược tham gia các cuộc họp trong và ngoài cơ quan theo sự phân công của cấp trên.\n5. Các yêu cầu về trình độ, năng lực 5.1- Yêu cầu về trình độ\nNhóm yêu cầu Yêu cầu cụ thể\nTrình độ đào tạo\n• Tốt nghiệp đại học trở lên với ngành hoặc chuyên ngành đào tạo phù hợp với lĩnh vực công tác.\nBồi dưỡng, chứng chỉ\n• Có chứng chỉ bồi dưỡng kiến thức, kỹ năng quản lý nhà nước đối với công chức ngạch chuyên viên chính hoặc tương đương hoặc có bằng cao cấp lý luận chính trị - hành chính.\nKinh nghiệm (thành tích công tác)\n• Có thời gian giữ ngạch chuyên viên hoặc tương\n đương từ đủ 09 năm trở lên. Trường hợp có thời gian tương đương với ngạch chuyên viên thì thời gian giữ ngạch chuyên viên tối thiểu 01 năm (đủ 12 tháng).\n • Trong thời gian giữ ngạch chuyên viên hoặc tương đương đã chủ trì hoặc tham gia xây dựng, thẩm định, góp ý kiến ít nhất 01 văn bản quy phạm pháp luật hoặc đề tài, đề án, dự án, chương trình nghiên cứu khoa học cấp cơ sở trở lên mà cơ quan sử dụng công chức được giao chủ trì\n nghiên cứu, xây dựng đã được cấp có thẩm quyền ban hành hoặc nghiệm thu.\nPhẩm chất cá nhân\n• Tuyệt đối trung thành, tin tưởng, nghiêm túc chấp hành chủ trương, chính sách của Đảng, pháp luật của Nhà nước, quy định của cơ\n quan:\n • Tinh thần trách nhiệm cao với công việc với tập thể, phối hợp công tác tốt;\n • Trung thực, thẳng thắn, kiên định nhưng biết lắng nghe;\n • Điềm tĩnh, nguyên tắc, cẩn thận, bảo mật thông tin.\n • Khả năng đoàn kết nội bộ.\n • Chịu được áp lực trong công việc.\n • Tập trung, sáng tạo, tư duy độc lập và logic.\nCác yêu cầu khác\n• Có khả năng tham mưu, xây dựng, thực hiện, kiểm tra và đề xuất các chủ trương, chính sách, nghị quyết, kế hoạch, giải pháp đối với các vấn đề thực tiễn liên quan trong phạm vi chức năng, nhiệm vụ được giao.\n • Có khả năng cụ thể hoá và tổ chức thực hiện hiệu quả các chủ trương, đường lối của Đảng, chính sách pháp luật của Nhà nước ở\n lĩnh vực công tác được phân công.\n • Có khả năng đề xuất những chủ trương, xây dựng quy trình nội bộ và giải pháp giải quyết các vấn đề thực tiễn liên quan đến chức năng, nhiệm vụ của đơn vị.\n • Hiểu và vận dụng được các kiến thức chuyên sâu,\n nâng cao về lĩnh vực hoạt động và thực thi, kỹ năng xử lý các tình huống trong quá trình hướng dẫn, kiểm tra, giám sát, tham mưu, đề xuất và thực hiện công việc theo vị trí việc làm.\n • Hiểu và vận dụng được các kiến thức về phương pháp nghiên cứu, tổ chức, triển khai nghiên cứu, xây dựng các tài liệu, đề\n tài, đề án thuộc lĩnh vực chuyên môn đảm nhiệm.\n • Biết vận dụng các kiến thức cơ bản và nâng cao về ngành, lĩnh vực; có kỹ năng thuyết trình, giảng dạy, hướng dẫn nghiệp vụ về\n ngành, lĩnh vực.\n • Áp dụng thành thạo các kiến thức; kỹ thuật xây dựng, ban hành văn bản vào công việc theo yêu cầu của vị trí việc làm.\n5.2- Các năng lực Nhóm năng lực Tên năng lực Cấp độ\nNhóm năng lực chung\n• Đạo đức và bản lĩnh 3-4\n• Tổ chức thực hiện công việc 3-4\n• Kỹ thuật soạn thảo và ban hành văn bản 3-4\n• Giao tiếp ứng xử\n3-4\n• Quan hệ phối hợp 3-4\n• Sử dụng công nghệ thông tin Phù hợp với chức năng,\n nhiệm vụ của cơ quan, tổ chức, đơn vị sử dụng vị trí việc làm được cấp có thẩm quyền phê duyệt\n• Sử dụng ngoại ngữ\nNhóm năng lực chuyên môn\n• Khả năng xây dựng văn bản 3-4\n• Khả năng hướng dẫn thực hiện văn bản 3-4\n• Khả năng theo dõi, kiểm tra thực hiện văn bản 3-4\n• Khả năng thực thi 3-4\n• Khả năng phối hợp thực hiện 3-4 Nhóm năng lực quản lý\n• Tư duy chiến lược 2-3\n• Quản lý sự thay đổi 2-3\n• Ra quyết định 2-3\n• Quản lý nguồn lực 2-3\n• Phát triển công chức 2-3 Phê duyệt của lãnh\nđạo Biểu số 6 TÊN CƠ QUAN:.... \n TÊN TỔ CHỨC:....\n -------\nCỘNG HÒA XÃ HỘI CHỦ NGHĨA VIỆT NAM\n Độc lập - Tự do - Hạnh phúc \n ---------------\nBẢN MÔ TẢ CÔNG VIỆC Tên VTVL: Chuyên viên Quản lý kiến trúc Mã vị trí việc làm:\nNgày bắt đầu thực hiện:\nĐịa điểm làm việc:\n(Địa chỉ trụ sở cơ quan)\nQuy trình công việc liên quan\n(Tên tài liệu, quy trình công việc liên quan đến vị trí này)\n1. Mục tiêu vị trí việc làm: (Tóm tắt tổng quan về vị trí việc làm)\nTham gia xây dựng chương trình, đề án, dự án, các văn bản quy phạm pháp luật, quy hoạch chuyên ngành, văn bản hướng dẫn thực thi trong lĩnh vực kiến trúc.\nChủ trì hoặc tham gia nghiên cứu, đề xuất cấp thẩm quyền các giải pháp, biện pháp xử lý vấn đề cụ thể trong lĩnh vực công việc được phân công.\n2. Các công việc và tiêu chí đánh giá\nTT Các công việc Tiêu chí đánh giá hoàn thành công việc Mảng công việc Công việc cụ thể\n2.1 Xây dựng văn bản 1. Tham gia xây dựng chương trình, đề án. dự án cấp bộ/tỉnh và các văn bản quy phạm pháp luật, thiết kế điển hình, quy hoạch chuyên ngành và văn bản hướng dẫn thực thi trong lĩnh vực kiến trúc.\n 2. Tham gia nghiên cứu, xây dựng hệ thống quy chuẩn,\n tiêu chuẩn, định mức kinh tế kỹ thuật trong lĩnh vực kiến trúc.\n 3. Chủ trì nghiên cứu, tham mưu cho UBND huyện các văn bản hướng dẫn việc tổ chức thực hiện các hoạt động trong lĩnh vực quản lý kiến trúc trên địa bàn (đối với VTVL tại phòng chuyên môn thuộc UBND cấp huyện).\n1. Dự thảo các văn bản được cấp có thẩm quyền ban hành.\n 2. Chương trình, đề án, dự án được nghiệm thu,\n ban hành.\n 3. Các quy hoạch được phê duyệt.\n 4. Quy chuẩn, tiêu chuẩn, định mức kinh tế kỹ thuật\n được ban hành.\n2.2 Hướng dẫn 1. Tham gia việc phổ biến, hướng dẫn chủ trương,\n chính sách của Đảng và Nhà nước, văn bản quy phạm pháp luật trong lĩnh vực kiến trúc.\n 2. Hướng dẫn tổ chức, cá nhân về việc thực hiện quy định pháp luật trong lĩnh vực kiến trúc.\n1. Văn bản hướng dẫn được xây dựng theo đúng nội dung quy định, đúng tiến độ.\n 2. Tham gia thực hiện, phổ biến, hướng dẫn pháp luật theo lĩnh vực hoạt động.\n2.3 Theo dõi, kiểm tra Tham gia theo dõi, kiểm tra, tổng hợp việc thực thi pháp luật trong lĩnh vực kiến trúc theo quy định của pháp luật.\nBáo cáo kết quả kiểm tra, đánh giá và có đề xuất kịp thời, đúng kế hoạch, được cấp thẩm quyền phê duyệt.\n2.4 Thực thi 1. Tham gia triển khai chương trình, dự án, đề\n án, đồ án quy hoạch đã được phê duyệt từ cấp bộ/tỉnh trong lĩnh vực kiến trúc.\n 2. Thực hiện các hoạt động nghiệp vụ theo quy định pháp luật.\n 3. Chủ trì thực hiện các quy trình, thủ tục theo\n đúng quy định.\n1. Kết quả triển khai công việc theo đúng kế hoạch:\n đảm bảo tiến độ, chất lượng theo quy định.\n 2. Các hoạt động nghiệp vụ, các quy trình, thủ tục\n được thực hiện theo đúng quy định.\n2.5 Nghiên cứu đề tài khoa học, dự án sự nghiệp kinh tế\nTham gia nghiên cứu các đề tài khoa học, dự án sự\n nghiệp kinh tế cấp bộ/tỉnh, chủ trì nghiên cứu các đề tài, dự án cấp cơ sở\n trong lĩnh vực kiến trúc.\nĐề tài, dự án được nghiệm thu ở mức đạt trở lên 2.6 Phối hợp thực hiện Có trách nhiệm phối hợp thực hiện các công việc liên quan theo phân công.\nCông việc, nhiệm vụ được giao thông suốt, tạo được mối quan hệ công tác phát triển hiệu quả cao.\n2.7 Họp, hội nghị, hội thảo Tham dự các cuộc họp, hội nghị, hội thảo liên quan đến lĩnh vực chuyên môn ở trong và ngoài cơ quan theo phân công.\nTham dự đầy đủ, tiếp thu, trao đổi thông tin, triển khai thực hiện theo kết luận cuộc họp 2.8 Xây dựng và thực hiện kế hoạch công tác năm, quý,\n tháng, tuần của cá nhân.\nXây dựng, thực hiện kế hoạch theo đúng kế hoạch công tác của đơn vị, cơ quan và nhiệm vụ được giao.\n2.9 Thực hiện các nhiệm vụ khác do cấp trên trực tiếp giao.\n3. Các mối quan hệ trong công việc 3.1- Bên trong\nĐược quản lý trực tiếp và kiểm duyệt kết quả bởi Quan hệ phối hợp trực tiếp trong đơn vị\nCác đơn vị phối hợp chính Lãnh đạo trực tiếp Các công chức chuyên môn khác trong đơn vị\nCác cơ quan, tổ chức,\n đơn vị thuộc Bộ, địa phương có liên quan.\n (Lưu ý: Việc xác định đơn vị phối hợp chính cần căn cứ vào mối quan hệ của tổ chức sử dụng vị trí việc làm này)\n3.2- Bên ngoài Ban, bộ, ngành,\n địa phương có quan hệ chính Bản chất quan hệ\n• Các cơ quan, tổ chức, đơn vị có hoạt động liên quan đến ngành, lĩnh vực tổ chức hộ máy thuộc phạm vi quản lý của đơn vị.\n (Lưu ý: Việc xác định các cơ quan, tổ chức,\n đơn vị có quan hệ chính cần căn cứ vào chức năng; nhiệm vụ của tổ chức sử dụng vị trí việc làm này)\n• Tham gia các cuộc họp có liên quan.\n • Cung cấp các thông tin theo yêu cầu.\n • Thu thập các thông tin cần thiết cho việc thực hiện công việc chuyên môn.\n • Lấy các thông tin thống kê.\n • Thực hiện các báo cáo theo yêu cầu.\n4. Phạm vi quyền hạn TT Quyền hạn cụ thể\n4.1\nĐược chủ động về phương pháp thực hiện công việc\n được giao:\n4.2 Tham gia ý kiến hoặc kiến nghị về các việc chuyên môn của đơn vị.\n4.3\nĐược cung cấp các thông tin chỉ đạo điều hành của tổ chức trong phạm vi nhiệm vụ được giao.\n4.4\nĐược yêu cầu cung cấp thông tin và đánh giá mức độ\n xác thực của thông tin phục vụ cho nhiệm vụ được giao.\n4.5\nĐược tham gia các cuộc họp trong và ngoài cơ quan theo sự phân công của cấp trên.\n5. Các yêu cầu về trình độ, năng lực 5.1- Yêu cầu về trình độ\nNhóm yêu cầu Yêu cầu cụ thể\nTrình độ đào tạo\n• Tốt nghiệp đại học trở lên với ngành hoặc chuyên ngành đào tạo phù hợp với lĩnh vực công tác.\nBồi dưỡng, chứng chỉ\n• Có chứng chỉ bồi dưỡng kiến thức, kỹ năng quản lý nhà nước đối với công chức ngạch chuyên viên và tương đương.\nPhẩm chất cá nhân\n• Tuyệt đối trung thành, tin tưởng, nghiêm túc chấp hành chủ trương, chính sách của Đang, pháp luật của Nhà nước, quy định của cơ\n quan;\n • Tinh thần trách nhiệm cao với công việc với tập thể, phối hợp công tác tốt:\n • Trung thực, thẳng thắn, kiên định nhưng biết lắng nghe;\n • Điềm tĩnh, nguyên tắc, cẩn thận, bảo mật thông tin.\n • Khả năng đoàn kết nội bộ.\n • Chịu được áp lực trong công việc.\n • Tập trung, sáng tạo, tư duy độc lập và logic.\nCác yêu cầu khác\n• Có khả năng tham mưu, xây dựng, thực hiện, kiểm tra và đề xuất các chủ trương, chính sách, nghị quyết, kế hoạch, giải pháp đối với các vấn đề thực tiễn liên quan trong phạm vi chức năng, nhiệm vụ được giao.\n • Có khả năng cụ thể hoá và tổ chức thực hiện hiệu quả các chủ trương, đường lối của Đảng, chính sách pháp luật của Nhà nước ở\n lĩnh vực công tác được phân công.\n • Có khả năng đề xuất những chủ trương, xây dựng quy trình nội bộ và giải pháp giải quyết các vấn đề thực tiễn liên quan đến chức năng, nhiệm vụ của đơn vị.\n • Hiểu và vận dụng được các kiến thức chuyên sâu,\n nâng cao về lĩnh vực hoạt động và thực thi, kỹ năng xử lý các tình huống trong quá trình hướng dẫn, kiểm tra, giám sát, tham mưu, đề xuất và thực hiện công việc theo vị trí việc làm.\n • Hiểu và vận dụng được các kiến thức về phương pháp nghiên cứu, tổ chức, triển khai nghiên cứu, xây dựng các tài liệu, đề\n tài, đề án thuộc lĩnh vực chuyên môn đảm nhiệm.\n • Biết vận dụng các kiến thức cơ bản và nâng cao về ngành, lĩnh vực: có kỹ năng thuyết trình, giảng dạy, hướng dẫn nghiệp vụ về\n ngành, lĩnh vực.\n • Áp dụng thành thạo các kiến thức: kỹ thuật xây dựng, ban hành văn bản vào công việc theo yêu cầu của vị trí việc làm.\n5.2- Các năng lực Nhóm năng lực Tên năng lực Cấp độ\nNhóm năng lực chung\n• Đạo đức và bản lĩnh 2-3\n• Tổ chức thực hiện công việc 2-3\n• Kỹ thuật soạn thảo và ban hành văn bản 2-3\n• Giao tiếp ứng xử\n2-3\n• Quan hệ phối hợp 2-3\n• Sử dụng công nghệ thông tin Phù hợp với chức năng,\n nhiệm vụ của cơ quan, tổ chức, đơn vị sử dụng vị trí việc làm được cấp có thẩm quyền phê duyệt\n• Sử dụng ngoại ngữ\nNhóm năng lực chuyên môn\n• Khả năng xây dựng văn bản 2-3\n• Khả năng hướng dẫn thực hiện văn bản 2-3\n• Khả năng theo dõi, kiểm tra thực hiện văn bản 2-3\n• Khả năng thực thi 2-3\n• Khả năng phối hợp thực hiện 2-3 Nhóm năng lực quản lý\n• Tư duy chiến lược 1-2\n• Quản lý sự thay đổi 1-2\n• Ra quyết định 1-2\n• Quản lý nguồn lực 1-2\n• Phát triển công chức 1-2 Phê duyệt của lãnh\nđạo Biểu số 7 TÊN CƠ QUAN:.... \n TÊN TỔ CHỨC:....\n -------\nCỘNG HÒA XÃ HỘI CHỦ NGHĨA VIỆT NAM\n Độc lập - Tự do - Hạnh phúc \n ---------------\nBẢN MÔ TẢ CÔNG VIỆC Tên VTVL: Chuyên viên cao cấp Quản lý hoạt động đầu tư xây dựng Mã vị trí việc làm:\nNgày bắt đầu thực hiện:\nĐịa điểm làm việc:\n(Địa chỉ trụ sở cơ quan)\nQuy trình công việc liên quan\n(Tên tài liệu, quy trình công việc liên quan đến vị trí này)\n1. Mục tiêu vị trí việc làm: (Tóm tắt tổng quan về vị trí việc làm)\nChủ trì tham mưu, tổng hợp và hoạch định chính sách, chiến lược có tính vĩ mô trong lĩnh vực quản lý hoạt động đầu tư xây dựng.\nChủ trì xây dựng chương trình, đề án, dự án, các văn bản quy phạm pháp luật, văn bản hướng dẫn thực thi trong lĩnh vực quản lý\nhoạt động đầu tư xây dựng.\n2. Các công việc và tiêu chí đánh giá\nTT Các công việc Tiêu chí đánh giá hoàn thành công việc Mảng công việc Công việc cụ thể\n2.1 Xây dựng văn bản 1. Chủ trì tham mưu, tổng hợp và hoạch định chính sách, chiến lược có tính vĩ mô trong lĩnh vực quản lý hoạt động đầu tư xây dựng.\n 2. Chủ trì xây dựng chương trình, đề án, dự án cấp quốc gia, cấp bộ và các văn bản quy phạm pháp luật, văn bản hướng dẫn thực thi trong lĩnh vực quản lý hoạt động đầu tư xây dựng.\n 3. Tham mưu nghiên cứu, xây dựng hệ thống quy chuẩn,\n tiêu chuẩn, định mức kinh tế kỹ thuật trong lĩnh vực hoạt động đầu tư xây dựng.\n1. Dự thảo các văn bản1 được cấp có thẩm quyền2 ban hành.\n 2. Chương trình, đề án, dự án được nghiệm thu,\n ban hành.\n 3. Quy chuẩn, tiêu chuẩn, định mức kinh tế kỹ thuật\n được ban hành.\n2.2 Hướng dẫn 1. Chủ trì việc phổ biến, hướng dẫn chủ trương,\n chính sách của Đảng và Nhà nước, văn bản quy phạm pháp luật trong lĩnh vực quản lý hoạt động đầu tư xây dựng.\n 2. Hướng dẫn tổ chức, cá nhân về việc thực hiện quy định pháp luật trong lĩnh vực quản lý hoạt động đầu tư xây dựng.\n1. Văn bản hướng dẫn được xây dựng theo đúng nội dung quy định, đúng tiến độ.\n 2. Tham gia thực hiện, phổ biến, hướng dẫn pháp luật theo lĩnh vực hoạt động.\n2.3 Theo dõi, kiểm tra 1. Chủ trì theo dõi, kiểm tra và tổng hợp kết quả\n thực hiện các chính sách, chiến lược có tính vĩ mô trong lĩnh vực quản lý hoạt\n động đầu tư xây dựng.\n 2. Chủ trì theo dõi, kiểm tra, tổng hợp việc thực thi pháp luật trong lĩnh vực quản lý hoạt động đầu tư xây dựng theo quy định của pháp luật.\nBáo cáo kết quả kiểm tra, đánh giá và có đề xuất kịp thời, đúng kế hoạch, được cấp thẩm quyền phê duyệt.\n2.4 Thực thi 1. Chủ trì triển khai chương trình, dự án, đề án\n đã được phê duyệt từ cấp bộ trở lên lĩnh vực quản lý hoạt động đầu tư xây dựng.\n 2. Chủ trì thực hiện các hoạt động nghiệp vụ theo quy định pháp luật.\n 3. Chủ trì thực hiện các quy trình, thủ tục theo\n đúng quy định.\n1. Kết quả triển khai công việc theo đúng kế hoạch:\n đảm bảo tiến độ, chất lượng theo quy định.\n 2. Các hoạt động nghiệp vụ, các quy trình, thủ tục\n được thực hiện theo đúng quy định..\n2.5 Nghiên cứu đề tài khoa học, dự án sự nghiệp kinh tế\nChủ trì hoặc tham gia nghiên cứu các đề tài khoa học, dự án sự nghiệp kinh tế cấp nhà nước, cấp bộ trong lĩnh vực quản lý hoạt\n động đầu tư xây dựng.\nĐề tài, dự án được nghiệm thu ở mức đạt trở lên.\n2.6 Phối hợp thực hiện Có trách nhiệm phối hợp thực hiện các công việc liên quan theo lĩnh vực nhiệm vụ được phân công.\nCông việc, nhiệm vụ được giao thông suốt, tạo được mối quan hệ công tác phát triển hiệu quả cao.\n2.7 Họp, hội nghị, hội thảo Chủ trì các báo cáo cuộc họp, hội nghị, hội thảo liên quan đến lĩnh vực chuyên môn ở trong và ngoài cơ quan theo phân công.\nTham dự đầy đủ, tiếp thu, trao đổi thông tin, triển khai thực hiện theo kết luận cuộc họp 2.8 Xây dựng và thực hiện kế hoạch công tác năm, quý,\n tháng, tuần của cá nhân.\nXây dựng, thực hiện kế hoạch theo đúng kế hoạch công tác của đơn vị, cơ quan và nhiệm vụ được giao.\n2.9 Thực hiện các nhiệm vụ khác do cấp trên trực tiếp giao.\n3. Các mối quan hệ trong công việc 3.1- Bên trong\nĐược quản lý trực tiếp và kiểm duyệt kết quả bởi Quan hệ phối hợp trực tiếp trong đơn vị\nCác đơn vị phối hợp chính Lãnh đạo trực liếp Các công chức chuyên môn khác trong đơn vị\nCác cơ quan, tổ chức,\n đơn vị thuộc Bộ, địa phương có liên quan.\n (Lưu ý: Việc xác\n định đơn vị phối hợp chính cần căn cứ vào mối quan hệ của tổ chức sử dụng vị\n trí việc làm này)\n3.2- Bên ngoài Ban, bộ, ngành,\n địa phương có quan hệ chính Bản chất quan hệ\n• Các cơ quan, tổ chức, đơn vị có hoạt động liên quan đến ngành, lĩnh vực tổ chức bộ máy thuộc phạm vi quản lý của đơn vị.\n (Lưu ý: Việc xác định các cơ quan, tổ chức,\n đơn vị có quan hệ chính cần căn cứ vào chức năng; nhiệm vụ của tổ chức sử dụng vị trí việc làm này)\n• Tham gia các cuộc họp có liên quan.\n • Cung cấp các thông tin theo yêu cầu.\n • Thu thập các thông tin cần thiết cho việc thực hiện công việc chuyên môn.\n • Lấy các thông tin thống kê.\n • Thực hiện các báo cáo theo yêu cầu.\n4. Phạm vi quyền hạn TT Quyền hạn cụ thể\n4.1\nĐược chủ động về phương pháp thực hiện công việc được giao;\n4.2 Tham gia ý kiến hoặc kiến nghị về các việc chuyên môn của đơn vị.\n4.3\nĐược cung cấp các thông tin chỉ đạo điều hành của tổ chức trong phạm vi nhiệm vụ được giao.\n4.4\nĐược yêu cầu cung cấp thông tin và đánh giá mức độ\n xác thực của thông tin phục vụ cho nhiệm vụ được giao.\n4.5\nĐược tham gia các cuộc họp trong và ngoài cơ quan theo sự phân công của cấp trên.\n5. Các yêu cầu về trình độ, năng lực 5.1- Yêu cầu về trình độ\nNhóm yêu cầu Yêu cầu cụ thể\nTrình độ đào tạo\n• Tốt nghiệp đại học trở lên với ngành hoặc chuyên ngành đào tạo phù hợp với lĩnh vực công tác.\n • Có bằng tốt nghiệp cao cấp lý luận chính trị hoặc bằng cao cấp lý luận chính trị - hành chính hoặc có giấy xác nhận trình độ lý\n luận chính trị tương đương cao cấp lý luận chính trị của cơ quan có thẩm quyền.\nBồi dưỡng, chứng chỉ\n• Có chứng chỉ bồi dưỡng kiến thức, kỹ năng quản lý nhà nước đối với công chức ngạch chuyên viên cao cấp hoặc tương đương hoặc có bằng cao cấp lý luận chính trị - hành chính.\nKinh nghiệm (thành tích công tác)\n• Có thời gian giữ ngạch chuyên viên chính hoặc tương đương từ đủ 06 năm trở lên. Trường hợp có thời gian tương đương với ngạch chuyên viên chính thì thời gian giữ ngạch chuyên viên chính tối thiểu 01 năm\n (đủ 12 tháng).\n • Trong thời gian giữ ngạch chuyên viên chính hoặc tương đương đã chủ trì hoặc tham gia xây dựng, thẩm định, góp ý kiến ít nhất 02 văn bản quy phạm pháp luật hoặc đề tài, đề án, dự án, chương trình nghiên cứu khoa học cấp nhà nước, cấp bộ, cấp ban, cấp ngành mà cơ quan sử dụng công chức được giao chủ trì nghiên cứu, xây dựng đã được cấp có thẩm quyền ban hành hoặc nghiệm thu.\nPhẩm chất cá nhân\n• Tuyệt đối trung thành, tin tưởng, nghiêm túc chấp hành chủ trương, chính sách của Đảng, pháp luật của Nhà nước, quy định của cơ\n quan;\n • Tinh thần trách nhiệm cao với công việc với tập thể, phối hợp công tác tốt:\n • Trung thực, thẳng thắn, kiên định nhưng biết lắng nghe:\n • Điềm tĩnh, nguyên tắc, cẩn thận, bảo mật thông tin.\n • Khả năng đoàn kết nội bộ.\n • Chịu được áp lực trong công việc.\n • Tập trung, sáng tạo, tư duy độc lập và logic.\nCác yêu cầu khác\n• Có khả năng tham mưu, xây dựng, thực hiện, kiểm tra và đề xuất các chủ trương, chính sách, nghị quyết, kế hoạch, giải pháp đối với các vấn đề thực tiễn liên quan trong phạm vi chức năng, nhiệm vụ được giao.\n • Có khả năng cụ thể hoá và tổ chức thực hiện hiệu quả các chủ trương, đường lối của Đảng, chính sách pháp luật của Nhà nước ở\n lĩnh vực công tác được phân công.\n • Có khả năng đề xuất những chủ trương, xây dựng quy trình nội bộ và giải pháp giải quyết các vấn đề thực tiễn liên quan đến chức năng, nhiệm vụ của đơn vị.\n • Hiểu và vận dụng được các kiến thức chuyên sâu,\n nâng cao về lĩnh vực hoạt động và thực thi, kỹ năng xử lý các tình huống trong quá trình hướng dẫn, kiểm tra, giám sát, tham mưu, đề xuất và thực hiện công việc theo vị trí việc làm.\n • Hiểu và vận dụng được các kiến thức về phương pháp nghiên cứu, tổ chức, triển khai nghiên cứu, xây dựng các tài liệu, đề\n tài, đề án thuộc lĩnh vực chuyên môn đảm nhiệm.\n • Biết vận dụng các kiến thức cơ bản và nâng cao về ngành, lĩnh vực; có kỹ năng thuyết trình, giảng dạy, hướng dẫn nghiệp vụ về\n ngành, lĩnh vực.\n • Áp dụng thành thạo các kiến thức: kỹ thuật xây dựng, ban hành văn bản vào công việc theo yêu cầu của vị trí việc làm.\n5.2- Các năng lực Nhóm năng lực Tên năng lực Cấp độ\nNhóm năng lực chung\n• Đạo đức và bản lĩnh 4-5\n• Tổ chức thực hiện công việc 4-5\n• Kỹ thuật soạn thảo và ban hành văn bản 4-5\n• Giao tiếp ứng xử\n4-5\n• Quan hệ phối hợp 4-5\n• Sử dụng công nghệ thông tin Phù hợp với chức năng, nhiệm vụ của cơ quan, tổ chức, đơn vị sử dụng vị trí việc làm được cấp có thẩm quyền phê duyệt\n• Sử dụng ngoại ngữ\nNhóm năng lực chuyên môn\n• Khả năng xây dựng văn bản 4-5\n• Khả năng hướng dẫn thực hiện văn bản 4-5\n• Khả năng theo dõi, kiểm tra thực hiện văn bản 4-5\n• Khả năng thực thi 4-5\n• Khả năng phối hợp thực hiện 4-5 Nhóm năng lực quản lý\n• Tư duy chiến lược 3-4\n• Quản lý sự thay đổi 3-4\n• Ra quyết định 3-4\n• Quản lý nguồn lực 3-4\n• Phát triển công chức 3-4 Phê duyệt của lãnh\nđạo Biểu số 8 TÊN CƠ QUAN:.... \n TÊN TỔ CHỨC:....\n -------\nCỘNG HÒA XÃ HỘI CHỦ NGHĨA VIỆT NAM\n Độc lập - Tự do - Hạnh phúc \n ---------------\nBẢN MÔ TẢ CÔNG VIỆC Tên VTVL: Chuyên viên chính Quản lý hoạt động đầu tư xây dựng Mã vị trí việc làm:\nNgày bắt đầu thực hiện:\nĐịa điểm làm việc:\n(Địa chỉ trụ sở cơ quan)\nQuy trình công việc liên quan\n(Tên tài liệu, quy trình công việc liên quan đến vị trí này)\n1. Mục tiêu vị trí việc làm: (Tóm tắt tổng quan về vị trí việc làm)\nTham gia tham mưu, tổng hợp và hoạch định chính sách, chiến lược có tính vĩ mô trong lĩnh vực hoạt động đầu tư xây dựng.\nChủ trì hoặc tham gia xây dựng chương trình, đề án,\ndự án, các văn bản quy phạm pháp luật, văn bản hướng dẫn thực thi trong lĩnh vực hoạt động đầu tư xây dựng.\n2. Các công việc và tiêu chí đánh giá\nTT Các công việc Tiêu chí đánh giá hoàn thành công việc Mảng công việc Công việc cụ thể\n2.1 Xây dựng văn bản 1. Tham gia tham mưu, tổng hợp và hoạch định chính sách, chiến lược có tính vĩ mô trong lĩnh vực hoạt động đầu tư xây dựng.\n 2. Chủ trì hoặc tham gia xây dựng chương trình, đề\n án, dự án cấp bộ/tỉnh và các văn bản quy phạm pháp luật, văn bản hướng dẫn thực thi trong lĩnh hoạt động đầu tư xây dựng.\n 3. Tham mưu nghiên cứu, xây dựng hệ thống quy chuẩn,\n tiêu chuẩn, định mức kinh tế kỹ thuật trong lĩnh vực hoạt động đầu tư xây dựng.\n1. Dự thảo các văn bản được cấp có thẩm quyền ban hành.\n 2. Chương trình, đề án, dự án được nghiệm thu,\n ban hành.\n 3. Quy chuẩn, tiêu chuẩn, định mức kinh tế kỹ thuật\n được ban hành.\n2.2 Hướng dẫn 1. Chủ trì hoặc tham gia việc phổ biến, hướng dẫn chủ trương, chính sách của Đảng và Nhà nước, văn bản quy phạm pháp luật trong lĩnh vực hoạt động đầu tư xây dựng.\n 2. Hướng dẫn tổ chức, cá nhân về việc thực hiện quy định pháp luật trong lĩnh vực hoạt động đầu tư xây dựng.\n1. Văn bản hướng dẫn được xây dựng theo đúng nội dung quy định, đúng tiến độ.\n 2. Tham gia thực hiện, phổ biến, hướng dẫn pháp luật theo lĩnh vực hoạt động.\n2.3 Theo dõi, kiểm tra 1. Tham gia theo dõi, kiểm tra và tổng hợp kết quả\n thực hiện các chính sách, chiến lược có tính vĩ mô trong lĩnh vực hoạt động đầu tư xây dựng.\n 2. Chủ trì theo dõi, kiểm tra, tổng hợp việc thực thi pháp luật trong lĩnh vực hoạt động đầu tư xây dựng theo quy định của pháp luật.\nBáo cáo kết quả kiểm tra, đánh giá và có đề xuất kịp thời, đúng kế hoạch, được cấp thẩm quyền phê duyệt.\n2.4 Thực thi 1. Tham gia triển khai chương trình, dự án, đề án\n đã được phê duyệt từ cấp bộ/tỉnh lĩnh vực quản lý hoạt động đầu tư xây dựng.\n 2. Chủ trì thực hiện các hoạt động nghiệp vụ theo quy định pháp luật.\n 3. Chủ trì thực hiện các quy trình, thủ tục theo\n đúng quy định.\n1. Kết quả triển khai công việc theo đúng kế hoạch:\n đảm bảo tiến độ, chất lượng theo quy định.\n 2. Các hoạt động nghiệp vụ, các quy trình, thủ tục\n được thực hiện theo đúng quy định.\n2.5 Nghiên cứu đề tài khoa học, dự án sự nghiệp kinh tế\nChủ trì hoặc tham gia nghiên cứu các đề tài khoa học, dự án sự nghiệp kinh tế cấp nhà nước, cấp bộ/tỉnh trong lĩnh vực hoạt động\n đầu tư xây dựng.\nĐề tài, dự án được nghiệm thu ở mức đạt trở lên 2.6 Phối hợp thực hiện Có trách nhiệm phối hợp thực hiện các công việc liên quan theo lĩnh vực nhiệm vụ được phân công.\nCông việc, nhiệm vụ được giao thông suốt, tạo được mối quan hệ công tác phát triển hiệu quả cao.\n2.7 Họp, hội nghị, hội thảo Tham dự các cuộc họp, hội nghị, hội thảo liên quan đến lĩnh vực chuyên môn ở trong và ngoài cơ quan theo phân công Tham dự đầy đủ, tiếp thu, trao đổi thông tin, triển khai thực hiện theo kết luận cuộc họp 2.8 Xây dựng và thực hiện kế hoạch công tác năm, quý,\n tháng, tuần của cá nhân Xây dựng, thực hiện kế hoạch theo đúng kế hoạch công tác của đơn vị, cơ quan và nhiệm vụ được giao.\n2.9 Thực hiện các nhiệm vụ khác do cấp trên trực tiếp giao.\n3. Các mối quan hệ trong công việc 3.1- Bên trong\nĐược quản lý trực tiếp và kiểm duyệt kết quả bởi Quan hệ phối hợp trực tiếp trong đơn vị\nCác đơn vị phối hợp chính Lãnh đạo trực liếp Các công chức chuyên môn khác trong đơn vị\nCác cơ quan, tổ chức,\n đơn vị thuộc Bộ, địa phương có liên quan.\n (Lưu ý: Việc xác định đơn vị phối hợp chính cần căn cứ vào mối quan hệ của tổ chức sử dụng vị trí việc làm này)\n3.2- Bên ngoài Ban, bộ, ngành,\n địa phương có quan hệ chính Bản chất quan hệ\n• Các cơ quan, tổ chức, đơn vị có hoạt động liên quan đến ngành, lĩnh vực tổ chức bộ máy thuộc phạm vi quản lý của đơn vị.\n (Lưu ý: Việc xác định các cơ quan, tổ chức,\n đơn vị có quan hệ chính cần căn cứ vào chức năng; nhiệm vụ của tổ chức sử dụng vị trí việc làm này)\n• Tham gia các cuộc họp có liên quan.\n • Cung cấp các thông tin theo yêu cầu.\n • Thu thập các thông tin cần thiết cho việc thực hiện công việc chuyên môn.\n • Lấy các thông tin thống kê.\n • Thực hiện các báo cáo theo yêu cầu.\n4. Phạm vi quyền hạn TT Quyền hạn cụ thể\n4.1\nĐược chủ động về phương pháp thực hiện công việc\n được giao;\n4.2 Tham gia ý kiến hoặc kiến nghị về các việc chuyên môn của đơn vị.\n4.3\nĐược cung cấp các thông tin chỉ đạo điều hành của tổ chức trong phạm vi nhiệm vụ được giao.\n4.4\nĐược yêu cầu cung cấp thông tin và đánh giá mức độ\n xác thực của thông tin phục vụ cho nhiệm vụ được giao.\n4.5\nĐược tham gia các cuộc họp trong và ngoài cơ quan theo sự phân công của cấp trên.\n5. Các yêu cầu về trình độ, năng lực 5.1- Yêu cầu về trình độ\nNhóm yêu cầu Yêu cầu cụ thể\nTrình độ đào tạo\n• Tốt nghiệp đại học trở lên với ngành hoặc chuyên ngành đào tạo phù hợp với lĩnh vực công tác.\nBồi dưỡng, chứng chỉ\n• Có chứng chỉ bồi dưỡng kiến thức, kỹ năng quản lý nhà nước đối với công chức ngạch chuyên viên chính hoặc tương đương hoặc có bằng cao cấp lý luận chính trị - hành chính.\nKinh nghiệm (thành tích công tác)\n• Có thời gian giữ ngạch chuyên viên hoặc tương đương từ đủ 09 năm trở lên. Trường hợp có thời gian tương đương với ngạch chuyên viên thì thời gian giữ ngạch chuyên viên tối thiểu 01 năm (đủ 12 tháng).\n • Trong thời gian giữ ngạch chuyên viên hoặc tương đương đã chủ trì hoặc tham gia xây dựng, thẩm định, góp ý kiến ít nhất 01 văn bản quy phạm pháp luật hoặc đề tài, đề án, dự án, chương trình nghiên cứu khoa học cấp cơ sở trở lên mà cơ quan sử dụng công chức được giao chủ trì\n nghiên cứu, xây dựng đã được cấp có thẩm quyền ban hành hoặc nghiệm thu.\nPhẩm chất cá nhân\n• Tuyệt đối trung thành, tin tưởng, nghiêm túc chấp hành chủ trương, chính sách của Đảng, pháp luật của Nhà nước, quy định của cơ\n quan:\n • Tinh thần trách nhiệm cao với công việc với tập thể, phối hợp công tác tốt:\n • Trung thực, thẳng thắn, kiên định nhưng biết lắng nghe:\n • Điềm tĩnh, nguyên tắc, cẩn thận, bảo mật thông tin.\n • Khả năng đoàn kết nội bộ.\n • Chịu được áp lực trong công việc.\n • Tập trung, sáng tạo, tư duy độc lập và logic.\nCác yêu cầu khác\n• Có khả năng tham mưu, xây dựng, thực hiện, kiểm tra và đề xuất các chủ trương, chính sách, nghị quyết, kế hoạch, giải pháp đối với các vấn đề thực tiễn liên quan trong phạm vi chức năng, nhiệm vụ được giao.\n • Có khả năng cụ thể hoá và tổ chức thực hiện hiệu quả các chủ trương, đường lối của Đảng, chính sách pháp luật của Nhà nước ở\n lĩnh vực công tác được phân công.\n • Có khả năng đề xuất những chủ trương, xây dựng quy trình nội bộ và giải pháp giải quyết các vấn đề thực tiễn liên quan đến chức năng, nhiệm vụ của đơn vị.\n • Hiểu và vận dụng được các kiến thức chuyên sâu,\n nâng cao về lĩnh vực hoạt động và thực thi, kỹ năng xử lý các tình huống trong quá trình hướng dẫn, kiểm tra, giám sát, tham mưu, đề xuất và thực hiện công việc theo vị trí việc làm.\n • Hiểu và vận dụng được các kiến thức về phương pháp nghiên cứu, tổ chức, triển khai nghiên cứu, xây dựng các tài liệu, đề\n tài, đề án thuộc lĩnh vực chuyên môn đảm nhiệm.\n • Biết vận dụng các kiến thức cơ bản và nâng cao về ngành, lĩnh vực; có kỹ năng thuyết trình, giảng dạy, hướng dẫn nghiệp vụ về\n ngành, lĩnh vực.\n • Áp dụng thành thạo các kiến thức; kỹ thuật xây dựng, ban hành văn bản vào công việc theo yêu cầu của vị trí việc làm.\n5.2- Các năng lực Nhóm năng lực Tên năng lực Cấp độ\nNhóm năng lực chung\n• Đạo đức và bản lĩnh 3-4\n• Tổ chức thực hiện công việc 3-4\n• Kỹ thuật soạn thảo và ban hành văn bản 3-4\n• Giao tiếp ứng xử\n3-4\n• Quan hệ phối hợp 3-4\n• Sử dụng công nghệ thông tin Phù hợp với chức năng,\n nhiệm vụ của cơ quan, tổ chức, đơn vị sử dụng vị trí việc làm được cấp có thẩm quyền phê duyệt\n• Sử dụng ngoại ngữ\nNhóm năng lực chuyên môn\n• Khả năng xây dựng văn bản 3-4\n• Khả năng hướng dẫn thực hiện văn bản 3-4\n• Khả năng theo dõi, kiểm tra thực hiện văn bản 3-4\n• Khả năng thực thi 3-4\n• Khả năng phối hợp thực hiện 3-4 Nhóm năng lực quản lý\n• Tư duy chiến lược 2-3\n• Quản lý sự thay đổi 2-3\n• Ra quyết định 2-3\n• Quản lý nguồn lực 2-3\n• Phát triển công chức 2-3 Phê duyệt của lãnh\nđạo Biểu số 9 TÊN CƠ QUAN:.... \n TÊN TỔ CHỨC:....\n -------\nCỘNG HÒA XÃ HỘI CHỦ NGHĨA VIỆT NAM\n Độc lập - Tự do - Hạnh phúc \n ---------------\nBẢN MÔ TẢ CÔNG VIỆC Tên VTVL: Chuyên viên Quản lý hoạt động đầu tư xây dựng Mã vị trí việc làm:\nNgày bắt đầu thực hiện:\nĐịa điểm làm việc:\n(Địa chỉ trụ sở cơ quan)\nQuy trình công việc liên quan\n(Tên tài liệu, quy trình công việc liên quan đến vị trí này)\n1. Mục tiêu vị trí việc làm: (Tóm tắt tổng quan về vị trí việc làm)\nTham gia xây dựng chương trình, đề án, dự án, các văn bản quy phạm pháp luật, văn bản hướng dẫn thực thi trong lĩnh vực hoạt động\nđầu tư xây dựng.\nChủ trì hoặc tham gia nghiên cứu, đề xuất cấp thẩm quyền các giải pháp, biện pháp xử lý vấn đề cụ thể trong lĩnh vực công việc được phân công.\n2. Các công việc và tiêu chí đánh giá\nTT Các công việc Tiêu chí đánh giá hoàn thành công việc Mảng công việc Công việc cụ thể\n2.1 Xây dựng văn bản 1. Tham gia xây dựng chương trình, đề án, dự án cấp bộ/tỉnh và các văn bản quy phạm pháp luật, văn bản hướng dẫn thực thi trong lĩnh vực hoạt động đầu tư xây dựng.\n 2. Tham gia nghiên cứu, xây dựng hệ thống quy chuẩn,\n tiêu chuẩn, định mức kinh tế kỹ thuật trong lĩnh vực hoạt động đầu tư xây dựng.\n 3. Chủ trì nghiên cứu, tham mưu cho UBND huyện các văn bản hướng dẫn việc tổ chức thực hiện các hoạt động trong lĩnh vực quản lý hoạt động đầu tư xây dựng trên địa bàn (đối với VTVL tại phòng chuyên môn thuộc UBND cấp huyện).\n1. Dự thảo các văn bản được cấp có thẩm quyền ban hành.\n 2. Chương trình, đề án, dự án được nghiệm thu,\n ban hành.\n 3. Quy chuẩn, tiêu chuẩn, định mức kinh tế kỹ thuật\n được ban hành.\n2.2 Hướng dẫn 1. Tham gia việc phổ biến, hướng dẫn chủ trương,\n chính sách của Đảng và Nhà nước, văn bản quy phạm pháp luật trong lĩnh vực hoạt\n động đầu tư xây dựng.\n 2. Hướng dẫn tổ chức, cá nhân về việc thực hiện quy định pháp luật trong lĩnh vực hoạt động đầu tư xây dựng.\n1. Văn bản hướng dẫn được xây dựng theo đúng nội dung quy định, đúng tiến độ.\n 2. Tham gia thực hiện, phổ biến, hướng dẫn pháp luật theo lĩnh vực hoạt động.\n2.3 Theo dõi, kiểm tra Tham gia theo dõi, kiểm tra, tổng hợp việc thực thi pháp luật trong lĩnh vực hoạt động đầu tư xây dựng theo quy định của pháp luật.\nBáo cáo kết quả kiểm tra, đánh giá và có đề xuất kịp thời, đúng kế hoạch, được cấp thẩm quyền phê duyệt.\n2.4 Thực thi 1. Tham gia triển khai chương trình, dự án, đề án\n đã được phê duyệt từ cấp bộ/tỉnh trong lĩnh vực hoạt động đầu tư xây dựng lĩnh vực quản lý hoạt động đầu tư xây dựng.\n 2. Thực hiện các hoạt động nghiệp vụ theo quy định pháp luật.\n 3. Chủ trì thực hiện các quy trình, thủ tục theo\n đúng quy định.\n1. Kết quả triển khai công việc theo đúng kế hoạch;\n đảm bảo tiến độ, chất lượng theo quy định.\n 2. Các hoạt động nghiệp vụ, các quy trình, thủ tục\n được thực hiện theo đúng quy định.\n2.5 Nghiên cứu đề tài khoa học, dự án sự nghiệp kinh tế\nTham gia nghiên cứu các đề tài khoa học, dự án sự\n nghiệp kinh tế cấp bộ/tỉnh, chủ trì nghiên cứu các đề tài, dự án cấp cơ sở\n trong lĩnh vực hoạt động đầu tư xây dựng.\nĐề tài, dự án được nghiệm thu ở mức đạt trở lên 2.6 Phối hợp thực hiện Có trách nhiệm phối hợp thực hiện các công việc liên quan theo phân công.\nCông việc, nhiệm vụ được giao thông suốt, tạo được mối quan hệ công tác phát triển hiệu quả cao.\n2.7 Họp, hội nghị, hội thảo Tham dự các cuộc họp, hội nghị, hội thảo liên quan đến lĩnh vực chuyên môn ở trong và ngoài cơ quan theo phân công.\nTham dự đầy đủ, tiếp thu, trao đổi thông tin, triển khai thực hiện theo kết luận cuộc họp 2.8 Xây dựng và thực hiện kế hoạch công tác năm, quý,\n tháng, tuần của cá nhân.\nXây dựng, thực hiện kế hoạch theo đúng kế hoạch công tác của đơn vị, cơ quan và nhiệm vụ được giao.\n2.9 Thực hiện các nhiệm vụ khác do cấp trên trực tiếp giao.\n3. Các mối quan hệ trong công việc 3.1- Bên trong\nĐược quản lý trực tiếp và kiểm duyệt kết quả bởi Quan hệ phối hợp trực tiếp trong đơn vị\nCác đơn vị phối hợp chính Lãnh đạo trực tiếp Các công chức chuyên môn khác trong đơn vị\nCác cơ quan, tổ chức, đơn vị thuộc Bộ, địa phương có liên quan.\n (Lưu ý: Việc xác\n định đơn vị phối hợp chính cần căn cứ vào mối quan hệ của tổ chức sử dụng vị\n trí việc làm này)\n3.2- Bên ngoài Ban, bộ, ngành,\n địa phương có quan hệ chính Bản chất quan hệ\n• Các cơ quan, tổ chức, đơn vị có hoạt động liên quan đến ngành, lĩnh vực tổ chức bộ máy thuộc phạm vi quản lý của đơn vị.\n (Lưu ý: Việc xác định các cơ quan, tổ chức,\n đơn vị có quan hệ chính cần căn cứ vào chức năng; nhiệm vụ của tổ chức sử dụng vị trí việc làm này)\n• Tham gia các cuộc họp có liên quan.\n • Cung cấp các thông tin theo yêu cầu.\n • Thu thập các thông tin cần thiết cho việc thực hiện công việc chuyên môn.\n • Lấy các thông tin thống kê.\n • Thực hiện các báo cáo theo yêu cầu.\n4. Phạm vi quyền hạn TT Quyền hạn cụ thể\n4.1\nĐược chủ động về phương pháp thực hiện công việc được giao;\n4.2 Tham gia ý kiến hoặc kiến nghị về các việc chuyên môn của đơn vị.\n4.3\nĐược cung cấp các thông tin chỉ đạo điều hành của tổ chức trong phạm vi nhiệm vụ được giao.\n4.4\nĐược yêu cầu cung cấp thông tin và đánh giá mức độ\n xác thực của thông tin phục vụ cho nhiệm vụ được giao.\n4.5\nĐược tham gia các cuộc họp trong và ngoài cơ quan theo sự phân công của cấp trên.\n5. Các yêu cầu về trình độ, năng lực 5.1- Yêu cầu về trình độ\nNhóm yêu cầu Yêu cầu cụ thể\nTrình độ đào tạo\n• Tốt nghiệp đại học trở lên với ngành hoặc chuyên ngành đào tạo phù hợp với lĩnh vực công tác.\nBồi dưỡng, chứng chỉ\n• Có chứng chỉ bồi dưỡng kiến thức, kỹ năng quản lý nhà nước đối với công chức ngạch chuyên viên và tương đương.\nPhẩm chất cá nhân\n• Tuyệt đối trung thành, tin tưởng, nghiêm túc chấp hành chủ trương, chính sách của Đảng, pháp luật của Nhà nước, quy định của cơ\n quan;\n • Tinh thần trách nhiệm cao với công việc với tập thể, phối hợp công tác tốt;\n • Trung thực, thẳng thắn, kiên định nhưng biết lắng nghe;\n • Điềm tĩnh, nguyên tắc, cẩn thận, bảo mật thông tin.\n • Khả năng đoàn kết nội bộ.\n • Chịu được áp lực trong công việc.\n • Tập trung, sáng tạo, tư duy độc lập và logic.\nCác yêu cầu khác\n• Có khả năng tham mưu, xây dựng, thực hiện, kiểm tra và đề xuất các chủ trương, chính sách, nghị quyết, kế hoạch, giải pháp đối với các vấn đề thực tiễn liên quan trong phạm vi chức năng, nhiệm vụ được giao.\n • Có khả năng cụ thể hóa và tổ chức thực hiện hiệu quả các chủ trương, đường lối của Đảng, chính sách pháp luật của Nhà nước ở\n lĩnh vực công tác được phân công.\n • Có khả năng đề xuất những chủ trương, xây dựng quy trình nội bộ và giải pháp giải quyết các vấn đề thực tiễn liên quan đến chức năng, nhiệm vụ của đơn vị.\n • Hiểu và vận dụng được các kiến thức chuyên sâu,\n nâng cao về lĩnh vực hoạt động và thực thi, kỹ năng xử lý các tình huống trong quá trình hướng dẫn, kiểm tra, giám sát, tham mưu, đề xuất và thực hiện công việc theo vị trí việc làm.\n • Hiểu và vận dụng được các kiến thức về phương pháp nghiên cứu, tổ chức, triển khai nghiên cứu, xây dựng các tài liệu, đề\n tài, đề án thuộc lĩnh vực chuyên môn đảm nhiệm.\n • Biết vận dụng các kiến thức cơ bản và nâng cao về ngành, lĩnh vực: có kỹ năng thuyết trình, giảng dạy, hướng dẫn nghiệp vụ về\n ngành, lĩnh vực.\n • Áp dụng thành thạo các kiến thức: kỹ thuật xây dựng, ban hành văn bản vào công việc theo yêu cầu của vị trí việc làm.\n5.2- Các năng lực Nhóm năng lực Tên năng lực Cấp độ\nNhóm năng lực chung\n• Đạo đức và bản lĩnh 2-3\n• Tổ chức thực hiện công việc 2-3\n• Kỹ thuật soạn thảo và ban hành văn bản 2-3\n• Giao tiếp ứng xử\n2-3\n• Quan hệ phối hợp 2-3\n• Sử dụng công nghệ thông tin Phù hợp với chức năng,\n nhiệm vụ của cơ quan, tổ chức, đơn vị sử dụng vị trí việc làm được cấp có thẩm quyền phê duyệt\n• Sử dụng ngoại ngữ\nNhóm năng lực chuyên môn\n• Khả năng xây dựng văn bản 2-3\n• Khả năng hướng dẫn thực hiện văn bản 2-3\n• Khả năng theo dõi, kiểm tra thực hiện văn bản 2-3\n• Khả năng thực thi 2-3\n• Khả năng phối hợp thực hiện 2-3 Nhóm năng lực quản lý\n• Tư duy chiến lược 1-2\n• Quản lý sự thay đổi 1-2\n• Ra quyết định 1-2\n• Quản lý nguồn lực 1-2\n• Phát triển công chức 1-2 Phê\n duyệt của lãnh đạo Biểu số 10 TÊN CƠ QUAN:....\n TÊN TỔ CHỨC:....\n -------\nCỘNG HÒA XÃ HỘI CHỦ NGHĨA VIỆT NAM\n Độc lập - Tự do - Hạnh phúc \n ---------------\nBẢN MÔ TẢ CÔNG VIỆC Tên VTVL: Chuyên viên cao cấp Quản lý phát triển\n đô thị\nMã vị trí việc làm:\nNgày bắt đầu thực hiện:\nĐịa điểm làm việc:\n(Địa chỉ trụ sở cơ quan)\nQuy trình công việc liên quan\n(Tên tài liệu, quy trình công việc liên quan đến vị trí này)\n1. Mục tiêu vị trí việc làm: (Tóm tắt tổng quan về vị trí việc làm)\nChủ trì tham mưu, tổng hợp và hoạch định chính sách, chiến lược có tính vĩ mô trong lĩnh vực phát triển đô thị.\nChủ trì xây dựng chương trình, đề án, dự án, các văn bản quy phạm pháp luật, quy hoạch chuyên ngành, văn bản hướng dẫn thực thi trong lĩnh vực phát triển đô thị.\n2. Các công việc và tiêu chí đánh giá\nTT Các công việc Tiêu chí đánh giá hoàn thành công việc Mảng công việc Công việc cụ thể\n2.1 Xây dựng văn bản 1. Chủ trì tham mưu, tổng hợp và hoạch định chính sách, chiến lược có tính vĩ mô trong lĩnh vực phát triển đô thị.\n 2. Chủ trì xây dựng chương trình, đề án, dự án cấp quốc gia, cấp bộ và các văn bản quy phạm pháp luật, quy hoạch chuyên ngành,\n văn bản hướng dẫn thực thi trong lĩnh vực phát triển đô thị.\n 3. Tham mưu nghiên cứu, xây dựng hệ thống quy chuẩn,\n tiêu chuẩn, định mức kinh tế kỹ thuật trong lĩnh vực phát triển đô thị.\n1. Dự thảo các văn bản1 được cấp có thẩm quyền2 ban hành.\n 2. Chương trình, đề án, dự án được nghiệm thu,\n ban hành.\n 3. Các quy hoạch được phê duyệt.\n 4. Quy chuẩn, tiêu chuẩn, định mức kinh tế kỹ thuật\n được ban hành.\n2.2 Hướng dẫn 1. Chủ trì việc phổ biến, hướng dẫn chủ trương,\n chính sách của Đảng và Nhà nước, văn bản quy phạm pháp luật trong lĩnh vực phát triển đô thị.\n 2. Hướng dẫn tổ chức, cá nhân về việc thực hiện quy định pháp luật trong lĩnh vực phát triển đô thị.\n1. Văn bản hướng dẫn được xây dựng theo đúng nội dung quy định, đúng tiến độ.\n 2. Tham gia thực hiện, phổ biến, hướng dẫn pháp luật theo lĩnh vực hoạt động.\n2.3 Theo dõi, kiểm tra 1. Chủ trì theo dõi, kiểm tra và tổng hợp kết quả\n thực hiện các chính sách, chiến lược có tính vĩ mô trong lĩnh vực phát triển\n đô thị.\n 2. Chủ trì theo dõi, kiểm tra, tổng hợp việc thực thi pháp luật trong lĩnh vực phát triển đô thị theo quy định của pháp luật.\nBáo cáo kết quả kiểm tra, đánh giá và có đề xuất kịp thời, đúng kế hoạch, được cấp thẩm quyền phê duyệt.\n2.4 Thực thi 1. Chủ trì triển khai chương trình, dự án, đề án,\n đồ án quy hoạch đã được phê duyệt từ cấp bộ trở lên trong lĩnh vực phát triển\n đô thị.\n 2. Chủ trì thực hiện các hoạt động nghiệp vụ theo quy định pháp luật.\n 3. Chủ trì thực hiện các quy trình, thủ tục theo\n đúng quy định.\n1. Kết quả triển khai công việc theo đúng kế hoạch;\n đảm bảo tiến độ, chất lượng theo quy định.\n 2. Các hoạt động nghiệp vụ, các quy trình, thủ tục\n được thực hiện theo đúng quy định.\n2.5 Nghiên cứu đề tài khoa học, dự án sự nghiệp kinh tế\nChủ trì hoặc tham gia nghiên cứu các đề tài khoa học, dự án sự nghiệp kinh tế cấp nhà nước, cấp bộ trong lĩnh vực phát triển\n đô thị.\nĐề tài, dự án được nghiệm thu ở mức đạt trở lên.\n2.6 Phối hợp thực hiện Có trách nhiệm phối hợp thực hiện các công việc liên quan theo lĩnh vực nhiệm vụ được phân công.\nCông việc, nhiệm vụ được giao thông suốt, tạo được mối quan hệ công tác phát triển hiệu quả cao.\n2.7 Họp, hội nghị, hội thảo Chủ trì các báo cáo cuộc họp, hội nghị, hội thảo liên quan đến lĩnh vực chuyên môn ở trong và ngoài cơ quan theo phân công.\nTham dự đầy đủ, tiếp thu, trao đổi thông tin, triển khai thực hiện theo kết luận cuộc họp 2.8 Xây dựng và thực hiện kế hoạch công tác năm, quý,\n tháng, tuần của cá nhân Xây dựng, thực hiện kế hoạch theo đúng kế hoạch công tác của đơn vị, cơ quan và nhiệm vụ được giao.\n2.9 Thực hiện các nhiệm vụ khác do cấp trên trực tiếp giao.\n3. Các mối quan hệ trong công việc 3.1- Bên trong\nĐược quản lý trực tiếp và kiểm duyệt kết quả bởi Quan hệ phối hợp trực tiếp trong đơn vị\nCác đơn vị phối hợp chính Lãnh đạo trực tiếp Các công chức chuyên môn khác trong đơn vị\nCác cơ quan, tổ chức,\n đơn vị thuộc Bộ, địa phương có liên quan.\n (Lưu ý: Việc xác định đơn vị phối hợp chính cần căn cứ vào mối quan hệ của tổ chức sử dụng vị trí việc làm này)\n3.2- Bên ngoài Ban, bộ, ngành,\n địa phương có quan hệ chính Bản chất quan hệ\n• Các cơ quan, tổ chức, đơn vị có hoạt động liên quan đến ngành, lĩnh vực tổ chức bộ máy thuộc phạm vi quản lý của đơn vị.\n (Lưu ý: Việc xác định các cơ quan, tổ chức,\n đơn vị có quan hệ chính cần căn cứ vào chức năng; nhiệm vụ của tổ chức sử dụng vị trí việc làm này)\n• Tham gia các cuộc họp có liên quan.\n • Cung cấp các thông tin theo yêu cầu.\n • Thu thập các thông tin cần thiết cho việc thực hiện công việc chuyên môn.\n • Lấy các thông tin thống kê.\n • Thực hiện các báo cáo theo yêu cầu.\n4. Phạm vi quyền hạn TT Quyền hạn cụ thể\n4.1\nĐược chủ động về phương pháp thực hiện công việc\n được giao;\n4.2 Tham gia ý kiến hoặc kiến nghị về các việc chuyên môn của đơn vị.\n4.3\nĐược cung cấp các thông tin chỉ đạo điều hành của tổ chức trong phạm vi nhiệm vụ được giao.\n4.4\nĐược yêu cầu cung cấp thông tin và đánh giá mức độ\n xác thực của thông tin phục vụ cho nhiệm vụ được giao.\n4.5\nĐược tham gia các cuộc họp trong và ngoài cơ quan theo sự phân công của cấp trên.\n5. Các yêu cầu về trình độ, năng lực 5.1- Yêu cầu về trình độ\nNhóm yêu cầu Yêu cầu cụ thể\nTrình độ đào tạo\n• Tốt nghiệp đại học trở lên với ngành hoặc chuyên ngành đào tạo phù hợp với lĩnh vực công tác.\n • Có bằng tốt nghiệp cao cấp lý luận chính trị hoặc bằng cao cấp lý luận chính trị - hành chính hoặc có giấy xác nhận trình độ lý\n luận chính trị tương đương cao cấp lý luận chính trị của cơ quan có thẩm quyền.\nBồi dưỡng, chứng chỉ\n• Có chứng chỉ bồi dưỡng kiến thức, kỹ năng quản lý nhà nước đối với công chức ngạch chuyên viên cao cấp hoặc tương đương hoặc có bằng cao cấp lý luận chính trị - hành chính.\nKinh nghiệm (thành tích công tác)\n• Có thời gian giữ ngạch chuyên viên chính hoặc tương đương từ đủ 06 năm trở lên. Trường hợp có thời gian tương đương với ngạch chuyên viên chính thì thời gian giữ ngạch chuyên viên chính tối thiểu 01 năm\n (đủ 12 tháng).\n • Trong thời gian giữ ngạch chuyên viên chính hoặc tương đương đã chủ trì hoặc tham gia xây dựng, thẩm định, góp ý kiến ít nhất 02 văn bản quy phạm pháp luật hoặc đề tài, đề án, dự án, chương trình nghiên cứu khoa học cấp nhà nước, cấp bộ, cấp ban, cấp ngành mà cơ quan sử dụng công chức được giao chủ trì nghiên cứu, xây dựng đã được cấp có thẩm quyền ban hành hoặc nghiệm thu.\nPhẩm chất cá nhân\n• Tuyệt đối trung thành, tin tưởng, nghiêm túc chấp hành chủ trương, chính sách của Đảng, pháp luật của Nhà nước, quy định của cơ\n quan;\n • Tinh thần trách nhiệm cao với công việc với tập thể, phối hợp công tác tốt;\n • Trung thực, thẳng thắn, kiên định nhưng biết lắng nghe;\n • Điềm tĩnh, nguyên tắc, cẩn thận, bảo mật thông tin.\n • Khả năng đoàn kết nội bộ.\n • Chịu được áp lực trong công việc.\n • Tập trung, sáng tạo, tư duy độc lập và logic.\nCác yêu cầu khác\n• Có khả năng tham mưu, xây dựng, thực hiện, kiểm tra và đề xuất các chủ trương, chính sách, nghị quyết, kế hoạch, giải pháp đối với các vấn đề thực tiễn liên quan trong phạm vi chức năng, nhiệm vụ được giao.\n • Có khả năng cụ thể hóa và tổ chức thực hiện hiệu quả các chủ trương, đường lối của Đảng, chính sách pháp luật của Nhà nước ở\n lĩnh vực công tác được phân công.\n • Có khả năng đề xuất những chủ trương, xây dựng quy trình nội bộ và giải pháp giải quyết các vấn đề thực tiễn liên quan đến chức năng, nhiệm vụ của đơn vị.\n • Hiểu và vận dụng được các kiến thức chuyên sâu,\n nâng cao về lĩnh vực hoạt động và thực thi, kỹ năng xử lý các tình huống trong quá trình hướng dẫn, kiểm tra, giám sát, tham mưu, đề xuất và thực hiện công việc theo vị trí việc làm.\n • Hiểu và vận dụng được các kiến thức về phương pháp nghiên cứu, tổ chức, triển khai nghiên cứu, xây dựng các tài liệu, đề\n tài, đề án thuộc lĩnh vực chuyên môn đảm nhiệm.\n • Biết vận dụng các kiến thức cơ bản và nâng cao về ngành, lĩnh vực; có kỹ năng thuyết trình, giảng dạy, hướng dẫn nghiệp vụ về\n ngành, lĩnh vực.\n • Áp dụng thành thạo các kiến thức; kỹ thuật xây dựng, ban hành văn bản vào công việc theo yêu cầu của vị trí việc làm.\n5.2- Các năng lực Nhóm năng lực Tên năng lực Cấp độ\nNhóm năng lực chung\n• Đạo đức và bản lĩnh 4-5\n• Tổ chức thực hiện công việc 4-5\n• Kỹ thuật soạn thảo và ban hành văn bản 4-5\n• Giao tiếp ứng xử\n4-5\n• Quan hệ phối hợp 4-5\n• Sử dụng công nghệ thông tin Phù hợp với chức năng, nhiệm vụ của cơ quan, tổ chức, đơn vị sử dụng vị trí việc làm được cấp có thẩm quyền phê duyệt\n• Sử dụng ngoại ngữ\nNhóm năng lực chuyên môn\n• Khả năng xây dựng văn bản 4-5\n• Khả năng hướng dẫn thực hiện văn bản 4-5\n• Khả năng theo dõi, kiểm tra thực hiện văn bản 4-5\n• Khả năng thực thi 4-5\n• Khả năng phối hợp thực hiện 4-5 Nhóm năng lực quản lý\n• Tư duy chiến lược 3-4\n• Quản lý sự thay đổi 3-4\n• Ra quyết định 3-4\n• Quản lý nguồn lực 3-4\n• Phát triển công chức 3-4 Phê\n duyệt của lãnh đạo Biểu số 11 TÊN CƠ QUAN:.... \n TÊN TỔ CHỨC:....\n -------\nCỘNG HÒA XÃ HỘI CHỦ NGHĨA VIỆT NAM\n Độc lập - Tự do - Hạnh phúc \n ---------------\nBẢN MÔ TẢ CÔNG VIỆC Tên VTVL: Chuyên viên chính Quản lý phát triển đô\n thị\nMã vị trí việc làm:\nNgày bắt đầu thực hiện:\nĐịa điểm làm việc:\n(Địa chỉ trụ sở cơ quan)\nQuy trình công việc liên quan\n(Tên tài liệu, quy trình công việc liên quan đến vị trí này )\n1. Mục tiêu vị trí việc làm: (Tóm tắt tổng quan về vị trí việc làm)\nTham gia tham mưu, tổng hợp và hoạch định chính sách, chiến lược có tính vĩ mô trong lĩnh vực phát triển đô thị.\nChủ trì hoặc tham gia xây dựng chương trình, đề án,\ndự án, các văn bản quy phạm pháp luật, quy hoạch chuyên ngành, văn bản hướng dẫn thực thi trong lĩnh vực phát triển đô thị.\n2. Các công việc và tiêu chí đánh giá\nTT Các công việc Tiêu chí đánh giá hoàn thành công việc Mảng công việc Công việc cụ thể\n2.1 Xây dựng văn bản 1. Tham gia tham mưu, tổng hợp và hoạch định chính sách, chiến lược có tính vĩ mô trong lĩnh vực phát triển đô thị.\n 2. Chủ trì hoặc tham gia xây dựng chương trình, đề\n án, dự án cấp bộ tỉnh và các văn bản quy phạm pháp luật, quy hoạch chuyên ngành, văn bản hướng dẫn thực thi trong lĩnh vực phát triển đô thị.\n 3. Tham mưu nghiên cứu, xây dựng hệ thống quy chuẩn,\n tiêu chuẩn, định mức kinh tế kỹ thuật trong lĩnh vực phát triển đô thị.\n1. Dự thảo các văn bản được cấp có thẩm quyền ban hành.\n 2. Chương trình, đề án, dự án được nghiệm thu,\n ban hành.\n 3. Các quy hoạch được phê duyệt.\n 4. Quy chuẩn, tiêu chuẩn, định mức kinh tế kỹ thuật\n được ban hành.\n2.2 Hướng dẫn 1. Chủ trì hoặc tham gia việc phổ biến, hướng dẫn chủ trương, chính sách của Đảng và Nhà nước, văn bản quy phạm pháp luật trong lĩnh vực phát triển đô thị.\n 2. Hướng dẫn tổ chức, cá nhân về việc thực hiện quy định pháp luật trong lĩnh vực phát triển đô thị.\n1. Văn bản hướng dẫn được xây dựng theo đúng nội dung quy định, đúng tiến độ.\n 2. Tham gia thực hiện, phổ biến, hướng dẫn pháp luật lĩnh vực hoạt động.\n2.3 Theo dõi, kiểm tra 1. Tham gia theo dõi, kiểm tra và tổng hợp kết quả\n thực hiện các chính sách, chiến lược có tính vĩ mô trong lĩnh vực phát triển\n đô thị.\n 2. Chủ trì theo dõi, kiểm tra, tổng hợp việc thực thi pháp luật trong lĩnh vực phát triển đô thị theo quy định của pháp luật.\nBáo cáo kết quả kiểm tra, đánh giá và có đề xuất kịp thời, đúng kế hoạch, được cấp thẩm quyền phê duyệt.\n2.4 Thực thi 1. Tham gia triển khai chương trình, dự án, đề\n án, đồ án quy hoạch đã được phê duyệt từ cấp bộ/tỉnh trong lĩnh vực phát triển\n đô thị.\n 2. Chủ trì thực hiện các hoạt động nghiệp vụ theo quy định pháp luật.\n 3. Chủ trì thực hiện các quy trình, thủ tục theo\n đúng quy định.\n1. Kết quả triển khai công việc theo đúng kế hoạch;\n đảm bảo tiến độ, chất lượng theo quy định.\n 2. Các hoạt động nghiệp vụ, các quy trình, thủ tục\n được thực hiện theo đúng quy định.\n2.5 Nghiên cứu đề tài khoa học, dự án sự nghiệp kinh tế\nChủ trì hoặc tham gia nghiên cứu các đề tài khoa học, dự án sự nghiệp kinh tế cấp nhà nước, cấp bộ/tỉnh trong lĩnh vực phát triển đô thị.\nĐề tài, dự án được nghiệm thu ở mức đạt trở lên 2.6 Phối hợp thực hiện Có trách nhiệm phối hợp thực hiện các công việc liên quan theo lĩnh vực nhiệm vụ được phân công.\nCông việc, nhiệm vụ được giao thông suốt, tạo được mối quan hệ công tác phát triển hiệu quả cao.\n2.7 Họp, hội nghị, hội thảo Tham dự các cuộc họp, hội nghị, hội thảo liên quan đến lĩnh vực chuyên môn ở trong và ngoài cơ quan theo phân công.\nTham dự đầy đủ, tiếp thu, trao đổi thông tin, triển khai thực hiện theo kết luận cuộc họp 2.8 Xây dựng và thực hiện kế hoạch công tác năm, quý,\n tháng, tuần của cá nhân.\nXây dựng, thực hiện kế hoạch theo đúng kế hoạch công tác của đơn vị, cơ quan và nhiệm vụ được giao.\n2.9 Thực hiện các nhiệm vụ khác do cấp trên trực tiếp giao.\n3. Các mối quan hệ trong công việc 3.1- Bên trong\nĐược quản lý trực tiếp và kiểm duyệt kết quả bởi Quan hệ phối hợp trực tiếp trong đơn vị\nCác đơn vị phối hợp chính Lãnh đạo trực tiếp Các công chức chuyên môn khác trong đơn vị\nCác cơ quan, tổ chức, đơn vị thuộc Bộ, địa phương có liên quan.\n (Lưu ý: Việc xác định đơn vị phối hợp chính cần căn cứ vào mối quan hệ của tổ chức sử dụng vị trí việc làm này)\n3.2- Bên ngoài Ban, bộ, ngành,\n địa phương có quan hệ chính Bản chất quan hệ\n• Các cơ quan, tổ chức, đơn vị có hoạt động liên quan đến ngành, lĩnh vực tổ chức bộ máy thuộc phạm vi quản lý của đơn vị.\n Lưu ý: Việc xác định các cơ quan, tổ chức, đơn vị có quan hệ chính cần căn cứ vào chức năng; nhiệm vụ của tổ chức sử dụng vị\n trí việc làm này)\n• Tham gia các cuộc họp có liên quan.\n • Cung cấp các thông tin theo yêu cầu.\n • Thu thập các thông tin cần thiết cho việc thực hiện công việc chuyên môn.\n • Lấy các thông tin thống kê.\n • Thực hiện các báo cáo theo yêu cầu.\n4. Phạm vi quyền hạn TT Quyền hạn cụ thể\n4.1\nĐược chủ động về phương pháp thực hiện công việc\n được giao;\n4.2 Tham gia ý kiến hoặc kiến nghị về các việc chuyên môn của đơn vị.\n4.3\nĐược cung cấp các thông tin chỉ đạo điều hành của tổ chức trong phạm vi nhiệm vụ được giao.\n4.4\nĐược yêu cầu cung cấp thông tin và đánh giá mức độ\n xác thực của thông tin phục vụ cho nhiệm vụ được giao.\n4.5\nĐược tham gia các cuộc họp trong và ngoài cơ quan theo sự phân công của cấp trên.\n5. Các yêu cầu về trình độ, năng lực 5.1- Yêu cầu về trình độ\nNhóm yêu cầu Yêu cầu cụ thể\nTrình độ đào tạo\n• Tốt nghiệp đại học trở lên với ngành hoặc chuyên ngành đào tạo phù hợp với lĩnh vực công tác.\nBồi dưỡng, chứng chỉ\n• Có chứng chỉ bồi dưỡng kiến thức, kỹ năng quản lý nhà nước đối với công chức ngạch chuyên viên chính hoặc tương đương hoặc có bằng cao cấp lý luận chính trị - hành chính.\nKinh nghiệm (thành tích công tác)\n• Có thời gian giữ ngạch chuyên viên hoặc tương đương từ đủ 09 năm trở lên. Trường hợp có thời gian tương đương với ngạch chuyên viên thì thời gian giữ ngạch chuyên viên tối thiểu 01 năm (đủ 12 tháng).\n • Trong thời gian giữ ngạch chuyên viên hoặc tương đương đã chủ trì hoặc tham gia xây dựng, thẩm định, góp ý kiến ít nhất 01 văn bản quy phạm pháp luật hoặc đề tài, đề án, dự án, chương trình nghiên cứu khoa học cấp cơ sở trở lên mà cơ quan sử dụng công chức được giao chủ trì\n nghiên cứu, xây dựng đã được cấp có thẩm quyền ban hành hoặc nghiệm thu.\nPhẩm chất cá nhân\n• Tuyệt đối trung thành, tin tưởng, nghiêm túc chấp hành chủ trương, chính sách của Đảng, pháp luật của Nhà nước, quy định của cơ\n quan;\n • Tinh thần trách nhiệm cao với công việc với tập thể, phối hợp công tác tốt;\n • Trung thực, thẳng thắn, kiên định nhưng biết lắng nghe;\n • Điềm tĩnh, nguyên tắc, cẩn thận, bảo mật thông tin.\n • Khả năng đoàn kết nội bộ.\n • Chịu được áp lực trong công việc.\n • Tập trung, sáng tạo, tư duy độc lập và logic.\nCác yêu cầu khác\n• Có khả năng tham mưu, xây dựng, thực hiện, kiểm tra và đề xuất các chủ trương, chính sách, nghị quyết, kế hoạch, giải pháp đối với các vấn đề thực tiễn liên quan trong phạm vi chức năng, nhiệm vụ được giao.\n • Có khả năng cụ thể hóa và tổ chức thực hiện hiệu quả các chủ trương, đường lối của Đảng, chính sách pháp luật của Nhà nước ở\n lĩnh vực công tác được phân công.\n • Có khả năng đề xuất những chủ trương, xây dựng quy trình nội bộ và giải pháp giải quyết các vấn đề thực tiễn liên quan đến chức năng, nhiệm vụ của đơn vị.\n • Hiểu và vận dụng được các kiến thức chuyên sâu,\n nâng cao về lĩnh vực hoạt động và thực thi, kỹ năng xử lý các tình huống trong quá trình hướng dẫn, kiểm tra, giám sát, tham mưu, đề xuất và thực hiện công việc theo vị trí việc làm.\n • Hiểu và vận dụng được các kiến thức về phương pháp nghiên cứu, tổ chức, triển khai nghiên cứu, xây dựng các tài liệu, đề\n tài, đề án thuộc lĩnh vực chuyên môn đảm nhiệm.\n • Biết vận dụng các kiến thức cơ bản và nâng cao về ngành, lĩnh vực; có kỹ năng thuyết trình, giảng dạy, hướng dẫn nghiệp vụ về\n ngành, lĩnh vực.\n • Áp dụng thành thạo các kiến thức; kỹ thuật xây dựng, ban hành văn bản vào công việc theo yêu cầu của vị trí việc làm.\n5.2- Các năng lực Nhóm năng lực Tên năng lực Cấp độ\nNhóm năng lực chung\n• Đạo đức và bản lĩnh 3-4\n• Tổ chức thực hiện công việc 3-4\n• Kỹ thuật soạn thảo và ban hành văn bản 3-4\n• Giao tiếp ứng xử\n3-4\n• Quan hệ phối hợp 3-4\n• Sử dụng công nghệ thông tin Phù hợp với chức năng, nhiệm vụ của cơ quan, tổ chức, đơn vị sử dụng vị trí việc làm được cấp có thẩm quyền phê duyệt\n• Sử dụng ngoại ngữ\n• Khả năng xây dựng văn bản 3-4 Nhóm năng lực chuyên môn\n• Khả năng hướng dẫn thực hiện văn bản 3-4\n• Khả năng theo dõi, kiểm tra thực hiện văn bản 3-4\n• Khả năng thực thi 3-4\n• Khả năng phối hợp thực hiện 3-4 Nhóm năng lực quản lý\n• Tư duy chiến lược 2-3\n• Quản lý sự thay đổi 2-3\n• Ra quyết định 2-3\n• Quản lý nguồn lực 2-3\n• Phát triển công chức 2-3 Phê\n duyệt của lãnh đạo Biểu số 12 TÊN CƠ QUAN:.... \n TÊN TỔ CHỨC:....\n -------\nCỘNG HÒA XÃ HỘI CHỦ NGHĨA VIỆT NAM\n Độc lập - Tự do - Hạnh phúc \n ---------------\nBẢN MÔ TẢ CÔNG VIỆC Tên VTVL: Chuyên viên Quản lý phát triển đô thị\nMã vị trí việc làm:\nNgày bắt đầu thực hiện:\nĐịa điểm làm việc:\n(Địa chỉ trụ sở cơ quan)\nQuy trình công việc liên quan\n(Tên tài liệu, quy trình công việc liên quan đến vị trí này)\n1. Mục tiêu vị trí việc làm: (Tóm tắt tổng quan về vị trí việc làm)\nTham gia xây dựng chương trình, đề án, dự án, các văn bản quy phạm pháp luật, quy hoạch chuyên ngành, văn bản hướng dẫn thực thi trong lĩnh vực phát triển đô thị.\nChủ trì hoặc tham gia nghiên cứu, đề xuất cấp thẩm quyền các giải pháp, biện pháp xử lý vấn đề cụ thể trong lĩnh vực công việc được phân công.\n2. Các công việc và tiêu chí đánh giá\nTT Các công việc Tiêu chí đánh giá hoàn thành công việc Mảng công việc Công việc cụ thể\n2.1 Xây dựng văn bản 1. Tham gia xây dựng chương trình, đề án, dự án cấp bộ/tỉnh và các văn bản quy phạm pháp luật, quy hoạch chuyên ngành, văn bản hướng dẫn thực thi trong lĩnh vực phát triển đô thị.\n 2. Tham gia nghiên cứu, xây dựng hệ thống quy chuẩn,\n tiêu chuẩn, định mức kinh tế kỹ thuật trong lĩnh vực phát triển đô thị.\n 3. Chủ trì nghiên cứu, tham mưu cho UBND huyện các văn bản hướng dẫn việc tổ chức thực hiện các hoạt động trong lĩnh vực quản lý phát triển đô thị trên địa bàn (đối với VTVL tại phòng chuyên môn thuộc UBND cấp huyện).\n1. Dự thảo các văn bản được cấp có thẩm quyền ban hành.\n 2. Chương trình, đề án, dự án được nghiệm thu,\n ban hành.\n 3. Các quy hoạch được phê duyệt.\n 4. Quy chuẩn, tiêu chuẩn, định mức kinh tế kỹ thuật\n được ban hành.\n2.2 Hướng dẫn 1. Tham gia việc phổ biến, hướng dẫn chủ trương,\n chính sách của Đảng và Nhà nước, văn bản quy phạm pháp luật trong lĩnh vực phát triển đô thị.\n 2. Hướng dẫn tổ chức, cá nhân về việc thực hiện quy định pháp luật trong lĩnh vực phát triển đỏ thị.\n1. Văn bản hướng dẫn được xây dựng theo đúng nội dung quy định, đúng tiến độ.\n 2. Tham gia thực hiện, phổ biến, hướng dẫn pháp luật theo lĩnh vực hoạt động.\n2.3 Theo dõi, kiểm tra Tham gia theo dõi, kiểm tra, tổng hợp việc thực thi pháp luật trong lĩnh vực phát triển đô thị theo quy định của pháp luật.\nBáo cáo kết quả kiểm tra, đánh giá và có đề xuất kịp thời, đúng kế hoạch, được cấp thẩm quyền phê duyệt.\n2.4 Thực thi 1. Tham gia triển khai chương trình, dự án, đề\n án, đồ án quy hoạch đã được phê duyệt từ cấp bộ/tỉnh trong lĩnh vực phát triển\n đô thị.\n 2. Thực hiện các hoạt động nghiệp vụ theo quy định pháp luật.\n 3. Chủ trì thực hiện các quy trình, thủ tục theo\n đúng quy định.\n1. Kết quả triển khai công việc theo đúng kế hoạch;\n đảm bảo tiến độ, chất lượng theo quy định.\n 2. Các hoạt động nghiệp vụ, các quy trình, thủ tục\n được thực hiện theo đúng quy định.\n2.5 Nghiên cứu đề lài khoa học, dự án sự nghiệp kinh tế\nTham gia nghiên cứu các đề tài khoa học, dự án sự\n nghiệp kinh tế cấp bộ/tỉnh, chủ trì nghiên cứu các đề tài, dự án cấp cơ sở\n trong lĩnh vực phát triển đô thị.\nĐề tài, dự án được nghiệm thu ở mức đạt trở lên 2.6 Phối hợp thực hiện Có trách nhiệm phối hợp thực hiện các công việc liên quan theo phân công.\nCông việc, nhiệm vụ được giao thông suốt, tạo được mối quan hệ công tác phát triển hiệu quả cao.\n2.7 Họp, hội nghị, hội thảo Tham dự các cuộc họp, hội nghị, hội thảo liên quan đến lĩnh vực chuyên môn ở trong và ngoài cơ quan theo phân công.\nTham dự đầy đủ, tiếp thu, trao đổi thông tin, triển khai thực hiện theo kết luận cuộc họp 2.8 Xây dựng và thực hiện kế hoạch công tác năm, quý,\n tháng, tuần của cá nhân.\nXây dựng, thực hiện kế hoạch theo đúng kế hoạch công tác của đơn vị, cơ quan và nhiệm vụ được giao.\n2.9 Thực hiện các nhiệm vụ khác do cấp trên trực tiếp giao.\n3. Các mối quan hệ trong công việc 3.1- Bên trong\nĐược quản lý trực tiếp và kiểm duyệt kết quả bởi Quan hệ phối hợp trực tiếp trong đơn vị\nCác đơn vị phối hợp chính Lãnh đạo trực tiếp Các công chức chuyên môn khác trong đơn vị\nCác cơ quan, tổ chức,\n đơn vị thuộc Bộ, địa phương có liên quan.\n (Lưu ý: Việc xác định đơn vị phối hợp chính cần căn cứ vào mối quan hệ của tổ chức sử dụng vị trí việc làm này)\n3.2- Bên ngoài Ban, bộ, ngành,\n địa phương có quan hệ chính Bản chất quan hệ\n• Các cơ quan, tổ chức, đơn vị có hoạt động liên quan đến ngành, lĩnh vực tổ chức bộ máy thuộc phạm vi quản lý của đơn vị.\n (Lưu ý: Việc xác định các cơ quan, tổ chức,\n đơn vị có quan hệ chính cần căn cứ vào chức năng; nhiệm vụ của tổ chức sử dụng vị trí việc làm này)\n• Tham gia các cuộc họp có liên quan.\n • Cung cấp các thông tin theo yêu cầu.\n • Thu thập các thông tin cần thiết cho việc thực hiện công việc chuyên môn.\n • Lấy các thông tin thống kê.\n • Thực hiện các báo cáo theo yêu cầu.\n4. Phạm vi quyền hạn TT Quyền hạn cụ thể\n4.1\nĐược chủ động về phương pháp thực hiện công việc\n được giao;\n4.2 Tham gia ý kiến hoặc kiến nghị về các việc chuyên môn của đơn vị.\n4.3\nĐược cung cấp các thông tin chỉ đạo điều hành của tổ chức trong phạm vi nhiệm vụ được giao.\n4.4\nĐược yêu cầu cung cấp thông tin và đánh giá mức độ\n xác thực của thông tin phục vụ cho nhiệm vụ được giao.\n4.5\nĐược tham gia các cuộc họp trong và ngoài cơ quan theo sự phân công của cấp trên.\n5. Các yêu cầu về trình độ, năng lực 5.1- Yêu cầu về trình độ\nNhóm yêu cầu Yêu cầu cụ thể\nTrình độ đào tạo\n• Tốt nghiệp đại học trở lên với ngành hoặc chuyên ngành đào tạo phù hợp với lĩnh vực công tác.\nBồi dưỡng, chứng chỉ\n• Có chứng chỉ bồi dưỡng kiến thức, kỹ năng quản lý nhà nước đối với công chức ngạch chuyên viên và tương đương.\nPhẩm chất cá nhân\n• Tuyệt đối trung thành, tin tưởng, nghiêm túc chấp hành chủ trương, chính sách của Đảng, pháp luật của Nhà nước, quy định của cơ\n quan;\n • Tinh thần trách nhiệm cao với công việc với tập thể, phối hợp công tác tốt;\n • Trung thực, thẳng thắn, kiên định nhưng biết lắng nghe;\n • Điềm tĩnh, nguyên tắc, cẩn thận, bảo mật thông tin.\n • Khả năng đoàn kết nội bộ.\n • Chịu được áp lực trong công việc.\n • Tập trung, sáng tạo, tư duy độc lập và logic.\nCác yêu cầu khác\n• Có khả năng tham mưu, xây dựng, thực hiện, kiểm tra và đề xuất các chủ trương, chính sách, nghị quyết, kế hoạch, giải pháp đối với các vấn đề thực tiễn liên quan trong phạm vi chức năng, nhiệm vụ được giao.\n • Có khả năng cụ thể hóa và tổ chức thực hiện hiệu quả các chủ trương, đường lối của Đảng, chính sách pháp luật của Nhà nước ở\n lĩnh vực công tác được phân công.\n • Có khả năng đề xuất những chủ trương, xây dựng quy trình nội bộ và giải pháp giải quyết các vấn đề thực tiễn liên quan đến chức năng, nhiệm vụ của đơn vị.\n • Hiểu và vận dụng được các kiến thức chuyên sâu,\n nâng cao về lĩnh vực hoạt động và thực thi, kỹ năng xử lý các tình huống trong quá trình hướng dẫn, kiểm tra, giám sát, tham mưu, đề xuất và thực hiện công việc theo vị trí việc làm.\n • Hiểu và vận dụng được các kiến thức về phương pháp nghiên cứu, tổ chức, triển khai nghiên cứu, xây dựng các tài liệu, đề\n tài, đề án thuộc lĩnh vực chuyên môn đảm nhiệm.\n • Biết vận dụng các kiến thức cơ bản và nâng cao về ngành, lĩnh vực; có kỹ năng thuyết trình, giảng dạy, hướng dẫn nghiệp vụ về\n ngành, lĩnh vực.\n • Áp dụng thành thạo các kiến thức; kỹ thuật xây dựng, ban hành văn bản vào công việc theo yêu cầu của vị trí việc làm.\n5.2- Các năng lực Nhóm năng lực Tên năng lực Cấp độ\nNhóm năng lực chung\n• Đạo đức và bản lĩnh 2-3\n• Tổ chức thực hiện công việc 2-3\n• Kỹ thuật soạn thảo và ban hành văn bản 2-3\n• Giao tiếp ứng xử\n2-3\n• Quan hệ phối hợp 2-3\n• Sử dụng công nghệ thông tin Phù hợp với chức năng, nhiệm vụ của cơ quan, tổ chức, đơn vị sử dụng vị trí việc làm được cấp có thẩm quyền phê duyệt\n• Sử dụng ngoại ngữ\nNhóm năng lực chuyên môn\n• Khả năng xây dựng văn bản 2-3\n• Khả năng hướng dẫn thực hiện văn bản 2-3\n• Khả năng theo dõi, kiểm tra thực hiện văn bản 2-3\n• Khả năng thực thi 2-3\n• Khả năng phối hợp thực hiện 2-3 Nhóm năng lực quản lý\n• Tư duy chiến lược 1-2\n• Quản lý sự thay đổi 1-2\n• Ra quyết định 1-2\n• Quản lý nguồn lực 1-2\n• Phát triển công chức 1-2 Phê\n duyệt của lãnh đạo Biểu số 13 TÊN CƠ QUAN:.... \n TÊN TỔ CHỨC:....\n -------\nCỘNG HÒA XÃ HỘI CHỦ NGHĨA VIỆT NAM\n Độc lập - Tự do - Hạnh phúc \n ---------------\nBẢN MÔ TẢ CÔNG VIỆC Tên VTVL: Chuyên viên cao cấp Quản lý Hạ tầng kỹ\n thuật Mã vị trí việc làm:\nNgày bắt đầu thực hiện:\nĐịa điểm làm việc:\n(Địa chỉ trụ sở cơ quan)\nQuy trình công việc liên quan\n(Tên tài liệu, quy trình công việc liên quan đến vị trí này)\n1. Mục tiêu vị trí việc làm: (Tóm tắt tổng quan về vị trí việc làm)\nChủ trì tham mưu, tổng hợp và hoạch định chính sách, chiến lược có tính vĩ mô trong lĩnh vực hạ tầng kỹ thuật.\nChủ trì xây dựng chương trình, đề án, dự án, các văn bản quy phạm pháp luật, quy hoạch chuyên ngành, văn bản hướng dẫn thực thi trong lĩnh vực hạ tầng kỹ thuật.\n2. Các công việc và tiêu chí đánh giá\nTT Các công việc Tiêu chí đánh giá hoàn thành công việc Mảng công việc Công việc cụ thể\n2.1 Xây dựng văn bản 1. Chủ trì tham mưu, tổng hợp và hoạch định chính sách, chiến lược có tính vĩ mô trong lĩnh vực hạ tầng kỹ thuật.\n 2. Chủ trì xây dựng chương trình, đề án, dự án cấp quốc gia, cấp bộ và các văn bản quy phạm pháp luật, quy hoạch chuyên ngành,\n văn bản hướng dẫn thực thi trong lĩnh vực hạ tầng kỹ thuật.\n 3. Tham mưu nghiên cứu, xây dựng hệ thống quy chuẩn,\n tiêu chuẩn, định mức kinh tế kỹ thuật trong lĩnh vực hạ tầng kỹ thuật.\n1. Dự thảo các văn bản1 được cấp có thẩm quyền2 ban hành.\n 2. Chương trình, đề án, dự án được nghiệm thu,\n ban hành.\n 3. Các quy hoạch được phê duyệt.\n 4. Quy chuẩn, tiêu chuẩn, định mức kinh tế kỹ thuật\n được ban hành.\n2.2 Hướng dẫn 1. Chủ trì việc phổ biến, hướng dẫn chủ trương,\n chính sách của Đảng và Nhà nước, văn bản quy phạm pháp luật trong lĩnh vực hạ\n tầng kỹ thuật.\n 2. Hướng dẫn tổ chức, cá nhân về việc thực hiện quy định pháp luật lĩnh vực hạ tầng kỹ thuật.\n1. Văn bản hướng dẫn được xây dựng theo đúng nội dung quy định, đúng tiến độ.\n 2. Tham gia thực hiện, phổ biến, hướng dẫn pháp luật theo lĩnh vực hoạt động.\n2.3 Theo dõi, kiểm tra 1. Chủ trì theo dõi, kiểm tra và tổng hợp kết quả\n thực hiện các chính sách, chiến lược có tính vĩ mô trong lĩnh vực hạ tầng kỹ\n thuật.\n 2. Chủ trì theo dõi, kiểm tra, tổng hợp việc thực thi pháp luật trong lĩnh vực hạ tầng kỹ thuật theo quy định của pháp luật.\nBáo cáo kết quả kiểm tra, đánh giá và có đề xuất kịp thời, đúng kế hoạch, được cấp thẩm quyền phê duyệt.\n2.4 Thực thi 1. Chủ trì triển khai chương trình, dự án, đề án,\n đồ án quy hoạch đã được phê duyệt từ cấp bộ trở lên trong lĩnh vực hạ tầng kỹ\n thuật.\n 2. Chủ trì thực hiện các hoạt động nghiệp vụ theo quy định pháp luật.\n 3. Chủ trì thực hiện các Quy trình, thủ tục theo\n đúng quy định.\n1. Kết quả triển khai công việc theo đúng kế hoạch;\n đảm bảo tiến độ, chất lượng theo quy định.\n 2. Các hoạt động nghiệp vụ, các quy trình, thủ tục\n được thực hiện theo đúng quy định.\n2.5 Nghiên cứu đề tài khoa học, dự án sự nghiệp kinh tế\nChủ trì hoặc tham gia nghiên cứu các đề tài khoa học, dự án sự nghiệp kinh tế cấp nhà nước, cấp bộ trong lĩnh vực hạ tầng kỹ\n thuật.\nĐề tài, dự án được nghiệm thu ở mức đạt trở lên.\n2.6 Phối hợp thực hiện Có trách nhiệm phối hợp thực hiện các công việc liên quan theo lĩnh vực nhiệm vụ được phân công.\nCông việc, nhiệm vụ được giao thông suốt, tạo được mối quan hệ công tác phát triển hiệu quả cao.\n2.7 Họp, hội nghị, hội thảo Chủ trì các báo cáo cuộc họp, hội nghị, hội thảo liên quan đến lĩnh vực chuyên môn ở trong và ngoài cơ quan theo phân công.\nTham dự đầy đủ, tiếp thu, trao đổi thông tin, triển khai thực hiện theo kết luận cuộc họp 2.8 Xây dựng và thực hiện kế hoạch công tác năm, quý,\n tháng, tuần của cá nhân.\nXây dựng, thực hiện kế hoạch theo đúng kế hoạch công tác của đơn vị, cơ quan và nhiệm vụ được giao.\n2.9 Thực hiện các nhiệm vụ khác do cấp trên trực tiếp giao.\n3. Các mối quan hệ trong công việc 3.1- Bên trong\nĐược quản lý trực tiếp và kiểm duyệt kết quả bởi Quan hệ phối hợp trực tiếp trong đơn vị\nCác đơn vị phối hợp chính Lãnh đạo trực tiếp Các công chức chuyên môn khác trong đơn vị\nCác cơ quan, tổ chức, đơn vị thuộc Bộ, địa phương có liên quan.\n (Lưu ý: Việc xác định đơn vị phối hợp chính cần căn cứ vào mối quan hệ của tổ chức sử dụng vị trí việc làm này)\n3.2- Bên ngoài Ban, bộ, ngành,\n địa phương có quan hệ chính Bản chất quan hệ\n• Các cơ quan, tổ chức, đơn vị có hoạt động liên quan đến ngành, lĩnh vực tổ chức bộ máy thuộc phạm vi quản lý của đơn vị.\n (Lưu ý: Việc xác định các cơ quan, tổ chức,\n đơn vị có quan hệ chính cần căn cứ vào chức năng; nhiệm vụ của tổ chức sử dụng vị trí việc làm này)\n• Tham gia các cuộc họp có liên quan.\n • Cung cấp các thông tin theo yêu cầu.\n • Thu thập các thông tin cần thiết cho việc thực hiện công việc chuyên môn.\n • Lấy các thông tin thống kê.\n • Thực hiện các báo cáo theo yêu cầu.\n4. Phạm vi quyền hạn TT Quyền hạn cụ thể\n4.1\nĐược chủ động về phương pháp thực hiện công việc\n được giao;\n4.2 Tham gia ý kiến hoặc kiến nghị về các việc chuyên môn của đơn vị.\n4.3\nĐược cung cấp các thông tin chỉ đạo điều hành của tổ chức trong phạm vi nhiệm vụ được giao.\n4.4\nĐược yêu cầu cung cấp thông tin và đánh giá mức độ\n xác thực của thông tin phục vụ cho nhiệm vụ được giao.\n4.5\nĐược tham gia các cuộc họp trong và ngoài cơ quan theo sự phân công của cấp trên.\n5. Các yêu cầu về trình độ, năng lực 5.1- Yêu cầu về trình độ\nNhóm yêu cầu Yêu cầu cụ thể\nTrình độ đào tạo\n• Tốt nghiệp đại học trở lên với ngành hoặc chuyên ngành đào tạo phù hợp với lĩnh vực công tác.\n • Có bằng tốt nghiệp cao cấp lý luận chính trị hoặc bằng cao cấp lý luận chính trị - hành chính hoặc có giấy xác nhận trình độ lý\n luận chính trị tương đương cao cấp lý luận chính trị của cơ quan có thẩm quyền.\nBồi dưỡng, chứng chỉ\n• Có chứng chỉ bồi dưỡng kiến thức, kỹ năng quản lý nhà nước đối với công chức ngạch chuyên viên cao cấp hoặc tương đương hoặc có bằng cao cấp lý luận chính trị - hành chính.\nKinh nghiệm (thành tích công tác)\n• Có thời gian giữ ngạch chuyên viên chính hoặc tương đương từ đủ 06 năm trở lên. Trường hợp có thời gian tương đương với ngạch chuyên viên chính thì thời gian giữ ngạch chuyên viên chính tối thiểu 01 năm\n (đủ 12 tháng).\n • Trong thời gian giữ ngạch chuyên viên chính hoặc tương đương đã chủ trì hoặc tham gia xây dựng, thẩm định, góp ý kiến ít nhất 02 văn bản quy phạm pháp luật hoặc đề tài, đề án, dự án, chương trình nghiên cứu khoa học cấp nhà nước, cấp bộ, cấp ban, cấp ngành mà cơ quan sử dụng công chức được giao chủ trì nghiên cứu, xây dựng đã được cấp có thẩm quyền ban hành hoặc nghiệm thu.\nPhẩm chất cá nhân\n• Tuyệt đối trung thành, tin tưởng, nghiêm túc chấp hành chủ trương, chính sách của Đảng, pháp luật của Nhà nước, quy định của cơ\n quan;\n • Tinh thần trách nhiệm cao với công việc với tập thể, phối hợp công tác tốt;\n • Trung thực, thẳng thắn, kiên định nhưng biết lắng nghe;\n • Điềm tĩnh, nguyên tắc, cẩn thận, bảo mật thông tin.\n • Khả năng đoàn kết nội bộ.\n • Chịu được áp lực trong công việc.\n • Tập trung, sáng tạo, tư duy độc lập và logic.\nCác yêu cầu khác\n• Có khả năng tham mưu, xây dựng, thực hiện, kiểm tra và đề xuất các chủ trương, chính sách, nghị quyết, kế hoạch, giải pháp đối với các vấn đề thực tiễn liên quan trong phạm vi chức năng, nhiệm vụ được giao.\n • Có khả năng cụ thể hóa và tổ chức thực hiện hiệu quả các chủ trương, đường lối của Đảng, chính sách pháp luật của Nhà nước ở\n lĩnh vực công tác được phân công.\n • Có khả năng đề xuất những chủ trương, xây dựng quy trình nội bộ và giải pháp giải quyết các vấn đề thực tiễn liên quan đến chức năng, nhiệm vụ của đơn vị.\n • Hiểu và vận dụng được các kiến thức chuyên sâu,\n nâng cao về lĩnh vực hoạt động và thực thi, kỹ năng xử lý các tình huống trong quá trình hướng dẫn, kiểm tra, giám sát, tham mưu, đề xuất và thực hiện công việc theo vị trí việc làm.\n • Hiểu và vận dụng được các kiến thức về phương pháp nghiên cứu, tổ chức, triển khai nghiên cứu, xây dựng các tài liệu, đề\n tài, đề án thuộc lĩnh vực chuyên môn đảm nhiệm.\n • Biết vận dụng các kiến thức cơ bản và nâng cao về ngành, lĩnh vực; có kỹ năng thuyết trình, giảng dạy, hướng dẫn nghiệp vụ về\n ngành, lĩnh vực.\n • Áp dụng thành thạo các kiến thức; kỹ thuật xây dựng, ban hành văn bản vào công việc theo yêu cầu của vị trí việc làm.\n5.2- Các năng lực Nhóm năng lực Tên năng lực Cấp độ\nNhóm năng lực chung\n• Đạo đức và bản lĩnh 4-5\n• Tổ chức thực hiện công việc 4-5\n• Kỹ thuật soạn thảo và ban hành văn bản 4-5\n• Giao tiếp ứng xử\n4-5\n• Quan hệ phối hợp 4-5\n• Sử dụng công nghệ thông tin Phù hợp với chức năng, nhiệm vụ của cơ quan, tổ chức, đơn vị sử dụng vị trí việc làm được cấp có thẩm quyền phê duyệt\n• Sử dụng ngoại ngữ\nNhóm năng lực chuyên môn\n• Khả năng xây dựng văn bản 4-5\n• Khả năng hướng dẫn thực hiện văn bản 4-5\n• Khả năng theo dõi, kiểm tra thực hiện văn bản 4-5\n• Khả năng thực thi 4-5\n• Khả năng phối hợp thực hiện 4-5 Nhóm năng lực quản lý\n• Tư duy chiến lược 3-4\n• Quản lý sự thay đổi 3-4\n• Ra quyết định 3-4\n• Quản lý nguồn lực 3-4\n• Phát triển công chức 3-4 Phê\n duyệt của lãnh đạo Biểu số 14 TÊN CƠ QUAN:.... \n TÊN TỔ CHỨC:....\n -------\nCỘNG HÒA XÃ HỘI CHỦ NGHĨA VIỆT NAM\n Độc lập - Tự do - Hạnh phúc \n ---------------\nBẢN MÔ TẢ CÔNG VIỆC Tên VTVL: Chuyên viên chính Quản lý Hạ tầng kỹ\n thuật Mã vị trí việc làm;\nNgày bắt đầu thực hiện:\nĐịa điểm làm việc:\n(Địa chỉ trụ sở cơ quan)\nQuy trình công việc liên quan\n(Tên tài liệu, quy trình công việc liên quan đến vị trí này)\n1. Mục tiêu vị trí việc làm: (Tóm tắt tổng quan về vị trí việc làm)\nTham gia tham mưu, tổng hợp và hoạch định chính sách, chiến lược có tính vĩ mô trong lĩnh vực hạ tầng kỹ thuật.\nChủ trì hoặc tham gia xây dựng chương trình, đề án,\ndự án, các văn bản quy phạm pháp luật, quy hoạch chuyên ngành, văn bản hướng dẫn thực thi trong lĩnh vực hạ tầng kỹ thuật.\n2. Các công việc và tiêu chí đánh giá\nTT Các công việc Tiêu chí đánh giá hoàn thành công việc Mảng công việc Công việc cụ thể\n2.1 Xây dựng văn bản 1. Tham gia tham mưu, tổng hợp và hoạch định chính sách, chiến lược có tính vĩ mô trong lĩnh vực hạ tầng kỹ thuật.\n 2. Chủ trì hoặc tham gia xây dựng chương trình, đề\n án, dự án cấp bộ/tỉnh và các văn bản quy phạm pháp luật, quy hoạch chuyên ngành, văn bản hướng dẫn thực thi trong lĩnh vực hạ tầng kỹ thuật.\n 3. Tham mưu nghiên cứu, xây dựng hệ thống quy chuẩn,\n tiêu chuẩn, định mức kinh tế kỹ thuật trong lĩnh vực hạ tầng kỹ thuật..\n1. Dự thảo các văn bản được cấp có thẩm quyền ban hành.\n 2. Chương trình, đề án, dự án được nghiệm thu,\n ban hành.\n 3. Các quy hoạch được phê duyệt.\n 4. Quy chuẩn, tiêu chuẩn, định mức kinh tế kỹ thuật\n được ban hành.\n2.2 Hướng dẫn 1. Chủ trì hoặc tham gia việc phổ biến, hướng dẫn chủ trương, chính sách của Đảng và Nhà nước, văn bản quy phạm pháp luật trong lĩnh vực hạ tầng kỹ thuật.\n 2. Hướng dẫn tổ chức, cá nhân về việc thực hiện quy định pháp luật trong lĩnh vực hạ tầng kỹ thuật.\n1. Văn bản hướng dẫn được xây dựng theo đúng nội dung quy định, đúng tiến độ.\n 2. Tham gia thực hiện, phổ biến, hướng dẫn pháp luật theo lĩnh vực hoạt động.\n2.3 Theo dõi, kiểm tra 1. Tham gia theo dõi, kiểm tra và tổng hợp kết quả\n thực hiện các chính sách, chiến lược có tính vĩ mô trong lĩnh vực hạ tầng kỹ\n thuật.\n 2. Chủ trì theo dõi, kiểm tra, tổng hợp việc thực thi pháp luật trong lĩnh vực hạ tầng kỹ thuật theo quy định của pháp luật.\nBáo cáo kết quả kiểm tra, đánh giá và có đề xuất kịp thời, đúng kế hoạch, được cấp thẩm quyền phê duyệt.\n2.4 Thực thi 1. Tham gia triển khai chương trình, dự án, đề\n án, đồ án quy hoạch đã được phê duyệt từ cấp bộ/tỉnh trong lĩnh vực hạ tầng kỹ\n thuật.\n 2. Chủ trì thực hiện các hoạt động nghiệp vụ theo quy định pháp luật.\n 3. Chủ trì thực hiện các quy trình, thủ tục theo\n đúng quy định.\n1. Kết quả triển khai công việc theo đúng kế hoạch;\n đảm bảo tiến độ, chất lượng theo quy định.\n 2. Các hoạt động nghiệp vụ, các quy trình, thủ tục\n được thực hiện theo đúng quy định.\n2.5 Nghiên cứu đề tài khoa học, dự án sự nghiệp kinh tế\nChủ trì hoặc tham gia nghiên cứu các đề tài khoa học, dự án sự nghiệp kinh tế cấp nhà nước, cấp bộ/tỉnh trong lĩnh vực hạ tầng kỹ thuật.\nĐề tài, dự án được nghiệm thu ở mức đạt trở lên 2.6 Phối hợp thực hiện Có trách nhiệm phối hợp thực hiện các công việc liên quan theo lĩnh vực nhiệm vụ được phân công.\nCông việc, nhiệm vụ được giao thông suốt, tạo được mối quan hệ công tác phát triển hiệu quả cao.\n2.7 Họp, hội nghị, hội thảo Tham dự các cuộc họp, hội nghị, hội thảo liên quan đến lĩnh vực chuyên môn ở trong và ngoài cơ quan theo phân công Tham dự đầy đủ, tiếp thu, trao đổi thông tin, triển khai thực hiện theo kết luận cuộc họp 2.8 Xây dựng và thực hiện kế hoạch công tác năm,quý,\n tháng, tuần của cá nhân Xây dựng, thực hiện kế hoạch theo đúng kế hoạch công tác của đơn vị, cơ quan và nhiệm vụ được giao.\n2.9 Thực hiện các nhiệm vụ khác do cấp trên trực tiếp giao.\n3. Các mối quan hệ trong công việc 3.1- Bên trong\nĐược quản lý trực tiếp và kiểm duyệt kết quả bởi Quan hệ phối hợp trực tiếp trong đơn vị\nCác đơn vị phối hợp chính Lãnh đạo trực tiếp Các công chức chuyên môn khác trong đơn vị\nCác cơ quan, tổ chức, đơn vị thuộc Bộ, địa phương có liên quan.\n (Lưu ý: Việc xác định đơn vị phối hợp chính cần căn cứ vào mối quan hệ của tổ chức sử dụng vị trí việc làm này)\n3.2- Bên ngoài Ban, bộ, ngành,\n địa phương có quan hệ chính Bản chất quan hệ\n• Các cơ quan, tổ chức, đơn vị có hoạt động liên quan đến ngành, lĩnh vực tổ chức bộ máy thuộc phạm vi quản lý của đơn vị.\n (Lưu ý: Việc xác định các cơ quan, tổ chức,\n đơn vị có quan hệ chính cần căn cứ vào chức năng; nhiệm vụ của tổ chức sử dụng vị trí việc làm này)\n• Tham gia các cuộc họp có liên quan.\n • Cung cấp các thông tin theo yêu cầu.\n • Thu thập các thông tin cần thiết cho việc thực hiện công việc chuyên môn.\n • Lấy các thông tin thống kê.\n • Thực hiện các báo cáo theo yêu cầu.\n4. Phạm vi quyền hạn TT Quyền hạn cụ thể\n4.1\nĐược chủ động về phương pháp thực hiện công việc\n được giao;\n4.2 Tham gia ý kiến hoặc kiến nghị về các việc chuyên môn của đơn vị.\n4.3\nĐược cung cấp các thông tin chỉ đạo điều hành của tổ chức trong phạm vi nhiệm vụ được giao.\n4.4\nĐược yêu cầu cung cấp thông tin và đánh giá mức độ\n xác thực của thông tin phục vụ cho nhiệm vụ được giao.\n4.5\nĐược tham gia các cuộc họp trong và ngoài cơ quan theo sự phân công của cấp trên.\n5. Các yêu cầu về trình độ, năng lực 5.1- Yêu cầu về trình độ\nNhóm yêu cầu Yêu cầu cụ thể\nTrình độ đào tạo\n• Tốt nghiệp đại học trở lên với ngành hoặc chuyên ngành đào tạo phù hợp với lĩnh vực công tác.\nBồi dưỡng, chứng chỉ\n• Có chứng chỉ bồi dưỡng kiến thức, kỹ năng quản lý nhà nước đối với công chức ngạch chuyên viên chính hoặc tương đương hoặc có bằng cao cấp lý luận chính trị - hành chính.\nKinh nghiệm (thành tích công tác)\n• Có thời gian giữ ngạch chuyên viên hoặc tương đương từ đủ 09 năm trở lên. Trường hợp có thời gian tương đương với ngạch chuyên viên thì thời gian giữ ngạch chuyên viên tối thiểu 01 năm (đủ 12 tháng).\n • Trong thời gian giữ ngạch chuyên viên hoặc tương đương đã chủ trì hoặc tham gia xây dựng, thẩm định, góp ý kiến ít nhất 01 văn bản quy phạm pháp luật hoặc đề tài, đề án, dự án, chương trình nghiên cứu khoa học cấp cơ sở trở lên mà cơ quan sử dụng công chức được giao chủ trì\n nghiên cứu, xây dựng đã được cấp có thẩm quyền ban hành hoặc nghiệm thu.\nPhẩm chất cá nhân\n• Tuyệt đối trung thành, tin tưởng, nghiêm túc chấp hành chủ trương, chính sách của Đảng, pháp luật của Nhà nước, quy định của cơ\n quan;\n • Tinh thần trách nhiệm cao với công việc với tập thể, phối hợp công tác tốt;\n • Trung thực, thẳng thắn, kiên định nhưng biết lắng nghe;\n • Điềm tĩnh, nguyên tắc, cẩn thận, bảo mật thông tin.\n • Khả năng đoàn kết nội bộ.\n • Chịu được áp lực trong công việc.\n • Tập trung, sáng tạo, tư duy độc lập và logic.\nCác yêu cầu khác\n• Có khả năng tham mưu, xây dựng, thực hiện, kiểm tra và đề xuất các chủ trương, chính sách, nghị quyết, kế hoạch, giải pháp đối với các vấn đề thực tiễn liên quan trong phạm vi chức năng, nhiệm vụ được giao.\n • Có khả năng cụ thể hóa và tổ chức thực hiện hiệu quả các chủ trương, đường lối của Đảng, chính sách pháp luật của Nhà nước ở\n lĩnh vực công tác được phân công.\n • Có khả năng đề xuất những chủ trương, xây dựng quy trình nội bộ và giải pháp giải quyết các vấn đề thực tiễn liên quan đến chức năng, nhiệm vụ của đơn vị.\n • Hiểu và vận dụng được các kiến thức chuyên sâu,\n nâng cao về lĩnh vực hoạt động và thực thi, kỹ năng xử lý các tình huống trong quá trình hướng dẫn, kiểm tra, giám sát, tham mưu, đề xuất và thực hiện công việc theo vị trí việc làm.\n • Hiểu và vận dụng được các kiến thức về phương pháp nghiên cứu, tổ chức, triển khai nghiên cứu, xây dựng các tài liệu, đề\n tài, đề án thuộc lĩnh vực chuyên môn đảm nhiệm.\n • Biết vận dụng các kiến thức cơ bản và nâng cao về ngành, lĩnh vực; có kỹ năng thuyết trình, giảng dạy, hướng dẫn nghiệp vụ về\n ngành, lĩnh vực.\n • Áp dụng thành thạo các kiến thức; kỹ thuật xây dựng, ban hành văn bản vào công việc theo yêu cầu của vị trí việc làm.\n5.2- Các năng lực Nhóm năng lực Tên năng lực Cấp độ\nNhóm năng lực chung\n• Đạo đức và bản lĩnh 3-4\n• Tổ chức thực hiện công việc 3-4\n• Kỹ thuật soạn thảo và ban hành văn bản 3-4\n• Giao tiếp ứng xử\n3-4\n• Quan hệ phối hợp 3-4\n• Sử dụng công nghệ thông tin Phù hợp với chức năng, nhiệm vụ của cơ quan, tổ chức, đơn vị sử dụng vị trí việc làm được cấp có thẩm quyền phê duyệt\n• Sử dụng ngoại ngữ\nNhóm năng lực chuyên môn\n• Khả năng xây dựng văn bản 3-4\n• Khả năng hướng dẫn thực hiện văn bản 3-4\n• Khả năng theo dõi, kiểm tra thực hiện văn bản 3-4\n• Khả năng thực thi 3-4\n• Khả năng phối hợp thực hiện 3-4 Nhóm năng lực quản lý\n• Tư duy chiến lược 2-3\n• Quản lý sự thay đổi 2-3\n• Ra quyết định 2-3\n• Quản lý nguồn lực 2-3\n• Phát triển công chức 2-3 Phê\n duyệt của lãnh đạo Biểu số 15 TÊN CƠ QUAN:.... \n TÊN TỔ CHỨC:....\n -------\nCỘNG HÒA XÃ HỘI CHỦ NGHĨA VIỆT NAM\n Độc lập - Tự do - Hạnh phúc \n ---------------\nBẢN MÔ TẢ CÔNG VIỆC Tên VTVL: Chuyên viên Quản lý Hạ tầng kỹ thuật Mã vị trí việc làm:\nNgày bắt đầu thực hiện:\nĐịa điểm làm việc:\n(Địa chỉ trụ sở cơ quan)\nQuy trình công việc liên quan\n(Tên tài liệu, quy trình công việc liên quan đến vị trí này)\n1. Mục tiêu vị trí việc làm: (Tóm tắt tổng quan về vị trí việc làm)\nTham gia xây dựng chương trình, đề án, dự án, các văn bản quy phạm pháp luật, quy hoạch chuyên ngành, văn bản hướng dẫn thực thi trong lĩnh vực hạ tầng kỹ thuật.\nChủ trì hoặc tham gia nghiên cứu, đề xuất cấp thẩm quyền các giải pháp, biện pháp xử lý vấn đề cụ thể trong lĩnh vực công việc được phân công.\n2. Các công việc và tiêu chí đánh giá\nTT Các công việc Tiêu chí đánh giá hoàn thành công việc Mảng công việc Công việc cụ thể\n2.1 Xây dựng văn bản 1. Tham gia xây dựng chương trình, đề án, dự án cấp bộ/tỉnh và các văn bản quy phạm pháp luật, quy hoạch chuyên ngành, văn bản hướng dẫn thực thi trong lĩnh vực hạ tầng kỹ thuật.\n 2. Tham gia nghiên cứu, xây dựng hệ thống quy chuẩn,\n tiêu chuẩn, định mức kinh tế kỹ thuật trong lĩnh vực hạ tầng kỹ thuật.\n 3. Chủ trì nghiên cứu, tham mưu cho UBND huyện các văn bản hướng dẫn việc tổ chức thực hiện các hoạt động trong lĩnh vực quản lý hạ tầng kỹ thuật trên địa bàn (đối với VTVL tại phòng chuyên môn thuộc UBND cấp huyện).\n1. Dự thảo các văn bản được cấp có thẩm quyền ban hành.\n 2. Chương trình, đề án, dự án được nghiệm thu,\n ban hành.\n 3. Các quy hoạch được phê duyệt.\n 4. Quy chuẩn, tiêu chuẩn, định mức kinh tế kỹ thuật\n được ban hành.\n2.2 Hướng dẫn 1. Tham gia việc phổ biến, hướng dẫn chủ trương,\n chính sách của Đảng và Nhà nước, văn bản quy phạm pháp luật trong lĩnh vực hạ\n tầng kỹ thuật.\n 2. Hướng dẫn tổ chức, cá nhân về việc thực hiện quy định pháp luật trong lĩnh vực hạ tầng kỹ thuật.\n1. Văn bản hướng dẫn được xây dựng theo đúng nội dung quy định, đúng tiến độ.\n 2. Tham gia thực hiện, phổ biến, hướng dẫn pháp luật theo lĩnh vực hoạt động.\n2.3 Theo dõi, kiểm tra Tham gia theo dõi, kiểm tra, tổng hợp việc thực thi pháp luật trong lĩnh vực hạ tầng kỹ thuật theo quy định của pháp luật.\nBáo cáo kết quả kiểm tra, đánh giá và có đề xuất kịp thời, đúng kế hoạch, được cấp thẩm quyền phê duyệt.\n2.4 Thực thi 1. Tham gia triển khai chương trình, dự án, đề\n án, đồ án quy hoạch đã được phê duyệt từ cấp bộ/tỉnh lĩnh vực hạ tầng kỹ thuật.\n 2. Thực hiện các hoạt động nghiệp vụ theo quy định pháp luật.\n 3. Chủ trì thực hiện các quy trình, thủ tục theo\n đúng quy định.\n1. Kết quả triển khai công việc theo đúng kế hoạch;\n đảm bảo tiến độ, chất lượng theo quy định.\n 2. Các hoạt động nghiệp vụ, các quy trình, thủ tục\n được thực hiện theo đúng quy định.\n2.5 Nghiên cứu đề tài khoa học, dự án sự nghiệp kinh tế\nTham gia nghiên cứu các đề tài khoa học, dự án sự\n nghiệp kinh tế cấp bộ/tỉnh, chủ trì nghiên cứu các đề tài, dự án cấp cơ sở\n trong lĩnh vực hạ tầng kỹ thuật.\nĐề tài, dự án được nghiệm thu ở mức đạt trở lên 2.6 Phối hợp thực hiện Có trách nhiệm phối hợp thực hiện các công việc liên quan theo phân công.\nCông việc, nhiệm vụ được giao thông suốt, tạo được mối quan hệ công tác phát triển hiệu quả cao.\n2.7 Họp, hội nghị, hội thảo Tham dự các cuộc họp, hội nghị, hội thảo liên quan đến lĩnh vực chuyên môn ở trong và ngoài cơ quan theo phân công.\nTham dự đầy đủ, tiếp thu, trao đổi thông tin, triển khai thực hiện theo kết luận cuộc họp 2.8 Xây dựng và thực hiện kế hoạch công tác năm, quý,\n tháng, tuần của cá nhân.\nXây dựng, thực hiện kế hoạch theo đúng kế hoạch công tác của đơn vị, cơ quan và nhiệm vụ được giao.\n2.9 Thực hiện các nhiệm vụ khác do cấp trên trực tiếp giao.\n3. Các mối quan hệ trong công việc 3.1- Bên trong\nĐược quản lý trực tiếp và kiểm duyệt kết quả bởi Quan hệ phối hợp trực tiếp trong đơn vị\nCác đơn vị phối hợp chính Lãnh đạo trực tiếp Các công chức chuyên môn khác trong đơn vị\nCác cơ quan, tổ chức, đơn vị thuộc Bộ, địa phương có liên quan.\n (Lưu ý: Việc xác định đơn vị phối hợp chính cần căn cứ vào mối quan hệ của tổ chức sử dụng vị trí việc làm này)\n3.2- Bên ngoài Ban, bộ, ngành,\n địa phương có quan hệ chính Bản chất quan hệ\n• Các cơ quan, tổ chức, đơn vị có hoạt động liên quan đến ngành, lĩnh vực tổ chức bộ máy thuộc phạm vi quản lý của đơn vị.\n (Lưu ý: Việc xác định các cơ quan, tổ chức,\n đơn vị có quan hệ chính cần căn cứ vào chức năng; nhiệm vụ của tổ chức sử dụng vị trí việc làm này)\n• Tham gia các cuộc họp có liên quan.\n • Cung cấp các thông tin theo yêu cầu.\n • Thu thập các thông tin cần thiết cho việc thực hiện công việc chuyên môn.\n • Lấy các thông tin thống kê.\n • Thực hiện các báo cáo theo yêu cầu.\n4. Phạm vi quyền hạn TT Quyền hạn cụ thể\n4.1\nĐược chủ động về phương pháp thực hiện công việc\n được giao;\n4.2 Tham gia ý kiến hoặc kiến nghị về các việc chuyên môn của đơn vị.\n4.3\nĐược cung cấp các thông tin chỉ đạo điều hành của tổ chức trong phạm vi nhiệm vụ được giao.\n4.4\nĐược yêu cầu cung cấp thông tin và đánh giá mức độ\n xác thực của thông tin phục vụ cho nhiệm vụ được giao.\n4.5\nĐược tham gia các cuộc họp trong và ngoài cơ quan theo sự phân công của cấp trên.\n5. Các yêu cầu về trình độ, năng lực 5.1- Yêu cầu về trình độ\nNhóm yêu cầu Yêu cầu cụ thể\nTrình độ đào tạo\n• Tốt nghiệp đại học trở lên với ngành hoặc chuyên ngành đào tạo phù hợp với lĩnh vực công tác.\nBồi dưỡng, chứng chỉ\n• Có chứng chỉ bồi dưỡng kiến thức, kỹ năng quản lý nhà nước đối với công chức ngạch chuyên viên và tương đương.\nPhẩm chất cá nhân\n• Tuyệt đối trung thành, tin tưởng, nghiêm túc chấp hành chủ trương, chính sách của Đảng, pháp luật của Nhà nước, quy định của cơ\n quan;\n • Tinh thần trách nhiệm cao với công việc với lập thể, phối hợp công tác tốt;\n • Trung thực, thẳng thắn, kiên định nhưng biết lắng nghe;\n • Điềm tĩnh, nguyên tắc, cẩn thận, bảo mật thông tin.\n • Khả năng đoàn kết nội bộ.\n • Chịu được áp lực trong công việc.\n • Tập trung, sáng tạo, tư duy độc lập và logic.\nCác yêu cầu khác\n• Có khả năng tham mưu, xây dựng, thực hiện, kiểm tra và đề xuất các chủ trương, chính sách, nghị quyết, kế hoạch, giải pháp đối với các vấn đề thực tiễn liên quan trong phạm vi chức năng, nhiệm vụ được giao.\n • Có khả năng cụ thể hóa và tổ chức thực hiện hiệu quả các chủ trương, đường lối của Đảng, chính sách pháp luật của Nhà nước ở\n lĩnh vực công tác được phân công.\n • Có khả năng đề xuất những chủ trương, xây dựng quy trình nội bộ và giải pháp giải quyết các vấn đề thực tiễn liên quan đến chức năng, nhiệm vụ của đơn vị.\n • Hiểu và vận dụng được các kiến thức chuyên sâu,\n nâng cao về lĩnh vực hoạt động và thực thi, kỹ năng xử lý các tình huống trong quá trình hướng dẫn, kiểm tra, giám sát, tham mưu, đề xuất và thực hiện công việc theo vị trí việc làm.\n • Hiểu và vận dụng được các kiến thức về phương pháp nghiên cứu, tổ chức, triển khai nghiên cứu, xây dựng các tài liệu, đề\n tài, đề án thuộc lĩnh vực chuyên môn đảm nhiệm.\n • Biết vận dụng các kiến thức cơ bản và nâng cao về ngành, lĩnh vực; có kỹ năng thuyết trình, giảng dạy, hướng dẫn nghiệp vụ về\n ngành, lĩnh vực.\n • Áp dụng thành thạo các kiến thức; kỹ thuật xây dựng, ban hành văn bản vào công việc theo yêu cầu của vị trí việc làm.\n5.2- Các năng lực Nhóm năng lực Tên năng lực Cấp độ\nNhóm năng lực chung\n• Đạo đức và bản lĩnh 2-3\n• Tổ chức thực hiện công việc 2-3\n• Kỹ thuật soạn thảo và ban hành văn bản 2-3\n• Giao tiếp ứng xử\n2-3\n• Quan hệ phối hợp 2-3\n• Sử dụng công nghệ thông tin Phù hợp với chức năng,\n nhiệm vụ của cơ quan, tổ chức, đơn vị sử dụng vị trí việc làm được cấp có thẩm quyền phê duyệt\n• Sử dụng ngoại ngữ\nNhóm năng lực chuyên môn\n• Khả năng xây dựng văn bản 2-3\n• Khả năng hướng dẫn thực hiện văn bản 2-3\n• Khả năng theo dõi, kiểm tra thực hiện văn bản 2-3\n• Khả năng thực thi 2-3\n• Khả năng phối hợp thực hiện 2-3 Nhóm năng lực quản lý\n• Tư duy chiến lược 1-2\n• Quản lý sự thay đổi 1-2\n• Ra quyết định 1-2\n• Quản lý nguồn lực 1-2\n• Phát triển công chức 1-2 Phê\n duyệt của lãnh đạo Biểu số 16 TÊN CƠ QUAN:.... \n TÊN TỔ CHỨC:....\n -------\nCỘNG HÒA XÃ HỘI CHỦ NGHĨA VIỆT NAM\n Độc lập - Tự do - Hạnh phúc \n ---------------\nBẢN MÔ TẢ CÔNG VIỆC Tên VTVL: Chuyên viên cao cấp Quản lý nhà ở\nMã vị trí việc làm:\nNgày bắt đầu thực hiện:\nĐịa điểm làm việc:\n(Địa chỉ trụ sở cơ quan)\nQuy trình công việc liên quan\n(Tên tài liệu, quy trình công việc liên quan đến vị trí này)\n1. Mục tiêu vị trí việc làm: (Tóm tắt tổng quan về vị trí việc làm)\nChủ trì tham mưu, tổng hợp và hoạch định chính sách, chiến lược có tính vĩ mô trong lĩnh vực nhà ở.\nChủ trì xây dựng chương trình, đề án, dự án, các văn bản quy phạm pháp luật, văn bản hướng dẫn thực thi trong lĩnh vực nhà ở.\n2. Các công việc và tiêu chí đánh giá\nTT Các công việc Tiêu chí đánh giá hoàn thành công việc Mảng công việc Công việc cụ thể\n2.1 Xây dựng văn bản 1. Chủ trì tham mưu, tổng hợp và hoạch định chính sách, chiến lược có tính vĩ mô trong lĩnh vực nhà ở.\n 2. Chủ trì xây dựng chiến lược, kế hoạch, chương trình, đề án, dự án phát triển nhà ở cấp quốc gia, cấp bộ và các văn bản quy phạm pháp luật, văn bản hướng dẫn thực thi trong lĩnh vực nhà ở.\n 3. Tham mưu nghiên cứu, xây dựng hệ thống quy chuẩn,\n tiêu chuẩn, định mức kinh tế kỹ thuật trong lĩnh vực nhà ở.\n1. Dự thảo các văn bản1 được cấp có thẩm quyền2 ban hành.\n 2. Chương trình, đề án, dự án được nghiệm thu,\n ban hành.\n 3. Quy chuẩn, tiêu chuẩn, định mức kinh tế kỹ thuật\n được ban hành.\n2.2 Hướng dẫn 1. Chủ trì việc phổ biến, hướng dẫn chủ trương,\n chính sách của Đảng và Nhà nước, văn bản quy phạm pháp luật trong lĩnh vực nhà ở.\n 2.. Hướng dẫn tổ chức, cá nhân về việc thực hiện quy định pháp luật trong lĩnh vực nhà ở.\n1. Văn bản hướng dẫn được xây dựng theo đúng nội dung quy định, đúng tiến độ.\n 2. Tham gia thực hiện, phổ biến, hướng dẫn pháp luật theo lĩnh vực hoạt động.\n2.3 Theo dõi, kiểm tra 1. Chủ trì theo dõi, kiểm tra và tổng hợp kết quả\n thực hiện các chính sách, chiến lược có tính vĩ mô trong lĩnh vực nhà ở.\n 2. Chủ trì theo dõi, kiểm tra, tổng hợp việc thực thi pháp luật trong lĩnh vực nhà ở theo quy định của pháp luật.\nBáo cáo kết quả kiểm tra, đánh giá và có đề xuất kịp thời, đúng kế hoạch, được cấp thẩm quyền phê duyệt.\n2.4 Thực thi 1. Chủ trì triển khai chương trình, dự án, đề án\n đã được phê duyệt từ cấp bộ trở lên trong lĩnh vực nhà ở.\n 2. Chủ trì thực hiện các hoạt động nghiệp vụ theo quy định pháp luật.\n 3. Chủ trì thực hiện các quy trình, thủ tục theo đúng quy định.\n1. Kết quả triển khai công việc theo đúng kế hoạch;\n đảm bảo tiến độ, chất lượng theo quy định.\n 2. Các hoạt động nghiệp vụ, các quy trình, thủ tục\n được thực hiện theo đúng quy định.\n2.5 Nghiên cứu đề tài khoa học, dự án sự nghiệp kinh tế\nChủ trì hoặc tham gia nghiên cứu các đề tài khoa học, dự án sự nghiệp kinh tế cấp nhà nước, cấp bộ trong lĩnh vực nhà ở.\nĐề tài, dự án được nghiệm thu ở mức đạt trở lên.\n2.6 Phối hợp thực hiện Có trách nhiệm phối hợp thực hiện các công việc liên quan theo lĩnh vực nhiệm vụ được phân công.\nCông việc, nhiệm vụ được giao thông suốt, tạo được mối quan hệ công tác phát triển hiệu quả cao.\n2.7 Họp, hội nghị, hội thảo Chủ trì các báo cáo cuộc họp, hội nghị, hội thảo liên quan đến lĩnh vực chuyên môn ở trong và ngoài cơ quan theo phân công.\nTham dự đầy đủ, tiếp thu, trao đổi thông tin, triển khai thực hiện theo kết luận cuộc họp 2.8 Xây dựng và thực hiện kế hoạch công tác năm, quý,\n tháng, tuần của cá nhân.\nXây dựng, thực hiện kế hoạch theo đúng kế hoạch công tác của đơn vị, cơ quan và nhiệm vụ được giao.\n2.9 Thực hiện các nhiệm vụ khác do cấp trên trực tiếp giao.\n3. Các mối quan hệ trong công việc 3.1- Bên trong\nĐược quản lý trực tiếp và kiểm duyệt kết quả bởi Quan hệ phối hợp trực tiếp trong đơn vị\nCác đơn vị phối hợp chính Lãnh đạo trực tiếp Các công chức chuyên môn khác trong đơn vị\nCác cơ quan, tổ chức, đơn vị thuộc Bộ, địa phương có liên quan.\n (Lưu ý: Việc xác\n định đơn vị phối hợp chính cần căn cứ vào mối quan hệ của tổ chức sử dụng vị\n trí việc làm này)\n3.2- Bên ngoài Ban, bộ, ngành,\n địa phương có quan hệ chính Bản chất quan hệ\n• Các cơ quan, tổ chức, đơn vị có hoạt động liên quan đến ngành, lĩnh vực tổ chức bộ máy thuộc phạm vi quản lý của đơn vị.\n (Lưu ý: Việc xác định các cơ quan, tổ chức,\n đơn vị có quan hệ chính cần căn cứ vào chức năng; nhiệm vụ của tổ chức sử dụng vị trí việc làm này)\n• Tham gia các cuộc họp có liên quan.\n • Cung cấp các thông tin theo yêu cầu.\n • Thu thập các thông tin cần thiết cho việc thực hiện công việc chuyên môn.\n • Lấy các thông tin thống kê.\n • Thực hiện các báo cáo theo yêu cầu.\n4. Phạm vi quyền hạn TT Quyền hạn cụ thể\n4.1\nĐược chủ động về phương pháp thực hiện công việc được giao:\n4.2 Tham gia ý kiến hoặc kiến nghị về các việc chuyên môn của đơn vị.\n4.3\nĐược cung cấp các thông tin chỉ đạo điều hành của tổ chức trong phạm vi nhiệm vụ được giao.\n4.4\nĐược yêu cầu cung cấp thông tin và đánh giá mức độ\n xác thực của thông tin phục vụ cho nhiệm vụ được giao.\n4.5\nĐược tham gia các cuộc họp trong và ngoài cơ quan theo sự phân công của cấp trên.\n5. Các yêu cầu về trình độ, năng lực 5.1- Yêu cầu về trình độ\nNhóm yêu cầu Yêu cầu cụ thể\nTrình độ đào tạo\n• Tốt nghiệp đại học trở lên với ngành hoặc chuyên ngành đào tạo phù hợp với lĩnh vực công tác.\n • Có bằng tốt nghiệp cao cấp lý luận chính trị hoặc bằng cao cấp lý luận chính trị - hành chính hoặc có giấy xác nhận trình độ lý\n luận chính trị tương đương cao cấp lý luận chính trị của cơ quan có thẩm quyền.\nBồi dưỡng, chứng chỉ\n• Có chứng chỉ bồi dưỡng kiến thức, kỹ năng quản lý nhà nước đối với công chức ngạch chuyên viên cao cấp hoặc tương đương hoặc có bằng cao cấp lý luận chính trị - hành chính.\nKinh nghiệm (thành tích công tác)\n• Có thời gian giữ ngạch chuyên viên chính hoặc tương đương từ đủ 06 năm trở lên. Trường hợp có thời gian tương đương với ngạch chuyên viên chính thì thời gian giữ ngạch chuyên viên chính tối thiểu 01 năm\n (đủ 12 tháng).\n • Trong thời gian giữ ngạch chuyên viên chính hoặc tương đương đã chủ trì hoặc tham gia xây dựng, thẩm định, góp ý kiến ít nhất 02 văn bản quy phạm pháp luật hoặc đề tài, đề án, dự án, chương trình nghiên cứu khoa học cấp nhà nước, cấp bộ, cấp ban, cấp ngành mà cơ quan sử dụng công chức được giao chủ trì nghiên cứu, xây dựng đã được cấp có thẩm quyền ban hành hoặc nghiệm thu.\nPhẩm chất cá nhân\n• Tuyệt đối trung thành, tin tưởng, nghiêm túc chấp hành chủ trương, chính sách của Đảng, pháp luật của Nhà nước, quy định của cơ\n quan;\n • Tinh thần trách nhiệm cao với công việc với tập thể, phối hợp công tác tốt;\n • Trung thực, thẳng thắn, kiên định nhưng biết lắng nghe;\n • Điềm tĩnh, nguyên tắc, cẩn thận, bảo mật thông tin.\n • Khả năng đoàn kết nội bộ.\n • Chịu được áp lực trong công việc.\n • Tập trung, sáng tạo, tư duy độc lập và logic.\nCác yêu cầu khác\n• Có khả năng tham mưu, xây dựng, thực hiện, kiểm tra và đề xuất các chủ trương, chính sách, nghị quyết, kế hoạch, giải pháp đối với các vấn đề thực tiễn liên quan trong phạm vi chức năng, nhiệm vụ được giao.\n • Có khả năng cụ thể hóa và tổ chức thực hiện hiệu quả các chủ trương, đường lối của Đảng, chính sách pháp luật của Nhà nước ở\n lĩnh vực công tác được phân công.\n • Có khả năng đề xuất những chủ trương, xây dựng quy trình nội bộ và giải pháp giải quyết các vấn đề thực tiễn liên quan đến chức năng, nhiệm vụ của đơn vị.\n • Hiểu và vận dụng được các kiến thức chuyên sâu,\n nâng cao về lĩnh vực hoạt động và thực thi, kỹ năng xử lý các tình huống trong quá trình hướng dẫn, kiểm tra, giám sát, tham mưu, đề xuất và thực hiện công việc theo vị trí việc làm.\n • Hiểu và vận dụng được các kiến thức về phương pháp nghiên cứu, tổ chức, triển khai nghiên cứu, xây dựng các tài liệu, đề\n tài, đề án thuộc lĩnh vực chuyên môn đảm nhiệm.\n • Biết vận dụng các kiến thức cơ bản và nâng cao về ngành, lĩnh vực; có kỹ năng thuyết trình, giảng dạy, hướng dẫn nghiệp vụ về\n ngành, lĩnh vực.\n • Áp dụng thành thạo các kiến thức; kỹ thuật xây dựng, ban hành văn bản vào công việc theo yêu cầu của vị trí việc làm.\n5.2- Các năng lực Nhóm năng lực Tên năng lực Cấp độ\nNhóm năng lực chung\n• Đạo đức và bản lĩnh 4-5\n• Tổ chức thực hiện công việc 4-5\n• Kỹ thuật soạn thảo và ban hành văn bản 4-5\n• Giao tiếp ứng xử\n4-5\n• Quan hệ phối hợp 4-5\n• Sử dụng công nghệ thông tin Phù hợp với chức năng, nhiệm vụ của cơ quan, tổ chức, đơn vị sử dụng vị trí việc làm được cấp có thẩm quyền phê duyệt\n• Sử dụng ngoại ngữ\nNhóm năng lực chuyên môn\n• Khả năng xây dựng văn bản 4-5\n• Khả năng hướng dẫn thực hiện văn bản 4-5\n• Khả năng theo dõi, kiểm tra thực hiện văn bản 4-5\n• Khả năng thực thi 4-5\n• Khả năng phối hợp thực hiện 4-5 Nhóm năng lực quản lý\n• Tư duy chiến lược 3-4\n• Quản lý sự thay dối 3-4\n• Ra quyết định 3-4\n• Quản lý nguồn lực 3-4\n• Phát triển công chức 3-4 Phê\n duyệt của lãnh đạo Biểu số 17 TÊN CƠ QUAN:.... \n TÊN TỔ CHỨC:....\n -------\nCỘNG HÒA XÃ HỘI CHỦ NGHĨA VIỆT NAM\n Độc lập - Tự do - Hạnh phúc \n ---------------\nBẢN MÔ TẢ CÔNG VIỆC Tên VTVL: Chuyên viên chính Quản lý Nhà ở\nMã vị trí việc làm:\nNgày bắt đầu thực hiện:\nĐịa điểm làm việc:\n(Địa chỉ trụ sở cơ quan)\nQuy trình công việc liên quan\n(Tên tài liệu, quy trình công việc liên quan đến vị trí này)\n1. Mục tiêu vị trí việc làm: (Tóm tắt tổng quan về vị trí việc làm)\nTham gia tham mưu, tổng hợp và hoạch định chính sách, chiến lược có tính vĩ mô trong lĩnh vực nhà ở.\nChủ trì hoặc tham gia xây dựng chương trình, đề án,\ndự án, các văn bản quy phạm pháp luật, văn bản hướng dẫn thực thi trong lĩnh vực nhà ở.\n2. Các công việc và tiêu chí đánh giá\nTT Các công việc Tiêu chí đánh giá hoàn thành công việc Mảng công việc Công việc cụ thể\n2.1 Xây dựng văn bản 1. Tham gia tham mưu, tổng hợp và hoạch định chính sách, chiến lược có tính vĩ mô trong lĩnh vực nhà ở.\n 2. Chủ trì hoặc tham gia xây dựng chiến lược, kế\n hoạch, chương trình, đề án, dự án phát triển nhà ở cấp quốc gia, cấp bộ/tỉnh và các văn bản quy phạm pháp luật, văn bản hướng dẫn thực thi trong lĩnh vực nhà ở.\n 3. Tham mưu nghiên cứu, xây dựng hệ thống quy chuẩn,\n tiêu chuẩn, định mức kinh tế kỹ thuật trong lĩnh vực nhà ở.\n1. Dự thảo các văn bản được cấp có thẩm quyền ban hành.\n 2. Chương trình, đề án, dự án được nghiệm thu,\n ban hành.\n 3. Quy chuẩn, tiêu chuẩn, định mức kinh tế kỹ thuật\n được ban hành.\n2.2 Hướng dẫn 1. Chủ trì hoặc tham gia việc phổ biến, hướng dẫn chủ trương, chính sách của Đảng và Nhà nước, văn bản quy phạm pháp luật trong lĩnh vực nhà ở.\n 2. Hướng dẫn tổ chức, cá nhân về việc thực hiện quy định pháp luật trong lĩnh vực nhà ở.\n1. Văn bản hướng dẫn được xây dựng theo đúng nội dung quy định, đúng tiến độ.\n 2. Tham gia thực hiện, phổ biến, hướng dẫn pháp luật theo lĩnh vực hoạt động.\n2.3 Theo dõi, kiểm tra 1. Tham gia theo dõi, kiểm tra và tổng hợp kết quả\n thực hiện các chính sách, chiến lược có tính vĩ mô trong lĩnh vực nhà ở.\n 2. Chủ trì theo dõi, kiểm tra, tổng hợp việc thực thi pháp luật trong lĩnh vực nhà ở theo quy định của pháp luật.\nBáo cáo kết quả kiểm tra, đánh giá và có đề xuất kịp thời, đúng kế hoạch, được cấp thẩm quyền phê duyệt.\n2.4 Thực thi 1. Tham gia triển khai chương trình, dự án, đề án\n đã được phê duyệt từ cấp bộ/tỉnh trong lĩnh vực nhà ở.\n 2. Chủ trì thực hiện các hoạt động nghiệp vụ theo quy định pháp luật.\n 3. Chủ trì thực hiện các quy trình, thủ tục theo\n đúng quy định.\n1. Kết quả triển khai công việc theo đúng kế hoạch;\n đảm bảo tiến độ, chất lượng theo quy định.\n 2. Các hoạt động nghiệp vụ, các quy trình, thủ tục\n được thực hiện theo đúng quy định.\n2.5 Nghiên cứu đề tài khoa học, dự án sự nghiệp kinh tế\nChủ trì hoặc tham gia nghiên cứu các đề tài khoa học, dự án sự nghiệp kinh tế cấp nhà nước, cấp bộ/tỉnh trong lĩnh vực nhà ở.\nĐề tài, dự án được nghiệm thu ở mức đạt trở lên 2.6 Phối hợp thực hiện Có trách nhiệm phối hợp thực hiện các công việc liên quan theo lĩnh vực nhiệm vụ được phân công.\nCông việc, nhiệm vụ được giao thông suốt, tạo được mối quan hệ công tác phát triển hiệu quả cao.\n2.7 Họp, hội nghị, hội thảo Tham dự các cuộc họp, hội nghị, hội thảo liên quan đến lĩnh vực chuyên môn ở trong và ngoài cơ quan theo phân công.\nTham dự đầy đủ, tiếp thu, trao đổi thông tin, triển khai thực hiện theo kết luận cuộc họp 2.8 Xây dựng và thực hiện kế hoạch công tác năm, quý,\n tháng, tuần của cá nhân.\nXây dựng, thực hiện kế hoạch theo đúng kế hoạch công tác của đơn vị, cơ quan và nhiệm vụ được giao.\n2.9 Thực hiện các nhiệm vụ khác do cấp trên trực tiếp giao.\n3. Các mối quan hệ trong công việc 3.1- Bên trong\nĐược quản lý trực tiếp và kiểm duyệt kết quả bởi Quan hệ phối hợp trực tiếp trong đơn vị\nCác đơn vị phối hợp chính Lãnh đạo trực tiếp Các công chức chuyên môn khác trong đơn vị\nCác cơ quan, tổ chức, đơn vị thuộc Bộ, địa phương có liên quan.\n (Lưu ý: Việc xác\n định đơn vị phối hợp chính cần căn cứ vào mối quan hệ của tổ chức sử dụng vị\n trí việc làm này)\n3.2- Bên ngoài Ban, bộ, ngành,\n địa phương có quan hệ chính Bản chất quan hệ\n• Các cơ quan, tổ chức, đơn vị có hoạt động liên quan đến ngành, lĩnh vực tổ chức bộ máy thuộc phạm vi quản lý của đơn vị.\n (Lưu ý: Việt xác định các cơ quan, tổ chức,\n đơn vị có quan hệ chính cần căn cứ vào chức năng; nhiệm vụ của tổ chức sử dụng vị trí việc làm này)\n• Tham gia các cuộc họp có liên quan.\n • Cung cấp các thông tin theo yêu cầu.\n • Thu thập các thông tin cần thiết cho việc thực hiện công việc chuyên môn.\n • Lấy các thông tin thống kê.\n • Thực hiện các báo cáo theo yêu cầu.\n4. Phạm vi quyền hạn TT Quyền hạn cụ thể\n4.1\nĐược chủ động về phương pháp thực hiện công việc\n được giao;\n4.2 Tham gia ý kiến hoặc kiến nghị về các việc chuyên môn của đơn vị.\n4.3\nĐược cung cấp các thông tin chỉ đạo điều hành của tổ chức trong phạm vi nhiệm vụ được giao.\n4.4\nĐược yêu cầu cung cấp thông tin và đánh giá mức độ\n xác thực của thông tin phục vụ cho nhiệm vụ được giao.\n4.5\nĐược tham gia các cuộc họp trong và ngoài cơ quan theo sự phân công của cấp trên.\n5. Các yêu cầu về trình độ, năng lực 5.1- Yêu cầu về trình độ\nNhóm yêu cầu Yêu cầu cụ thể\nTrình độ đào tạo\n• Tốt nghiệp đại học trở lên với ngành hoặc chuyên ngành đào tạo phù hợp với lĩnh vực công tác.\nBồi dưỡng, chứng chỉ\n• Có chứng chỉ bồi dưỡng kiến thức, kỹ năng quản lý nhà nước đối với công chức ngạch chuyên viên chính hoặc tương đương hoặc có bằng cao cấp lý luận chính trị - hành chính.\nKinh nghiệm (thành tích công tác)\n• Có thời gian giữ ngạch chuyên viên hoặc tương\n đương từ đủ 09 năm trở lên. Trường hợp có thời gian tương đương với ngạch chuyên viên thì thời gian giữ ngạch chuyên viên tối thiểu 01 năm (đủ 12 tháng).\n • Trong thời gian giữ ngạch chuyên viên hoặc tương đương đã chủ trì hoặc tham gia xây dựng, thẩm định, góp ý kiến ít nhất 01 văn bản quy phạm pháp luật hoặc đề tài, đề án, dự án, chương trình nghiên cứu khoa học cấp cơ sở trở lên mà cơ quan sử dụng công chức được giao chủ trì\n nghiên cứu, xây dựng đã được cấp có thẩm quyền ban hành hoặc nghiệm thu.\nPhẩm chất cá nhân\n• Tuyệt đối trung thành, tin tưởng, nghiêm túc chấp hành chủ trương, chính sách của Đảng, pháp luật của Nhà nước, quy định của cơ\n quan;\n • Tinh thần trách nhiệm cao với công việc với tập thể, phối hợp công tác tốt;\n • Trung thực, thẳng thắn, kiên định nhưng biết lắng nghe;\n • Điềm tĩnh, nguyên tắc, cẩn thận, bảo mật thông tin.\n • Khả năng đoàn kết nội bộ.\n • Chịu được áp lực trong công việc.\n • Tập trung, sáng tạo, tư duy độc lập và logic.\nCác yêu cầu khác\n• Có khả năng tham mưu, xây dựng, thực hiện, kiểm tra và đề xuất các chủ trương, chính sách, nghị quyết, kế hoạch, giải pháp đối với các vấn đề thực tiễn liên quan trong phạm vi chức năng, nhiệm vụ được giao.\n • Có khả năng cụ thể hóa và tổ chức thực hiện hiệu quả các chủ trương, đường lối của Đảng, chính sách pháp luật của Nhà nước ở\n lĩnh vực công tác được phân công.\n • Có khả năng đề xuất những chủ trương, xây dựng quy trình nội bộ và giải pháp giải quyết các vấn đề thực tiễn liên quan đến chức năng, nhiệm vụ của đơn vị.\n • Hiểu và vận dụng được các kiến thức chuyên sâu,\n nâng cao về lĩnh vực hoạt động và thực thi, kỹ năng xử lý các tình huống trong quá trình hướng dẫn, kiểm tra, giám sát, tham mưu, đề xuất và thực hiện công việc theo vị trí việc làm.\n • Hiểu và vận dụng được các kiến thức về phương pháp nghiên cứu, tổ chức, triển khai nghiên cứu, xây dựng các tài liệu, đề\n tài, đề án thuộc lĩnh vực chuyên môn đảm nhiệm.\n • Biết vận dụng các kiến thức cơ bản và nâng cao về ngành, lĩnh vực; có kỹ năng thuyết trình, giảng dạy, hướng dẫn nghiệp vụ về\n ngành, lĩnh vực.\n • Áp dụng thành thạo các kiến thức; kỹ thuật xây dựng, ban hành văn bản vào công việc theo yêu cầu của vị trí việc làm.\n5.2- Các năng lực Nhóm năng lực Tên năng lực Cấp độ\nNhóm năng lực chung\n• Đạo đức và bản lĩnh 3-4\n• Tổ chức thực hiện công việc 3-4\n• Kỹ thuật soạn thảo và ban hành văn bản 3-4\n• Giao tiếp ứng xử\n3-4\n• Quan hệ phối hợp 3-4\n• Sử dụng công nghệ thông tin Phù hợp với chức năng, nhiệm vụ của cơ quan, tổ chức, đơn vị sử dụng vị trí việc làm được cấp có thẩm quyền phê duyệt\n• Sử dụng ngoại ngữ\nNhóm năng lực chuyên môn\n• Khả năng xây dựng văn bản 3-4\n• Khả năng hướng dẫn thực hiện văn bản 3-4\n• Khả năng theo dõi, kiểm tra thực hiện văn bản 3-4\n• Khả năng thực thi 3-4\n• Khả năng phối hợp thực hiện 3-4 Nhóm năng lực quản lý\n• Tư duy chiến lược 2-3\n• Quản lý sự thay đổi 2-3\n• Ra quyết định 2-3\n• Quản lý nguồn lực 2-3\n• Phát triển công chức 2-3 Phê\n duyệt của lãnh đạo Biểu số 18 TÊN CƠ QUAN:.... \n TÊN TỔ CHỨC:....\n -------\nCỘNG HÒA XÃ HỘI CHỦ NGHĨA VIỆT NAM\n Độc lập - Tự do - Hạnh phúc \n ---------------\nBẢN MÔ TẢ CÔNG VIỆC Tên VTVL: Chuyên viên Quản lý Nhà ở\nMã vị trí việc làm:\nNgày bắt đầu thực hiện:\nĐịa điểm làm việc:\n(Địa chỉ trụ sở cơ quan)\nQuy trình công việc liên quan\n(Tên tài liệu, quy trình công việc liên quan đến vị trí này)\n1. Mục tiêu vị trí việc làm: (Tóm tắt tổng quan về vị trí việc làm)\nTham gia xây dựng chương trình, đề án, dự án, các văn bản quy phạm pháp luật, văn bản hướng dẫn thực thi trong lĩnh vực nhà ở.\nChủ trì hoặc tham gia nghiên cứu, đề xuất cấp thẩm quyền các giải pháp, biện pháp xử lý vấn đề cụ thể trong lĩnh vực công việc được phân công.\n2. Các công việc và tiêu chí đánh giá\nTT Các công việc Tiêu chí đánh giá hoàn thành công việc Mảng công việc Công việc cụ thể\n2.1 Xây dựng văn bản 1. Tham gia xây dựng chương trình, đề án, dự án và\n các văn bản quy phạm pháp luật, chiến lược, kế hoạch phát triển nhà ở; văn bản hướng dẫn thực thi trong lĩnh vực nhà ở.\n 2. Tham gia nghiên cứu, xây dựng hệ thống quy chuẩn,\n tiêu chuẩn, định mức kinh tế kỹ thuật trong lĩnh vực nhà ở.\n 3. Chủ trì nghiên cứu, tham mưu cho UBND huyện các văn bản hướng dẫn việc tổ chức thực hiện các hoạt động trong lĩnh vực quản lý nhà ở trên địa bàn (đối với VTVL tại phòng chuyên môn thuộc UBND cấp huyện).\n1. Dự thảo các văn bản được cấp có thẩm quyền ban hành.\n 2. Chương trình, đề án, dự án được nghiệm thu,\n ban hành.\n 3. Quy chuẩn, tiêu chuẩn, định mức kinh tế kỹ thuật\n được ban hành.\n2.2 Hướng dẫn 1. Tham gia việc phổ biến, hướng dẫn chủ trương,\n chính sách của Đảng và Nhà nước, văn bản quy phạm pháp luật trong lĩnh vực nhà ở.\n 2. Hướng dẫn tổ chức, cá nhân về việc thực hiện quy định pháp luật trong lĩnh vực nhà ở.\n1. Văn bản hướng dẫn được xây dựng theo đúng nội dung quy định, đúng tiến độ.\n 2. Tham gia thực hiện, phổ biến, hướng dẫn pháp luật theo lĩnh vực hoạt động.\n2.3 Theo dõi, kiểm tra Tham gia theo dõi, kiểm tra, tổng hợp việc thực thi pháp luật trong lĩnh vực nhà ở theo quy định của pháp luật.\nBáo cáo kết quả kiểm tra, đánh giá và có đề xuất kịp thời, đúng kế hoạch, được cấp thẩm quyền phê duyệt.\n2.4 Thực thi 1. Tham gia triển khai chương trình, dự án, đề án\n đã được phê duyệt từ cấp bộ tỉnh trong lĩnh vực nhà ở.\n 2. Thực hiện các hoạt động nghiệp vụ theo quy định pháp luật.\n 3. Chủ trì thực hiện các quy trình, thủ tục theo\n đúng quy định.\n1. Kết quả triển khai công việc theo đúng kế hoạch;\n đảm bảo tiến độ, chất lượng theo quy định.\n 2. Các hoạt động nghiệp vụ, các quy trình, thủ tục\n được thực hiện theo đúng quy định.\n2.5 Nghiên cứu đề tài khoa học, dự án sự nghiệp kinh tế\nTham gia nghiên cứu các đề tài khoa học, dự án sự\n nghiệp kinh tế cấp bộ/tỉnh, chủ trì nghiên cứu các đề tài, dự án cấp cơ sở\n trong lĩnh vực nhà ở.\nĐề tài, dự án được nghiệm thu ở mức đạt trở lên 2.6 Phối hợp thực hiện Có trách nhiệm phối hợp thực hiện các công việc liên quan theo phân công.\nCông việc, nhiệm vụ được giao thông suốt, tạo được mối quan hệ công tác phát triển hiệu quả cao.\n2.7 Họp, hội nghị, hội thảo Tham dự các cuộc họp, hội nghị, hội thảo liên quan đến lĩnh vực chuyên môn ở trong và ngoài cơ quan theo phân công.\nTham dự đầy đủ, tiếp thu, trao đổi thông tin, triển khai thực hiện theo kết luận cuộc họp 2.8 Xây dựng và thực hiện kế hoạch công tác năm, quý,\n tháng, tuần của cá nhân.\nXây dựng, thực hiện kế hoạch theo đúng kế hoạch công tác của đơn vị, cơ quan và nhiệm vụ được giao.\n2.9 Thực hiện các nhiệm vụ khác do cấp trên trực tiếp giao.\n3. Các mối quan hệ trong công việc 3.1- Bên trong\nĐược quản lý trực tiếp và kiểm duyệt kết quả bởi Quan hệ phối hợp trực tiếp trong đơn vị\nCác đơn vị phối hợp chính Lãnh đạo trực tiếp Các công chức chuyên môn khác trong đơn vị\nCác cơ quan, tổ chức, đơn vị thuộc Bộ, địa phương có liên quan.\n (Lưu ý: Việc xác định đơn vị phối hợp chính cần căn cứ vào mối quan hệ của tổ chức sử dụng vị trí việc làm này)\n3.2- Bên ngoài Ban, bộ, ngành,\n địa phương có quan hệ chính Bản chất quan hệ\n• Các cơ quan, tổ chức, đơn vị có hoạt động liên quan đến ngành, lĩnh vực tổ chức bộ máy thuộc phạm vi quản lý của đơn vị.\n (Lưu ý: Việc xác định các cơ quan, tổ chức,\n đơn vị có quan hệ chính cần căn cứ vào chức năng; nhiệm vụ của tổ chức sử dụng vị trí việc làm này)\n• Tham gia các cuộc họp có liên quan.\n • Cung cấp các thông tin theo yêu cầu.\n • Thu thập các thông tin cần thiết cho việc thực hiện công việc chuyên môn.\n • Lấy các thông tin thống kê.\n • Thực hiện các báo cáo theo yêu cầu.\n4. Phạm vi quyền hạn TT Quyền hạn cụ thể\n4.1\nĐược chủ động về phương pháp thực hiện công việc\n được giao;\n4.2 Tham gia ý kiến hoặc kiến nghị về các việc chuyên môn của đơn vị.\n4.3\nĐược cung cấp các thông tin chỉ đạo điều hành của tổ chức trong phạm vi nhiệm vụ được giao.\n4.4\nĐược yêu cầu cung cấp thông tin và đánh giá mức độ\n xác thực của thông tin phục vụ cho nhiệm vụ được giao.\n4.5\nĐược tham gia các cuộc họp trong và ngoài cơ quan theo sự phân công của cấp trên.\n5. Các yêu cầu về trình độ, năng lực 5.1- Yêu cầu về trình độ\nNhóm yêu cầu Yêu cầu cụ thể\nTrình độ đào tạo\n• Tốt nghiệp đại học trở lên với ngành hoặc chuyên ngành đào tạo phù hợp với lĩnh vực công tác.\nBồi dưỡng, chứng chỉ\n• Có chứng chỉ bồi dưỡng kiến thức, kỹ năng quản lý nhà nước đối với công chức ngạch chuyên viên và tương đương.\nPhẩm chất cá nhân\n• Tuyệt đối trung thành, tin tưởng, nghiêm túc chấp hành chủ trương, chính sách của Đảng, pháp luật của Nhà nước, quy định của cơ\n quan;\n • Tinh thần trách nhiệm cao với công việc với tập thể, phối hợp công tác tốt;\n • Trung thực, thẳng thắn, kiên định nhưng biết lắng nghe;\n • Điềm tĩnh, nguyên tắc, cẩn thận, bảo mật thông tin.\n • Khả năng đoàn kết nội bộ.\n • Chịu được áp lực trong công việc.\n • Tập trung, sáng tạo, tư duy độc lập và logic.\nCác yêu cầu khác\n• Có khả năng tham mưu, xây dựng, thực hiện, kiểm tra và đề xuất các chủ trương, chính sách, nghị quyết, kế hoạch, giải pháp đối với các vấn đề thực tiễn liên quan trong phạm vi chức năng, nhiệm vụ được giao.\n • Có khả năng cụ thể hóa và tổ chức thực hiện hiệu quả các chủ trương, đường lối của Đảng, chính sách pháp luật của Nhà nước ở\n lĩnh vực công tác được phân công.\n • Có khả năng đề xuất những chủ trương, xây dựng quy trình nội bộ và giải pháp giải quyết các vấn đề thực tiễn liên quan đến chức năng, nhiệm vụ của đơn vị.\n • Hiểu và vận dụng được các kiến thức chuyên sâu,\n nâng cao về lĩnh vực hoạt động và thực thi, kỹ năng xử lý các tình huống trong quá trình hướng dẫn, kiểm tra, giám sát, tham mưu, đề xuất và thực hiện công việc theo vị trí việc làm.\n • Hiểu và vận dụng được các kiến thức về phương pháp nghiên cứu, tổ chức, triển khai nghiên cứu, xây dựng các tài liệu, đề\n tài, đề án thuộc lĩnh vực chuyên môn đảm nhiệm.\n • Biết vận dụng các kiến thức cơ bản và nâng cao về ngành, lĩnh vực; có kỹ năng thuyết trình, giảng dạy, hướng dẫn nghiệp vụ về\n ngành, lĩnh vực.\n • Áp dụng thành thạo các kiến thức; kỹ thuật xây dựng, ban hành văn bản vào công việc theo yêu cầu của vị trí việc làm.\n5.2- Các năng lực Nhóm năng lực Tên năng lực Cấp độ\nNhóm năng lực chung\n• Đạo đức và bản lĩnh 2-3\n• Tổ chức thực hiện công việc 2-3\n• Kỹ thuật soạn thảo và ban hành văn bản 2-3\n• Giao tiếp ứng xử\n2-3\n• Quan hệ phối hợp 2-3\n• Sử dụng công nghệ thông tin Phù hợp với chức năng, nhiệm vụ của cơ quan, tổ chức, đơn vị sử dụng vị trí việc làm được cấp có thẩm quyền phê duyệt\n• Sử dụng ngoại ngữ\nNhóm năng lực chuyên môn\n• Khả năng xây dựng văn bản 2-3\n• Khả năng hướng dẫn thực hiện văn bản 2-3\n• Khả năng theo dõi, kiểm tra thực hiện văn bản 2-3\n• Khả năng thực thi 2-3\n• Khả năng phối hợp thực hiện 2-3 Nhóm năng lực quản lý\n• Tư duy chiến lược 1-2\n• Quản lý sự thay đổi 1-2\n• Ra quyết định 1-2\n• Quản lý nguồn lực 1-2\n• Phát triển công chức 1-2 Phê\n duyệt của lãnh đạo Biểu số 19 TÊN CƠ\n QUAN:....\n TÊN TỔ CHỨC:....\n -------\nCỘNG HÒA XÃ HỘI CHỦ NGHĨA VIỆT NAM\n Độc lập - Tự do - Hạnh phúc \n ---------------\nBẢN MÔ TẢ CÔNG VIỆC Tên VTVL: Chuyên viên cao cấp Quản lý Công Sở\nMã vị trí việc làm:\nNgày bắt đầu thực hiện:\nĐịa điểm làm việc:\n(Địa chỉ trụ sở cơ quan)\nQuy trình công việc liên quan\n(Tên tài liệu, quy trình công việc liên quan đến vị trí này)\n1. Mục tiêu vị trí việc làm: (Tóm tắt tổng quan về vị trí việc làm)\nChủ trì tham mưu, tổng hợp và hoạch định chính sách, chiến lược có tính vĩ mô trong lĩnh vực công sở.\nChủ trì xây dựng chương trình, đề án, dự án, các văn bản quy phạm pháp luật, văn bản hướng dẫn thực thi trong lĩnh vực công sở.\n2. Các công việc và tiêu chí đánh giá\nTT Các công việc Tiêu chí đánh giá hoàn thành công việc Mảng công việc Công việc cụ thể\n2.1 Xây dựng văn bản 1. Chủ trì tham mưu, tổng hợp và hoạch định chính sách, chiến lược có tính vĩ mô trong lĩnh vực công sở.\n 2. Chủ trì xây dựng chiến lược, kế hoạch, chương trình, đề án, dự án cấp quốc gia, cấp bộ về phát triển hệ thống công sở các cơ quan hành chính nhà nước, trụ sở làm việc thuộc sở hữu nhà nước và các văn bản quy phạm pháp luật, văn bản hướng dẫn thực thi trong lĩnh vực công sở.\n 3. Tham mưu nghiên cứu, xây dựng hệ thống quy chuẩn,\n tiêu chuẩn, định mức kinh tế kỹ thuật trong lĩnh vực công sở.\n1. Dự thảo các văn bản1 được cấp có thẩm quyền2 ban hành.\n 2. Chương trình, đề án, dự án được nghiệm thu,\n ban hành.\n 3. Quy chuẩn, tiêu chuẩn, định mức kinh tế kỹ thuật\n được ban hành.\n2.2 Hướng dẫn 1. Chủ trì việc phổ biến, hướng dẫn chủ trương,\n chính sách của Đảng và Nhà nước, văn bản quy phạm pháp luật trong lĩnh vực công sở.\n 2. Hướng dẫn tổ chức, cá nhân về việc thực hiện quy định pháp luật trong lĩnh vực công sở.\n1. Văn bản hướng dẫn được xây dựng theo đúng nội dung quy định, đúng tiến độ.\n 2. Tham gia thực hiện, phổ biến, hướng dẫn pháp luật theo lĩnh vực hoạt động.\n2.3 Theo dõi, kiểm tra 1. Chủ trì theo dõi, kiểm tra và tổng hợp kết quả\n thực hiện các chính sách, chiến lược có tính vĩ mô trong lĩnh vực công sở.\n 2. Chủ trì theo dõi, kiểm tra, tổng hợp việc thực thi pháp luật trong lĩnh vực công sở theo quy định của pháp luật.\nBáo cáo kết quả kiểm tra, đánh giá và có đề xuất kịp thời, đúng kế hoạch, được cấp thẩm quyền phê duyệt.\n2.4 Thực thi 1. Chủ trì triển khai chương trình, dự án, đề án\n đã được phê duyệt từ cấp bộ trở lên trong lĩnh vực công sở.\n 2. Chủ trì thực hiện các hoạt động nghiệp vụ theo quy định pháp luật.\n 3. Chủ trì thực hiện các quy trình, thủ tục theo\n đúng quy định.\n1. Kết quả triển khai công việc theo đúng kế hoạch;\n đảm bảo tiến độ, chất lượng theo quy định.\n 2. Các hoạt động nghiệp vụ, các quy trình, thủ tục\n được thực hiện theo đúng quy định.\n2.5 Nghiên cứu đề tài khoa học, dự án sự nghiệp kinh tế\nChủ trì hoặc tham gia nghiên cứu các đề tài khoa học, dự án sự nghiệp kinh tế cấp nhà nước, cấp bộ trong lĩnh vực công sở.\nĐề tài, dự án được nghiệm thu ở mức đạt trở lên.\n2.6 Phối hợp thực hiện Có trách nhiệm phối hợp thực hiện các công việc liên quan theo lĩnh vực nhiệm vụ được phân công.\nCông việc, nhiệm vụ được giao thông suốt, tạo được mối quan hệ công tác phát triển hiệu quả cao.\n2.7 Họp, hội nghị, hội thảo Chủ trì các báo cáo cuộc họp, hội nghị, hội thảo liên quan đến lĩnh vực chuyên môn ở trong và ngoài cơ quan theo phân công.\nTham dự đầy đủ, tiếp thu, trao đổi thông tin, triển khai thực hiện theo kết luận cuộc họp 2.8 Xây dựng và thực hiện kế hoạch công tác năm, quý,\n tháng, tuần của cá nhân.\nXây dựng, thực hiện kế hoạch theo đúng kế hoạch công tác của đơn vị, cơ quan và nhiệm vụ được giao.\n2.9 Thực hiện các nhiệm vụ khác do cấp trên trực tiếp giao.\n3. Các mối quan hệ trong công việc 3.1- Bên trong\nĐược quản lý trực tiếp và kiểm duyệt kết quả bởi Quan hệ phối hợp trực tiếp trong đơn vị\nCác đơn vị phối hợp chính Lãnh đạo trực tiếp Các công chức chuyên môn khác trong đơn vị\nCác cơ quan, tổ chức, đơn vị thuộc Bộ. địa phương có liên quan.\n (Lưu ý: Việc xác định đơn vị phối hợp chính cần căn cứ vào mối quan hệ của tổ chức sử dụng vị trí việc làm này)\n3.2- Bên ngoài Ban, bộ, ngành,\n địa phương có quan hệ chính Bản chất quan hệ\n• Các cơ quan, tổ chức, đơn vị có hoạt động liên quan đến ngành, lĩnh vực tổ chức bộ máy thuộc phạm vi quản lý của đơn vị.\n (Lưu ý: Việc xác định các cơ quan, tổ chức,\n đơn vị có quan hệ chính cần căn cứ vào chức năng; nhiệm vụ của tổ chức sử dụng vị trí việc làm này)\n• Tham gia các cuộc họp có liên quan.\n • Cung cấp các thông tin theo yêu cầu.\n • Thu thập các thông tin cần thiết cho việc thực hiện công việc chuyên môn.\n • Lấy các thông tin thống kê.\n • Thực hiện các báo cáo theo yêu cầu.\n4. Phạm vi quyền hạn TT Quyền hạn cụ thể\n4.1\nĐược chủ động về phương pháp thực hiện công việc\n được giao;\n4.2 Tham gia ý kiến hoặc kiến nghị về các việc chuyên môn của đơn vị.\n4.3\nĐược cung cấp các thông tin chỉ đạo điều hành của tổ chức trong phạm vi nhiệm vụ được giao.\n4.4\nĐược yêu cầu cung cấp thông tin và đánh giá mức độ\n xác thực của thông tin phục vụ cho nhiệm vụ được giao.\n4.5\nĐược tham gia các cuộc họp trong và ngoài cơ quan theo sự phân công của cấp trên.\n5. Các yêu cầu về trình độ, năng lực 5.1- Yêu cầu về trình độ\nNhóm yêu cầu Yêu cầu cụ thể\nTrình độ đào tạo\n• Tốt nghiệp đại học trở lên với ngành hoặc chuyên ngành đào tạo phù hợp với lĩnh vực công tác.\n • Có bằng tốt nghiệp cao cấp lý luận chính trị hoặc bằng cao cấp lý luận chính trị - hành chính hoặc có giấy xác nhận trình độ lý\n luận chính trị tương đương cao cấp lý luận chính trị của cơ quan có thẩm quyền.\nBồi dưỡng, chứng chỉ\n• Có chứng chỉ bồi dưỡng kiến thức, kỹ năng quản lý nhà nước đối với công chức ngạch chuyên viên cao cấp hoặc tương đương hoặc có bằng cao cấp lý luận chính trị - hành chính.\nKinh nghiệm (thành tích công tác)\n• Có thời gian giữ ngạch chuyên viên chính hoặc tương đương từ đủ 06 năm trở lên. Trường hợp có thời gian tương đương với ngạch chuyên viên chính thì thời gian giữ ngạch chuyên viên chính tối thiểu 01 năm\n (đủ 12 tháng).\n • Trong thời gian giữ ngạch chuyên viên chính hoặc tương đương đã chủ trì hoặc tham gia xây dựng, thẩm định, góp ý kiến ít nhất 02 văn bản quy phạm pháp luật hoặc đề tài, đề án, dự án, chương trình nghiên cứu khoa học cấp nhà nước, cấp bộ, cấp ban, cấp ngành mà cơ quan sử dụng công chức được giao chủ trì nghiên cứu, xây dựng đã được cấp có thẩm quyền ban hành hoặc nghiệm thu.\nPhẩm chất cá nhân\n• Tuyệt đối trung thành, tin tưởng, nghiêm túc chấp hành chủ trương, chính sách của Đảng, pháp luật của Nhà nước, quy định của cơ\n quan;\n • Tinh thần trách nhiệm cao với công việc với tập thể, phối hợp công tác tốt;\n • Trung thực, thẳng thắn, kiên định nhưng biết lắng nghe;\n • Điềm tĩnh, nguyên tắc, cẩn thận, bảo mật thông tin.\n • Khả năng đoàn kết nội bộ.\n • Chịu được áp lực trong công việc.\n • Tập trung, sáng tạo, tư duy độc lập và logic.\nCác yêu cầu khác\n• Có khả năng tham mưu, xây dựng, thực hiện, kiểm tra và đề xuất các chủ trương, chính sách, nghị quyết, kế hoạch, giải pháp đối với các vấn đề thực tiễn liên quan trong phạm vi chức năng, nhiệm vụ được giao.\n • Có khả năng cụ thể hóa và tổ chức thực hiện hiệu quả các chủ trương, đường lối của Đảng, chính sách pháp luật của Nhà nước ở\n lĩnh vực công tác được phân công.\n • Có khả năng đề xuất những chủ trương, xây dựng quy trình nội bộ và giải pháp giải quyết các vấn đề thực tiễn liên quan đến chức năng, nhiệm vụ của đơn vị.\n • Hiểu và vận dụng được các kiến thức chuyên sâu,\n nâng cao về lĩnh vực hoạt động và thực thi, kỹ năng xử lý các tình huống trong quá trình hướng dẫn, kiểm tra, giám sát, tham mưu, đề xuất và thực hiện công việc theo vị trí việc làm.\n • Hiểu và vận dụng được các kiến thức về phương pháp nghiên cứu, tổ chức, triển khai nghiên cứu, xây dựng các tài liệu, đề\n tài, đề án thuộc lĩnh vực chuyên môn đảm nhiệm.\n • Biết vận dụng các kiến thức cơ bản và nâng cao về ngành, lĩnh vực; có kỹ năng thuyết trình, giảng dạy, hướng dẫn nghiệp vụ về\n ngành, lĩnh vực.\n • Áp dụng thành thạo các kiến thức; kỹ thuật xây dựng, ban hành văn bản vào công việc theo yêu cầu của vị trí việc làm.\n5.2- Các năng lực Nhóm năng lực Tên năng lực Cấp độ\nNhóm năng lực chung\n• Đạo đức và bản lĩnh 4-5\n• Tổ chức thực hiện công việc 4-5\n• Khả năng theo dõi, kiểm tra thực hiện văn bản 4-5\n• Khả năng thực thi 4-5\n• Quan hệ phối hợp 4-5\n• Sử dụng công nghệ thông tin Phù hợp với chức năng, nhiệm vụ của cơ quan, tổ chức, đơn vị sử dụng vị trí việc làm được cấp có thẩm quyền phê duyệt\n• Sử dụng ngoại ngữ\nNhóm năng lực chuyên môn\n• Khả năng xây dựng văn bản 4-5\n• Khả năng hướng dẫn thực hiện văn bản 4-5\n• Khả năng theo dõi, kiểm tra thực hiện văn bản 4-5\n• Khả năng thực thi 4-5\n• Khả năng phối hợp thực hiện 4-5 Nhóm năng lực quản lý\n• Tư duy chiến lược 3-4\n• Quản lý sự thay đổi 3-4\n• Ra quyết định 3-4\n• Quản lý nguồn lực 3-4\n• Phát triển công chức 3-4 Phê duyệt của lãnh\nđạo Biểu số 20 TÊN CƠ\n QUAN:....\n TÊN TỔ CHỨC:....\n -------\nCỘNG HÒA XÃ HỘI CHỦ NGHĨA VIỆT NAM\n Độc lập - Tự do - Hạnh phúc \n ---------------\nBẢN MÔ TẢ CÔNG VIỆC Tên VTVL: Chuyên viên chính Quản lý Công sở\nMã vị trí việc làm:\nNgày bắt đầu thực hiện:\nĐịa điểm làm việc:\n(Địa chỉ trụ sở cơ quan)\nQuy trình công việc liên quan\n(Tên tài liệu, quy trình công việc liên quan đến vị trí này)\n1. Mục tiêu vị trí việc làm: (Tóm tắt tổng quan về vị trí việc làm)\nTham gia tham mưu, tổng hợp và hoạch định chính sách, chiến lược có tính vĩ mô trong lĩnh vực công sở.\nChủ trì hoặc tham gia xây dựng chương trình, đề án,\ndự án, các văn bản quy phạm pháp luật, văn bản hướng dẫn thực thi trong lĩnh vực công sở.\n2. Các công việc và tiêu chí đánh giá\nTT Các công việc Tiêu chí đánh giá hoàn thành công việc Mảng công việc Công việc cụ thể\n2.1 Xây dựng văn bản 1. Tham gia tham mưu, tổng hợp và hoạch định chính sách, chiến lược có tính vĩ mô trong lĩnh vực công sở.\n 2. Chủ trì hoặc tham gia xây dựng chiến lược, kế\n hoạch, chương trình, đề án, dự án cấp quốc gia, cấp bộ/tỉnh về phát triển hệ\n thống công sở các cơ quan hành chính nhà nước, trụ sở làm việc thuộc sở hữu nhà nước và các văn bản quy phạm pháp luật, văn bản hướng dẫn thực thi trong lĩnh vực công sở.\n 3. Tham mưu nghiên cứu, xây dựng hệ thống quy chuẩn,\n tiêu chuẩn, định mức kinh tế kỹ thuật trong lĩnh vực công sở.\n1. Dự thảo các văn bản được cấp có thẩm quyền ban hành.\n 2. Chương trình, đề án, dự án được nghiệm thu,\n ban hành.\n 3. Quy chuẩn, tiêu chuẩn, định mức kinh tế kỹ thuật\n được ban hành.\n2.2 Hướng dẫn 1. Chủ trì hoặc tham gia việc phổ biến, hướng dẫn chủ trương, chính sách của Đảng và Nhà nước, văn bản quy phạm pháp luật trong lĩnh vực công sở.\n 2.Hướng dẫn tổ chức, cá nhân về việc thực hiện quy định pháp luật trong lĩnh vực công sở.\n1. Văn bản hướng dẫn được xây dựng theo đúng nội dung quy định, đúng tiến độ.\n 2. Tham gia thực hiện, phổ biến, hướng dẫn pháp luật theo lĩnh vực hoạt động.\n2.3 Theo dõi, kiểm tra 1. Tham gia theo dõi, kiểm tra và tổng hợp kết quả\n thực hiện các chính sách, chiến lược có tính vĩ mô trong lĩnh vực công sở.\n 2. Chủ trì theo dõi, kiểm tra, tổng hợp việc thực thi pháp luật trong lĩnh vực công sở theo quy định của pháp luật.\nBáo cáo kết quả kiểm tra, đánh giá và có đề xuất kịp thời, đúng kế hoạch, được cấp thẩm quyền phê duyệt.\n2.4 Thực thi 1. Tham gia triển khai chương trình, dự án, đề án\n đã được phê duyệt từ cấp bộ/tỉnh trong lĩnh vực công sở.\n 2. Chủ trì thực hiện các hoạt động nghiệp vụ theo quy định pháp luật.\n 3. Chủ trì thực hiện các quy trình, thủ tục theo\n đúng quy định.\n1. Kết quả triển khai công việc theo đúng kế hoạch;\n đảm bảo tiến độ, chất lượng theo quy định.\n 2. Các hoạt động nghiệp vụ, các quy trình, thủ tục\n được thực hiện theo đúng quy định.\n2.5 Nghiên cứu đề tài khoa học, dự án sự nghiệp kinh tế\nChủ trì hoặc tham gia nghiên cứu các đề tài khoa học, dự án sự nghiệp kinh tế cấp nhà nước, cấp bộ/tỉnh trong lĩnh vực công sở.\nĐề tài, dự án được nghiệm thu ở mức đạt trở lên 2.6 Phối hợp thực hiện Có trách nhiệm phối hợp thực hiện các công việc liên quan theo lĩnh vực nhiệm vụ được phân công.\nCông việc, nhiệm vụ được giao thông suốt, tạo được mối quan hệ công tác phát triển hiệu quả cao.\n2.7 Họp, hội nghị, hội thảo Tham dự các cuộc họp, hội nghị, hội thảo liên quan đến lĩnh vực chuyên môn ở trong và ngoài cơ quan theo phân công.\nTham dự đầy đủ, tiếp thu, trao đổi thông tin, triển khai thực hiện theo kết luận cuộc họp 2.8 Xây dựng và thực hiện kế hoạch công tác năm, quý,\n tháng, tuần của cá nhân.\nXây dựng, thực hiện kế hoạch theo đúng kế hoạch công tác của đơn vị, cơ quan và nhiệm vụ được giao.\n2.9 Thực hiện các nhiệm vụ khác do cấp trên trực tiếp giao.\n3. Các mối quan hệ trong công việc 3.1- Bên trong\nĐược quản lý trực tiếp và kiểm duyệt kết quả bởi Quan hệ phối hợp trực tiếp trong đơn vị\nCác đơn vị phối hợp chính Lãnh đạo trực tiếp Các công chức chuyên môn khác trong đơn vị\nCác cơ quan, tổ chức, đơn vị thuộc Bộ. địa phương có liên quan.\n (Lưu ý: Việc xác\n định đơn vị phối hợp chính cần căn cứ vào mối quan hệ của tổ chức sử dụng vị\n trí việc làm này)\n3.2- Bên ngoài Ban, bộ, ngành,\n địa phương có quan hệ chính Bản chất quan hệ\n• Các cơ quan, tổ chức, đơn vị có hoạt động liên quan đến ngành, lĩnh vực tổ chức bộ máy thuộc phạm vi quản lý của đơn vị.\n (Lưu ý: Việc xác định các cơ quan, tổ chức,\n đơn vị có quan hệ chính cần căn cứ vào chức năng; nhiệm vụ của tổ chức sử dụng vị trí việc làm này)\n• Tham gia các cuộc họp có liên quan.\n • Cung cấp các thông tin theo yêu cầu.\n • Thu thập các thông tin cần thiết cho việc thực hiện công việc chuyên môn.\n • Lấy các thông tin thống kê.\n • Thực hiện các báo cáo theo yêu cầu.\n4. Phạm vi quyền hạn TT Quyền hạn cụ thể\n4.1\nĐược chủ động về phương pháp thực hiện công việc được giao;\n4.2 Tham gia ý kiến hoặc kiến nghị về các việc chuyên môn của đơn vị.\n4.3\nĐược cung cấp các thông tin chỉ đạo điều hành của tổ chức trong phạm vi nhiệm vụ được giao.\n4.4\nĐược yêu cầu cung cấp thông tin và đánh giá mức độ\n xác thực của thông tin phục vụ cho nhiệm vụ được giao.\n4.5\nĐược tham gia các cuộc họp trong và ngoài cơ quan theo sự phân công của cấp trên.\n5. Các yêu cầu về trình độ, năng lực 5.1- Yêu cầu về trình độ\nNhóm yêu cầu Yêu cầu cụ thể\nTrình độ đào tạo\n• Tốt nghiệp đại học trở lên với ngành hoặc chuyên ngành đào tạo phù hợp với lĩnh vực công tác.\nBồi dưỡng, chứng chỉ\n• Có chứng chỉ bồi dưỡng kiến thức, kỹ năng quản lý nhà nước đối với công chức ngạch chuyên viên chính hoặc tương đương hoặc có bằng cao cấp lý luận chính trị - hành chính.\nKinh nghiệm (thành tích công tác)\n• Có thời gian giữ ngạch chuyên viên hoặc tương dương từ đủ 09 năm trở lên. Trường hợp có thời gian tương đương với ngạch chuyên viên thì thời gian giữ ngạch chuyên viên tối thiểu 01 năm (đủ 12 tháng).\n • Trong thời gian giữ ngạch chuyên viên hoặc tương đương đã chủ trì hoặc tham gia xây dựng, thẩm định, góp ý kiến ít nhất 01 văn bản quy phạm pháp luật hoặc đề tài, đề án, dự án, chương trình nghiên cứu khoa học cấp cơ sở trở lên mà cơ quan sử dụng công chức được giao chủ trì\n nghiên cứu, xây dựng đã được cấp có thẩm quyền ban hành hoặc nghiệm thu.\nPhẩm chất cá nhân\n• Tuyệt đối trung thành, tin tưởng, nghiêm túc chấp hành chủ trương, chính sách của Đảng, pháp luật của Nhà nước, quy định của cơ\n quan;\n • Tinh thần trách nhiệm cao với công việc với tập thể, phối hợp công tác tốt;\n • Trung thực, thẳng thắn, kiên định nhưng biết lắng nghe;\n • Điềm tĩnh, nguyên tắc, cẩn thận, bảo mật thông tin.\n • Khả năng đoàn kết nội bộ.\n • Chịu được áp lực trong công việc.\n • Tập trung, sáng tạo, tư duy độc lập và logic.\nCác yêu cầu khác\n• Có khả năng tham mưu, xây dựng, thực hiện, kiểm tra và đề xuất các chủ trương, chính sách, nghị quyết, kế hoạch, giải pháp đối với các vấn đề thực tiễn liên quan trong phạm vi chức năng, nhiệm vụ được giao.\n • Có khả năng cụ thể hóa và tổ chức thực hiện hiệu quả các chủ trương, đường lối của Đảng, chính sách pháp luật của Nhà nước ở\n lĩnh vực công tác được phân công.\n • Có khả năng đề xuất những chủ trương, xây dựng quy trình nội bộ và giải pháp giải quyết các vấn đề thực tiễn liên quan đến chức năng, nhiệm vụ của đơn vị.\n • Hiểu và vận dụng được các kiến thức chuyên sâu,\n nâng cao về lĩnh vực hoạt động và thực thi, kỹ năng xử lý các tình huống trong quá trình hướng dẫn, kiểm tra, giám sát, tham mưu, đề xuất và thực hiện công việc theo vị trí việc làm.\n • Hiểu và vận dụng được các kiến thức về phương pháp nghiên cứu, tổ chức, triển khai nghiên cứu, xây dựng các tài liệu, đề\n tài, đề án thuộc lĩnh vực chuyên môn đảm nhiệm.\n • Biết vận dụng các kiến thức cơ bản và nâng cao về ngành, lĩnh vực; có kỹ năng thuyết trình, giảng dạy, hướng dẫn nghiệp vụ về\n ngành, lĩnh vực.\n • Áp dụng thành thạo các kiến thức; kỹ thuật xây dựng, ban hành văn bản vào công việc theo yêu cầu của vị trí việc làm.\n5.2- Các năng lực Nhóm năng lực Tên năng lực Cấp độ\nNhóm năng lực chung\n• Đạo đức và bản lĩnh 3-4\n• Tổ chức thực hiện công việc 3-4\n• Kỹ thuật soạn thảo và ban hành văn bản 3-4\n• Giao tiếp ứng xử\n3-4\n• Quan hệ phối hợp 3-4\n• Sử dụng công nghệ thông tin Phù hợp với chức năng, nhiệm vụ của cơ quan, tổ chức, đơn vị sử dụng vị trí việc làm được cấp có thẩm quyền phê duyệt\n• Sử dụng ngoại ngữ\nNhóm năng lực chuyên môn\n• Khả năng xây dựng văn bản 3-4\n• Khả năng hướng dẫn thực hiện văn bản 3-4\n• Khả năng theo dõi, kiểm tra thực hiện văn bản 3-4\n• Khả năng thực thi 3-4\n• Khả năng phối hợp thực hiện 3-4 Nhóm năng lực quản lý\n• Tư duy chiến lược 2-3\n• Quản lý sự thay đổi 2-3\n• Ra quyết định 2-3\n• Quản lý nguồn lực 2-3\n• Phát triển công chức 2-3 Phê duyệt của lãnh\nđạo Biểu số 21 TÊN CƠ\n QUAN:.... \n TÊN TỔ CHỨC:....\n -------\nCỘNG HÒA XÃ HỘI CHỦ NGHĨA VIỆT NAM\n Độc lập - Tự do - Hạnh phúc \n ---------------\nBẢN MÔ TẢ CÔNG VIỆC Tên VTVL: Chuyên viên Quản lý Công sở\nMã vị trí việc làm:\nNgày bắt đầu thực hiện:\nĐịa điểm làm việc:\n(Địa chỉ trụ sở cơ quan)\nQuy trình công việc liên quan\n(Tên tài liệu, quy trình công việc liên quan đến vị trí này)\n1. Mục tiêu vị trí việc làm: (Tóm tắt tổng quan về vị trí việc làm)\nTham gia xây dựng chương trình, đề án, dự án, các văn bản quy phạm pháp luật, văn bản hướng dẫn thực thi trong lĩnh vực công sở.\nChủ trì hoặc tham gia nghiên cứu, đề xuất cấp thẩm quyền các giải pháp, biện pháp xử lý vấn đề cụ thể trong lĩnh vực công việc được phân công.\n2. Các công việc và tiêu chí đánh giá\nTT Các công việc Tiêu chí đánh giá hoàn thành công việc Mảng công việc Công việc cụ thể\n2.1 Xây dựng văn bản 1. Tham gia xây dựng chương trình, đề án, dự án cấp bộ/tỉnh và các văn bản quy phạm pháp luật, văn bản hướng dẫn thực thi trong lĩnh vực công sở.\n 2. Tham gia nghiên cứu, xây dựng hệ thống quy chuẩn,\n tiêu chuẩn, định mức kinh tế kỹ thuật trong lĩnh vực công sở.\n 3. Chủ trì nghiên cứu, tham mưu cho UBND huyện các văn bản hướng dẫn việc tổ chức thực hiện các hoạt động trong lĩnh vực quản lý công sở trên địa bàn (đối với VTVL tại phòng chuyên môn thuộc UBND cấp huyện).\n1. Dự thảo các văn bản được cấp có thẩm quyền ban hành.\n 2. Chương trình, đề án, dự án được nghiệm thu,\n ban hành.\n 3. Quy chuẩn, tiêu chuẩn, định mức kinh tế kỹ thuật\n được ban hành.\n2.2 Hướng dẫn 1. Tham gia việc phổ biến, hướng dẫn chủ trương,\n chính sách của Đảng và Nhà nước, văn bản quy phạm pháp luật trong lĩnh vực công sở.\n 2. Hướng dẫn tổ chức, cá nhân về việc thực hiện quy định pháp luật trong lĩnh vực công sở.\n1. Văn bản hướng dẫn được xây dựng theo đúng nội dung quy định, đúng tiến độ.\n 2. Tham gia thực hiện, phổ biến, hướng dẫn pháp luật theo lĩnh vực hoạt động.\n2.3 Theo dõi, kiểm tra Tham gia theo dõi, kiểm tra, tổng hợp việc thực thi pháp luật trong lĩnh vực công sở theo quy định của pháp luật.\nBáo cáo kết quả kiểm tra, đánh giá và có đề xuất kịp thời, đúng kế hoạch, được cấp thẩm quyền phê duyệt.\n2.4 Thực thi 1. Tham gia triển khai chương trình, dự án, đề án\n đã được phê duyệt từ cấp bộ/tỉnh trong lĩnh vực công sở.\n 2. Thực hiện các hoạt động nghiệp vụ theo quy định pháp luật.\n 3. Chủ trì thực hiện các quy trình, thủ tục theo\n đúng quy định.\n1. Kết quả triển khai công việc theo đúng kế hoạch;\n đảm bảo tiến độ, chất lượng theo quy định.\n 2. Các hoạt động nghiệp vụ, các quy trình, thủ tục\n được thực hiện theo đúng quy định 2.5 Nghiên cứu đề tài khoa học, dự án sự nghiệp kinh tế\nTham gia nghiên cứu các đề tài khoa học, dự án sự\n nghiệp kinh tế cấp bộ/tỉnh, chủ trì nghiên cứu các đề tài, dự án cấp cơ sở\n trong lĩnh vực công sở.\nĐề tài, dự án được nghiệm thu ở mức đạt trở lên 2.6 Phối hợp thực hiện Có trách nhiệm phối hợp thực hiện các công việc liên quan theo phân công.\nCông việc, nhiệm vụ được giao thông suốt, tạo được mối quan hệ công tác phát triển hiệu quả cao.\n2.7 Họp, hội nghị, hội thảo Tham dự các cuộc họp, hội nghị, hội thảo liên quan đến lĩnh vực chuyên môn ở trong và ngoài cơ quan theo phân công.\nTham dự đầy đủ, tiếp thu, trao đổi thông tin, triển khai thực hiện theo kết luận cuộc họp 2.8 Xây dựng và thực hiện kế hoạch công tác năm, quý,\n tháng, tuần của cá nhân.\nXây dựng, thực hiện kế hoạch theo đúng kế hoạch công tác của đơn vị, cơ quan và nhiệm vụ được giao.\n2.9 Thực hiện các nhiệm vụ khác do cấp trên trực tiếp giao.\n3. Các mối quan hệ trong công việc 3.1- Bên trong\nĐược quản lý trực tiếp và kiểm duyệt kết quả bởi Quan hệ phối hợp trực tiếp trong đơn vị\nCác đơn vị phối hợp chính Lãnh đạo trực tiếp Các công chức chuyên môn khác trong đơn vị\nCác cơ quan, tổ chức, đơn vị thuộc Bộ, địa phương có liên quan.\n (Lưu ý: Việc xác định đơn vị phối hợp chính cần căn cứ vào mới quan hệ của tổ chức sử dụng vị trí việc làm này)\n3.2- Bên ngoài Ban, bộ, ngành,\n địa phương có quan hệ chính Bản chất quan hệ\n• Các cơ quan, tổ chức, đơn vị có hoạt động liên quan đến ngành, lĩnh vực tổ chức bộ máy thuộc phạm vi quản lý của đơn vị.\n (Lưu ý: Việc xác định các cơ quan, tổ chức,\n đơn vị có quan hệ chính cần căn cứ vào chức năng; nhiệm vụ của tổ chức sử dụng vị trí việc làm này)\n• Tham gia các cuộc họp có liên quan.\n • Cung cấp các thông tin theo yêu cầu.\n • Thu thập các thông tin cần thiết cho việc thực hiện công việc chuyên môn.\n • Lấy các thông tin thống kê.\n • Thực hiện các báo cáo theo yêu cầu.\n4. Phạm vi quyền hạn TT Quyền hạn cụ thể\n4.1\nĐược chủ động về phương pháp thực hiện công việc\n được giao:\n4.2 Tham gia ý kiến hoặc kiến nghị về các việc chuyên môn của đơn vị.\n4.3\nĐược cung cấp các thông tin chỉ đạo điều hành của tổ chức trong phạm vi nhiệm vụ được giao.\n4.4\nĐược yêu cầu cung cấp thông tin và đánh giá mức độ\n xác thực của thông tin phục vụ cho nhiệm vụ được giao.\n4.5\nĐược tham gia các cuộc họp trong và ngoài cơ quan theo sự phân công của cấp trên.\n5. Các yêu cầu về trình độ, năng lực 5.1- Yêu cầu về trình độ\nNhóm yêu cầu Yêu cầu cụ thể\nTrình độ đào tạo\n• Tốt nghiệp đại học trở lên với ngành hoặc chuyên ngành đào tạo phù hợp với lĩnh vực công tác.\nBồi dưỡng, chứng chỉ\n• Có chứng chỉ bồi dưỡng kiến thức, kỹ năng quản lý nhà nước đối với công chức ngạch chuyên viên và tương đương.\nPhẩm chất cá nhân\n• Tuyệt đối trung thành, tin tưởng, nghiêm túc chấp hành chủ trương, chính sách của Đảng, pháp luật của Nhà nước, quy định của cơ\n quan;\n • Tinh thần trách nhiệm cao với công việc với tập thể, phối hợp công tác tốt;\n • Trung thực, thẳng thắn, kiên định nhưng biết lắng nghe;\n • Điềm tĩnh, nguyên tắc, cẩn thận, bảo mật thông tin.\n • Khả năng đoàn kết nội bộ.\n • Chịu được áp lực trong công việc.\n • Tập trung, sáng tạo, tư duy độc lập và logic.\nCác yêu cầu khác\n• Có khả năng tham mưu, xây dựng, thực hiện, kiểm tra và đề xuất các chủ trương, chính sách, nghị quyết, kế hoạch, giải pháp đối với các vấn đề thực tiễn liên quan trong phạm vi chức năng, nhiệm vụ được giao.\n • Có khả năng cụ thể hóa và tổ chức thực hiện hiệu quả các chủ trương, đường lối của Đảng, chính sách pháp luật của Nhà nước ở\n lĩnh vực công tác được phân công.\n • Có khả năng đề xuất những chủ trương, xây dựng quy trình nội bộ và giải pháp giải quyết các vấn đề thực tiễn liên quan đến chức năng, nhiệm vụ của đơn vị.\n • Hiểu và vận dụng được các kiến thức chuyên sâu,\n nâng cao về lĩnh vực hoạt động và thực thi, kỹ năng xử lý các tình huống trong quá trình hướng dẫn, kiểm tra, giám sát, tham mưu, đề xuất và thực hiện công việc theo vị trí việc làm.\n • Hiểu và vận dụng được các kiến thức về phương pháp nghiên cứu, tổ chức, triển khai nghiên cứu, xây dựng các tài liệu, đề\n tài, đề án thuộc lĩnh vực chuyên môn đảm nhiệm.\n • Biết vận dụng các kiến thức cơ bản và nâng cao về ngành, lĩnh vực; có kỹ năng thuyết trình, giảng dạy, hướng dẫn nghiệp vụ về\n ngành, lĩnh vực.\n • Áp dụng thành thạo các kiến thức; kỹ thuật xây dựng, ban hành văn bản vào công việc theo yêu cầu của vị trí việc làm.\n5.2- Các năng lực Nhóm năng lực Tên năng lực Cấp độ\nNhóm năng lực chung\n• Đạo đức và bản lĩnh 2-3\n• Tổ chức thực hiện công việc 2-3\n• Kỹ thuật soạn thảo và ban hành văn bản 2-3\n• Giao tiếp ứng xử\n2-3\n• Quan hệ phối hợp 2-3\n• Sử dụng công nghệ thông tin Phù hợp với chức năng,\n nhiệm vụ của cơ quan, tổ chức, đơn vị sử dụng vị trí việc làm được cấp có thẩm quyền phê duyệt\n• Sử dụng ngoại ngữ\nNhóm năng lực chuyên môn\n• Khả năng xây dựng văn bản 2-3\n• Khả năng hướng dẫn thực hiện văn bản 2-3\n• Khả năng theo dõi, kiểm tra thực hiện văn bản 2-3\n• Khả năng thực thi 2-3\n• Khả năng phối hợp thực hiện 2-3 Nhóm năng lực quản lý\n• Tư duy chiến lược 1-2\n• Quản lý sự thay đổi 1-2\n• Ra quyết định 1-2\n• Quản lý nguồn lực 1-2\n• Phát triển công chức 1-2 Phê duyệt của lãnh\nđạo Biểu số 22 TÊN CƠ\n QUAN:....\n TÊN TỔ CHỨC:....\n -------\nCỘNG HÒA XÃ HỘI CHỦ NGHĨA VIỆT NAM\n Độc lập - Tự do - Hạnh phúc \n ---------------\nBẢN MÔ TẢ CÔNG VIỆC Tên VTVL: Chuyên viên cao cấp Quản lý thị trường bất động sản Mã vị trí việc làm:\nNgày bắt đầu thực hiện:\nĐịa điểm làm việc:\n(Địa chỉ trụ sở cơ quan)\nQuy trình công việc liên quan\n(Tên tài liệu, quy trình công việc liên quan đến vị trí này)\n1. Mục tiêu vị trí việc làm: (Tóm tắt tổng quan về vị trí việc làm)\nChủ trì tham mưu, tổng hợp và hoạch định chính sách, chiến lược có tính vĩ mô trong lĩnh vực kinh doanh bất động sản.\nChủ trì xây dựng chương trình, đề án, dự án, các văn bản quy phạm pháp luật, văn bản hướng dẫn thực thi trong lĩnh vực kinh doanh bất động sản.\n2. Các công việc và tiêu chí đánh giá\nTT Các công việc Tiêu chí đánh giá hoàn thành công việc Mảng công việc Công việc cụ thể\n2.1 Xây dựng văn bản 1. Chủ trì tham mưu, tổng hợp và hoạch định chính sách, chiến lược có tính vĩ mô trong lĩnh vực thị trường bất động sản.\n 2. Chủ trì xây dựng chiến lược, kế hoạch, chương trình, đề án, dự án phát triển nhà ở cấp quốc gia, cấp bộ và các văn bản quy phạm pháp luật, văn bản hướng dẫn thực thi trong lĩnh vực bất động sản.\n 3. Tham mưu nghiên cứu, xây dựng hệ thống quy chuẩn,\n tiêu chuẩn, định mức kinh tế kỹ thuật trong lĩnh bất động sản.\n1. Dự thảo các văn bản1 được cấp có thấm quyền2 ban hành.\n 2. Chương trình, đề án, dự án được nghiệm thu,\n ban hành.\n 3. Quy chuẩn, tiêu chuẩn, định mức kinh tế kỹ thuật\n được ban hành.\n2.2 Hướng dẫn 1. Chủ trì việc phổ biến, hướng dẫn chủ trương,\n chính sách của Đảng và Nhà nước, văn bản quy phạm pháp luật trong lĩnh vực bất\n động sản.\n 2. Hướng dẫn tổ chức, cá nhân về việc thực hiện quy định pháp luật trong lĩnh vực bất động sản.\n1. Văn bản hướng dẫn được xây dựng theo đúng nội dung quy định, đúng tiến độ.\n 2. Tham gia thực hiện, phổ biến, hướng dẫn pháp luật theo lĩnh vực hoạt động.\n2.3 Theo dõi, kiểm tra 1. Chủ trì theo dõi, kiểm tra và tổng hợp kết quả\n thực hiện các chính sách, chiến lược có tính vĩ mô trong lĩnh vực bất động sản.\n 2. Chủ trì theo dõi, kiểm tra, tổng hợp việc thực thi pháp luật trong lĩnh vực bất động sản theo quy định của pháp luật.\nBáo cáo kết quả kiểm tra, đánh giá và có đề xuất kịp thời, đúng kế hoạch, được cấp thẩm quyền phê duyệt.\n2.4 Thực thi 1. Chủ trì triển khai chương trình, dự án, đề án\n đã được phê duyệt từ cấp bộ trở lên trong lĩnh vực bất động sản.\n 2. Chủ trì thực hiện các hoạt động nghiệp vụ theo quy định pháp luật.\n 3. Chủ trì thực hiện các quy trình, thủ tục theo\n đúng quy định.\n1. Kết quả triển khai công việc theo đúng kế hoạch;\n đảm bảo tiến độ, chất lượng theo quy định.\n 2. Các hoạt động nghiệp vụ, các quy trình, thủ tục\n được thực hiện theo đúng quy định.\n2.5 Nghiên cứu đề tài khoa học, dự án sự nghiệp kinh tế\nChủ trì hoặc tham gia nghiên cứu các đề tài khoa học, dự án sự nghiệp kinh tế cấp nhà nước, cấp bộ/tỉnh trong lĩnh vực bất động sản.\nĐề tài, dự án được nghiệm thu ở mức đạt trở lên.\n2.6 Phối hợp thực hiện Có trách nhiệm phối hợp thực hiện các công việc liên quan theo lĩnh vực nhiệm vụ được phân công.\nCông việc, nhiệm vụ được giao thông suốt, tạo được mối quan hệ công tác phát triển hiệu quả cao.\n2.7 Họp, hội nghị, hội thảo Chủ trì các báo cáo cuộc họp, hội nghị, hội thảo liên quan đến lĩnh vực chuyên môn ở trong và ngoài cơ quan theo phân công.\nTham dự đầy đủ, tiếp thu, trao đổi thông tin, triển khai thực hiện theo kết luận cuộc họp 2.8 Xây dựng và thực hiện kế hoạch công tác năm, quý,\n tháng, tuần của cá nhân.\nXây dựng, thực hiện kế hoạch theo đúng kế hoạch công tác của đơn vị, cơ quan và nhiệm vụ được giao.\n2.9 Thực hiện các nhiệm vụ khác do cấp trên trực tiếp giao.\n3. Các mối quan hệ trong công việc 3.1- Bên trong\nĐược quản lý trực tiếp và kiểm duyệt kết quả bởi Quan hệ phối hợp trực tiếp trong đơn vị\nCác đơn vị phối hợp chính Lãnh đạo trực tiếp Các công chức chuyên môn khác trong đơn vị\nCác cơ quan, tổ chức, đơn vị thuộc Bộ, địa phương có liên quan.\n (Lưu ý: Việc xác định đơn vị phối hợp chính cần căn cứ vào mối quan hệ của tổ chức sử dụng vị trí việc làm này)\n3.2- Bên ngoài Ban, bộ, ngành,\n địa phương có quan hệ chính Bản chất quan hệ\n• Các cơ quan, tổ chức, đơn vị có hoạt động liên quan đến ngành, lĩnh vực tổ chức bộ máy thuộc phạm vi quản lý của đơn vị.\n (Lưu ý: Việc xác định các cơ quan, tổ chức,\n đơn vị có quan hệ chính cần căn cứ vào chức năng; nhiệm vụ của tổ chức sử dụng vị trí việc làm này)\n• Tham gia các cuộc họp có liên quan.\n • Cung cấp các thông tin theo yêu cầu.\n • Thu thập các thông tin cần thiết cho việc thực hiện công việc chuyên môn.\n • Lấy các thông tin thống kê.\n • Thực hiện các báo cáo theo yêu cầu.\n4. Phạm vi quyền hạn TT Quyền hạn cụ thể\n4.1\nĐược chủ động về phương pháp thực hiện công việc\n được giao;\n4.2 Tham gia ý kiến hoặc kiến nghị về các việc chuyên môn của đơn vị.\n4.3\nĐược cung cấp các thông tin chỉ đạo điều hành của tổ chức trong phạm vi nhiệm vụ được giao.\n4.4\nĐược yêu cầu cung cấp thông tin và đánh giá mức độ\n xác thực của thông tin phục vụ cho nhiệm vụ được giao.\n4.5\nĐược tham gia các cuộc họp trong và ngoài cơ quan theo sự phân công của cấp trên.\n5. Các yêu cầu về trình độ, năng lực 5.1- Yêu cầu về trình độ\nNhóm yêu cầu Yêu cầu cụ thể\nTrình độ đào tạo\n• Tốt nghiệp đại học trở lên với ngành hoặc chuyên ngành đào tạo phù hợp với lĩnh vực công tác.\n • Có bằng tốt nghiệp cao cấp lý luận chính trị hoặc bằng cao cấp lý luận chính trị - hành chính hoặc có giấy xác nhận trình độ lý\n luận chính trị tương đương cao cấp lý luận chính trị của cơ quan có thẩm quyền.\nBồi dưỡng, chứng chỉ\n• Có chứng chỉ bồi dưỡng kiến thức, kỹ năng quản lý nhà nước đối với công chức ngạch chuyên viên cao cấp hoặc tương đương hoặc có bằng cao cấp lý luận chính trị - hành chính.\nKinh nghiệm (thành tích công tác)\n• Có thời gian giữ ngạch chuyên viên chính hoặc tương đương từ đủ 06 năm trở lên. Trường hợp có thời gian tương đương với ngạch chuyên viên chính thì thời gian giữ ngạch chuyên viên chính tối thiểu 01 năm\n (đủ 12 tháng).\n • Trong thời gian giữ ngạch chuyên viên chính hoặc tương đương đã chủ trì hoặc tham gia xây dựng, thẩm định, góp ý kiến ít nhất 02 văn bản quy phạm pháp luật hoặc đề tài, đề án, dự án, chương trình nghiên cứu khoa học cấp nhà nước, cấp bộ, cấp ban, cấp ngành mà cơ quan sử dụng công chức được giao chủ trì nghiên cứu, xây dựng đã được cấp có thẩm quyền ban hành hoặc nghiệm thu.\nPhẩm chất cá nhân\n• Tuyệt đối trung thành, tin tưởng, nghiêm túc chấp hành chủ trương, chính sách của Đảng, pháp luật của Nhà nước, quy định của cơ\n quan;\n • Tinh thần trách nhiệm cao với công việc với tập thể, phối hợp công tác tốt;\n • Trung thực, thẳng thắn, kiên định nhưng biết lắng nghe;\n • Điềm tĩnh, nguyên tắc, cẩn thận, bảo mật thông tin.\n • Khả năng đoàn kết nội bộ.\n • Chịu được áp lực trong công việc.\n • Tập trung, sáng tạo, tư duy độc lập và logic.\nCác yêu cầu khác\n• Có khả năng tham mưu, xây dựng, thực hiện, kiểm tra và đề xuất các chủ trương, chính sách, nghị quyết, kế hoạch, giải pháp đối với các vấn đề thực tiễn liên quan trong phạm vi chức năng, nhiệm vụ được giao.\n • Có khả năng cụ thể hóa và tổ chức thực hiện hiệu quả các chủ trương, đường lối của Đảng, chính sách pháp luật của Nhà nước ở\n lĩnh vực công tác được phân công.\n • Có khả năng đề xuất những chủ trương, xây dựng quy trình nội bộ và giải pháp giải quyết các vấn đề thực tiễn liên quan đến chức năng, nhiệm vụ của đơn vị.\n • Hiểu và vận dụng được các kiến thức chuyên sâu,\n nâng cao về lĩnh vực hoạt động và thực thi, kỹ năng xử lý các tình huống trong quá trình hướng dẫn, kiểm tra, giám sát, tham mưu, đề xuất và thực hiện công việc theo vị trí việc làm.\n • Hiểu và vận dụng được các kiến thức về phương pháp nghiên cứu, tổ chức, triển khai nghiên cứu, xây dựng các tài liệu, đề\n tài, đề án thuộc lĩnh vực chuyên môn đảm nhiệm.\n • Biết vận dụng các kiến thức cơ bản và nâng cao về ngành, lĩnh vực; có kỹ năng thuyết trình, giảng dạy, hướng dẫn nghiệp vụ về\n ngành, lĩnh vực.\n • Áp dụng thành thạo các kiến thức; kỹ thuật xây dựng, ban hành văn bản vào công việc theo yêu cầu của vị trí việc làm.\n5.2- Các năng lực Nhóm năng lực Tên năng lực Cấp độ\nNhóm năng lực chung\n• Đạo đức và bản lĩnh 4-5\n• Tổ chức thực hiện công việc 4-5\n• Kỹ thuật soạn thảo và ban hành văn bản 4-5\n• Giao tiếp ứng xử\n4-5\n• Quan hệ phối hợp 4-5\n• Sử dụng công nghệ thông tin Phù hợp với chức năng, nhiệm vụ của cơ quan, tổ chức, đơn vị sử dụng vị trí việc làm được cấp có thẩm quyền phê duyệt\n• Sử dụng ngoại ngữ\nNhóm năng lực chuyên môn\n• Khả năng xây dựng văn bản 4-5\n• Khả năng hướng dẫn thực hiện văn bản 4-5\n• Khả năng theo dõi, kiểm tra thực hiện văn bản 4-5\n• Khả năng thực thi 4-5\n• Khả năng phối hợp thực hiện 4-5 Nhóm năng lực quản lý\n• Tư duy chiến lược 3-4\n• Quản lý sự thay đổi 3-4\n• Ra quyết định 3-4\n• Quản lý nguồn lực 3-4\n• Phát triển công chức 3-4 Phê duyệt của lãnh\nđạo Biểu số 23 TÊN CƠ\n QUAN:....\n TÊN TỔ CHỨC:....\n -------\nCỘNG HÒA XÃ HỘI CHỦ NGHĨA VIỆT NAM\n Độc lập - Tự do - Hạnh phúc \n ---------------\nBẢN MÔ TẢ CÔNG VIỆC Tên VTVL: Chuyên viên chính Quản lý thị trường bất\n động sản Mã vị trí việc làm:\nNgày bắt đầu thực hiện:\nĐịa điểm làm việc:\n( Địa chỉ trụ sở cơ quan)\nQuy trình công việc liên quan\n(Tên tài liệu, quy trình công việc liên quan đến vị trí này)\n1. Mục tiêu vị trí việc làm: (Tóm tắt tổng quan về vị trí việc làm)\nTham gia tham mưu, tổng hợp và hoạch định chính sách, chiến lược có tính vĩ mô trong lĩnh vực kinh doanh bất động sản.\nChủ trì hoặc tham gia xây dựng chương trình, đề án,\ndự án, các văn bản quy phạm pháp luật, văn bản hướng dẫn thực thi trong lĩnh vực kinh doanh bất động sản.\n2. Các công việc và tiêu chí đánh giá\nTT Các công việc Tiêu chí đánh giá hoàn thành công việc Mảng công việc Công việc cụ thể\n2.1 Xây dựng văn bản 1. Tham gia tham mưu, tổng hợp và hoạch định chính sách, chiến lược có tính vĩ mô trong lĩnh vực thị trường bất động sản.\n 2. Chủ trì xây dựng chiến lược, kế hoạch, chương trình, đề án, dự án phát triển thị trường bất động sản cấp quốc gia, cấp bộ/tỉnh và các văn bản quy phạm pháp luật, văn bản hướng dẫn thực thi trong lĩnh vực thị trường bất động sản.\n 3. Tham mưu nghiên cứu, xây dựng hệ thống quy chuẩn,\n tiêu chuẩn, định mức kinh tế kỹ thuật trong lĩnh vực thị trường bất động sản.\n1. Dự thảo các văn bản được cấp có thẩm quyền ban hành.\n 2. Chương trình, đề án, dự án được nghiệm thu,\n ban hành.\n 3. Quy chuẩn, tiêu chuẩn, định mức kinh tế kỹ thuật\n được ban hành.\n2.2 Hướng dẫn 1. Chủ trì hoặc tham gia việc phổ biến, hướng dẫn chủ trương, chính sách của Đảng và Nhà nước, văn bản quy phạm pháp luật trong lĩnh vực thị trường bất động sản.\n 2. Hướng dẫn tổ chức, cá nhân về việc thực hiện quy định pháp luật trong lĩnh vực thị trường bất động sản.\n1. Văn bản hướng dẫn được xây dựng theo đúng nội dung quy định, đúng tiến độ.\n 2. Tham gia thực hiện, phổ biến, hướng dẫn pháp luật theo lĩnh vực hoạt động.\n2.3 Theo dõi, kiểm tra 1. Tham gia theo dõi, kiểm tra và tổng hợp kết quả\n thực hiện các chính sách, chiến lược có tính vĩ mô trong lĩnh vực thị trường bất động sản.\n 2. Chủ trì theo dõi, kiểm tra, tổng hợp việc thực thi pháp luật trong lĩnh vực thị trường bất động sản theo quy định của pháp luật.\nBáo cáo kết quả kiểm tra, đánh giá và có đề xuất kịp thời, đúng kế hoạch, được cấp thẩm quyền phê duyệt.\n2.4 Thực thi 1. Tham gia triển khai chương trình, dự án, đề án\n đã được phê duyệt từ cấp bộ/tỉnh trong lĩnh vực bất động sản.\n 2. Chủ trì thực hiện các hoạt động nghiệp vụ theo quy định pháp luật.\n 3. Chủ trì thực hiện các quy trình, thủ tục theo\n đúng quy định.\n1. Kết quả triển khai công việc theo đúng kế hoạch;\n đảm bảo tiến độ, chất lượng theo quy định.\n 2. Các hoạt động nghiệp vụ, các quy trình, thủ tục\n được thực hiện theo đúng quy định.\n2.5 Nghiên cứu đề tài khoa học, dự án sự nghiệp kinh tế\nChủ trì hoặc tham gia nghiên cứu các đề tài khoa học, dự án sự nghiệp kinh tế cấp nhà nước, cấp bộ/tỉnh trong lĩnh vực thị trường bất động sản.\nĐề tài, dự án được nghiệm thu ở mức đạt trở lên 2.6 Phối hợp thực hiện Có trách nhiệm phối hợp thực hiện các công việc liên quan theo lĩnh vực nhiệm vụ được phân công.\nCông việc, nhiệm vụ được giao thông suốt, tạo được mối quan hệ công tác phát triển hiệu quả cao.\n2.7 Họp, hội nghị, hội thảo Tham dự các cuộc họp, hội nghị, hội thảo liên quan đến lĩnh vực chuyên môn ở trong và ngoài cơ quan theo phân công.\nTham dự đầy đủ, tiếp thu, trao đổi thông tin, triển khai thực hiện theo kết luận cuộc họp 2.8 Xây dựng và thực hiện kế hoạch công tác năm, quý,\n tháng, tuần của cá nhân.\nXây dựng, thực hiện kế hoạch theo đúng kế hoạch công tác của đơn vị, cơ quan và nhiệm vụ được giao.\n2.9 Thực hiện các nhiệm vụ khác do cấp trên trực tiếp giao.\n3. Các mối quan hệ trong công việc 3.1- Bên trong\nĐược quản lý trực tiếp và kiểm duyệt kết quả bởi Quan hệ phối hợp trực tiếp trong đơn vị\nCác đơn vị phối hợp chính Lãnh đạo trực tiếp Các công chức chuyên môn khác trong đơn vị\nCác cơ quan, tổ chức, đơn vị thuộc Bộ. địa phương có liên quan.\n (Lưu ý: Việc xác định đơn vị phối hợp chính cần căn cứ vào mối quan hệ của tổ chức sử dụng vị trí việc làm này)\n3.2- Bên ngoài Ban, bộ, ngành,\n địa phương có quan hệ chính Bản chất quan hệ\n• Các cơ quan, tổ chức, đơn vị có hoạt động liên quan đến ngành, lĩnh vực tổ chức bộ máy thuộc phạm vi quản lý của đơn vị.\n (Lưu ý: Việc xác định các cơ quan, tổ chức, đơn vị có quan hệ chính cần căn cứ vào chức năng; nhiệm vụ của tổ chức sử dụng vị\n trí việc làm này)\n• Tham gia các cuộc họp có liên quan.\n • Cung cấp các thông tin theo yêu cầu.\n • Thu thập các thông tin cần thiết cho việc thực hiện công việc chuyên môn.\n • Lấy các thông tin thống kê.\n • Thực hiện các báo cáo theo yêu cầu.\n4. Phạm vi quyền hạn TT Quyền hạn cụ thể\n4.1\nĐược chủ động về phương pháp thực hiện công việc\n được giao;\n4.2 Tham gia ý kiến hoặc kiến nghị về các việc chuyên môn của đơn vị.\n4.3\nĐược cung cấp các thông tin chỉ đạo điều hành của tổ chức trong phạm vi nhiệm vụ được giao.\n4.4\nĐược yêu cầu cung cấp thông tin và đánh giá mức độ\n xác thực của thông tin phục vụ cho nhiệm vụ được giao.\n4.5\nĐược tham gia các cuộc họp trong và ngoài cơ quan theo sự phân công của cấp trên.\n5. Các yêu cầu về trình độ, năng lực 5.1- Yêu cầu về trình độ\nNhóm yêu cầu Yêu cầu cụ thể\nTrình độ đào tạo\n• Tốt nghiệp đại học trở lên với ngành hoặc chuyên ngành đào tạo phù hợp với lĩnh vực công tác.\nBồi dưỡng, chứng chỉ\n• Có chứng chỉ bồi dưỡng kiến thức, kỹ năng quản lý nhà nước đối với công chức ngạch chuyên viên chính hoặc tương đương hoặc có bằng cao cấp lý luận chính trị - hành chính.\nKinh nghiệm (thành tích công tác)\n• Có thời gian giữ ngạch chuyên viên hoặc tương\n đương từ đủ 09 năm trở lên. Trường hợp có thời gian tương đương với ngạch chuyên viên thì thời gian giữ ngạch chuyên viên tối thiểu 01 năm (đủ 12 tháng).\n • Trong thời gian giữ ngạch chuyên viên hoặc tương đương đã chủ trì hoặc tham gia xây dựng, thẩm định, góp ý kiến ít nhất 01 văn bản quy phạm pháp luật hoặc đề tài, đề án, dự án, chương trình nghiên cứu khoa học cấp cơ sở trở lên mà cơ quan sử dụng công chức được giao chủ trì\n nghiên cứu, xây dựng đã được cấp có thẩm quyền ban hành hoặc nghiệm thu.\nPhẩm chất cá nhân\n• Tuyệt đối trung thành, tin tưởng, nghiêm túc chấp hành chủ trương, chính sách của Đảng, pháp luật của Nhà nước, quy định của cơ\n quan;\n • Tinh thần trách nhiệm cao với công việc với tập thể, phối hợp công tác tốt;\n • Trung thực, thẳng thắn, kiên định nhưng biết lắng nghe;\n • Điềm tĩnh, nguyên tắc, cẩn thận, bảo mật thông tin.\n • Khả năng đoàn kết nội bộ.\n • Chịu được áp lực trong công việc.\n • Tập trung, sáng tạo, tư duy độc lập và logic.\nCác yêu cầu khác\n• Có khả năng tham mưu, xây dựng, thực hiện, kiểm tra và đề xuất các chủ trương, chính sách, nghị quyết, kế hoạch, giải pháp đối với các vấn đề thực tiễn liên quan trong phạm vi chức năng, nhiệm vụ được giao.\n • Có khả năng cụ thể hóa và tổ chức thực hiện hiệu quả các chủ trương, đường lối của Đảng, chính sách pháp luật của Nhà nước ở\n lĩnh vực công tác được phân công.\n • Có khả năng đề xuất những chủ trương, xây dựng quy trình nội bộ và giải pháp giải quyết các vấn đề thực tiễn liên quan đến chức năng, nhiệm vụ của đơn vị.\n • Hiểu và vận dụng được các kiến thức chuyên sâu,\n nâng cao về lĩnh vực hoạt động và thực thi, kỹ năng xử lý các tình huống trong quá trình hướng dẫn, kiểm tra, giám sát, tham mưu, đề xuất và thực hiện công việc theo vị trí việc làm.\n • Hiểu và vận dụng được các kiến thức về phương pháp nghiên cứu, tổ chức, triển khai nghiên cứu, xây dựng các tài liệu, đề\n tài, đề án thuộc lĩnh vực chuyên môn đảm nhiệm.\n • Biết vận dụng các kiến thức cơ bản và nâng cao về ngành, lĩnh vực; có kỹ năng thuyết trình, giảng dạy, hướng dẫn nghiệp vụ về\n ngành, lĩnh vực.\n • Áp dụng thành thạo các kiến thức: kỹ thuật xây dựng, ban hành văn bản vào công việc theo yêu cầu của vị trí việc làm.\n5.2- Các năng lực Nhóm năng lực Tên năng lực Cấp độ\nNhóm năng lực chung\n• Đạo đức và bản lĩnh 3-4\n• Tổ chức thực hiện công việc 3-4\n• Kỹ thuật soạn thảo và ban hành văn bản 3-4\n• Giao tiếp ứng xử\n3-4\n• Quan hệ phối hợp 3-4\n• Sử dụng công nghệ thông tin Phù hợp với chức năng,\n nhiệm vụ của cơ quan, tổ chức, đơn vị sử dụng vị trí việc làm được cấp có thẩm quyền phê duyệt\n• Sử dụng ngoại ngữ\nNhóm năng lực chuyên môn\n• Khả năng xây dựng văn bản 3-4\n• Khả năng hướng dẫn thực hiện văn bản 3-4\n• Khả năng theo dõi, kiểm tra thực hiện văn bản 3-4\n• Khả năng thực thi 3-4\n• Khả năng phối hợp thực hiện 3-4 Nhóm năng lực quản lý\n• Tư duy chiến lược 2-3\n• Quản lý sự thay đổi 2-3\n• Ra quyết định 2-3\n• Quản lý nguồn lực 2-3\n• Phát triển công chức 2-3 Phê duyệt của lãnh đạo Biểu số 24 TÊN CƠ\n QUAN:....\n TÊN TỔ CHỨC:....\n -------\nCỘNG HÒA XÃ HỘI CHỦ NGHĨA VIỆT NAM\n Độc lập - Tự do - Hạnh phúc \n ---------------\nBẢN MÔ TẢ CÔNG VIỆC Tên VTVL: Chuyên viên Quản lý thị trường bất động sản Mã vị trí việc làm:\nNgày bắt đầu thực hiện:\nĐịa điểm làm việc:\n(Địa chỉ trụ sở cơ quan)\nQuy trình công việc liên quan\n(Tên tài liệu, quy trình công việc liên quan đến vị trí này)\n1. Mục tiêu vị trí việc làm: (Tóm tắt tổng quan về vị trí việc làm)\nTham gia xây dựng chương trình, đề án, dự án, các văn bản quy phạm pháp luật, văn bản hướng dẫn thực thi trong lĩnh vực kinh doanh bất động sản.\nChủ trì hoặc tham gia nghiên cứu, đề xuất cấp thẩm quyền các giải pháp, biện pháp xử lý vấn đề cụ thể trong lĩnh vực công việc được phân công.\n2. Các công việc và tiêu chí đánh giá\nTT Các công việc Tiêu chí đánh giá hoàn thành công việc Mảng công việc Công việc cụ thể\n2.1 Xây dựng văn bản 1. Tham gia xây dựng chương trình, đề án, dự án cấp bộ/tỉnh và các văn bản quy phạm pháp luật, văn bản hướng dẫn thực thi trong lĩnh vực kinh doanh bất động sản.\n 2. Tham gia nghiên cứu, xây dựng chỉ số giá bất động sản, hệ thống thông tin; quy chuẩn, tiêu chuẩn liên quan đến bất động sản.\n1. Dự thảo các văn bản được cấp có thẩm quyền ban hành.\n 2. Chương trình, đề án, dự án được nghiệm thu,\n ban hành.\n 3. Quy chuẩn, tiêu chuẩn, định mức kinh tế kỹ thuật\n được ban hành.\n2.2 Hướng dẫn 1. Tham gia việc phổ biến, hướng dẫn chủ trương,\n chính sách của Đảng và Nhà nước, văn bản quy phạm pháp luật trong lĩnh vực kinh doanh bất động sản.\n 2. Hướng dẫn tổ chức, cá nhân về việc thực hiện quy định pháp luật trong lĩnh vực kinh doanh bất động sản.\n1. Văn bản hướng dẫn được xây dựng theo đúng nội dung quy định, đúng tiến độ.\n 2. Tham gia thực hiện, phổ biến, hướng dẫn pháp luật theo lĩnh vực hoạt động.\n2.3 Theo dõi, kiểm tra Tham gia theo dõi, rà soát, kiểm tra, tổng hợp việc thực thi pháp luật về điều kiện năng lực của chủ đầu tư dự án; các dự án kinh doanh bất động sản để kiến nghị cơ quan nhà nước có thẩm quyền thực hiện việc thu hồi, đình chỉ, tạm dừng hoặc điều chỉnh, chuyển đổi, chuyển nhượng các dự\n án kinh doanh bất động sản.\nBáo cáo kết quả kiểm tra, đánh giá và có đề xuất kịp thời, đúng kế hoạch, được cấp thẩm quyền phê duyệt.\n2.4 Thực thi 1. Tham gia triển khai chương trình, dự án, đề án\n đã được phê duyệt từ cấp bộ/tỉnh kinh doanh bất động sản.\n 2. Thực hiện các hoạt động nghiệp vụ theo quy định pháp luật.\n 3. Chủ trì thực hiện các quy trình, thủ tục theo\n đúng quy định.\n1. Kết quả triển khai công việc theo đúng kế hoạch;\n đảm bảo tiến độ, chất lượng theo quy định.\n 2. Các hoạt động nghiệp vụ, các quy trình, thủ tục\n được thực hiện theo đúng quy định.\n2.5 Nghiên cứu đề tài khoa học, dự án sự nghiệp kinh tế\nTham gia nghiên cứu các đề tài khoa học, dự án sự\n nghiệp kinh tế cấp bộ/tỉnh, chủ trì nghiên cứu các đề tài, dự án cấp cơ sở\n trong lĩnh vực kinh doanh bất động sản.\nĐề tài, dự án được nghiệm thu ở mức đạt trở lên 2.6 Phối hợp thực hiện Có trách nhiệm phối hợp thực hiện các công việc liên quan theo phân công.\nCông việc, nhiệm vụ được giao thông suốt, tạo được mối quan hệ công tác phát triển hiệu quả cao.\n2.7 Họp, hội nghị, hội thảo Tham dự các cuộc họp, hội nghị, hội thảo liên quan đến lĩnh vực chuyên môn ở trong và ngoài cơ quan theo phân công.\nTham dự đầy đủ, tiếp thu, trao đổi thông tin, triển khai thực hiện theo kết luận cuộc họp 2.8 Xây dựng và thực hiện kế hoạch công tác năm, quý,\n tháng, tuần của cá nhân.\nXây dựng, thực hiện kế hoạch theo đúng kế hoạch công tác của đơn vị, cơ quan và nhiệm vụ được giao.\n2.9 Thực hiện các nhiệm vụ khác do cấp trên trực tiếp giao.\n3. Các mối quan hệ trong công việc 3.1- Bên trong\nĐược quản lý trực tiếp và kiểm duyệt kết quả bởi Quan hệ phối hợp trực tiếp trong đơn vị\nCác đơn vị phối hợp chính Lãnh đạo trực tiếp Các công chức chuyên môn khác trong đơn vị\nCác cơ quan, tổ chức, đơn vị thuộc Bộ. địa phương có liên quan.\n (Lưu ý: Việc xác định đơn vị phối hợp chính cần căn cứ vào mối quan hệ của tổ chức sử dụng vị trí việc làm này)\n3.2- Bên ngoài Ban, bộ, ngành,\n địa phương có quan hệ chính Bản chất quan hệ\n• Các cơ quan, tổ chức, đơn vị có hoạt động liên quan đến ngành, lĩnh vực tổ chức bộ máy thuộc phạm vi quản lý của đơn vị.\n (Lưu ý: Việc xác định các cơ quan, tổ chức,\n đơn vị có quan hệ chính cần căn cứ vào chức năng; nhiệm vụ của tổ chức sử dụng vị trí việc làm này)\n• Tham gia các cuộc họp có liên quan.\n • Cung cấp các thông tin theo yêu cầu.\n • Thu thập các thông tin cần thiết cho việc thực hiện công việc chuyên môn.\n • Lấy các thông tin thống kê.\n • Thực hiện các báo cáo theo yêu cầu.\n4. Phạm vi quyền hạn TT Quyền hạn cụ thể\n4.1\nĐược chủ động về phương pháp thực hiện công việc\n được giao;\n4.2 Tham gia ý kiến hoặc kiến nghị về các việc chuyên môn của đơn vị.\n4.3\nĐược cung cấp các thông tin chỉ đạo điều hành của tổ chức trong phạm vi nhiệm vụ được giao.\n4.4\nĐược yêu cầu cung cấp thông tin và đánh giá mức độ\n xác thực của thông tin phục vụ cho nhiệm vụ được giao.\n4.5\nĐược tham gia các cuộc họp trong và ngoài cơ quan theo sự phân công của cấp trên.\n5. Các yêu cầu về trình độ, năng lực 5.1- Yêu cầu về trình độ\nNhóm yêu cầu Yêu cầu cụ thể\nTrình độ đào tạo\n• Tốt nghiệp đại học trở lên với ngành hoặc chuyên ngành đào tạo phù hợp với lĩnh vực công tác.\nBồi dưỡng, chứng chỉ\n• Có chứng chỉ bồi dưỡng kiến thức, kỹ năng quản lý nhà nước đối với công chức ngạch chuyên viên và tương đương.\nPhẩm chất cá nhân\n• Tuyệt đối trung thành, tin tưởng, nghiêm túc chấp hành chủ trương, chính sách của Đảng, pháp luật của Nhà nước, quy định của cơ\n quan;\n • Tinh thần trách nhiệm cao với công việc với tập thể, phối hợp công tác tốt;\n • Trung thực, thẳng thắn, kiên định nhưng biết lắng nghe;\n • Điềm tĩnh, nguyên tắc, cẩn thận, bảo mật thông tin.\n • Khả năng đoàn kết nội bộ.\n • Chịu được áp lực trong công việc.\n • Tập trung, sáng tạo, tư duy độc lập và logic.\nCác yêu cầu khác\n• Có khả năng tham mưu, xây dựng, thực hiện, kiểm tra và đề xuất các chủ trương, chính sách, nghị quyết, kế hoạch, giải pháp đối với các vấn đề thực tiễn liên quan trong phạm vi chức năng, nhiệm vụ được giao.\n • Có khả năng cụ thể hóa và tổ chức thực hiện hiệu quả các chủ trương, đường lối của Đảng, chính sách pháp luật của Nhà nước ở\n lĩnh vực công tác được phân công.\n • Có khả năng đề xuất những chủ trương, xây dựng quy trình nội bộ và giải pháp giải quyết các vấn đề thực tiễn liên quan đến chức năng, nhiệm vụ của đơn vị.\n • Hiểu và vận dụng được các kiến thức chuyên sâu,\n nâng cao về lĩnh vực hoạt động và thực thi, kỹ năng xử lý các tình huống trong quá trình hướng dẫn, kiểm tra, giám sát, tham mưu, đề xuất và thực hiện công việc theo vị trí việc làm.\n • Hiểu và vận dụng được các kiến thức về phương pháp nghiên cứu, tổ chức, triển khai nghiên cứu, xây dựng các tài liệu, đề\n tài, đề án thuộc lĩnh vực chuyên môn đảm nhiệm.\n • Biết vận dụng các kiến thức cơ bản và nâng cao về ngành, lĩnh vực; có kỹ năng thuyết trình, giảng dạy. hướng dẫn nghiệp vụ về\n ngành, lĩnh vực.\n • Áp dụng thành thạo các kiến thức: kỹ thuật xây dựng, ban hành văn bản vào công việc theo yêu cầu của vị trí việc làm.\n5.2- Các năng lực Nhóm năng lực Tên năng lực Cấp độ\nNhóm năng lực chung\n• Đạo đức và bản lĩnh 2-3\n• Tổ chức thực hiện công việc 2-3\n• Kỹ thuật soạn thảo và ban hành văn bản 2-3\n• Giao tiếp ứng xử\n2-3\n• Quan hệ phối hợp 2-3\n• Sử dụng công nghệ thông tin Phù hợp với chức năng, nhiệm vụ của cơ quan, tổ chức, đơn vị sử dụng vị trí việc làm được cấp có thẩm quyền phê duyệt\n• Sử dụng ngoại ngữ\nNhóm năng lực chuyên môn\n• Khả năng xây dựng văn bản 2-3\n• Khả năng hướng dẫn thực hiện văn bản 2-3\n• Khả năng theo dõi, kiểm tra thực hiện văn bản 2-3\n• Khả năng thực thi 2-3\n• Khả năng phối hợp thực hiện 2-3 Nhóm năng lực quản lý\n• Tư duy chiến lược 1-2\n• Quản lý sự thay đổi 1-2\n• Ra quyết định 1-2\n• Quản lý nguồn lực 1-2\n• Phát triển công chức 1-2 Phê duyệt của lãnh\nđạo Biểu số 25 TÊN CƠ\n QUAN:....\n TÊN TỔ CHỨC:....\n -------\nCỘNG HÒA XÃ HỘI CHỦ NGHĨA VIỆT NAM\n Độc lập - Tự do - Hạnh phúc \n ---------------\nBẢN MÔ TẢ CÔNG VIỆC Tên VTVL: Chuyên viên cao cấp Quản lý vật liệu xây dựng Mã vị trí việc làm:\nNgày bắt đầu thực hiện:\nĐịa điểm làm việc:\n(Địa chỉ trụ sở cơ quan)\nQuy trình công việc liên quan\n(Tên tài liệu, quy trình công việc liên quan đến vị trí này)\n1. Mục tiêu vị trí việc làm: (Tóm tắt tổng quan về vị trí việc làm)\nChủ trì tham mưu, tổng hợp và hoạch định chính sách, chiến lược có tính vĩ mô trong lĩnh vực vật liệu xây dựng.\nChủ trì xây dựng chương trình, đề án, dự án, các văn bản quy phạm pháp luật, quy hoạch chuyên ngành, văn bản hướng dẫn thực thi trong lĩnh vực vật liệu xây dựng.\n2. Các công việc và tiêu chí đánh giá\nTT Các công việc Tiêu chí đánh giá hoàn thành công việc Mảng công việc Công việc cụ thể\n2.1 Xây dựng văn bản 1. Chủ trì tham mưu, tổng hợp và hoạch định chính sách, chiến lược có tính vĩ mô trong lĩnh vực vật liệu xây dựng.\n 2. Chủ trì xây dựng chương trình, đề án, dự án cấp quốc gia, cấp bộ và các văn bản quy phạm pháp luật, quy hoạch chuyên ngành,\n văn bản hướng dẫn thực thi trong lĩnh vực vật liệu xây dựng.\n 3. Tham mưu nghiên cứu, xây dựng hệ thống quy chuẩn,\n tiêu chuẩn, định mức kinh tế kỹ thuật trong lĩnh vực vật liệu xây dựng.\n1. Dự thảo các văn bản1 được cấp có thẩm quyền2 ban hành.\n 2. Chương trình, đề án, dự án được nghiệm thu,\n ban hành.\n 3. Các quy hoạch được phê duyệt.\n 4. Quy chuẩn, tiêu chuẩn, định mức kinh tế kỹ thuật\n được ban hành.\n2.2 Hướng dẫn 1. Chủ trì việc phổ biến, hướng dẫn chủ trương,\n chính sách của Đảng và Nhà nước, văn bản quy phạm pháp luật trong lĩnh vực vật liệu xây dựng.\n 2. Hướng dẫn tổ chức, cá nhân về việc thực hiện quy định pháp luật trong lĩnh vực vật liệu xây dựng.\n1. Văn bản hướng dẫn được xây dựng theo đúng nội dung quy định, đúng tiến độ.\n 2. Tham gia thực hiện, phổ biến, hướng dẫn pháp luật theo lĩnh vực hoạt động.\n2.3 Theo dõi, kiểm tra 1. Chủ trì theo dõi, kiểm tra và tổng hợp kết quả\n thực hiện các chính sách, chiến lược có tính vĩ mô trong lĩnh vực vật liệu xây dựng.\n 2. Chủ trì theo dõi, kiểm tra, tổng hợp việc thực thi pháp luật trong lĩnh vực vật liệu xây dựng theo quy định của pháp luật.\nBáo cáo kết quả kiểm tra, đánh giá và có đề xuất kịp thời, đúng kế hoạch, được cấp thẩm quyền phê duyệt.\n2.4 Thực thi 1. Chủ trì triển khai chương trình, dự án, đề án,\n đồ án quy hoạch đã được phê duyệt từ cấp bộ trở lên trong lĩnh vực vật liệu xây dựng.\n 2. Chủ trì thực hiện các hoạt động nghiệp vụ theo quy định pháp luật.\n 3. Chủ trì thực hiện các quy trình, thủ tục theo\n đúng quy định.\n1. Kết quả triển khai công việc theo đúng kế hoạch;\n đảm bảo tiến độ, chất lượng theo quy định.\n 2. Các hoạt động nghiệp vụ, các quy trình, thủ tục\n được thực hiện theo đúng quy định.\n2.5 Nghiên cứu đề tài khoa học, dự án sự nghiệp kinh tế\nChủ trì hoặc tham gia nghiên cứu các đề tài khoa học, dự án sự nghiệp kinh tế cấp nhà nước, cấp bộ trong lĩnh vực vật liệu xây dựng.\nĐề tài, dự án được nghiệm thu ở mức đạt trở lên.\n2.6 Phối hợp thực hiện Có trách nhiệm phối hợp thực hiện các công việc liên quan theo lĩnh vực nhiệm vụ được phân công.\nCông việc, nhiệm vụ được giao thông suốt, tạo được mối quan hệ công tác phát triển hiệu quả cao.\n2.7 Họp, hội nghị, hội thảo Chủ trì các báo cáo cuộc họp, hội nghị, hội thảo liên quan đến lĩnh vực chuyên môn ở trong và ngoài cơ quan theo phân công.\nTham dự đầy đủ, tiếp thu, trao đổi thông tin, triển khai thực hiện theo kết luận cuộc họp 2.8 Xây dựng và thực hiện kế hoạch công tác năm, quý,\n tháng, tuần của cá nhân.\nXây dựng, thực hiện kế hoạch theo đúng kế hoạch công tác của đơn vị, cơ quan và nhiệm vụ được giao.\n2.9 Thực hiện các nhiệm vụ khác do cấp trên trực tiếp giao.\n3. Các mối quan hệ trong công việc 3.1- Bên trong\nĐược quản lý trực tiếp và kiểm duyệt kết quả bởi Quan hệ phối hợp trực tiếp trong đơn vị\nCác đơn vị phối hợp chính Lãnh đạo trực tiếp Các công chức chuyên môn khác trong đơn vị\nCác cơ quan, tổ chức, đơn vị thuộc Bộ, địa phương có liên quan.\n (Lưu ý: Việc xác định đơn vị phối hợp chính cần căn cứ vào mối quan hệ của tổ chức sử dụng vị trí việc làm này)\n3.2- Bên ngoài Ban, bộ, ngành,\n địa phương có quan hệ chính Bản chất quan hệ\n• Các cơ quan, tổ chức, đơn vị có hoạt động liên quan đến ngành, lĩnh vực tổ chức bộ máy thuộc phạm vi quản lý của đơn vị.\n (Lưu ý: Việc xác định các cơ quan, tổ chức, đơn vị có quan hệ chính cần căn cứ vào chức năng; nhiệm vụ của tổ chức sử dụng vị\n trí việc làm này)\n• Tham gia các cuộc họp có liên quan.\n • Cung cấp các thông tin theo yêu cầu.\n • Thu thập các thông tin cần thiết cho việc thực hiện công việc chuyên môn.\n • Lấy các thông tin thống kê.\n • Thực hiện các báo cáo theo yêu cầu.\n4. Phạm vi quyền hạn TT Quyền hạn cụ thể\n4.1\nĐược chủ động về phương pháp thực hiện công việc\n được giao;\n4.2 Tham gia ý kiến hoặc kiến nghị về các việc chuyên môn của đơn vị.\n4.3\nĐược cung cấp các thông tin chỉ đạo điều hành của tổ chức trong phạm vi nhiệm vụ được giao.\n4.4\nĐược yêu cầu cung cấp thông tin và đánh giá mức độ\n xác thực của thông tin phục vụ cho nhiệm vụ được giao.\n4.5\nĐược tham gia các cuộc họp trong và ngoài cơ quan theo sự phân công của cấp trên.\n5. Các yêu cầu về trình độ, năng lực 5.1- Yêu cầu về trình độ\nNhóm yêu cầu Yêu cầu cụ thể\nTrình độ đào tạo\n• Tốt nghiệp đại học trở lên với ngành hoặc chuyên ngành đào tạo phù hợp với lĩnh vực công tác.\n • Có bằng tốt nghiệp cao cấp lý luận chính trị hoặc bằng cao cấp lý luận chính trị - hành chính hoặc có giấy xác nhận trình độ lý\n luận chính trị tương đương cao cấp lý luận chính trị của cơ quan có thẩm quyền.\nBồi dưỡng, chứng chỉ\n• Có chứng chỉ bồi dưỡng kiến thức, kỹ năng quản lý nhà nước đối với công chức ngạch chuyên viên cao cấp hoặc tương đương hoặc có bằng cao cấp lý luận chính trị - hành chính.\nKinh nghiệm (thành tích công tác)\n• Có thời gian giữ ngạch chuyên viên chính hoặc tương đương từ đủ 06 năm trở lên. Trường hợp có thời gian tương đương với ngạch chuyên viên chính thì thời gian giữ ngạch chuyên viên chính tối thiểu 01 năm\n (đủ 12 tháng).\n Trong thời gian giữ ngạch chuyên viên chính hoặc tương đương đã chủ trì hoặc tham gia xây dựng, thẩm định, góp ý kiến ít nhất 02 văn bản quy phạm pháp luật hoặc đề tài, đề án, dự án, chương trình nghiên cứu khoa học cấp nhà nước, cấp bộ, cấp ban, cấp ngành mà cơ quan sử dụng công chức được giao chủ trì nghiên cứu, xây dựng đã được cấp có thẩm quyền ban hành hoặc nghiệm thu.\nPhẩm chất cá nhân\n• Tuyệt đối trung thành, tin tưởng, nghiêm túc chấp hành chủ trương, chính sách của Đảng, pháp luật của Nhà nước, quy định của cơ\n quan;\n • Tinh thần trách nhiệm cao với công việc với tập thể, phối hợp công tác tốt;\n • Trung thực, thẳng thắn, kiên định nhưng biết lắng nghe;\n • Điềm tĩnh, nguyên tắc, cẩn thận, bảo mật thông tin.\n • Khả năng đoàn kết nội bộ.\n • Chịu được áp lực trong công việc.\n • Tập trung, sáng tạo, tư duy độc lập và logic.\nCác yêu cầu khác\n• Có khả năng tham mưu, xây dựng, thực hiện, kiểm tra và đề xuất các chủ trương, chính sách, nghị quyết, kế hoạch, giải pháp đối với các vấn đề thực tiễn liên quan trong phạm vi chức năng, nhiệm vụ được giao.\n • Có khả năng cụ thể hóa và tổ chức thực hiện hiệu quả các chủ trương, đường lối của Đảng, chính sách pháp luật của Nhà nước ở\n lĩnh vực công tác được phân công.\n • Có khả năng đề xuất những chủ trương, xây dựng quy trình nội bộ và giải pháp giải quyết các vấn đề thực tiễn liên quan đến chức năng, nhiệm vụ của đơn vị.\n • Hiểu và vận dụng được các kiến thức chuyên sâu,\n nâng cao về lĩnh vực hoạt động và thực thi, kỹ năng xử lý các tình huống trong quá trình hướng dẫn, kiểm tra, giám sát, tham mưu, đề xuất và thực hiện công việc theo vị trí việc làm.\n • Hiểu và vận dụng được các kiến thức về phương pháp nghiên cứu, tổ chức, triển khai nghiên cứu, xây dựng các tài liệu, đề\n tài, đề án thuộc lĩnh vực chuyên môn đảm nhiệm.\n • Biết vận dụng các kiến thức cơ bản và nâng cao về ngành, lĩnh vực; có kỹ năng thuyết trình, giảng dạy, hướng dẫn nghiệp vụ về\n ngành, lĩnh vực.\n • Áp dụng thành thạo các kiến thức; kỹ thuật xây dựng, ban hành văn bản vào công việc theo yêu cầu của vị trí việc làm.\n5.2- Các năng lực Nhóm năng lực Tên năng lực Cấp độ\nNhóm năng lực chung\n• Đạo đức và bản lĩnh 4-5\n• Tổ chức thực hiện công việc 4-5\n• Kỹ thuật soạn thảo và ban hành văn bản 4-5\n• Giao tiếp ứng xử\n4-5\n• Quan hệ phối hợp 4-5\n• Sử dụng công nghệ thông tin Phù hợp với chức năng,\n nhiệm vụ của cơ quan, tổ chức, đơn vị sử dụng vị trí việc làm được cấp có thẩm quyền phê duyệt\n• Sử dụng ngoại ngữ\nNhóm năng lực chuyên môn\n• Khả năng xây dựng văn bản 4-5\n• Khả năng hướng dẫn thực hiện văn bản 4-5\n• Khả năng theo dõi, kiểm tra thực hiện văn bản 4-5\n• Khả năng thực thi 4-5\n• Khả năng phối hợp thực hiện 4-5 Nhóm năng lực quản lý\n• Tư duy chiến lược 3-4\n• Quản lý sự thay đổi 3-4\n• Ra quyết định 3-4\n• Quản lý nguồn lực 3-4\n• Phát triển công chức 3-4 Phê duyệt của lãnh\nđạo Biểu số 26 TÊN CƠ\n QUAN:....\n TÊN TỔ CHỨC:....\n -------\nCỘNG HÒA XÃ HỘI CHỦ NGHĨA VIỆT NAM\n Độc lập - Tự do - Hạnh phúc \n ---------------\nBẢN MÔ TẢ CÔNG VIỆC Tên VTVL: Chuyên viên chính Quản lý vật liệu xây dựng Mã vị trí việc làm:\nNgày bắt đầu thực hiện:\nĐịa điểm làm việc:\n(Địa chỉ trụ sở cơ quan)\nQuy trình công việc liên quan\n(Tên tài liệu, quy trình công việc liên quan đến vị trí này)\n1. Mục tiêu vị trí việc làm: (Tóm tắt tổng quan về vị trí việc làm)\nTham gia tham mưu, tổng hợp và hoạch định chính sách, chiến lược có tính vĩ mô trong lĩnh vực vật liệu xây dựng.\nChủ trì hoặc tham gia xây dựng chương trình, đề án,\ndự án, các văn bản quy phạm pháp luật, quy hoạch chuyên ngành, văn bản hướng dẫn thực thi trong lĩnh vực vật liệu xây dựng.\n2. Các công việc và tiêu chí đánh giá\nTT Các công việc Tiêu chí đánh giá hoàn thành công việc Mảng công việc Công việc cụ thể\n2.1 Xây dựng văn bản 1. Tham gia tham mưu, tổng hợp và hoạch định chính sách, chiến lược có tính vĩ mô trong lĩnh vực vật liệu xây dựng.\n 2. Chủ trì xây dựng chương trình, đề án, dự án cấp bộ/tỉnh và các văn bản quy phạm pháp luật, quy hoạch chuyên ngành, văn bản hướng dẫn thực thi trong lĩnh vực vật liệu xây dựng.\n 3. Tham mưu nghiên cứu, xây dựng hệ thống quy chuẩn,\n tiêu chuẩn, định mức kinh tế kỹ thuật trong lĩnh vực vật liệu xây dựng.\n1. Dự thảo các văn bản được cấp có thẩm quyền ban hành.\n 2. Chương trình, đề án, dự án được nghiệm thu,\n ban hành.\n 3. Các quy hoạch được phê duyệt.\n 4. Quy chuẩn, tiêu chuẩn, định mức kinh tế kỹ thuật\n được ban hành.\n2.2 Hướng dẫn 1. Chủ trì hoặc tham gia việc phổ biến, hướng dẫn chủ trương, chính sách của Đảng và Nhà nước, văn bản quy phạm pháp luật trong lĩnh vực vật liệu xây dựng.\n 2. Hướng dẫn tổ chức, cá nhân về việc thực hiện quy định pháp luật trong lĩnh vực vật liệu xây dựng.\n1. Văn bản hướng dẫn được xây dựng theo đúng nội dung quy định, đúng tiến độ.\n 2. Tham gia thực hiện, phổ biến, hướng dẫn pháp luật theo lĩnh vực hoạt động.\n2.3 Theo dõi, kiểm tra 1. Tham gia theo dõi, kiểm tra và tổng hợp kết quả\n thực hiện các chính sách, chiến lược có tính vĩ mô trong lĩnh vực vật liệu xây dựng.\n 2. Chủ trì theo dõi, kiểm tra, tổng hợp việc thực thi pháp luật trong lĩnh vực vật liệu xây dựng theo quy định của pháp luật.\nBáo cáo kết quả kiểm tra, đánh giá và có đề xuất kịp thời, đúng kế hoạch, được cấp thẩm quyền phê duyệt.\n2.4 Thực thi 1. Tham gia triển khai chương trình, dự án, đề\n án, đồ án quy hoạch đã được phê duyệt từ cấp bộ/tỉnh trong lĩnh vực vật liệu xây dựng.\n 2. Chủ trì thực hiện các hoạt động nghiệp vụ theo quy định pháp luật.\n 3. Chủ trì thực hiện các quy trình, thủ tục theo\n đúng quy định.\n1. Kết quả triển khai công việc theo đúng kế hoạch;\n đảm bảo tiến độ, chất lượng theo quy định.\n 2. Các hoạt động nghiệp vụ, các quy trình, thủ tục\n được thực hiện theo đúng quy định.\n2.5 Nghiên cứu đề tài khoa học, dự án sự nghiệp kinh tế\nChủ trì hoặc tham gia nghiên cứu các đề tài khoa học, dự án sự nghiệp kinh tế cấp nhà nước, cấp bộ/tỉnh trong lĩnh vực vật liệu xây dựng.\nĐề tài, dự án được nghiệm thu ở mức đạt trở lên 2.6 Phối hợp thực hiện Có trách nhiệm phối hợp thực hiện các công việc liên quan theo lĩnh vực nhiệm vụ được phân công.\nCông việc, nhiệm vụ được giao thông suốt, tạo được mối quan hệ công tác phát triển hiệu quả cao.\n2.7 Họp, hội nghị, hội thảo Tham dự các cuộc họp, hội nghị, hội thảo liên quan đến lĩnh vực chuyên môn ở trong và ngoài cơ quan theo phân công.\nTham dự đầy đủ, tiếp thu, trao đổi thông tin, triển khai thực hiện theo kết luận cuộc họp 2.8 Xây dựng và thực hiện kế hoạch công tác năm, quý,\n tháng, tuần của cá nhân.\nXây dựng, thực hiện kế hoạch theo đúng kế hoạch công tác của đơn vị, cơ quan và nhiệm vụ được giao.\n2.9 Thực hiện các nhiệm vụ khác do cấp trên trực tiếp giao.\n3. Các mối quan hệ trong công việc 3.1- Bên trong\nĐược quản lý trực tiếp và kiểm duyệt kết quả bởi Quan hệ phối hợp trực tiếp trong đơn vị\nCác đơn vị phối hợp chính Lãnh đạo trực tiếp Các công chức chuyên môn khác trong đơn vị\nCác cơ quan, tổ chức, đơn vị thuộc Bộ. địa phương có liên quan.\n (Lưu ý: Việc xác định đơn vị phối hợp chính cần căn cứ vào mối quan hệ của tổ chức sử dụng vị trí việc làm này)\n3.2- Bên ngoài Ban, bộ, ngành,\n địa phương có quan hệ chính Bản chất quan hệ\n• Các cơ quan, tổ chức, đơn vị có hoạt động liên quan đến ngành, lĩnh vực tổ chức bộ máy thuộc phạm vi quản lý của đơn vị.\n (Lưu ý: Việc xác định các cơ quan, tổ chức,\n đơn vị có quan hệ chính cần căn cứ vào chức năng; nhiệm vụ của tổ chức sử dụng vị trí việc làm này)\n• Tham gia các cuộc họp có liên quan.\n • Cung cấp các thông tin theo yêu cầu.\n • Thu thập các thông tin cần thiết cho việc thực hiện công việc chuyên môn.\n • Lấy các thông tin thống kê.\n • Thực hiện các báo cáo theo yêu cầu.\n4. Phạm vi quyền hạn TT Quyền hạn cụ thể\n4.1\nĐược chủ động về phương pháp thực hiện công việc\n được giao;\n4.2 Tham gia ý kiến hoặc kiến nghị về các việc chuyên môn của đơn vị.\n4.3\nĐược cung cấp các thông tin chỉ đạo điều hành của tổ chức trong phạm vi nhiệm vụ được giao.\n4.4\nĐược yêu cầu cung cấp thông tin và đánh giá mức độ\n xác thực của thông tin phục vụ cho nhiệm vụ được giao.\n4.5\nĐược tham gia các cuộc họp trong và ngoài cơ quan theo sự phân công của cấp trên.\n5. Các yêu cầu về trình độ, năng lực 5.1- Yêu cầu về trình độ\nNhóm yêu cầu Yêu cầu cụ thể\nTrình độ đào tạo\n• Tốt nghiệp đại học trở lên với ngành hoặc chuyên ngành đào tạo phù hợp với lĩnh vực công tác.\nBồi dưỡng, chứng chỉ\n• Có chứng chỉ bồi dưỡng kiến thức, kỹ năng quản lý nhà nước đối với công chức ngạch chuyên viên chính hoặc tương đương hoặc có bằng cao cấp lý luận chính trị - hành chính.\nKinh nghiệm (thành tích công tác)\n• Có thời gian giữ ngạch chuyên viên hoặc tương đương từ đủ 09 năm trở lên. Trường hợp có thời gian tương đương với ngạch chuyên viên thì thời gian giữ ngạch chuyên viên tối thiểu 01 năm (đủ 12 tháng).\n • Trong thời gian giữ ngạch chuyên viên hoặc tương đương đã chủ trì hoặc tham gia xây dựng, thẩm định, góp ý kiến ít nhất 01 văn bản quy phạm pháp luật hoặc đề tài, đề án, dự án, chương trình nghiên cứu khoa học cấp cơ sở trở lên mà cơ quan sử dụng công chức được giao chủ trì\n nghiên cứu, xây dựng đã được cấp có thẩm quyền ban hành hoặc nghiệm thu.\nPhẩm chất cá nhân\n• Tuyệt đối trung thành, tin tưởng, nghiêm túc chấp hành chủ trương, chính sách của Đảng, pháp luật của Nhà nước, quy định của cơ\n quan;\n • Tinh thần trách nhiệm cao với công việc với tập thể, phối hợp công tác tốt;\n • Trung thực, thẳng thắn, kiên định nhưng biết lắng nghe;\n • Điềm tĩnh, nguyên tắc, cẩn thận, bảo mật thông tin.\n • Khả năng đoàn kết nội bộ.\n • Chịu được áp lực trong công việc.\n • Tập trung, sáng tạo, tư duy độc lập và logic.\nCác yêu cầu khác\n• Có khả năng tham mưu, xây dựng, thực hiện, kiểm tra và đề xuất các chủ trương, chính sách, nghị quyết, kế hoạch, giải pháp đối với các vấn đề thực tiễn liên quan trong phạm vi chức năng, nhiệm vụ được giao.\n • Có khả năng cụ thể hóa và tổ chức thực hiện hiệu quả các chủ trương, đường lối của Đảng, chính sách pháp luật của Nhà nước ở\n lĩnh vực công tác được phân công.\n • Có khả năng đề xuất những chủ trương, xây dựng quy trình nội bộ và giải pháp giải quyết các vấn đề thực tiễn liên quan đến chức năng, nhiệm vụ của đơn vị.\n • Hiểu và vận dụng được các kiến thức chuyên sâu,\n nâng cao về lĩnh vực hoạt động và thực thi, kỹ năng xử lý các tình huống trong quá trình hướng dẫn, kiểm tra, giám sát, tham mưu, đề xuất và thực hiện công việc theo vị trí việc làm.\n • Hiểu và vận dụng được các kiến thức về phương pháp nghiên cứu, tổ chức, triển khai nghiên cứu, xây dựng các tài liệu, đề\n tài, đề án thuộc lĩnh vực chuyên môn đảm nhiệm.\n • Biết vận dụng các kiến thức cơ bản và nâng cao về ngành, lĩnh vực; có kỹ năng thuyết trình, giảng dạy. hướng dẫn nghiệp vụ về\n ngành, lĩnh vực.\n • Áp dụng thành thạo các kiến thức; kỹ thuật xây dựng, ban hành văn bản vào công việc theo yêu cầu của vị trí việc làm.\n5.2- Các năng lực Nhóm năng lực Tên năng lực Cấp độ\nNhóm năng lực chung\n• Đạo đức và bản lĩnh 3-4\n• Tổ chức thực hiện công việc 3-4\n• Kỹ thuật soạn thảo và ban hành văn bản 3-4\n• Giao tiếp ứng xử\n3-4\n• Quan hệ phối hợp 3-4\n• Sử dụng công nghệ thông tin Phù hợp với chức năng, nhiệm vụ của cơ quan, tổ chức, đơn vị sử dụng vị trí việc làm được cấp có thẩm quyền phê duyệt\n• Sử dụng ngoại ngữ\nNhóm năng lực chuyên môn\n• Khả năng xây dựng văn bản 3-4\n• Khả năng hướng dẫn thực hiện văn bản 3-4\n• Khả năng theo dõi, kiểm tra thực hiện văn bản 3-4\n• Khả năng thực thi 3-4\n• Khả năng phối hợp thực hiện 3-4 Nhóm năng lực quản lý\n• Tư duy chiến lược 2-3\n• Quản lý sự thay đổi 2-3\n• Ra quyết định 2-3\n• Quản lý nguồn lực 2-3\n• Phát triển công chức 2-3 Phê duyệt của lãnh\nđạo Biểu số 27 TÊN CƠ\n QUAN:....\n TÊN TỔ CHỨC:....\n -------\nCỘNG HÒA XÃ HỘI CHỦ NGHĨA VIỆT NAM\n Độc lập - Tự do - Hạnh phúc \n ---------------\nBẢN MÔ TẢ CÔNG VIỆC Tên VTVL: Chuyên viên Quản lý vật liệu xây dựng Mã vị trí việc làm:\nNgày bắt đầu thực hiện:\nĐịa điểm làm việc:\n(Địa chỉ trụ sở cơ quan)\nQuy trình công việc liên quan\n(Tên tài liệu, quy trình công việc liên quan đến vị trí này)\n1. Mục tiêu vị trí việc làm: (Tóm tắt tổng quan về vị trí việc làm)\nTham gia xây dựng chương trình, đề án, dự án, các văn bản quy phạm pháp luật, quy hoạch chuyên ngành, văn bản hướng dẫn thực thi trong lĩnh vực vật liệu xây dựng.\nChủ trì hoặc tham gia nghiên cứu, đề xuất cấp thẩm quyền các giải pháp, biện pháp xử lý vấn đề cụ thể trong lĩnh vực công việc được phân công.\n2. Các công việc và tiêu chí đánh giá\nTT Các công việc Tiêu chí đánh giá hoàn thành công việc Mảng công việc Công việc cụ thể\n2.1 Xây dựng văn bản 1. Tham gia xây dựng chương trình, đề án, dự án cấp bộ/tỉnh và các văn bản quy phạm pháp luật, quy hoạch chuyên ngành, văn bản hướng dẫn thực thi trong lĩnh vực vật liệu xây dựng.\n 2. Tham gia nghiên cứu, xây dựng hệ thống quy chuẩn,\n tiêu chuẩn, định mức kinh tế kỹ thuật trong lĩnh vực vật liệu xây dựng.\n 3. Chủ trì nghiên cứu, tham mưu cho UBND huyện các văn bản hướng dẫn việc tổ chức thực hiện các hoạt động trong lĩnh vực quản lý vật liệu xây dựng trên địa bàn (đối với VTVL tại phòng chuyên môn thuộc UBND cấp huyện).\n1. Dự thảo các văn bản được cấp có thẩm quyền ban hành.\n 2. Chương trình, đề án, dự án được nghiệm thu,\n ban hành.\n 3. Các quy hoạch được phê duyệt.\n 4. Quy chuẩn, tiêu chuẩn, định mức kinh tế kỹ thuật\n được ban hành.\n2.2 Hướng dẫn 1. Tham gia việc phổ biến, hướng dẫn chủ trương,\n chính sách của Đảng và Nhà nước, văn bản quy phạm pháp luật trong lĩnh vực vật liệu xây dựng.\n 2. Hướng dẫn tổ chức, cá nhân về việc thực hiện quy định pháp luật trong lĩnh vực vật liệu xây dựng.\n1. Văn bản hướng dẫn được xây dựng theo đúng nội dung quy định, đúng tiến độ.\n 2. Tham gia thực hiện, phổ biến, hướng dẫn pháp luật theo lĩnh vực hoạt động.\n2.3 Theo dõi, kiểm tra Tham gia theo dõi, kiểm tra, tổng hợp việc thực thi pháp luật trong lĩnh vực vật liệu xây dựng theo quy định của pháp luật.\nBáo cáo kết quả kiểm tra, đánh giá và có đề xuất kịp thời, đúng kế hoạch, được cấp thẩm quyền phê duyệt.\n2.4 Thực thi 1. Tham gia triển khai chương trình, dự án, đề\n án, đồ án quy hoạch đã được phê duyệt từ cấp bộ/tỉnh trong lĩnh vực vật liệu xây dựng.\n 2. Thực hiện các hoạt động nghiệp vụ theo quy định pháp luật.\n 3. Chủ trì thực hiện các quy trình, thủ tục theo\n đúng quy định.\n1. Kết quả triển khai công việc theo đúng kế hoạch;\n đảm bảo tiến độ, chất lượng theo quy định.\n 2. Các hoạt động nghiệp vụ, các quy trình, thủ tục\n được thực hiện theo đúng quy định.\n2.5 Nghiên cứu đề tài khoa học, dự án sự nghiệp kinh tế\nTham gia nghiên cứu các đề tài khoa học, dự án sự\n nghiệp kinh tế cấp bộ/tỉnh, chủ trì nghiên cứu các đề tài, dự án cấp cơ sở\n trong lĩnh vực vật liệu xây dựng.\nĐề tài, dự án được nghiệm thu ở mức đạt trở lên 2.6 Phối hợp thực hiện Có trách nhiệm phối hợp thực hiện các công việc liên quan theo phân công.\nCông việc, nhiệm vụ được giao thông suốt, tạo được mối quan hệ công tác phát triển hiệu quả cao.\n2.7 Họp, hội nghị, hội thảo Tham dự các cuộc họp, hội nghị, hội thảo liên quan đến lĩnh vực chuyên môn ở trong và ngoài cơ quan theo phân công.\nTham dự đầy đủ, tiếp thu, trao đổi thông tin, triển khai thực hiện theo kết luận cuộc họp 2.8 Xây dựng và thực hiện kế hoạch công tác năm, quý,\n tháng, tuần của cá nhân.\nXây dựng, thực hiện kế hoạch theo đúng kế hoạch công tác của đơn vị, cơ quan và nhiệm vụ được giao.\n2.9 Thực hiện các nhiệm vụ khác do cấp trên trực tiếp giao.\n3. Các mối quan hệ trong công việc 3.1- Bên trong\nĐược quản lý trực tiếp và kiểm duyệt kết quả bởi Quan hệ phối hợp trực tiếp trong đơn vị\nCác đơn vị phối hợp chính Lãnh đạo trực tiếp Các công chức chuyên môn khác trong đơn vị\nCác cơ quan, tổ chức,\n đơn vị thuộc Bộ. địa phương có liên quan.\n (Lưu ý: Việc xác định đơn vị phối hợp chính cần căn cứ vào mối quan hệ của tổ chức sử dụng vị trí việc làm này)\n3.2- Bên ngoài Ban, bộ, ngành,\n địa phương có quan hệ chính Bản chất quan hệ\n• Các cơ quan, tổ chức, đơn vị có hoạt động liên quan đến ngành, lĩnh vực tổ chức bộ máy thuộc phạm vi quản lý của đơn vị.\n (Lưu ý: Việc xác định các cơ quan, tổ chức,\n đơn vị có quan hệ chính cần căn cứ vào chức năng; nhiệm vụ của tổ chức sử dụng vị trí việc làm này)\n• Tham gia các cuộc họp có liên quan.\n • Cung cấp các thông tin theo yêu cầu.\n • Thu thập các thông tin cần thiết cho việc thực hiện công việc chuyên môn.\n • Lấy các thông tin thống kê.\n • Thực hiện các báo cáo theo yêu cầu.\n4. Phạm vi quyền hạn TT Quyền hạn cụ thể\n4.1\nĐược chủ động về phương pháp thực hiện công việc\n được giao;\n4.2 Tham gia ý kiến hoặc kiến nghị về các việc chuyên môn của đơn vị.\n4.3\nĐược cung cấp các thông tin chỉ đạo điều hành của tổ chức trong phạm vi nhiệm vụ được giao.\n4.4\nĐược yêu cầu cung cấp thông tin và đánh giá mức độ\n xác thực của thông tin phục vụ cho nhiệm vụ được giao.\n4.5\nĐược tham gia các cuộc họp trong và ngoài cơ quan theo sự phân công của cấp trên.\n5- Các yêu cầu về trình độ, năng lực 5.1- Yêu cầu về trình độ\nNhóm yêu cầu Yêu cầu cụ thể\nTrình độ đào tạo\n• Tốt nghiệp đại học trở lên với ngành hoặc chuyên ngành đào tạo phù hợp với lĩnh vực công tác.\nBồi dưỡng, chứng chỉ\n• Có chứng chỉ bồi dưỡng kiến thức, kỹ năng quản lý\n nhà nước đối với công chức ngạch chuyên viên và tương đương.\nPhẩm chất cá nhân\n• Tuyệt đối trung thành, tin tưởng, nghiêm túc chấp hành chủ trương, chính sách của Đảng, pháp luật của Nhà nước, quy định của cơ\n quan;\n • Tinh thần trách nhiệm cao với công việc với tập thể, phối hợp công tác tốt;\n • Trung thực, thẳng thắn, kiên định nhưng biết lắng nghe;\n • Điềm tĩnh, nguyên tắc, cẩn thận, bảo mật thông tin.\n • Khả năng đoàn kết nội bộ.\n • Chịu được áp lực trong công việc.\n • Tập trung, sáng tạo, tư duy độc lập và logic.\nCác yêu cầu khác\n• Có khả năng tham mưu, xây dựng, thực hiện, kiểm tra và đề xuất các chủ trương, chính sách, nghị quyết, kế hoạch, giải pháp đối với các vấn đề thực tiễn liên quan trong phạm vi chức năng, nhiệm vụ được giao.\n • Có khả năng cụ thể hóa và tổ chức thực hiện hiệu quả các chủ trương, đường lối của Đảng, chính sách pháp luật của Nhà nước ở\n lĩnh vực công tác được phân công.\n • Có khả năng đề xuất những chủ trương, xây dựng quy trình nội bộ và giải pháp giải quyết các vấn đề thực tiễn liên quan đến chức năng, nhiệm vụ của đơn vị.\n • Hiểu và vận dụng được các kiến thức chuyên sâu,\n nâng cao về lĩnh vực hoạt động và thực thi, kỹ năng xử lý các tình huống trong quá trình hướng dẫn, kiểm tra, giám sát, tham mưu, đề xuất và thực hiện công việc theo vị trí việc làm.\n • Hiểu và vận dụng được các kiến thức về phương pháp nghiên cứu, tổ chức, triển khai nghiên cứu, xây dựng các tài liệu, đề\n tài, đề án thuộc lĩnh vực chuyên môn đảm nhiệm.\n • Biết vận dụng các kiến thức cơ bản và nâng cao về ngành, lĩnh vực; có kỹ năng thuyết trình, giảng dạy, hướng dẫn nghiệp vụ về\n ngành, lĩnh vực.\n • Áp dụng thành thạo các kiến thức; kỹ thuật xây dựng, ban hành văn bản vào công việc theo yêu cầu của vị trí việc làm.\n5.2- Các năng lực Nhóm năng lực Tên năng lực Cấp độ\nNhóm năng lực chung\n• Đạo đức và bản lĩnh 2-3\n• Tổ chức thực hiện công việc 2-3\n• Kỹ thuật soạn thảo và ban hành văn bản 2-3\n• Giao tiếp ứng xử\n2-3\n• Quan hệ phối hợp 2-3\n• Sử dụng công nghệ thông tin Phù hợp với chức năng,\n nhiệm vụ của cơ quan, tổ chức, đơn vị sử dụng vị trí việc làm được cấp có thẩm quyền phê duyệt\n• Sử dụng ngoại ngữ\nNhóm năng lực chuyên môn\n• Khả năng xây dựng văn bản 2-3\n• Khả năng hướng dẫn thực hiện văn bản 2-3\n• Khả năng theo dõi, kiểm tra thực hiện văn bản 2-3\n• Khả năng thực thi 2-3\n• Khả năng phối hợp thực hiện 2-3 Nhóm năng lực quản lý\n• Tư duy chiến lược 1-2\n• Quản lý sự thay đổi 1-2\n• Ra quyết định 1-2\n• Quản lý nguồn lực 1-2\n• Phát triển công chức 1-2 Phê duyệt của lãnh\nđạo PHỤ LỤC III KHUNG CẤP ĐỘ XÁC ĐỊNH YÊU CẦU VỀ NĂNG LỰC ĐỐI VỚI VỊ\nTRÍ VIỆC LÀM CÔNG CHỨC NGHIỆP VỤ CHUYÊN NGÀNH XÂY DỰNG\n(Kèm theo Thông tư số 11/2023/TT-BXD ngày 20 tháng 10 năm 2023 của Bộ trưởng Bộ Xây dựng)\nI. NHÓM NĂNG LỰC CHUNG Cấp độ\nĐạo đức và bản lĩnh Tổ chức thực hiện công việc Soạn thảo và\n ban hành văn bản Giao tiếp ứng xử\nQuan hệ phối hợp Sử dụng ngoại ngữ\nSử dụng công nghệ thông tin 5\nTạo dựng văn hóa dẫn dắt việc thực hiện đạo đức và bản lĩnh.\nĐưa ra các định hướng chiến lược.\nPhân tích, đánh giá, phản biện, hoạch định chính sách.\nGiao tiếp tốt về vấn\n đề mang tính chiến lược.\nThiết lập các định hướng quan hệ đối tác chiến lược.\nSử dụng thành thạo ngôn ngữ.\nAm hiểu về công nghệ\n thông tin và sử dụng thành thạo tin học theo lĩnh vực hoạt động 4\nChủ động, trách nhiệm cao với công việc; hướng dẫn, kiểm tra việc thực hiện.\nNhận biết trước và\n thích ứng với yêu cầu mới của công việc; phát huy nguồn lực bên trong và bên ngoài để có giải pháp đảm bảo chất lượng công việc.\nHiểu biết về vai trò, tác động xã hội của chính sách; xây dựng khung pháp lý hỗ trợ việc thực thi chính sách.\nGiao tiếp tốt trong và ngoài cơ quan, đơn vị.\nThiết lập mạng lưới quan hệ ở nhiều cấp.\nGiao tiếp trôi chảy,\n linh hoạt.\nAm hiểu về công nghệ thông tin và sử dụng một số phần mềm nâng cao 3\nTrách nhiệm cao với công việc được giao, gương mẫu trong thực hiện.\nĐề xuất điều chỉnh thủ tục, quy trình làm việc kịp thời để đáp ứng tốt hơn nhu cầu của cơ quan,\n địa phương.\nPhân tích, đánh giá, đề xuất chính sách phù hợp với chiến lược, định hướng dài hạn của cơ\n quan, đơn vị, địa phương.\nGiao tiếp tốt với tổ chức trong nội bộ cơ quan, đơn vị.\nTìm kiếm cơ hội xây dựng và mở rộng mạng lưới quan hệ.\nTrao đổi, giải thích được những thông tin phức tạp.\nHiểu biết cơ bản về\n công nghệ thông tin và sử dụng một số phần mềm nâng cao 2\nTự nhận trách nhiệm với công việc được giao, chuẩn mực trong thực hiện.\nLinh hoạt trong tổ\n chức thực hiện công việc nhằm đảm bảo các tiêu chuẩn chất lượng đã thống nhất.\nNắm vững các quy định và vai trò, tác động của hệ thống văn bản của Đảng, văn bản pháp quy và văn bản hành chính của cơ quan có thẩm quyền.\nThúc đẩy giao tiếp hai chiều.\nThiết lập được mạng lưới quan hệ tốt trong nội bộ.\nTrao đổi, trình bày thông tin ngắn gọn.\nHiểu biết cơ bản về\n máy tính và sử dụng một số phần mềm nâng cao.\n1 Trách nhiệm với công việc được giao, chuẩn mực trong thực hiện.\nTổ chức thực hiện công việc theo tiêu chuẩn chất lượng, quy trình có sẵn.\nNắm được các quy định về văn bản của Đảng, văn bản pháp quy và văn bản hành chính đê áp dụng vào công việc chuyên môn.\nNghe và trình bày thông tin một cách rõ ràng.\nTạo mối quan hệ tốt,\n chủ động phối hợp với đồng nghiệp trong công việc.\nGiao tiếp cơ bản.\nHiểu biết cơ bản về\n máy tính và sử dụng một số phần mềm nâng cao.\nGhi chú: Cấp độ được xác định từ cao xuống thấp, tương ứng từ 5 đến 1.\nII. NHÓM NĂNG LỰC CHUYÊN MÔN Cấp độ\nKhả năng xây dựng văn bản Khả năng hướng dẫn thực hiện Khả năng theo dõi, kiểm tra thực hiện Khả năng thực thi Khả năng phối hợp thực hiện 5\nChủ trì nghiên cứu,\n tổng hợp, xây dựng và hoạch định chính sách, chiến lược có tính vĩ mô của ngành, lĩnh vực công tác được phân công.\n- Chủ trì xây dựng hướng dẫn triển khai thực hiện văn bản về chuyên môn, nghiệp vụ của ngành,\n lĩnh vực công tác được phân công.\n - Chủ trì xây dựng giáo trình, tài liệu, chuyên đề giảng dạy; tham gia giảng dạy các lớp đào tạo,\n bồi dưỡng chuyên môn, nghiệp vụ cho cán bộ, công chức.\nChủ trì tổ chức kiểm tra, phân tích đánh giá, báo cáo tổng kết việc thực hiện các văn bản thuộc lĩnh vực công tác được phân công; đề xuất chủ trương, biện pháp để thực hiện các quy định hoặc quyết định quản lý đạt kết quả.\nChủ trì tổ chức triển khai thực hiện các hoạt động chuyên môn, nghiệp vụ theo nhiệm vụ của lĩnh vực công tác được phân công.\nChủ trì, tổ chức phối hợp thực hiện các công việc liên quan theo lĩnh vực nhiệm vụ được phân công.\n4\n- Tham gia nghiên cứu, tổng hợp, xây dựng và hoạch định chính sách, chiến lược có tính vĩ mô của ngành, lĩnh vực công tác được phân công.\n - Chủ trì xây dựng kế hoạch triển khai thực hiện các văn bản thuộc ngành, lĩnh vực công tác được phân công.\n- Chủ trì xây dựng hướng dẫn triển khai thực hiện văn bản về chuyên môn, nghiệp vụ thuộc lĩnh vực công tác được phân công.\n - Tham gia giảng dạy các lớp đào tạo, bồi dưỡng chuyên môn, nghiệp vụ cho cán bộ, công chức.\nChủ trì tổ chức kiểm tra, phân tích đánh giá, báo cáo tổng kết việc thực hiện các văn bản thuộc lĩnh vực công tác được phân công.\nTham gia tổ chức triển khai thực hiện các hoạt động chuyên môn, nghiệp vụ theo nhiệm vụ theo lĩnh vực công tác được phân công.\nTổ chức phối hợp thực hiện các công việc liên quan theo lĩnh vực nhiệm vụ được phân công.\n3\n- Tham gia xây dựng\n đề án thuộc ngành, lĩnh vực công tác được phân công.\n - Tham gia xây dựng kế hoạch triển khai thực hiện các văn bản thuộc lĩnh vực công tác được phân công.\n - Chủ trì xây dựng các văn bản thuộc lĩnh vực công tác được phân công.\n- Tham gia xây dựng hướng dẫn triển khai thực hiện các văn bản chuyên môn, nghiệp vụ thuộc lĩnh vực công tác được phân công.\n - Tham gia hướng dẫn thực hiện chuyên môn, nghiệp vụ cho công chức cùng ngạch hoặc ngạch thấp hơn.\nTổ chức theo dõi,\n kiểm tra và báo cáo tình hình thực hiện các văn bản thuộc lĩnh vực công tác\n được phân công.\nThực hiện các hoạt\n động chuyên môn, nghiệp vụ theo nhiệm vụ theo lĩnh vực công tác được phân công Tham gia tổ chức phối hợp thực hiện các công việc liên quan theo lĩnh vực nhiệm vụ được phân công.\n2\n- Tham gia xây dựng các văn bản thuộc lĩnh vực công tác được phân công.\n - Soạn thảo các quy định cụ thể, các văn bản khác thuộc phần việc được phân công.\nKhả năng hướng dẫn thực hiện chuyên môn, nghiệp vụ cho công chức cùng ngạch hoặc ngạch thấp hơn.\nTham gia theo dõi,\n kiểm tra và báo cáo tình hình thực hiện các văn bản thuộc lĩnh vực công tác\n được phân công Thực hiện các hoạt\n động chuyên môn, nghiệp vụ đúng thẩm quyền và trách nhiệm được giao.\nPhối hợp thực hiện các công việc liên quan theo lĩnh vực nhiệm vụ được phân công.\n1 Soạn thảo các văn bản thuộc phần việc được phân công.\n-\n-\nTham gia thực hiện các hoạt động chuyên môn, nghiệp vụ đúng thẩm quyền và trách nhiệm được giao.\nTham gia phối hợp thực hiện các công việc liên quan theo lĩnh vực nhiệm vụ được phân công.\nGhi chú:\n- Cấp độ được xác định từ cao xuống thấp, tương ứng từ 5 đến 1.\n- Đối với các ô để trống, đề nghị các cơ quan, tổ\nchức bổ sung nội dung theo yêu cầu về lĩnh vực (nếu có).\nIII. NHÓM NĂNG LỰC QUẢN LÝ\nCấp độ\nTư duy chiến lược Quản lý sự thay\n đổi Ra quyết định Quản lý nguồn lực Phát triển công chức 5\nĐịnh hướng mục tiêu, chiến lược phát triển dài hạn cho cơ quan, đơn vị/ ngành, lĩnh vực/ địa phương.\nChủ động nghiên cứu và tiến hành những thay đổi, cải tổ cơ bản trong cơ quan, đơn vị.\nRa quyết định có ảnh hưởng lớn đến uy tín, hoạt động của cơ quan, đơn vị.\nChủ động huy động nguồn lực trong và ngoài cơ quan, đơn vị.\nTạo môi trường phát triển, hoàn thiện kiến thức, kỹ năng, kinh nghiệm.\n4\nĐịnh hướng mục tiêu của lĩnh vực công tác được phân công, góp phần xây dựng chiến lược tổng thể.\nChủ động nghiên cứu và thực hiện tiến trình thay đổi trong các lĩnh vực công tác được phân công.\nRa quyết định khó,\n phức tạp, không theo chuẩn tắc thuộc quyền hạn, chức năng của lĩnh vực công tác được phân công.\nPhát huy được nguồn lực của lĩnh vực công tác được phân công.\nTạo cơ hội cho đồng nghiệp phát triển bản thân.\n3 Xây dựng được mục tiêu, định hướng cho mảng lĩnh vực công tác được phân công.\nChủ động nghiên cứu và thực hiện tiến trình thay đổi trong mảng lĩnh vực công tác được phân công.\nRa quyết định khó,\n phức tạp thuộc quyền hạn, chức năng của lĩnh vực công tác được phân công.\nPhát huy được nguồn lực của đơn vị.\nThúc đẩy học tập liên tục và phát triển.\n2 Xây dựng được mục tiêu, kế hoạch công việc cho nhóm/bộ phận.\nChủ động nghiên cứu và thực hiện tiến trình thay đổi cho nhóm/bộ phận.\nRa quyết định thể\n hiện được các nguyên tắc.\nPhát huy được nguồn lực của nhóm/bộ phận.\nHỗ trợ việc phát triển, hoàn thiện bản thân.\n1 Xác định được mục tiêu, kế hoạch công việc cho bản thân.\nChủ động nghiên cứu và thực hiện tiến trình thay đổi trong công việc.\nRa quyết định dựa theo nguyên tắc, quy trình có sẵn.\nThực hiện công việc tiết kiệm, hiệu quả.\nChia sẻ kiến thức,\n chuyên môn với đồng nghiệp.\nGhi chú: Cấp độ được xác định từ cao xuống thấp,\ntương ứng từ 5 đến 1.\n[1] Các văn bản của đảng (Nghị quyết, kết luận,\nquyết định, quy định...), Luật, pháp lệnh, các loại văn bản quy phạm pháp luật theo quy định\n[2] Ban Chấp hành Trung ương Đảng, Bộ Chính trị,\nQuốc hội, Ủy ban thường vụ Quốc hội, Chính phủ..."
}