{
  "url": "https://thuvienphapluat.vn/van-ban/So-huu-tri-tue/Quyet-dinh-28-2023-QD-UBND-xet-cong-nhan-sang-kien-thuc-day-hoat-dong-sang-kien-Dong-Thap-570197.aspx",
  "title": "Quyết định 28/2023/QĐ-UBND xét công nhận sáng kiến thúc đẩy hoạt động sáng kiến Đồng Tháp",
  "properties": {
    "Số hiệu": "28/2023/QĐ-UBND",
    "Loại văn bản": "Quyết định",
    "Nơi ban hành": "Tỉnh Đồng Tháp",
    "Người ký": "Nguyễn Phước Thiện",
    "Ngày ban hành": "20/06/2023",
    "Ngày hiệu lực": "Đã biết",
    "Ngày công báo": "Đang cập nhật",
    "Số công báo": "Đang cập nhật",
    "Tình trạng": "Đã biết"
  },
  "content": "ỦY BAN NHÂN DÂN TỈNH ĐỒNG THÁP\n -------\nCỘNG HÒA XÃ HỘI CHỦ NGHĨA VIỆT NAM\n Độc lập - Tự do - Hạnh phúc\n ---------------\nSố:\n 28/2023/QĐ-UBND\nĐồng Tháp, ngày 20 tháng 06 năm 2023 QUYẾT ĐỊNH BAN HÀNH QUY ĐỊNH XÉT, CÔNG NHẬN SÁNG KIẾN VÀ CÁC BIỆN PHÁP THÚC\nĐẨY HOẠT ĐỘNG SÁNG KIẾN TRÊN ĐỊA BÀN TỈNH ĐỒNG THÁP\nỦY BAN NHÂN DÂN TỈNH ĐỒNG THÁP Căn cứ Luật Tổ chức chính quyền địa phương ngày 19 tháng 6 năm 2015; Luật sửa đổi, bổ sung một số điều của Luật Tổ chức chính phủ và Luật Tổ chức chính quyền địa phương ngày 22 tháng 11 năm 2019;\nCăn cứ Luật Thi đua, khen thưởng ngày 26 tháng 11 năm 2003 và các Luật sửa đổi, bổ sung một số điều của Luật Thi đua, khen thưởng;\nCăn cứ Nghị định số\n13/2012/NĐ-CP ngày 02 tháng 3 năm 2012 của Chính phủ ban hành Điều lệ Sáng kiến;\nCăn cứ Nghị định số\n91/2017/NĐ-CP ngày 31 tháng 7 năm 2017 của Chính phủ quy định chi tiết thi hành một số điều của Luật Thi đua, khen thưởng;\nCăn cứ Thông tư số\n18/2013/TT-BKHCN ngày 01 tháng 8 năm 2013 của Bộ trưởng Bộ Khoa học và Công nghệ\nvề việc hướng dẫn thi hành một số quy định của Điều lệ Sáng kiến;\nCăn cứ Thông tư số\n12/2019/TT-BNV ngày 04 tháng 11 năm 2019 của Bộ trưởng Bộ Nội vụ quy định chi tiết thi hành một số điều của Nghị định số 91/2017/NĐ-CP ngày 31 tháng 7 năm 2017 của Chính phủ; Thông tư số 05/2020/TT-BNV ngày 09 tháng 11 năm 2020 của Bộ\ntrưởng Bộ Nội vụ về việc bãi bỏ khoản 7 Điều 2 Thông tư số 12/2019/TT-BNV ngày 04 tháng 11 năm 2019 của Bộ trưởng Bộ Nội vụ;\nTheo đề nghị của Giám đốc Sở\nKhoa học và Công nghệ tại Tờ trình số 1073/TTr-SKHCN ngày 30 tháng 5 năm 2023.\nQUYẾT ĐỊNH:\nĐiều 1.\nBan hành kèm theo Quyết định này Quy định xét, công nhận sáng kiến và các biện pháp thúc đẩy hoạt động sáng kiến trên địa bàn tỉnh\nĐồng Tháp.\nĐiều 2.\nQuyết định này có hiệu lực từ ngày 03 tháng 7 năm 2023.\nĐiều 3.\nChánh Văn phòng Ủy ban nhân dân Tỉnh; Thủ trưởng các Sở, ban, ngành Tỉnh; Chủ tịch Ủy ban nhân dân huyện, thành phố và các tổ chức,\ncá nhân liên quan căn cứ Quyết định thi hành./.\nNơi nhận:\n - Như Điều 3;\n - Chính phủ;\n - Bộ Khoa học và Công nghệ;\n - Cục Kiểm tra văn bản - Bộ Tư pháp;\n - Ban Thi đua - Khen thưởng Trung ương;\n - Website Chính phủ;\n - TT/TU; TT/HĐND Tỉnh;\n - BCSĐ/UBND Tỉnh;\n - CT và các PCT/UBND Tỉnh;\n - Đoàn đại biểu QH đơn vị tỉnh Đồng Tháp;\n - Sở, ngành Tỉnh;\n - Trung tâm Công báo Tỉnh;\n - Đài PT-TH Đồng Tháp;\n - Báo Đồng Tháp;\n - LĐVP/UBND Tỉnh;\n - UBND huyện, tp\n - Lưu: VT, CTTĐT, NC/KT (VA).\nTM. ỦY BAN NHÂN DÂN KT. CHỦ TỊCH PHÓ CHỦ TỊCH Nguyễn Phước Thiện QUY ĐỊNH XÉT, CÔNG NHẬN SÁNG KIẾN VÀ CÁC BIỆN PHÁP THÚC ĐẨY HOẠT ĐỘNG SÁNG KIẾN TRÊN ĐỊA BÀN TỈNH ĐỒNG THÁP\n(Kèm theo Quyết định số 28/2023/QĐ-UBND ngày 20/06/2023 của Ủy ban nhân dân tỉnh Đồng Tháp)\nChương I QUY ĐỊNH CHUNG\nĐiều 1.\nPhạm vi điều chỉnh và đối tượng áp dụng 1. Quy định này quy định điều kiện công nhận sáng kiến, các hoạt động xét, công nhận hiệu quả, phạm vi ảnh hưởng của sáng kiến và các biện pháp thúc đẩy hoạt động sáng kiến trên địa bàn tỉnh Đồng Tháp.\n2. Quy định này áp dụng đối với các cơ quan, tổ chức, cá nhân có hoạt động sáng kiến trên địa bàn tỉnh Đồng Tháp. Tổ chức, cá nhân liên quan đến hoạt động đánh giá, công nhận phạm vi ảnh hưởng, hiệu quả áp dụng của sáng kiến để xét tặng danh hiệu thi đua, hình thức khen thưởng trên địa bàn tỉnh Đồng Tháp.\n3. Các nội dung khác không quy\nđịnh tại Quy định này, thực hiện theo các văn bản khác theo quy định của pháp luật hiện hành.\nĐiều 2. Đối tượng được công nhận và không được công nhận sáng kiến 1. Đối tượng được công nhận là\nsáng kiến gồm các giải pháp kỹ thuật, giải pháp quản lý, giải pháp tác nghiệp hoặc giải pháp ứng dụng tiến bộ kỹ thuật được giải thích theo quy định tại Điều 3 Thông tư số 18/2013/TT-BKHCN ngày 01 tháng 8 năm 2013 của Bộ trưởng Bộ Khoa học và Công nghệ về hướng dẫn thi hành một số quy định của Điều lệ Sáng kiến ban hành theo Nghị định số 13/2012/NĐ-CP ngày 02 tháng 3 năm 2012 của Chính phủ.\n2. Đối tượng không được công nhận sáng kiến a) Giải pháp mà việc công bố,\náp dụng giải pháp trái với trật tự công cộng hoặc đạo đức xã hội.\nb) Giải pháp là đối tượng đang được bảo hộ quyền sở hữu trí tuệ theo quy định của pháp luật tính đến thời điểm xét công nhận sáng kiến.\nc) Sáng kiến đang tranh chấp giữa các tác giả.\nd) Sáng kiến được xác định là\nsao chép của tác giả khác.\nđ) Giải pháp trùng hoặc tương tự\nvới chức năng, nhiệm vụ của tổ chức, cá nhân được quy định bởi cấp có thẩm quyền.\nĐiều 3.\nCơ sở có quyền và trách nhiệm xét công nhận sáng kiến Cơ sở là cơ quan, tổ chức được thành lập theo pháp luật, có thể nhân danh chính mình tham gia quan hệ pháp luật dân sự một cách độc lập.\nĐiều 4. Điều kiện công nhận sáng kiến 1. Sáng kiến được cơ sở công nhận nếu đáp ứng đầy đủ các điều kiện sau đây:\na) Có tính mới trong phạm vi cơ\nsở đó;\nb) Đã được áp dụng hoặc áp dụng thử tại cơ sở đó và có khả năng mang lại lợi ích thiết thực;\n2. Việc đánh giá tính mới và khả\nnăng mang lại lợi ích thiết thực của sáng kiến được thực hiện theo quy định tại\nĐiều 4 của của Điều lệ Sáng kiến (Ban hành kèm theo Nghị định số 13/2012/NĐ-CP ngày 02 tháng 3 năm 2012 của Chính phủ).\nĐiều 5. Tác giả và đồng tác giả sáng kiến 1. Cách xác định tác giả, đồng tác giả sáng kiến a) Tác giả sáng kiến, đồng tác giả sáng kiến đứng tên nộp đơn yêu cầu công nhận sáng kiến phải là những người trực tiếp hoặc cùng nhau tạo ra sáng kiến bằng chính lao động sáng tạo của mình;\nb) Những người chỉ tham gia hỗ\ntrợ, giúp việc cho tác giả trong quá trình tạo ra sáng kiến và áp dụng sáng kiến thì không được coi là đồng tác giả sáng kiến (ví dụ: Tính toán, làm thí nghiệm,\nmô hình, mẫu thử, vẽ kỹ thuật, gia công, chế tạo chi tiết, tìm thông tin tư liệu,\nđánh máy; hỗ trợ kinh phí, phương tiện vật chất - kỹ thuật);\n2. Trong trường hợp sáng kiến có đồng tác giả và số lượng đồng tác giả vượt quá 03 người thì các đồng tác giả\nphải có bản giải trình nêu rõ nội dung công việc từng người tham gia tạo ra sáng kiến nộp kèm theo đơn yêu cầu công nhận sáng kiến.\n3. Cơ sở tiếp nhận đơn phải có\ntrách nhiệm xem xét, kiểm tra, xác minh những người khai nhận là tác giả (đồng tác giả) sáng kiến; trường hợp kết quả kiểm tra, xác minh cho thấy đủ cơ sở kết luận những người nộp đơn không đúng đối tượng là tác giả (đồng tác giả) sáng kiến thì cơ sở có quyền từ chối chấp nhận đơn.\nĐiều 6.\nNguyên tắc xét, công nhận sáng kiến và đánh giá hiệu quả, phạm vi ảnh hưởng của sáng kiến 1. Việc xét, công nhận sáng kiến và đánh giá hiệu quả, phạm vi ảnh hưởng của sáng kiến phải đảm bảo tính dân chủ,\nkhách quan, công khai, công bằng, thực chất và động viên được mọi tầng lớp nhân dân tích cực tham gia phong trào thi đua lao động sáng tạo, phát huy sáng kiến.\n2. Các trường hợp đạt giải nhất,\nnhì, ba trong các hội thi, cuộc thi sáng tạo khoa học - kỹ thuật cấp tỉnh, toàn quốc; được tặng Huy hiệu Tuổi trẻ sáng tạo của Trung ương Đoàn thanh niên Cộng sản Hồ Chí Minh; được tặng Bằng Lao động sáng tạo của Tổng Liên đoàn Lao động Việt Nam; được tặng Bằng Chứng nhận giải thưởng khoa học và công nghệ do Bộ trưởng,\nThủ trưởng cơ quan ngang Bộ, cơ quan nhà nước khác ở Trung ương, Chủ tịch Ủy ban nhân dân Tỉnh quyết định tặng, không phải thông qua họp Hội đồng sáng kiến cấp tỉnh. Tác giả (đồng tác giả) gửi bản sao các tài liệu, giấy tờ chứng minh một trong các tiêu chuẩn quy định tại điều này và gửi về cơ quan thường trực Hội đồng sáng kiến cấp tỉnh (Sở Khoa học và Công nghệ) để báo cáo trong các kỳ họp Hội đồng.\n3. Sáng kiến đề nghị xét, công nhận hiệu quả, phạm vi ảnh hưởng ở cấp cao hơn thì phải được công nhận và đề\nnghị của cấp dưới.\nChương II CÔNG NHẬN SÁNG KIẾN Mục 1. YÊU CẦU CÔNG NHẬN SÁNG KIẾN\nĐiều 7. Thực hiện quyền yêu cầu công nhận sáng kiến 1. Đối với giải pháp chưa được\náp dụng hoặc áp dụng thử, tác giả (đồng tác giả) có quyền nộp đơn yêu cầu công nhận sáng kiến vào bất cứ thời điểm nào từ khi tạo ra sáng kiến. Tuy nhiên, cơ\nsở có thẩm quyền tiếp nhận đơn chỉ tổ chức xét công nhận sáng kiến sau khi giải pháp đó được đưa vào áp dụng hoặc áp dụng thử.\n2. Đối với giải pháp đã được áp dụng, thời hiệu thực hiện quyền yêu cầu công nhận sáng kiến theo quy định tại Khoản 2 Điều 5 của Nghị định số 13/2012/NĐ-CP ngày 02 tháng 3 năm 2012 của Chính phủ ban hành Điều lệ công nhận Sáng kiến (sau đây gọi tắt là Nghị định số\n13/2012/NĐ-CP) và được hướng dẫn chi tiết như sau:\na) Thời hiệu để xác định quyền yêu cầu công nhận sáng kiến được tính kể từ ngày sáng kiến được đưa vào áp dụng lần đầu tiên (nếu sáng kiến trải qua các lần áp dụng thử thì tính từ ngày áp dụng thử lần đầu tiên) và chấm dứt tại thời điểm kết thúc ngày, tháng tương ứng của năm kế tiếp năm sáng kiến được đưa vào áp dụng lần đầu;\nb) Cơ sở có quyền từ chối tiếp nhận đơn yêu cầu công nhận sáng kiến khi tác giả (đồng tác giả) nộp sau thời hiệu quy định tại Điểm a, Khoản này.\n3. Trường hợp giải pháp đưa ra dưới dạng tiêu chuẩn, quy trình, quy phạm pháp luật dự kiến các đối tượng áp dụng bắt buộc phải thực hiện thì tác giả (đồng tác giả) phải nộp đơn yêu cầu công nhận sáng kiến trước khi được cấp có thẩm quyền quyết định ban hành để đảm bảo tính mới theo quy định tại Khoản 2 Điều 4 của Quy định này.\n4. Việc thực hiện quyền yêu cầu công nhận sáng kiến là do tác giả (đồng tác giả) tự nguyện thực hiện, không bắt buộc phải đăng ký sáng kiến ngay từ đầu năm dương lịch hoặc đầu năm học đối với các đơn vị sự nghiệp công lập hoạt động trong lĩnh vực giáo dục, đào tạo.\nĐiều 8. Cơ\nsở có thẩm quyền và trách nhiệm tiếp nhận yêu cầu công nhận sáng kiến 1. Cơ sở có thẩm quyền và trách nhiệm tiếp nhận yêu cầu công nhận sáng kiến là một trong các cơ sở sau đây:\na) Cơ sở là chủ đầu tư tạo ra sáng kiến: Là cơ quan, tổ chức đầu tư kinh phí, phương tiện vật chất - kỹ thuật dưới hình thức giao việc, thuê việc hoặc các hình thức khác cho tác giả để tạo ra sáng kiến;\nb) Cơ sở được tác giả sáng kiến chuyển giao sáng kiến theo thỏa thuận giữa hai bên, với điều kiện chủ đầu tư tạo ra sáng kiến từ chối công nhận sáng kiến và không có thỏa thuận khác với tác giả\ntạo ra sáng kiến;\nc) Cơ sở được tác giả sáng kiến chuyển giao sáng kiến theo thỏa thuận giữa hai bên, trong trường hợp tác giả\nsáng kiến đồng thời là chủ đầu tư tạo ra sáng kiến.\n2. Các cơ sở quy định tại Khoản 1 Điều này phải đáp ứng quy định tại Điều 2 của Thông tư số 18/2013/TT-BKHCN .\nĐiều 9. Đơn yêu cầu công nhận sáng kiến 1. Đơn yêu cầu công nhận sáng kiến áp dụng theo mẫu quy định tại Phụ lục I ban hành kèm theo Thông tư số 18/2013/TT-BKHCN .\n2. Mỗi đơn yêu cầu công nhận sáng kiến chỉ áp dụng cho một giải pháp. Trường hợp tác giả có nhiều giải pháp\nđề nghị công nhận sáng kiến thì không được gộp chung nhiều giải pháp đó vào trong một đơn mà phải trình bày riêng trong từng đơn yêu cầu công nhận sáng kiến.\n3. Đơn yêu cầu công nhận sáng kiến phải được tác giả ký và ghi rõ họ tên vào mục người nộp đơn ở trang cuối cùng của đơn; trường hợp sáng kiến có đồng tác giả thì người nộp đơn phải là một trong các đồng tác giả và phải được các đồng tác giả còn lại đồng ý nộp đơn và\ncùng ký xác nhận vào đơn.\n4. Đơn yêu cầu công nhận sáng kiến bao gồm các nội dung quy định tại Khoản 3 Điều 5 của Nghị định số\n13/2012/NĐ-CP và Khoản 1 Điều 5 của Thông tư số 18/2013/TT-BKHCN .\nĐiều 10. Sửa\nđổi, bổ sung đơn yêu cầu công nhận sáng kiến 1. Trước khi cơ sở có thẩm quyền công nhận sáng kiến ra Thông báo từ chối chấp nhận đơn hợp lệ, Thông báo từ chối công nhận sáng kiến hoặc Quyết định công nhận sáng kiến và cấp Giấy chứng nhận sáng kiến, tác giả sáng kiến có thể chủ động hoặc theo yêu cầu của cơ sở đó sửa\nđổi, bổ sung đơn.\n2. Việc sửa đổi, bổ sung không\nđược làm thay đổi bản chất của giải pháp nêu trong đơn yêu cầu công nhận sáng kiến ban đầu. Nếu việc sửa đổi, bổ sung đơn yêu cầu công nhận sáng kiến làm thay đổi bản chất sáng kiến thì tác giả phải nộp đơn mới và mọi thủ tục được tiến hành lại từ đầu.\n3. Việc sửa đổi, bổ sung đơn yêu cầu công nhận sáng kiến do tác giả chủ động thực hiện hoặc theo yêu cầu của cơ sở có thẩm quyền tiếp nhận đơn và phải được thể hiện bằng văn bản, trong đó\nghi rõ nội dung sửa đổi, bổ sung.\nĐiều 11.\nTiếp nhận và xem xét tính hợp lệ của đơn yêu cầu công nhận sáng kiến 1. Cơ sở quy định tại Điều 8 Quy định này khi nhận được yêu cầu công nhận sáng kiến phải có trách nhiệm tiếp nhận và xem xét đơn yêu cầu công nhận sáng kiến theo quy định tại Điều 6 của Nghị định số 13/2012/NĐ-CP và Khoản 1 Điều 6 của Thông tư số 18/2013/TT-BKHCN .\n2. Đơn yêu cầu công nhận sáng kiến được xem xét hợp lệ khi đáp ứng các quy định tại Điều 4 Quy định này.\n3. Việc cơ sở được yêu cầu công nhận sáng kiến chấp nhận hoặc từ chối chấp nhận đơn phải được thông báo bằng văn bản cho tác giả được biết.\nĐiều 12.\nĐánh giá đối tượng nêu trong đơn yêu cầu công nhận sáng kiến 1. Cơ sở tiếp nhận đơn yêu cầu công nhận sáng kiến phải có trách nhiệm đánh giá đối tượng nêu trong đơn theo quy định tại Điều 3 và Điều 4 của Nghị định số 13/2012/NĐ-CP ; Điều 4 của Thông tư số 18/2013/TT-BKHCN và Điều 2, Điều 4 của Quy định này.\n2. Để đánh giá tính mới của giải pháp nêu trong đơn, trước hết phải tiến hành tra cứu ở các nguồn thông tin sau\nđây:\na) Tất cả các hồ sơ yêu cầu công nhận sáng kiến đã được cơ sở tiếp nhận và có ngày nộp đơn sớm hơn;\nb) Các văn bản, sách, tác phẩm báo chí, tài liệu kỹ thuật, tài liệu phục vụ cho hoạt động chuyên môn, nghiệp vụ,\ncác báo cáo khoa học, báo cáo kết quả của các chương trình, đề tài nghiên cứu và các tài liệu khác thuộc cùng lĩnh vực áp dụng sáng kiến đã được công bố trước thời điểm tác giả nộp đơn yêu cầu công nhận sáng kiến dưới bất kỳ hình thức nào có thể tiếp cận công khai trong phạm vi cơ sở.\n3. Mục đích của việc tra cứu thông tin theo quy định tại Khoản 2 Điều này là tìm giải pháp có bản chất tương tự hoặc trùng lặp với giải pháp nêu trong đơn, trong đó:\na) Hai giải pháp được coi là\ntrùng nhau khi có tất cả các dấu hiệu hoặc đặc điểm cơ bản trùng nhau hoặc tương đương, có thể thay thế được cho nhau;\nb) Hai giải pháp được coi là\ntương tự nhau khi có phần lớn các dấu hiệu hoặc đặc điểm cơ bản trùng nhau hoặc tương đương, có thể thay thế được cho nhau.\n4. Khi tiến hành tra cứu theo quy định tại Khoản 2 Điều này phải tiến hành so sánh các dấu hiệu hoặc đặc điểm cơ bản của giải pháp nêu trong đơn với các dấu hiệu của giải pháp đối chứng được tìm thấy trong quá trình tra cứu thông tin, trong đó:\na) Dấu hiệu cơ bản của giải pháp có thể là đặc điểm về chức năng, công dụng, cấu tạo, liên kết, thành phần cùng với các dấu hiệu cơ bản khác tạo thành một tập hợp cần và đủ để xác định bản chất, nội dung của đối tượng;\nb) Các dấu hiệu cơ bản của giải pháp nêu trong các tài liệu khác được thể hiện và phát hiện theo tài liệu mô tả\nhoặc dạng thể hiện thực tế của giải pháp đó.\n5. Kết luận về tính mới của giải pháp nêu trong đơn a) Giải pháp nêu trong đơn được coi là có tính mới nếu không tìm thấy giải pháp đối chứng trong quá trình tra cứu thông tin hoặc có tìm thấy giải pháp đối chứng nhưng giải pháp nêu trong đơn có\nít nhất một dấu hiệu cơ bản không có mặt trong giải pháp đối chứng và dấu hiệu\nđó được gọi là dấu hiệu cơ bản khác biệt;\nb) Giải pháp nêu trong đơn được coi là không có tính mới nếu tìm thấy giải pháp có bản chất tương tự hoặc trùng lặp với giải pháp đó theo quy định tại Khoản 3 Điều này và phải thống kê được các giải pháp đối chứng tìm thấy, chỉ rõ các dấu hiệu trùng nhau, tên tài liệu\nđối chứng, số trang, số dòng, nguồn gốc tài liệu và ngày công bố của tài liệu tương ứng.\n6. Trường hợp cần thiết phải tra cứu thông tin về tình trạng bảo hộ quyền sở hữu trí tuệ theo quy định của pháp luật để đánh giá sáng kiến theo điều kiện quy định tại Điểm b Khoản 2, Điều 3 của Nghị định số 13/2012/NĐ-CP , cơ sở có thể tra cứu từ cơ sở dữ liệu về sở hữu công nghiệp có tại Cục Sở hữu trí tuệ và các nguồn thông tin khác do Cục Sở hữu trí tuệ quy định, có thể tham khảo trên Trang thông tin điện tử của Cục Sở hữu trí tuệ tại địa chỉ: http://www.noip.gov.vn hoặc có thể thông qua đơn vị có chức năng tư vấn về sở hữu trí tuệ theo quy định của pháp luật để hỗ trợ tra cứu về\nthông tin này.\nĐiều 13.\nĐánh giá về hiệu quả áp dụng sáng kiến\nĐánh giá hiệu quả áp dụng sáng kiến theo quy định tại Điểm b Khoản 1 Điều 3 của Nghị định số 13/2012/NĐ-CP:\n1. Trường hợp giải pháp nêu trong đơn chỉ là ý tưởng mang tính đề xuất, chưa được áp dụng hoặc áp dụng thử\ntại cơ sở thì chưa thể xem xét công nhận là sáng kiến.\n2. Trường hợp giải pháp nêu trong đơn đã được áp dụng hoặc áp dụng thử tại cơ sở thì đánh giá khả năng mang lại lợi ích thiết thực theo quy định tại Khoản 2 Điều 4 của Nghị định số\n13/2012/NĐ-CP ; Khoản 2 Điều 4 của Quy định này, bằng cách so sánh hiệu quả khi\náp dụng sáng kiến so với trường hợp không áp dụng giải pháp đó, hoặc so với những giải pháp tương tự đã biết.\n3. Trường hợp sáng kiến là giải pháp cải tiến giải pháp đã biết trước đó thì cần phải đánh giá rõ hiệu quả áp dụng sáng kiến khắc phục được đến mức độ nào những nhược điểm của giải pháp đã biết.\n4. Trường hợp áp dụng sáng kiến mang lại hiệu quả về mặt kinh tế thì việc xác định tiền làm lợi từ áp dụng sáng kiến thực hiện theo quy định tại Điều 11 của Nghị định số 13/2012/NĐ-CP .\n5. Cơ sở có thẩm quyền xét công nhận sáng kiến phải có trách nhiệm xem xét, kiểm tra, xác minh thực tế hiệu quả\náp dụng giải pháp được mô tả trong đơn yêu cầu công nhận sáng kiến.\nMục 2. TỔ\nCHỨC XÉT CÔNG NHẬN SÁNG KIẾN\nĐiều 14.\nThời hạn xét công nhận sáng kiến 1. Việc xét công nhận sáng kiến chỉ được thực hiện sau khi đơn yêu cầu công nhận sáng kiến được chấp nhận hợp lệ\nvà giải pháp nêu trong đơn đã được hoặc đang được áp dụng; trường hợp có tranh chấp về quyền tác giả hoặc có tố cáo, kiến nghị của cơ quan, tổ chức, cá nhân có liên quan đến giải pháp nêu trong đơn thì phải giải quyết xong mới tổ chức xét công nhận sáng kiến và phải thông báo cho tác giả được biết về việc này.\n2. Thời hạn xét công nhận sáng kiến thực hiện theo quy định tại Khoản 1, Điều 7 của Nghị định số 13/2012/NĐ-CP và thực hiện theo quy định này cụ thể như sau:\na) Trường hợp khi chấp nhận đơn hợp lệ mà trước đó tác giả đã hoàn thành việc áp dụng sáng kiến lần đầu thì việc xét công nhận sáng kiến được thực hiện trong khoảng thời gian từ ngày kế tiếp của ngày chấp nhận đơn đến ngày tương ứng của 3 tháng sau;\nb) Trường hợp tại thời điểm đơn yêu cầu công nhận sáng kiến được chấp nhận hợp lệ nhưng giải pháp nêu trong đơn chưa được áp dụng hoặc áp dụng thử thì việc xét công nhận sáng kiến chỉ được thực hiện khi giải pháp đó đã được đưa vào áp dụng hoặc áp dụng thử và thời hạn xét công nhận sáng kiến được thực hiện trong khoảng thời gian từ ngày kế tiếp của ngày hoàn thành việc áp dụng sáng kiến lần đầu đến ngày tương ứng của 3 tháng sau;\nc) Nếu tháng kết thúc thời hạn quy định tại Điểm a và b Khoản này không có ngày tương ứng thì thời hạn kết thúc vào ngày cuối cùng của tháng đó;\nd) Khi ngày cuối cùng của thời hạn quy định tại Điểm a và b Khoản này là ngày nghỉ cuối tuần hoặc ngày nghỉ lễ\nthì thời hạn kết thúc tại thời điểm kết thúc ngày làm việc tiếp theo ngày nghỉ\nđó.\nĐiều 15.\nThành lập Hội đồng sáng kiến 1. Hội đồng sáng kiến được thành lập theo quy định tại Điều 8 của Nghị định số 13/2012/NĐ-CP và Khoản 1 Điều 8 của Thông tư số 18/2013/TT-BKHCN và thực hiện theo quy định này cụ thể như\nsau:\na) Tác giả (đồng tác giả) của giải pháp yêu cầu công nhận sáng kiến không được là thành viên của Hội đồng sáng kiến;\nb) Tùy từng lĩnh vực áp dụng của sáng kiến được xét duyệt, cơ sở có thẩm quyền xét công nhận sáng kiến không có đủ\nchuyên môn để đánh giá giải pháp nêu trong đơn có thể mời chuyên gia, nhà khoa học có trình độ chuyên môn phù hợp và am hiểu sâu về lĩnh vực sáng kiến đề nghị\nlà thành viên chính thức của Hội đồng.\n2. Chuyên gia được mời tham gia Hội đồng sáng kiến phải đáp ứng các điều kiện sau:\na) Không phải là người có mối quan hệ như: Bố, mẹ, con, anh, chị, em ruột, bên vợ, bên chồng của tác giả (đồng tác giả);\nb) Không phải là người đã từng có khiếu nại, tố cáo đối với tác giả (đồng tác giả);\nc) Là người có chuyên môn cao phù hợp với lĩnh vực áp dụng sáng kiến, trong đó ưu tiên người có trình độ từ bậc\nđại học trở lên và không thấp hơn so với trình độ chuyên môn của tác giả (đồng tác giả);\nd) Việc áp dụng giải pháp nêu trong đơn không xâm phạm đến quyền, lợi ích hợp pháp của chuyên gia đó;\nđ) Là người có phẩm chất đạo đức tốt, có uy tín và kinh nghiệm trong lĩnh vực áp dụng sáng kiến.\n3. Thành phần của Hội đồng sáng kiến a) Chủ tịch Hội đồng là người đứng\nđầu cơ sở xét công nhận sáng kiến; trường hợp người đứng đầu cơ sở xét công nhận sáng kiến chính là tác giả (đồng tác giả) sáng kiến, thì Chủ tịch Hội đồng là cấp phó của người đứng đầu cơ sở được giao phụ trách hoạt động sáng kiến ở cơ sở hoặc có trình độ chuyên môn liên quan đến lĩnh vực áp dụng sáng kiến;\nb) 01 Phó Chủ tịch Hội đồng là\ncấp phó của người đứng đầu cơ sở được giao phụ trách hoạt động sáng kiến ở cơ sở\nhoặc có trình độ chuyên môn liên quan đến lĩnh vực áp dụng sáng kiến và do người\nđứng đầu cơ sở xét công nhận sáng kiến quyết định;\nc) Các Ủy viên còn lại gồm các chuyên gia hoặc người có trình độ chuyên môn có liên quan đến nội dung sáng kiến,\nđại diện của tổ chức công đoàn (nếu có) và các thành phần khác theo quyết định của người đứng đầu cơ sở xét công nhận sáng kiến;\nd) Thư ký là người được giao phụ\ntrách hoạt động sáng kiến ở cơ sở.\n4. Số lượng các thành viên Hội\nđồng có từ 7 đến 11 thành viên do người đứng đầu cơ sở xét công nhận sáng kiến quyết định.\n5. Bộ phận được giao phụ trách hoạt động sáng kiến ở cơ sở có trách nhiệm tham mưu công tác tiếp nhận, xử lý\ncác đơn yêu cầu công nhận sáng kiến để tham mưu cho Hội đồng Sáng kiến và người\nđứng đầu cơ sở xét công nhận sáng kiến.\n6. Nhiệm vụ của Hội đồng sáng kiến.\na) Tổ chức đánh giá một cách khách quan, trung thực giải pháp được yêu cầu công nhận sáng kiến theo quy định;\nb) Lập báo cáo đánh giá, trong\nđó phản ánh đầy đủ ý kiến của các thành viên và kết quả bỏ phiếu sau khi kết thúc mỗi phiên họp của Hội đồng;\nc) Bảo mật thông tin về các giải pháp đề nghị công nhận sáng kiến theo yêu cầu của tác giả hoặc người đứng đầu cơ sở xét công nhận sáng kiến;\nd) Xem xét đánh giá hiệu quả áp dụng và phạm vi ảnh hưởng của sáng kiến để tham mưu cho thủ trưởng cơ sở công nhận hoặc đề nghị cấp có thẩm quyền xem xét công nhận để công bố, phổ biến, áp dụng rộng rãi và hỗ trợ tác giả thực hiện các quy định của pháp luật có liên quan;\nđ) Tham mưu giải quyết các tranh chấp, khiếu nại, tố cáo hoặc kiến nghị của cơ quan, tổ chức, cá nhân có\nliên quan đến hoạt động sáng kiến ở sở;\ne) Thực hiện các nhiệm vụ khác theo yêu cầu của người có thẩm quyền thành lập Hội đồng Sáng kiến.\n7. Trách nhiệm của các thành viên Hội đồng sáng kiến a) Nghiên cứu hồ sơ các giải pháp đề nghị công nhận sáng kiến trước khi diễn ra phiên họp của Hội đồng;\nb) Tham dự đầy đủ phiên họp của Hội đồng; trường hợp vắng mặt phải báo cáo Chủ tịch Hội đồng xem xét chấp thuận và phải gửi phiếu nhận xét, đánh giá các giải pháp đề nghị công nhận sáng kiến trước khi diễn ra phiên họp để Hội đồng có cơ sở xem xét; khi cử người dự họp thay phải được Chủ tịch Hội đồng chấp thuận và người dự họp thay phải có trách nhiệm truyền đạt đầy đủ ý kiến nhận xét, đánh giá của thành viên vắng mặt nhưng không được quyền tham gia bỏ phiếu;\nc) Tham gia ý kiến nhận xét,\nđánh giá các giải pháp đề nghị công nhận sáng kiến theo chuyên môn, lĩnh vực công tác phụ trách tại các phiên họp Hội đồng và ghi rõ kết quả nhận xét, kết quả đánh giá đối với từng giải pháp trong Phiếu nhận xét, đánh giá; việc nhận xét, đánh giá các giải pháp phải khách quan, chính xác và chịu trách nhiệm về kết quả đánh giá;\nd) Không được cung cấp thông tin về kết quả xét công nhận sáng kiến trước khi Hội đồng ban hành biên bản kỳ\nhọp; không được lưu giữ, khai thác, công bố và sử dụng nội dung sáng kiến trái với quy định của pháp luật;\nđ) Thư ký có trách nhiệm tổng hợp hồ sơ sáng kiến và các tài liệu có liên quan để gửi tới các thành viên Hội đồng nghiên cứu trước khi tổ chức họp Hội đồng; ghi chép diễn biến cuộc họp trong đó\nthể hiện đầy đủ ý kiến của các thành viên dự họp và tổng hợp kết quả bỏ phiếu xét công nhận sáng kiến để dự thảo biên bản cuộc họp trình Hội đồng thông qua tại mỗi phiên họp; tham mưu cho Hội đồng lập báo cáo theo quy định tại Điểm b, Khoản 6 Điều này;\ne) Chịu trách nhiệm cá nhân về\ný kiến, kiến nghị và đề xuất của mình; đồng thời chịu trách nhiệm tập thể về ý\nkiến kết luận của Hội đồng, trừ trường hợp đã đề nghị bảo lưu ý kiến khác với kết luận của Hội đồng;\ng) Nhiệm vụ cụ thể của các thành viên Hội đồng do Chủ tịch Hội đồng phân công.\n8. Thẩm quyền Chủ tịch Hội đồng sáng kiến a) Tổ chức và chỉ đạo mọi hoạt\nđộng của Hội đồng;\nb) Phân công nhiệm vụ cụ thể\ncho các thành viên Hội đồng.\nc) Quyết định triệu tập các cuộc họp của Hội đồng;\nd) Chủ trì, kết luận các phiên họp Hội đồng;\nđ) Tạm dừng phiên họp Hội đồng khi chưa có đủ cơ sở công nhận hay từ chối công nhận sáng kiến hoặc có trên 1/3 số thành viên Hội đồng vắng mặt tại phiên họp;\ne) Thay mặt Hội đồng ký ban hành các văn bản thuộc thẩm quyền.\n9. Thẩm quyền của Phó Chủ tịch Hội đồng Sáng kiến a) Tham mưu cho Chủ tịch Hội đồng chỉ đạo chuẩn bị nội dung cho các phiên họp Hội đồng;\nb) Tham mưu cho Chủ tịch Hội đồng tổ chức, điều hành các phiên họp và xem xét các báo cáo, tài liệu đưa ra thảo luận tại mỗi phiên họp của Hội đồng;\nc) Thực hiện thẩm quyền của Chủ\ntịch Hội đồng khi được Chủ tịch Hội đồng ủy quyền chủ trì phiên họp của Hội đồng hoặc được người có thẩm quyền thành lập Hội đồng sáng kiến giao nhiệm vụ này.\n10. Chế độ làm việc của Hội đồng sáng kiến a) Phiên họp của Hội đồng chỉ\nđược coi là hợp lệ khi có mặt ít nhất 2/3 số thành viên của Hội đồng, trong đó\nphải có Chủ tịch Hội đồng; trường hợp Chủ tịch Hội đồng vắng mặt phải ủy quyền bằng văn bản cho Phó Chủ tịch chủ trì phiên họp;\nb) Hội đồng làm việc theo chế độ\ntập thể, thực hiện nguyên tắc tập trung dân chủ;\nc) Giải pháp khi đưa ra xem xét tại phiên họp của Hội đồng được công nhận là sáng kiến khi có ít nhất 2/3 số\nthành viên của Hội đồng đồng ý bằng hình thức bỏ phiếu kín;\nd) Bản sao nội dung các sáng kiến và các tài liệu liên quan phải được gửi cho các thành viên Hội đồng tối thiểu 05 ngày làm việc trước thời gian họp Hội đồng.\n11. Trình tự làm việc của Hội đồng sáng kiến a) Thư ký công bố quyết định thành lập Hội đồng và báo cáo tính hợp lệ của Hội đồng theo quy định.\nb) Chủ tịch Hội đồng hoặc Phó\nChủ tịch Hội đồng khi được Chủ tịch Hội đồng ủy quyền chủ trì phiên họp, yêu cầu Thư ký nêu tóm tắt các yêu cầu đối với Hội đồng và báo cáo kết quả tiếp nhận, xử\nlý đơn yêu cầu công nhận sáng kiến; báo cáo tóm tắt nội dung các giải pháp đề\nnghị công nhận sáng kiến;\nc) Các thành viên Hội đồng và\ncác đại biểu dự họp (nếu có) xem xét nội dung các sáng kiến và xem xét báo cáo của Thư ký để thảo luận, đánh giá các giải pháp theo quy định;\nd) Thư ký phát phiếu nhận xét,\nđánh giá giải pháp đề nghị công nhận sáng kiến để các thành viên Hội đồng tiến hành bỏ phiếu kín;\nđ) Các thành viên Hội đồng làm việc độc lập trong quá trình ghi phiếu nhận xét, đánh giá và chịu trách nhiệm cá nhân trước Hội đồng về kết quả đánh giá của mình;\ne) Chủ tịch Hội đồng công bố kết quả kiểm phiếu và kết luận cuộc họp.\n12. Hội đồng sáng kiến được sử\ndụng con dấu của cơ sở để thực hiện các nhiệm vụ được giao.\nĐiều 16.\nCông nhận sáng kiến và cấp Giấy chứng nhận sáng kiến 1. Kết quả xét công nhận sáng kiến được công bố rộng rãi trên trang thông tin điện tử của cơ quan, đơn vị sau thời hạn 15 ngày nếu không có ý kiến phản đối của cơ quan, tổ chức, cá nhân nào khác về kết quả đó thì đối với những giải pháp đủ điều kiện công nhận là sáng kiến, Thủ trưởng cơ sở phải có trách nhiệm ban hành Quyết định công nhận và cấp Giấy chứng nhận sáng kiến theo quy định tại Khoản 3, Điều 6 Thông tư số\n18/2013/TT-BKHCN và quy định cụ thể sau đây:\na) Với mỗi Sáng kiến được công nhận, các đối tượng quy định tại Khoản 2, Điều 9 của Thông tư số\n18/2013/TT-BKHCN được cấp 01 Quyết định công nhận sáng kiến kèm theo Giấy chứng nhận sáng kiến và không cấp lại; trường hợp Sáng kiến có đồng tác giả thì mỗi đồng tác giả được cấp 01 bản có giá trị như nhau;\nb) Giấy chứng nhận Sáng kiến phải có đầy đủ các thông tin theo quy định tại Khoản 2, Điều 7 của Nghị định số\n13/2012/NĐ-CP và được làm theo mẫu quy định tại Phụ lục III ban hành kèm theo Thông tư\nsố 18/2013/TT-BKHCN ;\n2. Kết quả xét công nhận sáng kiến phải được cơ sở thông báo bằng văn bản cho tác giả (đồng tác giả) được biết;\ntrường hợp từ chối công nhận sáng kiến thì phải nêu rõ lý do.\nĐiều 17.\nHuỷ bỏ việc công nhận Sáng kiến Theo yêu cầu của cơ quan, tổ chức,\ncá nhân, cơ sở công nhận sáng kiến có quyền huỷ bỏ việc công nhận sáng kiến theo quy định tại Khoản 3, Điều 9 của Thông tư số 18/2013/TT-BKHCN và hướng dẫn cụ\nthể như sau:\n1. Trước khi ra quyết định huỷ\nbỏ kết quả công nhận Sáng kiến, Thủ trưởng cơ sở có thể thành lập và tổ chức họp Hội đồng sáng kiến để xem xét tham mưu giải quyết và mời các cá nhân, đại diện các cơ quan, tổ chức có liên quan và tác giả (đồng tác giả) dự họp để giải trình và thống nhất phương án xử lý;\n2. Cuộc họp của Hội đồng Sáng kiến phải được lập thành biên bản, trong đó ghi rõ ý kiến của những người dự họp và kết luận của Hội đồng;\n3. Khi quyết định huỷ bỏ kết quả\ncông nhận Sáng kiến, Thủ trưởng cơ sở phải thu hồi và huỷ bỏ Quyết định công nhận và Giấy chứng nhận Sáng kiến đã cấp cho tác giả (đồng tác giả); thu hồi lại các khoản thù lao đã trả cho tác giả (đồng tác giả) và người tham gia tổ chức áp dụng sáng kiến lần đầu (nếu có); thu hồi hoặc đề nghị cấp có thẩm quyền thu hồi, huỷ\nbỏ các chế độ, quyền lợi mà tác giả (đồng tác giả) được hưởng từ sáng kiến đó.\nĐiều 18.\nXét công nhận Sáng kiến cho tác giả (đồng tác giả) là người đứng đầu cơ sở\n1. Người đứng đầu cơ sở xét công nhận Sáng kiến chính là tác giả (đồng tác giả) Sáng kiến thì phải được\nđánh giá thông qua Hội đồng Sáng kiến của cơ sở quy định tại Điều 8 Quy định này và trước khi quyết định công nhận Sáng kiến phải được sự chấp thuận của cơ\nquan quản lý cấp trên trực tiếp của cơ sở đó hoặc Sở Khoa học và Công nghệ theo quy định tại Khoản 4 Điều 7 của Nghị định số 13/2012/NĐ-CP và Điều 7 của Thông tư số 18/2013/TT-BKHCN .\n2. Trường hợp Sáng kiến được tạo ra không sử dụng kinh phí, phương tiện vật chất - kỹ thuật của Nhà nước và người\nđứng đầu cơ sở cơ sở xét công nhận Sáng kiến chính là tác giả (đồng tác giả)\nSáng kiến thì Sáng kiến đó phải được đánh giá thông qua Hội đồng Sáng kiến của cơ sở đó và trước khi quyết định công nhận Sáng kiến phải được sự chấp thuận của cơ quan có thẩm quyền theo quy định sau đây:\na) Trường hợp tác giả (đồng tác giả) sáng kiến là người đứng đầu các sở, ban, ngành, đoàn thể cấp tỉnh, doanh nghiệp Nhà nước, đơn vị sự nghiệp công lập trực thuộc Ủy ban nhân dân Tỉnh, Bí\nthư cấp ủy cấp huyện và tương đương, Chủ tịch Ủy ban nhân dân cấp huyện thì kết quả xét công nhận Sáng kiến ở cơ sở phải được trình lên Ủy ban nhân dân Tỉnh xem xét chấp thuận thông qua Hội đồng Sáng kiến cấp tỉnh;\nb) Trường hợp tác giả (đồng tác giả) Sáng kiến là người đứng đầu các cơ quan chuyên môn, đơn vị đơn vị sự nghiệp công lập trực thuộc Ủy ban nhân dân cấp huyện, bí thư Đảng ủy cấp xã, Chủ tịch Ủy ban nhân dân cấp xã thì kết quả xét công nhận Sáng kiến ở cơ sở phải được trình lên Ủy ban nhân dân cấp huyện xem xét chấp thuận thông qua Hội đồng Sáng kiến cấp huyện;\nc) Các trường hợp khác do cơ\nquan cấp trên trực tiếp của cơ sở đó xem xét chấp thuận.\n3. Hồ sơ đề nghị xét chấp thuận kết quả xét công nhận Sáng kiến cho các trường hợp quy định tại Khoản 2 Điều này áp dụng theo quy định tại Khoản 2, Điều 7 của Thông tư số 18/2013/TT-BKHCN .\n4. Thời hạn xem xét chấp thuận việc công nhận Sáng kiến cho các tác giả (đồng tác giả) quy định tại Khoản 2 Điều này áp dụng theo quy định tại Khoản 3, Điều 7 của Thông tư số 18/2013/TT-BKHCN .\nChương III XÉT CÔNG NHẬN HIỆU QUẢ\nÁP DỤNG VÀ PHẠM VI ẢNH HƯỞNG CỦA SÁNG KIẾN\nĐiều 19.\nThẩm quyền xét công nhận hiệu quả và phạm vi ảnh hưởng của sáng kiến 1. Trường hợp Sáng kiến đã được một cơ sở quy định tại Điều 8 Quy định này công nhận thì cơ quan quản lý cấp trên trực tiếp của cơ sở đó có thẩm quyền tổ chức đánh giá, xem xét công nhận hiệu quả áp dụng, mức độ ảnh hưởng của sáng kiến trong phạm vi quản lý để thực hiện các quy định liên quan.\n2. Thủ trưởng các sở, ban,\nngành, đoàn thể, doanh nghiệp tỉnh, các đơn vị sự nghiệp công lập thuộc Ủy ban nhân dân Tỉnh, Chủ tịch Ủy ban nhân dân cấp huyện có thẩm quyền tổ chức đánh giá, xem xét công nhận hiệu quả, phạm vi ảnh hưởng của sáng kiến được áp dụng ở\ncơ quan, đơn vị, địa phương đang quản lý để thực hiện các quy định liên quan đến sáng kiến thuộc thẩm quyền.\n3. Chủ tịch Ủy ban nhân dân Tỉnh có thẩm quyền đánh giá, xem xét công nhận hiệu quả, phạm vi ảnh hưởng của sáng kiến trên địa bàn tỉnh hoặc toàn quốc để thực hiện các quy định liên quan đến sáng kiến thuộc thẩm quyền.\n4. Trường hợp sáng kiến đã được công nhận bởi các cơ quan, đơn vị ngành dọc Trung ương đóng trên địa bàn tỉnh do bộ, ngành Trung ương quản lý về biên chế, tổ chức thì việc xét công nhận hiệu quả, phạm vi ảnh hưởng của sáng kiến do cơ quan cấp trên của các cơ quan, đơn vị\nđó xem xét đánh giá.\nĐiều 20.\nXét công nhận hiệu quả, phạm vi ảnh hưởng của sáng kiến ở cấp huyện 1. Tác giả (đồng tác giả) có\nnhu cầu đề nghị xét công nhận hiệu quả áp dụng và phạm vi ảnh hưởng của sáng kiến trên địa bàn huyện, thành phố để thực hiện các quy định liên quan đến sáng kiến thì phải được cơ sở quy định tại Điều 8 Quy định này chấp thuận và gửi hồ sơ về\ncơ quan thường trực Hội đồng công nhận hiệu quả, phạm vi ảnh hưởng của sáng kiến\nở cấp huyện. Hồ sơ gồm:\na) Tờ trình của Thủ trưởng cơ sở\ngửi Chủ tịch Ủy ban nhân dân cấp huyện;\nb) Sao y bản chính Đơn yêu cầu công nhận sáng kiến đã nộp ở cơ sở;\nc) Sao y bản chính Quyết định công nhận sáng kiến và Giấy chứng nhận sáng kiến do Thủ trưởng cơ sở quy định tại\nĐiều 8 Quy định này cấp;\nd) Sao y bản chính Biên bản họp Hội đồng Sáng kiến trong trường hợp Sáng kiến đã được đánh giá thông qua Hội đồng này;\nđ) Ý kiến đánh giá bằng văn bản của cơ quan chuyên môn hoặc chuyên gia trong lĩnh vực áp dụng Sáng kiến về hiệu quả và phạm vi ảnh hưởng, khả năng áp dụng rộng rãi hiệu quả của giải pháp nêu trong đơn (nếu có);\ne) Các tài liệu chứng minh hiệu quả, phạm vi ảnh hưởng, khả năng áp dụng rộng rãi của sáng kiến (nếu có).\n2. Sáng kiến được xem xét công nhận hiệu quả áp dụng và phạm vi ảnh hưởng trên địa bàn cấp huyện khi đáp ứng đủ\ncác điều kiện sau đây:\na) Đáp ứng đầy đủ các điều kiện kiện theo quy định tại Điều 3 và Điều 4 của Nghị định số 13/2012/NĐ-CP và Điều 4 của Thông tư số 18/2013/TT-BKHCN và theo hướng dẫn tại Điều 12 của Quy định này.\nb) Đã được một cơ sở trên địa bàn cấp huyện quy định tại Điều 8 Quy định này công nhận và cấp Giấy chứng nhận sáng kiến;\nc) Đã được phổ biến, áp dụng rộng rãi trên địa bàn cấp huyện hoặc có khả năng áp dụng rộng rãi cho nhiều cơ quan,\nđơn vị, tổ chức, cá nhân khác ngoài phạm vi cơ sở xét công nhận Sáng kiến;\nd) Hiệu quả áp dụng sáng kiến ở\ncơ sở là tiêu biểu, mang lại lợi ích thiết thực cho xã hội, xứng đáng vinh danh, nêu gương tác giả (đồng tác giả) trên địa bàn cấp huyện.\n3. Chủ tịch Ủy ban nhân dân huyện,\nthành phố có thẩm quyền thành lập Hội đồng công nhận hiệu quả, phạm vi ảnh hưởng của sáng kiến ở cấp huyện.\n4. Thành phần Hội đồng công nhận hiệu quả, phạm vi ảnh hưởng của sáng kiến ở cấp huyện gồm:\na) Chủ tịch Hội đồng là Chủ tịch hoặc Phó Chủ tịch Ủy ban nhân dân cấp huyện được giao phụ trách lĩnh vực Khoa học và Công nghệ; trường hợp những người này đều là đồng tác giả của sáng kiến thì\nChủ tịch Hội đồng là Phó Chủ tịch Ủy ban nhân dân cấp huyện phụ trách lĩnh vực liên quan đến lĩnh vực áp dụng sáng kiến;\nb) 01 Phó Chủ tịch Hội đồng là\nThủ trưởng cơ quan chuyên môn có chức năng tham mưu, giúp Ủy ban nhân dân cấp huyện thực hiện chức năng quản lý nhà nước về khoa học và công nghệ;\nc) 01 Ủy viên là Thủ trưởng cơ\nquan chuyên môn có chức năng tham mưu, giúp Ủy ban nhân dân cấp huyện thực hiện chức năng quản lý nhà nước về thi đua, khen thưởng; 01 Ủy viên là Lãnh đạo Liên\nđoàn Lao động huyện, thành phố; 01 Ủy viên là Lãnh đạo Văn phòng Ủy ban nhân dân huyện, thành phố; các Ủy viên còn lại là các chuyên gia, cán bộ, công chức,\nviên chức có trình độ chuyên môn liên quan đến lĩnh vực áp dụng sáng kiến, do Chủ tịch Ủy ban nhân dân cấp huyện quyết định;\nd) Thư ký Hội đồng là cán bộ,\ncông chức của cơ quan quy định tại Khoản 8 Điều này được giao nhiệm vụ tham mưu về hoạt động sáng kiến.\nđ) Số lượng các thành viên Hội\nđồng có từ 7 hoặc 9 thành viên do Chủ tịch Ủy ban nhân dân cấp huyện quyết định.\n5. Hội đồng công nhận hiệu quả,\nphạm vi ảnh hưởng của sáng kiến ở cấp huyện được sử dụng con dấu của Ủy ban nhân dân cấp huyện khi thực hiện nhiệm vụ được giao.\n6. Cơ quan thường trực Hội đồng công nhận hiệu quả, phạm vi ảnh hưởng của sáng kiến ở cấp huyện là phòng Kinh tế/\nKinh tế và Hạ tầng các huyện, thành phố. Cơ quan này có trách nhiệm:\na) Tiếp nhận các hồ sơ Sáng kiến thuộc thẩm quyền giải quyết của Hội đồng;\nb) Tham mưu thành lập Tổ chuyên môn hoặc mời chuyên gia trong lĩnh vực áp dụng sáng kiến tham gia Hội đồng;\nc) Tham mưu tổ chức họp Hội đồng trong thời hạn 01 tháng kể từ ngày nhận được hồ sơ hợp lệ theo quy định tại Khoản 2 Điều này;\nd) Lập báo cáo kết quả tiếp nhận,\nxử lý các hồ sơ sơ sáng kiến và tổng hợp các hồ sơ sáng kiến cùng các tài liệu có liên quan để gửi tới các thành viên Hội đồng nghiên cứu trước khi tổ chức họp Hội đồng;\nđ) Tham mưu tổ chức các hoạt động thuộc chức năng, nhiệm vụ của Hội đồng và thực hiện các nhiệm vụ khác theo yêu cầu của Chủ tịch Ủy ban nhân dân huyện, thành phố và Chủ tịch Hội đồng;\ne) Công bố công khai kết quả\nđánh giá của Hội đồng trên Trang Thông tin điện tử của Ủy ban nhân dân cấp huyện và trên các phương tiện truyền thông khác có liên quan để các tổ chức, cá nhân có liên quan thuận tiện khi có nhu cầu phản hồi (trừ các thông tin cần giữ bí mật theo yêu cầu của tác giả sáng kiến);\ng) Được sử dụng con dấu của cơ\nquan để thực hiện nhiệm vụ được giao.\n7. Nhiệm vụ của Hội đồng công nhận hiệu quả, phạm vi ảnh hưởng của sáng kiến ở cấp huyện:\na) Tham mưu cho Chủ tịch Ủy ban nhân dân cấp huyện xem xét công nhận hoặc đề nghị cấp có thẩm quyền xem xét công nhận những sáng kiến tiêu biểu, có mức độ ảnh hưởng, khả năng áp dụng rộng rãi theo quy định tại Khoản 3 Điều này để công bố, phổ biến, áp dụng rộng rãi và hỗ trợ tác giả sáng kiến thực hiện các quy định của pháp luật có liên quan;\nb) Giúp Ủy ban nhân dân cấp huyện xét chấp thuận kết quả xét công nhận sáng kiến cho các tác giả (đồng tác giả)\ntheo quy định tại Điểm b Khoản 2 Điều 18 Quy định này;\nc) Lập báo cáo đánh giá, trong\nđó phản ánh đầy đủ ý kiến của các thành viên và kết quả bỏ phiếu sau khi kết thúc mỗi phiên họp của Hội đồng để tham mưu cho Chủ tịch Ủy ban nhân dân cấp huyện xem xét quyết định;\nd) Thực hiện các nhiệm vụ khác theo yêu cầu của Chủ tịch Ủy ban nhân dân cấp huyện.\n8. Thẩm quyền và trách nhiệm của các thành viên Hội đồng cấp huyện thực hiện theo quy định tại Khoản 6, Khoản 7,\nKhoản 8 Điều 15 Quy định này. Nhiệm vụ cụ thể của các thành viên này do Chủ tịch Hội đồng phân công.\n9. Chế độ làm việc và trình tự\nlàm việc của Hội đồng tại mỗi phiên họp áp dụng theo quy định tại Khoản 10, Khoản 11 Điều 15 Quy định này.\n10. Sau khi kết thúc 05 ngày làm việc kể từ ngày công bố công khai thông tin theo quy định, nếu không có tổ\nchức, cá nhân nào phản đối kết quả đánh giá của Hội đồng thì cơ quan thường trực có trách nhiệm tổng hợp kết quả đánh giá của Hội đồng này để trình Chủ tịch Ủy ban nhân dân cấp huyện xem xét quyết định. Hồ sơ trình Chủ tịch Ủy ban nhân dân cấp huyện gồm:\na) Tờ trình của cơ quan Thường trực Hội đồng;\nb) Báo cáo đánh giá của Hội đồng;\ntrong đó phản ánh đầy đủ ý kiến của các thành viên và kết quả bỏ phiếu;\nc) Biên bản họp Hội đồng;\nd) Dự thảo Quyết định và Giấy chứng nhận của Chủ tịch Ủy ban nhân dân cấp huyện đối với các sáng kiến được Hội\nđồng thông qua;\nđ) Các tài liệu chứng minh hiệu quả, phạm vi ảnh hưởng, khả năng áp dụng rộng rãi của sáng kiến (nếu có).\n11. Khi nhận được hồ sơ quy định tại Khoản 10 Điều này, Chủ tịch Ủy ban nhân dân cấp huyện có trách nhiệm xem xét quyết định công nhận hiệu quả, phạm vi ảnh hưởng của sáng kiến. Giấy chứng nhận hiệu quả và phạm vi ảnh hưởng của sáng kiến theo mẫu quy định tại Phụ lục kèm theo.\n12. Kết quả xét công nhận hiệu quả, phạm vi ảnh hưởng của sáng kiến phải được Ủy ban nhân dân cấp huyện thông báo bằng văn bản cho cơ sở và tác giả (đồng tác giả) được biết; trường hợp từ\nchối công nhận thì phải nêu rõ lý do.\nĐiều 21.\nXét công nhận hiệu quả, phạm vi ảnh hưởng của sáng kiến ở các sở, ban, ngành,\nđoàn thể, doanh nghiệp Trường hợp các cơ sở trực thuộc các sở, ban, ngành, đoàn thể, doanh nghiệp tỉnh, các đơn vị sự nghiệp công lập thuộc Ủy ban nhân dân Tỉnh đáp ứng quy định tại Điều 8 Quy định này đã tổ chức xét công nhận sáng kiến thì có thẩm quyền xét công nhận hiệu quả, phạm vi ảnh hưởng của sáng kiến lĩnh vực thuộc thẩm quyền quản lý và được thực hiện như\nsau:\n1. Tác giả (đồng tác giả) có\nnhu cầu đề nghị xét công nhận hiệu quả áp dụng và phạm vi ảnh hưởng của sáng kiến\nở các sở, ban, ngành, đoàn thể, doanh nghiệp để thực hiện các quy định liên quan đến sáng kiến thì phải được cơ sở quy định tại Điều 8 Quy định này chấp thuận và gửi hồ sơ về cơ quan, đơn vị quản lý cấp trên. Hồ sơ gồm:\na) Tờ trình của Lãnh đạo cơ sở\ngửi Lãnh đạo cơ quan, đơn vị quản lý cấp trên;\nb) Sao y bản chính Đơn yêu cầu công nhận sáng kiến đã nộp ở cơ sở;\nc) Sao y bản chính Quyết định công nhận sáng kiến và Giấy chứng nhận sáng kiến do Thủ trưởng cơ sở quy định tại\nĐiều 8 Quy định này cấp;\nd) Sao y bản chính Biên bản họp Hội đồng Sáng kiến trong trường hợp Sáng kiến đã được đánh giá thông qua Hội đồng này;\nđ) Ý kiến đánh giá bằng văn bản của cơ quan chuyên môn hoặc chuyên gia trong lĩnh vực áp dụng Sáng kiến về hiệu quả và phạm vi ảnh hưởng, khả năng áp dụng rộng rãi hiệu quả của giải pháp nêu trong đơn (nếu có);\ne) Các tài liệu chứng minh hiệu quả, phạm vi ảnh hưởng, khả năng áp dụng rộng rãi của sáng kiến (nếu có).\n2. Sáng kiến được xem xét công nhận hiệu quả áp dụng và phạm vi ảnh hưởng ở các sở, ban, ngành, đoàn thể,\ndoanh nghiệp khi đáp ứng đủ các điều kiện sau đây:\na) Đáp ứng đầy đủ các điều kiện kiện theo quy định tại Điều 3 và Điều 4 của Nghị định số 13/2012/NĐ-CP và Điều 4 của Thông tư số 18/2013/TT-BKHCN và theo hướng dẫn tại Điều 12 của Quy định này.\nb) Đã được phổ biến, áp dụng rộng rãi trên địa bàn cấp huyện hoặc có khả năng áp dụng rộng rãi cho nhiều cơ quan,\nđơn vị, tổ chức, cá nhân khác ngoài phạm vi cơ sở xét công nhận sáng kiến;\nc) Hiệu quả áp dụng sáng kiến ở\ncơ sở là tiêu biểu, mang lại lợi ích thiết thực cho xã hội, xứng đáng vinh danh, nêu gương tác giả (đồng tác giả) ở các sở, ban, ngành, đoàn thể, doanh nghiệp.\n3. Thủ trưởng các sở, ban,\nngành, đoàn thể, doanh nghiệp có thẩm quyền thành lập Hội đồng công nhận hiệu quả, phạm vi ảnh hưởng của sáng kiến.\n4. Thành phần Hội đồng công nhận hiệu quả, phạm vi ảnh hưởng của sáng kiến ở ở các sở, ban, ngành, đoàn thể,\ndoanh nghiệp gồm:\na) Chủ tịch Hội đồng là Lãnh đạo các sở, ban, ngành, đoàn thể, doanh nghiệp;\nb) 01 Phó Chủ tịch Hội đồng là\nLãnh đạo Công đoàn cơ sở;\nc) Các Ủy viên còn lại là các chuyên gia, cán bộ, công chức, viên chức có trình độ chuyên môn liên quan đến lĩnh vực áp dụng sáng kiến;\nd) Thư ký Hội đồng là cán bộ,\ncông chức, viên chức của cơ quan, đơn vị quy định tại Khoản 8 Điều này được giao nhiệm vụ tham mưu về hoạt động sáng kiến.\nđ) Số lượng các thành viên Hội\nđồng có từ 7 hoặc 9 thành viên.\n5. Hội đồng công nhận hiệu quả,\nphạm vi ảnh hưởng của sáng kiến ở các sở, ban, ngành, đoàn thể, doanh nghiệp được sử dụng con dấu của sở, ban, ngành, đoàn thể, doanh nghiệp khi thực hiện nhiệm vụ được giao.\n6. Nhiệm vụ của Hội đồng công nhận hiệu quả, phạm vi ảnh hưởng của sáng kiến ở sở, ban, ngành, đoàn thể,\ndoanh nghiệp:\na) Tham mưu cho Lãnh đạo xem xét công nhận hoặc đề nghị cấp có thẩm quyền xem xét công nhận những sáng kiến tiêu biểu, có mức độ ảnh hưởng, khả năng nhân rộng để công bố, phổ biến, áp dụng rộng rãi và hỗ trợ tác giả sáng kiến thực hiện các quy định của pháp luật có\nliên quan;\nb) Lập báo cáo đánh giá, trong\nđó phản ánh đầy đủ ý kiến của các thành viên và kết quả bỏ phiếu sau khi kết thúc mỗi phiên họp của Hội đồng để tham mưu cho Lãnh đạo sở, ban, ngành, đoàn thể, doanh nghiệp xem xét quyết định;\nc) Thực hiện các nhiệm vụ khác theo yêu cầu Lãnh đạo sở, ban, ngành, đoàn thể, doanh nghiệp.\n7. Thẩm quyền và trách nhiệm của các thành viên Hội đồng thực hiện theo quy định tại Khoản 6, Khoản 7, Khoản 8\nĐiều 15 Quy định này. Nhiệm vụ cụ thể của các thành viên này do Chủ tịch Hội đồng phân công.\n8. Chế độ làm việc và trình tự\nlàm việc của Hội đồng tại mỗi phiên họp áp dụng theo quy định tại Khoản 10, Khoản 11 Điều 15 Quy định này.\n9. Sau khi kết thúc 05 ngày làm việc kể từ ngày công bố công khai thông tin theo quy định, nếu không có tổ chức,\ncá nhân nào phản đối kết quả đánh giá của Hội đồng thì bộ phận tham mưu có\ntrách nhiệm tổng hợp kết quả đánh giá của Hội đồng này để trình Lãnh đạo sở,\nban, ngành, đoàn thể, doanh nghiệp xem xét quyết định. Hồ sơ trình Lãnh đạo sở,\nban, ngành, đoàn thể, doanh nghiệp gồm:\na) Báo cáo đánh giá của Hội đồng;\ntrong đó phản ánh đầy đủ ý kiến của các thành viên và kết quả bỏ phiếu;\nb) Biên bản họp Hội đồng;\nc) Dự thảo Quyết định và Giấy chứng nhận;\nd) Các tài liệu chứng minh hiệu quả, phạm vi ảnh hưởng, khả năng áp dụng rộng rãi của sáng kiến (nếu có).\n10. Khi nhận được hồ sơ quy định tại Khoản 9 Điều này, Lãnh đạo sở, ban, ngành, đoàn thể, doanh nghiệp có trách nhiệm xem xét quyết định công nhận hiệu quả, phạm vi ảnh hưởng của sáng kiến.\nGiấy chứng nhận hiệu quả và phạm vi ảnh hưởng của sáng kiến theo mẫu quy định tại Phụ lục kèm theo.\n11. Kết quả xét công nhận hiệu quả, phạm vi ảnh hưởng của sáng kiến phải được Lãnh đạo sở, ban, ngành, đoàn thể,\ndoanh nghiệp thông báo bằng văn bản cho cơ sở và tác giả (đồng tác giả) được biết;\ntrường hợp từ chối công nhận thì phải nêu rõ lý do.\nĐiều 22.\nXét công nhận hiệu quả áp dụng, phạm vi ảnh hưởng của sáng kiến trên địa bàn Tỉnh và toàn quốc 1. Sáng kiến được xem xét công nhận hiệu quả áp dụng và phạm vi ảnh hưởng trên địa bàn tỉnh khi đáp ứng đủ các\nđiều kiện sau đây:\na) Đáp ứng đầy đủ các điều kiện kiện theo quy định tại Điều 3 và Điều 4 của Nghị định số 13/2012/NĐ-CP và Điều 4 của Thông tư số 18/2013/TT-BKHCN theo hướng dẫn tại Điều 12 của Quy định này;\nb) Đã được một cơ sở trên địa bàn tỉnh quy định tại Điều 8 Quy định này công nhận và cấp Giấy chứng nhận sáng kiến;\nc) Trường hợp cơ sở nêu tại Điểm b Khoản này là cơ quan, đơn vị trực thuộc sở, ban, ngành, đoàn thể cấp tỉnh, Ủy ban nhân dân cấp huyện thì phải được thủ trưởng sở, ban, ngành, đoàn thể cấp tỉnh,\nChủ tịch Ủy ban nhân dân cấp huyện công nhận hiệu quả, phạm vi ảnh hưởng sáng kiến đó theo quy định tại Điều 20, 21 Quy định này;\nd) Đã được phổ biến, áp dụng rộng rãi trên địa bàn tỉnh hoặc có khả năng áp dụng rộng rãi cho nhiều cơ quan, đơn vị, tổ chức, cá nhân khác trên địa bàn tỉnh;\nđ) Hiệu quả áp dụng sáng kiến ở\ncơ sở là tiêu biểu, mang lại lợi ích thiết thực cho xã hội, xứng đáng vinh danh, nêu gương tác giả (đồng tác giả) trên địa bàn tỉnh.\n2. Trường hợp tác giả (đồng tác giả) đề nghị Chủ tịch Ủy ban nhân dân Tỉnh xem xét công nhận hiệu quả áp dụng và phạm vi ảnh hưởng của sáng kiến trên phạm vi toàn quốc thì ngoài việc đáp ứng\nđủ các điều kiện quy định tại Khoản 1 Điều này, tác giả (đồng tác giả) phải chứng minh được sáng kiến đáp ứng một trong các điều kiện sau đây:\na) Đã được phổ biến, áp dụng rộng rãi trên phạm vi toàn quốc;\nb) Đã được chuyển giao áp dụng hiệu quả tại ít nhất 02 cơ sở ở địa phương khác nhau ngoài phạm vi tỉnh;\nc) Có khả năng áp dụng rộng rãi cho nhiều cơ quan, đơn vị, tổ chức, cá nhân khác trên phạm vi toàn quốc.\n3. Tác giả (đồng tác giả) có nhu cầu đề nghị Chủ tịch Ủy ban nhân dân Tỉnh xem xét công nhận hiệu quả áp dụng và\nphạm vi ảnh hưởng của sáng kiến theo quy định tại Khoản 1 và Khoản 2 Điều này phải được cấp có thẩm quyền quy định tại Điểm c Khoản 1 Điều này chấp thuận và\ngửi hồ sơ về cơ quan thường trực Hội đồng Sáng kiến cấp tỉnh. Hồ sơ gồm:\na) Tờ trình của cấp có thẩm quyền;\nb) Sao y bản chính Đơn yêu cầu công nhận sáng kiến đã nộp ở cơ sở;\nc) Sao y bản chính Quyết định công nhận sáng kiến và Giấy chứng nhận Sáng kiến do Thủ trưởng cơ sở quy định tại\nĐiều 8 Quy định này cấp;\nd) Sao y bản chính Quyết định và Giấy chứng nhận của cơ quan, đơn vị có thẩm quyền quy định tại Điểm c Khoản 1 Điều này;\nđ) Sao y bản chính Biên bản họp Hội đồng Sáng kiến của cơ sở có thẩm quyền xét công nhận sáng kiến quy định tại\nĐiều 6 Quy định này trong trường hợp sáng kiến đã được đánh giá thông qua Hội đồng này;\ne) Sao y bản chính Biên bản họp Hội đồng xét công nhận hiệu quả áp dụng và phạm vi ảnh hưởng của sáng kiến của cấp có thẩm quyền quy định tại Điểm c Khoản 1 Điều này;\ng) Ý kiến đánh giá bằng văn bản của cơ quan chuyên môn hoặc chuyên gia trong lĩnh vực áp dụng sáng kiến về hiệu quả và phạm vi ảnh hưởng, khả năng áp dụng rộng rãi của giải pháp nêu trong đơn\n(nếu có);\nh) Các tài liệu chứng minh hiệu quả, phạm vi ảnh hưởng, khả năng áp dụng rộng rãi của sáng kiến (nếu có).\n4. Chủ tịch Ủy ban nhân dân Tỉnh có thẩm quyền thành lập Hội đồng xét công nhận hiệu quả áp dụng và phạm vi ảnh hưởng của sáng kiến cấp tỉnh để thực hiện nhiệm vụ quy định tại Khoản 3 Điều 19 Quy định này.\n5. Tổ chức của Hội đồng xét công nhận hiệu quả áp dụng và phạm vi ảnh hưởng của sáng kiến cấp tỉnh gồm:\na) Chủ tịch Hội đồng là Chủ tịch hoặc Phó Chủ tịch Ủy ban nhân dân Tỉnh được giao phụ trách lĩnh vực Khoa học và\nCông nghệ; trường hợp những người này đều là đồng tác giả của sáng kiến thì Chủ\ntịch Hội đồng là Phó Chủ tịch Ủy ban nhân dân Tỉnh phụ trách lĩnh vực liên quan\nđến lĩnh vực áp dụng sáng kiến; Chủ tịch Hội đồng sáng kiến cấp tỉnh có thể ủy quyền cho Phó Chủ tịch Thường trực Hội đồng chủ trì, điều hành các phiên họp của Hội đồng;\nb) 01 Phó Chủ tịch Thường trực Hội đồng là Phó Giám đốc Sở Khoa học và Công nghệ phụ trách lĩnh vực Sở hữu trí\ntuệ;\nc) 01 Phó Chủ tịch Hội đồng là\nlãnh đạo Sở Nội vụ;\nd) Các Ủy viên gồm: Lãnh đạo Liên hiệp các Hội Khoa học và Kỹ thuật tỉnh; lãnh đạo Liên đoàn Lao động tỉnh;\nlãnh đạo phòng chuyên môn của sở Khoa học và Công nghệ có chức năng, nhiệm vụ\ntham mưu về hoạt động sáng kiến;\nđ) Thành viên chuyên ngành: Tùy từng lĩnh vực áp dụng của sáng kiến được xét duyệt, cơ quan Thường trực của Hội\nđồng sáng kiến cấp tỉnh quyết định mời các chuyên gia, nhà khoa học và các thành phần khác có trình độ chuyên môn phù hợp và am hiểu sâu về lĩnh vực sáng kiến đề nghị là thành viên chính thức của Hội đồng;\ne) Thư ký Hội đồng do chuyên viên bộ phận chuyên môn của Sở Khoa học và Công nghệ có chức năng, nhiệm vụ\ntham mưu về hoạt động sáng kiến kiêm nhiệm.\ng) Việc mời chuyên gia trong lĩnh vực áp dụng sáng kiến tham gia làm thành viên Hội đồng áp dụng theo quy định tại Khoản 1 và Khoản 2 Điều 15 của Quy định này;\n6. Số lượng các thành viên Hội\nđồng có từ 09 hoặc 11 thành viên do Chủ tịch Ủy ban nhân dân Tỉnh quyết định.\n7. Cơ quan thường trực Hội đồng Sáng kiến cấp tỉnh là Sở Khoa học và Công nghệ, có trách nhiệm:\na) Tiếp nhận các hồ sơ sáng kiến thuộc thẩm quyền giải quyết của Hội đồng Sáng kiến cấp tỉnh để tổng hợp, phân loại, xem xét, đánh giá sơ bộ;\nb) Mời một số thành viên chuyên ngành có trình độ chuyên môn phù hợp tham gia Hội đồng Sáng kiến;\nc) Tham mưu tổ chức họp Hội đồng xét công nhận hiệu quả áp dụng và phạm vi ảnh hưởng của sáng kiến cấp tỉnh trong thời hạn 01 tháng kể từ ngày nhận được hồ sơ hợp lệ theo quy định tại Khoản 3, Điều này;\nd) Lập báo cáo kết quả tiếp nhận,\nxử lý các hồ sơ sơ sáng kiến và tổng hợp các hồ sơ sáng kiến cùng các tài liệu có liên quan để gửi tới các thành viên Hội đồng nghiên cứu trước khi tổ chức họp Hội đồng;\nđ) Tham mưu tổ chức các hoạt động thuộc chức năng, nhiệm vụ của Hội đồng Sáng kiến cấp tỉnh và thực hiện các nhiệm vụ khác theo yêu cầu của Chủ tịch Ủy ban nhân dân Tỉnh và Chủ tịch Hội đồng xét công nhận hiệu quả áp dụng và phạm vi ảnh hưởng của sáng kiến cấp tỉnh;\ne) Được sử dụng con dấu của cơ\nquan để thực hiện nhiệm vụ được giao.\n8. Nhiệm vụ của Hội đồng a) Tham mưu cho Chủ tịch Ủy ban nhân dân Tỉnh xem xét công nhận hoặc đề nghị cấp có thẩm quyền xem xét công nhận những sáng kiến tiêu biểu, có mức độ ảnh hưởng, khả năng áp dụng rộng rãi theo quy định tại Khoản 1 và Khoản 2 Điều này để công bố, phổ biến, áp dụng rộng rãi và hỗ trợ tác giả sáng kiến thực hiện các quy định của pháp luật có liên quan;\nb) Tổng hợp kết quả đánh giá,\ntrong đó phản ánh đầy đủ ý kiến của các thành viên và kết quả bỏ phiếu sau khi kết thúc mỗi phiên họp của Hội đồng để tham mưu cho Chủ tịch Ủy ban nhân dân Tỉnh xem xét quyết định;\nc) Bảo mật thông tin về các sáng kiến theo yêu cầu của tác giả hoặc Chủ tịch Ủy ban nhân dân Tỉnh;\nd) Thực hiện quy trình làm việc theo quy định tại Khoản 11 Điều này và các nhiệm vụ khác theo yêu cầu của Chủ tịch\nỦy ban nhân dân Tỉnh.\n9. Thẩm quyền và trách nhiệm của các thành viên Hội đồng Sáng kiến cấp tỉnh thực hiện theo quy định tại Khoản 7,\nKhoản 8 và Khoản 9 Điều 15 Quy định này. Nhiệm vụ cụ thể của các thành viên này do Chủ tịch Hội đồng Sáng kiến cấp tỉnh phân công.\n10. Chế độ làm việc và trình tự\nlàm việc của Hội đồng tại mỗi phiên họp áp dụng theo quy định tại Khoản 10 và\nKhoản 11 Điều 15 Quy định này.\n11. Tham mưu giúp Hội đồng Sáng kiến cấp tỉnh xây dựng và ban hành quy trình và phương pháp đánh giá hiệu quả,\nphạm vi ảnh hưởng của sáng kiến trên địa bàn tỉnh.\n12. Sở Khoa học và Công nghệ có\ntrách nhiệm công bố công khai những thông tin sau đây trên Cổng thông tin điện tử của cơ quan mình hoặc của Ủy ban nhân dân Tỉnh và trên các phương tiện truyền thông khác có liên quan để các tổ chức, cá nhân có liên quan thuận tiện khi có\nnhu cầu phản hồi:\na) Kết quả đánh giá của Hội đồng;\nb) Nội dung các sáng kiến đã được Hội đồng công nhận (trừ các thông tin cần giữ bí mật theo yêu cầu của tác giả\nsáng kiến);\nc) Thông tin liên hệ của cơ\nquan Thường trực Hội đồng Sáng kiến cấp tỉnh.\n13. Sau khi kết thúc 05 ngày làm việc kể từ ngày công bố công khai thông tin theo quy định tại Khoản 12 Điều này, nếu không có tổ chức, cá nhân nào phản đối kết quả đánh giá của Hội đồng,\nSở Khoa học và Công nghệ có trách nhiệm tổng hợp kết quả đánh giá của Hội đồng này để trình Chủ tịch Ủy ban nhân dân Tỉnh xem xét, quyết định. Hồ sơ trình Chủ\ntịch Ủy ban nhân dân Tỉnh gồm:\na) Tờ trình của Sở Khoa học và\nCông nghệ;\nb) Biên bản họp Hội đồng, trong\nđó phản ánh đầy đủ ý kiến của các thành viên và kết quả bỏ phiếu; trường hợp cơ\nquan thường trực Hội đồng có quan điểm khác với kết quả đánh giá của Hội đồng thì phải gửi kèm theo báo cáo phân tích làm rõ những nội dung có liên quan để\ntrình Chủ tịch Ủy ban nhân dân Tỉnh xem xét;\nc) Dự thảo Quyết định và Giấy chứng nhận của Chủ tịch Ủy ban nhân dân Tỉnh về hiệu quả áp dụng, phạm vi ảnh hưởng của sáng kiến trên địa bàn Tỉnh đối với các sáng kiến được Hội đồng thông qua;\nd) Các tài liệu chứng minh hiệu quả, phạm vi ảnh hưởng, khả năng áp dụng rộng rãi của sáng kiến (nếu có).\n14. Khi nhận được hồ sơ quy định tại Khoản 13 Điều này, Chủ tịch Ủy ban nhân dân Tỉnh có trách nhiệm xem xét quyết\nđịnh công nhận và cấp Giấy chứng nhận cho các tác giả (đồng tác giả) của sáng kiến đáp ứng đủ các điều kiện theo quy định. Giấy chứng nhận hiệu quả và phạm vi ảnh hưởng của sáng kiến theo mẫu quy định tại Phụ lục kèm theo.\n15. Kết quả xét công nhận hiệu quả, phạm vi ảnh hưởng của sáng kiến trên địa bàn tỉnh phải được Sở Khoa học và\nCông nghệ thông báo bằng văn bản điện tử đã được ký số cho cơ sở và tác giả (đồng tác giả) được biết; trường hợp từ chối công nhận thì phải nêu rõ lý do.\nĐiều 23.\nHuỷ bỏ kết quả công nhận hiệu quả, phạm vi ảnh hưởng của sáng kiến 1. Cấp có thẩm quyền công nhận hiệu quả, phạm vi ảnh hưởng của Sáng kiến có thể xem xét huỷ bỏ kết quả này khi cơ sở công nhận Sáng kiến đã huỷ bỏ việc công nhận Sáng kiến theo quy định tại\nĐiều 17 Quy định này.\n2. Hồ sơ đề nghị huỷ bỏ kết quả\ncông nhận hiệu quả, phạm vi ảnh hưởng của sáng kiến gồm có:\na) Tờ trình của cơ sở đã huỷ bỏ\nviệc công nhận sáng kiến;\nb) Báo cáo tóm tắt lý do trình cấp có thẩm quyền huỷ bỏ kết quả này;\nc) Các tài liệu chứng minh cho việc huỷ bỏ công nhận sáng kiến (nếu có).\n3. Việc xem xét huỷ bỏ kết quả\ncông nhận hiệu quả, phạm vi ảnh hưởng của sáng kiến có thể áp dụng theo quy định tại Điều 17 Quy định này và các quy định hiện hành.\nChương IV CÁC BIỆN PHÁP THÚC ĐẨY HOẠT ĐỘNG SÁNG KIẾN\nĐiều 24.\nÁp dụng, chuyển giao sáng kiến; thỏa thuận về việc trả thù lao cho tác giả sáng kiến, người tham gia tổ chức áp dụng sáng kiến lần đầu; giải quyết tranh chấp,\nkhiếu nại, tố cáo.\nĐược thực hiện theo các quy định tại Nghị định số 13/2012/NĐ-CP và Thông tư số 18/2013/TT-BKHCN .\nĐiều 25.\nPhổ biến sáng kiến 1. Các cơ sở có sáng kiến được công nhận có trách nhiệm định kỳ 06 tháng một lần báo cáo tình hình công nhận sáng kiến cho cơ quan quản lý cấp trên trực tiếp hoặc Ủy ban nhân dân cấp huyện nơi cơ sở có trụ sở để theo dõi và hỗ trợ phổ biến sáng kiến.\n2. Các Sở, ngành, đoàn thể,\ndoanh nghiệp, Ủy ban nhân dân huyện, thành phố có trách nhiệm phổ biến sáng kiến thuộc lĩnh vực và địa bàn do mình quản lý bằng các biện pháp sau:\na) Khuyến khích các cơ sở có\nsáng kiến được công nhận, tác giả sáng kiến tự đầu tư kinh phí tạo ra sáng kiến phổ biến, chuyển giao sáng kiến cho các cơ sở khác trên địa bàn;\nb) Công bố, phổ biến, áp dụng rộng rãi các sáng kiến được tạo ra do Nhà nước đầu tư kinh phí, phương tiện vật chất\n- kỹ thuật.\nĐiều 26.\nKhuyến khích phong trào thi đua lao động sáng tạo 1. Tổ chức tổng kết, khen thưởng hoạt động sáng kiến:\na) Sở Khoa học và Công nghệ chủ\ntrì phối hợp Sở Nội vụ tham mưu, giúp Ủy ban nhân dân Tỉnh tổ chức tổng kết,\nkhen thưởng hoạt động sáng kiến trên địa bàn tỉnh Đồng Tháp;\nb) Các Sở, ngành, đoàn thể,\ndoanh nghiệp, địa phương tổ chức tổng kết hoạt động sáng kiến trong phạm vi cơ\nquan, đơn vị, địa phương.\n2. Sở Khoa học và Công nghệ,\nLiên hiệp các Hội Khoa học và Kỹ thuật Tỉnh, Liên đoàn Lao động Tỉnh, Tỉnh đoàn và các Sở, ngành, Ủy ban nhân dân các huyện, thành phố tổ chức thực hiện các biện pháp nhằm khuyến khích quần chúng tham gia các phong trào thi đua sáng tạo,\nnhư:\na) Tổ chức các hội thi sáng tạo,\ntriển lãm kết quả lao động sáng tạo, tổ chức các diễn đàn cho hoạt động sáng kiến như trang tin điện tử, câu lạc bộ sáng tạo;\nb) Phổ biến, tuyên truyền về\ncác tổ chức, cá nhân điển hình trong phong trào thi đua sáng tạo.\n3. Các cơ sở công nhận sáng kiến,\ncác Sở, ngành, đoàn thể, doanh nghiệp, Ủy ban nhân dân huyện, thành phố có thể\náp dụng các biện pháp nhằm khuyến khích cơ quan, tổ chức, cá nhân có thành tích xuất sắc trong việc tạo ra và áp dụng sáng kiến, như:\na) Ưu tiên xem xét nâng lương,\nnâng bậc thợ, đào tạo nâng cao trình độ và các chế độ phúc lợi khác cho tác giả,\nnhóm tác giả sáng kiến;\nb) Ưu tiên xem xét, cấp kinh phí và tạo điều kiện thuận lợi cho việc nghiên cứu phát triển và hoàn thiện, áp dụng sáng kiến.\nChương V\nĐIỀU KHOẢN THI HÀNH\nĐiều 27. Nội dung, mức chi và nguồn kinh phí thực hiện các hoạt động sáng kiến và biện pháp thúc đẩy hoạt động sáng kiến.\n1. Nội dung, mức chi thực hiện các hoạt động sáng kiến và biện pháp thúc đẩy hoạt động sáng kiến Thực hiện theo quy định tại Nghị\nquyết số 256/2019/NQ-HĐND ngày 16 tháng 7 năm 2019 của Hội đồng nhân dân Tỉnh quy định nội dung và mức chi từ ngân sách nhà nước để thực hiện hoạt động sáng kiến trên địa bàn tỉnh Đồng Tháp.\n2. Nguồn kinh phí\nThực hiện theo quy định tại Điều 2 của Thông tư số 03/2019/TT-BTC ngày 15 tháng 01 năm 2019 của Bộ Tài chính quy\nđịnh về nguồn kinh phí, nội dung và mức chi từ ngân sách nhà nước để thực hiện hoạt động sáng kiến.\nĐiều 28.\nTrách nhiệm của các cơ quan liên quan 1. Sở Khoa học và Công nghệ có\ntrách nhiệm a) Triển khai tổ chức, hướng dẫn thực hiện các hoạt động xét công nhận sáng kiến;\nb) Chủ trì phối hợp các đơn vị\nliên quan tham mưu Ủy ban nhân dân Tỉnh thực hiện việc xét các yêu cầu công nhận phạm vi ảnh hưởng, hiệu quả áp dụng của sáng kiến phạm vi toàn Tỉnh.\nc) Tiến hành các biện pháp cần thiết nhằm phổ biến sáng kiến, khuyến khích phong trào thi đua lao động sáng tạo tại địa phương theo quy định tại Điều 14 và Điều 15 của Điều lệ Sáng kiến.\nd) Xem xét, quyết định chấp thuận sáng kiến được tạo ra do Nhà nước đầu tư kinh phí, phương tiện vật chất, kỹ thuật mà tác giả là người đứng đầu cơ sở được yêu cầu công nhận sáng kiến theo quy định tại Điểm b Khoản 4 Điều 7 của Điều lệ Sáng kiến;\nđ) Tư vấn, hỗ trợ cung cấp thông tin cho các tác giả sáng kiến trong việc tạo ra, hoàn thiện sáng kiến và\nkhai thác sáng kiến trên cơ sở đề nghị của tác giả sáng kiến; hướng dẫn tác giả\ntiến hành thủ tục đăng ký xác lập quyền sở hữu công nghiệp đối với các giải pháp có khả năng được bảo hộ quyền sở hữu công nghiệp;\ne) Định kỳ hàng năm tổng hợp,\nbáo cáo Bộ Khoa học và Công nghệ (qua Cục Sở hữu trí tuệ) và Ủy ban nhân dân Tỉnh về tình hình công nhận, phổ biến và áp dụng sáng kiến tại địa phương theo quy định.\n2. Sở Nội vụ\na) Chủ trì hướng dẫn thực hiện chi tiết việc khen thưởng, xét tặng danh hiệu thi đua trên cơ sở các sáng kiến\nđã được công nhận phạm vi ảnh hưởng, hiệu quả áp dụng.\nb) Phối hợp Sở Khoa học và Công nghệ và các Sở, ban, ngành liên quan hướng dẫn việc xét, khen thưởng đối với các tác giả có sáng kiến mang lại hiệu quả, nâng cao năng suất lao động của cơ\nquan, đơn vị trong tỉnh phù hợp với quy định của Điều lệ Sáng kiến.\nb) Phối hợp Sở Khoa học và Công nghệ và các Sở, ngành liên quan hướng dẫn việc xét, công nhận phạm vi ảnh hưởng,\nhiệu quả áp dụng của sáng kiến để làm cơ sở xét, tặng danh hiệu thi đua, hình thức khen thưởng theo quy định của pháp Luật Thi đua, khen thưởng hiện hành.\n3. Liên đoàn Lao động Tỉnh,\nLiên hiệp các Hội Khoa học và Kỹ thuật Tỉnh, Tỉnh đoàn a) Tuyên truyền, phổ biến và tổ\nchức thực hiện các quy định của pháp luật về sáng kiến gắn với phong trào lao động sáng tạo tại địa phương;\nb) Tổ chức các hội thi, cuộc thi, triển lãm kết quả lao động sáng tạo để tôn vinh tổ chức, cá nhân điển hình và biểu dương các sáng kiến có thể áp dụng rộng rãi và mang lại lợi ích thiết thực cho xã hội;\nc) Định kỳ hàng năm báo cáo tình hình thực hiện Điều lệ Sáng kiến, gửi Sở Khoa học và Công nghệ để tổng hợp báo cáo Bộ Khoa học và Công nghệ trước ngày 15/12 hàng năm.\nd) Phối hợp với Sở Khoa học và\nCông nghệ tổ chức tổng kết hoạt động sáng kiến của đơn vị, địa phương theo quy\nđịnh.\n4. Sở Tài chính Có trách nhiệm phối hợp với các cơ quan đơn vị có liên quan hướng dẫn công tác quản lý, sử dụng và thanh quyết toán kinh phí cho hoạt động sáng kiến trên địa bàn tỉnh theo quy định hiện hành.\nĐiều 29. Tổ\nchức thực hiện 1. Những nội dung khác liên quan hoạt động sáng kiến mà không quy định chi tiết tại Quy định này được áp dụng theo quy định tại Nghị định số 13/2012/NĐ-CP ngày 02 tháng 3 năm 2012 của Chính phủ ban hành Điều lệ Sáng kiến và Thông tư số 18/2013/TT-BKHCN ngày 01 tháng 8 năm 2013 của Bộ Khoa học và Công nghệ;\n2. Các tổ chức, cá nhân, các cơ\nquan, đơn vị có trách nhiệm thực hiện Quy định này. Trong quá trình thực hiện nếu có vướng mắc kịp thời phản ánh về Sở Khoa học và Công nghệ để tổng hợp, tham mưu Ủy ban nhân dân Tỉnh xem xét, quyết định sửa đổi, bổ sung cho phù hợp./."
}