{
  "url": "https://thuvienphapluat.vn/van-ban/Tien-te-Ngan-hang/Van-ban-hop-nhat-14-VBHN-NHNN-2023-Nghi-dinh-xu-phat-hanh-chinh-linh-vuc-tien-te-ngan-hang-572015.aspx",
  "title": "Văn bản hợp nhất 14/VBHN-NHNN 2023 Nghị định xử phạt hành chính lĩnh vực tiền tệ ngân hàng",
  "properties": {
    "Số hiệu": "14/VBHN-NHNN",
    "Loại văn bản": "Văn bản hợp nhất",
    "Nơi ban hành": "Ngân hàng Nhà nước Việt Nam",
    "Người ký": "Đoàn Thái Sơn",
    "Ngày ban hành": "22/06/2023",
    "Ngày hợp nhất": "Đã biết",
    "Ngày công báo": "Đã biết",
    "Số công báo": "Đã biết",
    "Tình trạng": "Đã biết"
  },
  "content": "NGÂN HÀNG NHÀ NƯỚC VIỆT NAM\n -------\nCỘNG HÒA XÃ HỘI CHỦ NGHĨA VIỆT NAM\n Độc lập - Tự do - Hạnh phúc\n ---------------\nSố: 14/VBHN-NHNN Hà Nội, ngày 22 tháng 6 năm 2023 NGHỊ ĐỊNH QUY\nĐỊNH VỀ XỬ PHẠT VI PHẠM HÀNH CHÍNH TRONG LĨNH VỰC TIỀN TỆ VÀ NGÂN HÀNG Nghị định số 88/2019/NĐ-CP ngày 14 tháng 11 năm 2019 của Chính phủ quy định xử phạt vi phạm hành chính trong lĩnh vực tiền tệ\nvà ngân hàng, có hiệu lực kể từ ngày 31 tháng 12 năm 2019, được sửa đổi, bổ\nsung bởi:\n1. Nghị định số 143/2021/NĐ-CP ngày 31 tháng 12 năm 2021 của Chính phủ sửa đổi, bổ sung một số điều của Nghị định số 88/2019/NĐ-CP ngày 14 tháng 11 năm 2019 quy định về xử phạt vi phạm hành chính trong lĩnh vực tiền tệ và ngân hàng, có hiệu lực kể từ ngày 01 tháng 01 năm 2022.\n2. Nghị định số 23/2023/NĐ-CP ngày 12 tháng 5 năm 2023 của Chính phủ sửa đổi, bổ sung một số điều của Nghị định số 89/2016/NĐ-CP ngày 01 tháng 7 năm 2016 của Chính phủ quy định điều kiện đối với hoạt động đại lý đổi ngoại tệ, hoạt động cung ứng dịch vụ nhận và chi, trả ngoại tệ của tổ chức kinh tế và Nghị định số 88/2019/NĐ-CP ngày 14 tháng 11 năm 2019 của Chính phủ\nquy định về xử phạt vi phạm hành chính trong lĩnh vực tiền tệ và ngân hàng, có hiệu lực kể từ ngày 01 tháng 7 năm 2023.\nCăn cứ Luật Tổ chức Chính phủ ngày 19 tháng 6 năm 2015;\nCăn cứ Luật Xử lý vi phạm hành chính ngày 20 tháng 6 năm 2012;\nCăn cứ Luật Ngân hàng Nhà nước Việt Nam ngày 16 tháng 6 năm 2010;\nCăn cứ Luật Các tổ chức tín dụng ngày 16 tháng 6 năm 2010, Luật sửa đổi, bổ sung một số điều của Luật Các tổ chức tín dụng ngày 20 tháng 11 năm 2017;\nCăn cứ Luật Bảo hiểm tiền gửi ngày 18 tháng 6 năm 2012;\nCăn cứ Luật Phòng, chống rửa tiền ngày 18 tháng 6 năm 2012;\nCăn cứ Luật Phòng, chống khủng bố ngày 12 tháng 6 năm 2013;\nCăn cứ Luật Các công cụ chuyển nhượng ngày 29 tháng 11 năm 2005;\nCăn cứ Pháp lệnh Ngoại hối ngày 13 tháng 12 năm 2005, Pháp lệnh sửa đổi, bổ sung một số điều của Pháp lệnh Ngoại hối ngày 18 tháng 3 năm 2013;\nTheo đề nghị của Thống đốc Ngân hàng Nhà nước Việt Nam;\nChính phủ ban hành Nghị định quy định xử phạt vi phạm hành chính trong lĩnh vực tiền tệ và ngân hàng[1],[2].\nChương I QUY ĐỊNH CHUNG\nĐiều 1. Phạm vi điều chỉnh 1. Nghị định này quy định các hành vi vi phạm hành chính, hình thức xử phạt, mức xử phạt, biện pháp khắc phục hậu quả, thẩm quyền xử phạt vi phạm hành chính, thẩm quyền lập biên bản vi phạm hành chính trong lĩnh vực tiền tệ và ngân hàng.\n2. Vi phạm hành chính trong lĩnh vực tiền tệ và\nngân hàng bao gồm:\na) Vi phạm quy định về quản lý và sử dụng giấy phép;\nb) Vi phạm quy định về tổ chức, quản trị, điều hành;\nc) Vi phạm quy định về cổ phần, cổ phiếu, phần vốn góp;\nd) Vi phạm quy định về huy động vốn và phí cung ứng dịch vụ;\nđ) Vi phạm quy định về cấp tín dụng, nhận ủy thác, ủy thác và hoạt động liên ngân hàng;\ne) Vi phạm quy định về hoạt động cung ứng dịch vụ\nthông tin tín dụng;\ng) Vi phạm quy định về hoạt động ngoại hối và kinh doanh vàng;\nh) Vi phạm quy định về thanh toán, quản lý tiền tệ\nvà kho quỹ;\ni) Vi phạm quy định về mua, đầu tư vào tài sản cố định và kinh doanh bất động sản của tổ chức tín dụng, chi nhánh ngân hàng nước ngoài;\nk) Vi phạm quy định về bảo đảm an toàn hoạt động của tổ chức tín dụng, chi nhánh ngân hàng nước ngoài;\nl) Vi phạm quy định về bảo hiểm tiền gửi;\nm)[3] Vi phạm quy định về phòng, chống rửa tiền; phòng, chống tài trợ khủng bố; phòng, chống tài trợ\nphổ biến vũ khí hủy diệt hàng loạt;\nn) Vi phạm quy định về chế độ thông tin, báo cáo;\no) Vi phạm quy định về cản trở việc thanh tra,\nkhông thực hiện yêu cầu của người có thẩm quyền;\np) Vi phạm quy định về mua, bán và xử lý nợ;\nq) Vi phạm quy định về an toàn công nghệ thông tin trong hoạt động ngân hàng.\nĐiều 2. Đối tượng bị xử phạt vi phạm hành chính 1. Nghị định này áp dụng đối với tổ chức, cá nhân có hành vi vi phạm hành chính trong lĩnh vực tiền tệ và ngân hàng.\n2. Tổ chức quy định tại khoản 1 Điều này gồm:\na) Tổ chức tín dụng; đơn vị phụ thuộc của tổ chức tín dụng (chi nhánh, phòng giao dịch, văn phòng đại diện, đơn vị sự nghiệp ở trong nước; chi nhánh, văn phòng đại diện, ngân hàng 100% vốn ở nước ngoài); chi nhánh ngân hàng nước ngoài; Văn phòng đại diện của tổ chức tín dụng nước ngoài,\ntổ chức nước ngoài khác có hoạt động ngân hàng;\nb) Doanh nghiệp; đơn vị phụ thuộc của doanh nghiệp\n(chi nhánh, văn phòng đại diện);\nc) Hợp tác xã, liên hiệp hợp tác xã; đơn vị trực thuộc của hợp tác xã, liên hiệp hợp tác xã (chi nhánh, văn phòng đại diện);\nd) Các tổ chức khác được thành lập, hoạt động tại Việt Nam.\nĐiều 2a. Vi phạm hành chính nhiều lần[4]\nTổ chức, cá nhân vi phạm hành chính nhiều lần thì bị\nxử phạt về từng hành vi vi phạm, trừ các hành vi vi phạm hành chính nhiều lần là tình tiết tăng nặng quy định tại Điều 5; Điều 9; Điều 10; Điều 11; Điều 12; Điều 13; Điều 14; Điều 14a; Điều 15; Điều 16; Điều 17; Điều 18; Điều 19;\nĐiều 20; Điều 21; Điều 22; các khoản 1, 3, 4, 5, 6, 7, 8 Điều 23; các khoản 1, 3, 4, 5, 6, 7, 8 Điều 24; Điều 25;\nĐiều 26; Điều 27; Điều 28; Điều 28a; Điều 29; Điều 30; Điều 31; Điều 32;\nĐiều 33; khoản 1 Điều 34; Điều 35; Điều 36; Điều 37;\nĐiều 38; Điều 39; Điều 40; Điều 41; Điều 42; Điều 43; Điều 44; Điều 44a;\nĐiều 45; Điều 45a; Điều 46; Điều 47; Điều 50; Điều 51 Nghị định này.\nĐiều 2b. Thời điểm chấm dứt hành vi vi phạm hành chính[5]\nThời điểm chấm dứt hành vi vi phạm để tính thời hiệu xử phạt đối với một số hành vi vi phạm tại Chương II Nghị định này được quy định như sau:\n1. Đối với hành vi vi phạm quy định về nhận tiền gửi,\ncấp tín dụng, nhận ủy thác và ủy thác, mua trái phiếu doanh nghiệp, hoạt động liên ngân hàng tại điểm a khoản 2 Điều 12; điểm b khoản 3, điểm a, b, đ, g khoản 5, điểm b khoản 6, khoản 8 Điều 14; điểm a khoản 1 Điều 15; khoản 3, điểm a, d, đ\nkhoản 4 Điều 16; khoản 5, khoản 6 Điều 17 Nghị định này,\nthời điểm chấm dứt hành vi vi phạm để tính thời hiệu xử phạt là ngày các bên hoàn thành nghĩa vụ theo thỏa thuận, hợp đồng liên quan đến hành vi vi phạm hành chính.\n2. Đối với hành vi vi phạm quy định về công bố,\nniêm yết công khai thông tin, cung cấp thông tin, tài liệu, báo cáo tại khoản 1 Điều 8; điểm a khoản 1 Điều 12; điểm a khoản 1 Điều 13; điểm c khoản 1 Điều 14;\nđiểm c khoản 4 Điều 17; điểm d khoản 2 Điều 21; điểm a, c khoản 3 Điều 23; điểm a khoản 3 Điều 24; điểm a khoản 1 Điều 30; điểm a khoản 1 Điều 38; điểm a, b, d khoản 1, khoản 2, điểm a,\nb, c khoản 4, khoản 5, khoản 6 Điều 47 Nghị định này, thời điểm chấm dứt hành vi vi phạm để tính thời hiệu xử phạt là ngày thực hiện công bố, niêm yết công khai, cung cấp thông tin, tài liệu, báo cáo, sửa đổi, bổ sung thông tin,\ntài liệu, báo cáo.\n3. Đối với hành vi vi phạm quy định về đăng ký,\nthông báo, thực hiện thủ tục hành chính, gửi, ban hành quy định nội bộ, nội quy,\nphương án tại Điều 7; điểm b khoản 2 Điều 8;\nkhoản d, đ, e, g khoản 3 Điều 23; điểm a khoản 2 Điều 28; điểm a, b, c khoản 3 Điều 30; điểm a khoản 1 Điều 40 Nghị định này, thời điểm chấm dứt hành vi vi phạm để tính thời hiệu xử phạt là ngày thực hiện đăng ký, thông báo, thực hiện thủ tục hành chính, gửi, ban hành, sửa đổi, bổ sung quy định nội bộ, nội quy, phương án.\n4. Đối với hành vi vi phạm quy định về tỷ lệ bảo đảm an toàn, phân loại tài sản có, cam kết ngoại bảng, trích lập và sử dụng dự\nphòng để xử lý rủi ro tại Điều 35; điểm a,\nb, c khoản 1 Điều 36 Nghị định này, thời điểm chấm dứt hành vi vi phạm để\ntính thời hiệu xử phạt là ngày thực hiện đúng tỷ lệ bảo đảm an toàn, phân loại tài sản có, cam kết ngoại bảng, trích lập dự phòng rủi ro, sử dụng dự phòng để\nxử lý rủi ro theo quy định của pháp luật.\n5. Đối với hành vi vi phạm quy định về những thay đổi phải được Ngân hàng Nhà nước chấp thuận bằng văn bản tại Điều 5 Nghị định này, thời điểm chấm dứt hành vi vi phạm để tính thời hiệu xử phạt là ngày Ngân hàng Nhà nước chấp thuận bằng văn bản.\nĐiều 3. Hình thức xử phạt, mức phạt tiền, thẩm quyền phạt tiền và biện pháp khắc phục hậu quả\n1. Hình thức xử phạt chính:\na) Cảnh cáo;\nb) Phạt tiền.\n2. Hình thức xử phạt bổ sung:\na)[6] Tước quyền sử dụng giấy phép có thời hạn đối với: giấy chứng nhận đăng ký đại lý đổi ngoại tệ, giấy chứng nhận đăng ký đại lý đổi tiền của nước có chung biên giới trong thời hạn từ 01 tháng đến 03 tháng; giấy phép thu, chi ngoại tệ và hoạt động ngoại hối khác đối với hoạt động kinh doanh trò chơi điện tử có thưởng dành cho người nước ngoài,\nhoạt động kinh doanh casino trong thời hạn từ 03 tháng đến 06 tháng; giấy phép kinh doanh mua, bán vàng miếng trong thời hạn từ 06 tháng đến 9 tháng;\nb) Đình chỉ có thời hạn đối với: hoạt động ngoại hối trong thời hạn 03 tháng đến 06 tháng, nghiệp vụ ủy thác trong thời hạn từ 01 tháng đến 03 tháng, hoạt động mua, bán nợ trong thời hạn 03 tháng đến 06 tháng,\nviệc thực hiện hoạt động cung ứng dịch vụ thông tin tín dụng trong thời hạn từ\n01 tháng đến 03 tháng, việc sử dụng dịch vụ công nghệ thông tin của bên thứ ba trong thời hạn 01 tháng đến 03 tháng;\nc) Tịch thu tang vật, phương tiện được sử dụng để\nvi phạm hành chính[7], tịch thu ngoại tệ, đồng Việt Nam, tịch thu vàng.\n3. Mức phạt tiền và thẩm quyền phạt tiền:\na) Mức phạt tiền tối đa đối với hành vi vi phạm trong lĩnh vực tiền tệ và ngân hàng đối với tổ chức vi phạm là 2.000.000.000 đồng và đối với cá nhân vi phạm là 1.000.000.000 đồng;\nb) Mức phạt tiền quy định tại Chương II Nghị định này là mức phạt tiền áp dụng đối với cá nhân; mức phạt tiền đối với tổ chức có\ncùng một hành vi vi phạm hành chính bằng 02 lần mức phạt tiền đối với cá nhân;\nc) Mức phạt tiền đối với hành vi vi phạm của cá nhân là người làm việc tại quỹ tín dụng nhân dân, tổ chức tài chính vi mô bằng 10% mức phạt tiền quy định tại Chương II Nghị định này; mức phạt tiền đối với quỹ tín dụng nhân dân, tổ chức tài chính vi mô, đơn vị phụ thuộc của các tổ chức này bằng 02 lần mức phạt tiền đối với cá nhân là người làm việc tại quỹ tín dụng nhân dân,\ntổ chức tài chính vi mô;\nd) Thẩm quyền phạt tiền của từng chức danh quy định tại Chương III Nghị định này là thẩm quyền phạt tiền áp dụng đối với cá nhân.\nThẩm quyền phạt tiền áp dụng đối với tổ chức bằng 02 lần thẩm quyền phạt tiền\náp dụng đối với cá nhân.\n4. Biện pháp khắc phục hậu quả:\nTùy theo tính chất, mức độ vi phạm, tổ chức, cá\nnhân có hành vi vi phạm hành chính trong lĩnh vực tiền tệ và ngân hàng có thể bị\náp dụng một hoặc một số biện pháp khắc phục hậu quả sau đây theo quy định cụ thể\ntại Chương II Nghị định này:\na)[8] Buộc nộp vào ngân sách nhà nước số lợi bất hợp pháp có được do thực hiện hành vi vi phạm; buộc hoàn trả các loại phí đã thu sai cho tổ chức, cá nhân nộp phí; buộc hoàn trả số\ntiền đã chiếm đoạt cho khách hàng; buộc thu hồi nợ; buộc thu hồi số vốn sử dụng không đúng quy định; buộc thu hồi phần số dư cấp tín dụng vượt mức hạn chế, giới hạn; buộc nộp lại giấy phép đã bị tẩy xóa, sửa chữa;\nb) Buộc thoái vốn tại công ty con, công ty liên kết;\nbuộc bán số cổ phần vượt tỷ lệ theo quy định; buộc chuyển nhượng cổ phần, phần vốn góp; buộc khôi phục lại số cổ phần đã chuyển nhượng;\nc) Buộc trích lập các quỹ đúng quy định của pháp luật;\nbuộc thực hiện đúng tỷ lệ bảo đảm an toàn trong thời hạn tối đa 06 tháng; buộc phân loại tài sản có, trích lập dự phòng rủi ro; buộc hoàn nhập số tiền dự\nphòng rủi ro đã sử dụng không đúng quy định, chuyển khoản nợ đã xử lý bằng dự\nphòng rủi ro hạch toán nội bảng theo quy định của pháp luật; buộc hủy bỏ ngay quy định nội bộ không đúng quy định của pháp luật; buộc thực hiện đúng quy định của pháp luật về an toàn công nghệ thông tin trong hoạt động ngân hàng; buộc duy trì đủ các điều kiện để cấp giấy chứng nhận đủ điều kiện hoạt động cung ứng dịch vụ thông tin tín dụng;\nd) Buộc hoàn trả/thu hồi tài sản ủy thác cho bên ủy thác; buộc hoàn trả ngay số phí bảo hiểm đã thu, thu hồi ngay số tiền bảo hiểm\nđã trả; buộc khôi phục nguyên trạng khoản nợ về trước thời điểm thực hiện hoạt\nđộng mua, bán nợ;\nđ) Buộc thực hiện ngay việc đính chính thông tin sai lệch; buộc gửi lại báo cáo đầy đủ, chính xác; buộc nộp ngay số phí bảo hiểm bị thiếu;\ne) Buộc đóng dấu, bấm lỗ tiền giả;\ng) Buộc tiêu hủy toàn bộ tang vật, phương tiện được sử dụng để thực hiện hành vi vi phạm;\nh) Buộc duy trì tỷ lệ giá trị tài sản cố định phục vụ trực tiếp cho hoạt động so với vốn điều lệ, vốn được cấp và quỹ dự trữ bổ\nsung vốn điều lệ, vốn được cấp theo đúng quy định;\ni) Buộc niêm yết công khai ngay bản sao chứng nhận tham gia bảo hiểm tiền gửi; buộc thực hiện thủ tục chấp thuận niêm yết cổ phiếu trên thị trường chứng khoán nước ngoài hoặc dừng hoạt động niêm yết cổ phiếu trên thị trường chứng khoán nước ngoài đối với hành vi vi phạm;\nk) Không cho mở rộng phạm vi, quy mô và địa bàn hoạt\nđộng trong thời gian chưa khắc phục xong vi phạm;\nl) Chưa cho chia cổ tức đối với hành vi vi phạm;\nm)[9] Không được ký hợp\nđồng thanh toán thẻ với các tổ chức thanh toán thẻ khác; không được ký hợp đồng\nđại lý thanh toán với các bên giao đại lý thanh toán khác;\nn)[10] Đề nghị hoặc yêu cầu cấp có thẩm quyền xem xét, áp dụng biện pháp: thu hồi giấy phép; thu hồi giấy chứng nhận đăng ký đại lý đổi ngoại tệ;\nthu hồi giấy chứng nhận đăng ký đại lý đổi tiền của nước có chung biên giới; thu hồi giấy phép mở và sử dụng tài khoản ngoại tệ ở nước ngoài; thu hồi giấy phép kinh doanh mua, bán vàng miếng; thu hồi văn bản chấp thuận hoạt động cung ứng dịch vụ thanh toán không qua tài khoản thanh toán của khách hàng; thu hồi giấy phép hoạt động cung ứng dịch vụ trung gian thanh toán; đình chỉ hoặc miễn nhiệm chức danh quản trị, điều hành, kiểm soát;\nkhông cho đảm nhiệm chức vụ quản trị, điều hành, kiểm soát tại các tổ chức tín dụng, chi nhánh ngân hàng nước ngoài đối với cá nhân vi phạm và/hoặc cá nhân chịu trách nhiệm đối với hành vi vi phạm, yêu cầu tổ chức tín dụng, chi nhánh ngân hàng nước ngoài cách chức và thực hiện các biện pháp xử lý khác theo quy định của pháp luật đối với cá nhân vi phạm thuộc thẩm quyền của tổ chức tín dụng, chi nhánh ngân hàng nước ngoài;\no) Thay thế các đối tượng được bầu, bổ nhiệm hoặc đề\nnghị cấp có thẩm quyền ra quyết định miễn nhiệm các đối tượng được bầu, bổ nhiệm vi phạm quy định.\np)[11] Buộc chấm dứt hoạt động đại lý thanh toán; buộc tách biệt tài khoản thanh toán chỉ sử dụng cho hoạt động đại lý thanh toán;\nq)[12] Buộc thực hiện các quy định về nhận biết, cập nhật, xác minh thông tin nhận biết khách hàng;\nbuộc ban hành quy định nội bộ đúng quy định pháp luật; buộc thực hiện đúng quy\nđịnh pháp luật về quan hệ ngân hàng đại lý, các giao dịch liên quan tới công nghệ mới, giám sát đặc biệt một số giao dịch, đánh giá rủi ro.\nĐiều 3a. Thi hành biện pháp khắc phục hậu quả[13]\nViệc thi hành một số biện pháp khắc phục hậu quả\ntrong lĩnh vực tiền tệ, ngân hàng như sau:\n1.[14]\nĐối với biện pháp khắc phục hậu quả là đề nghị cấp có\nthẩm quyền xem xét, áp dụng biện pháp: thu hồi giấy phép; thu hồi giấy chứng nhận\nđăng ký đại lý đổi ngoại tệ; thu hồi giấy chứng nhận đăng ký đại lý đổi tiền của nước có chung biên giới; thu hồi giấy phép mở\nvà sử dụng tài khoản ngoại tệ ở nước ngoài; thu hồi giấy phép kinh doanh mua,\nbán vàng miếng; thu hồi văn bản chấp thuận hoạt động cung ứng dịch vụ thanh toán không qua tài khoản thanh toán của khách hàng; thu hồi giấy phép hoạt động cung ứng dịch vụ trung gian thanh toán.\nTrong thời hạn 03 ngày làm việc kể từ ngày ban hành quyết định xử phạt vi phạm hành chính, người ra quyết định xử phạt vi phạm hành chính có trách nhiệm gửi văn bản đề nghị cấp có\nthẩm quyền xem xét, áp dụng biện pháp khắc phục hậu quả này.\n2. Đối với biện pháp khắc phục hậu quả là đề nghị\nhoặc yêu cầu cấp có thẩm quyền xem xét, áp dụng biện pháp: đình chỉ hoặc miễn nhiệm chức danh quản trị, điều hành, kiểm soát; không cho đảm nhiệm chức vụ quản trị, điều hành, kiểm soát tại các tổ chức tín dụng, chi nhánh ngân hàng nước ngoài đối với cá nhân vi phạm và/hoặc cá nhân chịu trách nhiệm đối với hành vi vi phạm Trong thời hạn 03 ngày làm việc kể từ ngày ban hành quyết định xử phạt vi phạm hành chính, người ra quyết định xử phạt vi phạm hành chính có trách nhiệm gửi văn bản đề nghị hoặc yêu cầu cấp có thẩm quyền xem xét, áp dụng biện pháp khắc phục hậu quả này.\n3. Đối với biện pháp khắc phục hậu quả là buộc nộp lại giấy phép bị tẩy xóa, sửa chữa: căn cứ quyết định xử phạt vi phạm hành chính, đối tượng bị xử phạt vi phạm hành chính có trách nhiệm nộp lại giấy phép bị tẩy xóa, sửa chữa tới cơ quan có thẩm quyền cấp giấy phép.\nChương II HÀNH VI VI PHẠM HÀNH CHÍNH, HÌNH THỨC XỬ PHẠT VÀ MỨC PHẠT TIỀN Mục 1. VI PHẠM QUY ĐỊNH VỀ QUẢN LÝ VÀ SỬ DỤNG GIẤY PHÉP\nĐiều 4. Vi phạm quy định về giấy phép do Ngân hàng Nhà nước cấp 1. Phạt tiền từ 20.000.000 đồng đến 40.000.000 đồng\nđối với hành vi sử dụng tên tổ chức ghi trên các tài liệu, giấy tờ trong hoạt động không đúng tên tổ chức ghi trong giấy phép.\n2. Phạt tiền từ 40.000.000 đồng đến 50.000.000 đồng\nđối với hành vi không đảm bảo đủ các điều kiện quy định về điều kiện khai trương hoạt động quy định tại khoản 2 Điều 26 Luật Các tổ chức tín dụng.\n3. Phạt tiền từ 100.000.000 đồng đến 150.000.000 đồng\nđối với một trong các hành vi vi phạm sau đây:\na) Cho mượn, cho thuê, mua, bán, chuyển nhượng giấy phép;\nb) Tẩy xóa, sửa chữa giấy phép làm thay đổi nội dung giấy phép mà chưa đến mức bị truy cứu trách nhiệm hình sự, trừ trường hợp quy định tại điểm b khoản 4 Điều 27 Nghị định này.\n4. Phạt tiền từ 150.000.000 đồng đến 200.000.000 đồng\nđối với một trong các hành vi vi phạm sau đây:\na) Gian lận[15] các giấy tờ chứng minh đủ điều kiện để được cấp giấy phép trong hồ sơ đề nghị cấp giấy phép mà chưa đến mức bị truy cứu trách nhiệm hình sự, trừ trường hợp quy định tại khoản 2 Điều 18, điểm a khoản 4 Điều 27 Nghị\nđịnh này;\nb) Hoạt động không đúng nội dung ghi trong giấy phép, trừ trường hợp quy định tại khoản 6 Điều 17, điểm o khoản 4, điểm c khoản 8 Điều 23, điểm c khoản 5, khoản 6 Điều 24, điểm c khoản 4 Điều 27 Nghị định này.\n5. Phạt tiền từ 300.000.000 đồng đến 400.000.000 đồng\nđối với hành vi vẫn tiếp tục hoạt động sau khi đã bị cơ quan có thẩm quyền áp dụng biện pháp hạn chế, đình chỉ, tạm đình chỉ theo quy định tại điểm c khoản 2 Điều 59 Luật Ngân hàng Nhà nước Việt Nam.\n6.[16] Phạt tiền từ\n400.000.000 đồng đến 500.000.000 đồng đối với một trong các hành vi vi phạm sau\nđây:\na) Hoạt động không có giấy phép trừ trường hợp quy\nđịnh tại điểm c khoản 8 Điều 23, khoản 8 Điều 24, khoản 5 Điều 27 Nghị định này;\nb) Vi phạm quy định về sử dụng thuật ngữ liên quan\nđến hoạt động ngân hàng theo quy định tại Điều 5 Luật Các tổ chức tín dụng.\n7.[17] (được bãi bỏ)\n8. Biện pháp khắc phục hậu quả:\na) Buộc nộp vào ngân sách nhà nước số lợi bất hợp pháp có được do thực hiện hành vi vi phạm quy định tại các khoản 3, 4, 5 và 6 Điều này;\nb) Đề nghị cấp có thẩm quyền thu hồi giấy phép đối với hành vi vi phạm tại khoản 4 và khoản 5 Điều này;\nc) Đề nghị hoặc yêu cầu cấp có thẩm quyền xem xét,\náp dụng biện pháp đình chỉ từ 01 tháng đến 03 tháng hoặc miễn nhiệm chức danh quản trị, điều hành, kiểm soát; không cho đảm nhiệm chức vụ quản trị, điều hành, kiểm soát tại các tổ chức tín dụng, chi nhánh ngân hàng nước ngoài đối với cá nhân vi phạm và/hoặc cá nhân chịu trách nhiệm đối với hành vi vi phạm quy định tại các khoản 3, 4, 5 và 6 Điều này.\nYêu cầu tổ chức tín dụng, chi nhánh ngân hàng nước ngoài cách chức và thực hiện các biện pháp xử lý khác theo quy định của pháp luật\nđối với cá nhân vi phạm thuộc thẩm quyền của tổ chức tín dụng, chi nhánh ngân hàng nước ngoài.\nd)[18] Buộc nộp lại giấy phép bị tẩy xóa, sửa chữa đối với hành vi vi phạm quy định tại điểm b khoản 3 Điều này.\nĐiều 5. Vi phạm quy định về những thay đổi phải được Ngân hàng Nhà nước chấp thuận bằng văn bản 1.[19] (được bãi bỏ)\n2. Phạt tiền từ 50.000.000 đồng đến 100.000.000 đồng\nđối với việc thực hiện một trong các hành vi sau đây khi chưa được Ngân hàng Nhà nước chấp thuận bằng văn bản:\na) Thay đổi tên của tổ chức tín dụng, chi nhánh ngân hàng nước ngoài;\nb) Tạm ngừng hoạt động kinh doanh từ 05 ngày làm việc trở lên, trừ trường hợp tạm ngừng hoạt động do sự kiện bất khả kháng;\nc)[20] Thành lập chi nhánh, phòng giao dịch ở trong nước; thành lập văn phòng đại diện, đơn vị sự\nnghiệp ở trong nước; chi nhánh, văn phòng đại diện, ngân hàng 100% vốn ở nước ngoài của tổ chức tín dụng; khai trương hoạt động chi nhánh, phòng giao dịch ở\ntrong nước, phòng giao dịch bưu điện.\n3. Phạt tiền từ 100.000.000 đồng đến 150.000.000 đồng\nđối với hành vi mua bán, chuyển nhượng phần vốn góp của chủ sở hữu; mua bán,\nchuyển nhượng phần vốn góp của thành viên góp vốn; mua bán, chuyển nhượng cổ phần của cổ đông lớn; mua bán, chuyển nhượng cổ phần dẫn đến cổ đông lớn trở thành cổ\nđông thường và ngược lại khi chưa được Ngân hàng Nhà nước chấp thuận bằng văn bản.\n4. Phạt tiền từ 150.000.000 đồng đến 200.000.000 đồng\nđối với hành vi thay đổi mức vốn điều lệ, mức vốn được cấp khi chưa được Ngân hàng Nhà nước chấp thuận bằng văn bản.\n5. Phạt tiền từ 200.000.000 đồng đến 250.000.000 đồng\nđối với việc thực hiện một trong các hành vi sau đây khi chưa được Ngân hàng Nhà nước chấp thuận bằng văn bản:\na) Thay đổi địa điểm đặt trụ sở chính, chi nhánh của tổ chức tín dụng, địa điểm đặt trụ sở của chi nhánh ngân hàng nước ngoài;\nb) Niêm yết cổ phiếu trên thị trường chứng khoán nước ngoài.\nc)[21] Thay đổi chi nhánh quản lý phòng giao dịch của tổ chức tín dụng;\nd)[22] Tự nguyện chấm dứt hoạt động của chi nhánh, phòng giao dịch của tổ chức tín dụng;\nđ)[23] Thực hiện nội dung hoạt động, hoạt động nghiệp vụ ngân hàng.\n6. Phạt tiền từ 250.000.000 đồng đến 300.000.000 đồng\nđối với việc thực hiện một trong các hành vi sau đây khi chưa được Ngân hàng Nhà nước chấp thuận bằng văn bản:\na) Thành lập, mua lại công ty con, công ty liên kết theo quy định tại khoản 2, khoản 3 Điều 103 và khoản 3 Điều 110 Luật Các tổ chức tín dụng;\nb) Góp vốn, mua cổ phần, chuyển nhượng phần vốn góp, mua lại phần vốn góp của tổ chức tín dụng theo quy định tại Điều 71, điểm b khoản 4 Điều 103 Luật Các tổ chức tín dụng;\nc) Tham gia hệ thống thanh toán quốc tế;\nd) Mua lại cổ phần của cổ đông mà sau khi thanh toán hết số cổ phần mua lại dẫn đến việc giảm vốn điều lệ theo quy định tại Điều 57 Luật Các tổ chức tín dụng.\nđ)[24] Cung ứng dịch vụ thanh toán không dùng tiền mặt không qua tài khoản thanh toán của khách hàng.\n7. Phạt tiền từ 400.000.000 đồng đến 500.000.000 đồng\nđối với hành vi chia, tách, hợp nhất, sáp nhập, chuyển đổi hình thức pháp lý tổ\nchức tín dụng, chi nhánh ngân hàng nước ngoài mà chưa được cấp có thẩm quyền chấp thuận bằng văn bản.\n8. Biện pháp khắc phục hậu quả:\na) Chưa cho chia cổ tức đối với hành vi vi phạm quy\nđịnh tại điểm d khoản 6 Điều này cho đến khi khôi phục lại vốn điều lệ;\nb) Buộc thoái vốn tại công ty con, công ty liên kết\nđối với hành vi vi phạm quy định tại các điểm a, b khoản 6 Điều này;\nc) Buộc thực hiện thủ tục chấp thuận niêm yết cổ\nphiếu trên thị trường chứng khoán nước ngoài trong thời hạn từ 01 tháng đến 03 tháng hoặc dừng hoạt động niêm yết cổ phiếu trên thị trường chứng khoán nước ngoài đối với hành vi vi phạm quy định tại điểm b khoản 5 Điều này;\nd) Đề nghị hoặc yêu cầu cấp có thẩm quyền xem xét,\náp dụng biện pháp đình chỉ từ 01 tháng đến 03 tháng hoặc miễn nhiệm chức danh quản trị, điều hành, kiểm soát; không cho đảm nhiệm chức vụ quản trị, điều hành, kiểm soát tại các tổ chức tín dụng, chi nhánh ngân hàng nước ngoài đối với cá nhân vi phạm và/hoặc cá nhân chịu trách nhiệm đối với hành vi vi phạm quy định tại khoản 3, khoản 5, các điểm b, d khoản 6 Điều này.\nYêu cầu tổ chức tín dụng, chi nhánh ngân hàng nước ngoài cách chức và thực hiện các biện pháp xử lý khác theo quy định của pháp luật\nđối với cá nhân vi phạm thuộc thẩm quyền của tổ chức tín dụng, chi nhánh ngân hàng nước ngoài.\nMục 2. VI PHẠM QUY ĐỊNH VỀ TỔ\nCHỨC, QUẢN TRỊ, ĐIỀU HÀNH\nĐiều 6. Vi phạm quy định về tổ\nchức, quản trị, điều hành 1. Phạt tiền từ 20.000.000 đồng đến 30.000.000 đồng\nđối với một trong các hành vi vi phạm sau đây:\na) Vi phạm quy định về Hội đồng quản trị, Hội đồng thành viên, Ban kiểm soát quy định tại Điều 43, Điều 44, Điều 62, khoản 1 Điều 70, Điều 81, Điều 84 Luật Các tổ chức tín dụng;\nb) Không duy trì việc đảm bảo đầy đủ các điều kiện,\ntiêu chuẩn đối với thành viên Hội đồng quản trị, Ban kiểm soát, Tổng giám đốc\n(Giám đốc) theo quy định của Luật Các tổ chức tín dụng;\nc) Không tổ chức hoặc tổ chức Đại hội đồng cổ đông,\nĐại hội thành viên không đúng quy định.\n2. Phạt tiền từ 30.000.000 đồng đến 50.000.000 đồng\nđối với hành vi bầu, bổ nhiệm những người không được cùng đảm nhiệm chức vụ quy\nđịnh tại Điều 34 và khoản 3 Điều 83 Luật Các tổ chức tín dụng.\n3. Phạt tiền từ 100.000.000 đồng đến 150.000.000 đồng\nđối với một trong các hành vi vi phạm sau đây:\na) Bầu, bổ nhiệm những người không được đảm nhiệm chức vụ quy định tại các khoản 2, 3 Điều 33 Luật Các tổ chức tín dụng;\nb) Bầu, bổ nhiệm những chức danh quy định tại khoản 5 Điều 50, khoản 2 Điều 75 Luật Các tổ chức tín dụng không đủ tiêu chuẩn, điều kiện theo quy định của pháp luật.\n4. Phạt tiền từ 150.000.000 đồng đến 200.000.000 đồng\nđối với hành vi bầu, bổ nhiệm những chức danh không đủ tiêu chuẩn, điều kiện quy định tại các khoản 1, 2, 3 và 4 Điều 50 Luật Các tổ chức tín dụng.\n5. Phạt tiền từ 200.000.000 đồng đến 250.000.000 đồng\nđối với một trong các hành vi vi phạm sau đây:\na) Bầu, bổ nhiệm những trường hợp không được đảm nhiệm chức vụ quy định tại khoản 1 Điều 33 Luật Các tổ chức tín dụng;\nb) Bầu, bổ nhiệm nhân sự không thuộc danh sách nhân sự dự kiến đã được Ngân hàng Nhà nước chấp thuận.\n6. Biện pháp khắc phục hậu quả:\nThay thế các đối tượng được bầu, bổ nhiệm hoặc đề\nnghị cấp có thẩm quyền ra quyết định miễn nhiệm các đối tượng được bầu, bổ nhiệm vi phạm quy định tại các khoản 2, 3, 4 và 5 Điều này.\nĐiều 7. Vi phạm quy định về ban hành điều lệ, quy định nội bộ\n1. Phạt tiền từ 10.000.000 đồng đến 20.000.000 đồng\nđối với một trong các hành vi vi phạm sau đây:\na) Không gửi Ngân hàng Nhà nước một hoặc một số các văn bản quy định nội bộ theo quy định của pháp luật, trừ trường hợp quy định tại\nĐiều 40 Nghị định này;\nb) Không gửi Ngân hàng Nhà nước điều lệ, điều lệ được sửa đổi, bổ sung của tổ chức tín dụng theo quy định tại khoản 3 Điều 31 Luật Các tổ chức tín dụng;\nc) Ban hành quy định nội bộ có nội dung không đầy đủ\ntheo quy định của pháp luật.\n2. Phạt tiền từ 40.000.000 đồng đến 80.000.000 đồng\nđối với một trong các hành vi vi phạm sau đây:\na) Không ban hành một hoặc một số các quy định nội bộ theo quy định của pháp luật;\nb) Ban hành quy định nội bộ có nội dung không đúng quy định của pháp luật.\n3. Biện pháp khắc phục hậu quả:\nBuộc hủy bỏ ngay quy định nội bộ không đúng quy định của pháp luật đối với hành vi vi phạm quy định tại điểm b khoản 2 Điều này.\nĐiều 8. Vi phạm quy định về hệ\nthống kiểm soát nội bộ, kiểm toán độc lập 1. Phạt tiền từ 20.000.000 đồng đến 30.000.000 đồng\nđối với hành vi không báo cáo kết quả kiểm toán nội bộ, kiểm toán độc lập, báo cáo về hệ thống kiểm soát nội bộ theo quy định của pháp luật.\n2. Phạt tiền từ 30.000.000 đồng đến 50.000.000 đồng\nđối với một trong các hành vi vi phạm sau đây:\na) Không lựa chọn tổ chức kiểm toán độc lập theo quy định tại khoản 1 Điều 42 Luật Các tổ chức tín dụng;\nb) Không thông báo cho Ngân hàng Nhà nước về tổ chức kiểm toán độc lập được lựa chọn trong thời hạn 30 ngày theo quy định tại khoản 2 Điều 42 Luật Các tổ chức tín dụng.\n3. Phạt tiền từ 80.000.000 đồng đến 100.000.000 đồng\nđối với một trong các hành vi vi phạm sau đây:\na) Kiểm toán nội bộ không thực hiện những nội dung quy định tại khoản 2 Điều 41 Luật Các tổ chức tín dụng và các quy định pháp luật;\nb) Không thực hiện kiểm toán độc lập theo quy định tại khoản 1 Điều 42 Luật Các tổ chức tín dụng và quy định pháp luật, không thực hiện kiểm toán độc lập lại trong trường hợp báo cáo kiểm toán có ý kiến ngoại trừ của tổ chức kiểm toán độc lập theo quy định tại khoản 3 Điều 42 Luật Các tổ\nchức tín dụng và quy định của pháp luật;\nc) Không thực hiện giám sát của quản lý cấp cao, kiểm soát nội bộ, quản lý rủi ro, đánh giá nội bộ về mức đủ vốn theo quy định của pháp luật.\n4. Phạt tiền từ 100.000.000 đồng đến 150.000.000 đồng\nđối với hành vi không thành lập kiểm toán nội bộ chuyên trách thuộc Ban kiểm soát.\n5. Phạt tiền từ 200.000.000 đồng đến 250.000.000 đồng\nđối với hành vi không xây dựng hệ thống kiểm soát nội bộ theo quy định tại khoản 1, khoản 2 Điều 40 Luật Các tổ chức tín dụng.\nMục 3. VI PHẠM QUY ĐỊNH VỀ CỔ\nPHẦN, CỔ PHIẾU, PHẦN VỐN GÓP\nĐiều 9. Vi phạm quy định về cổ\nphần, cổ phiếu và giới hạn góp vốn, chuyển nhượng, hoàn trả phần vốn góp 1. Phạt tiền từ 50.000.000 đồng đến 100.000.000 đồng\nđối với một trong các hành vi vi phạm sau đây:\na) Không phát hành cổ phiếu đối với trường hợp cổ\nphiếu được phát hành dưới hình thức chứng chỉ trong thời hạn 30 ngày, kể từ\nngày khai trương hoạt động đối với tổ chức tín dụng thành lập mới hoặc trong thời hạn 30 ngày, kể từ ngày cổ đông thanh toán đủ cổ phần cam kết mua đối với tổ chức tín dụng tăng vốn điều lệ;\nb) Cổ đông sáng lập không nắm giữ số cổ phần tối thiểu về tỷ lệ và thời gian quy định tại khoản 5 Điều 55 Luật Các tổ chức tín dụng;\nc) Vi phạm quy định về giới hạn góp vốn, tỷ lệ sở hữu vốn góp, chuyển nhượng, hoàn trả phần vốn góp của thành viên góp vốn theo quy định của pháp luật.\n2. Phạt tiền từ 100.000.000 đồng đến 150.000.000 đồng\nđối với một trong các hành vi vi phạm sau đây:\na) Sở hữu cổ phần vượt tỷ lệ quy định tại các khoản 1, 2 và 3 Điều 55 Luật Các tổ chức tín dụng;\nb) Mua lại cổ phần của cổ đông mà sau khi thanh toán hết số cổ phần mua lại không đảm bảo các tỷ lệ an toàn trong hoạt động ngân hàng quy định tại khoản 1 Điều 130 Luật Các tổ chức tín dụng;\nc) Chuyển nhượng cổ phần không đúng quy định tại khoản 4 Điều 56 Luật Các tổ chức tín dụng.\n3. Biện pháp khắc phục hậu quả:\na) Buộc bán số cổ phần vượt tỷ lệ theo quy định trong thời hạn tối đa 06 tháng kể từ ngày quyết định xử phạt vi phạm hành chính có hiệu lực đối với hành vi vi phạm quy định tại điểm a khoản 2 Điều này;\nb) Buộc thực hiện đúng tỷ lệ bảo đảm an toàn trong thời hạn tối đa 06 tháng đối với hành vi vi phạm quy định tại điểm b khoản 2 Điều này;\nc) Chưa cho chia cổ tức đối với hành vi vi phạm quy\nđịnh tại khoản 2 Điều này cho đến khi khắc phục xong vi phạm;\nd) Đề nghị hoặc yêu cầu cấp có thẩm quyền xem xét,\náp dụng biện pháp đình chỉ từ 01 tháng đến 03 tháng hoặc miễn nhiệm chức danh quản trị, điều hành, kiểm soát; không cho đảm nhiệm chức vụ quản trị, điều hành, kiểm soát tại các tổ chức tín dụng, chi nhánh ngân hàng nước ngoài đối với cá nhân vi phạm và/hoặc cá nhân chịu trách nhiệm đối với hành vi vi phạm quy định tại khoản 2 Điều này.\nYêu cầu tổ chức tín dụng, chi nhánh ngân hàng nước ngoài cách chức và thực hiện các biện pháp xử lý khác theo quy định của pháp luật\nđối với cá nhân vi phạm thuộc thẩm quyền của tổ chức tín dụng, chi nhánh ngân hàng nước ngoài;\nđ) Buộc chuyển nhượng cổ phần đúng quy định của pháp luật đối với hành vi vi phạm quy định tại điểm c khoản 2 Điều này.\nĐiều 10. Vi phạm quy định về\ngóp vốn, mua cổ phần 1. Phạt tiền từ 100.000.000 đồng đến 150.000.000 đồng\nđối với hành vi dùng nguồn vốn khác ngoài vốn điều lệ và quỹ dự trữ để góp vốn,\nmua cổ phần không đúng quy định tại khoản 1 Điều 103, khoản 1 Điều 110 Luật Các tổ chức tín dụng.\n2. Phạt tiền từ 150.000.000 đồng đến 200.000.000 đồng\nđối với hành vi thực hiện hoạt động kinh doanh quy định tại khoản 2 Điều 103 Luật Các tổ chức tín dụng nhưng không thành lập hoặc mua lại công ty con, công ty liên kết.\n3.[25] Phạt tiền từ\n200.000.000 đồng đến 250.000.000 đồng đối với một trong các hành vi vi phạm sau\nđây:\na) Mua, nắm giữ cổ phiếu của tổ chức tín dụng khác không đúng điều kiện và vượt giới hạn quy định của Ngân hàng Nhà nước;\nb) Góp vốn, mua, nhận chuyển nhượng cổ phần của tổ\nchức tín dụng không đúng quy định tại điểm c khoản 1 Điều 54 Luật Các tổ chức tín dụng.\n4. Phạt tiền từ 250.000.000 đồng đến 300.000.000 đồng\nđối với một trong các hành vi vi phạm sau đây:\na) Vi phạm về giới hạn góp vốn, mua cổ phần quy định tại Điều 129 Luật Các tổ chức tín dụng;\nb) Vi phạm quy định về góp vốn, mua cổ phần quy định tại Điều 135 Luật Các tổ chức tín dụng.\n5. Biện pháp khắc phục hậu quả:\na) Buộc thu hồi số vốn sử dụng không đúng quy định\nđối với hành vi vi phạm quy định tại khoản 1 Điều này;\nb) Buộc chuyển nhượng phần vốn góp, cổ phần không\nđúng quy định đối với hành vi vi phạm quy định tại khoản 4 Điều này;\nc) Chưa cho chia cổ tức đối với hành vi vi phạm quy\nđịnh tại Điều này cho đến khi khắc phục xong vi phạm;\nd) Buộc nộp vào ngân sách nhà nước số lợi bất hợp pháp có được do thực hiện hành vi vi phạm quy định tại các khoản 1, 2 và 3 Điều này;\nđ) Không cho mở rộng phạm vi, quy mô và địa bàn hoạt\nđộng trong thời gian chưa khắc phục xong vi phạm đối với hành vi vi phạm quy định tại Điều này;\ne) Đề nghị hoặc yêu cầu cấp có thẩm quyền xem xét,\náp dụng biện pháp đình chỉ từ 01 tháng đến 03 tháng hoặc miễn nhiệm chức danh quản trị, điều hành, kiểm soát; không cho đảm nhiệm chức vụ quản trị, điều hành, kiểm soát tại các tổ chức tín dụng, chi nhánh ngân hàng nước ngoài đối với cá nhân vi phạm và/hoặc cá nhân chịu trách nhiệm đối với hành vi vi phạm quy định tại các khoản 1, 2, 3 và 4 Điều này.\nYêu cầu tổ chức tín dụng, chi nhánh ngân hàng nước ngoài cách chức và thực hiện các biện pháp xử lý khác theo quy định của pháp luật đối với cá nhân vi phạm thuộc thẩm quyền của tổ chức tín dụng, chi nhánh ngân hàng nước ngoài.\nĐiều 11. Vi phạm quy định về\nchào bán, chuyển nhượng cổ phần 1. Phạt tiền từ 150.000.000 đồng đến 200.000.000 đồng\nđối với hành vi chuyển nhượng cổ phần trong thời gian đảm nhiệm chức vụ quy định tại khoản 1 Điều 56 Luật Các tổ chức tín dụng.\n2. Phạt tiền từ 250.000.000 đồng đến 300.000.000 đồng\nđối với hành vi chuyển nhượng cổ phần trong thời gian xử lý hậu quả theo nghị\nquyết của Đại hội đồng cổ đông hoặc theo quyết định của Ngân hàng Nhà nước do trách nhiệm cá nhân thành viên Hội đồng quản trị, thành viên Ban kiểm soát, Tổng giám đốc (Giám đốc) trừ một trong các trường hợp quy định tại các điểm a, b và\nc khoản 2 Điều 56 Luật Các tổ chức tín dụng.\n3. Biện pháp khắc phục hậu quả:\na) Buộc khôi phục lại số cổ phần đã chuyển nhượng quy định tại Điều này trong thời gian tối đa 06 tháng kể từ ngày quyết định xử\nphạt vi phạm hành chính có hiệu lực;\nb) Đề nghị hoặc yêu cầu cấp có thẩm quyền xem xét,\náp dụng biện pháp đình chỉ từ 01 tháng đến 03 tháng hoặc miễn nhiệm chức danh quản trị, điều hành, kiểm soát; không cho đảm nhiệm chức vụ quản trị, điều hành, kiểm soát tại các tổ chức tín dụng, chi nhánh ngân hàng nước ngoài đối với cá nhân vi phạm và/hoặc cá nhân chịu trách nhiệm đối với hành vi vi phạm quy định tại Điều này.\nYêu cầu tổ chức tín dụng, chi nhánh ngân hàng nước ngoài cách chức và thực hiện các biện pháp xử lý khác theo quy định của pháp luật\nđối với cá nhân vi phạm thuộc thẩm quyền của tổ chức tín dụng, chi nhánh ngân hàng nước ngoài.\nMục 4. VI PHẠM QUY ĐỊNH VỀ HUY\nĐỘNG VỐN VÀ PHÍ CUNG ỨNG DỊCH VỤ\nĐiều 12. Vi phạm quy định về\nnhận tiền gửi 1. Phạt tiền từ 20.000.000 đồng đến 40.000.000 đồng\nđối với một trong các hành vi vi phạm sau đây:\na) Không công bố hoặc không niêm yết công khai các nội dung phải công bố hoặc niêm yết công khai về nhận tiền gửi và phát hành giấy tờ có giá theo quy định của pháp luật;\nb) Thực hiện nhận tiền gửi hoặc phát hành giấy tờ\ncó giá không đúng với nội dung đã công bố hoặc niêm yết công khai;\nc) Nhận tiền gửi, chi trả tiền gửi không đúng thủ tục theo quy định của pháp luật.\n2. Phạt tiền từ 100.000.000 đồng đến 150.000.000 đồng\nđối với một trong các hành vi vi phạm sau đây:\na) Nhận tiền gửi, phát hành giấy tờ có giá không\nđúng đối tượng được gửi tiền, đối tượng mua giấy tờ có giá theo quy định của pháp luật;\nb) Nhận tiền gửi, phát hành giấy tờ có giá không\nđúng quy định của pháp luật, trừ trường hợp quy định tại khoản 1, điểm a khoản 2 Điều này.\nĐiều 13. Vi phạm quy định về\nlãi suất huy động vốn, phí cung ứng dịch vụ, kinh doanh, cung ứng sản phẩm phái sinh 1. Phạt tiền từ 10.000.000 đồng đến 20.000.000 đồng\nđối với một trong các hành vi vi phạm sau đây:\na) Không niêm yết công khai lãi suất huy động vốn,\nmức phí cung ứng dịch vụ theo quy định;\nb) Niêm yết lãi suất huy động vốn, mức phí cung ứng dịch vụ không rõ ràng, gây nhầm lẫn cho khách hàng;\nc) Thu các loại phí cung ứng dịch vụ không đúng quy\nđịnh pháp luật, trừ trường hợp quy định tại điểm a khoản 4 Điều 14, điểm m khoản 4 Điều 23 Nghị định này.\n2. Phạt tiền từ 20.000.000 đồng đến 40.000.000 đồng\nđối với hành vi áp dụng lãi suất huy động vốn, mức phí cung ứng dịch vụ cao hơn mức đã niêm yết.\n3. Phạt tiền từ 50.000.000 đồng đến 100.000.000 đồng\nđối với hành vi vi phạm quy định về lãi suất huy động vốn; kinh doanh, cung ứng sản phẩm phái sinh về lãi suất, tiền tệ, giá cả hàng hóa và tài sản tài chính khác, trừ trường hợp quy định tại khoản 1, khoản 2 Điều này và điểm a khoản 8 Điều 23 Nghị định này.\n4. Biện pháp khắc phục hậu quả:\na) Buộc nộp vào ngân sách nhà nước số lợi bất hợp pháp có được do thực hiện hành vi vi phạm mức phí cung ứng dịch vụ quy định tại\nĐiều này;\nb) Đề nghị hoặc yêu cầu cấp có thẩm quyền xem xét,\náp dụng biện pháp đình chỉ từ 01 tháng đến 03 tháng hoặc miễn nhiệm chức danh quản trị, điều hành, kiểm soát; không cho đảm nhiệm chức vụ quản trị, điều hành, kiểm soát tại các tổ chức tín dụng, chi nhánh ngân hàng nước ngoài đối với cá nhân vi phạm và/hoặc cá nhân chịu trách nhiệm đối với hành vi vi phạm quy định tại khoản 3 Điều này.\nYêu cầu tổ chức tín dụng, chi nhánh ngân hàng nước ngoài cách chức và thực hiện các biện pháp xử lý khác theo quy định của pháp luật\nđối với cá nhân vi phạm thuộc thẩm quyền của tổ chức tín dụng, chi nhánh ngân hàng nước ngoài.\nMục 5. VI PHẠM QUY ĐỊNH VỀ CẤP TÍN DỤNG, NHẬN ỦY THÁC, ỦY THÁC VÀ HOẠT ĐỘNG LIÊN NGÂN HÀNG\nĐiều 14. Vi phạm quy định về cấp tín dụng 1. Phạt tiền từ 10.000.000 đồng đến 15.000.000 đồng\nđối với một trong các hành vi vi phạm sau đây:\na) Lưu giữ hồ sơ cấp tín dụng không đúng quy định của pháp luật;\nb) Phát hành cam kết bảo lãnh không theo hình thức mẫu do tổ chức tín dụng, chi nhánh ngân hàng nước ngoài thiết kế;\nc) Không niêm yết công khai thông tin, không cung cấp\nđầy đủ thông tin, tài liệu cho khách hàng theo quy định của pháp luật.\nd)[26] Hành vi tiếp nhận và xử lý khiếu nại của khách hàng không đúng quy định của pháp luật về cho vay tiêu dùng của công ty tài chính;\nđ)[27] Không tổ chức tập huấn, đào tạo nghiệp vụ cho nhân viên theo quy định của pháp luật về cho vay tiêu dùng của công ty tài chính;\ne)[28] Vi phạm quy định về mức cho vay tiêu dùng tối đa theo quy định của pháp luật về cho vay tiêu dùng của công ty tài chính;\ng)[29] Không ban hành khung lãi suất cho vay tiêu dùng trong từng thời kỳ hoặc ban hành khung lãi suất cho vay tiêu dùng không đầy đủ các nội dung theo quy định pháp luật về\ncho vay tiêu dùng của công ty tài chính.\n2.[30] Phạt tiền từ\n15.000.000 đồng đến 20.000.000 đồng đối với một trong các hành vi vi phạm sau\nđây:\na) Không kiểm tra, giám sát việc sử dụng vốn vay và\ntrả nợ của khách hàng theo quy định của pháp luật;\nb) Vi phạm quy định về biện pháp đôn đốc, thu hồi nợ\ntheo quy định của pháp luật về cho vay tiêu dùng của công ty tài chính.\n3. Phạt tiền từ 20.000.000 đồng đến 30.000.000 đồng\nđối với một trong các hành vi vi phạm sau đây:\na) Lập hợp đồng, thỏa thuận cấp tín dụng không đủ\ncác nội dung theo quy định của pháp luật;\nb)[31] Miễn, giảm lãi suất cấp tín dụng khi chưa ban hành quy định nội bộ;\nc) Chuyển nợ quá hạn, cơ cấu lại thời hạn trả nợ\nkhông đúng quy định của pháp luật;\nd) Áp dụng lãi suất cấp tín dụng không đúng quy định của pháp luật;\nđ) Thu lãi nợ quá hạn không đúng quy định của pháp luật;\ne) Thu nợ khoản vay bị quá hạn trả nợ không đúng quy\nđịnh của pháp luật.\n4. Phạt tiền từ 30.000.000 đồng đến 40.000.000 đồng\nđối với một trong các hành vi vi phạm sau đây:\na) Thu không đúng quy định của pháp luật các loại phí liên quan đến hoạt động cấp tín dụng;\nb) Sử dụng phương thức giải ngân không đúng quy định,\ntrừ trường hợp quy định tại điểm g khoản 4 Điều 23 Nghị định này.\n5. Phạt tiền từ 40.000.000 đồng đến 50.000.000 đồng\nđối với một trong các hành vi vi phạm sau đây:\na) Cấp tín dụng không có hợp đồng hoặc thỏa thuận bằng văn bản;\nb) Cấp tín dụng đối với tổ chức, cá nhân không đủ điều kiện theo quy định của pháp luật;\nc) Cấp tín dụng không có bảo đảm, cấp tín dụng với điều kiện ưu đãi cho các đối tượng quy định tại khoản 1 Điều 127 Luật Các tổ chức tín dụng;\nd) Vi phạm quy định về cấp tín dụng tại khoản 3 Điều 127 Luật Các tổ chức tín dụng;\nđ) Cho vay để đáp ứng nhu cầu vốn không được cho vay theo quy định của pháp luật;\ne) Ký thỏa thuận cấp bảo lãnh, cam kết bảo lãnh không đúng thẩm quyền theo quy định của pháp luật;\ng) Bao thanh toán đối với một hoặc một số trường hợp không được bao thanh toán theo quy định của pháp luật.\n6. Phạt tiền từ 80.000.000 đồng đến 120.000.000 đồng\nđối với một trong các hành vi vi phạm sau đây:\na) Vi phạm giới hạn cấp tín dụng quy định tại các khoản 2, 4 Điều 127, các khoản 1, 2 và 8 Điều 128 Luật Các tổ chức tín dụng;\nb) Cấp tín dụng dưới hình thức khác khi chưa được Ngân hàng Nhà nước chấp thuận;\nc) Vi phạm quy định về mức cho vay tối đa của tổ chức tín dụng khi cho vay để đầu tư ra nước ngoài.\n7. Phạt tiền từ 120.000.000 đồng đến 180.000.000 đồng\nđối với hành vi vi phạm về giới hạn và điều kiện cấp tín dụng để đầu tư, kinh doanh cổ phiếu, giới hạn và điều kiện cấp tín dụng để đầu tư, kinh doanh trái phiếu doanh nghiệp của tổ chức tín dụng, chi nhánh ngân hàng nước ngoài.\n8. Phạt tiền từ 250.000.000 đồng đến 300.000.000 đồng\nđối với hành vi cấp tín dụng đối với tổ chức, cá nhân quy định tại các khoản 1,\n3, 4, 5 và 6 Điều 126 Luật Các tổ chức tín dụng.\n9. Biện pháp khắc phục hậu quả:\na) Buộc thu hồi phần số dư cấp tín dụng vượt mức hạn chế, giới hạn trong thời hạn tối đa 06 tháng kể từ ngày quyết định xử phạt vi phạm hành chính có hiệu lực đối với hành vi vi phạm quy định tại điểm a khoản 6, khoản 7 Điều này;\nb) Buộc thu hồi nợ trong thời hạn tối đa 06 tháng kể\ntừ ngày quyết định xử phạt vi phạm hành chính có hiệu lực đối với hành vi vi phạm quy định tại các điểm b, đ khoản 5, điểm b khoản 6, khoản 8 Điều này;\nc) Buộc cổ đông lớn, cổ đông sáng lập chuyển nhượng cổ phần, vốn góp theo quy định của pháp luật trong thời hạn tối đa 06 tháng kể\ntừ ngày quyết định xử phạt vi phạm hành chính có hiệu lực đối với hành vi vi phạm quy định tại các điểm b, c, d khoản 5, điểm a khoản 6 Điều này;\nd) Đề nghị hoặc yêu cầu cấp có thẩm quyền xem xét,\náp dụng biện pháp đình chỉ từ 01 tháng đến 03 tháng hoặc miễn nhiệm chức danh quản trị, điều hành, kiểm soát; không cho đảm nhiệm chức vụ quản trị, điều hành, kiểm soát tại các tổ chức tín dụng, chi nhánh ngân hàng nước ngoài đối với cá nhân vi phạm và/hoặc cá nhân chịu trách nhiệm đối với hành vi vi phạm quy định tại khoản 5, điểm a khoản 6, khoản 7 và khoản 8 Điều này.\nYêu cầu tổ chức tín dụng, chi nhánh ngân hàng nước ngoài cách chức và thực hiện các biện pháp xử lý khác theo quy định của pháp luật\nđối với cá nhân vi phạm thuộc thẩm quyền, của tổ chức tín dụng, chi nhánh ngân hàng nước ngoài.\nĐiều 14a. Vi phạm quy định về\nđiểm giới thiệu dịch vụ[32]\nPhạt tiền từ 20.000.000 đồng đến 40.000.000 đồng đối với một trong các hành vi vi phạm sau đây:\n1. Không ký kết hợp đồng về việc mở điểm giới thiệu dịch vụ.\n2. Hợp đồng về việc mở điểm giới thiệu dịch vụ\nkhông quy định rõ trách nhiệm, quyền hạn của các bên liên quan và thời hạn hiệu lực hợp đồng.\n3. Thực hiện các hoạt động tại điểm giới thiệu dịch vụ ngoài phạm vi được phép theo quy định của pháp luật.\nĐiều 15. Vi phạm quy định về\nnhận ủy thác và ủy thác 1. Phạt tiền từ 80.000.000 đồng đến 100.000.000 đồng\nđối với một trong các hành vi vi phạm sau đây:\na) Nhận ủy thác, ủy thác không đúng đối tượng, phạm vi theo quy định của pháp luật;\nb) Lập hợp đồng ủy thác không đúng theo quy định của pháp luật.\n2. Phạt tiền từ 100.000.000 đồng đến 150.000.000 đồng\nđối với hành vi nhận ủy thác, ủy thác không tuân thủ các nguyên tắc ủy thác theo quy định của pháp luật.\n3. Hình thức xử phạt bổ sung:\nĐình chỉ nghiệp vụ ủy thác của tổ chức tín dụng,\nchi nhánh ngân hàng nước ngoài trong thời hạn từ 01 tháng đến 03 tháng đối với hành vi vi phạm quy định tại Điều này.\n4. Biện pháp khắc phục hậu quả:\na) Buộc hoàn trả/thu hồi tài sản ủy thác cho bên ủy thác đối với hành vi vi phạm quy định tại Điều này;\nb) Đề nghị hoặc yêu cầu cấp có thẩm quyền xem xét,\náp dụng biện pháp đình chỉ từ 01 tháng đến 03 tháng hoặc miễn nhiệm chức danh quản trị, điều hành, kiểm soát; không cho đảm nhiệm chức vụ quản trị, điều hành, kiểm soát tại các tổ chức tín dụng, chi nhánh ngân hàng nước ngoài đối với cá nhân vi phạm và/hoặc cá nhân chịu trách nhiệm đối với hành vi vi phạm quy định tại Điều này.\nYêu cầu tổ chức tín dụng, chi nhánh ngân hàng nước ngoài cách chức và thực hiện các biện pháp xử lý khác theo quy định của pháp luật\nđối với cá nhân vi phạm thuộc thẩm quyền của tổ chức tín dụng, chi nhánh ngân hàng nước ngoài.\nĐiều 16. Vi phạm quy định về\nmua trái phiếu doanh nghiệp 1. Phạt tiền từ 15.000.000 đồng đến 30.000.000 đồng\nđối với hành vi không giám sát việc sử dụng tiền thu từ phát hành trái phiếu của doanh nghiệp.\n2. Phạt tiền từ 30.000.000 đồng đến 40.000.000 đồng\nđối với hành vi lập hợp đồng mua trái phiếu doanh nghiệp không đủ các nội dung theo quy định của pháp luật.\n3. Phạt tiền từ 40.000.000 đồng đến 50.000.000 đồng\nđối với hành vi mua trái phiếu doanh nghiệp không có hợp đồng.\n4. Phạt tiền từ 100.000.000 đồng đến 150.000.000 đồng\nđối với một trong các hành vi vi phạm sau đây:\na) Thẩm định, kiểm tra phương án và các điều kiện phát hành trái phiếu của doanh nghiệp để xem xét quyết định mua trái phiếu doanh nghiệp khi chưa có đủ các điều kiện theo quy định của pháp luật;\nb) Không thẩm định, kiểm tra phương án và các điều kiện phát hành trái phiếu của doanh nghiệp;\nc) Vi phạm quy định về mua trái phiếu doanh nghiệp chuyển đổi;\nd) Mua trái phiếu doanh nghiệp phát hành nhằm mục\nđích cơ cấu lại các khoản nợ của doanh nghiệp.\nđ)[33] Chi nhánh ngân hàng nước ngoài mua trái phiếu chuyển đổi.\n5. Biện pháp khắc phục hậu quả:\na) Buộc thu hồi nợ trong thời hạn tối đa 01 năm kể\ntừ ngày quyết định xử phạt vi phạm hành chính có hiệu lực đối với hành vi vi phạm quy định tại khoản 4 Điều này;\nb) Đề nghị hoặc yêu cầu cấp có thẩm quyền xem xét,\náp dụng biện pháp đình chỉ từ 01 tháng đến 03 tháng hoặc miễn nhiệm chức danh quản trị, Điều hành, kiểm soát; không cho đảm nhiệm chức vụ quản trị, điều hành, kiểm soát tại các tổ chức tín dụng, chi nhánh ngân hàng nước ngoài đối với cá nhân vi phạm và/hoặc cá nhân chịu trách nhiệm đối với hành vi vi phạm quy định tại khoản 4 Điều này.\nYêu cầu tổ chức tín dụng, chi nhánh ngân hàng nước ngoài cách chức và thực hiện các biện pháp xử lý khác theo quy định của pháp luật\nđối với cá nhân vi phạm thuộc thẩm quyền của tổ chức tín dụng, chi nhánh, ngân hàng nước ngoài.\nĐiều 17. Vi phạm quy định trong hoạt động liên ngân hàng 1. Phạt tiền từ 10.000.000 đồng đến 20.000.000 đồng\nđối với một trong các hành vi vi phạm sau đây:\na) Cập nhật và lưu giữ thông tin giao dịch cho vay,\nđi vay; mua, bán có kỳ hạn giấy tờ có giá không đúng quy định của pháp luật;\nb) Không xác nhận thực hiện giao dịch theo quy định;\nc) Lập hợp đồng cho vay, mua lại giấy tờ có giá\nkhông đúng hình thức, nội dung theo quy định của pháp luật.\nd)[34] Thực hiện giao dịch mua, bán giấy tờ có giá bằng đồng tiền không phù hợp với quy định của pháp luật.\n2. Phạt tiền từ 20.000.000 đồng đến 30.000.000 đồng\nđối với một trong các hành vi vi phạm sau đây:\na) Không thực hiện đúng quy định về thời hạn cho vay, đi vay, gửi tiền, nhận tiền gửi và mua, bán có kỳ hạn giấy tờ có giá;\nb) Không thực hiện thanh toán các giao dịch cho vay, đi vay; gửi tiền, nhận tiền gửi; mua, bán có kỳ hạn giấy tờ có giá bằng đồng Việt Nam qua hệ thống thanh toán điện tử liên ngân hàng theo quy định của pháp luật;\nc) Không thực hiện đúng quy trình mua bán giấy tờ\ncó giá theo quy định;\nd) Thực hiện giao dịch cho vay, đi vay, gửi tiền,\nnhận tiền gửi ngoài phạm vi được ủy quyền.\nđ)[35] Mua kỳ phiếu,\ntín phiếu, chứng chỉ tiền gửi có thời hạn còn lại không đúng quy định của pháp luật.\n3. Phạt tiền từ 30.000.000 đồng đến 40.000.000 đồng\nđối với hành vi thực hiện giao dịch cho vay, đi vay ngoài trụ sở của chi nhánh ngân hàng nước ngoài tại Việt Nam.\n4. Phạt tiền từ 40.000.000 đồng đến 50.000.000 đồng\nđối với một trong các hành vi vi phạm sau đây:\na) Không thực hiện đúng quy định về nguyên tắc chung khi thực hiện giao dịch cho vay, đi vay; mua, bán có kỳ hạn giấy tờ có\ngiá giữa các tổ chức tín dụng, chi nhánh ngân hàng nước ngoài; gửi tiền tại tổ\nchức tín dụng khác không đúng quy định của pháp luật;\nb) Không xem xét, đánh giá lại khách hàng theo quy\nđịnh để xác định lại hạn mức tín dụng đối với từng khách hàng;\nc) Không thực hiện đúng quy định về cung cấp thông tin cho bên cho vay để phục vụ cho việc đánh giá khách hàng và xác định hạn mức giao dịch.\n5.[36] Phạt tiền từ\n80.000.000 đồng đến 120.000.000 đồng đối với một trong các hành vi vi phạm như\nsau:\na) Mua, bán có kỳ hạn các loại giấy tờ có giá không\nđược phép mua, bán;\nb) Mua, bán giấy tờ có giá của công ty tài chính hoặc công ty cho thuê tài chính phát hành không đúng quy định pháp luật.\n6. Phạt tiền từ 150.000.000 đồng đến 200.000.000 đồng\nđối với hành vi thực hiện việc đi vay, cho vay, mua, bán giấy tờ có giá bằng ngoại tệ không đúng phạm vi hoạt động ngoại hối được Ngân hàng Nhà nước cấp phép.\n7. Biện pháp khắc phục hậu quả:\nĐề nghị hoặc yêu cầu cấp có thẩm quyền xem xét, áp dụng biện pháp đình chỉ từ 01 tháng đến 03 tháng hoặc miễn nhiệm chức danh quản trị, điều hành, kiểm soát; không cho đảm nhiệm chức vụ quản trị, điều hành, kiểm soát tại các tổ chức tín dụng, chi nhánh ngân hàng nước ngoài đối với cá nhân vi phạm và/hoặc cá nhân chịu trách nhiệm đối với hành vi vi phạm quy định tại các khoản 5, khoản 6 Điều này.\nYêu cầu tổ chức tín dụng, chi nhánh ngân hàng nước ngoài cách chức và thực hiện các biện pháp xử lý khác theo quy định của pháp luật\nđối với cá nhân vi phạm thuộc thẩm quyền của tổ chức tín dụng, chi nhánh ngân hàng nước ngoài.\nMục 6. VI PHẠM QUY ĐỊNH VỀ HOẠT\nĐỘNG CUNG ỨNG DỊCH VỤ THÔNG TIN TÍN DỤNG\nĐiều 18. Vi phạm quy định về\nnguyên tắc, điều kiện hoạt động cung ứng dịch vụ thông tin tín dụng 1. Phạt tiền từ 20.000.000 đồng đến 40.000.000 đồng\nđối với một trong các hành vi vi phạm sau đây:\na) Không đảm bảo duy trì đủ một trong các điều kiện\nđể cấp Giấy chứng nhận đủ điều kiện hoạt động cung ứng dịch vụ thông tin tín dụng;\nb) Các thỏa thuận, cam kết trong hoạt động cung ứng dịch vụ thông tin tín dụng không được lập đúng hình thức theo quy định của pháp luật;\nc) Không công bố thông tin theo quy định của pháp luật.\n2. Phạt tiền từ 40.000.000 đồng đến 60.000.000 đồng\nđối với hành vi gian lận[37] các giấy tờ chứng minh đủ điều kiện để được cấp giấy chứng nhận đủ điều kiện hoạt động cung ứng dịch vụ thông tin tín dụng trong hồ sơ đề nghị cấp giấy chứng nhận mà chưa đến mức bị\ntruy cứu trách nhiệm hình sự.\n3. Phạt tiền từ 200.000.000 đồng đến 250.000.000 đồng\nđối với hành vi hoạt động cung ứng dịch vụ thông tin tín dụng không có Giấy chứng nhận đủ điều kiện hoạt động cung ứng dịch vụ thông tin tín dụng do Ngân hàng Nhà nước Việt Nam cấp.\n4. Biện pháp khắc phục hậu quả:\na) Buộc nộp vào ngân sách nhà nước số lợi bất hợp pháp có được do thực hiện hành vi vi phạm quy định tại các khoản 2, 3 Điều này;\nb) Đề nghị cấp có thẩm quyền thu hồi giấy chứng nhận\nđủ điều kiện hoạt động cung ứng dịch vụ thông tin tín dụng đối với hành vi vi phạm quy định tại các khoản 2, 3 Điều này;\nc) Buộc duy trì đủ các điều kiện để cấp Giấy chứng nhận đủ điều kiện hoạt động cung ứng dịch vụ thông tin tín dụng đối với hành vi vi phạm quy định tại điểm a khoản 1 Điều này.\nĐiều 19. Vi phạm quy định về\nthu thập, xử lý thông tin tín dụng 1. Phạt tiền từ 20.000.000 đồng đến 40.000.000 đồng\nđối với một trong các hành vi vi phạm sau đây:\na) Thu thập thông tin tín dụng không thuộc phạm vi theo quy định của pháp luật;\nb) Thu thập thông tin tín dụng của khách hàng vay khi chưa được sự đồng ý của khách hàng vay, trừ trường hợp thu thập thông tin theo yêu cầu của cơ quan nhà nước có thẩm quyền;\nc) Sử dụng thông tin tiêu cực về khách hàng vay để\ntạo lập sản phẩm thông tin tín dụng không đúng quy định của pháp luật;\nd) Cản trở hoạt động thu thập thông tin tín dụng hợp pháp của tổ chức, cá nhân.\n2. Phạt tiền từ 40.000.000 đồng đến 80.000.000 đồng\nđối với hành vi cố ý làm sai lệch nội dung thông tin tín dụng.\n3. Phạt tiền từ 80.000.000 đồng đến 100.000.000 đồng\nđối với hành vi thu thập trái phép các thông tin thuộc phạm vi, danh mục bí mật của Nhà nước.\n4. Hình thức xử phạt bổ sung:\na) Tịch thu phương tiện được sử dụng để thực hiện hành vi vi phạm quy định tại khoản 3 Điều này;\nb) Đình chỉ việc thực hiện hoạt động cung ứng dịch vụ thông tin tín dụng trong thời hạn từ 01 tháng đến 03 tháng đối với hành vi vi phạm quy định tại các khoản 2, 3 Điều này.\n5. Biện pháp khắc phục hậu quả:\nBuộc thực hiện ngay việc đính chính thông tin sai lệch\nđối với hành vi vi phạm quy định tại khoản 2 Điều này.\nĐiều 20. Vi phạm quy định về\nan toàn, lưu giữ thông tin tín dụng Phạt tiền từ 20.000.000 đồng đến 40.000.000 đồng đối với một trong các hành vi vi phạm sau đây:\n1. Không thực hiện quy định, quy trình bảo mật, an toàn công nghệ thông tin trong hoạt động cung ứng dịch vụ thông tin tín dụng;\n2. Không lưu giữ thông tin tín dụng về khách hàng vay trong thời hạn tối thiểu 05 năm kể từ ngày tổ chức hoạt động cung ứng dịch vụ thông tin tín dụng tiếp nhận được;\n3. Không thực hiện rà soát, đánh giá quy định nội bộ\nđịnh kỳ hàng năm về tính thích hợp, tuân thủ quy định của pháp luật.\nĐiều 21. Vi phạm quy định về\nkhai thác, sử dụng sản phẩm, dịch vụ và trao đổi, cung cấp thông tin tín dụng 1. Phạt tiền từ 10.000.000 đồng đến 20.000.000 đồng\nđối với một trong các hành vi vi phạm sau đây:\na) Cung cấp, sao chép sản phẩm thông tin tín dụng để\ncung cấp cho bên thứ ba không đúng quy định của pháp luật;\nb) Không khuyến cáo cho người sử dụng về nguyên tắc,\nphạm vi sử dụng sản phẩm thông tin tín dụng.\n2. Phạt tiền từ 20.000.000 đồng đến 40.000.000 đồng\nđối với một trong các hành vi vi phạm sau đây:\na) Sửa đổi sản phẩm thông tin tín dụng để cung cấp cho bên thứ ba không đúng quy định của pháp luật;\nb) Cung cấp, trao đổi thông tin tín dụng, cung cấp sản phẩm thông tin tín dụng khi chưa được sự đồng ý tại thỏa thuận với khách hàng vay, không đúng quy định của pháp luật;\nc) Cản trở hoạt động sử dụng thông tin tín dụng hợp pháp của tổ chức, cá nhân;\nd) Không niêm yết công khai mức giá cung cấp sản phẩm thông tin tín dụng theo quy định của pháp luật.\n3. Hình thức xử phạt bổ sung:\nĐình chỉ việc thực hiện hoạt động cung ứng dịch vụ\nthông tin tín dụng trong thời hạn từ 01 tháng đến 03 tháng đối với hành vi vi phạm quy định tại khoản 2 Điều này.\n4. Biện pháp khắc phục hậu quả:\nBuộc nộp vào ngân sách nhà nước số lợi bất hợp pháp có được do thực hiện hành vi vi phạm quy định tại điểm a khoản 1 và khoản 2 Điều này.\nĐiều 22. Vi phạm quy định về điều chỉnh sai sót đối với thông tin tín dụng của khách hàng vay Phạt tiền từ 10.000.000 đồng đến 15.000.000 đồng đối với một trong các hành vi vi phạm sau đây:\n1. Không trả lời văn bản đề nghị điều chỉnh sai sót hoặc không thông báo kết quả việc điều chỉnh sai sót theo quy định của pháp luật;\n2. Không thực hiện điều chỉnh sai sót hoặc phối hợp\nđiều chỉnh sai sót đối với thông tin tín dụng của khách hàng vay theo quy định của pháp luật.\nMục 7. VI PHẠM QUY ĐỊNH VỀ HOẠT\nĐỘNG NGOẠI HỐI VÀ KINH DOANH VÀNG\nĐiều 23. Vi phạm quy định về\nhoạt động ngoại hối 1. Phạt cảnh cáo đối với một trong các hành vi vi phạm sau đây:\na) Mua, bán ngoại tệ giữa cá nhân với nhau mà ngoại tệ mua, bán có giá trị dưới 1.000 đôla Mỹ (hoặc ngoại tệ khác có giá trị tương\nđương);\nb) Mua, bán ngoại tệ tại tổ chức không được phép thu đổi ngoại tệ mà ngoại tệ mua, bán có giá trị dưới 1.000 đôla Mỹ (hoặc ngoại tệ khác có giá trị tương đương);\nc) Thanh toán tiền hàng hóa, dịch vụ bằng ngoại tệ\ncó giá trị dưới 1.000 đôla Mỹ (hoặc ngoại tệ khác có giá trị tương đương) không\nđúng quy định của pháp luật.\n2. Phạt tiền từ 10.000.000 đồng đến 20.000.000 đồng\nđối với một trong các hành vi vi phạm sau đây:\na) Mua, bán ngoại tệ giữa cá nhân với nhau mà ngoại tệ mua, bán có giá trị từ 1.000 đôla Mỹ đến dưới 10.000 đôla Mỹ (hoặc ngoại tệ\nkhác có giá trị tương đương); mua, bán ngoại tệ giữa cá nhân với nhau mà ngoại tệ mua, bán có giá trị dưới 1.000 đôla Mỹ (hoặc ngoại tệ khác có giá trị tương\nđương) trong trường hợp tái phạm hoặc vi phạm nhiều lần;\nb) Mua, bán ngoại tệ tại tổ chức không được phép thu đổi ngoại tệ mà ngoại tệ mua, bán có giá trị từ 1.000 đôla Mỹ đến dưới 10.000 đôla Mỹ (hoặc ngoại tệ khác có giá trị tương đương); mua, bán ngoại tệ tại tổ chức không được phép thu đổi ngoại tệ mà ngoại tệ mua, bán có giá trị dưới 1.000 đôla Mỹ (hoặc ngoại tệ khác có giá trị tương đương) trong trường hợp tái phạm hoặc vi phạm nhiều lần;\nc) Thanh toán tiền hàng hóa, dịch vụ bằng ngoại tệ\ncó giá trị dưới 1.000 đôla Mỹ (hoặc ngoại tệ khác có giá trị tương đương) không\nđúng quy định của pháp luật trong trường hợp tái phạm hoặc vi phạm nhiều lần;\nthanh toán tiền hàng hóa, dịch vụ bằng ngoại tệ có giá trị từ 1.000 đôla Mỹ đến dưới 10.000 đôla Mỹ (hoặc ngoại tệ khác có giá trị tương đương) không đúng quy\nđịnh của pháp luật.\n3. Phạt tiền từ 20.000.000 đồng đến 30.000.000 đồng\nđối với một trong các hành vi vi phạm sau đây:\na) Không niêm yết tỷ giá mua, bán ngoại tệ tại địa điểm giao dịch theo quy định của pháp luật;\nb) Niêm yết tỷ giá mua, bán ngoại tệ nhưng hình thức,\nnội dung niêm yết tỷ giá không rõ ràng, gây nhầm lẫn cho khách hàng;\nc) Không niêm yết, thông báo công khai tỷ giá quy đổi giữa đồng Việt Nam, ngoại tệ với đồng tiền quy ước trong hoạt động kinh doanh trò chơi điện tử có thưởng dành cho người nước ngoài, hoạt động kinh doanh casino; niêm yết, thông báo công khai tỷ giá quy đổi giữa mệnh giá đồng tiền quy ước với đồng Việt Nam, ngoại tệ trong hoạt động kinh doanh trò chơi điện tử\ncó thưởng dành cho người nước ngoài, hoạt động kinh doanh casino không đúng quy\nđịnh của pháp luật;\nd)[38] Không thực hiện đúng quy định của pháp luật về việc đăng ký, thông báo với Ngân hàng Nhà nước chi nhánh tỉnh, thành phố đối với các trường hợp thay đổi liên quan đến hoạt động đại lý đổi ngoại tệ; hoạt động đại lý đổi tiền của nước có chung biên giới;\nđ) Không thực hiện đúng quy định của pháp luật về\nviệc thông báo, làm thủ tục đề nghị Ngân hàng Nhà nước chấp thuận đối với các trường hợp thay đổi, bổ sung, chấm dứt hợp đồng liên quan đến hoạt động cung ứng dịch vụ nhận và chi, trả ngoại tệ;\ne) Không thực hiện đúng quy định của pháp luật về\nviệc làm thủ tục đề nghị Ngân hàng Nhà nước chấp thuận điều chỉnh, sửa đổi, bổ\nsung giấy phép thu, chi ngoại tệ và hoạt động ngoại hối khác, đối với trường hợp thay đổi tên doanh nghiệp kinh doanh trò chơi điện tử có thưởng dành cho người nước ngoài, tên doanh nghiệp kinh doanh casino, tên gọi của tổ chức mở tài khoản ngoại tệ ở nước ngoài;\ng) Không thực hiện đúng quy định của pháp luật về\nthủ tục hành chính đối với: thủ tục chấp nhận chuyển ngoại tệ ra nước ngoài trước\nđầu tư; việc đăng ký, đăng ký thay đổi khoản vay nước ngoài, khoản phát hành trái phiếu quốc tế; đăng ký, đăng ký thay đổi khoản cho vay ra nước ngoài, khoản thu hồi nợ bảo lãnh cho người không cư trú; đăng ký, đăng ký thay đổi giao dịch ngoại hối liên quan đến hoạt động đầu tư ra nước ngoài; đăng ký chương trình cổ\nphiếu thưởng phát hành ở nước ngoài; đăng ký hạn mức tự doanh; đăng ký hạn mức tự doanh tạm thời; đăng ký hạn mức nhận ủy thác; đăng ký hạn mức nhận ủy thác tạm thời và các thủ tục hành chính khác liên quan đến giao dịch vốn khác; thủ tục hành chính đối với trường hợp đầu tư gián tiếp ra nước ngoài khác;\nh) Mua, bán ngoại tệ giữa cá nhân với nhau mà ngoại tệ mua, bán có giá trị từ 10.000 đôla Mỹ đến dưới 100.000 đôla Mỹ (hoặc ngoại tệ\nkhác có giá trị tương đương);\ni) Mua, bán ngoại tệ tại tổ chức không được phép thu đổi ngoại tệ mà ngoại tệ mua, bán có giá trị từ 10.000 đôla Mỹ đến dưới 100.000 đôla Mỹ (hoặc ngoại tệ khác có giá trị tương đương);\nk) Thanh toán tiền hàng hóa, dịch vụ bằng ngoại tệ\ncó giá trị từ 10.000 đôla Mỹ đến dưới 100.000 đôla Mỹ (hoặc ngoại tệ khác có\ngiá trị tương đương) không đúng quy định của pháp luật;\nl) Mua, bán ngoại tệ không đúng tỷ giá quy định của Ngân hàng Nhà nước, trừ trường hợp quy định tại điểm đ và điểm m khoản 4 Điều này;\nthu phí giao dịch ngoại tệ không đúng quy định của pháp luật.\n4. Phạt tiền từ 30.000.000 đồng đến 50.000.000 đồng\nđối với một trong các hành vi vi phạm sau đây:\na)[39] Ký hợp đồng đại lý đổi ngoại tệ, hợp đồng đại lý đổi tiền của nước có chung biên giới với tổ chức không đủ\nđiều kiện làm đại lý đổi ngoại tệ, đại lý đổi tiền của nước có chung biên giới; không hướng dẫn, kiểm tra đại lý đổi ngoại tệ, đại lý đổi tiền của nước có chung biên giới theo quy định của pháp luật;\nb)[40]\nKhông thực hiện đúng trách nhiệm của đại lý đổi ngoại tệ, đại lý đổi tiền của nước có chung biên giới theo quy định của pháp luật;\nlàm đại lý đổi ngoại tệ, đại lý đổi tiền của nước có chung biên giới đồng thời cho hai tổ chức tín dụng trở lên không đúng quy\nđịnh của pháp luật;\nc) Thanh toán công cụ chuyển nhượng bằng ngoại tệ\nkhông đúng quy định về hoạt động ngoại hối quy định tại Điều 9 Luật Các công cụ\nchuyển nhượng và các quy định pháp luật có liên quan;\nd) Không thực hiện đúng các quy định của pháp luật về việc mở, đóng, sử dụng tài khoản tại Việt Nam để thực hiện một trong các hoạt\nđộng: Đầu tư nước ngoài vào Việt Nam; đầu tư của Việt Nam ra nước ngoài; vay,\ntrả nợ nước ngoài; cho vay, thu hồi nợ nước ngoài, phát hành chứng khoán ở nước ngoài của người cư trú là tổ chức; phát hành chứng khoán tại Việt Nam của người không cư trú là tổ chức và các giao dịch vốn khác;\nđ) Quy định tỷ giá, các khoản chi hoa hồng, môi giới bằng tiền, hiện vật và các hình thức chi khuyến mại trong hoạt động mua, bán ngoại tệ dưới bất kỳ hình thức nào dẫn đến tỷ giá mua, bán, quy đổi thực tế vượt biên độ tỷ giá theo quy định của pháp luật;\ne) Làm đại lý chi trả ngoại tệ đồng thời cho hai tổ\nchức kinh tế trở lên không đúng quy định của pháp luật;\ng)[41] Thực hiện việc rút vốn, trả nợ đối với các khoản vay nước ngoài; giải ngân, thu hồi nợ đối với các khoản cho vay ra nước ngoài; thực hiện thu hồi nợ bảo lãnh cho người không cư trú; thực hiện chuyển tiền phục vụ hoạt động đầu tư nước ngoài vào Việt Nam,\nđầu tư của Việt Nam ra nước ngoài không đúng quy định của pháp luật, trừ trường hợp hành vi vi phạm này là hậu quả của hành vi vi phạm tại điểm d khoản 4 Điều này;\nh) Chuyển, mang ngoại tệ, đồng Việt Nam ra nước ngoài, vào Việt Nam không đúng quy định của pháp luật, trừ các hành vi vi phạm hành chính trong lĩnh vực hải quan;\ni) Ủy quyền, ủy quyền lại cho tổ chức kinh tế, tổ\nchức tín dụng làm đại lý chi, trả ngoại tệ không đúng quy định của pháp luật;\nk) Không thực hiện đúng quy định của pháp luật về\nviệc mở, đóng, sử dụng tài khoản chuyên dùng ngoại tệ trong hoạt động cung ứng dịch vụ nhận và chi, trả ngoại tệ;\nl) Không thực hiện đúng trách nhiệm của tổ chức tín dụng, tổ chức kinh tế làm đại lý chi, trả ngoại tệ, tổ chức kinh tế trực tiếp nhận và chi, trả ngoại tệ trong việc cập nhật sổ sách kế toán, lưu giữ chứng từ\nphù hợp với quy định của pháp luật;\nm) Không thực hiện đúng các quy định của pháp luật về việc thu phí, áp dụng tỷ giá chi trả trong hoạt động cung ứng dịch vụ nhận và chi, trả ngoại tệ;\nn) Giao dịch, báo giá, định giá, ghi giá trong hợp\nđồng, thỏa thuận, niêm yết, quảng cáo giá hàng hóa, dịch vụ, quyền sử dụng đất và các hình thức tương tự khác (bao gồm cả quy đổi hoặc điều chỉnh giá hàng hóa, dịch vụ, giá trị của hợp đồng, thỏa thuận) bằng ngoại tệ không đúng quy định của pháp luật;\no)[42] (được bãi bỏ)\n5. Phạt tiền từ 80.000.000 đồng đến 100.000.000 đồng\nđối với một trong các hành vi vi phạm sau đây:\na) Mở, đóng, sử dụng tài khoản ngoại tệ ở nước ngoài không đúng quy định của pháp luật;\nb) Cung ứng dịch vụ thanh toán, chuyển tiền đối với các giao dịch liên quan đến khoản vay nước ngoài, khoản cho vay, thu hồi nợ nước ngoài, bảo lãnh cho người không cư trú, đầu tư nước ngoài vào Việt Nam, đầu tư\ncủa Việt Nam ra nước ngoài và các giao dịch vốn khác không đúng quy định của pháp luật;\nc) Quy đổi mệnh giá đồng tiền quy ước không đúng quy định của pháp luật đối với doanh nghiệp kinh doanh trò chơi điện tử có thưởng dành cho người nước ngoài, doanh nghiệp kinh doanh casino;\nd) Không thực hiện đúng quy định của pháp luật về\nviệc mở, đóng, sử dụng tài khoản chuyên dùng ngoại tệ trong hoạt động kinh doanh trò chơi điện tử có thưởng dành cho người nước ngoài, hoạt động kinh doanh casino;\nđ) Không nộp số ngoại tệ tiền mặt vượt mức tồn quỹ\nvào tài khoản chuyên dùng ngoại tệ mở tại ngân hàng được phép trong trường hợp có nguồn thu ngoại tệ tiền mặt từ hoạt động kinh doanh trò chơi điện tử có thưởng dành cho người nước ngoài, hoạt động kinh doanh casino vượt mức tồn quỹ theo quy định của pháp luật;\ne) Mua, bán ngoại tệ giữa cá nhân với nhau mà ngoại tệ mua, bán có giá trị từ 100.000 đôla Mỹ trở lên (hoặc ngoại tệ khác có giá trị\ntương đương);\ng) Mua, bán ngoại tệ tại tổ chức không được phép thu đổi ngoại tệ mà ngoại tệ mua, bán có giá trị từ 100.000 đôla Mỹ trở lên (hoặc ngoại tệ khác có giá trị tương đương);\nh) Thanh toán tiền hàng hóa, dịch vụ bằng ngoại tệ\ncó giá trị từ 100.000 đôla Mỹ trở lên (hoặc ngoại tệ khác có giá trị tương\nđương) không đúng quy định của pháp luật.\ni)[43] Không thực hiện đúng trách nhiệm của đại lý đổi ngoại tệ, đại lý đổi tiền của nước có chung biên giới theo quy định của pháp luật trong trường hợp tái phạm; làm đại lý đổi ngoại tệ, đại lý đổi tiền của nước có chung biên giới đồng thời cho hai tổ chức tín dụng trở lên không đúng quy định của pháp luật trong trường hợp tái phạm.\n6. Phạt tiền từ 100.000.000 đồng đến 150.000.000 đồng\nđối với một trong các hành vi vi phạm sau đây:\na) Cấp tín dụng hoặc trả nợ trong nước bằng ngoại tệ\nkhông đúng quy định của pháp luật, trừ trường hợp quy định tại Điều 14 Nghị định này;\nb) Không bán ngoại tệ thu được cho tổ chức tín dụng theo quy định của pháp luật, trừ trường hợp quy định tại điểm b khoản 5 Điều này.\nc)[44] Mở, đóng, sử\ndụng tài khoản ngoại tệ ở nước ngoài không đúng quy định của pháp luật trong trường hợp tái phạm.\n7. Phạt tiền từ 150.000.000 đồng đến 200.000.000 đồng\nđối với một trong các hành vi vi phạm sau đây:\na) Không chấp hành các quy định của pháp luật về\nvay, trả nợ nước ngoài; cho vay, thu hồi nợ nước ngoài; bảo lãnh cho người không cư trú và các giao dịch vốn khác, trừ trường hợp quy định tại các điểm g khoản 3, điểm d, g khoản 4 và điểm b khoản 5 Điều này;\nb) Thực hiện giao dịch ngoại tệ giữa tổ chức tín dụng với nhau, giữa tổ chức tín dụng với khách hàng không đúng quy định của Ngân hàng Nhà nước, trừ trường hợp quy định tại điểm a khoản 8 Điều này;\nc) Không tuân thủ trạng thái ngoại tệ theo quy định của pháp luật.\n8. Phạt tiền từ 200.000.000 đồng đến 250.000.000 đồng\nđối với một trong các hành vi vi phạm sau đây:\na) Kinh doanh, cung ứng sản phẩm phái sinh tỷ giá,\nngoại hối không đúng quy định của pháp luật;\nb) Xuất khẩu, nhập khẩu ngoại tệ tiền mặt, đồng Việt Nam tiền mặt không đúng quy định của pháp luật;\nc) Hoạt động ngoại hối khi không được cấp có thẩm quyền cấp giấy phép hoặc giấy phép hoạt động ngoại hối đã hết thời hạn hoặc bị\ntước hoặc không đúng nội dung đã quy định trong giấy phép, trừ trường hợp quy định tại điểm d khoản 4[45], các điểm a, d khoản 5 Điều này.\n9. Hình thức xử phạt bổ sung:\na) Tịch thu số ngoại tệ, đồng Việt Nam đối với hành vi vi phạm quy định tại khoản 2, các điểm h, i, k khoản 3, điểm h khoản 4, các điểm e, g, h khoản 5, điểm b khoản 6 Điều này;\nb)[46] Tước quyền sử dụng giấy chứng nhận đăng ký đại lý đổi ngoại tệ, giấy chứng nhận đăng ký đại lý đổi tiền của nước có chung biên giới trong thời hạn từ 01 tháng đến 03 tháng đối với hành vi vi phạm quy định tại điểm b khoản 4 Điều này;\nc) Tước quyền sử dụng giấy phép thu, chi ngoại tệ\nvà hoạt động ngoại hối khác đối với hoạt động kinh doanh trò chơi điện tử có\nthưởng dành cho người nước ngoài, hoạt động kinh doanh casino trong thời hạn từ\n03 đến 06 tháng đối với hành vi vi phạm quy định tại điểm d, đ khoản 4 Điều này\n(đối với nội dung không thực hiện việc điều chỉnh giấy phép);\nd)[47] (được bãi bỏ)\nđ) Đình chỉ hoạt động ngoại hối trong thời hạn 03 tháng đến 06 tháng đối với tổ chức tín dụng, chi nhánh ngân hàng nước ngoài có\nhành vi vi phạm quy định tại điểm c khoản 8 Điều này.\n10.[48]\nBiện pháp khắc phục hậu quả:\nĐề nghị cấp có thẩm quyền thu hồi giấy chứng nhận đăng ký đại lý đổi ngoại tệ, giấy chứng nhận đăng ký đại lý đổi tiền của nước có chung biên giới, giấy phép mở và sử dụng tài khoản ngoại tệ ở nước ngoài đối với hành vi vi phạm quy định tại điểm i khoản 5, điểm c khoản 6 Điều này.\nĐiều 24. Vi phạm quy định về\nhoạt động kinh doanh vàng 1. Phạt cảnh cáo đối với một trong các hành vi vi phạm sau đây:\na) Mua, bán vàng miếng với tổ chức tín dụng hoặc doanh nghiệp không có Giấy phép kinh doanh mua, bán vàng miếng;\nb) Sử dụng vàng làm phương tiện thanh toán.\n2. Phạt tiền từ 10.000.000 đồng đến 20.000.000 đồng\nđối với một trong các hành vi vi phạm sau đây:\na) Mua, bán vàng miếng với tổ chức tín dụng hoặc doanh nghiệp không có Giấy phép kinh doanh mua, bán vàng miếng trong trường hợp tái phạm hoặc vi phạm nhiều lần;\nb) Sử dụng vàng làm phương tiện thanh toán trong trường hợp tái phạm hoặc vi phạm nhiều lần.\n3. Phạt tiền từ 30.000.000 đồng đến 50.000.000 đồng\nđối với một trong các hành vi vi phạm sau đây:\na) Không niêm yết công khai giá mua, giá bán vàng miếng tại địa điểm giao dịch theo quy định của pháp luật;\nb) Vi phạm trách nhiệm của tổ chức tín dụng, doanh nghiệp hoạt động kinh doanh mua, bán vàng miếng khi có thay đổi về mạng lưới chi nhánh, địa điểm kinh doanh mua, bán vàng miếng theo quy định của pháp luật.\n4. Phạt tiền từ 80.000.000 đồng đến 100.000.000 đồng\nđối với một trong các hành vi vi phạm sau đây:\na) Kinh doanh mua, bán vàng miếng không đúng quy định của pháp luật, trừ trường hợp quy định tại điểm a khoản 8 Điều này;\nb) Mang theo vàng khi xuất cảnh, nhập cảnh không\nđúng quy định của pháp luật, trừ các hành vi vi phạm hành chính trong lĩnh vực hải quan.\n5. Phạt tiền từ 140.000.000 đồng đến 180.000.000 đồng\nđối với một trong các hành vi vi phạm sau đây:\na) Thực hiện kinh doanh mua, bán vàng miếng thông qua các đại lý ủy nhiệm;\nb) Không thực hiện đúng quy định của pháp luật về\ntrạng thái vàng;\nc) Xuất khẩu, nhập khẩu vàng trang sức, mỹ nghệ;\nvàng nguyên liệu dưới dạng bột, dung dịch, vẩy hàn, muối vàng và các loại vàng trang sức dưới dạng bán thành phẩm mà không đúng theo nội dung ngành nghề đã\nđăng ký kinh doanh theo quy định của pháp luật.\n6.[49] Phạt tiền từ\n200.000.000 đồng đến 250.000.000 đồng đối với một trong các hành vi vi phạm sau\nđây:\na) Sử dụng vàng nguyên liệu nhập khẩu không đúng theo giấy phép nhập khẩu vàng nguyên liệu để sản xuất vàng trang sức, mỹ nghệ;\nb) Thực hiện kinh doanh mua, bán vàng miếng thông qua các đại lý ủy nhiệm trong trường hợp tái phạm.\n7. Phạt tiền từ 250.000.000 đồng đến 300.000.000 đồng\nđối với hành vi hoạt động sản xuất vàng miếng không đúng quy định của pháp luật.\n8. Phạt tiền từ 300.000.000 đồng đến 400.000.000 đồng\nđối với một trong các hành vi vi phạm sau đây:\na) Kinh doanh mua, bán vàng miếng nhưng không có giấy phép kinh doanh mua, bán vàng miếng;\nb) Thực hiện xuất khẩu hoặc nhập khẩu vàng nguyên liệu không có giấy phép do cơ quan nhà nước có thẩm quyền cấp theo quy định của pháp luật;\nc) Hoạt động kinh doanh vàng khác khi chưa được cấp có thẩm quyền cấp giấy phép theo quy định của pháp luật.\n9. Hình thức xử phạt bổ sung:\na) Tịch thu số vàng đối với hành vi vi phạm quy định tại các điểm a, c khoản 8 Điều này;\nb) Tước quyền sử dụng giấy phép kinh doanh mua, bán vàng miếng trong thời hạn từ 06 tháng đến 09 tháng đối với hành vi vi phạm quy\nđịnh tại điểm a khoản 5 Điều này.\n10.[50] Biện pháp khắc phục hậu quả:\nĐề nghị cơ quan có thẩm quyền thu hồi giấy phép kinh doanh mua, bán vàng miếng đối với hành vi vi phạm quy định tại điểm b khoản 6 Điều này.\nMục 8. VI PHẠM QUY ĐỊNH VỀ\nTHANH TOÁN, QUẢN LÝ TIỀN TỆ VÀ KHO QUỸ\nĐiều 25. Vi phạm quy định về\nthanh toán liên ngân hàng 1. Phạt tiền từ 10.000.000 đồng đến 20.000.000 đồng\nđối với một trong các hành vi vi phạm sau đây:\na) Không chấp hành đúng quy định về tổ chức thanh toán bù trừ, thanh toán bù trừ, thanh toán liên ngân hàng;\nb) Không trả lại các bộ chứng từ thanh toán bị sai trong ngày làm việc, trừ trường hợp bất khả kháng;\nc) Trả tiền vào tài khoản người nhận sau thời gian quy định;\nd) Gửi chứng từ ký quỹ không đúng quy định về thời gian.\n2. Phạt tiền từ 20.000.000 đồng đến 40.000.000 đồng\nđối với một trong các hành vi vi phạm sau đây:\na) Không trả lại ngay Lệnh chuyển Có đã bị từ chối hợp lệ; từ chối Lệnh chuyển Nợ có ủy quyền hợp lệ;\nb) Giao cho người không được ủy quyền khởi tạo, truyền các giao dịch qua hệ thống thanh toán bù trừ, thanh toán liên ngân hàng.\n3. Phạt tiền từ 100.000.000 đồng đến 150.000.000 đồng\nđối với một trong các hành vi vi phạm sau đây:\na) Cản trở việc vận hành hệ thống thanh toán bù trừ,\nthanh toán liên ngân hàng;\nb) Để lộ hoặc tiết lộ ra ngoài các thông tin không\nđược phép tiết lộ liên quan đến hệ thống thanh toán liên ngân hàng.\nĐiều 26. Vi phạm quy định về\nhoạt động thanh toán 1. Phạt tiền từ 3.000.000 đồng đến 5.000.000 đồng đối với hành vi sửa chữa, tẩy xóa không đúng quy định trên các phương tiện thanh toán, chứng từ thanh toán mà chưa đến mức bị truy cứu trách nhiệm hình sự.\n2. Phạt tiền từ 5.000.000 đồng đến 10.000.000 đồng\nđối với một trong các hành vi vi phạm sau đây:\na) Tiếp nhận, xử lý tra soát, khiếu nại của khách hàng không đúng quy định của pháp luật;\nb)[51] Cung cấp không trung thực thông tin có liên quan đến việc sử dụng dịch vụ thanh toán.\n3. Phạt tiền từ 10.000.000 đồng đến 15.000.000 đồng\nđối với một trong các hành vi vi phạm sau đây:\na) Không thực hiện đúng quy định của pháp luật về\nthời gian trong thanh toán, chuyển tiền, trừ các trường hợp thanh toán giữa tổ\nchức tín dụng với Ngân hàng Nhà nước;\nb) Vi phạm quy định về thông báo, niêm yết biểu phí\ndịch vụ thanh toán, biểu phí dịch vụ thẻ.\n4. Phạt tiền từ 20.000.000 đồng đến 30.000.000 đồng\nđối với một trong các hành vi vi phạm sau đây:\na)[52] Cung cấp không trung thực thông tin có liên quan đến việc cung ứng dịch vụ thanh toán;\nb) Ký duyệt lệnh thanh toán không đúng thẩm quyền hoặc sử dụng chữ ký điện tử của người khác;\nc) Mở, sử dụng và ủy quyền sử dụng tài khoản thanh toán không đúng quy định của pháp luật trong quá trình sử dụng dịch vụ thanh toán.\n5.[53] Phạt tiền từ\n40.000.000 đồng đến 50.000.000 đồng đối với một trong các hành vi vi phạm sau\nđây:\na) Thuê, cho thuê, mượn, cho mượn tài khoản thanh toán, mua, bán thông tin tài khoản thanh toán với số lượng từ 01 tài khoản thanh toán đến dưới 10 tài khoản thanh toán mà chưa đến mức bị truy cứu trách nhiệm hình sự;\nb) Làm giả chứng từ thanh toán khi cung ứng, sử dụng dịch vụ thanh toán mà chưa đến mức bị truy cứu trách nhiệm hình sự.\n6.[54] Phạt tiền từ\n50.000.000 đồng đến 100.000.000 đồng đối với một trong các hành vi vi phạm sau\nđây:\na) Mở tài khoản thanh toán cho khách hàng, cho phép khách hàng sử dụng tài khoản thanh toán không đúng quy định của pháp luật trong quá trình cung ứng dịch vụ thanh toán;\nb) Thuê, cho thuê, mượn, cho mượn tài khoản thanh toán, mua, bán thông tin tài khoản thanh toán với số lượng từ 10 tài khoản thanh toán trở lên mà chưa đến mức bị truy cứu trách nhiệm hình sự;\nc) Làm giả phương tiện thanh toán, lưu giữ, lưu hành,\nchuyển nhượng, sử dụng phương tiện thanh toán giả mà chưa đến mức bị truy cứu trách nhiệm hình sự;\nd) Phát hành, cung ứng, sử dụng các phương tiện thanh toán không hợp pháp mà chưa đến mức bị truy cứu trách nhiệm hình sự;\nđ) Hoạt động không đúng nội dung chấp thuận của Ngân hàng Nhà nước về việc cung ứng dịch vụ thanh toán không qua tài khoản thanh toán của khách hàng.\n7.[55] Phạt tiền từ\n100.000.000 đồng đến 150.000.000 đồng đối với một trong các hành vi vi phạm sau\nđây:\na) Xâm nhập hoặc tìm cách xâm nhập, đánh cắp dữ liệu,\nphá hoại, làm thay đổi trái phép chương trình phần mềm, dữ liệu điện tử sử dụng trong thanh toán; lợi dụng lỗi hệ thống mạng máy tính để trục lợi mà chưa đến mức bị truy cứu trách nhiệm hình sự;\nb) Mở hoặc duy trì tài khoản thanh toán nặc danh, mạo danh;\nc) Thực hiện, tổ chức thực hiện hoặc tạo điều kiện thực hiện các hành vi: sử dụng, lợi dụng tài khoản thanh toán, phương tiện thanh toán, dịch vụ thanh toán để đánh bạc, tổ chức đánh bạc, gian lận, lừa đảo,\nkinh doanh trái pháp luật và thực hiện các hành vi vi phạm pháp luật khác;\nd) Lấy cắp, thông đồng để lấy cắp thông tin tài khoản thanh toán mà chưa đến mức bị truy cứu trách nhiệm hình sự.\n8.[56] Phạt tiền từ\n150.000.000 đồng đến 200.000.000 đồng đối với các hành vi vi phạm sau đây:\na) Vi phạm quy định thanh toán bằng tiền mặt;\nb) Thực hiện cung ứng dịch vụ thanh toán mà không phải là tổ chức cung ứng dịch vụ thanh toán.\n9. Hình thức xử phạt bổ sung:\nTịch thu tang vật, phương tiện được sử dụng để thực hiện hành vi vi phạm quy định tại khoản 1, điểm b khoản 5 và điểm c, d khoản 6 Điều này.\n10.[57] Biện pháp khắc phục hậu quả:\na) Buộc nộp vào ngân sách nhà nước số lợi bất hợp pháp có được do thực hiện hành vi vi phạm quy định tại khoản 1, khoản 4, khoản 5, khoản 6, khoản 7 và khoản 8 Điều này;\nb) Không cho mở rộng phạm vi, quy mô và địa bàn hoạt\nđộng trong thời gian chưa khắc phục xong vi phạm đối với hành vi vi phạm quy định tại các điểm a, c, d khoản 6, điểm c khoản 7 và điểm a khoản 8 Điều này;\nc) Đề nghị cấp có thẩm quyền thu hồi văn bản chấp thuận hoạt động cung ứng dịch vụ thanh toán không qua tài khoản thanh toán của khách hàng đối với hành vi vi phạm tại điểm đ khoản 6 Điều này.\nĐiều 27. Vi phạm quy định về\ntrung gian thanh toán 1. Phạt tiền từ 5.000.000 đồng đến 10.000.000 đồng\nđối với một trong các hành vi vi phạm sau đây:\na)[58] Cung cấp không trung thực thông tin có liên quan đến việc cung ứng hoặc sử dụng dịch vụ\ntrung gian thanh toán;\nb) Tiếp nhận, xử lý tra soát, khiếu nại của khách hàng không đúng quy định của pháp luật;\nc) Vi phạm quy định về công cụ để Ngân hàng Nhà nước giám sát hoạt động cung ứng dịch vụ ví điện tử.\n2.[59] Phạt tiền từ\n15.000.000 đồng đến 20.000.000 đồng đối với một trong các hành vi vi phạm sau\nđây:\na) Cấp tín dụng cho khách hàng sử dụng ví điện tử,\ntrả lãi trên số dư ví điện tử hoặc bất kỳ hành động nào có thể làm gia tăng giá\ntrị tiền tệ trên ví điện tử so với giá trị tiền khách hàng nạp vào ví điện tử;\nb) Vi phạm quy định về thực hiện việc nạp tiền vào ví điện tử, rút tiền ra khỏi ví điện tử.\n3.[60] Phạt tiền từ\n20.000.000 đồng đến 30.000.000 đồng đối với một trong các hành vi vi phạm sau\nđây:\na) Tiết lộ, cung cấp thông tin khách hàng, thông tin về số dư ví điện tử và các giao dịch thanh toán của khách hàng tại tổ chức cung ứng dịch vụ trung gian thanh toán không đúng quy định của pháp luật;\nb) Thuê, cho thuê, mượn, cho mượn ví điện tử hoặc mua, bán thông tin ví điện tử từ 01 ví điện tử đến dưới 10 ví điện tử;\nc) Vi phạm quy định về tài khoản đảm bảo thanh toán.\n4.[61] Phạt tiền từ\n40.000.000 đồng đến 50.000.000 đồng đối với một trong các hành vi vi phạm sau\nđây:\na) Gian lận các giấy tờ chứng minh đủ điều kiện để\nđược cấp giấy phép hoạt động cung ứng dịch vụ trung gian thanh toán trong hồ sơ\nđề nghị cấp giấy phép mà chưa đến mức bị truy cứu trách nhiệm hình sự;\nb) Tẩy xóa, thay đổi nội dung ghi trong giấy phép hoạt động cung ứng dịch vụ trung gian thanh toán; mua, bán, chuyển nhượng, cho thuê, cho mượn giấy phép hoạt động cung ứng dịch vụ trung gian thanh toán; ủy thác, giao đại lý cho tổ chức, cá nhân khác thực hiện hoạt động được phép theo giấy phép hoạt động cung ứng dịch vụ trung gian thanh toán;\nc) Hoạt động không đúng nội dung quy định trong giấy phép hoạt động cung ứng dịch vụ trung gian thanh toán;\nd) Thuê, cho thuê, mượn, cho mượn ví điện tử hoặc mua, bán thông tin ví điện tử từ 10 ví điện tử trở lên;\nđ) Làm giả chứng từ khi cung ứng dịch vụ trung gian thanh toán mà chưa đến mức bị truy cứu trách nhiệm hình sự;\ne) Thực hiện, tổ chức thực hiện hoặc tạo điều kiện thực hiện các hành vi: sử dụng, lợi dụng dịch vụ trung gian thanh toán để đánh bạc, tổ chức đánh bạc, gian lận, lừa đảo, kinh doanh trái pháp luật và thực hiện các hành vi vi phạm pháp luật khác;\ng) Vi phạm quy định về hạn mức giao dịch qua ví điện tử;\nh) Báo cáo không trung thực số dư, số lượng ví điện tử theo quy định của pháp luật;\ni) Mở hoặc duy trì ví điện tử nặc danh, mạo danh;\nk) Lấy cắp, thông đồng để lấy cắp thông tin ví điện tử;\nl) Tổ chức cung ứng dịch vụ trung gian thanh toán thực hiện cung ứng dịch vụ hỗ trợ thu hộ, chi hộ, dịch vụ ví điện tử, dịch vụ cổng thanh toán điện tử khi chưa có thỏa thuận hợp tác, hợp đồng cung ứng dịch vụ với ngân hàng, các tổ chức khác phù hợp với nội dung Giấy phép và quy định của pháp luật;\nm) Không yêu cầu khách hàng hoàn thành việc liên kết ví điện tử với tài khoản thanh toán hoặc thẻ ghi nợ của khách hàng mở tại ngân hàng liên kết trước khi khách hàng sử dụng ví điện tử.\n4a.[62] Phạt tiền từ\n50.000.000 đồng đến 60.000.000 đồng đối với hành vi báo cáo không trung thực số\ndư, số lượng ví điện tử theo quy định của pháp luật trong trường hợp tái phạm.\n5. Phạt tiền từ 150.000.000 đồng đến 250.000.000 đồng\nđối với hành vi cung ứng dịch vụ trung gian thanh toán không có giấy phép.\n6.[63] Hình thức xử\nphạt bổ sung:\nTịch thu tang vật, phương tiện được sử dụng để thực hiện hành vi vi phạm quy định tại điểm đ khoản 4 Điều này.\n7.[64] Biện pháp khắc phục hậu quả:\na) Buộc nộp vào ngân sách nhà nước số lợi bất hợp pháp có được do thực hiện hành vi vi phạm quy định tại khoản 2, điểm b, c khoản 3, khoản 4, khoản 5 Điều này;\nb) Đề nghị cấp có thẩm quyền thu hồi giấy phép hoạt\nđộng cung ứng dịch vụ trung gian thanh toán đối với hành vi vi phạm tại các điểm a, b, c, e khoản 4; khoản 4a Điều này;\nc) Buộc nộp lại giấy phép bị tẩy xóa, sửa chữa đối với hành vi vi phạm quy định tại điểm b khoản 4 Điều này.\nĐiều 28. Vi phạm quy định về\nhoạt động thẻ ngân hàng 1. Phạt cảnh cáo đối với một trong các hành vi vi phạm sau đây:\na) Không thực hiện việc kiểm tra, bảo trì, bảo dưỡng máy giao dịch tự động;\nb) Không cập nhật thông tin về việc triển khai lắp\nđặt, thay đổi địa điểm, thay đổi thời gian hoạt động, chấm dứt hoạt động máy giao dịch tự động trên hệ thống quản lý máy giao dịch tự động và trang thông tin điện tử chính thức của tổ chức cung ứng dịch vụ thanh toán.\n2. Phạt tiền từ 10.000.000 đồng đến 15.000.000 đồng\nđối với một trong các hành vi vi phạm sau đây:\na) Không thông báo việc triển khai lắp đặt, thay đổi\nđịa điểm, thay đổi thời gian hoạt động, chấm dứt hoạt động của máy giao dịch tự\nđộng theo quy định của pháp luật;\nb) Không đảm bảo thời gian phục vụ khách hàng của hệ\nthống máy giao dịch tự động theo quy định của pháp luật;\nc) Không duy trì hoạt động của bộ phận hỗ trợ khách hàng để khách hàng liên hệ được bất cứ lúc nào;\nd) Không giám sát mức tồn quỹ tại máy giao dịch tự\nđộng, không đảm bảo máy giao dịch tự động phải có tiền để đáp ứng nhu cầu rút tiền của khách hàng theo quy định; không đảm bảo yêu cầu về hạn mức cho một lần rút tiền tại máy giao dịch tự động theo quy định của pháp luật;\nđ) Không đáp ứng các yêu cầu kỹ thuật về phần mềm,\nđường truyền cho máy giao dịch tự động theo quy định của pháp luật.\n3. Phạt tiền từ 15.000.000 đồng đến 20.000.000 đồng\nđối với hành vi không đảm bảo yêu cầu về nhật ký giao dịch của máy giao dịch tự\nđộng theo quy định của pháp luật.\n4. Phạt tiền từ 20.000.000 đồng đến 30.000.000 đồng\nđối với hành vi không thực hiện các biện pháp đảm bảo an toàn, bảo mật hoạt động của máy giao dịch tự động.\n5. Phạt tiền từ 30.000.000 đồng đến 50.000.000 đồng\nđối với một trong các hành vi vi phạm sau đây:\na) Vi phạm đồng tiền thanh toán trên thẻ;\nb) Thu phụ phí hoặc phân biệt giá khi chủ thẻ thanh toán tiền hàng hóa, dịch vụ bằng thẻ;\nc) Thuê, cho thuê, mua, bán thẻ hoặc thông tin thẻ,\nmở hộ thẻ (trừ trường hợp thẻ trả trước vô danh) với số lượng từ 01 thẻ đến dưới 10 thẻ;\nd)[65] Lập hợp đồng phát hành và sử dụng thẻ không đúng theo quy định pháp luật.\n6.[66] Phạt tiền từ\n50.000.000 đồng đến 100.000.000 đồng đối với một trong các hành vi vi phạm sau\nđây:\na) Thuê, cho thuê, mua, bán thẻ hoặc thông tin thẻ,\nmở hộ thẻ (trừ trường hợp thẻ trả trước vô danh) với số lượng từ 10 thẻ trở lên mà chưa đến mức bị truy cứu trách nhiệm hình sự;\nb) Phát hành thẻ, thanh toán thẻ không đúng quy định của pháp luật;\nc) Không từ chối thanh toán thẻ trong các trường hợp sử dụng thẻ để thực hiện các giao dịch thẻ bị cấm theo quy định của pháp luật,\nthẻ đã được chủ thẻ thông báo bị mất, thẻ hết hạn sử dụng, thẻ bị khóa, sử dụng thẻ không đúng phạm vi đã thỏa thuận tại hợp đồng hoặc thỏa thuận bằng văn bản về phát hành và sử dụng thẻ.\n7.[67] Phạt tiền từ\n100.000.000 đồng đến 150.000.000 đồng đối với một trong các hành vi vi phạm sau\nđây:\na) Thực hiện, tổ chức thực hiện hoặc tạo điều kiện thực hiện việc sử dụng thẻ trả trước vô danh trên môi trường Internet, chương trình ứng dụng trên thiết bị di động hoặc rút tiền mặt;\nb) Chuyển mạch thẻ, bù trừ giao dịch thẻ, quyết toán giao dịch thẻ không đúng theo quy định pháp luật về hoạt động thẻ ngân hàng;\nc) Chuyển thiết bị chấp nhận thẻ, QR Code cho bên khác sử dụng; chấp nhận thanh toán thẻ mà không có hợp đồng thanh toán thẻ; sử\ndụng trái phép các thiết bị chấp nhận thẻ, QR Code;\nd) Thực hiện, tổ chức thực hiện hoặc tạo điều kiện\nđể người khác thực hiện các hành vi giao dịch thẻ gian lận, giả mạo; giao dịch thanh toán khống tại đơn vị chấp nhận thẻ (không phát sinh việc mua bán hàng hóa và cung ứng dịch vụ);\nđ) Lấy cắp, thông đồng để lấy cắp thông tin thẻ mà\nchưa đến mức bị truy cứu trách nhiệm hình sự.\n8. Hình thức xử phạt bổ sung:\nTịch thu tang vật, phương tiện được sử dụng để thực hiện các hành vi quy định tại điểm c khoản 5, điểm a khoản 6, các điểm a, c và\nd khoản 7 Điều này.\n9.[68] Biện pháp khắc phục hậu quả:\na) Buộc nộp vào ngân sách nhà nước số lợi bất hợp pháp có được do thực hiện hành vi vi phạm quy định tại điểm b, c khoản 5; điểm a, c khoản 6 và khoản 7 Điều này;\nb) Không được ký hợp đồng thanh toán thẻ với các tổ\nchức thanh toán thẻ khác trong thời gian chưa khắc phục xong vi phạm đối với hành vi vi phạm quy định tại điểm b khoản 5, điểm a, c, d khoản 7 Điều này.\nĐiều 28a. Vi phạm quy định về\nhoạt động đại lý thanh toán[69]\n1. Phạt tiền từ 5.000.000 đồng đến 10.000.000 đồng\nđối với một trong các hành vi vi phạm sau đây:\na) Cung cấp không trung thực thông tin có liên quan\nđến việc cung ứng hoặc sử dụng hoạt động đại lý thanh toán;\nb) Tiếp nhận, xử lý tra soát, khiếu nại của khách hàng không đúng quy định của pháp luật;\nc) Thu các loại phí ngoài biểu phí do bên giao đại lý quy định và công bố;\nd) Không tách biệt tài khoản thanh toán chỉ sử dụng cho hoạt động đại lý thanh toán theo quy định của pháp luật;\nđ) Không công bố công khai danh sách các bên đại lý\nthanh toán đã ký kết hợp đồng trên trang thông tin điện tử và ứng dụng của bên giao đại lý.\n2. Phạt tiền từ 40.000.000 đồng đến 50.000.000 đồng\nđối với một trong các hành vi vi phạm sau đây:\na) Lợi dụng việc làm đại lý thanh toán để thực hiện,\ntổ chức thực hiện hoặc tạo điều kiện để tổ chức, cá nhân khác thực hiện các hành vi giao dịch gian lận, giả mạo, chiếm đoạt tiền của khách hàng, hành vi giao dịch cho các mục đích rửa tiền, tài trợ khủng bố, tài trợ phổ biến vũ khí\nhủy diệt hàng loạt và các hành vi vi phạm pháp luật khác;\nb) Thực hiện các nghiệp vụ đại lý thanh toán không\nđược bên giao đại lý ký kết trong hợp đồng đại lý thanh toán giữa bên giao đại lý và bên đại lý thanh toán.\n3. Phạt tiền từ 50.000.000 đồng đến 100.000.000 đồng\nđối với một trong các hành vi vi phạm sau đây:\na) Thực hiện hoạt động giao đại lý, làm đại lý\nthanh toán không phù hợp với nội dung ghi trong Giấy phép thành lập và hoạt động hoặc Giấy phép thành lập hoặc Quyết định quy định về tổ chức và hoạt động của cấp có thẩm quyền quyết định và văn bản sửa đổi, bổ sung Giấy phép (nếu có);\nb) Bên giao đại lý vi phạm quy định về số lượng điểm\nđại lý thanh toán, hạn mức giao dịch đối với một điểm đại lý thanh toán;\nc) Bên đại lý thanh toán là tổ chức không phải là tổ\nchức tín dụng, chi nhánh ngân hàng nước ngoài thực hiện giao đại lý lại cho bên thứ ba;\nd) Thực hiện hoạt động đại lý thanh toán khi chưa ký kết hợp đồng về hoạt động đại lý thanh toán với bên giao đại lý thanh toán;\nđ) Bên giao đại lý ký hợp đồng hoạt động đại lý\nthanh toán với bên đại lý thanh toán không phải là doanh nghiệp thành lập hợp pháp và có dư nợ bị tổ chức tín dụng, chi nhánh ngân hàng nước ngoài phân loại vào nhóm nợ xấu theo quy định của Ngân hàng Nhà nước;\ne) Giả mạo, mạo danh bên đại lý thanh toán.\n4. Biện pháp khắc phục hậu quả:\na) Buộc nộp vào ngân sách nhà nước số lợi bất hợp pháp có được do thực hiện hành vi vi phạm quy định tại điểm b khoản 2, khoản 3 Điều này;\nb) Buộc chấm dứt hoạt động đại lý thanh toán đối với các chủ thể vi phạm hành vi vi phạm quy định tại khoản 2, khoản 3 Điều này;\nc) Buộc tách biệt tài khoản thanh toán chỉ sử dụng cho hoạt động đại lý thanh toán đối với hành vi vi phạm quy định tại điểm d khoản 1 Điều này;\nd) Không được ký hợp đồng đại lý thanh toán với các bên giao đại lý thanh toán khác trong thời gian chưa khắc phục xong vi phạm đối với hành vi vi phạm quy định tại các điểm c, d khoản 1 Điều này;\nđ) Buộc hoàn trả các loại phí đã thu sai cho tổ chức,\ncá nhân nộp phí, trường hợp không xác định được đối tượng được hoàn trả thì nộp vào ngân sách nhà nước đối với hành vi vi phạm quy định tại điểm c khoản 1 Điều này;\ne) Buộc hoàn trả số tiền đã chiếm đoạt cho khách hàng đối với hành vi được thực hiện nhằm chiếm đoạt tiền của khách hàng quy định tại điểm a khoản 2 Điều này.\nĐiều 29. Vi phạm quy định về\ncông cụ chuyển nhượng 1. Phạt tiền từ 15.000.000 đồng đến 20.000.000 đồng\nđối với hành vi ký vào công cụ chuyển nhượng không đúng thẩm quyền.\n2. Phạt tiền từ 20.000.000 đồng đến 30.000.000 đồng\nđối với một trong các hành vi vi phạm sau đây:\na) Thực hiện không đúng quy định về nghĩa vụ của người chấp nhận quy định tại Điều 22 Luật Các công cụ chuyển nhượng;\nb) Nhờ thu qua người thu hộ không đúng quy định tại các khoản 1, 2 và 3 Điều 39 Luật Các công cụ chuyển nhượng.\n3. Phạt tiền từ 30.000.000 đồng đến 50.000.000 đồng\nđối với một trong các hành vi vi phạm sau đây:\na) Chuyển nhượng công cụ chuyển nhượng khi đã biết công cụ chuyển nhượng này quá hạn thanh toán hoặc đã bị từ chối chấp nhận, bị từ\nchối thanh toán hoặc đã được thông báo bị mất quy định tại khoản 4 Điều 15 Luật Các công cụ chuyển nhượng;\nb) Ký phát séc khi không đủ khả năng thanh toán.\n4. Phạt tiền từ 60.000.000 đồng đến 120.000.000 đồng\nđối với một trong các hành vi vi phạm sau đây:\na) Giả mạo chữ ký trên công cụ chuyển nhượng;\nb) Không thực hiện đúng quy định về in, giao nhận và quản lý séc trắng quy định tại các khoản 2, 3 Điều 64 Luật Các công cụ chuyển nhượng.\n5. Hình thức xử phạt bổ sung:\nTịch thu tang vật, phương tiện được sử dụng để thực hiện hành vi vi phạm quy định tại khoản 4 Điều này.\n6. Biện pháp khắc phục hậu quả:\nBuộc nộp vào ngân sách nhà nước số lợi bất hợp pháp có được do thực hiện hành vi vi phạm quy định tại điểm b khoản 3 và khoản 4 Điều này.\nĐiều 30. Vi phạm quy định về\nquản lý tiền tệ và kho quỹ\n1. Phạt cảnh cáo đối với một trong các hành vi vi phạm sau đây:\na)[70] Không niêm yết công khai tại nơi giao dịch mẫu tiêu biểu và quy định thu, đổi tiền không đủ\ntiêu chuẩn lưu thông của Ngân hàng Nhà nước;\nb) Đối tượng được cấp làm mất tiền mẫu; không thực hiện cấp cho các đối tượng được cấp tiền mẫu; không thu hồi tiền mẫu khi có\nthông báo đình chỉ lưu hành hoặc khi có yêu cầu;\nc) Không mở, không ghi chép đầy đủ các loại sổ sách liên quan đến hoạt động an toàn kho quỹ theo quy định của pháp luật.\n2.[71] Phạt tiền từ\n5.000.000 đồng đến 10.000.000 đồng đối với hành vi không thực hiện đúng quy định về phân loại, đóng gói, giao nhận kim khí quý, đá quý; đóng gói, niêm phong,\ngiao nhận, bảo quản, vận chuyển, kiểm kê tiền mặt, tài sản quý, giấy tờ có giá,\ntrừ trường hợp quy định tại điểm a khoản 3 và các điểm b, c, d, đ khoản 5 Điều này.\n3. Phạt tiền từ 10.000.000 đồng đến 15.000.000 đồng\nđối với một trong các hành vi vi phạm sau đây:\na) Không ban hành, niêm yết nội quy vào, ra kho tiền,\nquầy giao dịch tiền mặt; không ban hành quy trình giao dịch tiền mặt nội bộ và\ngiao dịch tiền mặt đối với khách hàng;\nb) Không có phương án canh gác, bảo vệ kho tiền;\nc) Không có nội quy, phương án phòng cháy, chữa cháy đối với kho tiền;\nd) Không thực hiện việc tuyển chọn, phân loại tiền không đủ tiêu chuẩn lưu thông.\nđ)[72] Từ chối đổi tiền không đủ tiêu chuẩn lưu thông cho khách hàng không đúng quy định của pháp luật.\n4. Phạt tiền từ 15.000.000 đồng đến 20.000.000 đồng\nđối với hành vi không lắp đặt các thiết bị an toàn kho tiền, phòng cháy, chữa cháy đối với kho tiền theo quy định của pháp luật.\n5. Phạt tiền từ 20.000.000 đồng đến 40.000.000 đồng\nđối với một trong các hành vi vi phạm sau đây:\na) Thực hiện đổi tiền không đúng quy định của pháp luật;\nb) Không bảo quản tiền mặt, tài sản quý, giấy tờ có\ngiá trong thời gian nghỉ buổi trưa theo quy định của pháp luật;\nc) Sử dụng và bảo quản chìa khóa cửa kho tiền, gian kho, két sắt, chìa khóa thùng đựng tiền trên xe chuyên dùng không theo quy định của pháp luật;\nd) Vận chuyển tiền mặt, tài sản quý, giấy tờ có giá\nkhông sử dụng xe chuyên dùng nhưng không có văn bản quy định về quy trình vận chuyển, bảo vệ, các biện pháp đảm bảo an toàn tài sản của cấp có thẩm quyền;\nđ) Không quy định bằng văn bản điều kiện, quy trình nhận, giao trả tài sản cho khách hàng, trách nhiệm của các bộ phận có liên quan trong việc đảm bảo an toàn tài sản khi làm dịch vụ quản lý, bảo quản tài sản,\ncho thuê tủ, két an toàn và các dịch vụ ngân quỹ khác.\n6. Phạt tiền từ 40.000.000 đồng đến 50.000.000 đồng\nđối với một trong các hành vi vi phạm sau đây:\na) Sử dụng kho tiền không đúng kết cấu và tiêu chuẩn kỹ thuật theo quy định của pháp luật;\nb) Sử dụng cửa kho tiền không đúng tiêu chuẩn kỹ\nthuật theo quy định của pháp luật.\nĐiều 31. Vi phạm quy định về bảo vệ tiền Việt Nam 1. Phạt cảnh cáo đối với một trong các hành vi vi phạm sau đây:\na) Không thông báo kịp thời cho cơ quan có thẩm quyền khi phát hiện tiền giả loại mới;\nb) Không thông báo kịp thời cho cơ quan có thẩm quyền khi phát hiện có dấu hiệu tàng trữ, lưu hành, vận chuyển tiền giả;\nc)[73] Bố trí người làm công tác thu giữ tiền giả, tạm thu giữ tiền nghi giả chưa qua tập huấn về kỹ\nnăng nhận biết tiền thật, tiền giả hoặc chưa qua bồi dưỡng nghiệp vụ giám định tiền;\nd) Không giao nộp tiền giả theo quy định của pháp luật.\n2. Phạt tiền từ 5.000.000 đồng đến 10.000.000 đồng\nđối với một trong các hành vi vi phạm sau đây:\na) Phát hiện tiền giả nhưng không thu giữ;\nb) Phát hiện tiền nghi giả nhưng không tạm giữ;\nc) Không lập biên bản hoặc thu giữ tiền giả, không\nđóng dấu, bấm lỗ theo quy định của Ngân hàng Nhà nước về xử lý tiền giả, tiền nghi giả khi thu giữ tiền giả hoặc tạm giữ tiền nghi giả.\n3. Phạt tiền từ 10.000.000 đồng đến 15.000.000 đồng\nđối với hành vi phá hoại, hủy hoại tiền Việt Nam trái pháp luật.\n4. Phạt tiền từ 40.000.000 đồng đến 50.000.000 đồng\nđối với hành vi sao chụp, in ấn, sử dụng bố cục, một phần hoặc toàn bộ hình ảnh,\nchi tiết, hoa văn của tiền Việt Nam không đúng quy định của pháp luật 5. Hình thức xử phạt bổ sung:\nTịch thu toàn bộ tang vật, phương tiện thực hiện hành vi vi phạm tại các khoản 2, 3 và 4 Điều này, giao cơ quan có thẩm quyền xử\nlý.\n6. Biện pháp khắc phục hậu quả:\na) Buộc đóng dấu, bấm lỗ tiền giả theo đúng quy định của Ngân hàng Nhà nước về xử lý tiền giả, tiền nghi giả đối với hành vi vi phạm quy định tại điểm c khoản 2 Điều này;\nb) Buộc tiêu hủy toàn bộ tang vật, phương tiện được sử dụng để thực hiện hành vi vi phạm quy định tại khoản 4 Điều này;\nc) Buộc nộp vào ngân sách nhà nước số lợi bất hợp pháp có được do thực hiện hành vi vi phạm quy định tại khoản 4 Điều này.\nMục 9. VI PHẠM QUY ĐỊNH VỀ\nMUA, ĐẦU TƯ VÀO TÀI SẢN CỐ ĐỊNH VÀ KINH DOANH BẤT ĐỘNG SẢN CỦA TỔ CHỨC TÍN DỤNG,\nCHI NHÁNH NGÂN HÀNG NƯỚC NGOÀI\nĐiều 32. Vi phạm quy định về\nmua, đầu tư vào tài sản cố định 1. Phạt tiền từ 100.000.000 đồng đến 150.000.000 đồng\nđối với hành vi vi phạm về mua, đầu tư vào tài sản cố định phục vụ trực tiếp cho hoạt động quá 50% vốn điều lệ và quỹ dự trữ bổ sung vốn điều lệ đối với tổ\nchức tín dụng hoặc quá 50% vốn được cấp và quỹ dự trữ bổ sung vốn được cấp đối với chi nhánh ngân hàng nước ngoài.\n2. Biện pháp khắc phục hậu quả:\na) Buộc duy trì tỷ lệ giá trị tài sản cố định phục vụ trực tiếp cho hoạt động so với vốn điều lệ, vốn được cấp và quỹ dự trữ bổ\nsung vốn điều lệ, vốn được cấp theo đúng quy định tại Điều 140 Luật Các tổ chức tín dụng đối với hành vi vi phạm quy định tại khoản 1 Điều này trong thời hạn tối\nđa 06 tháng kể từ ngày quyết định xử phạt vi phạm hành chính có hiệu lực;\nb) Buộc nộp vào ngân sách nhà nước số lợi bất hợp pháp có được do thực hiện hành vi vi phạm quy định tại khoản 1 Điều này.\nĐiều 33. Vi phạm quy định về\nkinh doanh bất động sản 1. Phạt tiền từ 200.000.000 đồng đến 250.000.000 đồng\nđối với hành vi kinh doanh bất động sản, trừ trường hợp quy định tại các khoản 1, 2 và 3 Điều 132 Luật Các tổ chức tín dụng.\n2. Biện pháp khắc phục hậu quả:\nBuộc nộp vào ngân sách nhà nước số lợi bất hợp pháp có được do thực hiện hành vi vi phạm quy định tại khoản 1 Điều này.\nMục 10. VI PHẠM QUY ĐỊNH VỀ BẢO\nĐẢM AN TOÀN HOẠT ĐỘNG CỦA TỔ CHỨC TÍN DỤNG, CHI NHÁNH NGÂN HÀNG NƯỚC NGOÀI\nĐiều 34. Vi phạm quy định về\nduy trì dự trữ bắt buộc, mua tín phiếu Ngân hàng Nhà nước bắt buộc 1. Phạt cảnh cáo đối với một trong các hành vi vi phạm sau:\na) Không duy trì đủ dự trữ bắt buộc theo quy định của pháp luật;\nb) Không tuân thủ quy định mua tín phiếu Ngân hàng Nhà nước bắt buộc.\n2. Phạt tiền từ 10.000.000 đồng đến 20.000.000 đồng\nđối với hành vi không duy trì đủ dự trữ bắt buộc theo quy định của pháp luật trong trường hợp tái phạm hoặc vi phạm nhiều lần.\n3. Biện pháp khắc phục hậu quả:\nĐề nghị hoặc yêu cầu cấp có thẩm quyền xem xét, áp dụng biện pháp đình chỉ từ 01 tháng đến 03 tháng hoặc miễn nhiệm chức danh quản trị, điều hành, kiểm soát; không cho đảm nhiệm chức vụ quản trị, điều hành, kiểm soát tại các tổ chức tín dụng, chi nhánh ngân hàng nước ngoài đối với cá nhân vi phạm và/hoặc cá nhân chịu trách nhiệm đối với hành vi vi phạm quy định tại khoản 2 Điều này.\nYêu cầu tổ chức tín dụng, chi nhánh ngân hàng nước ngoài cách chức và thực hiện các biện pháp xử lý khác theo quy định của pháp luật\nđối với cá nhân vi phạm thuộc thẩm quyền của tổ chức tín dụng, chi nhánh ngân hàng nước ngoài.\nĐiều 35. Vi phạm quy định về tỷ\nlệ bảo đảm an toàn 1. Phạt tiền từ 200.000.000 đồng đến 220.000.000 đồng\nđối với hành vi vi phạm quy định của pháp luật về một trong các tỷ lệ bảo đảm an toàn sau:\na) Tỷ lệ tối đa của nguồn vốn ngắn hạn được sử dụng\nđể cho vay trung hạn và dài hạn;\nb) Tỷ lệ dư nợ cho vay so với tổng tiền gửi;\nc) Tỷ lệ mua, đầu tư trái phiếu Chính phủ, trái phiếu\nđược Chính phủ bảo lãnh.\n2. Phạt tiền từ 250.000.000 đồng đến 300.000.000 đồng\nđối với hành vi vi phạm quy định của pháp luật về tỷ lệ khả năng chi trả.\n3. Phạt tiền từ 300.000.000 đồng đến 350.000.000 đồng\nđối với hành vi vi phạm tỷ lệ an toàn vốn tối thiểu theo quy định của pháp luật.\n4. Biện pháp khắc phục hậu quả:\na) Buộc thực hiện đúng tỷ lệ bảo đảm an toàn theo quy định trong thời hạn tối đa 06 tháng kể từ ngày quyết định xử phạt vi phạm hành chính có hiệu lực đối với hành vi vi phạm quy định tại các khoản 1, 2 và 3\nĐiều này;\nb) Không cho mở rộng phạm vi, quy mô và địa bàn hoạt\nđộng và bổ sung nghiệp vụ kinh doanh mới trong thời gian chưa khắc phục xong vi phạm đối với hành vi vi phạm quy định tại các khoản 1, 2 và 3 Điều này;\nc) Đề nghị hoặc yêu cầu cấp có thẩm quyền xem xét,\náp dụng biện pháp đình chỉ từ 01 tháng đến 03 tháng hoặc miễn nhiệm chức danh quản trị, điều hành, kiểm soát; không cho đảm nhiệm chức vụ quản trị, điều hành, kiểm soát tại các tổ chức tín dụng, chi nhánh ngân hàng nước ngoài đối với cá nhân vi phạm và/hoặc cá nhân chịu trách nhiệm đối với hành vi vi phạm quy định tại các khoản 2, 3 Điều này.\nYêu cầu tổ chức tín dụng, chi nhánh ngân hàng nước ngoài cách chức và thực hiện các biện pháp xử lý khác theo quy định của pháp luật\nđối với cá nhân vi phạm thuộc thẩm quyền của tổ chức tín dụng, chi nhánh ngân hàng nước ngoài.\nĐiều 36. Vi phạm quy định về\nphân loại tài sản có, cam kết ngoại bảng, trích lập và sử dụng dự phòng để xử\nlý rủi ro 1. Phạt tiền từ 150.000.000 đồng đến 200.000.000 đồng\nđối với một trong các hành vi vi phạm sau đây:\na) Thực hiện phân loại tài sản có, cam kết ngoại bảng không đúng quy định của pháp luật;\nb) Trích lập dự phòng rủi ro không đúng quy định của pháp luật, trừ trường hợp việc trích lập dự phòng rủi ro không đúng quy định của pháp luật là hậu quả của hành vi vi phạm tại điểm a khoản 1 Điều này;\nc) Sử dụng dự phòng để xử lý rủi ro không đúng quy\nđịnh của pháp luật;\nd) Không có biện pháp thu hồi nợ đầy đủ, triệt để đối với khoản nợ đã được sử dụng dự phòng để xử lý rủi ro.\n2. Biện pháp khắc phục hậu quả:\na) Buộc phân loại tài sản có, trích lập dự phòng rủi ro; hoàn nhập số tiền dự phòng rủi ro đã sử dụng không đúng quy định, chuyển khoản nợ đã xử lý bằng dự phòng rủi ro hạch toán nội bảng theo quy định của pháp luật trong thời hạn tối đa 01 tháng kể từ ngày quyết định xử phạt vi phạm hành chính có hiệu lực đối với hành vi vi phạm tại khoản 1 Điều này;\nb) Đề nghị hoặc yêu cầu cấp có thẩm quyền xem xét,\náp dụng biện pháp đình chỉ từ 01 tháng đến 03 tháng hoặc miễn nhiệm chức danh quản trị, điều hành, kiểm soát; không cho đảm nhiệm chức vụ quản trị, điều hành, kiểm soát tại các tổ chức tín dụng, chi nhánh ngân hàng nước ngoài đối với cá nhân vi phạm và/hoặc cá nhân chịu trách nhiệm đối với hành vi vi phạm quy định tại khoản 1 Điều này.\nYêu cầu tổ chức tín dụng, chi nhánh ngân hàng nước ngoài cách chức và thực hiện các biện pháp xử lý khác theo quy định của pháp luật\nđối với cá nhân vi phạm thuộc thẩm quyền của tổ chức tín dụng, chi nhánh ngân hàng nước ngoài.\nĐiều 37. Vi phạm quy định về\ntrích lập và sử dụng các quỹ\n1. Phạt tiền từ 20.000.000 đồng đến 40.000.000 đồng\nđối với hành vi trích lập hoặc sử dụng các quỹ không đúng quy định của pháp luật.\n2. Biện pháp khắc phục hậu quả:\nBuộc trích lập các quỹ đúng quy định của pháp luật trong thời hạn 15 ngày kể từ ngày quyết định xử phạt vi phạm hành chính có hiệu lực đối với hành vi vi phạm tại khoản 1 Điều này.\nMục 11. VI PHẠM QUY ĐỊNH VỀ BẢO HIỂM TIỀN GỬI\nĐiều 38. Vi phạm quy định về bảo hiểm tiền gửi 1. Phạt cảnh cáo đối với một trong các hành vi vi phạm sau đây:\na) Không niêm yết công khai bản sao chứng nhận tham gia bảo hiểm tiền gửi tại tất cả các điểm giao dịch có nhận tiền gửi;\nb) Nộp phí bảo hiểm tiền gửi không đầy đủ hoặc không đúng thời hạn theo quy định của pháp luật;\nc) Vi phạm thời hạn nộp hồ sơ đề nghị cấp giấy chứng nhận tham gia bảo hiểm tiền gửi theo quy định tại khoản 1 Điều 14 Luật Bảo hiểm tiền gửi.\n2. Phạt tiền từ 30.000.000 đồng đến 40.000.000 đồng\nđối với hành vi không nộp phí bảo hiểm tiền gửi theo quy định của pháp luật.\n3. Phạt tiền từ 40.000.000 đồng đến 60.000.000 đồng\nđối với hành vi trả tiền bảo hiểm cho người được bảo hiểm tiền gửi không đúng thời hạn quy định tại Điều 23 Luật Bảo hiểm tiền gửi.\n4. Phạt tiền từ 60.000.000 đồng đến 80.000.000 đồng\nđối với một trong các hành vi vi phạm sau đây:\na) Nhận bảo hiểm đối với tiền gửi không được bảo hiểm quy định tại Điều 19 Luật Bảo hiểm tiền gửi;\nb) Gian lận, giả mạo hồ sơ, tài liệu, giấy tờ về bảo hiểm tiền gửi mà chưa đến mức bị truy cứu trách nhiệm hình sự.\n5. Phạt tiền từ 100.000.000 đồng đến 150.000.000 đồng\nđối với một trong các hành vi vi phạm sau đây:\na) Không chi trả hoặc chi trả không đầy đủ tiền bảo hiểm;\nb) Cản trở, gây khó khăn, làm thiệt hại đến quyền và lợi ích hợp pháp của tổ chức bảo hiểm tiền gửi, tổ chức tham gia bảo hiểm tiền gửi, người được bảo hiểm tiền gửi và cơ quan, tổ chức có liên quan đến bảo hiểm tiền gửi;\nc) Lợi dụng chức vụ, quyền hạn làm trái quy định của pháp luật về bảo hiểm tiền gửi.\n6. Biện pháp khắc phục hậu quả:\na) Buộc niêm yết công khai ngay bản sao chứng nhận tham gia bảo hiểm tiền gửi đối với hành vi vi phạm được quy định tại điểm a khoản 1 Điều này;\nb) Buộc nộp ngay số phí bảo hiểm bị thiếu đối với hành vi vi phạm quy định tại điểm b khoản 1 Điều này và phải chịu phạt mỗi ngày nộp chậm bằng 0,05% số tiền nộp chậm theo quy định tại khoản 1 Điều 21 Luật Bảo hiểm tiền gửi;\nc) Buộc hoàn trả ngay số phí bảo hiểm đã thu, thu hồi ngay số tiền bảo hiểm đã trả do thực hiện hành vi vi phạm quy định tại khoản 4 Điều này;\nd) Đề nghị hoặc yêu cầu cấp có thẩm quyền xem xét,\náp dụng biện pháp đình chỉ từ 01 tháng đến 03 tháng hoặc miễn nhiệm chức danh quản trị, điều hành, kiểm soát; không cho đảm nhiệm chức vụ quản trị, điều hành, kiểm soát tại các tổ chức tín dụng, chi nhánh ngân hàng nước ngoài đối với cá nhân vi phạm và/hoặc cá nhân chịu trách nhiệm đối với hành vi vi phạm quy định tại điểm b khoản 4 và các điểm a, c khoản 5 Điều này.\nYêu cầu tổ chức tín dụng, chi nhánh ngân hàng nước ngoài cách chức và thực hiện các biện pháp xử lý khác theo quy định của pháp luật\nđối với cá nhân vi phạm thuộc thẩm quyền của tổ chức tín dụng, chi nhánh ngân hàng nước ngoài.\nMục 12. VI PHẠM QUY ĐỊNH VỀ PHÒNG,\nCHỐNG RỬA TIỀN; PHÒNG, CHỐNG TÀI TRỢ KHỦNG BỐ; PHÒNG, CHỐNG TÀI TRỢ PHỔ BIẾN VŨ\nKHÍ HỦY DIỆT HÀNG LOẠT[74]\nĐiều 39. Vi phạm quy định về\nnhận biết, cập nhật, xác minh thông tin nhận biết khách hàng[75]\n1. Phạt tiền từ 100.000.000 đồng đến 150.000.000 đồng\nđối với một trong các hành vi vi phạm sau đây:\na) Hành vi không nhận biết khách hàng; không cập nhật;\nkhông xác minh thông tin nhận biết khách hàng hoặc nhận biết khách hàng; cập nhật;\nxác minh thông tin nhận biết khách hàng không đúng quy định tại Điều 8, Điều 9,\nĐiều 10, Điều 11 Luật Phòng, chống rửa tiền và Luật Phòng, chống khủng bố;\nb) Hành vi không cập nhật danh sách tổ chức, cá\nnhân có liên quan đến khủng bố, tài trợ khủng bố; tổ chức, cá nhân bị chỉ định tham gia vào việc phổ biến và tài trợ phổ biến vũ khí hủy diệt hàng loạt.\n2. Phạt tiền từ 150.000.000 đồng đến 250.000.000 đồng\nđối với hành vi không bảo đảm bí mật thông tin, tài liệu báo cáo quy định tại Điều 29 Luật Phòng, chống rửa tiền và Luật Phòng, chống khủng bố.\n3. Biện pháp khắc phục hậu quả:\na) Buộc thực hiện các quy định về nhận biết; cập nhật;\nxác minh thông tin nhận biết khách hàng theo quy định tại Điều 8, Điều 9, Điều 10, Điều 11 Luật Phòng, chống rửa tiền và Luật Phòng, chống khủng bố đối với hành vi vi phạm quy định tại điểm a khoản 1 Điều này;\nb) Đề nghị hoặc yêu cầu cấp có thẩm quyền xem xét,\náp dụng biện pháp không cho đảm nhiệm chức vụ quản trị, điều hành, kiểm soát tại tổ chức tín dụng, chi nhánh ngân hàng nước ngoài đối với cá nhân vi phạm và/hoặc cá nhân chịu trách nhiệm đối với hành vi vi phạm quy định tại khoản 1, khoản 2 Điều này.\nYêu cầu tổ chức tín dụng, chi nhánh ngân hàng nước ngoài cách chức và thực hiện các biện pháp xử lý khác theo quy định của pháp luật\nđối với cá nhân vi phạm thuộc thẩm quyền của tổ chức tín dụng, chi nhánh ngân hàng nước ngoài.\nĐiều 40. Vi phạm quy định về\nquy định nội bộ về phòng, chống rửa tiền, tài trợ khủng bố, tài trợ phổ biến vũ\nkhí hủy diệt hàng loạt[76]\n1. Phạt tiền từ 200.000.000 đồng đến 300.000.000 đồng\nđối với một trong các hành vi vi phạm sau đây:\na) Không ban hành quy định nội bộ hoặc ban hành quy\nđịnh nội bộ không đúng quy định của pháp luật về phòng, chống rửa tiền, phòng,\nchống tài trợ khủng bố, phòng, chống tài trợ phổ biến vũ khí hủy diệt hàng loạt;\nb) Không phân công hoặc không đăng ký phân công hoặc phân công cán bộ, bộ phận chịu trách nhiệm về phòng, chống rửa tiền, phòng, chống tài trợ khủng bố không đúng quy định của pháp luật;\nc) Không thực hiện kiểm toán nội bộ hoặc thực hiện kiểm toán nội bộ không đúng quy định của pháp luật về phòng, chống rửa tiền,\nphòng, chống tài trợ khủng bố;\nd) Không đào tạo, bồi dưỡng hoặc đào tạo, bồi dưỡng về phòng, chống rửa tiền, phòng, chống tài trợ khủng bố không đúng quy định của pháp luật.\n2. Biện pháp khắc phục hậu quả\nBuộc ban hành quy định nội bộ đúng quy định pháp luật hoặc hủy bỏ ngay quy định nội bộ có nội dung không đúng quy định của pháp luật\nđối với hành vi vi phạm quy định tại điểm a khoản 1 Điều này.\nĐiều 41. Vi phạm quy định về\nphân loại khách hàng theo mức độ rủi ro[77]\nPhạt tiền từ 150.000.000 đồng đến 200.000.000 đồng\nđối với hành vi không phân loại khách hàng theo mức độ rủi ro hoặc phân loại khách hàng theo mức độ rủi ro không đúng quy định tại khoản 2, 3, 4 Điều 12 Luật Phòng, chống rửa tiền, Luật Phòng, chống khủng bố và pháp luật về phòng, chống tài trợ phổ biến vũ khí hủy diệt hàng loạt.\nĐiều 42. Vi phạm quy định về\nviệc xác định khách hàng nước ngoài là cá nhân có ảnh hưởng chính trị[78]\nPhạt tiền từ 150.000.000 đồng đến 200.000.000 đồng\nđối với hành vi không có hệ thống quản lý rủi ro để xác định khách hàng nước ngoài là cá nhân có ảnh hưởng chính trị theo quy định tại các khoản 2, 3 Điều 13 Luật Phòng, chống rửa tiền.\nĐiều 43. Vi phạm quy định về\nquan hệ ngân hàng đại lý, giao dịch liên quan tới công nghệ mới, giám sát đặc biệt giao dịch[79]\n1. Phạt tiền từ 150.000.000 đồng đến 200.000.000 đồng\nđối với một trong các hành vi vi phạm sau đây:\na) Không áp dụng các biện pháp quy định tại Điều 14 Luật Phòng, chống rửa tiền khi thiết lập quan hệ ngân hàng đại lý với ngân hàng\nđối tác nước ngoài;\nb) Không ban hành quy trình theo quy định tại Điều 15 Luật Phòng, chống rửa tiền.\n2. Phạt tiền từ 200.000.000 đồng đến 300.000.000 đồng\nđối với hành vi không giám sát đặc biệt đối với một số giao dịch theo quy định tại Điều 16 Luật Phòng, chống rửa tiền.\n3. Biện pháp khắc phục hậu quả:\na) Buộc thực hiện các biện pháp quy định tại Điều 14 Luật Phòng, chống rửa tiền đối với hành vi vi phạm quy định tại điểm a khoản 1 Điều này;\nb) Buộc ban hành quy trình theo quy định tại Điều 15 Luật Phòng, chống rửa tiền đối với hành vi vi phạm quy định tại điểm b khoản 1 Điều này;\nc) Buộc giám sát đặc biệt đối với một số giao dịch theo quy định tại Điều 16 Luật Phòng, chống rửa tiền đối với hành vi vi phạm quy định tại điểm c khoản 1 Điều này;\nd) Đề nghị hoặc yêu cầu cấp có thẩm quyền xem xét,\náp dụng biện pháp không cho đảm nhiệm chức vụ quản trị, điều hành, kiểm soát tại tổ chức tín dụng, chi nhánh ngân hàng nước ngoài đối với cá nhân vi phạm và/hoặc cá nhân chịu trách nhiệm đối với hành vi vi phạm quy định tại khoản 1, khoản 2 Điều này.\nYêu cầu tổ chức tín dụng, chi nhánh ngân hàng nước ngoài cách chức và thực hiện các biện pháp xử lý khác theo quy định của pháp luật\nđối với cá nhân vi phạm thuộc thẩm quyền của tổ chức tín dụng, chi nhánh ngân hàng nước ngoài.\nĐiều 44. Vi phạm quy định về\nbáo cáo giao dịch có giá trị lớn, giao dịch đáng ngờ, giao dịch chuyển tiền điện tử, báo cáo hành vi rửa tiền nhằm tài trợ khủng bố, báo cáo hành vi tài trợ khủng bố, tài trợ phổ biến vũ khí hủy diệt hàng loạt[80]\n1. Phạt tiền 80.000.000 đồng đến 120.000.000 đồng đối với hành vi không báo cáo đúng thời hạn theo quy định của pháp luật về phòng,\nchống rửa tiền, phòng, chống tài trợ khủng bố.\n2. Phạt tiền từ 150.000.000 đồng đến 250.000.000 đồng\nđối với một trong các hành vi vi phạm sau đây:\na) Không báo cáo các giao dịch có giá trị lớn;\nb) Không báo cáo các giao dịch đáng ngờ liên quan đến rửa tiền, tài trợ khủng bố, tài trợ phổ biến vũ khí hủy diệt hàng loạt;\nc) Không báo cáo các giao dịch chuyển tiền điện tử;\nd) Không báo cáo hành vi rửa tiền nhằm tài trợ khủng bố quy định tại Điều 30 Luật Phòng, chống rửa tiền, không báo cáo khi có nghi ngờ khách hàng hoặc giao dịch của khách hàng liên quan đến tài trợ khủng bố,\ntài trợ phổ biến vũ khí hủy diệt hàng loạt hoặc khách hàng nằm trong danh sách\nđen, danh sách bị chỉ định theo quy định của Luật Phòng, chống khủng bố, pháp luật về phòng, chống tài trợ phổ biến vũ khí hủy diệt hàng loạt.\n3. Biện pháp khắc phục hậu quả\na) Buộc phải gửi lại báo cáo đầy đủ, chính xác đối với hành vi vi phạm quy định tại Điều này;\nb) Đề nghị hoặc yêu cầu cấp có thẩm quyền xem xét,\náp dụng biện pháp đình chỉ hoặc miễn nhiệm chức danh quản trị, điều hành, kiểm soát; không cho đảm nhiệm chức vụ quản trị, điều hành, kiểm soát tại tổ chức tín dụng, chi nhánh ngân hàng nước ngoài đối với cá nhân vi phạm và/hoặc cá\nnhân chịu trách nhiệm đối với hành vi vi phạm quy định tại Điều này.\nYêu cầu tổ chức tín dụng, chi nhánh ngân hàng nước ngoài cách chức và thực hiện các biện pháp xử lý khác theo quy định của pháp luật\nđối với cá nhân vi phạm thuộc thẩm quyền của tổ chức tín dụng, chi nhánh ngân hàng nước ngoài.\nĐiều 44a. Vi phạm quy định về\ncung cấp thông tin[81]\n1. Phạt tiền từ 150.000.000 đồng đến 250.000.000 đồng\nđối với hành vi không cung cấp thông tin, cung cấp thông tin sai lệch hoặc thông tin không đúng quy định của Luật Phòng, chống rửa tiền, pháp luật về\nphòng, chống tài trợ khủng bố, pháp luật về phòng, chống tài trợ phổ biến vũ\nkhí hủy diệt hàng loạt mà chưa đến mức bị truy cứu trách nhiệm hình sự.\n2. Biện pháp khắc phục hậu quả\na) Buộc thực hiện ngay việc đính chính thông tin sai lệch đối với hành vi vi phạm quy định tại Điều này;\nb) Đề nghị hoặc yêu cầu cấp có thẩm quyền xem xét,\náp dụng biện pháp đình chỉ hoặc miễn nhiệm chức danh quản trị, điều hành, kiểm soát; không cho đảm nhiệm chức vụ quản trị, điều hành, kiểm soát tại tổ chức tín dụng, chi nhánh ngân hàng nước ngoài đối với cá nhân vi phạm và/hoặc cá\nnhân chịu trách nhiệm đối với hành vi vi phạm quy định tại Điều này.\nYêu cầu tổ chức tín dụng, chi nhánh ngân hàng nước ngoài cách chức và thực hiện các biện pháp xử lý khác theo quy định của pháp luật\nđối với cá nhân vi phạm thuộc thẩm quyền của tổ chức tín dụng, chi nhánh ngân hàng nước ngoài.\nĐiều 45. Vi phạm quy định về\ntrì hoãn giao dịch, phong tỏa tài khoản; niêm phong hoặc tạm giữ tài sản[82]\n1. Phạt tiền từ 150.000.000 đồng đến 250.000.000 đồng\nđối với một trong các hành vi vi phạm sau đây:\na) Không báo cáo việc trì hoãn giao dịch khi các bên liên quan tới giao dịch thuộc danh sách đen hoặc có lý do để tin rằng giao dịch được yêu cầu thực hiện có liên quan đến hoạt động phạm tội quy định tại khoản 3 Điều 33 Luật Phòng, chống rửa tiền;\nb) Không báo cáo việc thực hiện phong tỏa tài khoản,\nniêm phong, tạm giữ tài sản khi có quyết định của cơ quan nhà nước có thẩm quyền quy định tại Điều 34 Luật Phòng, chống rửa tiền;\nc) Không báo cáo ngay khi thực hiện việc tạm ngừng lưu thông, phong tỏa tiền, tài sản liên quan đến tài trợ khủng bố, tài trợ phổ\nbiến vũ khí hủy diệt hàng loạt theo quy định của pháp luật.\n2. Phạt tiền từ 250.000.000 đồng đến 350.000.000 đồng\nđối với một trong các hành vi vi phạm sau đây:\na) Không áp dụng biện pháp trì hoãn giao dịch khi các bên liên quan tới giao dịch thuộc danh sách đen hoặc có lý do để tin rằng giao dịch được yêu cầu thực hiện có liên quan đến hoạt động phạm tội quy định tại khoản 1 Điều 33 Luật Phòng, chống rửa tiền;\nb) Không phong tỏa tài khoản, không áp dụng biện pháp niêm phong hoặc tạm giữ tài sản khi có quyết định của cơ quan nhà nước có\nthẩm quyền quy định tại Điều 34 Luật Phòng, chống rửa tiền;\nc) Không thực hiện ngay việc tạm ngừng lưu thông,\nphong tỏa tiền, tài sản liên quan đến khủng bố, tài trợ khủng bố, tài trợ phổ biến vũ khí hủy diệt hàng loạt theo quy định của pháp luật.\n3. Biện pháp khắc phục hậu quả:\na) Buộc phải gửi lại báo cáo đầy đủ, chính xác đối với hành vi vi phạm quy định tại khoản 1 Điều này;\nb) Đề nghị hoặc yêu cầu cấp có thẩm quyền xem xét,\náp dụng biện pháp đình chỉ hoặc miễn nhiệm chức danh quản trị, điều hành, kiểm soát; không cho đảm nhiệm chức vụ quản trị, điều hành, kiểm soát tại các tổ chức tín dụng, chi nhánh ngân hàng nước ngoài đối với cá nhân vi phạm và/hoặc cá\nnhân chịu trách nhiệm đối với hành vi vi phạm quy định tại khoản 1, khoản 2 Điều này.\nYêu cầu tổ chức tín dụng, chi nhánh ngân hàng nước ngoài cách chức và thực hiện các biện pháp xử lý khác theo quy định của pháp luật\nđối với cá nhân vi phạm thuộc thẩm quyền của tổ chức tín dụng, chi nhánh ngân hàng nước ngoài. \nĐiều 45a. Vi phạm quy định về\nđánh giá rủi ro[83]\n1. Phạt tiền từ 150.000.000 đồng đến 250.000.000 đồng\nđối với một trong các hành vi vi phạm sau đây:\na) Không thực hiện đánh giá, không cập nhật kết quả\nđánh giá rủi ro rửa tiền và tài trợ khủng bố theo quy định của pháp luật về\nphòng, chống rửa tiền;\nb) Không ban hành, không cập nhật các chính sách,\nquy trình quản lý rủi ro được phát hiện từ báo cáo đánh giá rủi ro về rửa tiền,\ntài trợ khủng bố theo quy định của pháp luật về phòng, chống rửa tiền;\nc) Không gửi, không phổ biến, không công khai kết quả đánh giá hoặc cập nhật rủi ro về rửa tiền, tài trợ khủng bố theo quy định của pháp luật về phòng, chống rửa tiền.\n2. Biện pháp khắc phục hậu quả:\na) Buộc thực hiện quy định về đánh giá rủi ro về rửa tiền, tài trợ khủng bố theo quy định của pháp luật về phòng, chống rửa tiền đối với hành vi vi phạm quy định tại khoản 1 Điều này;\nb) Đề nghị cấp có thẩm quyền xem xét, áp dụng biện pháp đình chỉ hoặc miễn nhiệm chức danh quản trị, điều hành, kiểm soát; không cho đảm nhiệm chức vụ quản trị, điều hành, kiểm soát tại tổ chức tín dụng, chi nhánh ngân hàng nước ngoài đối với cá nhân vi phạm và/hoặc cá nhân chịu trách nhiệm đối với hành vi vi phạm quy định tại Điều này.\nYêu cầu tổ chức tín dụng, chi nhánh ngân hàng nước ngoài cách chức và thực hiện các biện pháp xử lý khác theo quy định của pháp luật\nđối với cá nhân vi phạm thuộc thẩm quyền của tổ chức tín dụng, chi nhánh ngân hàng nước ngoài. \nĐiều 46. Vi phạm quy định về\ncác hành vi bị cấm trong phòng, chống rửa tiền, phòng, chống tài trợ khủng bố[84]\n1. Phạt tiền từ 150.000.000 đồng đến 250.000.000 đồng\nđối với hành vi cản trở việc cung cấp thông tin phục vụ công tác phòng, chống rửa tiền, phòng, chống tài trợ khủng bố.\n2. Phạt tiền từ 300.000.000 đồng đến 400.000.000 đồng\nđối với một trong các hành vi vi phạm sau đây:\na) Thiết lập hoặc duy trì tài khoản vô danh hoặc tài khoản sử dụng tên giả;\nb) Cung cấp trái phép dịch vụ nhận tiền mặt, séc,\ncông cụ tiền tệ khác hoặc công cụ lưu trữ giá trị và thực hiện thanh toán cho người thụ hưởng tại một địa điểm khác.\n3. Phạt tiền từ 400.000.000 đồng đến 500.000.000 đồng\nđối với một trong các hành vi vi phạm sau đây:\na) Tổ chức hoặc tạo điều kiện thực hiện hành vi rửa tiền mà chưa đến mức truy cứu trách nhiệm hình sự;\nb) Thiết lập và duy trì quan hệ kinh doanh với ngân hàng được thành lập tại một quốc gia hoặc vùng lãnh thổ nhưng không có sự hiện diện hữu hình tại quốc gia hoặc vùng lãnh thổ đó và không chịu sự quản lý, giám sát của cơ quan quản lý có thẩm quyền;\nc) Không tố giác hành vi tài trợ khủng bố mà chưa đến mức bị truy cứu trách nhiệm hình sự;\nd) Lợi dụng việc tạm ngừng lưu thông, phong tỏa,\nniêm phong, tạm giữ, xử lý tiền, tài sản liên quan đến tài trợ khủng bố để xâm phạm lợi ích của Nhà nước, quyền, lợi ích hợp pháp của cơ quan, tổ chức, cá\nnhân;\nđ) Trực tiếp hoặc gián tiếp cung cấp tiền, tài sản,\nnguồn tài chính, nguồn lực kinh tế, dịch vụ tài chính hoặc dịch vụ khác cho tổ\nchức, cá nhân liên quan đến khủng bố, tài trợ khủng bố.\n4. Biện pháp khắc phục hậu quả:\nĐề nghị hoặc yêu cầu cấp có thẩm quyền xem xét, áp dụng biện pháp đình chỉ hoặc miễn nhiệm chức danh quản trị, điều hành, kiểm soát; không cho đảm nhiệm chức vụ quản trị, điều hành, kiểm soát tại các tổ chức tín dụng, chi nhánh ngân hàng nước ngoài đối với cá nhân vi phạm và/hoặc cá\nnhân chịu trách nhiệm đối với hành vi vi phạm quy định tại các khoản 2, khoản 3\nĐiều này.\nYêu cầu tổ chức tín dụng, chi nhánh ngân hàng nước ngoài cách chức và thực hiện các biện pháp xử lý khác theo quy định của pháp luật\nđối với cá nhân vi phạm thuộc thẩm quyền của tổ chức tín dụng, chi nhánh ngân hàng nước ngoài.\nMục 13. VI PHẠM QUY ĐỊNH VỀ\nCHẾ ĐỘ THÔNG TIN, BÁO CÁO\nĐiều 47. Vi phạm quy định về\nchế độ báo cáo, quản lý và cung cấp thông tin 1. Phạt tiền từ 5.000.000 đồng đến 10.000.000 đồng\nđối với một trong các hành vi vi phạm sau đây:\na) Vi phạm quy định về thời hạn, yêu cầu đầy đủ,\nchính xác từ lần thứ hai trở lên trong năm tài chính của các báo cáo thống kê\ncó định kỳ dưới 01 tháng;\nb) Gửi báo cáo không đúng thời hạn theo quy định của pháp luật, trừ trường hợp quy định tại điểm a khoản này, điểm a, điểm c khoản 5\nĐiều này và khoản 1 Điều 44 Nghị định này;\nc) Không lưu giữ, bảo quản hồ sơ, tài liệu đúng thời hạn theo quy định của pháp luật, trừ trường hợp quy định tại điểm a khoản 1 Điều 14 Nghị định này;\nd) Số liệu báo cáo gửi không chính xác từ 02 lần trở\nlên trong năm tài chính, trừ trường hợp quy định tại điểm b khoản 5 Điều này.\n2. Phạt tiền từ 10.000.000 đồng đến 15.000.000 đồng\nđối với hành vi không gửi đủ báo cáo hoặc báo cáo không đủ nội dung theo quy định của pháp luật, trừ trường hợp quy định tại khoản 2, khoản 3 Điều 44, khoản 1 Điều 45 Nghị định này.\n3. Phạt tiền từ 20.000.000 đồng đến 30.000.000 đồng\nđối với một trong các hành vi vi phạm sau đây:\na) Không đăng ký với cơ quan nhà nước có thẩm quyền về những thay đổi theo quy định tại điểm b khoản 4 Điều 29 Luật Các tổ chức tín dụng;\nb) Không công bố nội dung thay đổi quy định tại các\nđiểm a, b, c và d khoản 1 Điều 29 Luật Các tổ chức tín dụng trên các phương tiện thông tin của Ngân hàng Nhà nước và một tờ báo viết hàng ngày trong 03 số liên tiếp hoặc báo điện tử của Việt Nam trong thời hạn 07 ngày làm việc kể từ ngày\nđược Ngân hàng Nhà nước chấp thuận.\n4. Phạt tiền từ 30.000.000 đồng đến 40.000.000 đồng\nđối với một trong các hành vi vi phạm sau đây:\na)[85] Báo cáo không trung thực, trừ trường hợp quy định tại điểm h khoản 4 Điều 27 Nghị định này;\nb) Cung cấp những thông tin có liên quan đến hoạt động của Ngân hàng Nhà nước, tổ chức tín dụng, chi nhánh ngân hàng nước ngoài, thông tin khách hàng của tổ chức tín dụng, chi nhánh ngân hàng nước ngoài không đúng quy định của pháp luật;\nc) Không cung cấp thông tin, hồ sơ, tài liệu theo quy định của pháp luật;\nd) Làm lộ, sử dụng thông tin khách hàng của tổ chức tín dụng, chi nhánh ngân hàng nước ngoài không đúng mục đích theo quy định của pháp luật.\n5. Phạt tiền từ 40.000.000 đồng đến 50.000.000 đồng\nđối với một trong các hành vi vi phạm sau đây:\na) Gửi báo cáo về các chỉ tiêu thông tin tín dụng không đúng thời hạn cho Ngân hàng Nhà nước;\nb) Báo cáo các chỉ tiêu thông tin tín dụng không chính xác, không kịp thời, không đầy đủ hoặc không đúng yêu cầu kỹ thuật cho Ngân hàng Nhà nước;\nc) Không báo cáo thông tin tín dụng cho Ngân hàng Nhà nước theo quy định về hoạt động thông tin tín dụng của Ngân hàng Nhà nước;\nd) Không báo cáo thống kê các giao dịch chuyển tiền thanh toán quốc tế ra, vào theo quy định của pháp luật.\n6. Phạt tiền từ 50.000.000 đồng đến 100.000.000 đồng\nđối với một trong các hành vi vi phạm sau đây:\na) Không báo cáo ngay cấp có thẩm quyền về nguy cơ\nmất khả năng chi trả;\nb) Không thực hiện cung cấp thông tin theo yêu cầu của Ngân hàng Nhà nước và các cơ quan nhà nước có thẩm quyền theo quy định tại khoản 4 Điều 18 Luật Phòng, chống rửa tiền.\n7. Biện pháp khắc phục hậu quả:\na) Buộc phải gửi lại báo cáo đầy đủ, chính xác đối với hành vi vi phạm quy định tại các điểm a, b, d khoản 1, khoản 2 và khoản 5 Điều này;\nb)[86] Không cho mở\nrộng phạm vi, quy mô, địa bàn hoạt động và bổ sung nghiệp vụ kinh doanh mới trong thời gian chưa khắc phục xong vi phạm đối với hành vi vi phạm quy định tại các điểm a, b, d khoản 1; khoản 2 và khoản 5 Điều này;\nc) Đề nghị hoặc yêu cầu cấp có thẩm quyền xem xét,\náp dụng biện pháp đình chỉ từ 01 tháng đến 03 tháng hoặc miễn nhiệm chức danh quản trị, điều hành, kiểm soát; không cho đảm nhiệm chức vụ quản trị, điều hành, kiểm soát tại các tổ chức tín dụng, chi nhánh ngân hàng nước ngoài đối với cá nhân vi phạm và/hoặc cá nhân chịu trách nhiệm đối với hành vi vi phạm quy định tại điểm a khoản 6 Điều này.\nYêu cầu tổ chức tín dụng, chi nhánh ngân hàng nước ngoài cách chức và thực hiện các biện pháp xử lý khác theo quy định của pháp luật\nđối với cá nhân vi phạm thuộc thẩm quyền của tổ chức tín dụng, chi nhánh ngân hàng nước ngoài.\nMục 14. VI PHẠM QUY ĐỊNH VỀ CẢN TRỞ VIỆC THANH TRA, KHÔNG THỰC HIỆN YÊU CẦU CỦA NGƯỜI CÓ THẨM QUYỀN\nĐiều 48. Vi phạm quy định về cản trở việc thanh tra, không thực hiện yêu cầu của người có thẩm quyền 1. Phạt tiền từ 2.000.000 đồng đến 3.000.000 đồng đối với hành vi cản trở, gây khó khăn việc thanh tra, kiểm tra của người có thẩm quyền.\n2. Phạt tiền từ 5.000.000 đồng đến 10.000.000 đồng\nđối với hành vi trốn tránh việc thanh tra, kiểm tra của người có thẩm quyền.\n3. Phạt tiền từ 10.000.000 đồng đến 20.000.000 đồng\nđối với hành vi từ chối cung cấp thông tin, tài liệu, dữ liệu điện tử cho Đoàn thanh tra, kiểm tra hoặc người có thẩm quyền.\n4. Phạt tiền từ 20.000.000 đồng đến 30.000.000 đồng\nđối với một trong các hành vi vi phạm sau đây:\na) Không cung cấp đủ tài liệu, chứng từ, số liệu theo yêu cầu của Đoàn thanh tra;\nb) Tự ý tháo bỏ, di chuyển hoặc có hành vi khác làm thay đổi hiện trạng niêm phong gồm: Kho, quỹ, két bạc, sổ sách, chứng từ kế\ntoán, hồ sơ cấp tín dụng hoặc các tang vật đang bị niêm phong, tạm giữ;\nc) Không phong tỏa tài khoản, không hủy bỏ phong tỏa tài khoản theo yêu cầu của người có thẩm quyền theo quy định của pháp luật.\n5. Phạt tiền từ 30.000.000 đồng đến 50.000.000 đồng\nđối với một trong các hành vi vi phạm sau đây:\na)[87] Cung cấp thông tin, tài liệu thiếu trung thực;\nb) Can thiệp trái pháp luật vào việc xử lý của cấp có thẩm quyền và Thanh tra, giám sát ngành Ngân hàng;\nc) Che giấu, sửa chữa chứng từ, sổ sách hoặc thay đổi tang vật trong khi đang bị thanh tra.\n6. Phạt tiền từ 50.000.000 đồng đến 100.000.000 đồng\nđối với một trong các hành vi vi phạm sau đây:\na) Chuyển vốn, tài sản ra nước ngoài sau khi đã bị\nphong tỏa;\nb) Không thực hiện gửi vốn, tài sản vào Ngân hàng Nhà nước hoặc tổ chức tín dụng do Ngân hàng Nhà nước yêu cầu sau khi đã bị\nphong tỏa;\nc) Không thực hiện phong tỏa vốn và tài sản của chi nhánh ngân hàng nước ngoài theo yêu cầu của Ngân hàng Nhà nước.\nĐiều 49. Vi phạm quy định về\nnghĩa vụ của đối tượng thanh tra, giám sát ngân hàng 1. Phạt tiền từ 5.000.000 đồng đến 10.000.000 đồng\nđối với một trong các hành vi vi phạm sau đây:\na) Không cung cấp kịp thời, đầy đủ, chính xác thông tin, tài liệu theo yêu cầu của Ngân hàng Nhà nước;\nb) Không thực hiện khuyến nghị, cảnh báo rủi ro và\nan toàn hoạt động của Ngân hàng Nhà nước;\nc) Không báo cáo, giải trình đối với khuyến nghị, cảnh báo rủi ro và an toàn hoạt động của Ngân hàng Nhà nước.\n2. Phạt tiền từ 40.000.000 đồng đến 50.000.000 đồng\nđối với hành vi không chấp hành kết luận, kiến nghị, quyết định xử lý về thanh tra.\n3. Biện pháp khắc phục hậu quả:\nĐề nghị hoặc yêu cầu cấp có thẩm quyền xem xét, áp dụng biện pháp đình chỉ từ 01 tháng đến 03 tháng hoặc miễn nhiệm chức danh quản trị, điều hành, kiểm soát; không cho đảm nhiệm chức vụ quản trị, điều hành, kiểm soát tại các tổ chức tín dụng, chi nhánh ngân hàng nước ngoài đối với cá nhân vi phạm và/hoặc cá nhân chịu trách nhiệm đối với hành vi vi phạm quy định tại khoản 2 Điều này.\nYêu cầu tổ chức tín dụng, chi nhánh ngân hàng nước ngoài cách chức và thực hiện các biện pháp xử lý khác theo quy định của pháp luật\nđối với cá nhân vi phạm thuộc thẩm quyền của tổ chức tín dụng, chi nhánh ngân hàng nước ngoài.\nMục 15. VI PHẠM QUY ĐỊNH VỀ\nMUA, BÁN VÀ XỬ LÝ NỢ\nĐiều 50. Vi phạm quy định về\nmua, bán nợ của tổ chức tín dụng 1. Phạt tiền từ 50.000.000 đồng đến 80.000.000 đồng\nđối với hành vi không thành lập Hội đồng mua, bán nợ khi thực hiện mua, bán nợ.\n2. Phạt tiền từ 80.000.000 đồng đến 100.000.000 đồng\nđối với một trong các hành vi vi phạm sau:\na) Bán khoản nợ đã được sử dụng để bảo đảm nghĩa vụ\ndân sự khác, trừ trường hợp bên nhận bảo đảm đồng ý bằng văn bản về việc bán nợ;\nb) Bên bán nợ mua lại các khoản nợ đã bán, trừ trường hợp quy định tại Điều 148đ Luật Các tổ chức tín dụng đã được sửa đổi, bổ sung năm 2017.\n3. Hình thức xử phạt bổ sung:\nĐình chỉ hoạt động mua, bán nợ trong thời hạn 03 tháng đến 06 tháng đối với vi phạm tại khoản 1 Điều này.\n4. Biện pháp khắc phục hậu quả:\nBuộc khôi phục nguyên trạng khoản nợ về trước thời điểm thực hiện hoạt động mua, bán nợ đối với hành vi vi phạm quy định tại khoản 2 Điều này.\nĐiều 51. Vi phạm quy định về mua,\nbán và xử lý nợ xấu của Công ty Quản lý tài sản của tổ chức tín dụng Việt Nam 1. Phạt tiền từ 5.000.000 đồng đến 10.000.000 đồng\nđối với một trong các hành vi vi phạm sau đây:\na) Quản lý khoản nợ xấu đã mua và kiểm tra, giám sát tài sản bảo đảm có liên quan đến khoản nợ xấu không đúng quy định của pháp luật;\nb) Ủy quyền cho tổ chức tín dụng và kiểm tra, giám sát việc thực hiện các hoạt động được ủy quyền không đúng quy định của pháp luật;\nc) Thực hiện các biện pháp cơ cấu lại nợ, hỗ trợ\ntài chính cho khách hàng vay không đúng quy định của pháp luật;\nd) Góp vốn, mua cổ phần không đúng quy định của pháp luật;\nđ) Trích lập và sử dụng dự phòng rủi ro đối với các khoản nợ xấu đã mua theo giá trị thị trường không đúng quy định của pháp luật.\n2. Phạt tiền từ 10.000.000 đồng đến 15.000.000 đồng\nđối với một trong các hành vi vi phạm sau đây:\na) Mua, bán nợ xấu không đúng quy định của pháp luật;\nb) Xử lý tài sản bảo đảm của các khoản nợ xấu đã\nmua không đúng quy định của pháp luật.\n3. Phạt tiền từ 15.000.000 đồng đến 20.000.000 đồng\nđối với hành vi vi phạm thực hiện các hoạt động được Công ty Quản lý tài sản của tổ chức tín dụng Việt Nam ủy quyền sau khi bán nợ không đúng quy định của pháp luật.\nMục 16. VI PHẠM QUY ĐỊNH VỀ\nAN TOÀN CÔNG NGHỆ THÔNG TIN TRONG HOẠT ĐỘNG NGÂN HÀNG\nĐiều 52. Vi phạm quy định về\nan toàn công nghệ thông tin trong hoạt động ngân hàng 1. Phạt tiền từ 10.000.000 đồng đến 20.000.000 đồng\nđối với một trong các hành vi vi phạm sau đây:\na) Không đánh giá rủi ro công nghệ thông tin, rủi ro hoạt động trước khi sử dụng dịch vụ công nghệ thông tin của bên thứ ba theo\nđúng quy định của pháp luật;\nb) Không thực hiện đánh giá an ninh bảo mật hệ thống thông tin cung cấp dịch vụ giao dịch trực tuyến cho khách hàng trước khi đưa vào vận hành chính thức.\n2. Phạt tiền từ 20.000.000 đồng đến 30.000.000 đồng\nđối với một trong các hành vi vi phạm sau đây:\na) Không phổ biến, cập nhật các quy định về an toàn thông tin của tổ chức cho tất cả cá nhân trong tổ chức tối thiểu mỗi năm một lần;\nb) Không thực hiện hoặc thực hiện không đầy đủ việc sao lưu dự phòng bảo đảm an toàn dữ liệu theo quy định của pháp luật;\nc) Không triển khai các giải pháp an ninh mạng để\nkiểm soát các kết nối mạng, phát hiện phòng chống tấn công xâm nhập mạng cho các hệ thống thông tin cung cấp dịch vụ giao dịch trực tuyến cho khách hàng;\nd) Không thực hiện xác thực khách hàng truy cập dịch vụ khi cung ứng dịch vụ ngân hàng trên Internet theo đúng quy định của pháp luật;\nđ) Không hướng dẫn khách hàng thực hiện các biện pháp bảo đảm an toàn, bảo mật thông tin khi sử dụng dịch vụ ngân hàng trên Internet;\ne) Không lưu trữ nhật ký về hoạt động của hệ thống thông tin và người sử dụng, các lỗi phát sinh, các sự cố an toàn thông tin theo quy định của pháp luật.\n3. Hình thức xử phạt bổ sung:\nĐình chỉ việc sử dụng dịch vụ công nghệ thông tin của bên thứ ba trong thời hạn 01 tháng đến 03 tháng đối với các vi phạm tại điểm a khoản 1 Điều này.\n4. Biện pháp khắc phục hậu quả:\nBuộc thực hiện đúng quy định của pháp luật về an toàn công nghệ thông tin trong hoạt động ngân hàng.\nChương III THẨM QUYỀN XỬ PHẠT VI PHẠM HÀNH CHÍNH VÀ THẨM QUYỀN LẬP BIÊN BẢN VI PHẠM HÀNH CHÍNH\nĐiều 53. Thẩm quyền xử phạt vi phạm hành chính của Thanh tra, giám sát ngành Ngân hàng[88]\n1. Thanh tra viên ngân hàng đang thi hành công vụ\ncó quyền:\na) Phạt cảnh cáo;\nb) Phạt tiền đến 500.000 đồng;\nc)[89] Tịch thu tang vật, phương tiện vi phạm hành chính có giá trị không vượt quá 1.000.000 đồng;\n2. Chánh Thanh tra, giám sát Ngân hàng Nhà nước chi nhánh có quyền:\na) Phạt cảnh cáo;\nb) Phạt tiền đến 50.000.000 đồng;\nc)[90] Tịch thu tang vật, phương tiện vi phạm hành chính có giá trị không vượt quá 100.000.000 đồng;\nd) Áp dụng các hình thức xử phạt bổ sung, biện pháp khắc phục hậu quả được quy định tại khoản 2, khoản 4 Điều 3 Nghị\nđịnh này.\n3. Cục trưởng Cục Thanh tra, giám sát ngân hàng có\nquyền:\na) Phạt cảnh cáo;\nb) Phạt tiền đến 250.000.000 đồng;\nc)[91] Tịch thu tang vật, phương tiện vi phạm hành chính có giá trị không vượt quá 500.000.000 đồng;\nd) Áp dụng các hình thức xử phạt bổ sung, biện pháp khắc phục hậu quả được quy định tại khoản 2, khoản 4 Điều 3 Nghị\nđịnh này.\n4. Chánh Thanh tra, giám sát ngân hàng có quyền:\na) Phạt cảnh cáo;\nb) Phạt tiền đến 1.000.000.000 đồng;\nc) Áp dụng các hình thức xử phạt bổ sung, biện pháp khắc phục hậu quả được quy định tại khoản 2, khoản 4 Điều 3 Nghị\nđịnh này.\n5. Trưởng đoàn thanh tra do Thống đốc Ngân hàng Nhà\nnước, Chánh Thanh tra, giám sát ngân hàng ra quyết định có thẩm quyền xử phạt theo quy định tại khoản 3 Điều này.\nTrưởng đoàn thanh tra do Giám đốc Ngân hàng Nhà nước chi nhánh tỉnh, thành phố trực thuộc Trung ương, Cục trưởng Cục Thanh tra, giám sát ngân hàng, Chánh Thanh tra, giám sát Ngân hàng Nhà nước chi nhánh ra quyết\nđịnh có thẩm quyền xử phạt theo quy định tại khoản 2 Điều này.\nĐiều 54. Thẩm quyền xử phạt vi phạm hành chính của Chủ tịch Ủy ban nhân dân các cấp[92]\n1. Chủ tịch Ủy ban nhân dân cấp xã có quyền:\na) Phạt cảnh cáo;\nb) Phạt tiền đến 5.000.000 đồng;\nc) Tịch thu tang vật, phương tiện vi phạm hành chính có giá trị không vượt quá 10.000.000 đồng.\n2. Chủ tịch Ủy ban nhân dân cấp huyện có quyền:\na) Phạt cảnh cáo;\nb) Phạt tiền đến 100.000.000 đồng;\nc) Tước quyền sử dụng giấy phép, chứng chỉ hành nghề\ncó thời hạn hoặc đình chỉ hoạt động có thời hạn;\nd) Tịch thu tang vật, phương tiện vi phạm hành chính;\nđ) Áp dụng biện pháp khắc phục hậu quả được quy định tại khoản 4 Điều 3 Nghị định này.\n3. Chủ tịch Ủy ban nhân dân cấp tỉnh có quyền:\na) Phạt cảnh cáo;\nb) Phạt tiền đến 1.000.000.000 đồng;\nc) Tước quyền sử dụng giấy phép, chứng chỉ hành nghề\ncó thời hạn hoặc đình chỉ hoạt động có thời hạn;\nd) Tịch thu tang vật, phương tiện vi phạm hành chính;\nđ) Áp dụng biện pháp khắc phục hậu quả được quy định tại khoản 4 Điều 3 Nghị định này.\nĐiều 54a. Thẩm quyền xử phạt vi phạm hành chính của Công an nhân dân[93]\n1. Chiến sỹ Công an nhân dân đang thi hành công vụ\ncó quyền:\na) Phạt cảnh cáo;\nb) Phạt tiền đến 500.000 đồng.\n2. Thủ trưởng đơn vị Cảnh sát cơ động cấp đại đội,\nTrưởng trạm, Đội trưởng của người được quy định tại khoản 1 Điều này có quyền:\na) Phạt cảnh cáo;\nb) Phạt tiền đến 1.500.000 đồng.\n3. Trưởng Công an cấp xã, Trưởng đồn Công an, Trưởng Trạm Công an cửa khẩu, khu chế xuất, Trưởng Công an cửa khẩu Cảng hàng không quốc tế, Tiểu đoàn trưởng Tiểu đoàn cảnh sát cơ động, Thủy đội trưởng có quyền:\na) Phạt cảnh cáo;\nb) Phạt tiền đến 2.500.000 đồng;\nc) Tịch thu tang vật, phương tiện vi phạm hành chính có giá trị không vượt quá 5.000.000 đồng.\n4. Trưởng Công an cấp huyện; Trưởng phòng nghiệp vụ\nthuộc Cục An ninh chính trị nội bộ; Trưởng phòng nghiệp vụ thuộc Cục cảnh sát quản lý hành chính về trật tự xã hội; Trưởng phòng nghiệp vụ thuộc Cục Cảnh sát giao thông; Trưởng phòng nghiệp vụ thuộc Cục Cảnh sát phòng cháy, chữa cháy và\ncứu nạn, cứu hộ; Trưởng phòng nghiệp vụ thuộc Cục An ninh mạng và phòng, chống tội phạm sử dụng công nghệ cao; Trưởng phòng nghiệp vụ thuộc Cục Quản lý xuất nhập cảnh; Trưởng phòng Công an cấp tỉnh gồm: Trưởng phòng An ninh chính trị nội bộ, Trưởng phòng Cảnh sát quản lý hành chính về trật tự xã hội, Trưởng phòng Cảnh sát điều tra tội phạm về trật tự xã hội, Trưởng phòng Cảnh sát điều tra tội phạm về tham nhũng, kinh tế, buôn lậu, Trưởng phòng cảnh sát điều tra tội phạm về ma túy, Trưởng phòng Cảnh sát giao thông, Trưởng phòng Cảnh sát giao thông đường bộ\n- đường sắt, Trưởng phòng cảnh sát giao thông đường bộ, Trưởng phòng Cảnh sát\nđường thủy, Trưởng phòng Cảnh sát cơ động, Trưởng phòng Cảnh sát bảo vệ, Trưởng phòng Cảnh sát thi hành án hình sự và hỗ trợ tư pháp, Trưởng phòng cảnh sát phòng, chống tội phạm về môi trường, Trưởng phòng Cảnh sát phòng cháy, chữa cháy và cứu nạn, cứu hộ, Trưởng phòng An ninh mạng và phòng, chống tội phạm sử\ndụng công nghệ cao, Trưởng phòng Quản lý xuất nhập cảnh, Trưởng phòng An ninh kinh tế, Trưởng phòng An ninh đối ngoại, Trung đoàn trưởng Trung đoàn Cảnh sát cơ động, Thủy đoàn trưởng có quyền:\na) Phạt cảnh cáo;\nb) Phạt tiền đến 25.000.000 đồng;\nc) Tịch thu tang vật, phương tiện vi phạm hành chính có giá trị không vượt quá 50.000.000 đồng;\nd) Tước quyền sử dụng giấy phép, chứng chỉ hành nghề\ncó thời hạn hoặc đình chỉ hoạt động có thời hạn;\nđ) Áp dụng biện pháp khắc phục hậu quả được quy định tại điểm e khoản 4 Điều 3 Nghị định này.\n5. Giám đốc Công an cấp tỉnh có quyền:\na) Phạt cảnh cáo;\nb) Phạt tiền đến 100.000.000 đồng;\nc) Tước quyền sử dụng giấy phép, chứng chỉ hành nghề\ncó thời hạn hoặc đình chỉ hoạt động có thời hạn;\nd) Tịch thu tang vật, phương tiện vi phạm hành chính;\nđ) Áp dụng biện pháp khắc phục hậu quả được quy định tại các điểm a, e, g, k, n, p khoản 4 Điều 3 Nghị định này.\n6. Cục trưởng Cục An ninh chính trị nội bộ, Cục trưởng Cục An ninh kinh tế, Cục trưởng Cục Cảnh sát quản lý hành chính về trật tự xã hội,\nCục trưởng Cục Cảnh sát điều tra tội phạm về trật tự xã hội, Cục trưởng Cục Cảnh sát điều tra tội phạm về tham nhũng, kinh tế, buôn lậu, Cục trưởng Cục Cảnh sát\nđiều tra tội phạm về ma túy, Cục trưởng Cục Cảnh sát giao thông, Cục trưởng Cục Cảnh sát phòng cháy, chữa cháy và cứu nạn, cứu hộ, Cục trưởng Cục Cảnh sát phòng, chống tội phạm về môi trường, Cục trưởng Cục An ninh mạng và phòng, chống tội phạm sử dụng công nghệ cao, Cục trưởng Cục An ninh nội địa, Cục trưởng Cục Cảnh sát quản lý tạm giữ, tạm giam và thi hành án hình sự tại cộng đồng, Cục trưởng Cục Quản lý xuất nhập cảnh, Tư lệnh Cảnh sát cơ động có quyền:\na) Phạt cảnh cáo;\nb) Phạt tiền đến 1.000.000.000 đồng;\nc) Tước quyền sử dụng giấy phép, chứng chỉ hành nghề\ncó thời hạn hoặc đình chỉ hoạt động có thời hạn;\nd) Tịch thu tang vật, phương tiện vi phạm hành chính;\nđ) Áp dụng biện pháp khắc phục hậu quả được quy định tại các điểm a, e, g k, n, p khoản 4 Điều 3 Nghị định này.\nĐiều 54b. Thẩm quyền xử phạt vi phạm hành chính của Bộ đội biên phòng[94]\n1. Chiến sĩ Bộ đội biên phòng đang thi hành công vụ\ncó quyền:\na) Phạt cảnh cáo;\nb) Phạt tiền đến 500.000 đồng.\n2. Trạm trưởng, Đội trưởng của người được quy định tại khoản 1 Điều này có quyền:\na) Phạt cảnh cáo;\nb) Phạt tiền đến 2.500.000 đồng.\n3. Đội trưởng Đội đặc nhiệm phòng chống ma túy và tội phạm thuộc Đoàn đặc nhiệm phòng chống ma túy và tội phạm có quyền:\na) Phạt cảnh cáo;\nb) Phạt tiền đến 10.000.000 đồng;\nc) Tịch thu tang vật, phương tiện vi phạm hành chính có giá trị không vượt quá 20.000.000 đồng.\n4. Đồn trưởng Đồn biên phòng, Hải đội trưởng Hải đội biên phòng, Chỉ huy trưởng Ban chỉ huy Biên phòng Cửa khẩu cảng có quyền:\na) Phạt cảnh cáo;\nb) Phạt tiền đến 25.000.000 đồng;\nc) Tịch thu tang vật, phương tiện vi phạm hành chính có giá trị không vượt quá 50.000.000 đồng.\n5. Đoàn trưởng Đoàn đặc nhiệm phòng chống ma túy và\ntội phạm thuộc Cục Phòng chống ma túy và tội phạm thuộc Bộ Tư lệnh Bộ đội biên phòng có quyền:\na) Phạt cảnh cáo;\nb) Phạt tiền đến 100.000.000 đồng;\nc) Tịch thu tang vật, phương tiện vi phạm hành chính có giá trị không vượt quá 200.000.000 đồng.\n6. Chỉ huy trưởng Bộ đội biên phòng cấp tỉnh; Hải đoàn trưởng Hải đoàn biên phòng, Cục trưởng Cục Phòng chống ma túy và tội phạm trực thuộc Bộ Tư lệnh Bộ đội biên phòng có quyền:\na) Phạt cảnh cáo;\nb) Phạt tiền đến 1.000.000.000 đồng;\nc) Tước quyền sử dụng giấy phép, chứng chỉ hành nghề\ncó thời hạn hoặc đình chỉ hoạt động có thời hạn;\nd) Tịch thu tang vật, phương tiện vi phạm hành chính.\nĐiều 54c. Thẩm quyền xử phạt vi phạm hành chính của Cảnh sát biển[95]\n1. Cảnh sát viên Cảnh sát biển đang thi hành công vụ\ncó quyền:\na) Phạt cảnh cáo;\nb) Phạt tiền đến 1.500.000 đồng.\n2. Tổ trưởng Tổ nghiệp vụ Cảnh sát biển có quyền:\na) Phạt cảnh cáo;\nb) Phạt tiền đến 5.000.000 đồng.\n3. Đội trưởng Đội nghiệp vụ Cảnh sát biển, Trạm trưởng trạm Cảnh sát biển có quyền:\na) Phạt cảnh cáo;\nb) Phạt tiền đến 10.000.000 đồng;\n4. Hải đội trưởng Hải đội Cảnh sát biển có quyền:\na) Phạt cảnh cáo;\nb) Phạt tiền đến 25.000.000 đồng;\nc) Tịch thu tang vật, phương tiện vi phạm hành chính có giá trị không vượt quá 50.000.000 đồng.\n5. Hải đoàn trưởng Hải đoàn Cảnh sát biển, Đoàn trưởng\nĐoàn trinh sát, Đoàn trưởng Đoàn đặc nhiệm phòng, chống tội phạm ma túy thuộc Bộ\nTư lệnh Cảnh sát biển Việt Nam có quyền:\na) Phạt cảnh cáo;\nb) Phạt tiền đến 50.000.000 đồng;\nc) Tịch thu tang vật, phương tiện vi phạm hành chính có giá trị không vượt quá 100.000.000 đồng.\n6. Tư lệnh Vùng Cảnh sát biển, Cục trưởng Cục Nghiệp vụ và Pháp luật thuộc Bộ Tư lệnh Cảnh sát biển Việt Nam có quyền:\na) Phạt cảnh cáo;\nb) Phạt tiền đến 100.000.000 đồng;\nc) Tước quyền sử dụng giấy phép, chứng chỉ hành nghề\ncó thời hạn;\nd) Tịch thu tang vật, phương tiện vi phạm hành chính.\n7. Tư lệnh Cảnh sát biển Việt Nam có quyền:\na) Phạt cảnh cáo;\nb) Phạt tiền đến 1.000.000.000 đồng;\nc) Tước quyền sử dụng giấy phép, chứng chỉ hành nghề\ncó thời hạn hoặc đình chỉ hoạt động có thời hạn;\nd) Tịch thu tang vật, phương tiện vi phạm hành chính.\nĐiều 54d. Thẩm quyền xử phạt vi phạm hành chính của Quản lý thị trường[96]\n1. Kiểm soát viên thị trường đang thi hành công vụ\ncó quyền:\na) Phạt cảnh cáo;\nb) Phạt tiền đến 500.000 đồng.\n2. Đội trưởng Đội Quản lý thị trường, Trưởng phòng nghiệp vụ thuộc Cục Nghiệp vụ quản lý thị trường có quyền:\na) Phạt cảnh cáo;\nb) Phạt tiền đến 25.000.000 đồng;\nc) Tịch thu tang vật, phương tiện vi phạm hành chính có giá trị không vượt quá 50.000.000 đồng.\n3. Cục trưởng Cục Quản lý thị trường cấp tỉnh, Cục trưởng Cục Nghiệp vụ quản lý thị trường trực thuộc Tổng cục Quản lý thị trường có quyền:\na) Phạt cảnh cáo;\nb) Phạt tiền đến 50.000.000 đồng;\nc) Tịch thu tang vật, phương tiện vi phạm hành chính;\nd) Tước quyền sử dụng giấy phép, chứng chỉ hành nghề\ncó thời hạn hoặc đình chỉ hoạt động có thời hạn.\n4. Tổng Cục trưởng Tổng Cục Quản lý thị trường có\nquyền:\na) Phạt cảnh cáo;\nb) Phạt tiền đến 1.000.000.000 đồng;\nc) Tịch thu tang vật, phương tiện vi phạm hành chính;\nd) Tước quyền sử dụng giấy phép, chứng chỉ hành nghề\ncó thời hạn hoặc đình chỉ hoạt động có thời hạn.\nĐiều 54đ. Thẩm quyền của Thanh tra chuyên ngành du lịch[97]\n1. Thanh tra viên, người được giao thực hiện nhiệm vụ thanh tra chuyên ngành đang thi hành công vụ có quyền:\na) Phạt cảnh cáo;\nb) Phạt tiền đến 500.000 đồng.\n2. Chánh Thanh tra Sở, Trưởng đoàn thanh tra chuyên ngành cấp Sở có quyền:\na) Phạt cảnh cáo;\nb) Phạt tiền đến 50.000.000 đồng;\nc) Tước quyền sử dụng giấy phép, chứng chỉ hành nghề\ncó thời hạn hoặc đình chỉ hoạt động có thời hạn;\nd) Tịch thu tang vật, phương tiện vi phạm hành chính có giá trị không vượt quá 100.000.000 đồng;\nđ) Áp dụng biện pháp khắc phục hậu quả quy định tại\nđiểm n khoản 4 Điều 3 Nghị định này.\n3. Trưởng đoàn thanh tra chuyên ngành cấp Bộ có quyền:\na) Phạt cảnh cáo;\nb) Phạt tiền đến 250.000.000 đồng;\nc) Tước quyền sử dụng giấy phép, chứng chỉ hành nghề\ncó thời hạn hoặc đình chỉ hoạt động có thời hạn;\nd) Tịch thu tang vật, phương tiện vi phạm hành chính có giá trị không vượt quá 500.000.000 đồng;\nđ) Áp dụng biện pháp khắc phục hậu quả quy định tại\nđiểm n khoản 4 Điều 3 Nghị định này.\n4. Chánh Thanh tra cấp Bộ có quyền:\na) Phạt cảnh cáo;\nb) Phạt tiền đến 1.000.000.000 đồng;\nc) Tước quyền sử dụng giấy phép, chứng chỉ hành nghề\ncó thời hạn hoặc đình chỉ hoạt động có thời hạn;\nd) Tịch thu tang vật, phương tiện vi phạm hành chính;\nđ) Áp dụng biện pháp khắc phục hậu quả quy định tại\nđiểm n khoản 4 Điều 3 Nghị định này.\nĐiều 54e. Thẩm quyền xử phạt vi phạm hành chính của Hải quan[98]\nTổng cục trưởng Tổng cục Hải quan có quyền phạt tiền\nđến 1.000.000.000 đồng.\nĐiều 54g. Thẩm quyền xử phạt vi phạm hành chính của Ủy ban Cạnh tranh Quốc gia[99]\nChủ tịch Ủy ban Cạnh tranh Quốc gia có quyền:\n1. Phạt cảnh cáo.\n2. Phạt tiền đến 1.000.000.000 đồng.\n3. Tước quyền sử dụng giấy phép, chứng chỉ hành nghề\ncó thời hạn hoặc đình chỉ hoạt động có thời hạn.\n4. Tịch thu tang vật, phương tiện vi phạm hành chính.\n5. Áp dụng biện pháp khắc phục hậu quả quy định tại\nđiểm n khoản 4 Điều 3 Nghị định này.\nĐiều 55. Phân định thẩm quyền xử phạt vi phạm hành chính trong lĩnh vực tiền tệ và ngân hàng[100]\n1. Thẩm quyền xử phạt vi phạm hành chính của Chủ tịch\nỦy ban nhân dân các cấp Chủ tịch Ủy ban nhân dân các cấp có thẩm quyền xử\nphạt đối với hành vi vi phạm hành chính quy định tại Chương II Nghị định này theo thẩm quyền và chức năng, nhiệm vụ, quyền hạn được giao.\n2. Thẩm quyền xử phạt vi phạm hành chính của cơ\nquan Quản lý thị trường Người có thẩm quyền xử phạt của cơ quan Quản lý thị\ntrường xử phạt đối với hành vi vi phạm hành chính quy định tại khoản 1, khoản 2, các điểm a, b, h, i, k, l khoản 3, điểm n khoản 4[101], các điểm e, g, h khoản 5, điểm c khoản 8 Điều 23; khoản 1, khoản 2, điểm a khoản 3, điểm a khoản 4, điểm a khoản 6, khoản 7, các điểm a, c khoản 8 Điều 24 Nghị\nđịnh này.\n3. Thẩm quyền xử phạt vi phạm hành chính của Bộ đội biên phòng Người có thẩm quyền xử phạt của lực lượng Bộ đội biên phòng xử phạt đối với hành vi vi phạm hành chính quy định tại khoản 1, khoản 2, các điểm h, i, k khoản 3, điểm h khoản 4, các\nđiểm e, g, h khoản 5 Điều 23; khoản 1, khoản 2, khoản 4 Điều 24; điểm c khoản 4 Điều 47; khoản 3\nĐiều 48, điểm a khoản 5 Điều 48 Nghị định này.\n4. Thẩm quyền xử phạt vi phạm hành chính của Cảnh sát biển Người có thẩm quyền xử phạt của lực lượng Cảnh sát biển xử phạt đối với hành vi vi phạm hành chính quy định tại khoản 1, khoản 2, các điểm h, i, k khoản 3, điểm h khoản 4, các điểm e, g, h khoản 5,\nđiểm b khoản 8 Điều 23; khoản 1, khoản 2, các điểm a, b khoản 4, điểm c khoản 5, điểm a khoản 6, các điểm a, b khoản 8 Điều 24 Nghị định này.\n5. Thẩm quyền xử phạt vi phạm hành chính của Công an nhân dân Người có thẩm quyền xử phạt của cơ quan Công an nhân dân xử phạt đối với hành vi vi phạm hành chính quy định tại các khoản 3, 4 và 5 Điều 4; khoản 1, khoản 2,\ncác điểm a, b, c, h, i, k, l khoản 3, các điểm h, n khoản 4[102], các điểm c, e, g, h khoản 5, điểm c khoản 8 Điều 23; khoản 1, khoản 2, khoản 3, khoản 4, các điểm a, c khoản 5, khoản 6, khoản 7, khoản 8 Điều 24; điểm b khoản 2, khoản 5, khoản 6, khoản 7 Điều 26; điểm a khoản 1, các điểm a, b khoản 3, các điểm a, b, c, d, đ, e,\ni, k khoản 4, khoản 5 Điều 27; các điểm c, d khoản 5, khoản 6, khoản 7 Điều 28; điểm a khoản 1, các điểm a khoản 2, điểm e khoản 3 Điều 28a; điểm c khoản 3, khoản 4 Điều 30; Điều 31; khoản 2 Điều 39; Điều 44; Điều 45; Điều 46; điểm c khoản 4 Điều 47; Điều 48;\nđiểm b khoản 1, điểm c khoản 2 Điều 52 Nghị định này.\n6. Thẩm quyền xử phạt vi phạm hành chính của Thanh tra chuyên ngành du lịch Người có thẩm quyền xử phạt của Thanh tra chuyên ngành du lịch xử phạt đối với những hành vi vi phạm hành chính quy định tại khoản 1, khoản 2, các điểm a, b, c, h, i, k, l khoản 3, các điểm b, n khoản 4[103], các\nđiểm e, g, h khoản 5 Điều 23 Nghị định này.\n7. Thẩm quyền xử phạt vi phạm hành chính của Hải quan Tổng cục trưởng Tổng cục Hải quan xử phạt đối với hành vi vi phạm hành chính quy định tại điểm b khoản 8 Điều 23,\nđiểm c khoản 5, điểm b khoản 8 Điều 24 Nghị định này.\n8. Thẩm quyền xử phạt vi phạm hành chính của Chủ tịch\nỦy ban Cạnh tranh Quốc gia Chủ tịch Ủy ban Cạnh tranh Quốc gia xử phạt đối với hành vi vi phạm hành chính quy định tại khoản 1, khoản 2, các\nđiểm h, i, k khoản 3, các điểm e, g, h khoản 5 Điều 23; khoản 1 Điều 24 Nghị định này.\n9. Thẩm quyền xử phạt vi phạm hành chính của Thanh tra, giám sát ngành Ngân hàng Người có thẩm quyền xử phạt của Thanh tra, giám sát ngành Ngân hàng có thẩm quyền xử phạt vi phạm hành chính và áp dụng các biện pháp khắc phục hậu quả đối với hành vi vi phạm hành chính quy định tại Chương II Nghị định này theo thẩm quyền và chức năng, nhiệm vụ, quyền hạn được giao.\nĐiều 56. Thẩm quyền lập biên bản vi phạm hành chính Những người sau đây có thẩm quyền lập biên bản vi phạm hành chính:\n1.[104] Người có thẩm quyền xử phạt quy định tại Điều 53, Điều 54, Điều 54a, Điều 54b, Điều 54c, Điều 54d, Điều 54đ, Điều 54e, Điều 54g Nghị định này.\n2.[105] Người thuộc lực lượng Quân đội nhân dân, Công an nhân dân trong các cơ quan được quy định tại Nghị định này đang thi hành công vụ, nhiệm vụ theo văn bản quy phạm pháp luật hoặc văn bản hành chính do cơ quan, người có thẩm quyền ban hành; người chỉ huy tàu bay, thuyền trưởng, trưởng tàu và những người được chỉ huy tàu bay, thuyền trưởng, trưởng tàu giao nhiệm vụ lập biên bản.\n3. Công chức ngành Ngân hàng đang thi hành công vụ,\nnhiệm vụ được giao tại văn bản quy phạm pháp luật hoặc văn bản hành chính do cơ\nquan, người có thẩm quyền ban hành.\nChương IV\nĐIỀU KHOẢN THI HÀNH[106],[107]\nĐiều 57. Hiệu lực thi hành Nghị định này có hiệu lực thi hành từ ngày 31 tháng 12 năm 2019 và thay thế Nghị định số 96/2014/NĐ-CP ngày 17 tháng 10 năm 2014 của Chính phủ về xử phạt vi phạm hành chính trong lĩnh vực tiền tệ và ngân hàng.\nĐiều 58. Điều khoản chuyển tiếp 1. Đối với hành vi vi phạm hành chính về tiền tệ và\nngân hàng xảy ra trước thời điểm Nghị định này có hiệu lực mà sau đó mới bị\nphát hiện nhưng còn thời hiệu xử phạt hoặc đang trong quá trình xem xét, giải quyết thì áp dụng các quy định có lợi cho tổ chức, cá nhân vi phạm.\n2. Đối với quyết định xử phạt vi phạm hành chính trong lĩnh vực tiền tệ và ngân hàng đã được ban hành hoặc đã được thi hành xong trước thời điểm Nghị định này có hiệu lực thi hành, mà cá nhân, tổ chức bị xử\nphạt vi phạm hành chính còn khiếu nại thì áp dụng quy định của Nghị định số\n96/2014/NĐ-CP ngày 17 tháng 10 năm 2014 của Chính phủ về xử phạt vi phạm hành chính trong lĩnh vực tiền tệ và ngân hàng để giải quyết.\nĐiều 59. Trách nhiệm thi hành Thống đốc Ngân hàng Nhà nước Việt Nam, Bộ trưởng,\nThủ trưởng cơ quan ngang bộ, Thủ trưởng cơ quan thuộc Chính phủ, Chủ tịch Ủy ban nhân dân các tỉnh, thành phố trực thuộc Trung ương chịu trách nhiệm thi hành Nghị định này./.\nXÁC THỰC VĂN BẢN HỢP NHẤT KT. THỐNG ĐỐC PHÓ THỐNG ĐỐC\nĐoàn Thái Sơn\n[1]\nNghị định số 143/2021/NĐ-CP sửa đổi, bổ sung một số điều của Nghị định số\n88/2019/NĐ-CP ngày 14 tháng 11 năm 2019 quy định về xử phạt vi phạm hành chính trong lĩnh vực tiền tệ và ngân hàng có căn cứ ban hành như sau:\n“Căn cứ Luật Tổ chức Chính phủ\nngày 19 tháng 6 năm 2015; Luật sửa đổi, bổ sung một số điều của Luật Tổ chức Chính phủ và Luật Tổ chức chính quyền địa phương ngày 22 tháng 11 năm 2019;\nCăn cứ Luật Xử lý vi phạm hành chính ngày 20 tháng 6 năm 2012; Luật sửa đổi, bổ sung một số điều của Luật Xử lý vi phạm hành chính ngày 13 tháng 11 năm 2020;\nCăn cứ Luật Ngân hàng Nhà nước Việt Nam ngày 16 tháng 6 năm 2010;\nCăn cứ Luật Các tổ chức tín dụng ngày 16 tháng 6 năm 2010; Luật sửa đổi, bổ sung một số điều của Luật Các tổ chức tín dụng ngày 20 tháng 11 năm 2017;\nCăn cứ Luật Phòng, chống rửa tiền ngày 18 tháng 6 năm 2012;\nCăn cứ Luật Phòng, chống khủng bố ngày 12 tháng 6 năm 2013;\nTheo đề nghị của Thống đốc Ngân hàng Nhà nước Việt Nam;\nChính phủ ban hành Nghị định sửa đổi, bổ sung một số điều của Nghị định số 88/2019/NĐ-CP ngày 14 tháng 11 năm 2019 quy định về xử phạt vi phạm hành chính trong lĩnh vực tiền tệ và ngân hàng.”\n[2] Nghị định số 23/2023/NĐ-CP sửa đổi, bổ sung một số điều của Nghị định số 89/2016/NĐ-CP ngày 01 tháng 7 năm 2016 của Chính phủ\nquy định điều kiện đối với hoạt động đại lý đổi ngoại tệ, hoạt động cung ứng dịch vụ nhận và chi, trả ngoại tệ của tổ chức kinh tế và Nghị định số 88/2019/NĐ-CP ngày 14 tháng 11 năm 2019 của Chính phủ quy định về xử\nphạt vi phạm hành chính trong lĩnh vực tiền tệ và ngân hàng có căn cứ\nban hành như sau:\n“Căn cứ Luật Tổ chức Chính phủ ngày 19 tháng 6 năm 2015; Luật sửa\nđổi, bổ sung một số điều của Luật Tổ chức Chính phủ và Luật Tổ chức chính quyền\nđịa phương ngày 22 tháng 11 năm 2019;\nCăn cứ Luật Ngân hàng Nhà nước Việt Nam ngày 16 tháng 6 năm 2010;\nCăn cứ Luật Các tổ chức tín dụng ngày 16 tháng 6 năm 2010; Luật sửa đổi, bổ sung một số điều của Luật Các tổ chức tín dụng ngày 20 tháng 11 năm 2017;\nCăn cứ Luật Xử lý vi phạm hành chính ngày 20 tháng 6 năm 2012; Luật sửa đổi, bổ sung một số điều của Luật Xử lý vi phạm hành chính ngày 13 tháng 11 năm 2020;\nCăn cứ Luật\nĐầu tư ngày 17 tháng 6 năm 2020;\nCăn cứ Luật Doanh nghiệp ngày 17 tháng 6 năm 2020;\nCăn cứ Pháp lệnh Ngoại hối ngày 13 tháng 12 năm 2005; Pháp lệnh sửa đổi, bổ sung một số điều của Pháp lệnh Ngoại hối ngày 18 tháng 3 năm 2013;\nTheo đề nghị\ncủa Thống đốc Ngân hàng Nhà nước Việt Nam;\nChính phủ\nban hành Nghị định sửa đổi, bổ sung một số điều của Nghị định số 89/2016/NĐ-CP ngày 01 tháng 7 năm 2016 của Chính phủ quy định điều kiện đối với hoạt động đại lý đổi ngoại tệ, hoạt động cung ứng dịch vụ nhận và chi, trả ngoại tệ của tổ chức kinh tế và Nghị định số 88/2019/NĐ-CP ngày 14 tháng 11 năm 2019 của Chính phủ\nquy định về xử phạt vi phạm hành chính trong lĩnh vực tiền tệ và ngân hàng.”\n[3]\nĐiểm này được sửa đổi theo quy định tại khoản 1 Điều 1 của Nghị định số\n143/2021/NĐ-CP sửa đổi, bổ sung một số điều của Nghị định số 88/2019/NĐ-CP ngày 14 tháng 11 năm 2019 quy định về xử phạt vi phạm hành chính trong lĩnh vực tiền tệ và ngân hàng, có hiệu lực kể từ ngày 01 tháng 01 năm 2022.\n[4]\nĐiều này được bổ sung theo quy định tại khoản 2 Điều 1 của Nghị định số\n143/2021/NĐ-CP sửa đổi, bổ sung một số điều của Nghị định số 88/2019/NĐ-CP ngày 14 tháng 11 năm 2019 quy định về xử phạt vi phạm hành chính trong lĩnh vực tiền tệ và ngân hàng, có hiệu lực kể từ ngày 01 tháng 01 năm 2022.\n[5]\nĐiều này được bổ sung theo quy định tại khoản 3 Điều 1 của Nghị định số\n143/2021/NĐ-CP sửa đổi, bổ sung một số điều của Nghị định số 88/2019/NĐ-CP ngày 14 tháng 11 năm 2019 quy định về xử phạt vi phạm hành chính trong lĩnh vực tiền tệ và ngân hàng, có hiệu lực kể từ ngày 01 tháng 01 năm 2022.\n[6]\nĐiểm này được sửa đổi theo quy định tại điểm a khoản 1 Điều 2 của Nghị định số\n23/2023/NĐ-CP sửa đổi, bổ sung một số điều của Nghị định số 89/2016/NĐ-CP ngày 01 tháng 7 năm 2016 của Chính phủ quy định điều kiện đối với hoạt động đại lý đổi ngoại tệ, hoạt động cung ứng dịch vụ nhận và chi, trả ngoại tệ của tổ chức kinh tế và Nghị định số 88/2019/NĐ-CP ngày 14 tháng 11 năm 2019 của Chính phủ quy định về xử phạt vi phạm hành chính trong lĩnh vực tiền tệ\nvà ngân hàng, có hiệu lực kể từ ngày 01 tháng 7 năm 2023.\n[7]\nCụm từ “tịch thu giấy phép đã bị tẩy xóa, sửa chữa” được bãi bỏ theo quy định tại khoản 1 Điều 2 của Nghị định số 143/2021/NĐ-CP sửa đổi, bổ sung một số điều của Nghị định số 88/2019/NĐ-CP ngày 14 tháng 11 năm 2019 quy định về xử phạt vi phạm hành chính trong lĩnh vực tiền tệ và ngân hàng, có hiệu lực kể từ ngày 01 tháng 01 năm 2022.\n[8]\nĐiểm này được sửa đổi theo quy định tại điểm a khoản 4 Điều 1 của Nghị định số\n143/2021/NĐ-CP sửa đổi, bổ sung một số điều của Nghị định số 88/2019/NĐ-CP ngày 14 tháng 11 năm 2019 quy định về xử phạt vi phạm hành chính trong lĩnh vực tiền tệ và ngân hàng, có hiệu lực kể từ ngày 01 tháng 01 năm 2022.\n[9]\nĐiểm này được sửa đổi theo quy định tại điểm b khoản 4 Điều 1 của Nghị định số\n143/2021/NĐ-CP sửa đổi, bổ sung một số điều của Nghị định số 88/2019/NĐ-CP ngày 14 tháng 11 năm 2019 quy định về xử phạt vi phạm hành chính trong lĩnh vực tiền tệ và ngân hàng, có hiệu lực kể từ ngày 01 tháng 01 năm 2022.\n[10] Điểm này được sửa đổi theo quy định tại điểm b khoản 1 Điều 2 của Nghị định số 23/2023/NĐ-CP sửa đổi, bổ\nsung một số điều của Nghị định số 89/2016/NĐ-CP ngày 01 tháng 7 năm 2016 của Chính phủ quy định điều kiện đối với hoạt động đại lý đổi ngoại tệ, hoạt động cung ứng dịch vụ nhận và chi, trả ngoại tệ của tổ chức kinh tế và Nghị định số\n88/2019/NĐ-CP ngày 14 tháng 11 năm 2019 của Chính phủ quy định về xử phạt vi phạm hành chính trong lĩnh vực tiền tệ và\nngân hàng, có hiệu lực kể từ ngày 01 tháng 7 năm 2023.\n[11]\nĐiểm này được bổ sung theo quy định tại điểm c khoản 4 Điều 1 của Nghị định số\n143/2021/NĐ-CP sửa đổi, bổ sung một số điều của Nghị định số 88/2019/NĐ-CP ngày 14 tháng 11 năm 2019 quy định về xử phạt vi phạm hành chính trong lĩnh vực tiền tệ và ngân hàng, có hiệu lực kể từ ngày 01 tháng 01 năm 2022.\n[12]\nĐiểm này được bổ sung theo quy định tại điểm c khoản 4 Điều 1 của Nghị định số\n143/2021/NĐ-CP sửa đổi, bổ sung một số điều của Nghị định số 88/2019/NĐ-CP ngày 14 tháng 11 năm 2019 quy định về xử phạt vi phạm hành chính trong lĩnh vực tiền tệ và ngân hàng, có hiệu lực kể từ ngày 01 tháng 01 năm 2022.\n[13]\nĐiều này được bổ sung theo quy định tại khoản 5 Điều 1 của Nghị định số\n143/2021/NĐ-CP sửa đổi, bổ sung một số điều của Nghị định số 88/2019/NĐ-CP ngày 14 tháng 11 năm 2019 quy định về xử phạt vi phạm hành chính trong lĩnh vực tiền tệ và ngân hàng, có hiệu lực kể từ ngày 01 tháng 01 năm 2022.\n[14] Khoản này được sửa đổi theo quy định tại khoản 2 Điều 2 của Nghị định số 23/2023/NĐ-CP sửa đổi, bổ sung một số điều của Nghị định số 89/2016/NĐ-CP ngày 01 tháng 7 năm 2016 của Chính phủ\nquy định điều kiện đối với hoạt động đại lý đổi ngoại tệ, hoạt động cung ứng dịch vụ nhận và chi, trả ngoại tệ của tổ chức kinh tế và Nghị định số 88/2019/NĐ-CP ngày 14 tháng 11 năm 2019 của Chính phủ quy định về xử\nphạt vi phạm hành chính trong lĩnh vực tiền tệ và ngân hàng, có hiệu lực kể từ ngày 01 tháng 7 năm 2023.\n[15]\nCụm từ “giả mạo” được bãi bỏ theo quy định tại khoản 3 Điều 2 của Nghị định số\n143/2021/NĐ-CP sửa đổi, bổ sung một số điều của Nghị định số 88/2019/NĐ-CP ngày 14 tháng 11 năm 2019 quy định về xử phạt vi phạm hành chính trong lĩnh vực tiền tệ và ngân hàng, có hiệu lực kể từ ngày 01 tháng 01 năm 2022.\n[16]\nKhoản này được sửa đổi theo quy định tại điểm a khoản 6 Điều 1 của Nghị định số\n143/2021/NĐ-CP sửa đổi, bổ sung một số điều của Nghị định số 88/2019/NĐ-CP ngày 14 tháng 11 năm 2019 quy định về xử phạt vi phạm hành chính trong lĩnh vực tiền tệ và ngân hàng, có hiệu lực kể từ ngày 01 tháng 01 năm 2022.\n[17]\nKhoản này được bãi bỏ theo quy định tại khoản 2 Điều 2 của Nghị định số\n143/2021/NĐ-CP sửa đổi, bổ sung một số điều của Nghị định số 88/2019/NĐ-CP ngày 14 tháng 11 năm 2019 quy định về xử phạt vi phạm hành chính trong lĩnh vực tiền tệ và ngân hàng, có hiệu lực kể từ ngày 01 tháng 01 năm 2022.\n[18]\nĐiểm này được bổ sung theo quy định tại điểm b khoản 6 Điều 1 của Nghị định số\n143/2021/NĐ-CP sửa đổi, bổ sung một số điều của Nghị định số 88/2019/NĐ-CP ngày 14 tháng 11 năm 2019 quy định về xử phạt vi phạm hành chính trong lĩnh vực tiền tệ và ngân hàng, có hiệu lực kể từ ngày 01 tháng 01 năm 2022.\n[19]\nKhoản này được bãi bỏ theo quy định tại khoản 2 Điều 2 của Nghị định số\n143/2021/NĐ-CP sửa đổi, bổ sung một số điều của Nghị định số 88/2019/NĐ-CP ngày 14 tháng 11 năm 2019 quy định về xử phạt vi phạm hành chính trong lĩnh vực tiền tệ và ngân hàng, có hiệu lực kể từ ngày 01 tháng 01 năm 2022.\n[20]\nĐiểm này được sửa đổi theo quy định tại điểm a khoản 7 Điều 1 của Nghị định số\n143/2021/NĐ-CP sửa đổi, bổ sung một số điều của Nghị định số 88/2019/NĐ-CP ngày 14 tháng 11 năm 2019 quy định về xử phạt vi phạm hành chính trong lĩnh vực tiền tệ và ngân hàng, có hiệu lực kể từ ngày 01 tháng 01 năm 2022.\n[21]\nĐiểm này được bổ sung theo quy định tại điểm b khoản 7 Điều 1 của Nghị định số\n143/2021/NĐ-CP sửa đổi, bổ sung một số điều của Nghị định số 88/2019/NĐ-CP ngày 14 tháng 11 năm 2019 quy định về xử phạt vi phạm hành chính trong lĩnh vực tiền tệ và ngân hàng, có hiệu lực kể từ ngày 01 tháng 01 năm 2022.\n[22]\nĐiểm này được bổ sung theo quy định tại điểm b khoản 7 Điều 1 của Nghị định số\n143/2021/NĐ-CP sửa đổi, bổ sung một số điều của Nghị định số 88/2019/NĐ-CP ngày 14 tháng 11 năm 2019 quy định về xử phạt vi phạm hành chính trong lĩnh vực tiền tệ và ngân hàng, có hiệu lực kể từ ngày 01 tháng 01 năm 2022.\n[23]\nĐiểm này được bổ sung theo quy định tại điểm b khoản 7 Điều 1 của Nghị định số\n143/2021/NĐ-CP sửa đổi, bổ sung một số điều của Nghị định số 88/2019/NĐ-CP ngày 14 tháng 11 năm 2019 quy định về xử phạt vi phạm hành chính trong lĩnh vực tiền tệ và ngân hàng, có hiệu lực kể từ ngày 01 tháng 01 năm 2022.\n[24]\nĐiểm này được bổ sung theo quy định tại điểm c khoản 7 Điều 1 của Nghị định số\n143/2021/NĐ-CP sửa đổi, bổ sung một số điều của Nghị định số 88/2019/NĐ-CP ngày 14 tháng 11 năm 2019 quy định về xử phạt vi phạm hành chính trong lĩnh vực tiền tệ và ngân hàng, có hiệu lực kể từ ngày 01 tháng 01 năm 2022.\n[25]\nKhoản này được sửa đổi theo quy định tại khoản 8 Điều 1 của Nghị định số\n143/2021/NĐ-CP sửa đổi, bổ sung một số điều của Nghị định số 88/2019/NĐ-CP ngày 14 tháng 11 năm 2019 quy định về xử phạt vi phạm hành chính trong lĩnh vực tiền tệ và ngân hàng, có hiệu lực kể từ ngày 01 tháng 01 năm 2022.\n[26]\nĐiểm này được bổ sung theo quy định tại điểm a khoản 9 Điều 1 của Nghị định số\n143/2021/NĐ-CP sửa đổi, bổ sung một số điều của Nghị định số 88/2019/NĐ-CP ngày 14 tháng 11 năm 2019 quy định về xử phạt vi phạm hành chính trong lĩnh vực tiền tệ và ngân hàng, có hiệu lực kể từ ngày 01 tháng 01 năm 2022.\n[27]\nĐiểm này được bổ sung theo quy định tại điểm a khoản 9 Điều 1 của Nghị định số\n143/2021/NĐ-CP sửa đổi, bổ sung một số điều của Nghị định số 88/2019/NĐ-CP ngày 14 tháng 11 năm 2019 quy định về xử phạt vi phạm hành chính trong lĩnh vực tiền tệ và ngân hàng, có hiệu lực kể từ ngày 01 tháng 01 năm 2022.\n[28]\nĐiểm này được bổ sung theo quy định tại điểm a khoản 9 Điều 1 của Nghị định số\n143/2021/NĐ-CP sửa đổi, bổ sung một số điều của Nghị định số 88/2019/NĐ-CP ngày 14 tháng 11 năm 2019 quy định về xử phạt vi phạm hành chính trong lĩnh vực tiền tệ và ngân hàng, có hiệu lực kể từ ngày 01 tháng 01 năm 2022.\n[29]\nĐiểm này được bổ sung theo quy định tại điểm a khoản 9 Điều 1 của Nghị định số\n143/2021/NĐ-CP sửa đổi, bổ sung một số điều của Nghị định số 88/2019/NĐ-CP ngày 14 tháng 11 năm 2019 quy định về xử phạt vi phạm hành chính trong lĩnh vực tiền tệ và ngân hàng, có hiệu lực kể từ ngày 01 tháng 01 năm 2022.\n[30]\nKhoản này được sửa đổi theo quy định tại điểm b khoản 9 Điều 1 của Nghị định số\n143/2021/NĐ-CP sửa đổi, bổ sung một số điều của Nghị định số 88/2019/NĐ-CP ngày 14 tháng 11 năm 2019 quy định về xử phạt vi phạm hành chính trong lĩnh vực tiền tệ và ngân hàng, có hiệu lực kể từ ngày 01 tháng 01 năm 2022.\n[31]\nĐiểm này được sửa đổi theo quy định tại điểm c khoản 9 Điều 1 của Nghị định số\n143/2021/NĐ-CP sửa đổi, bổ sung một số điều của Nghị định số 88/2019/NĐ-CP ngày 14 tháng 11 năm 2019 quy định về xử phạt vi phạm hành chính trong lĩnh vực tiền tệ và ngân hàng, có hiệu lực kể từ ngày 01 tháng 01 năm 2022.\n[32]\nĐiều này được bổ sung theo quy định tại khoản 10 Điều 1 của Nghị định số\n143/2021/NĐ-CP sửa đổi, bổ sung một số điều của Nghị định số 88/2019/NĐ-CP ngày 14 tháng 11 năm 2019 quy định về xử phạt vi phạm hành chính trong lĩnh vực tiền tệ và ngân hàng, có hiệu lực kể từ ngày 01 tháng 01 năm 2022.\n[33]\nĐiểm này được bổ sung theo quy định tại khoản 11 Điều 1 của Nghị định số\n143/2021/NĐ-CP sửa đổi, bổ sung một số điều của Nghị định số 88/2019/NĐ-CP ngày 14 tháng 11 năm 2019 quy định về xử phạt vi phạm hành chính trong lĩnh vực tiền tệ và ngân hàng, có hiệu lực kể từ ngày 01 tháng 01 năm 2022.\n[34]\nĐiểm này được bổ sung theo quy định tại điểm a khoản 12 Điều 1 của Nghị định số\n143/2021/NĐ-CP sửa đổi, bổ sung một số điều của Nghị định số 88/2019/NĐ-CP ngày 14 tháng 11 năm 2019 quy định về xử phạt vi phạm hành chính trong lĩnh vực tiền tệ và ngân hàng, có hiệu lực kể từ ngày 01 tháng 01 năm 2022.\n[35]\nĐiểm này được bổ sung theo quy định tại điểm b khoản 12 Điều 1 của Nghị định số\n143/2021/NĐ-CP sửa đổi, bổ sung một số điều của Nghị định số 88/2019/NĐ-CP ngày 14 tháng 11 năm 2019 quy định về xử phạt vi phạm hành chính trong lĩnh vực tiền tệ và ngân hàng, có hiệu lực kể từ ngày 01 tháng 01 năm 2022.\n[36]\nKhoản này được sửa đổi theo quy định tại điểm c khoản 12 Điều 1 của Nghị định số\n143/2021/NĐ-CP sửa đổi, bổ sung một số điều của Nghị định số 88/2019/NĐ-CP ngày 14 tháng 11 năm 2019 quy định về xử phạt vi phạm hành chính trong lĩnh vực tiền tệ và ngân hàng, có hiệu lực kể từ ngày 01 tháng 01 năm 2022.\n[37]\nCụm từ “giả mạo” được bãi bỏ theo quy định tại khoản 3 Điều 2 của Nghị định số\n143/2021/NĐ-CP sửa đổi, bổ sung một số điều của Nghị định số 88/2019/NĐ-CP ngày 14 tháng 11 năm 2019 quy định về xử phạt vi phạm hành chính trong lĩnh vực tiền tệ và ngân hàng, có hiệu lực kể từ ngày 01 tháng 01 năm 2022.\n[38] Điểm này được sửa đổi theo quy định tại điểm a khoản 3 Điều 2 của Nghị định số 23/2023/NĐ-CP sửa đổi, bổ\nsung một số điều của Nghị định số 89/2016/NĐ-CP ngày 01 tháng 7 năm 2016 của Chính phủ quy định điều kiện đối với hoạt động đại lý đổi ngoại tệ, hoạt động cung ứng dịch vụ nhận và chi, trả ngoại tệ của tổ chức kinh tế và Nghị định số\n88/2019/NĐ-CP ngày 14 tháng 11 năm 2019 của Chính phủ quy định về xử phạt vi phạm hành chính trong lĩnh vực tiền tệ và\nngân hàng, có hiệu lực kể từ ngày 01 tháng 7 năm 2023.\n[39] Điểm này được sửa đổi theo quy định tại điểm b khoản 3 Điều 2 của Nghị định số 23/2023/NĐ-CP sửa đổi, bổ\nsung một số điều của Nghị định số 89/2016/NĐ-CP ngày 01 tháng 7 năm 2016 của Chính phủ quy định điều kiện đối với hoạt động đại lý đổi ngoại tệ, hoạt động cung ứng dịch vụ nhận và chi, trả ngoại tệ của tổ chức kinh tế và Nghị định số\n88/2019/NĐ-CP ngày 14 tháng 11 năm 2019 của Chính phủ quy định về xử phạt vi phạm hành chính trong lĩnh vực tiền tệ và\nngân hàng, có hiệu lực kể từ ngày 01 tháng 7 năm 2023.\n[40] Điểm này được sửa đổi theo quy định tại điểm b khoản 3 Điều 2 của Nghị định số 23/2023/NĐ-CP sửa đổi, bổ\nsung một số điều của Nghị định số 89/2016/NĐ-CP ngày 01 tháng 7 năm 2016 của Chính phủ quy định điều kiện đối với hoạt động đại lý đổi ngoại tệ, hoạt động cung ứng dịch vụ nhận và chi, trả ngoại tệ của tổ chức kinh tế và Nghị định số\n88/2019/NĐ-CP ngày 14 tháng 11 năm 2019 của Chính phủ quy định về xử phạt vi phạm hành chính trong lĩnh vực tiền tệ và\nngân hàng, có hiệu lực kể từ ngày 01 tháng 7 năm 2023.\n[41]\nĐiểm này được sửa đổi theo quy định tại điểm a khoản 13 Điều 1 của Nghị định số\n143/2021/NĐ-CP sửa đổi, bổ sung một số điều của Nghị định số 88/2019/NĐ-CP ngày 14 tháng 11 năm 2019 quy định về xử phạt vi phạm hành chính trong lĩnh vực tiền tệ và ngân hàng, có hiệu lực kể từ ngày 01 tháng 01 năm 2022.\n[42] Điểm này được bãi bỏ theo quy định tại điểm a khoản 1 Điều 3 của Nghị định số 23/2023/NĐ-CP sửa đổi, bổ\nsung một số điều của Nghị định số 89/2016/NĐ-CP ngày 01 tháng 7 năm 2016 của Chính phủ quy định điều kiện đối với hoạt động đại lý đổi ngoại tệ, hoạt động cung ứng dịch vụ nhận và chi, trả ngoại tệ của tổ chức kinh tế và Nghị định số\n88/2019/NĐ-CP ngày 14 tháng 11 năm 2019 của Chính phủ quy định về xử phạt vi phạm hành chính trong lĩnh vực tiền tệ và\nngân hàng, có hiệu lực kể từ ngày 01 tháng 7 năm 2023.\n[43] Điểm này được sửa đổi theo quy định tại điểm c khoản 3 Điều 2 của Nghị định số 23/2023/NĐ-CP sửa đổi, bổ\nsung một số điều của Nghị định số 89/2016/NĐ-CP ngày 01 tháng 7 năm 2016 của Chính phủ quy định điều kiện đối với hoạt động đại lý đổi ngoại tệ, hoạt động cung ứng dịch vụ nhận và chi, trả ngoại tệ của tổ chức kinh tế và Nghị định số\n88/2019/NĐ-CP ngày 14 tháng 11 năm 2019 của Chính phủ quy định về xử phạt vi phạm hành chính trong lĩnh vực tiền tệ và\nngân hàng, có hiệu lực kể từ ngày 01 tháng 7 năm 2023.\n[44]\nĐiểm này được bổ sung theo quy định tại điểm c khoản 13 Điều 1 của Nghị định số\n143/2021/NĐ-CP sửa đổi, bổ sung một số điều của Nghị định số 88/2019/NĐ-CP ngày 14 tháng 11 năm 2019 quy định về xử phạt vi phạm hành chính trong lĩnh vực tiền tệ và ngân hàng, có hiệu lực kể từ ngày 01 tháng 01 năm 2022.\n[45] Cụm từ\n“các điểm d, o khoản 4” được thay thế bằng cụm từ “điểm d khoản 4” theo quy định tại điểm b khoản 1 Điều 3 của Nghị định số 23/2023/NĐ-CP sửa đổi, bổ\nsung một số điều của Nghị định số 89/2016/NĐ-CP ngày 01 tháng 7 năm 2016 của Chính phủ quy định điều kiện đối với hoạt động đại lý đổi ngoại tệ, hoạt động cung ứng dịch vụ nhận và chi, trả ngoại tệ của tổ chức kinh tế và Nghị định số\n88/2019/NĐ-CP ngày 14 tháng 11 năm 2019 của Chính phủ quy định về xử phạt vi phạm hành chính trong lĩnh vực tiền tệ và\nngân hàng, có hiệu lực kể từ ngày 01 tháng 7 năm 2023.\n[46] Điểm này được sửa đổi theo quy định tại điểm d khoản 3 Điều 2 của Nghị định số 23/2023/NĐ-CP sửa đổi, bổ\nsung một số điều của Nghị định số 89/2016/NĐ-CP ngày 01 tháng 7 năm 2016 của Chính phủ quy định điều kiện đối với hoạt động đại lý đổi ngoại tệ, hoạt động cung ứng dịch vụ nhận và chi, trả ngoại tệ của tổ chức kinh tế và Nghị định số\n88/2019/NĐ-CP ngày 14 tháng 11 năm 2019 của Chính phủ quy định về xử phạt vi phạm hành chính trong lĩnh vực tiền tệ và\nngân hàng, có hiệu lực kể từ ngày 01 tháng 7 năm 2023.\n[47] Điểm này được bãi bỏ theo quy định tại điểm a khoản 1 Điều 3 của Nghị định số 23/2023/NĐ-CP sửa đổi, bổ\nsung một số điều của Nghị định số 89/2016/NĐ-CP ngày 01 tháng 7 năm 2016 của Chính phủ quy định điều kiện đối với hoạt động đại lý đổi ngoại tệ, hoạt động cung ứng dịch vụ nhận và chi, trả ngoại tệ của tổ chức kinh tế và Nghị định số\n88/2019/NĐ-CP ngày 14 tháng 11 năm 2019 của Chính phủ quy định về xử phạt vi phạm hành chính trong lĩnh vực tiền tệ và\nngân hàng, có hiệu lực kể từ ngày 01 tháng 7 năm 2023.\n[48] Khoản này được sửa đổi theo quy định tại điểm đ khoản 3 Điều 2 của Nghị định số 23/2023/NĐ-CP sửa đổi, bổ\nsung một số điều của Nghị định số 89/2016/NĐ-CP ngày 01 tháng 7 năm 2016 của Chính phủ quy định điều kiện đối với hoạt động đại lý đổi ngoại tệ, hoạt động cung ứng dịch vụ nhận và chi, trả ngoại tệ của tổ chức kinh tế và Nghị định số\n88/2019/NĐ-CP ngày 14 tháng 11 năm 2019 của Chính phủ quy định về xử phạt vi phạm hành chính trong lĩnh vực tiền tệ và\nngân hàng, có hiệu lực kể từ ngày 01 tháng 7 năm 2023.\n[49]\nKhoản này được sửa đổi theo quy định tại điểm a khoản 14 Điều 1 của Nghị định số\n143/2021/NĐ-CP sửa đổi, bổ sung một số điều của Nghị định số 88/2019/NĐ-CP ngày 14 tháng 11 năm 2019 quy định về xử phạt vi phạm hành chính trong lĩnh vực tiền tệ và ngân hàng, có hiệu lực kể từ ngày 01 tháng 01 năm 2022.\n[50]\nKhoản này được sửa đổi theo quy định tại điểm b khoản 14 Điều 1 của Nghị định số\n143/2021/NĐ-CP sửa đổi, bổ sung một số điều của Nghị định số 88/2019/NĐ-CP ngày 14 tháng 11 năm 2019 quy định về xử phạt vi phạm hành chính trong lĩnh vực tiền tệ và ngân hàng, có hiệu lực kể từ ngày 01 tháng 01 năm 2022.\n[51]\nĐiểm này được sửa đổi theo quy định tại điểm a khoản 15 Điều 1 của Nghị định số\n143/2021/NĐ-CP sửa đổi, bổ sung một số điều của Nghị định số 88/2019/NĐ-CP ngày 14 tháng 11 năm 2019 quy định về xử phạt vi phạm hành chính trong lĩnh vực tiền tệ và ngân hàng, có hiệu lực kể từ ngày 01 tháng 01 năm 2022.\n[52]\nĐiểm này được sửa đổi theo quy định tại điểm b khoản 15 Điều 1 của Nghị định số\n143/2021/NĐ-CP sửa đổi, bổ sung một số điều của Nghị định số 88/2019/NĐ-CP ngày 14 tháng 11 năm 2019 quy định về xử phạt vi phạm hành chính trong lĩnh vực tiền tệ và ngân hàng, có hiệu lực kể từ ngày 01 tháng 01 năm 2022.\n[53]\nĐiểm này được sửa đổi theo quy định tại điểm c khoản 15 Điều 1 của Nghị định số\n143/2021/NĐ-CP sửa đổi, bổ sung một số điều của Nghị định số 88/2019/NĐ-CP ngày 14 tháng 11 năm 2019 quy định về xử phạt vi phạm hành chính trong lĩnh vực tiền tệ và ngân hàng, có hiệu lực kể từ ngày 01 tháng 01 năm 2022.\n[54]\nKhoản này được sửa đổi theo quy định tại điểm d khoản 15 Điều 1 của Nghị định số\n143/2021/NĐ-CP sửa đổi, bổ sung một số điều của Nghị định số 88/2019/NĐ-CP ngày 14 tháng 11 năm 2019 quy định về xử phạt vi phạm hành chính trong lĩnh vực tiền tệ và ngân hàng, có hiệu lực kể từ ngày 01 tháng 01 năm 2022.\n[55]\nKhoản này được sửa đổi theo quy định tại điểm đ khoản 15 Điều 1 của Nghị định số\n143/2021/NĐ-CP sửa đổi, bổ sung một số điều của Nghị định số 88/2019/NĐ-CP ngày 14 tháng 11 năm 2019 quy định về xử phạt vi phạm hành chính trong lĩnh vực tiền tệ và ngân hàng, có hiệu lực kể từ ngày 01 tháng 01 năm 2022.\n[56]\nKhoản này được sửa đổi theo quy định tại điểm e khoản 15 Điều 1 của Nghị định số\n143/2021/NĐ-CP sửa đổi, bổ sung một số điều của Nghị định số 88/2019/NĐ-CP ngày 14 tháng 11 năm 2019 quy định về xử phạt vi phạm hành chính trong lĩnh vực tiền tệ và ngân hàng, có hiệu lực kể từ ngày 01 tháng 01 năm 2022.\n[57]\nKhoản này được sửa đổi theo quy định tại điểm g khoản 15 Điều 1 của Nghị định số\n143/2021/NĐ-CP sửa đổi, bổ sung một số điều của Nghị định số 88/2019/NĐ-CP ngày 14 tháng 11 năm 2019 quy định về xử phạt vi phạm hành chính trong lĩnh vực tiền tệ và ngân hàng, có hiệu lực kể từ ngày 01 tháng 01 năm 2022.\n[58]\nĐiểm này được sửa đổi theo quy định tại điểm a khoản 16 Điều 1 của Nghị định số\n143/2021/NĐ-CP sửa đổi, bổ sung một số điều của Nghị định số 88/2019/NĐ-CP ngày 14 tháng 11 năm 2019 quy định về xử phạt vi phạm hành chính trong lĩnh vực tiền tệ và ngân hàng, có hiệu lực kể từ ngày 01 tháng 01 năm 2022.\n[59]\nKhoản này được sửa đổi theo quy định tại điểm b khoản 16 Điều 1 của Nghị định số\n143/2021/NĐ-CP sửa đổi, bổ sung một số điều của Nghị định số 88/2019/NĐ-CP ngày 14 tháng 11 năm 2019 quy định về xử phạt vi phạm hành chính trong lĩnh vực tiền tệ và ngân hàng, có hiệu lực kể từ ngày 01 tháng 01 năm 2022.\n[60]\nKhoản này được sửa đổi theo quy định tại điểm c khoản 16 Điều 1 của Nghị định số\n143/2021/NĐ-CP sửa đổi, bổ sung một số điều của Nghị định số 88/2019/NĐ-CP ngày 14 tháng 11 năm 2019 quy định về xử phạt vi phạm hành chính trong lĩnh vực tiền tệ và ngân hàng, có hiệu lực kể từ ngày 01 tháng 01 năm 2022.\n[61]\nKhoản này được sửa đổi theo quy định tại điểm d khoản 16 Điều 1 của Nghị định số\n143/2021/NĐ-CP sửa đổi, bổ sung một số điều của Nghị định số 88/2019/NĐ-CP ngày 14 tháng 11 năm 2019 quy định về xử phạt vi phạm hành chính trong lĩnh vực tiền tệ và ngân hàng, có hiệu lực kể từ ngày 01 tháng 01 năm 2022.\n[62]\nKhoản này được bổ sung theo quy định tại điểm đ khoản 16 Điều 1 của Nghị định số\n143/2021/NĐ-CP sửa đổi, bổ sung một số điều của Nghị định số 88/2019/NĐ-CP ngày 14 tháng 11 năm 2019 quy định về xử phạt vi phạm hành chính trong lĩnh vực tiền tệ và ngân hàng, có hiệu lực kể từ ngày 01 tháng 01 năm 2022.\n[63]\nKhoản này được sửa đổi theo quy định tại điểm e khoản 16 Điều 1 của Nghị định số\n143/2021/NĐ-CP sửa đổi, bổ sung một số điều của Nghị định số 88/2019/NĐ-CP ngày 14 tháng 11 năm 2019 quy định về xử phạt vi phạm hành chính trong lĩnh vực tiền tệ và ngân hàng, có hiệu lực kể từ ngày 01 tháng 01 năm 2022.\n[64]\nKhoản này được sửa đổi theo quy định tại điểm g khoản 16 Điều 1 của Nghị định số\n143/2021/NĐ-CP sửa đổi, bổ sung một số điều của Nghị định số 88/2019/NĐ-CP ngày 14 tháng 11 năm 2019 quy định về xử phạt vi phạm hành chính trong lĩnh vực tiền tệ và ngân hàng, có hiệu lực kể từ ngày 01 tháng 01 năm 2022.\n[65]\nĐiểm này được sửa đổi theo quy định tại điểm a khoản 17 Điều 1 của Nghị định số\n143/2021/NĐ-CP sửa đổi, bổ sung một số điều của Nghị định số 88/2019/NĐ-CP ngày 14 tháng 11 năm 2019 quy định về xử phạt vi phạm hành chính trong lĩnh vực tiền tệ và ngân hàng, có hiệu lực kể từ ngày 01 tháng 01 năm 2022.\n[66]\nKhoản này được sửa đổi theo quy định tại điểm b khoản 17 Điều 1 của Nghị định số\n143/2021/NĐ-CP sửa đổi, bổ sung một số điều của Nghị định số 88/2019/NĐ-CP ngày 14 tháng 11 năm 2019 quy định về xử phạt vi phạm hành chính trong lĩnh vực tiền tệ và ngân hàng, có hiệu lực kể từ ngày 01 tháng 01 năm 2022.\n[67]\nKhoản này được sửa đổi theo quy định tại điểm c khoản 17 Điều 1 của Nghị định số\n143/2021/NĐ-CP sửa đổi, bổ sung một số điều của Nghị định số 88/2019/NĐ-CP ngày 14 tháng 11 năm 2019 quy định về xử phạt vi phạm hành chính trong lĩnh vực tiền tệ và ngân hàng, có hiệu lực kể từ ngày 01 tháng 01 năm 2022.\n[68]\nKhoản này được sửa đổi theo quy định tại điểm d khoản 17 Điều 1 của Nghị định số\n143/2021/NĐ-CP sửa đổi, bổ sung một số điều của Nghị định số 88/2019/NĐ-CP ngày 14 tháng 11 năm 2019 quy định về xử phạt vi phạm hành chính trong lĩnh vực tiền tệ và ngân hàng, có hiệu lực kể từ ngày 01 tháng 01 năm 2022.\n[69]\nĐiều này được bổ sung theo quy định tại khoản 18 Điều 1 của Nghị định số\n143/2021/NĐ-CP sửa đổi, bổ sung một số điều của Nghị định số 88/2019/NĐ-CP ngày 14 tháng 11 năm 2019 quy định về xử phạt vi phạm hành chính trong lĩnh vực tiền tệ và ngân hàng, có hiệu lực kể từ ngày 01 tháng 01 năm 2022.\n[70]\nĐiểm này được sửa đổi theo quy định tại điểm a khoản 19 Điều 1 của Nghị định số\n143/2021/NĐ-CP sửa đổi, bổ sung một số điều của Nghị định số 88/2019/NĐ-CP ngày 14 tháng 11 năm 2019 quy định về xử phạt vi phạm hành chính trong lĩnh vực tiền tệ và ngân hàng, có hiệu lực kể từ ngày 01 tháng 01 năm 2022.\n[71]\nKhoản này được sửa đổi theo quy định tại điểm b khoản 19 Điều 1 của Nghị định số\n143/2021/NĐ-CP sửa đổi, bổ sung một số điều của Nghị định số 88/2019/NĐ-CP ngày 14 tháng 11 năm 2019 quy định về xử phạt vi phạm hành chính trong lĩnh vực tiền tệ và ngân hàng, có hiệu lực kể từ ngày 01 tháng 01 năm 2022.\n[72]\nĐiểm này được bổ sung theo quy định tại điểm c khoản 19 Điều 1 của Nghị định số\n143/2021/NĐ-CP sửa đổi, bổ sung một số điều của Nghị định số 88/2019/NĐ-CP ngày 14 tháng 11 năm 2019 quy định về xử phạt vi phạm hành chính trong lĩnh vực tiền tệ và ngân hàng, có hiệu lực kể từ ngày 01 tháng 01 năm 2022.\n[73]\nĐiểm này được sửa đổi theo quy định tại khoản 20 Điều 1 của Nghị định số\n143/2021/NĐ-CP sửa đổi, bổ sung một số điều của Nghị định số 88/2019/NĐ-CP ngày 14 tháng 11 năm 2019 quy định về xử phạt vi phạm hành chính trong lĩnh vực tiền tệ và ngân hàng, có hiệu lực kể từ ngày 01 tháng 01 năm 2022.\n[74]\nTên mục này được sửa đổi theo quy định tại khoản 21 Điều 1 của Nghị định số\n143/2021/NĐ-CP sửa đổi, bổ sung một số điều của Nghị định số 88/2019/NĐ-CP ngày 14 tháng 11 năm 2019 quy định về xử phạt vi phạm hành chính trong lĩnh vực tiền tệ và ngân hàng, có hiệu lực kể từ ngày 01 tháng 01 năm 2022.\n[75]\nĐiều này được sửa đổi theo quy định tại khoản 22 Điều 1 của Nghị định số\n143/2021/NĐ-CP sửa đổi, bổ sung một số điều của Nghị định số 88/2019/NĐ-CP ngày 14 tháng 11 năm 2019 quy định về xử phạt vi phạm hành chính trong lĩnh vực tiền tệ và ngân hàng, có hiệu lực kể từ ngày 01 tháng 01 năm 2022.\n[76]\nĐiều này được sửa đổi theo quy định tại khoản 23 Điều 1 của Nghị định số\n143/2021/NĐ-CP sửa đổi, bổ sung một số điều của Nghị định số 88/2019/NĐ-CP ngày 14 tháng 11 năm 2019 quy định về xử phạt vi phạm hành chính trong lĩnh vực tiền tệ và ngân hàng, có hiệu lực kể từ ngày 01 tháng 01 năm 2022.\n[77]\nĐiều này được sửa đổi theo quy định tại khoản 24 Điều 1 của Nghị định số\n143/2021/NĐ-CP sửa đổi, bổ sung một số điều của Nghị định số 88/2019/NĐ-CP ngày 14 tháng 11 năm 2019 quy định về xử phạt vi phạm hành chính trong lĩnh vực tiền tệ và ngân hàng, có hiệu lực kể từ ngày 01 tháng 01 năm 2022.\n[78]\nĐiều này được sửa đổi theo quy định tại khoản 25 Điều 1 của Nghị định số\n143/2021/NĐ-CP sửa đổi, bổ sung một số điều của Nghị định số 88/2019/NĐ-CP ngày 14 tháng 11 năm 2019 quy định về xử phạt vi phạm hành chính trong lĩnh vực tiền tệ và ngân hàng, có hiệu lực kể từ ngày 01 tháng 01 năm 2022.\n[79]\nĐiều này được sửa đổi theo quy định tại khoản 26 Điều 1 của Nghị định số\n143/2021/NĐ-CP sửa đổi, bổ sung một số điều của Nghị định số 88/2019/NĐ-CP ngày 14 tháng 11 năm 2019 quy định về xử phạt vi phạm hành chính trong lĩnh vực tiền tệ và ngân hàng, có hiệu lực kể từ ngày 01 tháng 01 năm 2022.\n[80]\nĐiều này được sửa đổi theo quy định tại khoản 27 Điều 1 của Nghị định số\n143/2021/NĐ-CP sửa đổi, bổ sung một số điều của Nghị định số 88/2019/NĐ-CP ngày 14 tháng 11 năm 2019 quy định về xử phạt vi phạm hành chính trong lĩnh vực tiền tệ và ngân hàng, có hiệu lực kể từ ngày 01 tháng 01 năm 2022.\n[81]\nĐiều này được bổ sung theo quy định tại khoản 28 Điều 1 của Nghị định số\n143/2021/NĐ-CP sửa đổi, bổ sung một số điều của Nghị định số 88/2019/NĐ-CP ngày 14 tháng 11 năm 2019 quy định về xử phạt vi phạm hành chính trong lĩnh vực tiền tệ và ngân hàng, có hiệu lực kể từ ngày 01 tháng 01 năm 2022.\n[82]\nĐiều này được sửa đổi theo quy định tại khoản 29 Điều 1 của Nghị định số\n143/2021/NĐ-CP sửa đổi, bổ sung một số điều của Nghị định số 88/2019/NĐ-CP ngày 14 tháng 11 năm 2019 quy định về xử phạt vi phạm hành chính trong lĩnh vực tiền tệ và ngân hàng, có hiệu lực kể từ ngày 01 tháng 01 năm 2022.\n[83]\nĐiều này được bổ sung theo quy định tại khoản 30 Điều 1 của Nghị định số\n143/2021/NĐ-CP sửa đổi, bổ sung một số điều của Nghị định số 88/2019/NĐ-CP ngày 14 tháng 11 năm 2019 quy định về xử phạt vi phạm hành chính trong lĩnh vực tiền tệ và ngân hàng, có hiệu lực kể từ ngày 01 tháng 01 năm 2022.\n[84]\nĐiều này được sửa đổi theo quy định tại khoản 31 Điều 1 của Nghị định số\n143/2021/NĐ-CP sửa đổi, bổ sung một số điều của Nghị định số 88/2019/NĐ-CP ngày 14 tháng 11 năm 2019 quy định về xử phạt vi phạm hành chính trong lĩnh vực tiền tệ và ngân hàng, có hiệu lực kể từ ngày 01 tháng 01 năm 2022.\n[85]\nĐiểm này được sửa đổi theo quy định tại điểm a khoản 32 Điều 1 của Nghị định số\n143/2021/NĐ-CP sửa đổi, bổ sung một số điều của Nghị định số 88/2019/NĐ-CP ngày 14 tháng 11 năm 2019 quy định về xử phạt vi phạm hành chính trong lĩnh vực tiền tệ và ngân hàng, có hiệu lực kể từ ngày 01 tháng 01 năm 2022.\n[86]\nĐiểm này được sửa đổi theo quy định tại điểm b khoản 32 Điều 1 của Nghị định số\n143/2021/NĐ-CP sửa đổi, bổ sung một số điều của Nghị định số 88/2019/NĐ-CP ngày 14 tháng 11 năm 2019 quy định về xử phạt vi phạm hành chính trong lĩnh vực tiền tệ và ngân hàng, có hiệu lực kể từ ngày 01 tháng 01 năm 2022.\n[87]\nĐiểm này được sửa đổi theo quy định tại khoản 33 Điều 1 của Nghị định số\n143/2021/NĐ-CP sửa đổi, bổ sung một số điều của Nghị định số 88/2019/NĐ-CP ngày 14 tháng 11 năm 2019 quy định về xử phạt vi phạm hành chính trong lĩnh vực tiền tệ và ngân hàng, có hiệu lực kể từ ngày 01 tháng 01 năm 2022.\n[88]\nTên của Điều này được sửa đổi theo quy định tại điểm a khoản 34 Điều 1 của Nghị\nđịnh số 143/2021/NĐ-CP sửa đổi, bổ sung một số điều của Nghị định số\n88/2019/NĐ-CP ngày 14 tháng 11 năm 2019 quy định về xử phạt vi phạm hành chính trong lĩnh vực tiền tệ và ngân hàng, có hiệu lực kể từ ngày 01 tháng 01 năm 2022.\n[89]\nĐiểm này được sửa đổi theo quy định tại điểm b khoản 34 Điều 1 của Nghị định số\n143/2021/NĐ-CP sửa đổi, bổ sung một số điều của Nghị định số 88/2019/NĐ-CP ngày 14 tháng 11 năm 2019 quy định về xử phạt vi phạm hành chính trong lĩnh vực tiền tệ và ngân hàng, có hiệu lực kể từ ngày 01 tháng 01 năm 2022.\n[90]\nĐiểm này được sửa đổi theo quy định tại điểm c khoản 34 Điều 1 của Nghị định số\n143/2021/NĐ-CP sửa đổi, bổ sung một số điều của Nghị định số 88/2019/NĐ-CP ngày 14 tháng 11 năm 2019 quy định về xử phạt vi phạm hành chính trong lĩnh vực tiền tệ và ngân hàng, có hiệu lực kể từ ngày 01 tháng 01 năm 2022.\n[91]\nĐiểm này được sửa đổi theo quy định tại điểm d khoản 34 Điều 1 của Nghị định số\n143/2021/NĐ-CP sửa đổi, bổ sung một số điều của Nghị định số 88/2019/NĐ-CP ngày 14 tháng 11 năm 2019 quy định về xử phạt vi phạm hành chính trong lĩnh vực tiền tệ và ngân hàng, có hiệu lực kể từ ngày 01 tháng 01 năm 2022.\n[92]\nĐiều này được sửa đổi theo quy định tại khoản 35 Điều 1 của Nghị định số\n143/2021/NĐ-CP sửa đổi, bổ sung một số điều của Nghị định số 88/2019/NĐ-CP ngày 14 tháng 11 năm 2019 quy định về xử phạt vi phạm hành chính trong lĩnh vực tiền tệ và ngân hàng, có hiệu lực kể từ ngày 01 tháng 01 năm 2022.\n[93]\nĐiều này được bổ sung theo quy định tại khoản 36 Điều 1 của Nghị định số\n143/2021/NĐ-CP sửa đổi, bổ sung một số điều của Nghị định số 88/2019/NĐ-CP ngày 14 tháng 11 năm 2019 quy định về xử phạt vi phạm hành chính trong lĩnh vực tiền tệ và ngân hàng, có hiệu lực kể từ ngày 01 tháng 01 năm 2022.\n[94]\nĐiều này được bổ sung theo quy định tại khoản 37 Điều 1 của Nghị định số\n143/2021/NĐ-CP sửa đổi, bổ sung một số điều của Nghị định số 88/2019/NĐ-CP ngày 14 tháng 11 năm 2019 quy định về xử phạt vi phạm hành chính trong lĩnh vực tiền tệ và ngân hàng, có hiệu lực kể từ ngày 01 tháng 01 năm 2022.\n[95]\nĐiều này được bổ sung theo quy định tại khoản 38 Điều 1 của Nghị định số\n143/2021/NĐ-CP sửa đổi, bổ sung một số điều của Nghị định số 88/2019/NĐ-CP ngày 14 tháng 11 năm 2019 quy định về xử phạt vi phạm hành chính trong lĩnh vực tiền tệ và ngân hàng, có hiệu lực kể từ ngày 01 tháng 01 năm 2022.\n[96]\nĐiều này được bổ sung theo quy định tại khoản 39 Điều 1 của Nghị định số\n143/2021/NĐ-CP sửa đổi, bổ sung một số điều của Nghị định số 88/2019/NĐ-CP ngày 14 tháng 11 năm 2019 quy định về xử phạt vi phạm hành chính trong lĩnh vực tiền tệ và ngân hàng, có hiệu lực kể từ ngày 01 tháng 01 năm 2022.\n[97]\nĐiều này được bổ sung theo quy định tại khoản 40 Điều 1 của Nghị định số\n143/2021/NĐ-CP sửa đổi, bổ sung một số điều của Nghị định số 88/2019/NĐ-CP ngày 14 tháng 11 năm 2019 quy định về xử phạt vi phạm hành chính trong lĩnh vực tiền tệ và ngân hàng, có hiệu lực kể từ ngày 01 tháng 01 năm 2022.\n[98]\nĐiều này được bổ sung theo quy định tại khoản 41 Điều 1 của Nghị định số\n143/2021/NĐ-CP sửa đổi, bổ sung một số điều của Nghị định số 88/2019/NĐ-CP ngày 14 tháng 11 năm 2019 quy định về xử phạt vi phạm hành chính trong lĩnh vực tiền tệ và ngân hàng, có hiệu lực kể từ ngày 01 tháng 01 năm 2022.\n[99]\nĐiều này được bổ sung theo quy định tại khoản 42 Điều 1 của Nghị định số\n143/2021/NĐ-CP sửa đổi, bổ sung một số điều của Nghị định số 88/2019/NĐ-CP ngày 14 tháng 11 năm 2019 quy định về xử phạt vi phạm hành chính trong lĩnh vực tiền tệ và ngân hàng, có hiệu lực kể từ ngày 01 tháng 01 năm 2022.\n[100]\nĐiều này được sửa đổi theo quy định tại khoản 43 Điều 1 của Nghị định số\n143/2021/NĐ-CP sửa đổi, bổ sung một số điều của Nghị định số 88/2019/NĐ-CP ngày 14 tháng 11 năm 2019 quy định về xử phạt vi phạm hành chính trong lĩnh vực tiền tệ và ngân hàng, có hiệu lực kể từ ngày 01 tháng 01 năm 2022.\n[101]\nCụm từ “các điểm n, o khoản 4” được thay thế bằng cụm từ “điểm n khoản 4” theo quy định tại điểm c khoản 1 Điều 3 của Nghị định số\n23/2023/NĐ-CP sửa đổi, bổ sung một số điều của Nghị định số 89/2016/NĐ-CP ngày 01 tháng 7 năm 2016 của Chính phủ quy định điều kiện đối với hoạt động đại lý đổi ngoại tệ, hoạt động cung ứng dịch vụ nhận và chi, trả ngoại tệ của tổ chức kinh tế và Nghị định số 88/2019/NĐ-CP ngày 14 tháng 11 năm 2019 của Chính phủ quy định về xử phạt vi phạm hành chính trong lĩnh vực tiền tệ\nvà ngân hàng, có hiệu lực kể từ ngày 01 tháng 7 năm 2023.\n[102] Cụm từ\n“các điểm h, n, o khoản 4” được thay thế bằng cụm từ “các điểm h, n khoản 4” theo quy định tại điểm d khoản 1 Điều 3 của Nghị định số 23/2023/NĐ-CP sửa đổi, bổ\nsung một số điều của Nghị định số 89/2016/NĐ-CP ngày 01 tháng 7 năm 2016 của Chính phủ quy định điều kiện đối với hoạt động đại lý đổi ngoại tệ, hoạt động cung ứng dịch vụ nhận và chi, trả ngoại tệ của tổ chức kinh tế và Nghị định số\n88/2019/NĐ-CP ngày 14 tháng 11 năm 2019 của Chính phủ quy định về xử phạt vi phạm hành chính trong lĩnh vực tiền tệ và\nngân hàng, có hiệu lực kể từ ngày 01 tháng 7 năm 2023.\n[103] Cụm từ\n“các điểm b, n, o khoản 4” được thay thế bằng cụm từ “các điểm b, n khoản 4” theo quy định tại điểm đ khoản 1 Điều 3 của Nghị định số 23/2023/NĐ-CP sửa đổi, bổ\nsung một số điều của Nghị định số 89/2016/NĐ-CP ngày 01 tháng 7 năm 2016 của Chính phủ quy định điều kiện đối với hoạt động đại lý đổi ngoại tệ, hoạt động cung ứng dịch vụ nhận và chi, trả ngoại tệ của tổ chức kinh tế và Nghị định số\n88/2019/NĐ-CP ngày 14 tháng 11 năm 2019 của Chính phủ quy định về xử phạt vi phạm hành chính trong lĩnh vực tiền tệ và\nngân hàng, có hiệu lực kể từ ngày 01 tháng 7 năm 2023.\n[104]\nKhoản này được sửa đổi theo quy định tại khoản 44 Điều 1 của Nghị định số\n143/2021/NĐ-CP sửa đổi, bổ sung một số điều của Nghị định số 88/2019/NĐ-CP ngày 14 tháng 11 năm 2019 quy định về xử phạt vi phạm hành chính trong lĩnh vực tiền tệ và ngân hàng, có hiệu lực kể từ ngày 01 tháng 01 năm 2022.\n[105]\nKhoản này được sửa đổi theo quy định tại khoản 44 Điều 1 của Nghị định số\n143/2021/NĐ-CP sửa đổi, bổ sung một số điều của Nghị định số 88/2019/NĐ-CP ngày 14 tháng 11 năm 2019 quy định về xử phạt vi phạm hành chính trong lĩnh vực tiền tệ và ngân hàng, có hiệu lực kể từ ngày 01 tháng 01 năm 2022.\n[106]\nĐiều 3 và Điều 4 của Nghị định số 143/2021/NĐ-CP sửa đổi, bổ sung một số điều của Nghị định số 88/2019/NĐ-CP ngày 14 tháng 11 năm 2019 quy định về xử phạt vi phạm hành chính trong lĩnh vực tiền tệ và ngân hàng, có hiệu lực kể từ ngày 01 tháng 01 năm 2022 quy định như sau:\n“Điều 3. Trách nhiệm tổ chức thực hiện Thống đốc Ngân hàng Nhà nước Việt Nam, Bộ trưởng, Thủ trưởng cơ quan ngang bộ, Thủ trưởng cơ quan thuộc Chính phủ, Chủ tịch Ủy ban nhân dân các tỉnh, thành phố trực thuộc Trung ương và các cơ quan có liên quan chịu trách nhiệm thi hành Nghị định này.\nĐiều 4. Điều khoản thi hành 1. Nghị định này có hiệu lực thi hành từ ngày 01 tháng 01 năm 2022.\n2. Điều khoản chuyển tiếp a) Đối với hành vi vi phạm xảy ra và đã kết thúc trước thời điểm Nghị định này có hiệu lực mà bị phát hiện hoặc\nđang xem xét ra quyết định xử phạt khi Nghị định này đã có hiệu lực thì áp dụng quy định của Nghị định này nếu Nghị định này không quy định trách nhiệm pháp lý\nhoặc quy định trách nhiệm pháp lý nhẹ hơn;\nb) Đối với quyết định xử phạt vi phạm hành chính trong lĩnh vực tiền tệ và ngân hàng đã được ban hành hoặc đã\nđược thi hành xong trước thời điểm Nghị định này có hiệu lực thi hành, mà cá\nnhân, tổ chức bị xử phạt vi phạm hành chính còn khiếu nại thì áp dụng quy định của Nghị định số 88/2019/NĐ-CP ngày 14 tháng 11 năm 2019 của Chính phủ về xử phạt vi phạm hành chính trong lĩnh vực tiền tệ và ngân hàng để giải quyết.”\n[107]\nĐiều 4 và Điều 5 của Nghị định số 23/2023/NĐ-CP sửa đổi, bổ sung một số điều của Nghị định số 89/2016/NĐ-CP ngày 01 tháng 7 năm 2016 của Chính phủ quy định điều kiện đối với hoạt động đại lý đổi ngoại tệ, hoạt động cung ứng dịch vụ nhận và\nchi, trả ngoại tệ của tổ chức kinh tế và Nghị định số 88/2019/NĐ-CP ngày 14 tháng 11 năm 2019 của Chính phủ quy định về xử phạt vi phạm hành chính trong lĩnh vực tiền tệ và ngân hàng, có hiệu lực kể từ\nngày 01 tháng 7 năm 2023 quy định như sau:\n“Điều 4. Hiệu lực thi hành 1. Nghị định này có hiệu lực thi hành kể từ ngày 01 tháng 7 năm 2023.\n2. Kể từ ngày Nghị định này có hiệu lực thi hành, Giấy phép thành lập bàn đổi ngoại tệ đã cấp cho cá\nnhân tự động hết hiệu lực và cá nhân phải chấm dứt hoạt động đổi ngoại tệ. Cá\nnhân có nhu cầu tiếp tục thực hiện hoạt động đổi tiền của nước có chung biên giới phải thành lập tổ chức kinh tế để được Ngân hàng Nhà nước chi nhánh tỉnh biên giới xem xét cho phép thực hiện hoạt động\nđại lý đổi tiền của nước có chung biên giới theo quy định tại Nghị định này. \n3. Nghị định này bãi bỏ Điều 7 Quy chế quản lý tiền của nước có chung biên giới tại khu vực biên giới và khu vực kinh tế cửa khẩu Việt Nam ban hành kèm theo Quyết định số 140/2000/QĐ-TTg ngày 08 tháng 12 năm 2000 của Thủ tướng Chính phủ. \nĐiều 5. Trách nhiệm thi hành 1. Ngân hàng Nhà nước Việt Nam chịu trách nhiệm ban hành văn bản hướng dẫn về hoạt động đại lý đổi tiền của nước có\nchung biên giới.\n2. Thống đốc Ngân hàng Nhà nước Việt Nam, Bộ trưởng, Thủ trưởng cơ quan ngang bộ, Thủ trưởng cơ quan thuộc Chính phủ,\nChủ tịch Ủy ban nhân dân các tỉnh, thành phố trực thuộc Trung ương và tổ chức,\ncá nhân có liên quan chịu trách nhiệm thi hành Nghị định này./.”"
}